,created,domain,full_link,locked,selftext,subreddit,title,url
0,2016-08-17 03:20:13+00:00,mobile.twitter.com,https://www.reddit.com/r/lanadelrey/comments/4y3hmb/could_could_this_mean/,False,,lanadelrey,Could... could this mean?,https://mobile.twitter.com/LanaDelRey/status/765739521103101953
1,2016-08-05 17:51:09+00:00,self.lanadelrey,https://www.reddit.com/r/lanadelrey/comments/4wbnv6/lanas_taste_in_music/,False,"Does anyone care to share the titles of songs Lana has played in Instagram videos or anything of the like. A few that I know are
I. Murder of Birds by Jessica Hoop
II. LSD by A$AP Rocky
III. Where the Boys Are by Connie Francis
Any more? Or artists Lana has mentioned in general. 
Thank you. All my love x",lanadelrey,Lana's Taste in Music-,https://www.reddit.com/r/lanadelrey/comments/4wbnv6/lanas_taste_in_music/
2,2016-07-31 09:50:47+00:00,poetryfoundation.org,https://www.reddit.com/r/Poetry/comments/4vgh6o/general_on_earth_were_briefly_gorgeous_by_ocean/,False,,Poetry,[general] On Earth We’re Briefly Gorgeous by Ocean Vuong.,https://www.poetryfoundation.org/poetrymagazine/poems/detail/57586
3,2016-05-22 17:09:14+00:00,self.books,https://www.reddit.com/r/books/comments/4kjfhs/striking_and_endearing_biographies/,False,"I adore reading biographies, particularly on history's greatest, most troubled minds. I'm currently almost finished with a Frida Kahlo bio by Hayden Herrera that succeeds fantastically in making you feel like you *know* Frida, and that you're emotionally accompanying her on the roller coaster that was her life. 
Which biographies have efficiently done this for you, as well?",books,Striking and Endearing Biographies,https://www.reddit.com/r/books/comments/4kjfhs/striking_and_endearing_biographies/
4,2016-05-03 16:26:30+00:00,self.UTAustin,https://www.reddit.com/r/UTAustin/comments/4ho2q6/austin_grub_so_good_itll_make_you_slap_your_mama/,False,"The night before my freshman orientation (June 22) I want to take my parents out to dinner.

It's their first time in Austin (and I don't think they're too fond of the city either) and I want them to have a meal so good that they'll fall in love with this glorious town!

Any suggestions for where to go? I trust you. Shoot.

#HOOKEM",UTAustin,Austin Grub so good it'll make you slap your mama- anyone?,https://www.reddit.com/r/UTAustin/comments/4ho2q6/austin_grub_so_good_itll_make_you_slap_your_mama/
5,2016-03-18 21:40:59+00:00,self.UTAustin,https://www.reddit.com/r/UTAustin/comments/4b0djz/town_lake_apartments_any_good/,False,"I was recently offered a stipend to live at Town Lake, and I'd be paying immensely less than the cost of dorms (roughly 80% less). 
I'm still conflicted though, and I know little about Town Lake.
Does anyone have useful insight or testimonies about it?
Thanks, Longhorns :-)",UTAustin,Town Lake Apartments- any good?,https://www.reddit.com/r/UTAustin/comments/4b0djz/town_lake_apartments_any_good/
6,2016-02-21 18:22:01+00:00,twitter.com,https://www.reddit.com/r/lanadelrey/comments/46whh5/yes_every_media_person_deeming_lana_fake_forced/,False,,lanadelrey,"YES @ every media person deeming Lana ""fake"", ""forced"", ""inauthentic""",https://twitter.com/tavitulle/status/701074016656879616?s=09
7,2016-02-19 22:58:46+00:00,self.UTAustin,https://www.reddit.com/r/UTAustin/comments/46nbqd/all_acceptance_decisions_should_be_released_by/,False,Heads up for prospective freshman :-) Best of luck!,UTAustin,All acceptance decisions should be released by tonight!,https://www.reddit.com/r/UTAustin/comments/46nbqd/all_acceptance_decisions_should_be_released_by/
8,2015-10-19 22:50:23+00:00,youtu.be,https://www.reddit.com/r/lanadelrey/comments/3peyb1/i_can_see_my_baby_swinging/,False,,lanadelrey,I CAN SEE MY BABY SWINGING,https://youtu.be/pcLDPl0rC_8
9,2015-10-19 03:41:48+00:00,self.lanadelrey,https://www.reddit.com/r/lanadelrey/comments/3pb72v/you_and_lana_a_love_story/,False,"Tell me about how you first heard of Lana, what songs you heard first, initial impressions, bumps along the road, and anything additional. 
💝💝💝💝",lanadelrey,You and Lana: A Love Story,https://www.reddit.com/r/lanadelrey/comments/3pb72v/you_and_lana_a_love_story/
10,2015-10-15 13:56:54+00:00,self.UTAustin,https://www.reddit.com/r/UTAustin/comments/3ouvoz/plan_ii_honors_students_help_me_out/,False,"Hello, all.  I'm a current high school senior seriously considering following the Plan II Honors Program. However, I'm still conflicted as to whether or not it's for me.
If you're a Plan II Honor student or closely affiliated, I would love and appreciate some input regarding the advantages, faults, focus, or anything else regarding the program. Thanks in advance.",UTAustin,Plan II Honors Students- Help me out!,https://www.reddit.com/r/UTAustin/comments/3ouvoz/plan_ii_honors_students_help_me_out/
11,2015-10-05 21:10:18+00:00,self.aclfestival,https://www.reddit.com/r/aclfestival/comments/3nmgr6/vance_joy_and_hozier/,False,Was anyone else there for both of these sets? They both seemed like happy little boys and pretty enveloped in the crowd's energy. It was beautiful to witness!,aclfestival,Vance Joy and Hozier,https://www.reddit.com/r/aclfestival/comments/3nmgr6/vance_joy_and_hozier/
12,2015-09-23 02:02:28+00:00,self.UTAustin,https://www.reddit.com/r/UTAustin/comments/3m0jte/ut_austin_vs_st_edwardss_uni/,False,"Hello, Longhorns. Big fan of UT here, but recently I met with a St. Edward's admissions officer who somewhat sold me. Since I don't personally live in or near Austin and can't get a first hand or interpersonal comparison, I'd like to know the thoughts of you Austinites. What are the advantages of attending UT over St. Ed's? Or if you have inverse opinions, those would be appreciated as well.",UTAustin,UT Austin vs St. Edwards's Uni,https://www.reddit.com/r/UTAustin/comments/3m0jte/ut_austin_vs_st_edwardss_uni/
13,2015-09-22 22:26:58+00:00,bbc.co.uk,https://www.reddit.com/r/lanadelrey/comments/3lzrz8/lana_performs_selections_from_honeymoon_on_bbc/,False,,lanadelrey,Lana performs selections from Honeymoon on BBC Radio 1 (earlier today).,http://www.bbc.co.uk/programmes/b06bnsbn
14,2015-09-20 00:24:25+00:00,indexmagazine.com,https://www.reddit.com/r/lanadelrey/comments/3lmeld/lizzy_grant_interview_for_index_mag_circa_2008/,False,,lanadelrey,Lizzy Grant interview for Index Mag. Circa 2008.,http://www.indexmagazine.com/interviews/Lizzy_grant2.shtml
15,2015-08-24 22:31:54+00:00,self.AskReddit,https://www.reddit.com/r/AskReddit/comments/3i9cft/whats_something_that_became_less_special_with_the/,,"A daily routine, a special tradition or event, a way to do things... Something that was so exciting but now almost boringly accessible.",AskReddit,What's something that became less special with the rising popularity of the internet?,http://www.reddit.com/r/AskReddit/comments/3i9cft/whats_something_that_became_less_special_with_the/
16,2015-08-24 03:55:54+00:00,self.Music,https://www.reddit.com/r/Music/comments/3i5srj/jeff_buckleys_grace_turns_21_today/,,"HAPPY 21st to a record that has changed my whole life. If you have yet to hear it, ""it's never over."" 🎶👇 
http://open.spotify.com/album/05kFTS7QT3D9Ltb8fvFogN",Music,"JEFF BUCKLEY'S ""GRACE"" TURNS 21 TODAY",http://www.reddit.com/r/Music/comments/3i5srj/jeff_buckleys_grace_turns_21_today/
17,2015-08-21 03:28:22+00:00,self.UTAustin,https://www.reddit.com/r/UTAustin/comments/3hszpt/rookie_question_about_dec_1_deadline/,,"Prospective student here. Are SAT/ ACT scores accepted after December 1st if everything else is turned in? If so, for how long, and what are the cons of doing so? Thanks. xx",UTAustin,Rookie Question About Dec 1 Deadline,http://www.reddit.com/r/UTAustin/comments/3hszpt/rookie_question_about_dec_1_deadline/
18,2015-08-16 20:31:39+00:00,self.UTAustin,https://www.reddit.com/r/UTAustin/comments/3h8hde/jamming_w_instruments/,,Do people at UT usually jam together? Is there a specific spot or day or what have you? Thanks. Xx,UTAustin,Jamming (w/ instruments) ☺,http://www.reddit.com/r/UTAustin/comments/3h8hde/jamming_w_instruments/
19,2015-08-01 05:55:38+00:00,self.WeAreTheMusicMakers,https://www.reddit.com/r/WeAreTheMusicMakers/comments/3fdqxt/you_and_your_instrument_a_love_story/,,"I'm quite curious. Do tell about your experiences with the instrument you love above all others and know how/ are currently mastering.
What person/ place/ event/ moment/ idea made you interested in this particular instrument and at what age?
How long did it take you to get to a level you consider to be ""good"" at playing it?
What are some sacrifices you made along the way?
Any not too common tips for others currently attempting to master the same instrument? Additional info would be great too. Thanks!",WeAreTheMusicMakers,You and Your Instrument: A Love Story,http://www.reddit.com/r/WeAreTheMusicMakers/comments/3fdqxt/you_and_your_instrument_a_love_story/
20,2015-07-30 20:01:44+00:00,self.Hozier,https://www.reddit.com/r/Hozier/comments/3f79rm/hozier_singing_retrograde_at_glastonbury_the_lost/,,"I remember BBC posted this tent performance thing from Glastonbury, but they soon deleted it afterwards. Did anyone download the audio before they deleted it? Or the video itself? I loved it so very much- help!",Hozier,Hozier singing Retrograde at Glastonbury- THE LOST TREASURE.,http://www.reddit.com/r/Hozier/comments/3f79rm/hozier_singing_retrograde_at_glastonbury_the_lost/
21,2015-07-28 21:47:50+00:00,m.soundcloud.com,https://www.reddit.com/r/lanadelrey/comments/3ey9p3/burning_desire_cover_a_listen_is_appreciated_ft_2/,,,lanadelrey,Burning Desire cover! A listen is appreciated 😊 (ft 2 other songs),https://m.soundcloud.com/nicolealexis_xo/burning-creeps-retrograde-three-track-cover
22,2015-07-26 14:58:23+00:00,self.recordstore,https://www.reddit.com/r/recordstore/comments/3enwu5/rec_me_jazz_read_inside_for_more_details/,,"You know how every generation has their king of jazz? Who's ours?
And also, I would like to be informed on some jazz for first time listeners, I suppose the essentials. Somewhere along the lines maybe of Chet Baker. Thank you ☺",recordstore,Rec me Jazz; read inside for more details :),http://www.reddit.com/r/recordstore/comments/3enwu5/rec_me_jazz_read_inside_for_more_details/
23,2015-07-24 17:59:20+00:00,youtu.be,https://www.reddit.com/r/lanadelrey/comments/3egy8i/this_song_feels_like_something_lana_could_pull/,,,lanadelrey,This song feels like something Lana could pull off. Plus Jeff is golden.,https://youtu.be/wxqwq9BnjT0
24,2015-07-11 03:10:44+00:00,self.lanadelrey,https://www.reddit.com/r/lanadelrey/comments/3cviyx/help_me_with_some_lana_del_phrases/,,"I want to get a custom made necklace of a Lana phrase.  I was thinking maybe ""Ultraviolence"" or ""Paradise"", but I'm sure there are more interesting options out there. If anyone has ideas, I'd appreciate it. :)",lanadelrey,Help me with some Lana Del phrases.,http://www.reddit.com/r/lanadelrey/comments/3cviyx/help_me_with_some_lana_del_phrases/
25,2015-07-10 22:42:45+00:00,m.soundcloud.com,https://www.reddit.com/r/radioheadmusicians/comments/3cuorz/my_3_song_medley_ft_creep_as_well_as_lana_del_rey/,,,radioheadmusicians,My 3 Song Medley ft. CREEP / as well as Lana Del Rey and James Blake ***,https://m.soundcloud.com/nicolealexis_xo/burning-creeps-retrograde-three-track-cover
26,2015-07-09 06:18:04+00:00,youtu.be,https://www.reddit.com/r/lanadelrey/comments/3cnc59/ldr_x_craig_armstrong_devastatingly_beautiful/,,,lanadelrey,LDR x Craig Armstrong. Devastatingly beautiful.,https://youtu.be/OXP2mL5NKOk
27,2015-06-21 19:35:45+00:00,life-imitates-lana.tumblr.com,https://www.reddit.com/r/lanadelrey/comments/3amssq/a_look_into_each_era_of_elizabeth_grant_a/,,,lanadelrey,A look into each era of Elizabeth Grant; a breathtaking reflection.,http://life-imitates-lana.tumblr.com/post/122070477070/happy-birthday-to-lana-del-rey-06-21-1985
