,body,created,id,nest_level,parent_id,reply_delay,subreddit
0,When your childs pediatrician asks about their bruises,2016-08-31 20:12:21+00:00,d74gscv,1,t3_50ita2,5007,AskReddit
1,It's on my to watch list now lol,2016-08-30 12:50:28+00:00,d72ilow,4,t1_d72ierk,368,Showerthoughts
2,No but I'm still watching breaking bad. Had a bacon and egg bap this morning and a marvel at how awesome food creatures are,2016-08-30 12:37:34+00:00,d72i78h,2,t1_d72hp6u,1047,Showerthoughts
3,Wow. You really can do anything at Zombo.com,2016-08-20 11:15:57+00:00,d6p9j0l,2,t1_d6p9ev5,406,AskReddit
4,In Northern Ireland they are a banned breed. It's hit the press recently as officers in riot gear seized a dog while it's owners were out thinking its a pittbull.,2016-07-21 12:18:52+00:00,d5kuph6,2,t1_d5ku9xs,1009,AskReddit
5,like this? - http://www.goodnewsnetwork.org/,2016-07-19 00:49:46+00:00,d5hjpo6,1,t3_4tical,977,AskReddit
6,"I was a kid on holiday visiting my grandparents and my mum asked me to lift my her handbag. My nans dog decided I deserved to be mauled for it.
Huge family feud followed. Grandparents chose the dog over their grandkids and I havent seen them in 14 years.

You can imagine which hurt most.",2016-07-18 22:01:45+00:00,d5hd388,1,t3_4thd4t,3706,AskReddit
7,so... you're single ;),2016-07-14 00:33:38+00:00,d5bc529,2,t1_d5b660h,9313,AskReddit
8,Raining in Ireland. ,2016-07-14 00:16:53+00:00,d5bbj9g,1,t3_4sqb08,796,AskReddit
9,"Onions are so good!! I have a big issue with bananas and their taste, smell and feel. Wish I could eat them tho ",2016-06-12 22:10:27+00:00,d46j8mh,2,t1_d46j3qa,213,AskReddit
10,"I'm from Ireland, it's just called fizzy juice here",2016-06-12 20:23:13+00:00,d46edga,2,t1_d46ag1q,5616,mildlyinteresting
11,Hives ,2016-06-12 13:20:52+00:00,d45xzbe,1,t3_4nq03t,3901,AskReddit
12,avocado. I just don't get it. It smells like grapes but tastes like blah,2016-06-12 02:10:01+00:00,d45jwp8,1,t3_4no9nl,2049,AskReddit
13,Dumbo. Honestly was thinking of this earlier,2016-06-12 02:08:48+00:00,d45jvd7,1,t3_4no4vd,4279,AskReddit
14,My old dog suddenly turned vicious one night after 10 years of being a generally good dog and loving companion. Turned out she had a tumor pressing on her brain and I had to get her PTS :'(,2016-06-12 02:07:57+00:00,d45juhk,1,t3_4no3xa,4670,AskReddit
15,"When you're out for dinner and parents hand their kids electronics at full volume. I have nothing against giving a kid an Ipad when you're waiting on your meal but it's just ignorant to subject everyone else to it. You had the foresight to bring an Ipad, bring headphones or mute the fucking thing!",2016-06-11 23:20:59+00:00,d45elj5,1,t3_4nnmuu,2252,AskReddit
16,"Right that's it, 1.....2.....so help you if I get to 3!!",2016-06-11 23:18:18+00:00,d45eidy,1,t3_4nnhye,4221,AskReddit
17,grain mites,2016-06-11 23:14:57+00:00,d45ee94,1,t3_4nnpnk,729,AskReddit
18,"Veganism..sorry sorry ""a plant based diet""",2016-06-11 23:14:07+00:00,d45edal,1,t3_4nnpd1,808,AskReddit
19,"rubix cube solving 

https://www.youtube.com/watch?v=mCyYPimImyM",2016-06-11 23:11:52+00:00,d45east,1,t3_4nnoqe,934,AskReddit
20,"http://imgur.com/gallery/LsOnH
",2016-06-10 00:03:18+00:00,d430hez,2,t1_d430epn,123,AskReddit
21,Adopting a street dog from Bosnia I had never met because her photograph made my heart break. She traveled to Ireland for veterinary care and a home. Everyone told me it was a scam. Well it wasn't!,2016-06-10 00:01:15+00:00,d430epn,1,t3_4ndi36,2816,AskReddit
22,He has the ring..,2016-06-09 23:55:37+00:00,d4307a0,1,t3_4ndgwr,2942,AskReddit
23,I worked in a call centre and never took a call..for over a month. I just swiped in then went for a nap in a meeting room. ,2016-06-09 23:53:51+00:00,d4304wl,1,t3_4ndluj,899,AskReddit
24,"I'm a passenger in a car and I don't know how to drive but it starts or rolls down a hill etc and I have to climb in the front and steer and brake but I don't know how. Had the same nightmare since I was a kid until I finally learnt how to drive.
Now it's I'm in a car and I forget how to drive...",2016-06-09 23:51:19+00:00,d4301ig,1,t3_4ndlmc,839,AskReddit
25,Exactly! Essentially unless you are uncomfortable you are insulting the other person. But surely that means you are both uncomfortable?,2016-06-09 23:36:05+00:00,d42zgy1,3,t1_d42yxwo,843,AskReddit
26,Thank you x,2016-05-10 18:12:44+00:00,d3082bb,4,t1_d304i8b,4567,AskReddit
27,All 3 please. ,2016-05-10 16:03:51+00:00,d3021rz,2,t1_d30011w,2674,AskReddit
28,"How do I change it? It is a serious question 
",2016-05-10 15:09:49+00:00,d2zzm49,2,t1_d2zyv6h,1039,AskReddit
29,"can confirm, I'm now an avid turtle voyeur - https://www.youtube.com/watch?v=7rE_FG2xauA",2016-05-01 14:52:02+00:00,d2og3n6,2,t1_d2ofvvp,417,AskReddit
30,That made me smile haha,2016-05-01 14:49:16+00:00,d2og0gk,4,t1_d2oftt2,367,AskReddit
31,Taffy?,2016-05-01 14:41:59+00:00,d2ofsiv,2,t1_d2ofre2,63,AskReddit
32,Are they hot or have you some weird dental fetish?,2016-05-01 14:41:38+00:00,d2ofs4t,2,t1_d2ofr1u,62,AskReddit
33,You know I forgot that was tonight. Dammit now I can't wait,2016-05-01 14:38:28+00:00,d2ofoq1,1,t3_4h9a4t,76,AskReddit
34,"self holding umbrella
",2016-04-29 00:37:01+00:00,d2lg0u8,1,t3_4gwy6u,874,AskReddit
35,"When I found out on my first day he had cut everyone's hours and hired me unnecessarily then he told me to go look in the mirror..thinking I must've had food on my face or something I went to check it out...came back and asked him wtf he replied ""I just wanted to remind you how beautiful you are""

Few days later he asked if I had a web cam so he could watch me sleeping. My friend complained he was harassing me and she got moved to a different store then a few days later he swapped shifts on the rota so we'd be closing up together. My bf at the time came to stand outside the shop staring in the whole time we closed up. I was sacked the next day for being ""unreliable"". ",2016-04-29 00:32:27+00:00,d2lftni,1,t3_4gwmu5,5374,AskReddit
36,I'm a terrible girlfriend,2016-04-29 00:04:58+00:00,d2leopb,1,t3_4gwlhx,4257,AskReddit
37,"The food. It just appeared at most meal times. You ate what you wanted, didn't get fat and old people regularly gave you sweets or money for sweets. 

Also under the food category the prizes you used to get in Kelloggs little flip books and cool stuff to fight with my brothers over.
",2016-04-28 23:56:25+00:00,d2lecvz,1,t3_4gwr6h,1450,AskReddit
38,"Fell out with an ex over a petty thing..he died before we spoke again.
I felt like shit and decided to make amends with other exs so it wouldnt happen again...lets just say some people are meant to stay in your past, learnt this the hard way.
The only exs Im still friends with are ones I have sex with, plan to have sex with or would like to have sex with or we are literally only facebook friends and never talk.",2016-04-28 23:51:33+00:00,d2le67l,1,t3_4gwl8j,3569,AskReddit
39,Jasmine - Flying carpet and a genie. Sorted,2016-04-28 23:46:02+00:00,d2ldyrf,1,t3_4gwoz9,1735,AskReddit
40,I went to an all girls catholic school. Needless to say anytime someone had to read out a word like penis in biology it was the funniest thing EVER,2016-04-28 23:40:20+00:00,d2ldqy7,1,t3_4gwox4,1418,AskReddit
41,Electricity being provided by nuclear fusion (aka making mini stars),2016-04-28 23:21:31+00:00,d2ld14f,1,t3_4gwnkg,842,AskReddit
42,Normal arms but hypermobile joints,2016-04-28 12:32:50+00:00,d2klfrt,3,t1_d2k2qwi,42906,AskReddit
43,My kid can lick her elbow. Doesn't sound impressive? Try it..,2016-04-27 21:02:40+00:00,d2ju69f,1,t3_4gqbv0,3411,AskReddit
44,"Fish oils
",2016-04-27 21:01:49+00:00,d2ju4zd,1,t3_4gqb9d,3575,AskReddit
45,Peace be with you by the old gods and the new....then walk away,2016-04-27 21:00:13+00:00,d2ju2ep,1,t3_4gq6oa,5143,AskReddit
46,"""mummy won't wake up""",2016-04-27 20:57:00+00:00,d2jtx8p,1,t3_4gqhuc,1005,AskReddit
47,Well there goes my self esteem! haha I didnt get boobs til I hit 18,2016-04-27 19:54:36+00:00,d2jr17v,5,t1_d2jm0nu,6497,AskReddit
48,They're green/yellow haha ,2016-04-27 19:51:04+00:00,d2jqvhm,3,t1_d2jppc8,1515,AskReddit
49,In hindsight not my best hairstyle. I'd like to think I'm slightly more presentable these days http://imgur.com/0WAF4xe,2016-04-27 15:47:25+00:00,d2jfkno,5,t1_d2jc4j7,4729,AskReddit
50,It's had 10 years of re growth. We're good now thank god,2016-04-27 14:24:28+00:00,d2jbygn,3,t1_d2jbc4a,927,AskReddit
51,Not all women think that. Also  I know women more sex obsessed than men,2016-04-27 13:43:08+00:00,d2jac0e,3,t1_d2ja4t6,327,AskReddit
52,"http://imgur.com/9tY9IEi Posting this as my profile picture on bebo with a caption of ""moi""",2016-04-27 13:39:44+00:00,d2ja7km,1,t3_4gof99,1224,AskReddit
53,"Thank you. I'm not sure how I can prove it as such. It's for an autism charity I set up which is why the circle is so unique its supposed to represent a spectrum, I asked a girl I know if she could design a logo as a favor and she was busy but agreed to do us a quick sketched design, she sent the photo and I said thank you that's it really. Niavely I thought getting a digital copy would've been easier x",2016-04-25 18:54:46+00:00,d2gvyt1,2,t1_d2gugwk,1928,picrequests
54,"No deadline I'd just be grateful to get it sorted!!
",2016-04-25 02:17:55+00:00,d2g2dwv,4,t1_d2g2601,337,picrequests
55,"http://imgur.com/m5aoZMc
",2016-04-25 02:08:14+00:00,d2g20d9,2,t1_d2fy09o,6871,picrequests
56,It was done as a favour they designed it on paper as a favour and took a photograph,2016-04-25 02:05:22+00:00,d2g1wd1,2,t1_d2g1s5z,173,picrequests
57,"I'm a metal head, trust me that genre is covered
",2016-03-28 23:31:50+00:00,d1gzwab,2,t1_d1gzsiq,159,AskReddit
58,"She was found in Bosnia (hell for dogs) she was eating literally rubbish, her legs are deformed due to malnutrition.  A rescuer took her in. She needed vet care so they posted about her online.  I'm in Northern  Ireland, seen the post and asked if I could foster her with a potential to adopt, they did a home check and arranged for her to  travel over and I've had her since. I fell in love with her but the bigger she got the more stressed my other dog became so she had to be rehomed. On Thursday night she went. Fortunately my friend took her so I'll see her all the time :)",2016-01-16 09:18:01+00:00,cz0971a,2,t1_cz01uw1,20151,BeforeNAfterAdoption
59,Dammit I want  to google this but the you win,2016-01-03 05:29:44+00:00,cyk3fwl,2,t1_cyk3bq5,214,AskReddit
60,I regret not flagging this as serious - fact,2016-01-03 05:29:03+00:00,cyk3f5e,1,t3_3z8m1f,410,AskReddit
61,"Thank you exactly what I needed to know.  My uncle is leaving tomorrow and has learning difficultys, I promised I would make dvds of photographs and videos before he left as he wouldnt understand the internet and wouldnt know the make of player he has",2016-01-03 01:42:48+00:00,cyjwbxh,2,t1_cyjvxeo,737,explainlikeimfive
62,The moon definitely does have quakes hence the question,2016-01-02 04:34:42+00:00,cyizn6c,2,t1_cyizkbp,164,AskReddit
63,"Thats untrue, its affected by earths gravity and does infact have quakes. Kiddo was watching a documentary.",2016-01-02 04:31:05+00:00,cyizjdx,2,t1_cyizhwe,85,AskReddit
64,Yes! *ahem* I mean awh....,2015-12-29 05:06:15+00:00,cyenl9j,2,t1_cyenjpz,81,AskReddit
65,"Everyone is a stranger until you get to know them.
I've had some random messages from people wanting our address, there are ways to verify people and tell the genuine from the disingenuous. ",2015-12-23 09:42:25+00:00,cy8ssv3,3,t1_cy8kjui,22284,aww
66,thats a pretty big act of awesome right there,2015-12-23 03:31:29+00:00,cy8kkcz,2,t1_cy8gnz7,7120,AskReddit
67,"It's the thought that counts :)
",2015-12-23 03:27:42+00:00,cy8kg40,2,t1_cy8k8qe,400,AskReddit
68,only i didnt but way to spoil it. You must be fun at parties,2015-12-23 03:25:21+00:00,cy8kdl2,2,t1_cy8h60j,5852,aww
69,"http://imgur.com/gallery/Sczqk
",2015-12-23 01:07:00+00:00,cy8fs4c,2,t1_cy8fglo,572,aww
70,thank you and yes incredibly happy :),2015-12-18 03:51:18+00:00,cy31f0v,2,t1_cy3183f,366,randomactsofkindness
71,elaborate?,2015-12-18 00:08:24+00:00,cy2u5d9,2,t1_cy2u0ey,250,pics
72,"I would agree
",2015-11-27 01:06:13+00:00,cxe96ml,2,t1_cxe91is,321,AskReddit
73,"touche, also using the word like a lot ",2015-11-23 02:29:27+00:00,cx9pcgj,2,t1_cx9p3iq,417,Showerthoughts
74,"cheers, good to know someones thinking of me ;)",2015-11-17 19:24:43+00:00,cx3lzg1,4,t1_cx3ita1,4397,AskReddit
75,Honestly if I could that would be fucking amazing right now,2015-11-17 18:09:31+00:00,cx3iqe5,2,t1_cx3hzi0,1060,AskReddit
76,"Unfortunately that's the one thing i can't do 
",2015-11-17 18:08:30+00:00,cx3iou0,2,t1_cx3hxkh,1076,AskReddit
77,We're in Ireland so bit too far lol,2015-11-14 17:14:58+00:00,cx01p9q,7,t1_cx01j4c,336,AskReddit
78,"I can't afford 1:1 tuition, it's just a shame. She had wanted to try boxing as well and unfortunately the only contact sports that have agreed to take her is rugby",2015-11-14 16:55:06+00:00,cx013ky,5,t1_cx00tee,575,AskReddit
79,"We live in a country where guns are illegal. To be honest I can't understand why anyone would want to introduce a child to firearms, its completely bizarre, you want to keep your child safe not put them in danger.",2015-11-14 16:52:45+00:00,cx0112k,2,t1_cx00w2i,280,AskReddit
80,Unfortunately everywhere I have asked about martial arts have said they wont accept her as she has a history of seizures. Very frustrating as she is so active.,2015-11-14 16:23:17+00:00,cx006l8,3,t1_cwzzqb5,1001,AskReddit
81,Actually I seen a grumpy guy with short arms earlier in tesco and thought maybe sexual frustration was why he was so grumpy then I thought how awkward it would be for him to masturbate and then I thought about T-Rexs also having short arms and maybe that's why T-Rexs were such assholes,2015-11-13 21:56:52+00:00,cwzcvg3,2,t1_cwz53ba,12102,Showerthoughts
82,"She can to an extent do it with her front paw but she stands like this and then comes over and growls at you waiting for the ear rub then goes into a trance that can only be described as doggy heaven, she has a happy growl when you hit the right spot lol ",2015-11-13 13:43:07+00:00,cwyup0n,2,t1_cwyhxbk,38081,dogpictures
83,what about indigestion? and garlic breath?,2015-11-10 15:41:22+00:00,cwvdqua,2,t1_cwvdpes,60,AskReddit
84,"bubba?
",2015-11-10 15:38:28+00:00,cwvdmzg,2,t1_cwvdi9a,229,AskReddit
85,"She was born a street dog, literally eating trash to survive and was mal nourished so paws are deformed. She travelled from Bosnia-Herzegovina to N.Ireland ",2015-11-10 07:10:55+00:00,cwv3t4p,2,t1_cwurcia,23680,dogpictures
86,The last picture is her a few days ago ,2015-11-10 07:09:39+00:00,cwv3sam,2,t1_cwuwps4,14848,dogpictures
87,She's doing great!! :D ,2015-11-09 22:58:45+00:00,cwunobj,2,t1_cwuk3re,5172,aww
88,"Wow he does look similar and super cute! Sara is still growing and catching up due to her rough start but she's pretty enormous, pics don't do her justice.",2015-11-09 19:34:03+00:00,cwuexxd,4,t1_cwuerni,240,BeforeNAfterAdoption
89,newfoundland x setter the vet had thought due to partial webbed toes and dyspraxia but someone commented yesterday saying flat coat retriever retriever and she deffo has major traits of theres,2015-11-09 19:26:44+00:00,cwuemhx,2,t1_cwucf3d,3083,BeforeNAfterAdoption
90,"yea deleting now, have posted a new link :( messaged imgur too
",2015-11-09 18:14:35+00:00,cwubioy,2,t1_cwubho4,40,BeforeNAfterAdoption
91,"lmao I messaged imgur about it 
",2015-11-09 18:01:07+00:00,cwuay8d,2,t1_cwuasjx,218,aww
92,"what the fuck i just clicked the link 
",2015-11-09 17:45:04+00:00,cwua92b,3,t1_cwu7rdg,3513,aww
93,Are you giving her any supplements? I give mine cod liver oil capsules and I find it makes a huge difference and helps with joints too ,2015-11-09 15:08:33+00:00,cwu3zab,6,t1_cwu3n5z,610,aww
94,"Wow look at those ears and coat so smooth and glossy!! 

Sara's is more coarse and would be like a newfoundlands but is improving ",2015-11-09 14:55:41+00:00,cwu3jxi,4,t1_cwu1koe,4023,aww
95,"Pics?
",2015-11-09 11:42:32+00:00,cwtz0y8,2,t1_cwtyrmx,996,aww
96,"That's where Sara is from hence the name!! She was rescued by Milena (Saving Suffering Strays Sarajevo)Thank god for the work the SSSS team do, I happened to see a facebook post showing Sara, she was pitiful and needed vet care and a home and wouldn't have survived even in the kennels. I made the snap decision to foster her and I'm so glad I did, couldn't imagine life without her in it  ",2015-11-09 10:43:48+00:00,cwty6db,2,t1_cwtxxhl,1081,BeforeNAfterAdoption
97,"Aww that is sweet! Don't tell me she'll be an eternal puppy, I already have one of those and she's a torture haha",2015-11-09 08:20:44+00:00,cwtw48v,6,t1_cwtvzpu,455,BeforeNAfterAdoption
98,I've heard that before. I mean essentially she is a mongrel but she has slightly webbed toes of a Newfoundland and has the dyspraxia common in setters but she could really be anything!,2015-11-09 07:55:44+00:00,cwtvp4h,4,t1_cwtvcyu,1109,BeforeNAfterAdoption
99,We think a setter x Newfoundland,2015-11-09 06:49:02+00:00,cwtue9g,2,t1_cwtpwv6,9316,BeforeNAfterAdoption
100,She's absolutely stunning these days!! Her paws are still a little deformed but she's making wonderful progress and still a puppy ,2015-11-09 02:02:45+00:00,cwtkv9v,2,t1_cwtksxz,99,BeforeNAfterAdoption
101,Thank you! A girl set it up for her after a post on reddit went viral a while back for her. It puts a smile on her face everyday checking it and it's awesome knowing she has a positive supportive place to have her voice heard :),2015-11-08 20:50:36+00:00,cwt8j49,2,t1_cwt8bf8,288,autism
102,That's the thing she doesnt even watch it!! She just likes her hair do ,2015-11-07 15:31:49+00:00,cwrud61,2,t1_cwruad9,165,pics
103,"Lol she wouldn't sit still for me, this was Dora DIY",2015-11-07 15:28:07+00:00,cwru9en,2,t1_cwru2p6,417,funny
104,But was he successful? :p ,2015-11-05 01:16:31+00:00,cwovbfd,2,t1_cwov2fi,418,AskReddit
105,I meant a character not an actor.,2015-11-05 01:15:23+00:00,cwov9xn,2,t1_cwov5q3,197,AskReddit
106,Well I meant messages too..,2015-11-04 20:33:33+00:00,cwok9fv,2,t1_cwok4t2,170,AskReddit
107,Yea obviously that's what I did /s,2015-11-04 01:26:41+00:00,cwnmepk,4,t1_cwniqn5,5673,interestingasfuck
108,I love that looking it up is something you can do! Knew we loved our tea more :P ,2015-11-03 19:49:28+00:00,cwn8k8b,6,t1_cwn6bnb,3104,AskReddit
109,"What!! We are so into our tea!! Cup of tea and a round of potato bread ftw
",2015-11-03 18:06:31+00:00,cwn43ja,4,t1_cwn0oii,4791,AskReddit
110,God yes!!,2015-11-03 16:25:23+00:00,cwmzs36,2,t1_cwmyr2k,1494,AskReddit
111,What's wrong with the irish?,2015-11-03 16:25:02+00:00,cwmzrlb,2,t1_cwmz4ox,911,AskReddit
112,Okay without all the hassle. I mean yes legally you can but effort!! Also not all names you can think of may be legal or acceptable ,2015-11-03 00:32:08+00:00,cwm9sox,2,t1_cwm9lxl,306,AskReddit
113,"Weather you realized it or not you were down playing how ASD affects my daughter because she looks well and cute in the pictures which is my point, ASD is an invisible disability but it can be most certianly debilitating. You can't see it so you can't judge from the pictures but everyone has assuming because my daughter looks happy and well they assume they know her place on the spectrum, can tell her mental state and emotional well being is fine and always compare her to a case they know that appears much worse...looks can be deceiving is my point. I'm trying to raise awareness even if it's just helping someone see the truth one person at a time.",2015-11-02 22:17:04+00:00,cwm4k0q,4,t1_cwm4d37,282,interestingasfuck
114,another one who missed the point,2015-11-02 22:06:46+00:00,cwm44qz,2,t1_cwm2r3e,1931,interestingasfuck
115,"thank you , sorry for getting so defensive but the whole point of it was to raise awareness and it's frustrating.",2015-11-02 15:16:54+00:00,cwlmw5a,8,t1_cwlmgsv,745,interestingasfuck
116,"I said this is what autism ""looks like"" the point being it is an invisible disability and has no look!! When my daughter is having a good day and looks like most other kids but her behavior isnt typical for a child her size or age people often tell her off and when i explain say ""oh she doesnt look autistic"" this was in response to that. It is generally obvious my child has special needs as she looks ill with sleep deprivation and lack of eating, she requires a special needs pram and her behavior is not typical of a 7 year olds and given she is the size of a 9 year old its more obvious. My point is people dont see her being restrained or etc. How can you say she has ""mild autism"" because of a few photos where she looks well. this is exactly my point, it is a hidden disability along with schizophrenia, ADHD, ODD, PDA, SPD, epilepsy, an many more. The post was to highlight this and the responses were shocking in that people still ignored that point. It's a spectrum condition. I know kids who would be ""severe"" who are much happier than those with ""HF"". If you know one person on teh spectrum you know one. You can't tell unless you are living it. ",2015-11-02 14:45:56+00:00,cwllv37,6,t1_cwllbsx,1059,interestingasfuck
117,I am the mother and I think it is you that obviously has no idea,2015-11-02 14:17:18+00:00,cwll0es,4,t1_cwlko08,753,interestingasfuck
118,ah another one who missed the point.  http://imgur.com/gallery/IXkaq,2015-11-02 14:01:48+00:00,cwlkl90,2,t1_cwlk8nu,814,interestingasfuck
119,No! /s,2015-10-29 14:58:47+00:00,cwh6xzf,4,t1_cwgwz2s,29231,aww
120,"http://imgur.com/gallery/IXkaq I know what it's like, she didnt get a diagnosis cause she liked lining things up and is good at math. But people already think of that with ASD they dont see what I see when I look at my daughter on a good day",2015-10-28 15:25:08+00:00,cwfy676,2,t1_cwfv5bq,4715,autism
121,She wanted Darth Mol last week,2015-10-28 12:51:01+00:00,cwfsrap,4,t1_cwfrk37,3059,aww
122,"She gets sensory overload, so many things to try and process at once so if she say bites herself its only one thing to focus on if she can do it hard enough to block out the others. Apply that to banging her head, scratching her face etc  That's a blunt explanation. Look up SPD",2015-10-28 11:36:16+00:00,cwfr3iy,2,t1_cwfr1u0,149,aww
123,then you obviously didn't get the point i was trying to make,2015-10-28 11:26:22+00:00,cwfqx1o,2,t1_cwfqvku,133,aww
124,Sex caused it. All autistic kids are born as a result of their parents having sex. Imagine that... :P,2015-10-28 11:22:27+00:00,cwfquia,2,t1_cwfi0tw,27697,aww
125,http://imgur.com/gallery/IXkaq,2015-10-28 11:21:40+00:00,cwfqtz8,2,t1_cwfn8ak,14846,aww
126,"http://imgur.com/gallery/IXkaq
",2015-10-28 11:21:10+00:00,cwfqtn2,2,t1_cwfo6av,10998,aww
127,http://imgur.com/gallery/IXkaq,2015-10-28 11:20:50+00:00,cwfqtf3,2,t1_cwfmww3,15955,aww
128,"She has 3 legs and thats how she rests her behind, her tail is always wagging so she can stand and wag and rest at the same time
 http://imgur.com/gallery/ZdzKO",2015-10-28 11:19:27+00:00,cwfqska,4,t1_cwfdls7,34457,aww
129,One named Molly-Raine and called Mol for short although she wants to be called Raine-Storm instead but we aint hippies..,2015-10-28 11:16:07+00:00,cwfqqi5,2,t1_cwfqo3n,233,aww
130,"Because she cried her brain wasn't working right, she knew she was different and she NEEDED to know why, not all kids do and that's fair enough but I explained that when people have lots of little quirks they can be called traits and everyone has these but when you have lots of these and it makes life a bit tough you get a diagnosis of Autism and then adults know how to help better. 
She explains this to other kids and the response is amazing, they understand better than most adults. The ADHD she has to take medication for, she knows it helps her concentrate otherwise she can't play xbox and is a danger to herself. She can't actually hold a conversation if not medicated.
She is self aware but I hope in a positive way, I try to always explain if she's had a meltdown or overload why she did, I explain why she doesnt like loud noises or clothes that feel rough",2015-10-28 10:33:42+00:00,cwfq1yg,2,t1_cwfoqax,5690,aww
131,"She makes eye contact on her terms, It takes a while to get photos. Its a common misconception that kids with ASD dont make eye contact. Usually they cant make eye contact and process listen / talk, its easier to cope when looking away. I wasn't talking to her, we were playing",2015-10-28 10:11:49+00:00,cwfpqie,2,t1_cwfn8ak,10655,aww
132,"She has no learning delay, she just operates on a different system. Struggles with social situations, can't cope with out routine. Has sensory issues etc but essentially she's just a little girl that has some special needs to help her reach her full potential",2015-10-28 00:50:03+00:00,cwfbc33,4,t1_cwfacit,1510,aww
133,"When she was a baby she didn't sleep, she was happy enough but not tired. She was just always the quirky one, a real personality, ""that's just mol"" and the Drs said I was a young mum over reacting so I just got on with things trying my best. 
When she went to school her issues became much more apparent, she would come out of school and lie on the road unable to move, be touched, spoken to sometimes for hours and I hadn't a clue what to do, so many traits I overlooked as I simply didn't know. At the same time her epilepsy consultant changed and they picked up on the ASD within 5 minutes of meeting her, she was then put on a waiting list for over a year and diagnosed after an hour assessment. A big part of the issue was her undiagnosed ADHD largely masking her ASD traits and she has adult like speech so people assumed she was fine and I just wasn't coping with her. Even professionals need more awareness and training!",2015-10-28 00:22:55+00:00,cwfa9t5,2,t1_cwf9wol,532,aww
134,which one?,2015-10-28 00:09:18+00:00,cwf9q0j,2,t1_cwf9l3b,210,aww
