,body,created,id,nest_level,parent_id,reply_delay,subreddit
135,People with Asperger's Syndrome (high functioning autism) generally call themselves Aspies ,2015-10-27 23:23:31+00:00,cwf7zpn,2,t1_cwf7xbs,107,pics
136,"Yea he was a master of escape and survival..until he OD on calpol one day...at least he went peacefully
",2015-10-27 15:29:49+00:00,cwenxz0,2,t1_cweh5p7,12846,dogpictures
137,"That's not true, we like to open with something along the lines of organic progressive spiritual healing with a side of kale",2015-10-27 04:59:43+00:00,cweacdf,3,t1_cwea0ej,814,pics
138,Thankyou. My brain is failing too and I'm just coming across as blunt and apparently defensive so straight to the point and positive was nice to read :),2015-10-27 04:22:19+00:00,cwe9del,2,t1_cwe9864,314,pics
139,I did say I was ready to explode,2015-10-27 03:56:27+00:00,cwe8mby,4,t1_cwe8jt6,136,pics
140,"Do you know how often people tell my kid off for behaviors she cannot help? Every day, every single day and the general response to, ""she has ASD "" and a brief explanation of the behavior is an ignorant oh well she doesn't look autistic",2015-10-27 03:51:37+00:00,cwe8gz5,2,t1_cwe8ak5,338,pics
141,"I do politely educate, then I store away the frustration and release it in passive aggressive internet posts instead. 
It's not my job to educate the ignorant but I feel obliged",2015-10-27 03:49:19+00:00,cwe8ee6,2,t1_cwe87i7,359,pics
142,Crossfit...because...reps,2015-10-27 03:41:27+00:00,cwe85cp,2,t1_cwe848y,55,pics
143,she had another adventure to go on...,2015-10-26 07:08:36+00:00,cwd55ld,2,t1_cwd2b8j,8577,aww
144,"My kiddo listens to everything but loves punk, ska, oi etc so this is great :)",2015-10-25 22:12:01+00:00,cwco986,2,t1_cwco65g,139,AskReddit
145,"Lady was a terrier mix and made it to 16, in a way it was perfect. It was time for her to go, my daughter was 3/4 then and has fond memories but has had more youthful dogs for the crazy years. People will pass remarks about having dogs round babies but as long as you read your dogs behavior and give them their space it's the best!!",2015-10-25 19:13:59+00:00,cwch5vo,4,t1_cwch14b,187,dogpictures
146,"I feel bad making a pregnant lady cry but I know exactly what you're going through. We have a theory in my house that the dogs know when its time to leave and give their bed to another who really needs us.
",2015-10-25 18:35:59+00:00,cwcfl28,2,t1_cwcf7qu,533,dogpictures
147,http://imgur.com/QnagojX http://imgur.com/6xiZJ2b,2015-10-17 23:17:27+00:00,cw3f6e6,2,t1_cw3eohf,872,mildlyinteresting
148,"Yes she was a street dog and malnourished, couldn't stand when they saved her, she travelled from bosnia to the uk in july to live with m and get adequate veterinary care, she's being monitored closely. Her paws are strengthening as she grows and her body is trying to recover but her paws will never be as they should.",2015-10-17 23:14:51+00:00,cw3f37k,2,t1_cw3eohf,716,mildlyinteresting
149,"My kid has said worse to me. It hurts but as a parent you know it's heat of the moment, we were all young once.
",2015-10-17 21:06:39+00:00,cw3aqem,2,t1_cw39zzr,1265,AskReddit
150,"Yea she's 6 months in the pic and massive, the vet thinks she's setter/newfoundland ",2015-10-17 16:39:28+00:00,cw31rj7,2,t1_cw31nuq,180,mildlyinteresting
151,Good in bed but a shitty girlfriend. Makes a good cup of tea and likes to play tekken post coital.,2015-10-16 01:45:30+00:00,cw1dlk5,1,t3_3oxfs0,4376,AskReddit
152,"Slayer - Threshold 
https://www.youtube.com/watch?v=nFQhlpB6N2A 
Sets the mood nicely

",2015-10-16 01:43:42+00:00,cw1djac,1,t3_3oxe7b,5005,AskReddit
153,"Abuse - I don't care who it's toward, animal abuse, child abuse, abuse of a partner. There's no excuse for being an asshole.",2015-10-16 01:42:12+00:00,cw1dhbb,1,t3_3oxe7j,4912,AskReddit
154,"I was always a back sleeper but pregnancy has made me appreciate being able to lie on my stomach can't sleep any other way now. 
Also I sleep naked.",2015-10-16 01:40:46+00:00,cw1dff2,1,t3_3oxk8w,2017,AskReddit
155,"Baby photos of my daughter, up until she turned 1 there's only a handful of pictures which sucks. The computer completely crashed, still have the computer sitting but it's been 6 years and I think all hope is lost really.",2015-10-16 01:38:06+00:00,cw1dbq1,1,t3_3oxiv4,2482,AskReddit
156,The Giant's Causeway in Northern Ireland,2015-10-16 01:32:57+00:00,cw1d4vu,1,t3_3oxhdi,2856,AskReddit
157,"Emotionally - watching my child having seizures and panic attacks although grand- mal seizures are not so often at the moment. 
",2015-10-16 01:30:28+00:00,cw1d1m0,1,t3_3oxc2r,5186,AskReddit
158,"Stop saying you're quitting, stop counting days. Tell people who offer cigarettes that you don't smoke, tell yourself you don't smoke. 
It really does make a difference.",2015-10-16 01:26:36+00:00,cw1cwlg,1,t3_3oxkl1,1004,AskReddit
159,"also decent sex
",2015-10-10 19:39:07+00:00,cvv1xol,2,t1_cvv1x9k,22,AskReddit
160,A decent cup of tea,2015-10-10 19:38:45+00:00,cvv1x9k,1,t3_3o8yv4,1705,AskReddit
161,Dolly :),2015-10-10 19:19:28+00:00,cvv1afx,3,t1_cvv05n9,2099,AskReddit
162,"vampirefreaks.com
",2015-10-10 18:36:02+00:00,cvuzvt5,1,t3_3o8naa,3186,AskReddit
163,I have a 3 legged dog who falls over when she sneezes or if she gets wet and shakes. How can you not smile when you have a tripawd hopping about the place?,2015-10-10 18:30:59+00:00,cvuzpzp,1,t3_3o8o83,2438,AskReddit
164,Am I the only one who had to think about what all the senses are?,2015-10-10 18:28:46+00:00,cvuznej,1,t3_3o8rqf,762,AskReddit
165,"stupidity
",2015-10-10 18:28:02+00:00,cvuzmkh,1,t3_3o8rhm,824,AskReddit
166,"Dolly is the happiest dog in the world, the only time she stopped wagging her tail was in the hours after the op. She's amazing :) 
It's been 4 years now, she's been without it longer than she was with it. Tripawds are the best",2015-10-10 13:48:19+00:00,cvuragz,2,t1_cvur6dq,284,aww
167,"We live in Norther Ireland, there's no programmes like that here :(",2015-10-09 21:29:57+00:00,cvu63qf,2,t1_cvu404v,3393,autism
168,http://i.imgur.com/rjiW0PK.gif,2015-10-07 23:52:54+00:00,cvrwki3,1,t3_3nwmoa,491,AskReddit
169,"That's the problem, my daughter has special needs so I can't help out. He has a wife and kids but they don't help either. I just feel helpless and he's like a dad to me, always there for me. I just couldn't speak when he rang, I just offered to put the kettle on and said ""you know where I am""..
",2015-10-06 17:44:42+00:00,cvqb8ow,2,t1_cvqa582,1562,Advice
170,"I only found out imgur too. I've got nothing done since
",2015-10-04 20:23:18+00:00,cvo5avk,7,t1_cvo4v07,621,AskReddit
171,"I only found out imgur too. I've got nothing done since
",2015-10-04 20:23:18+00:00,cvo5av4,7,t1_cvo4v07,621,AskReddit
172,"I know, it's bad",2015-10-04 20:11:43+00:00,cvo4t1o,5,t1_cvo4qhi,100,AskReddit
173,I joined reddit a month ago and couldn't use it til 2 weeks ago when a friend told me how..,2015-10-04 20:08:19+00:00,cvo4nwj,3,t1_cvo4f0k,360,AskReddit
174,"When she was PTS I got the vet to come to the house to do it, was easier for her that way. He gave her an injection to make her sleepy and I held her as she drifted away, then he gave the injection to stop her heart. She went peacefully knowing she was adored. Fuck it's hard to type this.",2015-10-04 19:05:27+00:00,cvo23cj,2,t1_cvo2160,91,AskReddit
175,"When my dog was dying she was 16 had epilepsy, cancer etc
We took it easy, let her sleep in the bed, strolls in the park, lots of quality time cuddled up and on her last day I baked her cup cakes and fed her them all. She was happy :)
All a dog really wants is your attention x",2015-10-04 19:03:56+00:00,cvo2160,1,t3_3nh8ws,1694,AskReddit
176,beer and subway,2015-10-04 19:00:35+00:00,cvo1wag,1,t3_3nh1qs,4697,AskReddit
177,"Why my 7 year old who looks perfectly fine is in a special needs buggy. I've been told i'm gonna give her a complex and that she's going to get bullied (this is infront of her) and people constantly tell her she's too big or call her lazy and say I'm just spoiling her...
Because it couldnt possibly be that she's actually disabled of course",2015-10-04 18:59:56+00:00,cvo1vch,1,t3_3nh808,1880,AskReddit
178,I still struggle to work the internet,2015-10-04 18:55:02+00:00,cvo1o1k,1,t3_3nh5ta,2576,AskReddit
179,"well, when they deserve it that is....
",2015-10-04 18:54:09+00:00,cvo1mrv,2,t1_cvo1maa,19,AskReddit
180,I do it everytime :D,2015-10-04 18:53:50+00:00,cvo1maa,1,t3_3nh8sb,1152,AskReddit
181,I googled it. Is it essentially gravy cheesey chips?,2015-10-04 13:37:52+00:00,cvnqk4e,2,t1_cvnqiul,96,AskReddit
182,I can't believe nobody's said soup yet,2015-10-04 10:29:25+00:00,cvnnf33,1,t3_3nftad,1295,AskReddit
183,on it's own or...?,2015-10-04 10:16:53+00:00,cvnn925,2,t1_cvnn5kq,459,AskReddit
184,We've read the hobbit and watched all the movies. Think we'll start lord of the rings when she's off for christmas thanks :),2015-10-02 19:25:42+00:00,cvm0msv,2,t1_cvm0lal,65,AskReddit
185,"I need to write this stuff down, you guys are golden",2015-10-02 19:18:39+00:00,cvm0cwl,2,t1_cvm0970,161,AskReddit
186,"How could you with hold woody and buzz for that long""""",2015-10-02 19:18:02+00:00,cvm0c1w,4,t1_cvm0a57,83,AskReddit
187,I already showed her the goonies to put in context making her do the truffle shuffle before I give her stuff...does that make me a bad person?,2015-10-02 19:16:54+00:00,cvm0ai9,2,t1_cvm08jt,85,AskReddit
188,lol we watched them all already!!,2015-10-02 19:14:46+00:00,cvm07jh,2,t1_cvm06h9,45,AskReddit
189,I just bought snakes and ladders today :D,2015-10-02 19:10:09+00:00,cvm015e,2,t1_cvlzcl2,1046,AskReddit
190,"She is autistic but there's not much ASD friendly here but cinema screenings and then she gets annoyed because nobody else is behaving (total double standards). Although now you've got me thinking if I could organize something as I'm sure there's bound to be others in the same situation. Will have to look into it, thankyou :)",2015-10-02 19:08:46+00:00,cvlzz7s,4,t1_cvlzq0w,399,AskReddit
191,All she plays is minecraft!! Any suggestions?,2015-10-02 18:58:06+00:00,cvlzkc2,2,t1_cvlzfvj,185,AskReddit
192,"She loves Andre Reiu but she has SPD so we haven't braved concerts yet however my brother was a classical musican so hopefully with his help one day :)

You're so right though, passion is so important!!",2015-10-02 18:56:34+00:00,cvlzi4a,2,t1_cvlzczi,214,AskReddit
193,"We have a zoo membership and for her 5th birthday she asked for a pink bon jovi shirt :) http://imgur.com/IDZ7T6T

Will have to get on the rest of your suggestions!!",2015-10-02 18:54:06+00:00,cvlzehq,2,t1_cvlz8j7,253,AskReddit
194,My daughter has ASD. Do you think someone on the spectrum would understand it? She's high functioning.,2015-10-02 18:49:25+00:00,cvlz7wu,3,t1_cvlytts,584,AskReddit
195,We just finished the giraffe the pelly and me and thats all the roald dahl ones done. Reading the railway children before we start dick king-smith books,2015-10-02 18:47:08+00:00,cvlz4kt,2,t1_cvlz293,97,AskReddit
196,Playing the 9th symphony to her now will let you know how it goes ,2015-10-02 18:45:30+00:00,cvlz27t,2,t1_cvlyzr8,101,AskReddit
197,Yea we learnt the percy jackson lesson the hard way,2015-10-02 18:44:21+00:00,cvlz0ir,2,t1_cvlyyfs,87,AskReddit
198,"I saved the Harry Potter books until last year, I covered the room in fairy lights and played the theme music while I read, it was amazing!!",2015-10-02 18:40:48+00:00,cvlyvfa,2,t1_cvlyphs,246,AskReddit
199,She prefers the album at war with satan.....,2015-10-02 18:37:13+00:00,cvlyq9e,2,t1_cvlyo52,85,AskReddit
200,What kind of mushrooms we talkin?,2015-10-02 18:35:58+00:00,cvlyodl,2,t1_cvlynlo,32,AskReddit
201,Just deleted the thread by accident but yes deffo!!,2015-10-02 18:24:15+00:00,cvly7iv,2,t1_cvly5ff,87,AskReddit
202,"a. The web spun by a spider to catch its prey.
b. A single thread spun by a spider.
2. Something resembling the web of a spider in gauziness or flimsiness.
3. An intricate plot; a snare: caught in a cobweb of espionage and intrigue.
4. cobwebs Confusion; disorder: cobwebs on the brain.
tr.v. cob·webbed, cob·web·bing, cob·webs
To cover with or as if with cobwebs.",2015-10-02 13:25:28+00:00,cvlmj5o,2,t1_cvlmfc7,213,mildlyinteresting
203,https://31.media.tumblr.com/tumblr_lw4ic8HKXw1qf457j.gif,2015-10-02 09:08:15+00:00,cvlhvbi,1,t3_3n73kq,13288,InternetIsBeautiful
204,"https://www.youtube.com/watch?v=_KyiE5-Pqpk

sell tickets..",2015-10-02 08:35:56+00:00,cvlhfw2,1,t3_3n7e2x,741,AskReddit
205,"Duct tape, a packet of chicken and some condoms. Then ask if the dog outside has an owner",2015-10-01 19:51:34+00:00,cvkvgb3,1,t3_3n4sx2,4741,funny
206,"Metal (most genres) oi, ska, d-beat and general good ole rock n roll. Partial to classical and well this could go on. Basically if it's not shite I'll give it a go
https://www.youtube.com/watch?v=dQw4w9WgXcQ",2015-10-01 19:01:06+00:00,cvkt9a7,1,t3_3n4l95,4835,AskReddit
207,Simple co-ordination. I tried to change gear last week and grabbed the instructors leg. A meal rarely makes it in my mouth without crumbs in my cleavage and door frames are not  my friends,2015-10-01 18:58:48+00:00,cvkt5tp,1,t3_3n4qal,2636,AskReddit
208,She's been waiting so long she can no longer afford it due to inflation.,2015-10-01 13:07:46+00:00,cvkfjsh,1,t3_3n2kei,25199,gifs
209,shirtgate?,2015-10-01 12:48:07+00:00,cvkf15s,2,t1_cvkezre,97,AskReddit
210,"Raising my child to not be a complete asshole.
Also I volunteer for a few different charities.
I adopt pets, never buy.
I don't litter.
I try to be pleasant to everyone I meet.
I don't think I've made it a worse place yet....",2015-09-30 22:47:07+00:00,cvjv2dq,1,t3_3n0vi5,2490,AskReddit
211,It's actually really strong and I use extra strong tea bags,2015-09-30 22:36:45+00:00,cvjup61,2,t1_cvjulle,167,mildlyinteresting
212,"She was 16 and had developed epilepsy, a thyroid problem and a brain tumor. She was a rescue dog and was never in great health but she knew she was loved and it was the right time for her to go.
We got another addition to our pack the next day. My daughter is pretty logical so she accepted the death fairly well, there was of course some tears but it's not as painful anymore, just fond memories :)",2015-09-30 22:16:17+00:00,cvjtyar,2,t1_cvjtn4f,498,pics
213,Well I didn't put it there if that's what you think lol,2015-09-30 21:22:46+00:00,cvjrwi6,2,t1_cvjrsnd,164,mildlyinteresting
214,had to be done :),2015-09-30 20:10:22+00:00,cvjowfk,2,t1_cvjny16,1334,pics
215,My kid vomiting on my back. Then I vomited and my dog tried to eat it. Parenting is not for those with a weak stomach.,2015-09-30 18:07:22+00:00,cvjjma5,1,t3_3mzivs,4620,AskReddit
216,"Sitting beside your friends in the cinema, I like to leave at least a one seat gap. If I wanted to talk we wouldn't be at the cinema",2015-09-30 18:02:47+00:00,cvjjf8j,1,t3_3mzm28,3138,AskReddit
217,I've never had a fillling,2015-09-30 18:00:55+00:00,cvjjcgh,1,t3_3mzqwe,1209,AskReddit
218,"People who whistle a little when they say ""s""",2015-09-30 17:59:02+00:00,cvjj9lx,1,t3_3mznm4,2323,AskReddit
219,Or stepping in a puddle your pet has provided...,2015-09-30 17:58:23+00:00,cvjj8lg,2,t1_cvji70k,1467,AskReddit
220,"I was in the bathroom and suddenly I realized how quiet it was, which meant my kid was most definitely up to something. I went to open the bathroom door and couldn't open more than an inch or two. 
My daughter had nicked my bra and put one strap over the door handle and the other strap over the banister. I kept trying to pull the door open to no avail while she stood yelling ""booby trap"". 
I dread the teen years.",2015-09-30 17:31:17+00:00,cvji2yq,1,t3_3mzmy4,912,AskReddit
221,"https://www.youtube.com/watch?v=Xu7rPq_0kJ0

The Toasters - Don't let the bastards grind you down",2015-09-30 13:11:59+00:00,cvj842o,1,t3_3mygdj,3540,AskReddit
222,"My kid. If i didn't laugh i'd cry.
 ""MUMMMM""
Wait a wee second
""MUMMMM I did a bad thing"" *sound of paper ripping*
So I ran up the stairs like a maniac expecting destruction..
Little evil genius is standing tearing a piece of paper, she just wanted me to look at her toys all lined up and knew exactly how to get my immediate attention.
I'm getting out smarted by a 7 year old...I dread the teen years.",2015-09-29 20:30:36+00:00,cvii4js,1,t3_3mvfmk,2933,AskReddit
223,"When my daughter was a toddler she threw our hamster dinosaur at me when I was mid piss. 
He lived but the kid nearly didn't",2015-09-29 20:29:10+00:00,cvii2bb,1,t3_3mvjzm,1047,AskReddit
224,"If you've seen one of his movies then you've seen them all. Seriously he's only truly funny the first time, the second he's mildly amusing and by the third you want to punch him in teh dick to see if he really makes that groaning noise he things is funny when he's *acting pissed off..... *I use the term acting loosely",2015-09-29 20:27:18+00:00,cvihzeo,1,t3_3mvja6,1231,AskReddit
225,Giraffes spend so much time with their tongue exposed eating that they are blue to prevent sunburn,2015-09-29 20:25:08+00:00,cvihvx1,1,t3_3mvefk,3099,AskReddit
226,"Don't buy useless shit to fill space or to look nice unless it actually makes you happy it's pointless, one day you're gonna have to move it, until then you have to clean it. Effort!",2015-09-29 20:24:06+00:00,cvihuad,1,t3_3mvec6,3083,AskReddit
227,"Don't take out loans, it's not free money or easy money, you do in fact have to pay for it at some point. 
It's like my mum saying she'll give me £20 right now if I give her £30 later. Only with bigger amounts of money. Fucking stupid. Just save",2015-09-29 20:22:10+00:00,cvihrd6,1,t3_3mvh79,1809,AskReddit
228,Effort and I'm a shitty girlfriend,2015-09-29 20:14:20+00:00,cvihf3j,1,t3_3mv86a,4947,AskReddit
229,"Sarah McLachlan - In the arms of an angel

Was played at my little cousins funeral. Absolutely heartwrenching ",2015-09-29 19:15:06+00:00,cvieu2y,1,t3_3mv6rs,1973,AskReddit
230,thank you ,2015-09-29 18:08:37+00:00,cvic2ns,5,t1_cvhzdh9,21407,AskReddit
231,Porn,2015-09-29 17:50:50+00:00,cvibbqh,1,t3_3munjv,4501,AskReddit
232,"the population will only grow and the amount of firearms, Just because it's already a huge problem doesn't mean it's too late!! 
How many kids have fired guns that were in the house for their protection? How many people realistically use guns to hunt for every meal. In my opinion it's all excuses and there is no excuse for a childs death due to firearms.",2015-09-29 16:11:56+00:00,cvi77p0,5,t1_cvi6xlj,413,AskReddit
233,Round-a-bouts. I indicate when? I go in what lane? WHERE THE FUCK DID THAT GUY COME FROM?!?!,2015-09-29 16:01:27+00:00,cvi6sfc,1,t3_3mu9tf,3593,AskReddit
234,"I have no problem with say airsoft rifles, pellet guns etc but having ""the right to bear arms"". It's madness",2015-09-29 15:59:45+00:00,cvi6pzs,3,t1_cvi6l6c,202,AskReddit
235,Guns. I'm sorry to be 'that person' but seriously how many people have to die before you do something about that?,2015-09-29 15:48:07+00:00,cvi6995,1,t3_3muei5,868,AskReddit
236,Had sex in a disabled toilet with an ex before his band played a concert. Walked out and there was a man standing with his daughter waiting for an autograph. Fucking weird. I had to take the photograph.,2015-09-29 15:44:07+00:00,cvi63kx,1,t3_3mu597,4532,AskReddit
237,"I like to go to the cinema alone, walk my dogs or grab a coffee and sit in the park with a good book.",2015-09-29 15:41:47+00:00,cvi60ck,1,t3_3muccr,1379,AskReddit
238,I've thought how easy it would be to kill my child. I mean I'd never do it but I've thought about it.,2015-09-29 15:35:20+00:00,cvi5r7c,1,t3_3mu9jd,2150,AskReddit
239,"Aerosmith - dude looks like a lady. My brother kept singing ""do it like a lady"".
",2015-09-29 15:26:37+00:00,cvi5f2r,1,t3_3mubkd,795,AskReddit
240,I couldn't work the toaster. I just stood there staring at it convinced it couldn't be that simple and I was obviously missing something.,2015-09-29 11:56:43+00:00,cvhz2l3,1,t3_3mtm30,982,AskReddit
241,i usually put DR for a laugh to make me feel important because I'll never be a doctor or just put Ms,2015-09-29 11:47:52+00:00,cvhywkr,3,t1_cvhyhv7,1374,AskReddit
242,"Because they aren't doing it right.
The best sex is with someone you're comfortable with, you can talk about sex and laugh about it too. You are both willing to try new things and you both have similar desires.
There needs to be give and take, (no pun intended) sometimes you have to put yourself out there, you can't expect a blow job if you aren't going to go down on a girl. 
Also with things like oral sex communication is key, don't be afraid to give direction and dont be afraid to take it either!! There's no point putting someones dick in your mouth if they aren't enjoying it.

Getting good at sex takes time, you need to build your confidence and once you do you will enjoy it much more. Don't be afraid to enjoy yourself. You'd be amazed at what others do behind closed doors.
",2015-09-29 11:16:13+00:00,cvhycm9,1,t3_3mtgbr,2673,AskReddit
243,Farmer although I would love to see it attempt milking a cow or harvesting potatoes,2015-09-29 11:09:32+00:00,cvhy8r7,1,t3_3mthuf,1161,AskReddit
244,Ah now you've peaked my interest,2015-09-29 10:22:12+00:00,cvhxk4j,2,t1_cvhxju9,37,AskReddit
245,Preserve it so I can be brought back in the future..if they could make me look 16 again too that'd be swell,2015-09-29 10:00:05+00:00,cvhx9q5,1,t3_3mtayt,2272,AskReddit
246,"Ugly babies. I'm not talking kids with disability's, just really ugly babies, little skinny wrinkly shit machines. Everyone lies to the parents and says how cute they are and I'm standing there choking back the urge to tell the truth. The kid is clearly ugly as sin. Fingers crossed they grow out of it.  ",2015-09-29 09:52:11+00:00,cvhx640,1,t3_3mtbfu,1407,AskReddit
247,"Knob jockey or cum guzzler. Telling people that have the personality of a ""any vegetable"".
Also calling people quantum dick because most don't realise that quantum means extremely teeny tiny",2015-09-28 23:50:29+00:00,cvhhtw5,1,t3_3mrimm,1850,AskReddit
248,"I give really awesome blowjobs but it's hard to slip that into casual conversation. 

",2015-09-28 23:42:06+00:00,cvhhjjr,1,t3_3mrgkr,2229,AskReddit
249,"It's an intentionally open question, I wanted to see how people would interpret it more than get an answer to be honest",2015-09-28 19:30:51+00:00,cvh7wp0,2,t1_cvh7vgz,48,AskReddit
250,Some pretty nasty looking milk,2015-09-28 19:13:38+00:00,cvh75sr,1,t3_3mq5ca,5020,AskReddit
251,"Lemmy from motorhead, we just sat about he tried to get me to eat kinder eggs, we smoked and drank but he was no fun, I can't remember him saying anything that wasn't sleazy... But sure.",2015-09-28 19:11:26+00:00,cvh72ex,1,t3_3mqatt,2740,AskReddit
252,"white diesel is always lovely, more so on women and not an after shave but lynx Africa deodorant ",2015-09-28 18:34:32+00:00,cvh5jo4,1,t3_3mq6sw,2100,AskReddit
253,Pogs ,2015-09-28 18:32:52+00:00,cvh5h67,1,t3_3mq3br,3387,AskReddit
254,Elvis Costello - Pay it back,2015-09-28 18:31:29+00:00,cvh5f3w,1,t3_3mq0ja,4436,AskReddit
255,Aside from the obvious...back dimples on men who work out.,2015-09-28 18:26:32+00:00,cvh57vz,1,t3_3mpx02,5517,AskReddit
256,Loves to chew my bra straps then just lie with the rest of the bra until she's let out then leaves it in the garden. Steals my pants and socks too but doesnt chew them at all,2015-09-28 18:18:51+00:00,cvh4wcp,1,t3_3mq3ll,2436,AskReddit
257,"Needs more exercise then or mental stimulation, it's trying to burn off excess energy",2015-09-28 18:17:11+00:00,cvh4tw5,2,t1_cvh3ecs,2137,AskReddit
258,"Ordered a vibrator on amazon and forgot to change the address. The last address used was my parents so the vibrator arrived and of course I had failed to specify a first name on the package so mum opened it assuming it was for her. 
Fucking awkward",2015-09-28 18:16:06+00:00,cvh4s9v,1,t3_3mq05z,3661,AskReddit
259,"I'm a single adult, my browsing history consists of asking google questions I should probably know the answers to rather than having to ring my parents, porn and an amazon wishlist that is never ending.",2015-09-28 18:12:50+00:00,cvh4nke,1,t3_3mq637,1065,AskReddit
260,What a sweet bunny! Dem cheeks!!,2015-09-28 17:38:52+00:00,cvh3ag7,1,t3_3mpvl4,3208,aww
261,"There is a scientific explanation, something about a chemical being released in the oozey stuff so it does make you feel better.",2015-09-28 08:28:30+00:00,cvgpao4,1,t3_3mocar,1477,AskReddit
262,"I have no penis but, there's no people so there's no one to judge....sheep.",2015-09-28 08:26:10+00:00,cvgp9l6,1,t3_3moaav,2939,AskReddit
263,"Someone called my kid who has special needs ""a broken fuck trophy""
That's pretty low by any standards",2015-09-28 08:00:47+00:00,cvgoxka,1,t3_3mo8ie,2838,AskReddit
264,I am naked right now lying in bed on reddit. Exciting...,2015-09-28 01:43:11+00:00,cvgfyy9,1,t3_3mn1t5,4238,AskReddit
265,"The legend of Fionn mac Cumhaill (fin - ma- cool) 
It's about a giant that lived on the northcoast of Ireland and how the causeway was built between Scotland and Ireland before being destroyed. If you visit the Giants Causeway you can see the evidence for yourself!!",2015-09-28 01:02:35+00:00,cvgenav,1,t3_3mn100,2148,AskReddit
266,marshmallows and scratchcards,2015-09-28 00:58:08+00:00,cvgehyj,1,t3_3mn0fg,2142,AskReddit
267,when dishes come out of the dishwasher and have that weird too clean feeling and my hands are dry and you can hear a sort of squeak noise it's horrid,2015-09-28 00:29:21+00:00,cvgdkro,1,t3_3mmsw6,4029,AskReddit
268,A top that says giggity giggity goo across the boobs. Love it,2015-09-28 00:25:54+00:00,cvgdgsp,1,t3_3mmxr8,1468,AskReddit
269,Listening. I struggle to concentrate then I end up interrupting or seem rude,2015-09-28 00:23:43+00:00,cvgdeao,1,t3_3mmyto,870,AskReddit
270,Dr Hook - A little bit more,2015-09-28 00:22:33+00:00,cvgdczv,1,t3_3mmyt5,808,AskReddit
271,Pineapple pizza with Parmesan and BBQ dip and a beer ,2015-09-28 00:15:58+00:00,cvgd5rm,1,t3_3mmwmo,1424,AskReddit
