,body,created,id,nest_level,parent_id,reply_delay,subreddit
272,"music
tea
sleep",2015-09-28 00:14:31+00:00,cvgd451,1,t3_3mmqzy,4037,AskReddit
273,chomp - there's just something satisfying about how it sounds,2015-09-28 00:13:15+00:00,cvgd2pt,1,t3_3mmp2c,4886,AskReddit
274,Do you bring pizza?,2015-09-28 00:09:45+00:00,cvgcyst,1,t3_3mmusm,1939,AskReddit
275,Whenever I can. My kid doesn't really sleep so I try to get a nap when she's at school.,2015-09-28 00:01:38+00:00,cvgcptx,1,t3_3mmwc9,716,AskReddit
276,"Walk around on my tip toes, not too weird but I hate people asking what the fuck I'm doing. It just relaxes me.",2015-09-27 23:59:47+00:00,cvgcnnt,1,t3_3mmnuc,4685,AskReddit
277,Take your age half it and add seven. That's as young as you can date. Works everytime.,2015-09-27 23:49:08+00:00,cvgcbt2,1,t3_3mmpey,3264,AskReddit
278,There was more dick in the first five minutes of The Terminator than in the entire 50 shades of grey movie.,2015-09-27 23:43:06+00:00,cvgc515,1,t3_3mmnhd,3849,AskReddit
279,"mints, headphones, deodorant, a book and loose change. ",2015-09-27 23:41:44+00:00,cvgc3ii,1,t3_3mmrdy,1886,AskReddit
280,"On the edge of a panic attack, I can feel the anxiety building and I'm on here for distraction. So pretty shitty",2015-09-27 23:39:05+00:00,cvgc0hd,1,t3_3mms3z,1384,AskReddit
281,"Motorhead, Trivium, Napalm Death, Down, Mastodon - metal bands a lot basically, they're all pretty dead on guys, you get the odd dick head but sure. A lot of them were less exciting than I expected but they say never meet you idols for a reason.",2015-09-27 23:32:17+00:00,cvgbsmo,1,t3_3mmoa8,2832,AskReddit
282,How many people have you slept with and when did you lose your virginity. Some things should remain private,2015-09-27 23:17:54+00:00,cvgbc37,1,t3_3mmowc,1655,AskReddit
283,"If you knew my child you wold realize that it is very much to do with both, autism is entwined with who she is and how her mind works. Yes other kids may do things like this but I doubt so often, so seriously or with such conviction. This to her was the most logical conclusion, most children would not worry themselves or they would suggest buying a new one.",2015-09-27 21:34:33+00:00,cvg7t7t,2,t1_cvg7ncg,265,autism
284,"Last night I was dreaming that I was helping out rescuing dogs when my bottom front tooth began to break, it then crumbled and fell out completely, when i looked in the mirror there was no blood just a large gap and it was sore, there was all wire in my mouth and my teeth all began to crack. I then got in a car and couldn't find the handbrake, the car rolled down a hill and crashed and killed some dogs. I then ended up in an old fashioned prison, someone told the guard I had a mobile and they tried to take it away but when I said i needed it to look at pictures of my daughter they let me hide it. Later I was printing photos for the queen (yea it gets weird) and I tried to print some of my daughter. Then I was in my mums garden again with the dogs I was rescuing and all my teeth were in the rubbish bin and I woke up",2015-09-27 21:28:05+00:00,cvg7kmf,1,t3_3mm2p3,5015,AskReddit
285,Choosing my battles and not taking words spoken in haste personally.,2015-09-27 21:20:58+00:00,cvg7axv,1,t3_3mm38g,4355,AskReddit
286,"My heart was wrapped up in clover
The night I looked at you",2015-09-27 21:19:37+00:00,cvg795u,1,t3_3mm8xi,1822,AskReddit
287,100% of people who notice this comment will notice that this comment is not worth noticing.,2015-09-27 21:16:45+00:00,cvg75bj,1,t3_3mm9wt,1216,AskReddit
288,Toasted soda bread with proper butter and jam with a big mug of strong tea. Then sleep until you feel better.,2015-09-27 21:07:07+00:00,cvg6sfo,1,t3_3mm57w,2691,AskReddit
289,"Spaced!! There needs to be more!!

""Rabbits! Rabbits! Rabbits!""",2015-09-27 21:03:39+00:00,cvg6nsd,1,t3_3mm0e0,4590,AskReddit
290,"oh she is, she's still recovering and her feet still show the damage but she gets better every day",2015-09-27 20:33:44+00:00,cvg5iyc,2,t1_cvg4baz,1786,dogpictures
291,I've just had another look there's a lot of vintage watches from that time online so I think I'll try and get her one similar for Christmas you never know!!,2015-09-27 20:31:36+00:00,cvg5fwv,5,t1_cvg3zj9,2111,AskReddit
292,"Same idea only old fashioned, a thin brown leather strap and the sun and stars were at the top of the clock face, the sun and moon had little faces but it was very dainty and colourful. 
doubt it was as expensive as that but years ago the quality was much better.",2015-09-27 19:43:07+00:00,cvg3ezz,5,t1_cvg38ky,256,AskReddit
293,"I've looked over the years but haven't been able to find one like it, only tacky cheap versions ",2015-09-27 19:29:21+00:00,cvg2u68,3,t1_cvg2orv,219,AskReddit
294,"""son of a nutcracker"" - Buddy the elf
",2015-09-27 17:52:06+00:00,cvfyvkw,1,t3_3mlcc0,3960,AskReddit
295,I still drink I just know when to stop. Some limits should not be tested.,2015-09-27 17:45:46+00:00,cvfymau,3,t1_cvfybpa,465,AskReddit
296,"They've found a new species of animal that is nothing like we have ever seen but with a cuteness level similar to kittens and puppies and are half the hassle. 

I can dream....",2015-09-27 16:42:13+00:00,cvfwap8,1,t3_3ml10e,5001,AskReddit
297,They talk about the weather a lot.,2015-09-27 16:31:25+00:00,cvfvxs5,1,t3_3ml5mz,2109,AskReddit
298,"Few years ago my friend had a party with alots of her work friends, I didn't know anyone really so I just drank....a lot.
I drank a lot of JD and a bottle of Jager. I ended up at my parents house where I hadn't lived for years. I threw up everywhere, I stripped naked, I went to the toilet and missed (still can't figure that out as I'm a girl) I then tried to climb into bed naked with my mum. I woke two days later in their spare room in my fathers pajamas, there was a bucket beside me that contained alcohol and failed attempts I'd had at drinking water.
I had lay there awkwardly on my arm for over a day and trapped nerves, I couldn't feel the skin on my upper arm for nearly a year.

I'm glad I don't remember what happened at the party but I still can't shop in their store and can't drink jager or JD to this day, the thought makes me queasy.",2015-09-27 15:50:26+00:00,cvfumd8,1,t3_3mkzcq,2752,AskReddit
299,Under boob sweat,2015-09-27 15:27:32+00:00,cvftwwh,1,t3_3mkzp1,1206,AskReddit
300,just googled. well played.,2015-09-27 15:10:11+00:00,cvftex7,6,t1_cvftcuj,116,AskReddit
301,"sorry, the wings of a pterodactyl",2015-09-27 15:04:33+00:00,cvft96i,2,t1_cvft73h,129,AskReddit
302,"150%??
",2015-09-27 15:01:37+00:00,cvft6bg,4,t1_cvft5ly,43,AskReddit
303,Which parts?,2015-09-27 15:00:05+00:00,cvft4ux,2,t1_cvft4ag,34,AskReddit
304,"When I was a kid my mum had a gold watch that showed the sunshine during the day and the stars and moon came up at night she loved that watch and so did I.
I used to beg her to let me wear it and one day when I was about 9 she let me, it was a big deal and she gave me the ""I'm trusting you"" talk.
I was so excited, I went to the park with my friends that day and when I got home I realized the watch had come off. I ran back and searched for it but had to go home when it got dark. 
The look on my mums face was just awful.",2015-09-27 14:20:52+00:00,cvfs3y6,1,t3_3mkswz,958,AskReddit
305,Totally agree with you there!! I'm yet to meet an obese person that doesn't have some mental health issues. Which came first obesity or issues is sort of like the chicken and the egg question.,2015-09-27 12:43:05+00:00,cvfq2k4,2,t1_cvfq07y,238,AskReddit
306,"Yea a few years ago, my daughter kept waking and screaming and freaking out at something in her bedroom, she would scrab my face and screech if I carried her to that corner, she was only a baby. I got a medium and lots of strange shit happened then she said I needed a priest, I was skeptical and so was the priest but he came out anyway, I didn't tell him where my child was freaking out about but he walked straight upstairs into the room and stood where she had been terrified of. His expression froze and he started blessing the place, lighting candles and praying, he left a bible on her cot bed and insisted I blessed the house every night after. He kept asking had anyone done any ouija boards in the house. 
The next night my daughter went into her room and slept through we had no problems since.",2015-09-27 10:33:51+00:00,cvfo9xm,1,t3_3mk6p4,5605,AskReddit
307,"Not entirely sure but it would involve limited contact with people, I could work whenever I wanted, got paid a bomb and free childcare and didn't feel like work... I'll keep dreaming",2015-09-27 10:28:22+00:00,cvfo7lq,1,t3_3mk6vd,5109,AskReddit
308,Don't be a dick.,2015-09-27 10:26:12+00:00,cvfo6o0,1,t3_3mk9dm,2494,AskReddit
309,"I have lots of tattoos and fuck you tattooed on my hand I worked customer services, most people laugh to be honest and anyone who is offended is generally a dick anyway",2015-09-27 10:25:50+00:00,cvfo6i3,1,t3_3mk6bn,5497,AskReddit
310,25 and I reckon I peaked at 16-17 then had a kid.,2015-09-27 10:24:37+00:00,cvfo604,1,t3_3mk6uk,4901,AskReddit
311,"A polar bear, I'd call him creampuff and we'd just cuddle all day, frolic when it snows and basically I'd have the ultimate giant teddy bear :D 
",2015-09-27 10:20:19+00:00,cvfo45b,1,t3_3mk7fl,4057,AskReddit
312,The neighbors cat shitting in my fucking flower bed. ,2015-09-27 10:06:09+00:00,cvfnybr,1,t3_3mk4hc,6054,AskReddit
313,It's how we mark our territory.. ,2015-09-27 10:01:55+00:00,cvfnwi5,2,t1_cvfn9ht,3224,AskReddit
314,"We broke up and a few months later he rang me drunk and after rambling a bit his phone died, I thought nothing of it but an hour later I heard his motorbike outside my house, he came to apologize for his phone dying because drunk driving over to my house was more logical than charging his phone.. I gave him some toast and coffee and made him sober up before leaving.

It was so awkward. You know that's not even the worst it's just the easiest to explain.",2015-09-27 09:59:18+00:00,cvfnvf6,1,t3_3mk5ov,4515,AskReddit
315,"Once a week or more if I can. I usually go alone though, it's the only time I can truly relax and zone out.",2015-09-26 22:19:06+00:00,cvf7q4t,1,t3_3mi979,4881,AskReddit
316,My kid is has ODD/PDA so it's generally the only way she does what I need her to do.,2015-09-26 22:17:59+00:00,cvf7oum,1,t3_3mibs6,3569,AskReddit
317,Emma Stone and Scarlet Johansson - I don't mind who's licking who here if I'm honest,2015-09-26 22:11:56+00:00,cvf7hzk,1,t3_3miahp,3850,AskReddit
318,Anxiety and then i get anxious that the anxiety will keep me up and I'll be exhausted and more anxious the next day.,2015-09-26 22:03:06+00:00,cvf78dg,1,t3_3mif8f,1027,AskReddit
319,"Probably stumbling out of bed to have a look, being able to see fuck all due to cloud and going back to bed.
At least I can say I tried",2015-09-26 17:20:41+00:00,cvey5mh,1,t3_3mhb47,2485,AskReddit
320,Of course!! Even better for us I'd say multiple orgasms and more toys available to heighten the experience.,2015-09-26 17:19:40+00:00,cvey4ef,1,t3_3mh8y5,3363,AskReddit
321,Put the child lock on the car door. Halfway down the motorway on the way to hospital my toddler opened the door despite having a dislocated shoulder. NEVER AGAIN,2015-09-26 17:15:19+00:00,cvexz0z,1,t3_3mhdl3,1080,AskReddit
322,"Actual crocodiles under the monkey bars. We spent our childhood training for this scenario, can't let go now! ",2015-09-26 16:44:09+00:00,cvewz34,1,t3_3mh51j,2907,AskReddit
323,the pain is still so fresh,2015-09-26 16:41:58+00:00,cvewwil,3,t1_cvewvn9,47,AskReddit
324,"AH fucking cunt of a good fuck..fuck...ahhhh...shit..ahhh who left that there?!

I stood on a plug with no shoes on.",2015-09-26 16:38:10+00:00,cvewscc,1,t3_3mgzh7,5076,AskReddit
325,"Don't compare yourself to others. Don't measure your happiness against others. Start volunteering for a charity even just a charity shop, you will be included, feel productive and meet lots of lovely people.",2015-09-26 16:35:19+00:00,cvewp3p,1,t3_3mh7ab,1419,AskReddit
326,You always want what you can't have. I reckon if you live that long knowing you can't have kids it will destroy you. I guess there's always adoption but if it's because you made the choice to be sterilized it would be harder to live with. ,2015-09-26 16:33:13+00:00,cvewmsz,1,t3_3mgxy9,5500,AskReddit
327,The smell of crayons always reminds me of nursery school.,2015-09-26 16:29:19+00:00,cvewicv,1,t3_3mh52c,2006,AskReddit
328,"No it was just the sun was shining and it's a boy :)
want to see the cat you know now though!",2015-09-22 10:57:28+00:00,cva1txs,2,t1_cv9yk0q,14596,catpictures
329,"No, i was chipping the ice out and had already rescued 1 or two fish when I thought hey I should take a picture of this, nobody will ever believe me.",2015-09-21 22:57:39+00:00,cv9k6aa,2,t1_cv9jx7s,429,mildlyinteresting
330,yep - Chiquitos,2015-09-21 21:39:29+00:00,cv9hcur,2,t1_cv9halx,97,mildlyinteresting
331,yes they will...,2015-09-21 20:49:48+00:00,cv9fghe,1,t3_3luj4p,2233,Showerthoughts
332,"How to get out of bed in the morning, instead I lie til the last minute then when i have to get up i go on my phone for a bit, then i have to rush and look like a tramp all day",2015-09-21 20:18:56+00:00,cv9e85z,1,t3_3luf13,2039,AskReddit
333,unfortunately the butter weighs it down,2015-09-21 18:57:29+00:00,cv9ayyi,3,t1_cv9an1j,499,AskReddit
334,How do you think I feel! She's 7 and cute as hell.,2015-09-21 17:31:38+00:00,cv97l95,2,t1_cv97jqy,64,pics
335,That username was already taken,2015-09-21 13:43:01+00:00,cv8zbsi,3,t1_cv8zabv,85,AskReddit
336,nipples,2015-09-21 13:18:22+00:00,cv8ynff,1,t3_3lstqw,938,Showerthoughts
337,Went to see Filth and an old man was cracking one out in the row behind.,2015-09-21 13:08:30+00:00,cv8yee1,1,t3_3lssxr,777,AskReddit
338,"Not much of one due to lack of craic, he sat opening kinder eggs and playing with the toys. Nice guy but not exactly painting the town material.",2015-09-21 13:04:01+00:00,cv8yag3,5,t1_cv8w7n3,6424,AskReddit
339,"so much yes
",2015-09-21 12:59:38+00:00,cv8y6p1,2,t1_cv8y2pf,285,AskReddit
340,If nothing else at least one of them is bound to bring a gift you can put on ebay later,2015-09-21 12:54:05+00:00,cv8y22a,2,t1_cv8xxy8,297,AskReddit
341,Depends if they have control over their bowel movements then I guess.,2015-09-21 12:39:37+00:00,cv8xq6f,3,t1_cv8xmz6,241,AskReddit
342,"We didnt have 'a song' but i have a song for him Slayer - Threshold :D
",2015-09-21 12:34:42+00:00,cv8xm9z,1,t3_3lsjxe,4178,AskReddit
343,"Depends. I mean if a dog came into my house and shit in my hall I wouldn't get too annoyed but if a human did it I'd not be as accepting.
I guess I'm just willing to take more shit from cute animals than from people. Literally.",2015-09-21 12:31:56+00:00,cv8xk7o,1,t3_3lsoux,898,AskReddit
344,"Henry vii - is in a relationship 
is single
is in a relationship
is single
is in a relationship
is single
is in a relationship 
is single
is in a relationship 
is single
is in a relationship",2015-09-21 12:24:12+00:00,cv8xefw,1,t3_3lsmd4,1962,AskReddit
345,I did nazi that coming - Hitler #weejokes,2015-09-21 12:19:06+00:00,cv8xaro,1,t3_3lsmd4,1656,AskReddit
346,how toast always lands butter side down. I know the science behind it but you'd think the universe would give you a break sometime.,2015-09-21 12:07:23+00:00,cv8x2jk,1,t3_3lsmf7,908,AskReddit
347,Well the opposite of hurting puppys would be loving puppys right? I love kittens too,2015-09-21 12:03:31+00:00,cv8wzye,3,t1_cv8jir6,38894,AskReddit
348,"Why Harry Potter? I'm a huge fan but he seems to be a pretty needy guy

",2015-09-21 12:01:12+00:00,cv8wyes,2,t1_cv8wcrr,2096,AskReddit
349,Mum or Ma - Northern Ireland,2015-09-21 11:54:50+00:00,cv8wuba,1,t3_3lsip0,2601,AskReddit
350,"What you cooking?
Don't let me down with the answer!",2015-09-21 11:11:00+00:00,cv8w4bu,2,t1_cv8w278,232,AskReddit
351,Lemmy isn't much craic to be honest.,2015-09-21 10:52:02+00:00,cv8vu8o,3,t1_cv8uvbg,4570,AskReddit
352,"When people stop to chat but they're in the way, like in supermarkets, they stand in the middle of the aisle with their trolleys blocking everyone's way and when you ask them to move instead of stepping to the side they do the whole *eye roll* well i'll see you soon..send my love...etc etc that takes even longer and now I'm the asshole!!
Just step to the fucking side!!

Also when people in cars pull up at the side of the road to offer lifts to their friends and they end up having a conversation with the pedestrian leaning in the window while everyone has to wait for you to shut the fuck up.

",2015-09-21 10:47:14+00:00,cv8vrt1,1,t3_3ls9ti,4946,AskReddit
353,To get to the supermarket apparently.,2015-09-21 10:08:13+00:00,cv8v9jx,2,t1_cv8v8kv,134,mildlyinteresting
354,"Pretty much all the cool stuff from Harry Potter.
",2015-09-21 09:33:11+00:00,cv8uu46,1,t3_3ls62m,3360,movies
355,"My kid has special needs and my dad said she should be institutionalized and months later still doesn't get why I want an apology. He also explained to me when I was about 11 how I was a parasitic leech. 
He's verbally abusive, violent and selfish.

It's ironic because I'm pretty sure he's autistic which is why he thinks my child should be in an institution.",2015-09-21 09:05:11+00:00,cv8uhqx,1,t3_3ls6i3,1320,AskReddit
356,"He turned out to be really hot, we dated for a while. Still friends 10 years later",2015-09-21 08:58:54+00:00,cv8uezy,1,t3_3ls2cq,4270,AskReddit
357,Child birth. ,2015-09-21 08:56:49+00:00,cv8ue5g,1,t3_3ls29a,4220,AskReddit
358,The dog not peeing in the house.,2015-09-21 08:54:37+00:00,cv8ud7o,1,t3_3ls444,2639,AskReddit
359,Dyslexia ,2015-09-21 08:20:20+00:00,cv8txy6,1,t3_3lrzcs,4106,AskReddit
360,My immediate family because they're all mentally unstable ,2015-09-21 08:15:59+00:00,cv8tvyw,1,t3_3ls0yq,2749,AskReddit
361,He likes to put his dick in pigs. He has some serious thrill issues,2015-09-21 08:14:36+00:00,cv8tvbj,1,t3_3ls1xw,1918,AskReddit
362,Slayer - Threshold,2015-09-21 07:31:33+00:00,cv8taxh,1,t3_3lrvi7,3858,AskReddit
363,"Houston it's not cheese, I repeat it's not cheese.",2015-09-21 06:53:33+00:00,cv8sqdj,1,t3_3lrw5o,1140,AskReddit
364,Cock press ups.,2015-09-21 00:01:55+00:00,cv8h057,1,t3_3lqdhj,4278,AskReddit
365,cocaine,2015-09-21 00:00:06+00:00,cv8gy3y,1,t3_3lqbyr,4851,AskReddit
366,"Comedy, I think they're the funniest :D",2015-09-20 23:54:55+00:00,cv8gs0n,1,t3_3lqjv7,980,AskReddit
367,"The lion king gets me every time ""dad wake up"". 
Recently though southpaw had me, the kid had me all choked up.",2015-09-20 23:54:10+00:00,cv8gr4t,1,t3_3lqjxw,906,AskReddit
368,Because I'm a parent,2015-09-20 22:32:45+00:00,cv8dqs9,1,t3_3lq4ju,2825,AskReddit
369,Idiots,2015-09-20 22:26:12+00:00,cv8dhmo,1,t3_3lq5x8,1824,AskReddit
370,I saw an old woman get hit by a lorry when I was a kid. She just walked right in front of it. ,2015-09-20 22:23:37+00:00,cv8de3e,1,t3_3lq07d,4039,AskReddit
371,"The cinema. I like to go on my own, I don't have to talk to anyone, nobody expects me to do anything but just sit there and zone out. Everything is irrelevant for a bit.",2015-09-20 22:20:06+00:00,cv8d9i9,1,t3_3lpyao,4600,AskReddit
372,That I do nothing,2015-09-20 22:14:35+00:00,cv8d22s,1,t3_3lq3ff,2225,AskReddit
373,I like big butts and i cannot lie,2015-09-20 22:13:39+00:00,cv8d0rc,1,t3_3lpwj9,4978,AskReddit
374,The dog and the neighbours cat spooning on the bed. ,2015-09-20 22:08:28+00:00,cv8ctv8,1,t3_3lpzc9,3490,AskReddit
375,I have one. I'm comfortable with it.,2015-09-20 22:06:17+00:00,cv8cr4m,1,t3_3lq1bc,2540,AskReddit
376,"At this point i'm not sure I still qualify as a person in my own right. 
I'm more of a Woo kids are in school or Woo kids asleep at least for now kind of person.
",2015-09-20 22:02:48+00:00,cv8cmrz,3,t1_cv8cjnq,144,AskReddit
377,"having to untie my shoelaces to put my shoe on then tie them again. I slipped them off, why can't they slip back on?!",2015-09-20 22:00:27+00:00,cv8cjpp,1,t3_3lpwkv,4170,AskReddit
378,Someone who wants to settle down and hurt puppys,2015-09-20 21:58:19+00:00,cv8cgzv,1,t3_3lpw2y,4241,AskReddit
379,You have to do a course and pass a test to own a dog or kid. ,2015-09-20 21:52:21+00:00,cv8c90a,1,t3_3lq2h3,1256,AskReddit
380,Neither - I'm a parent. ,2015-09-20 21:44:55+00:00,cv8bz41,1,t3_3lq2je,781,AskReddit
381,I would go for dropping a book on the floor real loud and videoing the kittens reaction..looks like he wouldn't even wake lol,2015-09-20 20:59:30+00:00,cv8a9ou,2,t1_cv88yqd,1976,aww
382,"phew, wasn't entirely sure there.",2015-09-20 20:47:29+00:00,cv89sqi,2,t1_cv86i24,4741,catpictures
383,Only the wealthy officals etc will have computers etc though and i doubt they will be on shower thoughts on reddit. I guess you never know...but i doubt it ,2015-09-20 15:28:31+00:00,cv7xey9,2,t1_cv7xcea,155,Showerthoughts
384,Oh Maud!!,2015-09-20 12:26:50+00:00,cv7trrs,1,t3_3lnxbg,5336,funny
385,ah fuck,2015-09-19 19:23:19+00:00,cv765de,1,t3_3ljvrg,24078,Jokes
386,We keep them locked up so they cant run away and use food as a reward for compliance. I love my dogs but they are essentially furry prisoners :D,2015-09-19 16:55:01+00:00,cv71dic,2,t1_cv719ih,205,Showerthoughts
387,"[Imgur](http://i.imgur.com/lz8hU7Z.jpg) 

Had a laugh with it in a meme generator a while ago",2015-09-18 23:04:54+00:00,cv6em4w,4,t1_cv6ealf,628,funny
388,lmao can't wait to show her this,2015-09-18 22:17:31+00:00,cv6d4dy,2,t1_cv6d0yy,174,funny
389,"Suppose the smoke would help with the vomit taste..
Was she sober? I'm pretty disgusted.",2015-09-18 15:10:37+00:00,cv5wxks,2,t1_cv5wqzl,278,AskReddit
390,That's nasty!,2015-09-18 15:06:02+00:00,cv5wr27,2,t1_cv5wjpd,321,AskReddit
391,"Was it worse because it was a girl? We see footballers do it on TV all the time!
",2015-09-18 15:05:31+00:00,cv5wqbw,2,t1_cv5wl2t,226,AskReddit
392,"It's estimated that 40-60% of people with ADHD also have SPD (sensory processing disorder) 

Unfortunately in my experience ADHD medications do nothing to relieve this. However taking simple steps to recognize when you are struggling and preparing for it is half the battle. Simple things like bringing ear plugs or ear defenders if you're going somewhere that may be overwhelmingly noisy. Keeping a tissue with lavender oil or a scent you like can help when there's a bad smell in public.  

You really just need to realistic. Don't expect too much of yourself but these are things you can work on and if you can't fix it then don't put yourself in the situation unnecessarily. If you don't like wearing bras don't ever feel you have to because society expects it. You'll find people will say ""oh yea i hate that too"" but it's not the same, it doesn't drive them insane and niggle at them for forever. Don't be afraid to tell other people either if they are doing something that is making you miserable.

Look into sensory overload or sensory seeking and try to plan ahead. What can you do in these situations? There's so many people with similar issues and there's a lot of information out there to help ",2015-09-18 14:47:13+00:00,cv5w1n8,1,t3_3lfcfm,7554,ADHD
393,Eating bacon is the only option.,2015-09-17 23:17:26+00:00,cv59dff,2,t1_cv59b8s,114,funny
394,Fair amount of eejits here too.,2015-09-17 22:31:37+00:00,cv57usa,2,t1_cv57gf9,707,funny
395,I'm in Ireland actually haha,2015-09-17 22:14:57+00:00,cv57aer,2,t1_cv56zmm,531,funny
396,"My daughter is 7 and takes everything literally, I'm actually thankful she did this as I had tried to explain to her teacher about her literal interpretations and felt she didn't understand. I was worried the teacher would think she was trying to be a smart ass and would reprimand her but she saw her own error in her instructions and now the teacher has a visual of how my kids mind ticks. Gave us a good giggle too.
",2015-09-17 21:16:58+00:00,cv5574g,2,t1_cv54zqn,328,autism
397,She was supposed to write the words she got wrong on her spelling test. Teacher saw the funny side thankfully. ,2015-09-17 20:50:53+00:00,cv547ij,2,t1_cv53yk4,383,autism
398,"i searched bogeys, not boogers.
",2015-08-22 19:03:27+00:00,cuc1k5x,2,t1_cubze0x,4027,explainlikeimfive
399,"All the more reason surely?

",2015-08-22 16:37:59+00:00,cubwv4z,2,t1_cubwlwr,492,Showerthoughts
