,created,domain,full_link,locked,selftext,subreddit,title,url
0,2016-11-17 19:58:13+00:00,theonlinecitizen.com,https://www.reddit.com/r/Blackfellas/comments/5dhxre/singapore_to_hang_nigerian_national_for/,False,,Blackfellas,Singapore to hang Nigerian national for trafficking Marijuana,http://www.theonlinecitizen.com/2016/11/17/nigerian-national-set-to-be-hung-at-dawn-tomorrow-for-trafficking-of-cannabis-after-apex-court-dismisses-last-ditch-appeal/
1,2016-11-17 19:16:34+00:00,theonlinecitizen.com,https://www.reddit.com/r/Africa/comments/5dhovt/singapore_to_hang_nigerian_for_smuggling_a_few/,False,,Africa,Singapore to hang Nigerian for smuggling a few pounds of Marijuana,http://www.theonlinecitizen.com/2016/11/17/nigerian-national-set-to-be-hung-at-dawn-tomorrow-for-trafficking-of-cannabis-after-apex-court-dismisses-last-ditch-appeal/
2,2016-11-17 01:11:34+00:00,m.dw.com,https://www.reddit.com/r/islam/comments/5dd112/for_indias_extremist_hindus_trump_is_a_hero_for/,False,,islam,"For India′s extremist Hindus, Trump is a hero for inciting anti-Muslim sentiment",http://m.dw.com/en/for-indias-extremist-hindus-trump-is-a-hero/a-36362223
3,2016-10-25 19:00:11+00:00,dailymail.co.uk,https://www.reddit.com/r/blackladies/comments/59cupr/i_wish_amy_schumer_would_just_go_away/,False,,blackladies,I wish Amy Schumer would just go away,http://www.dailymail.co.uk/tvshowbiz/article-3868908/Amy-Schumer-slammed-racist-parody-Beyonce-s-Formation-starring-Goldie-Hawn.html
4,2016-10-18 18:09:39+00:00,self.badEasternPhilosophy,https://www.reddit.com/r/badEasternPhilosophy/comments/585btb/why_are_racists_attracted_to_buddhism_and/,False,"I had a traumatic experience with this white hippie lady at whole foods (yes, I know) and need to vent bc my city is so very very upper middle class White. 

I wore a #BLM shirt to whole foods, minding my own B, when this White hippie lady comes up to me and compliments my shirt. 

Then, she insincerely compliments my hair and I'm thinking, ""Ok... have you never seen a black person before? ""

But then she gives me a lecture on ALL LIVES matter, but does it in the most neoliberal, condescending way! 

""I'm Buddhist and we believe every life, including animals and plants, has value. I just hope we can all see past skin color and be one family.""

IT'S NICE YOU BELIEVE MY LIFE IS WORTH AS MUCH AS A MOSQUITO BISH.

Then she tells me she doesn't believe in racism and starts talking about how she volunteered in Africa and didn't see African children as ""black"". 

White hippie lady proceeds to whip out her phone and show me pictures of her HOLDING AFRICAN BABIES! 

I've had enough and don't want to get arrested at fucking Whole Foods with a bunch of White ppl staring at me, so I say I gotta go and the hippie Becky flitters away to Yoga class.

I moved here from the South and experienced racism there, but at least White southerners are real about it. They're not up in my space bc they know better. 

It's the smugness of their anti-racist racism that really makes me rage here. The ""progressive"" white hippies here think we live in a post-racial society and won't ever acknowledge their White privilege. 

It's like the new White American upper middle class has changed their religion to Buddhism, don't have to work 9 to 5, do yoga, and Raise their own chickens. They've traded country clubs for co-ops and bulimia for veganism, thinking it makes them better human beings. 

Adopting an Eastern religion is just their way of filling their empty, relatively worry-free lives. It doesn't absolve then from White Privilege. 

Meanwhile, POC don't have the luxury of creating hardships just because we're bored and have a trust fund to fall back on.",badEasternPhilosophy,Why are racists attracted to Buddhism and Hinduism? [X-post from r/blackladies],https://www.reddit.com/r/badEasternPhilosophy/comments/585btb/why_are_racists_attracted_to_buddhism_and/
5,2016-10-15 20:01:53+00:00,self.blackladies,https://www.reddit.com/r/blackladies/comments/57nt61/im_so_sick_of_white_hippies_who_think_theyre/,False,"I had a traumatic experience with this white hippie lady at whole foods (yes, I know) and need to vent bc my city is so very very upper middle class White. 

I wore a #BLM shirt to whole foods, minding my own B, when this White hippie lady comes up to me and compliments my shirt. 

Then, she insincerely compliments my hair and I'm thinking, ""Ok... have you never seen a black person before? ""

But then she gives me a lecture on ALL LIVES matter, but does it in the most neoliberal, condescending way! 

""I'm Buddhist and we believe every life, including animals and plants, has value. I just hope we can all see past skin color and be one family.""

IT'S NICE YOU BELIEVE MY LIFE IS WORTH AS MUCH AS A MOSQUITO BISH.

Then she tells me she doesn't believe in racism and starts talking about how she volunteered in Africa and didn't see African children as ""black"". 

White hippie lady proceeds to whip out her phone and show me pictures of her HOLDING AFRICAN BABIES! 

I've had enough and don't want to get arrested at fucking Whole Foods with a bunch of White ppl staring at me, so I say I gotta go and the hippie Becky flitters away to Yoga class.

I moved here from the South and experienced racism there, but at least White southerners are real about it. They're not up in my space bc they know better. 

It's the smugness of their anti-racist racism that really makes me rage here. The ""progressive"" white hippies here think we live in a post-racial society and won't ever acknowledge their White privilege. 

It's like the new White American upper middle class has changed their religion to Buddhism, don't have to work 9 to 5, do yoga, and Raise their own chickens. They've traded country clubs for co-ops and bulimia for veganism, thinking it makes them better human beings. 

Adopting an Eastern religion is just their way of filling their empty, relatively worry-free lives. It doesn't absolve then from White Privilege. 

Meanwhile, POC don't have the luxury of creating hardships just because we're bored and have a trust fund to fall back on.",blackladies,"I'm so sick of White hippies who think they're ""enlightened""",https://www.reddit.com/r/blackladies/comments/57nt61/im_so_sick_of_white_hippies_who_think_theyre/
6,2016-10-03 17:04:43+00:00,buzzfeed.com,https://www.reddit.com/r/blackladies/comments/55oo7b/alt_right_social_media_users_have_new_code_words/,False,,blackladies,Alt Right Social Media Users Have New Code words to describe other races,https://www.buzzfeed.com/alexkantrowitz/racist-social-media-users-have-a-new-code-to-avoid-censorshi?utm_term=.flL1ajBXYp#.uo08vOAL0Q
7,2016-09-26 21:21:28+00:00,gulfnews.com,https://www.reddit.com/r/blackladies/comments/54n03h/in_ghana_calls_to_tear_down_a_statue_of_racist/,False,,blackladies,"In Ghana, calls to tear down a statue of ‘racist’ Gandhi",http://gulfnews.com/news/africa/in-ghana-calls-to-tear-down-a-statue-of-racist-gandhi-1.1900403#.V-QMncWQzRB.twitter
8,2016-09-26 21:16:41+00:00,youtu.be,https://www.reddit.com/r/Blackfellas/comments/54mz8b/racist_taiwanese_commercial_with_blackface/,False,,Blackfellas,Racist Taiwanese commercial with Blackface,https://youtu.be/3ENmtHFulT4
9,2016-09-26 20:17:37+00:00,youtu.be,https://www.reddit.com/r/blackladies/comments/54mo17/racist_taiwanese_commercial_with_blackface/,False,,blackladies,Racist Taiwanese commercial with blackface,https://youtu.be/3ENmtHFulT4
10,2016-09-01 19:41:49+00:00,youtu.be,https://www.reddit.com/r/blackladies/comments/50p49m/is_this_racist_white_peoples_excessive_addiction/,False,,blackladies,Is This Racist? White people's excessive addiction to fake tans,https://youtu.be/HIMT6gU0e4M
11,2016-09-01 03:27:16+00:00,aljazeera.com,https://www.reddit.com/r/Africa/comments/50l8nb/gabon_election_protests_as_ali_bongo_beats_jean/,False,,Africa,Gabon election: Protests as Ali Bongo beats Jean Ping,http://www.aljazeera.com/news/2016/08/gabon-election-protests-ali-bongo-beats-jean-ping-160831183011584.html
12,2016-08-02 21:26:28+00:00,m.chron.com,https://www.reddit.com/r/blackladies/comments/4vuxwv/uh_student_body_vp_under_fire_for_all_lives/,False,,blackladies,UH student body VP under fire for 'All Lives Matter' gets punished by peers,http://m.chron.com/news/houston-texas/houston/article/UH-student-body-VP-under-fire-for-All-Lives-9002537.php
13,2016-08-02 21:12:36+00:00,m.chron.com,https://www.reddit.com/r/Blackfellas/comments/4vuve4/uh_student_body_vp_under_fire_for_all_lives/,False,,Blackfellas,UH student body VP under fire for 'All Lives Matter' gets punished by peers,http://m.chron.com/news/houston-texas/houston/article/UH-student-body-VP-under-fire-for-All-Lives-9002537.php
