,body,created,id,nest_level,parent_id,reply_delay,subreddit
163,"Here's the most recent army list, I'll probably tweak it quite a bit once I see how it performs and I don't own an Enginseer to put in the tank as it stands either.  For instance, I'd like to figure out how to get my Elysian D-99 guys in so that I can use Solomon Lok as their HQ with Jokaero Weaponsmiths in his entourage.  I'm still playing with point values though.
  
The Officer of the Fleet is in place for his -1 to reserves coming in, one further way of breaking up any attempt to drop pod bomb or deep strike on the Stormlord.
  
Inquisitor Coteaz is in place for ""I've been expecting you"" and will be attached to the Multi-meltas or a Scion Command squad with the weapons shuffled to put 4 melta-guns into it.  This way anything that does get through the Officer of the fleet in 2nd turn will have to deal with being sloshed with Martini-melta rifles upon contact with the ground.


*Disclaimer:  This is a totally experimental/concept army list that is 100% supposed to be goofy and/or silly on the table.  It will not be deployed in tournaments and I'm well aware that it could lose horribly and repeatedly.*
  
  
**Lions of Leander VI - Armored Fist (2000 Points)**
  
**Astra Militarum(Combined Arms Detachment) (1005 Points)**
  
*No Force Org Slot (110 Points)*
  
Enginseer - 2 Multi-melta Guns, 3 Servo Arms - 110 Points

*HQ (150 Points)*
  
Company Command Squad - 3 Lasguns, 1 Meltagun, Officer of the Fleet w/ CCW, Laspistol &amp; CCW, HoC: Kurov's Aquila - 150 Points
  
*Troops (165 Points)*
  
Veterans - 9 Lasguns, Laspistol &amp; CCW - 60 Points
Veterans - 6 Lasguns, 3 Plasma Guns, Laspistol &amp; CCW - 105 Points
  
*Lord of War (580 Points)*
  
Stormlord - 2 Pairs of Lascannon Turrets, 4 Twin-linked Heavy Bolters - 585 Points
  
**Militarum Tempestus (Combined Arms Detachment) (895 Points)**
  
*HQ (105 Points)*
  
Militarum Tempestus Command Squad - 2 Hot-shot Lasguns, 2 Meltaguns, Bolt Pistol &amp; CCW - 105 Points

*Troops (200 Points)*

Militarum Tempestus Scions - 2 Hot-shot Lasguns, 2 Plasma Guns, Bolt Pistol &amp; CCW - 100 Points
Militarum Tempestus Scions - 2 Hot-shot Lasguns, 2 Plasma Guns, Bolt Pistol &amp; CCW - 100 Points
  
*Lord of War (590 Points)*

Hellhammer - Pair of Lascannon Turrets, 2x Twin-linked Heavy Bolter - 590 Points
  
**Inquisition (Inquisitorial Detachment) (100 Points)**
  
*HQ (100 Points)*
  
Inquisitor Coteaz - 100 Points",2015-10-08 21:34:47+00:00,cvsz64o,4,t1_cvsxx0r,1897,Warhammer
164,"I got it specifically to try out an insanely goofy strategy I came up with, I explained it toward the top of the post here.  Will it work?  Who knows...but it will surely confuse an opponent when I set up two models on the board and say ""done"" during the deployment phase!",2015-10-08 19:40:57+00:00,cvsugzb,2,t1_cvs8jjk,47387,Warhammer
165,"I've actually been meaning to post about that and keep forgetting to.  What is up with that front left track spoke?  Not sure if you've built one personally but following the steps correctly results in the teeth not aligning on that front track.

You can see the same thing here on my Hellhammer:  [Click Here](http://i.imgur.com/E8GMm1p.png).  For the Hellhammer I actually cut the teeth clean out of the wheel and then manually layed them into place.

It's a bit hard to see here, as the Stormlord is at an angle, but if you put them side by side you'll still see the spacing of the left track for both tanks is off in comparison with their right track.

[Click Here](http://i.imgur.com/3YB4FK1.png)

Any insight on this would be awesome as it's relatively maddening when you're applying plastic glue and then racing against time to get things lined up right when dry fitting ""appeared"" to work just fine.

Thanks for the compliment!",2015-10-08 19:39:36+00:00,cvsuew0,2,t1_cvsjnxu,15741,Warhammer
166,"Oh absolutely!  I go to GW: City Walk relatively frequently and play as much as I can.  One of the key points behind the Stormlord was to provide a mechanized force for my Air Cav so that I did not have to drag all of the planes up there every time I wanted to play.  The Marauder Destroyer is especially fragile and without forcing my girlfriend to hold it in her lap the whole way I doubt it would get there intact!

If you're curious, you can check out this battle report that I posted a couple of weeks ago.  I don't win but it was a brutal throw down battle, one turn saw over 60 dice rolls pouring into a squad of Space Wolf heroes after my Scions were able to deep-strike into perfect kill range.  Unfortunately despite inflicting wounds, they did not drop them and tears soon followed.

Battle Report:  [Click Here](http://imgur.com/a/NAKws)",2015-10-08 19:33:52+00:00,cvsu6b4,2,t1_cvsixcv,16520,Warhammer
167,"The blue highlights are in fact pervasive in my army and a signature of the regiment.  I'm working on a regimental standard for them and you can believe it will be incorporated.

Here's a slightly out of date army shot album I posted a couple of weeks ago so you can see what I'm talking about:  [Click Here](http://imgur.com/a/EonMS)

Thanks for the input and the red/orange is most likely going to make an appearance in my Solar Auxilia army but when I started this army I had just finished 2,000 points of Skitarii.  Quite frankly I wanted nothing to do with the color red for as long as I could manage after that!",2015-10-08 19:29:41+00:00,cvsu04f,2,t1_cvsiswb,16465,Warhammer
168,"The thing with scratches to me is that none of my vehicles show battle damage so, suddenly banging up a single tank with battle damage would look bizarre.  If I had been doing that from the start I would agree but I've only been painting again since April of this year and before that I was done in 2001 when I joined the USAF.  I have some medical issues and despite being able to paint (time-wise) around 2007 my hands would shake uncontrollably whenever I tried to paint anything with detail.  

Earlier this year I noticed that my hands weren't shaking while typing anymore and grabbed an old banged up brush to see if I could tap small points on some of my old models.  When I realized that I could I was seriously excited and as the Skitarii had just come about, I got into them.  2,000 Points later I didn't want to see the color red again and grabbed a box of 5 Scions to clear my head and suddenly in 3 months time I'm looking at 4,000+ points of IG/MT/Elysians.  So to say I've been crash coursing my painting skills is an understatement.
  
Example of Single Figure Progression:  [April - Present - Oct 8th, 2015](http://i.imgur.com/RvHfgHv.png)
  
Some of the more mechanical things I'm still not hugely comfortable with.  It was only recently that I started actually drilling barrels, which is why the heavy bolters on the front of the Stormlord and the stubbers in the back all have their barrels drilled.  So the idea of scratching up the tank as it stands, especially for the first time on a super heavy that costs a pretty penny, isn't hugely appealing to me.  I can say this though, I will take your recommendations and when I complete this Chimera that came with the Cadian Defence Force box...I will battle scar it and paint it up, adding charring around the armor deflected shots.  If anything it will give me some time to practice without leaving me feeling like I ruined a super heavy if I mess up.

Thanks for the critique, I really appreciate it!",2015-10-08 19:25:23+00:00,cvsttpp,2,t1_cvsgntj,19781,Warhammer
169,"The power lines across the entire force have always been blue unless they were corrugated (which sometimes vary to metallic) or are tied to a Scion weapon system (which are a highlighted black).  

Raised armor panels are done in a shaded grey, while weapon based sights are predominantly based with Temple Guard Blue highlighted and sometimes highlighted with Baharroth Blue.

Lights are handled based on the system they are attached to.  If the light is protruding from the model it is based in temple guard blue but if it is recessed into the unit and/or hand held device it is gauss blaster green.  Forward facing lights that are not part a weapon sight system are gauss blaster green.  The only exception to this that I'm aware of off the top of my head can be found on the lascannon sights for my Valkyries which are Gauss Blaster Green due to the number of blue accent sights already in place.

The issue with trying to change something like this is we're talking about 4,000+ Combined Points of Astra Militarum (IG) and Militarum Tempestus.  This includes 3 Super Heavies (Marauder Destroyer, Hellhammer, and the Stormlord), 4 Valkyries, 1 Vulture, an Imperial Knight and then a combined 7 squads (Command squads included).  Support/specialized vehicles are also in there.  So changing one tank, especially a Super Heavy that draws eyes on the table, would make it look very out of place with the rest of the force.  It should be noted this force was never intended to become this large, I was only trying to put the Scion Air Cav formation on the board, but feedback here inclined me to continue building it up and I am consistent with my painting and color schemes.

I know that sounds like I'm just dismissing you but I can promise you that's not the case, I'm planning on building a Solar Auxilia army next and the feedback I've received from people will all influence how I decide to design them if I don't go with one of the pre-existing themes.  So trust me, I really do appreciate the criticism it's just not something I can retroactively apply to this army as it stands.  Thanks again for the honesty!",2015-10-08 18:54:46+00:00,cvssldy,2,t1_cvsfap7,20564,Warhammer
170,"Thank you!  I'll eventually end up posting the fluff codex for the army, as I am working on developing it in an Anphelion Project-like fashion that has really helped in visualizing how the regiment functions and what strategies fit best for it.",2015-10-08 18:29:16+00:00,cvsrjoc,2,t1_cvsbozn,30041,Warhammer
171,"Thank you!  The paint scheme has always been a love/hate thing for people it seems, you can see that even in the comments here, and while I'm sure I could make a singular model look better by changing things...in the end it would stick out like a sore thumb against the uniformity of the force.  I'll be putting a lot of thought into all the feedback before I start my Solar Auxilia regiment.",2015-10-08 18:27:00+00:00,cvsrg6q,2,t1_cvsat7w,33894,Warhammer
172,"Thank you very much!  The extra sponsons really do give the Stormlord a more threatening feel, especially when you keep in mind that the army list strategy I've been putting together, with peoples input over at Bolter and Chainsword, has the Hellhammer running close escort for it.  The Guard force on-board will be static while the Scions will dismount and seize objectives.  The Stormlord will also be self repairing on a 2+ thanks to the 3 Servitors and hurling 2 multi-melta shots out as well.  Inquisitor Coteaz will ensure that Drop Pods won't get in close to the Stormlord and those that do will be peppered with Multi-Melta fire on their way down; this is the entire reason I painted the Inquisitor that I posted recently, it's all been building to this strategy.

Mind you I'm aware the strategy is goofy and silly but it just sounds like a lot of fun on the table so who am I to argue?  I am a bit up in the air over the Enginseer model and may end up proxying the Titan Tech Priest from FW as I think he's more interesting than the two metal ones.  It should be noted that this army is almost done for the moment, new models will have me returning to it, but my next target is Solar Auxilia.  I'm just waiting for the book right now so I can read the back story and decide a paint theme for them.",2015-10-08 18:24:18+00:00,cvsrc56,2,t1_cvs9yg7,37512,Warhammer
173,"Thanks!  I will probably end up using some of the forge world dirt to dust up the tracks of both my super heavy tanks eventually.  I absolutely agree it adds to the realism of the tank.

As to the iconography, there's a custom decal making website that was made from a kickstarter and I've been working on coming up with some things to put on a custom sheet so that I can order it from them.  It's hard to place something like that with the 4 sponson setup but I'm sure I can figure something out.

Right now this was was just the last model between myself and starting into my Armies on Parade display, just glad it's done for the most part and I can use it in the store a lot easier than lugging my 4 Valkyries around with me!",2015-10-08 05:17:03+00:00,cvs717j,2,t1_cvs6vpc,395,Warhammer
174,"Yeah that was one of my debates but the entire regiments infantry-based units has that specific color scheme for armor plating with the grey being applied for uniforms.  The cloaks I vary as the officers usually have a fair deal of gray on them in the first place and making their cloaks gray would make provide no contrast on the unit.  

As Inquisitor Trelan Orvelus, which is who the model represents, is in charge of trying to clean up the nightmare of Leander VI it seemed obvious he would be utilizing paint that would match with the landscape on the planet.  I really wished there had been some chain or scale in the armor that would allow for me to change things up a bit but the sheer number of things on his belt does help some.

Thanks for the compliment and the critique!",2015-10-05 01:37:53+00:00,cvogn21,2,t1_cvofwe2,1337,Warhammer
175,"Sent you some of the information on the backstory!  Yeah, I just bought the Inquisition Codex and can see they are in fact cybernetic birds so everything works out just fine.  I don't think I'll run him as Coteaz all the time but I will admit that I find myself wanting to hunt down more Inquisitors now to integrate into the background since Leander VI is under their jurisdiction.  
  
The primary events on Leander VI take place before the Anphelion Project, so I might be able to weasel Solomon Lok in as well.  I just love his model but if I keep buying the models I love at this rate it's going to get ugly.
  
Thanks again for the compliment!",2015-10-05 01:32:43+00:00,cvoggui,2,t1_cvnz0ij,27862,Warhammer
176,"I'd say about an hour of staring at the model trying to make sure I accounted for all of the details and had a good way of handling them.  Followed by 4-5 hours of painting.  That's a really long time for me to work on a single model, I've finished 10 man squads in a little more than that.  I think a fair amount of time was wasted/dead time due to washes drying, as I'm usually working in assembly and by the time I come back around the first model is about ready to go...yet in this case it was more like apply the wash and stare at it waiting for it to dry.  

His visor was the worst, I tried going Gauss Green like I do for all my other soldiers in the regiment but it just had this weird flat look to it that would not go away.  I honestly think there may be about 5-6 layers of watered down paint in that small visor slit.  I finally settled on covering it with a green glaze and then ever so carefully trimmed it with nuln oil.  It's still a little dark for me now but at least it has some definition and it doesn't look like I just painted a line on his helmet.",2015-10-04 17:45:08+00:00,cvnyvxk,6,t1_cvnyn3y,351,Warhammer
177,"Haha yeah, I needed a helmet with a rebreather/gasmask component that matched his archaic looking armor.  That narrowed the choices down pretty rapidly and the Vanguard helmet is effectively a Medieval half-helmet with a rebreather attached to the bottom.  So that became the head of choice!",2015-10-04 17:19:47+00:00,cvnxvzl,4,t1_cvnwmp3,1920,Warhammer
178,Thank you very much!,2015-10-04 16:29:44+00:00,cvnvut1,2,t1_cvnvoi1,299,Warhammer
179,"It's pretty much total insanity/goofiness, I've avoid really posting it here before I'm just going to be amused deploying it on the field and don't really care if it wins or not.

That being said, basic concept 2 Combined Detachments (Scion/Guard), 1 Inquisitorial Detachment.  You lock and load the Scions and Guardsmen with a mix of Plasma and Melta weaponry, as well as an Enginseer with 2 multimeltas and his servitors for repairing...then you pile them all in a 4 Sponson Stormlord with a Hellhammer on point.   

Inquisitor Coteaz ensures the drop pods will not come a dropping on your head as he will be attached to the multimeltas or a 4 melta Scion command squad (up in the air); ""I've been expecting you"" will allow him to alpha strike the pods with meltas.

That's pretty much it, I just came up with it and started being amused at the idea of just setting two super heavies on the table with my entire army off to the side.  As the Stormlord is open topped only in relation to embark/disembark, I can jump squads out to take objects as well while maneuvering the bulk of the super heavies into protection around singular objectives.  

I know there are tons of holes in the strategy but it will be fun and with 20 firing points those melta/plasmas will unleash fury on anything that comes close while 6 combined lascannons can reach out to hit long range targets.  It will be amusing, one way or the other!",2015-10-04 16:28:09+00:00,cvnvstb,2,t1_cvnv5hn,1121,Warhammer
180,"Talk about old Guard references, I miss my egg on legs Sentinel, lost during the great purge of my families basement when I enlisted in the USAF back in 2001. ;)",2015-10-02 22:16:58+00:00,cvm6xa8,4,t1_cvm6iyc,709,Warhammer
181,"I appreciate the criticism and will do my best to explain the reasons why things are setup this way for the specific army.  The plasma color as well as wiring in my army is extremely entrenched for a specific reason and the plasma is actually three colors blended into the center with dry brushing.  While I understand that many people like the overwhelming glow effect that I've seen recently, I'm much more of a clean line painter and think that the glowing look detracts from the model itself as it has a tendency to overwhelm details that could have been painted in.  I'm sure people will disagree with that but at the point that I'm currently at the color scheme is locked in as I rely on it to keep my painting expedient.  
 
[Click Here for Previous Full Army Shot](http://i.imgur.com/yTkPGkf.png)
 
I do intend to handle plasma differently as soon as I start a second army but the Lions of Leander VI are the only army I'm working on right now.  Thanks again!",2015-10-02 22:13:34+00:00,cvm6t45,2,t1_cvl6l64,76763,Warhammer
182,Thank you so much!,2015-10-02 22:06:14+00:00,cvm6kad,2,t1_cvm4gsm,3612,Warhammer
183,"I'm going to try doing this after I complete my Armies on Parade entry which I am currently working on.  I do a lot of things that I'm sure would go against the norm since I learned to paint back in 2nd edition and paint styles have changed significantly since then.  At a recent tournament a guy pointed to my models stating it was obviously air brushed, when I stated that I don't use an air brush I'm not sure he believed me.

I may end up doing an Avenger Strike Fighter as my first painting video, no promises but I think it would be fun and everyone always seems fascinated in my vehicle camo pattern.

Thanks for the compliment!",2015-10-02 22:06:03+00:00,cvm6k28,2,t1_cvlrzkh,22476,Warhammer
184,"Ahahaha yeah, I was kinda stupefied looking for the Vox guys in the resin when I realized that they were all rocking the old headset I used doing Tech Support for the last 7 years.

Thanks for the compliment!",2015-10-02 22:03:53+00:00,cvm6hgb,2,t1_cvlwo1v,15521,Warhammer
185,"Thank you!  It's actually relatively simply.

Base: Warpolock Bronze

Dry Brush: Leadbelcher

Wash: Nuln Oil (Only 3/4ths of the way up the melta barrel)

Dry Brush: Screaming Bell back into the Nuln Oil, getting streaks as it goes but not going beyond the half barrel point.

You may need a watered down Nuln Oil pass at the end if it seems to bright red but beyond that it should look the same!

Thanks for the kind words.",2015-10-02 22:02:14+00:00,cvm6fhw,2,t1_cvlngj0,29242,Warhammer
186,"It's like you read my mind.  I'm playing with a mechanized strategy right now that includes members of the Inquisition and one of those members just showed up in my mailbox.

Thanks for the compliment!",2015-10-02 21:56:46+00:00,cvm68xd,2,t1_cvlmpak,30343,Warhammer
187,Thank you!,2015-10-02 21:55:44+00:00,cvm67pd,2,t1_cvlj4e7,40378,Warhammer
188,"Thanks!  That dusty look took a while to get down pat but it was worth the effort in the end.  The planet is pretty much a Mad Max-esque environment of hard baked desert and dead plants with a few small areas filled with poisonous plants as they (the Inquisition has no idea how) have cleansed the planet of the flesh eating portion in a Viral Bomb but in doing so expelled poisonous gas back into the atmosphere.  

That's the reasoning behind everyone being buttoned up!",2015-10-02 21:55:34+00:00,cvm67i9,2,t1_cvlg4fm,56477,Warhammer
189,"I absolutely love how he turned out so it's awesome to read that someone else took notice of him.  He was initially made to provide the Commissar for my Scion Air Cav formation, which is why he has a Scion backpack on, but now I think he's just one of my favorite character/individual models that I've done.

Thanks Again!",2015-10-02 21:53:06+00:00,cvm64hg,2,t1_cvldkso,63218,Warhammer
190,"The Hostile Environment part of the subject is due to all of the guardsmen using the [Cadian Hostile Environment Conversion Kit](http://www.forgeworld.co.uk/en-US/Cadian-Hostile-Environment-Troops-Conversion-Set), in one form or the other.  
 
This is primarily due to the fluff backing my army where I have a strict rule about all units being completely buttoned up due to the poisonous atmosphere on Leander VI.

Thanks for the compliment!",2015-10-02 21:51:44+00:00,cvm62uu,2,t1_cvl30w2,81847,Warhammer
191,"I may end up doing a heavy weapons team but the next venture will have me doing vehicles again and maybe some single characters.  I try to break up my painting so that I don't get bored because I start to slow down at that point; case and point the last half of squad two took almost a week and a half because I keep getting distracted.

Thanks!",2015-10-02 21:49:34+00:00,cvm6025,2,t1_cvl1443,85014,Warhammer
192,"I totally agree but when I post IG, I seem to get people who don't know what that means and also posting my Regiments name leaves people unsure as to the link.  So I've decided to buckle down and try to use the current standard naming for now!

Thanks for the compliment!",2015-10-02 21:47:49+00:00,cvm5xvy,2,t1_cvl6czx,75611,Warhammer
193,Thanks so much for the kind words!,2015-10-01 20:08:08+00:00,cvkw52w,2,t1_cvjdwib,101784,Warhammer
194,"Thanks!  I stumbled onto the pattern entirely accidentally when I started doing the wings of my first Valkyrie and it kind of set the Vehicle Camo for my mechanized and air cavalry after that.  I've typed it out a few time in previous posts so I'm going to copy/paste it below to save you having to go dig for it.

**Vehicles**

Base: Dryad Bark

Wash: Agrax Earthshade

Dry Brush: Gorthor Brown

Camo Technique: When dry brushing gorthor brown push down on the small dry brush to get a more distinct blotch of the color then pull it about to create the camo pattern, once you have 3-4 blotches with some room in between them use the residual paint on the dry brush to fill in the entire area.

I can't particularly explain why but the Agrax Earthshade leaves the surface much more prone to grab paint when your dry brushing which is how the weathered/faded look for the camo pattern is created.

**Vehicle Raised Armor Plates**

Base:  Eshin Grey

Wash:  Nuln Oil

Dry Brush:  Dawnstone

**Vehicle Metallic Surfaces**

Base:  Warlock Bronze

Wash:  Agrax Earthshade

Dry Brush:  Leadbelcher

**Vehicle Lights, Wiring, Accents**

Base (Wiring):  Temple Guard Blue

Small Lights:  Baharroth Blue or Gauss Blaster Green or Temple Guard Blue (I vary between these but tend to go back to Temple or Baharroth as a standard)",2015-09-29 03:52:38+00:00,cvhqn6o,2,t1_cvhf4j6,19270,Warhammer
195,Thank you very much!  My camera is relatively light so I just bring it every time I go to the store and then snap shots of the games I play.  I sometimes miss a turn because I get distracted but the flow of battle is relatively obvious at the end of the day.,2015-09-29 03:49:03+00:00,cvhqj5p,2,t1_cvhlaov,8643,Warhammer
196,"It was the best spent points on the field, hands down.  My opponent openly commented that the amount of devastation it was able to level and then rapidly maneuver to support more troops due to Vector Dancer made it his target over the Marauder Destroyer.  For 190 Points, it was monstrous and looming throughout every turn until I made the sacrificial play to try to stop Logan from getting to my Warlord.  I just wish Militarum Tempestus could utilize it directly, I've had to totally prepare an AM detachment just to field some of my units.
  
  
I feel like the MD would have done a fantastic job of handling Tyranids/Orks etc. but against a wall of terminators and 14AV Landraiders it could use Hellstrikes to remove one but after that it was just firing auto-cannons and the tail assault cannon...both of which did not have the punch to really take them out (What happened to Assault Cannons?!  I swear they used to be as scary as Lascannons back in 2nd edition or perhaps my memory is going...)
  
  
I'm currently working on a concept Army List that could end disastrously or completely catch my opponent off-guard.  I had to order another model tonight to make it work but the end result should be relatively amusing even if it doesn't work!

",2015-09-29 03:48:00+00:00,cvhqhyc,2,t1_cvhp8ym,2258,Warhammer
