,body,created,id,nest_level,parent_id,reply_delay,subreddit
0,"Mixed elements is fine as long as you're not fighting something that has alternating weaknesses/resists.  In the arena mixing them gives me versatility and that's what I'm equipped for.  Would I like Agrias' TM to use as an offhand to Moonblade?  Sure, I would, but I haven't finished it yet so that's a moot point.
  
As for calling me a whale, feel free if you want, but I only pulled 2 times for Luneth, 3 for Lightning, 4 for Ramza/Delita.  Amazon coins save you a ton of money.  The fact I have 4 fencers is a happy mistake, I didn't get Thief and in the last 5 minutes of the banner decided one more pull to get him.  I got 3 of her in that one pull, that's why their TM's all misaligned on percentage complete, I used the moogles from Maxwell to catch up the second one so I'd have two of the materia for now.
  
You'll notice no DKC or Elza, I didn't get DKC and I only pulled one time on the Brave Frontier banner.  Whales don't do that in my experience.  I pick and choose what I will go for, as it stands now my team is right where I want it so short of some nostalgia triggering character coming up I'll just be running events and farming TM's from here on out.",2016-11-20 00:26:21+00:00,da7l2t1,5,t1_da7ko0h,642,FFBraveExvius
1,"Even more amusing is his lack of an actual sword being equipped...there's a reason I went through the blood sweat and tears to finish off Moonblade.  Luneth gains 20% atk when using a sword from his passive Swordmaster.
  
Given, he's trying to make up for it with blade mastery but it shows a fundamental lack of understanding for the characters built in skills.  Had he taken Moonblade with blade mastery/Sakura he would be an even bigger nightmare.  His 2 Celestial Gloves are really the monstrous part, despite the obvious materia, as my Luneth would get relatively close to his without Blade Mastery if they were available.  
  
I still have 2 Lunge Combos, the aforementioned Brave Suit, and accessories to finish as I'm not focusing on Blade Mastery at this point.  I'd like to wait and see if that Heavy Armor/Sword materia in JP ends up stacking for us first.
  
Luneth Current Gear:  [http://imgur.com/ZtBtEQh](http://imgur.com/ZtBtEQh)
  
Luneth in Arena with Cheer/Advance Up:  [http://imgur.com/4YRVwsh](http://imgur.com/4YRVwsh)",2016-11-19 22:28:11+00:00,da7gk6v,3,t1_da7etnl,2713,FFBraveExvius
2,"I second this sentiment.  I've been known to intentionally trigger extracts as I pass them when I'm running solo just to keep it damn confusing for rogues as to whether they're running all over for an empty extract point.  You get multiple extracts flashing on the map, using concealer pulse on yourself, and no one knows where the live extract is actually going to occur.  
  
As long as your smart at that point and don't attach early or, if you've got something attached, toss a happy incendiary grenade on the rope as you depart to cover the gap before the 7 second mark...it's all gravy from there.",2016-11-06 05:31:17+00:00,d9nulca,3,t1_d9n4y87,39347,thedivision
3,"All I could think of when I read this was the TF2 Heavy Weapons Guy video.  After that I was done for and must build a set of gear to replicate this glorious hunting experience.
  
[LMG Rogue Killer](https://www.youtube.com/watch?v=jHgZh4GV9G0)",2016-11-04 22:09:39+00:00,d9m4wfy,3,t1_d9lfoeh,31096,thedivision
4,"I made this for the Brave-Exvius.com chat back during the FFT event after we all pulled so many Alma's that it felt like we were being stalked.  So I am well acquainted with the pain Alma brings to one and all...
  
[When you wish upon a star...](http://i.imgur.com/G7xwZuL.png)",2016-11-02 01:32:22+00:00,d9hqwr3,1,t3_5amxt3,2982,FFBraveExvius
5,"It's easier to get your thumb on when playing, I have the Hori grips on my 3DS XL as well and combined it makes Monster Hunter a non-hand cramping experience.  The grips alone though make the L/R camera rotation in SMIV:A a dream though, I almost never center the camera behind myself now since it's so easy to spin it when needed. :)",2016-09-24 03:14:43+00:00,d7zqr3g,4,t1_d7zh1vq,17397,Megaten
6,"So yeah, I was half asleep last night reading descriptions of different demons and hit on Dybbuk and something just clicked in my head, which resulted in a subsequent Photoshop to make Borat proud of my demon hunting skills!  ",2016-09-23 05:15:21+00:00,d7yimqy,1,t3_543804,95,Megaten
7,"I guess I'll get on board for this thread.  After getting Fencer from my 2nd 11 pull, which is just fine since that's all I was going to do, I finally decided to get off my ass and knock out the hero ring farming that I've been evading for weeks now.  This resulted in her ring slots being handled!
  
In the process I took her to max level and then geared her up so that my friends could get a feel for how she was in battles, albeit without dual wield.
  
I'm pretty damn happy about being able to provide that opportunity to my friends and I really like her as a character, so it was a double achievement for me.  My copy is definitely not even close to the best out there but she's not looking bad for someone who has only been really playing since July. (pre-signed up for Mecha Terra but Brave Frontier had my attention until recently).

Welp, here she is:  [Fencer](http://i.imgur.com/ayRkCAX.png?1)",2016-09-11 19:04:15+00:00,d7iio31,1,t3_529v4n,2505,FFBraveExvius
8,"...he needs a Snorlax buddy named Frans, so they can pump *clap* gyms up!  ",2016-08-25 17:55:42+00:00,d6wdg0p,1,t3_4zh3xy,42668,pokemongoyellow
9,"Done!  New to this game but I've been playing FF since the first one came out and Brave Frontier for quite a bit.  Currently running a Max level Vaan in lead (thank you rainbow crystal) and pushing through the story line.
  
Friend ID:  574,868,082",2016-08-11 10:04:10+00:00,d6d1p9b,1,t3_4x31c9,62708,FFBraveExvius
10,I plan on ordering them later this week actually!,2016-08-10 23:07:43+00:00,d6chz8i,2,t1_d6bojgg,40492,Warhammer
11,"I've found them fairly regularly here at Lindbergh City Center.  Along with a fair amount of other rare/desirable Pokemon.  They are not raining from the sky but with all the stops we have and the bizarre spawn of rare things (So far just at random I've run into a Tauros, Vulpix, and seen 2 Dratini) it's usually worth a few hours of bouncing around.  
  
I'll admit, short of a larger number of Pokemon Go players getting into the area, it can feel a bit sketchy late at night but I've never run into any real issues.
  
Hope that helps!",2016-08-02 02:07:56+00:00,d60hery,1,t3_4vp11j,15206,PKGOAtlanta
12,"Not a lawyer but worked for them for over 7.5 years, so I'll toss this out there and /u/reelbgpunk can safely correct me if I'm wrong.  The use of the word ""current"" strikes me as a rather vague unenforceable span of time in the signs current state.  
  
Target, for instance, is open very late and if you buy a soda there and ask for a bag/receipt it seems like you could use this as a way of proving you are a ""current patron"" of The Prado shopping center.  As they have not specified a measurable unit of time, I would argue a 24 hour/once a day window on a purchase could be argued as current.
  
Now, I know it's private property and they can do what they like, but it really feels like they've damned themselves from the get go with the wording of the signs.
  
Just a thought!",2016-08-02 01:55:03+00:00,d60gvzw,3,t1_d602owg,19887,PKGOAtlanta
13,"Haha, yeah but there were no threats involved, I did it a completely friendly tone of voice.  It's more of a polite way of saying ""don't be a douche"" and since he had never encountered me before it had the added psychological benefit of him thinking it was a coworker.
  
  
The whole ""I'm going to show up at your house"" thing is for kids who actually think that sounds like a threat.  A complete stranger narrating your life in a happy go lucky voice, before you have ever even killed him in-game...thats an itch that can't be scratched for most people.",2016-07-31 09:47:28+00:00,d5y60h6,3,t1_d5y5pid,1178,thedivision
14,"It works best when it's a streamer because they are invested in making themselves publicly visible.  It's amazing how many people have their Facebook address handle identical to their YouTube handle.  With a name, rough age, and general location you can utilize Google for a LinkedIn or Blackbookonline.info to trace their tax records...after that the rest just unfolds.  
  
  
I used to track down people for the lawfirms I worked for and was amazed at how easy it was, at least for US Citizens.",2016-07-30 21:05:41+00:00,d5xkml1,3,t1_d5x6f4q,23867,thedivision
15,"Played cat and mouse with a full group of Rogues to two of us a while ago, group member recognized one of the Rogues names and mentioned he was a douche...so I social engineered him and tracked down his apartment, job, etc before they caught up with us on a supply drop.  There's nothing quite like a random you've never seen before who begins calling you by your first name, mentioning your job, and the Ocean View from your apartment...in proximity chat.  
  
So much confusion and when his teammates downed me he was still demanding answers but I was lost to the magic of server transfer.  I can only imagine he went to work convinced it was a coworker the next day.  Best proximity chat use as a psychological weapon I have ever used, people just don't expect to hear their name as they show up red and ready to drop an outnumbered team.",2016-07-29 23:39:25+00:00,d5wkpzs,1,t3_4v6atm,40641,thedivision
16,Jump magic jump!,2016-07-28 20:05:59+00:00,d5uwxzs,2,t1_d5uvmmd,1617,pokemongoyellow
17,"Pretty sure on heroic the shotgunners will be equipped with AA12's loaded with the ever so magnificent [RPG rounds](http://i.imgur.com/RtE5BR3.jpg).  
  
This will ensure that when a shotgun wielding maniac drops into the pit he can wipe out the entire opposite corner with a single shot, sans the poor bastard wearing 100% exotic who gets to have his face checked in by an LMB exclusive titanium sheathed stock.",2016-06-28 09:40:46+00:00,d4r0ldt,3,t1_d4qyohn,6964,thedivision
18,"I had the thought that allowing a talent slot on weapons to mark it as XYZ specific set while active would allow for some interesting character customization...but the amount of balance issues that might introduce could potentially outweigh any benefits.

Still, I think that it would be a fun progression avenue to explore without rehashing tons of new sets to fill up stash space.",2016-06-14 16:10:32+00:00,d48w64n,1,t3_4o0l4n,24776,thedivision
19,"Thank you for the kind words and GGG for putting up with me for so long making it.  There were three other unique ideas that got turned down before Daresso's Defiance and I actually waited a good 3-4 months before proposing a retaliation based chest because I wanted to get a feel for how the game was on release, since it was in beta before.
  
My other favorite idea was ""A Brace of Wands"" a single item that took up both weapon slots and had two complimenting wand stats that would build build up damage as they stacked on each alternating hit.  I even designed a rendered mock up for it based on a flintlock pistol merged with a wand, basically bringing the idea of a wandslinger to an exaggerated level.  
  
[Mock Up of one of the wands](http://i.imgur.com/dhy93ph.png)
  
Release swallowed that one whole as it fell by the wayside and Daresso's Defiance was initially on Exquisite Leather and looked much different than what it looks like today.  I always wanted to buy another unique, when they had it in the microtransactions, to try and resurrect the wandslinger idea but it just never made it into the budget.
  
Thanks again for the kind words and thank you GGG for an awesome experience.",2016-05-28 01:33:09+00:00,d3mi98w,5,t1_d3m1u9n,26116,pathofexile
20,"Ripley's Believe it or Not, I've never run the chest on a ranged build.  It originally went on a build that was how I envisioned Daresso would fight (sword board) and has since been used on a 2h sword build as well.  I burnt myself out on ranged in beta after all the wipes and rerolls, I just couldn't do another one.  Glad you're enjoying it!
",2016-05-28 01:25:32+00:00,d3mhzum,5,t1_d3m1f06,26259,pathofexile
21,"Flattery will get you everywhere!  I really can't tell you how awesome it is reading all these posts, please do throw Erik love for giving me access to making one of Daresso's uniques and Rory for spending a year in the trenches on the test server as we hammered out failed ideas until coming to the final one.  He's a damn super hero.",2016-05-28 01:23:05+00:00,d3mhwzb,3,t1_d3maa05,13291,pathofexile
22,Hell yeah!  It should help you through the level grind and provide you with a solid defensive/offensive platform to build around.  Glad to hear you're looking into getting one.,2016-05-28 01:21:31+00:00,d3mhv1y,3,t1_d3m0a1z,27561,pathofexile
23,"You absolutely can because, despite later serving in the USAF, that would be exactly where I got that handle.  Audemus came with the creation of Daresso's Defiance actually as it means ""We Dare"" in Latin, playing off Daresso the Daring.",2016-05-28 01:20:06+00:00,d3mhtcl,3,t1_d3m66d2,19218,pathofexile
24,"It was all me, I wanted it to really strike home the idea of an opponent beating you down and then getting sloppy and/or becoming so predictable that raw savagery could turn the fight around.  That was the whole reason for the endurance charges/onslaught, a way to measure retaliation and provide mitigation to a solid hit that could be turned into an offensive strike in your favor.  
  
Thanks for the compliment!",2016-05-28 01:19:04+00:00,d3mhs61,3,t1_d3m8rl3,15385,pathofexile
25,"I had no idea about this but that's bizarre, even after so many new items that it could still not only be relevant but potentially the center piece of a powerful meta is cool as hell.  Hopefully it won't get nerfed since I still use my perfect rolled 6L one when I do get on and play, all of my builds are built around it so it's a bit terrifying to think it could suddenly get changed.  /fingerscrossed",2016-05-28 01:16:35+00:00,d3mhp80,5,t1_d3lzthp,27887,pathofexile
26,"&gt; Sweet unique, love the look and the mechanics. The flavour text is one of the best in the game.

Thank you!  I actually wrote that in one sitting and sent it to them with the warning from Rory that main character related items have strict flavor text rules.  When it came back with no changes, Rory was really shocked and I just stepped back from it to ensure it made it through the process.  I'm really glad you enjoyed it!
",2016-05-28 01:10:02+00:00,d3mhh15,5,t1_d3mgr6r,1309,pathofexile
27,"I can't tell you how rewarding it is to know people are still using it as I'm no longer really actively playing Path of Exile.  I try to run a search for it every once in a while to answer questions but people understand the item now and it's not needed really; my item is all grown up!
  
Thanks for the kind words.",2016-05-27 16:19:42+00:00,d3lwlqu,3,t1_d3lw4yk,629,pathofexile
28,Thank you.  I always get a chuckle out of the dodge on the item being brought up when people discuss it because that was just a bonus stat that Rory put on it right before release for flavor; I was under the impression we had as much on it as was going to be possible but he proved me wrong!,2016-05-27 16:17:35+00:00,d3lwibc,3,t1_d3lvv1u,873,pathofexile
29,"Any company who can put up with my back and forth banter for over a year to design a single item for their game is amazing in my book.  
  
[Daresso's Defiance](http://pathofexile.gamepedia.com/Daresso's_Defiance) took almost 1.5 years in total from when my first email arrived from Erik to Rory sending me a screenshot of the finalized item.  They will always have my utmost respect for the professionalism and tolerance during that time.  I was trying to design an item that would not be all powerful but would allow for many people to use it, despite the inevitable power creep of items over time in games like this, and really enjoy using it.
  
I'd like to think I succeeded but credit should go to Rory and Erik for understanding my goal and helping me achieve it.  Thanks guys.
  
-Fiveby5",2016-05-27 15:32:29+00:00,d3lui3t,1,t3_4la6ml,17340,pathofexile
30,"[GS 204 MP5 ST](http://i.imgur.com/HqiNqrq.jpg)

Manage to pick up a GS 204 mp5 ST last night and luckily paid attention to it before it was scrapped.  It handily beats my 204 tactical vector 45 acp and with a clip size of 63 rounds...well it's nice to not hear ""click click"" right as a guy is at no life and trying to run into cover.

My mods aren't the best on it as I primarily use an assault rifle but I find myself using it more and more now, it feels way more reliable in a firefight.  

Please forgive the purple muzzle break, I've had horrendous luck rolling a replacement (like 15 rolls without crit damage).",2016-05-25 22:42:17+00:00,d3jpank,1,t3_4kua3z,112933,thedivision
31,"Just a fun photoshop I put together today while grinding out FH ranks, thought it would be interesting to show Atro in a non-bright/colorful light and facing unknown danger.",2016-04-19 00:45:18+00:00,d289jyj,1,t3_4fezeu,685,bravefrontier
32,Orwen would get my vote!,2016-04-02 17:05:45+00:00,d1n4k0t,1,t3_4d2091,4427,bravefrontier
33,"I noted it above but I have a feeling his new art direction has something to do with the ""What If"" behind his Omni Evolution.  If he did not run from the main gate due to being concerned about the Emperor (at which point disappearing) he may have become the very person he sought to protect.  
  
His Extra Skill is entitled ""Successor's Right"" after all and that would see him taking up the position of a General or Commander.  With that in mind the Omni Evolution look appears to fit that role rather nicely.",2016-04-02 16:55:24+00:00,d1n46dx,3,t1_d1mi7vc,57048,bravefrontier
34,"...Orwen may or may not be maxed out with spheres applied in my inventory, just waiting for the day of his return per his history.  He's a really cool character fluff-wise, even if I wasn't playing when he was released!",2016-04-02 16:50:46+00:00,d1n40ef,2,t1_d1mok67,44508,bravefrontier
35,"Yeah, it's actually not bad but I can see how the sudden change from the brash warrior to that of a general  would bother people.  Personally, I just see it representing how Sirius matured as an individual.
  
This could hold especially true if his Omni represents what would have happened if he did not run away from his position at the Main Gate.",2016-04-02 16:48:38+00:00,d1n3xos,2,t1_d1mwyvg,14449,bravefrontier
36,I'm actually going to work on this if I get a chance.  It's rather difficult given the low-res nature of the image we received but I'll see if I can't make it match the white/silver of his 7 Star armor!,2016-04-02 16:47:12+00:00,d1n3vvc,3,t1_d1m9cuc,71498,bravefrontier
37,"I see your Helmetless Sodis and raise you!

[7 Star Sodis - DOING IT!](http://i.imgur.com/drEw1A5.png)

..and yes I'm aware it's am atrociously bad shop but I can't be a perfectionist all the time!",2016-04-01 20:07:55+00:00,d1m7c0y,1,t3_4cxi8b,2859,bravefrontier
38,You have solidified my decision to level the Breaker version of her that I got so that it can pair up with my current Guardian.  Now to figure out how to give her an unstoppable death ray...,2016-04-01 19:39:53+00:00,d1m640z,1,t3_4cxdp7,2402,bravefrontier
39,"I couldn't stand the yellow washed out photograph they provided so I have attempted to pull the colors out using his 7 star artwork to help provide bases for the color.  It's definitely not perfect, working in anime art is not my strong point, but the Omni form definitely does not look as bad (at least to me) as it initially did.

Hope you guys like it!

Edit: Tagged Fan Art but to be clear the original artwork is not mine, I just re-colored it to allow for the details in the design to stand out.",2016-04-01 19:36:55+00:00,d1m5za7,1,t3_4cxlrq,10,bravefrontier
40,"Oh I understood all of that, I take pictures of my painting work all the time and my backdrop is grey for that very reason!  The issue is I have two rambunctious cats and I hesitate to leave the sword disassembled in a location that they can get to, as I block off the front of the photo tent and they do not mess with it.  
  
I was able to get much better pictures of the Tsuka for you to look at in case you're curious.  Also this isn't my standard medium for photography but the new pics below came out better hopefully.  I've added them into the original album or you can click here!
  
[Tsuka 1](http://i.imgur.com/hfIH3lB.jpg)
  
[Tsuka 2](http://i.imgur.com/aP0s369.jpg)
  
[Tsuka - Close Ups](http://i.imgur.com/6S1KCLx.jpg)",2016-03-23 04:38:51+00:00,d1a4bcy,4,t1_d1a3ni8,1228,SWORDS
41,"Alright, I got a clear picture of the kozuka and I've kept it in 350 resolution to ensure you can zoom in on it.  Looking forward to any information that can be provided!

[Kozuka](http://i.imgur.com/rm0GczL.jpg)",2016-03-23 04:14:34+00:00,d1a3iv5,2,t1_d19z2n3,7507,SWORDS
42,"Thank you very much for the information /u/gabedamien!  I'll get a different temperature light bulb into the tent and see if that works better.  It's a big tent but the Katana is is so long that I'm really pushing it trying to get shots inside and I can't use the tripod I normally do.  I just found out about kozuka in the sheath and it does have an inscription on it.  I'll be posting it in the replies to /u/wotan_weevil as he pointed it out.
  
Thanks again!",2016-03-23 04:13:24+00:00,d1a3hg3,2,t1_d1a31fx,773,SWORDS
43,"There does look to be some nicks but they start around the middle and there's maybe 3 to 4 total, though I can't tell if it's an actual nick or just something on the edge.  I didn't want to rub it down or anything because I know there's a proper way of doing things and I was having to research just the disassemble process as it is!
  
The odd thing about the nicks is that it hasn't been pulled out of it's Saya more than a handful of times since it was originally purchased and that was done with great care.  It certainly hasn't been swung at anything or tapped into a hard object.  They may have already been there when it was purchased but upon asking my Father about it he had little to no light to shine on that so I guess it's a mystery.
  
I just measured it for you and the blade is 27.5 inches from the tip to the bottom of the Habaki.  The tang itself is roughly 5.75 inches, I say roughly because I was hovering the tape measure over the tang and didn't want to let it clack against it but that looked accurate.
  
Edit:  I'll be damned, I didn't know about the little knife and I called my Father to find out it had never been pointed out to him either.  It is engraved with Japanese characters on the blade.  Working on getting some pictures now.",2016-03-23 03:59:04+00:00,d1a2ziz,2,t1_d19z2n3,6577,SWORDS
44,"The Hamon is actually really visible in person, I'm taking the camera shot under 3 5500K lights in a photo tent that I use for my models since it's the best place I could put it where the cats wouldn't try to investigate.  When you put that much white light on a reflective metal it has a tendency to wash out anything on it.
  
I'll see if I can't get a picture of it in normal lighting that doesn't come out all yellow due to the apartment lights.  Thanks for the input!",2016-03-23 03:51:23+00:00,d1a2po0,2,t1_d1a0b6c,4194,SWORDS
45,"I will do that in just a moment once I add the new information &amp; pictures, that I got for Sugiyama, into the initial Album.  Thanks for the input SquiffSquiff!",2016-03-22 23:36:54+00:00,d19t3kb,2,t1_d19m44p,10226,Katanas
46,"I have followed your instructions and after doing some serious homework reading up on the process I was able to successfully disassemble the blade with ease and I must admit I am so thankful you mentioned gloves as I went and bought some felt finger/palmed work gloves.  I had not touched the blade regardless but I wanted to be careful.  I'm also able to remove the gloves without ever touching the felt side of the palm so they should be safe and the cushioning in the palm/fingers allows me to safely handle the sword - though I still won't touch the edge!

 &amp;nbsp;

I'll never forget my Dad demonstrating that it was not a toy when he first got it almost 30 years ago now and he barely lowered the sword on a piece of paper, edge side, and it passed right through it like butter.  It was seriously unlike anything I've ever seen, the paper didn't even resist beyond the initial contact where the edge tried to bend...then it might as well have not been there.  That's all I needed to see and I've respected the edge of every knife, weapon or not, since then.

 &amp;nbsp;

So here we go, I found some pretty interesting (I think?) things and was able to find a marking on the sword; although it was hidden from sight and not on the Tang.  I took shots of absolutely everything I could think of to make sure that we had as much information as possible and I have not re-assembled it in case you have further requests before I put it back together.

 &amp;nbsp;

[Katana - Unknown History - Disassembled](http://imgur.com/a/pzgUV)",2016-03-22 23:33:39+00:00,d19sysr,2,t1_d191nj4,39003,Katanas
47,"Haha the lack of clothes was the entire point!  Trust me, explaining why I'm staring intently at little naked men to my gf was a hilarious conversation.
  
Her: ""Why are they naked?""
    
- Attempts Fluff based explanation and receives blank stare -
  
""They're wearing the Emperor's new armour."" 
  
- deadpan delivery and immediately back to painting to escape further explanation! -",2016-03-18 03:30:58+00:00,d144ua3,2,t1_d137nqe,49997,Warhammer
48,Thank you very much!,2016-03-18 03:27:52+00:00,d144qta,2,t1_d1334wr,62376,Warhammer
