,body,created,id,nest_level,parent_id,reply_delay,subreddit
97,"Wow, that's some seriously high praise!  Thank you very much, seriously it's comments like this that keep me painting as I don't play near enough games to justify the time input. :)",2016-01-14 18:23:20+00:00,cyy699c,2,t1_cyxqp1i,32444,Warhammer
98,"The Power Is Yours - CAPTAIN PLAN...wait, that's not right...speaking of, is Volkite technically an element based weapon?  My guess is that once CHOOMED the Captain pops like a rotten grape just like everyone else.  Yet I digress...

Okay done being silly but damn is that awesome, thank you so much! 

",2016-01-14 09:01:20+00:00,cyxqddc,6,t1_cyxq9wp,378,Warhammer
99,"That's freaking awesome!  

Dramatic:  Born from Ash, Rusted with Blood
Eccentric:  Enlist Today! CHOOM Tomorrow!
Title:  Lord Marshal of the Rust Scorpions

I'm leaning toward the dramatic one, what's your opinion?

I cannot decide!",2016-01-14 08:49:14+00:00,cyxq6mn,4,t1_cyxpu75,1283,Warhammer
100,Thank you for the awesome compliment!,2016-01-14 08:24:35+00:00,cyxps95,2,t1_cyxpqf3,182,Warhammer
101,"This post feels like a trap since the last time I posted in here I got all sorts of flak and that was just one character.  The following screenshot is from 7 months ago, I've added some new 7*'s but I'm not actively playing everyday at this point.  
  
[Click for Screenshot](http://i.imgur.com/muUX4Ik.png)",2016-01-04 14:36:50+00:00,cylixy2,1,t3_3zen2a,6642,FFRecordKeeper
102,"I've never used it but my understanding is it's down right devastating due to the 18"" Torrent on it and the low cost upgrade to the Chem Inferno Gun if desired.  Also the template used at the end of that 18 inch torrent is the [Hellstorm Template](http://www.games-workshop.com/en-GB/Apocalypse-Hellstorm-Template), which makes the range of the tank deceptively long and you can pivot that template as desired...or at least that's how it's been described to me.  
  
I may have to get one eventually to handle large swarm armies but as I just put in an order for my Stormhammer last night, it's going to be a bit before I get around to the Infernus!",2015-12-26 16:58:59+00:00,cybw8d1,4,t1_cybt3q4,7920,Warhammer
103,"Thanks!  I like to do a little weathering on mine but I prefer the tanks to look like they've been through battles but at the same time that their crews are taking care of them.  
  
To much dirt/weathering being applied, while awesome in a diorama situation, is not really my cup of tea.  Yet I try to make the tanks still show their age and combat-worn outward appearance; this is one of the main reasons that every bit of steel on my models is based with Warlock Bronze, washed with Agrax Earthshade, and then dry brushed with Leadbelcher.  I find that it gives it a natural ""used"" look without having to dump a ton of Nuln Oil on it.",2015-12-25 05:07:28+00:00,cyapx68,2,t1_cyaii0l,17911,Warhammer
104,"&gt; Really have nothing to comment other than great work. Youve got the painting game covered :)

Thank you!  I'm still struggling on the table side of things as my brain has been struggling to get out of 2nd edition mode and it seems like there are always additional side rules that break from my understanding of the game.
  
For instance opening turn of a game against Tau, my Dracosan with Flare shields and 5 HP carrying 20 Veletaris was one shot destroyed by a Tau tank without there being a single thing I could do about it.  I'm starting to think I may have to buy codexes for all the forces just so I can make sure that I've read and understand each one implicitly.",2015-12-25 05:03:48+00:00,cyaptn9,2,t1_cyagvk6,21330,Warhammer
105,"Awesome, glad you liked them!  This army has been the most fun to paint, hands down, since I started painting again in April.  Hell, I don't think I've ever been this happy with a paint scheme as it just seems to adapt itself to any model I apply it to.  The bizarre thing is how the color of the paint scheme shifts under different lighting, they go from being shades of blue to shades of light grey/white.  Not sure what causes it, especially the deep blues that come out in low lighting but it's really a cool effect nonetheless.
  
For example, here is them on one of my local GW stores table and you can see how much more urban camo colored they appear: [Click Here](http://i.imgur.com/NpzOwdg.png)",2015-12-25 05:00:54+00:00,cyapqzb,2,t1_cyaemng,25854,Warhammer
106,"Thanks!  It's certainly not done yet but it's now reaching the point of functional.  
  
Now the big question is do I pursue a super heavy tank (Stormhammer/Stormsword etc) or do I make the attempt to put in an allied contingent of Questoris Knights with an Atrapos and Styrix.  The Knight route sounds fun but I'm hesitant due to the sheer lump sum investments it will require.  Of course one does not exclude the other, if we enter into the realm of insane point values, it's just the purchase of two Questoris Knights to even put them on the table that is making me balk.",2015-12-25 04:53:32+00:00,cyapju1,2,t1_cyadlyf,27485,Warhammer
107,Thank you very much!,2015-12-25 04:49:21+00:00,cyapfxw,2,t1_cyaan8g,33098,Warhammer
108,"Thanks!  I've been debating getting an Infernus as well but I just don't care for the look of it, despite how effective it is on the table.  I just can't shake this mental image of a Stormhammer flanked by two Malcador Annihilators throwing out a veritable fusillade of lascannon and cannon fire.  Not exactly practical but it would be fun!",2015-12-25 04:49:09+00:00,cyapfqp,2,t1_cya4lpt,44239,Warhammer
109,Thanks!,2015-12-13 07:52:12+00:00,cxxbj07,2,t1_cxwg45c,63068,Warhammer
110,"I might try brightening it a bit but it's supposed to look liked dried blood and rust, which is why it has such a red leather look.  The neat thing about the cloak is it doesn't have an ounce of red paint on it!  I based it with Rhinox Hide, washed it Nuln Oil, dry brushed Doombull Brown onto it and then hit it with Bloodletter glaze until it got that dark red.  After that I went back with Nuln Oil and put it in the creases of the cape to make sure they provided that moving cloth look.  So to make a brighter red I can just add another layer of glaze to it and it should stand out more but as a whole the 1905th isn't exactly the bright color group.  
  
Their entire Cohort, the Ash Scorpions, died almost to a man on Port Maw and the remaining men who founded the Rust Scorpions only survived because they were grievously wounded and put on a commandeered supply ship for immediate medical evac.  So the muted tones are the echoes of the Ash Scorpion colors, while the dark reds and the visors are all plays off different colors of rust...or at least that's what I tell myself!",2015-12-11 22:07:39+00:00,cxvtv1x,2,t1_cxvkhup,13891,Warhammer
111,"You know what makes it even worse?  The fact that I have been working at starting my own company since February and haven't had a normal paycheck since then.  After finishing my 40k force, as I was ordering my first Solar Auxilia order, all I could think was ""Just when I thought I was out...they pull me back in.""  Haha",2015-12-11 22:02:23+00:00,cxvto69,2,t1_cxvgl0f,19310,Warhammer
112,"Thanks, I'm about to start by second Incinerator later this evening and hearing all the kind words just amps me up to paint more.  I swear I would have stalled out a while ago if it wasn't for my desire to post these up on the reddit and other forums to read feedback!",2015-12-11 22:00:18+00:00,cxvtljj,2,t1_cxvcj30,25849,Warhammer
113,"Thanks!  I really can't wait to get them on the table so I can do a battle report, though I'm pretty sure learning the army in practice and not in the book will take some getting used to.  I actually came up with a ""Scorpion Formation"" strategy that I'm pretty excited about using, assuming the table wants to play nice and line things up for me.  I still need a few more things to make it functional though (2 Dracosans, 1 Incinerator, 1 Annihilator).  I came up to it when I was posed the question how I was going to safely disembark from the Dracosans as they can only be exited Left/Right.  It was only after coming up with the entire strategy that I realized it looked like a scorpion, which just made things all the better.
  
Here is the strategy and keep in mind Dracosans are 13AV/5HP with even more additional add-ons to toughen them up and shrug off melta weapons.
  
[Click Here](http://i.imgur.com/agk90Mx.png)
  
Basically the Dracosans move up and form into a jagged line, overlapping their fields of fire (1 will have to be a twin-linked lascannon, 3 demolisher cannons).  Troops disembark and move into adjacent cover/buildings etc. to hold the flanks.  Meanwhile the Malcador Annihilator provides suppressing anti-armor fire from behind the Dracosans.  
  
Next turn the Dracosans pull forward and straighten up to create a wall of 13AV/5HP in front of all movement but they leave a gap in between them, which the 3 Leman Russ Incinerators sporting Volkite Demi Culverins and Lascannons roll through like the stinger on the end of the scorpions tail.  This same turn, assuming I roll in the reserve, 3 Leman Russ Annihilators with Outflank come in behind enemy heavy vehicles and begin hammering them on the weakest point of their armor.  All the while the Incinerators are thrashing squads and are supported by Veletaris fire from cover.
  
That's the basic gist of of it at least!",2015-12-11 21:58:49+00:00,cxvtjk6,2,t1_cxv9k3z,32658,Warhammer
114,"I actually did that, I felt like the Red Scorpion decals would be interesting and was trying to think of a Lore way to hint at the descendants of the Rust Scorpions being made into that Chapter.  The only issue if their scorpion and the Ash Scorpions (905th) are pretty drastically different.  Most of the gear on the Rust Scorpions was designed to represent modified Ash Scorpion equipment, as they were entirely reliant on that supply ship for some time while they were in isolation, so changing the entire shape of the Scorpion doesn't sit well with me...despite it being incredibly convenient.  I also saw the Scorpion on the Freelancer Knight transfer sheet as well but it was once again different in design.

[Example](http://i.imgur.com/3a6rhkZ.png)
Left is the Rust Scorpions, Middle is the Ash Scorpions, Right is the Red Scorpions.",2015-12-11 21:49:07+00:00,cxvt6cp,2,t1_cxv9ecu,32576,Warhammer
115,Thank you!!!!!!!!,2015-12-11 21:32:56+00:00,cxvsjv7,2,t1_cxv4tz2,49748,Warhammer
116,"I'm looking into this today, as I believe the Questoris Knights dropped with Lord Marshal MaSade at one point but I'm not sure if I can get away with making them a single Knight as the House has a specific force structure.  There is simply never enough CHOOM! and it would be nice to have a Knight to use.  
  
I will say this though, things are getting pretty expensive at this point and I don't know that I can justify a Knight over a Stormhammer (which, while not a Volkite equipped vehicle, would be a damn shame not to get as it is SA specific); I'm also aesthetically vain enough that I feel the need to buy a second Stormhammer just to ensure it is painted up in Rust Scorpion colors.  I will see though and thank you for pointing it out, as I had not seen a Volkite equipped Knight last time I looked!",2015-12-11 21:32:36+00:00,cxvsjfg,2,t1_cxv4aes,51520,Warhammer
117,"Thank you for the compliment!  I try to let the fluff that I write drive the painting style while I'm initially coming up with it.  In this case the Rust Scorpions are actually the remnants of the Ash Scorpions who were wounded early on in the battle for Port Maw, which is described in the Forge World book HH: Conquest.  Their coloring is due to the fact their initial equipment was retrieved from the cargo ship they had been placed in, which was carrying replacement equipment for the 905th Ash Scorpions, and the ""Rust"" portion of their name was one of those barracks jokes that takes on a life of its own and eventually works its way into a units history.  In the case of the 1905th, one of the soldiers grimly joked that with all of the dried blood caked onto their armor they should be called the ""Rust Scorpions"" now...and it just stuck when they were reformed.
  
The background behind the 1905th is summed up in a communique that I've written, albeit I have not had a chance to revise a few spelling/grammar errors into the final format, but it's absolutely readable.  If you're curious, [Click Here](http://i.imgur.com/SofNVp0.png)!",2015-12-11 19:55:21+00:00,cxvon1z,2,t1_cxv7w8a,31434,Warhammer
118,"Thank you!  I use the same technique from my 40k Air Cavalry army to do the camo pattern and unfortunately it does not seem to translate into written instructions.
  
It breaks down into a fairly simple process that I discovered by accident on the first Valkyrie that I painted, color choice takes some work though and is not always obvious.  You base the model in a dark but muted version of the underlying color then you use either Agrax Earthshade for brown/earth tones or Nuln Oil for darker shades.  
  
The next step is determining the color for the brighter splotches and shading, which sounds easier (at least to me) than it actually is.  Luckily the camo scheme is relatively forgiving in that they blend into close to the same color and it's almost impossible to visually tell the difference.  My tanks in the army shot actually have 3 attempts at finding the right colors but they manage to look just about the same.

My final choice was a base of Skavenblight Dinge, Nuln Oil liberally over all Skavenblight panels, then dry brushing Celestra Grey in heavier splotches followed by a light dry brush that pulls the grey over the intervening Skavenblight Dinge.  That's how I create the weathered look, using the wash to darken the underlying color so that the splotches can create more contrast but still maintaining the darker color even with the light Celestra Grey dry brush in between.
    
For my 40k Army, I used Dryad Bark as a base, Agrax Earthshade as the wash, and Gorthor Brown as the splotch/shading color.  I think I'm going to have to make a video of the technique eventually because it's really a bizarre/cool effect, since the wash causes the surface to grab the light dry brush and prevents it from becoming close to the shade of the splotches.
  
I will say this though, prepare to murder small dry brushes in the process.  It won't matter how clean you keep them either, you're going to kill 1-2 per large model or 2-3 smaller vehicles because the splotches require pressure that pushes paint into the ferrule due to the way you have to use the brush.  I think I'm on brush number 18 at this point and I really need to go buy some more from the store.  Hope that helps!
",2015-12-11 19:48:34+00:00,cxvod26,2,t1_cxv0r1n,53938,Warhammer
119,"Thank you very much for the kind words!  I really enjoy commenting on the models and paint schemes when I post things up as it forces me to reflect on why I made specific choices.  It also helps grind specific paint color schemes into my thick head so I don't forget them the next time I do a model!
  
  
It may be a bit until I post something again as I am working on a Leman Russ Incinerator now and after posting two Valkyries at separate intervals a while back, I decided that I'd try to avoid posting duplicates of things already seen.  The one exception to that will me the Auxilia Tactical Command Section as it has been something akin to painting 6 characters for one squad.  I'm down to the two bodyguards, who have unique models, and then I'll post them up despite the Lord Marshal and Strategos being posted previously.  That squad has taken forever!",2015-12-08 22:30:37+00:00,cxs3jba,2,t1_cxrkp9k,25436,Warhammer
120,Thank you!,2015-12-08 13:47:21+00:00,cxrhm3v,2,t1_cxrdv0t,12829,Warhammer
121,"Thanks for following my work!  I've been a fan of the Solar Auxilia since I laid eyes on them but I stayed away from the models until I had my painting legs back.  Now that I've knocked out around 4k points of Imperial Guard, 2.5k of Skitarii, it felt like time to start building the force I actually wanted to paint from the start.  
  
I'll admit I do take more time painting these guys at a slower rate as I want the consistency of the scheme to come through when I end up taking the army picture later on.  So far I'm really happy with the results!",2015-12-08 13:46:36+00:00,cxrhlfj,2,t1_cxrbtni,20781,Warhammer
122,"Yeah they definitely do.  I think it has to do with the sheer amount of highly detailed components on the models; painting bright colors beyond accents just overwhelms the model and detracts from the final paint job.  I'm sure there are exceptions but I am partial to working with muted color schemes.
  
Thanks for the compliment!",2015-12-08 13:43:23+00:00,cxrhii5,2,t1_cxqvesz,50684,Warhammer
123,"Thanks!  The Strategos basically leads the Tactical Command squad while the Lord Marshal goes prowling about looking for fights he is surprisingly well equipped to win.  

&amp;nbsp;

He has an ability, mentioned in another post above, to grant +1 BS to a nearby vehicle which can't be applied to Super Heavies...but Malcadors aren't Super Heavies for the Solar Auxilia, so I'm sure you can see where I'm going with that.  

&amp;nbsp;

On top of that he can also call in a monstrous orbital strike with unlimited range which can also draw line of sight from any squad with a Nuncio Vox in it...so he doesn't even have to draw line of sight himself.  Which is handy given his need to stand near the big angry Malcador tank, I don't even have to get him out in the open to drop the barrage on someone!  It's only a one time thing per game but it's certainly will not be shrugged off by your opponent.

&amp;nbsp;

I'm pretty excited about getting these guys on a table, I've been slowed up by the shipping speed from Forge World more than anything.  I'm a bit concerned that the third Dracosan, which I've been putting off, may be more necessary than I initially thought.  Yet even if I order it right now, which I can't unfortunately, it wouldn't be here until the first week of December most likely.  So I may have to run my current Dracosans with twin-linked lascannons instead of demolishers in order to have enough open seats to fit the assault force.

&amp;nbsp;

Once the second Incinerator is painted and the second Annihilator is done, I'm going to take a run at a game regardless.  The Malcador will get ordered sometime around Christmas is my guess and that will be followed by a Thunderbolt to provide anti-air support in the long run.

&amp;nbsp;

I think I've spent more time planning the 1905th than I have painting it at this point!
",2015-11-22 01:11:17+00:00,cx8jv3k,2,t1_cx8cu86,12758,Warhammer
124,"Sure, I'm going to copy/paste what I put earlier as I'm about to run out the door!
 
 &amp;nbsp; 
  
CHOOM! The theoretical and subsequently amusing joke about the sound that Volkite weaponry makes when fired...as the description in the Horus Heresy rulebooks make it sound very close to a Martian Death Ray from old movies.
  
 &amp;nbsp; 
  
In relation to the 1905th Rust Scorpions, I've developed a force that relies on Volkite weaponry for almost 75% of its firepower. I'd say that makes promoting the weapon being used on the recruitment poster entirely justified. That and it's fun, which is really all that matters!
  
 &amp;nbsp; 
  
More on CHOOM! and Volkite Weaponry can be found here on Bolter &amp; Chainsword:  [Click Here](http://www.bolterandchainsword.com/topic/308805-martian-death-ray-club/)
",2015-11-21 18:16:18+00:00,cx85thu,2,t1_cx85lrt,366,Warhammer
125,"Thank you!  As to the Malcador question, I find it important to note that the Leman Russ Choo...Incinerators receive a +1 BS as long as they are firing on the same target.  This is key because they can run in a 3 tank assault squadron bringing all of their Volkite Demi Culverins to bear on a target and unleashing the Heavy (5) fury on them.  As they are already getting their BS buffed by the squadron skill, I will be giving the Malcador Annihilator the Strategos buff as it will nicely compliment the twin linked primary guns as well.

Of course if Forge World ever sees my photoshop dream of a Malcador chasis sporting a primary cannon consisting of four connected Volkite Demi Culverins for a Heavy (20)...""Unleash the Fury Mitch!""...explosion of CHOOM!, well I think we all know where the Strategos will be putting his buff then.
  
&amp;nbsp;
  
[Personal Concept Art: The Malcador Choominator](http://i.imgur.com/cfLj1HK.png)
  
&amp;nbsp;
  
I always do extra things like the poster in the hope that people will get a kick out of them.  I've also complete two Imperial Communiques; one, which explains the entire background behind the Rust Scorpions, and a second one that hints at possible issues with Lord Marshal Marcalius Audacter potentially being influenced by an artifact (ala` Fulgrim, to a much lesser extent).  
  
&amp;nbsp;
  
I honestly doubt I could even say how deep the influence runs until I write an after battle report from the Strategos' point of view; I usually sit around and bounce ideas about then just go with it when I'm writing.
  
&amp;nbsp;
  
In fact...here:
  
&amp;nbsp;
  
Quick Background: The Ash Scorpions are the 905th Solar Auxilia Cohort designed and written into lore by Forge World.  They fought a brutal battle across a giant Death Star-like space station to destroy the Rebel/Horus aligned Adeptus Mechanicus overseers signal jammer that was blocking all Imperium Fleet communications.  Only one squad Prime was left standing at the very end, his name is still unknown, and he managed to plunge his sword into the signal jammer, killing himself and shorting out the device.
    
&amp;nbsp;
  
Which should have been the end of the Ash Scorpions extremely decorated history...except the early wounded had been loaded onto a re-supply ship for the Cohort to be evacuated for medical attention.  The rest is explained in Lord Marshal Marcalius Audacter's communique below!
  
&amp;nbsp;
  
[Communique Describing the Origin and Founding of the 1905th Rust Scorpions](http://i.imgur.com/SofNVp0.png)
  
&amp;nbsp;
  
[Communique from a Prime (Sgt) to the Strategos Regarding the Lord Marshal](http://i.imgur.com/RJNFouA.png)
  
&amp;nbsp;
  
**Disclaimer:**
    
I will warn you that both of these were designed and written at 4-5 AM and as such I cannot be held responsible for any terrifyingly bad wording or spelling errors.  I'm almost positive my sleep addled mine substituted the wrong word a few times; despite being an English/History Major, when I'm zoned out writing I still slip up from time to time!",2015-11-21 17:15:33+00:00,cx83rtn,2,t1_cx7rxpa,37732,Warhammer
126,"Thanks!  I agree about the base, I actually ordered special bases for the Tactical Command squad but he simply has to much going on to fit on any of them; the typewriter specifically has a rather large footprint on the base and that prevented the model from being on one of the stone outcropping bases I had planned to use.
  
At the very least he matches the bases on the rest of the Veletaris and the Lord Marshal, so he won't look out of place by any means!",2015-11-21 16:51:53+00:00,cx82zx3,2,t1_cx7pvwz,41952,Warhammer
127,"CHOOM!  The theoretical and subsequently amusing joke about the sound that Volkite weaponry makes when fired...as the description in the Horus Heresy rulebooks make it sound very close to a Martian Death Ray from old movies.
  
In relation to the 1905th Rust Scorpions, I've developed a force that relies on Volkite weaponry for almost 75% of its firepower.  I'd say that makes promoting the weapon being used on the recruitment poster entirely justified.  That and it's fun, which is really all that matters!",2015-11-21 04:24:55+00:00,cx7opmi,2,t1_cx7mz0i,3997,Warhammer
128,"Thanks!  It's not a conversion.  The Strategos is actually one of several members of the Tactical Command squad that the Lord Marshal can break off from in the Horus Heresy (30k) Solar Auxilia army.  Each figure is really detailed so handling the squad in assembly is mostly pointless, since they have barely any shared parts.
  
As the Strategos is such an awesome sculpt, I thought he deserved to be singled out (same with my previous post of the Lord Marshal) in order for miniature to be appreciated.",2015-11-21 04:17:31+00:00,cx7oj3y,2,t1_cx7mk76,4446,Warhammer
129,"Thanks for the compliment!
  
I just checked the size real quick as the listed Baneblade measurements didn't seem accurate.  I am assuming they aren't including the barrels on the back but when you're trying to transport the tank you have to keep those things in mind!
  
Anyways the measurements are as follows:
  
Length (Barrels to Front Track):  9.5"" 
  
Width (Sponson tip to Sponson tip): 7""
  
Height (Bottom of Tracks to the Top of the Center Gun Mount): 3.5""
  
I did not include the antenna in the height because that thing is just begging to be broken when transporting the tank and I wish I had not placed it on there to begin with.  Yet I did so I'll have to deal with it, I may end up cutting it down to make it more manageable though.
  
Hope that helps!",2015-11-20 22:59:20+00:00,cx7fb7x,2,t1_cx73hmb,18672,Warhammer
130,"At the rate things are going, I'll be fielding these against 40k armies because no one else in my store has a 30k force to my knowledge.  I may have to cave and get a thunderbolt to provide some air cover though, soooo many flyers zipping around in 40k!",2015-11-14 06:03:59+00:00,cwzpsg7,2,t1_cwxkp47,153986,Warhammer
