,body,created,id,nest_level,parent_id,reply_delay,subreddit
0,I love this,2016-10-11 08:43:49+00:00,d8n3exh,2,t1_d8n3c1q,299,AskReddit
1,Oh well then... Nothing wrong with a good breeze,2016-10-08 09:53:25+00:00,d8j1vrl,1,t3_56fgz9,19530,tifu
2,Love it. I'm from Australia,2016-10-08 08:14:28+00:00,d8j0do9,1,t3_56g3ql,81,AskReddit
3,"Personally I'd say sons of anarchy, suits or even chuck. Very good shows!",2016-10-06 11:35:29+00:00,d8gaqgv,1,t3_564xbp,61,AskReddit
4,I just finished it. I cried when jax died and Opie,2016-10-06 01:38:40+00:00,d8fvkp0,2,t1_d8ewh8b,47889,AskReddit
5,Yeah. I would. Its the personality that counts,2016-10-03 11:36:58+00:00,d8bzf1z,1,t3_55n89b,76,AskReddit
6,So I can make fun of people ,2016-10-02 12:36:27+00:00,d8ap0se,2,t1_d8aoweg,348,AskReddit
7,I should ask this girl out! ,2016-10-01 06:40:43+00:00,d89bwwp,1,t3_558t50,50040,AskReddit
8,WWE is fake ,2016-10-01 06:24:30+00:00,d89bl0z,1,t3_557ado,71571,AskReddit
