,body,created,id,nest_level,parent_id,reply_delay,subreddit
0,"Oooh, these look delicious!",2016-11-01 15:09:57+00:00,d9gvnpy,1.0,t3_5a9u2k,133157.0,veganrecipes
1,LOVE Chai spice!,2016-11-01 13:14:50+00:00,d9gqs69,1.0,t3_5ad1fa,76727.0,awesomeveganrecipes
2,Gorgeous and sounds amazing! My son loves plums!,2016-10-25 20:18:15+00:00,d97ihe6,1.0,t3_595kfo,99062.0,awesomeveganrecipes
3,I've been obsessed with turmeric lately. I need to try this!,2016-10-25 20:17:44+00:00,d97igho,1.0,t3_59bz7b,13725.0,awesomeveganrecipes
4,These look so good!,2016-10-25 20:09:16+00:00,d97i1bn,1.0,t3_59af8f,32809.0,veganrecipes
5,This is my kind of salad!,2016-10-25 20:08:56+00:00,d97i0pa,1.0,t3_59bn18,16767.0,veganrecipes
6,I would think so. Let us know how it turns out!,2016-10-25 20:08:20+00:00,d97hzmv,,t1_d8sqroe,,veganrecipes
7,Quinoa is a great idea too!,2016-10-05 01:10:58+00:00,d8edl2l,2.0,t1_d8ecbxl,1713.0,veganrecipes
8,These are amazing! I definitely do not have a steady hand for decoration like this. :),2016-10-04 13:14:36+00:00,d8dgyt0,1.0,t3_55p3jo,67789.0,awesomeveganrecipes
9,I soooo need these in my life!,2016-10-04 13:14:04+00:00,d8dgy4j,1.0,t3_55nc9y,90309.0,awesomeveganrecipes
10,It would be perfect for the holidays!,2016-09-27 12:51:01+00:00,d840vcs,2.0,t1_d840820,1323.0,veganrecipes
11,Totally droolworthy!,2016-09-27 12:50:49+00:00,d840v55,2.0,t1_d8387db,54262.0,veganrecipes
12,"I've heard of that before, but never really knew what it was. Now I do! :)",2016-09-27 12:50:40+00:00,d840uzm,2.0,t1_d82o11w,79987.0,veganrecipes
13,Agree!,2016-09-23 13:14:20+00:00,d7ysm1d,2.0,t1_d7wuve5,130276.0,veganrecipes
14,I bought one just this summer and I love it!,2016-09-23 13:14:10+00:00,d7ysltp,2.0,t1_d7xgwxp,81999.0,veganrecipes
15,This looks so dreamy!!,2016-09-15 13:37:26+00:00,d7nro4x,1.0,t3_51vcur,555274.0,awesomeveganrecipes
16,"Mmmm, must make these!",2016-09-15 13:37:04+00:00,d7nrnmn,1.0,t3_52g8rv,237266.0,awesomeveganrecipes
17,"Oh, it's still technically summer here. I'm just saying that I, personally, am ready for fall to begin! :)",2016-09-08 00:30:51+00:00,d7dk6c7,2.0,t1_d7bvh3u,103052.0,veganrecipes
18,"Yes, me too!",2016-09-08 00:30:22+00:00,d7dk5nv,2.0,t1_d7c1o3a,94486.0,veganrecipes
19,Oh my - those look SO good!!! Drooling!,2016-09-02 19:45:13+00:00,d7769zy,4.0,t1_d756z31,122243.0,veganrecipes
20,That sounds perfect!,2016-09-02 19:44:24+00:00,d7768p5,2.0,t1_d76yipz,10149.0,veganrecipes
21,How fun! How did they turn out?,2016-09-01 01:43:07+00:00,d74ulul,2.0,t1_d74tw7l,1091.0,veganrecipes
22,That's awesome!,2016-09-01 01:42:45+00:00,d74ulcp,2.0,t1_d748zrf,29420.0,veganrecipes
23,"It might not be traditional, but it looks fantastic! :)",2016-08-26 02:33:58+00:00,d6wzzon,2.0,t1_d6vgzv6,91986.0,veganrecipes
24,"HaHa! Yes, so true!!",2016-08-24 19:49:21+00:00,d6v35xi,2.0,t1_d6ttr5g,79993.0,veganrecipes
25,This looks so cozy and comforting! Can't wait to try it1,2016-08-23 17:55:24+00:00,d6tj2pr,1.0,t3_4yjoga,352952.0,awesomeveganrecipes
26,PB&amp;Cookies is my FAVE!!!,2016-08-23 14:47:49+00:00,d6ta4vi,1.0,t3_4z3c2v,56787.0,vegan
27,These look so good! I was obsessed with pudding pops as a kid!!,2016-08-17 18:01:27+00:00,d6lg63d,1.0,t3_4xiikt,373754.0,awesomeveganrecipes
28,"Oh my gosh, yum!",2016-08-12 17:47:13+00:00,d6etlxo,1.0,t3_4x88ok,98508.0,awesomeveganrecipes
29,These look like the perfect snack!,2016-08-12 17:46:53+00:00,d6etlbc,1.0,t3_4x9fx6,84656.0,awesomeveganrecipes
30,"Yes, for sure! That sounds amazing! And actually, homemade seitan is really easy...I don't know why I don't make it more often!",2016-08-09 19:11:16+00:00,d6arq1s,2.0,t1_d6a9nrq,25185.0,veganrecipes
31,HaHa!! ,2016-08-09 02:33:52+00:00,d69vm60,2.0,t1_d69v4t7,746.0,veganrecipes
32,I fear I would never stop eating these....,2016-08-08 15:23:45+00:00,d6938cz,1.0,t3_4wmlts,67488.0,awesomeveganrecipes
33,This is just GORGEOUS!! Natalie outdid herself with this one!,2016-08-08 15:23:23+00:00,d6937s8,1.0,t3_4uvhmq,1032905.0,awesomeveganrecipes
34,Agree!,2016-08-08 15:20:23+00:00,d693344,2.0,t1_d686p5b,67174.0,awesomeveganrecipes
35,Yum! Both sound delicious!,2016-07-24 14:48:14+00:00,d5orilo,2.0,t1_d5ol8m3,18530.0,veganrecipes
36,Awesome! I'll have to check them out!,2016-07-20 20:40:45+00:00,d5k1wy4,4.0,t1_d5jyrue,3839.0,veganrecipes
37,"Super indulgent as I don't usually buy store bought cookies like that, but my gosh, they sound so good!",2016-07-20 19:06:55+00:00,d5jxb5m,2.0,t1_d5jvdry,2420.0,veganrecipes
38,I haven't tried those - are they vegan too?,2016-07-20 19:05:30+00:00,d5jx8oz,2.0,t1_d5jrurm,6779.0,veganrecipes
39,Me too! One pot dishes are the best! And love that this is spicy! :),2016-07-19 20:13:57+00:00,d5im2ew,2.0,t1_d5hykg4,37426.0,veganrecipes
40,I have made these and they are so good!! My kids loved them too!,2016-07-18 14:23:15+00:00,d5gtawb,1.0,t3_4teloe,12754.0,awesomeveganrecipes
41,I definitely have to try these. My kids LOVE LOVE LOVE cantaloupe!,2016-07-13 17:21:38+00:00,d5ath4x,1.0,t3_4shudg,90146.0,awesomeveganrecipes
42,"Mmmm, this looks so good! Might have to put it on the menu this week!",2016-07-13 17:20:00+00:00,d5atee0,1.0,t3_4so4bn,2135.0,veganrecipes
43,"Me neither, but it sounds sooo good!",2016-07-13 14:38:10+00:00,d5am2yc,2.0,t1_d58hfv0,143578.0,veganrecipes
44,This is so gorgeous!,2016-07-11 19:50:29+00:00,d58a03i,1.0,t3_4rir20,451055.0,awesomeveganrecipes
45,"Oh man, that sounds good!! ",2016-06-20 17:54:08+00:00,d4gwd20,1.0,t3_4oy4hi,26044.0,veganrecipes
46,Right?! I can't stop staring at the pic - looks sooo good!,2016-06-20 17:53:45+00:00,d4gwcfk,2.0,t1_d4gu5u5,2870.0,veganrecipes
47,Seriously droolworthy!,2016-06-12 17:20:14+00:00,d466kdm,1.0,t3_4nqbhz,12331.0,veganrecipes
48,"I'm so sorry this is happening to you. Pregnancy is so hard - I had a terrible time being pregnant (and I was NOT plant based at the time). Sounds like you are doing an amazing job! I hope you can put all these negative comments aside and enjoy this special time in your life. Best wishes for a happy, healthy pregnancy!!",2016-06-12 17:19:17+00:00,d466iwn,1.0,t3_4nq1x4,17184.0,vegan
49,I'm not totally sure. Stuff like this doesn't usually last more than 3 days in our house. We just put it on everything. :),2016-06-10 18:26:52+00:00,d43y8a7,2.0,t1_d43siyo,7518.0,veganrecipes
50,Haha! You can never have too many!,2016-06-10 18:26:15+00:00,d43y7bf,3.0,t1_d43s7uc,7898.0,veganrecipes
51,That streusel topping!!,2016-06-08 19:48:12+00:00,d41c011,1.0,t3_4n0544,95239.0,veganrecipes
52,"Gosh, I have no idea. Sorry. :(",2016-06-04 17:42:39+00:00,d3vwx64,2.0,t1_d3vlzhs,24445.0,veganrecipes
53,Really?? That is so cool!,2016-06-04 17:42:04+00:00,d3vwwhr,2.0,t1_d3v5nqm,64093.0,veganrecipes
54,That sounds amazing!,2016-06-04 17:41:48+00:00,d3vww5q,2.0,t1_d3uvas1,79849.0,veganrecipes
55,These remind me of my childhood! So fun!,2016-06-03 16:31:24+00:00,d3umz4k,1.0,t3_4m1ixj,179867.0,awesomeveganrecipes
56,These are beautiful!,2016-06-03 16:30:29+00:00,d3umxm8,1.0,t3_4m7qi1,89697.0,veganrecipes
57,That sounds so good!,2016-06-03 16:30:20+00:00,d3umxdn,2.0,t1_d3tu6lo,57512.0,veganrecipes
58,I agree - burritos! Or breakfast quesadillas. You could do tofu scramble or grilled/roasted veggies or even a fruity one with cashew cream cheese. Granola/vegan yogurt/fruit parfaits. Muffins and smoothies are always good portable options as well.  Good luck! Sounds like a great idea!,2016-06-03 16:28:11+00:00,d3umtr6,1.0,t3_4mczfm,8887.0,veganrecipes
59,These are gorgeous!,2016-05-23 17:22:50+00:00,d3glizo,1.0,t3_4kamjq,242934.0,awesomeveganrecipes
60,I agree. Those Cheesy Garlic Crumbs!!!,2016-05-23 17:21:36+00:00,d3glh0e,,t1_d38thfi,,awesomeveganrecipes
61,Let us know how it turns out.,2016-05-23 17:20:38+00:00,d3glff4,,t1_d37woku,,veganrecipes
62,The Cheesy Garlic Crumbs are what sold me!! :),2016-05-23 17:20:27+00:00,d3glf5i,,t1_d37qq0y,,veganrecipes
63,How was it??,2016-05-08 14:23:50+00:00,d2xfbm4,2.0,t1_d2vhrdd,156005.0,veganrecipes
64,Do you not like cucumbers? ,2016-05-06 16:32:00+00:00,d2vay38,2.0,t1_d2u6dno,76638.0,veganrecipes
65,That is a GREAT idea!,2016-05-06 16:31:23+00:00,d2vax2f,3.0,t1_d2v5s6o,6893.0,awesomeveganrecipes
66,I agree with the chili idea! You could even make two different kinds - one bean heavy and one veggie heavy (in crockpots - even better!) and then set out all the different toppings you can think of. Make some cornbread on the side and maybe a salad. Easy peasy! Good luck!!,2016-05-06 16:31:03+00:00,d2vawit,1.0,t3_4gb9zx,1001784.0,Vegan_Food
67,Yes! I want to make them all!,2016-05-05 18:37:04+00:00,d2u4nmu,2.0,t1_d2tt89d,15057.0,awesomeveganrecipes
68,This looks so good! Perfect for Cinco de Mayo...or any day because I crave Mexican food all the time!,2016-05-05 13:39:09+00:00,d2trg16,1.0,t3_4hso3s,123608.0,awesomeveganrecipes
69,"Holy wow, I need this!",2016-05-05 13:38:26+00:00,d2trf41,1.0,t3_4hy9uz,35437.0,awesomeveganrecipes
70,This sounds so good!,2016-04-30 11:39:25+00:00,d2n81n4,1.0,t3_4gqzmo,220255.0,veganrecipes
71,I thought so too. ,2016-04-30 11:37:08+00:00,d2n8092,2.0,t1_d2n5j4i,10265.0,VegRecipes
72,"LOL. Maybe not the best pic, but I do like the idea. I love cauliflower!",2016-04-29 23:21:53+00:00,d2mprvg,4.0,t1_d2mn12e,4584.0,VegRecipes
73,"Wow, I would have never thought of stuffing a cauliflower. Sounds amazing!",2016-04-29 18:03:25+00:00,d2mcsn1,1.0,t3_4gzz26,8446.0,VegRecipes
74,"Me too! I LOVE chili...eat it all year, even in the heat of summer. And LOVE that this is made in the slow cooker so it's basically hands off!",2016-04-29 18:01:58+00:00,d2mcqcg,2.0,t1_d2m0m9u,16981.0,VegRecipes
75,"Yes, for sure. Now, I can't believe that I ever didn't like it. It's so good! :)",2016-04-29 18:01:05+00:00,d2mcoxb,4.0,t1_d2m6sew,7777.0,veganrecipes
76,HaHa! Did you make it yet?,2016-04-29 18:00:37+00:00,d2mco71,,t1_d2isqpa,,veganrecipes
77,"Some recipes call for mixing plant milk and ACV to create buttermilk. However, the milk doesn't actually have to curdle for it to work, so you don't need to mix it and let it sit like most people think. Just mix it in right before you bake. ",2016-04-27 17:58:02+00:00,d2jlmtv,3.0,t1_d2jc2cm,12653.0,VeganBaking
78,:) ,2016-04-27 17:54:34+00:00,d2jlh24,4.0,t1_d2jl7fa,340.0,veganrecipes
79,"Oh me too! We eat it at least once a week, usually more. Yum!",2016-04-27 16:29:06+00:00,d2jhgxp,4.0,t1_d2ja306,10367.0,veganrecipes
80,"LOL!! I used to hate cilantro, then all of a sudden in my 20's I started to love it. Now I can't get enough. ",2016-04-27 13:36:01+00:00,d2ja2lj,2.0,t1_d2ikyz5,53064.0,veganrecipes
81,"No, not at all. You can use any onion you have on hand. I was just going with the whole tex-mex theme. :) Hope you enjoy!",2016-04-27 13:35:03+00:00,d2ja1bl,2.0,t1_d2j7qkk,4366.0,veganrecipes
82,I hope she loves these!,2016-04-27 13:33:02+00:00,d2j9yqp,2.0,t1_d2j4la2,13828.0,VegRecipes
83,"The ingredient list is not copyrighted, but instructions are. You could ask for people to copy/paste the ingredient list and then have to click the link to blog for directions. ",2016-04-27 03:39:37+00:00,d2iwpjc,3.0,t1_d2i67nv,36581.0,VegRecipes
84,You're welcome! :),2016-04-23 22:37:31+00:00,d2eqpej,2.0,t1_d2e7jup,35374.0,veganrecipes
85,"And who doesn't love pancakes, right?! :)",2016-04-22 17:31:13+00:00,d2datm1,2.0,t1_d2cclc0,66450.0,veganrecipes
86,Cauliflower is my fave! So versatile!,2016-04-19 21:34:40+00:00,d29fnv2,2.0,t1_d29bbjt,5586.0,VegRecipes
87,"I like to do super easy burrito bowls. Some cooked brown rice, can of black beans, heated frozen (or canned) corn,  diced red bell pepper, avocado and top it all off with salsa. If you get the Instant Rice, it takes only about 10 minutes from start to finish for the whole thing.",2016-04-19 17:06:51+00:00,d2933r6,1.0,t3_4fe0l0,72622.0,VegRecipes
88,I can't wait to try these! I'm thinking some chocolate and strawberries stuffed inside would be divine! :),2016-04-19 17:04:13+00:00,d292zfc,1.0,t3_4fhvh9,8741.0,VegRecipes
89,"LOL, right?! Or ""its too expensive to eat healthy.""",2016-04-19 17:02:53+00:00,d292x7b,,t1_d23iojx,,vegan
90,So many options! All yummy! :),2016-04-19 17:01:53+00:00,d292vio,2.0,t1_d28w63h,8855.0,VegRecipes
91,I agree! I love lentils in my tacos!,2016-04-19 17:01:07+00:00,d292u9v,2.0,t1_d28w3a1,8918.0,VegRecipes
92,That sounds good too!,2016-04-16 19:20:34+00:00,d25ibvn,2.0,t1_d256ef3,22288.0,VegRecipes
93,Oh man! I NEED these in my life today! :),2016-04-15 13:43:40+00:00,d23ygse,1.0,t3_4ewlnr,2583.0,veganrecipes
94,"I didn't see it, but I've been meaning to try to make ""meatballs"". Pecans are a great idea!",2016-04-15 13:25:53+00:00,d23xuad,1.0,t3_4eowri,128343.0,VegRecipes
95,"YES! I have the book and it's so great. Like you said, her chapters are organized by ingredient instead breakfast/lunch/dinner, etc. Perfect for Farmers Market Season or when trying to use up a certain veggie in your fridge. She also teaches you how to make variations on salsa, pesto, guacamole, smoothies, etc, so you can make them with whatever is already in your house. And the pictures are beautiful. I definitely think it will be a book I continually go back to time and again. I just hosted a giveaway on my blog, but it's over now. However, if you check out Veggies Don't Bite, I believe she is running a giveaway also and that one has several days left. Might be worth a try to win it if you're on the fence. :)",2016-04-15 13:24:56+00:00,d23xt4l,1.0,t3_4etaqy,58931.0,VegRecipes
96,I have a long list of recipes from her site to try! :),2016-04-15 13:19:57+00:00,d23xn6k,4.0,t1_d22uoe6,70492.0,VegRecipes
97,Glad you enjoyed it! Such a great resource for weeknight meals!,2016-04-15 13:19:28+00:00,d23xmlq,2.0,t1_d23u9cz,7831.0,VegRecipes
98,Thanks! No one can say that eating healthy is expensive now!,2016-04-15 13:19:08+00:00,d23xm6l,2.0,t1_d23sjj5,13970.0,VegRecipes
99,I love creamy potato soup! And those croutons look awesome!,2016-04-15 13:14:41+00:00,d23xgpl,1.0,t3_4erv6r,75788.0,veganrecipes
100,"You're welcome. We usually the buy the Nature's Bakery Fig Bars, but these homemade ones look SO much better!",2016-04-14 17:25:58+00:00,d22tqhe,2.0,t1_d22qv0y,3572.0,VegRecipes
101,Fig rolls - never heard of that! Natalie at Feasting on Fruit has some that look to die for as well.,2016-04-14 17:25:33+00:00,d22tpqe,2.0,t1_d22qrqq,3664.0,VegRecipes
102,The pic is just gorgeous! Hope you love them!,2016-04-14 17:24:40+00:00,d22to65,2.0,t1_d22qbc3,4180.0,veganrecipes
103,"If I made them, they probably would NOT look this good! LOL!
",2016-04-14 17:24:18+00:00,d22tnjw,2.0,t1_d22qa75,4198.0,veganrecipes
104,"I know, I LOVE figs! These look so gooey and delicious!",2016-04-14 14:18:13+00:00,d22kxff,2.0,t1_d22i6jb,4284.0,VegRecipes
105,"I would have never thought to make ""fish"" out of jackfruit, but yes, its the perfect flaky texture. Will have to try!",2016-04-13 18:18:16+00:00,d21gumy,1.0,t3_4e5de5,287121.0,veganrecipes
106,They are the best!,2016-04-13 18:15:52+00:00,d21gqhg,2.0,t1_d20g35h,69896.0,veganrecipes
107,Yum!,2016-04-13 18:15:24+00:00,d21gpp4,2.0,t1_d1zys4n,92844.0,VegRecipes
108,That is a GREAT idea!! Can't wait to try it!,2016-04-13 18:15:13+00:00,d21gpej,2.0,t1_d1zmsjg,113838.0,VegRecipes
109,I hope you enjoy!,2016-04-13 18:13:51+00:00,d21gmz4,,t1_d1u2sck,,VegRecipes
110,Thanks!,2016-04-13 12:33:15+00:00,d211x8u,2.0,t1_d20o95e,36430.0,VegRecipes
111,I LOVE this collection! And they are all so pretty too!,2016-04-13 12:25:28+00:00,d211pm6,1.0,t3_4eiif0,51016.0,veganrecipes
112,Love it! Sandwiches are underrated!,2016-04-12 23:40:03+00:00,d20hy8h,1.0,t3_4d8gxw,778640.0,VegRecipes
113,Yum!!,2016-04-12 20:31:03+00:00,d20a542,1.0,t3_4ehzjn,626.0,VegRecipes
114,Thank you so much!!,2016-04-12 20:08:21+00:00,d2092kn,2.0,t1_d1zm9m0,36160.0,veganrecipes
