,body,created,id,nest_level,parent_id,reply_delay,subreddit
0,Yeah still in movie mode but it appears that the artwork is taking a different turning which i think it looks better.,2016-11-19 17:18:39+00:00,da744xp,2,t1_da4ifjj,168762,Boruto
1,The artwork for this one has improved since the previous chapters. In my opinion is currently the best chapter out. It feels more like Naruto than it has done in the past.,2016-09-10 07:49:36+00:00,d7gqe1u,1,t3_51tgo8,126848,Boruto
2,It is incredibly fast paced but it is a nice change to some of the manga that i read. With some chapters what could be done in one chapter into like 4-5 chapters with other ones i read. With the chapters that do require extra chapters like character history they will probably do one or two which suits this manga. ,2016-08-21 14:49:57+00:00,d6qm8rd,1,t3_4ynd6h,121862,BlackClover
3,"Yeah i mean at the moment i am just playing Yo Kai Watch on my 3DS and i am trying to do some favours, quests etc but at the moment i am having problems on trying to find the locations of them on the map without a guide and where they are. I think that is one of the things they need to improve about the games is either improvement on a nav system or even introduce one onto the games. A guide even how to get Yo Kai would help as well. There are this guide [here](http://yokaipedia.net/list-of-yokai/) that gives you the food on how to catch them but it can be a bit of a bugger to navigate.",2016-08-17 18:15:22+00:00,d6lgvub,3,t1_d6ld50u,4343,yokaiwatch
4,"Thank you very much for releasing this. I am new to Yo Kai Watch and i have only recently purchased the game and only got into the anime a while back. I am also interested in starting the card game eventually but at the moment, im gonna stick with the games!",2016-08-17 16:52:12+00:00,d6lckt0,1,t3_4xbxkt,474689,yokaiwatch
5,You can check in the script itself. It will tell you what files it will and will not include. C4P will get most of the images but C4M will miss some of the movies. ,2016-07-22 22:05:02+00:00,d5mxwt5,1,t3_4shvbu,884455,computerforensics
6,"The UI itself is awful to look at. I was on an EnCase course recently and i say to one of the instructors that it was awful to look at. It was overkill grey scale but they did say that this is one of the things that they are working on but i ain't sure whether it is for 8.1 or a minor update. To be honest at the moment, it just looks like EnCase 7 with a new theme with some bug updates. Hopefully, it can work on some of the issues which 7 had/",2016-07-22 22:03:37+00:00,d5mxut1,1,t3_4tylrn,97532,computerforensics
7,"My advice is please don't kill yourself. Here are a few things that i hope can help and if you do just wanna talk, please dont hesitate to contact me through a message and/or speak to someone.

Here are a few pointers that may kick start what you need to:

* Firstly, get tested. It isn't cheap it can be up to £200 but overall, completely worth it as it can get you help and the support you require. 
* Secondly, make sure you get the support you need whether this be through mentors, support workers or just friends and family. In the UK if you are planning on attending university you can apply for Disability student allowance (DSA) which can pay for support. [DSA](https://www.gov.uk/disabled-students-allowances-dsas/overview)
* Thirdly, you will just eventually get used to being dyslexic. 
* Fourthly, try and contact a few companies specialising in dyslexia. They can probably support you and show you where to go.
* Is it a bitch to have? Yes. Can you deal with it? Yes. 
* Does it get frustrating? Yes. Again, can you deal with it? Yes. 

Overall everything does work out but you have to make sure that you are prepared for a big battle because it wont be easy but worth it because it will be able to help you progress through life.

Here are a few sites that may be able to help:

[Dyslexia Action](http://www.dyslexiaaction.org.uk/)

[NHS Choice's Dyslexia page](http://www.nhs.uk/conditions/Dyslexia/Pages/Introduction.aspx)

[British Dyslexia Assocation](http://www.bdadyslexia.org.uk/)",2016-05-27 19:46:02+00:00,d3m5lwj,1,t3_4lbxm9,6997,Dyslexia
8,"These boxes can be good. I had the regular ones but then changed to the anime series. The anime season in my opinion is better than the regular ones. You do get some nice stuff with them like hats, t-shirts, shot glasses, lanyards just to name a few examples.",2016-05-27 19:36:31+00:00,d3m57fs,1,t3_4l2q0q,155413,yokaiwatch
9,Its still appearing on my side and okay thank you.,2016-04-19 19:03:25+00:00,d298kkx,7,t1_d2987ua,452,OrcsMustDie
10,[Screenshot](http://pasteboard.co/jb47Wiy.jpg),2016-04-19 18:09:26+00:00,d2961hb,5,t1_d27zk3j,77448,OrcsMustDie
11,"[Screenshot](http://i.snag.gy/vYRPS.jpg)

Edit: Using Google Chrome 50.0.2661.75",2016-04-18 18:52:51+00:00,d27uonx,3,t1_d26qz6s,77394,OrcsMustDie
12,"This is an amazing skin update! The subreddit looks so much better than it did before.

However there does appear to be a bug with the subscribed and 'click here to select your user flair'. They both sliding to the right on and nearly are falling off the screen. ",2016-04-17 09:02:32+00:00,d265nx8,1,t3_4eplkl,274997,OrcsMustDie
13,"I reckon it may be Kingpin with a stable of super villains sounds interesting but at the same time, i wouldn't want too many super villains introduced so they can save them for other shows.",2016-04-16 10:15:28+00:00,d253ez1,3,t1_d24ftnp,50362,Daredevil
14,I do like Kingpin so I'm hoping he does return even if it is for just an episode or two. Bullseye may be an interesting character to have in the show but it depends whether they want to save him just for Daredevil alone.,2016-04-16 10:13:52+00:00,d253e5s,3,t1_d24ev8t,51599,Daredevil
15,Ah i forgot about Iron Fist! ,2016-04-15 19:51:37+00:00,d24erny,4,t1_d24e4nd,857,Daredevil
16,I believe Luke Cage is to launch first then The Defenders? I believe that is the order? Then probably season 3 after that.,2016-04-15 18:37:14+00:00,d24bfk9,2,t1_d249lwr,2409,Daredevil
17,Yeah same. I don't know much about The Defender comics but i reckon it probably one of the well known villains if anything.,2016-04-15 18:36:43+00:00,d24beru,2,t1_d249t3v,2114,Daredevil
18,Might just be me from the sounds of it!,2016-04-12 18:01:56+00:00,d2035st,2,t1_d1zl44o,33163,OrcsMustDie
19,Yeah from the sounds of it it could be just mine but i wanted to see if anyone else was having problems. Thank you.,2016-04-11 18:37:06+00:00,d1yrlco,2,t1_d1yndom,5451,OrcsMustDie
20,"Yeah i thought it was a driver issue because it keeps crashing and stating ""the driver has crashed and has successfully recovered"". And the same of what you have read, i keep seeing/reading that people are having problems with the new drivers.

I haven't heard of Display Driver Uninstaller so i will give that a try thank you very much. Do you have the website for it? I wish not to get a dodgy copy of the program.",2016-04-11 18:36:47+00:00,d1yrkuh,2,t1_d1y9swy,32075,OrcsMustDie
21,"I just spoke to someone in game who was on AMD and they said they were crashing as well so I'm guessing it is a general game bug which they need to resolve. The only way i have managed to fully prevent a full on PC crash is to try and ctrl, alt and del as fast as i can to get task manager up then it goes back to Windows and then i can continue playing again. I know this doesn't help your issue but it may lead to ideas possibly. 

I was also told in game that sometimes the recording can crash it to crash which is turned on by default? I'm guessing that is a NVIDIA GeForce experience thing possibly so you could try turning that off",2016-04-10 12:15:42+00:00,d1x6z38,6,t1_d1x5mtd,5098,OrcsMustDie
22,Yeah im gettting a serious problem now where it is crashing my computer to a point where it has to reboot to recover which is not great for my PC whatsoever. ,2016-04-10 10:42:14+00:00,d1x5ig6,4,t1_d1x440b,6030,OrcsMustDie
23,Have you tried reinstalling your graphics driver? I know it might be a long shot but it is worth trying.,2016-04-10 08:01:48+00:00,d1x383x,2,t1_d1wlck9,36731,OrcsMustDie
24,Yeah i had spoke to people in game yesterday who also used NVIDIA also said the same thing. It may be a certain type of graphic cards maybe?,2016-04-10 08:01:18+00:00,d1x37tu,2,t1_d1x283j,3515,OrcsMustDie
25,Yeah the arc at the moment isn't great and i do believe it is the final chapters as the series is finishing soon.,2016-03-14 18:36:08+00:00,d0zml9s,3,t1_d0yps9i,69756,BlackClover
26,Yeah i can't wait for the series to expand,2016-03-06 09:49:13+00:00,d0ph2wd,15,t1_d0oowz9,57567,BlackClover
27,"This could go a few ways. It could show that he is manipulating everything from the background (again) but this time from prison, or he could we could see that Matt is going to him in prison or that we could be seeing more background about his character. It will be interesting to see which way this goes.",2016-03-05 16:58:11+00:00,d0on77h,1,t3_490s05,49853,Daredevil
28,True forgot about that. I have been kept up to date with the chapters but clearly havent read the previous ones enough yet!,2016-03-05 16:55:27+00:00,d0on3q0,13,t1_d0omuvi,427,BlackClover
29,"Yeah exactly but im wondering whether he could manipulate it into something else. He has only got two swords at the moment which can easily expand for him to have collection of swords that each do there different things. Considering the sword itself absorbs the mana, he could manipulate it possibly do the same as Yami's wave based attacks.",2016-03-05 16:45:37+00:00,d0omrm1,11,t1_d0olnpk,2044,BlackClover
30,"I agree with all of your points there. I think at the moment there is a lot to be explored and i am trying to think which way the author may go as at the moment, the only person you could say with odd/no magic is Asta because he doesnt have mana no but in chapter 22 it stated that he was absorbing his magic by his sword so that could be explored possibly as well. ",2016-03-05 11:17:49+00:00,d0ofbew,9,t1_d0nrgwe,53266,BlackClover
31,"Yeah thats true. I was considering something along the lines of like limited spells to the said user for example. They obviously have elements but if they could have spells only limited to themselves or something?

I don't know really just something else to put a spin on grimoires because we understand they are the source of the spells but again, it would be nice to have a bit more a history relating to them and how they work properly for another future arc possibly?",2016-03-04 20:13:38+00:00,d0nqrzi,7,t1_d0np9dz,2091,BlackClover
32,"Oops sorry yes i remember now but the interest of having two Grimoires that are the same though, they could do a twist relating to that somehow like they can have the same spells or they could read the opposite Grimoire and learn new spells but could be damaging to the user as they arent developed enough or something along those lines.

Yeah i think we need some Yuno development like back history or somewhere where we can see his magic again in a good fight arc like Asta in his arc.

",2016-03-04 19:23:46+00:00,d0noldj,5,t1_d0noaer,417,BlackClover
33,"Oh yes. Forgot they had the double Four Leaf Clover Grimoire. I am wondering whether it will turn into one arc about Asta then one arc about Yuno because at the moment, even though Asta is the main protagonist we do need to see (personally) a bit more about Yuno because he is meant to be the rival. At the moment it feels like he is just there instead of a rival.",2016-03-04 18:41:42+00:00,d0nmqss,3,t1_d0nca6y,15207,BlackClover
34,Looks like another good chapter cant wait for this to be released! ,2016-03-04 09:34:36+00:00,d0n68m8,1,t3_48s8y8,67857,BlackClover
35,"I wonder how the the next arc will go. Will Aster develop more skills relating to Ki or sword skills/fighting styles from Yami (Probably won't happen but it is nice to see something funny between Yami and Aster) 

It will be interesting to see if we see more things like the Liar: the Faithless for example and the actual motive for why they are attacking the Clover Kingdom. 

Either way this is developing into a a very good manga series and it is slowly becoming one of my favourites.",2016-03-04 09:32:57+00:00,d0n67n3,1,t3_48ddds,293775,BlackClover
36,[Possibly this for you?](http://store.nintendo.co.uk/games/nintendo-3ds/hyrule-warriors-legends.list?widget_id=182331),2016-03-03 13:56:45+00:00,d0lzlo1,1,t3_3zemf6,5102214,NintendoUK
37,Pre-ordered mine with Amazon UK when it was first available to pre-order. Arriving tomorrow! ,2016-03-03 12:42:45+00:00,d0lxqh4,1,t3_48oqh0,51374,amiibo
38,"I played it on console so the graphics (even on console) were good but i wouldnt mind getting a full HD remake for PC. 

I yet to play Unity but it is to on the to buy list when the spring (or summer) sales begin!",2016-02-15 17:52:16+00:00,d00ur8s,3,t1_d009m8u,52306,assassinscreed
39,I cannot wait for this to be released. The first season was possibly my favourite season of television so far. ,2016-02-14 17:22:55+00:00,czzp9i7,1,t3_45rfba,4266,Daredevil
40,"I think it would be interesting to have a remake of all the previous AC games definitely with the graphics that are being released nowadays including the minor games like Chronicles (maybe). However, i think the problem we may have is that Ubisoft may not take the time not to necessary remove the repetitiveness of AC1 or find a way of overcoming this so it will be a graphics upgrade with a high price. If they do find some way of updating the game with new and improve graphics and possibly not as a high price then yes, i would be interested in getting the new games but at the moment, i still have the other ones to finish/buy (Unity mainly).  ",2016-02-14 17:20:24+00:00,czzp6gp,1,t3_45qq5u,12470,assassinscreed
41,"From the sounds of it, they possibly wont go to where the books went but I am not sure whether the books were considered canon or not. 

[spoiler](#s ""The books went that they returned to Pegasus Galaxy and Rodney got turned into a Wraith. He ended up attacking the city. There was loads of interesting character development like visiting Ronon's home planet of Sateda and Sheppard and Teyla in a relationship. "") The books were a very good read. I got three more books to finish.

I do miss the series and they never released a film. Netflix is still good for a catch up of most of the Stargate universe which is nice.
",2016-01-27 18:57:38+00:00,cze5duu,1,t3_42tlzl,79810,television
42,Happy New Year everyone!,2016-01-01 15:35:35+00:00,cyibkg3,1,t3_3yzfg9,43365,BlackClover
43,"I did just a search on Google for ""nvidia shield outside local"" you can probably improve on that and see what else you can find.",2015-11-29 17:52:58+00:00,cxgwupg,3,t1_cxgwtwc,40,theNvidiaShield
44,"According to this article, it is local only [Link: NVIDIA's support site](http://support-shield.nvidia.com/android-tv-user-guide/index.htm#t=Remote_GameStream.htm)

However, according to this site you can actually do it outside a local network with a VPN. [Link](http://forum.xda-developers.com/showthread.php?t=2435481) I have only own mine for two days so i havent tried yet but if you do a Google search you may find some answers for you.",2015-11-29 17:50:20+00:00,cxgwrct,1,t3_3uqenm,1287,theNvidiaShield
45,Thank you very much! These rescans are brilliant and are amazing quality.,2015-11-28 22:28:44+00:00,cxg4tuz,1,t3_3ujm50,67417,manga
46,Thank you very much! These rescans are brilliant and are amazing quality.,2015-11-28 22:28:38+00:00,cxg4trh,1,t3_3ujm61,67394,BlackClover
47,Thank you and i would like to enter please!,2015-11-22 11:15:41+00:00,cx8x87z,1,t3_3trdk7,36764,amiibo
48,It was an interesting episode but nothing interesting really happened apart from the mention of Sherlock's mother. It was a nice little filler episode for the season and I can't wait to see what the rest of the season holds.,2015-11-21 10:54:33+00:00,cx7vkn5,1,t3_3tivh6,112510,elementary
49,"It is definitely an interesting article to read. I have seen that they have done the Elementary vs Sherlock very well and have stated clearly what points are weaker and stronger. The article though hasn't gone into much detail about other differences like production value/times/length/writing of the season for example. I haven't stated actors because i think to be honest the right actors were chosen for both series. Both Sherlocks/John/Joan are brilliant. 

Because the article doesnt mention things like product value/times/length it does effect both shows in different ways. For example with Elementary we see/explore the backgrounds of each of the characters in a lot of different ways because we have more showtime however, in Sherlock we are limited to three episodes and even with them being an hour long we still dont see much details/background of the characters. We all know who Sherlock Holmes is but it is necessarily explored while Elementary choosing both the book and their own twist on the characters can do explore everything about the book and characters.

At the moment, i do still prefer Elementary over Sherlock. The reason behind is that Sherlock i wouldnt say has the better writing/actors/production value but it does have the better arcs in a sense that you are guessing (a lot more) throughout the three episodes to see overall who is the villain. Mainly that Sherlock you have to wait a year to three episodes or one in case of this year at Christmas while Elementary do 22/23 episodes in 9 months (dont quote me!). Some of the episodes because of this are very filler and are just there to fill the season but even with the minor filler episodes you can see the relationship between the characters develop. Having the twist with some of the characters with them being female in my opinion is more interesting then Sherlock because as the article stated in the season 1 finale, Joan 'the mascot' seen who Irene/Moriarty not Sherlock because she was a woman which again, we havent really seen in Sherlock. ",2015-11-18 20:53:45+00:00,cx4xlml,1,t3_3rwkk9,964465,elementary
50,"Yes. I have pre-ordered the UK version of the limited edition ready for the release in December. I played the first one for about 33 hours but haven't completed it yet but I love the storyline.

Personally i didn't focus my aim on the side quests but i didn't mind doing the hunting the monsters down side quests as i could do that while i was moving and doing the main storyline. I did them occasionally for some extra EXP if i was close to levelling or needed a few more points for new/upgrading skills. 
",2015-11-18 11:19:49+00:00,cx4eb2a,1,t3_3t6tla,59963,wiiu
51,"Thank you very much for the scan. Awesome quality as per usual. 

The Magic Emperor is officially badass. That is all.",2015-10-25 11:09:29+00:00,cwc2egf,1,t3_3q0g38,94875,BlackClover
52,Just started the Flash the other day and i have just finished all the episodes now. About to begin Season 2 episode 1! Watched the Arrow too! ,2015-10-13 18:43:46+00:00,cvyfp8b,2,t1_cvxa6wg,82086,elementary
53,Agreed!,2015-10-11 07:26:50+00:00,cvvmhg0,2,t1_cvvb0ih,25539,elementary
54,Looks like we will see some big changes this season. Not long to go now!,2015-10-10 15:09:09+00:00,cvutbd6,2,t1_cvup98x,11573,elementary
55,"At the moment, i think it is someone else but driven by possibly the Wizard King. So for example, someone else is doing the attacking but under the orders of the Wizard King possibly as an excuse to learn about more magic or to complete a resurrection of someone/something. ",2015-10-10 08:49:30+00:00,cvumyfg,2,t1_cvu22sx,47061,BlackClover
56,"Thank  for you for the chapter upload! As always amazing quality. 

Another interesting fight and new villains have arrived! I think Leon most likely will die which will add a new plot twist as it shows that the kingdom could possibly go to war with another one or go on a revenge plot for a while.  This battle is most definitely a good fight!",2015-10-10 08:48:34+00:00,cvumy0f,1,t3_3o4fta,55579,BlackClover
57,Okay i will read it after Boku no Hero as im enjoying that one at the moment. Then Hunter x Hunter then One Piece. I did enjoy the chapters so far but i honestly cant see how the series is gonna develop so it will be interesting to see how it goes.,2015-10-04 15:32:52+00:00,cvntvl3,25,t1_cvnog9h,13570,BlackClover
58,I will definitely add both Hunter x Hunter and One Piece on my to read list. The new chapter of Fire Brigade of Flames has been released on Mangastream. It sounds like a good series but a little too early to tell at the moment as there is no proper plot apart from he wants to become a hero.   ,2015-10-04 10:32:20+00:00,cvnngg9,23,t1_cvmzi1r,56351,BlackClover
59,"Good chapter. Thanks for uploading. I aint sure who is the bad guy at the moment but he/she has certainly made their move though against the Kingdom at least but i don't think it is the Wizard King because if the author did go down that root it is very early in the manga, possibly too early. 

I don't think Fuego Leon is dead but there is a lot of blood so he may be out for a while or something or unable to use magic again. Story wise it would be more interesting if he did die because then we can see what the after effects of him dying would do to the rest of the squads and the kingdom itself and maybe the revenge story begins or an arc of training to get more powerful? It does open many doors and it will be interesting to see what door is opened for next few chapters. ",2015-10-04 08:02:58+00:00,cvnlhdc,1,t3_3ncafq,66552,BlackClover
60,I havent read the Naruto novels yet. I am very eager to read them but i may wait until they are released first before reading them else where. I dont watch much anime. I got sick to death of all the fillers (Bleach and Naruto i'm looking at you) so i gave up on it. I did read some of Hunter x Hunter but never got around to finishing it. I stopped with One Piece around when Brook was introduced. I just lost interest in it for some reason. Don't why. I will have a look at Boku no Hero and see what it is like. ,2015-10-03 17:43:10+00:00,cvmx12l,21,t1_cvmvw29,1882,BlackClover
61,"* Naruto/Naruto Gaiden
* Bleach (got rubbish in my opinion, just reading it to finish it off)
* Full Metal Alchemist 
* The Seven Deadly Sins (very good one)
* Dragon Drive
* Ao no Exorcist (Quite a good one)
* Fairy tail and its spin offs (Possibly finishing soon?)
* Akama ga Kiru! and Zero
* Katekyo Hitman Reborn (Finished)
* Smokin' Parade (Just started on Mangastream)
* Fire Brigade of Flames (Just started on Mangastream)
* Shaman King
* Dragonball
* Pokemon (one or twice but never finished)
* One Piece (but stopped)
* UQ Holder

They are the ones i remember off of the top of my head. You?",2015-10-03 15:53:33+00:00,cvmt7f0,19,t1_cvmoro2,10645,BlackClover
62,Hahah i know but i need something good to read this week.,2015-10-03 12:27:44+00:00,cvmob04,17,t1_cvmo7bm,389,BlackClover
63,Thats always a possible answer but i dont think that would happen this early in the series.,2015-10-03 07:57:14+00:00,cvmkzwo,15,t1_cvmabpm,28354,BlackClover
64,All i can say easily is that I NEED THE CHAPTER NOW! I reckon Yami might appear. I hope he does because that would be badass or the other captains.,2015-10-03 07:56:55+00:00,cvmkzr4,15,t1_cvm2ggx,42294,BlackClover
65,I wouldn't be surprised it if was Aster with some of the newer magic knights or someone else appeared to help out. I agree the next logical step is the King himself but i think that would be too easy.,2015-10-02 18:33:02+00:00,cvlyk52,13,t1_cvlxyo4,897,BlackClover
66,Most likely not. He will probably appear at the end like HI GUYS or appear and show off his power and scare everyone away or something.,2015-10-02 18:06:11+00:00,cvlxi3d,11,t1_cvlxgpy,60,BlackClover
67,Okay. Definitely only just seen that for the first time and holy crap. Yeah either dead or gonna be permanently injured now.,2015-10-02 16:53:34+00:00,cvluklz,9,t1_cvlu3bf,687,BlackClover
68,You think? I aint sure about anyone dying at the moment.,2015-10-02 16:35:13+00:00,cvltsf2,7,t1_cvlsphp,1546,BlackClover
69,Exactly!,2015-10-02 16:04:02+00:00,cvlshon,5,t1_cvky7kw,68820,BlackClover
70,Agreed.,2015-10-01 19:16:49+00:00,cvktx83,3,t1_cvk6qzw,52879,BlackClover
71,Definitely a cliffhanger,2015-10-01 19:16:41+00:00,cvktx0i,3,t1_cvktdto,755,BlackClover
72,Still not sure whether it is a battle or speech week. I think battle with a little speech?,2015-10-01 17:53:24+00:00,cvkqgvh,1,t3_3n3o32,14928,BlackClover
73,Just have to wait and see! Not long now!,2015-09-30 18:10:40+00:00,cvjjr9a,3,t1_cvhz19s,108953,elementary
74,"I think we will see more a little bit more fights else where considering we had them all teleported else where and reveal the plan of the attack apart from revenge and if we are lucky, possible see these guys again [Link](http://jaiminisbox.com/reader/read/black_clover/en/0/9/page/15). 

Most likely learning about the different magic available and it will be interesting to see if we get any more information about the Black Bulls. I think and a major speech to Aster (again) about his lack of magic and how is slowly becoming everyone's rival as people are finally noticing his power and his magic.",2015-09-30 17:39:43+00:00,cvjifxs,1,t3_3mwik0,62556,BlackClover
75,I think it depends on your viewpoint. For example Naruto Gaiden was only 10 chapters long and that is now finished so that can be considered a reread. While Black Clover is currently 31 chapters long and hasn't finished so yes. It can be considered a refresh more then a reread. I said reread as it is easier in the long run of things. ,2015-09-30 15:48:01+00:00,cvjdqzi,4,t1_cvjbojv,3106,BlackClover
76,Congratulations on the positions!,2015-09-27 14:20:04+00:00,cvfs38a,1,t3_3mchzb,168313,BlackClover
77,Thank you for posting! It is an excellent chapter. I have re-read Black Clover about 3-4 times now. I'm just hooked on it.,2015-09-27 14:17:22+00:00,cvfs0r6,2,t1_cvfglo4,39348,BlackClover
