,body,created,id,nest_level,parent_id,reply_delay,subreddit
0,Anybody gonna get rekted for the abq show??,2016-09-15 08:01:06+00:00,d7nkbm7,1,t3_510rvy,990059,G59
1,"The idea that me and my best friend will ever be anyhting more then bestfriends. To clarify I am a guy. We spend all our free time together , do couples things . But it feels like nothing is really happening. Im fine with be just friends , but I'm going to start talking to other girls now.",2016-04-19 19:15:43+00:00,d29951e,1,t3_4fgtt7,34589,AskReddit
2,So lets say you end up dating a girl for several years . You ask her to marry you. She says yes. You guys end up having kids together. Is she into you ? You really cant tell. She could be just settling with you because she doesnt think she could do better.,2016-03-29 15:14:38+00:00,d1hqpo0,1,t3_4cepsx,20661,videos
3,"The second you stop fearing death , is the second you can start living.",2016-03-04 06:20:51+00:00,d0n2qtg,2,t1_d0mpqz8,21649,AskReddit
4,I thought Virgil actually murdered Kevin because he was crazy. Mind was totally blown with the International Assassin episode and I then realized I was watching possibly the greatest thing to ever been shown on TV.,2016-02-05 07:46:50+00:00,czom66g,1,t3_446jnu,48337,AskReddit
5,"100% of people who drink water , will die . Why ? Because water isn't real.",2015-12-01 04:08:15+00:00,cxirip2,1,t3_3uudrc,57164,AskReddit
6,"It was either going to be the scary door , or a Cake song .",2015-11-30 07:11:50+00:00,cxhpdk5,9,t1_cxhowkm,1384,Showerthoughts
7,"Are you by chance , in New Mexico?",2015-11-23 05:12:51+00:00,cx9uvod,2,t1_cx8zpdn,54260,AskReddit
8,"I know the feeling man , lifes hard and makes you feel like shit. Your not a shity person , just misunderstood.",2015-11-11 05:01:29+00:00,cww7yfb,1,t3_3sddyh,524,SuicideWatch
9,"I wish the whole internet would be gone. Some people that are very quiet in the real world , use the internet to share there  opinions they know nobody around them will agree with. They will refuse to even talk in a social setting , but have no problem ranting on the internet. And they get a couple people on the internet to agree with them , and they think that means there 100% right about everything , and will never adhere to someones elses opinion . I also think if there was no internet , people would stop getting offended by everything.",2015-11-06 03:57:34+00:00,cwqaes0,1,t3_3rmmxw,50497,AskReddit
10,"Speaking on my own behalf ; My ""church"" does not attribute to any of my opinions. My ""church"" does not control my life in any way. I am a liberal christian. In the grand scheme of things abortions and gay marriage isnt that big of a deal. But neither is arguing about religion. Who cares ? Theres dumb ignorant christians , and dumb ignorant atheists. Theres no need to fight over this and say ""if you  , a completley diffrent human being who has had a completley diffrent life then me , does not have the same opinions as me , then your wrong"" . We can all get along , find common ground , we are both people , we both have feelings , and we both can enjoy similar things in life. ",2015-11-06 03:53:19+00:00,cwqa95l,4,t1_cwq5otv,7196,AskReddit
11,"This is why I love the game , one secomd your in 5th place and next your in 75th because you got to confident",2015-10-22 14:13:55+00:00,cw8u3pd,1,t3_3prilk,7242,gaming
12,"That moment when your realize that your a creep by a lot of these peoples standards . Well looks like i gotta change somethings , because i finally found out why I'm single.",2015-10-09 05:24:47+00:00,cvtezoj,1,t3_3o010d,40622,AskReddit
13,England by The National,2015-10-07 22:04:50+00:00,cvrsrdl,1,t3_3nw920,46,AskReddit
14,They probably have the same PR team as Woody Harrelson,2015-09-18 04:40:23+00:00,cv5jzm0,2,t1_cv5jbk3,1550,AdviceAnimals
15,Stan is that you ?,2015-09-16 05:38:59+00:00,cv37xf2,5,t1_cv347iv,9903,videos
16,People who believe everything that's on facebook is true .,2015-09-16 02:14:50+00:00,cv32xwu,1,t3_3l4bxt,854,AskReddit
17,You,2015-09-16 00:40:42+00:00,cv2zqy3,1,t3_3l3wml,2337,AskReddit
18,Have any of you also tried sucking your own dick? Has anyone succeded.,2015-09-16 00:19:56+00:00,cv2z0o9,1,t3_3l3qsy,3785,AskReddit
19,Imagine dragons because it was an exes favorite band. Which sucks because there pretty decent. But everytime I hear them it brings back bad memories.,2015-09-16 00:16:22+00:00,cv2ywap,1,t3_3l3xy5,270,AskReddit
20,"Currently in a situation like this , stepmom has gotten my dad to hate me as well.",2015-09-14 22:16:46+00:00,cv1nga0,3,t1_cv0wzv8,56145,AskReddit
21,https://youtu.be/ZD2Dvzadhvk,2015-09-10 21:35:40+00:00,cux7qkg,1,t3_3keyrm,20500,todayilearned
22,Have i been shadow banned,2015-09-10 21:21:54+00:00,cux78eb,1,t3_3kbx58,71873,Showerthoughts
23,Ok James,2015-08-19 21:32:44+00:00,cu8rbms,2,t1_cu8csfz,20471,AskReddit
24,"I sometimes feel to lazy to turn on the tv so 
I just download whatever show i want to watch on my laptop.",2015-08-16 03:18:39+00:00,cu4iog1,1,t3_3h5xw1,244,AskReddit
25,"Or when people post ""lol cashier forgot to charge me for something , guess im lucky"" . No thats stealing you cunt go back into the store and tell them before someone looses there job for your stick of chapstick.",2015-08-12 17:57:07+00:00,cu0mc1o,2,t1_ctz8gsh,94441,AskReddit
26,Do any of you skate or longboard?,2015-08-11 21:23:26+00:00,ctzmjzo,1,t3_3gkm8p,44288,funhaus
27,Hey I submitted this a month ago!https://www.reddit.com/r/todayilearned/comments/3c8r5j/til_in_2007_during_the_writers_strike_steve/,2015-08-10 14:02:38+00:00,ctxxxy6,1,t3_3gew6d,44446,television
28,I feel like this happened on Rescue Me.,2015-08-10 13:59:06+00:00,ctxxu9i,1,t3_3gfwdl,22059,tifu
29,"I had just spent a 100$ on putting posters all over my room , i then get into an arguement with my dad . In a fit of rage I tear down and rip to shreds every poster i put up. Now if I buy a poster I frame it .",2015-08-09 04:32:30+00:00,ctwl6og,1,t3_3g8t1p,51916,AskReddit
30,Its my senior year of highschool! How do I handle everything this year and not get overwhelmed?,2015-08-09 04:15:21+00:00,ctwkq2h,1,t3_3g9f5v,39036,AskReddit
31,I was heading to Albuquerque!,2015-08-08 03:25:18+00:00,ctvkzde,3,t1_ctvkqcg,559,mildlyinteresting
32,"The ""no means no"" bandwagon. Rape is illegal in the US, walking around protesting rape in your underwear is not going to stop a rapist.Luckily in our country when they are caught they will go to prison. So chill the fuck out this isn't Iraq or India.",2015-08-08 01:30:08+00:00,ctvhmb4,1,t3_3g6uz5,5525,AskReddit
33,"And whats that ? Christian Conservatives who should do everything for god? I am a christian too m8, and my grandpa is a pastor. And guess what? He smoked weed, my dad smoked weed and now I smoke weed.",2015-08-08 01:26:55+00:00,ctvhiv9,4,t1_ctvhbaf,416,AskReddit
34,I really liked rockstar when it came out!,2015-08-08 01:24:39+00:00,ctvhge9,2,t1_ctvhb8n,282,AskReddit
35,"No hate here, but what is your opinion about the court system in the US and Canada and how in the majority of cases ( divorces , child custody ect) women win , even if the man is was cheated on , or is a better fit to parent?",2015-08-08 01:22:33+00:00,ctvhe2g,2,t1_ctuovuz,48072,AskReddit
36,"Oh man I guess that means every celebrity on the planet , most ceo's on the planet are losers. You seem to have grown up as a conservative dinosaur.",2015-08-08 01:15:58+00:00,ctvh6wa,2,t1_ctuw2zv,33926,AskReddit
37,"Nirvana sucks, members from the band said they sucked. They were not musical geniuses, Grohl might be now , but back then they were a shitty band from Seattle. They also got way more popular after Kurt killed himself.",2015-08-08 01:08:26+00:00,ctvgyy7,1,t3_3g4blw,48065,AskReddit
38,"Rape is illegal in the USA. You don't need to protest rape , because it's not going to stop rapists and it's been illegal for quite some time.",2015-08-08 01:04:30+00:00,ctvgusg,1,t3_3g4blw,47829,AskReddit
39,I was there yesterday! The construction crew was a mile down the road.,2015-08-08 00:52:24+00:00,ctvghz1,2,t1_ctv2kdv,23003,mildlyinteresting
40,Is this outside Dumas? i was just there!,2015-08-08 00:51:28+00:00,ctvggyc,1,t3_3g5fsl,26673,mildlyinteresting
41,When do you guys think you'll retire from making videoes ?,2015-08-05 15:48:19+00:00,ctsepsk,1,t3_3frny2,81402,funhaus
42,I just got a galxaxy s 6 edge . How does it compare to your guy's phones? ,2015-08-05 01:09:14+00:00,ctrsvvb,1,t3_3frny2,28657,funhaus
43,Just gonna drop this here http://imgur.com/zX4sDwm,2015-08-03 23:27:43+00:00,ctqhi47,1,t3_3fmgdu,31913,todayilearned
44,"A couple years back I was living with my dad and stepmom. They were both very mean people. They were supposed to pick me up after school one day , and they did 4 hours late . I called my dad upset they were picking me up so late. I told him I am his child and he doesn't give a shit about me , which is fucked up. He got mad . When he eventually picked me up , he was taking my stepmom and her kids to dinner. He said I didnt get to eat because of the way I talked to him. I got so upset that I jumped out of the car and ran as fast as I could . My dad followed me with the car and tried to throw me back in. He finally gave up . A guy across the street saw what happened and came over to me. He offere me a ride to somewhere safe. He drove me to my friends house . He asked me how old I was , I told him. He told me when I graduate i can tell my parents to fuck off and leave. He also told me to not make the people that see me as an option a priority. I only have one year left , my parents are still terrible, but his words of wisdom help me get through things. I never learned his name.",2015-08-03 17:55:16+00:00,ctq4f61,1,t3_3fkbcl,62721,AskReddit
45,My name is earl,2015-08-01 06:36:17+00:00,ctnps9a,2,t1_ctnk6nz,13932,Showerthoughts
46,My name is earl,2015-08-01 06:36:15+00:00,ctnps8j,2,t1_ctnk6nz,13930,Showerthoughts
47,"Some people i get along with, others that are more douchey then me I do not.",2015-07-31 06:34:53+00:00,ctmj065,3,t1_ctmiynj,123,AskReddit
48,Josh,2015-07-31 06:32:04+00:00,ctmiy20,1,t3_3f9aic,2508,AskReddit
49,Glad to see some old Shrute family photos.,2015-07-31 05:58:19+00:00,ctmi80n,1,t3_3f7zy1,24425,OldSchoolCool
50,My original comment still stands,2015-07-31 05:54:11+00:00,ctmi4o2,3,t1_ctmhdoh,1920,rant
51,Sounds like something that never happened.,2015-07-31 05:13:09+00:00,ctmh5lu,1,t3_3f8z8v,4260,rant
52,I hated that so much . Like the show is phenomonal and they end it with a god damn cliff hanger.,2015-07-31 01:50:15+00:00,ctmar8q,2,t1_ctm11xb,16174,AdviceAnimals
53,Thats why I also love torr.... I mean amazon prime. Yeah that,2015-07-31 01:47:11+00:00,ctman8r,1,t3_3f6tiq,27248,AdviceAnimals
54,Taylor would not ok it and she would probably sue them just for asking.,2015-07-31 01:42:06+00:00,ctmagrn,1,t3_3f7rz2,12675,Showerthoughts
55,My school had nerf gun war right before summer break. Glad charter schools dont have to follow that zero tolerance non sense.,2015-07-30 22:58:48+00:00,ctm4rgf,4,t1_ctlezex,40890,AskReddit
56,"It had 6,000 views when I watched it and 8,000 likes.",2015-07-30 15:52:55+00:00,ctln181,1,t3_3f5hj0,13016,videos
57,I kept scrolling till I found a GoT refrence.,2015-07-30 06:40:53+00:00,ctla9z4,2,t1_ctl46ur,13627,creepy
58,If its a fictional mocumentrary then Michael Scott and Holly need to be one of the couples he works with.,2015-07-30 05:40:47+00:00,ctl900g,1,t3_3f3z0e,12315,Showerthoughts
59,"*spoilers* The majority of paper towns is a about a guy lokking for his crush when she runs away. He finds her , she then basically tells him to fuck off , then they akwardly kiss. End of fault in our stars is her love intrest dies (he has cancer , so does she ) .",2015-07-30 05:29:56+00:00,ctl8qwj,3,t1_ctl7aur,3365,AskReddit
60,"Paper towns and the fault in our stars. *spoiler* The ending to paper towns made me feel like the whole fucking books was pointless and a slap in the face. The fault in our stars was too predictable . Oh gee a book about teens with cancer ,i never would have guessed some major charcters would die.",2015-07-30 03:19:51+00:00,ctl5328,1,t3_3f3vx2,5329,AskReddit
61,"Game of thrones , it will be a 70 hour movie when it's finished ",2015-07-29 22:25:53+00:00,ctkujba,1,t3_3f33st,764,AskReddit
62,"If I'm not mistaken santanists beleive in gaining knowledge , even if the knowledge is dangerous. My question is with the world currently being over populated and resources being scarce, would you agree that the only way for the human race to survive is to kill a significant precentage of the population?",2015-07-29 04:56:50+00:00,ctjxg0g,1,t3_3ez2am,12654,IAmA
63,"I found out why my dad and his ex had broke up. There relationship seemed great and then one day they werent together anymore. She had gotten pregnant , got an abortion and told my dad after the fact. My dad was pissed and imediatley broke up with her. He told me about when he got drunk a couple of years later.",2015-07-28 20:35:56+00:00,ctjfftd,1,t3_3ewxdt,15234,AskReddit
64,Actually it is one of the top sales jobs in the country. Its ok that your jealous.,2015-07-27 15:25:05+00:00,cthtpnl,3,t1_cthtjzw,254,todayilearned
65,"My dad is a rep for them. Its one of the best jobs he has ever had. He does Armani, Prada , Dolce , Polo and a couple other brands. Its preety nice wearing 1000$ to school that cost you nothing. He has to carry one of every glasses fram and sunglasses at all times. He also only has to pay 40% of wholesale. So a pair of thousand dollar sunglasses might cost him around 100$.",2015-07-27 15:19:28+00:00,cthti44,1,t3_3erhwg,10920,todayilearned
66,New Mexico is drinking a Corona and trying to explain to everyone that he is also an American. ,2015-07-27 05:20:07+00:00,cthgyi8,1,t3_3epql6,17955,AskReddit
67,"I liked the one comment on the video ""reddit will see this"".",2015-07-27 03:04:49+00:00,cthd4i7,1,t3_3eoxi9,24583,videos
68,This happened to me a couple of times when I was younger.,2015-07-23 14:56:25+00:00,ctde8x0,2,t1_ctd6jtq,19559,AskReddit
69,This happened to me a couple of times when I was younger.,2015-07-23 14:56:25+00:00,ctde8wt,2,t1_ctd6jtq,19559,AskReddit
70,Johny Depp in Tusk.,2015-07-23 04:19:00+00:00,ctd0b04,1,t3_3e7q7b,42523,movies
71,You ever heard of a charter school? Teachers at charter schools have two months to decide how and what they will teach in there subject.,2015-07-23 03:15:20+00:00,ctcy9nz,3,t1_ctcg4oq,28993,AskReddit
72,Oh my god this happens so often at my high school. I got a fast food job and I literally had to save for a year to get my car. But they get bran new cars . In fact I heard a kid complaining that his parents gave them there old Land Rover...... From 2012 . ,2015-07-23 03:05:57+00:00,ctcxy06,2,t1_ctchmeg,26377,AskReddit
73,They are mexican. Says it on the label.,2015-07-19 03:37:58+00:00,ct8bjgy,1,t3_3dsuki,1629,pics
74,Time to pretend by MGMT,2015-07-18 01:55:44+00:00,ct79tto,1,t3_3dn9kv,30309,Music
75,I think an hour short of full time is 39 hours not just one hour.,2015-07-15 07:29:28+00:00,ct3xius,12,t1_ct3xet1,405,WTF
76,"I swear I saw something that looked exactly like the batman from the aninated series in there , like right after the panda is shooting its gun.",2015-07-13 21:56:06+00:00,ct27g0c,1,t3_3d5z2r,6744,movies
77,"I was in it three years back. Got preety high up in the ranks , was even on the PoS podcast. I annoyed Lanza so he ended up blocking me. Then one day I made a catholic joke in a thread and Big Mike banned me for life. So I was wondering if it is still around or if it went downhill.",2015-07-13 03:13:06+00:00,ct1c3ec,3,t1_ct0vvkc,30460,survivor
78,I believe he did something for attack of the show. Bruce Greene was a producer and was shown on camera a couple of times. A lot of people that worked for G4 have become YouTube famous.,2015-07-12 18:29:41+00:00,ct0vd2l,7,t1_ct0o92e,14449,AskReddit
79,Remember when Kovic worked for G4,2015-07-12 07:00:42+00:00,ct0h6lm,5,t1_ct0fkur,4766,AskReddit
80,Cupception,2015-07-12 05:34:54+00:00,ct0ffmn,1,t3_3czdix,5429,Showerthoughts
81,How fucking dare you. LoZ is the greatest game series hands down! There is nothing wrong with it the definition of perfection! You are probably just a Sony or Xbox fanboy!,2015-07-12 03:32:10+00:00,ct0c5kn,2,t1_ct0bysz,404,AskReddit
82,They might think if they find a nice regular SO they might just have those feelings for them because there fans of them.,2015-07-09 00:33:03+00:00,cswusdj,1,t3_3cm901,341,Showerthoughts
83,The 90's didn't really end till 2006. ,2015-07-08 06:36:55+00:00,csvxut4,7,t1_csvd70x,37776,movies
84,"Hallelujah-Jeff Buckley version. The Wainwright version is great , but does not have as much emotion as the Buckley version.",2015-07-08 03:02:30+00:00,csvsajc,1,t3_3ci1ot,4090,AskReddit
85,I have an autographed poster of tony hawk. And I have been unable to find the poster itself on the internet.,2015-07-08 02:59:49+00:00,csvs7aq,1,t3_3ci32w,3243,AskReddit
86,The Safety Dance by Sleeping at Last,2015-07-08 02:54:13+00:00,csvs0ic,1,t3_3ci13n,3893,AskReddit
87,I like the console version more then the PC.,2015-07-08 02:51:03+00:00,csvrwk5,2,t1_csvq9cq,2881,AskReddit
88,Toy Story 2 on the N64 or ps1. First open world game I played and it blew my mind.,2015-07-08 02:45:26+00:00,csvrptf,1,t3_3ci2n7,2595,AskReddit
89,It's a trap. There tricking you into seeing a terrible Adam Sandler movie.,2015-07-08 02:34:12+00:00,csvrc14,1,t3_3chxn2,4415,gaming
90,Red Dead Redemption. I hated the fact that you couldn't swim. Ruined the game for me. ,2015-07-07 20:08:04+00:00,csvd84q,1,t3_3cfcxh,21984,AskReddit
91,"Then why, if they find any on you when they pat you down, they will not let you go into the concert?",2015-07-07 03:57:44+00:00,csumib7,2,t1_csumdgp,263,AskReddit
92,"I think the entire no means no campaign is a sham in western countries. Everyone I know think rape is bad. 99% of people in a westernized country think rape is bad. Rapists , when caught, go to prison. Yet there is giant fucking parades and anti rape protests. Why? Is the goal to get rid of rape? Most rapists have something mentally wrong, and that's not something that can be cured. I feel like the campaigns are headed by feminists that want a dominant female society. Do you know how many women falsify rape reports nowadays? They are teaching women that this is a huge problem in our country. I don't think it is. On a side note , the protests for country's that legally allow rape are totally cool with me and are not what I am talking about.",2015-07-07 02:41:16+00:00,csuk2i5,1,t3_3cbo1v,32712,AskReddit
93,"My ndad calls me selfish too. Like when i get upset that he or my nstepmom picked me up an hour or two late. Im being selfish , not them , apparently. ",2015-07-06 21:27:57+00:00,csu9cd2,2,t1_csu6432,4986,raisedbynarcissists
94,"My Ndad and Nstepmom blame my arguing and back talk for there marriage problems. When I get upset that they are doing this , they then tell me Im being a victim and need to grow up.",2015-07-06 21:26:11+00:00,csu9a27,1,t3_3cc5e3,6574,raisedbynarcissists
95,Alomodies I got some ballons and green chile for you- New Mexico,2015-07-06 20:49:50+00:00,csu7vq5,11,t1_csu5f8q,3751,nottheonion
96,"A cople of things happened at my highschool in the past year. First some girl had pepper spray and her friend sprayed it during class, and the local news was apperantley bored that day and reported on it. Link http://m.koat.com/news/pepper-spray-accident-causes-uproar-at-charter-school/32467394  Another inccident was when we tried to organize a nerf war. Teachers approved , but some parents complained. It was brought up at a board meeting, all my principal had to say about the subject was ""I want to know where I can find a nerf bazooka , and if its too late to sighn up"" . He joined us in the war.",2015-07-02 04:32:35+00:00,cspjjcp,1,t3_3bs922,34344,AskReddit
97,"Playing my ukulele helps me . My situation is kind of opposite . I live with my dad during the year. Me and him fight a lot , and i my stepmom doesnt like me at all. So we fight too . Afterwards i upset for maybe 30minutes and then im fine again. During the summer im with my mom and we dont really fight. Ive been with her for a month. And all of sudden i feel like i had a hige fight with my dad , nothing happened to trigger it though",2015-06-25 04:36:24+00:00,cshx81l,2,t1_cshx0px,459,depression
98,"So I really love demo disc. If a fan sent you horrible NES games and a retron, would you play it comically , and possibly turn into  show? Like AVGN , but actually funny?",2015-06-23 06:00:49+00:00,csfn32y,1,t3_3apilc,59862,funhaus
99,"Thank you , I'm definitely going to look into doing that.",2015-06-22 04:03:46+00:00,csega2t,2,t1_cseb9st,10864,personalfinance
100,"Im making about 600 a month . A cheap mobil home is about 450$ a month . That doesnt include utilities. I pay my gas , car insurance and phone , and thats around a 150$ a month.",2015-06-21 22:03:53+00:00,cse677e,2,t1_cse5sze,807,personalfinance
101,Loveblood by Sundara Karma sounded like an 80's song to me .,2015-06-19 19:54:45+00:00,csc7jjf,1,t3_3ae87q,28025,Music
102,Loveblood by Sundara Karma sounded like an 80's song to me .,2015-06-19 19:54:43+00:00,csc7jic,1,t3_3ae87q,28023,Music
103,The shooter needs to be found before he tries to kill again. They need to close all schools. ,2015-06-18 10:04:07+00:00,csajrar,1,t3_3a9n41,2337,inthenews
