,created,domain,full_link,locked,selftext,subreddit,title,url
0,2015-11-19 15:27:15+00:00,i.imgur.com,https://www.reddit.com/r/me_irl/comments/3tfxf8/meirl/,False,,me_irl,me🎓irl,http://i.imgur.com/lDnPX7F.jpg
1,2015-08-19 17:21:02+00:00,i.imgur.com,https://www.reddit.com/r/funny/comments/3hlvyl/the_world_is_an_unfair_and_cruel_place/,,,funny,The world is an unfair and cruel place.,http://i.imgur.com/EYhmFJx.jpg
2,2015-07-23 15:42:30+00:00,i.imgur.com,https://www.reddit.com/r/funny/comments/3ec1b6/contrary_to_popular_belief_feminists_have_always/,,,funny,"Contrary to popular belief, feminists have always had a sharp sense of humor.",http://i.imgur.com/pQaHGsn.jpg
3,2015-07-21 17:04:16+00:00,i.imgur.com,https://www.reddit.com/r/funny/comments/3e3anh/two_dogs_married_at_work_its_hilarious_that_this/,,,funny,Two dogs married at work. It's hilarious that this was allowed way before gay marriage was legal,http://i.imgur.com/EkKPl1R.jpg
4,2015-07-21 15:57:07+00:00,i.imgur.com,https://www.reddit.com/r/PoliticalHumor/comments/3e30yt/that_damn_illegal_aliens_you_wanna_to_stop/,,,PoliticalHumor,"That damn illegal aliens. You wanna to stop illegal immigration? So, when are you leaving?",http://i.imgur.com/sUq2a2y.jpg
5,2015-07-18 11:45:59+00:00,i.imgur.com,https://www.reddit.com/r/Bad_Cop_No_Donut/comments/3dq909/a_new_gun_control_proposal_in_san_francisco_would/,,,Bad_Cop_No_Donut,A new gun control proposal in San Francisco would force all sales of guns and ammo to be videotaped.,http://i.imgur.com/xQ43jqs.jpg
6,2015-07-18 08:05:51+00:00,i.imgur.com,https://www.reddit.com/r/funny/comments/3dpwaw/america_never_enough_mcdonalds/,,,funny,America: never enough Mcdonalds,http://i.imgur.com/sfVdPlp.jpg
7,2015-07-18 06:24:11+00:00,i.imgur.com,https://www.reddit.com/r/aww/comments/3dppge/the_cutest_police_officer_ever_i_can_only_wish/,,,aww,The cutest police officer ever ^_^ I can only wish there will be more cops like this in America,http://i.imgur.com/GG9or76.jpg
8,2015-07-01 08:35:35+00:00,i.imgur.com,https://www.reddit.com/r/PoliticalHumor/comments/3bqe70/and_i_stuck_in_the_middle_with_you/,,,PoliticalHumor,and I stuck in the Middle with you....,http://i.imgur.com/TWyeylN.jpg
