,body,created,id,nest_level,parent_id,reply_delay,subreddit
0,"So far I am just playing around with them but I really do like cold war, its great for splash damage and lobbing them though windows to clear a room. Only problem is that if one of your own team mates runs in front of you as soon as you fire you will blow yourself to hell an back!",2016-11-03 19:00:35+00:00,d9kd9ky,1.0,t3_5apgmb,111513.0,titanfall
1,damn man really love the work...oh and love the hat!!! reminds me of the hat I made that is currently too small for my head lol ah the joys of working with leather!,2016-10-25 18:24:17+00:00,d97cvuo,,t1_d95aml5,128823.0,chainmailartisans
2,I get my inspiration from a lot of place and yes I have seen the maille gallery and some of the pieces there are hell words describe how awe inspiring they can be...Though I am working more in leather of late then chainmail but have one top hat that kind of brings both my love of chainmail and leather together...oh and I do not cut my own rings..use to...said to hell with that and pay someone else to do the cutting a lot easier that way!!!,2016-10-22 11:39:13+00:00,d92xhnk,,t1_d8x1bzq,,chainmailartisans
3,These were scraps actually thought about stitching but tp be honest wife said the rivets would look better then stitching them and i have to admit i do like the look. The s eaps were peices that i honesty would not have used due to all the flaws in them,2016-10-08 18:53:59+00:00,d8jhxgk,2.0,t1_d8j8zke,13519.0,Leathercraft
4,"black socks, sandles, a very loud hawaiian shirt, black shorts and my very white..and I do mean blinding hairy legs sticking out from my shorts....oh wait that is my normal summer dress style..never mind go about your business!!",2016-10-03 05:40:34+00:00,d8bszhg,1.0,t3_55kf5j,28780.0,AskReddit
5,"That was the first time for me to try the angled punch for that normaly use vertical but liked the way it turned out and yeah it does get fucking crowded but that is what a fig is for, I will try the parallel lines next have something in mind to try and make a full leather bracelet, no metal what so ever.",2016-09-26 20:24:10+00:00,d834g7c,2.0,t1_d833bu7,1397.0,Leathercraft
6,Any time,2016-09-26 04:08:29+00:00,d828xsu,8.0,t1_d82231u,10943.0,Leathercraft
7,"Two things come to mind for this. First you could cover the back of the snaps and snap head with a little bit of leather so you do not have to make contact with the metal, though that is a little rough or you could make a leather button like what they use to use in old chaps here is a great video (not mine lol) on how to do this...https://www.youtube.com/watch?v=5azvy58pAEQ",2016-09-26 00:50:20+00:00,d821fxp,6.0,t1_d81w7v3,7765.0,Leathercraft
8,here you go https://www.tandyleather.com.au/en/product/line-20-snaps  you could use a line 24 snap as well just depends on how big you want the snap which boils down really to personal taste.,2016-09-25 22:29:59+00:00,d81vr6s,4.0,t1_d81upxu,1482.0,Leathercraft
9,Thanks,2016-09-25 19:42:12+00:00,d81o51n,2.0,t1_d81cx14,15682.0,Leathercraft
10,one simple line 20 snap cheated on the placement and used the design as a guide on where to place the snap after I had everything finished that way it was dead center and easier to place. I either use line 20 or line 24 snaps for all my bracelets. Tandy sells them rather cheap and a LOT of them.,2016-09-25 19:42:04+00:00,d81o4t9,2.0,t1_d81d0b0,15523.0,Leathercraft
11,That is really cool!,2016-09-25 09:04:19+00:00,d814u68,1.0,t3_54c55p,42079.0,Leathercraft
12,I would if I knew how lol but if you would like I can post the url to my website and the tote bag in question though I do agree with you about seeing tote bags as more female orinated but I have seen two guys so far carrying what I would consider a tote bag.,2016-09-13 10:27:29+00:00,d7kt11j,2.0,t1_d7koz4j,13939.0,malefashionadvice
13,nope and I honeslty do not think it needs it. Slides though the leather nicely and I honestly think that wax would ruin that feel but that is MPO. Really like how this stuff handles and I am honeslty surprised at it's strength as this is the first time I have ever used hemp.,2016-08-28 23:14:41+00:00,d70ivuq,5.0,t1_d70hxsa,1568.0,Leathercraft
14,"Thanks, its not the first project that I have hand stitched but this is the first tote bag at least I only have maybe 20 hours in all total of hand stitching in the tote bag I have made a messenger bag and that has 28 hours of hand stitching in it. The tote bag was WAY easier!",2016-08-28 19:10:51+00:00,d709dse,2.0,t1_d7013hz,12711.0,Leathercraft
15,I only use my pliers if I get stuck and can't pull it though. Other then that I just use my fingers which they really hate that lol.,2016-08-28 19:09:53+00:00,d709cdu,2.0,t1_d707rvb,2336.0,Leathercraft
16,I like the carriage thread but there is a difference between hemp and the waxed thread that I normally use. Mind you I am going to stick with the carriage thread as I like the feel and look of it. But with the waxed thread if you accidently run your needle though the thread you can still pull hard on it and the threading wont break. where as with the hemp if you run the needed though the thread and pull hard it has a tendency to SNAP even sounds like a snap when you break it. Other then that really love how it looks and feels,2016-08-28 19:09:13+00:00,d709bbx,3.0,t1_d701fa8,12061.0,Leathercraft
17,"Ok finally finished the project (family kept getting in the way joys of working in your own home lol) 

http://imgur.com/gallery/ywKx0",2016-08-28 10:30:21+00:00,d6ztif6,1.0,t3_4z5e95,440821.0,Leathercraft
18,"most welcome, what I would do is tell them it is thicker then a ""standarded belt"" as most belts tend to be around 6 to 7 oz once a while 8 to 9 but I think a ""standard"" belt tends to fall under the 6 to 7 oz. Just a thought for you.",2016-08-15 04:44:43+00:00,d6hy5rg,3.0,t1_d6hwj7m,3138.0,ArtisanGifts
19,"That is a pretty thick belt something that you might want to mention as a lot of people (that I am finding) are not aware of what 10 oz leather actually means, as I do leather work I understand it, great work by the way!",2016-08-15 03:48:00+00:00,d6hwdum,1.0,t3_4xmbi9,90423.0,ArtisanGifts
20,"I actually cut from the back side of the hide I find it easier as all products that I make are done by hand, no power tools are used at all. Though the dermal idea is a good one and hmm lacing honestly have not thought about using lace to hide the edges that is a damn good idea thank you for that one! Still really hate cutting stingray!!!

Oh and the marker trick works for the edges as well just did not use it this time around as this one was an experement",2016-08-10 19:07:59+00:00,d6c6z3z,2.0,t1_d6c1awt,6928.0,Leathercraft
21,scarry thing is I actually enjoyed it lol. Though might jack the price up a touch if I make another one.,2016-08-10 04:22:22+00:00,d6berv5,5.0,t1_d6b97e7,9221.0,Leathercraft
22,"Thanks and yep at 400 other wise it wont sell not that it has sold yet lol. The longest two times for this bag is the dry time for the dye work, and the sewing. Oh and make it easy on yourself...use square corners instead of rounded corners those are a bitch to stitch!!!",2016-08-10 01:27:25+00:00,d6b8clc,3.0,t1_d6b7pkm,936.0,Leathercraft
23,"Just showing this so you have an idea of sewing if you do it by hand like I do all my products. 

https://gibbinthegremlin.com/collections/messenger-bags/products/dark-brown-leather-messenger-bag 

I have 28 hours of hand stitching in this bag takes a while to get use to it but you can do it. As for leather weight I normally use 5 to 6 oz leather for messenger bags they handle a lot of abuse better with a thicker leather but I have seen a few people us 3 to 4 oz but that makes a softer flexable bag. ",2016-08-09 23:22:12+00:00,d6b37tm,1.0,t3_4wyivy,8088.0,Leathercraft
24,this was just something I was playing around with. And was going to go with a Mexican round braid but unfortinatly didn't have the length I needed in the roo lace ah well the double loop does give it a retro look doesn't it.,2016-08-06 20:58:23+00:00,d6720uo,2.0,t1_d671vk1,247.0,Leathercraft
25,false positive  just for the imagesofnetwork bot ,2016-08-06 19:00:23+00:00,d66xxmd,1.0,t3_4wfpnc,23158.0,ImagesOfMontana
26,"So tired of doing the right thing and having it bite me in the ass. Three major life events starting from 2000 I was run over by a car. The lady that mowed me down was a single mother of 4 kids, so I didn't sue her even though I was left with 250 grand in medical bills (long story madr short) she only had 25 grand of insurance after lawyer fees i was left with 14,800 which my family promptly ""borrowed "" most of it. 

 Second big event two years later my mother stole my check book and cleared out my bank account with her knowing i had written a check for 900 dollars which was the last of my long term disability check. This nearly ended up with me in jail for writing bad checks...only way i could get the money back was to sign an affidavit staing she forged my signature...which would have ended her going to jail..so of course i did the right thing and did not send her up the river.

Third event just recently told my good for nothing in laws that they could move in with the wife and myself after they got kicked out of their apartment for lieing about all the animals they had at the time (6 dogs 3 cats and 4 birds) this was suppose to be a short term thing a year and a half they are still here and sucking us dry of money...oh forgot to mention we had to bail them out money wise from some screw ups of theirs costing us a bit over 45 grand...cant kick them out do to inlaws wife is end stage kidney failure and i am too nice of a guy to put a dying woman out on the street no matter how much i want to...and no they are not paying rent to us on a regular bases and when they do they seem to think 400 a month is way more then they should have to pay...that wouldn't even get you a room here in Sydney Australia!!!

Forgot to mention also that A: the inlaws do nothing around the house other then sleep all day, the husband is a lazy so and so and to add to all that fun my wife is going though menopause that really helps matters!!",2016-07-25 11:42:43+00:00,d5punld,1.0,t3_4uf3nr,51945.0,AskReddit
27,"agreed its an underbust corset but each company will call it how ever it wants, and the gears are not glued on they are actually stitched in place so yes to both actually its steampunk and it could be considered Lingerie depending on the purpose this is worn for. Mostly though corsets are being used for two things, shapewear and outer wear now. ",2016-07-25 01:30:20+00:00,d5pf0kb,5.0,t1_d5pam1x,7116.0,steampunk
28,"This is why you wear a wide brimmed hat to stop yourself from smacking yourself in the eye with the whip! Worse place to accidently hit yourself with a whip is the back of the ear, that will make you swear like a sailor for  a good couple of days!",2016-07-25 01:19:47+00:00,d5pelpc,1.0,t3_4udydr,29768.0,funny
29,nice project and thanks for the idea,2016-07-23 22:05:04+00:00,d5o2hoz,2.0,t1_d5o29k8,383.0,maille
30,Thanks one day I hope to get it sold lol,2016-07-23 13:20:13+00:00,d5nl0ov,1.0,t3_4m35lz,4469449.0,wallet
31,Ok I was thinking that MIGHT be the case then tried go with just 5 scales on each row but started to go lopsided on me. Once I get to the desired length I will just assume that I stabilize the sides like you do with a normal long scalemail piece thanks for that!,2016-07-23 12:42:09+00:00,d5nk6gc,2.0,t1_d5niwha,4136.0,maille
32,I love the feel of stingray but man its a pain in the ass to work with! Especially to cut!,2016-07-02 02:05:52+00:00,d4w5ogh,2.0,t1_d4vxkbx,14265.0,ArtisanGifts
33,hmm good idea!,2016-07-01 20:09:22+00:00,d4vslan,2.0,t1_d4v8dgr,28403.0,wallets
34,"paint ball guns work wonders for that, either shoot the neighbor if they are on your lawn ""accidently of course"" or shoot the dog as it's about to crap. Really stops the dogs from crapping in your lawn, and before you whine about animal cruelty first paint balls are water based, second yes it stings but wont kill the dog, I have bene shot multiple times with paint balls and I am still alive to whine about it!",2016-06-27 10:46:20+00:00,d4pp2i8,2.0,t1_d4pf9rj,25265.0,AskReddit
35,See this is why I am not a dad..I would be taking pictures at the same time yelling RUN FOREST RUN!!!,2016-06-27 07:01:59+00:00,d4pkxuy,2.0,t1_d4p6eqb,25963.0,pics
36,am I going to hell for laughing?! I do not think KFC had this in mind but it might make a good commercial!!!,2016-06-27 04:39:45+00:00,d4ph4bp,1.0,t3_4q0d0f,18239.0,pics
37,The goal is to make a case that is stylish as well as protective because lets face it this stuff is not cheap and you do not want to drop it and have e juice every where or your atomizer broken (yes they can take some abuse but why chance it?),2016-06-24 22:18:37+00:00,d4mu7q3,5.0,t1_d4mu5ol,86.0,electronic_cigarette
38,I do not think hair ties would last that long,2016-06-24 22:17:11+00:00,d4mu5ol,4.0,t1_d4mroei,3729.0,electronic_cigarette
39,cool thanks for that!,2016-06-24 19:40:17+00:00,d4mnkiu,6.0,t1_d4m2igo,33084.0,Leathercraft
40,oh damn it you got me smacked by my wife because I was laughing!!!,2016-06-24 08:14:32+00:00,d4lzz4u,1.0,t3_4pjiaq,34393.0,funny
41,"I had thought of dropping the thickness down but the gear does need to be protected, if they were to drop the case with the 8 to 9z thickness should add a bit of padding to it, my niece in law vapes and she is always dropping that damned thing.",2016-06-23 19:42:19+00:00,d4l84cn,4.0,t1_d4l80lq,129.0,Leathercraft
42,hmm now that is a damn good idea might have to look into doing something like that even if it doesn't open all the way you could still get to what ever you needed.,2016-06-23 19:32:41+00:00,d4l7nnu,2.0,t1_d4l6j0z,1419.0,Leathercraft
43,"Yeah going to lose the straps everyone has brought up a good point that I had not thought of and that is the leather would stretch over time even though right now it's tight as heck, so going to go with an elastic band for the ejuice, but is two slots good enough because I might be able to make it so it would hold three",2016-06-23 19:31:18+00:00,d4l7l7i,2.0,t1_d4krw7g,19837.0,electronic_cigarette
44,"AH sorry about that thought the images might be a bit to much for reddit 
",2016-06-23 10:32:04+00:00,d4km8al,2.0,t1_d4kltcu,1380.0,electronic_cigarette
45,Hmm will have to give that some though at least a cloth pocket or two for the ejuices as making a pocket for the ejuice would be a small pain in the butt if its all leather!,2016-06-23 09:47:10+00:00,d4klg2t,2.0,t1_d4kla2n,608.0,electronic_cigarette
46,"hmm that is a good point as well, will have to look into that to see what material will work instead of the leather straps. Now how many spots for ejuice should there be? I thought two would be enough for a case like this.",2016-06-23 09:21:37+00:00,d4kl0vs,2.0,t1_d4kkjyz,1686.0,electronic_cigarette
47,I am not wasting dye on a prototype lol but the finished project would be dyed so that if you did spill any ejuice on it that shouldn't show up...hmm might have to experiment just to see what and if ejuice will stain leather dye or not!! Thanks for that idea,2016-06-23 09:20:11+00:00,d4kl00o,2.0,t1_d4kkecr,2148.0,electronic_cigarette
48,"Thanks it's just a really rough prototype that was running around in my head, would a zipper closure be better or a single strap with a snap on it?",2016-06-23 06:53:30+00:00,d4kib2r,4.0,t1_d4ki9b0,129.0,electronic_cigarette
49,how many extra batteries? already has two slots for extra batteries. ,2016-06-23 06:45:17+00:00,d4ki4ic,2.0,t1_d4khz13,417.0,electronic_cigarette
50,"hmm had not thought of the leather aspect might have to give that a go and see how it will look, as I do leather work as well I know which leather to use thanks for that idea.",2016-06-21 19:37:50+00:00,d4iecuo,3.0,t1_d4i8j9z,7242.0,chainmailartisans
51,yeah that be a bit of a pain in the rump best of luck with that one!,2016-06-21 19:37:20+00:00,d4iebzt,4.0,t1_d4hwjgm,24163.0,AskReddit
52,"I am SOO glad that my wife and I went in front of a justice of the peace, took a few photos at a local park then took all of our guests home for cake!!!!",2016-06-21 08:25:15+00:00,d4hrcu1,2.0,t1_d4hjaif,19450.0,AskReddit
53,damn I was drinking when i read that!! glad to know i am not the only business person with a cutting wit!!,2016-06-21 07:55:32+00:00,d4hquip,2.0,t1_d4hm0p3,12727.0,AskReddit
54,"There is a problem with this kind of thinking though, the noobie treadmill that is, it takes time to train someone new, I do not care how much ""experience"" the person has each job comes with its own twists and turns and it can take maybe a day or maybe a couple of months for a person to slot in right, in the mean time the job is not being done right, which then trickles down and out to other departments. There is something to be said about keeping experienced people to cut down on the actual lose that will cost the company money.",2016-06-21 04:30:03+00:00,d4hm7mh,3.0,t1_d4hciva,15621.0,personalfinance
55,"I like those really neat idea!
",2016-06-21 04:12:10+00:00,d4hloi0,1.0,t3_4p1a7l,21732.0,DIY
56,oh and if anyone has any suggestions on how to make it so this weave does not pull arm hair I am all ears!!!,2016-06-21 03:50:20+00:00,d4hkzu8,1.0,t3_4p2pfh,50.0,chainmailartisans
57,Thanks,2016-06-21 03:37:42+00:00,d4hkkw1,2.0,t1_d4gnlbg,46989.0,ArtisanGifts
58,"I use both Tandy's Eco Flo and Fiebings BUT I prefer eco flo for a couple of reasons, main reason is it's water based and safer to use around my dogs, if they get a hold of the fieibings it will really screw them up. Second reason I prefer it Eco Flo is that for me at any rate I seem to get better coverage then with the oil based dyes but that could be lack of practice on my part. Now keeping that in mind I LOVE Fiebing's ox blood!",2016-06-20 01:55:38+00:00,d4g2rgq,,t1_d4au90r,,Leathercraft
59,yep was going to suggest the rotary cutter only time I use one is for light leather makes it soo much easier!,2016-06-20 01:46:47+00:00,d4g2dfe,4.0,t1_d4f5u2x,66851.0,Leathercraft
60,"physical issues with leather working IF you hand stitch is your hands WILL end up hurting and thread will burn your finger joints..that stings like mad..oh and then there is the joy of slicing bits of flesh off with very sharp knives, not to mention even though the mallet may be made from raw hide still hurts like hell when you smack your thumb or finger instead of the metal stamp you meant to hit! oh and be ready for a sore back and neck from being hunched over while tooling and you forget what time it is or to move! but over all it's worth the pain I think.",2016-06-20 01:44:40+00:00,d4g2aez,1.0,t3_4or93j,88276.0,Leathercraft
61,Yeah Instagram seems to be a pretty good way to get people interested in your work I use that and facebook plus have spent a little money on my own webstore as well as etsy. Customers are slow but it does take time.,2016-06-20 01:37:16+00:00,d4g1zhc,2.0,t1_d4djx8n,189244.0,Leathercraft
62,well I will be blowed!! I am going to give that a try because working with waxed thread the thread always comes unknotted and the needle slips free a lot of times and since I do everything by hand that is going to be a really handy tip!!!,2016-06-20 01:29:18+00:00,d4g1nua,1.0,t3_4ojgqp,212632.0,Leathercraft
63,oh and for those not in Australia birdsall ships international and they handle all the paper work! Give them a call if you want some really good roo hides...I have not gotten any veg tan from them as I use Tandy for that. ,2016-06-20 01:26:26+00:00,d4g1jna,3.0,t1_d4g1fgm,173.0,Leathercraft
64,I have used birdsall-leather for all of my roo hide I really like the people there and their prices are great! They ship via Itoll and they are quick,2016-06-20 01:23:33+00:00,d4g1fgm,2.0,t1_d4e96jf,129212.0,Leathercraft
65,"Amazing I have made a couple of corsets myself I would not have tried to butt end the joins on the corset great way to cover that up as well!
",2016-06-20 01:16:44+00:00,d4g15ca,1.0,t3_4otmdk,37037.0,Leathercraft
66,"its a dark brown eco flo antique gel, I just applied it once then hit it with water in certain spots to lighten it and left other parts dry. The other part is the way the tooling was done, going lighter then heavier with the beveler",2016-06-15 19:49:44+00:00,d4amd9b,2.0,t1_d4airsw,4405.0,Leathercraft
67,Thanks it came out better then I thought it would and have an idea for the next one on how to improve the over all design which I will be making more then likely in a couple of days.,2016-06-10 20:49:08+00:00,d444j4k,2.0,t1_d43stkk,15665.0,Leathercraft
68,"I will use myself as an example here to make a small point about the bankruptcy as well as on medical bills in general. In 2000 I was living in Georgia (usa) and was walking home when some twit of a woman ran me over with her car while she was doing 65mph.  I got screwed all the way around. My left leg was shattered in 12 places, right knee blown out, thrown though a barbed wire fence that cut me in the middle of my head...bruised lung and kidney, major circulation damage to my legs. 

 I now have two rods in my left leg, a large pin in my left hip, a steel plate in my right knee and I did suffer some brain damage, long term and short term memory has some big holes in it, and a few other odd things such as I can not jump any more...I technically know how to jump but when I try the brain just says nope don't know how to do it.

Now none of this was my fault, and the lady that hit me only had basic insurance. At the time that was 25,000 dollars. I did have blue cross blue shield health insurance though work. Now here is where the kicker is. It cost some where around  250,000 US dollars to put me back together again. Now Blue cross blue shield paid only 50 grand of the total hospital bill then fought me for two years on getting back that 50 grand because they said since it was not my fault they should not have to pay.

I did not sue the lady that ran me over as it would have been useless and oddly enough wrong in my eyes because at the time of the accident she was a single mother of 4 young kids. And I like to sleep at night with out my over active conscience bugging me. My pond scum lawyers took 40% of that 25k(never type when you are tired added an extra 0 to that doh...wish it had been 250k but nope only got 25k as a settlement never ever get run over in Georgia you will get screwed!!!).  By the time everything was said and done I was left with about 14,800 in settlement money...and ALL yes you read that right ALL medical bills left to pay because they were in my name. 

I lost my job 3 days after the accident as Georgia is a no fault state, (which means that the factory could fire me for any reason and the reason  they used and I quote ""he can no longer physically do the job) they even had to life flight old humpty dumpty to South Carolina where at the time you could not declare bankruptcy due to medical bills in that state. Yep see that is the kicker some states will not let you declare bankruptcy to avoid medical bills.

after 10 years it actually disappers off your credit history, 7 years it goes off but its still under written for 3 years after that. Medical bills can actually play a huge role in if you get say a car or house loan. So what  John Oliver  did for those people was take a huge load off them not only from getting hassled and trust me debt collectors really do hassle you but he gave them something that is very hard to get back...piece of mind.

For YEARS (10 to be exact) I still had debt collectors calling me and trying to get back money that the hostpital had already written off",2016-06-07 08:26:32+00:00,d3z7zfh,10.0,t1_d3yquit,31950.0,explainlikeimfive
69,Thanks,2016-06-01 21:38:04+00:00,d3saed8,2.0,t1_d3s9ykp,606.0,wallets
70,and yes by the way also on leatherwork.net under Windrider30,2016-06-01 19:10:24+00:00,d3s3ooo,3.0,t1_d3s3me9,83.0,Leathercraft
71,Hello hehe hate to disappoint you but I am a yankee living in Australia lol plan on dieing here though and the wife says if I keep being a smart ass to her it may be sooner then I think!!!,2016-06-01 19:09:40+00:00,d3s3ng7,2.0,t1_d3rszan,13878.0,Leathercraft
72,"yes I am on Instagram or you can check out https://gibbinthegremlin.com/collections/wallets/products/black-leather-biker-wallet

that is my company I am TRYING to get off the ground (the pounding sound is my head against the desk if you are interested )

Instagram account is:under the same name of gibbinthegremlin",2016-06-01 19:09:01+00:00,d3s3me9,2.0,t1_d3rqzyq,16649.0,Leathercraft
73,"Most welcome and as for ""stealing this part"" I have used kangaroo hide for the braiding not sure how any other leather will hold up to the pressures that are put on the chain. Here is the source that I use for my kangaroo hide. http://www.birdsall-leather.com.au/ they are based in Australia but ship world wide..and no I am not affilated with them they are just my go to source for roo hide (as I live in Australia) any other questions feel free to ask.",2016-06-01 00:00:50+00:00,d3r39i9,2.0,t1_d3r1yj5,2045.0,Leathercraft
74,"Not the best of photos, the kangaroo hide is kind of a pain to take photos off later in the evening due to the camera flash reflecting off the hide. But it does have 5 slots for paper notes and what not, as well as 3 card slots for cards",2016-05-31 19:40:27+00:00,d3qs7w6,1.0,t3_4lx2yt,75.0,somethingimade
75,ugg no references that I do not know that makes it so that I have to go and look this person up and then get hooked on another author LOL,2016-05-26 07:29:09+00:00,d3k65cs,2.0,t1_d3k63pg,146.0,somethingimade
76,I have another wallet that is a bikers wallet but hmmm this style may just work a bit better for that. THANKS for the idea had not even thought of that!!,2016-05-26 03:13:10+00:00,d3jzdki,2.0,t1_d3jz9bs,189.0,somethingimade
