,body,created,id,nest_level,parent_id,reply_delay,subreddit
246,"I use a large tin myself but I like that, the tin holds everthing from my thread, to some lacing to both lacing and leather needles. But that is a cute little roll",2015-09-15 23:10:33+00:00,cv2wo8o,1.0,t3_3l2axt,21602.0,Leathercraft
247,"Very nice if you want to try to make an interesting pocket (one that I use for a coin purse as it holds a bit more) you can basically make an upside down T. http://gibbinthegremlin.tumblr.com/image/129108670390

Ignore the writing as it is just scrap that I had, what you do is measure what you want to hold, say a business card or four, you measure the item height wise, then double it plus add any where between 2 to 5 inches more for the flap, because you are basicly going to fold the sides in of the T and then fold all of that upward., then simply stitch it all together. Makes for a good coin purse or you can do something like this 

http://gibbinthegremlin.tumblr.com/image/129108955455

the possibilities are endless really. .",2015-09-15 00:14:13+00:00,cv1rkkt,1.0,t3_3kqn92,163676.0,Leathercraft
248,The real difference between burning a design and tooling a design is with tooling you get a more 3d look where as burning yeah you get a little bit of a 3d look but its not as detailed or crisp as tooling.,2015-09-15 00:03:42+00:00,cv1r75b,1.0,t3_3ktuiv,96881.0,Leathercraft
249,"Extra virgin olive oil is great to have, some times easier to get then neatsfoot at least for me. A good Aussie leather condisner is what I use (made by Fiebings) for that extra coat IF something is going to be outdoors and get banged up by the weather and what not..Oh and for when you start to slick your edges you can use water but recently I have been using Gum Tragacanth and I can tell a huge difference between using water and using the gum I get a really clean smooth edge with gum over water, a bit less work as well.",2015-09-15 00:01:51+00:00,cv1r4te,1.0,t3_3kttrt,97095.0,Leathercraft
250,nope there  is no less durable for natural veg tanned then say something like Horween as far as I have seen so long as you keep it in good conditions it will last just as long as a Horween will ,2015-09-14 23:58:35+00:00,cv1r0mc,1.0,t3_3kya2e,14201.0,Leathercraft
251,most welcome its something that I just kind of discovered myself after handing sewing (I hand sew everything no machines are used in my productions ) 3 and half feet worth of strapping for a messenger bag.,2015-09-14 19:46:33+00:00,cv1hoio,5.0,t1_cv11dmn,28742.0,Leathercraft
252,"Yep small anvil will help massively just rip the old portion out and set in a new snap , small anvils can be rather cheap if not use the corner of a desk or something firm that you can slip inside the holster to help set the rivet/snap",2015-09-14 11:23:20+00:00,cv10ydy,1.0,t3_3kqz5a,110512.0,Leathercraft
253,"There is a small trick to saddle stitching that I do and it works great, mind you this is for bigger projects but, start your saddle stitch as you normally do, I normally go about 4 to 6 holes, then once you have a needle on top and bottom of your project start on the top and do a running stitch, go about 4 to 5 holes, flips the project over and do another running stitch to the last hole you stopped at, then pull tight and start it gain. Works great and makes the stitching go quicker.",2015-09-14 11:20:06+00:00,cv10wk0,3.0,t1_cv02dc8,71369.0,Leathercraft
254,Mad props to you mate boot making is a SMALL interest of mine but it looks like a ton of work!!!,2015-09-14 11:18:30+00:00,cv10vkz,1.0,t3_3ksdo7,73631.0,Leathercraft
255,"Personally I just use a pair of wubber needle nose pliers in the left hand and a pair of wubber flat nose in the right, I do not bother with a jump ring any more as after a while you find those just slow you down a bit. Oh and a towel..keeps the rings from flying every where when I drop the pliers (hands let go of things that I am holding at random times due to head injury from being run over by a car) Of course I only work in aluiminum, sterling silver, gold so light material ",2015-09-10 11:24:43+00:00,cuwmp1y,1.0,t3_3jpksx,455422.0,maille
256,"I never take offense to anything someone says, I have very thick skin, and I use tumblr over imgur but tumblr of late has been a pain in my ass with linking to the right pic for some reason.",2015-09-10 08:17:09+00:00,cuwkcw8,2.0,t1_cuwihc3,7273.0,somethingimade
257,"For me it is Gibbinthegremlin's B.E.S.T Chainmail and Leather goods. 

Gibbin is a gremlin's name in a book that I am writing, and it also pays homage to my redneck ways just check out www.gibbinthegremlin.com if you want to see.  Now the only pit falls you have to worry about is that if someone else has your own name already... Also selling on Etsy takes a little while, hell selling on a platform like Shopify (which is what my store is using, and I am selling on Etsy under the same name) or Etsy or even Amazon takes time to get people to come into your store. And know this, the leather market is pretty full with other people selling the same products as you might so you have to learn to make your store stand out.",2015-09-08 20:03:16+00:00,cuus9ir,1.0,t3_3k3j44,20077.0,Leathercraft
258,"I do not know about that pic, but its a good start personally I use 3/4 oz leather for wallets as it keeps the bulk down, watch straps I do the same thing with.",2015-09-08 19:54:25+00:00,cuurwrq,1.0,t3_3k3n48,17724.0,Leathercraft
259,Ahvyes belt will be finshed to day had to shorten i Rd a bit my math was a tad off,2015-09-08 00:33:40+00:00,cutxj5p,5.0,t1_cutrlss,13909.0,malefashion
260,"sorry brain is dead of late (hand stitching a leather messenger bag, with a 3 and a half foot long cross body strap fries the brain a bit) what is a fit pic?",2015-09-07 20:23:37+00:00,cutr64s,3.0,t1_cut3vqp,61484.0,malefashion
261,Just finished my first leather messenger bag. Hand sewn a friend is going to beat the tar out of it over the week to see how it holds up plus give me ideas to improve on it. One idea he mentioned was putting a pocket on the side gusset to hokd calling cards.,2015-09-07 10:29:09+00:00,cutbz6j,1.0,t3_3jy9xj,7008.0,Leathercraft
262,"Now if you really want to see something tack..and this I freely admit to is tack, but I figure I walk with a cane (due to being run over) and people stare at me all the time, I might as well give them something to look at! This is a waist cinch belt:

https://instagram.com/p/7PMcmYpuOW/?taken-by=gibbinthegremlin",2015-09-06 22:52:52+00:00,cuswfgy,1.0,t3_3jw4z0,9201.0,malefashion
263,"That is why I made it...that and to be honest had the spikes laying around so said what the hell...just need to file the spikes down just a tad because I have actually made myself bleed once when I smacked my side, did not have the bracer tied that tie and it and slipped to the side...taught myself two things..A: Lace tighter and B: file the damn spikes down just a touch!!",2015-09-06 22:46:47+00:00,cusw8zu,2.0,t1_cusvq5h,1064.0,malefashion
264,"Ok not trying to sell this to anyone but this does link straight to my website simply because tumblr is being a pain today. But as savagepunkstuido said vegtan leather does not need boning in it to hold it this: http://www.gibbinthegremlin.com/collections/corsets-2/products/steampunk-brown-leather-corset 
was made from 4 to 5 oz leather and it holds up nicely to even tight lacing. ",2015-09-06 20:26:02+00:00,cusryhz,1.0,t3_3jt72p,68103.0,Leathercraft
265,Agreed veg tan leather does not need boning or stays as it is thick enough and man oh man this is some great tooling!! ,2015-09-06 20:21:40+00:00,cusrtfk,1.0,t3_3jt72p,67841.0,Leathercraft
266,"Thanks one of the easier weaves for me to do, people have problems with the weave itself but once you get use to it, its not bad.",2015-09-06 02:22:18+00:00,cus3vr6,2.0,t1_curzema,9272.0,somethingimade
267,Thanks for the info Cinnibar!!,2015-09-05 13:24:33+00:00,curh20t,4.0,t1_cuqvy3w,58074.0,maille
268,"Vinageroon is a home made chemical change in veg tan leather, you make it with white vinegar and steel wool  the mix turns veg tan leather black, but with a resist such as super sheen on it, as you can see the resist does not stop the vinageroon as it just changes the leather from underneath",2015-09-05 11:11:52+00:00,curexnz,2.0,t1_cur09zo,42205.0,Leathercraft
269,"First pull it as tight as you can get, once that is done, before burning the thread hammer the hell out of the stitching, it will actually flatten it a bit more to where it is not noticieable, then burn the stitch",2015-09-04 20:48:00+00:00,cuquwlp,1.0,t3_3jlezs,45002.0,Leathercraft
270,"if the batch is brittle how does that effect the end product? I mean if a couple of twists can snap them how do you actually tell and not just put it down to one or two bad rings, which we all get no matter who makes them.",2015-09-04 02:14:24+00:00,cupzy2u,2.0,t1_cup9sz6,42013.0,maille
271,"hmm good idea, will have pictures of the finished project some time during this weekend (screwed up some of the tooling so have to do it again doh..when working with two halves of a project make sure you know which way is up when dealing with leather!!!)",2015-09-03 21:28:23+00:00,cuppzwv,2.0,t1_cupew38,16913.0,corsetry
272,going to have to think of a more masculine name then waspie lol will have pictures of it come Saturday/sunday ,2015-09-03 12:31:57+00:00,cup66jo,1.0,t3_3jg6wa,30323.0,corsetry
273,"&gt; waspie
Very close actually ",2015-09-03 09:45:08+00:00,cup3hoh,2.0,t1_cup34fq,1765.0,corsetry
274,I haven't had much luck with Chicago screws to be truthful they are always hard to get to lock in place and anything on the other end still tends to spin a bit to easily.,2015-09-02 08:16:45+00:00,cuny5yx,2.0,t1_cunwgpu,6682.0,Leathercraft
275,"500 for advertisement (trust me goes quick)
As I do everything by hand, no need for sewing machine
500 more stamps and better figure carving stamps such as vieners and all that good stuff
1000 on Dyes  and needles as well as threads
rest goes towards leather different kinds of hides 
",2015-09-01 23:06:42+00:00,cunk5pb,1.0,t3_3j9p9w,7612.0,Leathercraft
276,"I suck at drafting lol had given it some thought, I have found something that I think I can use its a so called "" mini""  corset, have some ideas and will share with you the end product.",2015-09-01 22:40:22+00:00,cunjdsi,4.0,t1_cuni58e,2174.0,corsetry
277,"Ahh good to know thank you for that, saves me from experimenting on more scrap, I have to many ""experments"" running around here as it is!",2015-09-01 21:48:34+00:00,cunhk7n,5.0,t1_cunehbo,4774.0,Leathercraft
278,The other thing that I will say is that I think his asking price for a full finished bag is a bit high..if you look on Etsy you will see its going for around a grand Australian which is still a tad expensive personally I am thinking of selling the bag for around 250 to 300 haven't figure it out just yet.,2015-09-01 20:25:27+00:00,cunec5x,2.0,t1_cumzbwj,24167.0,Leathercraft
279,"Ok I have heard about giving the leather a ""soda"" burn what the hell is that actually?",2015-09-01 20:09:07+00:00,cundos5,3.0,t1_cun269e,17423.0,Leathercraft
280,Thanks I have seen this one and its about the only one that I have seen on the market though everyone is selling it as a physical item I would prefer something that I can download.,2015-09-01 20:08:39+00:00,cundo51,2.0,t1_cumx3bf,29565.0,corsetry
281,Yep its the Leodis pattern very well worth the money and no the gussets were really easy to do. The thing I like the most is the way the D-rings are attached I really like the arrow design. I am thinking of making another one but this time making it just a little bigger.,2015-09-01 20:07:28+00:00,cundmf8,2.0,t1_cumzbwj,23088.0,Leathercraft
282,"I let my batch go for two weeks, keeping it in the sun light when I can and I seem to get a nice dark shade of black off it, though I do not dip it I use a brush to brush it on lightly as you really do not need a thick coating unless you want both sides. I find that the smell doesn't seem to last as long as a week, more like two or three days. I have yet to use the bicarb but from my understanding by using the bicarb you will actually stop the piece from going darker as it stops the acid..as well as supposably helps with the smell will have to try it later.",2015-09-01 10:46:06+00:00,cumvv88,1.0,t3_3j66g7,27800.0,Leathercraft
283,"here you go just uploaded a few more photos of the bag

http://gibbinthegremlin.tumblr.com/",2015-08-31 20:58:10+00:00,cum99uy,1.0,t3_3j4krq,3075.0,Leathercraft
284,that is what I normaly do when working with a new metal buy a LOT of it because I KNOW I will be breaking and swearing a lot until I get the hang of it!,2015-08-31 20:49:18+00:00,cum8xbw,6.0,t1_cum7ist,2104.0,maille
285,I will have more posted up in a little bit. Still have to make the shoulder strap..then thinking of putting it up on my website and etsy both for maybe around 200,2015-08-31 20:47:30+00:00,cum8uqi,2.0,t1_cum7o4x,1776.0,Leathercraft
286,if Ti is anodized how well does the coating handle?,2015-08-31 20:03:17+00:00,cum7339,4.0,t1_cum6zeh,154.0,maille
287,"Ah cool thanks for the pointers I have never worked with it before and just know that some metals act differently at different sizes, like sterling silver, at 20g its easier to bend then BA at the same gauge. Did not know about the springback on titanium think I might just avoid using it for delicate things like the necklace!",2015-08-31 19:56:14+00:00,cum6svv,2.0,t1_culsgiw,22726.0,maille
288,It holds up very well actually stronger then it looks. But at an even lower id then what I used it would be VERY flimsy as I hate using 14k gold at lower ids hurts my hand and my eyes actually!,2015-08-31 19:51:46+00:00,cum6mht,2.0,t1_cum1jzi,7597.0,maille
289,Most welcome just know that Argentium Silver is actually a little stronger then sterling as well which means its just a hair harder to bend.,2015-08-31 02:50:35+00:00,culfdsb,3.0,t1_cules7s,1090.0,maille
290,Very nice and if you really want the bryzintine or how eve ryou spell it lol to stay in shape look into using Argentium Silver  its actualy still sterling silver but a tad heavier as well as holds against tarnish a lot better and just a touch brighter will really make it pop,2015-08-31 02:17:24+00:00,culeail,1.0,t3_3iza3v,28899.0,maille
291,Yeah tell him to set up a site on etsy or ebay and just see what happens I think those are cool as hell,2015-08-31 00:20:10+00:00,culaib4,1.0,t3_3iyalm,40125.0,somethingimade
292,looks good I have yet to figure out any of the viper weaves they do my head in for some reason!,2015-08-28 20:38:48+00:00,cuj1nk2,1.0,t3_3imwl6,90385.0,maille
293,for sterling silver as well as 14k gold real easy to clean it...soft tooth brush and tooth paste then just rinse off,2015-08-26 11:23:06+00:00,cug4u8h,1.0,t3_3awctz,5480504.0,maille
294,I asked her and she does not sell the wire itself. ,2015-08-26 04:18:51+00:00,cufxe92,4.0,t1_cufik6g,25973.0,maille
295,would that work with antique gel? As that is what I used for the brown,2015-08-26 03:43:02+00:00,cufwdd7,4.0,t1_cufvus5,1023.0,Leathercraft
296,what do you mean by graining the stain? Always looking for more information,2015-08-26 03:16:54+00:00,cufvkfq,2.0,t1_cufu0e9,2816.0,Leathercraft
297,"Ah cool did not know that it was brittle learn something new every day, thanks for the info, how does it preform when its smaller links..sterling silver acts a little strange, if you go with say a 20g 5/32 id it bends a LOT easier then aluminium does yet go in higher gauges the stronger it gets.",2015-08-25 21:47:53+00:00,cufk4ff,4.0,t1_cufj1h9,1749.0,maille
298,"I would say that the gauge of the wire is at fault here. I have run into this problem before with sterling silver as well, the gauge may be 16g but if you look at...just as an example..16g BA the sterling may say its 16g but its thicker then 16g BA.",2015-08-25 20:37:47+00:00,cufhft0,1.0,t3_3hxo55,317731.0,maille
299,I have a supplier in Australia that deals in Aregentium she hats cutting the stuff if its small links though.,2015-08-25 20:12:26+00:00,cufgfke,2.0,t1_cuff3id,2016.0,maille
300,I do not have a supplier for Titanium how well does that work?,2015-08-25 20:11:59+00:00,cufgew6,2.0,t1_cuez26p,28696.0,maille
301,personally I hate stainless kills my hands and I don't even make my own links!!! my hat goes off to you for being able to work in it!!,2015-08-25 20:11:28+00:00,cufge5p,2.0,t1_cuf9h9u,10340.0,maille
302,"Well I have almost 500 in material alone in that as for if people are willing to pay it, not yet but I am using it more as a window piece for my store. Drags a lot of people into the store when they see the piece ",2015-08-25 20:09:58+00:00,cufgc1m,2.0,t1_cufe1mj,3441.0,maille
303,"Yep I agree drop the ring size dwon to 1/4 or lower and it works really well anything over 1/4 and it just wants to fall apart, even the 16g 1/4 id can fall a little just ease to snap it tight and it fixes itself",2015-08-25 10:13:44+00:00,cuex1ip,1.0,t3_3hdy4c,637988.0,maille
304,"Well most of my friends think I am insane lol so they run when I want to use them as an ""experiment"" wasn't my fault the last experiment had them screaming for water...ok ok..using ghost peppers in the chilli that already had cayenne pepper in it might have been a bit much...still...they are a bunch of sore heads. Yes I am looking into doing the Foundations revealed sub though I do not use cloth I am pure leather. Also you are right about the duct tape issue but for now it lets me see the design a lot better. Also with the underbusts those are a bit less specific then a full corset.  So I can get away with it a little I think. ",2015-08-25 05:55:45+00:00,cuet4o7,4.0,t1_cuesxe9,624.0,corsetry
305,"Thanks all going to make a chainmail hat band for this as well, I don't do the google thing since I wear glasses already and googles and glasses just don't mix well lol.",2015-08-25 05:43:08+00:00,cuesvs6,1.0,t3_3ia1pn,14293.0,somethingimade
306,"My ""Goal"" is to be able to handle all sizes not just the slim side of things, big girls look just as hot as the skinny one's do in a corset but I find that there doesn't seem to be a lot of so called plus sized corsets, or if there are the s.o.bs want to charge way more then is needed. Thanks for the idea and info!",2015-08-25 05:42:15+00:00,cuesv6b,2.0,t1_cueqcix,6164.0,corsetry
307,"Thanks I am aiming more in the so called plus size range, from 35 inch waist to even have one that is in the 40 inch waist, have one that is  39.5 inch ( 101cm ) bust, 30.5 inch ( 77cm ) waist, and 40 inch ( 102cms ) hip the smallest one that I have made to date is  36-28-36 that one came out ok but its rather small. Just gives me a few ideas of what waist I may be shooting for or what is ""popular""  right now the lowest waist that I can go is 30.5 inches as I use the duct tape method when drafting (easier for me to see then just on a piece of paper)",2015-08-25 01:09:28+00:00,cuekk2t,2.0,t1_cuec0l2,14379.0,corsetry
308,"I have the pattern but to be honest do not like it as there is little way of help when it comes to putting it together, not to mention I work sololy in leather. And a neck collar can do one of two things, A: it can be for looks or it can be used as a posture collar, away to keep the head and chin up.",2015-08-24 19:44:32+00:00,cue8kw1,1.0,t3_35kp0y,9115393.0,corsetry
309,If it is for waist training was going to say you actually need two sizes smaller than your natural waist size. As its just for fashion I would stick with your normal size. You could contact the store and see what they say. As for stores that sell corsets on Amazon sadly can not help you there. But when you do find a store I would suggest getting in touch with them and asking them about their sizes.,2015-07-01 22:14:39+00:00,csp7lro,1.0,t3_3bouf2,83547.0,corsets
