,body,created,id,nest_level,parent_id,reply_delay,subreddit
77,"its a bi fold not a tri fold and both men and women find my website and I do have it on etsy as well, still not ovelry sure which market would be a better fit for the wallet.",2016-05-26 00:04:54+00:00,d3jsbk1,1.0,t3_4l2alz,4994.0,somethingimade
78,"one thing that I really do find interesting about a male corset is that you can change the shape of the body simply by measuring two inches above the natural waist, draft it at the waist and it will give a guy that V line mascuinle look do it two inches above the waist and the corset will give the guy a female look",2016-05-18 19:44:31+00:00,d3an4f8,4.0,t1_d3amxyn,213.0,Leathercraft
79,or if the corset is actually designed to force the male body into a female shape which this corset is not designed to do that.,2016-05-18 19:40:58+00:00,d3amxyn,3.0,t1_d3amwd0,53.0,Leathercraft
80,"Yep it does fit very well better pictures coming later in the day of how it fits. And a male corset is not as curvy as a woman's corset, unless you are actually use to tight lacing, which I am not, I only have a 4 inch waist reduction on this, and a lot of gut lol",2016-05-18 19:40:05+00:00,d3amwd0,2.0,t1_d3ahka9,6763.0,Leathercraft
81,"Thought of another thing, when putting the corset together, I dye the front of it, let the dye dry then soak the hell out of the back of each piece as a few panels will actually have to bend three different ways.",2016-05-16 21:20:19+00:00,d37zgog,2.0,t1_d35yvt7,149689.0,Leathercraft
82,Personally I simply tell them that all prices are firm. I have yet to have anyone try to continue to push for a discount once I have told them that all prices are firm. ,2016-05-15 09:23:57+00:00,d365u8l,1.0,t3_4jdkua,37106.0,smallbusiness
83,Also here is a good article but you do have to join the site but it does have a lot of really cool tutorials as well http://foundationsrevealed.com/index-of-articles/corsetry/corsetpatterns/158-corseting-the-male-form  though this article is a little confusing.,2016-05-15 08:10:19+00:00,d364oav,3.0,t1_d364ngt,91.0,Leathercraft
84,"I am following this tuitorial http://xystitch.tumblr.com/post/12052284416/corset-pattern-drafting-tutorial  now one part that is not explained that I had to kind of figure out is that he talks about 5 vertical lines, was trying to figure out where he was getting those line. Well those lines are how many panels you have, simply divide your bust line by the number of panels you want (like in the example and the corset that I am doing 5 panels each side) this way you know how wide each of your panels are.",2016-05-15 08:08:48+00:00,d364ngt,2.0,t1_d35yvt7,15798.0,Leathercraft
85,"All of this has been done by hand, as all of my products which some times takes a lot of man hours to finish but the end product is so worth the wait!",2016-05-11 21:42:33+00:00,d31vrwv,1.0,t3_4ixb8h,103.0,ArtisanGifts
86,That is really cool! love the work!,2016-05-06 08:21:31+00:00,d2uws71,1.0,t3_4i1pgf,44084.0,Leathercraft
87,Really like this!!!,2016-04-25 21:21:17+00:00,d2h2tkf,1.0,t3_4ge5mj,16858.0,pics
88,"Thanks only the second time I have used this style, normally when it comes to leather messenger bags they tend to be a bit square as it makes it easier to stitch this has no square edges on it, the friggin corners were and are a night mare but will freely admit I am sick enough to enjoy the challenge that this poses",2016-04-25 20:48:27+00:00,d2h1bzq,2.0,t1_d2h0xr7,503.0,somethingimade
89,28 hours worth of hand stitching yes,2016-04-25 19:55:30+00:00,d2gytvl,2.0,t1_d2ggszv,24764.0,BuyItForLife
90,The reason its better is that MOST people that hand stitch leather will use a saddle stitch. (depending on the thickness of the leather some times the really thin stuff you can not use a saddle stitch)  its also called the double needle stitch. What makes it actually better then a normal machine stitch is that the thread is doubled though each hole so that if the unlike the lock-stitch the thread should break the whole project will not suddenly start to unravel as you pull at that one little piece of string sticking out. ,2016-04-25 19:55:19+00:00,d2gytjd,2.0,t1_d2ghqcz,22943.0,BuyItForLife
91,As for the fraying at the end of the stitch were you A: using a waxed thread and b: did you cut as close to the leather that you could and C: did you melt the thread once you cut it to stop it from fraying. you could have accidently punched though the thread with the needle if you did it by hand. Which will weaken the thread and cause it to break or frey,2016-04-25 19:51:51+00:00,d2gynr5,3.0,t1_d2gl4hk,17489.0,BuyItForLife
92,"Correct that the saddle stitch, which is what I use for all products is actually stronger then a lock-stitch that a sewing machine uses. As for how long the stitching will last that particular bag I have made in the past for a friend, and after 4 years the stitching still is holding up. The other reason that I do everything by hand is a matter of choice, yes there are special (and you need a special one) sewing machine for leather but for some projects you simply can not use a machine as it will not bend the curves right, for straight sections yeah you could but once again it will only use a lock-stitch",2016-04-25 19:50:35+00:00,d2gylmu,3.0,t1_d2gpjmn,11691.0,BuyItForLife
93,nice use of the helm design and the ribbon!,2016-04-23 21:53:35+00:00,d2ep85n,1.0,t3_4fy4lo,121934.0,somethingimade
94,These I would be selling myself!! That is cool!!! What material did you use?,2016-04-23 21:02:27+00:00,d2enhs3,1.0,t3_4g4vaz,5862.0,somethingimade
95,I really like that!,2016-04-23 21:00:57+00:00,d2enftb,1.0,t3_4g1pz8,66530.0,somethingimade
96,after being run over by a car because some stupid woman was doing 65 mph on a wet road you do not do 40 on when its dry...I double check before I cross ANY roads!!!,2016-04-18 01:45:11+00:00,d270ik9,1.0,t3_4f8202,22691.0,Showerthoughts
97,cool thanks I really did not think that they would truly fall under the category of a corset but just wanted to get other people's advice as I have one up for sale on my website pics here are on imgur http://imgur.com/a/RP3Ps and felt it was more of a belt then a corset. And it could have some similariest to a back brace just did not want to stick it into the wrong category really.,2016-04-18 01:25:55+00:00,d26ztcb,2.0,t1_d26suyy,11670.0,corsetry
98,"personally and I hate using this but I would use a strap cutter, I kind of suck with a strap cutter some days but if you cut both of them with the strap cutter you are sure to get an even edge for both.",2016-04-17 21:55:16+00:00,d26s9a9,1.0,t3_4f3sms,88167.0,Leathercraft
99,"by checking it out you could cut the pieces out first, and hold them to gether with clips just to see if they will stand on their own or if you think it might be too floppy.",2016-04-14 08:31:31+00:00,d22ckxo,6.0,t1_d22ckja,42.0,Leathercraft
100,once you stitch everything together along with the gussets I think at the thickness it should stand on it's own but you are the one that has the leather at your hands I could check it out just to be safe.,2016-04-14 08:30:49+00:00,d22ckja,5.0,t1_d228q90,11279.0,Leathercraft
101,"considering the leather, the roo hide (for the lacing) and the eyelets a total of 40 bucks all total with a lot of left over leather and lace as well. The belt is made from 8 oz leather",2016-04-14 06:24:26+00:00,d22a8dq,2.0,t1_d228zo3,3123.0,Leathercraft
102,"Thank you I plan on making a couple of different styles but ugg ran out of eyelets of all things so have to wait a week to get some more, but the belt is for sale figured 70 is not asking to much for the craftsmenship as well as the time it takes to make this one. Good thing about the design is it's easy to adjust.",2016-04-14 04:24:51+00:00,d226xnh,2.0,t1_d224hha,4218.0,Leathercraft
103,They are not that hard to make really was a fun project hoping to get it sold.,2016-04-14 00:46:32+00:00,d21y8dh,2.0,t1_d21qglj,11358.0,Leathercraft
104,Supple is good and with that thickness you will not need a stiffener. ,2016-04-14 00:45:39+00:00,d21y71z,3.0,t1_d21y1ug,202.0,Leathercraft
105,"First off do not use pigskin for a pocket, just will not last very long, it can be done but just not advisable for the long haul. Now I have made several messenger bags 
http://imgur.com/a/IcMog this is my latest one and I do not use any bag stiffener nor did I line it as I did not feel it needed to be lined. Really only time you need a bag stiffener is if you are using thin leather, personaly for the messanger bags that I make I use any where between 5 to 7 oz leather as this way no bag stiffener is needed. As for lining I always actualy make the liner the same size as the piease and yes I do line each individual piece the reason I make them the same size is that I can then simply hand stitch (I do all stitching by hand) the pieces to gethere this way I do not rely sololly on glue to keep the linner in place. But that is a personal preference. ",2016-04-13 21:51:50+00:00,d21r3h0,1.0,t3_4e7xui,256870.0,Leathercraft
106,most welcome and here is the link to save you some time https://www.leathercraftlibrary.com/default.aspx?,2016-03-30 19:39:26+00:00,d1jh55b,6.0,t1_d1ivtms,34049.0,Leathercraft
107,"AH got you, again did this all off a pattern that I did not make someone else did, for this pattern check and a lot of other cool and some totally useless lol patterns check out tandy leather tandy leather library they have some great vids as well worth the 3 month sub the pattern is easy enough to shrink or extend if you wanted to.",2016-03-30 01:36:31+00:00,d1iiv91,4.0,t1_d1i10pm,24329.0,Leathercraft
108,"Thanks
",2016-03-29 17:50:37+00:00,d1hy3co,2.0,t1_d1h064v,65511.0,Leathercraft
109,Thanks,2016-03-29 17:50:30+00:00,d1hy34w,2.0,t1_d1hp11b,11675.0,Leathercraft
110,"Followed a pattern that I have, so no eye balling needed or are you talking the tooling the tooling I eyeballed to see how much depth that I wanted",2016-03-29 17:50:17+00:00,d1hy2qk,2.0,t1_d1hmezm,15754.0,Leathercraft
111,The only reason I posted to my webstore is that imgur will not allow you to edit the album..adding new photos once its been shared its a real pain in the rump! Only thing I do not like about imgur,2016-03-17 00:39:39+00:00,d12p38q,4.0,t1_d12amc8,20685.0,Leathercraft
112,thanks,2016-03-17 00:37:31+00:00,d12p0eq,2.0,t1_d12ctiy,17583.0,Leathercraft
113,"Here is all the photos that I have put up on my store, has photos of inside the bag as well as the pockets

https://gibbinthegremlin.com/collections/messenger-bags/products/dark-brown-leather-messenger-bag",2016-03-17 00:36:54+00:00,d12ozm1,4.0,t1_d12amc8,20520.0,Leathercraft
114,"The leather is veg tanned 6 to 7 oz (closer to 6) as for a term not overly sure to be honest other then just a rounded edge. I used a saddle stitch so yes did have to sew into the bag, I started with front of the bag as there is the pocket and leather catch for the front lap so it was just a bit easier to stitch from the top. It was a little difficult towards the middle of the bottom simply because it was dark inside the bag lol. Getting the leather to bend around the corners was actually the hardest part.",2016-03-16 18:21:23+00:00,d129443,2.0,t1_d124e03,6270.0,Leathercraft
115,its not the wrist that is sore the neck was stiffer then iron for a day or two but man my fingers...lets just say they STILL hate me lol,2016-03-16 12:08:27+00:00,d11uorf,2.0,t1_d11tg4m,3823.0,Leathercraft
116,"Take your time, I know that sounds kind of silly to say but you will get to a point where you are tired of the project or tired of hand stitching and you just want to rush it. That is when you get up and walk away for 20 minutes or so then come back to it. IF you do something similar to this bag with out bending the gusset to a 90 degree to give you a lip to glue to the back and front, take your gusset it line the top of it with the back (or front your choice) First then start punching your holes. 

What I did was laid the gusset down even with the front first, smacked used a wing divider then groved the line to help protect the stitching and to give a straight line for the pricking iron to follow. I then first drove the pricking iron into the front, then lined slide the pricking iron over to the gusset lined it up and then punched the holes, then went back to the front, punched holes, then over to the gusset going back and forth like the for the whole length of the front (keeping the gusset flat not trying to curve it) 
this way I actually had a perfect match set of holes. ",2016-03-16 09:56:48+00:00,d11sdre,2.0,t1_d11q9n4,8466.0,Leathercraft
117,Thanks I really like the way it looks as well.,2016-03-16 02:57:45+00:00,d11itcu,2.0,t1_d11hvmm,1393.0,Leathercraft
118,"I hope someone else cherish it forever putting it up for sale lol. But I really like the design, but to be honest the side gusset was a pain in the ass as I could not glue it in place!",2016-03-16 02:57:33+00:00,d11it3p,2.0,t1_d11i0r6,1171.0,Leathercraft
119,"added two new pics

http://imgur.com/gallery/fdUDL?lr=0",2016-03-14 18:02:01+00:00,d0zl35t,1.0,t3_4a55h7,167066.0,Leathercraft
120,its 6 to 7 oz (close to 6 oz) tooling leather from tandy. I have done other messenger bags and I feel that the 6 to 7 oz is the best thickness for a bag like this.,2016-03-14 18:01:49+00:00,d0zl2vh,2.0,t1_d0z64x0,29909.0,Leathercraft
121,roo is easy to work with very thin  hide would be good for first projects just becareful when cutting it. Roo hide is also used in whip making due to its strength here is a good place to buy roo hide from (I have used them on multiple times) http://www.birdsall-leather.com.au/ prices are not too bad.,2016-02-26 20:06:21+00:00,d0ezafg,1.0,t3_47nzcl,45616.0,Leathercraft
122,"I avoid roo hide for bags, wallets ok, lacing GREAT for things both decretive but mostly I see roo hide in whip making. now for a messenger bag I would use simple cow hide to be honest use 5 to 6 oz seems to be a good weight and thickness.",2016-02-20 20:01:04+00:00,d07bz3f,1.0,t3_46gvjf,170095.0,Leathercraft
123,"Why are you using an awl the diamond chisles are made to punch all the way though the leather, I use my pricking irons just like that smack it hard enough to drive it though both layers and go from there. No need for an awl unless I need to open the holes a bit wider if I am braiding.",2016-02-20 19:47:14+00:00,d07bit2,1.0,t3_46qvid,10228.0,Leathercraft
124,The only time I would use a sewing machine is if it is foot powdered (one of the OLD ONES) as I prefer to do everything by hand or powered by hand. And yeah I was thinking about tooling it or something maybe the next one I really need to get a maker's mark done up in a stamp.,2016-02-18 17:45:29+00:00,d04qa7y,2.0,t1_d04nrog,3214.0,Leathercraft
125,Thanks going to start selling them for around 60 AUD ,2016-02-14 19:37:02+00:00,czzu0lt,2.0,t1_czzsyd0,1835.0,Leathercraft
126,"What I did was first tooled the design, figured out close to where the center of the design was then used a pair of wing dividers to find the inner circle then just added a centemeter or so and did the outer circle then it was just pick a hole to start with and do a standard Mexican round basket weave though it is now a flat weave",2016-02-14 18:41:29+00:00,czzs2ih,4.0,t1_czzihqq,19007.0,Leathercraft
127,How what?,2016-02-14 02:16:20+00:00,czz3xbk,2.0,t1_czyw3zm,13995.0,Leathercraft
128,"yep have them go to this place, this is where I get my roo hide from. And by the way they ship international 

http://www.birdsall-leather.com.au/",2016-02-13 20:57:50+00:00,czyta4v,1.0,t3_45eb3p,120568.0,Leathercraft
129,thanks this will actually be the first bag that I have tried with hidden stitches as I real like the look and the leather I am using is a bit higher end so would prefer that kind of look,2016-02-12 04:22:04+00:00,czwy92d,4.0,t1_czww8ri,3175.0,Leathercraft
130,Yep planning a lining. I take it that i stitch the divider and lining together then stitch lining to outside of bag?,2016-02-11 23:16:10+00:00,czwmq4y,2.0,t1_czwfrkz,9546.0,Leathercraft
131,Thanks,2016-02-11 17:58:26+00:00,czw8tcu,2.0,t1_czvxw9a,18243.0,Leathercraft
132,Thanks that does make sense will have to give that a try and see what happens and yeah easiest way would be to have exposed stitching.,2016-02-11 17:58:17+00:00,czw8t4r,2.0,t1_czvx5eo,20522.0,Leathercraft
133,Soo true and tired of the parents just over lookung this behavior hell I had to yell at more then one kid for running up and mobbing my dog. My dog is actually a bit scared of little kids shr just doesn't know what to do with them and at 90 pounds my dog is no light weight.,2016-02-11 10:37:52+00:00,czvvncp,3.0,t1_czv5qjl,51305.0,AskReddit
134,Never piss off a menopausal woman!!!,2016-02-11 04:03:37+00:00,czvngxy,1.0,t3_454e8h,31848.0,AskReddit
135,Get a book called Leather Braiding by Bruce Grant worth the money!!!,2016-02-10 21:16:03+00:00,czv835k,2.0,t1_czv5jqm,3454.0,Leathercraft
136,This was the first time not only for making a leather book cover but also for trying my hand at the Mexican basket weave (that is what is on the spine) came out rather well.,2016-02-10 20:03:16+00:00,czv4vr6,1.0,t3_454nmf,42.0,Leathercraft
137,Thanks all for the comments been a little under the weather to respond of late (that and cut the hell out of my wrist with a paracord whip I made don't ask lol) I have bought a pattern off of lzpatterns and will give it a go and show you all what the finished product looks like. As for making my own patterns I am still a little scared to be honest of that as I have yet to really try that avenue. Might have to give it a go as for the thrift stores that is a good idea as I have not thought of that.,2016-02-10 19:59:44+00:00,czv4q7r,1.0,t3_44n2rf,261707.0,Leathercraft
138,for messenger bags I prefer to use 5 to 6 ounce leather though I have used 8 to 9 oz takes out that whole floppy effect,2016-02-07 19:15:59+00:00,czrau1l,1.0,t3_44ci9p,170839.0,Leathercraft
139,Thanks will not lie its a bit of a pain in the ass to get the gusset laced up at first. Still feels a little wrong to hold things together with just lace and some damn fine saddle stitching..even with the leather lace being kanagroo lace,2016-01-30 08:12:39+00:00,czhe59z,2.0,t1_czh1sok,28542.0,Leathercraft
140,Nope i have a habit of punching before I dye as i want the holes to be colored inside and out just in case the lace doesn't cover all of the holes,2016-01-27 23:08:21+00:00,czegeve,6.0,t1_czeba9k,7195.0,Leathercraft
141,"I was going to originally do some tooling but then I thought I would go for simple yet stunning look. The dye is eco flo medium brown gel, the only spots that are not even you can't see as its the holes where the lacing goes though.",2016-01-27 21:07:44+00:00,czeb93p,4.0,t1_cze4db6,9162.0,Leathercraft
142,"Thanks and yeah I wanted to give lacing a go with a neck corset, I have seen a couple with a simple cross stitch kind of set up then I thought what the hell lets try the double loop applique and see how it looks came out great I think.",2016-01-27 18:30:22+00:00,cze45s9,2.0,t1_cze0aru,5189.0,Leathercraft
143,"&gt; swiss corset close but not quiet that as this does not have the peeks to it really must get photos of it

",2016-01-26 02:20:22+00:00,czc0yfk,,t1_cz92yt4,,corsetry
144,Already asked in a few different forums so far still a mystery on why it cut itself ah well will go back to welting myself er learning to crack this whip proper like,2016-01-14 07:46:08+00:00,cyxp4k9,4.0,t1_cyxk4hy,12178.0,paracord
145,I am asking in general from anyone that uses a paracord whip,2016-01-14 04:16:32+00:00,cyxjwrk,2.0,t1_cywdsxj,76671.0,paracord
146,Thanks all,2015-12-24 22:33:26+00:00,cyafw8j,1.0,t3_3xlrnq,359381.0,Leathercraft
147,Ah I just see a lot of them being sold with just the waist messurment and that just did not make that much sense.,2015-12-04 02:16:48+00:00,cxmfn6m,4.0,t1_cxm4pu8,17201.0,corsetry
148,Sorry was half awake when I posted that (have to stop posting at 6 am!) I was wondering why the hip size was not mentioned as well as when I make an underbust corset I set the hip size on the dress maker's dummy that I have as well as the waist size. So was just wondering why they do not mention the hipsize when saleing a corset.,2015-12-03 21:22:28+00:00,cxm4dxx,2.0,t1_cxm2uq1,2126.0,corsetry
149,"thanks but I just checked them out they are right, just a shitty photo from my phone stupid flash and a combo of shaky hands lol.",2015-12-03 19:55:59+00:00,cxm0muz,2.0,t1_cxlihhc,36091.0,maille
150,you are right slipped the ring into the bottom two links instead of the two side ones thanks for that one didn't even notice!,2015-11-22 20:45:21+00:00,cx9chpk,2.0,t1_cx9auqe,2430.0,maille
151,To big for a wallet in my eyes. A wallet will fit in my pants pocket. This thing if you stick it on your pants pocket will be easy pickings for a pick pocket not to mention it would NOT be comfy in any pockets lol. Thanks,2015-11-13 01:33:38+00:00,cwyeik6,2.0,t1_cwy87pe,10223.0,somethingimade
152,Yep I use to buy from ring lords a lot when I lived in the states (I live in Australia and now have a local supplier) never had any problem with ring lords' messurements ,2015-11-11 20:41:02+00:00,cwwwpmg,5.0,t1_cwwfm9o,29788.0,maille
153,"Normally silver is not that bad, its just a hair thicker then AA or BA but not by much but 14k Gold on the other hand is way thicker. And I am glad that you used one of my images to show someone your bucket weave =). Best to ask your supplier about the thickness of the metal as I said it can throw you off..best to learn from my mistake lol, spent over 200 dollars on gold and silver to do a weave only to find out that the damned thicknesses were different even though it was the same AR and ID as AA it was way to damn tight so basicly had to go up and down a size which was ok as I used the rings for another type of weave. So just remember that the metal type does have an effect as well as the AR and ID",2015-11-11 12:00:06+00:00,cwwf7re,3.0,t1_cwwd8gl,8763.0,maille
154,Another geek woo hooo hehe thanks!!,2015-11-11 05:28:59+00:00,cww8owu,2.0,t1_cww51vo,7166.0,maille
155,"I use 16g 1/4 id and 20 g 5/32 for some of the dragon weave for BA and AA. Now do not get pissy with me over this but this link is to my store (don't have a pick loaded up to imgur of it) http://www.gibbinthegremlin.com/collections/precious-metal-bracelet/products/stunning-rose-gold-dragon-weave-bracelet

this is 16g 1.4 id sterling and 20 g 5/32 id 14k yellow gold

Now I have found that with sterling silver and 14k gold you have to becareful because say you want to make a dragon weave same length and everything as a BA and AA bracelet you can NOT use the same size rings as sterling and yellow gold are both thicker. So material really matters when it comes to gauge!",2015-11-10 21:39:23+00:00,cwvs84l,1.0,t3_3s92tl,46568.0,maille
156,"I am in the plans of trying something that I saw on Tandy's leather library well sort of, George was showing how to make a Rolled Roper belt, but instead of a belt I am going to try and do a bracelet like that.",2015-11-09 19:04:27+00:00,cwudo65,1.0,t3_3s41xm,37928.0,Leathercraft
157,"thanks
",2015-11-04 02:10:31+00:00,cwno2zo,4.0,t1_cwmxn9d,38295.0,somethingimade
158,I noticed that as well might have to pull ot a part and redo the directions said to lay the cups together where you want pull the extra stuff off and the attach the put extra stuff on other side of cup,2015-11-02 06:44:48+00:00,cwldcoo,2.0,t1_cwlb48r,5291.0,maille
159,"http://imgur.com/l6OFXcy

Inside of roo card holder did this project as A: I was bored and B: I was hoping the pounding from using the pricking irons at 6 am would drive my in-laws who are living with us at the moment out of the house...didn't work but still was fun to hear them whine and complain about it!!",2015-11-02 05:03:00+00:00,cwlaown,1.0,t3_3r6bem,73.0,Leathercraft
160,"Do not consider yourself wasting time or money, every project, even the ones we screw up on we can learn from. I tend to try and salvage bits and pieces, even leather as, depending on size of course, you can always reuse leather even if its just for practice.",2015-10-31 19:18:52+00:00,cwjplub,1.0,t3_3qtcan,127454.0,Leathercraft
161,"Hand stitched 7 spi  and the tooling is small enough that I feel it does not distract from it personally. Just adds a little bit more to it. The bag that I am working on now is the same design, same color, but will be adding straps instead of the damned magnetic closures. Will run the main straps under and then over the two side ovals on the flap of the bag, running the straps down the middle.",2015-10-30 19:14:25+00:00,cwioucn,2.0,t1_cwi3q45,48259.0,somethingimade
162,"See there is the problem that I do have with some bags, yes buckles are not as fast as snaps but if the strap is not sewn to the bag you could easily lose it. And honestly snaps do not last that long. I make bracelets and have had several come back to me (as they are all local) to have the snaps replaced. At lease with buckle and strap it will take a long time for them to wear out.",2015-10-28 19:27:15+00:00,cwg8ke8,9.0,t1_cwfz6xa,13074.0,Leathercraft
163,Agreed on the whole sticking thing give me good old fashioned blunt force trama!!!,2015-10-28 04:13:02+00:00,cwfj388,17.0,t1_cwfg1cv,5206.0,Showerthoughts
164,"snaps will fail a lot sooner then what buckles will. And with buckles lets face it people will always overload a bag, at least with buckles you have that option, where as snaps not so much, same as the magnetic closures that I used.",2015-10-27 20:09:13+00:00,cwezznx,7.0,t1_cwez3vv,1197.0,Leathercraft
165,true enough but again where are you going to find a Naginata? I think it would be easier to find a heavy blunt object. But I do like the distance a Naginata would give you!,2015-10-27 19:19:16+00:00,cwexsrl,15.0,t1_cwexr16,65.0,Showerthoughts
