,body,created,id,nest_level,parent_id,reply_delay,subreddit
166,"There is another problem that no one seems to want to touch on with ANY bladed weapon that is thin like a sword or a naginata, well two problems, first chipping, you WILL chip the blade sooner or later and second..sharping a blade, really how many people out there know how to truly sharpen a blade and to remove a nick from a blade? Best bet is either an axe or a heavy bludging item with a long handle especially for when you see a whole horde coming your way!
",2015-10-27 19:01:46+00:00,cwex1ha,13.0,t1_cwekioq,18168.0,Showerthoughts
167,"it was a little annoying to be honest but I do like the over all look of the bag, next one though I go with buckles",2015-10-27 18:58:15+00:00,cwewvsh,5.0,t1_cwevw32,1351.0,Leathercraft
168,"These are what I used

http://www.tandyleather.com.au/en/product/disk-magnets

http://www.tandyleather.com.au/en/product/magnetic-bag-clasps

they are just a little to fiddily to be honest for my taste next bag that I make, which will be like this one, I am using buckles for.",2015-10-27 18:57:31+00:00,cwewul1,1.0,t3_3q755t,163091.0,somethingimade
169,"Never understood why someone just doesn't carry a heavy mallet, sure its heavy but after a while you would get use to the weight, would make you stronger and wouldn't it be so much easier to drive a head into the shoulders (breaking the spinal cord) then trying to use a little knife to play wack a mole with a zombie's brain?!",2015-10-27 10:22:35+00:00,cwefkme,11.0,t1_cweae0f,19257.0,Showerthoughts
170,"By the way just because archaeologists are ""professionals"" does not mean you are not grave robbers, you still are robbing the dead..yeah most of the people that were close to them are worm food as well..yet you are still robbing graves..but you are a professional..that is what matters.....",2015-10-27 10:19:28+00:00,cwefizc,9.0,t1_cwdrf95,50405.0,Showerthoughts
171,"the disk magnet is the hard one to get it to attach as you need to sew cloth or another piece of leather (which I did) over top of both disks, that was really the only tricky part
",2015-10-27 05:32:48+00:00,cweb3yk,3.0,t1_cwdn76m,39343.0,Leathercraft
172,"They are a little fiddly, you have to kind of mess with the snaps just a little to make sure that they are properly set, and you have to be careful about not over filling the bag as the snaps will not close properly if the front bows out. Mind you they are strong and will handle a bit of weight. I had a heavy book, a lap top, mouse, and power cord in the bag and it held up nicely. Just seems a bit fiddling is all.",2015-10-26 18:41:22+00:00,cwdndpf,2.0,t1_cwdc7xv,17125.0,Leathercraft
173,most welcome any other questions feel free to ask.,2015-10-25 22:29:22+00:00,cwcowqr,6.0,t1_cwcov5e,74.0,Leathercraft
174,"Here is a pic as promised
http://imgur.com/3ENERAL
left is the bottom right is the sides that I tend to use when making the leather messenger bags, just tend to either make them shorter longer or wider, but the shape is the same.",2015-10-25 21:27:40+00:00,cwcmjwa,4.0,t1_cwcin7a,5859.0,Leathercraft
175,Will do one better i think i have a spare gusset if i do will take a pic of it,2015-10-25 21:20:28+00:00,cwcma0e,4.0,t1_cwcin7a,5427.0,Leathercraft
176,"Its actually a two piece gusset. Expect you just double it. Basicly what I have done is made two, single gusset messenger bags and put them together. The bag, front, and middle of the bag are all 6 oz leather the side gussets are 4 to 5 oz (closer to 4) same as the bottom. ",2015-10-25 18:53:31+00:00,cwcgavo,2.0,t1_cwc872c,12112.0,Leathercraft
177,"ok view of the side and inside of bag now that it's fully edge dyed. Only dying that is left is the bottom of the bag as well as the bottom of the flap. Bag turned out ok, not 100 % happy with the magnetic clasps as they are a little fiddely 

http://imgur.com/gmde1hm
",2015-10-25 11:24:01+00:00,cwc2ljh,1.0,t3_3q28um,58721.0,Leathercraft
178,I have about 14 to maybe 16 hours in hand stitching that is what takes the longest. I use a saddle stitch to make sure the bag will not come a part,2015-10-25 05:18:03+00:00,cwbx88g,2.0,t1_cwbm7lk,22771.0,Leathercraft
179,"internal shot of the bag as requested.

http://imgur.com/JEh4Sf2",2015-10-25 04:31:28+00:00,cwbw52v,2.0,t1_cwbmpv0,18989.0,Leathercraft
180,I will have more pics soon still slicking the edges then have to figure out what color i want to edge dress them,2015-10-25 01:53:00+00:00,cwbrktw,2.0,t1_cwbmpv0,9481.0,Leathercraft
181,"Here is a link its to Ring Lords this is what I am using for the pattern and instructions really easy to follow.
http://theringlord.com/cart/shopdisplayproducts.asp?id=199

just scroll down until you see the pdf for scale mail bra
 look for this description

Level: Intermediate
Jodey Hathaway (Bike Part Jewelry) shows how to make beautiful scalemail bra tops using small scales. This detailed instruction set explains everything from basic scalemail construction to contractions, edge stabilizing and fitting notes.
The instructions can be used for any cup size - the example used is size D.
The instructions can be used to make a form fitting supportive top or a loose halter.
The scale top design is courtesy of MailleTec.com
Model: Tiffany Wozniak Brock, Photo: Dragons Lair Photography",2015-10-23 11:51:22+00:00,cw9xt95,2.0,t1_cw9v4wc,11323.0,maille
182,"Yep have four contractions in , one of them is already in, *on the small side* and one more row will see two more set in. basicly how I have it set up is 11th row 1st con 2nd con is 16th row as well as the 3rd constrat last one is 16th row. This SHOULD fit a 39 and half inch bust",2015-10-23 06:49:09+00:00,cw9tf5x,2.0,t1_cw9megi,16123.0,maille
183,cool thanks for the reply. I must be doing better with the scale mail bra I am working on then (first one ever that I have done) have about 3 hours into one cup so far.,2015-10-19 00:30:54+00:00,cw4lr6j,3.0,t1_cw4apy0,17207.0,maille
184,Looks great how much time do you have in that?,2015-10-18 19:09:20+00:00,cw499yc,1.0,t3_3p5d1n,82917.0,maille
185,When I was making my own rings (I buy mune now much easier on hands) I simply either used a wood dowel rod and a screw..or nail rapid wire around screw at top of dowel then wrapped by hand or for thicker steel I would use a piece of rod iron. Wrap then cut,2015-10-18 01:32:14+00:00,cw3jkh3,1.0,t3_3omhpk,367632.0,maille
186,"Thanks though this is a slow process more of a ""quiet"" time of thing to do as right now business wise I am working more on getting a few messenger bags done (which even working in leather there is still a fair amount of noice)",2015-10-17 19:56:56+00:00,cw38be1,2.0,t1_cw37fdw,1609.0,maille
187,"good idea on the coin for the smaller edges will keep that in mind, I do use a wing divider reason the bottom line wavered was simply because the damn pieces came unglued, first time I used eco flow contact cement, leather could have still been a bit damp from the dye work for it not to set properly or could just be shit glue not sure on that, I always prepunch my gussets glue it then repunch that way you just have to put the iron in the same holes and go at it. Normally speaking ""normal"" contact cement will not come undone like that. The hardest part on a gusset by the way is getting the damn fold right. Forgot to mention that I am doing a ""classic"" brief case now this one with double gussets (that is going to do my head in I just know it lol) going to be saddle tanned will share when its done right now just started cutting out the parts",2015-10-14 22:11:35+00:00,cvzxz27,2.0,t1_cvzwm0w,2037.0,Leathercraft
188,"Yeah the whole exchange rate is a killer for me. People in England and the states and a few other places tend to get a hell of a deal when it comes to my products (I do chainmail jewellery working in everything from sterling silver to 14k Gold as well as a few platinum pieces) but yet I get HAMMERED when it comes to getting supplies from over seas which I try NOT to pass on to the customers unless I can not avoid it, one reason I do not do a lot of platinum pieces.",2015-10-14 18:49:23+00:00,cvzpda7,3.0,t1_cvywxyf,61376.0,Leathercraft
189,All about marketing. Know who your target market is...what they are willing to spend..what they are willing to buy. Point in fact I have seen some great holsters doing the rounds on a few forums I beling to yet they would not sell here in Australia as there is not that big of a market (northern territories maybe but still a smaller demographic) so I wouldn't even try to make one let alone try to sell it. If you want to sell your product go for it and do not let anyone tell you different.,2015-10-14 09:45:54+00:00,cvz8i0e,5.0,t1_cvz4uqd,14165.0,Leathercraft
190,"personally I would glue it and stitch it together that way the hide will flex with the canvas and you do not have any bowing out, but I would just stitch along the outer edges. There might be a better way to do it but that is the way that I would do it. Use a strong contact cement.",2015-10-14 04:51:52+00:00,cvz3hov,5.0,t1_cvz38rw,561.0,Leathercraft
191,May seem a bit steep to you but its already sold with an order for a second one though different colour and one more pouch on the other side. So that it will have three external  pockets. So at 400 am still making a profit which is what the aim is for.,2015-10-14 00:18:16+00:00,cvytgp3,2.0,t1_cvyq29t,5341.0,Leathercraft
192,"Yeah stitching line on the bottom did wander a bit, that was simply due to the damn glue not holding for some reason (last time I use eco flow glue for bags) even after letting it set for 4 hours. I tend to pre-punch the holes on the gussets first then glue, then simply use the pricking iron to repunch though the rest. But yeah damn line did wander here and there which kind of pissed me off to be honest.",2015-10-14 00:06:19+00:00,cvyt0g8,2.0,t1_cvyqi30,3937.0,Leathercraft
193,Yeah I think that would work if you use the hide as an outer covering and the canvas would help make things a bit stronger as well. ,2015-10-13 19:13:07+00:00,cvygywa,3.0,t1_cvxwugq,44130.0,Leathercraft
194,Thanks first time I have ever done a but join on leather as well as the mask is actually three different pieces,2015-10-08 06:37:10+00:00,cvs8nic,4.0,t1_cvs6cs9,6504.0,Leathercraft
195,"totally understand it lol and thanks, I really enjoy handstitching my projects but man that one was a nightmare, just on the final bottom side getting it to close off. Did leave the nose open just a little to help with breathing. ",2015-10-08 04:07:50+00:00,cvs5aaw,2.0,t1_cvs40n1,2959.0,Leathercraft
196,If I ever make another one which i doubt lol i will keep those ideas in mind it was a good challenge I do lovethe idea of using a ring for part of the straps,2015-10-08 02:18:10+00:00,cvs1w6o,1.0,t3_3nvobc,23683.0,Leathercraft
197,double spiral I think is a lot easier for people to do up if you are going to sell your stuff (which I do). A lot of folks just do not have the patients to keep twisting a piece of jewellery just to put it back on.,2015-10-05 19:18:19+00:00,cvp85cz,3.0,t1_cvovrj4,20222.0,maille
198,"There is another option that no one has talked about and that is a double spiral, it will hold its shape with out you having to continue to twist it every time you unhook the ends.

http://imgur.com/6Yica1D",2015-10-04 20:18:45+00:00,cvo53yw,1.0,t3_3mgwqe,710826.0,maille
199,All natural ,2015-10-04 02:28:51+00:00,cvne2gf,2.0,t1_cvn64sy,15444.0,steampunk
200,"Another thing about Vinegaroon is that a resist does NOT stop it, what it does is bleeds from UNDER the leather, it can create some interesting effects but you have to be really quick with the bicarb to stop the bleed though effect.",2015-09-29 19:27:53+00:00,cvife4g,6.0,t1_cvi8uh1,9361.0,Leathercraft
201,"You have to quick dip the leather in the bicarb ten to 15 seconds no more because you can actually damage the leather (I left one in for 2 minutes just to see what would happen) and the leather comes out rather stiff and has kind of a weird feeling to it, kind of hard to explain, even hitting it with olive oil did not restore the leather. I do like the vinegarroon, and the added effect the bicarb has is to help with the smell because it does take a while for the leather to stop sticking of vinegar!",2015-09-29 07:55:17+00:00,cvhvp2a,5.0,t1_cvhrxcb,11809.0,Leathercraft
202,I would honestly suggest you do it for just the first three months that is how I got started into making things out of leather then you can branch out from there.,2015-09-29 05:49:30+00:00,cvhtkik,3.0,t1_cvhofh7,10905.0,Leathercraft
203,"Nothing wrong with going to a class from tandy or even as Beastman said find a class at the local library if possible. Now one other source that I will give which I have learned a LOT from is from tandy and its:

http://www.leathercraftlibrary.com/

They do charge you like 35 bucks ever 3 months but it is worth it as George Hurst walks you thought different projects step by step plus they have a lot of other basic videos and it has all really helped me.",2015-09-28 19:19:21+00:00,cvh7er1,1.0,t3_3mpum5,9611.0,Leathercraft
204,lol that thought did actually come to me at one point in time.....,2015-09-28 19:14:44+00:00,cvh77ke,2.0,t1_cvh0ekj,10060.0,steampunk
205,Black nub will put out a very slim line,2015-09-28 10:10:28+00:00,cvgqjnm,5.0,t1_cvgpakz,6128.0,Leathercraft
206,"free hand I have is this 

http://www.tandyleather.com.au/en-aud/search/searchresults/83003-00.aspx

I like it",2015-09-28 08:19:27+00:00,cvgp6iy,4.0,t1_cvgp61g,60.0,Leathercraft
207,"That actually took me a bit to figure out but two things, one its ok for what it does but get a free hand groover and it works a bit better, because the damned bar on mine likes to slip. But you have to hold it at a sharp enough angle to get it to cut, once you get it started it cuts a nice groove.",2015-09-28 08:18:27+00:00,cvgp61g,3.0,t1_cvgogja,3126.0,Leathercraft
208,Thanks pretty easy to make and opens up more possibilities with adding a few extra desings,2015-09-27 23:27:38+00:00,cvgbncu,2.0,t1_cvgbfe9,414.0,Leathercraft
209,"I have made a few wallets what I do is I tend to use 4 to 5 oz, now if its for a minimalist wallet which is just one piece folded over and a pocket on the outside, 2 to 3 oz is not bad. Remember a lot of guys do not like really thick leather. What you COULD do if you still have your heart set on deer skin, is line the deer skin with a bag stiffener or as you said you can laminate two pieces together. Though not sure how well the bag stiffener would hold up to folding and bending unless you cut two pieces out and left the middle of the hide uncovered so it folds nice and neat like.",2015-09-27 20:08:07+00:00,cvg4hic,3.0,t1_cvfolxn,32787.0,Leathercraft
210,"Did forget to mention the cost of material goes up with a: better quality leather and B: I do not think deer hide would be thick enough for a backpack, could be wrong though. Would be good for small projects like wallets and what not. ",2015-09-27 10:10:04+00:00,cvfnzy2,1.0,t3_3mj9zx,28575.0,Leathercraft
211,"Depends on how much the hide is going to cost you, check out tandy as they have starter kits all the way up to kits that you can use the open a small leather working shop(that is what I did but it was around 3 grand) I can put a backpack together in about two days, that start to finish from cutting the leather out, drying time (for dyes) and I hand sew everything so that is where a lot of my time will get sunk into.  If you want either check out gibbinthegremlin on facebook or this is my store http://www.gibbinthegremlin.com/ just to give you a few ideas of what I do. Though facebook has more currant pics of some of the things I have done. ",2015-09-27 10:08:38+00:00,cvfnzcr,1.0,t3_3mj9zx,28489.0,Leathercraft
212,A combo of leather and metal even if it was just strips of metal ribbing,2015-09-27 03:12:40+00:00,cvfgcvn,5.0,t1_cvfc2xp,9005.0,Leathercraft
213,You would still run into the same  problem with a sword might stop a knofe though ,2015-09-26 23:42:33+00:00,cvfabba,3.0,t1_cvf8p00,3123.0,Leathercraft
214,"Its a good set but unfortinatly its a little easy to bend the irons well the single punch iron out of that set, threads hold up fine as I have had mine for just a little over a year and really enjoy it.",2015-09-26 22:19:33+00:00,cvf7qn8,3.0,t1_cveyuhy,16677.0,Leathercraft
215,"To be honest leather will not protect from a slash from a sword, knife yes, sword no, it might slow the blade just a touch even at 14 0z (tandy sells 13 Oz) the blade will still bite into the flesh, but the other thing you have to think about is the force of the blow in general can still break wrist bones or finger bones (been there done that, started using chainmail on top of leather to help take more of the force of the blade) not to mention that is some really thick leather which means moving fingers and what not would be pretty hard at some times when you really need mobility in your hands!",2015-09-26 22:17:50+00:00,cvf7op2,1.0,t3_3mi9uy,4494.0,Leathercraft
216,That is really cool!,2015-09-26 22:10:55+00:00,cvf7gu7,1.0,t3_3mgbje,39331.0,Leathercraft
217,It will work easily ,2015-09-24 00:31:57+00:00,cvc0vt6,1.0,t3_3m33gc,27659.0,maille
218,true but that might involve a lawsuit lol at least this way no law suit lol,2015-09-23 19:51:03+00:00,cvbqa8e,4.0,t1_cvbgna3,13710.0,steampunk
219,Trust me no one wants to see me in a gimp outfit lol,2015-09-23 02:00:36+00:00,cvax0xi,2.0,t1_cvar6dh,10456.0,steampunk
220,"works great and I did not know that either until I started to ask around, best way to find out something, simply ask..and ignore the jackasses that want to chime in with something that is not useful.",2015-09-22 21:07:09+00:00,cvamuws,3.0,t1_cvalxzq,1348.0,Leathercraft
221,"This is my mallet

 http://www.tandyleather.com.au/en-aud/35004-10.aspx?countryid=993

Seems tandy is not selling it or at least important it any longer to Australia so glad I got it when I did. Love the handle fits nice into my hand. The only thing I do not like about it is the end cap is just a nut with a dome cap on it so it comes off, not sure what the reasoning behind it is. But other then that really like this mallet!",2015-09-22 20:12:18+00:00,cvaklud,1.0,t3_3lycm8,12877.0,Leathercraft
222,Dye everything first tne reason is if you accidentally get contact glue on the front of the leather you can use a rubber eraser to remove the glue easily back side of the leather is a real bitch to remove so be careful there,2015-09-22 09:23:56+00:00,cva0l7j,1.0,t3_3lv8c2,37045.0,Leathercraft
223,you do great work. I do chainmail jewellery but have never gotten into the wire wrap part of things really like your style!,2015-09-22 05:24:41+00:00,cv9wvof,3.0,t1_cv9jw81,23698.0,somethingimade
224,I really like that!,2015-09-21 21:13:09+00:00,cv9gcte,1.0,t3_3lqmzd,76263.0,somethingimade
225,"Personally IF you have the time I think running your own website is a good thing. Yes Etsy,Ebay and all those sites have customers but they can cost you a pretty penny just to try and drive customers to your store. Where as if you run your own social media  you can drive people to your store, and most social media sites are free, even if you run some ads on say facebook. Personally I am starting my own business and using these accounts. Facebook, Twitter, Tumblr, Instagram, Pinetrest. It does take a while to drive customers to your websites but in all honest it might take you 30 minutes out of your day do run the gambit of social media websites. Which in turn saves you money as Etsy and all the others take a percentage out of all your sales, plus charge you per item to list. 

I think it really boils down to, if you are ready to take the next step.",2015-09-21 20:08:57+00:00,cv9dtzb,1.0,t3_3lokml,103667.0,smallbusiness
226,"Hello one and all. We have just started our chainmail and Leather business, true its a niche market but we feel that we supply the best chainmail jewellery and leather goods around. We make mostly bracelets and a few necklaces in metals from 14k Gold, Sterling Silver, to Aluminum. Leather goods are wallets, corsets, with a few new items such as messenger bags and backpacks soon to be put up on the website. Come check us out...

www.gibbinthegremlin.com",2015-09-21 20:00:14+00:00,cv9dhld,1.0,t3_3lr3v9,64090.0,smallbusiness
227,The only way to make it look less splitchy is keep hitting it with the dye until the splitchy part blends in.  As for the gusset I have had the same problem befor and my best guess would be that the gusset stretchs just a tad as we wet form it. I have had edges get just a hair longer after it was wet formed and that can be a bit of a pain,2015-09-20 12:26:13+00:00,cv7tre2,3.0,t1_cv7sp34,4384.0,Leathercraft
228,Looks great mate nice idea to put that extra leather on the side gussets where the strap will rub. Oil dyes can be a bit tricky to get that color you want. You can cheat the color if you want to make it go darker. You can rub some fiebings leather balm woth atom wax into the leather after you dye it the balm will actually darken the dye a bit. Over all I really like the look of that bag.,2015-09-20 03:13:21+00:00,cv7kb92,1.0,t3_3lmo73,5114.0,Leathercraft
229,I am thinking of setting the price around 250 to 300,2015-09-20 00:36:56+00:00,cv7fsjl,1.0,t3_3lh263,103121.0,Leathercraft
230,oh and the reason I say around 80 to 90 bucks is because I already had the leather,2015-09-19 22:00:36+00:00,cv7b2cl,3.0,t1_cv76upf,8105.0,Leathercraft
231,vinegar is ok so long as you don't mind the smell coke at least doesn't leave a smell but you don't want to leave it on for to long or it will start to eat into the base metal.,2015-09-19 20:18:29+00:00,cv77wib,4.0,t1_cv75itf,4532.0,Leathercraft
232,"With the hardware, dyes, thread, and leather I would say close to 80 bucks, the front and back are 6 to 7 Oz leather, Straps 6 to 7 oz, gusset 3 to 4 oz (closer to 4) straps to keep the back buckles 4 to 5 0z the rest is 6 to 7 oz. So yeah I would say close to 80 to 90 dollars all total.",2015-09-19 19:45:31+00:00,cv76upf,2.0,t1_cv6xc3b,18328.0,Leathercraft
233,"Side view of leather bag

http://gibbinthegremlin.tumblr.com/image/129411804690

and dreaded shoulder straps added 

http://gibbinthegremlin.tumblr.com/image/129411790575

Backpack is now 100% done! Oh shoulder straps are adjustable the hardest part was getting the first gusset on.",2015-09-19 11:44:58+00:00,cv6u4as,1.0,t3_3lh263,56803.0,Leathercraft
234,The coke wil d9 a good job of eating the rust but i would not leave the stuff in for a day more like an hour or two. Wash it with water dry  y hand then hit the blades with wd40 let it all dry for a day or so before you resharpen or use on leather.,2015-09-19 10:30:59+00:00,cv6t4jy,2.0,t1_cv6p8id,16711.0,Leathercraft
235,Thanks squishyburger but to be honest I am still learning only been doing leather about 9 months or so. This was my very first backpack more pics to come as I just finished it blasted straps and all,2015-09-19 08:21:32+00:00,cv6rijb,2.0,t1_cv6ojlz,11123.0,Leathercraft
236,My strap cutter is defective it starts out nice and straight then towards the middle it goes all squirrelly on me...a its the strap cutter not the user..that is my story and I'm sticking to it!!!!!,2015-09-19 01:04:52+00:00,cv6i5ai,3.0,t1_cv6cxnj,10391.0,Leathercraft
237,"I use tandy and a local supplier here in Australia, though local supplier I use for exotic hides such as kangaroo (I am in Australia so roo hide is a little cheap here)",2015-09-18 21:10:15+00:00,cv6au70,1.0,t3_3lduus,66174.0,Leathercraft
238,"For a saddle stitch there is no need for a knot at all, all you do is go to the end of your line, then back stitch a few holes, normaly I tend to back stitch 5 to 6 holes depending on how much thread I have left, then just cut the thread flush to the leather and take a lighter and melt the ends.",2015-09-18 19:56:51+00:00,cv684f2,1.0,t3_3lf0o6,33281.0,Leathercraft
239,I will have a pic of it some time soon and no not using a fabric under it as this is made from 6 to 7 0z leather which is strong enough that yeah it will stretch but it will not stretch that much. And with the buckles that I have set up if it stretches a little I can still adjust for it.,2015-09-17 20:09:39+00:00,cv52l45,2.0,t1_cv4mon3,24879.0,corsetry
240,Oooh now that is a great idea Bojaxx thanks for that mate!!!,2015-09-17 20:07:51+00:00,cv52il0,3.0,t1_cv4nyoa,22295.0,Leathercraft
241,"That is cool but do you catch it on anything? I have made a bracer using bag clasps, has a good look and easy to put on and off but you do have to be a little careful, though I have only hooked myself on one thing so far. 

http://gibbinthegremlin.tumblr.com/image/125376894325

Though I see I labeled it wrong doh that actualy goes to the compass rose cuff!!",2015-09-17 07:51:06+00:00,cv4h97h,3.0,t1_cv3zbej,36977.0,Leathercraft
242,For my project I cant save ot at this time but yes you can either use a bag stiffner or you can use a thicker piece of leather which is what i will do next time.,2015-09-17 06:21:44+00:00,cv4fskv,2.0,t1_cv3csqz,69407.0,Leathercraft
243,I like the watch strap one though not sure about using a sam brown button as the closure. Mostly for security purposes kind of thing.,2015-09-16 20:33:29+00:00,cv3wscq,1.0,t3_3l74g5,10054.0,Leathercraft
244,I have yet to come up with a maker's mark might be my logo or might be something like GTG as my website is www.gibbinthegremlin.com Putting the logo on might be a little difficult on a stamp thought.,2015-09-16 20:31:52+00:00,cv3wpxo,1.0,t3_3l6wsg,13014.0,Leathercraft
245,I am that guy at the beach of late with a bit of scalemail that I am working on...not bad until the wind pucks up aluminum scales are light enough to be picked up by a strong gust!,2015-09-16 10:19:38+00:00,cv3c582,1.0,t3_3j6lde,1314364.0,maille
