,body,created,id,nest_level,parent_id,reply_delay,subreddit
0,"Honestly, I've struggled with oily skin my whole life and genuinely scoffed at the gross idea of putting MORE oil on my face. I don't know about OCM proper, using cooking oil etc, but this Simple stuff washes off really nicely - breaks down with water, so I feel absolutely no residue at all, just my own skin. And the benefits I guess are that I'm not stripping away everything with acid and bubbles, so my skin doesn't react by making a butttonne of oil to compensate. Funny how science actually works! Coming from a former sceptic, try the oil.",2016-09-06 07:37:58+00:00,d7b93pe,3,t1_d7alp2f,42765,SkincareAddictionUK
1,"Bought on a whim Simple's new cleansing oil (grapeseed oil, I think?) when I saw it (£4ish) and swapped my old faithful foaming daily facial wash for it in an attempt to experiment with the oil cleansing method. Ladies and gentleman, I was the most sceptical of the lot, but I am sold. Not necessarily on the product, but using oil to cleanse. My skin is clear, soft, feels clean, and the wave of sebum that I fought on the daily after using all my old products has disappeared to leave beautiful healthy mattification all day long. OCM 👍

Skin type: oily with patches of dryness, hormonal breakouts
Product: &lt;b&gt;Simple Cleansing Oil (?)&lt;/b&gt;",2016-09-05 11:56:48+00:00,d7a5v8u,1,t3_5189td,17654,SkincareAddictionUK
2,"-deep breath-

GREEEEEEEEEEEEEEEEEEEEEN WIIIIIIIIIIIIIIIIIIIIIIING",2016-09-05 10:25:35+00:00,d7a4d6a,1,t3_516x9l,34627,ITcrowd
3,Hello Mallaton! I worked in international development and have now moved into the TEFL/independent school/boarding school/teaching world! ,2016-08-16 21:51:51+00:00,d6karkd,3,t1_d6kalwr,212,UKJobs
4,"Er, I followed the link and used the mobile version of the site. Does that help you? Sorry, technologically challenged!",2016-08-16 14:45:46+00:00,d6jqg1t,4,t1_d6jnjrv,4310,UKJobs
5,"Hi oil_moon, just wanted to chime in here as your story felt very familiar to my own. I recently left a good, well-paid office job with great prospects in a hugely popular field. I left because our organisation went under and so everyone lost their jobs, but I was unhappy for a long time before that.


I thought once I had the office job with regular easy hours I'd be sorted, happy for life. But my reality was much like yours: sedentary, unfulfilled, desire to be out, outside, away from petty gossip and politics, bored and yet supposedly tied to my 'enviable' position by the money and prospects. I gained weight, I stayed in a bad relationship, I spent all my money on crap I didn't need and food to fill the weekends.
My redundancy turned out to be the best thing that could have happened to me. 


I played for ages with what I might be happy doing - working outside, being active, being with animals or working the land. I looked at ranch work on workaway.com, I looked at farm work, I looked at teaching English as a foreign language abroad. I looked at everything and anything. I considered career paths I would never have previously acknowledged before. Somehow I was lucky enough to fall into something that turned out to be perfect for me. I run around all day, I laugh every day, I'm training and qualifying in my new field more and more, and I slump into bed exhausted every night but almost stunned with disbelief that my gamble paid off, and that I'm happy, and tired, and more healthy and more fulfilled. I have more money because I spend less on crap to fill a void, even though I took a massive paycut. And I can feel where the stress and tension and misery used to make me slow and miserable, and where instead I'm now zingy and alive and dedicated and in love with my life.


Friends and family give me raised eyebrows and concerned looks at the abrupt and unprecedented job change and lifestyle change, but it doesn't matter because I'm so happy. I followed what felt good to me, and I thank God/Allah/Vishnu every day I could. Follow what feels good to you, think about what was unthinkable before, and only good can come. Recently I got offered a hugely prestigious position in London in my old field for huge amount of money - even more than before - and I turned it down in order to proceed on my new path. That's how much of a difference the levels of fulfillment and types of lifestyle make. Take heart, it can be done. Follow what feels good.",2016-08-16 13:37:00+00:00,d6jnnt5,1,t3_4xyfuc,19316,UKJobs
6,"This was actually really interesting, constructive, and pleasant to use!",2016-08-16 13:20:28+00:00,d6jn2n0,2,t1_d6jgrv3,17163,UKJobs
7,Excellent! Thanks for the tips!,2016-08-11 10:18:21+00:00,d6d1ygl,3,t1_d6cgq06,42025,SkincareAddictionUK
8,"Estée Lauder Advanced Night Repair

Anything La Roche Posay - I'm literally budgeting right now in order to be able to afford to delve into their product lines later this year

A lot of my rich intentional students have lots of Kiehl's products and I'm getting intrigued, as it's a brand that I've not heard a lot about but seems to be snowballing lately",2016-08-10 13:23:26+00:00,d6br6hy,1,t3_4x0x03,22856,SkincareAddictionUK
9,"Helllllooooo. Swooping in here to suggest you pop over to /r/childfree as they have a whole sidebar thingy dedicated to collecting the details of pro-choice doctors details and a culture of sharing recommendations. Even if it's not your natural hunting ground, you may find details of a doctor you'd be comfortable visiting.",2016-08-09 10:54:22+00:00,d6a7xtt,1,t3_4wu2vf,27302,AskTrollX
10,I just want to say this is the best God damn thing I've seen in all my life. It's like the period equivalent of a box of chocolates. ,2016-08-08 21:40:26+00:00,d69kl6z,1,t3_4wsefu,3192,AskTrollX
11,"You can't tell, but I'm doing a lot of throat-clearing and awkward shuffling in my seat over here. Thank you so much! I didn't think it was that special, just me, mashing my hands against a keyboard now and then, hoping something legible comes out.

I think you've hit the nail on the head with the live and let live. Who are we to reason why? Unless someone is jumping a queue. Then they can burn for all we care about their motives.",2016-07-28 09:16:58+00:00,d5u7za9,7,t1_d5u5yg4,6617,childfree
12,"Exquisite! Well, really... 😊 that's okay, I'll buy myself one and pretend it's from you. Cheers!",2016-07-28 06:04:47+00:00,d5u43nc,2,t1_d5tzmre,8727,childfree
13,"You know, it sounds like a joke, but I think we're too awkward to challenge anyone as much as our American friends! So I know my closest friends' intentions about having children after years of knowing them. But I don't ask others, really, and they don't ask me. Even family doesn't stick it's nose in. And if one of us is brave enough to say 'actually no, I'm not planning on having kids' (like, when it's necessary, on a date or a little while into a relationship) it's met with polite murmurs and/or silence. The proper, repressed way! Haha. And if someone (rude) has outright asked (and by rude I mean our version of rude, which is attempting to discuss personal matters before the person in question brings it up or before you know the person well enough), I tend to respond very quietly if I have to, or not at all. This is the British equivalent of bursting into tears, so people stop asking pretty quickly. And I think as a society we're good at not assuming people want children, or can but won't, or... Assuming anything. We loathe assuming, lest it makes us look like a boob. But that's just my experience from my little corner of this little island. See, I don't even want to assume enough to speak for my countrymen!

For instance, I was talking to my doctor about contraception choices and she briefly said 'blah blah blah and if you're planning on having children this option is good', not a statement that begs a response but it was my opportunity to either say something to confirm, or not say anything at all. I remained politely quiet in my chair. So she breezed on, 'maybe more permanent options would suit you, like blah'. Flawless, perfect, everyone happy, no one blushing with embarrassment, no need for a cup of tea after other than simple thirst. I love my doctor, by the way.

And I've written you an essay! Sorry! Haha.",2016-07-27 20:50:31+00:00,d5thyl2,5,t1_d5th0gj,1174,childfree
14,"It is interesting! To be honest, I was just quoting Big Sean with abandon. The more you know!",2016-07-27 20:27:21+00:00,d5tgu3f,2,t1_d5tebss,3083,childfree
15,Thank you! I appreciate the feedback :),2016-07-27 16:25:30+00:00,d5t4qu0,2,t1_d5t2glg,2775,childfree
16,You're making me British and awkward. Thank you 😊,2016-07-27 16:24:56+00:00,d5t4puh,3,t1_d5sz0gp,7228,childfree
17,"Well, shucks. Thank you. I don't, and even if I did what, where would I write? Every bugger wants to write nowadays. I just put my trousers on like everyone else in the morning, one leg at a time. Haha.
But I'm glad you enjoyed my little tale! I'll try and write again next time I have something CF to add to the sub.

EDIT: Actually, you know what, guys? I write a bit for my own pleasure. About my job. Working with children at a boarding school. Haha. I'm as CF as they come, which makes my new career very interesting and out of character, and I'm writing about the experience! This also explains why my days off are so treasured...
Have a look, and let me know any thoughts you want to share
celtabelter.WordPress.com",2016-07-27 16:24:24+00:00,d5t4ows,2,t1_d5svo7o,12529,childfree
18,celtabelter.WordPress.com,2016-07-01 21:50:13+00:00,d4vwvi0,1,t3_4qowmf,77371,TEFL_Offtopic
19,"If you're here, reading this comment thread because like me you thought maybe we'd stumble across each other here, I still think of you. Every day. I'm sorry. You're the only person I got tongue tied around, that's why I couldn't tell you... Everything I wanted to tell you. ",2016-05-11 20:45:15+00:00,d31t5w7,1,t3_4isbdj,73424,oddlysatisfying
20,"Cheese straws, Wiltshire Pasty, lardy cake, cheese and onion pasty, gingerbread men... Brb Reeve's",2016-05-08 17:05:42+00:00,d2xkvl5,2,t1_d2xe350,12528,AskReddit
21,This thread made me so happy to read. I LOVE YOU GUYS.,2016-04-19 13:30:28+00:00,d28tp0u,1,t3_4fgdt6,24060,unitedkingdom
22,"Oh, with a TEFL/CELTA qualification on top of your teaching experience you could make BANK teaching English in the Middle East. Check out Dave's ESL Cafe for a good jobs board.",2016-04-17 14:20:24+00:00,d26bjql,2,t1_d26bi4d,84,IWantOutJobs
23,"Hello! In pretty much the same boat. What I'm looking at - TEFL in east Asia (great subreddits for this and the people I know who've done it dropped down to NZ/Australia for hols all the time), the workaway website has pure hunners of ranch/farm work positions for Canada/Aus/NZ/anywhere you want to go really, and Aus has it's 'do three months farm work, get another year visa' thing. Oh, or the ICS youth volunteering programme, you could be a team leader or something.
Anyway, hope this helps!",2016-04-17 14:19:00+00:00,d26bi4d,1,t3_4f632s,14499,IWantOutJobs
24,My mother would disagree with you,2015-10-16 20:42:39+00:00,cw29pfh,1,t3_3p05wd,16716,TheGirlSurvivalGuide
