,body,created,id,nest_level,parent_id,reply_delay,subreddit
229,That's a selick film though. Burton tried to do his own version with corpse bride and it wasn't anywhere near as good.,2015-12-22 23:28:44+00:00,cy8ceye,7,t1_cy7wc9r,24095,movies
230,YAMO!!! Miss that greasy ass shithole.,2015-12-22 14:07:49+00:00,cy7r0uk,1,t3_3xqtj2,64168,sanfrancisco
231,"Yes there was. I must have helped about 4 different co-ops in the research hall. Although the npc was not see through like other npc hunters, you could not lock on to her, hit her in any way and she would just ignore you.",2015-12-22 05:26:48+00:00,cy7hj2l,2,t1_cy7enp4,5633,bloodborne
232,Santa Monica blows though,2015-12-22 05:24:17+00:00,cy7hgm3,2,t1_cy7fins,3931,LosAngeles
233,Lovin those mikkellers,2015-12-22 02:55:14+00:00,cy7cnun,1,t3_3xqw1d,22794,beerporn
234,Didn't get mine yet :/,2015-12-21 20:43:31+00:00,cy6z0nd,1,t3_3xqis3,5852,bloodborne
235,They were hot 5 years ago. Nowadays though there are just simply better breweries putting stuff out practically everywhere. Dogfish makes a lot of strange ales and I applaud them for always trying something new. But they don't taste that great too often and dogfishhead has a nasty habit of always putting out new stuff in four packs. So you go and see their newest brew in a 4pk at 13 or 14 bucks and in no way are you gonna take a chance on it when you can get your favorite brewery's 6pk for about 10 bucks. I really love their brown ale and I hope they fix their pricing and packaging soon.,2015-12-18 09:55:32+00:00,cy3991z,1,t3_3x9vvk,39584,beer
236,that some movie tier shit. Fucking killer.,2015-12-17 22:43:23+00:00,cy2r5lh,1,t3_3x5k2b,77558,bloodborne
237,"Yeah nah sounds like this guy just gets overwhelmed by choices easily but I don't think he's right about a single thing. Here in LA at least, places with vast beer selection are crushing places with minimal taps or bottle choices. People like the choice, craft is super popular right now and people want to choose a specific beer with a meal. I work in distributing and the accounts that carry more craft skews and try new beers or bottles regularly crush the places that stick to the same 4 skews every month.",2015-12-17 22:21:14+00:00,cy2qbpv,1,t3_3x7d9k,38139,beer
238,"&gt;shrill laughter and mumbled Ebonics 

Everytime.",2015-12-16 16:22:07+00:00,cy1455s,2,t1_cy12o8l,2324,movies
239,People still take plebfork seriously?,2015-12-14 18:41:37+00:00,cxywv15,1,t3_3wr4dr,43811,electronicmusic
240,It's possible. I once summoned a guy whose face look exactly like the church guards. Pretty much inverted colors of the guy in OPs pic.,2015-12-13 23:02:07+00:00,cxxzvjz,2,t1_cxxvty2,6319,bloodborne
241,Wtf man this is your personal stash?,2015-12-13 08:24:06+00:00,cxxc2qx,1,t3_3wlhs1,21256,beerporn
242,You won't see it because it's not disturbed in Cali in bottles. You can find it on draft but you won't find it bottles. Reason being they don't label the the abv and by CA law it must be labeled. ,2015-12-12 17:59:41+00:00,cxwm5o2,2,t1_cxw8ts4,42346,beer
243,Star Wars blows.  ,2015-12-12 06:26:38+00:00,cxw93p6,1,t3_3wghgz,17588,pics
244,Just one man...just sell me one.,2015-12-11 02:24:24+00:00,cxuvjl1,1,t3_3waat9,15284,beerporn
245,What kind of game is this where you can get shot over and over and keep on running like nothing?,2015-12-10 19:56:12+00:00,cxugjby,1,t3_3w8btc,17424,gaming
246,This will never be topped ,2015-12-10 12:35:57+00:00,cxu0gjm,1,t3_3w5ifs,41828,bloodborne
247,The amount of butthurt in the is thread by macro drinkers is great. ,2015-12-09 19:22:37+00:00,cxt5hov,1,t3_3w2zii,14756,funny
248,Don't be upset other people actually care what they drink. you drink shit beer and that's ok. No point in getting salty over other people's choices though m8.,2015-12-09 18:45:13+00:00,cxt3u4r,2,t1_cxsydby,7448,funny
249,"Your post is super ignorant. I really really hate people who just generalize IPAs into ""dude they taste like pinecones hurr"". There are hundreds of thousands of ipas out there. Some taste bitter, some taste shitty but a lot are amazing. Some have spices, or coffee(black IPAs), fresh hop IPAs are amazing and taste like tropical fruit. Just like merlot, it's an easier style to make and it's very popular, so the market is over flooded with the style. Of course with over-saturation comes a lot of mediocre product, but don't lump it all together with the bad stuff. 

IPAs are very versatile. If you don't like them that's fine but stop talking about something you have no knowledge about. ",2015-12-09 18:33:09+00:00,cxt3alx,4,t1_cxt1s83,2055,funny
250,Protip: we know. People drink it because they have no self respect,2015-12-09 18:10:12+00:00,cxt29yz,2,t1_cxswysc,7330,funny
251,It's very mediocre. Not trying to be rude but with the amount of stuff out now it's something you will taste and forgot about within an hour.,2015-12-08 22:33:01+00:00,cxs3n1b,1,t3_3vx1bw,40464,beerporn
252,This happened to me as well with chalice boss blood letting beast. Beckoner was not doing anything in the corner (sent me a message saying his controller broke but I think he was just scared) so I just killed the boss in front of him while he watched lol.,2015-12-08 22:30:00+00:00,cxs3idu,1,t3_3vxghd,30908,bloodborne
253,"Mikkeller is my favorite brewery and I'm very excited for this. Mikkeller in San Diego, and a new Mikkeller bar in Los Angeles coming soon. Very excited",2015-12-08 22:24:06+00:00,cxs39g9,1,t3_3vy5k6,20060,beer
254,Me too. Mikkeller is my favorite brewery for the wacky beers they make. Not just a novelty brewery though because they make hundreds of amazing beers and a few novelty ones. Recently had a 0.03% abv beer from them.,2015-12-08 22:20:32+00:00,cxs341x,5,t1_cxs0u5l,2997,beer
255,Just as planned.,2015-12-06 23:59:29+00:00,cxpo5l5,1,t3_3vofxi,23466,worldnews
256,Fucking Rekt,2015-12-06 17:13:54+00:00,cxp7s07,1,t3_3vn07a,34669,bloodborne
257,Looks like shit,2015-12-03 05:23:27+00:00,cxld0b1,1,t3_3v8ro7,1397,movies
258,"Everybody's crying and getting their asshole real tight about this comment but you are right. Everytime something like this happens, new bills or laws are introduced trying to further restrict access to weapons for people who want them legally.",2015-12-03 01:59:46+00:00,cxl5vd2,2,t1_cxkqrzx,22042,LosAngeles
259,"After the last patch I noticed it added a problem I never had pre 1.07 patch. When co-oping at certain time of a boss roar, music noise, hit sound and environmental sounds all happening at once I would notice that the sound would lock up and the music would start to skip for a few seconds like a broken cd. Everything would sound glitchy and after a few seconds resume. Don't know if this has happened to anyone else. 

Checked my disc and no dirt or scratches and this only happens with co-op after patch 1.07. Hope they fix this.",2015-12-02 01:25:55+00:00,cxjup9h,1,t3_3v2gde,6722,bloodborne
260,No need to get upset over someone else's comment on an Internet forum about a video game. ,2015-11-30 04:23:32+00:00,cxhko0x,3,t1_cxhaz8d,15638,bloodborne
261,"First of all its not complaining because I said I found it interesting. Second of all yes his gems do have a huge affect on the fight because if you're waste of skin yet have about 3 18+ or more damage gems on what appears to be a fully upgraded weapon you now hit just as hard as any other starting title. As apparent by the numerous comments in this thread saying ""you hit just as hard as my character"".  The no heal run is cool but with a fully maxed out weapon, tons of people can and have done this with even weaker weapons so again, I'm not shitting on the guy just saying there are a lot far more impressive boss runs than this.",2015-11-30 04:21:54+00:00,cxhklxv,3,t1_cxhf95q,8571,bloodborne
262,"Although I do think this run is interesting, it's not very flattering seeing as how you do just as much damage as somebody who doesn't have your restrictions thanks to your applied high damage gems.

Compared to the videos I've seen on here, like torch only runs for example, this isnt very impressive. ",2015-11-29 23:07:39+00:00,cxh8xhz,1,t3_3uqo9r,16689,bloodborne
263,I've been trying for hours but no luck. Can get real close but I always manage to get one shotted by something. Got to the point where I had to summon and even they are dying constantly.,2015-11-28 11:41:18+00:00,cxfn68o,1,t3_3uk16q,20281,bloodborne
264,Nice,2015-11-28 06:27:51+00:00,cxfik7r,1,t3_3ujkxq,10408,todayilearned
265,"Yes, the amount of hoops I had to jump through this year (aka every year) to get bc is frustrating. Had to carry about 4 different skews for months to get my allocation. And I still got fucked over, by only getting the stout and no variants. Been on the phone with the distributor all day. ",2015-11-26 04:39:51+00:00,cxdex1g,3,t1_cxd8q3o,12284,beerporn
266,Lol whoops sold some dude four of these yesterday at $10 each. Didn't know I had to wait until Black Friday. Pulled them off the shelf.,2015-11-25 19:50:35+00:00,cxcxful,1,t3_3u7z4n,18063,beerporn
267,Still need help?,2015-11-24 21:41:44+00:00,cxbvfjq,2,t1_cxbenx7,24235,huntersbell
268,COMPLETED THANKS,2015-11-24 10:15:19+00:00,cxb8xs7,1,t3_3u27kh,1839,huntersbell
269,The dlc was already downloaded n the latest 9 gig patch. You already have it downloaded. All you are downloading now is a small activation key if you will. So technically you already have the DLC just need to download the key.,2015-11-23 19:38:53+00:00,cxagwks,2,t1_cxa34tq,23159,bloodborne
270,Hell yeah. Always down for some co-op. Especially since my high level guy hasn't been getting much love lately. Pm your psn name and I'll add you when I get off of work later.,2015-11-23 19:33:21+00:00,cxago15,4,t1_cxaghj4,249,bloodborne
271,Same boat as you man. Hated the idea of making a new character but I missed co-op and at level 285 it was rare outside of chalices. So I made a new one and capped at level 80. It will be interesting to play through the DLC at both levels. ,2015-11-23 19:25:30+00:00,cxagbpi,2,t1_cxad6rr,4405,bloodborne
272,Glad this was fake. If it was real I would genuinely be upset. The whole point of bb is that it's tragic and violent. Kids aren't safe from the nightmare.,2015-11-23 19:08:33+00:00,cxafli7,1,t3_3ty6gs,14057,bloodborne
273,this place blows. really nickle and dime you. Plus its in K-town and the area is a nightmare to drive in.,2015-11-23 05:40:54+00:00,cx9vm1g,1,t3_3tuyoc,29088,gaming
274,The patch is out already? I thought it came out a few days after the DLC?,2015-11-20 16:22:11+00:00,cx702r0,1,t3_3tk95g,12121,bloodborne
275,It happens,2015-11-18 21:35:25+00:00,cx4zc60,1,t3_3tbjir,13417,sanfrancisco
276,"Yeah looks like we have another anchorman 2 and dumb and dumber 2 here. The trailer alone had about 5 rehashed jokes. The pictures got me excited for this but I didnt even crack a smile at the trailer. Hopefully I'm wrong, and it will be great.",2015-11-18 16:21:03+00:00,cx4m7e3,1,t3_3tafur,11853,movies
277,"Yeah the router goes up to 300mbps so it supports more than our needs. And yes I've talked to time warner over the past few months extensively. Our internet used to go out every other night at around 2am for some reason. Or halt to insanely slow speeds such as 1kbps, they came out and were able to fix it after a couple of visits. But as for this speed problem they haven't  been able to do much and at this point I'm kind of fine/over it. Dealing with the online techs is exhausting as I find myself repaying the same convo everytime I call.",2015-11-18 01:05:08+00:00,cx3zmq9,6,t1_cx3wg9h,5271,LosAngeles
278,It's not,2015-11-17 22:53:38+00:00,cx3ut64,1,t3_3t6ntp,17342,beerporn
279,"Truly envious. I'm on their 200 Mbps plan but the most I ever get is 80 using wifi. I could get higher using Ethernet SOMETIMES. Called them and they gave me the ""up to doesn't mean guaranteed"" spiel.",2015-11-17 22:52:20+00:00,cx3ur9p,4,t1_cx3t9q6,2266,LosAngeles
280,up to*,2015-11-17 22:06:02+00:00,cx3sx6y,2,t1_cx3mqhk,8644,LosAngeles
281,Started telling my phone to shut up when they wouldn't be quiet over the npc dialogue. Got a bit too excited.,2015-11-17 21:47:10+00:00,cx3s5a4,1,t3_3t73db,7642,bloodborne
282,"Very nice selection, I also work as a buyer for a bottle shop in Hollywood. You have many lime ventures products here (assuming your in CA) now do you hate dealing with them or do you really hate dealing with them? Lol they are such a headache to deal with but they have amazing products. Every buyer I meet says the same thing about them as well.",2015-11-17 21:36:01+00:00,cx3roab,1,t3_3t49p3,60110,beerporn
283,"I t s
t
s",2015-11-16 17:51:00+00:00,cx29mz8,1,t3_3t0m2y,17346,videos
284,Holy shit that's great. Are you gonna layer the feather until they reach feet length?,2015-11-14 22:04:05+00:00,cx0apmd,1,t3_3ss3b8,29645,bloodborne
285,Not to sound like a ps fanboy but you do realize these are two entirely different sections (sony bmg and playstation) of a conglomerate run by completely different people right?,2015-11-11 10:21:47+00:00,cwwdvbq,2,t1_cwwcw06,4362,todayilearned
286,"Ah yes I remember pouring this after a few beers and remember spilling half of it over what I thought was a bad pour. Guess it was just badly carbonated. I'm a die hard Mikkeller fan and I've tried tons of beer geeks, this is probably one of my least favorites. Way too boozy to be balanced IMO. Brunch weasel is still my top.",2015-11-09 21:59:36+00:00,cwul9yd,1,t3_3s624r,10618,beerporn
287,I always get downvoted for this but I don't care. That FO is good but way overhyped. I would age it for a year or two. Mine tasted like it hadn't reached its full potential yet.,2015-11-07 19:46:22+00:00,cws2oql,1,t3_3rw62w,17108,beerporn
288,Well yeah that makes sense. I guess it's because this is the first time I'm hearing the whisky barrel distinction. The title implies that barrel aged beers have been gone. My fault for not reading the actual article.,2015-11-07 19:43:51+00:00,cws2lnu,3,t1_cws1jh7,1789,beer
289,How is this different from oak aged yeti which was just released?,2015-11-07 19:04:17+00:00,cws17hg,1,t3_3rwfai,9954,beer
290,When the meme so supreme you let out a scream.,2015-11-06 16:19:23+00:00,cwqrgyi,1,t3_3rr38g,17486,videos
291,I love co-oping. keeps me playing the game long after platinuming and now even more since this news or co-op specific covenants. wish people didn't stop leveling up. This was my first souls games and i didnt know people usually stop after a certain level.,2015-11-06 00:19:57+00:00,cwq29tn,3,t1_cwpyk49,5980,bloodborne
292,Shit guys I need advice. All this new co-op talk has me worried. I'm currently level 284 and I'm afraid I'm not gonna get much co op action when the doc comes out. I pretty much can only find chalice co op right now. I really really hate the idea of making a new character and starting over but do you think I'm gonna have to do it to get the most out of this DLC?,2015-11-05 21:14:12+00:00,cwpuy3d,1,t3_3rn5hj,18153,bloodborne
293,Otherway around for me. I come here for a little bit after other sites have bored me. Honestly can't stand to be on here for more than 15 mins. I can't go a single thread without reading some stupid ass pun.,2015-11-04 23:54:11+00:00,cwosem8,1,t3_3rih54,24584,AskReddit
294,Like molested?,2015-10-28 21:25:10+00:00,cwgdppg,1,t3_3qlsi8,5336,LosAngeles
295,Edit: whoops misread the bottles for those awful crime and punishment beers stone did. Hope you didn't bring any of those in because those are definitely long long time shelf sitters.,2015-10-28 16:46:35+00:00,cwg1mxc,1,t3_3qku9g,1136,beerporn
296,"""We've already stopped certain comedians from saying those jokes""
So I see your just pro censorship. Got it. 
""I'm a straight white male who's never been made fun of""

Jesus how did I not see this before. You're just false flagging tumblerite. ""I'm white and I've never been made fun of ever because of my priv""

Try to be a little less obvious next time. Shame I didn't hear what country you're in, because it would be nice to visit a delusional fantasy island where nothing bad happens and everybody is always nice to each other. Go back to tumbler , the rest of the Internet is gonna make you cry...more.",2015-10-28 15:20:22+00:00,cwfxz7g,10,t1_cwfp8od,20689,funny
297,"You can call me insensitive all you want. Do I personally advocate bullying? No. But it is going to happen and those who are too mentally unstable to handle a few nasty words are literally not fit for survival. As I said before, everyone gets made fun of and put down but we don't all kill ourselves. If the trans community has a big problem with suicide then that should be enough to let a light switch go off in your head and make you realize a lot of these people aren't healthy mentally and stopping bullying (which is impossible by the way) won't make that go away.

And since we've digressed so far I think you're forgetting the biggest part of this. It's about a fucking comedian making a joke. That's his job. He makes fun of everyone. If a certain group is going to take it personally then who gives a shit, fuck them. It's called having a sense of humor and not being a stuck up no fun idiot.",2015-10-28 04:21:46+00:00,cwfjd4x,8,t1_cwfhpdr,3008,funny
298,"I see you have misunderstood my post and are now just jumping to conclusions. At no point did I ever say it was ok to bully ANYONE but what my point was is that it's gonna happen regardless of wether you want it to or not. So being openly against bullying to just one specific demographic is dumb as hell. Also at no point in any of my posts did I assume you were from anywhere in specific as origin is not even relevant to this discussion. Are you even reading anything here?

EDIT: Also I'm never going to apologize for speaking my opinion or beliefs. If you want to live in some fantasy land where everyone has the same views and opinions as you, and everybody is nice to each other you go ahead but I'll be here in the real world.",2015-10-28 03:04:49+00:00,cwfgqib,6,t1_cwfegs3,3509,funny
299,"These people don't hold a monopoly on being bullied. Almost everyone I know has been a victim to bullying at some point in their life, but we're not all gonna kill ourselves are we? Oh boo hoo people are saying nasty words to me. It's pathetic, honestly. You have people being born in war ravaged countries plagued by hunger whom refuse to die and keep fighting to survive. Yet somebody's gonna go and off themselves because not everybody is crazy in love with them? Empathy for what? These people have proven they are mentally unfit to survive. If ""bullying"" doesn't make them kill themselves I'm sure something else will. Just look at studies that show pre and post op suicides. 

Everybody seriously needs to regrow a backbone. This country is going down the shitter because people are to afraid to make a joke without getting called a transphobic, homophobic, racist, etc

Sad times we live in.",2015-10-28 00:48:06+00:00,cwfb9bt,4,t1_cwf9ip7,2643,funny
300,"I just opened my FO last sat and thought it was a great beer but really not worth the hype. The smell was incredibly boozy, surprisingly not the taste though which was very pleasant. Very good vanilla notes. Liked it but honestly there are much better ""rich tasting"" type stouts that are easier to obtain and taste better IMO.

Mikkeller beer geek: dessert
Lost Abby track 10 or even serpents stout.
Amager Danish metal 

Just to name a few ",2015-10-26 20:46:53+00:00,cwdsjv5,1,t3_3q9zlr,26481,beerporn
301,"Subaru 
Playstation
Mikkeller beer
 Those are big three, can't really think of much else",2015-10-25 21:05:59+00:00,cwclpgo,1,t3_3q5aw1,27135,AskReddit
302,"Haha love how butthurt all you guys are. Quick to always shout ""muh free speech"" yet when you get triggered all of you start spouting ""durr I'm not mad it just wasn't funny"". There's a reason this dude has a Netflix special. It's because he's funny. Grow a backbone you fucking crybabies.",2015-10-25 16:25:58+00:00,cwca4br,1,t3_3q54xx,14072,funny
303,"I don't care if they are, that's on them and shouldn't stop people from making jokes or saying anything that's on their mind. The moment you start saying ""you can no longer make fun of X because it's offensive to y"" is the moment that logic will be applied to everything. It's comedy, grow a backbone you pussies. ",2015-10-25 16:21:57+00:00,cwc9yv0,2,t1_cwc8hzr,2485,funny
304,Overrated. Come to me DV,2015-10-24 08:53:32+00:00,cwb0bu6,1,t3_3pyuw3,34863,beerporn
305,"Work at a craft beer shop and I occasionally PA for movies. I don't mind how things ended up tbh. I'm only 24, don't think grades played to much in this choice but we'll see where I end up later.",2015-10-21 18:15:43+00:00,cw7vlpw,1,t3_3pm4li,29879,AskReddit
306,Hence why I kept referring to them as faux hipsters. Rich dudes just trying to get in on the fad wearing $250 pre ripped jeans and riding their $1000 fixed gear bikes. Acting like they've been there forever when they're  fresh from the valley.,2015-10-21 03:25:55+00:00,cw78kyf,4,t1_cw6yzvb,15899,LosAngeles
307,"I also never really cared about any cirque de solee shows because I thought it was just like a cheesy circus type thing. But man did those shows blow my mind. If you ever change your mind about vegas, the best solee show is called KA at the MGM I believe. Jesus man what a show. Its like being in the middle of a big budget action movie.",2015-10-20 21:42:32+00:00,cw6w1u1,4,t1_cw6vtsy,320,LosAngeles
308,I cant do a good number of the root chailces because I cant find any fucking tomb mold 5!!!!!! where is that shit I must have redone all the original chalices and I still didn't find any!,2015-10-20 21:37:38+00:00,cw6vug0,1,t3_3ph13p,41886,bloodborne
309,I had that same Vegas mentality for years. Had zero interest in gambling or clubbing. But I want a couple of months ago and had a blast. Lots to do besides the above mentioned and now I can't wait to go back. Only thing that's really shit is the heat and humidity over there.,2015-10-20 20:45:39+00:00,cw6tnkc,2,t1_cw6opi8,6737,LosAngeles
310,Ah yes my bad. It's called oatmeal but it is brewed with raisins. ,2015-10-20 20:39:12+00:00,cw6tci2,5,t1_cw6iqc9,14762,beerporn
311,Well that makes more sense. Watch out for Mercedes though. Those guys seem to have it out for you.,2015-10-20 20:37:15+00:00,cw6t8wo,6,t1_cw6rxx4,1749,LosAngeles
312,"Yeah nah. When I first moved to LA, I chose to  live in Venice right by the beach for the first 2 years of me here. 

I got sick of the west side real real quick. The same million dollar modern architecture house on every block. The same overpriced cliche faux hipster coffee bar or restaurant. The same overtly douchy nightclubs and bars of Santa Monica. The feeling of being trapped in a bubble because you don't want to be stuck in traffic for hours to visit other parts of the city. Having friends not want to visit because of said previous reason.

Honestly got tired of the zero diversity the west side has to offer. Everything is new or trendy and overpriced, the place feels like it's losing its soul quick. Venice seems like it got a hold of the San Francisco flu where the place used to have some good vibes and nice diverse areas then all these faux rich hipsters moved in, drove up the cost of everything around them while dulling out the place by making everything in the area identical. 

Place is nice to visit but I can't ever imagine moving back. ",2015-10-20 20:19:55+00:00,cw6sgtj,2,t1_cw6ivu5,13382,LosAngeles
313,"This is incredibly false. I used to live in San fransisco and I thought that public transportation system was bad but Jesus LA takes the cake for the worst.

I used to live in Venice when I first moved here. I also didn't think I needed a car, boy was I wrong. Had a brother who lived in Hollywood. If I wanted to go grab  dinner with him one day I would literally have to make a whole day about it because it would take me two hours to get there and then two hour back by bus. Moved to k-town a bit more central and got a job in weho. Left an hour early to make sure the bus wouldn't make me late for my interview. The bus was 30 minutes late and on top of that the driver stopped at a convenient store to get  snacks on everybody else's watch. Not to mention the all to common problem of having every bus be late then having them arrive in pairs because these idiots can't seem to work a cohesive schedule. 

So my job at the time had me ending very late. Like at around midnight. Waiting for a bus at that time was the absolute worst. Walk to bus stop wait an hour for the next bus, bus arrives but it doesn't stop at all because it's packed to the brim with people. Wait another hour for next bus, next bus doesn't stop because it's so packed again due to the insanely long wait times between busses. Next thing you know it's 2am and you're still at the bus stop.

Public transportation in the city is a joke. Sure you can survive in this city without a car. But you are having to spend a massive chunk of your day waiting and riding busses. Your ability to go when and where you want is severely hindered by not owning a car in this city. I mean unless you like dropping cash everyday by getting a lyft to places",2015-10-20 20:06:28+00:00,cw6rvbn,4,t1_cw6jmvm,11485,LosAngeles
314,Gonna have to agree with OP on this one. The espresso ones acidity is too overpowering IMO and the raisin one just isn't that great. The oak aged regular yeti is good but I do think the choco yeti is king.,2015-10-20 02:51:52+00:00,cw5yqzm,2,t1_cw5wjhj,3215,beerporn
315,"Some really bad photoshop, that's about it.",2015-10-20 02:48:47+00:00,cw5ymdk,1,t3_3pft82,902,truecreepy
