,body,created,id,nest_level,parent_id,reply_delay,subreddit
316,"I don't blame you for being pissed op. Bloodborne was my first souls game too. And I had your situation happen to me as well. Had about 7000 echoes (which I thought was a lot at the time) and had spent hours getting through the first area only to get killed by a stupid werewolf. The thing is no enemy in any area is really overpowered, some stronger than others but all are manageable. believe me this game has made me rage more than any other game ever but the feeling you get when you overcome something is something I've never felt from any other game. It's insanely satisfying. The game punishes you for getting greedy so be smart and only attack when you know you can. Even for my character whose at level 283 can still get wrecked for being over confident. Take breaks with not playing, it helped me. Stick with it man. You'll end up loving this fucking game.",2015-10-18 16:30:10+00:00,cw42yqz,1,t3_3p66mj,59398,bloodborne
317,Damn that was a pretty much spot on remake. Props to that dude because we know sebs never gonna release it.,2015-10-18 16:16:57+00:00,cw42go8,1,t3_3p7pop,20766,EdBangerRecords
318,Yeah it was incredibly mediocre and the entire story was pretty pointless. Also if you take away the beer aspect (which was the only reason I watched) it doesn't really affect the story in anyway. Movie is just a mediocre rom com.,2015-10-18 15:31:08+00:00,cw40wa3,2,t1_cw3ru8p,31170,beer
319,Dude literally has the charred hunter gloves.,2015-10-15 20:32:59+00:00,cw129n3,1,t3_3ovhj4,14686,bloodborne
320,"Having tried all of those before I can safely say Galaxy is the best with Pliny (depending on how fresh) a close second and enjoy by (again depending on the batch as some are better than others) as third. Noble is on top of their dipa game. The showers series was amazing and tongue tickles is godly. They need to bring back Nelson showers. That was an amazing dipa. Wasn't too crazy about this modern times special. City of the sun was a favorite IPA of theirs, much much better than this one imo.",2015-10-12 17:36:00+00:00,cvx4d2k,1,t3_3of1f6,44689,beerporn
321,I live in Southern California and here they are distributed by stone. Stone is pretty much everywhere here so it makes sense they would push for port brewing. Safeway/Von's/Ralph's have all been upping their craft selection over the past months as I've noticed a lot of more niche breweries like schmaltz showing up in big chain stores.,2015-10-12 17:21:52+00:00,cvx3s8p,1,t3_3ofepk,34157,beerporn
322,"I'm the buyer at a beer shop so I'm always trying new beers. I've been told the app would be great for me but I honestly don't see the point. Instagram works so well already as it is. I post every beer I try, with hashtags other people interested in the beer can chime in and comment. I've meet new people through Instagram for trades and getting together for bottle shares. I don't think untapped is necessary to be honest if you're already on Instagram.",2015-10-12 15:23:54+00:00,cvwz9qk,1,t3_3oezbk,38065,beer
323,I was expecting to find really interesting stuff but most of it was actually pretty boring. Pretty much every paper on the floor was a budget doc or regulations meetings doc.,2015-10-12 09:51:12+00:00,cvwruxw,3,t1_cvwrfuq,1935,LosAngeles
324,Idk I've once went inside some old abandoned  hospital near downy once and it was full of old patient records from the 70's and other creepy stuff.,2015-10-12 09:03:01+00:00,cvwr84r,1,t3_3od9nw,46028,LosAngeles
325,Funny I just gave up on dark souls 2 last night. Was around level 72 and just killed about my 7th boss. I was drunk so I stupidly killed the lady who levels you up only to find out she wouldn't be back. I wasn't stuck or anything I just honestly was not enjoying the game at all. I found it boring and I hated the slow mechanics of it so I deleted the game. I honestly am fine with this because I had zero fun with dark souls 2. Went back to BB and had a blast ,2015-10-10 15:31:58+00:00,cvutz2m,1,t3_3o6pxd,39026,bloodborne
326,Awwww hell yiss ,2015-10-09 18:29:54+00:00,cvtz2ss,1,t3_3o4oaa,546,PS4
327,Ok but when the fuck are we getting a White Castle?!,2015-10-09 02:22:20+00:00,cvt9kjs,1,t3_3nzp0t,34510,LosAngeles
328,"Idk man. I have a +10 wheel with high blood gems that I never use because I think it's too slow to use effectively but yesterday I was playing really drunk and decided to co-op with a really
Silly build.  Ariana's shoes, no pants or torso piece and a mensis cage and of course the wheel. I get summoned to help a guy with the three merciless watchers. I knew I was gonna die with the stupid build so I just went into fuck it mode and started going full offense. To my surprise I ended up wrecking every single one of those guys within a minute or two. Last time I underestimate that precious wheel.",2015-10-07 20:15:00+00:00,cvrodd4,1,t3_3nuwdu,13308,bloodborne
329,"Gonna have to disagree with you on that one. Love the games but the community is toxic as hell.

""Hey guys how do I get past these guys in this hall?""

""Git gud""

....

""Ok""",2015-10-06 20:54:56+00:00,cvqj3n7,2,t1_cvpy48p,36941,AskReddit
330,beachwood. nice,2015-10-03 00:23:08+00:00,cvmav3w,1,t3_3n79mt,61088,beerporn
331,Aww bummer I thought this was new footage,2015-10-02 20:03:30+00:00,cvm24uy,1,t3_3n8rks,12596,bloodborne
332,All these people saying they would beat him to death/shoot him or kill him in some horrible way is pretty funny. The hypocrisy you guys have on here is hilarious.,2015-10-02 19:55:07+00:00,cvm1t73,1,t3_3n7xu4,26066,WTF
333,I don't see how relationship status is relevant to this in any way. It's a matter of seeing this all the time and becoming a little desensitized to these videos.,2015-10-02 19:49:28+00:00,cvm1l5z,6,t1_cvlxvba,5626,WTF
334,I know what you mean OP. I'm level 285 and co-op is pretty much gone at this point for me.,2015-10-01 15:31:48+00:00,cvkkk41,1,t3_3n3e76,11397,bloodborne
335,"Yeah dude you really showed how little you can stand other people having opposing viewpoints.

Fuck off back to tumblr and go get triggered there.",2015-10-01 04:34:54+00:00,cvk6qgn,6,t1_cvk6nqn,176,LosAngeles
336,Cat ears and whiskers.,2015-10-01 04:25:47+00:00,cvk6hvi,4,t1_cvk3txx,5319,LosAngeles
337,Wow look at you being all offended and anal pained over a comment. ,2015-10-01 04:24:33+00:00,cvk6gp5,4,t1_cvk1ugl,8752,LosAngeles
338,Get it in,2015-09-30 19:09:48+00:00,cvjma8f,1,t3_3myt0r,18765,AskReddit
339,"Traumatic? Really? Being held an hour after school and being asked a couple of questions is traumatic? He's 14 not 4. Also he probably wouldn't have even been detained had he been willing to cooperate in the first place. This kid knew exactly what he was doing. He played everyone, you especially apparently.",2015-09-28 19:35:17+00:00,cvh83s9,2,t1_cvh2hnj,8185,videos
340,Absolutely love beer geek. There are so many variations of it too. I just opened the beer geek: dessert last night and it was incredibly tasty. Beer geek brunch weasel is great too.,2015-09-27 23:52:03+00:00,cvgcf1p,1,t3_3mmhew,7174,beerporn
341,I'm at 279 so somebody let me know what this is,2015-09-24 21:54:41+00:00,cvd2ip4,1,t3_3m6iqu,44042,bloodborne
342,"Even worse when you wait like 20 minutes at a gravestone, get summoned only to have the beckoner die somewhere and get sent back right away.",2015-09-21 16:48:45+00:00,cv95x9j,1,t3_3ls5zy,29551,bloodborne
343,"Wow, I've platnumed this game and I didn't even know you could summon in the hunters dream.   ",2015-09-20 15:25:32+00:00,cv7xbyt,1,t3_3lnrs8,21424,bloodborne
344,"Nah fuck this kid. He knew that clock looked sketchy. His teacher told him to put it away yet he would still show it around. He chose that case because he knew that people would easily mistake it for something else. He was just trying to cause trouble then as soon as hes in it, him and his dad play the race card. Also this kid is 14 not fucking 7, what 14 year old actually considers taking the plastic casing off a clock an invention? Fucking scam artists if you ask me.",2015-09-20 09:55:12+00:00,cv7rrzg,1,t3_3llkt1,48176,pics
345,The only scary thing about this is the reminder that the next silent hill game is a pachinko machine.,2015-09-19 15:41:24+00:00,cv6z2um,1,t3_3ljlwh,17565,scaredshitless
346,Just how disappointed of you are your family members?,2015-09-17 06:14:08+00:00,cv4fnec,1,t3_3l85dm,29957,IAmA
347,HOLY FUCK GET HYPE,2015-09-15 20:51:11+00:00,cv2rkbb,1,t3_3l0jl6,49095,bloodborne
348,"Generic answers but I love the BOM, BB and Kirk hammy. Wheel looks cool but I just can't seem to master it.",2015-09-14 17:20:55+00:00,cv1byck,1,t3_3kwxzf,9559,bloodborne
349,Shit that is badass. I wanted to go full hunter this Halloween too but I just don't have the time nor skills to make my own costume. They have a hunter outfit for sale on eBay but it's horrible quality so I'm passing.,2015-09-14 17:10:29+00:00,cv1bjm6,1,t3_3kv9lr,47138,bloodborne
350,"Oh no stop the presses , someone likes a different baseball team!",2015-09-10 21:38:43+00:00,cux7uk0,3,t1_cuwwi7e,17506,beer
351,"It's a soap stone, you can use it to summon",2015-09-10 20:38:18+00:00,cux5k6p,1,t3_3kf6ff,14335,funny
352,I'm at 272 and at this point online play is pretty much dead. No idea why anyone would go higher.,2015-09-08 19:57:45+00:00,cuus1k7,3,t1_cuum0e5,9066,bloodborne
353,"Huge fan of Mikkeller. Huge! I love their bar in San Francisco! Glad to hear they are opening this month in San Diego, since it's closer to my place in LA!",2015-09-07 06:54:08+00:00,cut8v72,1,t3_3jwtha,25829,beer
354,Haha fuck off with this.,2015-09-06 20:18:24+00:00,cusrpp1,1,t3_3jw44h,358,beer
355,"just recently beat it but i was amazed by how good it was.

THE WOLF AMONG US

loved it, the writing and direction was brilliant, should had been an HBO miniseries. You learn characters are not just black and white but have multiple shades of gray. Also a kick ass score. Jem of a game.  ",2015-09-05 06:46:13+00:00,curbin5,1,t3_3johsm,27767,AskReddit
356,Jeez the amount of butthurt by macro drinkers in here is insane.,2015-09-04 16:45:44+00:00,cuqlc3o,1,t3_3jlwoq,17521,funny
357,"Short answer yes. People drink it to get drunk, there is little to no actual taste in the thing.",2015-09-04 16:43:28+00:00,cuql8pr,2,t1_cuqe5yg,11195,funny
358,I realize it's a matter of preference but to be honest one type of beer is objectively better than the other. It's the same as saying a burger from a nice steakhouse is better  than a mcdouble. Sure you can like the McDonald's better but to say they are on the same level is delusional.,2015-09-04 16:39:34+00:00,cuql30q,2,t1_cuqe3sa,11078,funny
359,Ace beverage rep pls go,2015-09-04 16:35:35+00:00,cuqkx5c,2,t1_cuqdvr1,11285,funny
360,"Seriously all that bullshit in OPs pic, I would have seen the length and tossed that shit aside. If you got a problem with something I'm doing tell me straight up. Don't pussyfoot around.",2015-09-04 06:59:11+00:00,cuq79fh,2,t1_cuq6ogd,2009,LosAngeles
361,Yet another reason to hate this website. Idiots upvoting retarded shit like to the front page.,2015-08-31 17:08:08+00:00,cum0332,1,t3_3j2sw2,16927,pics
362,"There are a lot of IPAs that taste like pinecone and grass and I love those but what I would recommend if you can get your hands on them are some ""California style"" IPAs, most have delicious tropical fruit favors and very few have that overtly bitter grass taste. Give these a shot if ya see em.

Mosaic IPA by st. Archer

Just outstanding IPA by kern River brewing

pretty much every (not a name) IPA by noble ale works

Pretty much every (again not a name) IPA by el segundo brewing co

Enjoy by, by stone brewing co

Day glow by Elysian brewing co

aroma coma by drakes brewing co

Maharaja by Avery brewing co",2015-08-31 16:48:30+00:00,culzapa,3,t1_culvhwb,5972,todayilearned
363,mostly anything by almanac,2015-08-31 06:08:18+00:00,culkn4f,1,t3_3iwux9,101193,beer
364,"Actually I remember reading some time ago where Miyazaki himself said how one of the direct aesthetic influences for bloodborne was in fact bam stokers Dracula, whether it was the book or movie I don't remember but I'll try to find a link and edit it in later.",2015-08-30 18:00:58+00:00,cuky512,4,t1_cuklz3l,29942,bloodborne
365,"While I personally think this order is whack, I dig all the effort and time out into this.",2015-08-28 17:22:46+00:00,cuits1g,1,t3_3iqfhw,8338,beer
366,Yes it is. ,2015-08-28 06:43:12+00:00,cuidxvw,5,t1_cuiciit,4430,AskReddit
367,"On an unrelated note, I can't find anyone to play with anymore in this game. I think I'm over-leveled. I'm 270 and I could ring for hours without finding a single person. I'm on time warner 300mbps plan so I know it's not my internet. No other game does this. I could co-op fine when I was lower but now, nothing.",2015-08-28 02:02:37+00:00,cui6tdx,1,t3_3im1yp,36020,bloodborne
368,"This dude is naive or ignorant as hell. Talking like his ideas would even work or as if they are even good ideas in the first place. Crazy people shit on the street because they're crazy and don't care, that's pretty much it. ",2015-08-26 21:14:12+00:00,cugq7cp,1,t3_3ihfnz,16991,sanfrancisco
369,"Fuck Israel up their stupid fucking asses. The arrogance he has, fuck that piece of shit and fuck their war mongering. ",2015-08-25 07:39:37+00:00,cueux7r,1,t3_3i94xp,35917,worldnews
370,"You can hear her after helping someone, regardless of what gesture you do. Heard her before, and again yesterday. As another said, it's just a bug.",2015-08-23 23:54:20+00:00,cudbwco,1,t3_3i45rq,13414,bloodborne
371,"My go to when I don't want any special 22oz and just want a six pack to sit back and kill has to be finest kind IPA, followed by pizza port swamis IPA, the. If those are all gone maybe the grapefruit sculpin. Good thing about working at a bottle shop being the buyer is that I can always buy my own stash, at cost price. ",2015-08-23 22:56:52+00:00,cud9xq7,1,t3_3i30h9,29585,beer
372,"Absolutely love that bar. Bought some Keith shore spontan sour prints in the sour room downstairs, which now hang in my living room. Stoked they are opening a bar here in San Diego soon ( much closer to me in LA).",2015-08-23 22:47:13+00:00,cud9mo1,1,t3_3i3uny,14464,beerporn
373,Used to live right across the st. and frequented the store. It's a more than usually busy location so them not picking up right away makes sense. That being said I've never had trouble getting someone to answer the phone there. Also asking this on reddit is a bit strange as this is a very specific question you're asking the vast majority of LA redditors.,2015-08-22 18:25:16+00:00,cuc0bw4,1,t3_3hznai,2415,LosAngeles
374,"Seriously I'm in the same boat. I've been plying nothing but blood borne and the last of us multiplayer both have very tight intricate combat mechanics. Picked up God of war remastered as my first GOW game and I'm not a huge fan. Can't get past the second boss because for me mashing one button and jumping over and over, hitting something with no real sense of aim is way more difficult than any part of bloodborne.   ",2015-08-22 16:53:00+00:00,cubxby0,5,t1_cubvzpg,2569,bloodborne
375,Why is this not available for distribution in CA? Ive seen it on tap but never in a bottle.,2015-08-22 04:28:29+00:00,cubi9jx,1,t3_3hxgiw,4799,beerporn
376,"&gt; They're just Brewers

and youre just some random guy on reddit. I think I'll take their word over yours easily.",2015-08-22 00:32:53+00:00,cubb3qu,9,t1_cuba37w,1920,beerporn
377,How is it not a good source? You're hearing it directly from brewers who work at Founders and Cigar city.  You not agreeing with it doesn't make the source invalid.,2015-08-21 23:58:33+00:00,cuba0jc,7,t1_cub9d0a,1198,beerporn
378,"Stout and porter are often the same 

http://www.craftbrewingbusiness.com/beer-of-the-month/what-is-the-difference-between-porter-and-stout/",2015-08-21 20:45:24+00:00,cub3da2,5,t1_cub2oru,1075,beerporn
379,"You do know that a majority of times there are literally little to no differences between a stout and a porter. And most times it's just whichever the brewer decides to call it. For six packs most people prefer to call their dark beers a porter. Marketing as less heavy and less daunting than drinking a whole six pick of a a stout. To most people who know beer, they know there are very little differences between the two and most time none at all. It's all for the sake of a name change. 

http://www.craftbrewingbusiness.com/beer-of-the-month/what-is-the-difference-between-porter-and-stout/",2015-08-21 20:42:44+00:00,cub39ky,5,t1_cub2o6g,942,beerporn
380,Good job. Not gonna lie though you're music choice made me close the video about a quarter of the way in.,2015-08-21 17:53:19+00:00,cuawkzf,1,t3_3hv1e4,7067,bloodborne
381,Toss that rouge voodoo doughnut out and thank me later,2015-08-21 17:35:26+00:00,cuavud1,1,t3_3hum84,12576,beerporn
382,Nope I agree with him. Weak ass coffee stout. Acidity was so high I might as well have just been drinking cold brew coffee ,2015-08-21 17:34:57+00:00,cuavtmo,3,t1_cuauy8t,1244,beerporn
383,Everybody? Even those pedophiles out here?,2015-08-21 17:23:32+00:00,cuavci7,5,t1_cuapwga,7995,worldnews
384,Reddit isn't one single person genius. Different people with different ideas/opinions. Get off your soapbox you crybaby,2015-08-21 17:19:24+00:00,cuav66a,2,t1_cuaja82,21183,worldnews
385,"It's $16 pretty much everywhere and they have no intention of a price drop any time soon. The stuff flies off shelves pretty much everywhere. At my bottle shop we have to consistently order at least 8 cases each week. The demand is high, why lower prices?",2015-08-20 00:19:09+00:00,cu8xben,6,t1_cu8iejt,22491,beer
386,have been blessed enough to try each of these (and not pay for them). Love these. Sang royal is my favorite,2015-08-18 10:56:32+00:00,cu6wrfm,1,t3_3hcyag,51465,beerporn
387,"I really don't like session Ipa's. I agree that they taste good, but a lot of the fun (for me) is the nice warm buzz I get after my 3rd or 4th. I've been working in craft for a while now and I have a personal saying with my craft choices, ""If i get bloated before I get buzzed, it aint worth it"". This applies heavily to session beers. ",2015-08-18 01:17:07+00:00,cu6jytv,1,t3_3hcbws,25675,beer
388,"No hes' right. Ive been working in craft for about 4 years now and I'm still learning everyday. What I do know for sure is, that the US is hands down number 1 when it comes to craft beer and innovation. You can look it up or if you're too lazy I can do that for you. ",2015-08-18 01:11:11+00:00,cu6jrps,4,t1_cu6eyqw,8632,beer
389,Yeah live right next to it. Food isn't bad but idk something about it just doesn't work. Feels like it's trying really hard to be something it ain't.,2015-08-17 06:13:18+00:00,cu5mxr9,3,t1_cu5jpt6,8218,LosAngeles
390,Never heard of this beer or brewery ever. Then a friend brought one to a bottle share. ABSOLUTELY BLOWN AWAY. It has become my favorite sour now next to Tart of Darkness and Lou Pepe. Shame they dont distribute. Im a beer buyer for a shop in Hollywood and I would love for more people to try this. ,2015-08-17 03:51:37+00:00,cu5jl7k,1,t3_3h9bh8,11600,beerporn
391,"As some other people have said, mix it with grapefruit sculpin and it tastes good.",2015-08-16 04:44:23+00:00,cu4kukr,1,t3_3h51us,23583,beerporn
392,Looks like every comment in here got down voted. Who cares lol. Imaginary Internet points that mean nothing,2015-08-16 04:28:35+00:00,cu4kgwt,3,t1_cu4i7hf,5213,beer
393,And not one Mikkeller can at all. Keith shore doing all the artwork for Mikkeller is hands down my favorite and trumps all other beer label art by far.,2015-08-15 21:42:28+00:00,cu48zgp,1,t3_3h4j8o,7785,beer
394,So you went to Germany and brought back stuff that is already widely available here?(assuming you're from the US).,2015-08-15 20:17:11+00:00,cu46ij9,1,t3_3h3c9e,25715,beerporn
395,LOVE Mikkeller.,2015-08-13 23:38:10+00:00,cu26ta8,1,t3_3gw5px,11120,beerporn
396,Here to help if you still need it. shoot me a msg ,2015-08-13 23:24:20+00:00,cu26clj,1,t3_3gvlnw,18577,huntersbell
397,if you still need help im here,2015-08-13 23:23:35+00:00,cu26boz,1,t3_3gw4gp,10758,huntersbell
398,"I can help you

psn: lmen2072

send me a message",2015-08-13 23:22:25+00:00,cu26aad,1,t3_3gwnjy,2478,huntersbell
399,thanks for the help man,2015-08-11 20:10:04+00:00,ctzjjo5,2,t1_ctzj537,587,beer
400,"I called DHL Corporate. They are trying to work on getting them to just simply feel the weight of the package. As silly as it sounds its very easy to carry a package with two tee shirts and easily tell there is no extra weight from glass or liquid in there. Hence, no beer. DHL/customs is incompetent. ",2015-08-11 20:02:23+00:00,ctzj87w,2,t1_ctzj152,281,beer
401,Yeah i've read online of crooked customs agents not sending merch back nor will they clear it and many times end up just taking it home with them.,2015-08-11 20:00:12+00:00,ctzj4y3,2,t1_ctzizvi,200,beer
402,did you go through DHL?,2015-08-11 19:56:32+00:00,ctzizfc,2,t1_ctziu9c,209,beer
403,holy shit dude,2015-08-11 01:58:01+00:00,ctyos9i,1,t3_3gi958,20036,vinyl
404,"DUDE YES. Proud to say I've had all these before. Except for new hop freshner, just picked it up today. Also Citra showers trumps all those beers easily",2015-08-11 01:43:03+00:00,ctyo9nz,1,t3_3gi03h,23075,beerporn
405,Let me know if you need help. I love to help people with that chalice boos. Fought it so many times (from dying) that ive become accustomed to its every move.,2015-08-10 01:18:54+00:00,ctxgylb,1,t3_3gczn3,32834,bloodborne
406,BRAVO TRANK,2015-08-10 01:10:43+00:00,ctxgok7,1,t3_3gdlfk,21494,gaming
407,got dayum. I first heard this song in that ps2 game. loved it so much I bought the 12' single on discogs afterwards,2015-08-08 05:28:15+00:00,ctvo1ss,1,t3_3g7s2m,288,Disco
408,Wait...exactly how spicy are we talking here?,2015-08-08 01:33:35+00:00,ctvhq0m,1,t3_3g5apk,31618,LAlist
409,Yeah I was at a house party with SebastiAn in San Francisco a couple of years ago. It was my buddy's house and they have a strict no smoking indoors policy. He smoked indoors anways despite them asking him to go outside. He also had a massive ego but was still a nice and funny dude. ,2015-08-08 00:30:18+00:00,ctvftod,3,t1_ctvcgx3,6201,electronicmusic
410,Finally a reaction that is relatable. When you're in the heat of the moment sometimes consequences are hard to think about. I would have punched that fat bitch too.,2015-08-07 03:44:25+00:00,ctufkvv,2,t1_cttsujf,36134,AskReddit
411,"Holy shit this is the worst in the thread. Now I'm normally not a violent person. But if I was in your situation, I might have just beat the shit out of her upon finding myself free. ",2015-08-07 03:41:52+00:00,ctufhzi,2,t1_cttzuvn,26355,AskReddit
412,love mikkeller!,2015-08-06 22:09:44+00:00,ctu46ct,1,t3_3g191z,13127,beerporn
413,I'm the buyer at a beer shop. I have a nice selection of barrel aged stouts. This trade can happen. DM me,2015-08-06 00:12:00+00:00,ctszsk0,3,t1_ctsrj0a,12360,beerporn
414,Every time I fight executioners they always seem to be the best sports. Unlike those vileblood blood dreg hungry scum.,2015-08-05 20:07:34+00:00,ctsptgw,1,t3_3fvq3n,19253,bloodborne
415,God damn I'm jealous. Cantillon is a bitch to get here in SoCal ,2015-08-05 19:59:37+00:00,ctspgyq,1,t3_3fvnhl,19951,beerporn
416,"Nice . Never been to this cinema but props to them. More businesses need to have this ""we don't take any shit from anyone"" attitude. You break the rules, fuck you, you're out.",2015-08-05 19:48:45+00:00,ctsp06w,1,t3_3fw0fv,13616,videos
417,"Yep big pain in the ass. I'm the buyer at a craft bottle shop in west Hollywood. We've had a distributing account with stone for a about 5 years now and we always order a shit ton from them. Despite all this, we will never ever get Pliny (stone distributes Pliny in SoCal). It's ridiculous. All the meanwhile the buyer at whole foods a couple blocks away has the exact same rep I do and gets a case of Pliny each month. It's really frustrating.

Also that rule that some distributors have where you have to bring in a lot of shitty beer in order to get the limited stuff is annoying but makes sense. It's just how the game is played unfortunately.",2015-08-03 09:06:09+00:00,ctpqba1,2,t1_ctp7udh,42892,beer
418,I think you need more things to fill out your day. Judging from these photos this guy has done absolutely nothing wrong. Fuck off OP,2015-08-01 02:50:19+00:00,ctnkdc6,1,t3_3fcwhw,7466,LosAngeles
419,"Right now, yes. That will change soon though. I'm only one play through away from platinum trophy. Did all the dungeons and I'm at level 255 so pvp or co-op pve is rare to come across now. Still hasn't fought losefka or other small story related thins but other than that I think the game is finally starting to wear thin for me. Will start playing again once the expansion comes out though",2015-07-31 18:20:34+00:00,ctn2hzk,1,t3_3f9qff,32835,bloodborne
420,Work at a beer shop as the buyer so I get everything at cost. I haven't payed more than $10 for sculpin in months. Feels good man,2015-07-31 18:11:48+00:00,ctn24om,2,t1_ctlz9gy,77664,beerporn
421,Oh fuck off it's a fucking lion. The media will plaster these idiotic stories everywhere to distract people from the real crimes being committed daily.,2015-07-31 17:56:27+00:00,ctn1h5k,1,t3_3f9w4t,26883,worldnews
422,Whaaa. I know it's not the same but that ms 8.99 in SoCal,2015-07-31 02:45:46+00:00,ctmcpqa,1,t3_3f5ogz,48264,beer
423,"Good, fuck Mosquitos. Left my back door open for 10 minutes last night and got bite like 5 times. Hate those things",2015-07-30 20:56:30+00:00,ctm02sn,1,t3_3f64o3,19882,todayilearned
424,Fantome is very hit or miss for me. This one was very bitter and a bit too out there for me but interesting none the less,2015-07-30 01:25:49+00:00,ctl10kl,1,t3_3etdzi,189725,beerporn
