,body,created,id,nest_level,parent_id,reply_delay,subreddit
132,"Seeing as how you forgot let me remind you we were talking cost not retail price. But yeah come in, im in west Hollywood. Youll be amazed by all the fresh local cali beer youll be saying ""bells who?"".  :^)",2016-03-16 18:44:33+00:00,d12a5gx,15,t1_d129v4w,380,beer
133,Well you got me there. But with founders and left hand also coming around the same time it was more of a flavor of the month thing. Safe to say people around here have moved on.,2016-03-16 18:34:23+00:00,d129oxo,13,t1_d129hoh,275,beer
134,I dont think you've ever met anyone in the beer industry period.,2016-03-16 18:23:29+00:00,d1297gl,11,t1_d1296f0,39,beer
135,"""it would be $10 because i know it would""
So once again""dude because i said so lol"". Ive been working with bells and their reps for years. I know the bomber would be cheaper they are just to arrogant to make one. But hey you can keep telling yourself otherwise if it makes you feel better.
""enjoy your cali beer""
Will do. You enjoy your flyover state beer as well! Cheers. ",2016-03-16 18:16:16+00:00,d128w39,9,t1_d128ntu,312,beer
136,"Love how your baseless assumption is ""dude it would be $10 because i said so lol"". You literally have no clue what your talking about about. Also cool great seek out what you want as I literally dont care what you drink. But i know the beer crowd here in LA. No one gives a shit about bells. This will fly under the radar. But please feel free to buy the six pack and post it here to get those 5 upvotes and two comments! It will really show how much people care bro /s.",2016-03-16 17:59:48+00:00,d1285jz,7,t1_d1252z6,4064,beer
137,"They dont. Seeking out doesn't mean casually picking up a six pack of two hearted at whole foods. Seeking out means trades, lines, paying double, buying online etc. literally no one does that for bells.",2016-03-16 16:49:17+00:00,d124yf6,7,t1_d11wser,12078,beer
138,"Did you not read anything i wrote in my previous comments? I sell beer for a living too. Been doing it for 5 + years.  Hell Ive even had people from this sub come into my shop. I know how the pricing system and mark ups work. This beer will be $19 + for a sixer, remember me when you pay that (or lets face ot you probably wont) and think about how much cheaper it would have been for you if they just made it into a bomber.",2016-03-16 16:46:58+00:00,d124ulu,5,t1_d123heq,1802,beer
139,Also your comparing the highly sought after kbs to bells. Nobody seeks out bells and nobody will throw a parade over this beer. It will be great im sure but its nowhere near in the desire spectrum like kbs ,2016-03-16 04:24:08+00:00,d11lscc,5,t1_d11l1hd,1418,beer
140,Wish i could say its an opinion but its actually fact at least in my area of west hollywood. Work as a buyer for a beer shop. Bells 30th and their latest dopplebock are so expensive customers dont want anything to do with them. Yet they chug down regular expedition and other skus from bells like water. Breaking down expensive 6 packs also doesnt work because like i said people just want to try one and move on. Its just a bad business decision selling these beers in a format that wasnt really made for them. Bombers were specifically made for these types of rich expensive beers.,2016-03-16 04:17:11+00:00,d11lkgw,5,t1_d11l1hd,1001,beer
141,"Your math is off, really off. Assuming this 6pk is about $16-17 (cost price not retail price and im sure it will be because bells last two special bba 6ers were that price) each beer would be about $2.80 (once again cost price). 12oz + 12oz equals 24oz so thats slightly more than a bomber at $5.60. Now obviously bells wouldnt set a bomber like this that cheap so lets say they put it at $8 cost. After youre local shop gets it and marks it up you would be paying $13-16, $16 being at the very very max and super overpriced bottle shop. 

It would be a lot cheaper for you id they did 22's and if you didn't like the beer for whatever reason, you wouldnt be stuck with a whole six pack of it.",2016-03-16 04:01:24+00:00,d11l2ha,3,t1_d116yqr,20339,beer
142,"Its not about the amount youre getting genius. Its about selling the damn thing. Very few people are willing to pay $20+ for a six pck of a high abv stout. A super expensive high abv stout doesnt make much sense as a six pack. Because A, its too much of a rich high alcohol beer and b its so damn expensive. Most if these people just want to try the thing and move on. I had to split bells 30th anniversary into singles because nobody wanted 6er of an 11% abv stout at $25. Even at singles people would just buy one and move on. These beers would sell a lot lot more as bombers.  ",2016-03-16 03:53:08+00:00,d11kswn,3,t1_d11cuon,11424,beer
143,"they need to really drop the whole ""we dont make 22oz beers'' mentality. Paying $19.99 + for a sixer (which this will most undeniably be) is getting tiresome. ",2016-03-15 21:54:02+00:00,d115s7k,1,t3_4aihi5,29337,beer
144,"Hmm i just signed up with a friend of a friend. Seems you guys have identical rates, except he isn't doing the first lesson free thing. My first lesson is today and if it doesn't go well or I just can't get into his teaching style i will definitely remember this post.",2016-03-14 09:15:07+00:00,d0z5q88,1,t3_4aaw7s,30476,LAlist
145,"Taste like cognac and maple syrup, well at least the jist of it. Its a bit hard to drink in my opinion because there is just so much fucking flavor overwhelming your palette. ",2016-03-07 06:53:54+00:00,d0qimds,2,t1_d0q69mr,22961,beerporn
146,Go away mikey,2016-03-01 19:33:26+00:00,d0jpl46,1,t3_48hjvn,7359,vinyl
147,Knew it was possible. Fuck you tom.,2016-03-01 00:49:59+00:00,d0irmgj,1,t3_48bf9j,25134,WTF
148,Too late muchacho,2016-02-26 07:26:01+00:00,d0ect1u,1,t3_47nn3x,6649,bloodborne
149,Yeah i know that feel. Witcher can get interesting at times but im finding myself pushing on to continue the game. I always end up getting bored after an hour or two and going back to bb,2016-02-20 21:58:20+00:00,d07fvll,5,t1_d07besg,8067,bloodborne
150,Its the pc only players. I remember the golden days of comfy demon souls threads on /v/. As soon as ds came to pc it was the end and the community got a whole lot worse. You cant make any bb thread over there without salty pc gamers coming in to shit on the game.,2016-02-19 00:16:28+00:00,d058ajp,1,t3_46he02,6393,bloodborne
151,"Huh, work literally right next door and have never been inside. After seeing this pic guess now i dont have to lol",2016-02-17 16:17:52+00:00,d03b9ce,1,t3_468iog,10397,RoomPorn
152,Think of the trees brah!,2016-02-15 17:24:43+00:00,d00tm4k,1,t3_45vkq0,31516,LosAngeles
153,Fund my own private army. And a base. And get a one eyed dog.,2016-02-13 23:04:13+00:00,czyxiww,1,t3_45j01u,61794,AskReddit
154,Nice. I usuely don't really write descriptions at my store because our stock moves so fast (but mainly because I'm lazy) but I will for sours stouts or anything above $15. Is it a pain to keep typing up descriptions when distributors release and you order tons of new beer weekly?,2016-02-13 01:00:19+00:00,czxzwng,1,t3_45dab7,70062,beerporn
155,I was in your shoes. After so many hours in bb I wanted to give w3 a chance. It's pretty boring tbh. I'm at the second boss and I can't be bothered to pick the game back up. Think I'll just wait for dark souls 3.,2016-02-12 07:40:28+00:00,czx3avy,1,t3_45bfbr,33700,bloodborne
156,"Sunset got a lot. Melrose wine and spirits had some but it's probably gone now. Dt whole foods had some but they are making You buy a flight first which is scummy. And as far as I know Vendome Beverly Hills has not gotten their shipment yet. Idk if they ever will but you might want to give them a call.

Going totally of topic here and just my personal two cents. The beer is pretty mediocre. Had it for the first time yesterday and it pretty much just tastes like any generic west coast DIPA. If you've had any knee deep double or triple it tastes exactly the same.",2016-02-09 22:26:54+00:00,czu08ss,1,t3_44ydaw,11270,LAlist
157,Dank,2016-02-09 06:06:24+00:00,czt6hyq,1,t3_44r2m2,56958,circlejerk
158,Same. 10 is nothing now. That's the price of your typical run of the mill IPA bomber now. I'm even getting used to paying for $18-$20 for select 12oz bottles now :(,2016-02-08 20:24:50+00:00,czsloaf,2,t1_czseztk,9288,beerporn
159,This is a great food beer. Had it with a nice sirloin and was in heaven.,2016-02-08 19:58:30+00:00,czskjz8,1,t3_44ry3j,9017,beerporn
160,Fuck that's awesome. Wonder if they take commissions.,2016-02-08 19:41:40+00:00,czsjtxe,1,t3_44s50y,5676,bloodborne
161,Wow. Really? Lol,2016-02-07 19:41:46+00:00,czrbrpl,3,t1_czr5iso,10441,beerporn
162,Dayum son,2016-02-07 00:06:52+00:00,czqi21h,1,t3_44g1xx,40839,bloodborne
163,"Kinda funny how he has one but if you wanted one in sf, you probably can't have one.",2016-02-06 16:27:54+00:00,czq2q0a,1,t3_44d8ol,64828,sanfrancisco
164,One of my guys came out looking Asian...on accident. I'm shit at those sliders,2016-02-06 16:21:59+00:00,czq2j1s,1,t3_44fpgv,21080,bloodborne
165,Don't mean to put you down but you're very naive. The people who own Russian River are filthy fucking rich. And that's not an exaggeration. My stone rep whose met them (stone distributes rr in my area) says it's no uncommon knowledge that money isn't something they have a problem with. They brew tiny batches to create the desire. Which is honestly super smart because look at what that desire breeds. A line like this.,2016-02-06 04:06:31+00:00,czpo7pb,3,t1_czpdb9o,19826,beer
166,"You'd be surprised at how much of thier model is artificial scarcity. I work in beer in SoCal and a lot of reps have told me how they secretly brew at other facilities to double their supply without telling anyone. They are brewing more Pliny every year but they still play that image of ""quality over quantity"". This line is very much for looks, much like how inbev reps demand that any store that carry bcbs must have a early Black Friday line. They could easily make more younger but then that would give away the idea that maybe you don't need to wait in line for it. And that's the last thing they want.",2016-02-06 04:03:00+00:00,czpo41b,3,t1_czpck59,20782,beer
167,Dayum son,2016-02-03 03:32:31+00:00,czlv3ap,1,t3_43vei6,34196,beerporn
168,That's an expensive ass picture.,2016-02-03 03:30:28+00:00,czlv0qx,1,t3_43w9ir,23454,beerporn
169,My stores allocation comes soon. Stoked to finally try some.,2016-02-03 03:29:34+00:00,czluzmo,1,t3_43vgya,33171,beerporn
170,I always find their story pretty fascinating. Two brothers who started solid brands yet hate each other.,2016-02-02 22:38:02+00:00,czlk2aa,1,t3_43uxuv,22251,beer
171,"Prefer my door mat

http://imgur.com/a/xdgpk",2016-01-30 23:04:54+00:00,czhzsh9,1,t3_43eaif,30431,funny
172,Actually liked this one more than fundamental observation.,2016-01-30 16:26:29+00:00,czhn6fz,1,t3_43cr14,40985,beerporn
173,Love that kozik piece. Want one myself but not so willing to drop $250 for one.,2016-01-30 05:20:27+00:00,czhapxn,1,t3_43bso7,16859,beerporn
174,"Vendome Beverly hills. Also yeah last year we had to bring in about 30 cases of ""rain"" vodka to get pappy. This year we did it again and got screwed by the distributors and only got 10 and 12. Our whisky buyer was pissed.",2016-01-29 22:43:48+00:00,czgygna,5,t1_czgv9tp,4805,beer
175,Exactly the way you said it. People just want the new stuff but don't get all the hoops we have to jump through to get it. A buyer whom I know who also works near me got peche n Brett this year and I didn't. But he sold them in a bundle of three with other undesirable logdson beers. Total came to like $78 for the bundle. Now I like the guy but I found that an incredibly shitty thing to do. I would rather just not have something than have it and force people to buy something they don't want just to get it.,2016-01-29 19:46:54+00:00,czgr4bz,3,t1_czg7xoc,37097,beer
176,No boss health bar. Disappointed ,2016-01-29 00:03:14+00:00,czfs45u,1,t3_434e63,22479,bloodborne
177,As far as I've been dealing with them (like 3 years) I've known it's through them. Yeah they don't say they do and honestly it's so rarely given out to anybody that it makes sense that they just don't talk about it. Also as far as I know lime ventures is part of Shelton brothers as all of Shelton brothers products are on lime ventures portfolio.,2016-01-27 05:05:30+00:00,czdiyk4,3,t1_czdgh3g,4496,beer
178,"IPA's do have a shorter shelf life. IF (and thats a big if because as i mentioned earlier I always see if its worth it or not) I do have to bring in a IPA shelf sitter that I know I wont sell off before the freshness date ends. I will start putting it on sale, lowering the price more and more as the date gets closer. People love seeing beer go on sale so thankfully I've never had to take a complete loss on a product. ",2016-01-26 23:19:33+00:00,czd5zhu,3,t1_czd4woo,1624,beer
179,This video doesn't prove much about the weapon itself. I love the weapon (my main choice) but you're video just shows that you're super overleveled. Pretty sure you would be doing that damage with any other of your plus 10 weapons.,2016-01-26 22:25:52+00:00,czd3rqo,1,t3_42tmwz,5606,bloodborne
180,I have a +10 church pick that has a + 20% damage gem. Unfortunately it's a cursed gem and it reduces the durability of the weapon by 60%. It can really only last one boss fight max but man does it destroy. It is annoying to be fixing it all the time though. I agree it doesn't really add much to the game but I guess it's there for balance.,2016-01-26 22:20:57+00:00,czd3k1z,1,t3_42ss6m,15287,bloodborne
181,"Hey, beer buyer for a bottle shop in Hollywood here. Have some info not super specific to your wuestion but just useful info on ordering in general and other relevant stuff. If you want to open up a beer place first obviously you would need a liquor license. There are two types. An off premise license and an on premise license. Off premise means you can sell alcohol but not have people drink at your place. On premise means you can have people open up beers at your place but not take them home. You can also have both, a good example of that would be places like sunset beer in echo park.

As for distubuters there are many in SoCal or everywhere really. Their names and products change accordingly to where you're located. For example if i want to order stone IPA, I would go trough stone as they are also a big distributor, but say my store in another part of SoCal wants stone, i may not be able to order from stone to get it, I may have to order it from mission (another distrib). 

When ordering beer you will come to have a number of distributors you will deal with. Just an example of here are some distributors I deal with and some of the more popular brands they carry. Stone: stone, modern times, Oskar Blues, pizza port. Wine warehouse, almanac, delirium tremens, north coast. Unique craft: green flash, alpine, founders. Lime ventures, Mikkeller, parire, amager. Then there's craft beer guild: bells, knee deep, smuttynose etc.

As you can see there are a lot of distributors. I've only named a handful with some of their products, but there are a lot lot more. And some places depending on where you live also self distribute. Like el segundo brewing does that based off where I am.

Now the most annoying thing of buying beer is getting ""the good stuff"". For instance did you know that stone distributes Russian River and lime ventures distributes cantillion? Of course not because they don't tell you and they don't want you to ask about, hell even if you do, you won't get any. This is where the annoying game of you scratch my back I'll scratch yours comes in. To get your allocations (reserved cases of ""the good stuff"") be prepared to bring in a lot of unpopular or really slow moving beer. If you want bourbon county in your store get ready to bring in a lot of goose island year round beers. The most unpopular the better you're chances are of getting BCBS and variants when it's out. Works this way for pretty much any distributor. And it is by far the most annoying thing about ordering beer, especially if you have a smaller shop with limited space. As anything that is just sitting on your shelf collecting dust is costing you money. You could have something that moves really quick in that spot. So already a be willing to ask yourself is it worth it? Do I really want to bring in 6 cases of mike Hess in order to get that one case of breakfast stout?
It's an easy gig but something you need to be smart about. Especially when you're the owner and its your own money you're ordering with.",2016-01-26 22:10:54+00:00,czd34d2,1,t3_42ry4y,24346,beer
182,GOT DAYUM,2016-01-26 07:53:26+00:00,czcbn07,1,t3_42oogo,27772,pics
183,Rape,2016-01-26 01:26:13+00:00,czbytbp,1,t3_42lj29,40370,AskReddit
184,Damn I'm Mexican and even I think that looks rank. I'll never see the appeal of those things.,2016-01-25 22:41:09+00:00,czbsdhi,1,t3_42lstd,27063,LosAngeles
185,"Mikkeller Beer Geek dessert, the dessert and cocoa shake are the most sweetest so I would recommend those.

Smog city ""the nothing"", if you're living near California.",2016-01-25 00:57:55+00:00,czanom4,1,t3_42hs21,13404,beer
186,I can help. Shoot me a msg,2016-01-24 05:37:29+00:00,cz9r3dc,2,t1_cz9ohic,5750,bloodborne
187,Reminds me of why I don't watch key &amp; peele.,2016-01-21 22:42:54+00:00,cz72ry4,1,t3_420wem,20283,movies
188,its up,2016-01-21 06:08:23+00:00,cz687dc,6,t1_cz66rfl,3154,bloodborne
189,You went to Vermont and got magic hat? Why?,2016-01-21 04:50:08+00:00,cz65zj9,1,t3_41x17u,19057,beerporn
190,Give it another shot. It's fucking incredible and will completely kill your social life.,2016-01-21 04:49:21+00:00,cz65ynl,1,t3_41xuxg,7437,LAlist
191,Great stuff. Must have bought 6 4pks since its been out.,2016-01-21 01:33:03+00:00,cz5ytws,1,t3_41vnfz,25075,beerporn
192,Blue palms?,2016-01-20 08:25:32+00:00,cz508yy,1,t3_41sj8y,16535,beerporn
193,I ALWAYS get downvoted for this but I think fundamental observation by bottle logic is the most overhyped beer I've tasted. ,2016-01-20 08:23:06+00:00,cz507gw,3,t1_cz4uqz0,13848,beerporn
194,Damn this looks horrible ,2016-01-20 08:13:58+00:00,cz501v0,1,t3_41sbrc,18946,movies
195,"They already do friend. Check your local bottle shop. 

Source: beer buyer for a shop in SoCal ",2016-01-20 01:54:46+00:00,cz4p3f6,2,t1_cz4b8wl,20335,beer
196,Well what do you know! It's the exact same movie with the exact same jokes! Genius!,2016-01-19 20:03:39+00:00,cz4aq2b,1,t3_41pa7s,14287,movies
197,"Sure. I'm away from the ps4 though so I'll edit this comment later with a pic of my stats.

OK here it is. Its my co-op build. this particular set is a fire hunter themed set

http://imgur.com/a/8OQBw",2016-01-19 07:32:48+00:00,cz3pvse,4,t1_cz3og3h,4150,bloodborne
198,Doubt it. This is my fire/strength build. Haven't really pvp'd that much with it. its really more of a co-op build.,2016-01-19 01:47:40+00:00,cz3fjio,2,t1_cz3fgju,127,bloodborne
199,"""Nothing but superior beings here"" on top of a lamp that's really hard to get on in cathedral ward.",2016-01-18 20:53:34+00:00,cz3476h,1,t3_41jchg,20085,bloodborne
200,Mikkeller is great,2016-01-18 20:45:04+00:00,cz33u9s,1,t3_41k0cq,10839,beerporn
201,God damn this is a great thing to see on a miserable Monday morning.,2016-01-18 07:41:12+00:00,cz2i7t0,1,t3_41g6x1,28016,pics
202,That's...cool bit too much for me tho,2016-01-16 23:57:19+00:00,cz0xaw0,1,t3_419bwq,22888,bloodborne
203,Melrose wine and spirits. 7435 Melrose Ave. it is slighty marked up here though because of the area. It's about 13.99 a bottle. Wish I could lower it but my boss is strict about the pricing for this one. No limit though,2016-01-16 18:55:42+00:00,cz0mevu,3,t1_cz07fkr,41233,beerporn
204,No I don't. I've never heard the word in my entire life until now. Euphoric name btw,2016-01-15 18:03:48+00:00,cyzfszb,3,t1_cyzd0sh,3864,movies
205,"It's not a sequel and most likely isn't even tied to the story from clover field at all. They described it as a ""blood relative"".",2016-01-15 16:24:42+00:00,cyzbj8d,1,t3_41269y,30169,movies
206,Seeing that you have Beachwood I assume you're in SoCal in which case you are simply just not looking. BCBS is everywhere here. It's a massive shelf sitter at this point. Even the beer shop I work at (weho) has like 5 cases left.,2016-01-15 05:37:01+00:00,cyywlxe,1,t3_410etv,20233,beerporn
207,Did you get that glass at the San Francisco bar? That place is heaven. Picked up some beer print posters there that now hang on my wall.,2016-01-12 18:28:17+00:00,cyvkxq4,1,t3_40n31z,7264,beerporn
208,I didn't even know he had cancer. He just released an amazing album! Goodnight thin white duke. Your absence will be felt.,2016-01-11 07:30:45+00:00,cyttwci,1,t3_40fknb,2411,worldnews
209,"Nice, put in an order for the I want to believe. Always appreciate nice subtle video game clothes.",2016-01-11 07:16:18+00:00,cyttlax,1,t3_40fd37,5397,bloodborne
210,Because ayy lmao,2016-01-11 07:15:38+00:00,cyttksj,2,t1_cytsyw0,1724,bloodborne
211,"Working in beer I've been privileged to taste many delicious and rare beers over the years (Pliny older and younger, heady T. Utopias, cantillion, sip of sunshine, westie trapist 12). But perhaps the best beer I've ever tasted was Home sour Home by the rare barrel. I've had it multiple times and every single time I take that first sip I'm reminded, ""oh yeah this is it"".",2016-01-11 05:13:48+00:00,cytqqog,1,t3_40dp98,22925,beer
212,"Beer is something that your body gets immediately rewarded with. Beer (depending on the person) tastes delicious and alcohol helps release endorphins  as well as also physically filling you with substance. What lotto sells is an idea, a chance. You're  paying for the idea that maybe you might win. Comparing purchases of a physical item to an idea once again is not a good comparison.",2016-01-10 21:51:45+00:00,cytb02n,10,t1_cyta6u3,1252,todayilearned
213,"Which are something you own and can enjoy until you (or if) decide to get rid of. Where as spending money trying to win lotto, literally brings you nothing except maybe a slight sense of gambling excitement that lasts all of a few seconds. Not really comparable at all.",2016-01-10 21:26:13+00:00,cyta0dq,8,t1_cyt1rn1,12354,todayilearned
214,"Just had that modern times Devils teeth last night. It was ok but the coffee profile completely took over, took over to the point that it pretty much just tasted like coffee and not beer.",2016-01-10 07:10:01+00:00,cysomw9,1,t3_408ixz,29963,beer
215,"Considering the ps4 has a button dedicated to sharing and streaming itself, I find it highly unlikely they will start trying to take people's videos down. That being said, I hope it goes through to end all this lets play cancer that's ruining the Internet.",2016-01-09 17:37:42+00:00,cyrxr1n,1,t3_4065uk,17682,technology
216,"""Who fucking cares""  - anybody who's not a neckbeard ",2016-01-07 10:19:56+00:00,cyp6si7,1,t3_3zsu38,34936,videos
217,"OFFICIAL POWER RANKINGS (best to worst)
 1) Ridley Scott 
 2) Inarritu 
 3) Danny Boyle 
 4) David o Russel
 5) Quentin T.
 6) Tom ""oscarbait"" Hooper",2016-01-06 05:30:14+00:00,cynqr4v,1,t3_3zjg2y,72041,videos
218,"My first character is 285 on NG+7 and even being that over leveled the DLC was still incredibly difficult. At that level I didn't get much co-op action so I made a new character. 

I wanted to stop for this one at 85 but I soon found that impossible as I kept getting Rekt by everything. Now I'm at 145 and trying hard to keep it there for co-ops sake. The defiled hot dog is really testing my restraint though as I easily get one shotted by pretty much all his attacks. How people can beat him on a lower level is beyond me.",2016-01-04 22:36:53+00:00,cym1yk1,1,t3_3zg3ok,13041,bloodborne
219,No more Shitty jokes in this subreddit,2016-01-04 10:17:27+00:00,cyle6bm,1,t3_3zdoig,13027,bloodborne
220,M A J E S T I C,2015-12-30 20:25:33+00:00,cygi6xp,1,t3_3yr9wb,47791,bloodborne
221,"Knee deep is ok but I've had them disappoint several times. I found a tiny worm in one of their beers before, I told them trough email in a totally non complaining way and they never wrote back. They have shipped out entire batches of beers that were flat because of a bottling problem and refused to acknowledge the problem or take back the product (work at a beer store and the distrib. took it back). Not to mention all their stuff is 2-3 dollars overpriced for what it is. Started out as one of my favorite breweries, now I don't really ever buy their stuff. Breaking bud is great when fresh though.",2015-12-30 16:33:49+00:00,cyg8wvz,1,t3_3ysjjm,3611,beerporn
222,"Time for the weekly ""girls of reddit give me tips to help me not be a virgin anymore"" thread.",2015-12-28 17:20:12+00:00,cydxzxb,1,t3_3yiirm,19932,AskReddit
223,This has happened to me three times. Always at bergynworth. I don't know what activates it but it only happens when I help co-op with people.,2015-12-27 05:54:22+00:00,cycieez,1,t3_3ycbhm,20273,bloodborne
224,He left you alone to watch Star Wars on Christmas? And you're pregnant? Lol wow.,2015-12-26 01:19:07+00:00,cybf3lp,2,t1_cybaxbe,9478,pics
225,Yeah I platnumbed it months ago too. Never got it. Don't care too much tbh,2015-12-25 18:59:06+00:00,cyb4vrd,1,t3_3y6ab2,27939,bloodborne
226,Geographically the hamlet behind the clock tower doesn't make sense because when out side the tower you can see directly behind it and see there is no land where the hamlet would be. I always assumed the clock dial entrance to the hamlet was more of a portal.,2015-12-25 18:23:15+00:00,cyb3wge,2,t1_cyavwr8,25993,bloodborne
227,Yeah nah fuck off we know your kid didn't draw that.,2015-12-24 11:46:50+00:00,cy9ycwa,3,t1_cy9urj5,14953,pics
228,Utopias was 28% and it pretty much just tasted like cognac.,2015-12-22 23:37:30+00:00,cy8cq6d,1,t3_3xuc2f,29812,beerporn
