,body,created,id,nest_level,parent_id,reply_delay,subreddit
0,"Another Tron legacy. Great visuals, yet will still somehow find itself to be a chore to get through.",2016-11-13 16:12:58+00:00,d9yj16u,1,t3_5cpffb,20348,movies
1,"&gt;racist, xenophobic, mysogynist 

Racists aren't friends with p diddy, Russell Simmons or any person of color. Xenophobics arent open to the idea of having muslims as members of their cabinet. Mysogynists dont pick woman to run their political campaigns.

You ""tolerant"" and ""accepting"" liberals have your head so far up your own asses you've blinded yourself silly to the  hypocrisy that oozes off of you. Slandering people over and over with these horrible titles is the exact same thing as hate speech. Grow up, you live in a bubble, the rest of the US doesn't agree with you. Your crass arrogant ""tolerant"" attitude is what created Trump in the first place. Now reap what you sow.",2016-11-13 03:22:52+00:00,d9xzysq,4,t1_d9xm7bm,21087,LosAngeles
2,Just stop dfh. Focus on creating better/or expanding year round brews. All these super out there dfh beers are always super mediocre.,2016-11-10 19:37:32+00:00,d9uradj,1,t3_5c8efx,14819,beer
3,You sound like someone who's never been out of California.,2016-11-10 19:31:50+00:00,d9uqzr8,4,t1_d9u51d1,34983,LosAngeles
4,First of all you have to be 15 and unemployed. Having a complete lack of individual thought and how the world works outside of your city helps too. Hope to see you there!,2016-11-10 19:12:36+00:00,d9upzx6,2,t1_d9u4og0,34999,LosAngeles
5,"Morons. All of them. You lost, get over it. Your tantrums will literally change nothing so stop ruining other peoples time.",2016-11-10 19:08:33+00:00,d9upsfq,1,t3_5c61st,51577,LosAngeles
6,Opened for him years ago when i used to live and DJ in SF. Hes a rad dude.,2016-11-07 20:22:24+00:00,d9q16cf,1,t3_5bnisq,9944,electronicmusic
7,When will capeshit die?,2016-11-07 20:18:36+00:00,d9q0ze2,1,t3_5bmzh5,14857,movies
8,Lol this is just shitty 2deep4u performance art. Shes been doing this for years and never tried to make this a secret. The only thing shocking here is how people eat this pseudo art crap up. ,2016-11-04 16:25:50+00:00,d9lnsm0,1,t3_5b2j9l,26785,conspiracy
9,"So much ass pain in this thread. If you like yuengling yet are letting this stop you from drinking it then youre a fucking child, grow up. I cant wait to volunteer to help build that wall and have a nice ice cold yuengling while im at it. ",2016-10-27 05:10:35+00:00,d99m61e,1,t3_59kert,25497,beer
10,Tried to fight 3 dudes at once without ever having been in a fight. I was 25 and not a kid btw.,2016-10-23 04:03:37+00:00,d93vlv1,1,t3_58u38e,38963,AskReddit
11,Thanks dad,2016-10-17 16:50:12+00:00,d8vx2bi,2,t1_d8vkyum,18021,LosAngeles
12,Yeah ive come to find this out which makes no sense whatsoever. ,2016-10-12 01:31:59+00:00,d8o6yta,2,t1_d8n6ust,49272,unchartedmultiplayer
13,Very jealous ,2016-10-07 20:20:29+00:00,d8icxtb,1,t3_56beg5,23965,beerporn
14,Just stop. Its time to stop. Just no more please.,2016-10-05 17:25:40+00:00,d8f9etq,1,t3_55zhnd,13751,movies
15,"safe. yes. will they taste good. no.

beer never really expires. Ive had a 20 year old ""old numbskull"" from alesmith. It wasnt meant to be aged that long and tasted awful but it didnt cause me any harm.",2016-09-29 10:09:37+00:00,d86ppmb,1,t3_54zeb1,37386,beer
16,"Doing something as different and bold as OGF after the commercial success of Drive must have been a very difficult choice. If i were ever to direct i think id have done the same. Always taking risks doing something new instead of playing it safe with a proven formula. My question is, what do you think of directors who keep with the same one formula throughout their careers? Making the same movie every two years. I know they are good for studios and making them money. But do you think they are ultimately good for film and art? Does it cheapen film as an art medium to have so many directors out there who do it for a paycheck rather than to create something?",2016-09-27 19:53:51+00:00,d84ji2o,1,t3_54s3v8,4162,IAmA
17,They make some seriously killer beers,2016-09-22 20:46:04+00:00,d7xyw2f,1,t3_540t94,3722,beerporn
18,Good luck with this shit lol,2016-09-19 01:44:21+00:00,d7sl7b2,1,t3_53eisx,11822,LAlist
19,"This beer was originally called big head ipa in response to greg koch of stone saying that the east coast ""didnt know how to make an ipa"". ",2016-09-16 23:29:22+00:00,d7pxv0o,1,t3_534c6z,5801,beerporn
20,Finally nintendo is catching up graphically ,2016-09-16 02:05:51+00:00,d7opa2y,1,t3_52ylrm,15631,gaming
21,Sounds dated. Would be great back in 2008 now its just kinda like ..eh.,2016-09-14 19:53:49+00:00,d7mui2s,1,t3_52s35k,3327,electronicmusic
22,Its been gentrified by yuppies for years now man. Venice blows. ,2016-09-14 19:43:04+00:00,d7mty7p,5,t1_d7mod7i,6757,LosAngeles
23,Great more h3h3 shilling. Fuck off and keep this in your own subreddit.,2016-09-14 07:43:30+00:00,d7m5at6,1,t3_52nnn3,29068,videos
24,Jeez,2016-09-14 01:16:02+00:00,d7ltt4j,1,t3_52i7d5,82284,bloodborne
25,"You kind of have to hold it tbh. Whenever my shop gets rare stuff i dont put it out or mention it. We used to do that but then we would get all these people whom have never shopped with us before just coming in to get as much rare stuff as they could and never coming back until we had more ""whales"". Thats not who we wanted getting it, we want to give it to the regulars, the guys who come in and regularly spend on the more available stuff, basically the guys who keep us in business. We appreciate them the most so they always get priority on it.",2016-09-12 16:25:50+00:00,d7jpkyc,3,t1_d7in8e5,71385,beer
26,"Lol its not really hard to get cantillion in your shop. At least not in CA

STEP 1: buy a lot of regular stuff from shelton brothers/lime ventures

STEP 2: ask them for some cantillon every once in a while

STEP 3: most likely get it with your next order 

Its not an all the time thing obviously but they have more of the stuff than youd think. They dont list it on their inventory list but if you ask for it and like i mentioned do a lot of regular business with them youll get some eventually.   

",2016-09-11 19:58:00+00:00,d7ilcmc,1,t3_528700,28747,beer
27,Euwww maey gawd caull the cauups,2016-09-02 20:23:19+00:00,d777wfg,1,t3_50ucai,11091,sanfrancisco
28,This fucking post again. Every three months or so again and again. This was taken out of context. ,2016-09-02 20:15:01+00:00,d777jqp,1,t3_50qqzo,67742,conspiracy
29,The mikkeller sd bottles are really beautiful. Shame aside from the breakfast most of their line up is meh. Og mikkeller recipes are much better imo. ,2016-09-01 18:42:48+00:00,d75qhi0,1,t3_50lmma,48834,beerporn
30,Im defending his right to say whatever he wants without being labeled. Even though i dont agree with him and dont share any of his views but i wouldnt go so far as to label him a racist right away.,2016-08-31 04:02:41+00:00,d73l73b,10,t1_d73ipd9,4279,LosAngeles
31,"""Its not your culture"". So he cant say something because hes not part of a certain culture? What if he was part of the culture? Would he still not be able to say it because hes white? Telling someone they can't do something because of the color of their skin is textbook racism. Using the n word doesnt automatically make you a racist. Comedians say it all the time, look at louis ck. I personally am not a fan of the word but im more upset about the fact of other people being so quick to judge a person over them saying one distasteful word. ",2016-08-31 01:24:21+00:00,d73f9oi,8,t1_d739ksx,8418,LosAngeles
32,This douche bag blocked me in one day around melrose. Took him like 2 hours to move his car. Haha well looks like i win in the end ya shit!,2016-08-31 01:09:50+00:00,d73eo1m,1,t3_50chsh,25651,LosAngeles
33,Funny just how clueless these morons are.,2016-08-28 22:37:48+00:00,d70hjee,1,t3_4zzd67,33010,LosAngeles
34,I really hate reddit.,2016-08-21 10:21:36+00:00,d6qgbw7,1,t3_4ysme8,28994,gaming
35,Same here sucks. Makes me regret not just going to amoeba and paying a little more to just get it now.,2016-08-20 21:09:30+00:00,d6pt1zq,2,t1_d6pj606,15856,vinyl
36,How hot are we talking though?,2016-08-17 21:09:36+00:00,d6lpv1y,2,t1_d6l5aab,24296,AskReddit
37,"God fucking damn it. After years of putting it off, i finally bought it yesterday and now they lay this shit on me?",2016-08-17 20:42:59+00:00,d6loje3,1,t3_4y5k4r,26107,vinyl
38,Lucky. I have to wait until October for mine &gt;.&gt;,2016-08-16 18:52:54+00:00,d6k2bza,1,t3_4xziey,19067,vinyl
39,fucking sexy,2016-08-16 03:54:20+00:00,d6j9wc6,1,t3_4xw2nw,21425,vinyl
40,"Disagree. Bitches brew for example tastes better aged than fresh. Several beers specifically even say ""will age gracefully"" or even give you cellaring temps and tips.",2016-08-15 21:00:07+00:00,d6itbvz,3,t1_d6ioze3,5455,beerporn
41,Thats what people were saying to me but to be honest the vanilla was very faint and almost not even there to begin with when i tasted it so i always wondered what if.,2016-08-14 22:15:07+00:00,d6hka1u,3,t1_d6h8n82,17986,beerporn
42,Great bar. One of the best in the country i would say. Glad we are getting one soon here in LA,2016-08-14 17:10:28+00:00,d6h8gcu,1,t3_4xlg43,66011,beerporn
43,Had a 2015 one of these and wasnt too impressed to be honest. It was good but not amazing. Maybe i should have aged it. All the flavors were there just very very faint and almost felt like they hadnt reached their peak yet.,2016-08-14 15:41:27+00:00,d6h4xoo,1,t3_4xm9lb,47663,beerporn
44,Youre just gonna eat that potato like that all plain and shit?,2016-08-12 23:59:53+00:00,d6fadeh,1,t3_4xfnhc,12770,beerporn
45,Wait what? Why?,2016-08-08 06:01:34+00:00,d68ps45,1,t3_4wn9yg,24401,beer
46,Didnt really like this one. Much too sweet,2016-08-04 06:25:49+00:00,d63lqna,1,t3_4w1qeg,22777,beerporn
47,Dude wtf,2016-08-03 01:50:03+00:00,d61wue8,1,t3_4vtm3z,30512,beerporn
48,Getting triggered here!!!,2016-08-03 01:43:23+00:00,d61wju5,1,t3_4vv30b,13707,worldnews
49,This was also a drain pour for me. Didnt like that either because it was $10 for such a small bottle.,2016-08-01 16:33:47+00:00,d5zrlay,1,t3_4vk20u,55396,beer
50,"The reason those types of original movies died out in the seventies was that directors passion projects were costing more and more and not returning the profits. Those were different times when studios had full faith in directors to turn a profit on their films. Then it all changed. Movies started to bomb left and right. Look up the movie Heavens gate by the guy who directed The Deer Hunter. Almost bankrupt the studio. It was around here that studios no longer wanted to invest in movies where profits were a gamble. They wanted action, superhero, and already established licenses only because they knew those were guaranteed profits. You can blame hollywood studios all you want for being unoriginal, but blame audiences first for devouring all the unoriginal they put out. Hollywood is a business first and foremost. Always was, always will be. Never forget that.",2016-07-29 07:26:00+00:00,d5vmft9,1,t3_4v34rh,35400,movies
51,Islam has no place in the modern century. ,2016-07-26 19:04:10+00:00,d5rv24t,1,t3_4unotr,36753,worldnews
52,Thay also make tires,2016-07-25 07:06:54+00:00,d5pphe2,1,t3_4uffsj,30843,todayilearned
53,Still no new tunes &gt;.&gt;,2016-07-24 16:44:38+00:00,d5ovdxl,1,t3_4ud6hk,10456,EdBangerRecords
54,Looks like shit,2016-07-23 23:54:44+00:00,d5o68o4,1,t3_4u9pjz,15457,movies
55,Not really rare in most of California tbh,2016-07-22 17:58:27+00:00,d5mmq21,1,t3_4u0n08,55609,beerporn
56,No mikkeller? Dayum son,2016-07-16 04:48:36+00:00,d5e8tbb,1,t3_4t2mop,9230,beerporn
57,Such amazing beers,2016-07-16 01:43:20+00:00,d5e38z1,1,t3_4sxtyw,69148,beerporn
58,Nah,2016-07-16 01:41:03+00:00,d5e36cf,1,t3_4t26or,5363,beerporn
59,Stop shilling your channel here you hack.,2016-07-16 01:33:47+00:00,d5e2xy6,1,t3_4t1p0w,11667,videos
60,Youre name is bean?,2016-07-13 22:42:38+00:00,d5b7ztx,1,t3_4sl72o,67397,Braveryjerk
61,Underrated tbh,2016-07-13 22:39:35+00:00,d5b7vfn,2,t1_d5b3fsu,6213,worldnews
62,Meh.,2016-07-13 22:22:13+00:00,d5b75j9,1,t3_4soovn,13706,electronicmusic
63,I must be the only person who was seriously unimpressed with FO. Had it last year and didnt care for it. Kind of regret not trading it for a beautification when i had the chance.,2016-07-13 07:25:05+00:00,d5abfxo,1,t3_4shzt8,52724,beerporn
64,"Had multiple cantillons, heady topper, pliny elder/younger, westie 12, fundamental obsv, so many different BC stout variants. Three floyds stuff , hill farmstead stuff, maine beer co stuff, trillium, tired hands. All i want is a nice good crushable pilsner or kolsch.  

I think there comes a point where you try so much rare stuff where you honestly dont care to chase those beers anymore. The lines, the raffles, the trades...you just kind of go fuck that i just want to sit down and have an easy beer.",2016-07-11 21:37:37+00:00,d58eq8y,1,t3_4sb4jm,26342,beer
65,"""But our manliness got in the way"" hahaha. Seriously though, it sounds like the dog just needs more time around you and more training. Also sounds like youre just giving up on it tbh.",2016-07-11 21:24:17+00:00,d58e60e,1,t3_4scru9,7049,LAlist
66,Deal with it m8,2016-07-09 22:47:29+00:00,d560fxx,3,t1_d55irgw,31267,worldnews
67,Who the fuck is jai courtney?! This entire time i thought that was tom hardy!,2016-06-20 23:58:53+00:00,d4hc3sq,1,t3_4p0dwp,17693,movies
68,Work as a buyer for a beer store in la. Can confirm it is not currently retired. Just not a year round.,2016-06-20 15:14:13+00:00,d4gp7fr,3,t1_d4gfx6o,21664,beer
69,"If youre gonna go sour, go real sour then.

The bruery tart of darkness
Almanac sours
Mikkeller spontan series
Firestone barrel works series
",2016-06-18 15:20:30+00:00,d4ecevr,1,t3_4oohqo,6918,beer
70,"One, its a rock and not a Monet.
Two, the rock is still there its not broken just moved into another place.
Three, its a rock, no one cares, not even you. Less than five minutes from now youll forget all about this where as a timeless piece of art inspires others. This particular rock doesn't. 
Four, people work hard on art. Nobody works hard on rocks.
I could go on but you get it.",2016-06-17 18:03:51+00:00,d4dbp58,5,t1_d4daivi,1425,videos
71,Nice retort,2016-06-17 17:54:07+00:00,d4db7pm,4,t1_d4d9ylk,1551,videos
72,He pushed a rock! Grab the pitchforks! You guys need better things to get upset about.,2016-06-17 17:05:25+00:00,d4d8v5f,1,t3_4oijum,24898,videos
73,Its not like that at all whatsoever.,2016-06-17 17:04:11+00:00,d4d8t4f,3,t1_d4d4tmd,5110,videos
74,Except cutting down a tree is nowhere near equivalent to pushing a rock moron. ,2016-06-17 17:01:33+00:00,d4d8orr,2,t1_d4d0sq7,10559,videos
75,"Work on your timing and body language, other than that the crowd liked you.",2016-06-17 08:33:24+00:00,d4csyk2,1,t3_4ofekr,44305,videos
76,As someone in SoCal who doesnt deal with the hassle of trades im very very jealous.,2016-06-17 03:48:13+00:00,d4clt41,1,t3_4ofn83,24403,beerporn
77,The goat,2016-06-16 18:47:02+00:00,d4bygkf,1,t3_4oemep,3624,beerporn
78,"Like most of dfh new stuff, im excited yet not to optimistic about it.",2016-06-16 18:46:19+00:00,d4byf9r,1,t3_4oddhv,18107,beer
79,Well since you said please...i guess so.,2016-06-16 18:41:39+00:00,d4by6pt,2,t1_d4bt0x3,6143,worldnews
80,I dont see how this is relevant in anyway though. If a radical muslim can shoot up orlando and everybody starts yelling how this doesn't represent islam in anyway then if this guy is christian it also shouldn't matter. You hypocrites dont get to pick and choose when the religion of the attacker is relevant and when it isnt. ,2016-06-16 18:35:21+00:00,d4bxv7f,3,t1_d4bs2qv,6924,worldnews
81,"Hit box porn, like every other game out there that doesn't have hit box issues.",2016-06-14 23:31:30+00:00,d49hjqp,1,t3_4o2pma,19991,gaming
82,Meh. If this were any other game with the exact same trailer nobody would care.,2016-06-14 19:40:40+00:00,d496lw9,1,t3_4o24vj,12707,gaming
83,"Exactly in your shoes. I bought a ps4 and would put hours and hours into it. All i wanted to do was have a beer and play games. Then i realized i was literally wasting my life playing games. So much other things i could and should have been doing. So last month i gave away my ps4 and all my games (about $700 total of stuff) and now i use all that time to focus on my writing or practicing guitar. Things that actually pay off in the long run. I still miss gaming a lot though, i just dont do it because i consider it as strong as a drug.",2016-06-13 22:43:25+00:00,d47yhil,2,t1_d47b0lv,30677,AskReddit
84,"As a buyer for a small beer shop. Yes i do not like big macro corps coming in to muscle small guys out. Yet at the same time we have a new brewery every month (in la) and most of them start with the intent of selling out, which is a horrible reason to get into the craft. A lot of disrespect for the craft from both sides.",2016-06-12 06:07:03+00:00,d45qd66,1,t3_4nmkxx,41841,todayilearned
85,You mean just like every other platform? ,2016-06-09 19:11:06+00:00,d42o6ku,2,t1_d427lqw,22465,videos
86,"""None of the comedians are that good"". Totally subjective and many would disagree with you.",2016-06-08 17:14:50+00:00,d41440z,3,t1_d4102w0,4910,movies
87,"These used to be great. Now they just feel rushed and some batches good, some not so good. Wish stone didnt run these into the ground. Used to be something you looked forward to. Pretty much a year round brew now.",2016-06-02 14:39:28+00:00,d3t4hbj,1,t3_4m4a0g,53938,beerporn
88,Yeah but did they fix the mediocre combat system?,2016-06-01 01:14:17+00:00,d3r5z5d,1,t3_4lw71x,30169,gaming
89,"Cilantro is food of the gods, feel bad for anyone who doesnt have the superior gene. If you dont like ipas though why are you even here?",2016-05-28 10:10:05+00:00,d3mto8y,1,t3_4ld03f,44614,beer
90,Best price youll find that anywhere.,2016-05-28 09:55:58+00:00,d3mth84,1,t3_4ldqc5,32218,beerporn
91,Stop spamming the subreddit with these youtube e-celeb crap threads. The majority of people dont care. There are other subreddits to shill this cancer on.,2016-05-25 15:35:15+00:00,d3j660k,1,t3_4kyeqg,31414,videos
92,Wtf is the deal with these two retarded brothers you guys keep shilling for?! They arent funny and never were. Jesus christ just open up your youtube e-celeb subreddit already and fuck off with this cancer.,2016-05-25 03:57:45+00:00,d3io8oo,1,t3_4kx2x1,11381,videos
93,For what purpose? He's never going to win.,2016-05-22 18:11:45+00:00,d3feo6x,1,t3_4kj2fj,8837,LosAngeles
94,Girl with dragon tattoo ost.,2016-05-18 15:31:26+00:00,d3ab8xb,1,t3_4jvrpg,23214,vinyl
95,Hey thanks!,2016-05-11 17:25:13+00:00,d31jkgc,4,t1_d3160e5,20715,legaladvice
96,Op here . As one kind user helped me find. I just found out that my apt is under rent control. So legally i cant be evicted for this reason right?,2016-05-11 00:43:28+00:00,d30p5vg,1,t3_4iqs6m,20864,legaladvice
97,Ahh i see. As another user posted a site to help me see if my address was rent controlled and i guess mine isnt unfortunately. Thanks for the info though  ,2016-05-11 00:19:58+00:00,d30o985,4,t1_d30d1yy,15778,legaladvice
98,Always alone. And yeah never once had i heard about this. It seems insanely silly for places that are less than are not houses or super expensive.,2016-05-11 00:18:26+00:00,d30o70f,5,t1_d30hlfq,9986,legaladvice
99,"Thanks for the advice. I just entered my address and it did not show up unfortunately. 

Edit: read that wrong. Turns out i am under rent control!!! No way theyre kicking me out now!!!  Thanks brother!",2016-05-11 00:16:15+00:00,d30o3yc,2,t1_d30jxzw,6476,legaladvice
100,What do they care as long as the rent is getting paid? If i have any other financial trouble it still wouldn't affect my rent.  I get their concern that people might not pay rent but at the same time pre-judging someone like that is just a silly thing.,2016-05-11 00:13:14+00:00,d30nzqt,4,t1_d30n64s,1276,legaladvice
101,"it is not unfortunately. At least my unit isnt as rent has already gone up once, in the year ive been here.",2016-05-10 19:51:25+00:00,d30cs80,2,t1_d30cnjl,154,legaladvice
102,"Really? I've lived here for about 5 years now. Had apts in Venice, Koreatown and now silverlake, and I've never heard of this. usually a credit check was all that's needed.",2016-05-10 19:18:46+00:00,d30b6rq,3,t1_d30aqe4,570,legaladvice
103,This is absolutely awful. Guess not really much I can do then. :/,2016-05-10 19:06:08+00:00,d30al0o,2,t1_d30af5l,206,legaladvice
104,I would but its a one bedroom.,2016-05-10 19:02:14+00:00,d30aecu,2,t1_d30a9n7,167,legaladvice
105,Too bad they couldn't put more time and effort into a decent combat system.,2016-05-09 08:09:42+00:00,d2ydkpw,1,t3_4igb4h,40615,todayilearned
106,FUCK YEAH NOBLE AND BEACHWOOD LA REPRESENT! ,2016-05-08 01:06:07+00:00,d2wy34o,1,t3_4ia6qe,37998,beer
107,Wish mikkeller brought more rare stuff for their sd opening.,2016-04-29 21:58:09+00:00,d2mmrc1,1,t3_4h0msp,14466,beerporn
108,Wouldnt really consider this a lambic hut i would look for better stuff. ,2016-04-27 01:57:04+00:00,d2isqsj,1,t3_4glk0y,10068,beerporn
109,"Aww yes cucknada where mr supreme ""its 2016"" meme is in charge.",2016-04-21 11:39:34+00:00,d2bk3ru,1,t3_4fr83p,28748,pics
110,"Impressive, very nice.",2016-04-08 00:50:01+00:00,d1ubxde,1,t3_4dqxqf,42224,beerporn
111,Oh look another rushed cashgrab oh wait a minute its star wars so thats not possible.,2016-04-07 15:37:40+00:00,d1tn0h3,1,t3_4dqo8i,13684,movies
112,As ridiculous as it sounds. Its true. When youve got so much shit going on in your own yard its hard to think of your neighbors.,2016-04-04 04:29:55+00:00,d1ozh2e,1,t3_4d8rhw,13696,funny
113,Massive triggering in this thread.,2016-04-03 15:03:29+00:00,d1o41l7,1,t3_4d5bdq,28493,videos
114,Wow just made a res for this place last night. Glad ill be able to enjoy the view one mast time before it skyrockets in price.,2016-04-02 15:25:01+00:00,d1n11pb,1,t3_4d0hym,31248,LosAngeles
115,"Lol you dont really know sebastian do you? They don't call him the dark prince for nothing. I went to this show at his san francisco stop years ago.

This was sebastians live tour back in 2011 i think. This show was honestly the best ""dj"" show i have ever seen. It had a plot which for a electro show i found fascinating. Basically he takes power of france as a ruthless dictator and fucks up the country and gets assassinated. I remember there were people dancing and raging hard all the meantime people were getting their head smashed in on the big screen. Surreal yet great. Also our venue for once let people smoke indoors because sebby was doing it so the entire audience was chain smoking trying to keep up with sebbie (which we couldnt). Great great night.",2016-03-30 15:28:17+00:00,d1j5b6c,1,t3_4chtxk,61954,EdBangerRecords
116,Been drinking since 4pm and now you pull this shit on me?! Low blow,2016-03-30 08:38:49+00:00,d1iuf1e,1,t3_4ci5z8,32487,movies
117,Nice to hear its good. I have a bottle in my fridge right now yet to be opened,2016-03-29 21:24:32+00:00,d1i8czz,1,t3_4cfypz,20831,beerporn
118,Fuck yes,2016-03-26 20:57:15+00:00,d1ej56i,1,t3_4c10ad,30276,bloodborne
119,Oh yeah this looks fun as hell.,2016-03-23 04:31:57+00:00,d1a43na,1,t3_4bjv5t,20403,movies
120,Want that Mikkeller teku,2016-03-21 19:13:51+00:00,d186u02,1,t3_4bb5rd,47547,beerporn
121,WHATS GAWKER GONNA DO WHEN HULKOMAINA RUNS WILD ON YOU BROTHER,2016-03-19 21:59:05+00:00,d162y1l,1,t3_4b3ld4,21666,videos
122,This is gonna tank so hard,2016-03-16 21:55:58+00:00,d12isie,1,t3_4ap5wr,11861,movies
123,"$20 a six pack is literally the opposite of good value but ok, feel free to keep telling yourself it is.",2016-03-16 21:36:08+00:00,d12hxge,29,t1_d12encv,4340,beer
124,You are exaggerating and we both know it. Ciao,2016-03-16 20:09:36+00:00,d12dyyd,27,t1_d12du55,176,beer
125,"""Lol ok""

Nice. Funny to be objectively wrong i see.",2016-03-16 20:04:46+00:00,d12dqxf,25,t1_d12d5o8,774,beer
126,Youre making a bad case that bomber stouts dont sell well because certain breweries dont have a high demand at your shop. You are literally blaming the format of the beer instead of the actual beer. Those beers arent moving for you because they dont taste that great/nobody cares about them. Has nothing to do with them being 22oz. Step up fam,2016-03-16 20:03:40+00:00,d12dp3a,25,t1_d12d904,587,beer
127,Speedway isnt a bomber. Bad comparison mate,2016-03-16 19:49:04+00:00,d12d10i,23,t1_d12cgfd,762,beer
128,You get down voted for literally everything on here. Dont like pliny? Downvote. Think fundamental observation is overrated? Down vote. If youre judging based on down votes thats a poor sense of judgement on your part.,2016-03-16 19:41:04+00:00,d12co0m,23,t1_d12cgfd,282,beer
129,"In the realistic world where people are fed up with paying $20 plus for a sixer. Or in the realistic world where high abv stouts dont do well as six packs. Or how about the realistic world where  breaking packs down to singles is worse because now people can try the beer by a single 12oz for $3 as opposed to spending $15 for the bomber, therefore losing money for you and the brewery. Take your pick.",2016-03-16 19:14:03+00:00,d12bgw6,21,t1_d12b7kd,353,beer
130,"Yeah my bad guess it was prior2two who came up with that number. But my point still stands that a $16 bomber is better than a $20 six pack for a beer this style.

 Edit: and would ultimately sell twice as fast. ",2016-03-16 19:02:20+00:00,d12ayau,19,t1_d12arcw,259,beer
131,Ok so once again cost $10 after retail mark up that beer would be $16 max. Nowhere near your original estimate of $25-$30. How do you not know this? How much do you overcharge at your shop?,2016-03-16 18:50:53+00:00,d12afrb,17,t1_d12aam4,191,beer
