,body,created,id,nest_level,parent_id,reply_delay,subreddit
0,"I don't have a high school education, I left in the 9th grade.

Platonic is complicated, no standard conversation involves that word. ",2016-03-17 04:36:55+00:00,d12x5vx,4,t1_d12x3di,142,explainlikeimfive
1,"Because I'm gonna stream/record every pug and scrim I play.

Gg once more Reddit ",2016-03-14 21:40:24+00:00,d0zupk5,5,t1_d0ziucc,16233,GlobalOffensive
2,"Eco ace

They didn't have armor

It's not that special.",2016-03-14 17:02:16+00:00,d0ziio3,3,t1_d0zcwmm,8363,GlobalOffensive
3,"Eco ace while they peek one by one 

Well played reddit",2016-03-14 13:37:28+00:00,d0zaqsp,1,t3_4abi40,36063,GlobalOffensive
4,How does this have 400 up votes,2016-03-12 02:40:26+00:00,d0wr5qv,1,t3_49wozc,88918,GlobalOffensive
5,What the fuck,2016-03-11 18:02:57+00:00,d0w7lbu,2,t1_d0w4al7,4662,pyrocynical
6,10/0 perfect London ,2016-02-19 21:07:44+00:00,d06bmmy,1,t3_46jqre,43853,GlobalOffensive
7,yes,2016-02-19 15:10:15+00:00,d05wark,3,t1_d05js7h,35235,GlobalOffensive
8,👌🏻👌🏻,2016-02-18 19:36:37+00:00,d04vpdr,1,t3_46dmc9,43861,h3h3productions
9,"Reddit is so sensitive it's hilarious. You guys need to calm down, seriously. s1mple doesn't need your bullshit support, and you don't need to bring down freakazoid. Shit like this happens in MM all the time, don't know why it's any different in the pro scene.

It's like racial inequality. White man gets shot by a cop, no one bats an eye, black man gets shot it's racist.",2016-02-18 18:56:08+00:00,d04tqop,1,t3_46fb7h,11720,GlobalOffensive
10,can u not,2016-02-13 23:01:53+00:00,czyxfyi,2,t1_czyxdim,116,GlobalOffensive
11,"Nowadays you don't. Back then all the bands had to learn through blood and sweat. If only Kanye could go through what Slayer, Dead Kennedys, even NWA had to go through he wouldn't last a minute.",2016-02-13 04:45:24+00:00,czy6lwj,3,t1_czxyj8w,15982,Music
12,I mean it's not really that impressive. No disrespect.,2016-02-12 21:35:32+00:00,czxsluf,1,t3_45go11,4029,GlobalOffensive
13,Thank god Paul is #2. He's the most talented on the list.,2016-02-12 16:54:12+00:00,czxgnm5,1,t3_45ffvz,2284,Music
14,I feel like at this time SD transformed into Rock 'n Roll. They were more punk a few years before. Still one of my all time favorite bands.,2016-02-12 16:52:15+00:00,czxgkil,1,t3_45ctto,47711,Music
15,"Angel of Death by Slayer. It will 
And you jump up at the scream.",2016-02-12 16:49:58+00:00,czxggyk,1,t3_45cwi9,46509,Music
16,My dad showed me them a few years back. Been playing a few riffs of theirs on guitar.,2016-02-12 16:41:57+00:00,czxg4ee,2,t1_czwsiuw,53108,Music
17,"Realistically, is your aim good? Probably not. Your game sense is obviously trash. Don't focus on smokes and flashes, you are never going to use them. Just DM on 64 tick servers, you're not ready for ESEA so there's no reason to focus on 128 tick. Basically, sorry to put it bluntly, but you just can't do anything.",2016-02-11 18:23:06+00:00,czw9wo7,1,t3_459ls8,6865,GlobalOffensive
18,What was your ADR?,2016-02-11 00:50:07+00:00,czvgjmq,2,t1_czvggiu,141,GlobalOffensive
19,"No. He wasn't too good compared to Zxav, Penguin, and I. I don't really care, it's just Titan literally was always the last one in. It's not hard to win a 1v1 after your team did all the work...",2016-02-11 00:46:55+00:00,czvgfe2,2,t1_czvgb3e,196,GlobalOffensive
20,"Good post;
Reddit
???
",2016-02-11 00:43:27+00:00,czvgasj,3,t1_czvg38q,349,GlobalOffensive
21,If this was a shroud post it'd be on the front page.,2016-02-11 00:31:58+00:00,czvfvy2,1,t3_455ytu,765,GlobalOffensive
22,"Dude ESEA is all about stats man. When you clearly have more of an impact over a player and he gets higher RWS, it's tilting. He was always the last guy in... Did nothing.",2016-02-11 00:22:50+00:00,czvfkc3,2,t1_czvfiik,81,GlobalOffensive
23,"You can have 10 RWS simply by baiting and not doing anything. RWS barely matters, everyone knows it's a flawed system. ADR, FPR, sht like that matter. Team play matters. RWS is just individual.",2016-02-04 16:44:30+00:00,cznosi9,6,t1_czn0ygl,55039,GlobalOffensive
24,shut up normie,2016-01-27 00:51:36+00:00,czd9kw4,2,t1_czd9jk9,56,GlobalOffensive
25,Holy. Shit. Thank you. Worked.,2016-01-03 05:49:56+00:00,cyk4219,3,t1_cyk3ulv,418,h1z1
26,"I'm having the same problem. No solution whatsoever, I legit cannot play this game. Can't refund it now either, can't do anything.",2016-01-03 05:01:51+00:00,cyk2m7z,1,t3_3z8e5r,2555,h1z1
27,First joint experience?,2015-12-23 00:29:48+00:00,cy8eiqx,1,t3_3xvxn1,9088,IAmA
28,holy shit we need trump stat,2015-12-21 10:26:35+00:00,cy6gn1n,1,t3_3xlgik,61561,worldnews
29,Really? You think this game is just about frags? He's IGL... They can't just kick him. Newfagerino spottederino.,2015-12-17 00:56:59+00:00,cy1oz26,2,t1_cy1on8k,570,GlobalOffensive
30,"WHEN WILL SEAN  COME BACKKK?

oh and if i ever see you in public, chub n tuck with me?",2015-12-12 02:27:25+00:00,cxw2hts,1,t3_3wfzn6,10839,IAmA
31,Nerd ,2015-11-30 20:38:06+00:00,cxiagli,2,t1_cxhd6hu,70583,Chargers
32,That video was like some guy trying to force a smile ,2015-11-30 20:37:18+00:00,cxiafdq,1,t3_3urtwf,77629,Chargers
33,"Integrity and competition are two different things. We can argue all day long, there will be two different opinions no matter what. Neither of us will change each other's minds. However, doing what you have to do to win and keep your job is worth everything. Honestly, hope the guy is alright, but it's a competitive sport and winning is everything.",2015-11-30 20:28:36+00:00,cxia2d2,8,t1_cxi9v60,285,Jaguars
34,"Better get all the Jags fans to downvote his post and upvote yours!

Who cares. Chargers won and they deserved it. Now leave. :^)",2015-11-30 20:21:21+00:00,cxi9rcf,11,t1_cxhke5d,57925,Chargers
35,"Keep

Benching

Him",2015-11-30 20:11:13+00:00,cxi9c4s,1,t3_3urfrm,81699,Chargers
36,"Let me ask you this; did the challenge actually make you mad or are you sad/angry/salty/whatever that the Jaguars lost? It's not about morals, it's about winning. Do you think Brady cares about his opponent? No. He cares about one thing, and that's winning. Be angry all you want, they did what they had to do to win.",2015-11-30 19:56:58+00:00,cxi8qrd,6,t1_cxi7g9t,1869,Jaguars
37,"&gt; on our unconscious player. Since writing this I've seen reports that the challenge was thrown before anyone was aware that burns was injured.
&gt; 


https://i.ytimg.com/vi/7HoCKlNsolc/hqdefault.jpg
",2015-11-30 17:23:38+00:00,cxi2kk9,4,t1_cxhfqs9,54700,Jaguars
38,Yeah fuck the Chargers for challenging a play that could potentially help them win a game in a competitive sport! Fuck them for trying! FUCK FUCK FUCK THE CHARGERS!!!,2015-11-30 00:18:55+00:00,cxhbl0p,2,t1_cxh48wc,11771,Jaguars
39,"I'm legit not saying there's anything wrong with console, I played COD on console long before I got a gaming PC. Plebsole was merely a shot at people with consoles. I'll admit I had problems on PC, I had to adjust some things. However, PC feels a little easier than console, and you can do more with settings in shit. Again, of course it's perfect for console. Their main target audience is console players.",2015-11-25 17:55:19+00:00,cxcst2f,5,t1_cxcezqi,32887,blackops3
40,"1080p 60FPS, your point? I get 60FPS on 1080P as well. I'm just saying it's good on PC, but not everyone can or will dump money into a gaming rig for games like BO3 when they can get it on a console. 

I mean, if you really wanna jerk your dick over a PC/Console war be my guest.",2015-11-25 00:31:28+00:00,cxc1r9s,3,t1_cxc0kpx,2090,blackops3
41,I mean you're on PS3... Game was barely meant for last gen.,2015-11-24 21:56:15+00:00,cxbw1us,1,t3_3u4oyq,2094,blackops3
42,"it's good on PC, but not everyone has thousands of dollars to dump on a good rig for games like this. That's why COD is primarily a plebsole game.",2015-11-24 21:55:03+00:00,cxbvzz8,1,t3_3u4snw,610,blackops3
43,"Oh, no. Why do you need 144? This isn't CS where 144 and 60 is a huge difference.",2015-11-24 20:39:46+00:00,cxbsqmg,3,t1_cxbs5ca,830,blackops3
44,"960 you can run like medium-high settings at 100%.

I play on 750ti 2GB and I play at 80% medium-high settings with minimal FPS drops.",2015-11-24 20:18:53+00:00,cxbruea,1,t3_3u3loi,10889,blackops3
45,Only one. They've done a great job at preventing to so far on PC.,2015-11-24 20:10:33+00:00,cxbrhh5,1,t3_3u3wir,6344,blackops3
46,"Legal issues? How, it's peoples work and versions of logos or whatever, not actual representation of the company. So weird and dumb.",2015-11-24 19:22:17+00:00,cxbpe7u,2,t1_cxbnnfr,2465,blackops3
47,Can I ask what your build is?,2015-11-24 19:19:11+00:00,cxbp9ex,2,t1_cxbi515,10153,blackops3
48,"Or just an option to put it public so others can download it. I don't get why that's not an option.

Cryptokeys could work, it would set up somewhat of a virtual economy within the game, which I like.",2015-11-24 19:12:43+00:00,cxbozi3,1,t3_3u3sha,4348,blackops3
49,"Ah, that woulda been sick to get in a game with Happy",2015-11-24 19:02:41+00:00,cxbokbf,4,t1_cxba9zv,25903,blackops3
50,"I do for some reason.  

And OP, was Happy there too? I saw Happy's name, wanted to see if it was really him.",2015-11-24 10:15:24+00:00,cxb8xtn,2,t1_cxb8gsf,2085,blackops3
51,What are you specs?,2015-11-24 03:49:55+00:00,cxb0ggq,1,t3_3u11d9,3328,blackops3
52,"Same here. Could care less about KD. Winning is always the objective, and that's why I wish BO3 had a better MM system. But meh, games fine.",2015-11-23 04:36:34+00:00,cx9tsme,2,t1_cx9tnl4,268,blackops3
53,"We had a whole lobby using them in PC. Granted, we're all pretty good at the game but it was a really reliable gun. I went 40-6 on KC. Pretty good gun on our end.",2015-11-23 04:35:22+00:00,cx9tr9m,1,t3_3tt1cw,58478,blackops3
54,What/where are those challenges?,2015-11-22 04:08:04+00:00,cx8pez4,2,t1_cx8lq72,7217,blackops3
55,"I'll try this when I get home, thanks.",2015-11-16 17:41:39+00:00,cx299h2,2,t1_cx1rspw,45768,blackops3
56,"Funny and original! 

Seriously, I have 8. That's plenty. It should only use like two gigs...",2015-11-13 03:13:15+00:00,cwyi3bs,2,t1_cwyhgru,1089,CallOfDuty
57,bought one. +rep,2015-08-23 08:55:05+00:00,cucnwh0,1,t3_3i28a3,1412,Pins4Skins
58,bought one. +rep,2015-08-23 08:55:02+00:00,cucnwg2,1,t3_3i05s6,45701,Pins4Skins
59,"Ehh to be fair he can be good. He was exciting in their super bowl run, but I credit all that to Alex Smith. 

But I can't wait for Felipe to play with Stevie, he needs another big target. We also get to see LaDarius Green :3",2015-08-18 15:49:27+00:00,cu74wwf,2,t1_cu72t4h,3271,Chargers
60,Felipe pls ,2015-08-18 15:45:57+00:00,cu74run,1,t3_3hdxem,53448,Chargers
61,+1 bought shit from him,2015-08-10 16:22:04+00:00,cty2x4y,1,t3_3gha4c,157,GlobalOffensiveTrade
62,hi im a lqqkagn i selled wife for internet for play counter offensive stirke global i get 500 ping to somoalia server but i try,2015-08-03 22:29:58+00:00,ctqfhe5,10,t1_ctqfb5k,285,GlobalOffensive
63,Kreygasm fREAKAZOIDS Kreygasm Biceps Kreygasm,2015-07-12 21:15:39+00:00,ct10r0b,1,t3_3d1v47,397,GlobalOffensive
