,created,domain,full_link,locked,selftext,subreddit,title,url
110,2016-03-24 20:18:53+00:00,self.thedivision,https://www.reddit.com/r/thedivision/comments/4btci2/are_the_encounters_in_the_game_repeatable_missions/,False,Or can you complete them all without them coming back. I'm kind of a completionist and don't want to just keep doing them all if i don't need the exp. ,thedivision,Are the encounters in the game repeatable missions?,https://www.reddit.com/r/thedivision/comments/4btci2/are_the_encounters_in_the_game_repeatable_missions/
111,2016-03-23 19:29:29+00:00,self.Fallout,https://www.reddit.com/r/Fallout/comments/4bo1kx/did_the_glitch_where_you_cannot_start_the_dlc/,False,Quest starts and there is no way to progress after following the distress signal. ,Fallout,Did the glitch where you cannot start the DLC quest get fixed yet?,https://www.reddit.com/r/Fallout/comments/4bo1kx/did_the_glitch_where_you_cannot_start_the_dlc/
112,2016-03-23 01:25:35+00:00,self.Fallout,https://www.reddit.com/r/Fallout/comments/4bkh6b/i_need_help_starting_this_dlc/,False,"Installed it and started the quest. But when i follow the distress signal at the beginning there is no one there. No robots pop up even though the quest logs tells me to kill any hostile robots. 

I have closed and reopened the game. I have reinstalled the DLC and tried loading previous saves as well. 

No luck so far any help?",Fallout,I need help starting this DLC.,https://www.reddit.com/r/Fallout/comments/4bkh6b/i_need_help_starting_this_dlc/
113,2016-03-21 02:39:12+00:00,self.thewalkingdead,https://www.reddit.com/r/thewalkingdead/comments/4bajyy/do_we_have_any_explanation_to_why_dwights_face_is/,False,[removed],thewalkingdead,Do we have any explanation to why Dwight's face is burnt in the T.V show as of yet? Idk if this considered a spoiler or not.,https://www.reddit.com/r/thewalkingdead/comments/4bajyy/do_we_have_any_explanation_to_why_dwights_face_is/
114,2016-03-21 02:12:20+00:00,self.Vue,https://www.reddit.com/r/Vue/comments/4bagoe/is_hbo_currently_available/,False,I saw Showtime got added last year but any news on HBO? Those are really the only 2 concerns i had when i first looked at the channels available.,Vue,Is HBO currently available?,https://www.reddit.com/r/Vue/comments/4bagoe/is_hbo_currently_available/
115,2016-03-20 07:38:56+00:00,self.atheism,https://www.reddit.com/r/atheism/comments/4b6shu/can_you_guys_help_me_dig_up_some_dirt_on_joel/,False,"They seem to be squeaky clean according to my family and do ""a lot of charitable work"". 

Any help?",atheism,Can you guys help me dig up some dirt on Joel Osteen or Joyce Meyer?,https://www.reddit.com/r/atheism/comments/4b6shu/can_you_guys_help_me_dig_up_some_dirt_on_joel/
116,2016-03-19 22:45:57+00:00,self.thedivision,https://www.reddit.com/r/thedivision/comments/4b55og/is_the_flatiron_district_the_most_southern_part/,False,"It looks like there is a lot more that is blocked off.

Also i see Central Park at the top but it is out of bounds. 

Does the map expand later in the game?

I'm only level 20 right now but i was just curious. ",thedivision,Is the Flatiron District the most southern part of the map?,https://www.reddit.com/r/thedivision/comments/4b55og/is_the_flatiron_district_the_most_southern_part/
117,2016-03-15 19:34:08+00:00,self.paragon,https://www.reddit.com/r/paragon/comments/4ak1c5/how_much_is_the_game_going_to_cost/,False,Just curious.,paragon,How much is the game going to cost?,https://www.reddit.com/r/paragon/comments/4ak1c5/how_much_is_the_game_going_to_cost/
118,2016-03-11 20:57:45+00:00,self.thedivision,https://www.reddit.com/r/thedivision/comments/4a0p9r/are_the_story_missions_closes_currently/,False,Can't seem to play any of them.,thedivision,Are the story missions closes currently?,https://www.reddit.com/r/thedivision/comments/4a0p9r/are_the_story_missions_closes_currently/
119,2016-03-11 02:03:51+00:00,self.PS4,https://www.reddit.com/r/PS4/comments/49wpqa/getting_psn_error_ce386254_cant_broadcast_to/,False,been streaming all week and now suddenly having problems. Any idea why?,PS4,Getting PSN Error CE-38625-4. Can't broadcast to YouTube.,https://www.reddit.com/r/PS4/comments/49wpqa/getting_psn_error_ce386254_cant_broadcast_to/
120,2016-03-02 01:28:57+00:00,politico.com,https://www.reddit.com/r/SandersForPresident/comments/48jrwb/can_someone_explain_to_me_why_clinton_has_17/,False,,SandersForPresident,Can someone explain to me why Clinton has 17 delegates in MA and Sanders only has 1. Regardless of whether he is winning in percentage or not.,http://www.politico.com/2016-election/results/map/president/massachusetts
121,2016-02-27 22:45:31+00:00,self.Adobe,https://www.reddit.com/r/Adobe/comments/47yqh7/i_currently_have_photoshop_that_pay_10_a_month/,False,I only need Photoshop and Premiere what's the best way to go about it?,Adobe,I currently have Photoshop that pay $10 a month for. Do i need to pay another $10 a month to get another program?,https://www.reddit.com/r/Adobe/comments/47yqh7/i_currently_have_photoshop_that_pay_10_a_month/
122,2016-02-24 06:00:45+00:00,youtube.com,https://www.reddit.com/r/NewTubers/comments/47b52j/falling_off_rooftops_rainbow_six_siege/,False,,NewTubers,Falling off Rooftops: Rainbow Six Siege,https://www.youtube.com/watch?v=FbK4WfGvGT8&amp;ab_channel=MRHoward
123,2016-02-24 05:48:42+00:00,youtube.com,https://www.reddit.com/r/YouTubeGamers/comments/47b3hr/falling_off_rooftops_rainbow_six_siege/,False,,YouTubeGamers,Falling off Rooftops. Rainbow Six Siege,https://www.youtube.com/watch?v=FbK4WfGvGT8&amp;ab_channel=MRHoward
124,2016-02-23 01:48:34+00:00,self.SquaredCircle,https://www.reddit.com/r/SquaredCircle/comments/474atr/did_vince_drop_an_f_bomb/,False,[removed],SquaredCircle,Did Vince drop an F Bomb?,https://www.reddit.com/r/SquaredCircle/comments/474atr/did_vince_drop_an_f_bomb/
125,2016-02-23 01:33:35+00:00,self.SquaredCircle,https://www.reddit.com/r/SquaredCircle/comments/4748g4/did_vince_drop_and_f_bomb_during_that_segment_or/,False,[removed],SquaredCircle,Did Vince drop and F Bomb during that segment or was just my cable's audio that cut out?,https://www.reddit.com/r/SquaredCircle/comments/4748g4/did_vince_drop_and_f_bomb_during_that_segment_or/
126,2016-02-19 05:38:17+00:00,youtube.com,https://www.reddit.com/r/SandersForPresident/comments/46j5xa/saw_this_video_posted_in_response_to_bernies_free/,False,,SandersForPresident,Saw this video posted in response to Bernie's free healthcare and free education plans. What do you guys think?,https://www.youtube.com/watch?v=iYCSsaaRM94&amp;ab_channel=DineshD%27Souza
127,2016-02-18 01:48:59+00:00,youtube.com,https://www.reddit.com/r/SmallYTChannel/comments/46cbob/rainbow_six_siege_lets_play/,False,,SmallYTChannel,Rainbow Six Siege Let's Play!,https://www.youtube.com/playlist?list=PL2smiBqFBuBnrCVpGAZKPUESlIaioNXaW
128,2016-02-18 01:38:28+00:00,youtube.com,https://www.reddit.com/r/YTPL/comments/46ca2x/rainbow_six_siege_lets_plays/,False,,YTPL,Rainbow Six Siege Let's Plays,https://www.youtube.com/playlist?list=PL2smiBqFBuBnrCVpGAZKPUESlIaioNXaW
129,2016-02-18 01:26:42+00:00,gaming.youtube.com,https://www.reddit.com/r/YouTubeGamers/comments/46c8ct/live_streaming_wwe_2k16_taking_requests_for/,False,,YouTubeGamers,Live streaming WWE 2K16! Taking requests for matchups!,https://gaming.youtube.com/watch?v=AT05cvKrgew
130,2016-02-15 20:01:16+00:00,self.letsplaycollab,https://www.reddit.com/r/letsplaycollab/comments/45ydv4/looking_for_people_to_collab_with_on_ps4/,False,"PSN name is same as my username here. :)

Let me know!",letsplaycollab,"Looking for people to collab with on PS4. Currently playing Rainbow Six Siege, Elder Scrolls Online, or COD: Black Ops 3!",https://www.reddit.com/r/letsplaycollab/comments/45ydv4/looking_for_people_to_collab_with_on_ps4/
131,2016-02-15 19:51:11+00:00,self.LetsPlayVideos,https://www.reddit.com/r/LetsPlayVideos/comments/45ybnb/playing_rainbow_six_siege_1/,False,"https://www.youtube.com/playlist?list=PL2smiBqFBuBnrCVpGAZKPUESlIaioNXaW

I've uploaded a few videos so far and plan on continuing on a weekly basis.

Check it out if you want to see gameplay, get an idea of how the game works, check out maps, operators and more!",LetsPlayVideos,Playing Rainbow Six Siege #1,https://www.reddit.com/r/LetsPlayVideos/comments/45ybnb/playing_rainbow_six_siege_1/
132,2016-02-15 19:41:13+00:00,youtube.com,https://www.reddit.com/r/letsplay/comments/45y9eo/just_started_playing_rainbow_six_siege_if_anyone/,False,,letsplay,Just started playing Rainbow Six Siege if anyone is interested. I'll take any ideas or critiques too!,https://www.youtube.com/playlist?list=PL2smiBqFBuBnrCVpGAZKPUESlIaioNXaW
133,2016-02-15 18:08:09+00:00,self.illegaltorrents,https://www.reddit.com/r/illegaltorrents/comments/45xs1z/request_need_photoshop_with_simple_install/,False,Preferably CS6.,illegaltorrents,[REQUEST] Need Photoshop with simple install directions.,https://www.reddit.com/r/illegaltorrents/comments/45xs1z/request_need_photoshop_with_simple_install/
134,2016-02-09 20:50:34+00:00,facebook.com,https://www.reddit.com/r/atheism/comments/44yuq1/im_sure_some_of_you_have_seen_this_meme_can/,False,,atheism,I'm sure some of you have seen this meme. Can anyone defend the original post and counter argue the response?,https://www.facebook.com/inspiringphilosophy/photos/a.673006102780246.1073741829.668643796549810/985136361567217/?type=3&amp;theater
135,2016-02-08 17:37:21+00:00,self.wwesupercard,https://www.reddit.com/r/wwesupercard/comments/44rztq/anyone_else_having_trouble_getting_into_the_game/,False,Keep getting error 4-1016,wwesupercard,Anyone else having trouble getting into the game?,https://www.reddit.com/r/wwesupercard/comments/44rztq/anyone_else_having_trouble_getting_into_the_game/
136,2016-02-07 04:30:03+00:00,self.PS4,https://www.reddit.com/r/PS4/comments/44k07b/mods_are_supposedly_going_to_be_portable_to_ps4/,False,"I understand with ESO it's more complicated because it's online, but i'm telling you the game would be a shit ton better with an inventory and UI like that of skyrim or even fallout.",PS4,Mods are supposedly going to be portable to PS4 for Bethesda's Fallout 4. Is there any chance at all that some mods could be made for ESO or any other Bethesda games on PS4?,https://www.reddit.com/r/PS4/comments/44k07b/mods_are_supposedly_going_to_be_portable_to_ps4/
137,2016-02-07 03:40:24+00:00,imdb.com,https://www.reddit.com/r/atheism/comments/44jt47/have_you_guys_heard_of_this_new_movie_risen_tell/,False,,atheism,Have you guys heard of this new movie Risen. Tell me what you think.,http://www.imdb.com/title/tt3231054/
138,2016-01-26 04:38:10+00:00,self.AskDocs,https://www.reddit.com/r/AskDocs/comments/42pvo9/experiencing_mild_pain_in_my_left_ankle_whenever/,False,"I didn't injure it and have never had any problems with it before. I had to sit in class for about 3 hours and when i got up to leave it began hurting. 

It is not swollen and there is no bruising. 

I am 21 and am overweight (low 300's) if they makes any difference.

All i know is that it's not broken and it's not sprained. 

Any ideas? I've been elevating it if that could help. 

Thanks!",AskDocs,Experiencing mild pain in my left ankle whenever i apply pressure to it by walking or standing.,https://www.reddit.com/r/AskDocs/comments/42pvo9/experiencing_mild_pain_in_my_left_ankle_whenever/
139,2016-01-24 06:40:23+00:00,self.atheism,https://www.reddit.com/r/atheism/comments/42exk1/im_looking_for_summaries_of_each_of_the_books_of/,False,"Not like 1 sentence summaries, more in depth summaries of each book. 

If anyone can point me in the right direction it would be greatly appreciated.",atheism,I'm looking for summaries of each of the books of the bible.,https://www.reddit.com/r/atheism/comments/42exk1/im_looking_for_summaries_of_each_of_the_books_of/
140,2016-01-23 04:13:27+00:00,self.illegaltorrents,https://www.reddit.com/r/illegaltorrents/comments/429bnr/request_president_2009_documentary/,False,http://www.imdb.com/title/tt1374935/?ref_=wl_li_tt,illegaltorrents,[Request] President (2009 Documentary),https://www.reddit.com/r/illegaltorrents/comments/429bnr/request_president_2009_documentary/
141,2016-01-21 00:27:19+00:00,self.illegaltorrents,https://www.reddit.com/r/illegaltorrents/comments/41xa3b/request_think_world_religions_edition_2nd/,False,"Author: Robson

ISBN: 9780205934430

Copyright Year: 2013

Publisher: Pearson",illegaltorrents,[Request] THINK World Religions Edition: 2nd,https://www.reddit.com/r/illegaltorrents/comments/41xa3b/request_think_world_religions_edition_2nd/
142,2016-01-19 03:48:12+00:00,self.illegaltorrents,https://www.reddit.com/r/illegaltorrents/comments/41mrxs/textbook_requests/,False,"“Chinese Religious Life” by Palmer

ISBN: 9780199731381


“Taste of Blood” by Wafer

ISBN: 9780812213416


“In Extremis: Death &amp; Life in the 21st Century Haitian Art” by Cosentino

ISBN:  9780984755004


“Mama Lola” by Brown

ISBN:  9780520268104


Any Help appreciated. ",illegaltorrents,[Textbook Requests],https://www.reddit.com/r/illegaltorrents/comments/41mrxs/textbook_requests/
143,2016-01-11 04:10:29+00:00,self.blackops3,https://www.reddit.com/r/blackops3/comments/40f0wr/is_there_a_way_to_save_game_settings_in_local/,False,I play offline with friends and bots every once in a while and hate having to change setting for each game mode every time. ,blackops3,Is there a way to save game settings in local multiplayer?,https://www.reddit.com/r/blackops3/comments/40f0wr/is_there_a_way_to_save_game_settings_in_local/
144,2016-01-01 02:02:38+00:00,imgur.com,https://www.reddit.com/r/wwesupercard/comments/3yz78c/was_hoping_for_another_diva_i_could_pro_from_my/,False,,wwesupercard,Was hoping for another diva i could pro from my rewards.....,http://imgur.com/a/hXZu6
145,2015-12-30 07:28:50+00:00,self.illegaltorrents,https://www.reddit.com/r/illegaltorrents/comments/3yrbqz/request_mad_as_hell_2014_documentary_film/,False,,illegaltorrents,[REQUEST] Mad As Hell (2014 Documentary Film),https://www.reddit.com/r/illegaltorrents/comments/3yrbqz/request_mad_as_hell_2014_documentary_film/
146,2015-12-26 00:17:26+00:00,self.atheism,https://www.reddit.com/r/atheism/comments/3y8del/help_me_choose_between_two_books_the_god_delusion/,False,"Can only buy 1 right now and really want a good book. 

EDIT: Thanks to a fellow atheist of this subreddit i can now afford both. I look forward to reading these, but to continue the conversation tell me which one I should read first.",atheism,"Help me choose between two books. ""The God Delusion"" By Richard Dawkins, or ""God is Not Great"" By Christopher Hitchens",https://www.reddit.com/r/atheism/comments/3y8del/help_me_choose_between_two_books_the_god_delusion/
147,2015-12-23 04:30:02+00:00,self.illegaltorrents,https://www.reddit.com/r/illegaltorrents/comments/3xxalw/request_the_resurrection_of_jake_the_snake/,False,,illegaltorrents,[REQUEST] The Resurrection of Jake The Snake Roberts (Wrestling documentary),https://www.reddit.com/r/illegaltorrents/comments/3xxalw/request_the_resurrection_of_jake_the_snake/
148,2015-12-23 04:19:48+00:00,self.illegaltorrents,https://www.reddit.com/r/illegaltorrents/comments/3xx9ii/request_pitch_black_2000_movie/,False,,illegaltorrents,[REQUEST] Pitch Black (2000 Movie),https://www.reddit.com/r/illegaltorrents/comments/3xx9ii/request_pitch_black_2000_movie/
149,2015-12-23 01:50:13+00:00,self.mugen,https://www.reddit.com/r/mugen/comments/3xwrpu/some_of_the_pictures_for_characters_on_the/,False,Any idea how to fix this?,mugen,Some of the pictures for characters on the character selection screen get moved over a few spaces.,https://www.reddit.com/r/mugen/comments/3xwrpu/some_of_the_pictures_for_characters_on_the/
150,2015-12-23 01:27:22+00:00,self.illegaltorrents,https://www.reddit.com/r/illegaltorrents/comments/3xwour/request_the_amazing_spiderman_2/,False,,illegaltorrents,[REQUEST] The Amazing Spiderman 2,https://www.reddit.com/r/illegaltorrents/comments/3xwour/request_the_amazing_spiderman_2/
151,2015-12-23 00:25:50+00:00,self.illegaltorrents,https://www.reddit.com/r/illegaltorrents/comments/3xwhar/request_pokemon_seasons_1217_english/,False,"Looking for the English versions of those seasons.

Starts with Diamond and Pearl: Galactic Battles and ends with Best Wishes: Adventures in Unova and Beyond.

Any help would be appreciated.",illegaltorrents,[REQUEST] Pokemon Seasons 12-17 ENGLISH,https://www.reddit.com/r/illegaltorrents/comments/3xwhar/request_pokemon_seasons_1217_english/
152,2015-12-21 07:37:43+00:00,self.mugen,https://www.reddit.com/r/mugen/comments/3xoep5/is_it_possible_to_change_the_hard_controls_of_the/,False,"For some reason ""L"" is the default select button on the character selection screen.",mugen,"Is it possible to change the hard controls of the game so that ""enter"" on my keyboard is used to select a character.",https://www.reddit.com/r/mugen/comments/3xoep5/is_it_possible_to_change_the_hard_controls_of_the/
153,2015-12-21 03:41:32+00:00,self.atheism,https://www.reddit.com/r/atheism/comments/3xnpn8/evolutionary_experts_i_need_your_help/,False,"Without delving into to too many details, I had a conversation with my very very religious aunt and cousins the other night about a variety of things.

When the topic of evolution came up i explained evolution by natural selection and used examples like frogs in the rain forest developing spots or changing color over time in order to blend in with their surrounding more easily.   

They then said that those changes were guided by god and didn't just happen ""by chance"".

What do you guys think about this,and how can respond next time they say this. 

Thanks for any incite or input!

EDIT: if you don't think it's worth my time having these conversations with my family i respect your opinion but will likely not take your advice. I'm stubborn.",atheism,Evolutionary experts i need your help!,https://www.reddit.com/r/atheism/comments/3xnpn8/evolutionary_experts_i_need_your_help/
154,2015-12-11 06:32:59+00:00,self.SquaredCircle,https://www.reddit.com/r/SquaredCircle/comments/3wcb6e/i_was_watching_wm_2_again_and_noticed_that/,False,"Just thought it was funny, as i couldn't stop laughing watching him get his ass beat by Ricky Steamboat. ",SquaredCircle,I was watching WM 2 again and noticed that Hercules looked just like the fun loving Eugene from 2004.,https://www.reddit.com/r/SquaredCircle/comments/3wcb6e/i_was_watching_wm_2_again_and_noticed_that/
155,2015-12-09 04:37:22+00:00,self.buzzfeed,https://www.reddit.com/r/buzzfeed/comments/3w16a8/can_we_get_a_list_of_cast_members_in_the_buzzfeed/,False,,buzzfeed,Can we get a list of cast members in the buzzfeed videos?,https://www.reddit.com/r/buzzfeed/comments/3w16a8/can_we_get_a_list_of_cast_members_in_the_buzzfeed/
156,2015-12-06 22:05:02+00:00,self.fo4,https://www.reddit.com/r/fo4/comments/3vply2/so_how_are_mods_supposed_to_come_to_consoles_next/,False,"I really look forward to finally having mods in ps4 but I'm not sure how they plan on getting it to work by next year.

Also how will they port mods over once they have them available on pc.",fo4,So how are mods supposed to come to consoles next year when the creation kit won't be out till at least then anyway.,https://www.reddit.com/r/fo4/comments/3vply2/so_how_are_mods_supposed_to_come_to_consoles_next/
157,2015-12-06 06:18:59+00:00,self.gaming,https://www.reddit.com/r/gaming/comments/3vmtiz/were_the_gaming_awards_the_definitive_results_of/,False,,gaming,"Were the Gaming Awards the ""definitive"" results of the year? Is there a ""definitive"" source for GOTY?",https://www.reddit.com/r/gaming/comments/3vmtiz/were_the_gaming_awards_the_definitive_results_of/
158,2015-12-06 00:05:19+00:00,self.DIY,https://www.reddit.com/r/DIY/comments/3vlnjd/looking_to_soundproof_a_door_that_needs_to_be/,False,[removed],DIY,Looking to soundproof a door that needs to be usable. (Can open and close),https://www.reddit.com/r/DIY/comments/3vlnjd/looking_to_soundproof_a_door_that_needs_to_be/
159,2015-12-05 01:46:02+00:00,self.Markiplier,https://www.reddit.com/r/Markiplier/comments/3vhpml/is_there_anywhere_to_submit_game_requests_to_mark/,False,I saw there is an archived post here but nothing new. ,Markiplier,Is there anywhere to submit game requests to Mark?,https://www.reddit.com/r/Markiplier/comments/3vhpml/is_there_anywhere_to_submit_game_requests_to_mark/
160,2015-12-03 04:57:31+00:00,self.falloutsettlements,https://www.reddit.com/r/falloutsettlements/comments/3v8rcb/is_there_a_list_of_things_that_settlers_can_be/,False,So far i have them managing plants and guard posts. Anything else?,falloutsettlements,Is there a list of things that settlers can be assigned to somewhere?,https://www.reddit.com/r/falloutsettlements/comments/3v8rcb/is_there_a_list_of_things_that_settlers_can_be/
161,2015-11-24 23:12:29+00:00,self.Fallout,https://www.reddit.com/r/Fallout/comments/3u55rq/not_able_to_place_large_shack_in_build_mode/,False,"I had already placed it but want to move it. I've tried extending the wood floors i had built to fit and even tried just putting it on one of the empty building plots in sanctuary. 

Any ideas?",Fallout,Not able to place large shack in build mode.,https://www.reddit.com/r/Fallout/comments/3u55rq/not_able_to_place_large_shack_in_build_mode/
162,2015-11-24 05:00:14+00:00,self.epicmealtime,https://www.reddit.com/r/epicmealtime/comments/3u1gs5/can_we_petition_to_get_the_girls_in_these_videos/,False,,epicmealtime,Can we petition to get the girls in these videos Instagram or youtube links after each video.,https://www.reddit.com/r/epicmealtime/comments/3u1gs5/can_we_petition_to_get_the_girls_in_these_videos/
163,2015-11-24 02:02:40+00:00,uproxx.com,https://www.reddit.com/r/SquaredCircle/comments/3u0ufx/pretty_sure_the_miz_gets_punched_the_face_by_his/,False,,SquaredCircle,Pretty sure The Miz gets punched the face by his wife and Ex-WWE Diva Maryse in Santa's Little Helper.,http://uproxx.com/prowrestling/2015/10/santas-little-helper-trailer-miz-paige/
164,2015-11-19 22:33:10+00:00,self.illegaltorrents,https://www.reddit.com/r/illegaltorrents/comments/3thrj5/request_north_country_2005/,False,Stars  Charlize Theron. ,illegaltorrents,[REQUEST] North Country (2005),https://www.reddit.com/r/illegaltorrents/comments/3thrj5/request_north_country_2005/
165,2015-11-19 00:16:54+00:00,self.wwesupercard,https://www.reddit.com/r/wwesupercard/comments/3td6h0/does_maintenance_usually_last_more_than_an_hour/,False,Starting to get impatient haha,wwesupercard,Does maintenance usually last more than an hour.,https://www.reddit.com/r/wwesupercard/comments/3td6h0/does_maintenance_usually_last_more_than_an_hour/
166,2015-11-18 19:12:19+00:00,self.Fallout,https://www.reddit.com/r/Fallout/comments/3tbwcb/taking_t60b_power_armor_from_the_brotherhood/,False,[Pretty Funny](https://youtu.be/kIEB2z61iZI),Fallout,Taking T-60b Power Armor from the Brotherhood without them knowing.,https://www.reddit.com/r/Fallout/comments/3tbwcb/taking_t60b_power_armor_from_the_brotherhood/
167,2015-11-13 02:56:53+00:00,self.PS4,https://www.reddit.com/r/PS4/comments/3sm8hg/tried_to_upload_content_to_youtube_got_the_error/,False,Anyone know what this is or what i can do to fix this?,PS4,Tried to upload content to YouTube got the error CE-32947-5.,https://www.reddit.com/r/PS4/comments/3sm8hg/tried_to_upload_content_to_youtube_got_the_error/
168,2015-11-13 00:39:22+00:00,self.secretsanta,https://www.reddit.com/r/secretsanta/comments/3slqs8/theres_an_option_on_amazon_to_add_friends_from/,False,,secretsanta,There's an option on Amazon to add friends from facebook so you can view there wishlists. Does adding them let them know that you are looking at their wishlist?,https://www.reddit.com/r/secretsanta/comments/3slqs8/theres_an_option_on_amazon_to_add_friends_from/
169,2015-11-11 22:16:12+00:00,self.WWEGames,https://www.reddit.com/r/WWEGames/comments/3sglz5/is_the_current_demon_kane_in_the_game/,False,I can't seem to find him anywhere but could have swore i saw screen shots of him somewhere. ,WWEGames,Is the current Demon Kane in the game?,https://www.reddit.com/r/WWEGames/comments/3sglz5/is_the_current_demon_kane_in_the_game/
170,2015-11-11 02:21:57+00:00,self.PS4,https://www.reddit.com/r/PS4/comments/3scvkk/can_i_record_my_own_speech_through_my_headset/,False,,PS4,Can i record my own speech through my headset while playing a game on PS4?,https://www.reddit.com/r/PS4/comments/3scvkk/can_i_record_my_own_speech_through_my_headset/
171,2015-11-05 03:57:09+00:00,xvideos.com,https://www.reddit.com/r/IncestPorn/comments/3rl433/anyone_know_the_name_of_the_blond/,False,,IncestPorn,Anyone know the name of the blond?,http://www.xvideos.com/video14352717/cheerleader_and_stepmom_lesbians#_tabComments
172,2015-11-04 04:34:57+00:00,self.askscience,https://www.reddit.com/r/askscience/comments/3rgb28/can_memories_or_experiences_be_passed_down/,False,[removed],askscience,Can memories or experiences be passed down through DNA or genes in anyway?,https://www.reddit.com/r/askscience/comments/3rgb28/can_memories_or_experiences_be_passed_down/
173,2015-11-02 18:56:09+00:00,i.imgur.com,https://www.reddit.com/r/FoodPorn/comments/3r8tom/chocolate_frosted_glazed_donut_from_dunkin_donuts/,False,,FoodPorn,Chocolate Frosted Glazed Donut from Dunkin Donuts [721 x 1280],http://i.imgur.com/1ZyWXDV.jpg
174,2015-11-02 05:50:18+00:00,self.WWEGames,https://www.reddit.com/r/WWEGames/comments/3r6gfl/anyone_else_notice_the_ref_counting_to_3_and/,False,Is this a bug or do they make that happen sometimes just to really piss us off?,WWEGames,Anyone else notice the ref counting to 3 and ending a match even when the guy getting pinned grabs the rope.,https://www.reddit.com/r/WWEGames/comments/3r6gfl/anyone_else_notice_the_ref_counting_to_3_and/
