,created,domain,full_link,locked,selftext,subreddit,title,url
0,2016-11-22 02:12:38+00:00,self.SquaredCircle,https://www.reddit.com/r/SquaredCircle/comments/5e86cl/whats_the_latest_in_finn_balor/,False,"Rumble Return maybe?

EDIT: HAHA Meant ""on Finn Balor"" ",SquaredCircle,What's the latest in Finn Balor?,https://www.reddit.com/r/SquaredCircle/comments/5e86cl/whats_the_latest_in_finn_balor/
1,2016-11-22 02:01:34+00:00,self.answers,https://www.reddit.com/r/answers/comments/5e84dm/how_many_electoral_votes_would_each_state_get_if/,False,[removed],answers,How many Electoral votes would each State get if every individual vote was worth the same?,https://www.reddit.com/r/answers/comments/5e84dm/how_many_electoral_votes_would_each_state_get_if/
2,2016-11-22 01:43:13+00:00,self.PoliticalDiscussion,https://www.reddit.com/r/PoliticalDiscussion/comments/5e811z/how_many_electoral_votes_would_each_state_get_if/,False,[removed],PoliticalDiscussion,How many Electoral votes would each State get if every individual vote was worth the same?,https://www.reddit.com/r/PoliticalDiscussion/comments/5e811z/how_many_electoral_votes_would_each_state_get_if/
3,2016-11-22 01:35:29+00:00,youtube.com,https://www.reddit.com/r/politics/comments/5e7zo7/how_many_electoral_votes_would_each_state_get_if/,False,,politics,How many Electoral votes would each State get if every individual vote was worth the same?,https://www.youtube.com/watch?v=7wC42HgLA4k
4,2016-11-14 22:13:40+00:00,i.redd.it,https://www.reddit.com/r/oldpeoplefacebook/comments/5cys6u/kayaking/,False,,oldpeoplefacebook,Kayaking,https://i.redd.it/3aqebtg9tnxx.png
5,2016-11-12 18:03:22+00:00,i.redd.it,https://www.reddit.com/r/Pizza/comments/5clk83/im_getting_better_at_this_making_pizza_thing/,False,,Pizza,I'm getting better at this making pizza thing. [Sausage and Pepperoni],https://i.redd.it/cmyzb0mta8xx.jpg
6,2016-11-10 04:46:15+00:00,self.skyrimmods,https://www.reddit.com/r/skyrimmods/comments/5c61e0/so_should_i_update_my_game_with_the_latest_patch/,False,I've heard it's caused some problems.,skyrimmods,So should i update my game with the latest patch?,https://www.reddit.com/r/skyrimmods/comments/5c61e0/so_should_i_update_my_game_with_the_latest_patch/
7,2016-11-08 05:19:07+00:00,self.SquaredCircle,https://www.reddit.com/r/SquaredCircle/comments/5brfkv/why_were_rtruth_and_goldust_replaced/,False,[removed],SquaredCircle,Why were R-Truth and Goldust replaced?,https://www.reddit.com/r/SquaredCircle/comments/5brfkv/why_were_rtruth_and_goldust_replaced/
8,2016-11-07 02:50:04+00:00,self.skyrimmods,https://www.reddit.com/r/skyrimmods/comments/5bjtx8/is_there_a_difference_between_skse_and_sse/,False,,skyrimmods,Is there a difference between SKSE and SSE?,https://www.reddit.com/r/skyrimmods/comments/5bjtx8/is_there_a_difference_between_skse_and_sse/
9,2016-11-04 04:53:54+00:00,i.redd.it,https://www.reddit.com/r/skyrim/comments/5b1rno/literally_unplayable/,False,,skyrim,Literally unplayable,https://i.redd.it/qrhif9drajvx.jpg
10,2016-11-04 00:55:06+00:00,imgur.com,https://www.reddit.com/r/Pizza/comments/5b0ofo/meatlovers_pizza_full_pepperoni_half_sausage_half/,False,,Pizza,"Meatlovers Pizza (Full Pepperoni, Half Sausage, Half Bacon)",http://imgur.com/a/CHNyW
11,2016-11-01 20:01:26+00:00,youtube.com,https://www.reddit.com/r/wwesupercard/comments/5albxp/bigedudes_supercard_tutorial_for_new_players_part/,False,,wwesupercard,Bigedude's Supercard Tutorial for new Players. [PART 1],https://www.youtube.com/watch?v=9U2yd2Z8n1Y
12,2016-11-01 01:54:12+00:00,self.FalloutMods,https://www.reddit.com/r/FalloutMods/comments/5agjy3/is_there_a_way_to_see_the_newest_mods_on/,False,[removed],FalloutMods,Is there a way to see the newest mods on bethesda.net?,https://www.reddit.com/r/FalloutMods/comments/5agjy3/is_there_a_way_to_see_the_newest_mods_on/
13,2016-10-30 03:55:32+00:00,self.PoliticalDiscussion,https://www.reddit.com/r/PoliticalDiscussion/comments/5a4e42/can_we_compare_clinton_and_stein_accumulate_all/,False,[removed],PoliticalDiscussion,Can we compare Clinton and Stein? Accumulate all the pros and cons of each candidate and try and come to conclusion on who deserves a vote.,https://www.reddit.com/r/PoliticalDiscussion/comments/5a4e42/can_we_compare_clinton_and_stein_accumulate_all/
14,2016-10-28 02:27:06+00:00,self.thewalkingdead,https://www.reddit.com/r/thewalkingdead/comments/59s4i5/is_the_group_out_of_georgia_in_the_show/,False,[removed],thewalkingdead,Is the group out of Georgia in the show?,https://www.reddit.com/r/thewalkingdead/comments/59s4i5/is_the_group_out_of_georgia_in_the_show/
15,2016-10-28 01:42:35+00:00,self.thewalkingdead,https://www.reddit.com/r/thewalkingdead/comments/59rwdr/where_is_judith_currently/,False,[removed],thewalkingdead,Where is Judith currently?,https://www.reddit.com/r/thewalkingdead/comments/59rwdr/where_is_judith_currently/
16,2016-10-27 05:33:20+00:00,amazon.com,https://www.reddit.com/r/24hoursupport/comments/59meld/looking_for_a_wireless_mouse_with_both_forward/,False,,24hoursupport,"Looking for a wireless mouse with both ""forward"" and ""back"" buttons similar to the one linked.",https://www.amazon.com/Microsoft-Wireless-Mobile-Mouse-6000/dp/B0025ZH43O
17,2016-10-27 04:53:01+00:00,self.techsupport,https://www.reddit.com/r/techsupport/comments/59m9ed/im_looking_for_a_specific_kind_of_computer_mouse/,False,"Wireless and windows 10 compatible. 

[Here](https://www.amazon.com/Microsoft-Wireless-Mobile-Mouse-6000/dp/B0025ZH43O) is a reference to what i'm looking for design wise.",techsupport,"I'm looking for a specific kind of computer mouse with both ""forward"" and ""back"" buttons on it.",https://www.reddit.com/r/techsupport/comments/59m9ed/im_looking_for_a_specific_kind_of_computer_mouse/
18,2016-10-25 23:41:59+00:00,self.gaming,https://www.reddit.com/r/gaming/comments/59edt1/is_there_a_way_to_tell_what_specs_you_need_to_run/,False,I know there are minimum specs available for most games but I'm in the market for a new laptop soon and would like to get the most out of playing games like Skyrim and Civ 6,gaming,Is there a way to tell what specs you need to run specific games at the highest quality? (ultra settings),https://www.reddit.com/r/gaming/comments/59edt1/is_there_a_way_to_tell_what_specs_you_need_to_run/
19,2016-10-23 06:39:26+00:00,youtube.com,https://www.reddit.com/r/cringe/comments/58xgsc/trump_gets_booed_heckled_for_bad_jokes_at_al/,False,,cringe,"Trump Gets Booed, Heckled For Bad Jokes At Al Smith Dinner",https://www.youtube.com/watch?v=2HqA5i4AjOs&amp;index=75&amp;list=WL
20,2016-10-23 01:55:57+00:00,youtube.com,https://www.reddit.com/r/atheism/comments/58wh38/the_atheist_delusion_a_ray_comfort_movie/,False,,atheism,The Atheist Delusion: A Ray Comfort Movie,https://www.youtube.com/watch?v=ChWiZ3iXWwM&amp;feature=youtu.be
21,2016-10-22 20:04:44+00:00,imdb.com,https://www.reddit.com/r/torrentrequests/comments/58uxjv/request_michael_moore_in_trumpland/,False,,torrentrequests,[REQUEST] Michael Moore in Trumpland,http://www.imdb.com/title/tt6163356/
22,2016-10-20 05:32:21+00:00,self.SquaredCircle,https://www.reddit.com/r/SquaredCircle/comments/58f955/should_i_know_the_guy_that_austin_aries_chose_as/,False,[removed],SquaredCircle,Should I know the guy that Austin Aries chose as a tag partner? I've watched a lot of wrestling but have no idea who this guy is.,https://www.reddit.com/r/SquaredCircle/comments/58f955/should_i_know_the_guy_that_austin_aries_chose_as/
23,2016-10-18 00:56:33+00:00,self.SquaredCircle,https://www.reddit.com/r/SquaredCircle/comments/5810t0/the_combined_age_of_mark_henry_goldust_and_rtruth/,False,"They are 45, 47, and 44 respectively. ",SquaredCircle,"The combined age of Mark Henry, Goldust, and R-Truth is 136",https://www.reddit.com/r/SquaredCircle/comments/5810t0/the_combined_age_of_mark_henry_goldust_and_rtruth/
24,2016-10-14 07:57:07+00:00,self.WWEGames,https://www.reddit.com/r/WWEGames/comments/57fade/is_there_any_real_way_to_get_suggestions_or/,False,"There are just so many things i'd like to ask them about and even suggest for future games.

Mostly I just want to know why they STILL haven't put back in all the stuff they took out when the series came to the new gen. ",WWEGames,Is there any real way to get suggestions or concerns about the series to 2K?,https://www.reddit.com/r/WWEGames/comments/57fade/is_there_any_real_way_to_get_suggestions_or/
25,2016-10-14 06:55:03+00:00,self.WWEGames,https://www.reddit.com/r/WWEGames/comments/57f4dp/does_the_weight_detection_option_actually_do/,False,"I'm not seeing much of a difference. Whether on or off i can still suplex Andre with someone like Balor. 

Is it glitched? Or just not actual weight detection?",WWEGames,Does the weight detection option actually do anything?,https://www.reddit.com/r/WWEGames/comments/57f4dp/does_the_weight_detection_option_actually_do/
26,2016-10-13 01:24:31+00:00,self.WWEGames,https://www.reddit.com/r/WWEGames/comments/577r3a/we_should_get_a_thread_going_for_bugs_and_things/,False,[removed],WWEGames,We should get a thread going for bugs and things that need to be fixed. That way it's all in one place.,https://www.reddit.com/r/WWEGames/comments/577r3a/we_should_get_a_thread_going_for_bugs_and_things/
27,2016-10-12 02:19:15+00:00,self.WWEGames,https://www.reddit.com/r/WWEGames/comments/571v5h/is_there_a_way_to_change_the_entrance_for_an_alt/,False,I got an NWO savage alt attire and am trying to figure out how to add the NWO theme to that attire but not the original Savage. ,WWEGames,Is there a way to change the entrance for an alt attire?,https://www.reddit.com/r/WWEGames/comments/571v5h/is_there_a_way_to_change_the_entrance_for_an_alt/
28,2016-10-10 05:10:32+00:00,corespirit.com,https://www.reddit.com/r/atheism/comments/56qgdf/what_do_you_guys_think_about_this_article/,False,,atheism,What do you guys think about this article claiming there is proof Jesus didn't exist?,http://www.corespirit.com/ancient-confession-found-invented-jesus-christ/
29,2016-10-06 21:48:45+00:00,i.redd.it,https://www.reddit.com/r/SquaredCircle/comments/567ylj/the_dusty_rhodes_tag_team_classic_tournament/,False,,SquaredCircle,The Dusty Rhodes Tag Team Classic Tournament Brackets,https://i.redd.it/3dprmr6edxpx.png
30,2016-10-06 05:30:45+00:00,self.Ask_Politics,https://www.reddit.com/r/Ask_Politics/comments/563xr0/first_time_voting_this_year_do_they_signify_who/,False,,Ask_Politics,First Time Voting this year. Do they signify who are (R) and who are (D) when it comes to House and Senate candidates on the ballot?,https://www.reddit.com/r/Ask_Politics/comments/563xr0/first_time_voting_this_year_do_they_signify_who/
31,2016-10-05 03:42:26+00:00,self.torrentrequests,https://www.reddit.com/r/torrentrequests/comments/55xmvy/request_2016_streamy_awards/,False,,torrentrequests,[REQUEST] 2016 Streamy Awards,https://www.reddit.com/r/torrentrequests/comments/55xmvy/request_2016_streamy_awards/
32,2016-10-05 03:31:23+00:00,self.torrents,https://www.reddit.com/r/torrents/comments/55xl8y/request_the_2016_streamy_awards/,False,[removed],torrents,[REQUEST] The 2016 Streamy Awards,https://www.reddit.com/r/torrents/comments/55xl8y/request_the_2016_streamy_awards/
33,2016-10-05 03:09:41+00:00,self.youtube,https://www.reddit.com/r/youtube/comments/55xi17/anyone_know_where_i_can_watch_the_full_streamy/,False,Started it late and the video went private before i saw anyone win.,youtube,Anyone know where I can watch the full Streamy Awards?,https://www.reddit.com/r/youtube/comments/55xi17/anyone_know_where_i_can_watch_the_full_streamy/
34,2016-10-02 00:38:38+00:00,self.SquaredCircle,https://www.reddit.com/r/SquaredCircle/comments/55g1v1/who_do_you_think_will_be_able_to_dethrone_asuka/,False,"Ember Moon seems to be the most likely choice as of right now, but i still feel like it will be a while before it's believable that she could take out Asuka.",SquaredCircle,Who do you think will be able to dethrone Asuka as champ and how long will it take them to train up to that level of (kayfabe) skill.,https://www.reddit.com/r/SquaredCircle/comments/55g1v1/who_do_you_think_will_be_able_to_dethrone_asuka/
35,2016-09-27 05:43:21+00:00,youtube.com,https://www.reddit.com/r/Christianity/comments/54p6tx/how_to_tell_if_you_are_an_atheist_an_interesting/,False,,Christianity,How to tell if you are an atheist: An interesting talk that could help you understand why someone might identify as an atheist.,https://www.youtube.com/watch?v=AiYMuGUnMxM&amp;list=PL2smiBqFBuBkj0S1tCzd4LpAI6pi0hsxF&amp;index=5&amp;ab_channel=brain3zzzz
36,2016-09-27 04:47:53+00:00,self.Christianity,https://www.reddit.com/r/Christianity/comments/54p0ae/why_do_you_feel_prayer_works/,False,"I'd rather not have answers regarding feelings. Prayer can make people feel better, no doubt, but what exactly makes you feel that it works? Wouldn't prayer not matter in the grand scheme of things since God is supposed to be omniscient, thus already knowing what will happen in the future?",Christianity,Why do you feel prayer works?,https://www.reddit.com/r/Christianity/comments/54p0ae/why_do_you_feel_prayer_works/
37,2016-09-20 00:05:32+00:00,self.SquaredCircle,https://www.reddit.com/r/SquaredCircle/comments/53knhr/why_are_fans_still_hating_on_reigns_hes_away_from/,False,[removed],SquaredCircle,Why are fans still hating on Reigns? He's away from the title picture and continually getting beat in one way or another.,https://www.reddit.com/r/SquaredCircle/comments/53knhr/why_are_fans_still_hating_on_reigns_hes_away_from/
38,2016-09-19 07:34:45+00:00,self.AskReddit,https://www.reddit.com/r/AskReddit/comments/53ghxu/what_are_the_best_documentariesmovies_covering/,False,,AskReddit,What are the best documentaries/movies covering the conflicts in the middle east?,https://www.reddit.com/r/AskReddit/comments/53ghxu/what_are_the_best_documentariesmovies_covering/
39,2016-09-18 20:21:30+00:00,self.LosAngelesRams,https://www.reddit.com/r/LosAngelesRams/comments/53dyis/so_have_the_rams_gone_back_to_their_old_colors_or/,False,,LosAngelesRams,So have the Rams gone back to their old colors? OR are they just wearing throwbacks for today's game?,https://www.reddit.com/r/LosAngelesRams/comments/53dyis/so_have_the_rams_gone_back_to_their_old_colors_or/
40,2016-08-30 23:46:36+00:00,self.torrentrequests,https://www.reddit.com/r/torrentrequests/comments/50e77w/request_human_nutrition_science_of_healthy_living/,False,"ISBN-13: 9780073402529
ISBN-10: 0073402524

Authors: Tammy Stephenson - Wendy Schiff

",torrentrequests,[REQUEST] Human Nutrition: Science of Healthy Living (Book),https://www.reddit.com/r/torrentrequests/comments/50e77w/request_human_nutrition_science_of_healthy_living/
41,2016-08-29 07:13:52+00:00,self.SourceFed,https://www.reddit.com/r/SourceFed/comments/503tnk/looking_for_an_episode_of_comment_commentary/,False,,SourceFed,Looking for an episode of comment commentary where Steve and Matt keep reading the same comment over and over again.,https://www.reddit.com/r/SourceFed/comments/503tnk/looking_for_an_episode_of_comment_commentary/
42,2016-08-29 06:42:03+00:00,self.SourceFed,https://www.reddit.com/r/SourceFed/comments/503q92/im_looking_for_firstlast_videos_of_each_of_the/,False,"I've been looking and have only found Lee's last video, Joe's last comment commentary, and Elliot's last comment commentary. 

Any help would be greatly appreciated, as well as any of your personal favorites if you have them. ",SourceFed,I'm looking for first/last videos of each of the hosts as well as any compilation or best of videos for each host.,https://www.reddit.com/r/SourceFed/comments/503q92/im_looking_for_firstlast_videos_of_each_of_the/
43,2016-08-28 04:58:36+00:00,self.wwesupercard,https://www.reddit.com/r/wwesupercard/comments/4zy18u/am_i_the_only_one_that_cant_tell_the_difference/,False,,wwesupercard,Am I the only one that can't tell the difference between a SV fusion and an Epic fusion while it's cooking?,https://www.reddit.com/r/wwesupercard/comments/4zy18u/am_i_the_only_one_that_cant_tell_the_difference/
44,2016-08-26 03:34:34+00:00,self.SquaredCircle,https://www.reddit.com/r/SquaredCircle/comments/4zmmko/you_cant_give_someone_that_looks_like_a_potato/,False,"The first match on the show was Dillinger vs Blake. And the crowd booed the crap out of Blake. Not to mention the music sounded like it belonged to someone who was pretty awesome, and then he came out and disappointed everyone. ",SquaredCircle,You can't give someone that looks like a potato badass music like that. (NXT 8/24/16),https://www.reddit.com/r/SquaredCircle/comments/4zmmko/you_cant_give_someone_that_looks_like_a_potato/
45,2016-08-25 04:27:45+00:00,i.redd.it,https://www.reddit.com/r/SourceFed/comments/4zgrjf/there_you_go_guys_smaude/,False,,SourceFed,There you go guys.. SMAUDE,https://i.redd.it/2pnhz4ochghx.png
46,2016-08-25 00:42:02+00:00,youtube.com,https://www.reddit.com/r/YouTubeGamers/comments/4zftyq/help_sourcefed_nerd_get_to_1_million_subs_10_hr/,False,,YouTubeGamers,Help Sourcefed Nerd get to 1 Million Subs! || 10 HR Live Stream Live Now!,https://www.youtube.com/watch?v=LcRjfEduJK4&amp;ab_channel=SourceFedNERD
47,2016-08-24 21:24:03+00:00,i.redd.it,https://www.reddit.com/r/SourceFed/comments/4zewnd/heres_the_live_stream_schedule_for_the_day_guys/,False,,SourceFed,Here's the Live stream schedule for the day guys. (Pacific Time),https://i.redd.it/7tj5g91qdehx.png
48,2016-08-21 19:26:36+00:00,i.redd.it,https://www.reddit.com/r/wwesupercard/comments/4ywlju/id_say_ive_had_a_pretty_good_weekend/,False,,wwesupercard,I'd say I've had a pretty good weekend.,https://i.redd.it/rkbuw35zdsgx.jpg
49,2016-08-18 02:46:23+00:00,self.PS4,https://www.reddit.com/r/PS4/comments/4y9ulv/having_trouble_with_the_youtube_app_backend_error/,False,"I can watch videos fine, from the home page, but when I try and go to my library I get the same thing every time when it says ""Backend  error"".

Not sure why and was wondering if anyone knows how to fix this or where I could go for help if not here. ",PS4,Having Trouble with the Youtube app (Backend error),https://www.reddit.com/r/PS4/comments/4y9ulv/having_trouble_with_the_youtube_app_backend_error/
50,2016-08-17 19:06:05+00:00,self.PS4,https://www.reddit.com/r/PS4/comments/4y7h71/problem_with_youtube_app_backend_error/,False,"Every time I try and open up my library in the Youtube app it fails to load and I get a ""Backend Error"" 

Have not been able to find any answers online. 

I have logged out and back in, restarted the app and the PS4 and have even disconnected my youtube account from psn altogether before trying again. 

Any ideas? ",PS4,Problem with Youtube App (Backend Error),https://www.reddit.com/r/PS4/comments/4y7h71/problem_with_youtube_app_backend_error/
51,2016-08-17 03:34:32+00:00,self.Dentistry,https://www.reddit.com/r/Dentistry/comments/4y3jkp/i_recently_got_a_sedative_filling_put_in_a_tooth/,False,,Dentistry,I recently got a Sedative Filling put in a tooth that is going to need to be removed. Can I brush and chew with it normally? There is no pain (yet),https://www.reddit.com/r/Dentistry/comments/4y3jkp/i_recently_got_a_sedative_filling_put_in_a_tooth/
52,2016-08-17 01:54:49+00:00,self.AskVet,https://www.reddit.com/r/AskVet/comments/4y35jf/my_cat_gags_at_the_site_of_human_food/,False,"He eats and drinks enough and doesn't have any signs of distress like vomit or litter box problems. But whenever anyone around him eats or has food in front of him he gags a little bit. 

Just wanted to know if it's something I should take him to the vet for or not. He was said to be healthy at his last visit. ",AskVet,My cat gags at the site of human food.,https://www.reddit.com/r/AskVet/comments/4y35jf/my_cat_gags_at_the_site_of_human_food/
53,2016-08-16 01:31:06+00:00,imgur.com,https://www.reddit.com/r/wwesupercard/comments/4xx0f6/i_think_ss_tier_is_coming_this_week_guys/,False,,wwesupercard,I think SS tier is coming this week guys.,http://imgur.com/a/LUtt1
54,2016-08-16 00:43:10+00:00,self.SquaredCircle,https://www.reddit.com/r/SquaredCircle/comments/4xwsyr/so_whats_up_with_big_e/,False,"He wasn't in the preview for the tag title match at summerslam.

Is he legit injured?",SquaredCircle,So what's up with Big E?,https://www.reddit.com/r/SquaredCircle/comments/4xwsyr/so_whats_up_with_big_e/
55,2016-08-13 06:40:19+00:00,self.kickasstorrents,https://www.reddit.com/r/kickasstorrents/comments/4xhzmx/that_gofundme_campaign_has_been_taken_down_was_it/,False,,kickasstorrents,That GoFundMe campaign has been taken down. Was it fake?,https://www.reddit.com/r/kickasstorrents/comments/4xhzmx/that_gofundme_campaign_has_been_taken_down_was_it/
56,2016-08-12 06:14:50+00:00,self.thepiratebay,https://www.reddit.com/r/thepiratebay/comments/4xc691/when_i_click_on_the_magnet_link_to_an_open/,False,,thepiratebay,When I click on the magnet link to an open something directly in BitTorrent where does the actual torrent file get stored on my computer?,https://www.reddit.com/r/thepiratebay/comments/4xc691/when_i_click_on_the_magnet_link_to_an_open/
57,2016-08-09 07:37:02+00:00,self.wwesupercard,https://www.reddit.com/r/wwesupercard/comments/4wv0bv/how_long_should_i_wait_to_hear_back_after/,False,,wwesupercard,How long should I wait to hear back after emailing catdaddy about my season 1 cards?,https://www.reddit.com/r/wwesupercard/comments/4wv0bv/how_long_should_i_wait_to_hear_back_after/
58,2016-08-08 22:53:21+00:00,self.olympics,https://www.reddit.com/r/olympics/comments/4wt0f1/is_there_anywhere_to_rewatch_any_of_the_events_in/,False,I'm in the U.S and have cable but am not home during most of the airings. ,olympics,Is there anywhere to rewatch any of the events in full online? I'm looking for mostly Swimming and Track/Field Videos.,https://www.reddit.com/r/olympics/comments/4wt0f1/is_there_anywhere_to_rewatch_any_of_the_events_in/
59,2016-08-05 20:26:19+00:00,self.wwesupercard,https://www.reddit.com/r/wwesupercard/comments/4wcghg/will_we_be_able_to_train_s1_cards_once_s3_comes/,False,[removed],wwesupercard,Will we be able to train S1 cards once S3 comes out or do we need to fully level them before hand.,https://www.reddit.com/r/wwesupercard/comments/4wcghg/will_we_be_able_to_train_s1_cards_once_s3_comes/
60,2016-08-03 00:22:15+00:00,self.chrome,https://www.reddit.com/r/chrome/comments/4vvrbp/some_imgur_links_crash_when_i_try_and_open_them/,False,"It's strange it only happens with certain links. I have tried opening them in Firefox and have no problem, but wanted to see if this was fixable.",chrome,Some imgur links crash when I try and open them with chrome.,https://www.reddit.com/r/chrome/comments/4vvrbp/some_imgur_links_crash_when_i_try_and_open_them/
61,2016-08-02 06:23:57+00:00,molonlabemedia.com,https://www.reddit.com/r/politics/comments/4vr3zn/wikileaks_drops_bomb_on_hillary_clinton/,False,,politics,Wikileaks Drops Bomb on Hillary Clinton,http://www.molonlabemedia.com/2016/08/01/wikileaks-drops-bomb-hillary-clinton/
62,2016-08-02 06:00:46+00:00,molonlabemedia.com,https://www.reddit.com/r/news/comments/4vr1bv/wikileaks_drops_bomb_on_hillary_clinton/,False,,news,Wikileaks Drops Bomb on Hillary Clinton,http://www.molonlabemedia.com/2016/08/01/wikileaks-drops-bomb-hillary-clinton/
63,2016-07-31 22:53:36+00:00,reddit.com,https://www.reddit.com/r/SquaredCircle/comments/4vjhxs/so_someone_over_on_rmashup_made_a_mashup_of_sami/,False,,SquaredCircle,So someone over on r/mashup made a mashup of Sami Zayn's Theme and a Taylor Swift song...,https://www.reddit.com/r/mashups/comments/4vjan6/we_will_never_be_apart_taylor_swift_sami_zayn_235/
64,2016-07-28 06:00:11+00:00,facebook.com,https://www.reddit.com/r/SandersForPresident/comments/4uz7md/so_have_you_guys_seen_the_100page_report_on/,False,,SandersForPresident,So have you guys seen the 100-page report on Election Fraud in this years Dem Primary?,https://www.facebook.com/notes/election-justice-usa/democracy-lost-a-report-on-the-fatally-flawed-2016-democratic-primaries/923891901070837
65,2016-07-28 04:56:53+00:00,i.redd.it,https://www.reddit.com/r/tytonreddit/comments/4uyzre/so_there_is_a_theory_now_that_hillary_dws_and_tim/,False,,tytonreddit,"So there is a theory now that Hillary, DWS, and Tim Kaine planned to rig this election long ago. What are your thoughts?",https://i.redd.it/sujwp5a2twbx.png
66,2016-07-27 04:57:12+00:00,self.SquaredCircle,https://www.reddit.com/r/SquaredCircle/comments/4usyjv/does_anyone_think_spoiler_will_get_involved_in/,False,[removed],SquaredCircle,Does anyone think SPOILER will get involved in the Universal Title match at Summerslam?,https://www.reddit.com/r/SquaredCircle/comments/4usyjv/does_anyone_think_spoiler_will_get_involved_in/
67,2016-07-27 02:49:53+00:00,self.SquaredCircle,https://www.reddit.com/r/SquaredCircle/comments/4ush99/is_there_anyway_to_rewatch_smackdown_and_raw_on/,False,A family member doesn't have a computer and always misses the live shows.,SquaredCircle,Is there anyway to re-watch Smackdown and Raw on cable (Charter) in the U.S?,https://www.reddit.com/r/SquaredCircle/comments/4ush99/is_there_anyway_to_rewatch_smackdown_and_raw_on/
68,2016-07-27 00:49:42+00:00,self.SquaredCircle,https://www.reddit.com/r/SquaredCircle/comments/4urzkz/i_have_a_feeling_eva_marie_is_going_to_become_the/,False,[removed],SquaredCircle,I have a feeling Eva Marie is going to become the new Roman Reigns here in the IWC.,https://www.reddit.com/r/SquaredCircle/comments/4urzkz/i_have_a_feeling_eva_marie_is_going_to_become_the/
