,created,domain,full_link,locked,selftext,subreddit,title,url
69,2016-07-26 21:37:38+00:00,self.EnoughTrumpSpam,https://www.reddit.com/r/EnoughTrumpSpam/comments/4ur44s/so_theres_a_trump_cheat_sheet_over_on_rthe_donald/,False,"Just figured we could cross reference with our list over [here](https://www.reddit.com/r/EnoughTrumpSpam/comments/4teoxl/a_final_response_to_the_tell_me_why_trump_is_a/)

And maybe correct some of their posts. 

I don't know if i'm allowed to link that other post so just google Stump Cheat Sheet if you want to see it. 

EDIT: [Here's the post] (http://archive.is/OXrU3)",EnoughTrumpSpam,"So there's a ""Trump Cheat Sheet"" over on r/The_Donald that addresses many of his ""positions"" and how to fight against people supporting other candidates.",https://www.reddit.com/r/EnoughTrumpSpam/comments/4ur44s/so_theres_a_trump_cheat_sheet_over_on_rthe_donald/
70,2016-07-26 00:34:41+00:00,self.wwesupercard,https://www.reddit.com/r/wwesupercard/comments/4ulvyq/it_would_be_nice_if_catdaddy_could_maybe_give_us/,False,[removed],wwesupercard,It would be nice if Catdaddy could maybe give us a warning when servers were going down for maintenance. Or at least let us finish bouts before kicking us.,https://www.reddit.com/r/wwesupercard/comments/4ulvyq/it_would_be_nice_if_catdaddy_could_maybe_give_us/
71,2016-07-24 06:36:24+00:00,self.civbattleroyale,https://www.reddit.com/r/civbattleroyale/comments/4uc394/is_there_any_way_to_turn_off_the_top_lists_in_a/,False,"I'm observing but am still considered part of the game and keep getting those ""most literate civs"" or ""most well-fed civs"" lists.",civbattleroyale,"Is there any way to turn off the ""top lists"" in a game?",https://www.reddit.com/r/civbattleroyale/comments/4uc394/is_there_any_way_to_turn_off_the_top_lists_in_a/
72,2016-07-24 05:37:19+00:00,self.thewalkingdead,https://www.reddit.com/r/thewalkingdead/comments/4ubxbt/looking_to_get_into_the_comics_but_dont_want_to/,False,"How far can I read without spoiling anything and should I read the comics first or no?

What do you guys recommend who have done both?

Please no spoilers obviously. ",thewalkingdead,Looking to get into the comics but don't want to spoil the T.V show.,https://www.reddit.com/r/thewalkingdead/comments/4ubxbt/looking_to_get_into_the_comics_but_dont_want_to/
73,2016-07-24 04:31:00+00:00,self.civbattleroyale,https://www.reddit.com/r/civbattleroyale/comments/4ubq97/i_need_help_making_civs_go_to_war_with_each_other/,False,"I have been setting up AI only battles with just 2 Civs, on small maps to try and make them duel somewhat quickly. 

Is it normal to have 1000 turns go by and still not have a winner.

I set the game to quick turns and have tried mods like ""always war"" and expansive AI. 

Any ideas?",civbattleroyale,I need help making CIVs go to war with each other.,https://www.reddit.com/r/civbattleroyale/comments/4ubq97/i_need_help_making_civs_go_to_war_with_each_other/
74,2016-07-19 02:05:31+00:00,i.redd.it,https://www.reddit.com/r/civ/comments/4tir00/i_think_china_is_trying_to_send_a_message/,False,,civ,I think China is trying to send a message...,https://i.redd.it/rsg393i7q3ax.jpg
75,2016-07-15 21:39:50+00:00,self.civ,https://www.reddit.com/r/civ/comments/4t1iai/using_the_ige_and_experience_game_crashes_every/,False,"I have tried playing with 40 civs and have tried playing with 5 (and everywhere in between)

Have also tried large and small maps and makes no differences. 

I have also tried to just unlock satellites in the tech tree but the game crashes after i do so as well.

I'm trying to set up an AI only game if that makes a difference. ",civ,Using the IGE and experience game crashes every time I try and explore map. Any ideas why?,https://www.reddit.com/r/civ/comments/4t1iai/using_the_ige_and_experience_game_crashes_every/
76,2016-07-11 03:00:31+00:00,self.civ,https://www.reddit.com/r/civ/comments/4s8uhy/game_crashes_whenever_i_try_and_load_a_replay_of/,False,"I have all the DLC installed and the game in question was pretty huge. 

Just wondering if there is anything i could do to solve this problem.",civ,Game crashes whenever i try and load a replay of a game. (CIV 5),https://www.reddit.com/r/civ/comments/4s8uhy/game_crashes_whenever_i_try_and_load_a_replay_of/
77,2016-07-07 08:14:53+00:00,self.SquaredCircle,https://www.reddit.com/r/SquaredCircle/comments/4rngu6/is_kenneth_johnson_one_of_the_competitors_in_the/,False,They have the same name and honestly kind of seem similar to me. Anyone got any ideas?,SquaredCircle,"Is Kenneth Johnson (one of the competitors in the Cruiserweight Classic) the son of famous WWF manager ""Slick""?",https://www.reddit.com/r/SquaredCircle/comments/4rngu6/is_kenneth_johnson_one_of_the_competitors_in_the/
78,2016-07-07 07:05:30+00:00,self.evolution,https://www.reddit.com/r/evolution/comments/4rn9o5/explaining_natural_selection_and_the_galapagos/,False,"We know that there are both Dome-Shaped and Saddleback Tortoises on the Galapagos islands due to natural selection and those specific traits being needed in order for the species to survive in their respective environments. 

But more specifically it was a mutation that leads to the differences correct?

My understanding is that the causes of mutations are primarily due to errors taking place during meiosis or DNA replication but what causes said error's to take place?

A creationist would say, even if they DID believe in evolution or any part of it, that said errors were caused by God. 

With that obviously not being the case then what is the correct answer to this question. ",evolution,Explaining natural selection and the Galapagos Tortoises to a creationist. Details inside.,https://www.reddit.com/r/evolution/comments/4rn9o5/explaining_natural_selection_and_the_galapagos/
79,2016-07-01 07:27:14+00:00,self.civ,https://www.reddit.com/r/civ/comments/4qqis2/can_cities_produce_culture_in_civ_5_the_way_they/,False,Just picked up Civ 5 and wasn't sure. ,civ,Can cities produce culture in Civ 5 the way they did in Civ 4?,https://www.reddit.com/r/civ/comments/4qqis2/can_cities_produce_culture_in_civ_5_the_way_they/
80,2016-07-01 01:13:16+00:00,self.njpw,https://www.reddit.com/r/njpw/comments/4qp4hp/is_there_somewhere_that_i_can_go_to_watch_past/,False,I guess if had to narrow it down i'd like to at least watch the finals of many of the tournaments. ,njpw,Is there somewhere that I can go to watch past matches from G1 Tournaments?,https://www.reddit.com/r/njpw/comments/4qp4hp/is_there_somewhere_that_i_can_go_to_watch_past/
81,2016-06-26 07:40:47+00:00,self.brexit,https://www.reddit.com/r/brexit/comments/4pwry2/is_there_any_sort_of_moviedocumentary_out_there/,False,"I've seen Brexit the movie and Lexit the movie, but can't seem to find one for the other cause. ",brexit,Is there any sort of movie/documentary out there that makes the case for remaining in the EU?,https://www.reddit.com/r/brexit/comments/4pwry2/is_there_any_sort_of_moviedocumentary_out_there/
82,2016-06-25 06:46:25+00:00,self.youtube,https://www.reddit.com/r/youtube/comments/4prfar/2_copyright_claims_in_2_days_getting_a_little/,False,"Ok so i have a small YouTube channel and have recently started doing a playthrough of GTA V.

FIRST CLAIM:

I got a copyright claim the other day for showing [this](https://youtu.be/trkdn5H6vG0?t=15m10s) part of the game. 

**This is not my video or channel, my video is currently blocked but this is the exact clip that was shown on my channel (as it's part of the main campaign) with the only difference being that i full screened the T.V for part of the speech.**

The Claimant was Take 2 Interactive which made me curious because i thought they would have been smarter. 

Rockstar's full policy on monetization and posting of copyrighted content can be viewed [here](https://support.rockstargames.com/hc/en-us/articles/200153756-Policy-on-posting-copyrighted-Rockstar-Games-material)

In it, it states

&gt;To make our position on this subject easier to understand, we have put together a list of content that, if posted, would result in a take-down notice:

&gt;&gt;Pre-Release Footage: No pre-release leaked footage of any kind: Any posting of in-game footage from leaked copies of the game prior to its official release date will be taken down, regardless of how the game was obtained. This includes ""early unboxing"" videos.

&gt;&gt;Spoilers: Posting video showing the ending of the game, pure cutscenes or any other big reveal in the story. It's ok to show cutscenes as part of a larger play-through (or in a narrated ‘Let’s Play’ type video) but isolated videos of the game's cinematics will be removed. If you are unsure if what you want to post is considered a spoiler, please contact copyright@take2games.com and describe exactly what scene you are wondering about and in what context the scene would appear.

&gt;&gt;Encouraging Cheating: Videos posted that encourage and promote ways to cheat your way towards gaining illegitimate RP or in-game money or duplicating counterfeit in-game items.

&gt;&gt;**In-game Entertainment: Things like the TV shows and comedy performances in Grand Theft Auto IV, or the silent movies in Red Dead Redemption. We prefer fans to experience these in the context of the game's world, so any posting of these in isolation will be flagged for removal.**

So i think the video got taken down because an automatic system thought the thing on the t.v was like a show or something. I'm not sure, but i do know the claim is false. 

Not sure if i should contact them at the email provided or not.





SECOND CLAIM:

This one seems much simpler and is obviously ridculous. 

You can view the segmant involved [here](https://youtu.be/fGIu6JfIY8Y?t=41s)
 (again not my video or channel)

The audio from this scene is what's in question and the the Claimant is ""TuneCore on behalf of Glo Gang"" With the content being ""Trevor (Interlude) - Lil Flash. 

So i looked up Lil Flash and found [this](https://soundcloud.com/lil-flash-gta-music/lil-flash-trevor-outro) on soundcloud. 

He apparently thinks he owns the content and is trying to put ads on my video. 



So i filed a dispute on the first claim and haven't done anything on the second. What do you guys think? What do you reccomend? Did i miss any needed info? 

Thanks for any help. ",youtube,2 copyright claims in 2 days. Getting a little upset. (GTA V Let's Play),https://www.reddit.com/r/youtube/comments/4prfar/2_copyright_claims_in_2_days_getting_a_little/
83,2016-06-25 02:11:40+00:00,self.wwesupercard,https://www.reddit.com/r/wwesupercard/comments/4pqidl/so_i_think_that_last_little_update_got_rid_of_the/,False,[removed],wwesupercard,So i think that last little update got rid of the ID Changer-- bout thing.,https://www.reddit.com/r/wwesupercard/comments/4pqidl/so_i_think_that_last_little_update_got_rid_of_the/
84,2016-06-23 06:10:06+00:00,self.youtube,https://www.reddit.com/r/youtube/comments/4pfabk/having_trouble_with_tube_buddy_anyone_that_uses/,False,"I see the Tube Buddy icon at the top of my youtube screen to the left of the ""upload"" button. It's red and has an error sign next to it. 

When i click the button it brings me to http://status.tubebuddy.com/

Which tells me nothing is wrong. The extension is showing up under any video i see and i can't access any features.

Anyone know what to do?

I have uninstalled and reinstalled. I have logged out of my youtube (google) account and back in and still nothing. ",youtube,Having trouble with Tube Buddy. Anyone that uses the program i seek your help.,https://www.reddit.com/r/youtube/comments/4pfabk/having_trouble_with_tube_buddy_anyone_that_uses/
85,2016-06-20 02:42:12+00:00,self.applehelp,https://www.reddit.com/r/applehelp/comments/4owjb5/im_on_windows_7_and_need_help_installing_drivers/,False,"When i try and update the driver under ""device manager"" it says there are no driver to be found. 

I've gone to program files -&gt; common files -&gt; apple -&gt; mobile device support -&gt; drivers and only found a .dll file for an IPOD not and Ipad. 

I'm trying to restore the IPAD through Recovery mode and the device won't install drivers when i connect it to my laptop in recovery mode.

Itunes also will not recognize it however my laptop does.
Any ideas?",applehelp,I'm on windows 7 and need help installing drivers (recovery mode) for my ipad.,https://www.reddit.com/r/applehelp/comments/4owjb5/im_on_windows_7_and_need_help_installing_drivers/
86,2016-06-18 20:30:38+00:00,self.wwesupercard,https://www.reddit.com/r/wwesupercard/comments/4oq61p/beware_the_select_all_button_guys/,False,"Just got the WM Sheamus and IMMEDIATELY hit the select all to train a SV Pro and lost him. 

I should have checked but i wouldn't have thought a WM card would be selected when you hit that button. They might wanna change that.

Luckily Sheamus isn't one of the best WM cards but i mean it still kinda sucks.",wwesupercard,"Beware the ""select all"" button guys.",https://www.reddit.com/r/wwesupercard/comments/4oq61p/beware_the_select_all_button_guys/
87,2016-06-01 04:56:18+00:00,self.wwesupercard,https://www.reddit.com/r/wwesupercard/comments/4lzl6k/not_sure_if_this_has_been_addressed_but_is_there/,False,,wwesupercard,Not sure if this has been addressed but is there any way Catdaddy could give us access to all the season 1 cards pictures?,https://www.reddit.com/r/wwesupercard/comments/4lzl6k/not_sure_if_this_has_been_addressed_but_is_there/
88,2016-06-01 02:12:06+00:00,self.2007scape,https://www.reddit.com/r/2007scape/comments/4lyxup/is_there_any_way_to_view_what_quests_your_friends/,False,Trying to catch up to a buddy of mine so we can quest together. ,2007scape,Is there any way to view what quests your friends have completed in OS?,https://www.reddit.com/r/2007scape/comments/4lyxup/is_there_any_way_to_view_what_quests_your_friends/
89,2016-05-31 01:25:08+00:00,self.VPN,https://www.reddit.com/r/VPN/comments/4lsqc9/currently_cant_afford_any_extra_costs_is_there/,False,[removed],VPN,Currently can't afford any extra costs. Is there any VPN that would be better than nothing and is in some way free?,https://www.reddit.com/r/VPN/comments/4lsqc9/currently_cant_afford_any_extra_costs_is_there/
90,2016-05-19 22:07:52+00:00,self.GMail,https://www.reddit.com/r/GMail/comments/4k50pq/how_do_i_a_connect_my_google_account_with_a_gmail/,False,when i try and go to my gmail it just asked me to make a new gmail account to log in with my google account. ,GMail,How do i a connect my google account with a gmail account if hotmail is already connected?,https://www.reddit.com/r/GMail/comments/4k50pq/how_do_i_a_connect_my_google_account_with_a_gmail/
91,2016-05-19 21:54:15+00:00,self.AskReddit,https://www.reddit.com/r/AskReddit/comments/4k4yd5/how_do_i_connect_a_google_account_with_a_gmail/,False,[removed],AskReddit,How do I connect a google account with a gmail account if hotmail is already connected?,https://www.reddit.com/r/AskReddit/comments/4k4yd5/how_do_i_connect_a_google_account_with_a_gmail/
92,2016-05-19 21:24:08+00:00,self.google,https://www.reddit.com/r/google/comments/4k4t64/where_can_i_go_on_reddit_to_get_help_with_gmail/,False,The sidebar says not to ask here but i don't see any other subreddit listed for this kind of stuff.,google,Where can i go on reddit to get help with Gmail and Google account problems?,https://www.reddit.com/r/google/comments/4k4t64/where_can_i_go_on_reddit_to_get_help_with_gmail/
93,2016-05-14 20:07:43+00:00,self.PS4,https://www.reddit.com/r/PS4/comments/4jcwyy/just_updated_uncharted_4_v_103_and_needed_to/,False,"I had 10 GB free and the update was 75Mb.

It wouldn't let me update until i had 16GB or so free. 

What gives?",PS4,Just Updated Uncharted 4 (V 1.03) and needed to clear a ridiculous amount of space on my system.,https://www.reddit.com/r/PS4/comments/4jcwyy/just_updated_uncharted_4_v_103_and_needed_to/
94,2016-05-05 02:45:28+00:00,self.SquaredCircle,https://www.reddit.com/r/SquaredCircle/comments/4hy1p0/any_word_on_whenif_hideo_itami_is_coming_back/,False,Just curious.,SquaredCircle,Any word on when/if Hideo Itami is coming back?,https://www.reddit.com/r/SquaredCircle/comments/4hy1p0/any_word_on_whenif_hideo_itami_is_coming_back/
95,2016-05-02 06:31:44+00:00,self.EASportsUFC,https://www.reddit.com/r/EASportsUFC/comments/4heynt/can_you_set_up_fights_between_fighters_in/,False,I'm thinking about getting the game and was just wondering. ,EASportsUFC,Can you set up fights between fighters in different weight classes?,https://www.reddit.com/r/EASportsUFC/comments/4heynt/can_you_set_up_fights_between_fighters_in/
96,2016-05-01 07:11:27+00:00,self.wwesupercard,https://www.reddit.com/r/wwesupercard/comments/4h85kc/not_able_to_see_the_team_event/,False,[removed],wwesupercard,Not able to see the team event.,https://www.reddit.com/r/wwesupercard/comments/4h85kc/not_able_to_see_the_team_event/
97,2016-04-22 00:46:10+00:00,youtube.com,https://www.reddit.com/r/tobuscus/comments/4fw39n/olga_kay_mentions_she_is_not_going_to_talk_about/,False,,tobuscus,"Olga Kay mentions she is not going to talk about any of the recent ""YouTube Drama"" on her channel.",https://www.youtube.com/watch?v=Df_KdsxNU00&amp;ab_channel=OlgaKay
98,2016-04-21 20:32:11+00:00,self.EASPORTSUFC2,https://www.reddit.com/r/EASPORTSUFC2/comments/4fuz23/is_there_a_way_to_set_up_a_com_vs_com_fight/,True,Was thinking about picking up the game but this is something I like doing a lot.,EASPORTSUFC2,Is there a way to set up a Com vs Com fight?,https://www.reddit.com/r/EASPORTSUFC2/comments/4fuz23/is_there_a_way_to_set_up_a_com_vs_com_fight/
99,2016-04-19 01:10:30+00:00,self.wwesupercard,https://www.reddit.com/r/wwesupercard/comments/4ff54q/can_someone_explain_to_me_why_the_card_limit_cant/,False,"There's gotta be a reason that i'm not seeing. 

I've been stuck at 140/150 after training away all rares and below and it sucks. 

I could delete a bunch of cards, but it's such a waste. ",wwesupercard,Can someone explain to me why the card limit can't be raised?,https://www.reddit.com/r/wwesupercard/comments/4ff54q/can_someone_explain_to_me_why_the_card_limit_cant/
100,2016-04-14 01:20:31+00:00,self.wwesupercard,https://www.reddit.com/r/wwesupercard/comments/4eosn7/so_it_looks_like_other_people_are_able_to_play/,False,"Yes i updated. I'm on Android and have tried on both accounts i have. 

I keep getting error 4-404 but can see Zayn and Owens on the home screen. 

Any ideas?",wwesupercard,So it looks like other people are able to play the game. I keep getting an error...,https://www.reddit.com/r/wwesupercard/comments/4eosn7/so_it_looks_like_other_people_are_able_to_play/
101,2016-04-06 04:33:38+00:00,self.wwesupercard,https://www.reddit.com/r/wwesupercard/comments/4dk9r7/a_feature_i_would_really_like_to_see/,False,[removed],wwesupercard,A feature I would REALLY like to see.,https://www.reddit.com/r/wwesupercard/comments/4dk9r7/a_feature_i_would_really_like_to_see/
102,2016-04-06 00:58:33+00:00,self.SquaredCircle,https://www.reddit.com/r/SquaredCircle/comments/4djhg8/my_unpopular_opinion_on_roman_reigns/,False,"So let me preface this by saying I get why people don't like him just like I get why people don't like John Cena. I don't agree with those reasons (at least not completely) but I do understand them.

Now I've been a fan of Reigns since the shield debuted on the main roster. I was also a fan of Ambrose and to a slightly lesser extent Rollins. (I know another unpopular opinion)

Ever since Rollins broke off from the group I was tired of HIM and the whole Authority gimmick that made Kane look EVEN worse and kind of stagnated Orton's career for a while. 

Now onto Reigns. I like his in ring style a lot. Just as I like Rollins and Ambrose in the ring. (all for different reasons of course) I thought they all deserved to be in the main event picture but Reigns just seemed like a good choice for World Champion to me. I think a lot of people would have agreed with me if it wasn't for Daniel Bryan being so popular. (Someone I have always liked but never jumped on the hype train for, at least not until he won the I.C title.)

So I think people began to hate Reigns because he wasn't the face that the fans wanted to see win. I get that because I've had to sit and watch MANY superstars get pushed who I absolutely couldn't stand (E.G Del Rio) but I also figured it was for a reason. It was to tell a story and to entertain the fans in one way or another. 

So now we go onto WM 31. Reigns challenges Lesnar for the world title and everyone is pissed because it's not Bryan. I was ecstatic because it was a really good matchup. To powerful guys, that fight in real high energy matches. I would have been content if Lesnar beat him and retained and I would have been pretty siked if Reigns had overcome and won the World Title. All I wanted was an all out war and we ended up getting that for the most part. 

Now the part that everyone else seemed to love was also the worst moment of the Mania for me and honestly ruined the main event from what I was hoping it would be. Instead of the match ending with there being a clear winner and, therefore, champion, Rollins comes down and interferes in the match. If that wasn't bad enough he then steals the win and the Championship. I get that it was exciting for people to see because it was a Money in the Bank cash in, but I would have MUCH preferred it happen the next night to a beat up and bruised champion regardless of who it was. 

So Rollins goes on to be champion for over 200 days as I constantly hoped he would Kayfabe get injured and drop the belt. (turns out he actually ended up getting hurt and I kind of felt bad, but not really)

So my big problem at this point is that Reigns and Lesnar didn't get to finish their amazing match a Mania and never got a rematch either. 

Now move onto this past year's Royal Rumble where everyone wanted ANYONE but Reigns to win. Again I had no problem with him winning if did, I figured he would be in the main event at WM again the problem I had was that it was against HHH. I would have preferred Ambrose or Styles (which it looks like we will get to see now) or someone else. Anyway, I think it's a popular opinion that the match at Mania this past weekend was nothing special. I know am left feeling bored of Reigns and although I don't hate him like most people seem to I certainly am getting tired of seeing the same stuff. 

I think a heel turn is imminent and hopefully, Styles actually ends up winning the title. 

O.K now you guys can tell me how great Bryan, Rollins and Del Rio are and why Reigns and Cena suck. I'm all ears haha. 
",SquaredCircle,My unpopular opinion on Roman Reigns,https://www.reddit.com/r/SquaredCircle/comments/4djhg8/my_unpopular_opinion_on_roman_reigns/
103,2016-04-05 00:38:04+00:00,change.org,https://www.reddit.com/r/SandersForPresident/comments/4de1dx/dnc_debate_on_the_young_turks_getting_the_real/,False,,SandersForPresident,DNC Debate on The Young Turks. Getting the real questions asked.,https://www.change.org/p/the-young-turks-dnc-debate-on-the-young-turks?recruiter=12487981&amp;utm_source=share_petition&amp;utm_medium=copylink
104,2016-04-04 22:39:29+00:00,self.youtube,https://www.reddit.com/r/youtube/comments/4ddjp6/looking_for_a_free_easy_to_use_video_introoutro/,False,"I've been using [Bitable](https://app.biteable.com/video/209019/scene/1/edit) but there are limited animations and a terrible watermark that cannot be taken off. 

If anyone has any suggestions they would be greatly appreciated. ",youtube,"Looking for a free, easy to use, video intro/outro maker.",https://www.reddit.com/r/youtube/comments/4ddjp6/looking_for_a_free_easy_to_use_video_introoutro/
105,2016-04-04 05:54:26+00:00,self.SquaredCircle,https://www.reddit.com/r/SquaredCircle/comments/4d9tea/anyone_know_where_i_can_watch_early_nxt_stuff/,False,"The Network only goes back to 2014 when I believe Bo Dallas was NXT champ. 

Anyone know where i can watch NXT from the beginning?",SquaredCircle,Anyone know where I can watch early NXT stuff?,https://www.reddit.com/r/SquaredCircle/comments/4d9tea/anyone_know_where_i_can_watch_early_nxt_stuff/
106,2016-04-02 17:54:02+00:00,self.wwesupercard,https://www.reddit.com/r/wwesupercard/comments/4d2ig5/can_you_buy_a_supertoken_and_scan_it_twice_for_a/,False,Also how many uses to they usually have. 4?,wwesupercard,Can you buy a supertoken and scan it twice for a pro?,https://www.reddit.com/r/wwesupercard/comments/4d2ig5/can_you_buy_a_supertoken_and_scan_it_twice_for_a/
107,2016-03-29 21:02:42+00:00,self.AndroidQuestions,https://www.reddit.com/r/AndroidQuestions/comments/4chi9o/error_recording_mobile_gameplay/,False,"I just starting using the Play Games new recording feature and every time I get about a minute or less into the recording I get the message ""Recording failed: unknown encoder error"" and the recording not only stops but fails to save. 

I really could use a fix for this if anyone can help.",AndroidQuestions,Error Recording mobile gameplay.,https://www.reddit.com/r/AndroidQuestions/comments/4chi9o/error_recording_mobile_gameplay/
108,2016-03-29 02:36:15+00:00,self.SquaredCircle,https://www.reddit.com/r/SquaredCircle/comments/4cdjmb/so_what_are_the_wyattsbray_doing_for_mania/,False,I know Harper is injured but seems weird Bray at least isn't involved with anything.,SquaredCircle,So what are the Wyatt's/Bray doing for Mania?,https://www.reddit.com/r/SquaredCircle/comments/4cdjmb/so_what_are_the_wyattsbray_doing_for_mania/
109,2016-03-29 00:28:10+00:00,self.SquaredCircle,https://www.reddit.com/r/SquaredCircle/comments/4cd1dn/who_is_the_guy_in_the_yellow_shirt_and_hat_in_the/,False,I see him at EVERY event. Not sure if this has been talked about here before or not.,SquaredCircle,Who is the guy in the yellow shirt and hat in the front row at every WWE event?,https://www.reddit.com/r/SquaredCircle/comments/4cd1dn/who_is_the_guy_in_the_yellow_shirt_and_hat_in_the/
