,body,created,id,nest_level,parent_id,reply_delay,subreddit
1608,"&gt; The images also shouldn't be linked to the page that you are already on

Yeah that happened automatically, I'll have to look into it.",2016-02-06 04:21:41+00:00,czponq6,2.0,t1_czpoh43,369.0,Entrepreneur
1609,"Correct decision.  They took a chance when recruiting from Essendon, they knew the goods could well be tarnished.  ",2016-02-06 04:17:15+00:00,czpoizt,1.0,t3_449m53,78972.0,AFL
1610,Enhance!,2016-02-06 04:13:37+00:00,czpof1o,1.0,t3_449nb1,78113.0,australia
1611,I'm sure those million or so would have been handy fighting the Nazis,2016-02-06 04:11:01+00:00,czpoccz,1.0,t3_44clic,29008.0,history
1612,Falling Skies,2016-02-06 04:06:25+00:00,czpo7lt,1.0,t3_44bvpo,37615.0,AskReddit
1613,92 is not that many,2016-02-03 23:11:04+00:00,czmvsnl,1.0,t3_440aqa,27425.0,dataisbeautiful
1614,"Note:  ""pants"" in the UK means underwear",2016-02-03 23:09:16+00:00,czmvq20,1.0,t3_440sac,21173.0,StarWars
1615,"""Bounty Hunters! We don't need their pants""",2016-02-03 23:08:37+00:00,czmvp4o,1.0,t3_440sac,21134.0,StarWars
1616,"Not necessarily, Kepler has found some smaller than Earth so they do show up in the sample ",2016-02-03 20:29:14+00:00,czmokoh,3.0,t1_czmaahr,19811.0,worldbuilding
1617,"Here are some of mine:    
They came down in the night; a huge bulbous craft that tapered at the top, like a flaming teardrop trickling it’s way down from the dark sky. *-The Blue Shard of Night*   
It was time to kill evil. *-Crows in the Rain*    
The party was bound to be a good one, that was apparent right from the start when Dale caught a glimpse of Helen's sister. *-Human Collision*    
Just to make things more interesting for the naked man, rain started falling. *-Ironbound*
",2016-02-03 11:35:12+00:00,czm5899,1.0,t3_43vdal,63588.0,writing
1618,Hence...the Fermi Paradox.  Most Earth-like planets are super-Earths (2-3 times bigger),2016-02-03 11:16:25+00:00,czm4xss,1.0,t3_43y295,26667.0,worldbuilding
1619,I like that it's fantasy yet you're thinking of multiple planets...that sounds interesting,2016-02-03 11:12:50+00:00,czm4vw3,1.0,t3_43yrtv,13952.0,writing
1620,"We don't get a gazillion hits, the ads pay for hosting only, and the original post states quite clearly there is no payment.",2016-02-02 21:15:18+00:00,czlgf84,2.0,t1_czkvl6d,35656.0,writing
1621,Email info@sf-books.com,2016-02-02 19:26:37+00:00,czlbi41,2.0,t1_czkykt3,19965.0,writing
1622,"Sorry to anyone that I have been slow responding to...I've been overwhelmed with responses so I apologize if anyone fell through the cracks. If you haven't done so already, please send your work to info@sf-books.com. If you emailed already then it will be appearing on the site shortly. Thanks!!!!",2016-02-02 09:02:26+00:00,czktplq,1.0,t3_4383ne,344827.0,scifiwriting
1623,"Sorry to anyone that I have been slow responding to...I've been overwhelmed with responses so I apologize if anyone fell through the cracks.  If you haven't done so already, please send your work to info@sf-books.com.  If you emailed already then it will be appearing on the site shortly.  Thanks!!!!",2016-02-02 08:43:35+00:00,czktfhe,1.0,t3_436kki,370920.0,scifi
1624,I'll consider it!,2016-02-01 23:21:09+00:00,czkawm3,2.0,t1_czkam5k,457.0,scifi
1625,"awesome, this is the sort of thing i was looking for",2016-02-01 23:18:20+00:00,czkaspp,2.0,t1_czk8g3i,3557.0,AskReddit
1626,really?,2016-02-01 22:12:13+00:00,czk85zu,2.0,t1_czk7vd7,434.0,AskReddit
1627,god that was awful,2016-02-01 12:28:07+00:00,czjmcfy,1.0,t3_43m5xw,38732.0,AFL
1628,"I've heard many Americans pronounce solder as ""sodder""",2016-01-31 23:32:32+00:00,czj32oi,1.0,t3_43iwdb,39727.0,AskReddit
1629,I thought this was going to be about someone owning google.com before google existed...   It wasn't that long since Surface.com was owned by a powder coating company,2016-01-31 23:30:40+00:00,czj30a4,1.0,t3_43j5sd,33932.0,technology
1630,"Cool!  I read the first chapter of The Asymptote's Tail ... I love the post-scarcity theme.  It would be awesome if I could put something of yours on sf-books.com...maybe something similar to your author bio on amazon, an overview of your work",2016-01-29 16:31:37+00:00,czgil1x,2.0,t1_czggkds,2884.0,scifi
1631,"Hi Mikey!  I checked out you stuff and it looks awesome, I'll pm you
",2016-01-29 16:13:30+00:00,czghsvu,2.0,t1_czgbif3,11475.0,scifi
1632,"you can send stuff to info @ sf-books.com    
Thanks!",2016-01-29 15:35:23+00:00,czgg8wq,2.0,t1_czg95vv,17022.0,scifiwriting
1633,Awesome! looking forward to it,2016-01-29 10:24:37+00:00,czg8rn0,4.0,t1_czg8l74,744.0,scifiwriting
1634," Basically looking for anything related to written science fiction, so articles, reviews or stories    
www.sf-books.com",2016-01-29 09:57:54+00:00,czg8dj1,2.0,t1_czg89kw,451.0,scifiwriting
1635,Ah thanks,2016-01-29 08:17:16+00:00,czg6sj4,2.0,t1_czg5wyo,2942.0,scifi
1636,Doesn't explain why he's fully clothed,2016-01-29 05:09:11+00:00,czg2lpu,1.0,t3_435hlo,27205.0,pics
1637,well that was a shitty waste of time,2016-01-29 03:22:00+00:00,czfz5ch,1.0,t3_435krq,19657.0,StarWars
1638,http://sf-books.com,2016-01-29 03:13:04+00:00,czfytsq,2.0,t1_czfxxrs,1525.0,scifi
1639,sorry you're right it was a tv show  https://en.wikipedia.org/wiki/The_Ghost_Busters,2016-01-26 21:13:47+00:00,czd0k41,6.0,t1_czcyvjl,2182.0,AskReddit
1640,are you sure they watched it?,2016-01-26 20:05:51+00:00,czcxgab,5.0,t1_czcjyoj,18863.0,movies
1641,Nah there was a B&amp;W movie as well,2016-01-26 20:02:31+00:00,czcxayx,4.0,t1_czcnn2p,13002.0,AskReddit
1642,"While we're at it, Cracked is a rip off of Mad",2016-01-26 14:19:16+00:00,czciw2a,2.0,t1_czcblbv,23302.0,AskReddit
1643,Not to mention the earlier film called Ghostbusters,2016-01-26 14:16:45+00:00,czcit7h,2.0,t1_czc494f,38253.0,AskReddit
1644,We Are The World,2016-01-26 14:12:24+00:00,czcioc7,1.0,t3_42p1k3,45814.0,AskReddit
1645,This is starting to look like The Expendables,2016-01-26 04:58:53+00:00,czc76kk,1.0,t3_42opgt,16922.0,AFL
1646,"I read that as ""inappropriate examples""",2016-01-26 04:57:04+00:00,czc74gg,1.0,t3_42n6ps,34209.0,learnprogramming
1647,"It's not cheating, but it's not reading either. It's a whole other format.  The same as seeing a movie is not the same as seeing a play.",2016-01-26 00:34:11+00:00,czbwssz,1.0,t3_42k19o,65784.0,books
1648,Thread saved ,2016-01-25 22:02:43+00:00,czbqryb,1.0,t3_42lsih,24845.0,gamedev
1649,"Front door blows into a million splinters, let's just fix that shit and go back to bed ",2016-01-25 07:26:27+00:00,czb0loj,4.0,t1_czau6t4,13746.0,AskReddit
1650,James Hird should read it,2016-01-25 07:06:40+00:00,czb07t7,2.0,t1_czaw25u,9517.0,AFL
1651,Here's why- because they catch drug cheats.  Clearly the AFL doesn't want this,2016-01-23 22:02:54+00:00,cz9cosn,1.0,t3_429v5q,53737.0,AFL
1652,Domesticated animals killing wildlife is not nature,2016-01-23 21:17:22+00:00,cz9b3y8,3.0,t1_cz8w2z2,28587.0,pics
1653,You reckon it will be completed in 2020?,2016-01-23 10:59:03+00:00,cz8u2cb,2.0,t1_cz8t382,4448.0,australia
1654,Yep I live in a similar salient.  It's maddening.,2016-01-23 10:53:07+00:00,cz8tzoo,1.0,t3_429vs2,13182.0,australia
1655,"&gt; Okay, look up games he scored a touch down. Fast forward to them.

How would you know where in the game he scored a touchdown?  Or laid a tackle, or caught a pass?",2016-01-23 10:45:34+00:00,cz8tw35,2.0,t1_cz8tqs2,682.0,explainlikeimfive
1656,if it were injured...,2016-01-23 10:12:00+00:00,cz8tgio,3.0,t1_cz8tg8h,34.0,pics
1657,I sell soap too and I gotta tell you packaging is by far the hardest part.  In the end I just went with shrink wrap and a sticker label,2016-01-23 08:46:02+00:00,cz8s99x,1.0,t3_427m16,41579.0,Entrepreneur
1658,Looks like it's killing wildlife,2016-01-23 08:42:13+00:00,cz8s765,1.0,t3_428693,33956.0,pics
1659,Did I stutter?,2016-01-22 03:14:55+00:00,cz7cuw7,2.0,t1_cz79fsg,5680.0,australia
1660,"Yes absolutely, as I said elsewhere it's a service like public transport. It exits to serve the Australian taxpayer",2016-01-22 01:05:24+00:00,cz7854f,6.0,t1_cz770ta,1777.0,australia
1661,??? Business mail is still paid for,2016-01-22 00:32:57+00:00,cz76wxw,4.0,t1_cz76kvl,529.0,australia
1662,Packages provide revenue,2016-01-22 00:31:56+00:00,cz76viu,4.0,t1_cz76nfa,356.0,australia
1663,"I think you are defining letters as grandmothers writing to each other, whereas I am defining letters as anything delivered by the postie.  And yes, it has fucking increased.",2016-01-21 23:40:41+00:00,cz74yg1,8.0,t1_cz74j7b,693.0,australia
1664,"12.6 million letters per day
http://auspost.com.au/about-us/fast-facts-about-australia-post.html",2016-01-21 23:33:04+00:00,cz74oe1,2.0,t1_cz749px,651.0,australia
1665,That excuse doesn't cut it due to population increases.  I guess you'll be learning that in year 9.,2016-01-21 23:24:07+00:00,cz74cbj,6.0,t1_cz73vn4,739.0,australia
1666,Dude you're not suppose to use cold water,2016-01-21 23:17:03+00:00,cz742ne,1.0,t3_41xob1,76590.0,pics
1667,It's a bit of a worry that the doorway opens directly to the outside without any baffles or a dogleg,2016-01-21 23:10:28+00:00,cz73tu7,1.0,t3_41z7mj,49143.0,australia
1668,"If it's making massive losses then that's simply due to mismanagement.   Fuel is cheaper than it has been for ages, and automation cuts way into wage expenditure.  If it's losing money it's not because stamps are too cheap.  AP managed just fine for over 100 years and suddenly it unprofitable?  Please.",2016-01-21 22:59:23+00:00,cz73eyg,4.0,t1_cz735en,413.0,australia
1669,"It's a public service, it shouldn't be striving for profits",2016-01-21 22:38:58+00:00,cz72m7i,2.0,t1_cz71wpq,1060.0,australia
1670,More commonly known as a fairy penguin,2016-01-21 09:47:10+00:00,cz6cbc8,,t1_cz2b4qs,,pics
1671,Did you get craft services?,2016-01-21 09:38:56+00:00,cz6c6sm,3.0,t1_cz5wrab,32472.0,movies
1672,If you can't tell the difference between race and religion there is no point,2016-01-21 09:18:50+00:00,cz6bvs6,7.0,t1_cz6bup7,120.0,australia
1673,So it would be racist to oppose Scientology?,2016-01-21 08:47:13+00:00,cz6bdxg,5.0,t1_cz6b3b0,1097.0,australia
1674,"&gt; Why do some people think criticism of Islam is racism?

Because some people are idiots

",2016-01-21 08:43:22+00:00,cz6bboq,4.0,t1_cz5pooa,39536.0,australia
1675,"&gt; arguing against Islam itself - and that would be defined as a hate group.

Nope, still not a hate group.  Unless having an opinion on ideology is hateful",2016-01-21 08:31:43+00:00,cz6b4v3,5.0,t1_cz5oerp,40517.0,australia
1676,"&gt; Currently, there aren't millions of Scientologists fleeing war zones with such of their children as remain intact, so it is a bit different in that regard.

What does this have to do with food packaging?",2016-01-21 08:14:57+00:00,cz6avxg,3.0,t1_cz66g5p,11385.0,australia
1677,"The religious aspects, yes.  The gift giving, eating, drinking, and general good will to all men- not so much",2016-01-21 02:25:10+00:00,cz60tjo,5.0,t1_cz5v7pv,8795.0,australia
1678,wouldn't it be cool if it had moons heated by tidal flexing?  Yet another place to look for life,2016-01-20 21:22:23+00:00,cz5ook4,1.0,t3_41up8u,22712.0,science
1679,I guess it would be ok if companies started adding Scientology endorsements to foods. It's Xenu approved!,2016-01-20 20:59:55+00:00,cz5nnz1,1.0,t3_41ti0w,44543.0,australia
1680,Ah ok. My point is it's a homage,2016-01-20 20:55:14+00:00,cz5ng6i,3.0,t1_cz5eddp,12174.0,bttf
1681,"What do you mean "" doesn't affect you""? The steady creep of religious mumbo jumbo into the secular sphere affects all of us",2016-01-20 20:53:34+00:00,cz5ndfh,3.0,t1_cz55dua,26727.0,australia
1682,"&gt; These dolts don't even realise that God and Allah are the same thing!

LOL this is like saying the Norse god Thor is the same thing as Marvel Comic's Thor.  ",2016-01-20 12:28:46+00:00,cz542w9,3.0,t1_cz53bh4,2532.0,australia
1683,what's this about a tax?,2016-01-20 12:14:56+00:00,cz53tdv,2.0,t1_cz53jma,895.0,australia
1684,How is anti-halal a hate group?,2016-01-20 12:11:27+00:00,cz53r09,1.0,t3_41ti0w,12835.0,australia
1685,I never finished watching Firefly...I think I made it through about 4 episodes,2016-01-20 12:03:05+00:00,cz53lj3,1.0,t3_41rzbo,37591.0,AskReddit
1686,The number of French Civilians who died on D-Day,2016-01-20 11:59:51+00:00,cz53jii,1.0,t3_41pkif,68084.0,AskReddit
1687,That's a lot of gold,2016-01-20 04:45:01+00:00,cz4v5d6,1.0,t3_41rn7j,15942.0,pics
1688,Ben Kingsley???,2016-01-20 04:25:01+00:00,cz4uiae,2.0,t1_cz3wl1c,52372.0,movies
1689,"Surely the Oscar goes to the best actor, despite skin colour.  Should we start having quota of black actors?  How about Asians?  Sheeesh",2016-01-20 04:13:51+00:00,cz4u4p7,1.0,t3_41mgua,92612.0,movies
1690,they are monotremes,2016-01-20 03:25:16+00:00,cz4sftj,4.0,t1_cz4qx2y,2483.0,AskReddit
1691,Platypuses aren't mammals,2016-01-20 02:20:42+00:00,cz4q23b,2.0,t1_cz4e5tl,17901.0,AskReddit
1692,"Awesome show, I'm mid way through season 2.  But why are there so many Australians in it?",2016-01-19 22:45:28+00:00,cz4hqqo,1.0,t3_41pp6f,18867.0,scifi
1693,I want him to interview Hatty Hattington,2016-01-19 22:33:03+00:00,cz4h7w3,1.0,t3_41pidw,20374.0,Showerthoughts
1694,What are RUDs?,2016-01-19 19:53:09+00:00,cz4a9hs,1.0,t3_41mvai,56443.0,spacex
1695,Cloke?,2016-01-19 06:51:44+00:00,cz3p2my,3.0,t1_cz3o45p,2504.0,AFL
1696,"He'll fit right in
EDIT the downvotes tell me he won't fit right in ",2016-01-19 06:50:48+00:00,cz3p1ya,1.0,t3_41n627,4574.0,AFL
1697,boom!,2016-01-19 06:14:05+00:00,cz3o7ob,1.0,t3_41n21m,4276.0,dadjokes
1698,"I recently read Matthew Reilly's Great Zoo of China, where China discovered dragons and built a zoo around them.   Seriously if this is fair dinkum and they exist, Tassie could make their own billion dollar industry out of them ( minus the carnage..) 
And they're worried about their stupid forestry industry.... They seriously need to pull their heads out, this could be the biggest thing in the world if true",2016-01-19 05:09:15+00:00,cz3mi8u,1.0,t3_41lazj,25471.0,australia
1699,"Have not seen it, might have to watch it now",2016-01-19 00:52:12+00:00,cz3dilp,1.0,t3_41ko0a,17666.0,movies
1700,He was 70.  Lemmy always went one better,2016-01-19 00:41:11+00:00,cz3d4nj,3.0,t1_cz3cw92,397.0,pics
1701,"no, a news site",2016-01-19 00:14:27+00:00,cz3c6y3,2.0,t1_cz3c4rg,106.0,pics
1702,"wow, maybe they were field testing in 1989",2016-01-18 23:25:41+00:00,cz3afn4,7.0,t1_cz3abm3,178.0,australia
1703,"Absolutely, why?",2016-01-18 23:15:19+00:00,cz3a1n8,5.0,t1_cz39rz3,418.0,australia
1704,So nothing would happen apart from some ideological hand-wringing,2016-01-18 23:13:50+00:00,cz39zkt,2.0,t1_cz2nl3x,35962.0,explainlikeimfive
1705,Who is this girl Clementine? She sounds wonderful,2016-01-18 23:05:38+00:00,cz39oal,1.0,t3_41jl8i,24634.0,explainlikeimfive
1706,Yes they were.  I was at trade school (Melbourne) and they were in the canteen,2016-01-18 22:57:33+00:00,cz39d4c,3.0,t1_cz399rl,139.0,australia
1707,So how much oil is a 'barrel' then?,2016-01-18 22:27:08+00:00,cz385aw,3.0,t1_cz2zjue,12266.0,worldnews
1708,Why is oil still measured in barrels?,2016-01-18 22:26:20+00:00,cz3845l,1.0,t3_41jvtn,18499.0,worldnews
1709,I still remember the first time I saw these way back in 1989.  Genius.,2016-01-18 22:12:15+00:00,cz37jox,1.0,t3_41isdp,34191.0,australia
1710,???????? the mind boggles,2016-01-18 22:10:52+00:00,cz37hod,3.0,t1_cz2tfc5,20308.0,australia
1711,Is it 100 per MCT or 50 each (total of 100)?,2016-01-18 20:50:41+00:00,cz342vx,4.0,t1_cz30kn2,5015.0,spacex
1712,So it's basically a submarine in space,2016-01-18 20:44:53+00:00,cz33tyk,1.0,t3_41j6t0,21907.0,spacex
1713,"Tabby and Barnard should get together, they have a star each!",2016-01-18 20:03:28+00:00,cz32338,1.0,t3_41jgo3,15470.0,scifi
1714,"Or the great nanobot revolt of 20947 when the panel builders turned on their masters and started destroying what they created, only to be replaced with new versions that built twice as fast",2016-01-18 20:00:11+00:00,cz31y7r,2.0,t1_cz2uahc,11136.0,scifi
1715,Sounds like the narrator from Battleblock Theatre ... That guy cracks me up,2016-01-18 09:34:11+00:00,cz2k6ud,4.0,t1_cz2jept,2892.0,space
1716,Doesn't it have hydraulic pressure holding the deployed legs in place?,2016-01-18 06:09:35+00:00,cz2g42n,4.0,t1_cz2c4k6,7865.0,spacex
1717,Agreed!  I wonder if six or eight legs might be an option?,2016-01-18 06:07:16+00:00,cz2g1zy,2.0,t1_cz2aco8,10629.0,spacex
1718,I really want to see somebody moonwalk on that,2016-01-17 23:01:14+00:00,cz20zi0,1.0,t3_41dwbt,28012.0,Futurology
1719,he has a point,2016-01-17 14:12:40+00:00,cz1i331,1.0,t3_41csli,18791.0,AFL
1720,because of the injections,2016-01-17 14:10:40+00:00,cz1i1o5,2.0,t1_cz1duqk,16945.0,AFL
1721,"&gt; So seemingly half or more of the 34 players correctly left the ""what medications and supplements are you taking"" 

It doesn't mean what injections did you have today, it means what are you taking this season",2016-01-17 14:08:23+00:00,cz1i01z,5.0,t1_cz1g8pl,6328.0,AFL
1722,"I laughed at the part where he says they got a phone call saying the club was under investigations for drugs, and Hird was shocked and confused about what could they possibly be referring to.   Er...do you think those hundreds of injections you've been giving to players might have something to do with it James?  Hmmmm?    
Does he not understand how stupid he sounds?",2016-01-17 13:56:50+00:00,cz1hs1c,1.0,t3_41cs0c,18268.0,AFL
1723,Lol Twisted Sister,2016-01-17 08:44:15+00:00,cz1d73m,2.0,t1_cz16dq7,16512.0,Screenwriting
1724,"Oh wow, I never thought of that. Makes sense either way ",2016-01-17 08:36:18+00:00,cz1d2lk,2.0,t1_cz18hq0,12535.0,spacex
1725,"I guess you could, but then you'd have to pay for it",2016-01-17 04:00:37+00:00,cz162oi,3.0,t1_cz15uf1,394.0,Futurology
1726,Think how much you'll save on parking as well,2016-01-17 00:28:35+00:00,cz0ygkh,2.0,t1_cz0onlf,16028.0,Futurology
1727,Parking garages are going to be obsolete soon... Just send your car home then call it to pick you up again,2016-01-17 00:22:56+00:00,cz0y8tr,1.0,t3_4199ck,25454.0,Futurology
1728,"The internet is roughly 20 years old now, how long is it going to take these corporations to realise that artificial barriers don't work online.  The old world of geographic locations and borders simply does not translate to the online world.",2016-01-17 00:03:18+00:00,cz0xijd,1.0,t3_418bt1,39412.0,technology
1729,It also deliberately didn't carry enough fuel for a landing in case the crew just decided to land ,2016-01-16 23:53:39+00:00,cz0x62p,1.0,t3_4190f2,27374.0,space
1730,The new millennium ,2016-01-16 06:48:15+00:00,cz06nsv,1.0,t3_415sbi,25444.0,AskReddit
1731,Can you give some example where this actually happened? Many old laws are still on the books but widely ignored.  And it's not childish to call out peadophilia,2016-01-15 20:42:35+00:00,cyzmozx,3.0,t1_cyzkgi6,3095.0,worldnews
1732,I never said it was aliens.,2016-01-15 05:57:51+00:00,cyyx4zd,4.0,t1_cyywrik,891.0,space
1733,to be fair we've never seen anything quite like this,2016-01-15 05:06:30+00:00,cyyvrtw,2.0,t1_cyydlel,28727.0,space
1734,"except for, ya know... the dipping
",2016-01-15 05:05:05+00:00,cyyvqcd,2.0,t1_cyybyff,30864.0,space
1735,"Thanks for this, I have never read Chinese Sci-fi or even heard of any.  I wonder if the translator is related to the author?",2016-01-15 04:43:15+00:00,cyyv390,4.0,t1_cyy5wlu,37656.0,space
1736,Oscar nominated film 50 Shades of Grey doesn't quite sound right,2016-01-14 21:02:59+00:00,cyyddy5,1.0,t3_40xmeq,26043.0,movies
1737,"I love Darkman, I could never understand why it flopped",2016-01-14 20:48:51+00:00,cyycr79,1.0,t3_40xleu,25656.0,scifi
1738,Same age as Bowie....WTF is going on?,2016-01-14 20:37:18+00:00,cyyc8ne,1.0,t3_40xdxy,28925.0,movies
1739,The ABC has been on the nose since they sacked Junglist and replaced him with Hex and Goose,2016-01-14 11:11:01+00:00,cyxs9vc,2.0,t1_cyxo5hx,15309.0,australia
1740,RemindMe! Tomorrow,2016-01-14 11:01:43+00:00,cyxs4st,,t1_cyxmzw6,17868.0,australia
1741,not a bad job!,2016-01-14 06:25:27+00:00,cyxnhxo,2.0,t1_cyxn8qv,665.0,pics
1742,"
is this real?",2016-01-14 05:58:38+00:00,cyxmv7g,4.0,t1_cyxldn6,3296.0,powerball
1743,"From wikipedia:  
*Throughout the descent Aldrin had called out navigation data to Armstrong, who was busy piloting the LM. *

https://en.wikipedia.org/wiki/Apollo_11#Landing",2016-01-14 04:36:30+00:00,cyxkk94,4.0,t1_cyxjo12,1650.0,space
1744,Were they all spacex employees or general public?,2016-01-14 02:50:16+00:00,cyxgzs4,2.0,t1_cyxc6wg,8067.0,space
1745,Even if they can only use each one two or three times it's a huge step forward,2016-01-14 02:48:48+00:00,cyxgxyh,2.0,t1_cyxbmy6,8827.0,space
1746,I think Armstrong was piloting the Eagle,2016-01-14 02:46:48+00:00,cyxgvbp,2.0,t1_cyx6163,16831.0,space
1747,"How big will it have to be??  Sounds huge, especially if the rumoured 100 passengers is correct",2016-01-14 02:25:23+00:00,cyxg3zh,3.0,t1_cyx9gai,10721.0,space
1748,Can they stutter fire it?  Or does switching the engine on and off take too long?,2016-01-14 02:19:26+00:00,cyxfweh,4.0,t1_cyxbm89,7099.0,space
1749,Can't wait to see one land in the daylight,2016-01-13 20:10:36+00:00,cyx0ln1,2.0,t1_cywfo8d,41653.0,space
1750,Interesting .... I'd like to see hard numbers of those that died on their way to buy a ticket,2016-01-13 03:59:08+00:00,cyw8mdg,1.0,t3_40ol2d,22834.0,todayilearned
1751,It's a drug thing...,2016-01-12 22:28:52+00:00,cyvvu8c,3.0,t1_cyvdhqk,25114.0,AFL
1752,I though this was an EmDrive sub,2016-01-12 20:19:48+00:00,cyvpy3q,3.0,t1_cyt9f4e,169691.0,EmDrive
1753,Ha this just gets better and better,2016-01-12 19:52:51+00:00,cyvopv1,1.0,t3_40lzqy,33227.0,AFL
1754,CAS is not a legal system,2016-01-12 19:49:25+00:00,cyvokbu,12.0,t1_cyv7jwz,29400.0,australia
1755,"It's not a problem at all.  If you can't state what was injected, you're going down.  Simple.  It has to be this way, otherwise anyone could claim ignorance and keep doping to their heart's content.",2016-01-12 11:27:30+00:00,cyv7d4u,10.0,t1_cyv79sr,365.0,australia
1756,They are not bound by those principals,2016-01-12 09:34:14+00:00,cyv5q8e,8.0,t1_cyv4gyz,4668.0,australia
1757,picked up some power converters,2016-01-12 07:23:42+00:00,cyv3fmk,2.0,t1_cyunxa3,26938.0,StarWars
1758,Yes they should and maybe they will,2016-01-12 07:22:50+00:00,cyv3eza,1.0,t3_40jbw6,31530.0,StarWars
1759,I like this,2016-01-12 07:21:08+00:00,cyv3dqp,1.0,t3_40gr9e,64250.0,dataisbeautiful
1760,"Precisely.  If they players can't account for what went into their systems then CAS have to assume it was illegal.  Also, the players lied and hid the secret injections from ASADA.  Guilty.",2016-01-12 04:46:27+00:00,cyuyzvm,6.0,t1_cyuyqo7,423.0,australia
1761,Hardly,2016-01-12 04:35:13+00:00,cyuykov,4.0,t1_cyuw9gx,3675.0,australia
1762,Because the ad shows all the banned players who will not be playing this year,2016-01-12 04:34:29+00:00,cyuyjph,3.0,t1_cyuwyip,2548.0,australia
1763,He's the only one with any integrity,2016-01-12 01:32:33+00:00,cyuriht,2.0,t1_cyupj60,3224.0,AFL
1764,There was one Dune movie,2016-01-12 01:22:53+00:00,cyur5gk,4.0,t1_cyuq7jc,1520.0,scifi
1765,"I always loved Merry Christmas Mr Lawrence. The music is great, though I'm not sure he did it",2016-01-12 01:22:12+00:00,cyur4jv,2.0,t1_cyucvek,21314.0,scifi
1766,Why not Fences McFadden?,2016-01-12 01:18:59+00:00,cyur08v,4.0,t1_cyubtmb,22589.0,scifi
1767,I can't believe the Queen outlived Bowie,2016-01-12 01:17:02+00:00,cyuqxn1,1.0,t3_40gmxs,44679.0,Showerthoughts
1768,Bi,2016-01-12 01:14:47+00:00,cyuqulc,2.0,t1_cyuqfz4,646.0,pics
1769,Don't make us spell it out,2016-01-12 01:13:27+00:00,cyuqssv,2.0,t1_cyupybe,1377.0,pics
1770,At least he never got fat.  Imagine being known as the Fat White Duke,2016-01-12 01:12:42+00:00,cyuqrqz,1.0,t3_40ixlv,14252.0,pics
1771,How...... Oh.,2016-01-12 01:11:13+00:00,cyuqpry,6.0,t1_cyuqbhj,638.0,pics
1772,I think you are living in fantasy land,2016-01-11 23:52:23+00:00,cyunu4x,4.0,t1_cyuns7l,86.0,australia
1773,There is an ad for Essendon memberships showing right now on the screen outside Etihad LOL. They might want to change that campaign,2016-01-11 23:36:51+00:00,cyun9dt,1.0,t3_40iybr,8258.0,australia
1774,They rolled the dice and lost big time,2016-01-11 22:59:46+00:00,cyulusf,2.0,t1_cyulknf,428.0,AFL
1775,"They got 2 years but have already served one 
EDIT: not sure served is the right word, but the penalty has been backdated one year",2016-01-11 22:59:00+00:00,cyulto2,2.0,t1_cyulbxd,743.0,AFL
1776,Or no winner,2016-01-11 22:55:02+00:00,cyulo2b,3.0,t1_cyukop1,1477.0,AFL
1777,It should,2016-01-11 22:54:07+00:00,cyulmr1,3.0,t1_cyuknl5,1467.0,AFL
1778,"What the hell is that, larger?",2016-01-11 22:24:16+00:00,cyukfho,1.0,t3_40ho4a,19154.0,pics
1779,Whatever it takes...,2016-01-11 22:20:41+00:00,cyukaat,3.0,t1_cyuikl4,2465.0,australia
1780,It's unfortunate that they cheated,2016-01-11 22:19:35+00:00,cyuk8p8,2.0,t1_cyujmzd,897.0,australia
1781,"They knew it was dodgy. Why all the secrecy? Why were the drugs administered away from the club? Why the consent forms?  They must have known something was up, but only Zhaka said no to it.",2016-01-11 22:16:09+00:00,cyuk3qy,4.0,t1_cyuip4e,2022.0,AFL
1782,Remember when we weren't allowed to know who they were?,2016-01-11 22:11:26+00:00,cyujwxx,1.0,t3_40iei4,9681.0,AFL
1783,Remember #standbyhird,2016-01-11 22:09:47+00:00,cyujujf,2.0,t1_cyuig1t,1987.0,AFL
1784,I doubt they would be allowed to train.  They need to hire a bunch of PTs and train away from the club,2016-01-11 22:06:38+00:00,cyujpwe,3.0,t1_cyuitax,1285.0,AFL
1785,Guilty!,2016-01-11 21:24:34+00:00,cyuhxb2,1.0,t3_40iei4,6869.0,AFL
1786,Has the decision been made?,2016-01-11 21:22:33+00:00,cyuhu76,3.0,t1_cyuhe6q,630.0,AFL
1787,"The car knows what's around it, 360 degees around. People don't.  I doubt such a situation would ever arise where the car has no avoidance strategy",2016-01-11 07:56:34+00:00,cytuecu,6.0,t1_cytrtgd,7242.0,Futurology
