,body,created,id,nest_level,parent_id,reply_delay,subreddit
819,In any number of articles,2016-08-08 01:58:37+00:00,d68id02,6.0,t1_d68gp51,2904.0,worldnews
820,That was ruled out,2016-08-08 00:12:03+00:00,d68ensa,4.0,t1_d68eh43,318.0,worldnews
821,"It's not a small percentage, it's a massive percentage.  ",2016-08-08 00:04:47+00:00,d68eemf,2.0,t1_d685p0d,13742.0,worldnews
822,Such as...?,2016-08-08 00:03:28+00:00,d68ecy7,2.0,t1_d685val,13398.0,worldnews
823,"Eyes of the Overworld, then Cugel's Saga.  ",2016-08-06 22:03:39+00:00,d6749mj,1.0,t3_4rs9tw,2577813.0,FansOfJackVance
824,Battle Beyond The Stars was fun in its day. And it had a killer soundtrack,2016-08-05 22:21:10+00:00,d65zawr,1.0,t3_4waetn,31550.0,sciencefiction
825,LOL wonderful observation ,2016-08-05 22:12:53+00:00,d65yz75,3.0,t1_d65y4py,1256.0,writing
826,Sounds like Car Wars,2016-08-05 22:08:27+00:00,d65ysve,3.0,t1_d65cfet,29445.0,gamedev
827,"LOL should have known there would be ""controversy""...some people just aren't happy unless they are complaining",2016-08-05 13:32:28+00:00,d65bg3m,1.0,t3_4w64cy,67296.0,movies
828,How can you not have any pages!!!,2016-08-05 13:27:16+00:00,d65b92o,2.0,t1_d653y5d,19254.0,movies
829,I love Hitchhikers and I still haven't read it,2016-08-05 08:27:11+00:00,d654cgw,1.0,t3_4w431c,75143.0,books
830,The captain of the Bantu Wind?,2016-08-05 07:49:43+00:00,d653mjm,7.0,t1_d64ske6,21735.0,movies
831,He also played a similar role in Toast of London,2016-08-04 11:08:45+00:00,d63rf8a,1.0,t3_4w0otu,52433.0,movies
832,"I think it's an optional extra
",2016-08-04 07:21:58+00:00,d63n0wl,2.0,t1_d638kg7,26212.0,Futurology
833,The US does not own the Moon.  If permission was denied they could have launched from elsewhere,2016-08-03 20:37:59+00:00,d62zfgt,1.0,t3_4vy7nc,29599.0,space
834,Chocky,2016-08-03 08:07:02+00:00,d6286kx,1.0,t3_4vuhg5,43655.0,sciencefiction
835,"Fascinating.  Is it possible to have a planet where the centrifugal force exactly negates it's gravity, making it Zero G on the surface?",2016-08-03 08:03:26+00:00,d62844d,1.0,t3_4vsf3i,66961.0,sciencefiction
836,Plug for www.sf-books.com. There are a few stories there under Fiction,2016-08-03 06:23:32+00:00,d625zw0,1.0,t3_4vsj76,59377.0,scifiwriting
837,oh?,2016-08-01 10:45:27+00:00,d5zfovw,6.0,t1_d5zaycc,14822.0,AskReddit
838,Young Guns,2016-08-01 10:44:35+00:00,d5zfo92,1.0,t3_4vjxgo,36360.0,AskReddit
839,And then try Toast of London,2016-08-01 08:50:52+00:00,d5zdlsq,3.0,t1_d5z47cv,21326.0,AskReddit
840,that was uncalled for,2016-08-01 04:40:02+00:00,d5z7t7u,2.0,t1_d5z1w89,10029.0,movies
841,A teaser maybe,2016-08-01 04:33:28+00:00,d5z7low,1.0,t3_4viaqq,36453.0,movies
842,TIL Andre Norton is a woman,2016-07-31 21:05:09+00:00,d5yr5ry,6.0,t1_d5y5xwp,40937.0,printSF
843,Alice??,2016-07-31 07:49:25+00:00,d5y41xq,4.0,t1_d5xxggv,15613.0,printSF
844,Is that the ep where they are designing the Lunar Module? Because that one is my favourite,2016-07-31 07:37:35+00:00,d5y3ty9,4.0,t1_d5xnz6i,32189.0,spacex
845,He rejected her before she said she wasn't a virgin,2016-07-30 23:11:34+00:00,d5xp0af,3.0,t1_d5xnjfm,2587.0,movies
846,What is all purpose flour?,2016-07-30 08:48:20+00:00,d5wzsei,1.0,t3_4v9a7e,36178.0,dessert
847,You're talking about Liberal voters aren't you ,2016-07-30 07:20:00+00:00,d5wy8us,3.0,t1_d5wqd6w,17636.0,australia
848,They are basically telling people to lie.  ,2016-07-30 01:51:54+00:00,d5wp8s6,1.0,t3_4v6bas,48374.0,australia
849,You are basically saying no Australian could ever be good enough for the role.,2016-07-30 01:47:03+00:00,d5wp2uc,2.0,t1_d5wl7so,6817.0,australia
850,What an absolute cunt.  I never thought Turnbull could be that petty...guess I was wrong,2016-07-30 01:45:00+00:00,d5wp0dn,1.0,t3_4v9cxj,9700.0,australia
851,"Every country with its own indigenous football code call it soccer.  Countries without their own game call it football   
EDIT: Why the downvotes?  it's true.  I guess people don't like the truth",2016-07-29 23:29:45+00:00,d5wkdbz,1.0,t3_4v83dm,17693.0,todayilearned
852,I am looking forward to this film more than ep VIII,2016-07-29 12:30:14+00:00,d5vsgno,1.0,t3_4v42mi,40521.0,StarWars
853,All those were books...,2016-07-29 06:05:34+00:00,d5vkkzn,1.0,t3_4v34rh,30574.0,movies
854,He's written a novel as well,2016-07-28 06:16:23+00:00,d5u4dzp,3.0,t1_d5tpj5g,24192.0,Moviesinthemaking
855,What film is it.? Mad Max?,2016-07-28 06:02:23+00:00,d5u41gv,1.0,t3_4uxtdi,21485.0,DIY
856,Not just a typo though...somehow they managed to mess up a title card,2016-07-27 12:56:57+00:00,d5svprx,2.0,t1_d5svkp9,269.0,movies
857,What is the movie called...?,2016-07-27 12:52:40+00:00,d5svkx6,4.0,t1_d5svivx,108.0,movies
858,"What the hell is Long, Stock &amp; Two Smoking Barrels?  A sequel?",2016-07-27 12:48:32+00:00,d5svgcg,2.0,t1_d5svebe,110.0,movies
859,"It's Matrix Reloaded, and I auditioned to be one of the Agent Smiths.  I wasn't tall enough (I'm 6'1).  Hugo Weaving is bloody tall",2016-07-27 12:46:39+00:00,d5sve9a,1.0,t3_4uohgj,85599.0,movies
860,What's vague about it?,2016-07-27 12:43:25+00:00,d5svaqk,2.0,t1_d5sv9en,75.0,movies
861,These guys seriously need to get laid,2016-07-27 10:24:28+00:00,d5ss2xo,1.0,t3_4utt8n,2580.0,worldnews
862,You can't trademark a hashtag,2016-07-27 10:19:47+00:00,d5srzuf,1.0,t3_4ur3ph,45873.0,worldnews
863,google Wobbleboard,2016-07-27 05:42:53+00:00,d5smidr,2.0,t1_d5rvw64,37309.0,AskReddit
864,They went in a lift...who knows how far that traveled,2016-07-26 12:05:37+00:00,d5rcol7,3.0,t1_d5raurp,4898.0,AskReddit
865,and?,2016-07-26 12:04:43+00:00,d5rcnqk,2.0,t1_d5r5rub,20633.0,AskReddit
866,If you die in The Matrix you die in real life...mainly because you can't get to a phone,2016-07-26 12:02:22+00:00,d5rclib,2.0,t1_d5r36c1,26052.0,AskReddit
867,How did Hanibal Lecter get out of that cage?,2016-07-26 11:55:43+00:00,d5rcf5z,1.0,t3_4umv1s,26548.0,AskReddit
868,Had a cardboard DeathStar in the late 70's.  I would gladly pay $100 for one.,2016-07-26 11:50:12+00:00,d5rca30,1.0,t3_4uif85,82859.0,AskReddit
869,"Two nuns were in a car, when suddenly a demon appeared on the hood. ""What do we do""? cried the first nun. ""Show him your cross!"" replied the second.  So the first nun screamed ""GET OFF THE FUCKING CAR!!""",2016-07-26 11:43:48+00:00,d5rc4f6,3.0,t1_d5qfjic,56385.0,AskReddit
870,"My house didn't come with any items, it was kind of empty",2016-07-26 04:07:36+00:00,d5r1sjl,1.0,t3_4uikbm,53069.0,AskReddit
871,Well it's not a pipe,2016-07-26 04:05:04+00:00,d5r1p7x,1.0,t3_4ujh8n,41702.0,Art
872,"So? It wasnt a bailout, it was a contract.",2016-07-26 03:03:06+00:00,d5qz20j,6.0,t1_d5qun89,5541.0,space
873,Bailing them out?  You mean paying cash in exchange for services..?  Isn't that just business?,2016-07-26 01:26:25+00:00,d5qufxe,4.0,t1_d5qu5sy,345.0,space
874,I have the DVD box set and don't think I've even watched it...might have to bump it up my list,2016-07-26 01:17:37+00:00,d5qu0nm,1.0,t3_4ujyur,26359.0,movies
875,"I was an extra on The Matrix Reloaded.  There is a really brief scene (like 3 seconds) when you see an overhead shot of Neo, Morpheus and Trinity walking through a crowd in the lobby before getting into an elevator.  We shot that all day, with the real actors (not stand-ins) and did about 20 takes.  Every extra in that scene had hair and makeup, and full costume even though it was a long-shot from overhead.  Andy Wachowski directed (didn't see Larry).  And people wonder why films are so expensive.",2016-07-26 01:13:16+00:00,d5qtt6p,1.0,t3_4ujx11,26620.0,movies
876,"Well they do pronounce it Karma-con, which is kind of fitting",2016-07-26 01:01:28+00:00,d5qt9iq,2.0,t1_d5qlpvz,10080.0,movies
877,Is Peter Jackson involved in this one?,2016-07-26 01:00:09+00:00,d5qt79o,2.0,t1_d5qhwbs,14828.0,movies
878,A CGI Asterix movie!!  About time.. I hope it does better than Tintin,2016-07-26 00:59:07+00:00,d5qt5j1,1.0,t3_4uk2t5,24095.0,movies
879,Is that guy's name Anastasia?,2016-07-25 22:59:02+00:00,d5qnqiy,1.0,t3_4ukgii,12359.0,pics
880,Probably Rendezvous With Rama from the school library when I was about 12 ,2016-07-25 21:30:14+00:00,d5qjomo,1.0,t3_4ujh36,18055.0,printSF
881,"Australia.. I can remember doing:    
To Kill A Mockingbird - Harper Lee    
The Pearl - John Steinbeck    
Monkey Grip - Helen Garner    
That Eye The Sky - Tim Winton    
Lord of the Flies - William Golding    
Animal Farm - George Orwell   
probably some others I've forgotten about
",2016-07-25 11:53:28+00:00,d5puwpu,1.0,t3_4ufe0x,48705.0,books
882,"The Quick &amp; the Dead  - Leo DiCaprio, Russell Crowe, Sharon Stone, Lance Hendriksen",2016-07-25 04:53:24+00:00,d5pm7t7,1.0,t3_4ufnhx,19667.0,movies
883,great film too,2016-07-25 04:51:49+00:00,d5pm665,2.0,t1_d5phrkl,7769.0,movies
884,and Mel Gibson,2016-07-25 04:49:53+00:00,d5pm454,2.0,t1_d5pbxfg,16892.0,movies
885,This is the theme of Pink Floyd's *Time*. Roger Waters wrote it when he was 24.  **Twenty fucking four!**,2016-07-25 04:43:25+00:00,d5plxcu,3.0,t1_d5pdc0u,14251.0,AskReddit
886,"I'm sorry, but that last shot of Lando clapping just does not fit the music.  At least with YubNub he's clapping in time (sort of)",2016-07-24 13:01:33+00:00,d5ooone,2.0,t1_d5o92nq,42187.0,StarWars
887,"No way, YubNub is awesome",2016-07-24 12:53:54+00:00,d5ooio5,1.0,t3_4uattk,45767.0,StarWars
888,Essendon,2016-07-24 02:11:25+00:00,d5oasgp,5.0,t1_d5oa2jw,1337.0,worldnews
889,I lost my shit when Duncan (tooth kid) kept miming Eleven taking off her dress,2016-07-24 00:11:31+00:00,d5o6t1j,,t1_d5goubb,,television
890,Can't help but think this was his plan all along,2016-07-23 21:54:36+00:00,d5o2447,1.0,t3_4u7k9i,45045.0,worldnews
891,Duh,2016-07-23 21:47:14+00:00,d5o1uzk,1.0,t3_4u7okn,41682.0,atheism
892,Jarre was always awesome,2016-07-23 15:10:35+00:00,d5no1wj,,t1_d5go3m5,,television
893,answer OP!,2016-07-23 04:55:17+00:00,d5nbnoi,6.0,t1_d5mwn4q,26500.0,pics
894,You appear to have a castle outside your window,2016-07-23 04:54:16+00:00,d5nbmoz,1.0,t3_4u246x,66675.0,pics
895,Looks like a Spartan warrior,2016-07-22 05:03:42+00:00,d5lzgsm,1.0,t3_4twsp1,58532.0,pics
896,I'm gonna continue to be late to the party until Netfilx gets the series,2016-07-21 11:07:31+00:00,d5kt2ix,1.0,t3_4tv6wk,24980.0,scifi
897,WTF? I've never heard of that.,2016-07-21 11:04:05+00:00,d5kt00t,1.0,t3_4tvnb8,16701.0,melbourne
898,I know... But why can't that work be linked to some kind of objective in a game?,2016-07-21 08:31:30+00:00,d5kqb36,2.0,t1_d5kpvra,1411.0,Showerthoughts
899,He's an African American,2016-07-21 06:10:13+00:00,d5knfs5,3.0,t1_d5kmczz,2520.0,Futurology
900,Presumably you are also getting equity when you sell your apples ... I'm no expert though ,2016-07-21 06:07:22+00:00,d5kndcj,6.0,t1_d5kmx51,1090.0,Futurology
901,This sounds like what is outlined in *Ghost Crime* but for the music industry.  ie. when you buy a digital download you are buying a tiny share of the copyright,2016-07-21 05:18:51+00:00,d5km3zi,5.0,t1_d5kkkh3,3157.0,Futurology
902,"She reprogrammed the computer, presumably in assembly, within three minutes?  I'm calling bullshit",2016-07-21 04:27:42+00:00,d5kkm4h,1.0,t3_4trhx1,48900.0,space
903,or a bomb?,2016-07-20 05:57:57+00:00,d5j8qsz,8.0,t1_d5j7vit,1997.0,australia
904,"I've watched two so far, really looking forward to seeing where this goes",2016-07-20 05:23:54+00:00,d5j7us3,1.0,t3_4t5vo5,297327.0,television
905,And it has Winona Ryder!,2016-07-20 05:13:26+00:00,d5j7kam,1.0,t3_4t5vo5,296699.0,television
906,The law is an ass,2016-07-19 23:53:25+00:00,d5ivmhc,4.0,t1_d5isgen,4536.0,australia
907,"Agreed, he should have been shot within the hour, then everybody could go home.  Not let the situation fester resulting it two innocent deaths",2016-07-19 22:25:49+00:00,d5irxgt,6.0,t1_d5iku1s,9486.0,australia
908,"&gt; just because he's holding a gun and saying he's going to kill people doesn't mean the police can legally shoot him.

Then the law must change",2016-07-19 22:23:59+00:00,d5iruik,4.0,t1_d5i1ihw,36472.0,australia
909,Their lives were in danger as soon as he locked the doors and denied them liberty.  Lethal force was appropriate and should have been administered much sooner.,2016-07-19 22:23:23+00:00,d5irtku,3.0,t1_d5i1932,37048.0,australia
910,"&gt; Snipe the guy through a window and if it turns out his gun was fake / not loaded 

irrelevant whether it was loaded...the threat was real.  If you take hostages you forfeit your right to life",2016-07-19 22:19:40+00:00,d5irnop,2.0,t1_d5i07pl,39563.0,australia
911,"She's not wrong.  As soon as you take hostages your ""rights as an individual"" cease.  Anything done to you is done in self defense",2016-07-19 22:16:39+00:00,d5iriy1,1.0,t3_4tkjd8,41026.0,australia
912,Yes.  I read it in his voice.,2016-07-19 22:06:49+00:00,d5ir3uf,2.0,t1_d5iqke1,746.0,Showerthoughts
913,I never claimed otherwise,2016-07-19 20:48:06+00:00,d5inmqh,6.0,t1_d5hwrk4,45659.0,australia
914,Great music,2016-07-19 20:46:32+00:00,d5ink6d,1.0,t3_4tlqsn,18585.0,gamedev
915,"The article is wrong, the political i the religion are entwined, they are one and the same.",2016-07-19 07:11:25+00:00,d5hvopa,1.0,t3_4tixtx,15838.0,australia
916,But none of them will specifically set out to kill you,2016-07-19 07:08:45+00:00,d5hvmov,4.0,t1_d5hv5y9,1303.0,australia
917,The movie is much better... I'd avoid the miniseries,2016-07-19 06:40:06+00:00,d5hv0hq,1.0,t3_4tj1y0,12344.0,sciencefiction
918,If your smartphone isn't free then you're on the wrong contract,2016-07-18 06:14:51+00:00,d5giwjm,2.0,t1_d5g347u,29790.0,Futurology
919,Is it just me or is the title done in a Stephen King font?,2016-07-17 10:16:48+00:00,d5fhxdd,1.0,t3_4t7zr5,23959.0,scifi
920,Yeah...and fuck those poor folk who don't have exorbitant amounts of money,2016-07-16 22:36:09+00:00,d5f0jla,2.0,t1_d5ebe6d,57173.0,StarWarsLeaks
921,Because Disney are dicks,2016-07-16 22:34:27+00:00,d5f0hld,1.0,t3_4t3c38,60200.0,StarWarsLeaks
922,"bloody Disney... I can only assume the *want* people to see it like this, to build tension/anticipation or whatever.  I dunno but it's a pretty dick move",2016-07-16 22:29:21+00:00,d5f0bnw,2.0,t1_d5eihbu,31852.0,StarWarsLeaks
923,Didn't Hitler get rid of all the judges too?,2016-07-16 21:35:04+00:00,d5eyjbi,1.0,t3_4t5lmc,13805.0,worldnews
924,Death Star Droid,2016-07-16 12:02:46+00:00,d5egf6i,1.0,t3_4t05v3,67962.0,StarWars
925,"It's been pulled, is there a mirror?",2016-07-16 12:00:32+00:00,d5egdqd,2.0,t1_d5dt233,54100.0,StarWars
926,There's a new trailer?,2016-07-16 11:52:28+00:00,d5eg8vm,1.0,t3_4t07di,66844.0,StarWars
927,So the whole country is ripe for invasion?,2016-07-16 06:34:29+00:00,d5eb7zc,3.0,t1_d5eawyl,924.0,AskReddit
928,Why?,2016-07-15 23:33:31+00:00,d5dyxgm,2.0,t1_d5dywaj,55.0,worldnews
929,"The majority are in their homes, the extremists are on the streets ",2016-07-15 23:07:08+00:00,d5dxz6g,2.0,t1_d5dxxlb,76.0,worldnews
930,Islam has always been used for war,2016-07-15 23:05:47+00:00,d5dxxgg,2.0,t1_d5dxp9v,371.0,worldnews
931,Not unless you're Chewie,2016-07-15 22:50:14+00:00,d5dxd4r,2.0,t1_d5dx194,553.0,worldnews
932,Or supporting the coup,2016-07-15 22:12:52+00:00,d5dvzjh,4.0,t1_d5dvotp,479.0,worldnews
933,Germany ,2016-07-15 22:09:03+00:00,d5dvug7,3.0,t1_d5dvoys,243.0,worldnews
934,It has just started,2016-07-15 22:07:45+00:00,d5dvsow,2.0,t1_d5dvnfq,233.0,worldnews
935,Do NOT do that... They are hoping to make a human shield ,2016-07-15 22:02:11+00:00,d5dvl62,2.0,t1_d5dvi19,138.0,worldnews
936,Good thing.  The military are secular. The gov are theocratic dictators,2016-07-15 21:50:23+00:00,d5dv4ql,4.0,t1_d5dt0li,3151.0,worldnews
937,He has fled to Germany,2016-07-15 21:48:28+00:00,d5dv216,2.0,t1_d5dsk3f,3686.0,worldnews
938,I miss Davison,2016-07-15 06:38:09+00:00,d5d0vnl,2.0,t1_d5c2grf,53243.0,doctorwho
939,Capaldi is my favourite of the new Doctors ,2016-07-15 06:33:27+00:00,d5d0rzl,1.0,t3_4st0t5,64695.0,doctorwho
940,Where's Ross..?,2016-07-15 05:39:57+00:00,d5czjft,1.0,t3_4stalh,57644.0,IAmA
941,"Education.  And start treating Islam like the violent ideology that it is, instead of tip-toeing around it",2016-07-15 05:26:01+00:00,d5cz6rv,5.0,t1_d5cscuv,12812.0,AskReddit
942,why not just have a copper NBN if you're so adverse to progress,2016-07-14 10:54:22+00:00,d5bshjz,3.0,t1_d5bmqcg,18018.0,australia
943,Why not Hyperloop?,2016-07-14 04:48:32+00:00,d5bkyvx,1.0,t3_4sqpxi,11429.0,australia
944,The line of slashing Elves was the moment I went 'Holy shit this is gonna be awesome',2016-07-14 03:41:37+00:00,d5bivg0,2.0,t1_d5asmj8,38305.0,AskReddit
945,"My kids did recently, but it was after we'd landed",2016-07-13 07:00:28+00:00,d5aay6v,4.0,t1_d5a5gvj,12147.0,AskReddit
946,Rick Astley,2016-07-13 03:25:16+00:00,d5a50qj,1.0,t3_4sipsp,30430.0,AskReddit
947,As someone who doesn't know anything beyond the third book...when did Harry Potter turn into the Texas Chainsaw Massacre?,2016-07-12 13:04:01+00:00,d594qbe,1.0,t3_4sbavx,79679.0,pics
948,Is this a record? I can't remember a longer one,2016-07-12 06:17:45+00:00,d58wpdg,1.0,t3_4seq2i,13960.0,AFL
949,Weren't you even paying attention?,2016-07-12 05:00:57+00:00,d58us73,3.0,t1_d58l2gx,16787.0,movies
950,Bald guy's name is Baldi,2016-07-12 03:02:04+00:00,d58r15l,1.0,t3_4sc0uy,35510.0,pics
951,Career over?,2016-07-11 09:07:43+00:00,d57o3mf,1.0,t3_4s9q0g,6559.0,AFL
952,Can you give an example of the weak directing?,2016-07-11 08:29:56+00:00,d57ngnb,5.0,t1_d574ldh,37982.0,movies
953,Huntsmen always get put outside but Whitetails get the fucking spray,2016-07-10 06:36:17+00:00,d56f3mk,2.0,t1_d564g08,20976.0,todayilearned
954,Aren't computers invented in your country?,2016-07-10 06:32:56+00:00,d56f0y9,4.0,t1_d56dsij,3129.0,Showerthoughts
955,You might enjoy Level Up a Your Life by the Nerdfitness dude,2016-07-10 06:31:10+00:00,d56ezkd,1.0,t3_4s39z3,19047.0,Showerthoughts
956,awesome website,2016-07-10 02:14:04+00:00,d567asq,1.0,t3_4s1afz,31381.0,gamedev
957,Yep we've always called it Wooster-sheer sauce,2016-07-10 01:27:43+00:00,d565scw,3.0,t1_d55xhxz,14779.0,AskReddit
958,Scunthorpe,2016-07-10 01:26:18+00:00,d565qpz,5.0,t1_d55pqs4,27943.0,AskReddit
959,Roo-ral.  I've noticed Americans have trouble with mirror as well..it comes out as meeeeer,2016-07-10 01:25:24+00:00,d565pql,2.0,t1_d55m7bm,34044.0,AskReddit
960,Imagine it's a warm water world heated by tidal flexing of several massive moons...one can hope,2016-07-10 00:58:19+00:00,d564tpn,1.0,t3_4ryyyp,70426.0,space
961,"&gt; So its somewhat like an artificial selection for bulls that are brave but not too smart.

It's a fine line between bravery and stupidity",2016-07-10 00:36:41+00:00,d5644a5,4.0,t1_d5618th,5133.0,worldnews
962,Tidy.,2016-07-09 10:38:02+00:00,d55eprs,1.0,t3_4rumlr,76573.0,travel
963,LOL,2016-07-09 06:50:38+00:00,d55ayz2,3.0,t1_d51xro1,207620.0,AFL
964,One of his earlier films that is pretty great is Man Without a Face... I've never seen it mentioned on Reddit,2016-07-08 13:07:28+00:00,d546z29,2.0,t1_d53dyy1,56670.0,movies
965,he had a bomb?,2016-07-08 12:48:55+00:00,d546en9,2.0,t1_d546bl6,172.0,news
966,Or make it really expensive,2016-07-08 12:44:23+00:00,d5469uo,3.0,t1_d545k3h,1568.0,news
967,Love this book... It would make a really cool movie,2016-07-08 04:19:06+00:00,d53uhgy,2.0,t1_d53adnn,29376.0,learnprogramming
968,Good?  We eradicate the homeless by giving them homes,2016-07-07 09:21:34+00:00,d52lwjg,1.0,t3_4ri38f,77782.0,Futurology
969,The SAS should have been called in as soon as it became apparent it was terrorist related.  This was just way above the capabilities of the police force,2016-07-07 09:14:51+00:00,d52lsdu,1.0,t3_4rltgr,29818.0,australia
970,More snipers.  I wonder what the outcome would have been had this happened in the US,2016-07-06 09:49:17+00:00,d516s50,2.0,t1_d512jc1,13310.0,australia
971,I though we knew it was a gas giant?,2016-07-06 01:40:18+00:00,d50ttoz,3.0,t1_d50gs5n,18896.0,IAmA
972,LOVE ISN'T ALWAYS ON TIME,2016-07-05 11:31:38+00:00,d4zv1jp,3.0,t1_d4ztj7t,5198.0,australia
973,Mel Gibson does a great solo commentary on Braveheart,2016-07-05 10:26:25+00:00,d4ztvr8,1.0,t3_4r7zjx,64433.0,movies
974,Goonies is a great commentary with the cast 20 years later,2016-07-05 10:23:21+00:00,d4zttzb,1.0,t3_4r7zjx,64249.0,movies
975,Kangaroo Jack was reshot to make the Kangaroo the star of the film,2016-07-05 10:21:57+00:00,d4ztt68,1.0,t3_4rb6a1,17620.0,movies
976,Surely no-one could vote for the Coalition twice..?,2016-07-05 05:10:03+00:00,d4znwtz,2.0,t1_d4zle6l,5529.0,australia
977,Throughout this whole election count everyone has been saying Labor can't win....which is what makes [this](http://vtr.aec.gov.au/HouseDefault-20499.htm) so confusing.  It's looking like a Labor win to me,2016-07-05 05:04:59+00:00,d4zns7m,1.0,t3_4r9o4a,23082.0,australia
978,Obviously.  I don't claim otherwise,2016-07-05 05:01:25+00:00,d4znoyk,3.0,t1_d4zmtsg,1978.0,australia
979,Australia and NZ should have a joint space agency ... ANZSA,2016-07-04 23:32:18+00:00,d4zdhlv,1.0,t3_4r4yt0,77927.0,australia
980,"Gotta love the Aussie attitude towards counting ... ""government in limbo? Fuck it we'll do it on Tuesday, Monday's an RDO""",2016-07-04 23:21:29+00:00,d4zd4g9,1.0,t3_4r9o4a,2472.0,australia
981,Now I can watch part 2 of Chain of Command! That captain really was a douche,2016-07-04 21:38:09+00:00,d4z9hq9,1.0,t3_4r6pk5,38818.0,scifi
982,I was not aware of that,2016-07-04 05:58:15+00:00,d4yikq7,3.0,t1_d4yglwp,4763.0,StarWars
983,I love the eye roll of contempt the other girl shows,2016-07-04 00:25:10+00:00,d4y8zfm,4.0,t1_d4xmnr8,39384.0,AFL
984,"I've never heard anyone say that, including on tv",2016-07-04 00:19:22+00:00,d4y8skt,2.0,t1_d4xufok,24198.0,AskReddit
985,Brexit,2016-07-04 00:17:35+00:00,d4y8qho,1.0,t3_4r1tos,42647.0,AskReddit
986,"Relevant video methinks  https://youtu.be/3eIVJR9Ga9M?t=1m1s
",2016-07-03 13:11:48+00:00,d4xm9yp,1.0,t3_4qzdr2,52612.0,AskReddit
987,Ok what the hell is an autism tattoo?,2016-07-03 12:42:50+00:00,d4xlo4d,1.0,t3_4qzkuy,47796.0,StarWars
988,"Yep, fibre to the box in the street, then 100 year old corroded copper to your premises.  ",2016-07-03 11:54:43+00:00,d4xksf5,7.0,t1_d4xhhxu,13449.0,AskReddit
989,A whole 20 mbps!,2016-07-03 11:52:24+00:00,d4xkqzk,5.0,t1_d4xe49n,23642.0,AskReddit
990,"who is that??

",2016-07-03 11:45:36+00:00,d4xkmv5,3.0,t1_d4xdkmh,24508.0,AskReddit
991,A Single Dissolution?,2016-07-03 11:36:26+00:00,d4xkhjv,3.0,t1_d4xjne1,3350.0,australia
992,"Nope, he was the first man on the moon (along with Neil), but the second to *walk* on it",2016-07-03 09:28:40+00:00,d4xio6v,2.0,t1_d4wr9ln,57967.0,pics
993,Is another election a possibility?  ,2016-07-03 05:30:13+00:00,d4xeen1,1.0,t3_4r0ewm,7599.0,australia
994,So what did Turnbull say in his speech ?,2016-07-03 03:11:30+00:00,d4xanzx,1.0,t3_4qzj1z,14327.0,australia
995,It was certainly frustrating but a wins a win ,2016-07-03 01:04:15+00:00,d4x6tnn,1.0,t3_4qxh2o,37173.0,AFL
996,He cost them the game. Seriously how can you pass the ball from 5m out instead of kicking the goal? ,2016-07-03 01:02:30+00:00,d4x6rp5,2.0,t1_d4w9i31,75127.0,AFL
997,What do you mean by gun... Pistol or rifle?,2016-07-03 00:56:50+00:00,d4x6lf4,1.0,t3_4qx6om,42028.0,melbourne
998,Fraudband,2016-07-02 09:23:43+00:00,d4wftr6,2.0,t1_d4wfrwl,217.0,australia
999,I've got a good feeling about this... Lots of swings to Labor,2016-07-02 09:08:35+00:00,d4wfltj,1.0,t3_4qwa1k,6894.0,australia
1000,And guessing,2016-07-02 08:50:59+00:00,d4wfcih,3.0,t1_d4wfbwu,68.0,australia
1001,Confusing isn't it? They are guessing basically ,2016-07-02 08:45:32+00:00,d4wf9kd,2.0,t1_d4wf705,286.0,australia
1002,What did she say?,2016-07-02 08:44:12+00:00,d4wf8w6,2.0,t1_d4wf1t4,756.0,australia
1003,No they haven't ,2016-07-02 08:41:33+00:00,d4wf7fo,2.0,t1_d4wf6l3,91.0,australia
1004,It does say seats won though...,2016-07-02 08:38:52+00:00,d4wf5xn,3.0,t1_d4wf44b,190.0,australia
1005,Small country seats apparently,2016-07-02 08:34:31+00:00,d4wf3gw,3.0,t1_d4wf2mf,87.0,australia
1006,How is ABC showing 14 seats to coalition already? Polls closed less than half an hour ago... ??,2016-07-02 08:28:55+00:00,d4wf0bi,1.0,t3_4qwa1k,4514.0,australia
1007,Was thinking the same.. I think they left one on the floor ,2016-07-02 08:19:13+00:00,d4weur6,2.0,t1_d4weqco,448.0,australia
1008,I was just reading left to right unfurling as I went and putting numbers in any boxes I liked as I came across them.  I noted ALP was on the far left of the ballot so they may do well in the Senate,2016-07-02 06:25:47+00:00,d4wcrwm,1.0,t3_4qv7vd,16558.0,australia
1009,"No, why would it?",2016-07-02 01:57:36+00:00,d4w5el6,8.0,t1_d4w42s5,2492.0,australia
1010,No I'll be pissed off if the Libs get back in ,2016-07-02 00:16:11+00:00,d4w25od,6.0,t1_d4w0wnp,2220.0,australia
1011,"That was just off the top of my head, feel free to google",2016-07-01 23:31:00+00:00,d4w0m1f,4.0,t1_d4w0fwr,278.0,australia
1012,That sounds like human meat,2016-07-01 23:28:47+00:00,d4w0j3b,2.0,t1_d4vt9ol,11059.0,Futurology
1013,"You don't even have to call it meat.. It's protein. So something like Growtein, Promeal, Promax etc might work",2016-07-01 23:28:02+00:00,d4w0i3k,1.0,t3_4qtp3c,12690.0,Futurology
1014,Expect for the Democratic ideal dating back 2500 years,2016-07-01 22:54:07+00:00,d4vza9z,2.0,t1_d4vvtmb,5419.0,australia
1015,"I like to browse on here http://propertykeyword.com/can.html
",2016-07-01 22:04:35+00:00,d4vxfl3,6.0,t1_d4vvhoi,2931.0,pics
1016,Sounds like a tragic freak accident,2016-06-30 23:49:13+00:00,d4uos1o,1.0,t3_4qnx44,10831.0,Futurology
1017,"The worst part is that if Turnbullshit gets back in, he's going to think he has a mandate to do whatever the hell he likes with Medicare",2016-06-30 23:45:44+00:00,d4uonei,1.0,t3_4qo7us,6993.0,australia
1018,I just discovered you can make games in html(5),2016-06-30 12:51:28+00:00,d4tvrx6,1.0,t3_4qiikx,49524.0,AskReddit
1019,"As an aside, why are those two countries not in the EU?",2016-06-29 21:29:10+00:00,d4t57gd,2.0,t1_d4sggmz,32048.0,worldnews
