,body,created,id,nest_level,parent_id,reply_delay,subreddit
0,Grundy's last second goal against the Tigers was pretty special.  I went to high five the guy sitting behind me (stranger) and ended up getting a hug LOL.  It was that kind of game,2016-11-22 06:05:53+00:00,daanygf,1.0,t3_5e8fxg,10658.0,AFL
1,Space is very cold..heat travels from hot to cold.  What's the problem?,2016-11-22 05:42:22+00:00,daanabe,2.0,t1_da9n08o,48273.0,Futurology
2,space is very cold,2016-11-22 05:36:56+00:00,daan4oc,3.0,t1_da9v82t,37937.0,Futurology
3,"&gt; This device claims to maintain constant acceleration at any velocity with just constant energy input

No-one has ever made that claim.  Since we have not yet put one in space, nobody knows if the acceleration will be constant, or reach a plateau like a car accelerator",2016-11-22 05:34:46+00:00,daan2d1,7.0,t1_daa74cm,23363.0,Futurology
4,So only deniers are allowed to be inflammatory.  Got it.,2016-11-22 01:14:15+00:00,daachjp,7.0,t1_daa4ys6,10533.0,EmDrive
5,Excuse me?,2016-11-21 22:14:39+00:00,daa4rsb,5.0,t1_daa1xv7,3456.0,EmDrive
6,"I have not seen anyone tearing the paper apart, apart from a few deniers on this forum",2016-11-21 20:08:49+00:00,da9yhmu,1.0,t3_5e3hxt,32686.0,EmDrive
7,"&gt; But it isn't a sphere and so your hypothesis falls at the first hurdle.

All physics involves approximations..",2016-11-21 20:04:39+00:00,da9ya82,11.0,t1_da9s63o,7245.0,EmDrive
8,LOL is this guy for real?,2016-11-21 20:02:26+00:00,da9y67u,3.0,t1_da9nr03,12526.0,EmDrive
9,"If you can't download it for whatever reason PM me and I'l send you a free copy, even after the sale has ended",2016-11-21 10:15:06+00:00,da9cssi,1.0,t3_5dx9ii,91337.0,eFreebies
10,PM me I'll send you a copy,2016-11-21 10:00:16+00:00,da9ck6v,2.0,t1_da9c1i6,1945.0,eFreebies
11,"&gt; It's not rocket science.

It kind of is",2016-11-21 09:59:30+00:00,da9cjs1,7.0,t1_da9c3n7,1679.0,EmDrive
12,What. The. Fuck.   How can you call a stadium ghmbaxyz whatever the fuck it is,2016-11-21 09:15:10+00:00,da9btt8,1.0,t3_5e21d4,19465.0,AFL
13,If you don't like his data maybe you should take it up with him?,2016-11-21 07:11:13+00:00,da99fn3,5.0,t1_da8zj9z,16971.0,EmDrive
14,You don't sound delighted ,2016-11-21 06:14:57+00:00,da9823p,5.0,t1_da8wn1l,17833.0,EmDrive
15,No he isn't.  How can he add to the paper if it's already been published?,2016-11-21 02:17:43+00:00,da8z2zt,3.0,t1_da8uzug,6447.0,EmDrive
16,Virtual particles have mass and inertia too,2016-11-20 19:34:10+00:00,da8hmu5,2.0,t1_da7hurh,73973.0,EmDrive
17,WTF is catsup? And what does it have to do with emdrive?,2016-11-20 19:32:58+00:00,da8hl41,2.0,t1_da7xrxz,45463.0,EmDrive
18,"&gt;In the paper they say there are no analytical solutions for a truncated cone. This is not true. It is workable, see Greg Egan's work. Yes, he is a sci-fi author but he also has a BSc in math. If he can work it out why can't White? Does he not remember how or is he genuinely ignorant of this? The former is more forgivable but he should have asked someone.

You can't attack a peer reviewed paper with non peer-reviewed sources...that's just lazy or desperate (or both)",2016-11-20 19:29:15+00:00,da8hg71,1.0,t3_5dvprz,65317.0,EmDrive
19,How about Mt Gambia?,2016-11-20 10:32:57+00:00,da81p5i,4.0,t1_da80yhh,2772.0,australia
20,This is way more powerful than a photon drive (flashlight),2016-11-20 07:16:59+00:00,da7y985,7.0,t1_da7lfg3,24071.0,Futurology
21,Enough to levitate an apple,2016-11-20 06:19:20+00:00,da7wxhu,5.0,t1_da7ad3g,37610.0,EmDrive
22,Battlefield Earth was pretty epic ,2016-11-20 03:34:34+00:00,da7rxmq,3.0,t1_da7ioa0,15109.0,books
23,Do the writers get a royalty?,2016-11-20 03:30:40+00:00,da7rswx,1.0,t3_5dqczj,90538.0,books
24,"and physicists are expert at what works in theory, with no practical aptitude",2016-11-20 02:06:59+00:00,da7orzm,7.0,t1_da7og8v,546.0,EmDrive
25,No,2016-11-19 21:39:01+00:00,da7enwm,6.0,t1_da79y3d,7018.0,EmDrive
26,Wow the deniers are getting really salty now that the world is catching on,2016-11-19 19:40:28+00:00,da79vsa,1.0,t3_5dsg5q,22095.0,EmDrive
27,Aren't you arguing from authority as well? (Newton),2016-11-19 19:39:17+00:00,da79u30,4.0,t1_da78rzx,1538.0,EmDrive
28,They're better,2016-11-19 19:37:00+00:00,da79qsi,5.0,t1_da78hrx,1820.0,EmDrive
29,Those people hate all study into emdrive and would not tolerate a space test...,2016-11-19 19:31:03+00:00,da79i1f,5.0,t1_da6tyws,31770.0,science
30,Was that published in a peer reviewed journal?,2016-11-19 19:28:20+00:00,da79dxi,6.0,t1_da6v1x1,27290.0,science
31,This was a replication of Shawyer's experiments,2016-11-19 19:23:28+00:00,da796lo,3.0,t1_da6vwsb,23962.0,science
32,How about a whole bank of them?,2016-11-19 10:41:36+00:00,da6tyxm,3.0,t1_da6ozvj,16663.0,Futurology
33,trying and failing,2016-11-19 10:25:30+00:00,da6tqh6,4.0,t1_da6rw7m,7011.0,Futurology
34,How is it legal to own a tank?,2016-11-19 08:01:32+00:00,da6rfhl,1.0,t3_5dpd5j,33499.0,australia
35,You think 12k a year if fine as everyone else?,2016-11-19 08:00:37+00:00,da6rex3,3.0,t1_da6r7vg,649.0,australia
36,Good for you!,2016-11-19 08:00:00+00:00,da6rej2,2.0,t1_da6qq3e,2224.0,australia
37,It basically takes money from investors ( who hoard it) and give it to consumers ( who spend it),2016-11-19 07:58:38+00:00,da6rdnh,4.0,t1_da6ns5q,9733.0,australia
38,Eliminate Centrelink,2016-11-19 07:56:25+00:00,da6rc86,2.0,t1_da6icxp,20125.0,australia
39,"Because it is not printing new money, it is redistributing existing money ",2016-11-19 07:55:35+00:00,da6rbo7,2.0,t1_da6oy7w,6816.0,australia
40,What an idiot,2016-11-19 07:48:38+00:00,da6r74v,1.0,t3_5drebs,2308.0,AFL
41,Why people go to these shit holes is beyond me,2016-11-19 07:44:24+00:00,da6r4f0,1.0,t3_5dpx1e,25591.0,worldnews
42,Then why is it still a Police Box?,2016-11-19 02:23:20+00:00,da6ifsm,17.0,t1_da6gxm4,2643.0,doctorwho
43,whatever happened to Three Body Problem?,2016-11-18 21:38:28+00:00,da67kv2,1.0,t3_5dms3n,24295.0,movies
44,I loved Tora Tora Tora when I was a kid,2016-11-18 21:37:24+00:00,da67j63,1.0,t3_5dlubf,38163.0,movies
45,The Longest Day,2016-11-18 21:36:51+00:00,da67ib0,1.0,t3_5dlubf,38130.0,movies
46,Dances With Wolves,2016-11-18 21:36:01+00:00,da67gwz,1.0,t3_5dmr47,24484.0,movies
47,Sweet! What is this film about I haven't heard of it ..?,2016-11-18 08:09:54+00:00,da5fcfm,1.0,t3_5dikoy,37321.0,movies
48,Finally some sense ,2016-11-17 23:09:46+00:00,da4w8sw,19.0,t1_da4vwyu,435.0,doctorwho
49,"I've already won idiot. When The Doctor is a woman, then you can say you've won.",2016-11-17 22:56:19+00:00,da4vmtg,17.0,t1_da4ub1t,1723.0,doctorwho
50,"Food, drink, family, friends, presents, and the festive spirit.  Seriously if Christmas didn't exist we'd have to invent it.    
Tim Minchin sums it up perfectly https://www.youtube.com/watch?v=fCNvZqpa-7Q
",2016-11-17 19:39:57+00:00,da4m38i,6.0,t1_da4jvrn,2682.0,atheism
51,No is the answer to that question,2016-11-17 19:37:35+00:00,da4lyxq,1.0,t3_5dg9ci,16229.0,atheism
52,Yay space race,2016-11-17 19:36:35+00:00,da4lx3y,1.0,t3_5df7h1,31259.0,worldnews
53,Not so. There are many many rules which have been established...the faulty chameleon circuit is one example,2016-11-17 19:33:51+00:00,da4ls7i,15.0,t1_da4i1ep,4546.0,doctorwho
54,I see no particles,2016-11-17 15:57:19+00:00,da4b4io,1.0,t3_5dfpns,9848.0,EmDrive
55,"I have no idea what the hell you are talking about.  What does UNIT have to do with anything?  If there ""no canon"" then the Tardis can be a fire hydrant and the Doctor can be a donkey.  Do you even know what canon means?",2016-11-17 15:37:01+00:00,da4a6pq,13.0,t1_da421qh,15912.0,doctorwho
56,Jack Nicholson glances at the camera in The Shining...i think just after the door chopping scene,2016-11-17 07:04:02+00:00,da3xgj3,1.0,t3_5de58d,6039.0,movies
57,album version:  https://www.youtube.com/watch?v=GZAlpS3e5C0,2016-11-17 05:46:32+00:00,da3vfb6,2.0,t1_da3ryyh,6199.0,australia
58,"That is Sergent Small, another Weddings Parties Anything song",2016-11-17 05:43:35+00:00,da3vc5i,2.0,t1_da3r3ya,7346.0,australia
59,The train full of workers is correct but I don't remember laughing children...?,2016-11-17 04:27:05+00:00,da3sur0,2.0,t1_da3rxwd,1477.0,australia
60,I love the pina colada ones but my family hate them,2016-11-17 04:25:17+00:00,da3ssfw,1.0,t3_5ddfo7,6462.0,australia
61,Seems I'm the only one that cares,2016-11-17 03:32:39+00:00,da3qrnu,11.0,t1_da3n529,5338.0,doctorwho
62,"Collingwood v Hawthorn.    
Collingwood v GWS",2016-11-17 01:55:42+00:00,da3mspz,1.0,t3_5db3dd,23844.0,AFL
63,"""Is it Grundy? It's Grundy!!!!""  I'm making a sign next time we play Richmond ",2016-11-17 01:54:02+00:00,da3mq65,3.0,t1_da3chi2,14031.0,AFL
64,"Oh no! You're one of those dickheads that think new Who is the be all and end all, and screw everything that came before.  The Doctor is male.  End of discussion",2016-11-17 01:45:54+00:00,da3mdto,11.0,t1_da3lxpv,646.0,doctorwho
65,Why is humanoid important but gender is not?,2016-11-16 23:51:22+00:00,da3hlo6,7.0,t1_da3gcf8,1735.0,doctorwho
66,"I would love to see a spin off show about a female time lord, with her own tardis ",2016-11-16 23:07:35+00:00,da3fofz,9.0,t1_da3cip6,4003.0,doctorwho
67,Only through 50 years of stories,2016-11-16 23:03:54+00:00,da3fiio,11.0,t1_da3fajy,292.0,doctorwho
68,Could the Doctor regenerate into a donkey? Or a Dalek?  If you're changing genders why not species as well?,2016-11-16 22:43:10+00:00,da3ejoq,5.0,t1_da2vw68,22569.0,doctorwho
69,Has the Doctor *ever* been a woman?  Time lords do not change gender.  Any deviation from that is merely a reboot of the canon and not to be taken seriously ,2016-11-16 22:34:11+00:00,da3e45x,9.0,t1_da3cip6,1999.0,doctorwho
70,Then they are not fit custodians of the Doctor Who universe,2016-11-16 21:57:50+00:00,da3cdbv,9.0,t1_da3cae0,102.0,doctorwho
71,"It's nothing to do with prejudice, it's about dramatic integrity",2016-11-16 21:57:22+00:00,da3cch3,7.0,t1_da335yv,11080.0,doctorwho
72,And it says they work from home ....?,2016-11-16 19:45:21+00:00,da35rq0,8.0,t1_da2qbwa,19467.0,EmDrive
73,Bollocks,2016-11-16 19:44:28+00:00,da35q47,5.0,t1_da2vw68,11847.0,doctorwho
74,"We never saw the regeneration, so ....",2016-11-16 19:44:14+00:00,da35pob,7.0,t1_da335yv,3092.0,doctorwho
75,According to the character being male ,2016-11-16 12:04:52+00:00,da2mf5c,5.0,t1_da2m3bl,1001.0,doctorwho
76,Can't they just fold already?,2016-11-16 08:28:22+00:00,da2imqg,1.0,t3_5d56ov,39678.0,AFL
77,"Yep, which rules her out",2016-11-16 06:48:12+00:00,da2gise,3.0,t1_da2fof2,2016.0,doctorwho
78,But the Doctor is not female ,2016-11-16 06:04:48+00:00,da2ferl,3.0,t1_da1lkly,40806.0,doctorwho
79,Jonathan Rhys Meyers,2016-11-16 06:01:31+00:00,da2fbhi,1.0,t3_5d3i5f,47769.0,doctorwho
80,She's a woman,2016-11-16 06:00:16+00:00,da2fa86,2.0,t1_da1giv2,46567.0,doctorwho
81,Er...Swindon is a woman,2016-11-16 05:58:45+00:00,da2f8p3,1.0,t3_5d3i5f,47603.0,doctorwho
82,"My parents music was Neil Young, Pink Floyd, Van Morrison and Arlo Guthrie.  The 70s was actually pretty cool for music",2016-11-16 05:48:35+00:00,da2eyaf,4.0,t1_da27j9k,11703.0,AskReddit
83,"&gt; The rest are engineers of one sort or the other and work from their homes (not in the lab.)

How can you possibly know this unless you are a work colleague..? ",2016-11-16 05:00:59+00:00,da2dh0q,6.0,t1_da1tc62,27689.0,EmDrive
84,Sorry I think it's Daryll Reynolds,2016-11-15 20:58:17+00:00,da1sa4i,1.0,t3_5d4juv,4751.0,c64
85,"Sorry, there are seven: Harold White, Paul March, James Lawrence, Jerry Vera, Andre Sylvester, David Brady, and Paul Bailey",2016-11-15 18:46:03+00:00,da1ln1c,4.0,t1_da18i19,17132.0,EmDrive
86,I still haven't seen it...will have to check if it's on Nefilx,2016-11-15 04:10:06+00:00,da0udoc,1.0,t3_5cvm02,57829.0,movies
87,It's the only way forward,2016-11-15 03:55:41+00:00,da0tszu,1.0,t3_5cv7ec,64958.0,worldnews
88,There are about six names on the paper,2016-11-15 03:51:25+00:00,da0tmvi,2.0,t1_da0cfoc,23378.0,EmDrive
89,I think they are doing that with the Cannae ,2016-11-14 22:12:10+00:00,da0ewcj,2.0,t1_da04h13,12617.0,EmDrive
90,Why minimal exposure to the sun? And stop using the word troll you sound like a toddler that has just learnt a new word,2016-11-14 22:01:24+00:00,da0eeaf,10.0,t1_da0e2p1,392.0,EmDrive
91,"If you can't understand that fuel is finite but electricity is renewable, then maybe you should go back to r/funnypics or wherever you came from",2016-11-14 21:44:40+00:00,da0dkt0,8.0,t1_da0a3ub,4171.0,EmDrive
92,LOl are you new here?,2016-11-14 20:08:48+00:00,da08s7j,6.0,t1_da06rew,2445.0,EmDrive
93,"Lol really? Electricity is fuel?  I thought it was energy, silly me",2016-11-14 19:25:43+00:00,da06n7y,4.0,t1_d9zsdiq,19079.0,EmDrive
94,he's a good actor,2016-11-14 04:57:30+00:00,d9zg7r0,,t1_d9w13jc,,StarWars
95,Not so.  Conventinal rockets run out of fuel.  Emdrive never runs out of fuel (as long as there's sunlight),2016-11-14 03:52:25+00:00,d9zdn31,2.0,t1_d9yerxc,50586.0,EmDrive
96,The estimates I've seen say between 30 - 60 days,2016-11-14 03:51:23+00:00,d9zdlk3,1.0,t3_5cp2c0,71075.0,EmDrive
97,It's just a strange theme...  How about Crucifixion St or Electrocution Road?,2016-11-14 03:40:21+00:00,d9zd5kr,4.0,t1_d9za8np,4152.0,australia
98,Which is why he was suspended for a year,2016-11-13 23:16:18+00:00,d9z21wo,12.0,t1_d9yzqdf,3231.0,AFL
99,"Cars I can understand, but guns?",2016-11-13 20:44:23+00:00,d9yv2fp,2.0,t1_d9yu608,1109.0,australia
100,I was surprised to see Armalite,2016-11-13 20:03:01+00:00,d9yt3ni,1.0,t3_5crp2q,540.0,australia
101,"If I was an athlete operating under a drug code, yes",2016-11-13 04:41:58+00:00,d9y2zyf,6.0,t1_d9y2asf,1090.0,AFL
102,"What is the vertical line just above the surface, far right of pic?  Maybe a meteorite?",2016-11-12 23:59:20+00:00,d9xrwdv,2.0,t1_d9xfvek,18525.0,space
103,"Yep, skeptical of bullshit",2016-11-12 23:04:34+00:00,d9xpr6j,10.0,t1_d9xp3iv,1046.0,AFL
104,Lol really? Nobody believes that,2016-11-12 21:58:07+00:00,d9xn8ug,8.0,t1_d9xn6b3,106.0,AFL
105,And *still* they lined up for injections.  Only Zhakarakis had the balls and the brains to say no.,2016-11-12 21:30:12+00:00,d9xm5j9,6.0,t1_d9xm2fg,136.0,AFL
106,"James Bond was a huge hit before the first movie came out, so I guess a bit like the Harry Potter films?",2016-11-12 21:23:36+00:00,d9xlwck,1.0,t3_5clxsa,7464.0,movies
107,I have never heard of this movie.  Looks like a decent cast though,2016-11-12 21:13:30+00:00,d9xli7u,1.0,t3_5cjfq6,49605.0,movies
108,Being gullible is no defense,2016-11-12 21:12:23+00:00,d9xlgm9,4.0,t1_d9x2xwp,33544.0,AFL
109,someone should calculate that,2016-11-12 21:10:59+00:00,d9xlen6,2.0,t1_d9x0y1t,41221.0,AFL
110,we have a lot of sun,2016-11-12 20:02:10+00:00,d9xip72,2.0,t1_d9xbg6w,10879.0,teslamotors
111,This is the old paper-mill redevelopment yeah?,2016-11-12 20:01:31+00:00,d9xio8w,1.0,t3_5cjpme,38549.0,teslamotors
112,It's impulse power,2016-11-12 19:27:46+00:00,d9xhc5q,1.0,t3_5cjko4,40017.0,EmDrive
113,How does that explain reverse thrust?  When cavity is turned around the thrust is always small end forward.  You're saying it's coincidence?,2016-11-12 19:26:17+00:00,d9xh9yr,8.0,t1_d9x1u39,31467.0,EmDrive
114,And how does this explain the reverse thrust?,2016-11-12 09:16:53+00:00,d9x0i8d,6.0,t1_d9x0bdd,704.0,EmDrive
115,He didn't care enough to find out,2016-11-12 09:15:33+00:00,d9x0hgx,2.0,t1_d9wxmhi,8901.0,AFL
116,Give up Hird you're just embarrassing yourself and Essendon,2016-11-12 09:14:09+00:00,d9x0gn8,1.0,t3_5cj6yb,11424.0,AFL
117,And then what?,2016-11-12 09:02:31+00:00,d9x09up,4.0,t1_d9wzjgi,2510.0,EmDrive
118,I just recently read this in Michael Palin's diaries.  Led Zeppelin also invested in it.,2016-11-12 08:56:06+00:00,d9x060v,1.0,t3_5ci5wj,26973.0,todayilearned
119,"Can you believe they kept shooting at each other that morning?  And yes, some soldiers died the morning of the 11th",2016-11-12 04:06:04+00:00,d9wt4so,1.0,t3_5ce0d3,60187.0,history
120,wtf,2016-11-12 03:58:15+00:00,d9wsvkv,1.0,t3_5cfh0e,40028.0,StarWars
121,This suggests to me that the microwaves or virtual particles or whatever's causing the effect are bouncing around in there long after the power is switched off.  Or the chamber is still resonating like a bell that has been struck,2016-11-11 23:48:17+00:00,d9wjijm,2.0,t1_d9vrxdv,38266.0,EmDrive
122,"How can you have a thermal effect in a vacuum, where there is no bouyancy?",2016-11-11 21:53:24+00:00,d9wes6r,2.0,t1_d9vuo8s,26367.0,EmDrive
123,"silent bicycles are a hazard to pedestrians, they can build up a lot of speed.  But that's what bells and horns are for",2016-11-11 19:27:00+00:00,d9w82bh,6.0,t1_d9w1vqm,7838.0,Futurology
124,so are bicycles,2016-11-11 16:29:28+00:00,d9vznkx,2.0,t1_d9vyaut,1761.0,Futurology
125,fake exhaust pipe,2016-11-11 16:27:59+00:00,d9vzl0d,2.0,t1_d9vwo0c,3873.0,Futurology
126,"I'm not so sure, hand drawn ads were still around in the 80's and we had decent photos in the papers by then",2016-11-11 16:15:22+00:00,d9vyzri,2.0,t1_d9vmhxc,27380.0,australia
127,I had a Golden Rough,2016-11-11 10:07:59+00:00,d9vo6pn,2.0,t1_d9v51r7,35172.0,australia
128,"They've changed.  They used to be foil wrapped in a paper sleeve, now they're just in plastic.  Disappointing ",2016-11-11 10:04:40+00:00,d9vo4mx,2.0,t1_d9va6vx,27811.0,australia
129,Bertie Beetle beats both,2016-11-11 10:01:55+00:00,d9vo2u5,1.0,t3_5cb4cn,38464.0,australia
130,The camera was invented ed in the 1800s,2016-11-11 09:48:41+00:00,d9vnu6i,2.0,t1_d9vla48,7497.0,australia
131,whoa,2016-11-11 06:58:52+00:00,d9vk6jw,1.0,t3_5c9uwp,40661.0,StarWars
132,Shawyer thinks so,2016-11-11 06:40:46+00:00,d9vjp7l,1.0,t3_5cc0ve,15641.0,EmDrive
133,About bloody time,2016-11-11 06:33:47+00:00,d9vjidv,1.0,t3_5ccjip,8409.0,AFL
134,The day is not complete unless you've kicked a burning terrorist in the balls,2016-11-10 19:19:49+00:00,d9uqd69,3.0,t1_d9ujrzq,7560.0,pics
135,It looks shit.  Should have gone with the traditional jumper,2016-11-10 08:37:06+00:00,d9u3oby,1.0,t3_5c6a1r,10213.0,AFL
136,Which one?,2016-11-10 06:32:21+00:00,d9u0qv7,3.0,t1_d9u0o7l,165.0,history
137,Who's that?,2016-11-10 05:51:03+00:00,d9tzjx5,1.0,t3_5c25ht,47079.0,pics
138,That says it all,2016-11-10 05:47:10+00:00,d9tzfne,1.0,t3_5c39qr,35810.0,pics
139,Why would they pay?  In what fantasy world would that happen?,2016-11-10 04:20:04+00:00,d9twfcr,1.0,t3_5c35ge,31799.0,worldnews
140,and Howe!!,2016-11-10 02:01:05+00:00,d9tqsrk,4.0,t1_d9sh81y,66695.0,AFL
141,"Why wouldn't they publish?  Why would EW stop pursuing emdrive?  This can only encourage *more* research, not less",2016-11-09 20:04:17+00:00,d9tafod,1.0,t3_5c29kd,10750.0,EmDrive
142,"November 11 in Australia ( 11/11) :

1880: Death of Ned Kelly    
1918: Armistice Day/Remembrance Day    
1975: Sacking of Prime Minister Whitlam    

",2016-11-09 19:53:07+00:00,d9t9v8o,1.0,t3_5c059n,36911.0,history
143,Yes and he has a star on the Walk of Fame!  That is how Harrison discovered him,2016-11-09 19:39:11+00:00,d9t95u6,2.0,t1_d9smwx9,34265.0,todayilearned
144,"Blinded, how?",2016-11-09 07:28:49+00:00,d9sh71w,1.0,t3_5bw3k1,35834.0,worldnews
145,Thanks a lot America.  Cunts,2016-11-09 07:22:36+00:00,d9sgy7t,1.0,t3_5byfnw,10069.0,worldnews
146,This has happened before...one of the early Star Trek movies (IV I think) has the same theme as Lord of the Rings (animated).  Both were by the same composer,2016-11-09 04:35:29+00:00,d9s93o9,1.0,t3_5btht3,50723.0,movies
147,Do 1's weigh more than 0's?,2016-11-09 04:30:22+00:00,d9s8ua3,1.0,t3_5buoi0,38724.0,todayilearned
148,"Nope, not infallible... I just have a whole lot more confidence in their abilities than some random on the Internet",2016-11-08 23:18:59+00:00,d9rtkr0,13.0,t1_d9rsmka,1226.0,EmDrive
149,What's it made of?,2016-11-08 19:59:18+00:00,d9rjj1r,2.0,t1_d9r6u2h,14448.0,EmDrive
150,LOL I have used that same quote in regards to emdrive,2016-11-08 19:58:05+00:00,d9rjgpa,1.0,t3_5bu8ld,12249.0,EmDrive
151,Will Hubble continue as well?,2016-11-08 19:39:30+00:00,d9rihov,1.0,t3_5bs47y,40295.0,worldnews
152,"Agreed, that's why it pisses me off so much when people like Crackpot think they know better than the scientists working on it.",2016-11-08 19:30:26+00:00,d9ri0n4,11.0,t1_d9rds63,4809.0,EmDrive
153,"He is not taking the right approach.  His approach is ridicule the people working on it and never let anyone even mention it again.  That is not science, that is some sort of religious fervour ",2016-11-08 19:23:23+00:00,d9rhnds,7.0,t1_d9qt70p,42042.0,EmDrive
154,The Germans are the best at that stuff,2016-11-08 19:12:04+00:00,d9rh23r,1.0,t3_5bsp52,27602.0,teslamotors
155,Why would a virtual particle be on-shell?,2016-11-08 10:51:28+00:00,d9qwn04,7.0,t1_d9qpq6f,19153.0,EmDrive
156,I don't think we can afford to be making approximations,2016-11-08 10:48:07+00:00,d9qwky2,9.0,t1_d9quq2v,6382.0,EmDrive
157,We both know that didn't happen,2016-11-08 10:36:31+00:00,d9qwdqz,16.0,t1_d9qwa6i,331.0,EmDrive
158,The front reminds me of a Predator helmet.  Badass,2016-11-08 07:57:37+00:00,d9qti94,1.0,t3_5bn8gl,54342.0,teslamotors
159,I'm not a fan of no dash... it means you have to look around to see your gauges ,2016-11-08 07:52:42+00:00,d9qtemd,1.0,t3_5bqzq5,15150.0,teslamotors
160,But it's clear you don;t understand either,2016-11-08 06:47:15+00:00,d9qrxhi,11.0,t1_d9qrqm5,445.0,EmDrive
161,I already told you I wasn't a physicist,2016-11-08 06:37:15+00:00,d9qro8s,9.0,t1_d9qrkig,240.0,EmDrive
162,"Well electrons are not massless, so that's their first mistake",2016-11-08 06:21:18+00:00,d9qr8tp,7.0,t1_d9qpq6f,2943.0,EmDrive
163,It's published next month,2016-11-08 05:36:46+00:00,d9qpvfh,2.0,t1_d9qppxp,284.0,Futurology
164,"&gt; For example the quantum vacuum virtual plasma is complete and utter nonsense. 

Just because *you* don't understand it doesn't mean it's nonsense",2016-11-08 05:15:57+00:00,d9qp6m8,5.0,t1_d9qhvmt,10575.0,EmDrive
165,"Clearly you didn't read it, yet you're trying to defend it.  Curious.",2016-11-08 05:11:01+00:00,d9qp0d3,14.0,t1_d9qogjp,926.0,EmDrive
166,please provide some sanity to r/emdrive,2016-11-08 04:45:48+00:00,d9qo2sk,2.0,t1_d9pz191,32741.0,Futurology
167,TIL Vin Diesel was in Saving Private Ryan,2016-11-08 03:42:42+00:00,d9qlkpz,1.0,t3_5bpr41,14593.0,todayilearned
168,"Did you even read his post? He wasn't making a comparison, he was saying this is how it should be done ",2016-11-08 02:36:59+00:00,d9qin4r,12.0,t1_d9pxy4r,26310.0,EmDrive
169,"What department is that, the Toy Department? What this does is guarantee the nay-sayers can't sweep it under the table like they want to, that funding will continue despite their bleatings",2016-11-08 00:48:09+00:00,d9qdu07,3.0,t1_d9qdhdv,491.0,EmDrive
170,Momentum is shifting. The general public are starting to belive,2016-11-08 00:06:42+00:00,d9qc21k,1.0,t3_5bpvci,305.0,EmDrive
171,Well I guess that depends on your industrial loyalties.,2016-11-07 21:42:48+00:00,d9q5btw,8.0,t1_d9q4jnv,901.0,EmDrive
172,"*everything* is based on physics, even cooking. I don't see theoretical breakdowns in cookbooks",2016-11-07 21:22:33+00:00,d9q49sq,6.0,t1_d9q3mkr,742.0,EmDrive
173,"Is AIAA one of these ""crackpot"" journals?  I think it's hilarious that anti-crew were saying the emdive is bullshit until it's peer-reviewed.  Now they are saying peer-review is bullshit. LOL",2016-11-07 20:15:45+00:00,d9q0u6c,10.0,t1_d9p93y7,50322.0,EmDrive
174," Because it's aerospace engineering, not theoretical physics",2016-11-07 10:25:12+00:00,d9pdx9j,4.0,t1_d9oaz31,62969.0,EmDrive
175,Looks stoopid ,2016-11-07 10:18:22+00:00,d9pdt7i,1.0,t3_5bk38w,23474.0,AFL
176,So it's ok to attack a peer reviewed paper by citing science fiction?  Fucking amateur hour round here,2016-11-07 03:56:30+00:00,d9p4ff2,10.0,t1_d9p3u9l,876.0,EmDrive
177,Shall we start with his reference to a science fiction writers blog? Lol,2016-11-07 03:40:03+00:00,d9p3rkh,8.0,t1_d9p3lc6,255.0,EmDrive
178,The AIAA.  How can you not know this? It's been in the news for months,2016-11-07 03:17:06+00:00,d9p2um7,14.0,t1_d9p1jp7,1868.0,EmDrive
179,"It has been accepted and is being published next month.,. How did you miss this vital fact?",2016-11-07 02:43:44+00:00,d9p1gay,12.0,t1_d9p1d1v,130.0,EmDrive
180,Er... have you been asleep the last 24 hours?,2016-11-07 02:33:38+00:00,d9p117d,10.0,t1_d9p0a8f,1034.0,EmDrive
181,You're the one spraying around ad hominems buddy.  Not intellectually honest eh?,2016-11-07 02:05:42+00:00,d9ozu2d,6.0,t1_d9oylyf,1731.0,EmDrive
182,"Oh? Has ""free energy"" and Cold Fusion appeared in a Peer Reviewed journal?",2016-11-07 02:03:42+00:00,d9ozr2a,8.0,t1_d9oyybn,1131.0,EmDrive
183,Maybe you should,2016-11-07 01:18:23+00:00,d9oxtk3,6.0,t1_d9o6pxf,36553.0,EmDrive
184,"Yep, I know waffle when I see it",2016-11-07 00:48:17+00:00,d9owkre,8.0,t1_d9ornzg,6786.0,EmDrive
185,So what are your qualifications? ,2016-11-06 23:26:12+00:00,d9ot0jz,8.0,t1_d9orqhv,1762.0,EmDrive
186,I'm not a physicist so  I don't pretend to be qualified to pick apart this stuff. Let's leave it to the Experts shall we?,2016-11-06 22:46:46+00:00,d9orad2,6.0,t1_d9op2nf,2924.0,EmDrive
187,Doubtful ,2016-11-06 22:38:15+00:00,d9oqwrj,6.0,t1_d9ole9x,6816.0,EmDrive
188,It is.,2016-11-06 20:02:18+00:00,d9ojcms,3.0,t1_d9o1hp4,29168.0,EmDrive
189,Random student on the Internet knows better than NASA scientists..   I think not ,2016-11-06 20:01:45+00:00,d9ojboc,4.0,t1_d9oevhe,5674.0,EmDrive
190,Blah blah blah,2016-11-06 10:16:28+00:00,d9nzxle,2.0,t1_d9nyssv,4450.0,EmDrive
191,because you are smarter than NASA scientists,2016-11-06 02:09:48+00:00,d9nnkqc,2.0,t1_d9nmdt7,1678.0,EmDrive
192,"I'm assuming because it was a leak of copyrighted material, etc",2016-11-06 00:34:34+00:00,d9njjau,2.0,t1_d9njawk,331.0,EmDrive
193,The cat has bolted and the horse is out of the bag,2016-11-06 00:25:47+00:00,d9nj61n,2.0,t1_d9nj0cq,226.0,EmDrive
194,"Well he got something wrong, I've seen calculations that put the trip to Mars at around 30 days",2016-11-05 22:13:13+00:00,d9nduos,4.0,t1_d9nd112,1230.0,Futurology
