,body,created,id,nest_level,parent_id,reply_delay,subreddit
2369,"It's Buster Keaton, which the clocktower sequence was inspired by",2015-10-24 10:12:14+00:00,cwb19dv,1.0,t3_3pvwy7,89818.0,bttf
2370,"I wonder if there's a market for a photographer photographer...you know, like getting a shot of you up a tree photographing the wedding couple",2015-10-23 03:25:01+00:00,cw9okyg,1.0,t3_3pu6f4,14205.0,pics
2371,"Is it possible to use background stars to observe a planet in transition that is not correctly aligned?  For example if we are orientated to the pole of a star which has a planet orbiting, could we see recurrent dimming of stars behind it?",2015-10-23 00:58:26+00:00,cw9jgr5,1.0,t3_3psmom,28243.0,IAmA
2372,Well played,2015-10-23 00:53:22+00:00,cw9ja8v,1.0,t3_3pszxm,22710.0,technology
2373,Really?  that's the best you could come up with?,2015-10-22 23:07:18+00:00,cw9fk9b,1.0,t3_3psof7,20887.0,pics
2374,Outstanding,2015-10-22 09:17:41+00:00,cw8nuxu,1.0,t3_3pkrdp,113571.0,StarWars
2375,"We would have picked Aish at 10 in the draft, instead we got Freeman.  This year we effectively traded out Freeman for Aish so a win for us too",2015-10-22 09:06:17+00:00,cw8nphp,6.0,t1_cw8lzh1,7171.0,AFL
2376,I'm not sure you can guarantee anything,2015-10-22 09:01:28+00:00,cw8nn6r,4.0,t1_cw8lo2w,8002.0,EmDrive
2377,because they measured something,2015-10-22 06:31:31+00:00,cw8lde3,2.0,t1_cw85zwg,29376.0,EmDrive
2378,I'd totally forgotten about that,2015-10-22 03:56:07+00:00,cw8hqsk,1.0,t3_3pkhj0,98510.0,movies
2379,"The ""Save The Clocktower"" lady.....my whole life I thought she was trying to get the clocktower restored, only tonight on my umpteeth re-watch I realise she is trying to *prevent* mayor Goldie Wilson from restoring it.",2015-10-22 03:39:28+00:00,cw8h7k0,1.0,t3_3pnmht,38085.0,movies
2380,as long as midfielders kick goals its all good,2015-10-22 02:26:03+00:00,cw8ep3b,2.0,t1_cw8e1i3,1102.0,AFL
2381,"Can't believe we got all the players we were chasing! (except maybe Danger, but that wasn't really serious)",2015-10-22 02:18:05+00:00,cw8eesw,1.0,t3_3ppscj,1991.0,AFL
2382,How would thermals affect a laser?  It was my understanding that the lasers were fixed so unless the thermals are reacting with the actual beam rather than the mountings I'm not sure how it could be thermal effects.,2015-10-21 23:29:41+00:00,cw88g2a,2.0,t1_cw856y6,5313.0,EmDrive
2383,"&gt; Obviously he's made a mistake in doing a line in front of a camera

Ah, so *that's* the mistake he was talking about.   ",2015-10-21 23:19:06+00:00,cw882w1,2.0,t1_cw876js,1516.0,AFL
2384,"Lol I actually said this to a girl!  First day of high school a girl comes up to me and says ""want a screw?""  Obviously I was supposed to say ""yeah!"" But instead I said ""not with you"".  She threw a screw at me and stormed off. I'd ruined her joke",2015-10-20 21:49:40+00:00,cw6wc2i,3.0,t1_cw6pii4,9468.0,AskReddit
2385,Ah that brought a tear to the eye ,2015-10-20 21:43:51+00:00,cw6w3q8,2.0,t1_cw6ssiq,4604.0,AFL
2386,"it looks like fan art, is that official?",2015-10-20 16:30:47+00:00,cw6imro,1.0,t3_3phzqr,5263.0,movies
2387,I guess Han shot first,2015-10-20 16:21:45+00:00,cw6i9ey,4.0,t1_cw6h2nx,1759.0,StarWars
2388,No belief without evidence.  And Han has seen a lot of evidence.,2015-10-20 16:19:27+00:00,cw6i62h,1.0,t3_3phh3d,12827.0,StarWars
2389,I can't imagine Harrison staying up for it.  In fact id love to see a Harrison Ford reaction video,2015-10-20 04:15:46+00:00,cw61o6j,1.0,t3_3pfyn7,3777.0,StarWars
2390,What ep is this?,2015-10-20 04:12:27+00:00,cw61klz,2.0,t1_cw5sx6l,13479.0,StarWars
2391,Nope,2015-10-20 04:05:24+00:00,cw61d12,4.0,t1_cw60s4m,1098.0,StarWars
2392,How can Maul come back?,2015-10-20 03:45:50+00:00,cw60qml,2.0,t1_cw5xo9a,4845.0,StarWars
2393,Explain,2015-10-20 03:40:41+00:00,cw60kld,1.0,t3_3pet4z,19672.0,Showerthoughts
2394,Portal 2 anyone?,2015-10-20 03:33:52+00:00,cw60c6t,2.0,t1_cw5xqee,4043.0,StarWars
2395,http://img2.wikia.nocookie.net/__cb20080317203541/starwars/images/a/a9/GrizzFrix.jpg,2015-10-20 03:30:25+00:00,cw607vp,4.0,t1_cw5xg55,4237.0,StarWars
2396,The Force Awakens book?,2015-10-20 03:25:45+00:00,cw601u1,5.0,t1_cw5ztky,362.0,StarWars
2397,Her husband? where did you get that from?,2015-10-20 03:18:11+00:00,cw5zrg7,3.0,t1_cw5xgvh,3476.0,StarWars
2398,Disappointed there was no Luke,2015-10-20 02:42:58+00:00,cw5ye92,1.0,t3_3pfq9g,1835.0,StarWars
2399,The walking driod outside the temple reminds me of Portal 2,2015-10-20 02:22:13+00:00,cw5xjw8,1.0,t3_3pfpoz,810.0,StarWars
2400,No Luke....  :(,2015-10-20 02:20:12+00:00,cw5xgs6,1.0,t3_3pfpoz,689.0,StarWars
2401,Whoa sounds like The Force/Jedi have become urban legends,2015-10-20 02:18:48+00:00,cw5xem6,1.0,t3_3pfq9s,383.0,StarWars
2402,Omg worst game ever.  Cheering for the clock  here....it's like sitting in a traffic jam inching forward every few minutes,2015-10-20 02:02:11+00:00,cw5wp8r,1.0,t3_3pfaqt,6198.0,StarWars
2403,"If those of you watching the game get an ad break check this out    
https://www.youtube.com/watch?v=8lrY81Zmnuc&amp;index=1    
(football related not Star Wars related)",2015-10-20 00:43:25+00:00,cw5titf,1.0,t3_3pfaqt,1472.0,StarWars
2404,How long til half time?,2015-10-20 00:40:55+00:00,cw5tf6p,1.0,t3_3pfaqt,1322.0,StarWars
2405,exactly my point,2015-10-20 00:40:01+00:00,cw5tdxg,3.0,t1_cw5sm9e,1206.0,StarWars
2406,Don't worry I'm not a big fan of churches either.,2015-10-19 22:12:30+00:00,cw5o3cq,4.0,t1_cw5iyps,7903.0,australia
2407,"""Can't say how...""  LOL I assume someone at Lucasfilm showed it to him.  Unless he somehow pirated it",2015-10-19 22:11:30+00:00,cw5o20k,1.0,t3_3pdjs3,17644.0,StarWars
2408,And give the money directly to NASA,2015-10-19 21:13:06+00:00,cw5luf1,1.0,t3_3pcdym,32864.0,atheism
2409,Does it get quite when it snows? I imagine that would be quite eerie ,2015-10-19 21:11:31+00:00,cw5ls6r,1.0,t3_3pcn7z,27807.0,todayilearned
2410,I did.  It's just pages of gibberish with my one phrase on an otherwise blank page.   I'm calling shennaigans,2015-10-19 10:43:47+00:00,cw50obq,3.0,t1_cw50l3g,383.0,Futurology
2411,"Ben Ken for Howe, and basically pick 68 for Seedsman.  Pick 68.  That sucks.  We'd better land Aish and Trelore after this",2015-10-19 07:48:24+00:00,cw4yclc,1.0,t3_3pbjj7,7303.0,AFL
2412,"&gt; the problem is the strawman being perpetuated by both sides: fools who believe all Muslim's secretly follow an interpretation akin to Al-Qaeda and fools who label legitimate criticism of Islamic doctrine and beliefs as bigotry (influenced by what I like to call Islamaphobia-phobia)

Hit the nail on the head.  In the Bendigo mosque debate both sides are too stupid to realise that Islam is not a race.  There are legitimate concerns, but the idiots who are protesting would not know about them",2015-10-19 05:47:51+00:00,cw4wakp,2.0,t1_cw4t29j,7458.0,australia
2413,Why do you find it disturbing? ,2015-10-19 05:35:54+00:00,cw4w1mm,2.0,t1_cw4pkfk,12373.0,australia
2414,Gibberish.  it would be much more entertaining if they used random assortments of English words.,2015-10-19 03:47:21+00:00,cw4t6ob,1.0,t3_3pa1a9,20258.0,Futurology
2415,"He was at his second club, and didn't really make it at either.  I don't think you can blame Buckley for that.",2015-10-19 02:36:54+00:00,cw4qldc,2.0,t1_cw4pc3m,1984.0,AFL
2416,I don't see how they could miss finals next year,2015-10-19 02:35:14+00:00,cw4qj52,1.0,t3_3papf2,4706.0,AFL
2417,I wish they had tours of the dirigible docking station,2015-10-19 01:18:57+00:00,cw4nkis,1.0,t3_3p9wds,13537.0,todayilearned
2418,"That was awesome, great find!",2015-10-18 23:39:18+00:00,cw4jvqk,1.0,t3_3p5eed,98500.0,AFL
2419,bollocks,2015-10-18 23:31:05+00:00,cw4jkuv,1.0,t3_3pa3uw,3756.0,AFL
2420,Note Finn's grip on the lightsaber...like he knows how to twirl it,2015-10-18 22:57:55+00:00,cw4icih,1.0,t3_3p8oif,23762.0,StarWars
2421,Looks like the same old logo on the poster,2015-10-18 22:56:17+00:00,cw4iad0,4.0,t1_cw3qfzh,62393.0,StarWars
2422,"There is no such thing as a fake review as all reviews are opinion only.  If amazon has a problem it should correct it's review system, not sue people.  If they weighted star ratings based on sales it would go a long way to fixing a broken system.",2015-10-18 22:50:53+00:00,cw4i2yd,1.0,t3_3p7l5p,48688.0,technology
2423,start a punk band,2015-10-18 22:45:56+00:00,cw4hwdk,2.0,t1_cw3vmq2,39811.0,AskReddit
2424,Life,2015-10-18 22:44:20+00:00,cw4hu9o,1.0,t3_3p7ti1,40611.0,AskReddit
2425,Note Finn's hand positioning in the [Wide Poster](http://i.imgur.com/DuTEfgb.jpg). (which is obscured in the regular version).  That is no amateur ,2015-10-18 22:38:37+00:00,cw4hmrd,1.0,t3_3p8lnv,23891.0,movies
2426,Ah but the trench has a shield protecting it this time,2015-10-18 22:35:00+00:00,cw4hhzi,2.0,t1_cw42atm,22949.0,movies
2427,What is that little thing next to R2?,2015-10-18 22:30:36+00:00,cw4hc2o,3.0,t1_cw44f32,19310.0,movies
2428,I don't see any Luke,2015-10-18 22:28:35+00:00,cw4h9eh,1.0,t3_3p8lnv,23289.0,movies
2429,I assume the reason they are so expensive is because they are so rare,2015-10-18 01:22:09+00:00,cw3j8yv,3.0,t1_cw37dow,21210.0,worldnews
2430,Wouldn't that indicate the ban is working?  How is this a bad thing?,2015-10-17 19:20:26+00:00,cw3741h,1.0,t3_3p3lee,30338.0,worldnews
2431,"What's this about an ""official"" logo? So the logo on all the merch was not official?",2015-10-17 09:46:29+00:00,cw2t538,1.0,t3_3p1n1h,41924.0,StarWars
2432,Boo Hoo,2015-10-17 07:36:04+00:00,cw2rj57,1.0,t3_3p07mh,55205.0,worldnews
2433,She was cute as anything in Heathers,2015-10-17 07:15:31+00:00,cw2r8r8,2.0,t1_cw20j84,51588.0,movies
2434,LOL it became ok after 4 months,2015-10-17 07:13:29+00:00,cw2r7o7,3.0,t1_cw2f2fc,28623.0,movies
2435,I somehow missed that.. BRB,2015-10-17 07:10:47+00:00,cw2r68q,3.0,t1_cw28w6e,38922.0,movies
2436,I had a thing for Elisabeth Shue from Karate Kid,2015-10-17 07:09:18+00:00,cw2r5ib,1.0,t3_3p0b90,52207.0,movies
2437,Max you should put some football in your novels....how about a future where Aussie Rules has surpassed soccer as the worlds most popular game?  I'd read it,2015-10-17 04:43:11+00:00,cw2oi7l,3.0,t1_cw2c60c,24820.0,books
2438,"I love Company too, the idea of a company that no one knows what they do just amuses me.  Sort of like Renholme Industries I guess",2015-10-17 04:34:38+00:00,cw2oayp,2.0,t1_cw29bbe,28916.0,books
2439,No,2015-10-16 02:36:44+00:00,cw1ffm9,1.0,t3_3owsga,17943.0,space
2440,Given that solar collectors are generally silica based that would make it a Glass Onion,2015-10-15 23:51:23+00:00,cw19k7k,3.0,t1_cw0q21w,29403.0,askscience
2441,"Imagine Earth's asteroid belt, with the asteroids all within a kilometer reach of each other, in a sphere around the sun instead of a ring.  I'm not sure even that would account for 22% of the light.    
EDIT: in reality the asteroids are about 1 million km from each other",2015-10-15 23:28:30+00:00,cw18sm1,10.0,t1_cw0z2ff,15052.0,askscience
2442,Are you 5?,2015-10-15 22:40:44+00:00,cw176rm,2.0,t1_cw13iu0,5872.0,todayilearned
2443,Now witness the power of this fully operational Dyson Sphere!,2015-10-15 08:49:01+00:00,cw0gbfx,5.0,t1_cw0ccd8,13660.0,Futurology
2444,Dark matter,2015-10-15 08:47:27+00:00,cw0gapv,5.0,t1_cw0d1x5,11712.0,Futurology
2445,What have they actually found?  Is it like a Dyson Ring or something?,2015-10-15 05:03:26+00:00,cw0ce8y,1.0,t3_3oszaz,10425.0,Futurology
2446,He won the Anzac medal this year,2015-10-15 04:54:56+00:00,cw0c6pn,2.0,t1_cw06llo,10636.0,AFL
2447,Turns out I did! thaks,2015-10-15 03:33:23+00:00,cw09wh1,2.0,t1_cw08rpr,2094.0,EliteDangerous
2448,3 is clearly the best,2015-10-15 00:38:58+00:00,cw03qyy,2.0,t1_cw02vsh,1376.0,AFL
2449,Wonderful!  But what is the ceramic plate for..?,2015-10-15 00:20:56+00:00,cw032e1,1.0,t3_3osasg,4638.0,EmDrive
2450,"&gt; The emdrive doesn't produce thrust because it's just an ordinary microwave cavity.

And yet, it moves",2015-10-14 09:43:29+00:00,cvz8gwt,3.0,t1_cvy7j5z,65663.0,EmDrive
2451,Go read Machine Man by Max Barry.  A guy does exactly that ,2015-10-14 04:15:45+00:00,cvz2hsi,1.0,t3_3omcwy,33712.0,Showerthoughts
2452,And who is Brez?,2015-10-14 01:34:19+00:00,cvywfkc,3.0,t1_cvypa0h,11114.0,StarWars
2453,Will it be a full length trailer this time?,2015-10-14 01:31:09+00:00,cvywara,1.0,t3_3omj1g,21454.0,StarWars
2454,We once did it with seeds attached,2015-10-13 03:17:20+00:00,cvxrcl1,4.0,t1_cvxito5,13423.0,pics
2455,Vader! Release him!,2015-10-13 01:46:05+00:00,cvxnw4n,1.0,t3_3oha0f,27474.0,StarWars
2456,So it's basically the Wolftone's *Streets of New York* with a female protagonist ,2015-10-13 01:35:38+00:00,cvxnhdi,1.0,t3_3ogvm3,32576.0,movies
2457,Gotta get out there and find 'em!,2015-10-13 00:17:35+00:00,cvxkfn4,2.0,t1_cvwuanp,42541.0,AFL
2458,Would be good to have a 'Games Played' column,2015-10-13 00:10:36+00:00,cvxk61r,1.0,t3_3oi20v,10832.0,AFL
2459,Wait...so you're saying the capital of Kansas is not Kansas City?,2015-10-12 22:28:36+00:00,cvxgew7,2.0,t1_cvx06w8,23971.0,AskReddit
2460,"There's a footballer called ""Mundy"", and whenever I'm watching a game with my son I slip in a ""Tuesday"" joke",2015-10-12 22:17:04+00:00,cvxfz1u,3.0,t1_cvx2bnt,19913.0,AskReddit
2461,I'm using that,2015-10-12 22:13:54+00:00,cvxfulb,2.0,t1_cvwyfzy,26020.0,AskReddit
2462,A box as in...a trade,2015-10-12 22:12:16+00:00,cvxfsbr,3.0,t1_cvx1mca,20711.0,AskReddit
2463,Final trailer?  We haven't seen a first trailer yet!  Just a couple of teasers,2015-10-12 19:36:45+00:00,cvx9e6q,1.0,t3_3ofvrk,28584.0,StarWars
2464,Yep that is messed up.,2015-10-12 19:32:34+00:00,cvx97s3,7.0,t1_cvwzn84,14303.0,atheism
2465,"Nice Straw Man dude.  All I'm saying you can't just turn a blind eye because it's ""culture"".  Do you disagree?",2015-10-12 19:31:44+00:00,cvx96jg,3.0,t1_cvwyeu1,16345.0,atheism
2466,I thought you were letting Aish walk for free?,2015-10-12 09:47:54+00:00,cvwrtdm,2.0,t1_cvwput0,8406.0,AFL
2467,Most of the time they don't even realize what they are doing is terrible.  Take circumcision for instance.  Religion is a powerful blinder.,2015-10-12 08:11:27+00:00,cvwqijo,5.0,t1_cvwnitv,9950.0,atheism
2468,"He's not wrong.  If culture is used as shield to commit atrocities, screw that culture",2015-10-12 08:09:00+00:00,cvwqhaz,1.0,t3_3odgfv,39796.0,atheism
2469,"&gt; People are going to be super shitty when Hawthorn land a top 10 pick as part of the last minute trade that gets Aish to Collingwood

what did you have in mind?",2015-10-12 02:55:19+00:00,cvwj9ex,2.0,t1_cvwhbkk,3463.0,AFL
2470,don't you get a pension or something for being ex-military?,2015-10-12 02:41:46+00:00,cvwitbt,4.0,t1_cvwg7z0,4573.0,AskReddit
2471,"Awesome news!  but where are your results?    
EDIT: I see they are in the other thread.",2015-10-11 22:40:05+00:00,cvwatqg,1.0,t3_3odlez,3384.0,EmDrive
2472,"Well he didn't say it *was* Mars Direct, just that it was based on it.  ie. a starting point",2015-10-11 21:57:13+00:00,cvw9aws,3.0,t1_cvvnrwe,46695.0,space
2473,Andy Weir has stated that his Ares missions are based on Mars Direct,2015-10-11 02:47:32+00:00,cvvfn58,1.0,t3_3oa3t8,7436.0,space
2474,I thought it covered all that?  You're saying he was worse than the movie showed?,2015-10-10 22:39:22+00:00,cvv7rvd,6.0,t1_cvuwqnz,20294.0,movies
2475,"I tried to read Mr Mercedes, but I can't stand present-tense so I gave up pretty quickly.  Same with SnowCrash.",2015-10-10 22:19:22+00:00,cvv74mi,1.0,t3_3o8dk9,21202.0,books
2476,Thank you for your cooperation....goodnight.,2015-10-10 22:14:20+00:00,cvv6ym9,1.0,t3_3o7u94,31059.0,technology
2477,Really? I thought it was pretty harsh!  ,2015-10-10 21:11:22+00:00,cvv4y36,6.0,t1_cvv0r99,7692.0,movies
2478,It was in the Mad Magazine at the time some maybe that's where they recollect it from,2015-10-10 14:25:01+00:00,cvus5ub,2.0,t1_cvudxch,46384.0,movies
2479,I don't get the hate for that movie,2015-10-10 14:19:13+00:00,cvus0wc,4.0,t1_cvu8jnr,56367.0,movies
2480,I'm not buying Fassbender as Jobs,2015-10-10 14:13:17+00:00,cvurvqy,1.0,t3_3o49xb,77575.0,movies
2481,what about match payments?,2015-10-10 14:05:43+00:00,cvurpbs,3.0,t1_cvur867,1206.0,AFL
2482,So this isn't Rome Sweet Rome with another title?,2015-10-10 01:05:52+00:00,cvud59s,1.0,t3_3o3wbz,36214.0,movies
2483,He used satellite imagery to find landmarks he remembered as a child,2015-10-09 10:13:30+00:00,cvtjjxm,2.0,t1_cvth98p,10088.0,todayilearned
2484,Can not wait to see this one,2015-10-09 06:53:45+00:00,cvtgqjv,1.0,t3_3o1p7r,19604.0,EmDrive
2485,Good so far.  But jumping from pseudocode directly to C was a bit of a leap,2015-10-09 06:38:26+00:00,cvtggjy,7.0,t1_cvsr1f9,44475.0,todayilearned
2486,I was thinking he sounds a bit Kiwi actually,2015-10-09 06:32:24+00:00,cvtgcjj,3.0,t1_cvsniap,49209.0,todayilearned
2487,who's that?,2015-10-09 03:10:21+00:00,cvtb8fx,3.0,t1_cvt84ky,5170.0,pics
2488,worst line ever,2015-10-09 03:08:53+00:00,cvtb6rb,4.0,t1_cvt8qda,4151.0,pics
2489,I read it as Albuquerque Eyes ,2015-10-09 03:07:47+00:00,cvtb5f8,1.0,t3_3o14nj,15866.0,pics
2490,Maybe you should ask yourself why players want to leave?,2015-10-09 00:46:02+00:00,cvt5zhb,2.0,t1_cvt4z4p,1707.0,AFL
2491,"He lived in a small village and was uneducated, so no he didn't know.",2015-10-09 00:14:29+00:00,cvt4v8d,2.0,t1_cvt34vn,3029.0,todayilearned
2492,Quick lock the doors they're trying to escape!,2015-10-08 22:52:41+00:00,cvt21ye,2.0,t1_cvs8jrq,58869.0,AFL
2493,attitude,2015-10-08 22:47:32+00:00,cvt1vj5,2.0,t1_cvs85n5,59820.0,AFL
2494,I could live with that.  A 1yr contract at Carlton then on to the Pies.,2015-10-08 22:42:46+00:00,cvt1pky,10.0,t1_cvsdac7,39271.0,AFL
2495,Clubs are going to just stop trading with you,2015-10-08 22:40:43+00:00,cvt1mzj,3.0,t1_cvs7pir,60765.0,AFL
2496,Stop being such a crap club?  Then I'm sure a few might stay.,2015-10-08 22:36:16+00:00,cvt1h9y,3.0,t1_cvscf77,41879.0,AFL
2497,"&gt; Ahh yes the ever solid moral and ethical compass of James Hird.

Ok let's use the words of Eddie then.  They are a bunch of Campaigners",2015-10-08 22:31:59+00:00,cvt1bpg,2.0,t1_cvt10k6,510.0,AFL
2498,It's not like Collingwood is getting Aish for free either (unless he goes in the draft),2015-10-08 22:30:42+00:00,cvt19yg,2.0,t1_cvt152t,224.0,AFL
2499,What the hell is Coke day?,2015-10-08 22:21:08+00:00,cvt0xf2,1.0,t3_3nzcgi,25269.0,todayilearned
2500,Can you elaborate?,2015-10-08 21:34:53+00:00,cvsz6ao,2.0,t1_cvsz1n5,193.0,todayilearned
2501,I would argue that they enhance the view,2015-10-08 19:54:26+00:00,cvsv1mj,1.0,t3_3nyxm4,22979.0,worldnews
2502,"I wish I worked in film marketing, but sadly no.  I literally learnt this today from the online Harvard CS50 course    
https://youtu.be/B5oR3KmcCng?t=2963",2015-10-08 17:12:28+00:00,cvsocir,5.0,t1_cvsktoy,5176.0,todayilearned
2503,He didn't know the name of his village,2015-10-08 11:10:19+00:00,cvscm9v,2.0,t1_cvsck9m,211.0,todayilearned
2504,There's no Disney logo before Miramax films either,2015-10-08 07:52:38+00:00,cvs9v1d,2.0,t1_cvs9p0p,693.0,StarWars
2505,"I just finished Week 1 of Harvard's CS50 course.  Not sure if watching a lecture or a rock concert.  Anyway, do I have to register a student No. with github and all that jazz or am I just fine to keep watching videos through edX?",2015-10-08 05:22:11+00:00,cvs75fq,1.0,t3_3net0p,356510.0,learnprogramming
2506,nope,2015-10-07 19:22:50+00:00,cvrm6ki,3.0,t1_cvr5oez,27909.0,australia
2507,thanks asswipe I'll take it from here,2015-10-07 19:22:29+00:00,cvrm617,7.0,t1_cvqplmn,70099.0,worldnews
2508,My guess is the MCT which was supposed to be revealed later this year,2015-10-07 02:01:33+00:00,cvqu150,1.0,t3_3ns5p1,3524.0,EmDrive
2509,That is why I never buy it.  Always go Kellogg's or Uncle Toby's ,2015-10-07 00:49:16+00:00,cvqrj3i,1.0,t3_3np16d,47731.0,australia
2510,Flickr is not a link dumass. Learn what a link is.,2015-10-06 23:40:21+00:00,cvqp4v1,5.0,t1_cvqlo3w,5964.0,worldnews
2511,How do you get jobs without interviews?,2015-10-06 21:45:55+00:00,cvql3hb,1.0,t3_3nqlvg,11595.0,learnprogramming
2512,"Read the article, did not see a link. So I guess you're the dummy!",2015-10-06 21:06:12+00:00,cvqjk4r,3.0,t1_cvq2nuw,25479.0,worldnews
2513,He was better than Rioli but never got the credit,2015-10-06 11:37:16+00:00,cvpz1vu,1.0,t3_3nof4t,16918.0,AFL
2514,a link would be nice,2015-10-06 06:53:40+00:00,cvpuzb3,1.0,t3_3nlput,45657.0,worldnews
2515,Should have parachuted in a company of troops to hold and protect the ruins as a matter of urgency ,2015-10-06 04:08:36+00:00,cvprev9,1.0,t3_3nl5cc,44165.0,pics
2516,but only on audio :(,2015-10-06 03:53:23+00:00,cvpqy04,1.0,t3_3nk071,67047.0,doctorwho
2517,"Ah I see, thanks.  Nomenclature is a bit misleading ",2015-10-06 01:12:37+00:00,cvpl9dq,3.0,t1_cvpl0zc,387.0,EmDrive
2518,I'd like someone to bring me a tray of assorted candies and chocolates,2015-10-05 23:05:42+00:00,cvpgw14,1.0,t3_3nkq2t,32987.0,movies
2519,what are the obvious reasons?,2015-10-05 23:00:58+00:00,cvpgq6b,3.0,t1_cvp12k5,23957.0,movies
2520,what a butthead,2015-10-05 23:00:27+00:00,cvpgpjh,3.0,t1_cvp45w1,19281.0,movies
2521,There is a secret cabal of wheelchair bound scientists engineering a zombie outbreak,2015-10-05 20:28:32+00:00,cvpb0ib,1.0,t3_3nk8b7,33933.0,Showerthoughts
2522,"I really want to market a drug called Placebo, which would just be sugar pills. no one could claim it didn't work",2015-10-05 20:22:43+00:00,cvparsx,1.0,t3_3nkds9,29812.0,Showerthoughts
2523,That is so good.  A shame it didn't win.,2015-10-05 05:31:45+00:00,cvonmtw,1.0,t3_3ni7eh,24254.0,todayilearned
2524,https://theinnergent.files.wordpress.com/2014/10/jens-feet-it-crowd.png,2015-10-05 03:50:26+00:00,cvol0g9,1.0,t3_3ni8s4,17485.0,pics
2525,"LOL ""rock or something""   :)",2015-10-05 03:47:35+00:00,cvokxb5,1.0,t3_3ni1fp,20692.0,pics
2526,Great film too.,2015-10-05 03:43:17+00:00,cvokse3,1.0,t3_3nhabd,32244.0,movies
2527,well he did have to sell his castle,2015-10-05 03:41:01+00:00,cvokpmj,4.0,t1_cvoh6z3,6392.0,movies
2528,Not allowed?  So he isn't all-powerful anymore?,2015-10-05 02:10:50+00:00,cvohqgo,1.0,t3_3nguzj,33503.0,atheism
2529,"I see your point but it would totally be voluntary, more of a ""hey let's go get scanned!"" rather than ""Damn it's my turn to get scanned now how can I escape..""",2015-10-05 00:52:42+00:00,cvof51z,4.0,t1_cvodtsn,2404.0,weddingplanning
2530,it would take about 2 minutes per scan,2015-10-05 00:51:30+00:00,cvof3o3,2.0,t1_cvoekic,989.0,weddingplanning
2531,"Interesting, thanks.  I thought of it more as a fun thing than a formal thing, like a photobooth where you get people holding bottles and pulling faces etc.",2015-10-05 00:03:21+00:00,cvodj2d,2.0,t1_cvoda4u,468.0,weddingplanning
2532,"yeah it was about 2 seconds of screen time (oh look, a baby!)",2015-10-04 23:41:55+00:00,cvoctvg,8.0,t1_cvocr9g,130.0,movies
2533,unless you were drunk yesterday,2015-10-04 23:10:49+00:00,cvobqnq,4.0,t1_cvoaent,2223.0,AskReddit
2534,"EmDrive. Hardly anyone knows anything about it, but if it pans out it will change the course of history.  And there have been some exciting results recently",2015-10-04 11:22:27+00:00,cvno429,1.0,t3_3neil9,38564.0,AskReddit
2535,Are you supposed to choose one per subject or do them all?,2015-10-04 10:14:31+00:00,cvnn7ys,1.0,t3_3net0p,28450.0,learnprogramming
2536,Sorry I don't,2015-10-04 07:31:19+00:00,cvnl0wi,5.0,t1_cvn317v,39264.0,movies
2537,"I just thought of a decent sized plot-hole.  They should have waited out the storm like Watney suggested, if the MAV tipped, they could all travel to the other MAV.  (Or maybe the rover was not big enough for all of them?)",2015-10-04 03:08:44+00:00,cvnf85d,1.0,t3_3n6gji,177058.0,movies
2538,"I quite like this one:  http://www.nasa.gov/images/content/610210main_apollo17_1600_946-710.jpg
",2015-10-04 03:00:52+00:00,cvnezwp,1.0,t3_3ncsmm,38738.0,space
2539,Well done!  Nice to see a control and inverted tests as well.   Excellent results.,2015-10-04 02:09:28+00:00,cvndhr4,1.0,t3_3ne6jq,11827.0,EmDrive
2540,Butcher's apostrophe,2015-10-03 10:30:32+00:00,cvmms99,1.0,t3_3n82ep,76090.0,AskReddit
2541,Looks like Cloke went pretty close.....how do they measure on water anyway?,2015-10-03 10:25:37+00:00,cvmmq9t,1.0,t3_3nbkny,11267.0,AFL
2542,That was his baby? holy crap I totally missed that,2015-10-03 09:08:49+00:00,cvmlun6,6.0,t1_cvltada,60289.0,movies
2543,"I love the *Starman* sequence, best montage I've seen in years",2015-10-03 09:06:39+00:00,cvmltqc,2.0,t1_cvlbdx1,107662.0,movies
2544,The blond girl was good too,2015-10-03 09:04:25+00:00,cvmlstw,3.0,t1_cvlvfdo,56980.0,movies
2545,"It wasn't terror before liftoff, it was relief at finally being able to talk to another human being.  There was an interview with Matt Damon about this scene, the tears were unscripted..they just flowed ",2015-10-03 09:01:30+00:00,cvmlrnr,3.0,t1_cvlueqe,58309.0,movies
2546,"hmm not sure if he counts as ""big""",2015-10-03 01:24:39+00:00,cvmcm11,3.0,t1_cvmcjj8,154.0,AskReddit
2547,Where do you get the apple?,2015-10-02 17:40:46+00:00,cvlwhgi,4.0,t1_cvl2m6x,67516.0,EmDrive
2548,Have there been any?,2015-10-02 17:34:12+00:00,cvlw7qn,1.0,t3_3n8rd8,3740.0,EmDrive
2549,2d.  3d belongs in the '80s,2015-10-02 02:04:44+00:00,cvl91xm,2.0,t1_cvkdl45,52709.0,movies
2550,What's the 'fuck' rule?,2015-10-02 01:57:49+00:00,cvl8sxd,2.0,t1_cvk8x7q,71118.0,movies
2551,It's comedy hour at the UN,2015-10-01 23:01:04+00:00,cvl2syo,1.0,t3_3n39ft,41995.0,news
2552,It's not going into orbit just sling-shotting around,2015-10-01 21:32:00+00:00,cvkzllz,2.0,t1_cvkzhtc,163.0,space
2553,Ok we use ion engines and add a radiation shelter.  The ISS is modular so we can just add and upgrade stuff as needed.,2015-10-01 21:27:36+00:00,cvkzfhg,2.0,t1_cvkz70u,358.0,space
2554,They could put it back in orbit when it returns I guess,2015-10-01 21:25:09+00:00,cvkzbzn,2.0,t1_cvkz5df,282.0,space
2555,They've found some more lost episodes?,2015-10-01 21:23:41+00:00,cvkz9xn,1.0,t3_3n4fxu,15548.0,doctorwho
