,body,created,id,nest_level,parent_id,reply_delay,subreddit
0,"No era de extrañar algo así, el pucherazo se vió desde que se recontó el primer 14%, se la han hecho a Podemos, han pecado de inocentes al no impugnar la concesión a dedo de Indra y sacar a la gente a las calles para que no fuera a dedo y han pecado después del pucherazo al aceptar los resultados como reales. Ha desaparecido 1,2 millones de personas y no ha caido ninguna bomba nuclear, no deja de ser curioso. Si aceptamos esto estamos perdidos porque siempre, siempre, siempre lo pueden repetir.",2016-06-27 23:06:51+00:00,d4qikar,1,t3_4pzn2k,94677,podemos
1,"Si fuera tu religión no verías bien que en tu lugar de oración vinieran a perturbar, es de simple lógica, de sentido común y de civismo, lo único que quiere cualquiera que practica su fe es que lo dejen en paz practicarla y lo único que pide cualquier persona que quiera una convivencia armoniosa es que no se la increpe. Puede que esos lugares no sean de culto para ti ni tan siquiera sagrados pero para otras personas si lo son, no vives sólo en el mundo y mientras convivas con los demás debes respetarlos. Te falta empatía básica y una buena dosis de sentido común. 

Y lee todo el texto, no soy católico ni cristiano pero como budista, como español, como simplemente ser humano respeto las creencias de los demás y no se me pasaría por la cabeza prohibirles tener sus lugares de culto (aunque no los considerara asi) , realizar sus prácticas en paz y tranquilidad y tampoco ofenderlos al generalizar estupidamente por los actos negativos cometidos por algunos de ellos, de hecho sería tan estúpido como si yo considerara que en podemos son tan radicales e intolerantes con las creencias de los demás como tú.

Lo que quería decir es que detrás de la ""aconfesionalidad"" se esconde una antireligiosidad y me has dado la razón mensaje tras mensaje. ",2016-05-27 20:32:30+00:00,d3m7jhr,5,t1_d3l413b,75980,podemos
2,"La gente es libre de educar a sus hijos donde quiera y si quieren hacerlo en un lugar acorde a sus creencias ¿que hay de malo en ello?, si la fe se pudiera forzar por otro lado no seríamos hombres y nadie adoctrina a nadie, no empecemos con el cuento de siempre de que las religiones son mecanismos de control y demás chorradas tipo new age. Si hubiera escuelas en las que se educase a los chavales en los principios budistas y hubiera sesiones de meditación por ejemplo llevaría a mis hijos si los tuviera a ellas sin pensarlo, ¿porque no las hay? porque este no es un pais de tradición budista sino católica pero en los paises budistas si las hay y a nadie se le ocurre la idea peregrina de que no existan, de adoctrinamiento y demás chufladas que nuevamente no prueban una actitud neutral sino antireligiosa, si es que tu mismo me estás dando la razón. 
La actitud neutral sería permitir que existan y que la gente sea libre de educar a sus hijos en ellas, a mi tampoco me parece bien que haya que ir a las escuelas obligatoriamente ni educar a los chavales según el sistema del sistema cuando este no nos satisface, que cada padre o madre los eduque como quiera siempre que los chavales superen los mismos exámenes para garantizar al menos una cultura básica pero la enseñanza debería ser una que desarrolle el potencial inherente de cada persona y no que lo ahogue como se hace en este sistema, debería ser libre y no obligatoria al menos hasta cierto punto.",2016-05-26 21:31:50+00:00,d3kzimh,4,t1_d3kh1ms,23989,podemos
3,"¿Pero que imposición de creencias? , muy ""aconfesional"" tu postura, para nada anticristiana (negando que los lugares de culto deban existir) una cosa es que este país haya sido tradicionalmente cristiano y haya habido un trato de favor a la iglesia, que hay que recordar ayuda diariamente a miles de personas materialmente y espiritualmente a muchos miles más y otra que digamos que nos imponen sus creencias o que los lugares sagrados no deberían estar ahí porque son construcciones ilegítimas o demás ideas peregrinas. Hay que respetar los lugares de culto que se han construido a lo largo de los años cuando en este país en cada casa había un altar donde ahora hay una TV.",2016-05-26 18:44:34+00:00,d3krvrd,3,t1_d3khxyy,12746,podemos
4,"Para muestra un botón...hablaba de la religión cristiana y ya estaba mentando uno los terrenos de la Iglesia, coger la parte por el todo una y otra vez, ¿tan dificil es hacer esa distinción de la que hablaba en el primer mensaje?, ¿plantarse en un lugar de culto claramente provocando al ir desnudo con gritos y demás tropelías no es censurable?,¿eso es ejercer la libertad de expresión?, claramente no, debemos respetarnos unos a otros e igual que un cristiano no debería plantarse en una playa nudista diciendo indecentes a los que allí estén tampoco deberían plantarse los nudistas en las iglesias, es muy censurable. Tampoco veo bien que se use la blasfemia y la burla como un medio de libertad de expresión (como aquel padre nuestro nuevamente y claramente anticristiano,no nos engañemos, esa no es una actitud aconfesional sino claramente anticonfesional) ya que lo principal debería ser el respeto entre los seres humanos. Decís aconfesional pero insisto en que más que neutral parece estar contra el pensamiento religioso teísta y repito en concreto contra el cristiano (no el Ronaldo contestando al graciosillo ;) . Y si,la libertad de uno a expresar su oposición a la fe cristiana representada por la Iglesia termina donde empieza la libertad de culto de una persona que quiere estar tranquila en su templo rezándole a Dios o a Jesús o la Virgen o al santo que quiera sin que venga nadie a proferir gritos y a perturbar su contemplación y si no entendemos eso es que nos hemos pasado de progres pero tres pueblos y porque precisamente los extremos se tocan estaremos pisoteando la libertad que pretendemos llevar por bandera. Por otro lado estoy a favor de las personas (y sus libertades y por eso también he escrito esto) por encima siempre del capital y de unos pocos contra muchos, si Jesús estuviera aqui estaría de acuerdo con los movimientos políticos que pretenden acabar con la mafia política y las oligarquías, las puertas giratorias, la banca (aqui siempre me gusta recordar que según la tradición religiosa y siendo el profeta Mahoma el último profeta el último mensaje que recibió de Dios fué el de la guerra contra la usura y cito: ""Y si no dejáis la usura, sabed que Dios y Su Mensajero os declaran la guerra” (Al-Báqarah, 2:278-279), la explotación, las leyes contra la inmigración, el freno de los desalojos y demás medidas con las que estoy de acuerdo también pero no acepto esa posición falsamente aconfesional que repito y denuncio es antireligiosa.",2016-05-26 15:01:00+00:00,d3khg3z,1,t3_4l2dw5,57463,podemos
5,"No he dicho que sea repugnante el cuerpo humano sino presentarse en un lugar donde la gente va a buscar la paz en una actitud provocadora y claramente alteradora de esa paz con gritos y demás. Lee lo que he dicho otra vez y verás que no hablo del cuerpo humano como repugnante; efectivamente cada religión tiene su casa, en este caso una Iglesia y entrar en ella con gritos y actitudes provocadoras es un comportamiento repugnante.",2016-05-26 14:44:58+00:00,d3kgqhy,2,t1_d3jqbc9,56104,podemos
