,body,created,id,nest_level,parent_id,reply_delay,subreddit
422,"I gotcha. I found the following:

Phone|Sprint|Amazon
:--|:--|:--|
**LG G4**| 24x$25 = $600 | $[469](http://www.amazon.com/LG-H815-5-5-Inch-Unlocked-Smartphone/dp/B00YA8308M/ref=sr_1_1?s=wireless&amp;ie=UTF8&amp;qid=1439233491&amp;sr=1-1&amp;keywords=lg+g4)
**HTC One M9**| 24x$27 = $648 | $[609](http://www.amazon.com/HTC-Unlocked-Cellphone-Warranty-Gunmetal/dp/B00V59AUKA/ref=sr_1_3?&amp;s=wireless&amp;ie=UTF8&amp;qid=1439233312&amp;sr=1-3&amp;keywords=htc+one+m9)
**Galaxy S6 Edge**|24x$28 = $672| $[664](http://www.amazon.com/Samsung-Galaxy-G925F-Unlocked-Cellphone/dp/B00VXN88T8/ref=sr_1_1?s=wireless&amp;ie=UTF8&amp;qid=1439233571&amp;sr=1-1&amp;keywords=galaxy+s6+edge)

Am I missing something? Is the only benefit here the ability to spread the payment out? To be fair, if I put a $609 M9 on a credit card with a 15% interest rate, it would cost me $820.54 assuming I paid it off as slow as possible (and monthly compounding, $822.01 if daily), which makes the $648 option from Sprint more appealing.

Sorry, the last time I got a phone upgrade, it was still they days of, ""You are eligible for a free phone every 2 years as long as you sign a contract."" I'm new to the new way of doing things. Thinking I may hold off for the Nexus 5 though. ",2015-08-10 19:15:25+00:00,cty9ypd,6.0,t1_cty7p87,3308.0,PickAnAndroidForMe
423,What's your preferred place to buy an unlocked phone? ,2015-08-10 17:29:22+00:00,cty5m1t,4.0,t1_cty4pnv,1332.0,PickAnAndroidForMe
424,"Good to know that thread is still being updated.

Wtf.

http://imgur.com/egmyMMu

",2015-08-06 15:13:37+00:00,cttmjgo,3.0,t1_ctt2ryu,49188.0,AskReddit
425,This feels like the most 90s thing of all time. I'm not complaining. ,2015-08-05 02:34:52+00:00,ctrvuhy,1.0,t3_3fksao,171001.0,Marvel
426,If you're looking for a project: http://www.instructables.com/id/Homemade-air-conditioner/ ,2015-08-03 02:11:12+00:00,ctph39h,2.0,t1_ctpgcn2,1472.0,Random_Acts_Of_Amazon
427,"I recently learned that that's the purpose of that little slot/tab thingy on the back of those common [keychain bottle (and apparently can) openers.](https://s3.amazonaws.com/grinderpunch/ebay/product_images/bottleopener/Bottle-can_Opener_BLK.jpg)

If you have one of those, you're in business!",2015-08-03 02:08:34+00:00,ctph0ih,2.0,t1_ctpgrow,481.0,Random_Acts_Of_Amazon
428,"Hahaha, just giving you a hard time man. Whenever I am on a treadmill, with or without a ruck, my only thought is, ""When will this be over?"" I spend a stupid amount of time doing math in my head on a long ruck, so I just thought I'd give you some grief. 

Good for you for leaving the original math in the post though, haha. ",2015-07-30 18:49:20+00:00,ctluooc,4.0,t1_ctlu8zf,594.0,Goruck
429,You may have mixed up your Booms and your Rooms. ,2015-07-30 17:55:03+00:00,ctlsb2n,3.0,t1_ctlpztd,3130.0,boardgames
430,"If you are traveling 60 miles an hour, how long does it take you to travel 60 miles? ",2015-07-29 21:08:46+00:00,ctkrfu0,2.0,t1_ctkou1t,3630.0,Goruck
431,"Right on, thank you. ",2015-07-29 18:18:34+00:00,ctkjw8n,6.0,t1_ctkj8tj,867.0,videos
432,Finally started Messiah. Not... in love with this. Is it just me? Or is this one regarded as a little slower? ,2015-07-29 18:00:35+00:00,ctkj32v,4.0,t1_ctkh0ch,2727.0,videos
433,$59.99 per can? I'm just assuming. ,2015-07-29 16:53:38+00:00,ctkg1u8,5.0,t1_ctkeu80,1659.0,worldnews
434,"&gt; Hungry Hobo

Hell yes Moline, IL. ",2015-07-29 16:51:06+00:00,ctkfxrf,7.0,t1_ctkbf7g,6264.0,worldnews
435,"I know you've mentioned wanting to hear about non-AW systems, but I've been listening to a podcast called [Houses and Humans](http://housesnhumans.libsyn.com/), and it has done nothing but make me want to play AW. Highly recommend you give it a listen. The first episode is just the group building the world together - which sounds like a really fun way to approach things (as opposed to being a DM who puts countless hours into detailing an entire world, only to have your players destroy part of it and ignore the other half, for example.)
",2015-07-28 17:17:03+00:00,ctj6r6l,1.0,t3_3evhlq,33927.0,rpg
436,"I mean, it's ~98 degrees inside your mouth. I haven't measured the temp of the inside of my dick... ever... but I assume it's not far off. ",2015-07-27 16:37:27+00:00,cthwkak,3.0,t1_cthtmg3,4485.0,AskReddit
437,Gotcha - kinda figured it would be a cost-prohibitive project. Appreciate the response though. ,2015-07-24 03:13:42+00:00,cte67wy,3.0,t1_ctducnk,20857.0,DicePorn
438,"I know I'm not the first to ask about you selling these, but I'm special. Kind of.

Getting married in a few months, 2 of the groomsmen + the officiant are or have been in my D&amp;D groups. Would love to throw these at them as gifts. And while I'm at it, a couple of personalized sets for the 3 non-D&amp;D folks in the party. If that's possible and not an insane burden, let me know? The MTG symbols would even be fine for all three of the D&amp;D guys, as we all play that too, so no need for any custom art there. ",2015-07-23 20:12:30+00:00,ctdrc9h,1.0,t3_3e9be4,75248.0,DicePorn
439,Looks like you may be having the same issue with Light Armor giving Accuracy ;),2015-07-23 18:03:15+00:00,ctdlv6x,7.0,t1_ctdlkkb,421.0,FFRecordKeeper
440,"All good man. Another one:

Galbadian Helmet (VII) Hat 2*

Mag +3

Def +7

Eva +96

Mnd +5",2015-07-23 17:54:53+00:00,ctdlijv,5.0,t1_ctdlcdn,246.0,FFRecordKeeper
441,"All good. Not sure if this is the appropriate place to submit an item to add, but:

Flail (VIII) 3*

Stats for +:

ATK: +21

MAG +39

ACC +89

MND +20",2015-07-23 17:49:23+00:00,ctdla77,3.0,t1_ctdl731,127.0,FFRecordKeeper
442,"It looks like the stats are closer to correct before I add it to my inventory - then when I do, it shifts the fields so a Rod's +ATK now is +HP, and it's +MAG is now +ATK, etc.",2015-07-23 17:46:58+00:00,ctdl6lq,3.0,t1_ctdl2gt,163.0,FFRecordKeeper
443,"Wyvern Claws (III) are listed as ATK +34 when my 10/10 Claws are showing +35. Is there supposed to be some variance? My goal here is to be helpful, not nitpicky, hope that's clear. ",2015-07-23 17:43:56+00:00,ctdl1zj,2.0,t1_ctdkyrc,129.0,FFRecordKeeper
444,"Hi there - not sure if this has been brought up yet, but your Obelisk (spear, XII) is listed as having +HP instead of its actual stats. (Mine is a +, and at 15/15 it's ATK +46, ACC +89).

Thanks!",2015-07-23 17:41:47+00:00,ctdkyrc,1.0,t3_3dnkcn,514280.0,FFRecordKeeper
445,"No argument here. The original GR2 was my first ruck,  and I love it. How much were you looking for for the SD anyway? I might be able to find a buyer. ",2015-07-23 13:30:13+00:00,ctdb9dw,3.0,t1_ctda75x,2235.0,Goruck
446,"Shadow rucks are no longer for sale on the website, making this something of a collector's item. I almost wish I needed a second one ;)

Good luck!",2015-07-23 05:10:13+00:00,ctd1phk,1.0,t3_3e91ok,25522.0,Goruck
447,"I used to do P90x (and by that, I mean that I've done the first 2 weeks like 3 different times then quit). There's a point where they're doing some tricep work, and Tony (? whatever the guy's name is), turns back to one of his bros and says, ""What kind of weight are you working with back there?"" The guy replies, ""25s,"" and Tony says, ""WOW you're a madman!"" 

I looked down at my 25s, realized why this was MURDERING my arms, and went out to get some 10s. Didn't feel too bad about it, but it took seeing this jacked dude tell another jacked dude that he was crazy for using 25s for that workout before I felt comfortable dialing it down so that I could actually complete the exercise. ",2015-07-22 20:54:49+00:00,ctckk11,4.0,t1_ctchm9y,4114.0,videos
448,"You just described me exactly, except I'm probably just regular-fat, not skinny-fat. (29 years old, 6'0"", ~205 lbs.)

If you hate exercise but enjoy walking, and are open to a suggestion, consider [rucking](http://www.goruck.com/fitness-benefits/c/83). Short version: get a backpack with a frame, throw some weight in it, go for a walk. Lower weight and shorter walks at first, build up both over time. 

A couple years ago, I did a [GoRuck Challenge](http://www.goruck.com/tough/c/25) that pushed me beyond what I thought I was capable of. I trained for 6 weeks leading up to it and STILL within about 90 minutes or so was ready to tap out. The guy leading it told me to suck it up and get back in line, I did, and 11 hours later was so happy I stuck it out. 

I hate running - I find it super boring, I get depressed with how slow I'm moving, so I start to sprint, then get burnt out, so I walk, then get pissed that I'm walking, so I try to make up for it by sprinting. (On the one hand, interval training is actually good, but on the other, my overall distance is a joke because of this approach.) BUT, when I go for a nice long ruck (anything over 1 hour is awesome, at a 4.0mph pace), I can throw in the headphones, listen to a podcast (The Nerdist, Just OK Gamers, Crit Juice), or a book on tape, and before I know it I've walked 8 miles, and I'm sweating my dick off. It *really* feels like I'm accomplishing much more doing this than going for a ""run."" Yes, it will take much more time, but if you're someone who enjoys listening to podcasts or books, it flies by. 

Anyway, just my two cents. Good luck with everything. ",2015-07-22 20:45:55+00:00,ctck6ex,3.0,t1_ctcbz80,11494.0,videos
449,"I can't overstate the value of ""take a few seconds to think about it."" I've been public speaking in some form or another for years (lots and lots of mock trial, specifically), and people seem to think that there's a problem with actually thinking before you speak. Just take a breath, think about your answer, then go for it. 

I have also had enormous success with being extremely honest while thinking out loud. (**Disclaimer**: honesty is not *always* the best policy in an interview. For example, ""I just need a job for now while I find a place to live in another state,"" is never the correct answer to, ""So, why do you want to work here?"") That said, if you are asked something like, ""How would you approach this problem?"" the intent is to see your problem solving skills; your process. It's not a terrible idea to let them know how you arrived at your conclusions: ""Well, from what you've told me, it would seem that X. That said, I would want to know if Y is a factor, but I think the best course of action would likely be Z."" This is not being indecisive: it is demonstrating that you're examining a problem from multiple angles. 

Good luck!",2015-07-21 14:23:20+00:00,ctavwdw,2.0,t1_ctaqnqa,13681.0,Random_Acts_Of_Amazon
450,"I can't believe I didn't know that about Geico. That's pretty awesome. (And McDonald's is a good illustration of my point: you don't need to name your place ""BURGERS"" in order for people to patronize it.)",2015-07-21 04:22:04+00:00,ctajt5d,3.0,t1_ctaaiml,16942.0,Random_Acts_Of_Amazon
451,"Based on this thread, you have read more than I ever will. However, it looks like you like fantasy. And so:

[Guardians of the Flame](http://amzn.com/1568650612 ) by Joel Rosenberg. (The link is actually for the first 3 books collected into 1 volume, so technically, you're looking for ""The Sleeping Dragon."")

If you're a D&amp;D person, this is a lot of fun. Group of college kids plays a D&amp;D knockoff, and the DM (professor) transports them INTO the game. They wrestle with a sort of split-personality now as they learn to adapt to their new reality. The engineer is now also a wizard, the football jock is now a sneaky rogue, the wheelchair-bound guy with muscular dystrophy is now a powerful warrior.

In my opinion, it has a lot more depth than may it may appear to at first glance - some moral questions, some interesting relationships between the characters, etc. 

Anyway, it's one of my favorites. Enjoy!",2015-07-20 20:03:43+00:00,cta2fb0,1.0,t3_3dy6fm,20110.0,Random_Acts_Of_Amazon
452,"This is barely an entry, but: 

Consider using a word (or two, probably not more) that is not directly related to the industry. I'm not saying the other entries in this thread are bad by any stretch, but consider: What does ""Google"" have to do with searching? What does ""Amazon"" have to do with an online book (and later, everything) store? What does ""McDonald's"" have to do with burgers? Why do we associate ""Geico"" with insurance? When someone says ""Nike"" we think athletic wear. 

It's not *required* to use a name that is some kind of pun or spin off of a term related to cameras and ink. 

Name it Aimee New (and not Aimee New Designs, or Aimee New Prints). 

Make a name for yourself. ",2015-07-20 19:48:06+00:00,cta1s91,1.0,t3_3dz11g,6018.0,Random_Acts_Of_Amazon
453,"Just emailed the landing page of CR to a couple buddies so that it will forever be in my Gmail. Looking forward to exactly what you described. As a huge fan of Acquisitions Inc., I'm pumped. 

(Semi-related: I've really enjoyed the Board with Life podcast series on D&amp;D, if you're looking for more.)",2015-07-20 18:31:26+00:00,ct9yqxs,4.0,t1_ct9ru1f,10348.0,DnD
454,Wow good catch!,2015-07-17 20:27:23+00:00,ct6yznb,4.0,t1_ct6yx8n,101.0,MechanicalKeyboards
455,"[You say that](http://2.bp.blogspot.com/_EKfCI8QuAaM/S7MAgCjgXdI/AAAAAAAADmA/Gv2TldgEE40/s1600/JD1C0051.JPG) but, uh... [you are correct.](http://2.bp.blogspot.com/_EKfCI8QuAaM/S7MBC86NGyI/AAAAAAAADmI/c6UrDxuwHDk/s1600/JD1C0068.JPG)",2015-07-17 20:21:34+00:00,ct6yrf3,2.0,t1_ct6vi6x,5025.0,MechanicalKeyboards
456,"Agreed. I actually listened to Wil Wheaton read it the first time, but I'm pretty sure it will make the list of books I ""read"" twice. ",2015-07-17 18:28:00+00:00,ct6uaj5,2.0,t1_ct6me05,11567.0,Random_Acts_Of_Amazon
457,"I agree, but I did like the fact that I could buy food I'd heard of at Sam's, instead of Kirkland for days. (I know, Kirkland food is actually really good, in fact sometimes it's just repackaged other stuff etc. etc.)

I'm just saying, if I want a 6 gallon bag of Doritos, I can't find that at Costco. ",2015-07-17 14:00:54+00:00,ct6jnnk,5.0,t1_ct6cqh3,21217.0,todayilearned
458,"I was picked to be some kind of spokesman for my school at a [D.A.R.E.](https://en.wikipedia.org/wiki/Drug_Abuse_Resistance_Education) event - I'm going to claim this was 4th grade, but I can't be sure. 

I ended up on a camera for the local news, and the reporter asked me, ""What are drugs?"" My mind jumped to like, ""well, a lot of drugs are made out of chemicals, I don't know the names of those chemicals, I have no idea what kind of plant the marijuana plan is, what are they looking for here, uhhhhhhhh..."" and ultimately I managed to spit out: ""I don't know.""

The family had a field day with that one. ",2015-07-17 13:52:04+00:00,ct6jd6y,2.0,t1_ct6g1n1,7801.0,funny
459,"FYI - if it is real, be aware of the restrictions on selling it, especially if you're in EU. 

https://en.wikipedia.org/wiki/Nazi_memorabilia",2015-07-17 04:09:56+00:00,ct67ok5,1.0,t3_3dl18u,3198.0,knives
460,I feel like I'm missing something. ,2015-07-15 19:20:20+00:00,ct4has0,2.0,t1_ct4guda,680.0,Random_Acts_Of_Amazon
461,"Same here - it's so good. Better with people who've played a lot, but still easy enough to teach to a new player. And requires 0 equipment, so no hassle on that front. ",2015-07-15 15:35:17+00:00,ct486s3,4.0,t1_ct3o2xy,50067.0,Random_Acts_Of_Amazon
462,"Oh man, I'm paralyzed by choice. I would pick an easier-to-spell, more phonetic last name (and then feel guilty that I was somehow dishonoring my father in doing so.) I've always liked the name ""Jack"" as a first name, despite the relative plainness of it. But I figure I'll push for that one if I ever have a son. 

Tough question, terrible answer.

[Hingle McCringleberry.](http://www.rantlifestyle.com/wp-content/uploads/2013/12/HingleMcCringleberry.jpg)",2015-07-15 15:33:57+00:00,ct484vm,2.0,t1_ct3jzvx,56953.0,Random_Acts_Of_Amazon
463,"Copying this from another response:

[Eldritch Horror](https://www.fantasyflightgames.com/en/products/eldritch-horror/). 

Supports up to 8 players, is co-op (you all vs. the game) which is a VERY welcome relief to playing competitive games with lawyers, is very difficult to actually beat, and is heavy on the theme, which is H.P. Lovecraft's Cthulhu mythos. Can't recommend enough. 

There are a lot of solid ""serious"" board games out there - Battlestar Galactica and Game of Thrones are both excellent, even if you've never seen either show (although the GoT one in particular is MORE fun when you have a little more background.) If you're looking for a little more light-hearted fun, [Castles of Mad King Ludwig](http://www.amazon.com/gp/product/B00NP7E05G?colid=3UL3I3O372ZA&amp;coliid=I3U1YO4Y8N3NIY&amp;ref_=wl_it_dp_o_pd_nS_img) is a blast. Just the right balance of chance and strategy, in my opinion. 

For Diablo: I played a LOT of D1, missed out on the D2 craze, and now am back with D3. Really enjoy it, but again, it gets repetitive. I own and have barely scratched the surface of Torchlight 1 and 2 - but they are definitely on the to-do list. Grim Dawn I am not familiar with.",2015-07-15 15:32:02+00:00,ct48271,2.0,t1_ct3klck,55829.0,Random_Acts_Of_Amazon
464,"Haha, don't worry: I also drink beer. Old Rasputin is my favorite, but just about any stout or porter will do. For the whiskey: I drink it with ice, or without ice, or with ice and ginger ale, or with coffee. There's almost no wrong way to drink whiskey. ",2015-07-15 15:28:13+00:00,ct47wrv,3.0,t1_ct3levz,54231.0,Random_Acts_Of_Amazon
465,"Hello Susie! Favorite TV show is possibly The Wire, but I'm biased in so far as I am *currently* watching it for the first time. The hype was correct: this show is crazy good. 

Movie is probably The Bourne Identity (and its sequels). I read the books in... maybe 2005? Also excellent, and it's cool because they're a little different - Bourne is a Vietnam vet in the books, for example. ",2015-07-15 15:24:04+00:00,ct47r3q,2.0,t1_ct3lzvl,52987.0,Random_Acts_Of_Amazon
466,"Been here since 2008, when I moved to St. Paul. I came from Moline, IL (border of IL and IA), so it wasn't a huge leap in terms of culture/climate/etc. My fiance is from Boston, so I've been East a few times, and really like it there too!",2015-07-15 15:22:33+00:00,ct47p16,2.0,t1_ct3o59d,49192.0,Random_Acts_Of_Amazon
467,"Hi Beth, and thanks for the welcome. ",2015-07-15 15:20:53+00:00,ct47mqq,2.0,t1_ct3qooy,44686.0,Random_Acts_Of_Amazon
468,"Thank you! I think the sub has been on my radar for a long time, but I was just re-reminded of it when doing some searching for the Prime Day deals (which so far have been a big letdown - let me know if anyone finds anything good!)

Currently I'm reading Sojourn, the 3rd book in the [Legend of Drizzt](https://en.wikipedia.org/wiki/The_Legend_of_Drizzt) series, as well as the Annotated [Dragons of Autumn Twilight](https://en.wikipedia.org/wiki/Dragons_of_Autumn_Twilight), the first book in the Dragonlance series. Like I said, big fantasy fan. ",2015-07-15 15:20:41+00:00,ct47mg4,2.0,t1_ct3lrrb,53173.0,Random_Acts_Of_Amazon
469,He's one of the best. Double hawk. ,2015-07-15 14:59:04+00:00,ct46tar,2.0,t1_ct3mphs,50261.0,Random_Acts_Of_Amazon
470,"True, and I occasionally do make it that way. In terms of protein, you could do MUCH better than Italian sausage, but I like to pretend the chicken balances that out. Actually if you use sausage, you pretty much don't need any oil. ",2015-07-15 14:58:44+00:00,ct46suy,4.0,t1_ct3nxcw,48138.0,Random_Acts_Of_Amazon
471,"Hello! The wedding will be at the Minneapolis Event Center, so indoors. Neither of us are super outdoorsy people, and October can be risky in MN, as I'm sure you know. Figured we'd play it safe. 

For 2GW, I am a ""storyteller"" which means I'm one of those guys pouring samples of whiskey at liquor stores. I went to law school with the owner (Kieran)'s son, and had a great customer service experience buying from him, so when they announced they were looking for help, I signed up. It's a nice way to make a little side money, meet great people, and support a local business. (Well, the product is now available nationwide, but it started out as MN-only.) ",2015-07-15 14:57:12+00:00,ct46qur,2.0,t1_ct3p0bj,46193.0,Random_Acts_Of_Amazon
472,"Yeah honestly there was a lot of solo content in MoP which was great for me, especially because I was one of those achievement hunting people. But at a certain point out started to feel like a job or an obligation, and that's when you know it's time to call it a day. ",2015-07-15 04:10:18+00:00,ct3t2dt,4.0,t1_ct3qr1x,4337.0,Random_Acts_Of_Amazon
473,"That's pretty much my current method too. For the favorite:
http://www.reddit.com/r/Random_Acts_Of_Amazon/comments/3dauhf/intro_just_got_prime_and_ready_to_get_gifty/ct3eof7",2015-07-14 23:45:24+00:00,ct3k0s8,2.0,t1_ct3h6yx,4700.0,Random_Acts_Of_Amazon
474,"Hello and thanks! 

I'm a big fan of a dish I make myself: bow tie pasta,  any kind of green/red/yellow peppers, broccoli, garlic, chicken, and spicy Italian sausage. Top with a little olive oil, parm cheese,  crushed red peppers, black pepper,  and lemon pepper. It's not at all healthy but it's delicious and easy. ",2015-07-14 23:41:43+00:00,ct3jvz5,2.0,t1_ct3is8b,1861.0,Random_Acts_Of_Amazon
475,"Horde for vanilla through WotLK, then took a break because law school is hard, then came back with a faction transfer to Alliance because only a couple of my buddies still played, and that's what they were. (And during BC, I was in on a server-first Kael'thas kill, no big deal.) 

So then of course the rest of the crew dusted off their toons and re-upped, switching to Alliance too. Played through WoD on and off, mostly off. Killed the sub probably 6 months ago or so, and I seriously doubt I will return. Great memories though. ",2015-07-14 23:35:27+00:00,ct3jnub,2.0,t1_ct3i5na,2535.0,Random_Acts_Of_Amazon
476,"This is not nearly as badass, but the time in 1996 when Gavin Rossdale played Glycerine alone on the stage in the rain (ie, risking electrocution) stands out in my mind as a solid example of ""the music comes first."" 

Enjoy: https://www.youtube.com/watch?v=tfatUZ5RDG0

Edit: Here's [an article on it](http://consequenceofsound.net/2010/07/youtube-live-gavin-rossdale-cheats-death-on-spring-break/), and a quote from that:

""Despite perilous rain and a foreboding storm nearby, Rossdale kept the amps on, refused to put down his guitar, and performed the song every teenager played to their girlfriend until Dave Grohl wrote Everlong.""",2015-07-14 23:29:53+00:00,ct3jgrw,4.0,t1_ct3i3zu,2276.0,Random_Acts_Of_Amazon
477,"If it's gotta be right now: back porch with an acoustic guitar and a dark beer - ideally Russian Imperial Stout. 

If it's a ""I need to get out of town"" thing: Dubuque Iowa, where I went to college and still the home town of some good friends. ",2015-07-14 23:27:53+00:00,ct3je9r,2.0,t1_ct3hya7,2416.0,Random_Acts_Of_Amazon
478,Thank you and thank you!,2015-07-14 23:25:50+00:00,ct3jbmv,2.0,t1_ct3i1dr,2150.0,Random_Acts_Of_Amazon
479,Awesome - thank you! I'll check these links out. ,2015-07-14 23:23:04+00:00,ct3j84k,3.0,t1_ct3h21h,3574.0,Random_Acts_Of_Amazon
480,Right on. I am indeed on US. I'll post my ID later on.,2015-07-14 22:22:06+00:00,ct3h07g,4.0,t1_ct3gpo6,464.0,Random_Acts_Of_Amazon
481,"Not yet. We are looking at getting a dog - possibly a French bulldog - and naming her (or him, whatever) Anna Kendrick Lamar. ",2015-07-14 22:10:23+00:00,ct3gk6m,4.0,t1_ct3gi8s,85.0,Random_Acts_Of_Amazon
482,"Human ;)

But I'm sure the answer you were looking for is: Monk. And ""play"" is strong - it's been probably a month since I've logged in. It get too repetitive for me and I have to switch to other things for a bit. I actually JUST picked up Skyrim. Turns out everyone was right, it's a really fun game. Who knew.",2015-07-14 22:09:29+00:00,ct3giz2,2.0,t1_ct3ggfs,112.0,Random_Acts_Of_Amazon
483,Thank you! ,2015-07-14 22:05:34+00:00,ct3gdlj,2.0,t1_ct3gcnu,44.0,Random_Acts_Of_Amazon
484,"Haha, thank you! And glad to have another Bastion/Transistor fan. SO good. ",2015-07-14 22:05:20+00:00,ct3gdb6,4.0,t1_ct3g4jl,383.0,Random_Acts_Of_Amazon
485,"Yeah I think they ""clean"" things by abrading them with essentially fiberglass. 

And then I looked it up: https://en.wikipedia.org/wiki/Melamine_foam

Straight from the article, ""...when used for cleaning it works like extremely fine sandpaper, getting into tiny grooves and pits in the object being cleaned.""",2015-07-14 22:04:37+00:00,ct3gccy,4.0,t1_ct3g88q,181.0,Random_Acts_Of_Amazon
486,"Welcome! You beat me to this community by a few hours, but I still have a (selfish) question for you:

I came across this: https://www.mapiful.com/ and I LOVE the look of the maps they make. But, I don't $60 love it. So then I discovered the acronym GIS and found QGIS, and ArcMap/ArcGIS/ArcReader, and am still trying to figure all of this out. My question for you is, ""Is there a moderately easy way to custom-make a basic line art map like the ones in the above link?""

Thanks, welcome, and thanks!",2015-07-14 22:02:11+00:00,ct3g92e,1.0,t3_3d9vzx,17476.0,Random_Acts_Of_Amazon
487,"Thank you!

I *used* to play a ton of D3, but boy does it get repetitive at times. I haven't been back since the latest update though - maybe I should give that a shot. Monks are the best.

Dave Grohl is insane. I saw the Foo Fighters ""open"" for the Chili Peppers, and they were at *least* as good. Such a great show. ",2015-07-14 21:57:57+00:00,ct3g349,2.0,t1_ct3fh65,931.0,Random_Acts_Of_Amazon
488,"Absolutely not.

But seriously I keep hearing that Scotch is worth looking into. I'll try it eventually. Maybe. ",2015-07-14 21:56:41+00:00,ct3g1dy,2.0,t1_ct3ftsg,319.0,Random_Acts_Of_Amazon
489,http://i.imgur.com/tIHaC7Y.png,2015-07-14 21:55:06+00:00,ct3fz48,4.0,t1_ct3ez6m,1526.0,Random_Acts_Of_Amazon
