,body,created,id,nest_level,parent_id,reply_delay,subreddit
228,https://www.youtube.com/watch?v=pbAD6RqOUJo,2016-01-27 20:27:08+00:00,cze9f04,6.0,t1_czdy2g6,15325.0,wow
229,"Made by former Special Forces guys out of stuff that will last forever: http://www.goruck.com/kit-bag-32l-black-/p/GEAR-000005

Probably more space than you need. Or like, certainly more. But they look cool. 

If you want one you can wear, this is only 10L (the above link is 32L): http://www.goruck.com/10l-hydration-bullet-black-/p/GEAR-000002

Benefits of that one: much smaller, tough as hell, can use it to carry any amount of weight, great for hikes/times you want a CamelBak. ",2016-01-24 09:08:22+00:00,cz9v7l7,1.0,t3_42dtjs,28122.0,malefashionadvice
230,"I used to see your point, but then I watch the reaction videos of kids or even adults discovering that, for example [Star Wars and FFVII Spoiler](/s ""Vader is Luke's father, or that Aeris dies""), and I realize that we all had to make various discoveries at some point in our lives. That point isn't always in the theater, or at the comic store the day the book was released. I'll sacrifice 4 seconds to put a spoiler tag on something if it means someone else gets to experience the awesome. ",2016-01-24 08:39:55+00:00,cz9us1f,4.0,t1_cz9j76e,26702.0,Marvel
231,Or Google Wave. ,2016-01-22 23:43:35+00:00,cz8e0de,3.0,t1_cz79xtc,78578.0,ProjectFi
232,"I actually love it in PvP. I don't think of it as a crutch because all the time you're launching your giant hammers at me (or just the wall 30 feet away from me, whatever, that will still kill me) or one-shotting me from Narnia with your goddamn golden gun, I'm sitting there *not* using my super - so how is that a crutch? 

But nothing is sweeter than that countdown because the round is ""over"" and I pop up and quick-rez my teammate and then we dance on that titan's grave. ",2016-01-22 18:32:48+00:00,cz817sq,6.0,t1_cz7z6jv,2810.0,DestinyTheGame
233,"I just moved to Milford last week. Where's this great pizza? 

*Edit: wow, so many replies! Thanks for all the tips!",2016-01-21 09:57:39+00:00,cz6ch1a,7.0,t1_cz694m7,11462.0,AskReddit
234,Thank you so much! Looking forward to digging in. ,2016-01-20 21:11:16+00:00,cz5o6if,7.0,t1_cz5mvhq,1719.0,MechanicalKeyboards
235,"Any tips to getting started with Vim? It's so intimidating to me. 

Also, as a non-coder (uh... for now...) does Vim offer anything that my favorite Sublime Text doesn't (aside from all the keyboard shortcuts/navigation)? ",2016-01-20 20:05:04+00:00,cz5l5bu,5.0,t1_cz5fws9,7056.0,MechanicalKeyboards
236,Like... body paint? Or... ,2016-01-20 20:03:03+00:00,cz5l22j,2.0,t1_cz5cq6f,11345.0,MechanicalKeyboards
237,(link to relevant xkcd) ,2016-01-20 19:24:51+00:00,cz5jbv5,5.0,t1_cz5i1hx,1738.0,gaming
238,"&gt; zero tolerance policy

https://en.wikipedia.org/wiki/Zero_tolerance_(schools)",2016-01-19 17:40:08+00:00,cz44j1y,7.0,t1_cz440r1,728.0,leagueoflegends
239,Get your goddamn opinions out of here. ,2016-01-19 17:22:34+00:00,cz43siq,4.0,t1_cz3xmfq,10465.0,diablo3
240,"Fair. I should have said, ""I believe it, but Jesus Christ."" ",2016-01-18 21:01:40+00:00,cz34jpd,7.0,t1_cz34d4x,253.0,wow
241,I can't believe how upset people are getting despite your rational replies. ,2016-01-18 20:54:55+00:00,cz3496i,5.0,t1_cz32af7,2791.0,wow
242,Came across this somewhere: http://www.diablofans.com/builds/57700-demon-hunter-deaths-breath-strafe-speed-farm ,2016-01-18 02:49:54+00:00,cz29kq0,1.0,t3_41dlp4,46320.0,Diablo3DemonHunters
243,There's no way to know. But he does now. Maybe. ,2016-01-18 01:29:00+00:00,cz26nk5,6.0,t1_cz25v7k,1348.0,BuyItForLife
244,"Er, now I've confused myself. What I should have said was, ""If you're joking based on the name and didn't realize that Shallots actually *are* knives, here's a link."" ",2016-01-18 00:47:55+00:00,cz254z5,4.0,t1_cz24rlh,569.0,BuyItForLife
245,"I can't tell if you're joking, but... 

http://kershaw.kaiusaltd.com/knives/knife/shallot

In case you're not joking, these are all in a line from knife maker Ken Onion. ",2016-01-18 00:35:41+00:00,cz24nsj,2.0,t1_cz243hq,888.0,BuyItForLife
246,"Noob follow up: are armor engrams weighted to be something for the class you decrypt on? Ie, I have 7 warlock exotic helmets and have dismantled several more, but have never seen a CN. Is that because my warlock (who I can get over 311) is my usual decrypter? ",2016-01-15 23:32:31+00:00,cyzti6j,3.0,t1_cyz1ng9,48742.0,DestinyTheGame
247,Cause he doesn't have a right arm. ,2016-01-15 05:43:54+00:00,cyywsas,7.0,t1_cyywc90,1011.0,funny
248,"He'll never be the head of a major corporation.

I'm not doing this right. ",2016-01-15 05:02:18+00:00,cyyvnfh,5.0,t1_cyyv9cr,804.0,funny
249,Agreed. Not *just* a story. ,2016-01-14 18:30:19+00:00,cyy6ku7,7.0,t1_cyy209w,6195.0,gamegrumps
250,"I read this as your accounting of 3 separate events, from a non-native English speaker.

1. Haven't seen this pic in a while
2. Made a friend
3. And I laugh to the point of tears!",2016-01-14 16:38:50+00:00,cyy1ngq,4.0,t1_cyy05zn,2184.0,gamegrumps
251,"I'm not 100% sure, but on a typewriter, doesn't the caps key actually physically lock the shift key down? Makes a little more sense when you think of it that way maybe. ",2016-01-12 23:36:03+00:00,cyvyjaj,4.0,t1_cyvsfxs,8516.0,MechanicalKeyboards
252,"Great answer, and great advice. Thanks! ",2016-01-11 04:55:49+00:00,cytq8xf,3.0,t1_cytm99c,7443.0,FinalFantasy
253,"Hey there,

I was planning on a full playthrough of all the games in order as well, and I was wondering: did you use guides? I know, I know, ""Don't use a guide the first time through, experience things, discover, blah blah blah."" But we're talking about a MASSIVE amount of hours to devote to the overall project, and while I have played through a handful of FF games in the past (none to completion except for VII), I don't know that I can commit to playing through them all multiple times.

So, if I'm only going to play through any given game once, should I use a guide? ",2016-01-11 01:45:43+00:00,cytjyzz,1.0,t3_40aqrt,57182.0,FinalFantasy
254,"&gt; OP drives off into the sunset, running over several children.

*OP drives off into the internet...*",2016-01-07 19:54:53+00:00,cypp40e,5.0,t1_cypn4q2,2662.0,funny
255,"Wait. 

Alexander Capeles was found naked and bloodied on a tarp.

Adan Llanos was charged.

I'm not sure that headline was worded correctly. ",2016-01-07 00:02:49+00:00,cyopj15,1.0,t3_3zioz8,153684.0,Connecticut
256,"Right on - and just for some context, I was the guild leader who thought that anyone without max level gems/reforge/enchants/flasks wasn't pulling their weight, so I'm familiar with the idea of ""do what it takes to be ready for the raid."" And I remember back in vanilla, when the closest thing to what you're describing was grinding out Dark Iron rep to craft FR gear, and even that wasn't so bad. 

I think it just touched the nerve where I realize that since I haven't played in months, and I don't love the idea of being casual, that I would have some serious catching up to do. 

MoP was the first time I just leveled slowly and enjoyed the content for what it was instead of sprinting to the end and then switching characters to do it again. I definitely was a fan of the amount of solo/small group/matchmaking elements they've incorporated in the more recent expansions (or at least what was available in MoP, I can't speak beyond that.)

Thanks for the reply! ",2016-01-05 07:44:30+00:00,cymkd9h,5.0,t1_cymj60r,3512.0,wow
257,"Oh man. This post and your comment just totally confirmed my decision to not resubscribe. No offense intended, it's just that I had a PTSD flashback of grinding for a currency to catch up for a thing so I could do the hard mode, and holy god no thank you. 

Now I'd better get back to Destiny, where I only have a couple hours to get enough rep with Iron Banner to receive my rewards package, guaranteed to be a light level IB weapon or armor over 310 Light. That should really help me with this week's challenge mode in the raid.

There is no escape. ",2016-01-05 06:34:04+00:00,cymiw4v,3.0,t1_cymb27f,14226.0,wow
258,"I think that's exactly the idea.


Bill: $0.83 | Pay with credit.
:-|:-|
Amt. paid w/credit | **$0.83**
Amt. paid w/cash | $0.85

Bill: $0.82 |  pay with cash.
:-|:-|
Amt. paid w/credit | $0.82
Amt. paid w/cash | **$0.80**

|||
:-|:-|
Total paid if credit all the time | $1.65.
Total paid if cash all the time | $1.65.
Total paid if you adjust your method to the situation | $1.63.

",2015-12-28 01:41:29+00:00,cydc9xt,7.0,t1_cydbvuh,728.0,todayilearned
259,"Right on. I have been having decent luck with those, but no MIDA yet, so I'll probably pick this up. Thank god I fly home from the in-laws' before Xur leaves. ",2015-12-26 02:08:37+00:00,cybgaz6,6.0,t1_cyb5a3q,24861.0,DestinyTheGame
260,"Oh, right, duh. Y2 player here. ",2015-12-25 18:57:23+00:00,cyb4u2u,4.0,t1_cyb4rve,134.0,DestinyTheGame
261,Dumb question. How did you get a MIDA using marks? ,2015-12-25 18:53:04+00:00,cyb4pul,2.0,t1_cyb3942,3240.0,DestinyTheGame
262,"Oh, whoops - totally misread that. GeekKeys != geekhack. My mistake. ",2015-12-24 07:49:59+00:00,cy9uzb6,3.0,t1_cy9uvtn,332.0,MechanicalKeyboards
263,"Are these the ones I paid Ivanovich for in June? I ordered a set of blanks and a set of dark printed, and haven't seen them.",2015-12-24 07:39:31+00:00,cy9uspk,1.0,t3_3y0w0t,26874.0,MechanicalKeyboards
264,Good old Health. ,2015-12-24 04:51:32+00:00,cy9r01w,8.0,t1_cy9olf4,5287.0,AskReddit
265,Is that a GR2? ,2015-12-24 04:44:37+00:00,cy9qtmg,1.0,t3_3xykn0,55660.0,cardsagainsthumanity
266,"Ctrl+F where location 

And for the Y2 guardians like myself: in the hangar, down the stairs past the Dead Orbit guys. ",2015-12-18 21:21:08+00:00,cy3tv33,2.0,t1_cy3ali6,35572.0,DestinyTheGame
267,http://local.fedex.com/,2015-12-10 09:53:48+00:00,cxtxzj8,2.0,t1_cxtklsi,30228.0,Random_Acts_Of_Amazon
268,"I think you're taking those quotes out of contacts. 

",2015-12-03 23:05:29+00:00,cxm8lbf,5.0,t1_cxm2np0,8573.0,todayilearned
269,"I think it's not a perfect solution, but I don't know what would be. If you start with some baseline (I'll just pull this out of the air: 4 players = 3 gates, and 6 players = 4 gates), then having 5 players presents an issue. You are forced between rolling (say, every time gates spawn, which would increase game time; or just once at the beginning of the game, and if that's what you're doing, why bother), or just flat declaring that 5 is the same as 6.

I'm not a game designer by any stretch, but I have to think that creating a game that is equally fun no matter how many players you have must be extremely difficult. In the above ""roll when gates spawn"" scenario, I could very easily see someone then saying, ""It's bullshit that an extra gate spawned just because I rolled a 3."" Sometimes making a flat rule eliminates the complaint that a game is *too* luck-based. ",2015-12-03 16:21:50+00:00,cxlro4w,10.0,t1_cxlhput,26381.0,boardgames
270,"When I say shot-caller I just mean someone to provide some direction - a leader of some kind. If you have 5 people saying, ""I don't know, what do YOU want to do?"" in a circle, nothing can get done. I don't mean someone TELLING people what to do, that would definitely be boring. 

My group size varies, but when we get some Eldritch going it's generally 5 or 6. FYI - EH is easier with an even number of player. 4 is easier than 3, 6 is easier than 5, etc. You get the same number of gates/monster spawns/etc. on those pairings, so having an extra investigator is helpful. ",2015-12-03 02:48:29+00:00,cxl7oq6,8.0,t1_cxkzqmg,12597.0,boardgames
271,"Every time I play this game, the 4-hour marathons are a direct result of needing to explain rules, people getting sidetracked with whatever football is on in the background, or too much talking leading up to/during your turn.

If you can focus up and have a good shot-caller, this is much smoother.

*Edit: Also, larger groups = longer games (obviously), but the double-whammy is that the more players, the longer it takes to get around to your turn again. That encourages getting distracted, getting up to grab a beer, or a snack, or watch the game, or whatever. Smaller groups = faster games not just because less people, but because less people = everyone is more invested because it's about to be their turn again. ",2015-12-02 21:47:13+00:00,cxkvxxh,6.0,t1_cxkun8s,1736.0,boardgames
272,"If you happen to have two, I'd gladly take one.",2015-11-30 18:28:14+00:00,cxi54in,8.0,t1_cxi29vt,4344.0,DestinyTheGame
273,"S is next do D, O is next to I, songs = dings. 

Wrap it up boys, case closed. ",2015-11-27 17:33:20+00:00,cxev2oz,5.0,t1_cxea6hl,57060.0,DestinyTheGame
274,"/r/mechanicalkeyboards is waiting for you. 

",2015-11-25 16:01:55+00:00,cxco9jw,2.0,t1_cxcm6fw,3391.0,battlestations
275,"Nerdery? I'm actually about to move out of St. Paul, but I always wondered what it would be like to work there. ",2015-11-25 14:24:29+00:00,cxckw3v,7.0,t1_cxca8oq,33648.0,battlestations
276,Spivey? ,2015-11-24 22:25:04+00:00,cxbx7mk,8.0,t1_cxbwhia,1095.0,funny
277,"Yeah I think ""aren't that many rules"" only applies to people familiar with other editions. Although, yes, there are less than previous editions, there are still quite a lot from the point of view of someone who thinks D&amp;D is related to Monopoly, or, say, the World of Warcraft. ",2015-11-24 21:38:00+00:00,cxbv9m5,3.0,t1_cxbu8m6,1415.0,DnD
278,Why are there no links to Carmenjello/Cinnamon from [The League?](https://youtu.be/y5ekjRGLyEM?t=2m8s),2015-11-23 22:25:42+00:00,cxao088,1.0,t3_3tyt69,16588.0,IAmA
279,"Yeah, almost like a [Cranberry color.](https://www.youtube.com/watch?v=6Ejga4kJUts)",2015-11-23 22:18:59+00:00,cxanqia,5.0,t1_cxadwhj,13793.0,IAmA
280,"*edditor. 

ETFY",2015-11-23 17:06:20+00:00,cxaag0p,4.0,t1_cxa0uxt,22636.0,dndnext
281,"Right on, thanks so much for the reply. ",2015-11-23 16:54:11+00:00,cxa9ycc,3.0,t1_cxa9qrt,305.0,starcraft
282,"Hey there, you seem friendly and super responsive. So allow me to capitalize on that!

I have a 2-monitor setup at home, and then separate from that, a laptop dock that plugs into a 3rd monitor AND one of the first two we just mentioned. So, left+mid = laptop dock, mid+right = desktop. In addition to all of that, my X-box is also plugged into that center screen.

Because of this setup, my needs are constantly changing. When I'm working from home, the laptop gets 2 screens. When I'm playing a PC game, the desktop gets 2. When I'm on the x-box, it's using the mid, and I've got the desktop on the right. 

And finally, the question: Does Rainmeter have the capability to adjust for the above situations on the fly? Ie, I set up 3 different configurations, and based on what's plugged in and turned on, Rainmeter can adapt? Or would I need to manually switch between layouts? (And if I need to go manual, is there a way to build that switch somehow into the layout itself - like clicking on ""use subreddit style"" for example? Alternately, can it be hotkeyed?)

Thanks!",2015-11-23 16:44:13+00:00,cxa9jwi,1.0,t3_3txw3r,10750.0,starcraft
283,Sounds like they were appealing. ,2015-11-21 00:58:16+00:00,cx7izuc,4.0,t1_cx70e80,30476.0,AskReddit
284,"Noob here, but isn't ToM recommended for the Sisters too? ",2015-11-20 20:11:12+00:00,cx795ib,6.0,t1_cx78ija,981.0,DestinyTheGame
285,"Got it. Thank you, this is awesome. ",2015-11-19 18:49:46+00:00,cx5zech,3.0,t1_cx5xlmj,2614.0,DestinyTheGame
286,"I'm confused. Today is Thursday, so if I'm 3 at 2178, I should turn in. But what if I'm 3 and 2000? What's the reason to wait that last 178? (I'm sure it's obvious and I'm just missing it.)",2015-11-19 17:50:07+00:00,cx5wxu2,1.0,t3_3tge75,1985.0,DestinyTheGame
287,"I'll come. GT: CPH Apple Cider

Mostly Y2 player, have a mic, have done VoG (once), 305 warlock

*Edit: oh yeah, need it for my NTTE too! ",2015-11-17 19:26:55+00:00,cx3m2tf,1.0,t3_3t5erx,25029.0,DestinySherpa
288,More chances for the elusive Helium Extractor ghost that people claim exist! ,2015-11-17 01:05:16+00:00,cx2qpyv,3.0,t1_cx2injk,12886.0,DestinyTheGame
289,Ahhh. Gotcha. ,2015-11-17 00:53:47+00:00,cx2qb4u,7.0,t1_cx2q1tt,440.0,DestinyTheGame
290,"Does that mean you have multiple accounts, or play on XB1 and PS4 both? ",2015-11-17 00:45:12+00:00,cx2q0cc,5.0,t1_cx2ov9s,1935.0,DestinyTheGame
291,"I have seen it, but thank you all the same. Overwhelming amounts of information in spreadsheet format are my favorite. I don't think I saw that stuff at the bottom though, I'll check that out for sure. ",2015-11-17 00:16:29+00:00,cx2ozq0,4.0,t1_cx2li4t,5704.0,CruciblePlaybook
292,"Nice! I came up with the same answer about spawning with more by re-reading that sniper comparison thread, but I didn't know that ammo pickups were not affected. Either way, thank you, that's solid info. ",2015-11-16 22:24:23+00:00,cx2kugy,2.0,t1_cx2kedb,688.0,CruciblePlaybook
293,Cool video. Tiny nit-pick tip for your next one: [add a black outline to that text to improve readability.](http://i.imgur.com/pQjoQ.png?fb),2015-11-16 19:19:32+00:00,cx2d7pm,1.0,t3_3sz2p4,59040.0,CruciblePlaybook
294,That's a fair point. ,2015-11-16 18:56:07+00:00,cx2c9xd,4.0,t1_cx2bs51,726.0,CruciblePlaybook
295,This is an excellent example of high level information that I'm looking for. ,2015-11-16 18:41:43+00:00,cx2booa,2.0,t1_cx2bhfv,290.0,CruciblePlaybook
296,"Agreed on both points. I'm mostly looking for some of those specifics. SUPER high level tips about communication and turn off vibration are great, and I understand there's no change there. 

I'm mostly talking about things that are probably so second nature to a Y1 player that you forget that the new people may not know them. (It's hard to give examples without being a Y1 player, but my thing about, ""+ammo bonuses do/don't stack (I still don't know the answer)"" is the kind of thing I'm looking for.)",2015-11-16 18:30:51+00:00,cx2b8hl,2.0,t1_cx2axvk,432.0,CruciblePlaybook
297,"So, again, I could be wrong about this, and please correct me. But here's where I got concerned. (The following is from [The Trials of Osiris Playbook for Beginners [work in progress]](https://www.reddit.com/r/CruciblePlaybook/comments/380ch8/the_trials_of_osiris_playbook_for_beginners_work))

1. Equip Thorn as your primary weapon.
2. Equip a properly rolled LDR 5001 or Her Benevolence as your sniper rifle.
3. Equip Tomorrows Answer, or a properly rolled The Dreamwaker/Radegasts Fury/equivelant Legendary rocket launcher.
4. Play as a Gunslinger, Sunsinger, or Striker.
5. LET'S TALK PVP BUILDS (*editor: Are any of these still valid?)

These are a small handful of things that, I am assuming, make that an outdated guide. Yes, tips about calling things out and play with low sensitivity and turn off vibration are all still relevant. I'm talking about some of the more specific things. ",2015-11-16 18:28:16+00:00,cx2b4ot,2.0,t1_cx2ankt,706.0,CruciblePlaybook
298,"Lowly Y2 player here: could we change the bot to say ""The Dark Beyond"" instead of ""We've Woken the Hive on the Moon"" (for Captivating Light, if not at all times.) I realize it's a little more spelled out on some dailies, but I just stupidly spun in circles trying to find a mission called ""We've Woken the Hive."" ",2015-11-12 23:04:04+00:00,cwy91sj,1.0,t3_3silte,50336.0,DestinyTheGame
299,"He main mean, ""Where on the internet did you find the art assets?"" 

And if he didn't mean that, I do ;)",2015-11-12 22:22:46+00:00,cwy7fq6,3.0,t1_cwxtumr,19915.0,DestinyTheGame
300,"Also the names of his victims:

Isreal, Moreno, Hitman

Erik, Isreal, Hitman. 
",2015-11-12 21:16:32+00:00,cwy4smo,3.0,t1_cwy4o5g,181.0,DestinyTheGame
301,"Very nice, thank you. ",2015-11-12 20:14:24+00:00,cwy27cp,2.0,t1_cwxxn9z,6626.0,DestinyTheGame
302,"Nice, thanks! ",2015-11-12 20:13:28+00:00,cwy25yy,2.0,t1_cwxxjik,6720.0,DestinyTheGame
303,"Gotcha, thank you! ",2015-11-12 20:13:22+00:00,cwy25sv,3.0,t1_cwy20q8,201.0,DestinyTheGame
304,Mind posting it if it's convenient? ,2015-11-12 20:12:58+00:00,cwy255r,2.0,t1_cwxyfvb,5384.0,DestinyTheGame
305,"Is the VoG/CE sparrow faster than the one you got along with the Old Guard emblem/shader (or whatever it's called - the one you get from owning Dark Below and HoW OR being 30 before TTK came out)? If the servers weren't down, I'd have names of things. ",2015-11-12 20:06:49+00:00,cwy1w0b,1.0,t3_3sirla,34385.0,DestinyTheGame
306,"I think opaque means the opposite of what you think it means. 

You may have meant transparent or translucent. 

[The more you know!](http://i.imgur.com/HshcIwg.gif)",2015-11-12 18:18:02+00:00,cwxxee6,2.0,t1_cwrfrp1,487103.0,xboxone
307,"i7-2600 @ 3.4 GHz

12 GB RAM

GTX 460

Power supply: Corsair HX 750w

Why me? I'm not special, but I put this together around 3-4 years ago, have not upgraded it since, and since I just got married in October, really need to tighten the belt. Weddings are stupid expensive :( 

Awesome giveaway though! ",2015-11-11 17:59:06+00:00,cwwq725,2.0,t1_cwwfrjt,19574.0,starcraft
308,"I was making a weak pun on ""the four races are posts."" So, which kind of posts? 

I'll see myself out. 

*Edit*: Pun isn't even the right word. I'll see myself even further out. ",2015-11-10 21:26:02+00:00,cwvroct,4.0,t1_cwvrgzh,303.0,DestinyTheGame
309,"Praise be, [Brother Ruxin.](http://www.fantasyfootballfools.com/wp-content/uploads/2011/12/Ruxin-Shiva-Blast-600x320.jpg)",2015-11-10 21:20:51+00:00,cwvrgss,3.0,t1_cwvfb6r,17874.0,DestinyTheGame
310,Yes but what kind of posts are they? ,2015-11-10 21:18:42+00:00,cwvrdn1,2.0,t1_cwvkeci,10222.0,DestinyTheGame
311,"He dropped all the weight and is now jacked, engaged to a hot chick, and living in NYC working as an actor, his dream job.

Sucker. ",2015-11-10 03:55:33+00:00,cwuym1z,1.0,t3_3s4sq7,50584.0,AskReddit
312,Your men are already dead. ,2015-11-07 03:56:57+00:00,cwrhgd5,5.0,t1_cwrfdt9,4188.0,funny
313,Magenta and lime green. Obviously. ,2015-11-06 21:34:50+00:00,cwr4p0j,1.0,t3_3rrron,22601.0,Random_Acts_Of_Amazon
314,"I shadowed a Light, but at the end of 6ish hours, Cadre Daniel asked everyone if they wanted to keep going. Pretty sure we were out there for more like 10 hours, and they definitely needed their headlamps - and it was in the summer. 

2 is 1 and 1 is none. Store it in your car for emergencies after. ",2015-11-06 21:33:05+00:00,cwr4mfd,2.0,t1_cwqtxuz,15237.0,Goruck
315,"Gotcha. Having the Alchemist Raiment roll with ""increased armor while using a void based class"" seems pretty silly, so I really hope they will eventually change. ",2015-11-06 17:32:52+00:00,cwquiou,9.0,t1_cwqsk7r,2819.0,DestinyTheGame
316,"Super noob question, but I've searched and been unable to find a definitive answer: do the kiosk perks/stat rolls ever change? ",2015-11-06 16:36:02+00:00,cwqs5nd,7.0,t1_cwqm01d,10515.0,DestinyTheGame
317,Hero!,2015-11-06 05:27:15+00:00,cwqd67w,7.0,t1_cwqa8qc,5655.0,DestinyTheGame
318,"Ah, fair enough. If I was higher than rank 3 I'd volunteer to just test it manually (keep all 5 guns on me and see what he brings to the table Wednesday). 

Maybe someone over rank 5 can take one for the team?",2015-11-05 14:18:54+00:00,cwpdpcn,4.0,t1_cwp5qpl,27152.0,DestinyTheGame
319,Sunsinger post from 2 days ago: https://www.reddit.com/r/DestinyTheGame/comments/3r6vkv/an_indepth_sunsinger_guide_now_updated_for_the/ ,2015-11-04 22:01:52+00:00,cwoo5ro,2.0,t1_cwo3nbn,29764.0,DestinyTheGame
320,Roger that. Thank you! ,2015-11-04 21:15:13+00:00,cwom42b,6.0,t1_cwolzwh,156.0,DestinyTheGame
321,"I think that's how all bounties work, right? Like if Petra had the same bounty 2 weeks in a row, and you hadn't completed last week's, then turning it in now will not let you pick up the new copy. Same goes for dailies, in my experience.

Disclaimer: Y2 player, barely know what I'm doing, but that's what I've observed so far. ",2015-11-04 21:10:09+00:00,cwolvyy,2.0,t1_cwo2qn1,28801.0,DestinyTheGame
322,"Excellent. I have 1 flight, 3 identity, and 1 judgement chilling in the bank so far. 

(Also 9 radiant shards, 8 ascendant shards, 7 radiant energy, 11 ascendant energy - if there's anything off the top of your head I should save/use those for in terms of shaders/emblems/ships/whatever, I'm all ears!)",2015-11-04 21:00:19+00:00,cwolgk0,8.0,t1_cwokme3,1124.0,DestinyTheGame
323,"Right on, thank you. ",2015-11-04 19:39:27+00:00,cwohvrl,6.0,t1_cwohrrj,153.0,DestinyTheGame
324,"Dumb question: is that also the only way to get those ships/shaders? Is this recommendation to dismantle them aimed at Y1 players who already have them? 

I'm a Y2 player and I like collecting everything. Please advise! ",2015-11-04 19:32:17+00:00,cwohkmg,4.0,t1_cwocese,7056.0,DestinyTheGame
325,"&gt; Pinski file

https://youtu.be/d3NlnLySnq0?t=4m08s",2015-11-04 16:56:19+00:00,cwoar39,5.0,t1_cwo65m5,6754.0,DnDBehindTheScreen
326,"I'm not an official Sherpa or anything, but if anyone wants to tag my name for help on Xbox next time, I can lend a hand. Got mine last night on the 2nd attempt.

We had a full fireteam - one buddy who has 3 310+ guys on his PS account (recently switched to Xbox to play with more friends), and another friend. I think we were 293, 295, 298 - ish. (My max is 303 but I was not wearing max LL gear). 2 of us had swords. First attempt was a wipe due to not-enough-aggression during the boss fight, second attempt corrected that.

Ran it again to get a 4th friend his (same 2/3 from the first run); ended that run in 1 attempt with 2 minutes to spare. ",2015-11-03 21:47:47+00:00,cwndtju,1.0,t3_3rcfmb,33494.0,DestinyTheGame
