,body,created,id,nest_level,parent_id,reply_delay,subreddit
0,"Most typed phrase: ""break down."" ",2016-11-21 01:28:26+00:00,da8x209,3.0,t1_da8qihb,9647.0,AskReddit
1,"I have no reason to doubt you, but do you happen to have a source? I'm just curious if blizzard ever acknowledged this at all. ",2016-11-20 16:18:27+00:00,da89gv4,7.0,t1_da8183o,22501.0,woweconomy
2,There were rumors that you could get mechanohog parts but I've never seen it personally. ,2016-11-19 17:28:31+00:00,da74iyo,5.0,t1_da6wj3p,15256.0,woweconomy
3,"Hey, if that gun wants to identify as a PC, who are you to shoot it down. ",2016-11-18 16:49:45+00:00,da5tx6d,4.0,t1_da5pst7,5355.0,buildapc
4,"No. Because English is made out of nonsense, ""its"" is possessive, and ""it's"" is a contraction for ""it is."" 

Good luck: http://theoatmeal.com/comics/apostrophe",2016-11-16 19:13:51+00:00,da347k9,11.0,t1_da31kxn,3163.0,worldnews
5,"This has certainly brightened my day. 

http://i.imgur.com/4cKaA.gif",2016-11-16 19:09:48+00:00,da340i0,14.0,t1_da327tk,2167.0,worldnews
6,"""it is"" users. ",2016-11-16 17:36:23+00:00,da2zbyn,9.0,t1_da2z8td,103.0,worldnews
7,Can't tell if that typo is intentional. ,2016-11-16 17:33:09+00:00,da2z633,7.0,t1_da2t0lr,7616.0,worldnews
8,"This is Fist of the North Star, right? ",2016-11-09 23:27:35+00:00,d9tk9xj,4.0,t1_d9tfyxa,5561.0,malefashionadvice
9,Depends on whether you can walk without rhythm. ,2016-11-09 23:26:18+00:00,d9tk7vr,3.0,t1_d9tiyby,1701.0,malefashionadvice
10,"Gemstone is still alive. I don't play, but I briefly came back last year. Just couldn't do it. ",2016-11-07 21:36:30+00:00,d9q504t,7.0,t1_d9q116m,4616.0,AskReddit
11,"I'm 99% sure it used to be like that. I haven't ignored someone since vanilla, so when I read this I thought the only way he did that was ignore, unignore, whisper, log off. ",2016-11-07 13:42:02+00:00,d9pib2n,4.0,t1_d9pecix,10289.0,wow
12,You negative love it. ,2016-11-04 14:15:17+00:00,d9lhgl6,3.0,t1_d9les50,4101.0,woweconomy
13,"Yeah - I picked up a Sprite Darter Hatchling (or 3) 43 days ago. Avg price 3700 to buy, sold my first one today for 19,000. Just a question of how much bag space you want to devote to something that could take over a month to sell. I love seeing the % profit on that kind of thing, so I don't mind as much. ",2016-11-04 06:47:33+00:00,d9l6osc,4.0,t1_d9kjvix,34719.0,woweconomy
14,"I shadowed a Daniel ""light"" that went at least 10 hours. That guy is rad. So cool of him to offer more at the 6 hour point, and cool of the class to be up for it. ",2016-11-03 15:08:49+00:00,d9k15o9,2.0,t1_d9jw91l,6841.0,Goruck
15,Two sentences. No one has that kind of time. ,2016-11-03 13:25:35+00:00,d9jwngz,5.0,t1_d9jbpsn,41151.0,videos
16,Read this in Tina's voice (from Bob's Burgers.),2016-10-31 04:53:02+00:00,d9eze1y,9.0,t1_d9ehxo3,24520.0,AskReddit
17,https://youtu.be/vLhPeNcwHr0,2016-10-30 23:48:49+00:00,d9emhsz,2.0,t1_d9ek6s4,3117.0,firefly
18,It's actually a great example if you disagree with his main argument. ,2016-10-27 09:47:36+00:00,d99rpof,8.0,t1_d99qy8l,2772.0,funny
19,"1. This sucks, and it sounds like you've got a legitimate case.
2. Just keep the tickets flowing until they resolve it. 

That said, as someone who works in customer support, ""It's been 24 hours,"" made me sad. I don't know if the ratio of GMs to Players is publicly available, but my guess is that it's not great. If every GM was expected to reply to every ticket immediately, you'd need several hundred thousand GMs. Be patient, be respectful (which you totally have been), and be persistent. Someone will notice that the ticket has 20 replies on it and ask why his or her coworkers are failing to help you. ",2016-10-25 14:41:42+00:00,d9725hi,1.0,t3_59b36h,3356.0,woweconomy
20,"First and most importantly: [Kronk is the best.](http://i.imgur.com/qY49h5L.gif)

Next: Thanks for the awesome reply. I clearly have not given the usefulness of cantrips enough consideration. ",2016-10-22 06:28:57+00:00,d92shkm,6.0,t1_d926fyd,39146.0,3d6
21,"So I've been thinking about EK for my next campaign, and having never played one, I'm confused. You're talking about adding cantrips to the mix at level 7? Are they really that useful? Or temp 5 hp at level 8? This just seems like such a small gain to dip Wiz for. ",2016-10-21 18:00:13+00:00,d921twz,4.0,t1_d920nr2,1440.0,3d6
22,"I'm thinking about the twink thing myself, but is the entire thing reliant on skinning/herbing? Could you do like mining/JC, or are the big gems gated too much? (Sorry to derail a bit OP - I'm planning to check out your blog too!) ",2016-10-21 14:39:54+00:00,d91sc4s,2.0,t1_d91ay76,40731.0,woweconomy
23,"This is a bug, right? ",2016-10-20 15:33:48+00:00,d90epc9,5.0,t1_d90bysu,3343.0,wow
24,Ah. The old... I'm on mobile and it's too much work. ,2016-10-20 15:18:25+00:00,d90dx6t,6.0,t1_d90cfmn,1824.0,AskReddit
25,"Oh! See I wasn't sure if you meant to type ""region"" and auto correct gave us ""religion."" Thank you for clearing that up! ",2016-10-17 21:19:58+00:00,d8waqao,8.0,t1_d8wagid,343.0,videos
26,Region? ,2016-10-17 21:11:45+00:00,d8wac5f,6.0,t1_d8w9xzb,481.0,videos
27,I believe in you. ,2016-10-17 14:32:18+00:00,d8vqihx,12.0,t1_d8vp2mz,2115.0,gaming
28,"Holy shit man, commas. ",2016-10-17 13:03:35+00:00,d8vn3ln,10.0,t1_d8ve0c5,25771.0,gaming
29,Eli5 please - this seems like the opposite advice of the rest of this thread. ,2016-10-15 03:31:56+00:00,d8sosoc,3.0,t1_d8sb1fm,22460.0,woweconomy
30,That's not how sarcasm works. ,2016-10-15 03:16:27+00:00,d8soafx,6.0,t1_d8sjs3s,7779.0,Minecraft
31,All leather wearers. Which is kind of a shame because I was thinking about running old content on one of each armor type for wardrobe purposes. ,2016-10-02 21:23:01+00:00,d8baasd,2.0,t1_d8atgha,22471.0,woweconomy
32,It's not gay if it's gay. ,2016-09-30 18:45:16+00:00,d88mz2w,5.0,t1_d88jpiw,4334.0,todayilearned
33,"[No, this is a temple block.](https://i.ytimg.com/vi/nRM8p2re_cY/hqdefault.jpg)",2016-09-30 14:59:39+00:00,d88cqlp,4.0,t1_d87yu0w,34405.0,pics
34,"I think this is a great idea, but I wonder if a Discord chat channel would make even more sense. Plenty of quick one-off questions could be answered in more or less real time that way.",2016-09-28 15:01:14+00:00,d85jt7r,1.0,t3_54w04m,10176.0,woweconomy
35,"Totally agreed. I deal with the refreshes all the time because I buy and sell a silly amount of things. I'm a weirdo who thinks this sort of thing is fun. That said, if ever you DO buy a lot of stuff, the ability to hit ""open all"" and then tab out and dick around on Reddit is great. ",2016-09-28 14:59:36+00:00,d85jqgj,12.0,t1_d85ji13,293.0,wow
36,"Hey man, I don't want to tell you how to live your life ;)

(But TSM also covers your mailbox - click ""Open All"" and grab a glass of water.) ",2016-09-28 14:35:27+00:00,d85ilrk,10.0,t1_d85if45,247.0,wow
37,"At the risk of cutting into my own profits, I highly recommend you use TSM (TradeSkillMaster) even only as a buyer. (Disable all the modules that aren't the base + Buying, to save yourself some RAM.) You can punch in ""Starlight Rose"" and with a mouse wheel macro (that the addon creates for you), you can buy 200 single stacks in a couple of seconds. It's an intimidating addon for sure, but very worth it if you buy things on the AH at all. ",2016-09-28 14:26:27+00:00,d85i78v,8.0,t1_d85hmb9,796.0,wow
38,"The buyer is not aware of the AH price, the buyer wants 1000 of the thing but it's only available in stacks of 5 on the AH, the buyer is in Dalaran and in a hurry. 

Edit: There's no reason to downvote the guy I'm replying to - this is a perfectly reasonable question. I never understand why questions would be downvoted.",2016-09-28 13:45:32+00:00,d85ghk1,6.0,t1_d85gcve,189.0,wow
39,"Bastion of Twilight. 

Unless something changed that I don't know about, you can use a [Potion of Treasure Finding](http://www.wowhead.com/item=58488/potion-of-treasure-finding) to increase your gains. My understanding is that you basically need to be a tailor to get the extra cloth. ",2016-09-27 14:06:33+00:00,d843ixp,3.0,t1_d842q0c,1255.0,woweconomy
40,"Hey, I know this post is way late, but I keep referring to your and /u/0b607a's tables, and I have a question: 

Do you guys keep getting missions requiring Holy Nova specifically? I'm currently looking at 4 missions with it, with Calia on the bench (I'm following the Alonsus ally route). 

In an effort to actually level these guys up and gear them instead of constantly swapping who I have active, I'd like to stick with one or the other approaches. Maybe I'm just getting really bad RNG, but it feels like Holy Nova (aka Sol) is always in demand. ",2016-09-19 15:03:50+00:00,d7t7055,,t1_d7b9nus,,wow
41,"I didn't think it needed a ton of explanation, but here's the first sentence:

&gt; Australia, sometimes known in technical contexts by the names Sahul, Australinea or Meganesia, to distinguish it from the Australian mainland, is a continent comprising mainland Australia, Tasmania, New Guinea, Seram, possibly Timor, and neighbouring islands.

The relevant parts:
&gt; Australia... is a continent...

As I say further down, I still think it's fine to call it both an island AND a continent. This is the most ridiculous use of all of our time. ",2016-09-15 17:52:08+00:00,d7o3gdw,11.0,t1_d7nxl0s,7229.0,funny
42,"https://en.wikipedia.org/wiki/Mainland_Australia

&gt; This article is about the main island. For the continent, see Australia (continent). 

This is what we get for using Wikipedia for our semantic battles. They call the mainland an island, but also that + the surrounding islands make up the continent. Everyone should call it a continent, but I can see allowing ""Australia"" to be called an island. Whatever. ",2016-09-15 05:06:55+00:00,d7nglyn,13.0,t1_d7ndpjd,5711.0,funny
43,Cuba is an island and a country. You can be two things. ,2016-09-15 03:17:47+00:00,d7nd7q7,11.0,t1_d7ncq4m,788.0,funny
44,https://en.m.wikipedia.org/wiki/Continent,2016-09-15 02:48:32+00:00,d7nc3n9,9.0,t1_d7na4m4,3017.0,funny
45,Oh right - I think the only way to get those rush orders is through missions. ,2016-09-14 18:54:23+00:00,d7mrhvq,4.0,t1_d7moco2,3854.0,woweconomy
46,"Is the reason for Primals so that you can get around the daily limit on War Paints? It seem like using the hut or the profession have a better return on the amount of pigment required, but obviously you're time gated that way.

Have people done the math on primals vs. garrison resources to buy rush orders? ",2016-09-14 16:21:20+00:00,d7mk1i9,2.0,t1_d7miz5i,1354.0,woweconomy
47,"If he's me, the answer is Ivan Ivanovich/sturzen.kultur@gmail.com 

Dark PBT BLANK keyset $37

Dark PBT PRINTED keyset $65

GROUPBUY FEE $5

Total including shipping + PayPal fee: $76.76

Order placed 6/18/15. It's been pretty much confirmed that this seller has vanished, despite having run several actual group buys prior to this one. I'm pretty bummed, and won't be doing another group buy based on this experience. 

Edit: If you want the original post: https://geekhack.org/index.php?topic=71995.0",2016-09-13 02:53:48+00:00,d7khuiy,6.0,t1_d7k9au5,12196.0,MechanicalKeyboards
48,"In other words, I was way off. In my defense, the things I listed can look exactly like the things he's actually using. ",2016-09-09 21:17:49+00:00,d7g6mmb,3.0,t1_d7fqd6v,20991.0,battlestations
49,"Looks like ElvUI for the action bars and unit frames, some map addon (SexyMap?), and Forte or CoolLine for the cooldowns. ",2016-09-09 15:27:58+00:00,d7fqd6v,2.0,t1_d7foyl0,1843.0,battlestations
50,"Can't you just flip the red and whites? (Unless those only connect with a 3.5mm, right?) ",2016-09-09 15:17:21+00:00,d7fpvd0,2.0,t1_d7flolt,5909.0,battlestations
51,"M'Kilrogg

(tips Helm of Precognition) ",2016-09-08 05:42:18+00:00,d7dv8mj,9.0,t1_d7d37sy,41682.0,wow
52,"I may be wrong, but does dispersion maintain the level if you drop combat? Maybe if you pop it while in combat it does, but if you leave combat and then pop it, it does not. ",2016-09-07 04:21:35+00:00,d7cfo4p,3.0,t1_d7c2s1a,20298.0,wow
53,"Politely disagree. I think a lot more ""regular"" people (meaning people who are not fans of either sci-fi or fantasy) have seen Star Wars. ",2016-09-07 04:17:00+00:00,d7cfjao,3.0,t1_d7cfb6r,456.0,wow
54,You just blew my mind. ,2016-09-06 13:30:14+00:00,d7bg5o8,5.0,t1_d7bem6m,3079.0,wow
55,"This is where I struggle. Do I buy ore at 80g each, even though that price is crazy? Because the next auction up is 270g. But is the only person buying it at 269 some sucker like me? Should I not buy anything in these first few days and just post and hope? ",2016-08-30 19:04:31+00:00,d72ytmn,3.0,t1_d72owxq,12821.0,woweconomy
56,"If you're like me, you tried Events after Battle Pets failed without /reloading first. Reload and try Events again. Worked for me. ",2016-08-30 18:30:30+00:00,d72x8ov,3.0,t1_d727fay,51719.0,woweconomy
57,Honestly I would have said last week was the time. But that's not super helpful. This is probably the best time for the next long while. ,2016-08-30 08:10:19+00:00,d72cyra,2.0,t1_d72cmjh,1191.0,woweconomy
58,"Read the first sentence, thought of this post. Sorry bro.

http://imgur.com/a/98AS2

*Edit: Maybe the last 2 as well.",2016-08-30 07:23:47+00:00,d72c51m,1.0,t3_50996m,11604.0,wow
59,Weird. Working now though - thanks! ,2016-08-29 18:01:00+00:00,d71hi0g,4.0,t1_d71fzcy,1935.0,Coffee
60,Hey Matt - the code doesn't seem to be working just yet. Wanted to give you a heads up. ,2016-08-29 17:17:48+00:00,d71fguh,2.0,t1_d71aa0p,6856.0,Coffee
61,"Usually not more than vanilla, as I understand it. Depends on your goals I suppose: vanilla for sniping and storage only, full account if you want max level crafters (but do you NEED an 11th character with alchemy?) ",2016-08-29 03:59:32+00:00,d70t9i8,2.0,t1_d70s4zg,2047.0,woweconomy
62,"Course he did.
&gt; a solid 8",2016-08-28 05:30:04+00:00,d6znzd5,7.0,t1_d6zl2eo,6465.0,funny
63,"&gt; 14.16% movespeed

That's practically an entire [Outlaw rogue talent.](http://www.wowhead.com/spell=196922/hit-and-run)

*Edit:
&gt; basically getting a Druid talent for free

I just read that. I don't know how I missed it. You win. ",2016-08-28 02:40:51+00:00,d6zj6db,2.0,t1_d6yag2x,92027.0,wow
64,"Disclaimer: if you get a refund, you have to stop complaining about the game. Choose wisely. ",2016-08-27 17:27:53+00:00,d6yzjbt,1.0,t3_4zslu6,48323.0,gaming
65,Artist is Megan Lara. She has a lot of awesome nerd related art. ,2016-08-26 14:41:08+00:00,d6xjer3,2.0,t1_d6wziaq,44351.0,firefly
66,So awesome. Just saw this on Facebook and knew I had to make sure it was here. Good looking out /u/studabakerhoch,2016-08-26 07:47:39+00:00,d6x8vpb,1.0,t3_4zn0vg,8483.0,listentothis
67,"I just finished reading PayPal Wars, so Peter's name caught my eye. Great read if you're interested in startups/Silicon Valley culture. ",2016-08-21 07:50:14+00:00,d6qduse,7.0,t1_d6q0row,25923.0,funny
68,"My understanding is that the addons are wrong, but on the side of caution. Meaning they say you haven't learned something that you actually have, not the other way around. 

Annoying, but much better than the reverse. ",2016-08-20 17:19:43+00:00,d6pkhkn,5.0,t1_d6ph1v1,5393.0,woweconomy
69,I think he's a New X-Man. ,2016-08-20 17:11:57+00:00,d6pk6ui,2.0,t1_d6pjvm3,491.0,xmen
70,The future is here! http://www.instructables.com/id/Arduino-Automatic-Watering-System-For-Plants/ ,2016-08-19 06:36:01+00:00,d6nr92f,4.0,t1_d6nqwpz,899.0,Cyberpunk
71,If you can program an arduino to alert you when your plant needs water... maybe that's not too far off? ,2016-08-19 03:32:06+00:00,d6nlqwp,2.0,t1_d6nhzum,5727.0,Cyberpunk
72,"https://mods.curse.com/addons/wow/monars-wardrobehelper

I like this one a lot, but I basically just installed it, so I'm not an expert. Biggest thing I like about it so far is that you can break it down by source: show me what I need to collect from Dire Maul, etc. ",2016-08-17 05:43:19+00:00,d6ksh6h,1.0,t3_4xvgy7,121648.0,WowUI
73,Ah makes sense. I'm nothing close to an artist so I don't know the rules or what's available in the way of free skyline photos. ,2016-08-15 21:11:36+00:00,d6ituh8,3.0,t1_d6itlzo,313.0,Cyberpunk
74,This is awesome. If you did some recognizable skylines (Chicago and Minneapolis are my personal requests) you could probably make a couple bucks on Etsy. ,2016-08-15 20:34:11+00:00,d6is38r,1.0,t3_4xun92,11954.0,Cyberpunk
75,"Gotcha, thank you. Technically the invasion blues are Wed content, right? I suppose I could just text this. ",2016-08-15 20:27:24+00:00,d6irrqp,7.0,t1_d6iohxj,4112.0,woweconomy
76,Noob question: could you take your non enchanter to a garrison enchanting hut to DE? ,2016-08-15 18:54:25+00:00,d6ingo6,5.0,t1_d6iksxw,3329.0,woweconomy
77,"In what way? I didn't know this existed until this post, and now I need it. ",2016-08-08 18:36:02+00:00,d69c2a0,5.0,t1_d6952ud,9000.0,battlestations
78,"So from some addition non-scientific research (taking a photo and trying to measure things), they LOOK like they should fit. But neither cap sits on the other's stem. I'm confused. It's like both stems are too big for the other's caps, which doesn't make any sense.

Here's my non-science: http://imgur.com/Vkst616",2016-08-07 19:38:54+00:00,d6847oc,3.0,t1_d67mtp9,37299.0,MechanicalKeyboards
79,"Just something I came across at a thrift store today. I grabbed it thinking I could use the keycaps, but alas - they have that Cherry cross, but they are not Cherry (they're a little too thick). 

Apparently you can own one too for $11: http://www.ebay.com/itm/291821104875?rmvSB=true",2016-08-06 23:57:42+00:00,d6784i2,1.0,t3_4wigoq,70.0,MechanicalKeyboards
80,Can't you just learn the pet then re-cage it on your other toon? ,2016-08-05 08:55:09+00:00,d654uwm,4.0,t1_d653g7v,4454.0,woweconomy
81,"Iron Man, who?, Tony Stark.",2016-08-05 07:30:10+00:00,d65388b,2.0,t1_d650stn,6074.0,Marvel
82,"Are they like, at least 10k? I just don't understand why someone would dupe a pet then throw it on the AH for peanuts. ",2016-08-05 07:26:34+00:00,d6535ia,4.0,t1_d652ui6,845.0,woweconomy
83,"I've never done it - but the vampire lady requires at least 3 people, right? Or 5? ",2016-08-05 07:10:58+00:00,d652ta4,2.0,t1_d64ikym,34167.0,woweconomy
84,Why would someone be putting them on the AH at sniper prices though? ,2016-08-05 06:58:15+00:00,d652j1m,2.0,t1_d6526ku,902.0,woweconomy
85,Jane Fonda Newsroom clip literally burn this building to the ground ,2016-07-27 04:11:50+00:00,d5sjren,6.0,t1_d5sjh13,511.0,IAmA
86,"For what it's worth, it looks like the team is on it. There have been like 5 updates to TSM today. ",2016-07-20 03:28:03+00:00,d5j47y8,2.0,t1_d5j1gqv,4212.0,woweconomy
87,"Nice. I hate that the game only shows you your own armor class. If I'm shopping on my monk, I want to know if that cloth item is relevant. Sounds like this is the answer. ",2016-07-19 22:25:00+00:00,d5irw5r,2.0,t1_d5irobj,295.0,woweconomy
88,"Can you start switching the same week you clear it on normal? I assume the normal trash wouldn't respawn, but would the heroic if you switched to normal then back? ",2016-07-15 21:03:56+00:00,d5dt9pw,4.0,t1_d5dlv11,10093.0,woweconomy
89,"Awesome. Makes sense, probably should have pieced that together on  my own, but good to have it confirmed. Thank you!",2016-07-14 17:03:07+00:00,d5c5wjb,3.0,t1_d5c0n5h,6697.0,woweconomy
90,"Hey all, two questions for you today: 

First one is about Sheyrah's Posting operations for transmog: what's the method to the madness behind min/max pricing? 

Here's what I mean:

Group|Min|Max|Normal
:--|:--|:--|:--
0-500|40% avg|100% avg|70% avg
500-1000|50% avg|100% avg|70% avg
1000-5000|50% avg|150% avg|100% avg
5k-20k|70% avg|150% avg|100% avg
20k-50k|80% avg|150% avg|100% avg
100k-250k|95% avg|200% avg|150% avg
250k-500k|95% avg|200% avg|125% avg (accident?)
500k-1000k|95% avg|200% avg|150% avg

Clearly there is a pattern of the %s increasing as the value of the item increases, but I guess I'm curious as to why. Why would I want to post a piece of gear that's worth 1000g as low as 50% of that, or conversely, if someone else has posted above maximum, why would I want to list it at 70%? Is the thought that a piece of transmog listed at 70% is much more likely to sell than one listed at 100?

Second: how is Region Avg Daily Sold calculated? I'd love to know how to intelligently weigh whether or not a piece of old world tailoring actually sells. It seems like 1 seller on my server has listed 1 of every vanilla crafted item for a very high price, but it doesn't seem like something worth investing time in undercutting if they never actually sell. ",2016-07-14 14:33:17+00:00,d5byz8z,1.0,t3_4satou,264316.0,woweconomy
91,I can't tell if you linked them backwards on purpose. ,2016-07-14 04:09:03+00:00,d5bjrpm,5.0,t1_d5bj9ax,949.0,leagueoflegends
92,"I've done 2 30's several times - they have 2 sleeves for this purpose, so I'm sure you'll be good to go. ",2016-07-13 18:40:53+00:00,d5ax6i6,1.0,t3_4snhs4,14357.0,Goruck
93,"Legally. Longboards. It's like they are making references to inside jokes (a very comic books thing to do) except these aren't jokes. They're just words. 

Hardwick or Jonah or whoever is behind this needs to put a leash on it. ",2016-07-13 18:39:21+00:00,d5ax3xz,2.0,t1_d5at8xh,4960.0,xmen
94,"&gt;my points are all mute

Moot. The more you know. ",2016-07-12 12:21:50+00:00,d593km4,5.0,t1_d58q9lr,34848.0,cardsagainsthumanity
95,"I'm something like 720, so I feel like this shouldn't be as big of an issue for me. Shadow priest AoE is not exactly impressive, so that's possibly part of it. Also I was pulling like, the entire first room at once, which may be aggressive. ",2016-07-09 20:41:38+00:00,d55w4e7,6.0,t1_d55q37p,10278.0,woweconomy
96,Do you find yourself getting too much pushback or silenced? Or is your pet doing the tanking? I feel like I'm doing something wrong (or maybe I'm just pulling too much at once?),2016-07-09 17:46:04+00:00,d55pxr8,4.0,t1_d55c2gi,35894.0,woweconomy
97,"Do you find that you need a tank for this? I feel like my shadow priest is too squishy for this. 

(Also, 10 or 25?) ",2016-07-09 05:40:11+00:00,d559e8s,2.0,t1_d54hjdl,44658.0,woweconomy
98,Excellent. ,2016-07-04 12:57:38+00:00,d4yq5bg,5.0,t1_d4yphbx,1870.0,AskReddit
99,Segreated? ,2016-07-04 11:39:52+00:00,d4yolnp,6.0,t1_d4ym8ji,8700.0,funny
100,Agreed! I looked at it for way too long trying to figure it out. ,2016-07-02 01:37:30+00:00,d4w4rlp,4.0,t1_d4vvipz,15665.0,GameDeals
101,"So I don't know if you meant ""tied"" as the past tense of ""tie,"" or it was a typo, or what, but it made me question if I was saying that phrase wrong. 

The phrase is ""tide over,"" which I guess makes the past tense ""tided,"" maybe. I don't know. http://www.merriam-webster.com/dictionary/tide%20over",2016-07-01 20:32:04+00:00,d4vtlfq,2.0,t1_d4vke9r,11945.0,GameDeals
102,"Hey, ho.",2016-07-01 20:23:31+00:00,d4vt85p,10.0,t1_d4vk0ru,11904.0,videos
103,https://gfycat.com/ThoroughCompetentAcornweevil#?speed=2,2016-06-30 17:01:13+00:00,d4u6i1s,6.0,t1_d4u0swa,7251.0,funny
104,"I would love to leverage my tailoring, enchanting, and JC, but I'm not clear on where to begin. The crafting window doesn't show me crafting expenses, which I'm not clear on (it seems to have data in terms of market price of the crafting materials - even ones that don't require BoP items). But is that essentially what you're doing? Seeing that X item costs Y and sells for more than Y? ",2016-06-28 19:32:10+00:00,d4rlk5n,2.0,t1_d4r63e8,21161.0,woweconomy
105,"I wasn't clear before: the es-87 + DSA Dolch is what I care about. This white case is good looking, but I think I prefer my black one. ",2016-06-27 03:03:54+00:00,d4pdox2,5.0,t1_d4p6vzs,10847.0,MechanicalKeyboards
106,"""for sale"" or ""on sale""? I see them at $110 now, but I feel like they're always at $110.

This is my end game - and my first mech is a black es-87, so I feel like we're basically brothers. ",2016-06-26 19:50:00+00:00,d4oxqde,3.0,t1_d4ovmp5,3481.0,MechanicalKeyboards
107,"Sorry, I meant not an option for me on this specific machine. I did settle on the 1080 because this was provided for me by my employer. (I was about to upgrade my desktop, where I was running a GTX460, and when they said they'd buy me a new Macbook, I convinced them that this machine would be both cheaper and more powerful. I have since come to regret this, because it is 10.5 lbs - I should have gotten a featherweight Macbook for work/travel and a grown-up desktop for gaming. Hindsight.) ",2016-06-23 15:48:24+00:00,d4kwo00,7.0,t1_d4ktux2,3577.0,wow
108,100%,2016-06-23 14:42:02+00:00,d4ktk6n,4.0,t1_d4ko7ux,9351.0,wow
109,Negative - not even an option. ,2016-06-23 14:41:08+00:00,d4ktiro,5.0,t1_d4ki9aj,28188.0,wow
110,Don't have 4k. ,2016-06-23 14:38:37+00:00,d4ktewq,2.0,t1_d4ks8dp,1727.0,wow
111,"Enabled for the laptop screen, not for the external. ",2016-06-23 14:38:17+00:00,d4ktedo,2.0,t1_d4krxxx,2179.0,wow
112,"It's actually a laptop (check the link in the post for the specs) - and I know what you're thinking, but look at the desktop-GPU and CPU in this before assuming laptop=weak performance. On paper, this thing should be crushing it. ",2016-06-23 05:20:55+00:00,d4kg3a0,2.0,t1_d4kfttc,593.0,wow
113,Wait isn't the speed from Speccy showing per-stick? So 2133/2 = 1066? ,2016-06-23 04:36:59+00:00,d4kev7j,3.0,t1_d4ketnq,89.0,wow
114,"Huh. That is odd. This is how it's advertised on Sager's site:

16GB Dual Channel DDR4 SDRAM at 2133MHz ",2016-06-23 04:35:30+00:00,d4ketnq,2.0,t1_d4kek9f,531.0,wow
115,"Just took a look - WoW is using 1500mb right now, with all addons turned off, and a fresh restart of WoW. I have no idea what normal is. ",2016-06-23 03:55:59+00:00,d4kdh0m,2.0,t1_d4kctbh,938.0,wow
116,"I've seen some similar behavior in League, but to be honest I haven't played League in quite a while. I don't seem to have any issues in Overwatch at all. ",2016-06-23 03:53:21+00:00,d4kdbxx,4.0,t1_d4kdaon,38.0,wow
