,body,created,id,nest_level,parent_id,reply_delay,subreddit
117,"Just disabled all addons, getting ~30fps on Ultra with No anti-aliasing and no vert sync in my garrison. ",2016-06-23 03:43:07+00:00,d4kcwk5,2.0,t1_d4kcu5o,123.0,wow
118,"Yep, on the ssd. ",2016-06-23 03:37:09+00:00,d4kcpik,2.0,t1_d4kco34,69.0,wow
119,"Yeah man, I didn't realize my lame joke would awaken the beast. Yeesh. 

Related: There are several recent-ish Steam releases for the franchise. Closer to the RPG experience, I'm told. http://store.steampowered.com/app/300550/ 

",2016-06-21 14:26:02+00:00,d4hzs9b,3.0,t1_d4hxpy2,3292.0,Cyberpunk
120,That has nothing on [this Sega Genesis game.](http://vignette2.wikia.nocookie.net/shadowrun/images/6/64/366854_57114_front.jpg/revision/latest?cb=20130702212550&amp;path-prefix=en),2016-06-21 06:51:19+00:00,d4hpn3x,1.0,t3_4p2s7x,9719.0,Cyberpunk
121,"Understood - but for people who cancel and repost, are they doing it every hour? I could easily do that process 10+ times a day, I just feel like I'm throwing money away on AH fees. 

*Edit - You're also welcome to criticize my current shopping/reposting approach. I have no idea if this is a good use of my time. It feels like I'm spreading it too thin - every kind of leather, every kind of dust/essence/etc, every herb. Buying low and selling a little bit less low.",2016-06-20 20:54:14+00:00,d4h4pen,3.0,t1_d4h0zd2,4814.0,woweconomy
122,"I'm afraid of canceling, but I'm not sure if that is warranted. 

Basically my approach has been to shop for crafting mats of all expansions, and repost, both using Sheyra's operations. I'll buy anything listed at 80% or lower, and throw them back up immediately. For the most part, this has been profitable, but it feels very slow. 

Since I work from home, I can run sniper in the background, and I could also be canceling and reposting all day, but I don't have any idea if that's wise. Are there any sweeping general tips on this? Thanks! ",2016-06-20 19:16:24+00:00,d4h05s5,1.0,t3_4oylxn,22430.0,woweconomy
123,"I won't even try and explain, I'll just hold on tight. ",2016-06-17 00:26:18+00:00,d4cdk5m,8.0,t1_d4bzmze,18940.0,gaming
124,"So no Surge, just a chicka Cherry Cola. ",2016-06-16 18:34:31+00:00,d4bxto4,6.0,t1_d4bqxbg,8303.0,gaming
125,"[Tony Hawk's Pro Skater 3 - Review date: October 29, 2001](http://www.gamespot.com/reviews/tony-hawks-pro-skater-3-review/1900-2820972/)

Now I'm trying to remember the state of the internet in 2001. Did you click on the review, then go grab a Squeeze-It or a Surge, while you waited for it to load? Maybe fire up WinAmp to listen to Gin and Juice ""by Phish""? 
",2016-06-16 12:33:32+00:00,d4bhjnh,4.0,t1_d4b7h0p,28368.0,gaming
126,"Awesome, thank you. ",2016-06-15 20:12:01+00:00,d4angxi,3.0,t1_d4al49d,2850.0,woweconomy
127,"Possibly a dumb question:

Is it necessary to wait for a TSM desktop update before reposting items you've sniped/bought to allow the databases to adjust for what's available?

Use case: I see a Large Prismatic Shard selling for 1c, region sale avg is 12g. I buy it. If I then run an Auctioning scan, will the database still think there's one for sale at 1c and return something like, ""Below minimum price"" and thus skip the posting? Or will it recognize that particular item is no longer available? When I hover over the item, I see ""8 auctions (37 min 47s ago), so it feels like the scan WILL think that the unit I purchased is still available.

I hope this makes sense. Thanks in advance! ",2016-06-15 19:00:46+00:00,d4ajyyn,1.0,t3_4nvhvg,194439.0,woweconomy
128,"He was making a joke based on you using ""waste"" instead of ""waist."" See, if your WASTE is 31""... you may have a medical issue. ",2016-06-07 20:56:07+00:00,d3zyo1z,4.0,t1_d3zxn0m,1310.0,frugalmalefashion
129,Alex?!,2016-06-06 16:10:54+00:00,d3y73kt,5.0,t1_d3y5x5f,1615.0,boardgames
130,Makes perfect sense. ,2016-06-06 13:08:30+00:00,d3xzz01,5.0,t1_d3xzt43,326.0,boardgames
131,"I managed to destroy my buddy's Arkham Horror BOARD - not a tiny tile/token/card. I feel like that's asking a lot from them, so I haven't. What do you guys think? A little greedy?

(By ""destroy"" I mean that I either tried to fold it the wrong way, or picked it up wrong, but I managed to tear it along one of the folding seams - it's totally still playable, it's just in two pieces.) ",2016-06-06 13:00:13+00:00,d3xzpzl,3.0,t1_d3xyzdw,1580.0,boardgames
132,"That's fair. I'm not competitive enough for that to be a factor, and my guess is there are a couple of people out there like me. Also I'm just one guy with a tiny sample size, so take the whole thing with a massive grain of salt. ",2016-06-03 19:42:23+00:00,d3uvte2,5.0,t1_d3uuy9s,1143.0,buildapcsales
133,"I enjoyed my deathadder for a while when I first got it - but it was also my first grown up peripheral purchase ever. Eventually, right click became mushy, whatever coating is on the sides started to peel, and the cord frayed. Even in that condition, I think of it as a step up, but my new Logitech G502 is the sexiest thing I've ever touched. ",2016-06-03 18:37:20+00:00,d3usuhl,3.0,t1_d3usqi5,145.0,buildapcsales
134,I bet your brother has some kind of monopoly on lists. You monster. ,2016-06-02 23:36:41+00:00,d3ts69d,7.0,t1_d3tgs83,16072.0,todayilearned
135,I may not have Accounting on - I'll check in a bit. Good catch! ,2016-06-02 01:21:30+00:00,d3sj608,3.0,t1_d3s72rx,17859.0,woweconomy
136,"I feel like this has to have come up before, but I can NOT find the answer.

Just imported all of Sheyrah's awesome TSM groups/operations, but I'm running into:

""Did not post [Maelstrom Crystal] because your minimum price (max (105% avgbuy, 90%avg(dbmarket, dbmarket, dbhistorical, dbregionmarketavg))) is invalid.""

I have read that ""avgbuy"" and ""avgsell"" can be an issue if you have no record of either. Another example is for setting the Primal Spirit price, I had to delete all the references to avgbuy of herbs (avgbuy(item:109124)) and just go with the dbmarket values - it refused to work otherwise. 

I just want to confirm that I'm not missing anything. In her PasteBin she says, 
&gt; For those of you that don't go buy 1 of each current expansion herb, I have a backup in the string to just reference the market value of herbs on your server. I had to put this back up in there because too many people were getting lost with tsm not showing a price for primal spirits because they didn't know they had to buy 1 of each current expansion herb.

But that didn't seem to work, I had to actually delete it.

Anyway, any help would be welcome. This affects a ton (maybe all?) of her custom prices as well - they're all based on avgbuy instead of market. (Side question: why? Why not just use market?)

Thanks all! ",2016-06-01 20:17:48+00:00,d3s6sx7,1.0,t3_4lpeth,199061.0,woweconomy
137,Wait. ,2016-05-19 16:03:02+00:00,d3bq5ck,4.0,t1_d3bla7p,6678.0,Overwatch
138,I have a 980 and have all kinds of lag/stuttering going on. Is it because I've got youtube on the 2nd monitor? I feel like I've tried everything. ,2016-05-18 19:47:02+00:00,d3an8wg,6.0,t1_d3ab30v,15552.0,wow
139,Totally agreed. Having great CS for a shit product doesn't really get you anywhere on its own. But it sure doesn't hurt the situation. ,2016-05-08 01:38:44+00:00,d2wz42x,2.0,t1_d2wugby,8828.0,wow
140,"How does that work when you can switch heroes on the fly? You get your +5, then someone else switches to support and now it says Need Tank +5. What's the cutoff? 

",2016-05-07 18:16:18+00:00,d2wkmyr,4.0,t1_d2wgdao,7397.0,Overwatch
141,"Awesome, thank you! Generally speaking, WoW updates in the background and unless I just never log out, I should be set in that department.

For a fan curve - is there a good rule of thumb I should go by in terms of how aggressive to set it and what an acceptable temp is while under stress? ",2016-04-25 18:56:31+00:00,d2gw1r6,2.0,t1_d2gvrfv,369.0,buildapc
142,Shoot. I had to look it up (thank you /u/coldgears) but I remember now. Oof. ,2016-04-25 14:06:20+00:00,d2givsd,6.0,t1_d2g8ana,31136.0,AskReddit
143,"Wait, is this a ""not my tempo"" reference?",2016-04-25 05:02:54+00:00,d2g7ook,4.0,t1_d2g0y0z,12254.0,AskReddit
144,https://www.youtube.com/watch?v=dLuLTOwn3N8,2016-04-24 07:45:33+00:00,d2f5skt,1.0,t3_4g76fl,3784.0,todayilearned
145,"Oh man, if only I hadn't JUST ordered a set of these in June of 2015 that I never received. ",2016-04-21 15:11:08+00:00,d2br8ih,1.0,t3_4fswvx,6703.0,mechmarket
146,Improvised explosive devices? ,2016-04-20 03:50:26+00:00,d29w5yj,2.0,t1_d29h1vh,20636.0,battlestations
147,"You both seem like you know what you're talking about.

WTB tips on getting [Not Even a Scratch](http://www.wowhead.com/achievement=1762/not-even-a-scratch) as a solo-queuer. ",2016-04-17 13:18:09+00:00,d269uxj,7.0,t1_d25vyh5,40393.0,wow
148,Thank you. Looks like this is part of a quest chain? Wowhead is failing me. ,2016-04-15 13:58:33+00:00,d23z0u0,4.0,t1_d21j5vh,154316.0,wow
149,"That's what it was. Thank you. Also what's the average time to 60 in full heirlooms, like 3 hours? ",2016-04-15 13:58:01+00:00,d23z031,3.0,t1_d218qp0,167379.0,wow
150,"I don't know, a bunch of my friends and I just came back. It's all a question of what you want to get out of it. We all played on and off for a decade, and none of us have seen the current raid, so we figured what the hell, let's get together one night a week and see what's ""new."" 

Oddly enough, a lot of us are putting in a lot more than one night a week in Ashran, because we're the type who hates to have sub-par gear for the actual raid night. Or we want to unlock flying, or try some mythic 5 mans, or whatever. 

There are reasons - but most of them revolve around NOT having a sub for the past year. ",2016-04-13 14:15:16+00:00,d215i3u,4.0,t1_d214cvn,1728.0,wow
151,"When you say ""the mount..."" ",2016-04-13 14:12:32+00:00,d215e2a,2.0,t1_d2104nw,10406.0,wow
152,There's something about wanting to make sure your professions are at a certain level so they get boosted too. Someone smarter than me can probably help. ,2016-04-13 14:12:05+00:00,d215ddf,1.0,t3_4el56y,9272.0,wow
153,A giant [ass-dragon?!](https://xkcd.com/37/),2016-04-13 14:09:48+00:00,d215a00,3.0,t1_d1zkkr8,107736.0,wow
154,"Jadelah - fire mage on my old US Skullcrusher. Sadly the higher quality versions seem to be behind a paywall here http://www.warcraftmovies.com/pv.php?t=3&amp;l=Soulsphere

but you can watch the potato version for free: https://www.youtube.com/watch?v=g7Xb4RN1VMg

Man I miss being undead. Best caster animations. ",2016-04-13 13:59:22+00:00,d214uze,2.0,t1_d1zy6zl,78240.0,wow
155,"This is not me, and I don't know anything about what makes a good tattoo, but I found this: https://s-media-cache-ak0.pinimg.com/736x/55/d1/c0/55d1c02423acfd9a3fc776f1d62bbc0d.jpg ",2016-04-06 15:27:43+00:00,d1s7kib,3.0,t1_d1s2245,8049.0,skyrim
156,"When you say basement, does that involve riding a column of water down and placing blocks as you go? That terrifies me. ",2016-04-05 16:38:04+00:00,d1qv6z2,2.0,t1_d1qog4d,9089.0,feedthebeast
157,"Maximum efficiency? 

German detected. ",2016-04-04 19:35:00+00:00,d1ppwc5,3.0,t1_d1pptf7,104.0,feedthebeast
158,"Gotcha. The ability to smash compressed blocks is SO nice, so I'm not sure if I'll ever actually use this now that I've graduated to compressed hammers. Thanks for the info! ",2016-04-04 18:20:14+00:00,d1pmih6,5.0,t1_d1pkqzn,2377.0,feedthebeast
159,Why does it exist? Just so you can smash dirt before getting a cobble gen setup? ,2016-04-04 14:57:24+00:00,d1pdm1x,3.0,t1_d1p1kix,32789.0,feedthebeast
160,Noob question but I have been unable to find it through Google: what does the Chicken Stick do? ,2016-04-04 04:40:36+00:00,d1ozs8a,1.0,t3_4d8g1t,19488.0,feedthebeast
161,https://www.youtube.com/watch?v=lg7MAacSPNM,2016-04-04 04:34:28+00:00,d1ozlx8,5.0,t1_d1owc3b,5342.0,feedthebeast
162,"Anyone able to point to a generic skyblock guide at all? I've seen the IEE guide, but that assumes you can just go mining and whatnot. ",2016-04-02 00:25:23+00:00,d1mgxoo,1.0,t3_4cxhzt,18369.0,feedthebeast
163,I mean this sounds pretty close to the religion joke I was making anyway. :) ,2016-03-29 20:13:45+00:00,d1i51gl,4.0,t1_d1i43dx,1161.0,firefly
164,"Like you grew up going to dig sites mostly because your mom was into it, then started doing a little research on your own in high school. By college you had formed your own opinions about archeology, and decided it wasn't for you? Like it's cool if other people are archeologists, just don't force your views on me, you know? ",2016-03-29 19:43:56+00:00,d1i3l03,2.0,t1_d1hy8hy,6623.0,firefly
165,"Well shoot, that definitely rings a bell. Maybe that mentality is why it was on the Marine Corps reading list for a while... ",2016-03-28 04:27:09+00:00,d1g0jrq,7.0,t1_d1g0dxg,342.0,todayilearned
166,"I have a law degree, and I'm still not a lawyer. ",2016-03-28 04:08:55+00:00,d1g00t6,6.0,t1_d1fcwuy,40954.0,videos
167,"He did kill him, but not intentionally. And he did everything he could to prevent the fight in the first place. And he felt remorse when he found out the kid died. 

I took away more of, ""Sometimes violence is necessary, but always as a last resort, and only the minimum amount needed to accomplish the goal.""",2016-03-28 04:00:39+00:00,d1fzrt8,5.0,t1_d1fzk9n,415.0,todayilearned
168,Search no more. http://store.tripleaughtdesign.com/Apparel/Sweaters-Hoodies?_ga=1.61863980.1630855429.1459100870,2016-03-27 17:48:36+00:00,d1ff1rb,5.0,t1_d1ewouo,50583.0,thedivision
169,Unequip everything. You should still have some stats. I'm curious what they are. ,2016-03-27 17:35:42+00:00,d1felvf,3.0,t1_d1feh42,230.0,thedivision
170,What does figure skating have to do with this? ,2016-03-23 21:20:22+00:00,d1b0e0i,4.0,t1_d1axdv5,3963.0,todayilearned
171,"Entered! Out of curiosity, where are you shipping from? ",2016-03-21 18:27:17+00:00,d184qmy,1.0,t3_4bd3xm,5412.0,mechmarket
172,"Wow, I didn't think that the shade of green could feel ""right"" on a per-turtle basis, but this drawing shows me that it totally can.",2016-03-21 15:31:04+00:00,d17x4dg,3.0,t1_d17apdu,54519.0,MechanicalKeyboards
173,"&gt; plays.tv

Have you ever tried Forge.gg? I haven't used either yet (just OBS into Twitch), but I just learned about Forge and was wondering if anyone has any opinions. (Also, tough luck man.)",2016-03-21 15:23:03+00:00,d17wsq5,3.0,t1_d17oaga,21069.0,Minecraft
174,Now let's do this in front of XT... ,2016-03-20 17:07:09+00:00,d16v3y1,6.0,t1_d16tl52,2633.0,wow
175,"Oh weird - even when I select All and hit Generate, it still only shows me Newegg. Weird.

Anyway, good catch! ",2016-03-19 07:57:45+00:00,d15i7ny,4.0,t1_d133987,164484.0,GameDeals
176,"According to this, yes: https://isthereanydeal.com/#/page:game/price?plain=xcomenemywithinexpansion ",2016-03-17 00:41:34+00:00,d12p5o9,2.0,t1_d12m00m,5088.0,GameDeals
177,Nice -  good find! ,2016-03-16 20:05:28+00:00,d12ds5x,2.0,t1_d12bhw1,3046.0,GameDeals
178,"I have no idea how long this has been active, but was talking about the game with a coworker, saw that it's $30 on Steam and $7.50 on NewEgg, so figured I'd throw it up here. ",2016-03-16 19:09:38+00:00,d12b9vo,1.0,t3_4ap9vv,407.0,GameDeals
179,https://www.youtube.com/watch?v=V5Z_ZducwbQ,2016-03-16 05:04:14+00:00,d11mz5c,3.0,t1_d118y6b,21190.0,MechanicalKeyboards
180,"Gotcha - I like having options for things, but I hate wasting time and finding out that I could have accomplished something a lot faster or using way less resources. It sounds like this is a little more linear and self-explanatory, so I'll definitely give it a shot. ",2016-03-14 04:25:11+00:00,d0z04mk,9.0,t1_d0yzh0v,1407.0,feedthebeast
181,"Is there like a quick and dirty ""things to be aware of"" or ""best practices"" type of doc out there for it? I recently started my first playthrough of Agrarian Skies 2 (and first AS of any # for me), and I'm at a point where I have no idea what the best method for generating power is (I'm using a single magmatic dynamo that's being fed by 3 crucibles, which apparently is overkill and also servos are expensive and oh my god I have no idea if the single auto-sieve is the right thing to be concerning myself with someone help.)

Basically something that says ""these are some milestones to help you naturally progress"" is probably fine. I'm capable of conducting my own research, but an outline would be welcome. ",2016-03-14 03:54:27+00:00,d0yz9c1,7.0,t1_d0yyukm,828.0,feedthebeast
182,"2 enters will insert line breaks on Reddit :) 

&gt;http://www.wowhead.com/item=118791/razorcrystal-blade -
&gt;
&gt;http://www.wowhead.com/item=57929/dawnblaze-blade -
&gt;
&gt;http://www.wowhead.com/item=28427/blazefury -
&gt;
&gt;http://www.wowhead.com/item=86219/scimitar-of-seven-stars -
&gt;
&gt;http://www.wowhead.com/item=50068/rigormortis - 
&gt;
&gt;http://www.wowhead.com/item=94964/qons-flaming-scimitar -
&gt;
&gt;http://www.wowhead.com/item=125207/wild-gladiators-mageblade -
&gt;
&gt;http://www.wowhead.com/item=102809/grievous-gladiators-quickblade -
&gt;
&gt;http://www.wowhead.com/item=45266/malice
",2016-03-14 02:50:25+00:00,d0yxaiz,2.0,t1_d0yas0f,38206.0,wow
183,"And pair it with a http://www.wowhead.com/item=19352/chromatically-tempered-sword

No, it doesn't match at all. But it's the right thing to do. ",2016-03-14 02:47:18+00:00,d0yx6xc,3.0,t1_d0ygzqs,27278.0,wow
184,Dual Crafter is Duel Crafter in WAILA :),2016-03-13 06:26:17+00:00,d0xzsdt,1.0,t3_4a73cp,6019.0,feedthebeast
185,Worked for me at 12:30am PST. ,2016-03-11 08:32:19+00:00,d0vs42u,1.0,t3_49wk64,25748.0,buildapcsales
186,Mother of god. What have I been waiting for? ,2016-03-09 21:57:26+00:00,d0twu1h,11.0,t1_d0tl254,15389.0,funny
187,I should probably play that. I've heard it mentioned a lot. ,2016-03-09 17:31:25+00:00,d0tkmy2,9.0,t1_d0t89pg,24802.0,funny
188,"This makes me miss Gemstone, but what other MUDs are you guys referring to?",2016-03-09 06:47:55+00:00,d0t4diz,7.0,t1_d0sxckg,13028.0,funny
189,"Right on, thanks!",2016-03-05 22:15:14+00:00,d0oxu8h,4.0,t1_d0osxiz,8940.0,woweconomy
190,"Right on, thanks!",2016-03-05 22:15:12+00:00,d0oxu6y,4.0,t1_d0ouoeu,5707.0,woweconomy
191,"Hey, I'm just coming back after a long off period myself. Which ring are you talking about, and why was it important to you? ",2016-03-05 15:55:05+00:00,d0ol5io,2.0,t1_d0oemsr,19818.0,woweconomy
192,Yeah but you save typing 5 letters. Think of what you can do with all that time. ,2016-03-05 15:45:22+00:00,d0okus2,6.0,t1_d0okd6u,984.0,wallpapers
193,"And an infinite number of them. That way one team can work on cat forms, one team on one tier of raids,  one team to update Westfall and oh yeah they have a finite number of people. 

To say, ""they can work on multiple things,"" is true, but there are still limitations no matter how you look at it. Also time is finite. So the people updating cat forms cannot simultaneously be working on anything else. Obviously. 

The scenario of ""just give it to a different team"" assumes that some other team exists just sitting around waiting for something to do. I feel like this shouldn't need explanation. ",2016-03-05 15:41:30+00:00,d0okqfk,7.0,t1_d0oi7ed,5655.0,wow
194,"Two of my favorite members of Doomtree: 

SIMS: https://www.youtube.com/watch?v=Y_x6M3UXq9M

P.O.S: https://www.youtube.com/watch?v=7PputxGopVQ",2016-03-04 05:09:15+00:00,d0n0pke,6.0,t1_d0n0jlt,315.0,videos
195,"Not by me, but this was taken. ",2016-03-01 23:40:47+00:00,d0k0k6x,3.0,t1_d0jvwh5,6670.0,GameDeals
196,"Update: http://i.imgur.com/

Looks like 3 passes and 1 fail on the external 1TB. ",2016-03-01 16:14:21+00:00,d0jglsj,2.0,t1_d0je9n6,3433.0,buildapc
197,"Awesome - I will definitely take a look at that tool. That was my hesitation - the drives are over 5 years old, and I have to wonder if it's silly to invest in maintaining them vs. just starting fresh. Thank you! ",2016-03-01 15:28:42+00:00,d0jeq14,2.0,t1_d0je9n6,694.0,buildapc
198,"It took me like 9 hours to make an IC2 mass fab/replicator/recycler, but it was worth it for nether quartz alone. ",2016-03-01 04:44:34+00:00,d0j0i84,4.0,t1_d0ix732,5563.0,Minecraft
199,"A 20ft ethernet cord plus these: https://www.securecableties.com/10mm-white-flat-nail-cable-clip-100-pack?gclid=Cj0KEQiA0sq2BRDRt6Scrqj71vQBEiQAg5bj0-qap29oevRQtBqDIUcT-GVY4D77TsDCCpFxpO0mPtQaAkiG8P8HAQ

You can run the cord along the base board (if you have carpet in that room the cord will be practically invisible) from the PC to the router. Very cheap solution, and the fastest connection available. ",2016-02-28 17:59:25+00:00,d0h272r,3.0,t1_d0h0xhb,2101.0,buildapc
200,The call out of this in The Newsroom is awesome. ,2016-02-28 17:38:24+00:00,d0h1f81,7.0,t1_d0h16iv,404.0,leagueoflegends
201,"Nah,  that was pretty good. Shake it off. ",2016-02-28 10:34:25+00:00,d0groh4,2.0,t1_d0gpq37,7990.0,firefly
202,"&gt; Engineering rocket boots
http://www.wowhead.com/item=23824/rocket-boots-xtreme

Also the belt ""enchant"" (engineering tinker) that is on a 2min cd: http://www.wowhead.com/spell=55016/nitro-boosts",2016-02-27 20:37:58+00:00,d0g4fqd,,t1_d0bwrhn,,woweconomy
203,"Sorry, what ARE you selling then? 20k per day purely from Card of Omens? ",2016-02-26 07:33:42+00:00,d0ecyb6,4.0,t1_d0ceisj,124791.0,woweconomy
204,[Hackers](http://www.imdb.com/title/tt0113243/) takes the prize for me. ,2016-02-25 02:26:25+00:00,d0cs7yx,3.0,t1_d0ckdqc,12156.0,MechanicalKeyboards
205,"&gt; tasslehof

Says the guy known for stealing shit. ",2016-02-24 17:00:14+00:00,d0c3ybv,9.0,t1_d0byf3c,8254.0,funny
206,Terry Brooks' Sword of Shannara series on the shelf. Nice. ,2016-02-22 23:02:27+00:00,d09vljk,1.0,t3_47105l,31332.0,videos
207,"Wow, TIL Brooks is from Sterling. Moline native here. I've only read Heritage (where I started in 4th grade), Original, and Magic Kingdom, but I'm starting the whole series fresh and looking forward to the series I haven't read yet. ",2016-02-20 18:14:36+00:00,d078eh4,,t1_d009uwg,,shannara
208,"Super fun. In my experience, an Xbox controller lends itself well to this game. ",2016-02-19 14:11:46+00:00,d05u99p,5.0,t1_d05njoj,21475.0,truegaming
209,"You are absolutely correct. But if you want some entertainment, look into Connor McGregor. ",2016-02-19 14:07:06+00:00,d05u3zy,7.0,t1_d05p03c,15665.0,bodyweightfitness
210,"Haha, fair enough. Also Doritos are the best thing. ",2016-02-16 21:24:52+00:00,d02dqyq,7.0,t1_d02bsub,2602.0,gamegrumps
211,"Well, above the desk, absolutely. ",2016-02-16 13:32:47+00:00,d01uppv,2.0,t1_d01rg80,10870.0,battlestations
212,"Extra mayo, cool ranch, root beer,  healthy. 

I'm not a scientist, but, uh... ",2016-02-16 13:02:03+00:00,d01tzva,5.0,t1_d01pave,17456.0,gamegrumps
213,Good choice for an exception to that rule. ,2016-02-16 12:39:51+00:00,d01tj46,4.0,t1_d01nrj8,20830.0,videos
214,"Either we are the only ones to get the reference, or OP was accidentally awesome. Either way, great song. ",2016-02-16 12:28:09+00:00,d01tavf,2.0,t1_d01dm9m,38653.0,battlestations
215,"It's Two Women for me, but I'd take either. ",2016-02-15 18:26:01+00:00,d00w5nm,3.0,t1_d00vuiw,447.0,Firewatch
216,You can't feel *that* bad with a Spotted Cow. ,2016-02-15 16:44:33+00:00,d00s06l,1.0,t3_45wyug,4401.0,Firewatch
217,"Hey guys, going to piggy back on this post with a question. I just reactivated, discovered I've been hacked (all characters naked, new characters I didn't make on servers I've never touched). Submitted a ticket,  told sorry, nothing to be done. 

Anyway, just looking for a tip on where I could get base level 100 gear. I don't mind working my way back up, I just don't want to get booted from LFG for being naked. I did manage to get a couple epics via follower missions, but any advice is welcome! ",2016-02-14 23:50:12+00:00,d002rwi,1.0,t3_45mduq,99303.0,wow
218,Is it not a shawl collar? ,2016-02-10 18:33:05+00:00,czv0ygn,6.0,t1_czuv1uu,8220.0,malefashionadvice
219,"David Spade uses the phrase ""speed bag his nuts"" in his HBO special Take the Hit from like 20 years ago. He's quoting his grandma when she found out he went to grade school with Brad Pitt. The whole special is pretty great, in my opinion.

I'm on mobile and can't figure out how to share the link at a certain time, so skip to 22:55 (or enjoy the whole thing).

https://youtu.be/XntTb6UdO8Q",2016-02-10 18:08:49+00:00,czuzvqr,6.0,t1_czurs6o,11900.0,AskReddit
220,"I never knew TFC and TF2 were meant to be in the same universe. I used to play TFC and CS (what, 1.5?) back when they were all the rage in high school. I should really finally complete HL1 and 2. ",2016-02-06 04:19:43+00:00,czpolnm,4.0,t1_czplsjn,5573.0,GameDeals
221,"What, like a puma? 

Yeah there you go. ",2016-02-05 21:23:13+00:00,czpaend,3.0,t1_czp6vzf,5075.0,boardgames
222,"Just my 2 cents. And hey, I'm just some guy on the internet, you don't have to listen to me. ",2016-02-04 03:36:51+00:00,czn5v8z,6.0,t1_czn5866,978.0,summonerschool
223,"I submit to your grasp on this as being way better than mine. I don't know anything about the math behind when AP vs. MPen is preferable, so I'm sure you're right. ",2016-02-03 16:50:10+00:00,czmeq38,6.0,t1_czmb0et,5487.0,summonerschool
224,"&gt; LCK

My guess is EMF v KT: https://www.youtube.com/watch?v=kXMZ3oTi4nU ",2016-02-03 13:16:17+00:00,czm76mz,3.0,t1_czm3nui,12676.0,summonerschool
225,"It's inefficient in a vacuum, in which you have an unlimited number of slots to play with. But if you want those sweet AP glyphs AND MR, you don't have a lot of options. If your goal is to maximize efficiency on a per rune basis, then you're right. Just depends on what you're aiming for. ",2016-02-03 13:12:27+00:00,czm73dq,4.0,t1_czlxnea,30089.0,summonerschool
226,Obviously: http://i.imgur.com/TojGU.gif ,2016-02-01 23:30:18+00:00,czkb9c2,7.0,t1_czkb0z0,361.0,wow
227,"If you'd like to be mad, check out this post from 2 years ago: https://www.reddit.com/r/WTF/comments/1u51ui/it_is_suddenly_so_clear_why_my_cable_internet/

*mad may be a strong word. ",2016-02-01 23:24:44+00:00,czkb1ky,2.0,t1_czjnebw,36354.0,jgviral
