,created,domain,full_link,locked,selftext,subreddit,title,url
0,2016-06-02 20:50:35+00:00,self.shield,https://www.reddit.com/r/shield/comments/4m9bsm/something_shield_has_been_missing/,False,"Where is Scorpio and the Zodiac? They are a huge part of SHIELD's history and the franchise's best run in comics.

I really, really hope the Hydra plotline is mostly finished, and if they do introduce the Zodiac, I think they shouldn't have anything to do with Inhumans.

What do you guys think?",shield,Something SHIELD has been missing,https://www.reddit.com/r/shield/comments/4m9bsm/something_shield_has_been_missing/
1,2016-05-21 18:50:26+00:00,youtube.com,https://www.reddit.com/r/CrazyDCFans/comments/4kew3w/andre_is_a_baller/,False,,CrazyDCFans,Andre is a Baller!,https://www.youtube.com/watch?v=qKDT3lBwRRc
2,2016-05-19 23:30:34+00:00,imgur.com,https://www.reddit.com/r/im14andthisisdeep/comments/4k5e0p/i_love_facebook/,False,,im14andthisisdeep,I love Facebook,http://imgur.com/li62Xe8
3,2016-05-17 18:23:30+00:00,inverse.com,https://www.reddit.com/r/Marvel/comments/4jscjm/how_is_hawkeye_not_dead_yet/,False,,Marvel,How Is Hawkeye Not Dead Yet?,https://www.inverse.com/article/15658-how-is-hawkeye-not-dead-yet-marvel-s-avenger-archer-should-be-toast
4,2016-05-17 18:19:55+00:00,independent.co.uk,https://www.reddit.com/r/Marvel/comments/4jsbus/marvel_producer_admits_its_plots_are/,False,,Marvel,Marvel producer admits its plots are 'interchangeable and disposable',http://www.independent.co.uk/arts-entertainment/films/news/marvel-producer-admits-its-plots-are-interchangeable-and-disposable-a7032546.html
5,2016-05-17 17:51:50+00:00,youtube.com,https://www.reddit.com/r/CrazyDCFans/comments/4js6o7/dc_for_life_suicide_squad_marvel_is_garbage_bvs/,False,,CrazyDCFans,DC For Life Suicide squad! Marvel is Garbage! BVS at 870 Mill now!,https://www.youtube.com/watch?v=k5Y3buTwssc
6,2016-05-17 17:09:34+00:00,birthmoviesdeath.com,https://www.reddit.com/r/Marvel/comments/4jrysh/inside_the_new_marvel_bullpen/,False,,Marvel,Inside The New Marvel Bullpen,http://birthmoviesdeath.com/2016/05/09/inside-the-new-marvel-bullpen
7,2016-05-16 21:57:11+00:00,youtube.com,https://www.reddit.com/r/CrazyDCFans/comments/4jnkfd/marvelites_opinions_are_worthless_like/,False,,CrazyDCFans,Marvelites opinions are Worthless Like Trump&amp;Sanders,https://www.youtube.com/watch?v=2frTeZSqxYA
8,2016-05-16 21:29:29+00:00,np.reddit.com,https://www.reddit.com/r/CrazyDCFans/comments/4jnfj6/you_know_what_dc_cinematic_needs_more_post_about/,False,,CrazyDCFans,You know what DC_cinematic needs? More post about how DC is just too smart for normies.,https://np.reddit.com/r/DC_Cinematic/comments/4jn9v0/in_the_words_of_ledger_dc_is_ahead_of_the_curve/
9,2016-05-14 14:01:50+00:00,np.reddit.com,https://www.reddit.com/r/CrazyDCFans/comments/4jbib8/dc_fans_overjoyed_as_sophisticated_film_critic/,False,,CrazyDCFans,DC fans overjoyed as sophisticated film critic and intellectual Tyrone Magnus says he prefers Batman v Superman to Civil War,https://np.reddit.com/r/DC_Cinematic/comments/4j9sh3/tyrone_magnus_liked_batman_v_superman_more_than/?sort=confidence
10,2016-05-13 04:10:34+00:00,self.whowouldwin,https://www.reddit.com/r/whowouldwin/comments/4j4myo/secret_wars/,False,"The ANAD Molecule Man is organizing a new secret war to entertain himself, only this time it's a heavy hitters only match in a battle world with a wide variety of resources. He also allows a week of prep time for either team or match up.


Hero team:

1.Thor

2.Silver Surfer

3.Doctor Strange

4.Hulk

5.Black Bolt(full power)

6.X-man

7.Hyperion

8.Blue Marvel

9.Sentry

10.Gladiator(Majestor)

11.Cable(uninhibited)

12.Iceman(omega level)

Villain team:

1.Gorr

2.Dark Phoenix

3.Doctor Doom

4.Juggernaut

5.Magneto(full power)

6.Apocalypse

7.Thanos

8.Anti-man

9.Void

10.Annihilus

11.Onslaught

12.Vulcan

A. Which team comes out on top?

B. Who wins each corresponding number matchup (Genesis vs Apocalypse, Hyperion vs Thanos etc.)?

C. Who wins in a free-for-all brawl?",whowouldwin,SECRET WARS,https://www.reddit.com/r/whowouldwin/comments/4j4myo/secret_wars/
11,2016-05-12 19:12:49+00:00,youtube.com,https://www.reddit.com/r/CrazyDCFans/comments/4j2bnl/batman_v_superman_mos_obama/,False,,CrazyDCFans,BATMAN V SUPERMAN &amp;MOS= OBAMA! Haters/Marvelites=Delusional Republican NUTS in Denial!,https://www.youtube.com/watch?v=GPquMwK82Ao
12,2016-05-12 19:10:10+00:00,youtube.com,https://www.reddit.com/r/CrazyDCFans/comments/4j2b77/andres_got_some_advice_for_future_film_makers/,False,,CrazyDCFans,Andre's got some advice for future film makers.,https://www.youtube.com/watch?v=6F0XzoxQPwk
13,2016-05-12 06:46:38+00:00,np.reddit.com,https://www.reddit.com/r/CrazyDCFans/comments/4izfpn/dc_cinematic_user_watches_film_3_times_in/,False,,CrazyDCFans,DC_Cinematic user watches film 3 times in theaters before deciding he likes it.,https://np.reddit.com/r/DC_Cinematic/comments/4ixb69/i_liked_bvs_but_only_after_my_third_viewing_is/?sort=confidence
14,2016-05-11 15:11:53+00:00,change.org,https://www.reddit.com/r/CrazyDCFans/comments/4ivd4l/petition_to_stop_disney_from_paying_off_critics/,False,,CrazyDCFans,"Petition to stop Disney from paying off critics, this is real.",https://www.change.org/p/rotten-tomatoes-stop-disney-from-paying-critics?recruiter=538942757&amp;utm_source=petition_show&amp;utm_medium=copylink
15,2016-05-11 15:08:03+00:00,np.reddit.com,https://www.reddit.com/r/CrazyDCFans/comments/4ivchv/when_your_sub_starts_upvoting_armond_white_you/,False,,CrazyDCFans,When your sub starts upvoting Armond White you may have a problem.,https://np.reddit.com/r/dawnofjustice/comments/4i7ogm/armond_white_analysis_civil_war_vs_bvs/
16,2016-05-10 15:56:14+00:00,youtu.be,https://www.reddit.com/r/Marvel/comments/4ipvpr/black_panther_a_nation_under_our_feet_part_1_ft/,False,,Marvel,Black Panther: A Nation Under Our Feet - Part 1 ft Run the Jewels,https://youtu.be/WVqAnQe_xGw
17,2016-05-09 06:36:57+00:00,np.reddit.com,https://www.reddit.com/r/moviescirclejerk/comments/4iif1l/dae_lex_luthor_having_an_evil_plan_was/,False,,moviescirclejerk,DAE Lex Luthor having an evil plan was unpredictable?,https://np.reddit.com/r/DC_Cinematic/comments/4ii3lq/one_of_the_best_things_about_bvs/?sort=confidence
18,2016-05-09 06:35:09+00:00,np.reddit.com,https://www.reddit.com/r/CrazyDCFans/comments/4iieuz/arthurian_disection_of_the_many_shocking_twists/,False,,CrazyDCFans,Arthurian disection of the many shocking twists and turn in BvS.,https://np.reddit.com/r/DC_Cinematic/comments/4ii3lq/one_of_the_best_things_about_bvs/?sort=confidence
19,2016-05-09 05:52:44+00:00,youtu.be,https://www.reddit.com/r/CrazyDCFans/comments/4iialw/loving_andres_ball_handling_technique/,False,,CrazyDCFans,Loving Andre's ball handling technique,https://youtu.be/3DbVBy4gLFo
20,2016-05-08 19:15:50+00:00,youtu.be,https://www.reddit.com/r/CrazyDCFans/comments/4ifwbo/the_definitive_top_ten_comicbook_movies_list_by/,False,,CrazyDCFans,The Definitive Top Ten Comicbook Movies List by Futurexmdc.,https://youtu.be/AzOox7K6b50
21,2016-05-06 20:22:26+00:00,youtube.com,https://www.reddit.com/r/CrazyDCFans/comments/4i6x94/andre_celebrates_civil_war/,False,,CrazyDCFans,Andre celebrates Civil War,https://www.youtube.com/watch?v=WrlKEWexcrY
22,2016-05-06 17:07:50+00:00,np.reddit.com,https://www.reddit.com/r/CrazyDCFans/comments/4i61j2/how_dawn_of_justice_is_a_german_expressionist_film/,False,,CrazyDCFans,How Dawn of Justice is a German Expressionist film.,https://np.reddit.com/r/DC_Cinematic/comments/4i5k5f/how_bvs_is_a_modern_german_expressionist_film/
23,2016-05-06 17:00:51+00:00,np.reddit.com,https://www.reddit.com/r/CrazyDCFans/comments/4i60ch/our_favorite_sub_gets_sub_of_the_day_comments_go/,False,,CrazyDCFans,Our favorite sub gets sub of the day. Comments go as expected.,https://np.reddit.com/r/DC_Cinematic/comments/4i5769/congratulations_rdc_cinematic_you_are_subreddit/
24,2016-05-06 07:05:19+00:00,youtu.be,https://www.reddit.com/r/CrazyDCFans/comments/4i41mu/crazy_dc_fan_on_podcast_loses_it_on_cohost_good/,False,,CrazyDCFans,Crazy DC fan on podcast loses it on co-host (good bits at 33:00),https://youtu.be/D5CbK4wxN3s
25,2016-05-05 16:40:08+00:00,np.reddit.com,https://www.reddit.com/r/CrazyDCFans/comments/4i0q6k/top_minds_of_rdc_cinematic_deduce_the_poor/,False,,CrazyDCFans,Top minds of /r/dc_cinematic deduce the poor critical reception of Batman v Superman actually had nothing to with the film's quality.,https://np.reddit.com/r/DC_Cinematic/comments/4hwzt6/academics_on_batman_v_superman/
26,2016-05-05 14:41:59+00:00,youtu.be,https://www.reddit.com/r/CrazyDCFans/comments/4i06rv/andres_10th_bvs_viewing/,False,,CrazyDCFans,Andre's 10th BvS viewing,https://youtu.be/5gFrf_oWyDM
27,2016-05-04 18:30:53+00:00,youtube.com,https://www.reddit.com/r/CrazyDCFans/comments/4hvwf8/looks_like_we_got_a_couple_turning_on_each_other/,False,,CrazyDCFans,Looks like we got a couple turning on each other.,https://www.youtube.com/watch?v=vgV-1W7zanQ
28,2016-05-02 14:41:00+00:00,youtu.be,https://www.reddit.com/r/CrazyDCFans/comments/4hhory/bvs_was_a_masterpiece_you_dont_think_so_well_you/,False,,CrazyDCFans,BvS was a masterpiece! You don't think so? Well you just don't get it!,https://youtu.be/XNlSZlBV2N8
29,2016-04-29 23:48:45+00:00,np.reddit.com,https://www.reddit.com/r/CrazyDCFans/comments/4h275x/essay_illustrating_why_brand_loyalty_is_actually/,False,,CrazyDCFans,Essay illustrating why brand loyalty is actually a good thing incoming tomorrow.,https://np.reddit.com/r/DC_Cinematic/comments/4h264v/dc_cinematic_universe_vs_dc_fandivided_we_fall/
30,2016-04-29 21:27:52+00:00,youtube.com,https://www.reddit.com/r/CrazyDCFans/comments/4h1m39/kevin_smith_liked_civil_war_traitor/,False,,CrazyDCFans,Kevin Smith liked Civil War? TRAITOR!!!,https://www.youtube.com/watch?v=MnDjt3z8Y3s
31,2016-04-29 18:46:53+00:00,imgur.com,https://www.reddit.com/r/moviescirclejerk/comments/4h0vtr/thought_bvs_was_a_financial_disappointment_think/,False,,moviescirclejerk,Thought BvS was a financial disappointment? Think again (x-post /r/crazydcfans),http://imgur.com/acWGnWr
32,2016-04-29 18:43:21+00:00,imgur.com,https://www.reddit.com/r/CrazyDCFans/comments/4h0v85/facts_about_the_batman_v_superman_doritos_factor/,False,,CrazyDCFans,FACTS ABOUT THE BATMAN V SUPERMAN DORITOS FACTOR,http://imgur.com/acWGnWr
33,2016-04-28 23:11:42+00:00,np.reddit.com,https://www.reddit.com/r/CrazyDCFans/comments/4gwo5z/civil_war_was_way_worse_than_arthurian_legend/,False,,CrazyDCFans,Civil War was way worse than Arthurian Legend that was Batman V Superman (x-post /r/moviescirclejerk),https://np.reddit.com/r/DC_Cinematic/comments/4gu0ji/so_i_just_watched_cw_and_now_im_sure/
34,2016-04-28 23:03:43+00:00,np.reddit.com,https://www.reddit.com/r/CrazyDCFans/comments/4gwmyy/can_bvs_beat_civil_war_at_the_box_office_well_it/,False,,CrazyDCFans,Can BvS beat Civil War at the box office? Well it can if you factor in Blu Ray sales of course!,https://www.np.reddit.com/r/boxoffice/comments/4gwhp6/can_captain_america_civil_war_beat_batman_v/
35,2016-04-22 17:22:45+00:00,imgur.com,https://www.reddit.com/r/Marvel/comments/4fzhch/my_personal_favorite_alex_ross_piece/,False,,Marvel,My personal favorite Alex Ross piece.,http://imgur.com/igXY66O
36,2016-04-22 00:53:50+00:00,youtube.com,https://www.reddit.com/r/CrazyDCFans/comments/4fw4g3/look_how_totally_fun_the_dceu_is/,False,,CrazyDCFans,Look how totally fun the DCEU is!!!,https://www.youtube.com/watch?v=9JRAJEmO2ac
37,2016-04-21 13:11:54+00:00,manofsteelanswers.com,https://www.reddit.com/r/CrazyDCFans/comments/4fsvt0/this_website/,False,,CrazyDCFans,This website.,http://www.manofsteelanswers.com
38,2016-04-21 00:26:50+00:00,youtube.com,https://www.reddit.com/r/DeepIntoYouTube/comments/4fqglb/how_to_get_free_gas_with_a_coca_cola_part_1/,False,,DeepIntoYouTube,How To Get Free Gas With A Coca Cola - Part 1,https://www.youtube.com/watch?v=yO8ZJMKJilg
39,2016-04-20 20:16:14+00:00,np.reddit.com,https://www.reddit.com/r/CrazyDCFans/comments/4fpbcc/if_i_dont_like_marvel_movies_why_do_other_people/,False,,CrazyDCFans,"If I don't like Marvel movies, why do other people like Marvel movies?!?!",https://www.np.reddit.com/r/DC_Cinematic/comments/4fodgb/why_is_marvel_so_widely_praised_when_theyve_had_a/
40,2016-04-20 20:15:06+00:00,np.reddit.com,https://www.reddit.com/r/CrazyDCFans/comments/4fpb5l/batman_v_superman_is_an_overlooked_masterpiece/,False,,CrazyDCFans,BATMAN v SUPERMAN IS AN OVERLOOKED MASTERPIECE,https://www.np.reddit.com/r/DC_Cinematic/comments/4fmb7f/heres_an_interesting_analysis_i_saw_on_rmovies/
41,2016-04-20 19:19:47+00:00,np.reddit.com,https://www.reddit.com/r/CrazyDCFans/comments/4fp16m/dc_films_are_too_adult_for_general_audiences/,False,,CrazyDCFans,DC films are too adult for general audiences.,https://www.np.reddit.com/r/DC_Cinematic/comments/4fosp7/dc_cinematic_is_focused_on_drama_art_and/
42,2016-04-20 18:29:55+00:00,youtube.com,https://www.reddit.com/r/youtubedrama/comments/4fos5j/movie_youtuber_drama/,False,,youtubedrama,Movie Youtuber drama!,https://www.youtube.com/watch?v=kfGTO1rV_pk
43,2016-04-20 17:24:14+00:00,youtube.com,https://www.reddit.com/r/videos/comments/4fog6e/youtube_film_critic_and_batman_v_superman_fan/,False,,videos,"Youtube film critic and Batman v Superman fan Grace Randolph has taken to twitter to accuse film critics of an anti-BvS ""agenda"". John Campea's response.",https://www.youtube.com/watch?v=kfGTO1rV_pk
44,2016-04-20 17:09:30+00:00,twitter.com,https://www.reddit.com/r/CrazyDCFans/comments/4fodhb/bvs_victim_complex_in_overdrive_ps_john_campea/,False,,CrazyDCFans,BvS Victim Complex in overdrive. PS John Campea liked BvS and gave it a good review.,https://twitter.com/GraceRandolph/status/722559639985000449
45,2016-04-20 16:56:50+00:00,youtube.com,https://www.reddit.com/r/CrazyDCFans/comments/4fob8x/john_campea_on_grace_randolphs_antics/,False,,CrazyDCFans,John Campea on Grace Randolph's antics,https://www.youtube.com/watch?v=kfGTO1rV_pk
46,2016-04-20 16:41:11+00:00,twitter.com,https://www.reddit.com/r/CrazyDCFans/comments/4fo8if/there_are_people_who_agree_with_me_thats_why_im/,False,,CrazyDCFans,"There are people who agree with me, THATS WHY I'M RIGHT. Grace continuing to expose critics' anti-BvS ""agenda"".",https://twitter.com/GraceRandolph/status/722410363120132096
47,2016-04-20 16:35:44+00:00,np.reddit.com,https://www.reddit.com/r/CrazyDCFans/comments/4fo7k2/movie_with_2_biggest_superheroes_ever_not/,False,,CrazyDCFans,Movie with 2 biggest superheroes ever not actually meant to be blockbuster.,https://np.reddit.com/r/DC_Cinematic/comments/4flcea/dawn_of_justice_was_never_meant_to_be_a/
48,2016-04-19 19:12:27+00:00,imgur.com,https://www.reddit.com/r/Marvel/comments/4fj7tx/alex_ross_doctor_strange/,False,,Marvel,Alex Ross Doctor Strange.,http://imgur.com/FfV3EFA
49,2016-04-18 01:55:55+00:00,np.reddit.com,https://www.reddit.com/r/CrazyDCFans/comments/4f9n8x/bvs_nwo_conspiracy_analysis_xpost/,False,,CrazyDCFans,BvS: NWO Conspiracy Analysis (x-post /r/moviescirclejerk),https://np.reddit.com/r/dawnofjustice/comments/4f27ln/bvs_nwo_conspiracy_analysis/
50,2016-04-17 23:59:39+00:00,youtu.be,https://www.reddit.com/r/CrazyDCFans/comments/4f97a3/bvs_is_a_successs_haters_cant_deal/,False,,CrazyDCFans,BVS is a successs! haters Can't Deal!,https://youtu.be/Q5fWfwkvgFo
51,2016-04-17 00:54:01+00:00,twitter.com,https://www.reddit.com/r/CrazyDCFans/comments/4f4jyo/sure_grace_the_hate_campaign_is_the_reason/,False,,CrazyDCFans,"Sure Grace, the hate campaign is the reason audiences aren't flocking to it. Nothing to do with the film itself at all.",https://twitter.com/GraceRandolph/status/721422554569814016
52,2016-04-16 23:35:02+00:00,imgur.com,https://www.reddit.com/r/CrazyDCFans/comments/4f4a6f/if_we_just_over_explain_something_really_obvious/,False,,CrazyDCFans,If we just over explain something really obvious it will look less stupid. Right guys?,http://imgur.com/a/DIdY8
53,2016-04-16 22:41:58+00:00,youtube.com,https://www.reddit.com/r/CrazyDCFans/comments/4f4359/the_rock_and_kevin_heart_jokingly_call_marvel/,False,,CrazyDCFans,The Rock and Kevin Heart jokingly call Marvel actors bitches. Futurexmdc's dreams come true.,https://www.youtube.com/watch?v=T-kSVVK_pdY
54,2016-04-16 22:37:15+00:00,twitter.com,https://www.reddit.com/r/CrazyDCFans/comments/4f42hm/my_favorite_twitter_troll_hes_got_some_dank_dc/,False,,CrazyDCFans,My favorite twitter troll. He's got some dank DC memes,https://twitter.com/HackSnyder
55,2016-04-16 19:40:57+00:00,self.CrazyDCFans,https://www.reddit.com/r/CrazyDCFans/comments/4f3doa/due_to_brigades_ive_set_it_to_subscribers_only/,False,"Can't vote unless you're a subscriber now. I'm not getting as much help from the Marvel illuminati or the Disney black ops as I was hoping, so I've been forced to resort to this.",CrazyDCFans,Due to brigades I've set it to subscribers only.,https://www.reddit.com/r/CrazyDCFans/comments/4f3doa/due_to_brigades_ive_set_it_to_subscribers_only/
56,2016-04-16 19:20:53+00:00,imgur.com,https://www.reddit.com/r/CrazyDCFans/comments/4f3ak9/looks_like_theyre_up_to_those_classic_imdb/,False,,CrazyDCFans,Looks like they're up to those classic IMdb shenanigans again. (x-post /r/marvelstudios),http://imgur.com/dgM9Mko
57,2016-04-16 16:58:17+00:00,np.reddit.com,https://www.reddit.com/r/CrazyDCFans/comments/4f2pai/great_new_essay_from_the_kind_people_at_dc/,False,,CrazyDCFans,Great New Essay from the kind people at DC_cinematic,https://www.np.reddit.com/r/DC_Cinematic/comments/4f0y2a/upon_a_second_viewing_i_think_my_criticism_of_bvs/
58,2016-04-16 16:39:23+00:00,m.youtube.com,https://www.reddit.com/r/CrazyDCFans/comments/4f2mfz/check_out_the_8th_viewing_swag_guarantees_5_more/,False,,CrazyDCFans,Check out the 8th viewing swag. Guarantees 5 more viewings.,https://m.youtube.com/watch?feature=youtu.be&amp;v=Kc4oYGutZQs
59,2016-04-16 05:27:56+00:00,imgur.com,https://www.reddit.com/r/CrazyDCFans/comments/4f0n9u/2smart/,False,,CrazyDCFans,2smart,https://imgur.com/DZH67TI
60,2016-04-15 23:46:15+00:00,youtube.com,https://www.reddit.com/r/CrazyDCFans/comments/4ezheq/youve_gotta_appreciate_the_childlike_enthusiasm/,False,,CrazyDCFans,You've gotta appreciate the child-like enthusiasm.,https://www.youtube.com/watch?v=th-KWcTSzUQ
61,2016-04-15 22:58:14+00:00,bleedingcool.com,https://www.reddit.com/r/CrazyDCFans/comments/4ezag2/grace_randolph_was_apparently_fired_by_marvel/,False,,CrazyDCFans,Grace Randolph was apparently fired by Marvel.,http://www.bleedingcool.com/2011/09/13/marvel-fires-grace-randolph-as-their-watcher/
62,2016-04-15 19:46:58+00:00,10minuteramble.files.wordpress.com,https://www.reddit.com/r/CrazyDCFans/comments/4eygn6/another_great_onion_cartoon/,False,,CrazyDCFans,Another great Onion cartoon.,https://10minuteramble.files.wordpress.com/2010/04/kellymarvelvsdc_jpg_445x1000_upscale_q85-1.jpg
63,2016-04-15 17:44:50+00:00,theonion.com,https://www.reddit.com/r/CrazyDCFans/comments/4exvew/the_onions_editorial_cartoons_know_whats_up/,False,,CrazyDCFans,The Onion's editorial cartoons know whats up.,http://www.theonion.com/graphic/special-afflecks-52679
64,2016-04-15 15:23:56+00:00,np.reddit.com,https://www.reddit.com/r/CrazyDCFans/comments/4ex7cn/the_best_batman_v_superman_defender_essay/,False,,CrazyDCFans,The best Batman v Superman defender essay.,https://np.reddit.com/r/DC_Cinematic/comments/4dx0ne/whats_the_oldest_lie_in_america/
65,2016-04-15 15:18:51+00:00,i.imgur.com,https://www.reddit.com/r/CrazyDCFans/comments/4ex6is/batman_v_superman_bingo/,False,,CrazyDCFans,Batman v Superman Bingo,https://i.imgur.com/InyjrJ4.jpg
66,2016-04-15 15:16:16+00:00,youtu.be,https://www.reddit.com/r/CrazyDCFans/comments/4ex64o/grace_explains_the_scary_truth_about_the/,False,,CrazyDCFans,Grace explains the scary truth about the malicious critics who wanted Batman v Superman to fail.,https://youtu.be/HDOQdur9CnQ
67,2016-04-15 04:32:49+00:00,twitter.com,https://www.reddit.com/r/CrazyDCFans/comments/4ev4sh/that_awkward_moment_when_youre_a_professional/,False,,CrazyDCFans,That awkward moment when you're a professional film critic and you don't understand how Rotten Tomatoes works.,https://twitter.com/GraceRandolph/status/720716523636137984
68,2016-04-15 04:29:38+00:00,youtube.com,https://www.reddit.com/r/CrazyDCFans/comments/4ev4eu/andre_tells_us_who_the_real_hero_is/,False,,CrazyDCFans,Andre tells us who the real hero is.,https://www.youtube.com/watch?v=tT4-vtV7OaM
69,2016-04-15 04:28:46+00:00,thewrap.com,https://www.reddit.com/r/CrazyDCFans/comments/4ev4ar/article_on_this_phenomena/,False,,CrazyDCFans,Article on this phenomena.,http://www.thewrap.com/captain-america-batman-v-superman-reviews-ignite-nutty-fan-conspiracy-furor-commentary/
70,2016-04-15 04:26:25+00:00,np.reddit.com,https://www.reddit.com/r/CrazyDCFans/comments/4ev40s/antidc_conspiracy_crazy_to_you_but_not_to_some_dc/,False,,CrazyDCFans,"Anti-DC conspiracy? Crazy to you, but not to some DC fans.",https://www.np.reddit.com/r/DC_Cinematic/comments/47n6ex/is_there_a_controlled_smear_campaignscheme/
71,2016-04-15 04:21:24+00:00,twitter.com,https://www.reddit.com/r/CrazyDCFans/comments/4ev3ga/seeing_people_prefer_a_marvel_movie_to_a_dc_one/,False,,CrazyDCFans,Seeing people prefer a Marvel movie to a DC one? Don't let them get away with that shit!,https://twitter.com/GraceRandolph/status/720628666103939077
72,2016-04-15 04:19:53+00:00,youtube.com,https://www.reddit.com/r/CrazyDCFans/comments/4ev3a9/so_disney_biased_marvel_tomatoes_rates_civil_bore/,False,,CrazyDCFans,so Disney Biased Marvel Tomatoes Rates Civil Bore RT100?what a shocker! sh@t Site!,https://www.youtube.com/watch?v=f1VDimWhYUs
73,2016-04-14 21:07:58+00:00,twitter.com,https://www.reddit.com/r/moviescirclejerk/comments/4etbm7/rotten_tomatoes_thinks_it_can_attack_batman_v/,False,,moviescirclejerk,Rotten tomatoes thinks it can attack Batman v Superman and be biased in favor of Marvel. It's over shills!!!,https://twitter.com/GraceRandolph/status/720716523636137984
74,2016-04-14 18:20:27+00:00,twitter.com,https://www.reddit.com/r/moviescirclejerk/comments/4esigq/dont_let_the_shills_win/,False,,moviescirclejerk,DON'T LET THE SHILLS WIN!,https://twitter.com/GraceRandolph/status/720628666103939077
75,2016-04-12 18:45:56+00:00,self.Marvel,https://www.reddit.com/r/Marvel/comments/4ehj0c/seriously_what_can_we_do_to_get_a_nextwave_agents/,False,"I've always been fond of the idea, but after watching this video on the history of adult swim:
https://www.youtube.com/watch?v=Pkup4zo97E0&amp;feature=share

I've realized this wouldn't only scratch a Marvel itch that's been bugging me for a while (an adult oriented Marvel cartoon), it'd fit the style, humor, and general demographic of that channel incredibly well. A Marvel self parody cartoon on that channel would be killer!

So how do we make this happen?",Marvel,"Seriously, what can we do to get a NextWave Agents of HATE cartoon on AdultSwim?",https://www.reddit.com/r/Marvel/comments/4ehj0c/seriously_what_can_we_do_to_get_a_nextwave_agents/
76,2016-04-10 04:08:39+00:00,youtube.com,https://www.reddit.com/r/DeepIntoYouTube/comments/4e4imq/nazi_zombies_meets_mlp/,False,,DeepIntoYouTube,Nazi Zombies Meets MLP,https://www.youtube.com/watch?v=tW7Z7WMMOh8
77,2016-03-27 05:54:55+00:00,reddit.com,https://www.reddit.com/r/moviescirclejerk/comments/4c4mmi/uj_astroturfing_uj/,False,,moviescirclejerk,[uj] astroturfing? [uj],https://www.reddit.com/r/movies/comments/4c3fre/batman_v_superman_ultimate_edition_release_date/
78,2016-03-25 05:49:35+00:00,self.moviescirclejerk,https://www.reddit.com/r/moviescirclejerk/comments/4bvfnf/i_loved_bvs_and_whether_this_is_upvoted_or_not/,False,"Now that we've got that out of the way,  why does everyone else like the movie? Why are critics and people who dislike the movie wrong?",moviescirclejerk,I LOVED BVS AND WHETHER THIS IS UPVOTED OR NOT DETERMINES IF I'M ALLOWED TO LIKE IT. SO UPVOTE OR YOURE A MARVEL FANBOY.,https://www.reddit.com/r/moviescirclejerk/comments/4bvfnf/i_loved_bvs_and_whether_this_is_upvoted_or_not/
79,2016-03-25 00:33:34+00:00,self.DC_Cinematic,https://www.reddit.com/r/DC_Cinematic/comments/4buejq/for_the_those_trying_to_act_like_people_here_are/,False,[removed],DC_Cinematic,FOR THE THOSE TRYING TO ACT LIKE PEOPLE HERE ARE CIRCLEJERKING AGAINST BvS,https://www.reddit.com/r/DC_Cinematic/comments/4buejq/for_the_those_trying_to_act_like_people_here_are/
80,2016-03-24 18:38:48+00:00,self.marvelstudios,https://www.reddit.com/r/marvelstudios/comments/4bswgc/can_we_agree_to_never_become_this/,False,[removed],marvelstudios,Can we agree to never become this.,https://www.reddit.com/r/marvelstudios/comments/4bswgc/can_we_agree_to_never_become_this/
81,2016-02-15 00:01:00+00:00,self.Marvel,https://www.reddit.com/r/Marvel/comments/45trs4/has_the_big_six_become_the_big_seven/,False,"Marvel's top heroes for the past 30 or so years have consistently been 

1. Spider-man

2. Wolverine

3. Hulk

4. Captain America

5. Iron man

6. Thor


So my question is, after Deadpool opening bigger than any other first installment of a superhero franchise ever, is he on track to being number 7 on that list?


Also, what do we all think of SIX, soon to be TEN different billion $ franchises being made with Marvel characters? 


The six being Spider-man, X-men, Avengers, Iron man, Captain America, and Thor, and the 4 up and comers to be Guardians of the Galaxy, Wolverine, Ant-man, and Deadpool (all high grossing films with confirmed sequels)",Marvel,Has the Big Six become the Big Seven?,https://www.reddit.com/r/Marvel/comments/45trs4/has_the_big_six_become_the_big_seven/
82,2015-10-31 04:55:29+00:00,imgur.com,https://www.reddit.com/r/im14andthisisdeep/comments/3qxmk5/ever_wonder_why_there_are_no_seatbelts_on_school/,False,,im14andthisisdeep,Ever wonder why there are no seatbelts on school buses?,http://imgur.com/hra7SPJ
