,created,domain,full_link,locked,selftext,subreddit,title,url
0,2016-06-09 18:22:34+00:00,politico.com,https://www.reddit.com/r/HillaryForAmerica/comments/4nc5cf/clinton_super_pac_targets_hispanics_with_new/,False,,HillaryForAmerica,Clinton super PAC targets Hispanics with new anti-Trump digital ads,http://www.politico.com/story/2016/06/priorities-superpac-trump-hispanics-224123
1,2016-06-09 05:28:33+00:00,fusion.net,https://www.reddit.com/r/hillaryclinton/comments/4n9f0l/hillary_clinton_won_big_in_californias_heaviest/,False,,hillaryclinton,Hillary Clinton won big in California’s heaviest Latino districts,http://fusion.net/story/311314/latino-voters-california-primary-2016/
2,2016-06-09 05:28:22+00:00,fusion.net,https://www.reddit.com/r/HillaryForAmerica/comments/4n9f02/hillary_clinton_won_big_in_californias_heaviest/,False,,HillaryForAmerica,Hillary Clinton won big in California’s heaviest Latino districts,http://fusion.net/story/311314/latino-voters-california-primary-2016/
3,2016-06-08 02:45:03+00:00,rollcall.com,https://www.reddit.com/r/hillaryclinton/comments/4n2vrz/the_daisy_ad_a_halfcentury_later_will_portraying/,False,,hillaryclinton,The Daisy Ad — A Half-Century Later — Will portraying Trump as a national security threat be persuasive?,http://www.rollcall.com/news/opinion/the-daisy-ad-a-half-century-later-walter-shapiro-column
4,2016-06-08 02:44:57+00:00,rollcall.com,https://www.reddit.com/r/HillaryForAmerica/comments/4n2vri/the_daisy_ad_a_halfcentury_later_will_portraying/,False,,HillaryForAmerica,The Daisy Ad — A Half-Century Later — Will portraying Trump as a national security threat be persuasive?,http://www.rollcall.com/news/opinion/the-daisy-ad-a-half-century-later-walter-shapiro-column
5,2016-06-06 19:40:14+00:00,nymag.com,https://www.reddit.com/r/HillaryForAmerica/comments/4muu1r/bernie_sanders_has_some_strange_ideas_about_why/,False,,HillaryForAmerica,Bernie Sanders Has Some Strange Ideas About Why He Deserves the Nomination,http://nymag.com/daily/intelligencer/2016/06/strange-ideas-why-bernie-deserves-nomination.html
6,2016-06-06 19:40:09+00:00,nymag.com,https://www.reddit.com/r/hillaryclinton/comments/4muu15/bernie_sanders_has_some_strange_ideas_about_why/,False,,hillaryclinton,Bernie Sanders Has Some Strange Ideas About Why He Deserves the Nomination,http://nymag.com/daily/intelligencer/2016/06/strange-ideas-why-bernie-deserves-nomination.html
7,2016-06-06 19:40:03+00:00,nymag.com,https://www.reddit.com/r/BernieSandersSucks/comments/4muu0g/bernie_sanders_has_some_strange_ideas_about_why/,False,,BernieSandersSucks,Bernie Sanders Has Some Strange Ideas About Why He Deserves the Nomination,http://nymag.com/daily/intelligencer/2016/06/strange-ideas-why-bernie-deserves-nomination.html
8,2016-06-05 18:16:57+00:00,thedailybeast.com,https://www.reddit.com/r/BernieSandersSucks/comments/4momo0/the_white_entitlement_of_some_sanders_supporters/,False,,BernieSandersSucks,"The White Entitlement of Some Sanders Supporters: If you’re young, white and privileged, you don’t expect to lose. When you do, it must be because you got cheated. Blacks know better.",http://www.thedailybeast.com/articles/2016/06/05/the-white-entitlement-of-some-sanders-supporters.html
9,2016-06-05 00:03:00+00:00,politicade.com,https://www.reddit.com/r/BernieSandersSucks/comments/4mkz1d/confirmed_bernie_sanders_illegally_used_campaign/,False,,BernieSandersSucks,Confirmed: Bernie Sanders Illegally Used Campaign Funds For Overnight Trip To Italy,http://www.politicade.com/confirmed-bernie-sanders-illegally-used-campaign-funds-for-overnight-trip-to-italy/
10,2016-06-03 19:11:17+00:00,morningconsult.com,https://www.reddit.com/r/hillaryclinton/comments/4mehvp/good_cali_news_4_hillary_85_percent_of_the/,False,,hillaryclinton,"Good Cali News 4 Hillary: ""85 percent of the ballots mailed to voters who were not registered with the Democratic Party did not include a presidential ballot test.""",https://morningconsult.com/2016/05/31/california-voters-turning-record-numbers/
11,2016-06-03 18:14:13+00:00,huffingtonpost.com,https://www.reddit.com/r/HillaryForAmerica/comments/4me7y5/when_sanders_superdelegate_truthism_confronts/,False,,HillaryForAmerica,"When Sanders’ Superdelegate Truthism Confronts Reality, Reality Wins",http://www.huffingtonpost.com/amy-fried/sanders-superdelegate-tru_b_10218614.html
12,2016-06-02 15:13:05+00:00,washingtonpost.com,https://www.reddit.com/r/politics/comments/4m7mlg/fact_checker_bernie_sanderss_factually_incorrect/,False,,politics,"Fact Checker: Bernie Sanders’s ‘factually incorrect’ delegate math; ""Three Pinocchios""",https://www.washingtonpost.com/news/fact-checker/wp/2016/06/02/bernie-sanderss-factually-incorrect-delegate-math/
13,2016-06-01 18:42:32+00:00,washingtonpost.com,https://www.reddit.com/r/hillaryclinton/comments/4m2t3o/hillary_has_already_won_the_presidency/,False,,hillaryclinton,Hillary has already won the presidency,https://www.washingtonpost.com/news/opinions/wp/2016/06/01/hillary-has-already-won-the-presidency/
14,2016-05-31 14:46:41+00:00,imgur.com,https://www.reddit.com/r/enoughsandersspam/comments/4lvjy9/definitive_proof_better_pictures_of_bernies_nap/,False,,enoughsandersspam,*** Definitive Proof - Better Pictures of Bernie's Nap During Veterans Day Ceremony - Sequence of High Quality Photos Show His Eyes Closed - Click Each Photo to Enlarge to See Him Sleeping ***,http://imgur.com/a/2TolN
15,2016-05-31 03:38:45+00:00,realclearpolitics.com,https://www.reddit.com/r/enoughsandersspam/comments/4lt9yb/bernie_whines_i_have_a_real_problem_with_the_new/,False,,enoughsandersspam,"Bernie Whines, ""I Have a Real Problem With the New York Times"" - Yeah, Bernie, They're Not Buying Your Badly Used Car",http://www.realclearpolitics.com/video/2016/05/29/bernie_sanders_i_have_a_real_problem_with_the_new_york_times.html
16,2016-05-31 03:37:06+00:00,realclearpolitics.com,https://www.reddit.com/r/enoughsandersspam/comments/4lt9p3/bernie_sanders_isnt_interested_in_answering/,False,,enoughsandersspam,Bernie Sanders Isn't Interested In Answering Questions About Socialism In Venezuela,http://www.realclearpolitics.com/video/2016/05/30/bernie_sanders_isnt_interested_in_answering_questions_about_socialism_in_venezuela.html
17,2016-05-31 02:56:20+00:00,mediaite.com,https://www.reddit.com/r/hillaryclinton/comments/4lt3oo/sarah_palin_just_gave_hillary_clinton_the_perfect/,False,,hillaryclinton,Sarah Palin Just Gave Hillary Clinton The Perfect Nickname For Donald Trump,http://www.mediaite.com/online/sarah-palin-just-gave-hillary-clinton-the-perfect-nickname-for-donald-trump/
18,2016-05-29 14:23:07+00:00,medium.com,https://www.reddit.com/r/enoughsandersspam/comments/4lklco/bernie_has_paid_64_million_to_old_towne_media_a/,False,,enoughsandersspam,"Bernie Has Paid $64 Million to Old Towne Media, a Secretive &amp; Labyrinthine Company With All White Employees",https://medium.com/@VonEbsy/old-towne-media-llc-buying-a-political-revolution-40cbac5cb4c3
19,2016-05-29 03:01:27+00:00,mediad.publicbroadcasting.net,https://www.reddit.com/r/democrats/comments/4litum/lawyers_representing_church_that_lost_2_million/,False,,democrats,Lawyers Representing Church That Lost $2 Million on Jane Sanders Land Deal Serve Bernie Sanders With Demand Letter to Release All Documents Related to His Involvement in Loan Application,http://mediad.publicbroadcasting.net/p/vpr/files/201605/toensing-sanders-letter-20160525.pdf
20,2016-05-29 03:01:24+00:00,mediad.publicbroadcasting.net,https://www.reddit.com/r/BernieSandersSucks/comments/4lituf/lawyers_representing_church_that_lost_2_million/,False,,BernieSandersSucks,Lawyers Representing Church That Lost $2 Million on Jane Sanders Land Deal Serve Bernie Sanders With Demand Letter to Release All Documents Related to His Involvement in Loan Application,http://mediad.publicbroadcasting.net/p/vpr/files/201605/toensing-sanders-letter-20160525.pdf
21,2016-05-29 03:01:06+00:00,mediad.publicbroadcasting.net,https://www.reddit.com/r/enoughsandersspam/comments/4litt1/lawyers_representing_church_that_lost_2_million/,False,,enoughsandersspam,Lawyers Representing Church That Lost $2 Million on Jane Sanders Land Deal Serve Bernie Sanders With Demand Letter to Release All Documents Related to His Involvement in Loan Application,http://mediad.publicbroadcasting.net/p/vpr/files/201605/toensing-sanders-letter-20160525.pdf
22,2016-05-29 03:00:02+00:00,mediad.publicbroadcasting.net,https://www.reddit.com/r/hillaryclinton/comments/4litoy/lawyers_representing_church_that_lost_2_million/,False,,hillaryclinton,Lawyers Representing Church That Lost $2 Million on Jane Sanders Land Deal Serve Bernie Sanders With Demand Letter to Release All Documents Related to His Involvement in Loan Application,http://mediad.publicbroadcasting.net/p/vpr/files/201605/toensing-sanders-letter-20160525.pdf
23,2016-05-29 02:53:32+00:00,digital.vpr.net,https://www.reddit.com/r/politics/comments/4liswg/republicans_claim_sanders_used_senate_office_to/,False,,politics,Republicans Claim Sanders Used Senate Office To Help Wife At Burlington College,http://digital.vpr.net/post/republicans-claim-sanders-used-senate-office-help-wife-burlington-college
24,2016-05-29 02:53:17+00:00,digital.vpr.net,https://www.reddit.com/r/BernieSandersSucks/comments/4lisvp/republicans_claim_sanders_used_senate_office_to/,False,,BernieSandersSucks,Republicans Claim Sanders Used Senate Office To Help Wife At Burlington College,http://digital.vpr.net/post/republicans-claim-sanders-used-senate-office-help-wife-burlington-college
25,2016-05-29 02:08:27+00:00,salon.com,https://www.reddit.com/r/enoughsandersspam/comments/4linda/its_time_to_look_in_the_mirror_bernie_now_more/,False,,enoughsandersspam,"It’s time to look in the mirror, Bernie: Now, more than ever, Sanders needs to be criticized for his failed political theories - Sanders backers must stop calling Clinton a ""sore winner,"" and instead learn the right lessons from his failure",http://www.salon.com/2016/05/28/its_time_to_look_in_the_mirror_bernie_now_more_than_ever_sanders_needs_to_be_criticized_for_his_failed_political_theories/
26,2016-05-29 02:08:15+00:00,salon.com,https://www.reddit.com/r/democrats/comments/4linch/its_time_to_look_in_the_mirror_bernie_now_more/,False,,democrats,"It’s time to look in the mirror, Bernie: Now, more than ever, Sanders needs to be criticized for his failed political theories - Sanders backers must stop calling Clinton a ""sore winner,"" and instead learn the right lessons from his failure",http://www.salon.com/2016/05/28/its_time_to_look_in_the_mirror_bernie_now_more_than_ever_sanders_needs_to_be_criticized_for_his_failed_political_theories/
27,2016-05-29 02:07:10+00:00,salon.com,https://www.reddit.com/r/hillaryclinton/comments/4lin82/its_time_to_look_in_the_mirror_bernie_now_more/,True,,hillaryclinton,"It’s time to look in the mirror, Bernie: Now, more than ever, Sanders needs to be criticized for his failed political theories - Sanders backers must stop calling Clinton a ""sore winner,"" and instead learn the right lessons from his failure",http://www.salon.com/2016/05/28/its_time_to_look_in_the_mirror_bernie_now_more_than_ever_sanders_needs_to_be_criticized_for_his_failed_political_theories/
28,2016-05-29 02:06:08+00:00,salon.com,https://www.reddit.com/r/BernieSandersSucks/comments/4lin2s/its_time_to_look_in_the_mirror_bernie_now_more/,False,,BernieSandersSucks,"It’s time to look in the mirror, Bernie: Now, more than ever, Sanders needs to be criticized for his failed political theories - Sanders backers must stop calling Clinton a ""sore winner,"" and instead learn the right lessons from his failure",http://www.salon.com/2016/05/28/its_time_to_look_in_the_mirror_bernie_now_more_than_ever_sanders_needs_to_be_criticized_for_his_failed_political_theories/
29,2016-05-29 01:58:32+00:00,salon.com,https://www.reddit.com/r/enoughsandersspam/comments/4lim4g/a_day_to_remember_one_year_ago_today_bernies_rape/,False,,enoughsandersspam,"A Day to Remember - One Year Ago Today, Bernie's Rape Porn Secret Shame Was Exposed",http://www.salon.com/2015/05/29/bernie_sanders_exposed_a_shocking_look_at_his_views_on_rape_and_violence_against_women/
30,2016-05-25 16:20:58+00:00,washingtonpost.com,https://www.reddit.com/r/hillaryclinton/comments/4l0ggc/trumps_attacks_on_the_gops_most_prominent_latina/,False,,hillaryclinton,"Trump’s attacks on the GOP’s most prominent Latina, Susana Martinez, should alarm Republicans",https://www.washingtonpost.com/news/powerpost/paloma/daily-202/2016/05/25/daily-202-trump-s-attacks-on-the-gop-s-most-prominent-latina-susana-martinez-should-alarm-republicans/57447430981b92a22da97667/?tid=pm_politics_pop_b
31,2016-05-25 16:13:35+00:00,washingtonpost.com,https://www.reddit.com/r/hillaryclinton/comments/4l0f2x/in_a_trumpclinton_matchup_racial_prejudice_makes/,False,,hillaryclinton,"In a Trump-Clinton match-up, racial prejudice makes a striking difference",https://www.washingtonpost.com/news/monkey-cage/wp/2016/05/25/in-a-trump-clinton-match-up-theres-a-striking-effect-of-racial-prejudice/
32,2016-05-25 16:12:48+00:00,marketwatch.com,https://www.reddit.com/r/hillaryclinton/comments/4l0exr/why_the_economy_may_favor_hillary_clinton_over/,False,,hillaryclinton,"Why the economy may favor Hillary Clinton over Donald Trump: The real determinant is jobs and wages, regardless of current polls",http://www.marketwatch.com/story/hillary-clinton-will-win-in-november-says-the-economy-2016-05-25
33,2016-05-24 18:11:21+00:00,fortune.com,https://www.reddit.com/r/hillaryclinton/comments/4kv5ty/donald_trumps_incoherent_positions_are_part_of/,False,,hillaryclinton,Donald Trump's Incoherent Positions Are Part of His Master Plan ~ He thinks unpredictability is a strength. He’s wrong.,http://fortune.com/2016/05/13/donald-trump-policies-unpredictability/
34,2016-05-24 18:11:05+00:00,fortune.com,https://www.reddit.com/r/democrats/comments/4kv5s9/donald_trumps_incoherent_positions_are_part_of/,False,,democrats,Donald Trump's Incoherent Positions Are Part of His Master Plan ~ He thinks unpredictability is a strength. He’s wrong.,http://fortune.com/2016/05/13/donald-trump-policies-unpredictability/
35,2016-05-23 02:27:38+00:00,inquisitr.com,https://www.reddit.com/r/enoughsandersspam/comments/4klt3h/jake_tapper_manages_to_keep_a_straight_face_when/,False,,enoughsandersspam,"Jake Tapper Manages to Keep a Straight Face When Bernie Sanders Boasts: ""People Who Come To My Rallies Can Do Arithmetic""",http://www.inquisitr.com/3122977/bernie-sanders-chides-cnns-jack-tapper-people-who-come-to-my-rallies-can-do-arithmetic-video/
36,2016-05-22 03:28:44+00:00,chicagonow.com,https://www.reddit.com/r/democrats/comments/4kgxx4/a_cautionary_tale_of_two_narcissists_bernie/,False,,democrats,A cautionary tale of two narcissists: Bernie Sanders and Donald Trump,http://www.chicagonow.com/politics-now/2016/05/a-cautionary-tale-of-two-narcissists-bernie-sanders-and-donald-trump/
37,2016-05-22 03:27:59+00:00,chicagonow.com,https://www.reddit.com/r/hillaryclinton/comments/4kgxu1/a_cautionary_tale_of_two_narcissists_bernie/,False,,hillaryclinton,A cautionary tale of two narcissists: Bernie Sanders and Donald Trump,http://www.chicagonow.com/politics-now/2016/05/a-cautionary-tale-of-two-narcissists-bernie-sanders-and-donald-trump/
38,2016-05-20 14:20:48+00:00,talkingpointsmemo.com,https://www.reddit.com/r/Drumpf/comments/4k8g84/maryland_trump_delegate_indicted_on_fed_child/,False,,Drumpf,"Maryland Trump Delegate Indicted On Fed Child Porn, Explosives, Gun Charges",http://talkingpointsmemo.com/livewire/caleb-andrew-bailey-trump-delegate-indicted
39,2016-05-20 14:20:22+00:00,talkingpointsmemo.com,https://www.reddit.com/r/EnoughTrumpSpam/comments/4k8g5r/maryland_trump_delegate_indicted_on_fed_child/,False,,EnoughTrumpSpam,"Maryland Trump Delegate Indicted On Fed Child Porn, Explosives, Gun Charges",http://talkingpointsmemo.com/livewire/caleb-andrew-bailey-trump-delegate-indicted
40,2016-05-20 14:19:58+00:00,talkingpointsmemo.com,https://www.reddit.com/r/hillaryclinton/comments/4k8g3n/maryland_trump_delegate_indicted_on_fed_child/,False,,hillaryclinton,"Maryland Trump Delegate Indicted On Fed Child Porn, Explosives, Gun Charges",http://talkingpointsmemo.com/livewire/caleb-andrew-bailey-trump-delegate-indicted
41,2016-05-20 03:30:13+00:00,self.Jane4Prison,https://www.reddit.com/r/Jane4Prison/comments/4k6de6/is_there_any_truth_to_the_rumor_that_jane_sanders/,False,I've heard they're using real lady cons in Season Four so I was wondering if anyone knew if Jane Sanders will be one of the convicts. Has anyone else heard this?,Jane4Prison,Is There Any Truth to the Rumor That Jane Sanders Will Make a Cameo in the New Season of 'Orange Is the New Black',https://www.reddit.com/r/Jane4Prison/comments/4k6de6/is_there_any_truth_to_the_rumor_that_jane_sanders/
42,2016-05-20 03:20:07+00:00,heatst.com,https://www.reddit.com/r/hillaryclinton/comments/4k6c1d/burlington_college_board_member_feds_asking/,False,,hillaryclinton,Burlington College Board Member: Feds ‘Asking Questions’ About Jane Sanders Loan,http://heatst.com/politics/breaking-burlington-college-board-member-has-heard-feds-have-been-asking-questions-about-jane-sanders-loan-deal/
43,2016-05-20 03:19:46+00:00,heatst.com,https://www.reddit.com/r/politics/comments/4k6bzr/burlington_college_board_member_feds_asking/,False,,politics,Burlington College Board Member: Feds ‘Asking Questions’ About Jane Sanders Loan,http://heatst.com/politics/breaking-burlington-college-board-member-has-heard-feds-have-been-asking-questions-about-jane-sanders-loan-deal/
44,2016-05-20 03:19:18+00:00,heatst.com,https://www.reddit.com/r/democrats/comments/4k6bx4/burlington_college_board_member_feds_asking/,False,,democrats,Burlington College Board Member: Feds ‘Asking Questions’ About Jane Sanders Loan,http://heatst.com/politics/breaking-burlington-college-board-member-has-heard-feds-have-been-asking-questions-about-jane-sanders-loan-deal/
45,2016-05-19 18:38:27+00:00,yahoo.com,https://www.reddit.com/r/BernieSandersSucks/comments/4k3z3l/with_bernielostme_hashtag_black_voters_describe/,False,,BernieSandersSucks,"With #BernieLostMe Hashtag, Black Voters Describe How Bernie Sanders Messed Up",https://www.yahoo.com/news/bernielostme-hashtag-black-voters-describe-152100756.html
46,2016-05-19 18:32:06+00:00,yahoo.com,https://www.reddit.com/r/democrats/comments/4k3xxx/with_bernielostme_hashtag_black_voters_describe/,False,,democrats,"With #BernieLostMe Hashtag, Black Voters Describe How Bernie Sanders Messed Up",https://www.yahoo.com/news/bernielostme-hashtag-black-voters-describe-152100756.html
47,2016-05-19 15:44:34+00:00,forbes.com,https://www.reddit.com/r/enoughsandersspam/comments/4k32p5/sorry_bernie_wall_street_wasnt_deregulated/,False,,enoughsandersspam,"Sorry Bernie, Wall Street Wasn't Deregulated Pre-Crash",http://www.forbes.com/sites/jaredmeyer/2016/02/10/bernie-sanders-wall-street-not-deregulated/
48,2016-05-18 14:29:19+00:00,motherjones.com,https://www.reddit.com/r/BernieSandersSucks/comments/4jwx65/the_sad_decline_and_fall_of_bernie_sanders/,False,,BernieSandersSucks,The Sad Decline and Fall of Bernie Sanders,http://www.motherjones.com/kevin-drum/2016/05/decline-fall-bernie-sanders
49,2016-05-18 14:28:31+00:00,motherjones.com,https://www.reddit.com/r/democrats/comments/4jwx1k/the_sad_decline_and_fall_of_bernie_sanders/,True,,democrats,The Sad Decline and Fall of Bernie Sanders,http://www.motherjones.com/kevin-drum/2016/05/decline-fall-bernie-sanders
50,2016-05-18 14:26:59+00:00,talkingpointsmemo.com,https://www.reddit.com/r/BernieSandersSucks/comments/4jwwrc/sanders_is_telling_his_supporters_that_he_can/,False,,BernieSandersSucks,"Sanders is telling his supporters that he can still win, which he can’t. He’s suggesting that the win is being stolen by a corrupt establishment, an impression which will be validated when his phony prediction turns out not to be true.",http://talkingpointsmemo.com/edblog/it-comes-from-the-very-top
51,2016-05-17 19:11:30+00:00,theweek.com,https://www.reddit.com/r/enoughsandersspam/comments/4jsl3l/bernie_has_excellent_management_skills_he_lets/,False,,enoughsandersspam,"Bernie Has Excellent Management Skills ~ He Lets His Wife Do His Taxes, the Same Wife Who Drove a College Into Bankruptcy With Crushing Debt",http://theweek.com/speedreads/624641/burlington-college-close-due-crushing-debt-incurred-by-bernie-sanders-wife-jane-sanders
52,2016-05-16 19:11:49+00:00,huffingtonpost.com,https://www.reddit.com/r/enoughsandersspam/comments/4jmqqb/gone_are_the_days_when_berniebros_carpetbombed_ha/,False,,enoughsandersspam,Gone Are the Days When BernieBros Carpetbombed HA Goodman's Comments With Loving Comments; Now People Openly Mock Poor Deluded Goodman,http://www.huffingtonpost.com/h-a-goodman/bernie-sanders-must-campa_b_9990718.html
53,2016-05-16 19:01:38+00:00,patheos.com,https://www.reddit.com/r/enoughsandersspam/comments/4jmov7/diehard_berniebro_admits_stick_a_fork_in_bernie/,False,,enoughsandersspam,"Die-Hard BernieBro Admits: ""Stick a Fork in Bernie Sanders, He’s Done.""",http://www.patheos.com/blogs/dispatches/2016/05/04/stick-a-fork-in-bernie-sanders-hes-done-or-is-he/
54,2016-05-14 02:08:20+00:00,talkingpointsmemo.com,https://www.reddit.com/r/BernieSandersSucks/comments/4j9l0t/msnbc_host_to_top_sanders_aide_telling_backers_he/,False,,BernieSandersSucks,MSNBC Host To Top Sanders Aide: Telling Backers He Can Still Win Is ‘Dishonest’,http://talkingpointsmemo.com/livewire/thomas-roberts-jeff-weaver-sanders-superdelegates
55,2016-05-14 02:08:10+00:00,talkingpointsmemo.com,https://www.reddit.com/r/enoughsandersspam/comments/4j9l02/msnbc_host_to_top_sanders_aide_telling_backers_he/,False,,enoughsandersspam,MSNBC Host To Top Sanders Aide: Telling Backers He Can Still Win Is ‘Dishonest’,http://talkingpointsmemo.com/livewire/thomas-roberts-jeff-weaver-sanders-superdelegates
56,2016-05-14 01:49:52+00:00,np.reddit.com,https://www.reddit.com/r/enoughsandersspam/comments/4j9ipw/senility_alert_bernie_will_continue_campaigning/,False,,enoughsandersspam,Senility Alert: Bernie Will Continue Campaigning for the Nomination *After* the Last Primary in Washington DC,https://np.reddit.com/r/politics/comments/4j5nz8/let_it_go_democrats_bernie_sanders_will_campaign/
57,2016-05-10 17:56:35+00:00,self.BernieSandersSucks,https://www.reddit.com/r/BernieSandersSucks/comments/4iqhf6/berniebros_will_be_crowing_tonight_after_sanders/,False,"Sanders is expected to win by a small margin in West Virginia today, based on the latest polls. But a small margin is actually a loss. Why, you ask. The reason is simple math: unless Sanders wins about 77% of the West Virginia vote today, he's fallen further behind. Given he's hundreds of delegates behind, he needs massive margins now to win, massive margins that are all but impossible to achieve. So if he doesn't win at least 77% today, that means his margins in the last remaining races must be even *higher* going forward.

BernieBros hate Nate Silver because he constantly drenches them with cold hard math. Here is Nate's math for the impossible cliff Sanders now faces: http://i.imgur.com/7a0vVOM.jpg",BernieSandersSucks,"BernieBros Will Be Crowing Tonight After Sanders Wins West Virginia - Just Remind Them That Unless He Wins 77% of West Virginia, He's Actually Fallen Further Behind",https://www.reddit.com/r/BernieSandersSucks/comments/4iqhf6/berniebros_will_be_crowing_tonight_after_sanders/
58,2016-05-10 17:56:15+00:00,self.enoughsandersspam,https://www.reddit.com/r/enoughsandersspam/comments/4iqhdg/berniebros_will_be_crowing_tonight_after_sanders/,False,"Sanders is expected to win by a small margin in West Virginia today, based on the latest polls. But a small margin is actually a loss. Why, you ask. The reason is simple math: unless Sanders wins about 77% of the West Virginia vote today, he's fallen further behind. Given he's hundreds of delegates behind, he needs massive margins now to win, massive margins that are all but impossible to achieve. So if he doesn't win at least 77% today, that means his margins in the last remaining races must be even *higher* going forward.

BernieBros hate Nate Silver because he constantly drenches them with cold hard math. Here is Nate's math for the impossible cliff Sanders now faces: http://i.imgur.com/7a0vVOM.jpg",enoughsandersspam,"BernieBros Will Be Crowing Tonight After Sanders Wins West Virginia - Just Remind Them That Unless He Wins 77% of West Virginia, He's Actually Fallen Further Behind",https://www.reddit.com/r/enoughsandersspam/comments/4iqhdg/berniebros_will_be_crowing_tonight_after_sanders/
59,2016-05-08 02:15:03+00:00,i.imgur.com,https://www.reddit.com/r/enoughsandersspam/comments/4icuhw/feeling_the_bern_los_angeles_style/,False,,enoughsandersspam,"Feeling the Bern, Los Angeles Style",http://i.imgur.com/9orUtJ0.jpg
60,2016-05-06 14:47:54+00:00,np.reddit.com,https://www.reddit.com/r/BernieSandersSucks/comments/4i5eem/viva_méxico_bernie_campaigns_with_two_illegal/,False,,BernieSandersSucks,¡Viva México! ~ Bernie Campaigns With Two Illegal Aliens on Stage in Kentucky ~ ¡Viva Bérnie!,https://np.reddit.com/r/SandersForPresident/comments/4hs0em/two_undocumented_bernie_supporters_join_him_on/
61,2016-05-06 14:44:37+00:00,politicususa.com,https://www.reddit.com/r/BernieSandersSucks/comments/4i5dwt/hypotheticals_and_wishful_thinking_fuel_the_myth/,False,,BernieSandersSucks,"Hypotheticals And Wishful Thinking Fuel The Myth Of Bernie Sanders’ Electability: ""If you were designing the perfect target for Republicans in November, you’d create Bernie Sanders.""",http://www.politicususa.com/2016/05/05/dont-succumb-bernie-sanders-electability-myth.html
