,created,domain,full_link,locked,selftext,subreddit,title,url
24,2015-07-26 20:07:16+00:00,self.starwarstrader,https://www.reddit.com/r/starwarstrader/comments/3eowjf/speculation_no_marathon_deadline_announcement/,,"Deadline is more than 1 week after card drop I'm guessing.  Maybe deadline will be 1 week after GM Wk 20?  Would be nice to give everyone extra time to get what they need...

If there were a lot of new players from comic con, makes sense to give them extra time to catch up too. Win win for everyone",starwarstrader,[Speculation] No marathon deadline announcement means...,http://www.reddit.com/r/starwarstrader/comments/3eowjf/speculation_no_marathon_deadline_announcement/
25,2015-07-24 02:55:29+00:00,self.starwarstrader,https://www.reddit.com/r/starwarstrader/comments/3eeh44/reflections_is_by_far_my_favorite_set_and_the/,,"So I wish there were more sets like reflections, insanely good looking.  NO variants, keeping demand concentrated.  And actually a super cool mechanic.

I might just be a little biased though since I finally got a yellow jango yesterday, promptly blew thru all of my 125k credits to wiff...  Spent 5 minutes grinding tapjoy to luck sack it on the very next pack :)  Cracked a second yellow jango with the count at 2.1k at like 1 am, and stayed up til 3 am for the big 50k weekly bonus and pulled it in 6 packs.  Safe to say I've spent my pack luck for the week :)",starwarstrader,Reflections is by far my favorite set and the mechanic is awesome,http://www.reddit.com/r/starwarstrader/comments/3eeh44/reflections_is_by_far_my_favorite_set_and_the/
26,2015-07-10 08:01:33+00:00,self.starwarstrader,https://www.reddit.com/r/starwarstrader/comments/3crylr/variant_love_or_not/,,"Two things I wish about variants:

1. I really wish variants were grouped together instead of scattered within a set in our collection.  Its just so much better visually to see them all clustered.  I totally understand why some players dump all the other variants just to keep their collection clean.

2. Related to this, I wish the rarest variant got super special treatment, similar to hearthstone golden level flair instead of just a different color (which isn't even always the coolest looking one!)

I know blizzard has a team of artists which maybe SWT doesn't yet have the resources for, but I am pretty sure if the master access variants looked WAYYY cooler instead of just being rarer, that would kick the demand and spending into overdrive which is good for everyone, and maybe even get us back to a happy place of just regular and foil variants for every card (my dream)

For non hearthstone players see: http://www.tentonhammer.com/image/view/256023",starwarstrader,Variant love... (or not),http://www.reddit.com/r/starwarstrader/comments/3crylr/variant_love_or_not/
27,2015-06-30 19:16:26+00:00,self.starwarstrader,https://www.reddit.com/r/starwarstrader/comments/3bnznh/featurerequest_notion_of_tradeable_count/,,"So I think the whole idea of locks is a bit backwards.  I think the feature everyone really wants now that our collections are ginormous and only growing over time is the opposite.  Here are all the cards I want to trade, and that should be the default view when you trade to start (Filter by tradeable)  This probably requires a bit of work on the backend for them, but this by far would make trading so much better.  As everyone can now easily distinguish between (no this is my set I'm collecting, and here feel free to offer on this complete set I'm trading).  You can always still do the 1:1 and ask for someone to make things tradeable, so think of this as making locks infinite (with a view of unlocked cards only)",starwarstrader,[FeatureRequest] Notion of Tradeable count replacing locks entirely,http://www.reddit.com/r/starwarstrader/comments/3bnznh/featurerequest_notion_of_tradeable_count/
28,2015-06-27 19:19:20+00:00,self.starwarstrader,https://www.reddit.com/r/starwarstrader/comments/3bbwzk/maybe_this_is_just_me_but/,,"Sketchbook makes me miss shadowboxes... its like half the variants (half the fun of opening), and 1000x uglier...",starwarstrader,Maybe this is just me but...,http://www.reddit.com/r/starwarstrader/comments/3bbwzk/maybe_this_is_just_me_but/
29,2015-06-26 10:09:55+00:00,self.starwarstrader,https://www.reddit.com/r/starwarstrader/comments/3b6ew6/yoda_have_you_seen_my_lightsaber/,,"So...I'm pretty sure the best possible award card for the golden lightsaber(10) set is an amethyst variant similar to my favorite shred card ever...

I think that card would be ridiculously sick looking...

And well...Samuel jackson...

http://www.quickmeme.com/meme/35rfxm",starwarstrader,"Yoda, have you seen my lightsaber?",http://www.reddit.com/r/starwarstrader/comments/3b6ew6/yoda_have_you_seen_my_lightsaber/
30,2015-06-23 03:18:22+00:00,self.starwarstrader,https://www.reddit.com/r/starwarstrader/comments/3asekh/bug_two_purple_lukes_with_the_same_image/,,"So I just noticed today that two of the Luke purples have identical pictures, I was trying to figure out why I had two in my collection and the grouping was all off after trading for the 157, I was like wtf I have one already?  Then noticed the 222 one had a different subtext and appears to just have the wrong text: Rebel Commander.  But talk about confusing :)",starwarstrader,[Bug] Two purple lukes with the same image?,http://www.reddit.com/r/starwarstrader/comments/3asekh/bug_two_purple_lukes_with_the_same_image/
31,2015-06-22 05:11:21+00:00,self.starwarstrader,https://www.reddit.com/r/starwarstrader/comments/3aoi1z/trade_value_of_gold_elegant_anakin_2_no_i_didnt/,,"well if you are curious what kind of heat you need to land one of the gold lightsabers.  #2 went for:

- 1x black nb maul
- 1x red nb maul, opress, nightbrothers
- 1x white nb maul, opress, nightbrothers, ventress

How do I know this?  Because I couldn't bring myself to trade my black maul so I let the other guy get it for this (which I think is a pretty good price assuming you can let go of a black maul with no regrets).

I made a slightly stronger offer with black maul, full red nb, and white nb, but I cancelled it and replaced it with han + obi + red nb which I thought was worth more...  But he really wanted black maul (I don't blame him I couldn't trade mine)...  So I dropped out

Argh, so close...but I couldn't do it :(",starwarstrader,Trade value of gold elegant anakin #2 (no i didn't get it),http://www.reddit.com/r/starwarstrader/comments/3aoi1z/trade_value_of_gold_elegant_anakin_2_no_i_didnt/
32,2015-06-20 08:29:29+00:00,self.starwarstrader,https://www.reddit.com/r/starwarstrader/comments/3ahsnk/do_you_think_there_will_be_a_card_award_for_the/,,"I know nothing has been mentioned in terms of an award card... but given how grueling its going to be collecting all of the 77s, what are everyone's thoughts on whether there will be an award card at the end of this?  I will likely collect them either way, but it will definitely be pretty disappointing if there's nothing at the end...",starwarstrader,Do you think there will be a card award for the death march (77s),http://www.reddit.com/r/starwarstrader/comments/3ahsnk/do_you_think_there_will_be_a_card_award_for_the/
33,2015-06-17 18:10:33+00:00,self.starwarstrader,https://www.reddit.com/r/starwarstrader/comments/3a6ulk/theory_why_the_reprints_maybe_were_a_good_thing/,,"So perhaps the red maul and blue GM were actually going to be awards like good ole gold porkins.  But when they saw the reaction, they decided to dump them into the set and give us a worthy reward :)

Now that I think about it, the Sith variant/3 way could have been the same thing",starwarstrader,[Theory] Why the reprints maybe were a good thing,http://www.reddit.com/r/starwarstrader/comments/3a6ulk/theory_why_the_reprints_maybe_were_a_good_thing/
