,created,domain,full_link,locked,selftext,subreddit,title,url
0,2016-11-21 20:47:22+00:00,self.TheSilphRoad,https://www.reddit.com/r/TheSilphRoad/comments/5e6fbc/speculation_cp_change_means_gen_2_is_near/,False,"Seems like this would be one of the critical things they would do before pushing out Gen 2, since the meta was going to change anyways from all the new mons.  I can't wait!",TheSilphRoad,Speculation: CP change means Gen 2 is near...,https://www.reddit.com/r/TheSilphRoad/comments/5e6fbc/speculation_cp_change_means_gen_2_is_near/
1,2016-11-19 17:45:02+00:00,self.MobiusFF,https://www.reddit.com/r/MobiusFF/comments/5dtjxj/mage_or_white_mage_next_dancer_8/,False,"I just finished Dancer as my first 8*.  My other jobs are Ranger, Mage, White Mage.  I read that White mage is the best support in MP, but dancer already is that role as well, should I focus on Mage next, or pull for a warrior job?",MobiusFF,Mage or White Mage next (Dancer 8*),https://www.reddit.com/r/MobiusFF/comments/5dtjxj/mage_or_white_mage_next_dancer_8/
2,2016-11-17 23:22:33+00:00,self.TheSilphRoad,https://www.reddit.com/r/TheSilphRoad/comments/5dj3ji/id_love_a_cp_range_pokemon_filter_to_make/,False,"Instead of a more complicated feature that let us save teams/recall last attack teams.  I think all I really want is a new filter that lets me pick a CP range (i.e. 1200-1600 when training up a 1600 gym), since the game remembers your last filter, this would eliminate most of the current nightmare that is picking 6 pokemon before every training fight...",TheSilphRoad,I'd love a CP Range pokemon filter to make training less painful,https://www.reddit.com/r/TheSilphRoad/comments/5dj3ji/id_love_a_cp_range_pokemon_filter_to_make/
3,2016-10-28 06:10:12+00:00,self.MobiusFF,https://www.reddit.com/r/MobiusFF/comments/59szrk/playing_for_about_a_week_lvl_22_what_should_i_be/,False,"So I've been playing about a week and am pretty hooked now.  I've read most of the guides which were written 2 mos back, so I have a general idea of what I'm working towards (card augment, clear all single player, save up to buy mobius box, etc).  

My primary question is what should I be focusing on next with my stamina (Chapter 3.1/Infinite arena/or the new tower/farming augments)?  And for MP should I focus on skills for my one pulled job (ranger?)

Current status:

- Cleared Chapters 1,2 + Explorations 1/2.  Working on Chapter 3.1.
- Infinite arena, I can do easy, and I've cleared the first treasure area, but the next sections are red and too hard

Jobs

- Pulled Ranger (Close to finishing panel 3), Starter jobs are about all about done with 3rd panel (not doing starter ranger anymore ofc)

Abilities:

- Amazon (Rolled)
- Bought: fenrir, hades, salamander, fafnir
- Have weak lvl 2 ability MP 3*s and chapter drops

Basically I just want to catch up as efficently as possible, so I want to avoid dumping stuff into abilities that will not be useful once I'm caught up.  But I've had to spread out and level warrior/mage to clear content so I haven't really been focusing on ranger to this point figuring its best to rush the content...?


",MobiusFF,"Playing for about a week (lvl 22), what should I be doing to catch up fastest?",https://www.reddit.com/r/MobiusFF/comments/59szrk/playing_for_about_a_week_lvl_22_what_should_i_be/
4,2016-10-05 20:50:22+00:00,self.TheSilphRoad,https://www.reddit.com/r/TheSilphRoad/comments/561q79/how_to_reward_grinding_make_this_more_rpg_like/,False,[removed],TheSilphRoad,How to reward grinding (Make this more RPG like),https://www.reddit.com/r/TheSilphRoad/comments/561q79/how_to_reward_grinding_make_this_more_rpg_like/
5,2016-09-02 17:30:20+00:00,self.TheSilphRoad,https://www.reddit.com/r/TheSilphRoad/comments/50uehg/time_to_save_100_eevee_for_gen_2/,False,"So I finally got my first perfect pokemon, I'm already lvl 30 and been collecting full gyms every day, so I don't really need to power up a new attacker/defender as I have an army of vaps/flares/jolts already.

I'm thinking I will just wait until the gen 2 eevee evolutions come along, and in general stop evolving good eevee's and save all 90+ IVs instead.
 
Thoughts?
",TheSilphRoad,Time to save 100% Eevee for gen 2?,https://www.reddit.com/r/TheSilphRoad/comments/50uehg/time_to_save_100_eevee_for_gen_2/
6,2015-12-10 10:24:35+00:00,self.starwarstrader,https://www.reddit.com/r/starwarstrader/comments/3w7giz/thoughts_on_simple_fun_features/,False,"So I think some of the blatant money grabbing would have gone over better if they simply added a few free fun features at the same time.

For example with all these low count variants, they could have at the same time introduced permanent den variants like an unlimited 1000 white/500blue/250red/100yellow shreds for a thick variant border(like the pink for golds).  And these might actually end up as pretty useful currency long term for trading too, as more of a premium hoarding unit.

These add value to base which would indirectly make opening packs more valuable, and also give people things to do other than hoarding (which is pretty boring if you ask me).

Maybe we can get something like this for the next base set...
",starwarstrader,Thoughts on simple FUN features...,https://www.reddit.com/r/starwarstrader/comments/3w7giz/thoughts_on_simple_fun_features/
7,2015-12-07 21:25:54+00:00,self.starwarstrader,https://www.reddit.com/r/starwarstrader/comments/3vubae/what_makes_a_good_set/,False,"So given that I think the sets are going downhill fast in terms of how they are designed. 

Most of the new sets were modeled after TK death marches it appears :/

Examples of death marches:

- 77 (66 days of daily drops)
- TK (44 days of near daily drops with random vacations)
- Space Paintings (Is this one finally done?)

Knowing how many inserts in a set, and whether an award is there is good and all.  But given that the last few sets have had (21, 15, 18, 20, 29) on daily release schedules...  I mean its great for stacking inserts if that's the goal...

It might be a good time to remind Topps what we like.

So if you look at the high demand popular sets, they almost always were short and compact.

- Reflections (6 cards + award)
- Del Rey (7 cards, for some reason no award)
- WoSW, Prism, Badges, Quotes 1 (8-10 cards)

So for me, after the subjective ""do I like the set question?""  The top 2 things I like in a set are:

1. Compact (6-9 cards + award) [And EVERY set should have an award, otherwise be like huddle and say its a ONE OFF no chase]

2. No more than 2-3 variants.  I personally liked the old locations: 5k-2k with 1:10-1:25 odds, 2k-500 with 1:30-1:50 odds, and the 500-10 count rare tier with 1:50-1:1000 odds

",starwarstrader,What makes a good set...,https://www.reddit.com/r/starwarstrader/comments/3vubae/what_makes_a_good_set/
8,2015-10-20 03:19:07+00:00,medium.com,https://www.reddit.com/r/starwarstrader/comments/3pfzi4/long_but_this_seems_to_be_the_direction_this_sub/,False,,starwarstrader,"Long, but this seems to be the direction this sub is going (why constant topps bashing is not constructive for dialogue)",https://medium.com/bad-words/why-twitter-s-dying-and-what-you-can-learn-from-it-9ed233e37974
9,2015-10-16 19:56:48+00:00,self.starwarstrader,https://www.reddit.com/r/starwarstrader/comments/3p14o2/a_different_approach_whats_your_favorite_thing/,False,"Seems like we are back sliding into the days of constant complaints again.  Don't get me wrong, the mistakes bug me too.  I just don't think constantly kicking Topps is going to result in anything useful in the longrun other than pissing them off.  (How would you feel if you constantly read this stuff from their perspective?)

My suggestion is that we give them positive reinforcement about the stuff we DO like and want more of.  I'm pretty sure they know what's a flaming disaster without us pointing it out over and over again...

So for me, the new stuff I like are:

1. Del Rey (Awesome looking cards, no variants low count)
2. Red schematic mechanic (shredding gold/yellows as the only way to get a card is a neat mechanic and is different and interesting)
3. Return of Pink/Green/Orange (I much prefer my variants to be consistent and in a set, unlike random SD variants which all look different and appear to be one offs)

[EDIT: Including my favorites from the comments below]

- Guaranteed insert sets / All inserts at once (ESB/Darklight side style, encourages trading)
- Short compact sets (weekend/week long, stays fresh that way)

(I promise I won't argue about your favorite things unless you say that collegiate is your favorite set because it has the best art in the game...)",starwarstrader,"A different approach, what's your FAVORITE thing (what do you wish they did MORE of)",https://www.reddit.com/r/starwarstrader/comments/3p14o2/a_different_approach_whats_your_favorite_thing/
10,2015-10-14 21:00:52+00:00,self.starwarstrader,https://www.reddit.com/r/starwarstrader/comments/3ortf0/terrible_precedentwtf_with_rebels/,False,"Now I usually don't get too involved in criticizing sales/gimmicks that Topps pulls.  But I think we need to make it clear that some stuff should not be messed around with or the whole point of collecting sets/awards breaks down.

Lets see what happened today with the Rebels set.

1. For a set that was supposed to be completed over the weekend, instead they decided to give away the entire stock of inserts BEFORE they gave the award.

2. And if that wasn't enough, what used to be a 400 count master access only variant, was handed out basically for free to everyone as well in the sales pack.  So what was going to be a nice low count sepia award, will now be...wait for it... a 750 count set because of a typo in the original post?  

So to sum up, if you played by the stated rules and chased the set during the weekend it was supposed to be completed.  You LOSE big time, because not only did they cheapen your set, awards, they also decided to give away all the inserts at way less than what you paid to open them.  

Uh...what?  This should never happen again.  These inserts should go into the AT-Junkbo pack like everything else.",starwarstrader,Terrible precedent...WTF with Rebels?,https://www.reddit.com/r/starwarstrader/comments/3ortf0/terrible_precedentwtf_with_rebels/
11,2015-09-30 09:06:04+00:00,self.starwarstrader,https://www.reddit.com/r/starwarstrader/comments/3my0uj/toppsjer_is_listening_you_can_do_what_you_want/,False,"While we might not necessarily always agree with everything he decides, he really does seem to listen and try to help when possible.  I think our collective anger at this ban wave is justified, but its clear that they are trying to target the emulators mostly.  I think the multiple account thing just fell out of that.  I got my [EDIT 1 account PER family member] back, and got some reassurance that we can have [EDIT 1 account PER family member] accounts total to do what we will with (aka vault/ feeder accounts, no need to worry about lopsided trades/cycling).


A lot of the mess here was created by the previous regime, we should cut him some slack while he tries to improve things.  We also have the opportunity for direct dialogue with Jer now, if we as a whole tried to be more constructive, its a great opportunity to get more awesome changes inspired by this sub like the hoarding chase.


Mostly my advice is for everyone is to be nice to him, constant bashing/negativity is just going to make him dread coming here, he's trying to build a community, so we should welcome him, not do our best to make him go away!  

[EDIT: removed my unnecessarily harsh comment about customer service]

[UPDATE: I can't update the title, but it looks like my title is misleading, the rough metric appears to be # accounts = # people in your family/household, and you are free to swap cards around within your circle in that situation]",starwarstrader,ToppsJer IS listening / You can do what you want with your MAX 3 accounts.,https://www.reddit.com/r/starwarstrader/comments/3my0uj/toppsjer_is_listening_you_can_do_what_you_want/
12,2015-09-29 21:04:39+00:00,self.starwarstrader,https://www.reddit.com/r/starwarstrader/comments/3mvs0m/constructive_advice_for_topps_about_the_multiple/,False,"So I think the easiest fix for this fiasco regarding multiple accounts is just to mimic what lots of other F2P games have with something equivalent to a monthly VIP package for like $5 (no extra credits included).  

I'm pretty sure a lot of us would welcome some nominal monthly fee per device like that just to not worry about this issue, and then you could use that to distinguish between emulator accounts and real.  Since lets be real here, the only thing bad about emulator accounts is they NEVER convert to real paying users.  

I can't fathom why Topps would not want us all to pay $5 per extra account.  Make it a $5 for 30 days of master access, and state clearly that if you buy this on your account, you can make however many 9 vintage hans for 1 whites you want between your accounts.  Seems like an easy win win to me.  When your automation flags these accounts for review, you see oh they bought this bundle on all of the accounts, so automatically leave them alone.",starwarstrader,Constructive advice for Topps about the multiple device/accounts,https://www.reddit.com/r/starwarstrader/comments/3mvs0m/constructive_advice_for_topps_about_the_multiple/
13,2015-09-29 03:21:11+00:00,self.starwarstrader,https://www.reddit.com/r/starwarstrader/comments/3msejr/just_when_you_thought_it_was_okay_to_use_vaults/,False,"So I thought everything was all groovy with the recent posts on here saying that as long as you aren't emulating and you have one account per device, and you aren't doing anything that seems wrong.  You are fine.  WRONG.

Today I got a 3 day suspension for 'cycling' cards between my accounts???  Where cycling consists of moving a ton of the recently completed sets from my main account to my vault?  And moving some marathons back to my main account.

I can't even begin to understand how stupid this policy is.  So I can have one account per device, but I'm not allowed to move cards between them?  Looks like they have some automated system which flags your trades if you do too many lopsided trades which falls into the 'system alerts them bucket'.",starwarstrader,Just when you thought it was okay to use vaults...,https://www.reddit.com/r/starwarstrader/comments/3msejr/just_when_you_thought_it_was_okay_to_use_vaults/
14,2015-09-23 23:36:51+00:00,self.starwarstrader,https://www.reddit.com/r/starwarstrader/comments/3m4s4p/improvementsfeedback_on_shipsschematics/,False,"Perhaps I'm in the minority, but I'm not going anywhere near building ships.  I will certainly flipping resources, and trading for finished ships.  But this just isn't a very appealing mechanic right now.

Here's the tweaks I would love to see to make this more appealing.

First, rather than 4 variants of the same thing with ridiculously scaling costs, can we not have it be different cards that take different amounts resources?  Space 1: cheap, Tie fighter: somewhat more, Xwing: even more: Falcon: a lot... Star Destroyer (this can cost a ton of resources).  

But...really a pink Slave one requires 1 million credits resources in 24 hours...for a 100+ count card?  I honestly feel bad for the people who built these.  

Which leads to issue #2 Time windows are fine, but time windows with bad pack structure is death.  Pinks in master, blues in blue pack.  Greys in resource.  Different times to build each, and the pink schematic becomes pure trash after a short 24 hour window???  

Easy fix is to do it like the gold 2 chase:  If you build it in 24 hours you get a PINK, 48 hours you get a GREEN, 1 week you get a GREY, after that a WHITE.  Release the entire set of schematics up front, and then everyone can be happy.

So TL:DR:  Make the variants based on time to build from release.  Make each THING cost different amounts.  Worthless schematics suck (and please make it easier to pull schematics in one central place, the master pack perhaps?)
 ",starwarstrader,Improvements/Feedback on Ships/Schematics,https://www.reddit.com/r/starwarstrader/comments/3m4s4p/improvementsfeedback_on_shipsschematics/
15,2015-09-16 20:45:47+00:00,self.starwarstrader,https://www.reddit.com/r/starwarstrader/comments/3l7v4k/reflections_has_been_dethroned/,False,"I have a new favorite set, and its Illustrated!

- Its a gorgeous unique looking set

- Its accessible with a guaranteed insert per pack, 175k to collect all the steel with easy 1:1 swaps.

- Its not too bad with variants (steel/green/blue/red) with green and red being special and using different mechanics not just pull packs (yawn)

- There's built in entropy with the sliding window of shred making people WANT to trade.  Unlike darkside/light side which was pretty dull since the value of those was basically strictly declining, here different sets of cards will change value over time, giving opportunity for profits.

- So its popular and got something for everyone: casual (steel) / traders (green/blue) / and high end (red).  I love it!",starwarstrader,Reflections has been dethroned,https://www.reddit.com/r/starwarstrader/comments/3l7v4k/reflections_has_been_dethroned/
16,2015-09-12 19:09:07+00:00,self.starwarstrader,https://www.reddit.com/r/starwarstrader/comments/3kp10d/topps_support_wait_for_me_was4_days/,False,"So I got my main account back on my phone, took 4 days, not too bad.  No mention of issues about multiple accounts to me at least...

Of course I was only able to last about 3 days, before I went and got a new ipad yesterday :)  ",starwarstrader,Topps support wait for me was(~4 days),https://www.reddit.com/r/starwarstrader/comments/3kp10d/topps_support_wait_for_me_was4_days/
17,2015-09-12 00:35:52+00:00,self.starwarstrader,https://www.reddit.com/r/starwarstrader/comments/3km202/there_are_free_swt_pack_code_inserts_in_the/,False,"Target finally had some so I picked up a bunch of the boxed 16 card packs for $5.  Only opened one so far, for pretty nice mix, a yoda sticker, a bunch of 77 looking cardboard cards, a finn insert, a chewy foil, AND a free SWT pack code insert!",starwarstrader,There are free SWT pack code inserts in the Journey physical packs,https://www.reddit.com/r/starwarstrader/comments/3km202/there_are_free_swt_pack_code_inserts_in_the/
18,2015-09-10 00:35:35+00:00,self.starwarstrader,https://www.reddit.com/r/starwarstrader/comments/3kbpma/what_was_your_ticket_response_times/,False,"For people who got locked out of their device after upgrade (wrong login method) and filed support tickets, how long was the ETA til unlock?  Yep I'm that guy too, forgot I used facebook after finally upgrading, and logged in with my bunt id...FAIL....ARGH 0 card account.  Ticket has been open for almost a day, just wondering how long I have to wait...

",starwarstrader,What was your ticket response times?,https://www.reddit.com/r/starwarstrader/comments/3kbpma/what_was_your_ticket_response_times/
19,2015-09-05 18:35:55+00:00,self.starwarstrader,https://www.reddit.com/r/starwarstrader/comments/3jrrz9/kudos_to_topps/,False,"I think its safe to say that Topps deserves some credit.  The Smugglers Den feature is AWESOME.  And the design of the premiere set mechanics I think is a good indication of how they are combating the dead set effect.


Now there's an option of an uber elite bonus award possible where you shred your set into the ultra rare tier.  I don't think this is always a good thing, but now there's at least an option for an explicit conversion of the entire ""dead set"" into a hot award that holds all the value.  (Hardcore friendly).


Regular set collection still is valuable and can be 'easier'.  As hardcore players will just get both, with their elite tier award, and the regular one.  Dead sets are still dead, but the active value is now more fully captured in the elite award.  I love it (and my 2 copies of the kylo award)",starwarstrader,Kudos to Topps,https://www.reddit.com/r/starwarstrader/comments/3jrrz9/kudos_to_topps/
20,2015-08-20 01:51:01+00:00,self.starwarstrader,https://www.reddit.com/r/starwarstrader/comments/3hny53/suggestion_next_lightsaber_set_ideas/,,"Perhaps I am in the minority, but I actually think Topps does a pretty good job taking constructive criticism/feedback.

Given that lightsabers are pretty iconic, and well the outcome of the elegant weapons set was pretty mixed given the completion rates.

I think a few things went wrong:

1. Suboptimal structure (2 different regular packs and a 25k uber expensive 1:4000 master only?)  4 variants and demand was pretty much dead on arrival of the set.

2. Lack of variety and differentiation in card art (combined with way too long of a set).  Hopefully the length of the set was related to the fact that the golds were not getting pulled fast enough, otherwise I have to question why we had 2-3 copies of the same lightsaber with a button moved around).  

My suggestions for the next saber set:

If you want an elite set AND make it popular, this is what I would love, combining low variants and overall card count that makes sets valuable (reflection/prisms).

Set length of 5-10

- Common Variant: 2500 count - black/white version, BIG HILT with BLADE, think mechanical saber but even more zoomed in on the hilt.

- Rare Variant: 25 count - COLOR version, so you have red/green/blue/purple, these would have made me want to keep my goldens if they were more interesting and unique

- 5k SINGLE saber pack 1:50 b/w odds (still high like before, but these will be worth more) (1:5000 color odds) so both will sell out roughly the same time.  I don't think its actually all that important to put a high odd set like this behind master access since anyone who's going for the 5000 packs almost certainly is buying master pack access... this would just make the rare variant actually get pulled, but not a big difference either way
",starwarstrader,[Suggestion] Next lightsaber set ideas,http://www.reddit.com/r/starwarstrader/comments/3hny53/suggestion_next_lightsaber_set_ideas/
21,2015-08-04 19:18:07+00:00,self.starwarstrader,https://www.reddit.com/r/starwarstrader/comments/3fs6p8/what_would_you_have_preferred_for_the/,,"So I think the most important cards to get 'right' and have wow factor are the first card of the wave, and the award.  I like the Wk 11's in general, but the awards were definitely more like wk 22 wow factor (as in negative wow) :(  

Vintage: Boba + Han [Perfect, this was well thought out, I only wish they saved Falcon for Wk 21 maybe]

Widevision: Funeral Pyre + Vader Butt [This would have been fine if Vader Butt was Wk 11 and the award was funeral pyre... We'd all be like WOW BEST AWARD ever. instead...MEGA DUD].  Runner up: Power of the Jedi could have been a sweet award too

TC: Tano + Vos [I think Tano should have been the reward, the award NEEDS to be better than the other cards in the set to validate the worth of the chase IMO]

Bounty: Zuckuss + Eval?  This set is entirely random to me, I don't know who anyone is, so I wish the award was someone I knew :)

Connection: Leia/Han + ?? [The format of these cards is fixed and their hands are tied, There hasn't been a yoda connection yet, so if its not the wave 3 award, maybe we get it for our wave 2 award)

GM: Heir + ?? [I really hope its better than Super Star wars!]

I think that its ok if the set drags on...But I'd much rather extra time be taken to get the award right than to give us a mediocre reward.  It really cheapens the chase if the payoff is not satisfying...  My heuristic would be the BEST card is the award, with the second best card being first in set.

What do you wish they had done instead? Just using the existing cards they chose but reordered for maximal impact...

",starwarstrader,What would you have preferred for the Wk11/Award/Wk21 marathons,http://www.reddit.com/r/starwarstrader/comments/3fs6p8/what_would_you_have_preferred_for_the/
22,2015-08-03 02:37:05+00:00,self.starwarstrader,https://www.reddit.com/r/starwarstrader/comments/3fkpcb/brainstorm_for_77_award_ideas/,,"Rather than hope/pray for a 77 award... Why don't we be proactive and suggest ideas for 77 awards while there might be time for us to inspire(or is it beg? lol)

I personally think something like the purple award for golds would be SICK.  Like gold or special variants of the 66 cards for anyone that got them all.  Its flashy unique, and worthy of the long haul...  It certainly feels harder than the gold chase... Should be pretty cheap/easy to design, and I know I'd never trade my variant set :)



",starwarstrader,Brainstorm for 77 award ideas,http://www.reddit.com/r/starwarstrader/comments/3fkpcb/brainstorm_for_77_award_ideas/
23,2015-07-27 05:05:35+00:00,self.starwarstrader,https://www.reddit.com/r/starwarstrader/comments/3eqljr/how_to_do_win_win_gold_swaps_with_only_dupes_they/,,"So hopefully this isn't news to most people, but I've had to explain this in trades several times to people with several thousand trades this week while fleshing out gold sets...

Common situation: He has at least one dupe you don't need, but you have at least 2 dupes he needs.

Win Win Offer:  You take one of his dupes, and singles you need, and offer him all the dupes he needs + singles he needs for the counts to match up.  He gains +1 need, and you gain needs equal to the dupes - 1 you trade, EVERYONE WINS

There's basically no reason ever to not accept this assuming all involved golds are equal rarity, and the only goal is to complete your set as fast as possible.  





",starwarstrader,How to do win win gold swaps with only dupes they need (without the +1 crap),http://www.reddit.com/r/starwarstrader/comments/3eqljr/how_to_do_win_win_gold_swaps_with_only_dupes_they/
