,body,created,id,nest_level,parent_id,reply_delay,subreddit
565,"&gt; I would say that its just as sexist and ""bullshit"" to have gender disappointment over not having a girl because you wanted to dress her up in pink and bows as it is to have gender disappointment over not having a boy because you wanted him to carry on your last name.

No, it's not the same thing. Forgive me for going fully feministic-ballistic on you - I know a lot of people have an aversion to that, and sadly, some of those people are women themselves, - but the truth is that passing on the name is a symbol of legal, economic, social, and political privilege of men in a traditional society: with the name a son inherits whatever else his father is giving him - money, land, slaves... the estate. Daughters were not even worth the investment of education - because they were not supposed to carry the family name and inherit the family's fortune the way sons were. So passing on the name remains a symbol of that preferential treatment of male heirs. It is no accident that women changed their family name to that of the husband's (and still many do, obviously): this indicates who the woman belonged to - first, to her father, then to her husband. She did not have any economic power, and therefore had to ""belong"" to a man. So while wanting to dress up your daughter in pink is culturally sexist, it is markedly different from wanting/continuing to exercise an *institutionalized* kind of sexism, one that promotes (or at least used to promote) economic (and with it - social, legal, political, and ultimately cultural) inequality between women and men. Symbols are powerful things. Not only do they indicate ""how things are"", they also reinforce the idea of ""how things should be"", which in many cases means maintaining the status quo (i.e., no change). If you think about how even now the default option is for a child to carry the father's name, and how because of that *women do not even develop the expectation of passing on their name*, OP's ""grief"" over his ""lost name"" seems a little presumptuous. It's like, dude, women don't even get to think about that, so you know, maybe you should get over losing this entitlement. 

&gt;I also think its a little presumptuous to assume that it's all egotistical and due to unwarranted self important that a man wants his son to carry on his last name? 

It's egotistical, I think, because - and you may not like to hear this either - because ultimately, no matter how you look at it, no matter how you spin this, but ultimately **no one in the world gives a shit whether your name lives or dies. No one.** Just you (or OP, in this case) and maybe your son/s, if you raise them in that same tradition. Ask yourself, why should the world care? Who do you think you are that you think that this is somehow an important issue to anybody else? Some last names have already died out, so what? The people who had those names are long gone, and that's it. Think of your own last name: say, one of your ancestor whose last name you inherited lived in 18th or whatever number'th century. Does it matter to you? Does it matter to them that you live and have their last name? Obviously, I'm talking in absurd terms here, but that's why hopefully it should be clear that this whole obsession (or a milder version of it) with ""passing on my last name"" is absurd. It just doesn't make sense. And it's egotistical/self-celebratory because it's based on an assumption that the world will lose something valuable if your last name dies out, which is a laughable idea, really. What's that? You don't care about the world? You only care about how you feel about it? Q.E.D.",2015-09-22 01:49:40+00:00,cv9qbbs,5.0,t1_cv9jbrn,11760.0,predaddit
566,"OK, here's what I think to be clearer.

I'm not saying people shouldn't have gender disappointment. There are different reasons for wanting a certain gender for your baby. Some parents envision playing sports with their sons, or doing braids for their daughters, or what have you, and then they experience gender disappointment and need to adjust their expectations, and I have no problem with that. But wanting a son because of your name, to pass your name down, as one of the commentators noted on here, is patriarchal bullshit. To me this ""reason"" is all about the man's ego and unwarranted sense of self importance. And it is something that women do not experience really, just because the society at one point decided that it's men's names that will be passed down, not women's.

I think my comments can be helpful for OP to perhaps see why his disappointment is unwarranted and possibly help him overcome it (OK, I could have used this word instead of ""ridiculous"", but really it doesn't change my point).",2015-09-21 21:40:44+00:00,cv9hegr,5.0,t1_cv9gv6z,852.0,predaddit
567,"There are different reasons for wanting a certain gender for your baby. Some parents envision playing sports with their sons, or doing braids for their daughters, or what have you, and then they experience gender disappointment and need to adjust their expectations, and I have no problem with that. But wanting a son because of your name, to pass your name down, as one of the commentators noted on here, is patriarchal bullshit. To me this ""reason"" is all about the man's ego and self importance. And it is something that women do not experience really, just because the society at one point decided that it's men's names that will be passed down, not women's.",2015-09-21 21:31:16+00:00,cv9h1p6,3.0,t1_cv9fv9y,1855.0,predaddit
568,"Well, just like OP is allowed to have those feelings, I'm allowed to have mine, and express them to him, no? Or are we only supposed to be supportive and understanding in this sub?",2015-09-21 20:30:47+00:00,cv9ep7v,3.0,t1_cv9ekeh,201.0,predaddit
569,"Honestly, as a woman I find these concerns ridiculous. Women basically live knowing that their name under normal circumstances will not be passed down. I think this is the main reason why women are less likely to have what is known as gender disappointment, it seems (I don't have a study to cite here, just general perception and experience). Wanting to pass a name down is all about a man's ego, and not much else, really. As a woman I just wanna say, get over yourself. There's gonna be a new, absolutely helpless human in this world who will need all your care and support. And you're disappointed that you won't be able to pass your name down. Honestly, how ridiculous is that. ",2015-09-21 20:21:59+00:00,cv9ecnh,1.0,t3_3lu1dc,7667.0,predaddit
570,"Boom, another uncrafty response.",2015-09-21 20:09:18+00:00,cv9dug8,4.0,t1_cv9cwuu,1406.0,tennis
571,"I'd say your chances of getting a work visa are extremely low. You first need to have a job offer, and the company hiring you would need to be willing to sponsor your visa (that's a couple of grand at least), and the company would need to make a compelling case that you possess a set of skills that are hard to find among the US citizens/permanent residents. 

There's also illegal working but I don't know how to go about that.

Edit: I should have said ""skills that are in high demand in the US"" rather than ""skills that are hard to find"". These two concepts overlap but are not exactly the same. 
",2015-09-21 16:38:14+00:00,cv95ijl,1.0,t3_3lt5gy,7227.0,newjersey
572,Horse meat. ,2015-09-20 14:41:03+00:00,cv7wc1i,1.0,t3_3lnuyo,15457.0,AskReddit
573,"You can't. According to this source, it costs between $1200 to $2700. http://www.laboratoryequipment.com/news/2014/02/prenatal-blood-test-non-invasive-accurate 

I don't know where that guy got the $50 price from. ",2015-09-18 20:49:06+00:00,cv6a2y2,6.0,t1_cv69eaa,1101.0,predaddit
574,"Sorry, it's me again. I researched this again, and according to this source -  http://www.laboratoryequipment.com/news/2014/02/prenatal-blood-test-non-invasive-accurate - the cell-free DNA costs between $1200 and $2700. So, whatever price you found in a brochure must be with insurance. It's impossible for this test to cost under $100. 
",2015-09-18 20:47:34+00:00,cv6a0xo,7.0,t1_cv60end,14932.0,predaddit
575,What state are you in? If you don't mind sharing that.,2015-09-18 17:19:27+00:00,cv620il,7.0,t1_cv60end,2445.0,predaddit
576,"Where does it cost $50??? Last time I researched this, I couldn't find a price, and one of the labs said ""we have financing options available"". You'd think this is only needed for hella expensive procedures. Plus, my cousin lives in Switzerland, and there the free cell DNA test is around $1,000 (not covered by insurance yet, as too new). So where did you see the 50 dollars for this test???",2015-09-18 14:55:44+00:00,cv5wd0u,5.0,t1_cv5m9zo,30195.0,predaddit
577,"""Possibly"". Not possibly. This is a valid point.",2015-09-18 14:49:42+00:00,cv5w4y4,5.0,t1_cv5vy8h,304.0,tennis
578,"Why Ostrava? You mean Prague? Or Bratislava for Slovakia? Why the hell Ostrava all of a sudden, ha-ha?",2015-09-18 14:44:33+00:00,cv5vy52,3.0,t1_cv5vgfz,815.0,tennis
579,"I fear your Occam's razor is too quick. You don't have to be on that list of records to be disliked for coming from a communist country, or do you? This then becomes a very narrowly constructed argument: if you're on the list of all time greats, where you come from is important, otherwise no. 

Then saying that Djokovic liked Safin because he could beat Federer and calling it ""reverse racism"" isn't holding up at all. There could have been hundreds of other reasons for why Djokovic liked the fact that Safin could topple Federer, besides ""reverse racism"".",2015-09-18 14:41:32+00:00,cv5vu5f,3.0,t1_cv5vb8m,875.0,tennis
580,And then there was Li Na... Extremely popular.,2015-09-18 14:34:32+00:00,cv5vl3a,3.0,t1_cv5uwhn,1168.0,tennis
581,What about Li Na? Is she a hot chick? She was very popular.,2015-09-18 14:34:00+00:00,cv5vkd0,3.0,t1_cv5v27c,858.0,tennis
582,"Oh, and then there was Safin of course. Immensely popular player. ",2015-09-18 14:16:07+00:00,cv5uxrr,1.0,t3_3lfju0,1964.0,tennis
583,"I think this argument night have some merit, but the counterargument to this of course would be that lots of female players from former communist countries are hella popular. ",2015-09-18 14:13:33+00:00,cv5uuo3,1.0,t3_3lfju0,1810.0,tennis
584,"Yes, that's true. It occurred to me 10 minutes ago. I wanted to post an edit, but you beat me to it, lol.",2015-09-18 11:20:34+00:00,cv5qg9m,5.0,t1_cv5qc43,384.0,tennis
585,"Yes, that's true. It occurred to me 10 minutes ago. I wanted to post an edit, but you beat me to it, lol.",2015-09-18 11:20:13+00:00,cv5qg2h,5.0,t1_cv5qc43,363.0,tennis
586,Murica,2015-09-18 11:05:48+00:00,cv5q6y5,7.0,t1_cv5l91n,19694.0,AskReddit
587,"When you say fatherless kids, do you mean kids who were born to single mothers, or do you also include kids whose fathers, say, left, or died when they were 12?",2015-09-18 10:47:25+00:00,cv5pwcb,2.0,t1_cv4pisn,72398.0,predaddit
588,Yeah but you don't get a Nobel Peace prize when you start a war either.,2015-09-18 05:25:51+00:00,cv5l0h9,8.0,t1_cv4t5x1,47441.0,news
589,"If he holds every service game to love with 4 aces, no tiebreak, it wouldn't be 24 aces per set. You don't win six service games without going into a tiebreak. If he wins a set 6-0, then this is three service games, if he wins it 6-4, then it's five service games. 20 aces per set is the maximum.",2015-09-18 04:29:58+00:00,cv5jq3r,3.0,t1_cv5a8xt,17121.0,tennis
590,"He's also played more matches than most of those guys. Hence, more aces.",2015-09-18 04:20:35+00:00,cv5jhf9,2.0,t1_cv4ui83,41487.0,tennis
591,"I don't know what part of this ""kept the fans involved"". Do you mean the fans were like, watching him play and counting the aces? Ain't nobody's got time for that. Like, seriously, who would do that. ",2015-09-18 04:19:08+00:00,cv5jg30,2.0,t1_cv4s6x6,44942.0,tennis
592,"Excuse me, what was the context like? I think the context was all about whether Djovokic's injury was real or not. So that's the context, and this quote wasn't taken out of it. ",2015-09-17 21:12:21+00:00,cv550w4,2.0,t1_cv4u1t2,16479.0,tennis
593,"Hiii, this piece is written so well, kudos to you. I do not necessarily agree with all the points you made, but you made all of them well. Congrats!! Also, I laughed at ""this is where a Federer fan throws a chair at me"", and I loved the word ""trivalry""!! And also - I completely forgot that the next year is the Olympics year, and oh god, how I hope Novak wins the gold medal there, and the possibility of a golden grand slam for him - I can't wait to see what happens!!! Thank you, I enjoyed reading this. Good job!!",2015-09-17 20:58:25+00:00,cv54i2z,1.0,t3_3lb6nu,20798.0,tennis
594,Thanks!! Great answers!! Did you need to shave the pubic hair? Is that the expectation? I'd imagine that shaving it with a big belly is hard... Unless you go to a salon... But maybe that's not ok either. I don't know - what's the norm here? Thanks!!,2015-09-17 17:37:41+00:00,cv4wg46,14.0,t1_cv4az3d,52117.0,AdviceAnimals
595,How long did you walk for? Half an hour or more?,2015-09-17 03:03:13+00:00,cv4asi2,5.0,t1_cv4apds,152.0,AdviceAnimals
596,"Shit man... Speaking of shit, lol. Did you poop? How did that work? Who cleans it? Does the baby have some on them, maybe? Always wanted to know the but was too embarrassed to ask.",2015-09-17 03:01:08+00:00,cv4apxv,12.0,t1_cv4ajuf,306.0,AdviceAnimals
597,What did you do at the gym at that point? Genuinely curious.,2015-09-17 02:51:25+00:00,cv4aeb7,3.0,t1_cv47zbp,4215.0,AdviceAnimals
598,Second trimester here too. What's the pain like? Did you scream from pain?,2015-09-17 02:50:03+00:00,cv4acmx,10.0,t1_cv4a4f1,409.0,AdviceAnimals
599,"Is her belly real? It'd seem too big for a baby that's due in March, no? ",2015-09-17 02:19:44+00:00,cv49bq0,1.0,t3_3l7pf4,22284.0,videos
600,"Yeah, I was going through this AMA, and I started wondering if this was some kind of a cult. Everyone loves it, and it's about ""new kind of leadership"" with ""mindfulness"" thrown in for good measure. Kool-aid, anyone?",2015-09-17 01:26:36+00:00,cv47h9m,2.0,t1_cv3tt2e,21816.0,IAmA
601,"""I love your accent!""

""Wanna fuck?""",2015-09-16 18:54:38+00:00,cv3smim,3.0,t1_cv3ghcx,18633.0,AskReddit
602,"7-1 still. Take it from someone from Kazakhstan. The Borat movie came out in 2006. Nine years. So, you can't really complain to me. So yeah, again: 7-1. ",2015-09-15 21:39:50+00:00,cv2th4m,1.0,t3_3l3dgo,222.0,AskReddit
603,"Actually, maybe not so much anymore, since it's pretty clear to everyone and himself that Novak is just a superior player now. But when he was still no 1, he just couldn't take Novak's success, for example. Just refused to acknowledge that Novak was a quality player. One example comes to mind - when they played a US Open semi-final, and Novak played lights out shots on Federer's match points (the ones that Novak later described as ""I just closed my eyes and went for it""), Federer was asked about those matchpoints, and Federer said something to the tune of ""Are you kidding me? Any junior can hit those shots"". And that he just for the longest time couldn't come to grips that Djokovic was actually a real champion. He was okay with Rafa challenging him, but couldn't accept Novak as another worthy challenger. ~~But he ate shit in the end~~

Or when he was losing the 2009 US Open final to Del Potro, and had an argument with an umpire (which he rarely does), and he acted like an entitled little brat, saying stuff like ""Don't tell me what to do, okay?"" And you could just tell that he was mightily annoyed that someone dared to challenge him in the match, and he was losing control of the match, and the US Open title was slipping away. He just could not believe it was happening, it seemed.

Or, the Aussie Open final 2009, when he lost to Nadal, and let those famous waterfalls out. That's when I realized that he wasn't such a humble guy actually, because instead of giving the spotlight to the worthy winner, he grabbed all that spotlight with his floods of tears. LIke, he was completely comfortable standing on the stage in front of a mike, and fucking crying to the whole world. Hey, give the stage to the winner! Noooo, I wanna cry and make everybody (including the winner) sorry that I lost ~~and because someone took my toy away~~. Like he made it all about himself, when he should have been Nadal's shadow in the trophy ceremony.

And of course, there's also this article: http://sports.yahoo.com/blogs/tennis-busted-racquet/roger-evaluating-federer-cocky-comments-154457703.html 

But as I said, maybe he's changed. I don't follow his interviews anymore (because I can't stand him), but at least he had a lot of praise for Novak in his speech. Yeah, I guess he has had to accept this new reality that he's no longer the God of tennis. ",2015-09-15 17:11:28+00:00,cv2ims1,9.0,t1_cv1th43,57918.0,tennis
604,So what? This doesn't negate the point he made about New Yorkers at the match.,2015-09-15 04:06:39+00:00,cv202gt,3.0,t1_cv1ytei,2336.0,tennis
605,"Maybe that actually means that the field is pretty strong, eh?",2015-09-15 01:00:19+00:00,cv1t9j2,5.0,t1_cv1fvfm,21570.0,tennis
606,His falsely humble persona I was talking about has nothing to do with his being emotional or not. There's just no logical connection between the two concepts. No wonder I was having trouble understanding you.,2015-09-15 00:49:08+00:00,cv1suo1,7.0,t1_cv1sqsi,174.0,tennis
607,What are you trying to say even? ,2015-09-15 00:23:14+00:00,cv1rw2u,5.0,t1_cv1q77t,2894.0,tennis
608,Lol,2015-09-14 20:00:27+00:00,cv1i8jw,7.0,t1_cv1h4lo,1671.0,tennis
609,These are some of the many many many examples: http://sports.yahoo.com/blogs/tennis-busted-racquet/roger-evaluating-federer-cocky-comments-154457703.html ,2015-09-14 17:56:10+00:00,cv1dc6y,5.0,t1_cv12sp0,18167.0,tennis
610,"Yeah, that's what my Spanish husband basically said when we were watching the match on TV. I was getting completely pissed off by the lack of support for Djokovic, and he said: ""What do you expect from these people? They're just townies (lol). All they know about tennis is Federer. It's like people from small towns in Spain root for Real Madrid or Barcelona, because that's all that's visible to them"". 

I loved that he called New Yorkers townies. They completely deserved this title yesterday. :))",2015-09-14 17:54:38+00:00,cv1da3o,1.0,t3_3kwzyh,10687.0,tennis
611,Completely agreed. His falsely humble persona makes me throw up a little whenever it shows up. ,2015-09-14 10:06:27+00:00,cv0zuxr,3.0,t1_cv0wdi4,14368.0,tennis
612,"Federer is the first abuser of this. See last Cincinnati. Cincinnati, Karl.",2015-09-14 10:01:53+00:00,cv0zsr9,2.0,t1_cv0ue0x,19540.0,tennis
613,Graf-Hingis at rolly g. ,2015-09-14 04:08:28+00:00,cv0tnha,3.0,t1_cv0s0go,3162.0,tennis
614,"1/11 on Novak's second serves. Second serves, Karl.",2015-09-14 03:59:41+00:00,cv0tejy,2.0,t1_cv0qw5u,4686.0,tennis
615,wut,2015-09-13 20:50:12+00:00,cv0esb6,3.0,t1_cv0ehxl,423.0,tennis
616,"Haha, that too. And all those people wearing absolutely tasteless Ralph Laurens with those huge polo horses on them. Argh.",2015-09-12 23:21:20+00:00,cuzh0s1,3.0,t1_cuzgzfd,73.0,tennis
617,"Does anyone else think that of all the grand slam trophy ceremonies, US Open's is a bit of a circus? All these flags everywhere, and... yeah, it's the flags. ",2015-09-12 21:38:30+00:00,cuzdpr7,1.0,t3_3kpgcg,2409.0,tennis
618,"Well, she was down 2-5. She knew it was slipping away for a while. So, it wasn't a big shock that she lost. It would have been much more bitter if the set/match was close.",2015-09-12 21:36:51+00:00,cuzdnv4,2.0,t1_cuzcf4s,2252.0,tennis
619,"Yes, she's been nothing short of amazing in her attitude and humanity. Love her.",2015-09-12 21:35:23+00:00,cuzdm4z,2.0,t1_cuzckri,1881.0,tennis
620,"I thought she was gonna say ""I never believed, and I want everyone to believe"" or some bullshit like that. I was already cringing on the inside, but thank god it wasn't that. Hahaha. #SillyMe",2015-09-12 21:34:37+00:00,cuzdl8q,4.0,t1_cuzday2,521.0,tennis
621,"Yeah, he did. Apparently he landed at 1 pm today (along with the Italian prime-minister) and rushed to the Open. Wasn't late, so that's good. ",2015-09-12 21:33:22+00:00,cuzdjs3,2.0,t1_cuzcino,1866.0,tennis
622,No question on gender? ,2015-09-12 03:48:58+00:00,cuyonwb,1.0,t3_3kjbac,54148.0,tennis
623,"Italians are coming out of the woods. Well, ciao, I guess. And forza or whatever. ",2015-09-12 03:28:12+00:00,cuyo4w7,2.0,t1_cuya9xu,26705.0,tennis
624,"As always. Remember his username, he likes showing up with the stupidest opinions and judgements.",2015-09-12 03:22:49+00:00,cuynzug,6.0,t1_cuyh15y,14600.0,tennis
625,So... are you saying they were forced then?,2015-09-11 21:24:19+00:00,cuyd9oc,4.0,t1_cuycplh,935.0,tennis
626,"Yeah, you know, most of the match, I was thinking ""what is she trying to achieve with that slice?!?!"" But somehow, it worked. Serena's 40 UFs also factored in, I suppose.",2015-09-11 19:26:15+00:00,cuy8x7o,2.0,t1_cuy885f,1288.0,tennis
627,But you didn't let it pass.,2015-09-11 19:23:26+00:00,cuy8txs,4.0,t1_cuy8ks9,566.0,tennis
628,"Come on, she wasn't ""phenomenal"". She just ""put the ball in and ran"" (c). Serena didn't show up.

EDIT: The win is phenomenal, of course. Serena lost a completely winnable match, we all know that. I'm happy for Vinci. ",2015-09-11 19:22:41+00:00,cuy8t2f,2.0,t1_cuy815z,1376.0,tennis
629,Time to engage New Jersey. ,2015-09-11 19:10:58+00:00,cuy8gml,3.0,t1_cuy805a,716.0,tennis
630,"Yeah, it's like she serves well and so much drama. Come on girl, we know you can serve. It's not like you did something out of the ordinary. ",2015-09-11 18:37:03+00:00,cuy74q7,2.0,t1_cuy5q6i,2141.0,tennis
631,I think that's the least of her concerns.,2015-09-11 17:23:19+00:00,cuy48g5,2.0,t1_cuy3af3,1458.0,tennis
632,And that's coming from an English person... ,2015-09-11 15:05:03+00:00,cuxysoc,2.0,t1_cuxw0xd,4757.0,AskReddit
633,"Kazakhstan: the greatest country in the world. The stereotype about potassium is not true though, hehe.",2015-09-11 15:02:49+00:00,cuxypmb,1.0,t3_3kix5x,17334.0,AskReddit
634,Can confirm. Source: I'm Kazakh.,2015-09-11 15:01:40+00:00,cuxyo5f,3.0,t1_cuxy89h,711.0,AskReddit
635,"Hi again, you should read this. http://www.nytimes.com/2010/11/14/books/review/Greif-t.html 

It makes the whole ""why are tastes important"" question clearer. Let me know if you have any comments. ",2015-09-10 22:16:54+00:00,cux97o9,1.0,t3_3kc22c,73298.0,offmychest
636,"Hi there, I'm 13 weeks pregnant (so obviously, I'm a premom, rather than predad, lol). We also conceived right away, and even though it was planned, it was also kind of unplanned, because we didn't expect it after the first month of trying. 

So it was also both exciting and terrifying for me. And whenever I gave in to the worries, my husband always had the most reassuring words, even though I'm sure he's been equally terrified. He'd just say with so much conviction ""don't worry, everything will be fine"", that it immediately had a calming effect on me. Made me feel very secure and at peace with everything.  ",2015-09-10 21:59:17+00:00,cux8lgc,1.0,t3_3kg11n,8853.0,predaddit
637,Did you tell him about this subreddit!?!?! :) I hope he comes to hang out with us at some point.,2015-09-10 21:22:31+00:00,cux7987,1.0,t3_3kfwp2,8121.0,betterCallSaul
638,"OMG, I'm dead here. Oh, how I miss that show!!!",2015-09-10 21:21:52+00:00,cux78dg,3.0,t1_cux4xto,3564.0,betterCallSaul
639,"Maybe transfer to an in-state college? It'll be way cheaper, and most likely some of your classes will count. That would also mean that you can start your academic career anew (i.e., your GPA will be set to zero). If you start the process now, you can be at a new school next semester.",2015-09-10 19:44:16+00:00,cux3fxq,1.0,t3_3kf4eg,11809.0,offmychest
640,No. And fuck off.,2015-09-10 17:48:09+00:00,cuwyvuc,7.0,t1_cuwyu6q,73.0,thelastpsychiatrist
641,You should read the exchange below. I don't know what the OP is doing anymore.,2015-09-10 17:43:23+00:00,cuwyp5a,6.0,t1_cuwumkx,6320.0,thelastpsychiatrist
642,"""What has happened since the May post?"" 

""Nobody knows that""  

""I understand that, but what happened to the BLOG?""

I don't know anymore what you're trying to get at. LOL. You are either extremely dumb, or you think that the ""BLOG"" is something different from his... blog. Anyway, nobody knows. That's the answer, ok?",2015-09-10 17:41:07+00:00,cuwylx7,5.0,t1_cuwycqz,387.0,thelastpsychiatrist
643,I don't know why you're getting downvoted. Are people just uncomfortable with this idea?,2015-09-10 10:43:01+00:00,cuwm1k1,3.0,t1_cuwc2lb,30461.0,pics
644,I'm on the phone so I can't reply at length. But I want to leave this comment to get back to it tomorrow.,2015-09-10 02:49:16+00:00,cuwd6pi,1.0,t3_3kc22c,3240.0,offmychest
645,I don't know what can be sadder than this. I want to thank you for letting us know how you feel. Thank you for making us pause and contemplate... I feel so much compassion for you that I can only describe it as love. ,2015-09-10 00:48:34+00:00,cuw94g6,1.0,t3_3k852r,49755.0,offmychest
646,Read the sixth paragraph of the story again.,2015-09-10 00:09:32+00:00,cuw7t08,3.0,t1_cuw6q8i,1957.0,offmychest
647,Russian refugees? Why? From what war? ,2015-09-09 22:43:17+00:00,cuw4ved,1.0,t3_3jhazm,555582.0,offmychest
648,For many more years to come - sure.,2015-09-09 21:52:37+00:00,cuw3122,4.0,t1_cuw2atz,1178.0,tennis
649,"It's good for the TV and the ratings, and all that. Meaning, no interruptions of broadcasting is good for everyone.",2015-09-09 21:09:07+00:00,cuw1em4,2.0,t1_cuvznae,2651.0,tennis
650,"It gets very, very slippery with just a few raindrops on the court. Not worth the risk of falling over and getting injured.",2015-09-09 21:05:20+00:00,cuw19di,2.0,t1_cuvzh9o,2669.0,tennis
651,Right?!!?!!,2015-09-09 19:29:43+00:00,cuvxfat,3.0,t1_cuvxd7g,86.0,tennis
