,body,created,id,nest_level,parent_id,reply_delay,subreddit
478,"Lol yeah, I should correct it. ",2015-12-11 22:46:09+00:00,cxvv8mi,3.0,t1_cxvsawz,4773.0,SandersForPresident
479,SABR will become rampant. Tennis will become the game of SABR. ,2015-12-11 17:40:11+00:00,cxvizyh,1.0,t3_3we8yu,3179.0,tennis
480,"One of my FB friends shared this video on her page yesterday, and what do you know - all these people came out of the woodwork to ""like"" the video, and/or to profess their love for Bernie (including myself). It was so exciting to see. I had no idea that there were so many Bernie supporters among my FB friends. We even had a discussion in the comments about how we all hope that he makes it, and I managed to plug in the DFA poll. I think I brought a couple of Bernie votes in the DFA. :) So yeah, from my limited experience, this round of FB shares may actually amount to something substantial. ",2015-12-11 16:31:33+00:00,cxvg846,1.0,t3_3wcz2w,21164.0,SandersForPresident
481,"Ya, one of the top comments for the video was ""The more I listen to Bernie, the more I'm inclined to give him my vote"". I'm like yeah, girl, I know that feeling. That feeling is the BERN. :)",2015-12-11 16:27:20+00:00,cxvg23o,2.0,t1_cxv7gpu,20860.0,SandersForPresident
482,"Yes, and one of the top comments under that video was from a deaf person, who said ""Thank you for thinking about us!! We're all rooting for you!"" I almost fucking cried. No really, I almost did. :)",2015-12-11 16:24:00+00:00,cxvfxe5,2.0,t1_cxvfmf5,470.0,SandersForPresident
483,"I really enjoyed this. It's like two colleagues talking about their work, and they both know that the other one ""gets"" it. Made for a much better interview. ",2015-12-11 16:17:08+00:00,cxvfnr7,1.0,t3_3w96js,79458.0,tennis
484,"&gt;I hesitate to blatantly admit drug use online

Proceeds to blatantly admit drug use online. I guess it's good to know that you hesitated? :) (Don't mean to be a dick, just laughing). ",2015-12-11 15:41:58+00:00,cxvebwj,2.0,t1_cxv60t0,24324.0,AdviceAnimals
485,"What could 10 an hour, down from 1 a minute, mean? ",2015-12-11 04:16:59+00:00,cxuznj9,2.0,t1_cxusm9h,11602.0,BabyBumps
486,"I like this. I like the theme of the poster - the moment when the player is serving, which is not new for a RG poster but what's new is the angle: the artist chose to focus on the player's legs only, thus bringing the beauty of the legs positioning during the serve to the forefront. You can only see the rest of the player in the shadow. If you look at the RG posters through the years, you'll see that each one of them focuses on one aspect of the game, so this latest one is in line with the whole collection, yet it has its own subject, never covered before. ",2015-12-10 16:36:11+00:00,cxu7zlt,1.0,t3_3w7lep,19204.0,tennis
487,"No, it's definitely a woman. Look at the length of the skirt/shorts. Men's is longer.",2015-12-10 16:25:49+00:00,cxu7juk,2.0,t1_cxu7aik,378.0,tennis
488,It's just common knowledge in tennis. ,2015-12-10 11:23:20+00:00,cxtz8by,4.0,t1_cxtvjuo,14314.0,tennis
489,"Also, please don't forget to vote in this poll: https://www.reddit.com/r/SandersForPresident/comments/3vt7n4/call_to_action_this_poll_matters_more_than_the/",2015-12-10 03:30:35+00:00,cxtoyez,8.0,t1_cxtldah,5973.0,SandersForPresident
490,"Don't people, at least on this sub, know this about azarenka? Every time someone complains about this on here, I'm like yeah buddy, what did you expect. ",2015-12-10 01:37:52+00:00,cxtkw0a,2.0,t1_cxt1tqv,27479.0,tennis
491,So sorry for your loss. You need to sue the shit out of that hospital. So sorry.,2015-12-09 02:56:53+00:00,cxsdsgv,1.0,t3_3w08do,8711.0,BabyBumps
492,"Thanks!! And I already voted for Bernie in DFA (convenient that they don't ask about citizenship - which we could probably highlight in the other threads, or even other subreddits... like what countries would benefit from Bernie? Palestine comes to mind now... maybe others too).",2015-12-09 01:14:12+00:00,cxs9vm0,3.0,t1_cxs8pg8,1834.0,SandersForPresident
493,"How big of a deal is this? Could someone ELI5 to a non-American, please? Thanks a lot. ",2015-12-09 00:12:32+00:00,cxs7iyr,1.0,t3_3vxv5b,30574.0,SandersForPresident
494,OMG are you me? ,2015-12-08 21:26:56+00:00,cxs0nkh,4.0,t1_cxryglj,2805.0,BabyBumps
495,They're so fun. I almost fell asleep watching this. ,2015-11-26 22:52:56+00:00,cxe5c7v,1.0,t3_3udzwy,7845.0,tennis
496,So where are you now? How many miles away from NYC is that?,2015-11-25 18:41:21+00:00,cxcuo8u,1.0,t3_3u84nc,11475.0,casualiama
497,"Thanks for doing this, whoever did this. Nice gallery to go thru. I didn't realize how many doubles players there are, and how little most of their names tell me. It's like who are these people??",2015-11-25 18:37:34+00:00,cxcuisc,1.0,t3_3u7fx1,24154.0,tennis
498,"Chill man, it was a joke. I just remembered you from the thread, and saw a little funny connection between the two comments. ",2015-11-20 21:15:19+00:00,cx7bm0s,6.0,t1_cx7behf,342.0,tennis
499,"Oh, we don't know what happens behind the doors. But it is a sticky situation from the look of it.",2015-11-20 21:12:34+00:00,cx7bid4,5.0,t1_cx7b9l9,393.0,tennis
500,"Sure. But it's probably hard for the women to see each other. If you're Ilhan - Donna is someone who your husband left you for; if you're Donna - Ilhan is that ex who's still very much present in your boyfriend's life. Perhaps, neither of them cares, that's a possibility, sure. But it's hard for me to imagine that, especially given the recency of the drama that occurred. ",2015-11-20 20:53:03+00:00,cx7arw3,3.0,t1_cx7ad04,649.0,tennis
501,"Yeah. I mean they don't appear to be sitting next to each other, but yeah, they're both there. Ilham is with the daughter, so she's probably there ""with the kid"". The other day though Wawrinka's daughter was there with Wawr's parents, and Ilham was absent, which was kind of more understandable? ",2015-11-20 20:34:50+00:00,cx7a2kb,3.0,t1_cx79vx7,285.0,tennis
502,"Oh yeah, you're that Swiss guy [who's better at English than native speakers](https://www.reddit.com/r/tennis/comments/3sx4vw/unlikely_things_for_andy_murray_to_think/cx16vx0?context=3). Lol",2015-11-20 20:30:35+00:00,cx79wm0,4.0,t1_cx79q5b,281.0,tennis
503,"Also, it just occurred to me that the age difference between these two women is 20 years or so. Shall we say, he has range?",2015-11-20 20:24:54+00:00,cx79oqr,2.0,t1_cx79lct,146.0,tennis
504,Wawrinka doesn't seem to shy away from drama. Both Ilham and Donna Vekic are in the audience. The balls on this guy. ,2015-11-20 20:22:28+00:00,cx79lct,1.0,t3_3tlf11,7518.0,tennis
505,Denial is hell of a drug. ,2015-11-20 20:20:44+00:00,cx79ivp,1.0,t3_3tkeqp,23180.0,tennis
506,"Well, he called Serena Williams a man on his twitter once. Then the tweet got deleted. ",2015-11-20 09:23:29+00:00,cx6qn6t,3.0,t1_cx5spi2,62404.0,tennis
507,"But he did. He said ""sorry to tell you this mate"". /s",2015-11-20 09:21:00+00:00,cx6qlzh,8.0,t1_cx604kg,51214.0,tennis
508,"I don't know why I was hoping that the point would be won by Kei. I've spent some time on this subreddit, I should know better. ",2015-11-20 01:35:49+00:00,cx6ezfo,1.0,t3_3tgf6y,29546.0,tennis
509,"Well, your dl serves as a form of ID, not citizenship. If a foreign guy shows up at a voting station, guess what? He's not allowed to vote. ",2015-11-17 19:43:02+00:00,cx3ms4e,5.0,t1_cx3djfl,13144.0,newjersey
510,Not for foreign nationals.,2015-11-17 19:40:41+00:00,cx3mohg,4.0,t1_cx3eiaw,11560.0,newjersey
511,"More of a case of the woman being a brat, in my opinion.",2015-11-17 15:33:17+00:00,cx3cd4q,2.0,t1_cx3bga5,1527.0,gifs
512,A drivers license does not equal citizenship. ,2015-11-17 15:28:18+00:00,cx3c6c2,2.0,t1_cx3av14,2291.0,newjersey
513,"Ha-ha yeah, this guy is clueless on so many levels.",2015-11-17 15:25:38+00:00,cx3c2vc,7.0,t1_cx3bnin,718.0,newjersey
514,Vote? Only citizens can vote. You do realize that a driving license does not equal citizenship?,2015-11-17 15:23:28+00:00,cx3c017,3.0,t1_cx38r7k,6371.0,newjersey
515,"Yes yes yes yes for Rachmaninov's piano concerto no. 2, specifically. I know it by heart (I mean in my mind). It's magnificent.",2015-11-17 06:42:27+00:00,cx31tu2,3.0,t1_cx310dx,2189.0,AskReddit
516,How do you know he's autistic? ,2015-11-16 18:57:43+00:00,cx2ccac,4.0,t1_cx29l6a,4076.0,funny
517,This was fun to read. What country was the foreign guy from? ,2015-11-16 18:48:41+00:00,cx2byxu,6.0,t1_cx29s5v,3245.0,funny
518,"Or, ""Nobody likes you. Everybody hates you"". Oh wait.",2015-11-16 08:19:21+00:00,cx1w6dh,2.0,t1_cx1kdc8,24846.0,tennis
519,"Donna Tart's ""The Secret History"". I'm thinking a movie with a nostalgic feel, like "" the virgin suicides"".",2015-11-16 05:15:10+00:00,cx1sa5e,1.0,t3_3sz06x,9591.0,AskReddit
520,"What makes you think that I, or anyone else in this thread, are Americans? ",2015-11-16 03:54:06+00:00,cx1pp4h,3.0,t1_cx1jg9w,10511.0,tennis
521,1K minimum. At that price it'll be a shitty one too. ,2015-11-15 23:37:33+00:00,cx1gbjq,5.0,t1_cx1c07y,6805.0,newjersey
522,"What did the guy say before ""I'm gonna break his legs""? ",2015-11-15 19:37:38+00:00,cx16vx0,1.0,t3_3sx4vw,4754.0,tennis
523,"Can confirm all of this info. Currently live in HP, no car, walk/bike everywhere I need, including groceries. Apartments are expensive, that's true too. Post Office is also close by, which is nice. Doctors, dentists, hairdressers, eateries, all within a walking distance. New Brunswick train station/Rutgers main campus is 30 min of walking away. ",2015-11-15 19:29:37+00:00,cx16ks2,3.0,t1_cx10yct,9493.0,newjersey
524,Where's the plot twist?,2015-11-15 07:32:55+00:00,cx0r80f,2.0,t1_cx0kt9v,14599.0,AskReddit
525,I agree. Maybe not creepy but definitely weird. A bit inappropriate/classless maybe? I know that my husband and I wouldn't have appreciated that. ,2015-11-14 07:33:07+00:00,cwzrfwm,2.0,t1_cwzbf46,36825.0,BabyBumps
526,"How did France support, and how would you like to repay, specifically? ",2015-11-14 06:00:02+00:00,cwzppji,2.0,t1_cwzjc3q,14445.0,worldnews
527,"Omg omg, you are me. There's a lady down the hall at my work who eats in her office, and the clickety clackety noise of her utensils against the plate just kills me.",2015-11-13 18:07:49+00:00,cwz40oi,3.0,t1_cwyxzbw,9419.0,AskReddit
528,"Try being tired. Things kind of get drive automatically too, without much thinking. ",2015-11-11 05:24:14+00:00,cww8kgq,3.0,t1_cww83li,1052.0,AskReddit
529,What did you get as a prize?)),2015-11-11 00:37:20+00:00,cwvyuca,3.0,t1_cwvwlb7,3781.0,tennis
530,"22,666 views for me at 5:49 am EST. ",2015-11-06 10:49:37+00:00,cwqiv1c,3.0,t1_cwqas5w,24094.0,gifs
531,"That's a big if, though. Huge even. So huge in fact that it is an existential question that philosophers debate about. Especially compared to death penalty where the state definitely takes real, fully formed human lives away.",2015-11-06 09:55:04+00:00,cwqi4ps,11.0,t1_cwq6i5m,27614.0,worldnews
532,"""I don't know anyone who'd do it so you must be gay"". What kind of logic is that? Just because you personally don't know any guys that would do it, doesn't mean those guys don't exist. ",2015-10-31 17:36:44+00:00,cwjm9to,2.0,t1_cwjif38,6852.0,offmychest
533,"$3. It'd better be good though, lol",2015-10-29 16:01:43+00:00,cwh9goe,1.0,t3_3qlhh1,76362.0,thelastpsychiatrist
534,"This is beautifully written. Thank you for sharing. Your post reminded me of the Russian figure skater - yekaterina gordeeva - who lost her skating partner and husband (Sergei) before they turned 30. She wrote a book about him and their love called ""My Sergei"", and later in interviews she said that she needed to talk and write about him, that it was part of her grieving process. You may want to write more about your husband - I'm sure people would be interested. Also, you may want to read this book about Sergei, maybe you'll find it helpful. I'm sorry about your loss, and I don't know you, and where you are, but this morning you and your husband, you guys touched my soul. Sending hugs and love your way.",2015-10-26 18:27:27+00:00,cwdmsn0,1.0,t3_3q8z1u,43182.0,offmychest
535,But you're cornered already. ,2015-10-20 07:00:26+00:00,cw65e03,8.0,t1_cw62m8b,7854.0,AskReddit
536,"Awwww. She's like, Mommy, I can see you!!! ))",2015-10-18 17:01:06+00:00,cw444mk,1.0,t3_3p7ufo,19244.0,BabyBumps
537,More about this match: http://www.chinadaily.com.cn/english/doc/2005-08/30/content_473476.htm,2015-10-16 05:40:41+00:00,cw1kq9q,1.0,t3_3oxhae,17758.0,tennis
538,"No, the dress there was different. ",2015-10-16 05:18:18+00:00,cw1k9a3,2.0,t1_cw1co7p,14269.0,tennis
539,"Hey well done!! Congrats!!! You are an inspiration, truly, and I'm proud of you! Celebrating with you in spirit!!!",2015-10-16 03:46:25+00:00,cw1hu4d,1.0,t3_3owpp2,23264.0,offmychest
540,"Since you have height there, add ""weight: Nalbandian"". :)",2015-10-13 20:12:35+00:00,cvyjj6w,2.0,t1_cvyd3by,8923.0,tennis
541,Movement Djokovic???!?!? WHAT. ,2015-10-13 20:11:31+00:00,cvyjhgs,2.0,t1_cvyike8,1272.0,tennis
542,"Here's the pasta reference. It's about Vinci, not Pennetta actually. http://www.si.com/tennis/2015/09/11/us-open-womens-semifinals-vinci-upsets-serena

I also couldn't find anything about Borat for some reason. I do remember those references were there, not once or twice, but several times. 

As for ""worth reading"", I personally haven't found anything of interest in his columns in a long time. This sub is way more interesting.",2015-10-13 16:52:23+00:00,cvyawfy,5.0,t1_cvy86l0,4004.0,tennis
543,"I'm familiar with the research on mental health that has been organized in the past century, thank you very much. I've never though seen this kind of behavior mentioned as a symptom of depression or any other mental disorder. If you are so well-acquainted with the research on mental health in the past century (judging by how patronizing and know-it-all you sound), please point me to a source that mentions this. I'd be most grateful for your expertise on the topic.  ",2015-10-13 15:23:41+00:00,cvy7blc,6.0,t1_cvy70yl,456.0,AskReddit
544,"You look fine!!! Delete that ""friend"" from your FB and your life. ",2015-10-13 14:31:14+00:00,cvy5e16,1.0,t3_3oj385,46076.0,BabyBumps
545,"&gt;Executive Editor and Senior Writer

So? It doesn't matter who you are, you still can post a lousy column. 

As for cultural insensitivity: he's the one who wrote ""Tomorrow in the final Pennetta will play for a bowl of pasta"", which is like, come on. How effing old and tired is this to write about Italians in terms of Italian food? Whenever there's talk about Kazakh players, he's like ""BORAAAAT"". That's just such a low kind of humor, and there's been numerous other examples of this, I just can't remember them all right now. Just pay attention, you'll see them again. He said on two separate occasions that the capital of Qatar was Dubai. That's the Executive Editor and Senior Writer we're talking about, with a Yale degree at that. I actually pointed this out to him, and he wrote back ""I'm thoroughly embarrassed, I don't know how I made this mistake"". Well, probably because you never knew, and never bothered to check. And these are not some random locales - both Dubai and Qatar host major tennis tournaments, and as a Senior freaking tennis Writer you're supposed to know your tennis geography.

Oh, and all those typos in his columns. There hasn't been a single column without some gaping typos. Not a big deal, sure, but very unprofessional. Especially for the Executive Editor and Senior Writer, lol.

And the column is just not interesting. Same old, same old cliches and ""stories"". There are better tennis writers out there, that's for sure. ",2015-10-13 13:33:52+00:00,cvy3j9s,3.0,t1_cvxvyzn,26676.0,tennis
546,"Remember the underwear commercial Rafa did recently? Tommy Hilfiger or something. Very raunchy. Anyways, this tennis ""columnist"" at Sports Illustrated, whom I hate passionately, is of the opinion that the fact that Rafa is doing such a low-brow advertising campaign is a sign of soon-ish retirement for him. Because apparently he's trying to cash in on his name before he becomes irrelevant. 

But it's not why I hate the columnist. Maybe he has a point here. I hate the columnist because he's repetitive, unfunny, kiss-assy, culturally insensitive, and just ultimately stupid. Jon Wertheim is his name. Remember this name, and don't read his column, kids. ))

Edit: all these downvotes for expressing my opinion about a writer? Interesting. ",2015-10-13 04:21:55+00:00,cvxtfv7,1.0,t3_3oird6,14942.0,tennis
547,"Really?? Is there more info about this? I have a family member who's like that, but she doesn't seem depressed. Can you tell me more?",2015-10-13 03:37:34+00:00,cvxs1n7,4.0,t1_cvxep2m,21225.0,AskReddit
548,"I... I had no idea this was a thing. I'm a woman, had never heard of/experienced the cervix being hit by a dick. Wut. ",2015-10-13 03:32:25+00:00,cvxrv0f,2.0,t1_cvx05r1,42251.0,AskReddit
549,What parts did we miss? Lol,2015-10-10 23:48:39+00:00,cvva01a,2.0,t1_cvv0w79,16871.0,tennis
550,Please explain why. I'd love to hear your opinion. ,2015-10-09 03:01:03+00:00,cvtax7r,3.0,t1_cvtakli,589.0,AskReddit
551,Why the hell did she do that?? ,2015-10-07 14:56:08+00:00,cvrbabd,1.0,t3_3ntyiq,9641.0,newjersey
552,"Wow. So, according to you Stalin is innocent. I wonder if this is kind of akin to denying the Holocaust? ",2015-10-04 04:46:58+00:00,cvnhvr1,4.0,t1_cvnh9nh,1481.0,todayilearned
553,"Ok, I get that doing laundry at home is more convenient than at a public laundromat. If you're going home, sure, take your laundry with you. But why drive for a couple of hours for that reason specifically?????",2015-10-03 21:41:31+00:00,cvn56px,2.0,t1_cvn4rmx,794.0,NoStupidQuestions
554,When/how do they learn to do laundry then? At point does this happen? Is it hard to learn to do laundry? I still don't quite get it. ,2015-10-03 21:40:17+00:00,cvn55d3,2.0,t1_cvn4otf,866.0,NoStupidQuestions
555,"Sorry - stupid question, perhaps. Why did you take your laundry to your parents house from Indiana to Ohio? Couldn't you do that somewhere in Indiana? ",2015-10-03 21:14:24+00:00,cvn4bcm,2.0,t1_cvmrp49,22244.0,AskReddit
556,"Did you read the whole article? Because it also states the following: 

""Although the hidden curriculum conveys a great deal of knowledge to its students, the inequality promoted through its disparities among classes and social statuses often invokes a negative connotation. For example, Pierre Bourdieu asserts that education-related capital must be accessible to promote academic achievement. The effectiveness of schools becomes limited when these forms of capital are unequally distributed.[7] Since the hidden curriculum is considered to be a form of education-related capital, it promotes this ineffectiveness of schools as a result of its unequal distribution. As a means of social control, the hidden curriculum promotes the acceptance of a social destiny without promoting rational and reflective consideration.[8] According to Elizabeth Vallance, the functions of hidden curriculum include “the inculcation of values, political socialization, training in obedience and docility, the perpetuation of traditional class structure-functions that may be characterized generally as social control.”[9] Hidden curriculum can also be associated with the reinforcement of social inequality, as evidenced by the development of different relationships to capital based on the types of work and work-related activities assigned to students varying by social class.[10]""

Obviously, Wikipedia is not the only source out there. It's really hard not to be rude and condescending in a situation where there's an abundance of information available on the web, yet a person wants someone to explain it all to them. ",2015-10-01 01:28:29+00:00,cvk0sm1,3.0,t1_cvk0e0o,698.0,sociology
557,"If you google ""hidden curriculum"", the top result will be the Wikipedia article on ""hidden curriculum"". I just read it, and it explains the answer to your question pretty well. 

Next time you have a question about a concept, try googling it first. Useful skill to have. ",2015-10-01 00:44:25+00:00,cvjz8ou,1.0,t3_3n1ang,3111.0,sociology
558,"But what do you mean by ""practicality of sociological concepts""? Why arguing that all concepts are socially constructed is not practical? 

Also, re. your point of scientific facts - not only do scientific facts change, but these facts exist as a result of scientific inquiry, and how science is done is also agreed upon by the scientific community (which again - socially constructed). My point is that just by claiming that X is a scientific fact does not mean that X is not socially constructed. 

I guess what you're trying to say is that gravity exists ontologically (i.e., in reality). Sure. But the concept of it, be it a scientific fact even, exists because this is how we defined it (agreed upon). Our current understanding of gravity may be limited or not completely full, so it may not accurately reflect the ontology of gravity. Which again, points to the fact that gravity is a socially constructed concept.  ",2015-09-29 21:51:19+00:00,cvilgtj,9.0,t1_cvijwfv,2366.0,sociology
559,"The concept of gravity, along with all other concepts, *are* socially (not sociologically, as you put it) constructed. ",2015-09-29 20:58:11+00:00,cvijbxj,7.0,t1_cvhzjon,31104.0,sociology
560,What point are you making?,2015-09-25 07:12:34+00:00,cvdiz3w,3.0,t1_cvdivh1,390.0,Showerthoughts
561,"I never said that. Jesus, OP. Those were just examples of why people may want one gender over the other. 

To the audience: I'm getting out of here. OP has a reading comprehension problem or something. Meaning: turns out OP is not very bright, and it's not worth pursuing this discussion further.",2015-09-22 03:18:39+00:00,cv9ti32,5.0,t1_cv9taq1,354.0,predaddit
562,"Honestly, OP, you look pretty stupid yourself: you either did not understand my argument, or have poor reading skills, or both. That, coupled with your belief that one can learn gender from a fetus's heartbeat, kind of draws a certain picture of you. I won't bother you anymore on this thread. Good luck.",2015-09-22 03:11:52+00:00,cv9t9mr,7.0,t1_cv9syqt,530.0,predaddit
563,"No, that's not what I imply. You should have read until the end.",2015-09-22 03:05:24+00:00,cv9t1la,7.0,t1_cv9syqt,142.0,predaddit
564,"Sometimes people swimming in an ocean of self-pity need a kick in the butt, rather than support and understanding. Perhaps you're right, that this is a sub for ""predads"" who are seeking just that - support and understanding. But for the life of me I also don't see why an adult person can't take some criticism of their position. Maybe it will enable them to examine and change their views, and OP will be able to overcome his disappointment. Which is the ultimate goal here, no?
",2015-09-22 02:51:55+00:00,cv9skry,7.0,t1_cv9r0aq,2606.0,predaddit
