,body,created,id,nest_level,parent_id,reply_delay,subreddit
0,"I hate him. Absolutely hate him from your description. He does not deserve you. I wish I were your big bear brother and could beat the shit out of him, and then give you a big bear hug, and take you and your son away from him. I hope you find that strength in you soon, because you don't have that brother, so you have to do what's right on your own, friend. You're on your own, sure, but you absolutely cannot be treated like that. You have rights. Human rights. You have to fight for them, friend. You have to. You have to. You have to. I hate him so much.",2016-11-21 03:51:23+00:00,da936m0,1.0,t3_5dyrqk,40676.0,breakingmom
1,Ohh I need to see that show. Any idea what it was called?,2016-11-21 03:39:12+00:00,da92oka,3.0,t1_da8wt88,8214.0,AskReddit
2,But how can there be any evidence of nothingness? I mean it's nothingness. It's like saying what's the evidence of absence? ,2016-11-19 04:32:38+00:00,da6mj4u,2.0,t1_da64v0o,28485.0,AskReddit
3,"Her tweets would be all over the internet. Or maybe she's finally ran out of the pics of ""her babies"" when they were little. Lol.",2016-11-18 18:43:36+00:00,da5zfp3,2.0,t1_da5yxgz,629.0,tennis
4,"It is, but some people use it as a negative somehow.",2016-11-17 18:00:51+00:00,da4h71f,3.0,t1_da4cmto,5512.0,newjersey
5,"""The armpit of America, hahaha"". Usually said by people living in shitholes of America.",2016-11-17 14:27:15+00:00,da4795c,1.0,t3_5dexbc,18257.0,newjersey
6,"I went to IU for grad school, and how live in NJ too. Hoo hoo hoo... Just kidding.",2016-11-17 14:14:46+00:00,da46s3z,2.0,t1_da43z1j,5404.0,newjersey
7,"Unmotivated and stressed. Welcome to the Reddit club, Novak.",2016-11-17 13:55:24+00:00,da463d4,1.0,t3_5dfjyr,4742.0,tennis
8,Does anyone know who this guy is??,2016-11-16 03:37:24+00:00,da2acxa,1.0,t3_5d53j6,23122.0,funny
9,My thoughts exactly,2016-11-16 03:35:50+00:00,da2aala,2.0,t1_da28t3a,2088.0,funny
10,Aww that hair!!!)),2016-11-13 02:37:35+00:00,d9xy82o,1.0,t3_5cmwxk,14120.0,breastfeeding
11,"So he's an exact opposite of Donald Trump, who went from a political joke to a powerful Republican. ",2016-11-13 02:36:30+00:00,d9xy6gx,1.0,t3_5cm4ef,24002.0,newjersey
12,He looks in this photo like... what's his name... Josh Hartnett.,2016-11-12 22:35:00+00:00,d9xon4n,2.0,t1_d9wvwu8,61063.0,tennis
13,"Get your free pump from your insurance (thanks, Obama. No really, thank you). It takes a while to order and deliver it. You may or may not end up using it, but it's good to have it as an option.",2016-11-08 17:01:40+00:00,d9ra48r,1.0,t3_5bsjku,22453.0,beyondthebump
14,Did she marry Matt Damon?,2016-11-03 16:16:48+00:00,d9k4mn4,1.0,t3_5axd33,2773.0,olympics
15,Couldn't pay probably. ,2016-11-03 02:36:38+00:00,d9jdjz6,3.0,t1_d9j0xay,15984.0,AskReddit
16,"Likewise though, just because it's impossible to know, doesn't mean there's something.",2016-11-01 04:26:19+00:00,d9gfq8z,6.0,t1_d9g97yp,10196.0,AskReddit
17,Omg. I can't. She's the best!!!,2016-11-01 03:46:55+00:00,d9geg8f,2.0,t1_d9fna2i,35666.0,breakingmom
18,No it wasn't. Read again when it happened.,2016-10-31 15:52:24+00:00,d9fgpeg,7.0,t1_d9fefwk,2533.0,AskReddit
19,I love this graphic! It's one of those things that's so simple yet beautiful that I wish I had thought of that!!! Lol,2016-10-31 02:17:05+00:00,d9et7op,1.0,t3_5a6y3s,33655.0,tennis
20,That's an awesome idea. I'll be doing that too.,2016-10-27 20:59:56+00:00,d9aisk4,5.0,t1_d9agujs,2456.0,Showerthoughts
21,Each current active player needs to get the biggest number of slams to be goat. Thread closed. Lol.,2016-10-27 04:01:56+00:00,d99jzk1,1.0,t3_59lxfv,1947.0,tennis
22,"I like everyone's outfit! Even the judge's, lol. Beautiful family, congrats, and thank you!!",2016-10-27 03:42:17+00:00,d99ja85,1.0,t3_59k4j0,23339.0,pics
23,"Your hubs is really funny. I wish mine texted descriptive stories like this to me! Instead I get ""she's OK""... (1 hour later) ""going to bed now"". And I'm like ""WHO, who, who is going to bed now? You or her?????"" ",2016-10-26 23:17:27+00:00,d99891x,1.0,t3_59hukb,31228.0,beyondthebump
24,"I bought a used bike for $50. Used it for two years, sold it for $60. Go me, right?",2016-10-26 04:02:26+00:00,d982no4,1.0,t3_59c0el,41266.0,AdviceAnimals
25,"The best thing about Deliciano is his looks, and uh, what's this, lol.",2016-10-26 03:49:52+00:00,d9827c2,1.0,t3_59dwg6,20522.0,tennis
26,Haha that's funny. Do you mind saying your field of study? ,2016-10-26 01:20:49+00:00,d97vyck,2.0,t1_d97uvhn,1438.0,AskAcademia
27,"Yes, my husband's face lit up like someone turned a bulb on inside his head, when he heard the heartbeat, lol. His reaction made me more emotional than the heartbeat itself, lol. ",2016-10-24 23:15:09+00:00,d96ajx8,2.0,t1_d962f57,10575.0,beyondthebump
28,Too long didn't read. Ain't nobody got time for that.,2016-10-21 21:44:28+00:00,d92c2q9,8.0,t1_d9290fx,4317.0,tennis
29,What is this Swiss language? Lol,2016-10-21 18:59:57+00:00,d924puo,7.0,t1_d921di2,4143.0,tennis
30,"Roger's mom is South African, so he spoke English as his native language growing up. ",2016-10-21 18:59:29+00:00,d924p1g,6.0,t1_d920xze,4644.0,tennis
31,Omg. I can't. ((,2016-10-21 17:02:57+00:00,d91z1nr,2.0,t1_d91i4iw,33379.0,AskReddit
32,I love this,2016-10-21 06:02:32+00:00,d91fy1f,1.0,t3_58lc14,7192.0,gifs
33,"Oh, oh, I got two:

""If you need to rely on your friends' charity to keep your ""business"" running, that's not a business"". 

""If you need your friends' charity to bring income to your family, why don't you use an actual charity instead"".

Boom. Cue evil laughter here.
",2016-10-21 04:58:12+00:00,d91e97u,1.0,t3_58kcs2,16834.0,breakingmom
34,"That's awesome. Send a thank you note to all who made it possible in our behalf!! Maybe write about this to your local media outlet? Hell, write to a national publication. That's the kind of behavior and attitude we all want to see more of in the world. ",2016-10-21 01:40:53+00:00,d916qtw,1.0,t3_58klpt,1711.0,breastfeeding
35,"Such a cute little boy... Sorry, Lion!!",2016-10-21 01:34:44+00:00,d916h15,1.0,t3_58jesp,15818.0,beyondthebump
36,Best reaction. Same as me. ,2016-10-20 04:35:06+00:00,d8zwu02,2.0,t1_d8zso21,6043.0,tennis
37,Such is life.,2016-10-20 04:34:31+00:00,d8zwt8q,3.0,t1_d8zvx7r,1494.0,tennis
38,"So then what, did he publish it somewhere else out what?",2016-10-20 02:01:51+00:00,d8zpqe4,2.0,t1_d8ysbpu,39977.0,AskAcademia
39,"My baby is the same, lol. ",2016-10-17 22:01:23+00:00,d8wcnzx,2.0,t1_d8w0sq9,14243.0,beyondthebump
40,"I don't know about Germany, but if you're applying for a US visa you need to demonstrate ties to your home country, so you don't become an illegal immigrant there. Things like a good job, property to your name, and/or a car, your kids staying behind etc. Basically, if you're single, don't have a good job, have no real estate, your chances to get a US visa can be pretty low. Maybe it's similar to the way the German consulate operates too?",2016-10-17 17:08:53+00:00,d8vy09g,1.0,t3_57wnv0,23424.0,Kazakhstan
41,I think there's an organization that can make these photos free? Read more about it here: http://www.cbsnews.com/pictures/heartwarming-photos-of-foster-kids-getting-adopted/,2016-10-15 17:43:35+00:00,d8t9z0i,3.0,t1_d8t0jst,16181.0,beyondthebump
42,"Reshape the economy? No shit, Sherlock. ",2016-10-15 04:27:24+00:00,d8sqh0b,1.0,t3_57iz4y,23467.0,sociology
43,"""The Secret History"", her first novel, is an amazing book, in my opinion. ",2016-10-14 15:50:43+00:00,d8rvd0n,4.0,t1_d8rdrq1,38503.0,AskReddit
44,"Yes, most definitely. I'd love to know your opinion on her too but I don't know how to make that happen...",2016-10-14 15:48:27+00:00,d8rv907,4.0,t1_d8rdrq1,38367.0,AskReddit
45,What's your take on Donna Tart? ,2016-10-14 03:41:36+00:00,d8rapqm,2.0,t1_d8r0j1z,13565.0,AskReddit
46,savage,2016-10-12 21:19:21+00:00,d8pd8j1,2.0,t1_d8ocvdu,62295.0,AskAcademia
47,"I think you may be better off asking someone who's local about what to do, rather than here. Mental health, the concepts of personal space/privacy, concern for others etc. can be drastically different depending on a culture. Better yet, ask a local professor about what they'd do. ",2016-10-12 21:03:10+00:00,d8pchf7,1.0,t3_576c4r,1920.0,AskAcademia
48,So you didn't read it? Then how do you know what's in the book?,2016-10-12 02:04:21+00:00,d8o8ask,5.0,t1_d8o818v,390.0,AskAcademia
49,Have you read the book? ,2016-10-12 01:41:06+00:00,d8o7cpa,3.0,t1_d8o5bpp,2878.0,AskAcademia
50,Can you let me know why? I'm curious. Thanks!!,2016-10-12 01:40:16+00:00,d8o7bgv,9.0,t1_d8o5bdj,2842.0,AskAcademia
51,haha whatever dude,2016-10-12 00:09:38+00:00,d8o3h31,7.0,t1_d8nyap7,7385.0,AskAcademia
52,"Depends. Maybe some people would prefer the convenience of reading the book, rather than searching for this kind of info online. Don't assume shit about other people.",2016-10-11 21:44:28+00:00,d8nxat2,5.0,t1_d8nvva3,1835.0,AskAcademia
53,Exactly. I don't know what the fucking point of that comment is.,2016-10-11 21:33:39+00:00,d8nwsjy,4.0,t1_d8nunkh,2705.0,AskAcademia
54,So? This doesn't mean the book is not worth reading. ,2016-10-11 21:01:41+00:00,d8nvao4,3.0,t1_d8npo43,6871.0,AskAcademia
55,"There's a good chapter about this in the book ""The professor is in"". Read it. You won't regret it, I promise you.",2016-10-11 18:11:48+00:00,d8nmxuj,1.0,t3_56y7uf,13812.0,AskAcademia
56,"Apply for public assistance for the child. I believe you or your so will qualify. Your state said have all the available assistance listed on a website, along with conditions of qualifying. This will help with the costs related to the child, for sure. You may even qualify for free child care, so going to school may be a little easier.",2016-10-11 11:07:18+00:00,d8n5wer,1.0,t3_56wlof,20008.0,personalfinance
57,"Would it make it easier for you if you two got married? I know it would've eased my mind... Perhaps, time to start taking about it? ",2016-10-07 17:55:28+00:00,d8i5xzw,1.0,t3_55odza,351940.0,AskAcademia
58,That's such an awesome text. Love it. I wish my 35-year old husband could communicate like that!! ,2016-10-06 15:19:58+00:00,d8git5a,1.0,t3_564yni,12858.0,breakingmom
59,"I dunno, it sounds a bit condescending to me. It course it makes sense, I'm not stupid. Whenever I hear this, I get slightly irritated on the inside, and say something like ""sure, but what about blah blah blah"".",2016-10-06 04:00:37+00:00,d8g15gh,3.0,t1_d8flmzr,23050.0,AskReddit
60,Plot twist: it's actually Karolina. Helping Kristyna boost the ranking.,2016-10-03 02:50:20+00:00,d8bnj81,1.0,t3_55ld7q,5371.0,tennis
61,I'm from kaz. Have an upvote. ,2016-10-03 01:34:03+00:00,d8bkj3n,3.0,t1_d8be816,9654.0,gifs
62,"Omg, I don't know why but I just had the most epic laughing fit over this.",2016-10-01 04:27:19+00:00,d898q6s,7.0,t1_d894y7x,7059.0,AskReddit
63,"I'm curious why you think you make more money than them? Shouldn't you also not judge ""by the cover"", so to speak? It just caught my eye that you complain about being judged but then there goes your own judgement... ",2016-10-01 04:00:13+00:00,d897wke,1.0,t3_5589xz,47072.0,workingmoms
64,"Ohh no, this is so awful. I can't believe people say this shit. I'm so sorry that you have to put up with this shit.",2016-10-01 03:46:10+00:00,d897h39,2.0,t1_d896c1o,2132.0,breakingmom
65,"Omg, congratulations. I'm hitting six months next week, can't wait! My supply has also been dropping, and we also supplement. I wonder why this happened. Do you have any idea?",2016-09-24 04:05:00+00:00,d7zs7iw,1.0,t3_546yk8,25432.0,breastfeeding
66,"I just googled this last name in Cyrillic (Бычек), and a few people came up. It's definitely a Slavic last name, not Kazakh. I mean it's entirely possible that her family was Slavic but living in Kazakhstan. Could it be? As for the ethnically Kazakh part of her heritage (if she has that), it would have to be a different last name, most likely. Where does she live now? The US? When did her family come to the States? It's very unusual for ethic Kazakhs to have emigrated to the States back in the day. Like, unheard of. Russians, Ukrainians, Belorussians, etc., yes, but not Kazakhs Kazakhs (i.e. ethic Kazakhs).",2016-09-23 20:51:59+00:00,d7zdc13,1.0,t3_544f4n,30549.0,Kazakhstan
67,Off topic. This made me remember and wonder about Mitt Romney's private dinner with the donors dinner footage. I wonder how much money that person made... ,2016-09-17 19:00:04+00:00,d7qu5dw,1.0,t3_537lvo,13514.0,legaladvice
68,Thank you for writing this. It made me feel much better about everything. ,2016-09-16 06:26:00+00:00,d7oximq,1.0,t3_52zsa8,14949.0,beyondthebump
69,Fantastic read! Thanks a lot to the guy who translated etc.,2016-09-16 06:07:28+00:00,d7ox48y,1.0,t3_52zpwu,14834.0,tennis
70,"You trolling, right? You have to be!",2016-09-14 01:04:57+00:00,d7ltd4u,3.0,t1_d7lmwfa,9627.0,AskAcademia
71,Saving it.,2016-09-13 04:38:28+00:00,d7klrek,3.0,t1_d7kgx5t,7623.0,politics
72,Only US open does that. ,2016-09-11 00:10:04+00:00,d7hknb1,2.0,t1_d7hhjs0,5099.0,tennis
73,Why smoking? How does that help?,2016-09-11 00:05:26+00:00,d7hkh8z,2.0,t1_d7hipgk,2929.0,AskAcademia
74,Who's Keith,2016-09-08 00:24:38+00:00,d7djx4m,3.0,t1_d7dglre,5041.0,tennis
75,You have a point there.,2016-09-07 15:18:40+00:00,d7cvhb3,3.0,t1_d7cu20e,1996.0,tennis
76,"I didn't know us, tennis fans, elected you to be our spokesperson.",2016-09-07 15:15:46+00:00,d7cvcpu,3.0,t1_d7cresn,5945.0,tennis
77,Haha love it!!,2016-09-05 04:25:32+00:00,d79x69d,1.0,t3_5176tx,8968.0,reactiongifs
78,Ahaha love it. Where can I see more of this kind of pan-Scandinavian hatred? ,2016-09-03 01:47:21+00:00,d77jhgu,3.0,t1_d77ht9l,3070.0,reactiongifs
79,"Yes, good point. Thing is that I'm creating a classification based on respondents' answers to several survey items, not just one. Let's say I want them to clarify as A, B or C. However, the survey didn't ask them ""Are you A, B or C?"" It asked ""How much of A are you?"" A separate item asked ""How much of B are you?"" And one more item asked about C. So now I have people in the dataset that have, for example, 4 (""strongly agree"") on A, 4 (""strongly agree"") on B, and 2 (""disagree"") on C. Now, I can assign this person to either group A or B, but group B has way too few people, so in order to make the categories of the classification ""more balanced"" I put them in group B. See my problem? I need a justification for that decision. I know I know, it's a questionable thing to do, and there are other ways to deal with this problem (e.g., make this group ""mixed A and B""), but for the purpose of my study it'll work (I.e. all subsequent analyses work well on the resulting classification). If you have any feedback on this, I'll be interested to know your thoughts. Thank you.",2016-09-01 17:45:03+00:00,d75nt9h,4.0,t1_d75gbkz,9642.0,sociology
80,"Thank you for your response. I rejected cluster analysis as a method precisely because I wanted to identify membership groups a priori. For that I need a justification which, yes, is based conceptually on a theory, but I also wanted to make sure that my classification is also methodologically sound. Do you have any advice about that?",2016-09-01 14:54:47+00:00,d75fw13,2.0,t1_d75fipy,490.0,sociology
81,"Hi, I'm trying to finish my dissertation with a five-month old, and just like you I have no help, and we don't wanna hire a babysitter, etc. I completely understand what you're going though. I, too, can only work when she's napping. Here's what I think you may wanna do:

- Commit to absolutely protecting the time when she's napping, and only devote it to studying. Everything else can be done when baby's awake. Hell, I even work out in front of mine when she's on a playmat. If I need to talk on the phone, I take baby out for a walk, as she likes being outside, and is always quiet, thus letting me enjoy my conversations. Etc. Etc.

- You didn't say anything about this, but if you haven't, consider sleep training. Saves a lot of time too.

- Husband and I do a big cook on Sundays for the week. I learned about it on Reddit, actually (r/mealprep or something like that). We plan a menu of lunches and dinners (our breakfasts are like cereal or toast) for the week, buy all the groceries we need, make those meals, pack them, and put them on the fridge. And then obviously eat them during the week. Saves a lot of time and energy during the week. Most importantly for me is it saves a lot of mental energy for me: I don't think about what to cook, and whether I have all ingredients I need, and whether it's worth running to the store for that one ingredient I don't have, etc. Etc. Seriously, it's a life saver (and money saver too. And headache saver!!).

- Lastly, look into the resources your school may have for students who are parents. For example, I know a couple of my friends qualified for cheap (or maybe even no-cost) university-run daycare. Perhaps, there's something else. Some scholarship maybe or something? Or some group of student parents that babysit for each other? I'd start with your advisor, and/or email the Dean of students or Dean of your school or someone like that. Tell them, I'm so and so, how can the university help me given me my circumstances? 

- Also, work with your professors if you're failing. Ask for an extended deadline, or maybe even an incomplete at the end of the semester, but don't abuse these options. Only use them in extreme circumstances. You don't wanna end up with a bunch of incompletes come Christmas.

Good luck, girl. I know it's hard, but it's not impossible. It's been done, so you can do it too. Let me know if you wanna talk more about all this.",2016-08-30 23:44:29+00:00,d73b6hw,1.0,t3_50co74,18490.0,breakingmom
82,Do celebrities (like Serena Williams) have some special role within the organization?,2016-08-28 16:19:03+00:00,d702k4u,1.0,t3_4zzruz,3938.0,IAmA
83,You could try some free online courses?,2016-08-25 21:39:08+00:00,d6wnznq,1.0,t3_4zk0gb,11606.0,sociology
84,What? No. I wouldn't call a bronze medal sucking at the Olympics.,2016-08-22 04:29:33+00:00,d6rhg17,3.0,t1_d6rh5sw,555.0,olympics
85,But not Novak. Wtf.,2016-08-22 02:29:08+00:00,d6rd7n9,1.0,t3_4yx514,19028.0,olympics
86,How is this not a movie yet?,2016-08-18 17:43:46+00:00,d6mvn8m,1.0,t3_4yc2sv,17558.0,Showerthoughts
87,"I'd like to recommend ""Paying for the Party"" - how class affects college experience and post graduation outcomes. ",2016-08-18 05:34:01+00:00,d6m9c1z,1.0,t3_4y7v0b,33627.0,sociology
88,"Omg, I just want you and your baby to be okay. Which you will be. I just want you guys to get there ASAP. Hugs.",2016-08-16 01:47:22+00:00,d6j54sg,1.0,t3_4xum3q,31097.0,breakingmom
89,Congrats! I'm so happy for you guys!! ,2016-08-14 00:19:59+00:00,d6gho1y,4.0,t1_d6gfiih,3632.0,olympics
90,"Omg, I'm from Kazakhstan! You guys this is amazing!!! We got two golds today - one in weightlifting, which we're traditionally strong at, but swimming man, swimming is amazing!! ",2016-08-11 03:22:57+00:00,d6cs1gq,1.0,t3_4x5ic0,7991.0,olympics
91,"What import taxes? I don't understand. If you sell it, there's nothing to import, no?",2016-08-10 16:04:46+00:00,d6by0wg,3.0,t1_d6bsqnl,7180.0,Kazakhstan
92,Why don't you sell it instead? ,2016-08-10 13:43:29+00:00,d6brwm4,1.0,t3_4x1ir9,11149.0,Kazakhstan
93,"It's awesome. To think that my baby was all curled up like this in my womb. Ah. Stuff of magic, innit?",2016-08-10 04:00:57+00:00,d6be30x,1.0,t3_4wzom0,9713.0,WTF
94,"I'm a tennis nut, so, um, tennis.",2016-08-06 03:24:50+00:00,d66ab7d,2.0,t1_d65i7s4,40727.0,AskReddit
95,"Hey, so I'm female, and I remember a guy who was great on a dating site and texting, including pictures, but when I hung out with him on the first (and only) date, I knew it wasn't gonna work. I remember he wore an ill-fitting cheap ass shirt, which was very off-putting to me. Superficial of me? Maybe. But when I saw what he was wearing, I immediately regretted the time I had spent in front of the mirror, putting makeup on and trying on different outfits, trying to look my best for him. Sure, for each his own, but it was a sign that we were worlds apart as far as personal appearance goes. Then he mentioned that he wanted to move to a small town, and tired of living in the city, whereas all I wanted was to move to an even bigger city. Also his career aspirations and activities with friends were not aligned with mine. So it was very clear (to me) like maybe 30 minutes into the date that we weren't gonna click, ever, whereas he seemed like he had no clue. When I said I wanted to leave, he seemed to be taken aback. If I had to explain to him why, I would've said ""incompatible lifestyles and aspirations"". I think it's related to people's socioeconomic status too, how people were raised and socialized, so maybe that could be your answer. 

In any case, the encouragement I have for you is that you're still very young, and you're trying to figure this whole dating thing out, and you'll get better at it with time. It'll be painful sometimes but it's part of the game. It's absolutely normal.",2016-07-31 01:01:56+00:00,d5xsncq,1.0,t3_4vcdrs,36217.0,offmychest
96,"Oh God, I had a laughing fit over this. It's a perfect combo of the gif and the text. Thanks for the laugh, OP. Hope your depression gets better.",2016-07-30 17:27:19+00:00,d5xcjly,1.0,t3_4vanev,45981.0,reactiongifs
97,This is beautifully written. Happy birthday to your girl. PS: publish this somewhere else too. It's beautiful.,2016-07-29 04:25:57+00:00,d5vhqvo,1.0,t3_4v47yf,9401.0,breakingmom
98,"I do the same on occasion. I don't feel guilty though. Baby's fine, mommy's less tired and therefore better equipped to handle the day, to me that's a win. I wake up grateful to my daughter - I tell her thank you for letting me sleep. ))",2016-07-28 15:03:57+00:00,d5ui39v,1.0,t3_4v10yd,1489.0,beyondthebump
99,"Why don't you just bring them anyway? It's not like they're super expensive, if they are thrown out by the customs.",2016-07-26 20:25:18+00:00,d5rz4uh,1.0,t3_4updan,15750.0,Kazakhstan
100,Add sharapova and Azarenka to the mix.,2016-07-26 19:59:26+00:00,d5rxtph,3.0,t1_d5rrhwj,7574.0,tennis
101,"I read the initial comment about how fed will mess up someone's tournament, and I was like ""exactly!"" Then I read yours, and I was like ""omg, even more exactly!"". ",2016-07-26 19:58:16+00:00,d5rxrin,3.0,t1_d5rsd7c,6456.0,tennis
102,Yeah. Lol,2016-07-26 19:49:11+00:00,d5rxb19,2.0,t1_d5rp288,9902.0,beyondthebump
103,"Can I pm you too, please? Currently in a PhD program, and kind of having second thoughts about all this. Thanks!",2016-07-26 02:50:43+00:00,d5qyhjb,2.0,t1_d5qphxc,11476.0,sociology
104,"I took a taxi once, got the driver's phone number, and have used his services on occasion, mostly for rides to the airport. I call him, tell him the addresses and he picks me up and drops me off. You could do something like that? If not, I can pm you this guy's number. He's in New Brunswick. Which is Central Jersey too. ",2016-07-23 17:18:23+00:00,d5nscky,1.0,t3_4u8ust,3475.0,newjersey
105,"&gt; in this tournament.

You mean always? 
",2016-07-23 00:18:11+00:00,d5n2uz9,2.0,t1_d5mznhj,5232.0,tennis
106,"Maybe now that you're older you actually have more of an understanding just how unfair this little tiny kitten's life and death were, and of course it fills you with this pain. I don't know your kitten but her death makes me sad too. You know, because sweet little kittens aren't supposed to die, especially not like this. They're innocent, why did this have to happen to her??",2016-07-22 16:35:34+00:00,d5miqc5,1.0,t3_4u2guw,15515.0,offmychest
107,So... Is this happening or not? ,2016-07-18 20:48:42+00:00,d5h9ys2,1.0,t3_4tgz15,4270.0,beyondthebump
108,"As for shymkent and Texas, the comparison is there because shymkent is the ""redneck-ish"" part of kaz. ",2016-07-18 13:44:45+00:00,d5grzqk,1.0,t3_4tefcf,13811.0,Kazakhstan
109,"Ha, I'm from taldykurgan. When I was little (in the 1980s), I heard my parents joke that we live in талды-париж (taldy-paris), lol. I guess the joke is that this small provincial city is compared to a center of the world culture. And талды-париж kind of rolls off your tongue better than, say, taldy-london. ",2016-07-18 13:41:14+00:00,d5grvnq,1.0,t3_4tefcf,13600.0,Kazakhstan
110,"Thanks!! But uh... who is he??? Why so secretive, right??",2016-07-16 04:28:34+00:00,d5e89w5,4.0,t1_d5e595x,6118.0,tennis
111,"I just scrolled down to the bottom of this thread (it's at 70 comments now). Nobody knows. If someone knows who her boyfriend is, can you let me know asap. Super important. /s Thanks. ",2016-07-16 01:29:56+00:00,d5e2tkl,2.0,t1_d5dh70j,32147.0,tennis
112,"Sorry, what exactly is ""amazing"" in this post?",2016-07-15 16:39:46+00:00,d5dhg5a,2.0,t1_d5cvdb5,48027.0,breastfeeding
113,RICO.,2016-07-13 17:33:49+00:00,d5au1q2,4.0,t1_d5aazu3,37868.0,personalfinance
114,Civil evil.,2016-07-07 17:10:54+00:00,d531eis,6.0,t1_d52z7ms,2661.0,AskReddit
115,"Musically speaking, not literally. Jeez.",2016-07-05 01:38:10+00:00,d4zhmmx,13.0,t1_d4zg6jh,2721.0,funny
116,What do you think helped?,2016-07-03 23:37:50+00:00,d4y7f3y,1.0,t3_4r3niy,11374.0,breastfeeding
117,"Oh fuck this twitter user blocked me, lol.",2016-07-03 21:41:16+00:00,d4y3f5v,1.0,t3_4r25fg,26943.0,tennis
118,"No, Miami. Offers quite a bit of more prize money than Rogers cup.",2016-06-30 02:00:01+00:00,d4tfsmc,10.0,t1_d4tf3r4,1149.0,tennis
119,"Omg, wut. At this point I'm like ""there's so much you need to learn, I don't even want to start telling you how things are"".",2016-06-29 21:58:40+00:00,d4t6j4c,8.0,t1_d4t61tq,644.0,tennis
120,Wow,2016-06-24 07:36:28+00:00,d4lz5yg,4.0,t1_d4lz0hv,394.0,worldnews
