,body,created,id,nest_level,parent_id,reply_delay,subreddit
256,I wonder when he first caught his attention? ,2016-03-06 16:08:17+00:00,d0pocmo,2.0,t1_d0pnjqb,1626.0,tennis
257,Please vote for him. Please. ,2016-03-06 05:49:18+00:00,d0pc9v5,2.0,t1_d0ot633,35755.0,BabyBumps
258,"Great! Congratulations!! I'm doing it at Robert Wood Johnson. Simply because it's within walking distance for me. Is it a girl or a boy? First child? (I'm having a girl, first child. Can't wait!!) ",2016-03-05 19:08:44+00:00,d0ornol,,t1_d0ofvfm,25700.0,BabyBumps
259,"I don't think it's that clear that Trump will beat Hillary in the general. People may get so terrified of a potential Trump presidency, they will vote for anyone else. ",2016-03-03 17:50:48+00:00,d0m92eg,1.0,t3_48sewt,8816.0,SandersForPresident
260,Me too!! New Brunswick! Due in three weeks!!,2016-03-03 04:31:06+00:00,d0lnvt9,,t1_d0lj7vs,7945.0,BabyBumps
261,New Brunswick!! Due in three weeks! ,2016-03-03 04:30:32+00:00,d0lnv70,,t1_d0hzmlj,,BabyBumps
262,Lol clueless. Google stopped working or what?,2016-03-02 02:33:24+00:00,d0k7lgj,2.0,t1_d0k7i0p,134.0,SandersForPresident
263,I don't know why you're repeating something that's been on the front of this sub for several days now. Meaning: everybody knows that already.,2016-03-02 00:27:03+00:00,d0k2e01,2.0,t1_d0k28fi,232.0,SandersForPresident
264,Why didn't you register on time? Just curious.,2016-03-01 15:07:17+00:00,d0jdwbr,2.0,t1_d0jci6z,2338.0,SandersForPresident
265,I can't believe I knew what this was about just from the heading. Hahaha. Love it.,2016-03-01 07:40:33+00:00,d0j4uen,1.0,t3_48cm6d,36530.0,BabyBumps
266,Ewwww.,2016-02-29 04:22:05+00:00,d0horx4,3.0,t1_d0hmlmk,3709.0,tennis
267,"Sorry, how is anyone gonna know that he voted in the Republican primary? How do they check for that? Genuinely curious. Thanks.",2016-02-27 16:58:48+00:00,d0fwsvs,3.0,t1_d0ftx9o,5295.0,SandersForPresident
268,I'd say Malcolm gladwell's books are examples of what looks like research but isn't. ,2016-02-27 05:32:25+00:00,d0fja8j,1.0,t3_47rai5,30752.0,sociology
269,"Well, here's where you and I differ on understanding her first question. Since there was no prior context whatsoever, I understood ""the number just don't add up"" as ""how you're proposing to finance your initiatives is not feasible, the numbers just don't add up"". This was my line of thought because I had heard this argument ""the math doesn't add up"" many times before. That's why when she asked about ""what's your prediction [on the number of delegates]"" it seemed to me like a completely unrelated question to the previous one. I don't know what she really referred to with ""the math doesn't add up"" but somehow I doubt that it was about the projected number of delegates, because how can the numbers that everybody knows can change depending on many factors don't add up? ",2016-02-25 21:29:29+00:00,d0drkj6,7.0,t1_d0dqjjt,1304.0,SandersForPresident
270,You're sooooo funny. ,2016-02-25 20:44:28+00:00,d0dpfq2,5.0,t1_d0dof5z,1267.0,SandersForPresident
271,"The second question might have been completely unrelated to the first one. Logic, hello?",2016-02-25 20:21:33+00:00,d0doc59,3.0,t1_d0do5x7,217.0,SandersForPresident
272,"""Man"" in Kazakh is ""adam"". I'm not joking. ",2016-02-25 20:18:56+00:00,d0do7n7,2.0,t1_d0dewvc,12190.0,todayilearned
273,"Technically, yes. But really what he meant was (I think) ""nobody knows how things will develop so it's hard to make a prediction"".",2016-02-25 19:04:32+00:00,d0dkqop,3.0,t1_d0dkmhz,156.0,SandersForPresident
274,"As a Kazakh - you have no idea how incredibly tired those jokes are. It's like I've heard them all and all variations of the jokes a million times over. People don't realize that, and think they're hella original and funny when they say them to me, whereas I'm thinking to myself ""oh god, here we go, another moron who likes to think he's witty as hell"". ",2016-02-25 18:41:25+00:00,d0djoce,3.0,t1_d0dg7uv,4573.0,todayilearned
275,"Kazakh here. Our anthem used to be just a very popular song that people would sing when drunk at weddings and such, or feeling a bit of patriotic fervor (usually also when drunk, lol). Every Kazakh knew this song. And then they made it into the national anthem. Which was a perfect choice, but now it feels very official and grand, rather than this cute folksy song people used to sing when shit drunk in the face. ",2016-02-25 18:18:29+00:00,d0dimim,3.0,t1_d0d8qyl,14365.0,todayilearned
276,"It's funny how when she asks ""what's your prediction?"" her question seems completely reasonable, but after his ""I don't know, nor do you, not does anybody else"" answer, I felt ""what a dumb question indeed"". Bernie's magic. ))",2016-02-25 16:52:48+00:00,d0des7w,1.0,t3_47jf7a,4542.0,SandersForPresident
277,"She's not stupid, she's arrogant. She thinks she's above everyone else, and can get away with anything. ",2016-02-24 23:45:36+00:00,d0cm1fh,4.0,t1_d0c2gti,26354.0,politics
278,"It's Princeton, not Harvard.",2016-02-23 19:01:03+00:00,d0awltw,3.0,t1_d09wmu6,70376.0,SandersForPresident
279,I liked reading about his family and childhood. Very interesting. ,2016-02-23 14:28:38+00:00,d0al36l,1.0,t3_47479x,46979.0,SandersForPresident
280,I'm almost 36 weeks. You're also probably going to be fine.,2016-02-23 14:05:38+00:00,d0akdav,3.0,t1_d0aj2p9,2836.0,BabyBumps
281,"I've read that cervix length between 2 and 4 cm is considered normal. They measured mine, it was 3 cm, and they said the length was ""great"". So either you're mistaken about the length, or they are maybe trying to play it safe or something. ",2016-02-23 07:08:45+00:00,d0acrar,1.0,t3_474qku,12826.0,BabyBumps
282,"Thank you. You're inspiring. I think I'll give phonebanking a try finally. Don't know when, but with every post like this, it's weighing more and more on my mind.",2016-02-22 23:08:03+00:00,d09vtv3,1.0,t3_472xmd,7871.0,SandersForPresident
283,"Thanks. Is NAACP widely known? Sorry, completely ignorant about these things here. Thank you.
",2016-02-22 21:26:45+00:00,d09reuu,4.0,t1_d09lr9e,7522.0,SandersForPresident
284,Is Ben jealous widely known? I'd never heard of him before he endorsed Bernie (I'm not American). Thanks.,2016-02-22 15:43:06+00:00,d09cjz3,2.0,t1_d091pjm,31297.0,SandersForPresident
285,More like migraine.,2016-02-21 04:40:20+00:00,d07t9ij,5.0,t1_d07qd4g,5796.0,videos
286,For Bernie? Or for Federer?,2016-02-21 04:36:52+00:00,d07t5yi,8.0,t1_d07sdky,1644.0,SandersForPresident
287,Just like a certain Roger Federer against Novak many many many times.,2016-02-21 02:27:33+00:00,d07p6pa,6.0,t1_d07op9i,854.0,SandersForPresident
288,Stupid troll.,2016-02-20 22:25:47+00:00,d07gugk,2.0,t1_d07gpvh,220.0,SandersForPresident
289,"I'm sure there's some context to this of which I'm not aware. But without any context - this looked like the White House is proud that Bernie Sanders approves of Obama, lol. It's like they're trying to convince the public that Bernie endorses Obama. Thanks, Obama. No, seriously, thank you.",2016-02-20 17:06:19+00:00,d0764ue,1.0,t3_46pxs2,15729.0,SandersForPresident
290,"All I'm saying is that she sounded convincing. I have no idea who's right - Hillary or Warren but Clinton sounded convincing, and I'm a Bernie supporter. So your average viewer is even more likely to feel that Hillary was ""right"".",2016-02-20 14:51:58+00:00,d07269m,3.0,t1_d071zig,452.0,SandersForPresident
291,"I dunno, I thought she was convincing about the details of why she voted for that particular bill in 2001. She is of course wrong about the larger point of money influence in politics.",2016-02-20 14:42:17+00:00,d071xlb,1.0,t3_46q594,3178.0,SandersForPresident
292,"I know of three Hillary supporters. All three are women. One has an autistic child, and apparently Hillary has since kind of a comprehensive plan for autism research or awareness or something like that. So that I understand. The other two just really seem to be your garden variety feminists, who see Bernie as an old white man - something I think they've been taught to see as enemy.",2016-02-20 07:52:32+00:00,d06vb1h,2.0,t1_d069y5z,41051.0,SandersForPresident
293,"Joe, the realtor, is a sequel to Joe, the plumber. ))",2016-02-19 08:04:10+00:00,d05ndeq,4.0,t1_d05melr,3093.0,SandersForPresident
294,"Yes!! This, so much this!! You could tell she was mad at the guy, and wanted to destroy him. ",2016-02-19 06:09:09+00:00,d05kzyz,2.0,t1_d05i7d3,5855.0,SandersForPresident
295,What if you guys won the world cup? ,2016-02-18 18:06:29+00:00,d04rap7,4.0,t1_d04kqzo,8644.0,AskReddit
296,"Aren't people from rural towns fucked now already? In fact, isn't everyone fucked already in a sense?",2016-02-18 18:03:11+00:00,d04r561,5.0,t1_d04okex,3232.0,AskReddit
297,"How about Secretary of Minority Affairs? I mean, why the hell not. There *should* be a department of Minority Affairs. ",2016-02-17 13:37:41+00:00,d035k5j,3.0,t1_d034en6,2808.0,SandersForPresident
298,What is Hamberg? LOL,2016-02-17 04:56:13+00:00,d02v7ub,2.0,t1_d02un1w,1078.0,tennis
299,"Yep, it's a love train. ))",2016-02-17 03:55:41+00:00,d02t788,2.0,t1_d02p1c4,6678.0,SandersForPresident
300,"I remember reading that once a tournament didn't have a final, because of continuously bad weather. Monday came and went, and it was still raining. I think they announced two winners, and that was the end of it. I wanna say it was a women's tournament in England, like in the 80s or 90s.",2016-02-17 03:34:51+00:00,d02sggv,2.0,t1_d02pi9n,4703.0,tennis
301,"I wanted to kill John Cusack. Like, let the guy speak, for God's sake.",2016-02-16 21:46:23+00:00,d02eq6i,3.0,t1_d02cyz9,2327.0,SandersForPresident
302,It's lovely!!!,2016-02-16 20:59:30+00:00,d02cm7m,1.0,t3_4625hg,32165.0,betterCallSaul
303,"Yes!! And horror at the human condition, almost like. Also almost made choke up.",2016-02-16 08:31:35+00:00,d01pnht,2.0,t1_d01jpv9,14706.0,SandersForPresident
304,The Rio Olympics tennis tournament will be on hard courts. ,2016-02-16 06:32:00+00:00,d01namf,2.0,t1_d01a566,22827.0,tennis
305,You sound like you're 12. Have a good day.,2016-02-13 16:29:46+00:00,czyk4dz,13.0,t1_czyg3mp,8733.0,AskAnAmerican
306,You're so witty. I'm in awe.,2016-02-13 12:00:36+00:00,czye0ig,11.0,t1_czy8a03,22040.0,AskAnAmerican
307,"Haven't looked at the data, but maybe Kenya's there because of the whole Obama's birth certificate thing that was pedaled by Trump? I imagine the story got some traction in Kenya, and people were looking Trump up.",2016-02-13 11:59:41+00:00,czye026,3.0,t1_czy7h9g,24018.0,SandersForPresident
308,I'm not American. And you're a moron.,2016-02-13 05:15:23+00:00,czy7dnj,9.0,t1_czy5jxj,4132.0,AskAnAmerican
309,"And I guess some of us don't. Whatcha  gonna do about that, cupcake?",2016-02-13 03:46:05+00:00,czy4zfb,7.0,t1_czy3vkr,2305.0,AskAnAmerican
310,"Sure, there's lots of resources on the internet for that. I cannot imagine having questions for Europeans similar to ""what is meatloaf and why is it in every TV show?"" I dunno. Not interested in that sort of stuff. ",2016-02-12 22:14:36+00:00,czxu4gm,5.0,t1_czxtxt3,296.0,AskAnAmerican
311,"Well, you still acted as a presumptuous ass, lol. ",2016-02-12 22:07:21+00:00,czxtuql,5.0,t1_czxsh1v,2109.0,AskAnAmerican
312,What is shockingly stupid? Not caring about Europe? Why is that stupid? Please enlighten me.,2016-02-12 21:31:06+00:00,czxsffa,3.0,t1_czxrptn,1059.0,AskAnAmerican
313,"What makes you think I don't speak foreign languages? I speak two more (three in total), and English is my second language. So no, you're not in a very smart territory, by any stretch of imagination. Joke's on you, lol.",2016-02-12 21:29:49+00:00,czxsdj2,3.0,t1_czxpzny,3521.0,AskAnAmerican
314,That fish is called vobla. Google it. )),2016-02-12 17:18:00+00:00,czxhomm,8.0,t1_czxh73c,678.0,SandersForPresident
315,"But what could I possibly want to ask them about? I guess I just don't care about Europe, lol.",2016-02-12 14:54:47+00:00,czxbssn,1.0,t3_45ctw1,40636.0,AskAnAmerican
316,"I thought that too, got pregnant after one month of trying. I felt the same way, like seriously? If I knew I'd get pregnant so fast, I would've waited a few months. But hey, at least we saved $10k on ivf (because that's what I thought we'd end up doing. Why? I don't know. Who knows why. Because. That's why.), hehe.",2016-02-11 04:05:01+00:00,czvnik3,3.0,t1_czviq2k,8112.0,BabyBumps
317,Thank you.,2016-02-11 00:05:43+00:00,czvey41,3.0,t1_czv92g8,8857.0,SandersForPresident
318,"Paul McCartney may actually be friends with Trump, lol.",2016-02-10 03:03:03+00:00,czubhaw,3.0,t1_czubbu1,228.0,SandersForPresident
319,"Hold on, did he say that???? Wat.",2016-02-09 19:23:01+00:00,cztrzyh,2.0,t1_cztrjmn,597.0,SandersForPresident
320,"Omg, she is such a victim, always. ""Why is it just me? Is it because I'm a woman? Stop your artful smear! You're running a negative campaign! That's not fair!"" Poor Hillary. ",2016-02-07 17:59:58+00:00,czr83cu,1.0,t3_44m0zm,8523.0,SandersForPresident
321,"Also: ""Bernie Sanders has created a movement, and that makes the white house worried"". 

Edit: actually, it's ""upset"", not ""worried"". ",2016-02-07 15:09:39+00:00,czr2n8h,2.0,t1_czr1po3,2351.0,SandersForPresident
322,"Yes!! Just download the ""Google hangouts"" app, and you're set!",2016-02-06 04:02:02+00:00,czpo31p,4.0,t1_czpmn44,2875.0,SandersForPresident
323,"Get a Google voice account. It's free, and you can call from your computer for free in the US.",2016-02-06 03:12:55+00:00,czpmlre,2.0,t1_czpmf3d,347.0,SandersForPresident
324,"Yeah, I guess it remains to be seen what the voters think. Godspeed Bernie. ",2016-02-05 15:36:17+00:00,czovwk1,5.0,t1_czouhrs,2334.0,SandersForPresident
325,Because I didn't think Bernie was strong last night. ,2016-02-05 14:41:57+00:00,czotyo4,3.0,t1_czotj1o,794.0,SandersForPresident
326,"Yeah, ok, Iowa might have been. What about last night's debate??",2016-02-05 14:28:15+00:00,czotii5,3.0,t1_czot3zm,776.0,SandersForPresident
327,"OMG. I was losing all hope honestly, after Iowa and after yesterday's debate. I started believing he had no chance. But, omg, I can hope again? Maybe not yet. I'll believe it when I see the numbers after last night's debate. ",2016-02-05 14:07:21+00:00,czosvd8,1.0,t3_44atcp,2202.0,SandersForPresident
328,"""Pretty"" sure? You need to be 100% sure!!",2016-02-04 15:23:26+00:00,cznlf6q,3.0,t1_czndjyu,21097.0,SandersForPresident
329,Here's the video: http://www.msnbc.com/morning-joe/watch/woodward-clinton-has-to-get-off-screaming-stuff-614955075537,2016-02-03 16:29:22+00:00,czmduh1,1.0,t3_43zndl,13194.0,SandersForPresident
330,"What difference would it make, if he's bashing wall street, while physically being in new York or some place else, if it's on TV anyway? ",2016-02-03 05:40:45+00:00,czlz1ny,4.0,t1_czlufri,8812.0,SandersForPresident
331,"If you like Hillary because she's a woman, then... What? What can we possibly say to this without insulting the person????",2016-02-03 01:55:49+00:00,czlrj4a,1.0,t3_43wk16,14109.0,SandersForPresident
332,"Orrr, start a new world war. ",2016-02-02 22:00:43+00:00,czliifl,3.0,t1_czlg7go,3004.0,AdviceAnimals
333,What if I live in an old house? What should I do? ,2016-02-02 16:45:49+00:00,czl4la9,3.0,t1_czl0vt2,5799.0,newjersey
334,"You should have said, ""well, I'm Chechen"", and pulled an AK-47. That would have shown him. ",2016-02-02 16:20:19+00:00,czl3jw6,1.0,t3_43uggg,6192.0,AdviceAnimals
335,Why are you telling me? I'm not OP.,2016-02-02 04:54:16+00:00,czko490,3.0,t1_czklqry,3674.0,tennis
336,"If you google ""US Open tickets"", I'm sure you'll find something useful.",2016-02-02 04:53:03+00:00,czko2rq,2.0,t1_czk8ulq,23056.0,tennis
337,"You're gonna be waiting a long time, buddy. Go to bed. ",2016-02-02 00:59:29+00:00,czkelwd,2.0,t1_czkekio,61.0,SandersForPresident
338,"Cincinnati: not hard at all. You can totally wait until the draws are out and even the schedule is released, and buy the tickets then. Yeah, even on the same day. I was able to buy two tickets for the 2009 final the day before (Federer - Djokovic). I don't think this event is ever sold out. 

US Open: I've never tried to see Federer there, but again I would think early rounds should be totally available the day of.",2016-02-01 19:45:54+00:00,czk1x4m,1.0,t3_43pqkf,5570.0,tennis
339,I wish there were live-steaming of the caucasus from some of the precincts. ,2016-02-01 19:14:42+00:00,czk0jse,1.0,t3_43owoy,13660.0,SandersForPresident
340,What about your mom? And your dad's friends' wives???? I hope they're not siding with Hillary!!! :),2016-02-01 18:49:18+00:00,czjzgqv,1.0,t3_43p536,9163.0,SandersForPresident
341,but for that type of law to exist... we need Bernie!! :) ,2016-02-01 15:27:50+00:00,czjr6fp,6.0,t1_czjqw7z,483.0,SandersForPresident
342,"Yeah, now you have an excuse. :) ",2016-02-01 14:58:41+00:00,czjq6pz,2.0,t1_czjoua5,2630.0,SandersForPresident
343,"Yeah. It's really odd when you think about it. Why should the rest of the country put up with Iowa's desire to be the first caucus/primary state? So what if they do? Voting for presidential candidates should be regulated at the federal level, no? ",2016-02-01 14:58:00+00:00,czjq5y7,4.0,t1_czjoui8,2576.0,SandersForPresident
344,"One could still bring snacks. If they're not allowed, OK, keep them in your bag, and eat them later. What's the big deal. On the other hand, I don't understand why there should be snacks in the first place. ",2016-02-01 13:20:12+00:00,czjnfh5,1.0,t3_43nuhu,11647.0,SandersForPresident
345,Sorry what is the October surprise? Thanks!,2016-02-01 05:21:21+00:00,czjew1m,2.0,t1_czjaq9i,8091.0,SandersForPresident
346,"Bernie Sanders is challenging the status quo, and the African-American community has been the victim of the status quo for generations. ",2016-01-31 20:50:03+00:00,czix3go,1.0,t3_43k098,11039.0,SandersForPresident
347,"I know, right?? When I saw ""nosotros"", I choked up for some reason. I don't even know why. ",2016-01-31 16:35:43+00:00,czio8y9,3.0,t1_cziejf3,31628.0,SandersForPresident
348,"""Let's get real, folks"". Argh.",2016-01-31 07:05:38+00:00,czidqml,2.0,t1_czi8344,13261.0,SandersForPresident
349,"Omg, I'm almost in tears. Amazing &amp; beautiful. How can we lose when there's so many of us, and we're together. ",2016-01-31 01:00:57+00:00,czi3lb9,1.0,t3_43fgl7,20601.0,SandersForPresident
350,Oh man. Thank you for doing all of this. ,2016-01-31 00:56:57+00:00,czi3gp7,1.0,t3_43g5jz,10435.0,SandersForPresident
351,Thank you! And happy birthday!!! ,2016-01-29 21:31:27+00:00,czgvlj8,1.0,t3_43awzv,797.0,SandersForPresident
352,"Um, why not? What's not OK about commenting on this article?",2016-01-29 16:21:52+00:00,czgi5x8,2.0,t1_czggv9n,1850.0,SandersForPresident
353,Sucks that you have to worry about these things. :((,2016-01-29 04:52:34+00:00,czg246r,6.0,t1_czff6pe,35879.0,newjersey
354,Having a kid.,2016-01-29 03:37:19+00:00,czfzotr,1.0,t3_435sn4,17729.0,AskReddit
355,"Wow, that's awesome. I should find a gym like that!!!",2016-01-28 18:48:19+00:00,czfewu8,5.0,t1_czfeq68,256.0,pics
356,"I'm going to reach out to the campaign with this, but you could actually do it too. I don't know why you won't. ",2016-01-28 16:11:23+00:00,czf840y,3.0,t1_czf4uzq,5174.0,SandersForPresident
357,Wat. Daycare at the gym? Is that a thing?????!!! ,2016-01-28 16:02:55+00:00,czf7rpm,3.0,t1_czf6grl,1979.0,pics
358,I love it.,2016-01-28 14:11:28+00:00,czf3s1f,1.0,t3_431ivj,37530.0,SandersForPresident
359,"As someone who's never been interested in comics and comic book stores, can you explain to me what it is about Weaver that screams to you comic store owner? Thank you.",2016-01-28 14:06:55+00:00,czf3n6c,2.0,t1_czersra,35002.0,SandersForPresident
360,"People canvassing in Iowa could distribute copies of this guide maybe? To Bernie supporters. Maybe we should let the official campaign know?

u/Alexanderr: do you think this could work?",2016-01-28 13:49:16+00:00,czf359p,1.0,t3_431q00,33232.0,SandersForPresident
361,Case closed then.,2016-01-27 16:49:49+00:00,czdzozd,8.0,t1_czdzmve,83.0,SandersForPresident
362,"&gt; Also, Israel has become laughably evil in the past decade or 2

I don't see how this is relevant to a one-state solution. ",2016-01-27 16:47:56+00:00,czdzm4h,4.0,t1_czdyf7f,1664.0,SandersForPresident
363,"So then, Bernie is the best choice for you on that matter. ",2016-01-27 16:46:19+00:00,czdzjiz,6.0,t1_czdz32y,634.0,SandersForPresident
364,"Well then, I don't think you're gonna find an American politician whose stance on Israel you're gonna like. ",2016-01-27 16:35:26+00:00,czdz2ks,4.0,t1_czdybs4,1047.0,SandersForPresident
365,"I'm sorry, why don't you like his stance on Israel? I know that he wants a two state solution for the conflict between Israel &amp; Palestine. You gotta like that, no? ",2016-01-27 15:47:26+00:00,czdx341,2.0,t1_czdwf2h,1031.0,SandersForPresident
366,He's prob American living in Korea. Not south Korean.,2016-01-27 04:42:46+00:00,czdi8xi,3.0,t1_czdhzkw,473.0,SandersForPresident
367,"Yes. This is the most important thing of the ""Bernie's platform"". This is what makes everything else ""rigged"". This is what's killing democracy in this country, and keeps regular folks away from decision-making at all levels (local, state, and national). If we don't fix this issue, all other issues won't be fixed how they should be; they'll only be fixed in line with the wishes of those who are behind all the money in politics. I believe this is the most serious issue of our time.",2016-01-26 18:52:47+00:00,czcu63g,2.0,t1_czcfann,25895.0,SandersForPresident
368,Made me cry. Thank you.,2016-01-26 17:53:36+00:00,czcri7a,1.0,t3_42rhg7,15371.0,SandersForPresident
369,Just because she's Armenian doesn't mean she can't work with a turk.,2016-01-26 15:23:34+00:00,czcl4tm,3.0,t1_czck7lk,1500.0,SandersForPresident
370,"Has to be that BBC comment about Bartoli, how she wasn't a ""looker"". Just unbelievable, really. ",2016-01-24 20:58:34+00:00,czadm20,1.0,t3_42f9gj,42983.0,tennis
371,You should read the whole thing. It's worth it.,2016-01-24 05:58:14+00:00,cz9rmej,2.0,t1_cz9n76o,9513.0,SandersForPresident
372,What's illegal?,2016-01-23 06:32:52+00:00,cz8py5l,2.0,t1_cz8nc7b,6562.0,SandersForPresident
373,"Yeah. During the last debate, as she was nodding to Bernie's tirade about how he's running against Hillary and not Bill and his past, it struck me how actually heartbreaking and almost tragic it was that she's done everything within her power and put up with so much public humiliation and shit, and even made her daughter say all those incorrect things about Bernie, things she knows are not true... All this in order to become president one day, but here she was, nodding helplessly and gratefully to her rival's words, who came to her rescue out of his own goodness, humanity and decency. I felt like her nodding to this was an admission and realization that she'll never be this good, and that she counted on being pragmatic about her career but what she should have been is true to her ideals. And should have had ideals in the first place. This is a tragedy of the ancient Greece proportions, folks. I hope someone makes a movie about this. It'd probably get an Oscar or two, lol. ",2016-01-23 06:26:13+00:00,cz8pt7e,5.0,t1_cz8p5sp,1748.0,SandersForPresident
374,"Or ""Me. Me me me me me"". ",2016-01-22 21:10:28+00:00,cz87z1c,2.0,t1_cz844nn,5417.0,SandersForPresident
375,"Um, I don't know how to break this to you, but Iowa probably looks pretty wintery now.",2016-01-22 01:15:21+00:00,cz78iiq,2.0,t1_cz701ma,13116.0,SandersForPresident
376,"Ah, this is so beautifully said. Omg. ",2016-01-21 22:31:51+00:00,cz72c30,2.0,t1_cz6qmd8,16188.0,SandersForPresident
377,"Omg yes, me too, non-American but a recent permanent resident with an American baby in my belly. This ad gave me goosebumps. Apparently I love this country more than I realized, and this country deserves Bernie so bad. ",2016-01-21 14:08:35+00:00,cz6hebv,2.0,t1_cz6ev4j,6156.0,SandersForPresident
378,"I'm starting to think of Mika and Joe as good pals. Always so good to see them, lol.",2016-01-19 15:55:07+00:00,cz409vt,1.0,t3_41oedm,12692.0,SandersForPresident
379,"Oooooh, interesting. Can you tell me the details?",2016-01-19 10:37:13+00:00,cz3su07,6.0,t1_cz3sfjc,1644.0,casualiama
380,"What. What gave you that feeling, I wonder? ",2016-01-19 01:57:02+00:00,cz3fwd7,2.0,t1_cz37c2m,13798.0,tennis
381,"There are two zverevs. One is playing Novak in 1r, the other fritz in q.

Edit: Not Novak, Andy.",2016-01-16 02:48:52+00:00,cz0077g,3.0,t1_cyzdh1x,34731.0,tennis
382,"Whether it was directed at Bernie or not, it's just such a tacky thing to say. It's like she's always trying to dominate everyone she's dealing with. I think she loves being a one-upper. I think that's the only kind of competition philosophy that she naturally understands. This is how she sees herself against the GOP, this is what she did against Obama, and this is how she wishes she could be positioned against Bernie, but she knows she can't really, hence all these ridiculous statements, that ""are kind of against Bernie but maybe not"". Either way, she's only competent when she can be openly competitive and aggressive (e.g., Benghazi). Otherwise she's at a loss as to what to do. She just doesn't know any other way. She's trapped in her own habitual thinking, and can't see the world differently. That's what's so annoying about her - that she always wants to one-up you, even on such trivial matters like grandchildren.

""Other people say they have extraordinary grandchildren, but I actually have one"" - well, didn't you just turn into one of those people, lol? Nope, the ridiculous logic of this statement doesn't bother her, as long as she feels that she's one-upping others. What's next? Comparing haircuts, purses and outfits?",2016-01-15 18:06:29+00:00,cyzfx6k,1.0,t3_413gpd,10466.0,SandersForPresident
