,body,created,id,nest_level,parent_id,reply_delay,subreddit
0,"This what they are talking about, polarization has led to people like you (based on your statement)  being unable understand that many Republicans legitimately have problems with Obama's ACA, race baiting, disappointing economic policy,corruption and more.   In turn many Republicans can't understand that Dems have legitimate qualms about Gerrymandering, Repub fiscal policy and their attitude toward minorities. Before the 2000s it wasn't a guarantee that Texas would go red or California blue, most states could be swing states as evidenced by Johnson, Nixon and Regan! They voted based on the candidate, not party.  Both sides can't understand each other  anymore which in turn leads to hate. And it seems to be spreading to other western democracies as well. ",2016-11-21 19:58:36+00:00,da9xz5f,4.0,t1_da9vzrj,2316.0,politics
1,Calm down it's just weed. ,2016-11-18 16:35:34+00:00,da5t8hf,2.0,t1_da5qgoz,3600.0,trees
2,And they have the nerve to attack Christians who believe in creationism. ,2016-11-17 14:30:24+00:00,da47dj9,1.0,t3_5dfbk8,10785.0,The_Donald
3,"We shouldn't boycott a company just because the ceo endorsed Hillary, we should boycott them for playing dirty like discriminating trump supporters, shoeing unacceptable bias (like news who claim to be neutral) and censoring trump supporters. ",2016-11-14 12:54:48+00:00,d9zqaru,1.0,t3_5cvphc,1272.0,The_Donald
4,"Everyone sees to forget how weak Bernie is. He surrendered and campaigned for Hillary KNOWING that he was cheated by her. He is weaker than Clinton, Trump would of wrecked him. ",2016-11-11 15:30:41+00:00,d9vwziz,3.0,t1_d9vwtjq,224.0,The_Donald
5,lol Wynne (Ontario's Premier) looks like a witch.,2016-11-10 19:00:12+00:00,d9updfd,7.0,t1_d9uoez4,1101.0,The_Donald
6,Well she was  leader of one of the most poweful countries at that time so Ceasre and Antony were like ¯\ _(ツ)_ /¯,2016-11-10 14:37:35+00:00,d9ucb0q,5.0,t1_d9ubalx,1563.0,AskReddit
7,She said it.,2016-11-09 16:44:40+00:00,d9t0hq2,2.0,t1_d9t0goh,34.0,The_Donald
8,ABC is amplifying the screams to make it sound deafening. ,2016-11-09 16:41:57+00:00,d9t0cp0,1.0,t3_5c1xd3,2028.0,The_Donald
9,"I only support Trump, rest of the Republicans are anti worker. Hopefully he can change that. ",2016-11-09 16:26:50+00:00,d9szl2c,6.0,t1_d9szb9f,325.0,ImGoingToHellForThis
10,"Republicans are gold, they control every federal branch now.",2016-11-09 16:17:00+00:00,d9sz3e8,5.0,t1_d9sy4hs,1205.0,dataisbeautiful
11,"That's all government propaganda. Unemployment is going down because many people are giving up looking for jobs, so they are no longer listed as unemployed. America can only only manage 1-2% growth with rock bottom interest rates, growth use to be 3 or more percent with much higher interest rates. And many jobs that are coming back are part time and/or low wage. ",2016-11-09 14:57:33+00:00,d9svgc3,4.0,t1_d9sum2o,1197.0,ImGoingToHellForThis
12,CONGRATS EVERYONE!!!,2016-11-09 14:42:30+00:00,d9suth3,1.0,t3_5bzw0a,21707.0,TrumpLivesMatter
13,WE MEMED HIM INTO THE WHITE HOUSE!!,2016-11-09 05:16:32+00:00,d9sb6nb,2.0,t1_d9sawp6,310.0,The_Donald
14,If they want a second civil war maybe.,2016-11-09 05:12:36+00:00,d9saz56,2.0,t1_d9saw7w,90.0,politics
15,NO BRAKES!!!,2016-11-09 05:10:26+00:00,d9sauz5,2.0,t1_d9sat9o,55.0,The_Donald
16,PENNSYLVANIA HAS FLIPPED !!!!!!!!!!!!!!!!!,2016-11-09 05:08:16+00:00,d9saqwz,1.0,t3_5by8rh,4072.0,The_Donald
17,DECLARE WISCONSIN YOU DUCKS. ,2016-11-09 05:05:17+00:00,d9salcu,1.0,t3_5by8rh,3893.0,The_Donald
18,WHY WON'T THEY CALL GEORGIA?,2016-11-09 04:17:47+00:00,d9s87ro,1.0,t3_5bxu8r,5479.0,The_Donald
19,"Probably go back to blue, Seattle hasn't been counted yet. ",2016-11-09 04:16:53+00:00,d9s8688,2.0,t1_d9s82xq,105.0,The_Donald
20,"If he looses Michigan, can he still win?",2016-11-09 04:07:27+00:00,d9s7ost,1.0,t3_5bxu8r,4859.0,The_Donald
21,Still need to win Michigan. Not over yet.,2016-11-09 03:48:55+00:00,d9s6owi,2.0,t1_d9s6o0g,29.0,The_Donald
22,Only 1% counted so far though.,2016-11-09 03:48:27+00:00,d9s6o13,2.0,t1_d9s6n6x,28.0,The_Donald
23,"GUYS IT'S NOT OVER YET, TRUMP MUST WIN MICHIGAN",2016-11-09 03:47:33+00:00,d9s6mel,1.0,t3_5bxu8r,3665.0,The_Donald
24,As a Canadian pls no.,2016-11-09 03:44:22+00:00,d9s6fxg,3.0,t1_d9s63ve,362.0,politics
25,"I'm having fun knowing that Canada has a chance of being free of NAFTA and TPP (assuming if he keeps his promise). I'm having fun watching people act like the world is crashing down now after being so sure that Trump would be crushed. TBF Trump supporters would be acting the same way if the situation reverses. Who knows, it could change by the end of the night. No matter what though, we will all be here tomorrow, and in 8 months. ",2016-11-09 03:27:52+00:00,d9s5jqp,4.0,t1_d9s54fi,474.0,politics
26,Tell your family member it's going to be okay. America is going to be great again. :) ,2016-11-09 03:18:24+00:00,d9s51j9,2.0,t1_d9s4ur9,220.0,politics
27,CNN ADMITS THE POLLSTERS MISSED WAVES OF PEOPLE. ,2016-11-09 03:07:50+00:00,d9s4hrt,1.0,t3_5bxu8r,1282.0,The_Donald
28,"Watching the stream now. Only time I'd watch CNN. 

http://www.cnn.com/2016/11/07/politics/live-election-results-coverage/index.html",2016-11-09 02:38:28+00:00,d9s31ab,3.0,t1_d9s2zws,43.0,The_Donald
29,So counties don't matter?,2016-11-09 02:37:44+00:00,d9s2zw4,3.0,t1_d9s2z9t,20.0,The_Donald
30,CNN ADMITS THAT DONALD HAS A CLEAR PATH. BTFO,2016-11-09 02:37:17+00:00,d9s2z2j,1.0,t3_5bxfqg,4121.0,The_Donald
31,"Hey I'm not American, are counties just for administration or do they count towards the electoral vote, or is just popular vote in a state?",2016-11-09 02:36:58+00:00,d9s2yg5,1.0,t3_5bxfqg,4102.0,The_Donald
32,NH HAS FLIPPED!!!!,2016-11-09 02:28:23+00:00,d9s2iui,1.0,t3_5bxfqg,3587.0,The_Donald
33,MICHIGAN AND VIRGINIA BABY!!,2016-11-09 02:10:58+00:00,d9s1nqr,2.0,t1_d9s1moo,36.0,The_Donald
34,HE'S LEADING IN MICHIGAN!!!!!!!,2016-11-09 02:10:42+00:00,d9s1n8l,1.0,t3_5bxfqg,2526.0,The_Donald
35,DEUS VULT!,2016-11-09 01:17:58+00:00,d9rz4wf,2.0,t1_d9rz3he,49.0,The_Donald
36,I imagine they are countingthe cities first. Rest of the state should be red. ,2016-11-09 01:13:04+00:00,d9rywhm,2.0,t1_d9ryuyk,55.0,The_Donald
37,Didn't everyone think that NC was the one that would flip?,2016-11-09 00:49:24+00:00,d9rxtdr,2.0,t1_d9rxsix,29.0,The_Donald
38,Exit polls.,2016-11-09 00:47:12+00:00,d9rxpea,2.0,t1_d9rxous,19.0,The_Donald
39,Let's hope it stays that way.,2016-11-09 00:46:54+00:00,d9rxovd,2.0,t1_d9rxmg7,84.0,The_Donald
40,"Don't know about commentary but I'm tracking it using gaurdian. 

https://www.theguardian.com/us-news/ng-interactive/2016/nov/08/us-election-2016-results-live-clinton-trump?view=map&amp;type=presidential",2016-11-09 00:43:57+00:00,d9rxjti,2.0,t1_d9rxc98,266.0,politics
41,Mine has trump leading Virginia. ,2016-11-09 00:38:56+00:00,d9rxb8h,2.0,t1_d9rx9h2,60.0,The_Donald
42,Is that based on exit polls?,2016-11-09 00:32:52+00:00,d9rx0zi,2.0,t1_d9rx0bq,23.0,The_Donald
43,"TRUMP IS ONLY DOWN BY 6 000 VOTES
EDIT: NEVER MIND LIKE 30 000. Still recoverable though. ",2016-11-09 00:31:56+00:00,d9rwzdj,2.0,t1_d9rwxbp,73.0,The_Donald
44,"I think it's possible, he really closed the gap in polling there. Could go either way. ",2016-11-08 23:41:54+00:00,d9rumj5,4.0,t1_d9rujll,106.0,The_Donald
45,Right now he is leading in New Hampshire too. ,2016-11-08 23:40:38+00:00,d9ruker,2.0,t1_d9rugfb,145.0,The_Donald
46,Agreed but if  Trump maintains his lead in New Hampshire that's a good indicator for other purple states. ,2016-11-08 23:39:26+00:00,d9ruigh,2.0,t1_d9rufig,107.0,The_Donald
47,https://www.theguardian.com/us-news/ng-interactive/2016/nov/08/us-election-2016-results-live-clinton-trump?view=map&amp;type=presidential,2016-11-08 23:34:55+00:00,d9rub0h,2.0,t1_d9ruali,14.0,The_Donald
48,"I'm watching the guardian.

https://www.theguardian.com/us-news/ng-interactive/2016/nov/08/us-election-2016-results-live-clinton-trump?view=map&amp;type=presidential",2016-11-08 23:34:39+00:00,d9ruaj4,2.0,t1_d9ru7bd,116.0,The_Donald
49,Me too man. First results look good though. ,2016-11-08 23:23:13+00:00,d9rtrvd,2.0,t1_d9rtoe5,125.0,The_Donald
50,Romney had 60%. Let's hope Trump gets to 80%!!,2016-11-08 23:19:56+00:00,d9rtme5,2.0,t1_d9rtifz,141.0,The_Donald
51,"IMO 2 and 5 are baseless, he wants to get rid of abortion in planned parenthood but wants to keep the rest and yes, trump wants conservative judges but has said nothing on repealing gay marriage, in fact he has been the most pro gay Repub. Point 1 has merit but he wants to replace it with something that doesn't increase in price. I disagree that the tax plans will add that much debt if Trump is able to maintain good long term growth, which I think is better than a short term stock decline. Don't know enough to comment on 4, and I totally agree with you on 6, his opposition to net neutrality is extremely disappointing. What industry do you work in?

Here is what will harm me if Hillary wins:

1. NAFTA and TPP will in my view hurt the economy long term as more jobs leave the west. I want to go into the legal field, and less people with jobs means less business for me, less money, etc.  

2. Corruption is bad for everyone, leads to bad policy, bad services etc. 

3. Hillary's interventionism and pro immigrant policies will increase terrorism and war deaths for everyone involved.  ",2016-11-07 23:04:16+00:00,d9q99pn,6.0,t1_d9pytyo,12493.0,AskTrumpSupporters
52,"Many Christians believe the bible is the literal word of god, with god speaking through many authors.",2016-11-07 16:52:48+00:00,d9pqj9n,5.0,t1_d9ppolm,1030.0,worldnews
53,Nope. Trump supporters have faced much discrimination due to Demonization by the media. We post many examples of this. ,2016-11-03 01:45:53+00:00,d9jb1vi,2.0,t1_d9j8yyq,2636.0,TrumpLivesMatter
54,Agree we don't need a tactical nuke. We'll get her through attrition. ,2016-11-02 15:47:04+00:00,d9ih4wl,2.0,t1_d9igenh,872.0,The_Donald
55,"Keefe shouldn't be over hyping it sough, if he told the truth this video would have more impact. ",2016-11-02 15:39:34+00:00,d9igr9j,4.0,t1_d9idqxg,3686.0,The_Donald
56,The Liberals voted for it too. ,2016-11-02 13:31:32+00:00,d9iaxj2,4.0,t1_d9i774t,7484.0,worldnews
57,Must of been thinking about the emails then lol. Thanks. ,2016-10-31 20:44:30+00:00,d9fw6ln,4.0,t1_d9fsk9i,4203.0,AskTrumpSupporters
58,How is it for you guys?,2016-10-31 20:42:57+00:00,d9fw3oz,1.0,t3_5aeuga,9.0,The_Donald
59,It's obvious exaggeration no ill intent. She wants to let in 650 000. ,2016-10-31 15:58:51+00:00,d9fh24s,2.0,t1_d9exd7b,43566.0,AskTrumpSupporters
60,"It ended showing them the light. 

Serious though, if you weren't here r/all was all the Donald for an hour due to known reasons.",2016-10-28 02:21:40+00:00,d9awcub,2.0,t1_d9aw865,184.0,The_Donald
61,I hope they don't use it as an excuse to get us banned. ,2016-10-28 02:09:12+00:00,d9avth5,1.0,t3_59s17k,32.0,The_Donald
62,There was a fair amount of marriage with aboriginals/first nations before 1916 though. ,2016-10-27 12:58:01+00:00,d99w2yp,5.0,t1_d99vjw3,979.0,AskReddit
63,"Personally I though it sucked not b/c it was biased but I b/c Trump and Clinton were awful to listen too, whereas Romney and Obama were good.  Maybe that's how they view the election. 
",2016-10-27 12:55:26+00:00,d99vzvy,1.0,t3_59mi8r,24637.0,AskTrumpSupporters
64,"That seems to be said at all funerals, no matter the faith. ",2016-10-23 02:02:24+00:00,d93rc6e,3.0,t1_d93qjsd,1245.0,atheism
65,His poll numbers dived because of the media pushing the sex scandals. ,2016-10-22 19:04:14+00:00,d93bm8n,7.0,t1_d92m0x9,59757.0,AskTrumpSupporters
66,In my opinion the country has gotten so divided that there will be violence no matter who wins. ,2016-10-18 01:06:39+00:00,d8wkth8,1.0,t3_580qiw,4197.0,AskTrumpSupporters
67,"All the females I know say it's a chore, *but they do it all the time.*",2016-10-15 15:35:20+00:00,d8t4ytw,3.0,t1_d8t1i6k,6303.0,AskReddit
68,Same thing essentially.,2016-10-14 01:43:39+00:00,d8r5ex2,2.0,t1_d8r5ad2,169.0,The_Donald
69,"I think it means Rest of the World. They get the institutions last and need the development to compensate, which you can only change with Common Sense. ",2016-10-13 21:15:35+00:00,d8qtk9t,3.0,t1_d8qt9vg,376.0,eu4
70,I have the same problem. Don't have the rights of man dlc so I assume this is a problem with the patch?,2016-10-12 15:37:41+00:00,d8ovzk8,1.0,t3_573k9u,15239.0,eu4
71,"You have it mixed up, Lot's daughters got him drunk so they would get pregnant, he was very upset when he found out. ",2016-10-11 14:20:07+00:00,d8nbrd7,5.0,t1_d8n9fyj,3662.0,politics
72,The heat really came down when he asked trump supporters to tell him if they were attacked for their political views. They hate it when they are exposed for their intolerance. ,2016-10-03 21:22:18+00:00,d8co5qb,2.0,t1_d8co3j8,77.0,The_Donald
73,"Also have you guys noticed that the recent attacks on Trump supporters have swept inder the rug, no mention on the MSM and no results come up on search engines. 

If you have experienced any form of discrimination, intimidation or violence because of your support with trump, share them with r/TrumpLivesMatter and of course this dom reddit! ",2016-10-03 20:06:29+00:00,d8ckk1g,1.0,t3_55pmem,204.0,The_Donald
74,"I'm anti cannabis too but you're either an ass or a pro weed troll. You can't convert people to your cause by talking down to them like that.

EDIT: Or most likely at CTR troll.  ",2016-09-27 13:40:56+00:00,d842jvv,3.0,t1_d842g4r,171.0,promos
75,He's betting that she won't.,2016-09-27 03:04:30+00:00,d83msgr,3.0,t1_d83mf5y,479.0,The_Donald
76,"I agree he could of said something about the delporables, gone after her a little more. Overall however I though it was good, I think he wants to look toned down. ",2016-09-27 02:49:03+00:00,d83m29i,2.0,t1_d83lyqr,118.0,The_Donald
77,"My fav moment. ""I will release my tax returns when you release 33k emails!""",2016-09-27 02:47:57+00:00,d83m0b5,1.0,t3_54n817,16926.0,The_Donald
78,Ya but he didn't mess up.,2016-09-27 02:41:52+00:00,d83lpl5,2.0,t1_d83lnye,52.0,The_Donald
79,"People are frustrated that Trump is pulling punches on Hillary's corruption, but remember he went after her at first, so I predict that he is trying to pace it out at the debates, keep it on policy so that people don't think he is obsessed with Clinton's flaws. ",2016-09-27 02:34:02+00:00,d83lar9,1.0,t3_54n817,16091.0,The_Donald
80,"She's talking and they are not showing it, maybe a camera screw up?",2016-09-27 02:31:58+00:00,d83l6og,2.0,t1_d83l4th,60.0,The_Donald
81,THIS IS IT LADS THE NUKE QUESTION.,2016-09-27 02:29:18+00:00,d83l1mr,1.0,t3_54n817,15807.0,The_Donald
82,"Darn right, kind of frustrating that he is pulling punches. ",2016-09-27 02:27:56+00:00,d83kz02,2.0,t1_d83kwwy,61.0,The_Donald
83,The moderator doesn't ask her to prove her claims. ,2016-09-27 02:26:13+00:00,d83kvkc,1.0,t3_54n817,15622.0,The_Donald
84,You can predict that Clinton will start every argument with a joke.,2016-09-27 02:24:29+00:00,d83ks76,1.0,t3_54n817,15518.0,The_Donald
85,DAMMIT Is it cutting out for everyone else?,2016-09-27 02:14:34+00:00,d83k80w,1.0,t3_54n817,14923.0,The_Donald
86,His linguistic rifle his aimed...,2016-09-27 02:09:57+00:00,d83jxx0,2.0,t1_d83jv9r,80.0,The_Donald
87,So?? Trump was both preparing for the debate and being president WHILE SEEING THE PEOPLE!,2016-09-27 02:00:28+00:00,d83jfju,1.0,t3_54n817,14077.0,The_Donald
88,Have you guys seen Scott Adams livestream? looks like his gf is crying. ,2016-09-27 01:42:25+00:00,d83igaa,1.0,t3_54n817,12994.0,The_Donald
89,Big league,2016-09-27 01:26:18+00:00,d83hjx8,2.0,t1_d83hill,41.0,politics
90,"#HillarysReality 

",2016-09-27 01:23:25+00:00,d83hdzy,1.0,t3_54n817,11854.0,The_Donald
91,"Just got back, are they talking about energy or jobs?",2016-09-27 01:20:52+00:00,d83h8yn,1.0,t3_54n817,11701.0,The_Donald
92,"They take turns, it's moderated. 

EDIT: Apparently I'm wrong, they are talking over each other now. ",2016-09-27 01:18:49+00:00,d83h593,2.0,t1_d83h3ty,45.0,The_Donald
93,"Doesn't work on YT, go to his website, I'm watching right now.",2016-09-27 01:05:15+00:00,d83ghg0,2.0,t1_d83ggr1,24.0,The_Donald
94,Here we go lads! ,2016-09-27 01:04:50+00:00,d83ggqp,1.0,t3_54n817,10739.0,The_Donald
95,We'll see if Trump's strategy pays off. Him not doing a mock debate worries me but TBH I doubt that. ,2016-09-27 00:33:57+00:00,d83f52o,2.0,t1_d83eb3v,1216.0,The_Donald
96,LOVE DEM TENDIES.,2016-09-27 00:30:32+00:00,d83ezwo,2.0,t1_d83ew4u,148.0,The_Donald
97,"ISIS stated that they will only attack straight whites so it doesn't get labelled a hate crime.

http://therightscoop.com/isis-commands-supporters-to-target-white-people/",2016-09-18 02:30:45+00:00,d7razgv,2.0,t1_d7rakjy,652.0,The_Donald
98,"Most Schools where I am it's early November, but some Dual JD programs have the deadline in April. ",2016-09-17 21:45:17+00:00,d7r0juu,6.0,t1_d7qzdya,1824.0,LSAT
99,"Can you still apply to law school (deadline is November) without an LSAT score?

EDIT: I am not OP.",2016-09-17 18:53:16+00:00,d7qtvmy,3.0,t1_d7qivjr,17824.0,LSAT
100,THE FUTURE DOES NOT BELONG TO THOSE WHO SLANDER THE MEME OF PEPE. ,2016-09-17 11:15:29+00:00,d7qfa8l,2.0,t1_d7q73sl,25753.0,4chan
101,BUT PEPE IS A MEME OF PEACE!,2016-09-17 02:36:00+00:00,d7q49h7,3.0,t1_d7q3rrw,896.0,The_Donald
102,WHO IS THAT RED HEAD???,2016-09-16 22:20:30+00:00,d7pva3z,7.0,t1_d7prefj,5486.0,The_Donald
103,"But white people get the most crap for being racist, even though other races are too. ",2016-09-16 01:00:31+00:00,d7ommit,7.0,t1_d7om8pm,554.0,worldnews
104,"But the Chinese benefit from western countries having stricter environmental laws, gives more incentive to move to China. ",2016-09-12 17:47:07+00:00,d7jtft5,8.0,t1_d7jrnxk,2209.0,politics
105,"I'm interested, do you have a source?",2016-09-12 01:49:30+00:00,d7j0u81,7.0,t1_d7j0bsf,732.0,politics
106,Could be medical equipment of some kind or part of her clothing. I'm betting on the equipment. ,2016-09-11 18:02:42+00:00,d7ifmcq,1.0,t3_529qug,221.0,The_Donald
107,"I'm no fan of Google b/c they are clearly shill for the left but I think the black ribbon is fine, sometimes less is more. ",2016-09-11 14:35:52+00:00,d7i6xlq,2.0,t1_d7i6nu2,501.0,The_Donald
108,They thought that Makarov was being backed by the US because most of his attacks were in Russia anyways and he wanted revenge against the governing nationalists for not giving him a place in government getting b/c he was too much of a psycho. ,2016-09-11 14:29:11+00:00,d7i6ptj,4.0,t1_d7i5jp1,2316.0,gaming
109,That's something a fascist would say. ,2016-09-10 12:55:57+00:00,d7gvqus,3.0,t1_d7gmn7j,29019.0,politics
110,Most Wanted 2012 is almost universally hated by the fanbase b/c it is nothing like the original or NFS and is even more similar to Burnout than Hot Pursuit 2010. ,2016-09-07 17:17:58+00:00,d7d0xb9,,t1_d79mjdd,,assassinscreed
111,"Not really, they both conquer. ",2016-09-03 22:19:59+00:00,d78gwd3,10.0,t1_d78gn6i,459.0,AskReddit
112,Add studying and you have mine.,2016-09-03 03:00:12+00:00,d77ls90,4.0,t1_d77lbki,909.0,funny
113,"Burkinis are nothing like a burka, you can still see the face, it's like a swimsuit.  This does nothing to help the terrorism problem. ",2016-08-24 17:48:46+00:00,d6uxc7a,2.0,t1_d6ui1au,24440.0,The_Donald
114,"No Atticus was against racism, it was the other townsfolk in the novel  who were racist, except I think for the store owner with the shotgun. ",2016-08-22 16:43:22+00:00,d6s18gk,3.0,t1_d6s0776,1343.0,The_Donald
115,r/TrumpLivesMatter ,2016-08-20 19:22:52+00:00,d6pp53v,3.0,t1_d6pcosg,20660.0,The_Donald
116,"Let's face it, the campaign has seen better days. But he can really turn it around at the first debate just like Regan did. He really needs to prep for it. 
EDIT: Also this news proves that Trump has the support of red states, contrary to what the MSM is saying. ",2016-08-17 13:19:23+00:00,d6l2ohb,2.0,t1_d6l1vnh,1433.0,The_Donald
117,It's even worse that he is a minister too. ,2016-08-16 22:17:24+00:00,d6kbuxz,6.0,t1_d6k9xgk,2683.0,TumblrInAction
118,"Remember, if the victim was a supporter of any other political; candidate, especially a Clinton one this would be national news. ",2016-08-10 12:33:24+00:00,d6bplk2,1.0,t3_4wr61c,156729.0,TrumpLivesMatter
119,Article says that it was a backpack most likely owned by a homeless man. Police blew it up because of protocol. ,2016-08-06 18:38:47+00:00,d66x62y,2.0,t1_d66x1vn,194.0,The_Donald
120,"They shouldn't pull people over with it, just park it somewhere and give the people ice cream and a chance to interact with the officers. ",2016-08-02 17:22:15+00:00,d619cml,7.0,t1_d6167ze,3839.0,nottheonion
121,1683 great year?,2016-08-01 16:43:23+00:00,d5zs1ej,7.0,t1_d5zi7wh,14749.0,The_Donald
122,If you believe that why are you a supporter?  Do you like the current Republican party?,2016-07-31 19:38:04+00:00,d5ynpso,4.0,t1_d5ygibw,10444.0,AskTrumpSupporters
123,They are not refugees at the moment. ,2016-07-31 19:01:29+00:00,d5yly8g,4.0,t1_d5yk7to,2596.0,The_Donald
124,He was atheist but preffered Islam to Christianity. ,2016-07-31 01:56:27+00:00,d5xufqf,4.0,t1_d5xncdk,12814.0,ImGoingToHellForThis
125,"A lot of the scientists were ministers, priests and Imams. [Ironically it was a catholic priest who first put forth the big bang theory in the 1930s.](http://www.realclearscience.com/lists/priests_who_were_scientists/georges_lemaitre.html)",2016-07-31 01:55:08+00:00,d5xue5y,7.0,t1_d5xsa78,3860.0,ImGoingToHellForThis
126,"The sub was never totally positive, it was always attacking someone. ",2016-07-30 20:42:32+00:00,d5xjrw3,2.0,t1_d5xa24i,15818.0,AskTrumpSupporters
127,"There is only 2 presidential debates, the GOP hat like 9. He can't afford him to pull out and I don't want him to either. I did hear the the DNC is trying to put the debates at the same time as the football game though. ",2016-07-30 20:32:56+00:00,d5xjf76,6.0,t1_d5xisnz,1020.0,AskTrumpSupporters
128,"I guess it's hard to tell the difference between a free minded supporter and a radical who loves whatever their candidate says, but I think I am a free mind supporter because I don't agree with everything says. 

Basically the most important question you should ask as a Trump supporter:

Do I agree with his vision for America and do I think he can make it so? 

I think it's a fair point o want Trump to stop being so controversial, especially now that Hillary is mired in a negative scandal of her own. ",2016-07-30 19:34:01+00:00,d5xh8wt,3.0,t1_d5xh3o3,235.0,AskTrumpSupporters
129,He said the same thing with Bernie's wife. Makes sense because his (Trump's) whole family spoke. ,2016-07-30 19:30:09+00:00,d5xh3qi,2.0,t1_d5xf0tb,3373.0,The_Donald
130,"Three theories:

1. It was an innocent remark saying that he legit wanted to hear his wife. He also stated he wanted to hear Bernie's wife speak.

2. He wants his statement to cause a media storm for anti-islam undertones, and then explain that his remark was innocent, again highlighting similar remarks to Sander's wife. This could damage the media more than Trump.

3. Could of said it to highlight the cultural issues Muslims have so it doesn't look like he is picking on an innocent/flawless demographic. 

My money's on 2, 3 is just too risky and out of character this point in the election, and undo everything Trump has done since May.  Trump has been moving away from signalling out demographic groups like this. That and republicans invited a Muslim for the opening prayers of the convention, so it would fly in the face of the, wanting to repair bridges with the Muslim community.  I don't think it's 1 because let's ace it, Trump has always known, or should now by now the impacts of his words. We'll see how it plays out., I could be wrong. ",2016-07-30 19:22:53+00:00,d5xgu2n,1.0,t3_4vdex6,1759.0,AskTrumpSupporters
131,"""What does him being the parent of a slain soldier add to the conversation? Is that supposed to make me think his opinion on politics holds more weight than anyone else? Why?"" 

Republicans, and a matter of fact many Americans have this logic. Don't agree with it but let's face it, our side is just of guilty on this. ",2016-07-30 19:02:33+00:00,d5xg3cj,3.0,t1_d5xfmyb,729.0,The_Donald
132,Yeah but for the first time I saw anti-trumpers talking about this on Facebook rather than how racist it is. It's ground breaking like that. ,2016-07-29 12:35:27+00:00,d5vsm2i,4.0,t1_d5vjksv,25730.0,AskTrumpSupporters
133,"Yes, a university professor and a few friends. The prof said that Hillary is great if you want the status quo and many people want that. She also likes her experience due to her political and professional career. It was a legit point. Obviously we don't agree. ",2016-07-29 02:59:53+00:00,d5vegeu,1.0,t3_4v4gsj,739.0,AskTrumpSupporters
134,"I agree I was disappointed, but his AMA is actually making positive headlines throughout he web. The one where he talks about rigging the system is moving a lot of leftists to trump. But yeah I wish his answers weren't the usual political stuff and he answered more of them. ",2016-07-29 02:57:57+00:00,d5vedet,2.0,t1_d5uwrfn,24948.0,AskTrumpSupporters
135,"The same reason why anti gay Muslims kill other anti gay muslims. Because they are a different religion, thus heathens/infidels. ",2016-07-29 02:50:22+00:00,d5ve1pm,3.0,t1_d5v8hyu,8164.0,AskTrumpSupporters
136,"It honestly depends. If he lost it it can be painful (despicably phantom pains) but children can be very resilient. If he was born without then he actually has it very good. Either way amputees (and people with other disabilities).  I'd say that amputees have a way higher quality of life than a paraplegic, but I can't speak or all amputees,paraplegics and people with other disabilities. ",2016-07-29 02:23:53+00:00,d5vcwou,4.0,t1_d5v9oas,4783.0,gifs
137,"No problem, it's back up for me now so maybe it is for you too.",2016-07-28 18:33:30+00:00,d5usfd3,3.0,t1_d5urzmt,532.0,The_Donald
