,body,created,id,nest_level,parent_id,reply_delay,subreddit
138,"Not just you, I can't even access twitter right now and I don't have an account. ",2016-07-28 18:22:45+00:00,d5urw64,1.0,t3_4v26b2,57.0,The_Donald
139,Archive link for legit tweets and sli img for shitposts!!,2016-07-28 17:21:41+00:00,d5uotyj,1.0,t3_4v1g71,4698.0,The_Donald
140,"Maybe they waited after the nomination to guarantee Trump Victory?
",2016-07-28 03:41:36+00:00,d5tzpx4,2.0,t1_d5tzohb,60.0,The_Donald
141,"I know the feeling man. If it makes you feel better most people who ask a question wont get them answered, there is over a 11 000 of them. ",2016-07-27 23:09:40+00:00,d5toghd,1.0,t3_4uxk4a,82.0,The_Donald
142,"BUT WE ARE **NOT** on the front page, they took us off!",2016-07-27 22:55:25+00:00,d5tnsmx,1.0,t3_4uxhw3,33.0,The_Donald
143,"screen cap this people, we must never forget!!!",2016-07-27 22:48:14+00:00,d5tng3w,3.0,t1_d5tndka,88.0,The_Donald
144,"Go into private browsing, go to reddit's front page which is the first thing you see on Reddit, it's not there. ",2016-07-27 22:47:07+00:00,d5tne4w,3.0,t1_d5tncc7,62.0,The_Donald
145,"Someone posted that Trump's AMA is nowhere on the front page, and he's right. Complete censorship.",2016-07-27 22:45:03+00:00,d5tnajl,1.0,t3_4uxg62,61.0,The_Donald
146,"You're right, it's #1 on r/all but not on the front page. 

I checked with Private Browsing.",2016-07-27 22:43:20+00:00,d5tn7ft,1.0,t3_4uxfq0,100.0,The_Donald
147,"It’s an honor Mr.Trump!  

What will your trade policy be in regards to allied, developed countries like Canada and Britain? 
",2016-07-27 22:31:19+00:00,d5tml2q,1.0,t3_4uxdbn,177.0,The_Donald
148,That's bad (for them). ,2016-07-27 17:44:36+00:00,d5t8q9d,4.0,t1_d5t8iug,244.0,The_Donald
149,How much of this vid is real?,2016-07-27 17:37:27+00:00,d5t8d5h,2.0,t1_d5t7x6s,527.0,The_Donald
150,Here is a live periscope: https://www.periscope.tv/w/1DXxyllrQDbJM,2016-07-26 01:50:33+00:00,d5qvki5,1.0,t3_4ulykh,3498.0,HillaryForPrison
151,I saw he twist from the very beginning... because Ishmael had Kiefer Sutherland's voice. I didn't know the motives though. ,2016-07-26 00:06:59+00:00,d5qqq53,1.0,t3_4ubf4g,162615.0,metalgearsolid
152,It comes from the DNC e-mails. ,2016-07-25 23:31:30+00:00,d5qp5gv,3.0,t1_d5qozou,220.0,SandersForPresident
153,"I am a Trump supporter but I have to give it to Sanders supporters, you rarely pushed the identity card and instead focused  of trade and economics and political transparency. ",2016-07-25 23:10:46+00:00,d5qo82t,2.0,t1_d5qo2tw,205.0,SandersForPresident
154,Aren't celebs supposed to be singing?,2016-07-25 22:57:42+00:00,d5qnogt,1.0,t3_4uijjh,34788.0,politics
155,"They want to eliminate ALL super-delegates, and rightly so. ",2016-07-25 21:25:24+00:00,d5qjg53,2.0,t1_d5qjd56,103.0,politics
156,I see more Trump signs than Hillary's. ,2016-07-25 21:05:18+00:00,d5qihge,1.0,t3_4uijjh,28044.0,politics
157,What are they chanting now?,2016-07-25 20:53:15+00:00,d5qhwqx,1.0,t3_4uijjh,27321.0,politics
158,"Have you guys seen the DNC? It's a wreck, the speakers can't speak because everyone is booing. ",2016-07-25 20:50:47+00:00,d5qhsbz,1.0,t3_4uka11,6790.0,The_Donald
159,Rachel Dozel,2016-07-25 20:42:29+00:00,d5qhdrv,2.0,t1_d5qh9i8,150.0,politics
160,"Thank you for doing this AMA Justin!

Trends show that since the 1970s the number of Terrorist incidents has been decreasing, and people have been saying that the spike in terrorist attacks is not a genuine increase in attacks but the result of media over reporting and social media allowing us to be notified of an attack instantly. Do you agree with this assessment?",2016-07-25 20:34:55+00:00,d5qh0s9,1.0,t3_4ukpdo,816.0,The_Donald
161,You have to double space it man. ,2016-07-25 16:11:21+00:00,d5q4eui,6.0,t1_d5pxt6z,9376.0,The_Donald
162,The mods must be on deck that night.,2016-07-25 16:02:42+00:00,d5q40hn,2.0,t1_d5q3yot,64.0,The_Donald
163,This AMA will be miles better. Okie doke?,2016-07-25 16:02:04+00:00,d5q3ze3,2.0,t1_d5q3vtg,130.0,The_Donald
164,"A lot of pro trump ads are not from his campaign but from organizations who endorse him, like the Police Organizations, NRA etc.",2016-07-25 15:06:34+00:00,d5q1gzs,5.0,t1_d5q0p56,1056.0,politics
165,Now 79% and had 5 500 points. The brigadiers are no match for our HIGH ENERGY. ,2016-07-25 15:04:21+00:00,d5q1dhy,2.0,t1_d5q18k9,185.0,The_Donald
166,Are we going to show him this?,2016-07-25 14:33:02+00:00,d5q00uy,2.0,t1_d5pyoj6,2024.0,The_Donald
167,His staff browses this sub so I imagine they will brief him. ,2016-07-25 14:32:05+00:00,d5pzzek,2.0,t1_d5pzxge,82.0,The_Donald
168,The leaks have motivated them. ,2016-07-25 03:00:58+00:00,d5pihh9,2.0,t1_d5pfmay,4483.0,The_Donald
169,"Yes he is. You can also tell by his name, Malik, which is a common name among Muslims. ",2016-07-24 13:15:17+00:00,d5ooztl,3.0,t1_d5ooo3w,865.0,The_Donald
170,"It is a shame but it doesn't excuse what the guy did, he could of made a successful example of himself. ",2016-07-24 03:02:22+00:00,d5ocemc,6.0,t1_d5o0ck3,21523.0,The_Donald
171,"It' seems like it's both, he's an German-Iranian who identified as German, and looked up to Brevik. He was upset that Turks and Kosavirs would bully him for acting German, and apparently he was receiving psychiatric care. ",2016-07-23 18:19:41+00:00,d5nujke,4.0,t1_d5ntjl3,1674.0,The_Donald
172,Trump just has to maintain course until November!!,2016-07-23 17:45:29+00:00,d5ntbhs,2.0,t1_d5nru0u,2520.0,The_Donald
173,"I stand corrected, didn't know that NY was always skewed that much against Repubs. Great news!",2016-07-23 17:44:22+00:00,d5nta1m,4.0,t1_d5md5ny,98013.0,The_Donald
174,Just like any other candidate really. ,2016-07-23 15:21:56+00:00,d5noerk,3.0,t1_d5n4fxh,51593.0,AskTrumpSupporters
175,But do they usually poll at 30%? I think a lot of this is Romney and Glenn Beck being anti-trump. I think trump will still win but only with a plurality of Utah votes. Pence definitely helps. ,2016-07-23 15:10:07+00:00,d5no1et,2.0,t1_d5nn9qe,1563.0,AskTrumpSupporters
176,I imagine BLM hates it even more.,2016-07-23 00:58:08+00:00,d5n4ayq,2.0,t1_d5n3ro5,896.0,The_Donald
177,Yeah they do. They get paid 3.50 to correct the record!!,2016-07-22 14:57:12+00:00,d5mea81,1.0,t3_4u34xn,210.0,The_Donald
178,"7 points is not a ""mere"" difference, but knowing this election  maybe it can close by November! ",2016-07-22 14:21:45+00:00,d5mcs6u,2.0,t1_d5mck9r,321.0,The_Donald
179,What were they chanting?,2016-07-22 02:56:15+00:00,d5lv3ye,1.0,t3_4tzr1i,14163.0,The_Donald
180,She got shut down fast lol. ,2016-07-22 02:46:01+00:00,d5lupbx,2.0,t1_d5lum7b,134.0,The_Donald
181,"I'm a big supporter myself but I'm dssapointed that they are all focusing on Hillary's foreign policy we get it. He needs to talk about the abuses of the left, how they assault trump supporters and how Hillary is using race to pander to votes at the price of stability and lives. ",2016-07-22 02:39:40+00:00,d5lug95,2.0,t1_d5ludgl,116.0,The_Donald
182,PLEASE TALK MORE ABOUT THE RACE BAITING. WE KNOW HER FOREIGN POLICY SUCKS. ,2016-07-22 02:35:22+00:00,d5lua46,1.0,t3_4tzr1i,12910.0,The_Donald
183,"These are Donald's positions, and Donald won't support abortion. That and she is countering the claim that he is a sexist.",2016-07-22 02:15:59+00:00,d5ltj1h,2.0,t1_d5ltfzh,132.0,The_Donald
184,I like him. ,2016-07-22 01:33:56+00:00,d5lryhq,2.0,t1_d5lrxgq,47.0,The_Donald
185,"They are tired of the speakers attacking Hillary's foregin policy, and I am too, WE GET IT. WE AGREE, WE'RE REPUBLICANS. Look, he just mentioned the bathroom issue as stupid and the crowd lit up. Now they need to talk about the race baiting and free trade and people will be excited again. ",2016-07-22 01:26:59+00:00,d5lrp2j,2.0,t1_d5lrl1e,178.0,The_Donald
186,inb4 msm and r/politics accuses him of being a failure. ,2016-07-22 01:22:17+00:00,d5lris2,1.0,t3_4tzr1i,8525.0,The_Donald
187,EMAILS ARE IMPORTANT BUT THEY NEED TO TALK ABOUT HOW SHE IS A RACE BAITER.,2016-07-22 01:09:55+00:00,d5lr2jn,1.0,t3_4tzr1i,7783.0,The_Donald
188,"r/politics is a hive mind, first they were totally pro Bernie, they were overwhelmingly anti Hillary when she was winning  and now that Trump is beating Hillary in the polls are overwhelmingly anti trump. I don't suspect that their is some manipulation though. ",2016-07-21 21:07:54+00:00,d5lhieh,1.0,t3_4tyyvd,3366.0,The_Donald
189,"No both candidates on the top are being unreasonable, the one ones on the bottom are reasonable position. ",2016-07-20 02:54:39+00:00,d5j2z76,10.0,t1_d5j2rnd,313.0,politics
190,"C'mon man I can make Clinton look bad too!

Trump: Let's go after terrorist's families.

Clinton: Let in more under the guise of refugees so they can go after your family. (yes I know not all refugees are terrorists) 

Here is a less bias example that looks at their policy:

Trump: The states should be responsible more the minimum wage.

Clinton: Federally mandated wage increase. 

",2016-07-20 02:34:39+00:00,d5j25h5,8.0,t1_d5izes3,4064.0,politics
191,You missed nothing.,2016-07-19 03:06:29+00:00,d5hp80r,2.0,t1_d5hp6k5,63.0,The_Donald
192,WHEN DO THEY START TALKING ABOUT TRADE?,2016-07-19 02:53:39+00:00,d5hoplm,1.0,t3_4ti594,10939.0,The_Donald
193,Flynn needs to let the USAs come naturally.,2016-07-19 02:48:17+00:00,d5hohu3,1.0,t3_4ti594,10617.0,The_Donald
194,OHH IT'S REDDIT'S FAVORITE GENERA!!,2016-07-19 02:40:13+00:00,d5ho69e,1.0,t3_4ti594,10133.0,The_Donald
195,What stream is this? I'm watching right side and I don't see any protestors.,2016-07-19 02:20:38+00:00,d5hndfp,2.0,t1_d5hnag7,124.0,The_Donald
196,I know I can't believe I never heard him speak before he rocks. ,2016-07-19 02:12:40+00:00,d5hn1w6,3.0,t1_d5hmwp7,218.0,The_Donald
197,"Just tuned in, did Trump speak already?",2016-07-19 02:08:09+00:00,d5hmvd8,1.0,t3_4ti594,8209.0,The_Donald
198,They have been really ramping up their propaganda ever sine he tied with Hillary in the polls. ,2016-07-18 14:21:23+00:00,d5gt8g2,2.0,t1_d5gt2f8,279.0,The_Donald
199,"Can confirm, we love being talked about. Because no one hardly does. :(",2016-07-16 00:33:33+00:00,d5e0z3v,3.0,t1_d5e0tlb,275.0,The_Donald
200,Not a failure yet but it's definitely getting bloody. ,2016-07-15 22:41:42+00:00,d5dx25u,2.0,t1_d5dx0wz,57.0,The_Donald
201,NBC says that he is fleeing to London after being denied asylum by Germany.,2016-07-15 22:37:54+00:00,d5dwx6r,2.0,t1_d5dwvw6,58.0,The_Donald
202,America already is. ,2016-07-15 20:56:44+00:00,d5dsyvw,3.0,t1_d5dsv8o,145.0,The_Donald
203,He's loosing then.,2016-07-15 20:55:25+00:00,d5dswuk,2.0,t1_d5dstwl,119.0,The_Donald
204,"I don't think it is, ISIS doesn't have too much support in the country, especially the army.",2016-07-15 20:45:25+00:00,d5dshs5,3.0,t1_d5dsfkw,92.0,The_Donald
205,A secular coup would make sense b/c the president is an Islamist but you are right it could go either way. ,2016-07-15 20:38:35+00:00,d5ds883,4.0,t1_d5ds282,237.0,The_Donald
206,Unless if it's the NYPD,2016-07-15 20:32:40+00:00,d5drz76,4.0,t1_d5drpre,375.0,The_Donald
207,"Erogdan is an Islamist so yes, if the military is indeed trying to remove him they are fighting the Muslim brotherhood, although I don't know if there is any official ties. ",2016-07-15 20:24:31+00:00,d5drmtx,4.0,t1_d5drinp,158.0,The_Donald
208,"Martial law is when the military takes over administrative control from the civilian government. Instead of getting arrested by police and tried by courts you are arrested by soldiers and tried by military tribunal. Many other civil liberties such as free speech, freedom of movement and due process are suspended. Martial law is typically used as a last resort to make sure a government/ country doesn't collapse during a disaster. Also used to quickly eliminate opposition. ",2016-07-15 20:22:20+00:00,d5drjck,2.0,t1_d5dr9hl,375.0,The_Donald
209,I thought he was delaying the announcement.,2016-07-15 15:01:53+00:00,d5dd16z,2.0,t1_d5dcw7m,191.0,The_Donald
210,Maybe be he took it down due to copyright?,2016-07-14 20:34:31+00:00,d5cfqer,1.0,t3_4svex4,537.0,The_Donald
211,He took it down :(,2016-07-14 20:33:13+00:00,d5cfo92,1.0,t3_4svex4,459.0,The_Donald
212,"At least we're not heathens,",2016-07-12 20:08:56+00:00,d59nk2y,5.0,t1_d59a4u8,16811.0,4chan
213,"Guys, [S4P is revolting](https://www.reddit.com/r/SandersForPresident/comments/4shhs2/sorry_bernie_i_love_you_but_even_with_your/). It's glorious. ",2016-07-12 16:33:19+00:00,d59d80i,2.0,t1_d59cp8x,650.0,The_Donald
214,"Many foster agencies let you determine what age you'll accept, usually the younger ones have less problems violence and more with discipline. ",2016-07-12 16:25:48+00:00,d59cuxu,5.0,t1_d59buy8,1252.0,AskReddit
215,So the rise of the American Empire?,2016-07-11 20:09:34+00:00,d58av9x,7.0,t1_d58a7us,861.0,The_Donald
216,"If they have these feelings, help them. If they act on these feelings, hang them.",2016-07-11 20:04:40+00:00,d58an8z,2.0,t1_d583d0c,9592.0,The_Donald
217,This needs a source.,2016-07-09 02:34:47+00:00,d55405j,1.0,t3_4rwygg,19621.0,The_Donald
218,BLM rioting for thugs like Brown nullify destroys any sympathy others have for the ones who were wrongly shot. ,2016-07-08 13:26:55+00:00,d547lxp,3.0,t1_d547fnd,319.0,The_Donald
219,It hasn't been confirmed it was them. ,2016-07-08 03:04:31+00:00,d53rlna,2.0,t1_d53rfmv,247.0,The_Donald
220,IT'S JUST A PRANK BRO. ,2016-07-08 03:01:14+00:00,d53rgvk,2.0,t1_d53rg4y,29.0,The_Donald
221,Sounds like it. Could be the suspect or the cops.,2016-07-08 02:56:21+00:00,d53ra19,2.0,t1_d53r8q6,58.0,The_Donald
222,Depends if they are stranger cops or your local cops. Be friendly with your local cops but treat stranger cops as you would any other stranger. ,2016-07-07 12:17:29+00:00,d52pdvz,6.0,t1_d52kxq5,13893.0,The_Donald
223,"Dude, getting circumcised as an adult is way more cruel than having it as a baby. Babies heal faster and don't remember, and they don't get erections that cause pain in the stitching. That and many adults have to be circumcised to deal with infection. ",2016-07-07 12:14:01+00:00,d52panx,11.0,t1_d52nu1r,3877.0,The_Donald
224,"It's actually operated by some one else, they just pay royalties for his name. ",2016-07-06 17:48:59+00:00,d51nnrp,2.0,t1_d51mvhx,934.0,The_Donald
225,"Hopfully this is a joke it's horrible to discriminate people based on their political views. 

That's what liberals do. ",2016-07-05 17:00:09+00:00,d507083,1.0,t3_4rcpcv,12172.0,The_Donald
226,Yeah but they didn't run for president afterwards did they?,2016-07-05 15:34:36+00:00,d502wkj,3.0,t1_d502lvp,358.0,politics
227,Egypt has been pretty good to Israel and they crack down hard on Islamists. ,2016-07-04 15:56:27+00:00,d4yvqqx,4.0,t1_d4yvf5w,452.0,The_Donald
228,"Good for them, I wish more municipal councils were like this. ",2016-07-03 20:02:42+00:00,d4xzsi2,1.0,t3_4r304r,7810.0,The_Donald
229,She is popular son social media. ,2016-07-03 20:00:39+00:00,d4xzppj,2.0,t1_d4xxa0t,3923.0,The_Donald
230,This may be an unpopular opinion but they should either remove porn from reedit or separate it from the main site. If we want it we can seek it out ourselves. ,2016-06-27 19:03:25+00:00,d4q7hfx,2.0,t1_d4q24v2,6754.0,The_Donald
231,"To be fair at the time of Luther the Catholic Church was incredibly corrupt (and they tried to kill him), they even wouldn't let you read the bible, so everything they did would be seen as self serving. You have to consider that many other Europeans agreed, before the church got it's act together half of Europe converted to Protestantism, from England to Hungary and France.  Luther probably had no contact with Muslims so he couldn't grasp the full impact of their conquest, Spain was fully under Christian control and the Ottomans weren't obsessed with converting people, unlike the Catholics who would burn you at the stake. ",2016-06-26 13:32:44+00:00,d4okyql,3.0,t1_d4odayz,26696.0,The_Donald
232,[Listening to this right now](https://www.bing.com/videos/search?q=rule+britania&amp;view=detail&amp;mid=4294D157D75830B1A5864294D157D75830B1A586&amp;FORM=VIRE),2016-06-24 02:40:07+00:00,d4lpp93,1.0,t3_4pjo9h,12114.0,The_Donald
233,They are almost done only 3 districts left. ,2016-06-24 02:37:05+00:00,d4lpkvk,2.0,t1_d4lpkb1,25.0,The_Donald
234,"Agreed, the trends in England and Wales heavily suggest a leave victory.",2016-06-24 02:35:39+00:00,d4lpivy,2.0,t1_d4lpgtd,93.0,The_Donald
235,#BRITAIN IS. (LEAVE),2016-06-24 02:31:56+00:00,d4lpduj,2.0,t1_d4lpctw,46.0,The_Donald
236,"I'm not an expert but I think they have three more to go: Southwark, Kingston-thames and Kensigtion-Chelsea. ",2016-06-24 02:30:55+00:00,d4lpchd,4.0,t1_d4lp9i1,130.0,The_Donald
237,It's possible but there is still the rest of England.,2016-06-24 02:28:25+00:00,d4lp905,2.0,t1_d4lp86e,36.0,The_Donald
238,#51.1% NO BREAKS. ,2016-06-24 02:23:42+00:00,d4lp2h4,1.0,t3_4pjo9h,11129.0,The_Donald
239,"Don't call it yet, the leave's lead shrunk to 145k. There s still hope though.",2016-06-24 02:20:36+00:00,d4loxzi,2.0,t1_d4louhp,144.0,The_Donald
240,"Plus leave is getting at least 30% support in Scotland and N.Ireland, so that's not too bad.",2016-06-24 02:14:48+00:00,d4lopj4,2.0,t1_d4lonss,73.0,The_Donald
241,#THE GAP IS WIDENING,2016-06-24 02:08:49+00:00,d4loh5d,1.0,t3_4pjo9h,10236.0,The_Donald
242,"Can we have a link, I have their results but i can't find their prediction.",2016-06-24 02:07:50+00:00,d4lofrj,2.0,t1_d4lodnb,89.0,The_Donald
243,Britain will just have to refurbish their old ships and muskets  have to take over the EU for themselves.,2016-06-24 02:06:33+00:00,d4lodxt,2.0,t1_d4loche,61.0,The_Donald
244,"This is just just victory by popular vote, right?",2016-06-24 02:05:40+00:00,d4locp2,1.0,t3_4pjo9h,10047.0,The_Donald
245,I think they'll massively vote stay.,2016-06-24 02:03:05+00:00,d4lo936,2.0,t1_d4lo83h,44.0,The_Donald
246,Ironically this time we hope the leave option wins lol.,2016-06-24 02:02:25+00:00,d4lo86w,2.0,t1_d4lo6rq,62.0,The_Donald
247,London is going to ruin it I just know it.,2016-06-24 01:57:56+00:00,d4lo1un,2.0,t1_d4lnzjr,94.0,The_Donald
248,Most threads I go to highly respect sources and many threads with false information are called out in the comments. ,2016-06-20 23:08:06+00:00,d4ha6in,5.0,t1_d4h98ga,1443.0,AskTrumpSupporters
249,HE NEEDS TO DISAVOW HIS RED PILL COMMENTS. ,2016-06-20 23:04:43+00:00,d4ha1v0,6.0,t1_d4h82gp,2979.0,AskTrumpSupporters
250,"Hillary's supporters have heard all the anti Hillary memes before. It's time to break the stereotype and arguments on bankruptcy, racism and others used against trump. Educate them on his REAL positions. Scott Adams had a great blog post about this.  We also made a sub called r/TrumpLivesMatter that gives strategies, although we mostly deal with violence and discrimination against Trump Supporters. ",2016-06-20 11:43:43+00:00,d4gim1f,1.0,t3_4oy9a1,1341.0,The_Donald
251,No he says the number 1 goal is to stop Trump.,2016-06-18 14:48:24+00:00,d4ebetz,4.0,t1_d4e0xjw,32042.0,The_Donald
252,"Thanks, added.",2016-06-17 23:02:02+00:00,d4dok35,2.0,t1_d4bjcdg,120846.0,TrumpLivesMatter
253,Good catch! Added. ,2016-06-17 23:01:54+00:00,d4dojxd,2.0,t1_d4b1ijr,162746.0,TrumpLivesMatter
254,But at the same time churches shouldn't be saying it's okay. ,2016-06-16 15:16:41+00:00,d4bo33y,4.0,t1_d4b2i21,46856.0,uncensorednews
255,"I remember that there was a lot of outrage in the commments for removing the rule. 
",2016-06-15 19:48:53+00:00,d4ambo8,6.0,t1_d4aajzu,14423.0,EnoughTrumpSpam
256,"I think he needs to explain his comments more, like with the judge. He isn't just of Mexican decent but is also part of the activist group La Raza which has a history of protecting illegal immigrants. Not being confrontational or anything I am legit curious  but what did you think about Trumps comments on the judge and the Orlando shooting?",2016-06-15 18:37:58+00:00,d4aiuo7,5.0,t1_d4ahj02,1615.0,AskTrumpSupporters
257,There is still a 5 months until the election so he still has time.,2016-06-15 18:08:06+00:00,d4ahdoz,3.0,t1_d4adc57,4944.0,AskTrumpSupporters
258,"From the article, ""As soon as we got to the window, someone inside said 'Hell no! I'm not serving them,'""",2016-06-15 17:39:49+00:00,d4afzu0,2.0,t1_d4afm78,462.0,TrumpLivesMatter
259,Damn one person says they like fatpeoplehate and hatesubs delegate us as all liking it. Who's generalizing an entire group of people now SJWs? ,2016-06-13 17:06:55+00:00,d47irrm,4.0,t1_d47fq9w,3966.0,The_Donald
260,"Trump Supporter here, it weirds me out too. I just call him Trump. ",2016-06-12 23:16:04+00:00,d46lpt5,3.0,t1_d46inip,4879.0,The_Donald
261,Looks like we are having an upvote problem again.,2016-06-12 20:49:37+00:00,d46g2yg,1.0,t3_4ns57o,554.0,The_Donald
262,Looks like we are having up vote problems again.,2016-06-12 20:49:11+00:00,d46g21y,1.0,t3_4ns57o,528.0,The_Donald
263,Looks like we are having up vote problems again.,2016-06-12 20:49:08+00:00,d46g1z0,1.0,t3_4ns57o,525.0,The_Donald
264,Coming together would be nice if Obama didn't use tragedies like these to promote gun control every damn time. ,2016-06-12 18:51:52+00:00,d46ajgz,5.0,t1_d46acrr,261.0,The_Donald
265,"Because Obama said that they didn't have any conclusions on the motives, and ten ISIS announces that they did it and a report from CNN comes out saying that the shooter called 911 saying that he pledged allegiance to ISIS. Obama probably knew what it was (how can NSA,CIA not know) but didn't say it during his speech for so he wouldn't break the DParty  Narrative. ",2016-06-12 18:38:54+00:00,d469zbr,3.0,t1_d469tyy,205.0,The_Donald
266,I swear they time the announcements just to make Obama look bad.,2016-06-12 18:26:18+00:00,d469fcw,1.0,t3_4nrj12,90.0,The_Donald
267,"B/c the problem isn't with gun ownership, it's the rise of mental illness and radical islam that cause these shootings. ",2016-06-12 18:20:16+00:00,d4695v0,2.0,t1_d4691i8,163.0,AskReddit
268,"Whether or not you agree with Milo  this clashes with Trump's message. Trump always says ""radical Islam"" or ""radical Islamic terrorism. Trump has never attacked Islam based on the Q'uran just on their frequent violent actions. ",2016-06-12 18:14:12+00:00,d468w3j,1.0,t3_4nrgax,328.0,The_Donald
269,"HE DID IT, HE SAID TERROR.",2016-06-12 18:00:17+00:00,d468ajz,1.0,t3_4nr6lj,2906.0,The_Donald
270,I think it's starting now.,2016-06-12 17:58:35+00:00,d4687xw,1.0,t3_4nr6lj,2804.0,The_Donald
271,"Damn, I just checked some other subs and you are right. We are the only talking about this. ",2016-06-12 17:33:10+00:00,d4674kl,8.0,t1_d466xf3,273.0,The_Donald
272,It' not just us the problem is site wide. I still think it's suspicious but as far as I can tell everyone's up votes are broken. Go to any defaults and the top threads are from a few hours ago. ,2016-06-12 17:27:19+00:00,d466vcw,6.0,t1_d466k7q,432.0,The_Donald
273,147,2016-06-12 17:19:38+00:00,d466jgi,3.0,t1_d463pky,3912.0,The_Donald
274,"I don't agree with the LGBT community, but they shouldn't be killed to protect muh feels. ",2016-06-12 17:18:28+00:00,d466hmr,2.0,t1_d462dfi,5819.0,The_Donald
275,"That post was great, SJWs get a taste of their own medicine. Most ""homophobes"" don't kill gays.  ",2016-06-12 17:06:59+00:00,d465zpb,8.0,t1_d465s3w,296.0,AskReddit
276,"Thanks for the clarification, given the current censorship of major subs this being censorship didn't seem far fetched. ",2016-06-12 16:52:46+00:00,d465dpx,4.0,t1_d4651yg,446.0,The_Donald
277,Is this problem affecting other subs?,2016-06-12 16:45:58+00:00,d4652y0,3.0,t1_d464r9l,440.0,The_Donald
278,"We made a sub called r/TrumpLivesMatter specifically deals with the censorship and harassment of Trump Supporters. Currently our upvotes work. 
",2016-06-12 16:31:58+00:00,d464gqc,2.0,t1_d4646xz,374.0,The_Donald
279,"This very suspicious be an accident. We made a sub called r/TrumpLivesMatter that specifically deals with the censorship and harassment of Trump Supporters. Currently our upvotes work, but who knows for how long?
",2016-06-12 16:22:07+00:00,d4641bv,2.0,t1_d463vfj,229.0,The_Donald
280,"This very suspicious  be an accident. We made a sub called r/TrumpLivesMatter that specifically deals with the censorship and harassment of Trump Supporters. Currently our upvotes work, but who know for how long? ",2016-06-12 16:20:20+00:00,d463yiu,2.0,t1_d463k2a,571.0,The_Donald
281,Fair enough.,2016-06-12 15:45:36+00:00,d462j3v,6.0,t1_d460ekc,3516.0,TrumpLivesMatter
282,"MMMM. LIBS, HOW DOES THAT MEDICINE TASTE?",2016-06-12 15:38:43+00:00,d4629of,1.0,t3_4nqp4c,624.0,The_Donald
283,So you think the violence is okay?,2016-06-12 14:45:53+00:00,d460da2,4.0,t1_d4608pt,239.0,TrumpLivesMatter
284,"At first it does but than it says, ""Passive resistance works in certain situations, but it has no impact on heartless racists. "" Since we are the ""heartless racists"" and ""goons' this flier is justifying violence against us. ",2016-06-12 14:38:31+00:00,d4604u9,2.0,t1_d45zx4v,413.0,TrumpLivesMatter
285,"There isn't a problem with that, it's just hippocracy that some applicants engage in, they tweet out religious sayings over Twitter as long as it is a minority religion. ",2016-06-12 00:04:15+00:00,d45fzt6,6.0,t1_d45dq7a,4209.0,The_Donald
286,He (and many other politicians) celebrate overtly religious holidays like Ramadan but don't celebrate the religious aspect of Christmas and Easter. ,2016-06-11 22:07:37+00:00,d45c810,4.0,t1_d45afk7,3149.0,The_Donald
287,Probably fake I've done some digging and no one else  is talking about it. ,2016-06-11 19:03:59+00:00,d455pv0,2.0,t1_d45561m,919.0,The_Donald
288,Where is this picture from?,2016-06-11 19:02:13+00:00,d455nm5,1.0,t3_4nmj1r,2683.0,The_Donald
289,"I wouldn't cast out all  Mormons after all there are a fair share of Mormon centipedes here.
",2016-06-11 18:57:36+00:00,d455hnf,2.0,t1_d454bjv,1946.0,The_Donald
290,"If it was her channel that deleted comments it would read, ""comments are disabled""",2016-06-10 16:01:48+00:00,d43rnrr,2.0,t1_d43qnfo,1377.0,The_Donald
