,body,created,id,nest_level,parent_id,reply_delay,subreddit
291,"It's probably google b/c when a channel turns off comments it says ""comments are disabled,""",2016-06-10 15:39:11+00:00,d43qny0,2.0,t1_d43l86w,8036.0,The_Donald
292,u/Orioneagle If you guys have similar stories feel free to share them with r/TrumpLivesMatter. We created this sub so that Trump supporters have a place to discuss their hardships. We would love to hear more about what happened.  Hopefully you heal up!  ,2016-06-10 13:06:58+00:00,d43kltc,2.0,t1_d43h4d6,8653.0,The_Donald
293,[Twitter directly promoted her tweet.](https://i.sli.mg/yEe8LN.png),2016-06-09 22:44:34+00:00,d42xj4l,2.0,t1_d42srrn,6871.0,The_Donald
294,Some wahabbis (ISIS sect) want it blown up as well.,2016-06-09 17:37:44+00:00,d42jr2m,4.0,t1_d42ixxi,1036.0,The_Donald
295,If you guys are interested we made a sub called r/TrumpLivesMatter that talks about the violence and hardships Trump supporters face. ,2016-06-09 16:00:27+00:00,d42f76v,2.0,t1_d428zc0,8619.0,The_Donald
296,It's a nonstop riot. ,2016-06-09 15:53:39+00:00,d42evqc,2.0,t1_d42cyky,2487.0,The_Donald
297,"That wasn't my point. The point is that the people can say that google isn't biased b/c of the algorithm, but they changed or suppressed the algorithm so that it doesn't expose people to the crooked Hillary meme, which is becoming massively popular. ",2016-06-09 13:30:21+00:00,d428qqm,4.0,t1_d428hg3,431.0,The_Donald
298,They could still censor it though like they do with Crooked Hillary.,2016-06-09 12:54:10+00:00,d427ivj,2.0,t1_d4252ei,5854.0,The_Donald
299,"This is great, I wish Canadian parties would do this. 
EDIT: Actually they could of set this up better. The categories they ask you to rank is so vague. The foreign policy section is especially atrocious. ",2016-06-08 23:02:37+00:00,d41kk8p,1.0,t3_4n76mg,9097.0,The_Donald
300,Glad the truth is being exposed. Next stop... the MSM!!,2016-06-08 12:58:16+00:00,d40sqxw,1.0,t3_4n298x,45559.0,TrumpLivesMatter
301,CROOKED HILLARY CAN NOT STOP OUR TRAIN WHICH HAS NO BREAKS AND WILL ALLOW US TO BUILD THE WALL 10 FEET TALLER. ,2016-06-08 01:56:29+00:00,d40b1hv,1.0,t3_4n2npm,255.0,The_Donald
302,Trudeau wants 700 000 to come to Canada. ,2016-06-05 21:47:27+00:00,d3xadvm,2.0,t1_d3x5kno,7512.0,The_Donald
303,"This ios a great video! Have you checked out, r/TrumpLivesMatter, it's a sub we made that specifically deals with the experience of Trump supporters like this. 
",2016-06-04 01:59:58+00:00,d3va07q,1.0,t3_4mg42x,2582.0,The_Donald
304,It's like the stereotype that Trump supporters are the typical voters who don't care about politics. My experience has showed me the opposite.  ,2016-06-03 15:24:09+00:00,d3ujvv5,2.0,t1_d3uiyad,1246.0,TrumpLivesMatter
305,If you are interested we made a sub called r/TrumpLivesMatter that specifically deals with the attacks and hardships Trump supporters face. ,2016-06-03 15:09:32+00:00,d3uj7zf,2.0,t1_d3uh14g,3042.0,The_Donald
306,F that SAND ON GUARD FOREVER!! ,2016-06-03 02:24:15+00:00,d3tyh7i,3.0,t1_d3tp0qp,15010.0,The_Donald
307,"BASED GOD, I like it (and hopefully he does to)!",2016-06-02 21:24:50+00:00,d3tmztx,2.0,t1_d3tlntm,1865.0,The_Donald
308,DARN RIGHT WE DO!,2016-06-01 21:20:54+00:00,d3s9nb6,4.0,t1_d3s6yib,3576.0,The_Donald
309,"So what's the deal with r/Mr.Trump? Aren't you a mod there to? Are we making peace?

EDIT: Glad to see you're okay!",2016-06-01 21:10:05+00:00,d3s96e8,1.0,t3_4m3k4z,202.0,The_Donald
310,Darn I'm not doing it right? I just push the numbers that correlate with the letters?,2016-06-01 20:12:00+00:00,d3s6jce,2.0,t1_d3s65o7,502.0,The_Donald
311,"The term based was actually used before r/the_donald to describe an awesome person ""BASED so and so"". Cuck comes from before here as well; and refers to a man who lets other people @#%$ his wife. On r/the_donald it is used to refer to never trump and Bernie supporters, because the never trump movement would rather see Clinton become president (thus $%^ the nation) and for Bernie supporters because Sanders let BLM protestors storm his stage during a rally. ",2016-06-01 18:48:18+00:00,d3s2nr7,2.0,t1_d3s1qut,1166.0,The_Donald
312,The want that cheap labour too.,2016-06-01 18:18:36+00:00,d3s19l5,2.0,t1_d3ron9r,17295.0,The_Donald
313,We love our BBWs!!,2016-05-26 22:54:20+00:00,d3l2v1t,1.0,t3_4l7mze,4817.0,The_Donald
314,"It was the conservative narrative, but this year the civil war  narrative has been totally flipped. ",2016-05-25 21:22:56+00:00,d3jm31m,2.0,t1_d3jlcau,1032.0,The_Donald
315,"We made a counter movement, r/TrumpLivesMatter where we expose the ""tolerant"" treatment Trump supporters and like minded right wingers get from BLM and others. ",2016-05-25 20:25:53+00:00,d3jjl10,1.0,t3_4l1n0j,679.0,The_Donald
316,"Anyone who doesn't realize the MSM's clear agenda has to brain, are foolish, those who want to keep these attacks happening are dangerous.  If you guys are interested we made a sub called r/TrumpLivesMatter that talks about the harassment Trump supporters face, offers support and more. We can show the world that centipede lives matter too!",2016-05-25 17:57:13+00:00,d3jcpr8,2.0,t1_d3j3257,12803.0,The_Donald
317,So is this what wizards do in their spare time?,2016-05-24 02:24:32+00:00,d3h88on,1.0,t3_4kreol,3372.0,gaming
318,Hope you find it helpful! Thanks! ,2016-05-24 00:19:39+00:00,d3h3cod,5.0,t1_d3h2zhw,575.0,The_Donald
319,"I don't think so since they voted against the bill. They just thought they could Trudeau look bad, and it backfired immensely. ",2016-05-24 00:17:25+00:00,d3h39jz,6.0,t1_d3gby64,38977.0,The_Donald
320,HIGH ENERGY!!!!,2016-05-24 00:16:10+00:00,d3h37w8,3.0,t1_d3h36p4,54.0,The_Donald
321,Nice! Have you considered checking out r/TrumpLivesMatter? We made this sub to specifically discuss these kinds of things. ,2016-05-24 00:09:22+00:00,d3h2yil,3.0,t1_d3h2oij,448.0,The_Donald
322,You weren't logged in when you viewed this though right?,2016-05-24 00:05:00+00:00,d3h2sob,1.0,t3_4kr19b,294.0,The_Donald
323,"Hey coupderaco, it sucks that the story you posed on r/news was banned. Did you try to re-upload it according to the sub's rules?",2016-05-24 00:01:15+00:00,d3h2nnh,1.0,t3_4kkj0g,96532.0,TrumpLivesMatter
324,"This is disgusting. No one should have their home vandalized for supporting a political candidate! 

If you guys are interested we made a sub called r/TrumpLivesMatter that specifically collects these kind of stories and offers support, strategies  on expressing your support for Trump and more. Feel free to tell us what you think. ",2016-05-23 23:56:17+00:00,d3h2h3b,1.0,t3_4kqnkc,4585.0,The_Donald
325,"Call me cynical but this is all manufactured, probably by the liberals as a distraction, hear be out. Elbow gate happened the exact same time that Trudeau is trying to amend parliamentary protocol that would give hardly any time to opposition leaders to debate a bill. Why? B/c the assisted dying bill (the same bill they were debating when that baby got elbowed) was nearly defeated in the house, when he Libs have a majority government. Trudeau wants to make sure it never happened again, in addition to muzzling the opposition he has evoked struck party discipline and is forcing all his MPs to vote for the bill. As I said, Elbowgate is just a distraction. ",2016-05-23 13:17:53+00:00,d3gbn1g,4.0,t1_d3g3luq,24914.0,The_Donald
326,"Get this, on Facebook trending they left out what organization this guy belonged to. Shocking right?",2016-05-22 22:06:16+00:00,d3fn4fz,1.0,t3_4kjv5b,12011.0,Conservative
327,[People's reaction when they Play Assassin's Creed Syndicate.] (https://imgflip.com/readImage?iid=11610377),2016-05-22 22:04:40+00:00,d3fn2l6,1.0,t3_4kkl60,2310.0,gaming
328,Don't forget that hose like to bomb us... ,2016-05-22 19:24:36+00:00,d3fhbzk,2.0,t1_d3f7ycj,15911.0,The_Donald
329,You might as well just buy a real game... ,2016-05-22 19:22:48+00:00,d3fh9ni,1.0,t3_4kgwvk,57790.0,gaming
330,"Try R/TrumpLivesMatter, we're... like not he taliban. But we have nice hair. ",2016-05-22 19:20:48+00:00,d3fh70k,1.0,t3_4kjyzt,659.0,The_Donald
331,"This is unfortunate, we shouldn't stoop to the level of SJWs. 

If you guys are interested we made a sub called r/TrumpLivesMatter that specifically collects these kind of stories and offers support, tips on expressing your support for Trump and more. Don't worry though we are not in competition with this one.",2016-05-22 19:16:11+00:00,d3fh10j,1.0,t3_4kjvk0,1648.0,The_Donald
332,This is a lot nicer than what other papers call him.,2016-05-22 17:49:54+00:00,d3fduy4,2.0,t1_d3fcngd,1960.0,The_Donald
333,All the articles I'm reading saying it's to close to call. ,2016-05-22 17:41:28+00:00,d3fdjnf,2.0,t1_d3fd1d2,826.0,The_Donald
334,"Sorry to hear that, always sucks when topics like this devolve into yelling. So...did you win?",2016-05-22 17:22:36+00:00,d3fcukr,2.0,t1_d3f7p0t,9093.0,TrumpLivesMatter
335,"I think Hillary will still win, when Cruz screws Trump in Colorado it was all over the MSM but with Bernie and Nevada you hear nothing. ",2016-05-21 22:46:03+00:00,d3eledp,1.0,t3_4kfvfa,212.0,The_Donald
336,"""You either die a hero, or live long enough to become the Villain,"" - Harvey Dent ",2016-05-21 22:42:47+00:00,d3elap2,1.0,t3_4kfuvx,239.0,The_Donald
337,"No wonder since Zuckerburg let's his opinion on everything be known, those guys are usually the least tolerant. This is proof that Trump supporters are being silenced, the only social media sites where we have a constant voice is here. 

If you guys are interested  r/TrumpLivesMatter that specifically collects these kind of stories and offers support, tips etc. to Trump supporters who are having their voice silenced. Don't worry we are not in competition with this one though. ",2016-05-21 19:45:00+00:00,d3efagt,2.0,t1_d3eeuc9,793.0,The_Donald
338,"China is growing at arapid rate though, at around 5% a year while USA is hovering around 1-2% a year. It's only a matter of time until China becomes the richest, a few years ago they were only worth 7 trillion. ",2016-05-21 14:12:49+00:00,d3e42no,4.0,t1_d3e2yhz,2642.0,The_Donald
339,What? Their stealing our narrative (Repubs would rather have a Clinton presidency.) ,2016-05-21 13:41:00+00:00,d3e3932,1.0,t3_4kdf54,3322.0,The_Donald
340,Yes.,2016-05-21 02:09:15+00:00,d3dpcfh,3.0,t1_d3dpbr3,35.0,TrumpLivesMatter
341,I'd say they are based they just had a bit of a rough patch. Double the reddit means double the trump. ,2016-05-21 02:05:40+00:00,d3dp8er,1.0,t3_4kbm10,352.0,TrumpLivesMatter
342,I'm okay with it as long as it doesn't affect our ability to get on to r/all. ,2016-05-20 23:34:27+00:00,d3dkbx3,1.0,t3_4kaybn,1585.0,TrumpLivesMatter
343,I love it!,2016-05-20 23:02:08+00:00,d3dj84p,2.0,t1_d3div29,621.0,The_Donald
344,"B/c the mods (and some devoted users) of these two subs are at war with each other, the mods at R- Mr. Trump are former mods of the Donald who were not invited back because of ideological differences, from what I've observed, the mods of r/the donald want to transform this into a more campaign oriented sub (which means less Muslim and less NSFW content) although there is still (and hopefully always) some of both, while R. Mr. Trump want to double down on offensive content(just look at their draw muhammad page, there is a lot of 18+ content there). As a result both sides are calling each other other undercover shills/cucks, but in my eyes Mr. Trump is the worst offender because they present doctored modmail conversations to slander r/ the donald mods. They even sent doctored photos to Milo in an attempt to get him to turn against r/ the donald. Theoretically both can exist and help the movement as  both have different enough approaches for there to be an overlap in subs, but at the moment both want each other gone. 

EDIT: Spelling ",2016-05-20 22:59:36+00:00,d3dj4uo,4.0,t1_d3dik13,986.0,The_Donald
345,"TRUMPS A LIAR!!!! 

I'LL NEVER BE TIRED OF WINNING!",2016-05-20 19:14:17+00:00,d3dab05,1.0,t3_4k976n,8074.0,The_Donald
346,"All politicians repeat their speeches, jut look at Hillary's and Bernie's. We are just sensitive to it because we often watch almost every speech Trump does, but most people don't. ",2016-05-20 18:48:08+00:00,d3d963x,2.0,t1_d3d92tp,121.0,The_Donald
347,FUCK YEAH STAY OUT OF OUR BATHROOMS. ,2016-05-20 18:38:04+00:00,d3d8pzw,1.0,t3_4k976n,5901.0,The_Donald
348,"Agreed, I am no fan of Hillary but I wish he'd move on. ",2016-05-20 18:35:49+00:00,d3d8mgv,2.0,t1_d3d8jzz,95.0,The_Donald
349,I love how they don't hesitate to use the word thug. ,2016-05-20 17:45:36+00:00,d3d6ft4,2.0,t1_d3d6dld,84.0,The_Donald
350,Is this r/the_Donald's official youtube channel?,2016-05-20 17:16:33+00:00,d3d55ke,1.0,t3_4k976n,1010.0,The_Donald
351,Maybe they will endorse Trump?? This is the time to do it. ,2016-05-20 17:15:54+00:00,d3d54jk,2.0,t1_d3d4la1,734.0,The_Donald
352,This one is pretty awesome though. ,2016-05-20 17:09:15+00:00,d3d4u2m,2.0,t1_d3d4nc8,256.0,The_Donald
353,"Is Trump actually alt right though, like he hasn't identified as alt right. I think Ben wanting to expand the debate to the alt right is his own attempt at smearing Trump. ",2016-05-20 17:07:38+00:00,d3d4rkf,1.0,t3_4k964q,833.0,The_Donald
354,This is glorious. ,2016-05-19 02:01:33+00:00,d3b2qvd,2.0,t1_d3b1zm7,1126.0,Mr_Trump
355,It be nice if we can surpass s4p. ,2016-05-19 01:51:19+00:00,d3b2c48,5.0,t1_d3b25xl,244.0,The_Donald
356,He did accuse that sub of censorship on twitter so it'a very possible he knows. ,2016-05-19 01:34:58+00:00,d3b1oie,2.0,t1_d3b1mhz,82.0,Mr_Trump
357,"Not meaning to put down Catholicism as well, but  Martin Luther wanted to reform the Catholic church from within, but instead of co-operating the church sent assassins, which prompted Luther to call the pope the anti Christ and seek protection from nobles. Nobles who really believed or were just power hungry that would  spread Protestantism (in it's many forms) and their empires across the world, free from the church. The following centuries would see back to back supremacy of three protestant powers (Great Britain, Germany and USA) and until the French revolution most inventions and discoveries were made in protestant countries. So maybe this drama will attract more people and weaken the donald, but make the movement as a whole more powerful due to the means of expression becoming more decentralized, if we're being optimistic. ",2016-05-19 00:07:45+00:00,d3ayal3,5.0,t1_d3axfu9,1396.0,The_Donald
358,"Found the papist! In all seriousness though I agree. I think the mods of both subs have made mistakes and/or don't want to give up power. Both need to stop flaming each other for the good of the movement, although Mr.Trump is doing most of the flaming at the moment. ",2016-05-18 23:32:27+00:00,d3awzyk,3.0,t1_d3aw14d,1556.0,The_Donald
359,We are clearly loosing subs though. Hopefully this doesn't impact the amount of times Trump reaches the front page. ,2016-05-18 23:27:26+00:00,d3awt9x,2.0,t1_d3avb18,2393.0,The_Donald
360,"I know a lot of 70 years old who look miles better than Bill. But the presidency really ages you, I wonder what trump will look like in 2024. ",2016-05-18 20:29:40+00:00,d3apdhs,2.0,t1_d3abp2g,17304.0,The_Donald
361,"I don't disagree with posting some anti-Islam things. The mods effed up and they rectified it. I agree their rule has been flawed, but guess what? A lot of people are. We need more transparency, defiantly. This not an excuse to divide the reddit community. If we are divided we can't get into r/all/. 

Now... go back to Mommy now you little shill. ( ͡° ͜ʖ ͡°)
",2016-05-18 02:43:57+00:00,d39qfzt,6.0,t1_d39q4dw,456.0,The_Donald
362,I never said that in my post. ,2016-05-18 02:32:32+00:00,d39pyn6,6.0,t1_d39px3b,60.0,The_Donald
363,"It's not cuckery to show some damn self restraint, I myself have been personally wronged by Muslims and I hate what they are doing to my community, I hate everything they get away with.  But I don't go every where IRL yelling ""FILTHY MUZZIES!"" If you get too extreme even people who agree with you walk away. The_donald is just right, we can criticize Muslims/ feminists an have great discussion, but we can't let it dominate.   You need to look calm and composed, especially in an election sub like this. You want to rag on Islam 24/7 go to an anti Islam sub, want to rag on feminism, 24/7 go to Red pill. Anti Islam/feminism is important to this sub but it's not the main focus. ",2016-05-18 02:29:25+00:00,d39ptwq,4.0,t1_d39pal2,733.0,The_Donald
364,"Alroni, I think the Mr.Trump sub-reddit is well intentioned but misguided. I know you guys are concerned about the censorship but we need to start to appear less radical if we really want Trump to win the election. Although I agree that Islam and feminism are a scourge on the west  posts related to them were hijacking this sub. We are a pro-donald sub. I just wish the mods would come out and say this. ",2016-05-18 02:08:35+00:00,d39ox7n,2.0,t1_d39onyb,362.0,The_Donald
365,Whoever gets the popular vote just gets bragging rights.,2016-05-18 01:38:52+00:00,d39nl20,2.0,t1_d39ni7a,105.0,SandersForPresident
366,"If we can't re unify there needs to be a peace treaty where the different Donald subs recognize each other and their different methods in promoting Trump's campaign. A house divided shall not Stand. 
Edit: And for the record limiting Muslim discussion was a good call in my opinion, we have to stay the track of getting Trump elected. ",2016-05-18 01:31:36+00:00,d39n93f,5.0,t1_d39ikj8,6237.0,The_Donald
367,We were played. A least Donald did a good job.,2016-05-18 01:00:42+00:00,d39ltwj,1.0,t3_4jts6h,5326.0,The_Donald
368,He just pulled ahead by around 100. ,2016-05-18 00:58:17+00:00,d39lq12,2.0,t1_d39lme4,129.0,The_Donald
369,AWESOME! Now all we need is Ron...,2016-05-18 00:54:44+00:00,d39lk3c,1.0,t3_4ju48s,140.0,The_Donald
370,I love it when successful people don't forget where they started. ,2016-05-18 00:53:43+00:00,d39lic9,2.0,t1_d39le8j,151.0,The_Donald
371,"Okay so it's like how the Dems are counting the Nevada votes right now? That makes sense, thanks.",2016-05-18 00:49:45+00:00,d39lbz0,3.0,t1_d39l9ig,92.0,The_Donald
372,"kek &lt;--- 

kek

kek

kek",2016-05-18 00:48:23+00:00,d39l9t3,3.0,t1_d39l5ul,145.0,The_Donald
373,What do you guys think of the Kentucky Caucus? It was Really close with Trump getting 17 delegates and Cruz getting 15. ,2016-05-18 00:46:55+00:00,d39l7d8,1.0,t3_4jts6h,4499.0,The_Donald
374,"Everyone switches the channel, not just Trump supporters. Even LGBT ""allies"" don't give a shit when their trans/LGBT acrivist buddies aren't around. ",2016-05-18 00:43:12+00:00,d39l1ay,2.0,t1_d39knob,487.0,The_Donald
375,"The silent majority think Trans people are mentally insane, us being enraged will prove that. ",2016-05-18 00:36:17+00:00,d39kps9,2.0,t1_d39ki51,274.0,The_Donald
376,It's fox too I thought they weren't into this.,2016-05-18 00:34:42+00:00,d39kn1x,2.0,t1_d39kldx,63.0,The_Donald
377,SERIOUSLY THEY PUT A TRANNY BETWEEN TRUMP SEGMENTS? F-- Fox!,2016-05-18 00:28:08+00:00,d39kboy,2.0,t1_d39k4p3,233.0,The_Donald
378,"I liked it, but I can understand why people would be disappointed. She asked tough questions and Trump answered them well. Could of been a lot longer. ",2016-05-18 00:25:47+00:00,d39k7e8,2.0,t1_d39k40b,114.0,The_Donald
379,"Great interview. 
And Damn that Tranny is ugly.",2016-05-18 00:24:22+00:00,d39k4xo,1.0,t3_4jts6h,3146.0,The_Donald
380,"I think it's time that the Trump Campaign make their own subreddit or take control of this one, that way it makes it harder for us to be infiltrated or intimidated by Admins. ",2016-05-17 23:39:54+00:00,d39i9bn,6.0,t1_d39g3la,3179.0,The_Donald
381,"Trumirium, I am neutral on the feuds between these two great subs, but I think that this strife is being created on purpose by outside forces to disrupt Donald's online presence. This is very worrying to me, we need to unite!!",2016-05-17 23:37:12+00:00,d39i5es,2.0,t1_d39fjmk,3825.0,Mr_Trump
382,Ever since Milo tweeted that our sub numbers have been falling.,2016-05-17 23:29:29+00:00,d39hu6i,1.0,t3_4jth2v,4226.0,The_Donald
383,That and the stuff he said on other subs would probably destroy his life id connected to his real identity. Aa far as I know Trump gal doesn't have this problem. ,2016-05-15 21:42:02+00:00,d36r9zg,3.0,t1_d36r323,305.0,The_Donald
384,"Disagree, the only users who know what mod is the best are the other mods. That and having more open discussion is an open invitation for subversion",2016-05-15 21:36:14+00:00,d36r24o,3.0,t1_d36qyba,168.0,The_Donald
385,Hopefully it wasn't because of some over zealous centipedes upset about the rule change. :( ,2016-05-15 21:14:49+00:00,d36q92u,3.0,t1_d36q408,223.0,The_Donald
386,"But Jesus also wrecked a temple when it was being used for sinful purposes and called the  Pharisees and Saudecees (those who were corrupting God's word) Vipers and Snakes. Sometimes you have to be tough to get stuff done, and God knows this better than anyone. ",2016-05-15 18:26:59+00:00,d36k44r,3.0,t1_d36jb9a,1325.0,The_Donald
387,Actually Bacha Bazi came from before Islam. The Taliban is actually kind of popular in some villages there because they execute anyone practicing it.,2016-05-15 16:03:03+00:00,d36f0m8,4.0,t1_d36dnbi,2219.0,The_Donald
388,"This hits too close to home. :( 
I guess it's time for a change.",2016-05-15 15:59:17+00:00,d36evl4,1.0,t3_4jezwz,34487.0,The_Donald
389,Trudeau only got 39% of the vote with Harper getting 31% and Mulcair 19%. So we're not all cucked. ,2016-05-14 01:25:19+00:00,d34shzx,3.0,t1_d34ka8q,14201.0,The_Donald
390,"He slaps me and sends me to vote for Hillary, I am crying now.",2016-05-14 01:07:47+00:00,d34rx3l,5.0,t1_d34pi1h,4296.0,The_Donald
391,Dude no we have to make Canada great again.,2016-05-13 15:45:06+00:00,d345amt,6.0,t1_d340k4k,6711.0,The_Donald
392,This is not 4chan's proudest moment... ,2016-05-13 15:36:39+00:00,d344wpf,4.0,t1_d33z4ir,8622.0,The_Donald
393,"What, so the democrat party can run unopposed? We have to keep the republicans together now. If we want a multi party system both parties need to break up or loose members to a third party that can attract both. ",2016-05-13 02:15:37+00:00,d33j58n,3.0,t1_d33ibso,1281.0,The_Donald
394,"lol of course Rand Paul would win on reddit. Then again, that's who I voted for too!


To all the Web people: Doing that would split the repub party beyond measure. ",2016-05-12 20:59:25+00:00,d336y35,1.0,t3_4j2td0,308.0,The_Donald
395,"Those who profess to be Muslim CAN and are often be very strict and Orthodox, but for example look at the Muslims of Central Asia who were formerly under Russian control. Their brand of Islam is heavily influenced by Tengrism and local traditions, thus not 100% based on the Quran. The central Asian countries like Kazakhstan, Uzbekistan do not have the terrorism that other Muslims have. Although sadly, [this starting to change] (http://thedailyjournalist.com/theinvestigative/the-islamic-situation-in-kazakhstan/). ",2016-05-12 15:27:46+00:00,d32rr2t,7.0,t1_d32rblq,562.0,The_Donald
396,TIFFANY??,2016-05-12 14:53:02+00:00,d32q7q7,2.0,t1_d32n56c,4560.0,The_Donald
397,You forgot to add Justin Trudeau. ,2016-05-12 14:52:23+00:00,d32q6py,2.0,t1_d32ot8l,1965.0,The_Donald
398,"Pinning down what Muslims ""actually""  believe is very difficult because it can be quite diverse depending on their culture, surroundings, economics etc, much like members of the Christian faith. The point is that a Muslim who follows the Qur'an 100% is a threat to society, as they must follow the feel good stuff in the Quran along with it's demands to spread the faith no matter what, which includes instructions for violence that are infinitely more explicit than that of the old testament. ",2016-05-12 14:43:17+00:00,d32pspc,5.0,t1_d32orcb,1497.0,The_Donald
399,"Not a lot changes in game development in 5 months, this is most likely the final design, sadly",2016-05-11 21:29:21+00:00,d31v770,2.0,t1_d31k77u,13862.0,civ
400,That around half of them. ,2016-05-10 21:22:25+00:00,d30h57l,1.0,t3_4iqbc9,14348.0,The_Donald
401,It's time the mods crack down on posts with false information. ,2016-05-10 18:13:39+00:00,d3083vz,3.0,t1_d2zxr2d,13693.0,The_Donald
402,Or just use ad block. ,2016-05-09 16:42:17+00:00,d2yrfuy,2.0,t1_d2ykdk7,10491.0,The_Donald
403,"I'm surprised you are attacking him on this and not the bridge scandal. Who the heck takes a laser pointer outside? You can blind people easily, especially people in aircraft. ",2016-05-09 16:38:48+00:00,d2yraeg,6.0,t1_d2ypiw8,2435.0,The_Donald
404,"Tbh this looks more sci Fi, WW1 soldiers didn't care maces or capes. ",2016-05-06 18:22:55+00:00,d2vfy68,1.0,t3_4i5av0,14281.0,Battlefield
405,"The west hadn't achieved maximum glory yet. 

Oh and they were allied with Britain when they stopped taking over European countries. ",2016-05-06 18:21:02+00:00,d2vfv42,2.0,t1_d2va51u,7613.0,The_Donald
406,"Not theologically but many conservative Catholics (espically Hispanic and African Catholics),etc.  see many social issues the way Evangelic would. Hispanics however tend not to vote Repub. at the moment.  ",2016-05-05 21:04:20+00:00,d2ubf1z,10.0,t1_d2u80md,4438.0,The_Donald
407,"But that still wouldn't make up for the loss in evangelical voters which studies say make up around 25% of the population, and this doesn't include Catholics and mainline protestants, Mormons etc. who share their views. Republicans can't afford to anger them  because let's face it; Socialists and (many) progressives will never vote Republican.
",2016-05-05 19:08:11+00:00,d2u62t0,8.0,t1_d2u5ho6,774.0,The_Donald
408,They could just stay home though.,2016-05-05 18:51:35+00:00,d2u5bkd,6.0,t1_d2u3oy8,2131.0,The_Donald
409,"When you constantly use hyperbole such as calling Donald Trump a joke it's only natural that his supporters will start referring to his opposition as jokes as well. And no, we are serious in our support. :) ",2016-05-05 18:41:32+00:00,d2u4uys,4.0,t1_d2u3xnm,1217.0,The_Donald
