,body,created,id,nest_level,parent_id,reply_delay,subreddit
410,my gosh the president's only argument is that China screws over the states more lol. ,2016-05-05 00:43:23+00:00,d2t7f56,1.0,t3_4hx718,5605.0,The_Donald
411,"Call me nuts but I think Bernie still has a serious chance, we need keep the pressure on him as well, as I think Bernie will be harder to beat. ",2016-05-04 01:41:28+00:00,d2rv7h6,1.0,t3_4hs8lg,312.0,The_Donald
412,"I can't believe it, now I'm just waiting for him to say it. ",2016-05-04 00:37:21+00:00,d2rsbsm,1.0,t3_4hrxch,145.0,The_Donald
413,"I doubt about NY, the turnout for the dem primaries was far larger than the GOPs. The other states can be switched though. ",2016-05-03 19:04:31+00:00,d2rdmcq,4.0,t1_d2r7ieh,7889.0,The_Donald
414,"lol I love Turkey's face, they are Muslim , yet in the past they tried to be the most pro woman. ",2016-05-02 14:39:23+00:00,d2po1au,1.0,t3_4hgq2z,8737.0,The_Donald
415,"They are looking at all the candidate reedits, which I think is great it's a good way to increase political participation, today is our day on hat reddit. It's good exposure. ",2016-05-02 14:35:32+00:00,d2pnvx2,2.0,t1_d2pmycm,1474.0,The_Donald
416,"That's because they changed the requirements though, as far as I can tell they changed the index to include GDP per capita, which skews it in favour of countries who have a larger number of billionaires i.e. USA. ",2016-04-30 20:22:57+00:00,d2no94v,5.0,t1_d2ngdm9,13012.0,The_Donald
417,"So let me get this ,straight, she's actually a mod here?",2016-04-30 16:22:24+00:00,d2nfiuj,3.0,t1_d2nbext,7705.0,The_Donald
