,body,created,id,nest_level,parent_id,reply_delay,subreddit
0,Same issue on XBOX One. Started 5 minutes ago.,2016-09-14 02:07:16+00:00,d7lvvbu,1,t3_52o9uo,364,RocketLeague
1,"Alternatively, if Cousins entered free agency, he could have been the top paid QB around Oswiler's area, and Oswiler would have been given less.",2016-06-08 18:52:07+00:00,d419bhq,1,t3_4n6le3,816,nfl
2,"Eh. Funny at times, but overall felt like 22 minutes of set-up without a punchline. Big step down from ""The Greatest Event"" series.",2016-04-10 22:05:30+00:00,d1xqvdc,1,t3_4e7g93,5614,television
3,"A ""Night at the Museum"" style film, based in Disneyland, staring Mickey (among other Disney characters) is slowly in the works, to be directed by Jon Favreau (Iron Man). Film will be called ""Magic Kingdom"".",2016-04-10 15:12:50+00:00,d1xbecu,1,t3_4e5ffb,15052,movies
4,See a doctor.,2016-04-10 05:32:23+00:00,d1x0cr6,1,t3_4e4qvq,73,AskReddit
5,Time to conclude the journey we started 6 years ago...,2016-03-26 16:08:50+00:00,d1e9byj,1,t3_4c1omu,520,anime
6,"I find it funny that the article's location is Boca Raton, Florida, where New Yorkers go to retire.",2016-03-21 13:38:35+00:00,d17t2dv,1,t3_4bc89n,878,nfl
7,I think bobybushia is implying that Tom has gone senile.,2016-03-21 13:36:48+00:00,d17t0ds,3,t1_d17ss0c,471,nfl
8,"I presume ""Viva Pinata"" took place in 2008 when it came out, and it was just as real as MW2 will be.",2016-03-06 22:55:02+00:00,d0q2sox,1,t3_498in0,15587,gaming
9,"I freaked out seeing the words ""Dolphins"" and ""Ireland"" in the same title.

Ireland is one of my trigger words.",2016-03-03 04:08:05+00:00,d0ln50t,1,t3_48p775,14085,nfl
10,We did it Reddit!,2016-02-18 01:02:42+00:00,d03xjbr,4,t1_d03x9sy,431,10cloverfieldlane
11,What went down today? Please excuse my obliviousness.,2016-02-18 00:52:57+00:00,d03x6gz,2,t1_d03wl2e,965,10cloverfieldlane
12,The cannon is done. The fannon lives on.,2016-02-16 04:05:46+00:00,d01izez,1,t3_460o93,252,gravityfalls
13,"Psycho-Pass has always impressed me with it's fluid animation and cyberpunk visuals. Additionally, it has one of the finest English dubs ever produced.",2016-02-03 23:42:53+00:00,czmx15e,1,t3_4413b3,19310,anime
14,"Man of Stealing: Superhero uses his powers to pull off the ultimate heist. (Yes I cheated a little, sue me)",2016-01-19 15:24:19+00:00,cz3z6ip,1,t3_41ntws,21789,AskReddit
15,The Thin Blue Lining: Horrowing tale of jean sowers in Asia.,2016-01-19 15:22:59+00:00,cz3z55z,1,t3_41ntws,21709,AskReddit
16,Are they sharing Inglewood with the Rams? The NFL Mods and Kroenke are too much ego for a single staduim to handle.,2016-01-12 23:07:48+00:00,cyvxfl8,1,t3_40p03r,66,nfl
17,"Like I need another reason after ""Battlefront"" to hate EA...",2016-01-11 23:03:51+00:00,cyum0l4,1,t3_40hhot,23761,CFB
18,"Ill never forget when Vandervoort killed the whiny brat on ""V"" a couple years back.",2016-01-11 22:55:12+00:00,cyuloaz,1,t3_40jdqo,459,television
19,That's a South Park worthy name.,2016-01-11 17:09:30+00:00,cyu71x1,1,t3_40hj6x,1974,television
20,I remember Bryan Fuller wanted Bowie for Hannibal. Who wouldn't want David Bowie in anything though...,2016-01-11 17:06:00+00:00,cyu6wvp,1,t3_40fti6,32478,television
21,"It's not that he made Cutler look good, he coordinated Cutler's best season in his entire career. Same with Peyton Manning. And he coached Tim fucking Tebow to an 8-8 record.

Our interim HC and OC this year didn't even get the best of Tanny, who regressed a bit from last season.

So your wondering why I'm excited about bringing in a coach who has been known to max the potential of QBs who play for him?",2016-01-09 17:08:28+00:00,cyrwrn1,5,t1_cyrwdq8,678,miamidolphins
22,"Hallelujah.

Gase just coordinated Cutler's best statistical season. In Denver he coordinated Peyton's best statistical season. He QB coached Tim Fucking Tebow to an 8-8 record. He's learned from Nick Saban, John Fox, and several other successful coaches. Considered to be one of the brightest young offensive minds in the game and is praised from all corners of the NFL as such. Has shown ability to adapt his coaching style and schemes to personnel.

I was shocked he didn't get a HC gig last year, and was my #1 HC candidate this cycle.

Hallelujah.
",2016-01-09 16:51:26+00:00,cyrw6v1,1,t3_406wuk,962,nfl
23,"For what it's worth, he also gave Cutler his best season ever (statistically, not opinionated).",2016-01-09 16:49:20+00:00,cyrw4bt,3,t1_cyrw0cz,206,miamidolphins
24,And still nothing on Person of Interest... Starting to expect a summer burn off run.,2016-01-09 03:56:18+00:00,cyrgp22,1,t3_402fme,32901,TelevisionRatings
25,"Huh, never thought about it like that. Thanks!",2016-01-08 23:05:47+00:00,cyr753y,5,t1_cyr6w1k,406,nfl
26,"As someone not too familiar with the role of an ST coordinator (outside of of special teams plays of course), how does being one make you more like an HC than being a coordinator?",2016-01-08 22:57:59+00:00,cyr6umf,3,t1_cyr6jzg,463,nfl
27,"$20 bucks says it starts the week after ""It's Always Sunny"" concludes this season, which would be 11 weeks from now.",2016-01-07 14:03:25+00:00,cypb1py,1,t3_3zu2fp,30737,television
28,His lackluster output this weekend cost me a Fantasy Football championship.,2016-01-05 16:21:16+00:00,cymvnnf,1,t3_3zkpxx,1539,nfl
29,Do you have anything actually constructive?,2016-01-01 23:40:59+00:00,cyiqqu6,2,t1_cyiqhr3,472,youtubers
30,"First piece of advice, find someone else to bounce off of with commentary. You have a good quick talk style, with a nice radio inflection. You seem like a conversationalist, so have a conversation. I think you could benefit from having another opinion to play off of.

Second, I like your use of unconventional color changes, flipping the video around to come around more comedic. Adds a nice flavor.

I'd move the microphone down closer to where you're sitting, it looks weird in the top right corner of the screen, leaving empty space below.

Finally, pick a game to commentate over that isn't already overexposed. Tap into a loyal fanbase of a smaller game, grow from there. Be the big fish in the small pond, not the small fish in the big pond, at least to start.",2016-01-01 23:13:34+00:00,cyipuiq,1,t3_3z1nst,14311,youtubers
31,"First question that needs to be answered on a channel's first impression: What makes this channel unique, unlike anything else on YouTube.

I can't tell here. Your latest video is a couple British people talking over Counter Strike. That's all over the internet. It's not new. Next video down is Black Ops III. Again, nothing unique. Find a niche game to start with, tap into that game's fanbase. Also, you can cut down the video lengths in half, keep the best material and cut the fat.

Otherwise, the presentation itself (graphics, transitions) are good.",2016-01-01 23:08:01+00:00,cyipnub,1,t3_3z1lvb,14865,youtubers
32,♫ I did not take H.G.H. ♫,2015-12-28 05:15:24+00:00,cydiugb,1,t3_3yglal,16242,nfl
33,dey took er jerbs,2015-12-24 18:10:03+00:00,cya7swy,5,t1_cya67o2,2900,nfl
34,http://imgur.com/Yyx3cfQ,2015-12-22 21:46:24+00:00,cy88m7p,2,t1_cy87gvc,1721,humansvszombies
35,huh...,2015-12-19 00:25:52+00:00,cy407pw,1,t3_3xebai,8230,boxoffice
36,So this is the film I've been hearing about lately that's been smashing advance ticket records left and right...,2015-12-16 15:31:53+00:00,cy129a5,1,t3_3x2upd,5735,anime
37,My favorite of that gag was when Buster rolled his eyes as well.,2015-12-16 14:36:06+00:00,cy10dx3,3,t1_cy0vsfw,13347,television
38,"Only reality show I want from NBC is ""The Maya Rudolph Show"" they tested 2 years ago. Now THAT had potential.",2015-12-16 14:34:13+00:00,cy10buh,1,t3_3x0fly,51935,television
39,How have I not seen this yet...,2015-12-16 14:31:37+00:00,cy108z9,2,t1_cy0x1mt,8160,DaftPunk
40,Gorgeous in the most haunting fashion.,2015-12-16 14:30:34+00:00,cy107sx,1,t3_3x0cw7,52867,HannibalTV
41,USF made it to the second round!!!,2015-12-16 14:30:09+00:00,cy107cw,1,t3_3wzlfr,63502,CFB
42,Is that Bob from Bob's Burgers?,2015-12-16 14:28:53+00:00,cy105zf,1,t3_3slrvp,2900474,ads
43,"This speaks to how great the first two Bioshocks were, that even now years later, it's art deco scheme and color palate are nearly instantly recognizable. The art direction in those games are some of the best in the history of gaming.",2015-12-16 14:27:54+00:00,cy104w7,1,t3_3x0xhl,43713,gaming
44,"I was never excited for this show, a more kiddie version of Robot Chicken set in the Star Wars universe with wonky animation. I thought Seth Green had better things to do. Not crying over this not making it to air.",2015-12-16 14:25:54+00:00,cy102nu,1,t3_3wyacq,81014,television
45,"Gotham, in the ""so bad it's good"" kind of way.",2015-12-16 14:23:03+00:00,cy0zzjn,1,t3_3x0cah,52673,television
46,"Makes sense. Many shows like this, True Detective, Nathan For You, the more creatively ambitious shows are taking a year + to make new seasons, taking their time for quality.",2015-12-16 14:22:22+00:00,cy0zyt1,1,t3_3wz1iu,70447,television
47,"Not knowing there was a commercial debuting on the debate, I was shocked by how accurate of a send up it was.",2015-12-16 14:21:38+00:00,cy0zy0q,1,t3_3x12n6,41021,television
48,One of the best parts of GF was how the show's visionary and core cast were all so familial. You rarely see that on television these days. It just boosts creativity and energy all around when the entire team clicks like that.,2015-12-11 15:05:54+00:00,cxvd2qc,1,t3_3wazwb,51377,gravityfalls
49,Madden 16's Super Bowl prediction is one step closer to coming true!,2015-12-11 15:02:18+00:00,cxvcyd4,1,t3_3wbv7j,38212,nfl
50,One player is relatively young and on the uprise. The other just had a potentially career ending injury in his 30s. Not even close.,2015-12-11 14:58:21+00:00,cxvctk9,1,t3_3wafx3,58659,miamidolphins
51,"Very quick turnaround from a month ago when he was watching game footage from his college days to ""remember when he was good"".",2015-12-11 14:56:57+00:00,cxvcrtv,1,t3_3waujl,52924,miamidolphins
52,Absolutely. Make him HC of the Pats. Now. Forever. Re-balance the playing field.,2015-12-11 14:56:25+00:00,cxvcr6d,1,t3_3wdmkc,2288,nfl
53,"Ill be honest, I was surprised when Jon went back to TDS first to bring attention to Zadroga before Colbert.",2015-12-11 14:53:21+00:00,cxvcnmg,1,t3_3wcv7o,17804,television
54,"Musical genius behind ""The Book of Mormon"" and ""Avenue Q"" involved? Sure, why not!",2015-12-11 14:51:13+00:00,cxvcl4a,1,t3_3wd4mx,11850,television
55,Very curious how Magneto fits into this... I have a feeling Fassbender gets limited screentime.,2015-12-11 14:49:28+00:00,cxvcj26,1,t3_3wdk73,2946,movies
56,"She already booked a new Showtime gig. ""Roadies"". It was picked up in October, so filming should be in the Spring, same time as Wayward Pines.",2015-12-11 03:05:48+00:00,cxux35q,7,t1_cxuww8i,306,television
57,"I'm sure you'll see a couple old characters return in supporting roles, like with Heroes Reborn, but for the most part expect new leading characters. Half the cast has already moved on to other projects, and none are contractually obligated to return.

The press release already announced a new main character, saying ""a new arrival"" leads the show. Also, there's a new showrunner who will likely bring in his own writers room.

It will be a soft reboot, not a total reboot, but for the most part it's a new set of characters taking the focus.",2015-12-11 02:56:27+00:00,cxuwqrx,5,t1_cxuw95u,812,television
58,"Yes I do.

""Because of the long time frame between the project’s pickup/production and its airdate, the options on all actors had lapsed long ago. (Wayward Pines’ Season 1 cast included Matt Dillon, Carla Gugino and Melissa Leo.) The idea was to explore a potential second installment with different characters and cast but in the same world""

http://deadline.com/2015/12/m-night-shyamalan-wayward-pines-renewed-season-2-fox-new-showrunner-1201663497/

",2015-12-11 02:26:48+00:00,cxuvn13,3,t1_cxuvbb8,493,television
59,"Show will likely reboot, with entirely new set of characters. All of the cast contracts expired over the summer.",2015-12-10 22:15:47+00:00,cxumhak,1,t3_3w96d8,14641,television
60,"Futurama already had it's resurrection. Twice actually. I'm sure it will return in some form down the road, the creators aren't in a rush. It's easier to revive animated shows later than live action.",2015-12-10 22:14:45+00:00,cxumfro,1,t3_3w9dc3,12152,television
61,"No. And for the record, watching season 1 isn't a per-requisite to watching season 2. They are intertwined, but exist independently.",2015-12-10 22:13:29+00:00,cxumdy5,1,t3_3w9v3i,5845,television
62,Nathan just making sure all his bases are covered.,2015-12-10 22:12:33+00:00,cxumcj3,2,t1_cxukcmw,2867,television
63,"I enjoyed this season, I love the continuity. I thought the sci-fi plot of the final three episodes was nice, especially the riff on Ex Machina, but the show struggled at the finish line, just like last year. The second episode, ""Where My Country Gone"", was the best episode of the season.",2015-12-10 22:12:11+00:00,cxumc09,1,t3_3wa9j0,622,television
64,Spread the word.,2015-12-10 19:35:29+00:00,cxufn90,3,t1_cxufe11,358,television
65,Ah yes... The Claw of Shame.,2015-12-10 19:20:45+00:00,cxuf0f8,3,t1_cxuez1l,54,television
66,If anyone needs convincing to check out this magnificent show..... Hopefully this will give you the motivation: https://www.youtube.com/watch?v=iXbE2GACAMw,2015-12-10 17:41:20+00:00,cxuar57,1,t3_3w8kse,5914,television
67,I made a video for this very purpose: https://www.youtube.com/watch?v=iXbE2GACAMw,2015-12-10 17:36:41+00:00,cxuak2b,5,t1_cxua1gv,730,television
68,Yep. Glad you enjoyed it!,2015-12-10 17:06:23+00:00,cxu99uu,2,t1_cxu6bho,4232,television
69,Best comedy on TV. Not just a parody of business shows. It's a study of human nature. A character piece on loneliness. A showcase of conceptual art. A send up of the media. It's.... Nathan For You.,2015-12-10 16:14:06+00:00,cxu72gl,1,t3_3w8kse,680,television
70,"If you're looking for people, I've got a somewhat deep voice, and have done sports radio broadcasting for a few years on my college campus. I do a NFL and CFB panel show weekly now.",2015-12-10 15:32:59+00:00,cxu5f8q,4,t1_cxu1d2i,8010,nfl
71,"Not me, not my intention with this post lol",2015-12-06 20:28:33+00:00,cxpfeat,4,t1_cxp929m,9421,NASCAR
72,Now that you mention it.... yeah.,2015-12-06 20:28:13+00:00,cxpfdsl,2,t1_cxpd2go,3353,NASCAR
73,I'm not surprised. I just found his reaction very funny.,2015-12-06 17:46:52+00:00,cxp8w8u,2,t1_cxp8tj3,132,NASCAR
74,"Awesome! Finally! Brad did a dump of 5ish tracks tonight.

With this out, my most anticipated track to be released becomes the final 3 minutes of D&amp;MvTF. Hopefully we get that one sooner than later...",2015-12-04 00:58:25+00:00,cxmcpav,1,t3_3vcki5,3160,gravityfalls
75,Don't Hassel The Beck.,2015-12-02 23:28:16+00:00,cxl03ye,1,t3_3v56me,33432,nfl
76,Every NFL coaching contract is essentially a 1 year contract if you don't perform up to the owner's expectations. There is plenty of money around to buy out a coach's contract.,2015-12-02 23:25:40+00:00,cxl00eh,7,t1_cxkvq0y,6203,nfl
77,When C.P. hits 18.88 miles per hour... you're gonna see some serious shit.,2015-12-02 00:59:20+00:00,cxjtpf8,1,t3_3v2m1f,2821,nfl
78,https://www.youtube.com/watch?v=v_aSoeVaE7M,2015-12-01 18:59:39+00:00,cxjelul,2,t1_cxjct67,2455,gravityfalls
79,Biggest circlejerk since the Jenny fiasco...,2015-11-24 02:40:50+00:00,cxaxqse,2,t1_cxavrp7,2971,funny
80,The Chase cheated Gordon out of three championships. This is poetic justice. That's what makes this okay.,2015-11-20 03:09:45+00:00,cx6i36v,3,t1_cx6abwr,13761,NASCAR
81,"Eh, I get where you're coming from, but SPECTRE didn't really infiltrate MI6. Denbigh was just influencing things.",2015-11-18 07:19:15+00:00,cx4auvm,3,t1_cx2c9n6,130999,movies
82,I guarantee you Stan's eyes will be the final card revealed.,2015-11-07 17:02:13+00:00,cwrx2sl,1,t3_3rvjrk,23400,gravityfalls
83,"Here's an idea: let's hire 2 time Academy Award winning actor Christoph Waltz, and give him the Khan treatment, awful dialogue, nothing to do, and just three fucking scenes.

At the same time, lets  retcon the previous three films to give the illusion ""everything is connected"", tainting the prior films in the process.

Fuck it, put tentacle porn in the opening credits.

Dave Bautista was cool though.",2015-11-06 20:39:04+00:00,cwr2d65,1,t3_3rq1vq,58771,movies
84,"Yes, I was including all prime time programming.

Just scripted programming alone, ABC is doing wonderful. They have the most shows averaging over a 2.0 rating at a moment. Unfortunately, they don't have Football, giving CBS and NBC the advantage.",2015-11-06 16:44:06+00:00,cwqshla,2,t1_cwp7iig,116183,TelevisionRatings
85,I knew I was in for a special experience when I saw tentacle-rape in the opening credits.,2015-11-06 16:42:10+00:00,cwqseum,1,t3_3rq1vq,44557,movies
86,"Have you seen Star Trek Into Darkness and Austin Powers 3?

Good. You've seen SPECTRE.",2015-11-06 16:20:04+00:00,cwqrhz0,1,t3_3rq1vq,43231,movies
87,"""Here, have a head that's always screaming!""",2015-11-05 00:57:21+00:00,cwoumsx,1,t3_3rjlgs,13081,gravityfalls
88,"I want to cover it eventually, but I'm starting with the Big 4. I don't watch anything on The CW outside of The Flash (occasionally), so I don't have a real interest in that network.",2015-11-04 21:29:53+00:00,cwomrix,2,t1_cwogrjo,8178,TelevisionRatings
89,I'm not expecting a big ratings uptick for this one. The two shows already had a big crossover audience anyways. This is more fan service than trying to get new viewers.,2015-11-04 15:26:50+00:00,cwo71a9,1,t3_3rhlx3,7727,television
90,"Seems like the natural progression for them; they are already the exclusive distributor of some anime, like Sidona.",2015-11-04 15:24:33+00:00,cwo6xzn,1,t3_3rfydk,44929,television
91,"It speaks to the sad state of network television. The networks have no confidence whatsoever in their bench lineup. With CBS announcing the Star Trek online only show this week, they are seeing that the end is near for their broadcast days.",2015-11-04 15:23:43+00:00,cwo6wub,1,t3_3qgdqo,678857,TelevisionRatings
92,"I forgot Jennifer Lopez used to be a thing...

That doesn't bode well for this show.",2015-11-04 15:22:42+00:00,cwo6veq,1,t3_3qmknh,577955,TelevisionRatings
93,That's what happens when your show drops from a 2.1 to a 1.3...,2015-11-04 15:21:33+00:00,cwo6tuf,1,t3_3qs89h,482354,TelevisionRatings
94,"I'll say 1.0

I think the hype has simmered since Comic Con, and there was already crossover between the show's fan-bases, so there shouldn't be a substantial uptick.",2015-11-04 15:08:17+00:00,cwo6bq5,1,t3_3rdyka,72889,TelevisionRatings
95,"There's no point in a hiatus this close to the show's end. Cut it off now with 2 or 3 episodes to go, you lose viewer momentum.",2015-10-27 20:16:50+00:00,cwf0bph,3,t1_cwezq7x,816,gravityfalls
96,I'm due for an early seasons Community binge.,2015-10-26 23:28:21+00:00,cwdyrcw,1,t3_3qbaf6,17384,funny
97,"If the games were close, I'd agree with you.

But they weren't. Two consecutive blowouts say a lot, even against ACF South teams. Especially seeing how we lost to the Jaguars in week 2.",2015-10-26 15:12:34+00:00,cwdeu63,2,t1_cwdcw1t,3326,nfl
98,"I'm confident our coach, a former Tight End, will have plenty of insight on how to defend against Gronk.",2015-10-26 15:09:36+00:00,cwdeq4g,5,t1_cwdbwna,5040,nfl
99,"Oh Tanny boy, the pipes, the pipes are IN THE ENDZONE, TOUCHDOWN DOLPHINS.",2015-10-25 21:00:47+00:00,cwcli52,1,t3_3q6qdp,3610,nfl
100,"Great episode, but I was thrown off by some of the worst editing I've ever seen in DW.

About halfway through the episode, when the Doctor and Ashildr were in the middle of their break in and entered the room of the sleeping man, the camera did 3 quick zoom cuts on the same shot, with maybe a single second between zooms. It was horrible.

Anyone else notice that?",2015-10-25 05:23:47+00:00,cwbxcoy,1,t3_3q2l73,31723,doctorwho
101,"I meant after Wierdmageddon 2, and an additional episode in November, there will only be 2 episodes left, and at that point there is no point in a hiatus like justaguest12 suggested would happen.",2015-10-22 01:50:50+00:00,cw8dggh,4,t1_cw88ico,8357,gravityfalls
102,No point in a hiatus if there's only 2 episodes left to show.,2015-10-21 20:09:36+00:00,cw80i5m,2,t1_cw7z5lp,1869,gravityfalls
103,"I expect Luke to play the part of Yoda in Empire Strikes Back:
Wise, old mentor, living in self-isolation, and helps train one of the new characters at an important point but remains independent of the main plot/action.",2015-10-20 18:43:14+00:00,cw6o9xr,1,t3_3pie95,7592,StarWars
104,I hope you realize the main complaint against the new Star Trek films was that J.J. made them look too much like Star Wars...,2015-10-20 02:42:26+00:00,cw5ydha,2,t1_cw5x6ts,1719,movies
105,"This was a third teaser trailer, not a true theatrical trailer.
With under 1:50 of film footage, very little story info, and little contextual dialogue.

J.J. is really locking down the secrets here. I know that's his thing, but I was expecting a bit of plot info in the final trailer.

Still pumped as hell though.",2015-10-20 02:29:10+00:00,cw5xuek,1,t3_3pfpp1,1226,movies
106,"This was the plan at FOX for a bit; Kevin Reilly, when he was in charge of developing shows for the network, he wanted to introduce shorter seasons. Gotham was only supposed to have 16 episodes a season, and Empire/Last Man On Earth would have continued to only have 13 episode years. Unfortunately that all changed when Reilly was shuffled out of FOX.",2015-10-19 20:54:35+00:00,cw5l3yj,11,t1_cw4b8b6,89872,TelevisionRatings
107,I can never get enough T.J. Miller.,2015-10-16 19:07:10+00:00,cw25w7v,7,t1_cw253x1,1183,gravityfalls
108,"If we are to go by the amount of end cards left to be filled in, this season will have 21 episodes...",2015-10-15 18:38:21+00:00,cw0xezt,7,t1_cw0whfs,1327,gravityfalls
109,Clearly in the next episode Blendin goes back in time and puts unconscious Blendin's goggles back on.... duh.,2015-10-14 03:45:05+00:00,cvz1jpv,1,t3_3oo09y,7107,gravityfalls
110,"Confirmation of no hiatus is just as good as a new episode.
So today is a double-win as far as I'm concerned.

Oh, and also HOLY SHIT.",2015-10-13 01:11:21+00:00,cvxmir6,1,t3_3oiylu,183,gravityfalls
111,"If Mabel knew about the rift, she wouldn't have given it over to Billendin. It's partially Dipper and Ford's fault for keeping everyone else in the dark.

Bill tricked Mabel just like he tricked everyone else at some point.",2015-10-13 00:39:55+00:00,cvxlaf2,1,t3_3oiuew,188,gravityfalls
112,"It literally just finished airing. Give it 45 minutes, then some uploads will start appearing. Not here, but search around.",2015-10-13 00:38:21+00:00,cvxl878,1,t3_3oiuhe,62,gravityfalls
113,"Error 217: Brain has crashed, please reboot.",2015-10-13 00:33:00+00:00,cvxl0uv,1,t3_3oito6,131,gravityfalls
114,"That was one of the best-
That was one of the b-
Thta wsa one fo th-
Tha-
(BUFFERING)",2015-10-13 00:32:28+00:00,cvxl03s,1,t3_3oito6,99,gravityfalls
115,"The fact the fans were able to put it together is a testament to how well planned it was on Hirsh's part, as opposed to the mysteries from LOST where they just made plot elements and figured out the mystery aspect later.

I recently introduced a friend to GF, and he binged it over a weekend. After he watched Not What He Seems, I directed him to all the clues from over the years. He was flabbergasted.",2015-10-12 20:42:22+00:00,cvxc6f3,5,t1_cvxb5l1,1434,gravityfalls
116,&gt;,2015-10-07 19:59:22+00:00,cvrnpu1,28,t1_cvrljes,3133,pics
117,"After these blowout losses to the Bills and Jets, in two games where we were never a threat, I think the Dolphins might be one of the worst teams in the NFL. ",2015-10-04 16:07:48+00:00,cvnv3gx,1,t3_3ngbnm,7055,nfl
118,The penalty flag is Miami's leading receiver today.,2015-10-04 15:55:16+00:00,cvnunpc,1,t3_3ngbnm,6303,nfl
119,And that right there was the end of any support anyone had left for Philbin.,2015-10-04 15:44:21+00:00,cvnu9xq,1,t3_3ngbnm,5648,nfl
120,"I could have sworn I just heard a ""fire philbin"" chant in the crowds. Anyone else hear that, or is my imagination being hopeful?",2015-10-04 15:35:51+00:00,cvntzcy,1,t3_3ngbnm,5138,nfl
121,Joe Gotta Go,2015-10-04 15:34:07+00:00,cvntx59,1,t3_3ngbnm,5034,nfl
122,I love watching the Dolphins penalty their way down the field.,2015-10-04 14:39:54+00:00,cvns85j,1,t3_3ngbnm,1781,nfl
123,"Dolphins to Bears: ""You punted 10 times and flew home? We'll do you one better- we'll punt it 10 times then fly intercontinental""",2015-10-04 14:38:06+00:00,cvns66v,1,t3_3ngbnm,1673,nfl
124,NFL_Mod bot has the time management skills of Tom Coughlin.,2015-10-04 14:14:23+00:00,cvnrh1o,1,t3_3ngbnm,250,nfl
125,It's comical how little improvement the Dolphins have shown since last week.,2015-10-04 14:12:38+00:00,cvnrf8x,1,t3_3ngbnm,145,nfl
126,"Yeah, who doesn't want to see more of his golf clap.",2015-10-04 14:10:06+00:00,cvnrcg0,2,t1_cvnrbxo,26,nfl
127,"Looks like you have an abundance of shots lined up. If you don't want all 56, ill be happy to take some off your hands.",2015-10-04 12:35:05+00:00,cvnp7db,1,t3_3nfxbp,4954,miamidolphins
128,"Gee, I wonder why.",2015-10-03 23:59:04+00:00,cvn9jbt,1,t3_3nd5oa,21617,dataisbeautiful
129,What show were you referencing?,2015-10-02 20:14:25+00:00,cvm2jmk,4,t1_cvm2b02,387,gravityfalls
130,"It's not his skills as a voice actor, it's the fact every character he has played is a despicable (but lovable) narcissist, I can't picture him as being able to sell a high end car. It clashes with my image of Arnett. I could picture him reading those lines sarcastically in something like Arrested Development.",2015-10-02 02:24:54+00:00,cvl9qyu,3,t1_cvl9kcx,317,nfl
131,I just can't take Will Arnett seriously as a car commercial narrator.,2015-10-02 02:18:50+00:00,cvl9jew,1,t3_3n61aw,8623,nfl
