,body,created,id,nest_level,parent_id,reply_delay,subreddit
265,"It's simply not their bushiness model. They make money from distribution, not production. For them, it might not be worth the extra investment. There is more money to spend in internet entertainment, since the potential audience is much bigger than any single TV service provider.",2015-08-07 00:12:29+00:00,ctu8lkz,1,t3_3g184f,20882,television
266,"Is ""don't"" an option?",2015-08-07 00:10:45+00:00,ctu8jgr,1,t3_3g1jf9,16222,television
267,This is the kind of ticket that you're gonna want to laminate.,2015-08-06 22:02:36+00:00,ctu3wjk,1,t3_3g1ch8,11305,DailyShow
268,"The funniest show currently on TV. I watch Review, Rick and Morty, It's Always Sunny, but none of them can match the awkward humor of Nathan Fielder.",2015-08-06 21:50:37+00:00,ctu3fx8,1,t3_3fx76s,89963,television
269,"I absolutely loved Stewart/Colbert's ""Indecision 2008"" election night special, where they were both behind the same desk, live for the evening. I was disappointed when they didn't do it again back in 2012.",2015-08-06 21:47:47+00:00,ctu3bwz,1,t3_3fzux4,34294,television
270,Jon and Bill have always shown each other courtesy; so this is a fitting way to end this friendly rivalry. I consider Bill to be one of the classier (if not classiest) members of the FOX family.,2015-08-06 21:45:23+00:00,ctu38jd,1,t3_3g00vj,30870,television
271,"Also known as the ""Jon Stewart Retirement Party"".",2015-08-06 21:44:19+00:00,ctu3725,1,t3_3g1s2c,3943,television
272,"Kingpin is violent and brutal. Kilgrave is psychologically, and sexually abusive.",2015-07-30 07:12:40+00:00,ctlavpx,3,t1_ctl7oev,8694,television
273,"Between this and ""Nathan For You"", Comedy Central is truly, finally, the king of television comedy.",2015-07-30 04:33:02+00:00,ctl7a16,1,t3_3f2bfx,34183,television
274,"I'm most intrigued about how they are going to handle the Purple Man. He's a sick disgusting character in the comics, yet David Tennant is so generally likeable.",2015-07-30 04:31:36+00:00,ctl78m9,1,t3_3f2ksc,30497,television
275,"Shhhh....... I want to believe.

Wait. Wrong show.",2015-07-29 14:39:28+00:00,ctkabdp,3,t1_ctka7ho,168,television
276,"Not a movie, but a show. We get 13 installments of this. And yet Firefly remains in limbo.",2015-07-29 14:32:59+00:00,ctka2cc,1,t3_3f0r35,7903,television
277,"For a 26 year old show, The Simpsons has held up much better than, say, Family Guy (which has had half the lifespan). I don't hold it against the show now that it's not as good as it used to be. The Simpsons has earned a bit of leeway. And again, it's still pretty funny. Maybe not every week, but most weeks.",2015-07-29 05:54:08+00:00,ctjyvkg,1,t3_3ezsex,2332,television
278,[HE THREW IT ON THE GROUND!](http://24.media.tumblr.com/tumblr_lgouggFDB21qdertoo1_400.gif),2015-07-28 20:35:09+00:00,ctjfem7,1,t3_3exh27,7296,nfl
279,I blew air out my nostrils.,2015-07-28 20:22:57+00:00,ctjevh9,11,t1_ctixedg,25712,tifu
280,NFL should enlist TMZ to get the data.,2015-07-28 19:10:15+00:00,ctjbp7u,4,t1_ctjacse,1801,nfl
281,"Are we talking objectively legitimately reasons, or acceptable within the villian's worldview?

Objectively: Tony Sopranno
Worldview: Ben Linus",2015-07-28 18:42:27+00:00,ctjaggz,1,t3_3ewpld,11634,television
282,Bring in the dancing lobsters!,2015-07-28 18:38:00+00:00,ctja93z,1,t3_3exh27,267,nfl
283,"Isn't ColbertNation still up and running? It has all of his clips, ever.",2015-07-28 18:29:39+00:00,ctj9w0s,1,t3_3exaqb,2318,television
284,"This show is the pinnacle of Comedy Central's renisance. 

Can't wait for the new season of ""The Hunk""",2015-07-28 16:19:59+00:00,ctj4db5,1,t3_3es3lh,89685,television
285,"Hopefully Aaron Paul has better material to work with next year, he felt disconnected this season.",2015-07-28 16:03:03+00:00,ctj3o1a,1,t3_3ewrz3,1120,television
286,Troy's trip must finally be over...,2015-07-28 16:02:04+00:00,ctj3mko,1,t3_3euvjf,44029,television
287,Final five minutes of Person of Interest's season finale.,2015-07-26 18:12:47+00:00,ctgv8if,1,t3_3eoe96,2244,television
288,"I'm enjoying your content as well, looking forward to seeing what you put out next!",2015-07-26 17:40:29+00:00,ctgu5xn,3,t1_ctgpyak,8044,television
289,I still can't believe Bill Pullman AND Jenna Elfman attached themselves to that project.,2015-07-26 07:58:22+00:00,ctgi5up,4,t1_ctggb7z,6204,television
290,"Gad has unfortunately been on my radar since his career started as a Daily Show correspondent. He's the gift that keeps on giving. Wait, not gift, the other thing..... annoying stepbrother.",2015-07-26 06:07:46+00:00,ctgg5w5,2,t1_ctfl19n,69880,television
291,And I thought I saw them for the last time...,2015-07-25 06:29:25+00:00,ctfhfha,1,t3_3egse7,47510,television
292,Steve Coogan was never a suitable replacement for Hoffman. He lacks the nuance.,2015-07-25 06:27:52+00:00,ctfhefi,1,t3_3ehlg8,34916,television
293,"We are entering a new prime area of animated television. Adventure Time, Regular Show, Steven Universe, Gravity Falls, all shows with deeply developed characters, a lack of childish humor, continuity (which for a while networks didn't think kids would be able to follow), and perhaps the best voice acting the industry ha s seen (at least in diversity of talent), and of course increasing quality in animation. Adventure Time was never a show I could get into myself either, but I recognize the appeal. These days, there's an animated show for everyone.",2015-07-25 06:26:48+00:00,ctfhdpo,1,t3_3eiwwp,10252,television
294,"I'm very curious how the show will react to this development. They need to do some sort of tribute, they can't just roll the issue out the door like they did with ISIS.",2015-07-25 06:23:26+00:00,ctfhbhg,1,t3_3ehhce,36437,television
295,"Was the audiotape released today? If so, it didn't get much coverage...",2015-07-25 06:22:34+00:00,ctfhaxi,1,t3_3ef881,80733,television
296,"Great video, an on point breakdown. Also enjoyed your take on Gravity Falls (I attempted something similar right before ATOTS as well). I've subscribed, looking forward to more!",2015-07-24 19:11:31+00:00,ctewktu,1,t3_3eglkh,9741,television
297,"This was announced about a month or so ago. I don't see the issue, in fact given the quality of most of their programing, it's nice to get a look at what they have coming up. This is far from Hulu Plus territory, and they're not selling us anything we haven't already bought. It's a minor inconvenience.",2015-07-24 19:04:28+00:00,ctewbjm,1,t3_3eh32k,1852,television
298,"""movie""",2015-07-24 18:59:04+00:00,ctew4dj,1,t3_3eh5bj,569,television
299,Okabe Rintarou. Everything from episode 12 and onward is absolutely miserable. You know what I'm talking about.,2015-07-23 07:54:19+00:00,ctd52ws,1,t3_3e9z5t,18925,anime
300,"Very deserving. Can't wait to see how the rest of this season plays out. Especially with Michelle Gomez in the mix, that came out of nowhere, not that I'm complaining. No one plays crazy like Gomez.",2015-07-22 17:24:27+00:00,ctcbjvo,1,t3_3e50hc,61063,television
301,I'm absolutely pumped. The fact that The Muppets are returning to primetime television is enough to make me cry. The fact that it's going to be in the vein of 30 Rock makes me squeal.,2015-07-22 17:20:43+00:00,ctcbe0w,1,t3_3e42gi,76096,television
302,"FX knew the ratings would be lower when they moved the show to FXX. They should be happy with the new ratings, and the show is already renewed for two upcoming seasons. For FXX, it's not about high ratings, it's about bringing any kind of audience to an entirely new channel. Low ratings are better than no ratings right now.",2015-07-22 17:19:31+00:00,ctcbc90,4,t1_ctc92eb,3214,television
303,"This past weekend I caught up on the past two seasons of ""Childrens Hospital"". I tuned out of the show eons ago, despite it being one of my favorite comedies at the time. I found these recent seasons to be a bit below the bar however; Season 5 transported the show from Not-Brazil to Not-Japan, and I think the show put too much focus on the new fake setting. Season 6 simply lacked many of the cast members for too many episodes, but there were some standout episodes, particularly ""Fan Fiction"". The show needs to get some of it's mojo back, which might be more difficult now that Rob Corddry is tied up with the horrible ""Ballers"" on HBO.",2015-07-22 17:16:33+00:00,ctcb7h7,1,t3_3e7dpg,8058,television
304,"If you wanted to go a step further in political commentary, you should Photoshop other Republicans into the picture, as the hostages (as Trump really is holding the party hostage to his insane thoughts).",2015-07-22 17:10:46+00:00,ctcayo4,1,t3_3e4lus,67202,rickandmorty
305,"Not many things make me queasy, but this picture makes me sick. I feel nauseous looking at it. 10/10",2015-07-22 17:08:54+00:00,ctcavsr,1,t3_3e2mn8,97283,rickandmorty
306,"Futurama is easily the closest comparison, in terms of creativity, intelligence, rapid humor, and sci-fi concepts.

Also, they're not adult shows, but both Over The Garden Wall and Gravity Falls are good shows to check out for Rick and Morty fans.
",2015-07-22 17:06:55+00:00,ctcasx6,1,t3_3e6e0r,30606,rickandmorty
307,"I didn't believe the Goat/Bill theory before tonight, but the Goat taking the thumbdrive, not eating it but carrying it away, with a very specific musical cue, opened my eyes.",2015-07-14 04:10:58+00:00,ct2kjs4,2,t1_ct2f75a,9380,gravityfalls
308,"I'm in the same boat regarding convincing people lol, that's partially why I made this. One of the jokes I cut from the video was a statement on how I've been trying to convince people to watch the show, followed by a jump cut, zoomed in shot of me darkly claiming ""you know who you are"" before going back to normal.

Glad you enjoyed it!",2015-07-13 04:24:26+00:00,ct1e5d0,2,t1_ct18tiw,10551,gravityfalls
309,It's a reference to some of my previous videos.,2015-07-13 04:21:10+00:00,ct1e27z,2,t1_ct1dlay,1024,television
310,Not strange at all lol. I also discovered and binged this show back in February in a 48 hour period. I've never been sucked into a show as effectively as with GF.,2015-07-12 22:16:14+00:00,ct12r3c,2,t1_ct121ge,1254,television
311,His loss lol,2015-07-12 21:18:00+00:00,ct10tpw,4,t1_ct10qh4,170,gravityfalls
312,"No harm in showing it to him anyway, I'm sure he can spare the 6 minutes.",2015-07-12 21:06:20+00:00,ct10fyx,2,t1_ct10c3x,205,gravityfalls
313,There's always a way.,2015-07-12 20:51:59+00:00,ct0zz71,4,t1_ct0z9xn,1224,television
314,"I'm sure you can find the episodes online somewhere.

I'd recommend watching the entire season, since every episode is funny and subverts science fiction tropes, but if you want the essentials, I'd recommend 1-5 to meet all the characters and introduce plot points, and 9, 16, 19 and 20 for the main plot. The funniest other episodes are 7, 10 and 13, although really you should watch the entire first season.",2015-07-12 19:47:24+00:00,ct0xu7j,2,t1_ct0xl1b,478,television
315,Wouldn't that be nice.,2015-07-12 06:01:56+00:00,ct0g1dr,1,t3_3cyh8g,26242,gravityfalls
316,I'd love to have Grunkle Stan go up against nuclear Gandhi....,2015-07-12 06:01:15+00:00,ct0g0v7,1,t3_3cy4pt,32912,gravityfalls
317,"Plausible. I thought we were done with the Blind Eye after their episode, but seeing how their memory zapper is back in the new episodes, I guess anything is on the table.",2015-07-12 06:00:42+00:00,ct0g0fy,1,t3_3cyntk,22482,gravityfalls
318,"The credits sequences don't exist within the universe either, but the cryptograms at the end of each episode are real. ""Stan is not what he seems"" is a true statement in the eyes of Alex Hirsch. ",2015-07-07 00:40:06+00:00,csufzg1,4,t1_csucdnn,6451,gravityfalls
319,"He's up there, along with the severely underrated John Swartzwelder (wrote countless timeless Simpsons episodes from it's first 15 seasons, including ""Homer's Enemy"" and the first few Treehouse episodes) and the already mentioned Lorne Michaels.",2015-07-05 22:05:42+00:00,cst72zv,1,t3_3c89z9,4241,television
320,"While I enjoy the look inside Elliot's way of thinking, the fact that this results in everyone calling E Corp ""Evil Corp"" bugs me. Seems a bit cringy, which is unfortunate because the rest of the show is outstanding.",2015-07-05 22:01:06+00:00,cst6xzu,1,t3_3c7chd,22220,television
321,"I'm curious if Netflix would shell out to get Carrey back as Olaf. It's not like he's doing much else these days, and Netflix certainly has the money. I hope they try.",2015-07-05 21:59:13+00:00,cst6vz1,1,t3_3c7vm2,11361,television
322,"Comedy Central has been on a roll these past couple of years. Shows like ""Review"" and ""Nathan For You"" are incredibly high concept, that redefine the term surreal. Tosh.0 is now the lone trashy outlier of CC's programing.",2015-07-05 21:57:36+00:00,cst6u7q,1,t3_3c6u1n,36146,television
323,"Here is why I believe this move was made now: television contracts for cancelled shows expire on June 30 every year. Assuming Hannibal is on the same cycle as normal fall/spring shows, NBC made this move now instead of in Aigust at the end of the season to allow Hannibal to find a new home before the cast contracts expire. Remember when Community was picked up on June 30 last year by Yahoo? That was as last minute as it gets. Hannibal is now on the clock.",2015-06-22 21:21:45+00:00,csf74vx,1,t3_3ar44q,1805,HannibalTV
324,"I love that Battlebots is back, but I'm getting seriously concerned about the amount of reboots and revivals on broadcast television these days. But I guess it doesn't matter, because robots are beating each other up.",2015-06-22 15:09:17+00:00,cset4xc,1,t3_3apdvc,9320,television
325,Now that's my kind of Yoga class...,2015-06-22 12:54:35+00:00,csepaw7,1,t3_3aojwo,26458,comicbooks
326,"I highly doubt this is the end of Aqua Teen. At the very least, the producers have expressed interest at making another movie for a while now.",2015-06-22 12:53:29+00:00,csepa06,1,t3_3amy8t,59389,television
327,"While I love that they fixed their mistake, WatchMojo has now lost all of their (previously nonexistant) credibility by caving into fans (who were right) instead of sticking to their guns (which were pointed in the wrong direction to begin with).",2015-06-22 12:43:28+00:00,csep21s,1,t3_3ao9j4,32479,gravityfalls
