,body,created,id,nest_level,parent_id,reply_delay,subreddit
132,"I would also like a piggy back ride, please.",2015-10-02 02:14:25+00:00,cvl9dzi,1,t3_3n61aw,8358,nfl
133,"Looks out to sea on this run... Not sure I buy it yet though. Funny enough, EURO was the first model to latch onto Sandy hooking back west into New York instead of going out to see like the other models were suggesting at the time all those years ago...",2015-09-30 18:15:15+00:00,cvjjyal,2,t1_cvjjsz1,209,TropicalWeather
134,"In 12+ years of reading every NHC discussion, I have never seen them need ""Key Points"" before. Goes to show how complex this situation is, and the pressure the NHC must be under to get this right.",2015-09-30 18:05:27+00:00,cvjjjb8,2,t1_cvj7g33,19105,TropicalWeather
135,"While you should always keep an eye on systems, and never write anything off until it's north of your latitude, The chances of this impacting Florida are incredibly neglible. At a certain point, no matter how far South she continues to drift in the short term, Joaquin will at some point in the next few days slingshot north.",2015-09-30 18:04:24+00:00,cvjjhpx,4,t1_cvj8fd8,16900,TropicalWeather
136,"Still concerned about Joaquin's continued SW dive. Reminding me of Hanna (2008) who dived three full degrees south of expectations, from North of the Bahamas to the coast of Hispaniola in a two day span.",2015-09-30 18:01:36+00:00,cvjjdg3,1,t3_3msgky,138231,TropicalWeather
137,"Still though, it's a different animation style. In anime style, the shorts should be longer.",2015-09-25 15:04:11+00:00,cvdsp7l,3,t1_cvdnctd,10717,gravityfalls
138,Show continues to up the ante. Looking forward to continued serialization!,2015-09-24 20:34:03+00:00,cvczcn2,1,t3_3m7e0f,20654,television
139,Thank god! I can't wait to see their take on the 2018 elections. Nothing interesting until then really...,2015-09-24 20:33:41+00:00,cvczc4o,1,t3_3m59ni,67467,television
140,"The PG-13 jokes will take some getting used to, and too much of the humor attempted to come from the fact we were watching Muppets in human situations, but it was still a good start and the potential to grow is there.",2015-09-23 19:34:09+00:00,cvbpj8j,1,t3_3m0axl,67225,television
141,"Colbert has been doing a fantastic job so far holding back his bias, and showing the opponent respect and parity.",2015-09-23 19:33:17+00:00,cvbphv6,1,t3_3lwuns,128061,television
142,"Scream Queens is almost dead on arrival. No way it makes another season, but it will outlive Minority Report.",2015-09-23 19:31:26+00:00,cvbpf0n,1,t3_3m2q89,15067,television
143,I tend to avoid anything from the Shonda Rhimes area of ABC...,2015-09-21 21:44:04+00:00,cv9hiyn,3,t1_cv9gzi6,864,television
144,Never expected Veep to win after being passed up for the prior 3 years. So glad to see it finally get recognized as television's funniest program!,2015-09-21 02:59:04+00:00,cv8n8ld,1,t3_3lqmsl,10699,television
145,"As far as I am concerned, with these serious political issues, Colbert has already won late night. I absolutely can not wait for the Trump interview on the 22nd.",2015-09-20 18:56:16+00:00,cv856d5,1,t3_3lof8p,15818,television
146,"I'm surprised this issue is still ongoing. Darabont was fired, what, 3 years ago at least?",2015-09-20 18:55:23+00:00,cv8554s,1,t3_3lou3x,8586,television
147,Still can't believe this was renewed over Selfie...,2015-09-20 18:32:28+00:00,cv849ae,3,t1_cv83zuf,375,television
148,Time to continue not to see what all the buzz is about.,2015-09-20 18:31:11+00:00,cv847ga,1,t3_3lo6v8,19953,television
149,"This is normally something networks do to attract first time views.
This episode is definitely not designed for first time viewers.",2015-09-20 18:30:54+00:00,cv84709,1,t3_3lncmj,45822,television
150,"Anyone know if FOX is still working on the American remake?
(please say no)",2015-09-20 18:28:46+00:00,cv843ro,1,t3_3lk1zy,103175,television
151,It was part of a series of quick images right after Ford's encounter with Bill in Mabelcorn.,2015-09-17 19:31:01+00:00,cv510pv,2,t1_cv50m61,595,gravityfalls
152,"Actually, their shortest production turnaround time was 3 days for ""AWESOME-O"". They intentionally had it rushed, if I remember correctly they needed the short week to attend a wedding...",2015-09-17 18:47:56+00:00,cv4za5w,5,t1_cv4qog2,13001,television
153,"Jags, Buccs, and Fins all in top 5 lowest cost per oz. Praise Florida!",2015-09-17 18:20:02+00:00,cv4y61c,1,t3_3lbugo,1461,nfl
154,Overall time of possession. Was something like 38-22 in favor of the Redskins,2015-09-17 14:44:54+00:00,cv4pocd,5,t1_cv4mgft,5880,nfl
155,"They serve refreshments, yes.",2015-09-17 14:34:37+00:00,cv4panv,1,t3_3lah1m,10903,gifs
156,"""Jim TomaSula""- Trent Dilfer",2015-09-16 01:09:44+00:00,cv30r88,1,t3_3l22es,32279,nfl
157,AFC East: The NFL's only undefeated division.,2015-09-14 00:06:45+00:00,cv0lqch,1,t3_3ksml6,29188,nfl
158,"Let me be clear, there is NOTHING good about this design.",2015-09-13 21:37:06+00:00,cv0gl60,1,t3_3ktpoy,3735,nfl
159,"We haven't really had many possessions. Redskins eating up as much clock as possible, the Yakety Sax fumble earlier cost us a possession, and Juice's punt return for TD also eliminated a possession. We simply haven't had many second half opportunities to give Miller the ball.",2015-09-13 19:50:50+00:00,cv0cccd,2,t1_cv0canj,73,nfl
160,"Still 66% completion, some bad passes but overall has taken care of the ball well. No fumbles or INTs. A QB who doesn't turn the ball over is good enough right now.",2015-09-13 19:48:55+00:00,cv0c9ma,2,t1_cv0c5d4,170,nfl
161,JUICE,2015-09-13 19:31:36+00:00,cv0bjfx,1,t3_3ksqsi,10875,nfl
162,"""Penalty, Redskins, Delaying the game with too many penalties""",2015-09-13 19:30:29+00:00,cv0bht4,1,t3_3ksqsi,10808,nfl
163,That failed early 4th-and-1 conversion that SHOULD have been a short field goal attempt (and likely in) is coming back to haunt us.,2015-09-13 19:22:46+00:00,cv0b6q4,2,t1_cv0b5ub,39,nfl
164,"The Redskins should just take a knee right now, it will do less damage than whatever penalty they get from running a play.",2015-09-13 19:08:49+00:00,cv0amix,1,t3_3ksqsi,9508,nfl
165,"CBS should pre-empt that new sitcom ""Life in Pieces"" and just replay that fumble for 30 minutes, 22 episodes this year.",2015-09-13 18:51:19+00:00,cv09wt3,1,t3_3ksqsi,8458,nfl
166,That was some Yakety Sax level bullshit...,2015-09-13 18:49:42+00:00,cv09ufq,1,t3_3ksqsi,8361,nfl
167,"Reminds me when ""Parks and Recreation"" initially made the full time switch from their original theme to a shortened version, making time for more episode. Wouldn't surprise me now if this shortened version is the status quo going forward. If I'm not mistaken, 4 of the last 6 episodes have the shortened them, and really ATOTS shouldn't count since it was extended anyways.",2015-09-08 02:22:04+00:00,cuu0vmk,1,t3_3k1bsy,4703,gravityfalls
168,"Fuller has stated over and over that he has a plan for Season 4 that takes place before Silence.

Amazon wanted the show, they passed though because Fuller couldn't guarantee them a season within one year since he has to do American Gods.",2015-09-08 01:44:42+00:00,cutzpfx,3,t1_cutr1az,19605,television
169,"$10 says he makes a single appearance either at the very beginning when the crew leaves for the trip, or during the very end credits scene.",2015-09-08 01:43:49+00:00,cutzod0,2,t1_cutz0z1,1121,gravityfalls
170,"The trademark of a Social Justice Warrior is that they really don't care about the cause, they just want to sound involved.

John Oliver genuinely cares about the topics he discusses. His team goes into deep detail during research, and it's clear Oliver is speaking from the heart.

I wouldn't call Oliver a SJW.",2015-09-07 12:23:57+00:00,cutdlq8,1,t3_3jusdf,82249,television
171,Hopefully this is a longer season than season 5. With more Brock.,2015-09-07 12:17:12+00:00,cutdhmi,1,t3_3jxvzh,23678,television
172,"In regards to the original content, the battle between Netflix, Amazon, and Hulu is becoming similar to HBO, Starz, and Showtime. It's about who has the original programming that you prefer.

Also, Amazon still failed to save Hannibal, so screw them.",2015-09-07 12:16:00+00:00,cutdgvw,1,t3_3jwdvm,53167,television
173,This will be the toughest division this year.,2015-09-06 16:13:09+00:00,cusjxrb,1,t3_3juhsp,17599,nfl
174,Have fun with the Jets and Dolphins DLines!,2015-09-06 16:09:32+00:00,cusjtsb,3,t1_cusg6q6,8377,nfl
175,"I'm slowly warming up to Bing, given it's forced integration with Windows 10.",2015-09-06 16:06:02+00:00,cusjq0l,1,t3_3jun8c,12803,funny
176,"Great list. Where have you been all my life?

I would also through in Bored To Death.",2015-09-06 16:03:03+00:00,cusjmrn,2,t1_curk7ib,88178,television
177,I feel like IMDB on a whole can use a facelift for the 21st century. It's current design just feels so clunky.,2015-09-06 16:01:21+00:00,cusjkwg,1,t3_3jno20,160333,television
178,"I would have suggested you hold off until we get that official recut that seems to have been in the pipeline for forever now, but I doubt we will ever get it. Anyways, absolutely watch Season 4. It's a different experience, and might seem lost for a while, and does have some unenjoyable episodes early on, but overall it's a blast.",2015-09-06 15:57:48+00:00,cusjh73,1,t3_3jspr3,61338,television
179,I'm guessing during the break is when Daylight Savings Time switched on. That change always lowers TV ratings.,2015-09-06 15:55:23+00:00,cusjeo4,1,t3_3jtpue,40712,television
180,I can imagine Netflix will produce a competitor to the new Amazon car show. Probably with better production values.,2015-09-06 15:54:18+00:00,cusjdi0,1,t3_3julfj,13461,television
181,"Hannibal, The Legend of Korra, and Veep. Especially Veep.",2015-09-06 15:53:02+00:00,cusjc6h,1,t3_3juvr9,6296,television
182,You know what.... Chuck rewatch. That's how I'm spending my Labor Day off.,2015-09-06 15:52:29+00:00,cusjbm0,2,t1_cusih3g,1803,television
183,Anything from Bryan Fuller really.,2015-09-06 12:16:28+00:00,cusehfv,2,t1_curhxjo,79865,television
184,"For a spec script, that was pretty top notch! Have you considered attempting scripts for other shows, or just Silicon Valley due to your knowledge of the tech industry?",2015-09-06 07:37:38+00:00,cusavvh,1,t3_3jpdtk,100283,television
185,Ask again in 3 days.,2015-09-06 07:12:50+00:00,cusaihe,1,t3_3jry54,42674,television
186,He was more of a real newsman on CC than most actual reporters.,2015-09-06 07:12:24+00:00,cusai9d,1,t3_3jtkl6,12642,television
187,"The original Teen Titans show was fantastic. To see this show come along, claim the same continuity, keep the voice actors, but change the animation and get rid of the pathos plot.... I just can't watch it.",2015-09-06 07:12:05+00:00,cusai2a,1,t3_3jtg4l,15227,television
188,"I thought he was always involved, in an advisory capacity. I guess working on Sponge Out Of Water last year rekindled his love for the characters.",2015-09-06 07:10:34+00:00,cusah6l,1,t3_3jswll,26167,television
189,I can't handle this much nostalgia. Any word if CatDog is getting in on this?,2015-09-06 07:09:21+00:00,cusaghy,1,t3_3jrptk,46165,television
190,"Graham, Stills, Toon: RIP Saints receiving corps.",2015-09-02 01:40:12+00:00,cunoojc,1,t3_3j972a,23696,nfl
191,Its unfair to compare him to anything other than a Fullback at this point.,2015-09-02 01:39:36+00:00,cunonre,1,t3_3j9kkm,18662,nfl
192,"Actually, the full plot of the show doesn't really start getting introduced until the second half of season 2, and gets in gear during the second half of season 3. Everything before that is a slow burn, and the HR plotline.",2015-09-01 18:41:34+00:00,cuna7zk,3,t1_cun9uym,547,television
193,"After the first season the show becomes something much grander, and ambitious than the pilot/most of the first season.",2015-09-01 17:50:12+00:00,cun86qq,1,t3_3j8o56,2826,television
194,Oh boy... forgot about that abomination...,2015-09-01 16:18:05+00:00,cun4hh1,3,t1_cun4atj,277,todayilearned
195,"For a fraction of a second, I could see the ""Wile E Coyote"" realization of impending doom look on her face.",2015-09-01 16:01:38+00:00,cun3udw,1,t3_3j7jyh,14919,funny
196,I'm down for a group rewatch. The only issue is waiting a week for each episode.... I don't think I have that kind of restraint.,2015-09-01 16:00:20+00:00,cun3sjs,1,t3_3j7d7w,19136,HannibalTV
197,I could have sworn last night that the Raiders released Richardson to make space for Jackson. That seemed logical...,2015-09-01 15:58:48+00:00,cun3qft,1,t3_3j7k57,14644,nfl
198,"I wonder which organization is more ""evil"", the WWE or the NFL...",2015-09-01 15:58:02+00:00,cun3pct,1,t3_3j7w9v,7902,todayilearned
199,"It's the second best network drama behind Hannib-

It's the best network drama.",2015-09-01 15:56:21+00:00,cun3mx8,1,t3_3j7k40,14513,television
200,"Person of Interest is now on Netflix, so there's that. Seems like it would be up your alley.",2015-09-01 13:01:20+00:00,cumyj4a,1,t3_3j7q0y,909,television
201,"This might be a bit of a cheat, but anything from ""Kroll Show"", but if I had to pick one of his bits, ""Wheels Ontario"".",2015-09-01 12:59:58+00:00,cumyhvl,1,t3_3j4m81,60210,television
202,or Parks and Rec about a year ago.,2015-09-01 12:58:05+00:00,cumyg77,6,t1_cumgcob,46273,television
203,"This show, along with ""Dollhouse"", made for some great Friday nights on FOX.",2015-09-01 12:55:50+00:00,cumye6f,1,t3_3j6i92,29607,television
204,"Cable sitcoms (other than, for obvious reasons, ones on Comedy Central) don't have the budget and resources of either network shows, or your premium cable shows.",2015-09-01 03:28:52+00:00,cumnjl7,1,t3_3j635q,3066,television
205,What a time to be able to change the channel.,2015-09-01 03:24:17+00:00,cumne8b,1,t3_3j3bst,44644,television
206,Glad to see Colbert isn't being forced to dumb down his product for a wider audience.,2015-09-01 03:23:18+00:00,cumnd2g,1,t3_3j3453,48020,television
207,"I understand revivals are all the rage these days, but the fact that someone at NBC thought a ""Coach"" revival was ever a good idea is laughable. Unfortunately, ""Heroes: Reborn"" is still on the way...",2015-09-01 02:47:12+00:00,cumm4l0,1,t3_3j60dn,1801,television
208,"I'm cautiously optimistic. A 2 hour movie would be easier to put together than a new season, while telling a grander story in a condensed time cutting out filler. The show was already low budget, so a movie wouldn't be that expensive. As many have stated, the way the show ended was perfect, so a continuation in a different medium seems like the right move.",2015-08-31 20:10:48+00:00,cum7dwv,1,t3_3j39fw,19670,HannibalTV
209,"This might be the most anti-cynical rock song I've ever heard.

Also, the best part of Ricky Gervais' ""The Invention of Lying"".",2015-08-31 20:05:21+00:00,cum762c,1,t3_3j2n8q,31129,Music
210,"Just how in ""Sock Opera"" the plots were intertwined.",2015-08-29 00:41:56+00:00,cuj9vl0,3,t1_cuj9hrr,752,gravityfalls
211,"In my opinion, Gravity Falls is second best behind ""Hannibal"".

Oh wait, that ended 3 hours ago.

Never mind.",2015-08-28 05:38:52+00:00,cuicps1,1,t3_3in7hl,31800,gravityfalls
212,It's supposed to be open to interpretation.,2015-08-28 05:23:06+00:00,cuicdmf,1,t3_3iotww,2441,HannibalTV
213,"2 &gt; 3 &gt; 1

But really, they are all individually fantastic seasons of television, and add up to create one of the most consistently incredible shows I have ever watched. It feels like a crime to rank them.",2015-08-28 03:36:22+00:00,cui9oey,1,t3_3iom1i,365,HannibalTV
214,"Uh, did you not watch the second season finale?",2015-08-28 03:30:02+00:00,cui9hz9,2,t1_cui931c,833,HannibalTV
215,"It didn't top the 2nd season finale, where the first 40 minutes was a continuous ticking clock to something we knew was coming, and the last 20 minutes explosive, but it was good.

The last 10 minutes though, were perfect.",2015-08-28 03:04:39+00:00,cui8qis,1,t3_3ioimj,216,HannibalTV
216,Yes.,2015-08-28 03:03:16+00:00,cui8p0w,3,t1_cui8on2,21,HannibalTV
217,"I wouldn't suggest a show that has multiple shinigami as major characters, just saying. Don't get me wrong, I love Death Note (well, the first half), but it's not a good gateway show.

I'd also suggest Steins;Gate. Little fanservice, high stakes, no fantasy, set in present day Earth, and a gripping story (after the first few, somewhat slow episodes).",2015-08-28 00:31:11+00:00,cui40ip,3,t1_cui3o8y,658,television
218,"It looks like Erika might make the rare journey up Florida's spine. Currently, NHC has her moving parallel to Florida's East coast, from Miami north. I'm expecting the track to shift slightly west at 11pm in agreement with the latest models.",2015-08-27 23:37:51+00:00,cui2b7b,1,t3_3im1ys,27332,weather
219,"Death Note is not a good gateway anime.

For American television fans, a good first anime I'd suggest would be Psycho-Pass. It's a serialized story, very deep characters, stunning animation, a plot type were familar with (detectives in a near futuristic society), and it's overall one of the better animes in recent years (just the first season.",2015-08-27 16:19:38+00:00,cuhl83t,1,t3_3ilszb,4774,television
220,"HBO has had great comedies for ages. Curb Your Enthusiasm, Bored To Death, Veep, list goes on...",2015-08-27 04:28:14+00:00,cuh4tya,1,t3_3ik27g,1436,television
221,Still making less than Charlie Sheen did at 2 1/2 Men's peak.,2015-08-27 02:43:55+00:00,cuh1ps1,1,t3_3iiy3w,14175,television
222,The fact that it's been 3 months since the first season ended and there hasn't been an renewal yet is unfortunately discouraging.,2015-08-27 02:41:31+00:00,cuh1muh,4,t1_cugt0ni,15150,television
223,"Between this, and the rumor that AS shut down Aqua Teen and not the creators, you have to wonder if Adult Swim is trying to move on from their longtime programs, and what this means for the already rarely aired Venture Bros...",2015-08-27 02:39:48+00:00,cuh1krl,1,t3_3ifldc,75606,television
224,"I'm personally disappointed, but I understand USA's reasoning. Just gets me more anticipated for the finale!",2015-08-27 02:35:46+00:00,cuh1fts,1,t3_3iifix,21558,television
225,"Ever since Comcast took over NBC, they haven't been able to develop a comedy. NBC's sitcom division was the only thing the network was doing right for a long time, and now they don't even have that.

http://i.imgur.com/GmSe6Hc.jpg",2015-08-24 23:10:26+00:00,cuegdco,1,t3_3i8uh5,9824,television
226,People want to watch news about The Donald. It's how the news business works. Nothing here is new.,2015-08-24 14:24:35+00:00,cudwepa,1,t3_3i7clj,650,television
227,"It's not as good as Kingsman, but it oozes style. I wouldn't expect anything less from Guy Ritchie. If you liked this film, go check out ""Lock, Stock and Two Smoking Barrels""",2015-08-24 12:20:43+00:00,cudt35u,1,t3_3i5ku0,34397,movies
228,"In my eyes, the best ""series finale"" (which unfortunately lost that distinction after it aired) was the Scrubs season 8 final episode.",2015-08-24 12:19:32+00:00,cudt2a9,1,t3_3i5pul,31749,television
229,"Rick and Morty, Childrens Hospital, Robot Chicken, the Toonami block, and The Greatest Events in Television History would like to have a word with you.

Toonami was never all original content, they have always had reruns. ",2015-08-24 12:17:04+00:00,cudt0h0,1,t3_3i63tn,23384,television
230,"I don't understand the question, and I won't respond to it.",2015-08-24 12:14:01+00:00,cudsy7z,1,t3_3i6bru,17560,television
231,"Although the first season was bumpy but enjoyable, the finale last night was incredible. Well paced, funny throughout, surprisingly tense... everything this past season was just building towards last night.",2015-08-24 12:13:28+00:00,cudsxrv,1,t3_3i695f,19464,television
232,"She's not A list yet, not close. I'd say C list. She can't lead a show or movie right now.",2015-08-24 12:12:04+00:00,cudswq8,3,t1_cudn0s2,22378,television
233,This is more common than you might think in the voice acting industry.,2015-08-24 04:20:35+00:00,cudkree,1,t3_3i5u2u,789,todayilearned
234,"The finale, the last episode, was pretty good. Enjoyed the narrative device with the deceased characters. Fake out at the end was ok. Rest of season 8 was awful.",2015-08-24 03:55:00+00:00,cudk296,1,t3_3i4wxg,15652,television
235,"Oh, no disagreement that Season 4 is still a great season of television. Those episodes you listed, along with ""Prophets"" early in the year, were all excellent. I just think the bar was so incredibly high after season 3, it's ok for S4 to be a little bit under.",2015-08-24 03:51:47+00:00,cudjyvd,5,t1_cudjtwc,298,television
236,"The team that finishes last this season, or the team that has the worst team's draft pick.

Too early for this nonsense.",2015-08-24 03:08:10+00:00,cudioip,1,t3_3i5hvs,2785,nfl
237,"Really glad to see the Dolphins getting love from almost every poster in this thread. I am not nearly that optimistic.

On the other hand, I think the Texans will make it. Too much talent, and passion from the coaches not to make it. I like what you have with Mallet. Think you should have held onto Fitz though.",2015-08-24 03:07:29+00:00,cudinqr,4,t1_cudh4h0,2814,nfl
238,"Hannibal is the best thing for another week lol. Second half of Fargo is phenomenal, especially after..... well, you'll know it when you see it :)",2015-08-24 02:59:44+00:00,cudievg,2,t1_cu9rgql,289462,television
239,"I'd disagree about the show's seriousness (at times). It's not a prime-time drama, but ""Not What He Seems"" and ""A Tale of Two Stans"" weren't light watching.",2015-08-24 02:57:13+00:00,cudibyt,2,t1_cu8hzfd,378146,television
240,"With all the ""Blunt Talk"" discussion, on a whim, I just started ""Bored To Death"", and I'm halfway through the binge. What a charming, quirky program.",2015-08-24 02:55:26+00:00,cudi9x5,1,t3_3hlb5f,388397,television
241,"Let's make shots like these illegal, no one should have to risk injury. A sport where safety is all that matters? How about we call it ""sarcastaball""!",2015-08-24 02:52:58+00:00,cudi6yp,1,t3_3i5d73,4191,nfl
242,"Ah yes, the ""What do you want"" face",2015-08-24 02:50:47+00:00,cudi4d0,1,t3_3i5jey,974,aww
243,"Wait until they find out how much those college laundry machines cost.

""You mean I have to pay to clean my clothes?!?!?!""",2015-08-24 02:49:53+00:00,cudi3bu,1,t3_3i3j8u,34245,AdviceAnimals
244,Great job hiding from Samaritan...,2015-08-24 02:46:30+00:00,cudhz9e,1,t3_3i4u8v,12752,television
245,"Post revival Doctor Who. Although it stumbled a little during the Matt Smith years, there is a general trend of the show improving over time. At the very least, in terms of production values.",2015-08-24 02:45:39+00:00,cudhyav,1,t3_3i3iae,34400,television
246,"Season 4 was a slight step down from 3, simply because the Brotherhood story-line wasn't nearly as engaging as the Vigilance story.",2015-08-24 02:44:11+00:00,cudhwzs,3,t1_cudgval,1866,television
247,"Season 1 was basically a 6 episode long ""pilot"".",2015-08-24 02:42:22+00:00,cudhv96,7,t1_cud3560,25526,television
248,"Between SU, Gravity Falls, and the more underrated Star and the Forces of Evil, we are in a new golden age of family animated programming.",2015-08-24 02:41:24+00:00,cudhtzs,1,t3_3i26o3,66907,television
249,Still find it hard to believe this is how Olivia Munn got her start...,2015-08-24 02:40:09+00:00,cudhsda,1,t3_3i568k,6773,television
250,"I'm very glad this is much more ""Jonathan Ames"" than it is ""Seth MacFarlane"". Having Seth's name almost kept me away from this project.",2015-08-24 02:39:42+00:00,cudhruj,1,t3_3i4htu,18004,television
251,I still don't believe this is the end of the show...,2015-08-24 02:38:46+00:00,cudhqqb,1,t3_3i4f7h,19078,television
252,Trying the file from MEGA,2015-08-21 04:41:29+00:00,cuac9xg,2,t1_cuac5vy,273,HannibalTV
253,Same fake from a half hour ago.,2015-08-21 04:39:55+00:00,cuac8iu,2,t1_cuac1af,488,HannibalTV
254,I'm pretty sure that's a fake.,2015-08-21 03:55:10+00:00,cuab2vy,2,t1_cuab0pg,132,HannibalTV
255,"Some shows peak early, some peak later. It's not a rule that shows peak at seasons 4-6, hell maybe 20% of shows are lucky to make it that long. Heroes, for example, peaked in it's first year.",2015-08-15 14:08:57+00:00,cu3vulr,3,t1_cu3s2fd,13912,television
256,This show caught me off guard last year with it's B-movie charm and lack of seriousness all around. Glad to see it's somewhat of a success for Syfy.,2015-08-15 14:06:49+00:00,cu3vsth,1,t3_3h3crn,3095,television
257,"First movie was funny, second was tedious. Don't see the point of making a show based off a set of movies no one remembers from a few years ago. Ratings failure waiting to happen.",2015-08-15 14:04:10+00:00,cu3vqny,1,t3_3h1dih,52861,television
258,"Reminds me of ""No Heroics"" from ITV in England. I think ABC tried to remake it over here but it didn't pass the pilot stage.",2015-08-15 14:02:19+00:00,cu3vp6z,1,t3_3gzt9q,76636,television
259,"This ""nostalgiac revival"" movement has been out of control since Fuller House was announced.",2015-08-15 05:46:55+00:00,cu3nzs9,1,t3_3h04f6,42414,television
260,"Be careful what you wish for..... This could easily be another ""Arrested Development Season 4"". Not bad, but can never match our high expectations.",2015-08-15 05:44:30+00:00,cu3ny3q,1,t3_3gyuhf,63224,television
261,Not surprised; these kinds of leaks have become the norm.,2015-08-11 05:18:39+00:00,ctyuyur,1,t3_3gk204,1179,television
262,"Strictly new, first season shows? The Brink",2015-08-11 05:18:03+00:00,ctyuyb6,1,t3_3gk37x,380,television
263,The best kind of correct.,2015-08-07 11:21:42+00:00,ctuo63k,11,t1_ctuhov0,22903,nfl
264,"Yeah, but why miss an opportunity to get Colbert and Stewart behind the same desk for an evening?",2015-08-07 04:24:07+00:00,ctugqjz,3,t1_ctugoii,123,television
