,body,created,id,nest_level,parent_id,reply_delay,subreddit
83,"I use the ribbon all the time, in addition to keyboard shortcuts and context menus. Things like show extensions and hidden items, invert selection, copy path and more are very handy from the ribbon. 

Just because you only copy and paste doesn't mean Microsoft should dumb down their File Explorer for everyone",2016-08-09 13:48:58+00:00,d6acq8h,3,t1_d69nq84,53764,Windows10
84,"I like it, but you left out the most difficult part of any file explorer concept. How will you (if you think it should be) integrate the ribbon? The File Explorer has a very powerful ribbon which makes modifying and manipulating selection and files very easy. How would that get added?",2016-08-08 21:00:34+00:00,d69it0q,1,t3_4wqzwo,16309,Windows10
85,Yes and no. Companies who are guided by profits alone do not last. Companies who work within regulations and avoid costly confrontation with government bodies and respect the local people and their land tend to last much longer and make more profits overall. ,2016-08-05 21:34:20+00:00,d65xean,2,t1_d65p94k,10857,Political_Revolution
86,"My main issue with many of these abstract discussions is how removed from reality they become. 

&gt; exploitation is realized as appropriation of value created by any wage labour for capitalist

This is such a confusing sentence for me. I think I understand the intent however it is such a gross over-simplification it looses nearly all connection to reality. 

As an example let's say there is a business:

* Goods production
 * Low education workers (roughly 100)
 * Low education managers (roughly 15)
 * Educated Managers
* Goods design
 * Inexperienced designers
 * Experienced designers
 * Design managers
* Finance
 * Inexperienced buyers
 * Experienced buyers
 * Inexperienced Sales
 * Experienced Sales
 * Accounting
 * Sales Manager
 * Buyer manager
* Directors
 * Director of production
 * Director of design
 * Director of finance 
* Vice President
* President/Founder
* Board
 * 5 Board members
 * Chairman of the board 
 * Shareholders

In this example who is the ""Capitalist""? 

Also generally as salary for an individual increases, generally their responsibility and their dependence on the company's success also increases. In this company many people are benefiting from many other people. The low education workers are benefiting from good design giving them easy work with good pay. The designers are benefiting from good money management giving them freedom and good pay. Finally the shareholders are all benefiting from people doing good work. 
",2016-08-05 21:03:46+00:00,d65w4hw,16,t1_d65uitu,2151,Political_Revolution
87,I always thought the free market was just one aspect of capitalism. Am I wrong? ,2016-08-05 20:05:18+00:00,d65ti52,10,t1_d65rhts,2641,Political_Revolution
88,"It is always interesting to me how when discussing capitalism people jump to sweatshops. I think more people should jump to the middle class as examples of ""worker exploitation."" Before capitalism there were kings and peasants. I would choose to live today over any other time to be alive and largely because of how capitalism enables people to be more than simple farmers.

Where does the idea ""exploitation is systemic part of capitalism"" come from?  Is it a Marx idea or somewhere else?",2016-08-05 20:04:11+00:00,d65tgce,14,t1_d65rmex,2408,Political_Revolution
89,"My original comment intent was to give a more broad realistic understanding of the word capitalism. I know that word means very different things to different people, but it is generally used to mean private for profit business not owned or operated by the government. Also a political system which acknowledges, encourages, and protects this way of doing business. 

I do not think /u/DavidByron2 is completely wrong, I just think he over simplified what the Bible ""says about capitalism."" he was also unaware some rare banks offer special ""no interest"" loans.

Frequently there are cases of abuse within business, however similar cases can be found in all forms of political and economic systems. So capitalism does not require abuse, instead humans tend to abuse every system they create.",2016-08-05 19:12:55+00:00,d65r45d,12,t1_d65m8id,6165,Political_Revolution
90,"I think we are on the same side of this discussion. I believe the economic systems in biblical times do not adhere to strict modern definitions (nor do modern economies like China trying to be both communist and capitalist).

You say ""They were just trying to sell and not trying to make a profit"" what exactly brings you to that conclusion? Surely farmers and land owners in biblical times were trying to make a profit, right?",2016-08-05 18:37:17+00:00,d65pfsg,8,t1_d65m1a6,4275,Political_Revolution
91,"I am not pretending to know everything. Using Google to define words grounds a discussion around a single source for word meaning. If people are discussing a topic but have different meanings for the same words the communication breaks down.

My intent with my original comment was to highlight the danger of applying modern concepts to biblical contexts. Also to mention the existence of non-traditional loans which do not charge interest. 

You had an opportunity to education yourself. You obviously don't want to.",2016-08-05 17:13:14+00:00,d65lf7z,8,t1_d65ktx7,748,Political_Revolution
92,"&gt; OK you don't know what capitalism is.

Maybe you are right... let me [Google the definition](https://www.google.com/#q=define+capitalism): 

**Cap·i·tal·ismˈkapədlˌizəm/: noun:** *an economic and political system in which a country's trade and industry are controlled by private owners for profit, rather than by the state.*

So you made up a definition of the word to fit your world view. However that is not enough to redefine the word. When The majority of people read/hear/use the word capitalism they are not using your definition. 

There are many examples in the Bible of economic systems where the trade and industry were controlled by private owners for profit rather than by the state. 

&gt; Interest is the cost of money.

Maybe you are right... let me [Google the definition](https://www.google.com/#safe=off&amp;q=define+intrest):

**in·ter·est ˈint(ə)rəst/ noun:** *2. money paid regularly at a particular rate for the use of money lent, or for delaying the repayment of a debt.*

Shoot. I guess you made up another definition of a common word. 

&gt; Such a bank would be like a grocer who gives away his produce for free. ie nonexistent.

Or such a bank would simply have a flat fee for taking out a loan. The difference being a flat fee is not a rate. Such bank loans do exist. http://www.npr.org/sections/money/2016/05/13/477956675/episode-701-a-bank-without-interest 

",2016-08-05 16:55:59+00:00,d65klkn,6,t1_d65jnun,1176,Political_Revolution
93,"Capitalism was not an ideology during Biblical times. There are many references to farming or making goods and selling them for money. 

You are correct about the lending money at interest, however that is not capitalism that is just one part of the banking system. Also there are banks which lend money at no interest, they operate with fees only.",2016-08-05 16:15:21+00:00,d65inou,4,t1_d65h1di,2037,Political_Revolution
94,Here is the link: https://www.bing.com/explore/rewards-browse-and-earn,2016-07-19 16:01:45+00:00,d5ia20j,1,t3_4tgxvd,73859,bing
95,I'll be very interested to see some reviews of how well the phone works. I hope the fingerprint reader is fast and accurate. I'm also excited to see some photos taken with the camera. ,2016-07-18 15:30:12+00:00,d5gvwqe,1,t3_4tfeq0,4092,windowsphone
96,They should just store the bits to single file in more than one country so no single country can remand files be turned over,2016-07-16 20:23:29+00:00,d5ew59e,2,t1_d5ertx1,7565,technology
97,"Play Mario and finish your beer after every level, it'll have the same effect",2016-07-07 14:09:37+00:00,d52t105,1,t3_4rlncc,49854,Showerthoughts
98,My WiFi passwords get forgotten on my laptop every time my wireless adapter driver gets updated. Maybe you have a weird bug where your adaptor driver gets updated every time you restart. Try uninstalling and reinstalling your adaptor driver,2016-07-01 23:01:38+00:00,d4vzju8,1,t3_4qu6y7,4873,Windows10
99,"&gt; My favorite is the new Pen-Ink feature. Apparently, even when your device is asleep/h you can jot down note by simply writing on the screen. Also, you do not need a special program to be open, just simply write and it will save/note/illustrate. This is LOVE! 

I just want to clarify the machine does wake up, you just don't have to put in your password. It is very similar to how a blank OneNote page opens with the click of the pen. You have access to the inking but not to the full computer.",2016-07-01 12:43:21+00:00,d4v94ln,1,t3_4qoan3,52662,Surface
100,Woo! Hooray for competition and free stuff!,2016-06-29 15:47:50+00:00,d4so615,1,t3_4qfy9d,2946,pcmasterrace
101,"You could have a sign that says ""haldo"" in the style of peasant's quest",2016-06-28 00:18:59+00:00,d4qlc1o,1,t3_4q5eg3,15007,HomestarRunner
102,"Settings &gt; System &gt; Display &gt; ""Change the size of text, apps, and other items:"" &gt; try at 150% or 200%",2016-06-27 20:20:35+00:00,d4qb967,3,t1_d4q91le,2750,Windows10
103,"I think a more accurate representation could be, ""Microsoft still believes hand tracking will probably be added to native PC input in the future, alongside keyboard, mouse, touchscreen, and voice.",2016-06-27 15:57:28+00:00,d4pyse6,1,t3_4q3gby,7157,microsoft
104,"My only suggestion would be to make sure your display scaling it set to give you big touch targets, but the file explorer is one the worst parts about trying to use Windows 10 as a tablet",2016-06-27 14:06:51+00:00,d4pua4p,1,t3_4q2yvk,7552,Windows10
105,"Yeah I find it interesting they just make a generic search the help page. I don't know which is better, a search which should be up to date, or a old out of date help page",2016-06-24 13:12:59+00:00,d4m6m29,3,t1_d4m622h,1036,Windows10
106,For me it is a Bing search. Is Chrome your default browser and is Google your default search engine?,2016-06-24 11:31:09+00:00,d4m3st5,1,t3_4pma6f,2278,Windows10
107,For Microsoft to abandon new ventures they would be clinging to the 80s and 90s. Their fate would be the same as IBM and they would slowly decay until they went out of business. That is not a winning strategy for Microsoft nor a good outcome for their users.,2016-06-21 22:40:26+00:00,d4imu17,4,t1_d4imn66,274,Windows10
108,"I would not agree that UWP apps are meant for mobile. Apps on the desktop come with a huge list of benefits to their online counterparts.

* Better hardware support
* Independently stable (i.e. tabs can crash whole browsers)
* Better offline support
* Better Window management support
* Less network activity
* Deeper OS Integration (i.e. Sharing, Cortana)
* Sandboxed 
* Secure authentication (Windows Hello &amp; Passport)
* lower latencies 

Also, I understand modern web apps can be very powerful, but the potential of UWP apps spans from a calculator to Tomb Raider. 
",2016-06-21 22:37:28+00:00,d4impmh,4,t1_d4ii2is,6269,Windows10
109,"They are not abandoning their Win32 APIs, they are simply augmenting them. Do you wish Microsoft just call it quits, lay off 90% of their Windows staff and only focus on fixing bugs?",2016-06-21 22:14:04+00:00,d4ilqm7,2,t1_d4ij84z,3393,Windows10
110,I would guess this is intentional. The old ideology behind building great programs was to fill them with features and buttons (see MS Office in the 90s). Eventually more developers realized they should 80/20 their features and UI to provide a great experience. It seems like UWP apps are focused on solving a single problem well and not doing everything.,2016-06-21 22:08:43+00:00,d4iliko,5,t1_d4ikuk6,926,Windows10
111,hahah. IDK! fixed :),2016-06-21 22:05:06+00:00,d4ild2w,5,t1_d4iknam,985,Windows10
112,I thought that could be the case... but surely the APIs are complete enough to make awesome applications. To me that is a bad excuse. The OneNote app for iOS is more fully featured than the UWP version. There should be no APIs holding it back.,2016-06-21 20:28:39+00:00,d4igurc,4,t1_d4ieanl,3126,Windows10
113,"If we were in /r/Android I would agree with you, but this is Windows 10 we are talking about. Microsoft goes on and on and on about how apps work great on every platform. Also since the app runs on Windows, Xbox, HoloLens, Mobile, Hub and IoT the teams for each app should be bigger because you are building one app and not 6 different apps.

Microsoft needs to show how UWP apps are the future for everyone and saying ""well this wasn't really designed for high res computers, or low res computers, or keyboard/mouse etc."" devalues the UWP proposition. ",2016-06-21 20:26:06+00:00,d4igq4c,2,t1_d4ifqzj,1182,Windows10
114,This app requires flash. Just FYI,2016-06-21 19:08:45+00:00,d4icxxm,1,t3_4ohzvm,390286,windowsapps
115,"You clearly don't understand what UWP apps are. Which is fine, you can live a full happy life never understanding them. But your opinion regarding UWP apps will be less meaningful.

edit: added apps ",2016-06-21 19:05:44+00:00,d4icsmy,3,t1_d4ib40e,2096,Windows10
116,YOU HAVE BEEN MADE MODERATOR OF /r/OutdatedTechnology,2016-06-21 18:54:23+00:00,d4ic902,2,t1_d4i8xxl,4121,Windows10
117,"Thank you for pointing this out. For some reason my apps only update when I go to the app page in the store, otherwise no update",2016-06-21 18:28:17+00:00,d4iazni,2,t1_d4i68h6,5950,Windows10
118,"I think they need a clear target (Which they seem to have), then both the OS and the apps can be updated simultaneously. This is not an ""either/or"" more of a just fix the UI on Apps and the OS at the same time",2016-06-21 18:11:35+00:00,d4ia71y,2,t1_d4i59c8,6179,Windows10
119,Microsoft is a big company. They should be able to do both.,2016-06-21 18:09:53+00:00,d4ia43z,2,t1_d4i8t5x,1618,Windows10
120,"When I say slow, I am referring to using the app, not just opening it. For example, scrolling down in the photos app takes forever for the thumbnails to load. Searching for an email and loading old emails takes way longer than it should. Sway opens fast, but fails to ever load photos. Opening the Store is quick, but there are many delays involved in searching for finding and installing an app.


Do you not experience these issues?",2016-06-21 15:39:05+00:00,d4i2ynj,2,t1_d4i2kfg,525,Windows10
121,"PCs will never vanish. Nothing ever does. Microsoft is obviously chasing profits because they are a company. It is a good move. In an alternate universe that author is writing a post making Microsoft looking bad for clinging too tightly to the PC market. You're damned if you do you're damned if you don't. 

Notes on this article. 

&gt; ""Microsoft fights for relevance in the cloud"" 

What? They are relevant, maybe not number one, but they are safely number two.

There is no mention of HoloLens or Mixed reality, or VR or AR. In this entire article, which I thought was about the future of computing. 

&gt; ""Continuum assumes that if the center of computing has shifted from the PC to the phone""

No, continuum is a UX which allows devices to adapt to changing use cases. 

&gt; ""If there’s a piece missing from Microsoft’s cloud strategy and Continuum, it’s support for the legacy applications of Windows, software that in some cases predates the Internet""

What??? NO Continuum plus cloud virtualization IS that piece; how did they miss this?

&gt; ""Evidently the thrill of combat is not entirely gone at Microsoft.""

This author has an ax to grind and it is obvious. ",2016-06-21 14:41:11+00:00,d4i0esr,1,t3_4p4o0m,3338,microsoft
122,"So help me understand what you mean by, ""Over a week"" Have you had icons before? When/why did they go away? Are you on an Insider Build?",2016-06-21 14:20:58+00:00,d4hzku4,1,t3_4p2p7p,37978,Windows10
123,I would guess as much,2016-06-21 13:56:50+00:00,d4hyn13,6,t1_d4h9fhw,54477,Windows10
124,"I would like to see them install 5 super common extensions on each browser then run the test. To me this would be more ""real world"" 

To clarify, I think the test in this video is a good test. It just doesn't represent how I use my browsers.",2016-06-20 21:50:25+00:00,d4h71px,4,t1_d4h6qag,464,Windows10
125,That was my thought as well. I'd love to see the same test ran with a few extensions running,2016-06-20 20:45:42+00:00,d4h4b56,2,t1_d4h0f4l,5026,Windows10
126,"This is not a replacement for project, as of today. More of a task tracker. Think Wunderlist plus Trello.",2016-06-07 12:38:19+00:00,d3zcxha,2,t1_d3zcrsg,339,microsoft
127,"Bing is profitable

Xbox as a whole (including games) ~~might be~~ **IS**  profitable -/u/GrzegorzWidla

Office is profitable

Azure is super profitable

Surface is profitable 

SharePoint is profitable 

Server is profitable

~~I don't know about Skype~~

""Skype is indeed profitable"" -/u/GrzegorzWidla

""Exchange is profitable

Dynamics is profitable

Visual Studio is profitable "" -Thinks /u/McBeers

edit: Adding more details
",2016-05-27 14:23:02+00:00,d3lrk3v,1,t3_4lai25,6807,microsoft
128,"You can do this today with the desktop program. Under the view tab select ""Paper Size""",2016-05-26 12:47:29+00:00,d3kcbt0,2,t1_d3k5unf,20056,OneNote
129,does /u/MSOneNote have any comment?,2016-05-25 20:04:20+00:00,d3jiluk,2,t1_d3j9u1h,11358,OneNote
130,I see this comment and it seems like it should be reason to invest more into OneNote. Essentially the Word/Excel market is saturated. Microsoft has all of those users they will get. OneNote on the other hand is a huge growth opportunity for them.,2016-05-25 20:03:44+00:00,d3jikvb,2,t1_d3il97m,62677,OneNote
131,"I would like to know the answer to this question as well. All of the Office programs have a similar way of doing things

* Cropping and manipulating photos
* Add-Ins
* Macros
* Tell-Me
* Sharing
* etc.

I want to know why the OneNote desktop program has been ignored for the last couple of updates",2016-05-25 16:55:02+00:00,d3j9u1h,1,t3_4kw4p8,70618,OneNote
132,"Help me understand this, can you connect a controller to a Windows Phone wirelessly? or would you need adaptors and plug it in?",2016-05-25 16:46:58+00:00,d3j9ghj,3,t1_d3j4xaj,5973,xboxone
133,"Yeah, IDK why so many companies do it but I don't like it. ",2016-05-23 18:50:13+00:00,d3gpfkg,4,t1_d3gngf5,2650,Surface
134,"it is strange but tech companies refer to the entire line of a product as a single noun.

Here is Apple doing it with ""iPad"" https://www.youtube.com/watch?v=SgxsmJollqA ",2016-05-23 12:44:10+00:00,d3gaobf,2,t1_d3g7jel,9165,Surface
135,If you're in the Midwest it could be a female blue-grey gnatcatcher https://www.allaboutbirds.org/guide/Blue-gray_Gnatcatcher/id,2016-05-17 20:34:09+00:00,d39aag8,1,t3_4jhkqm,176448,bird
136,"Let me guess, you buy the cheapest appliance you can find. The problem is not the companies who make cheap products, the problem is the consumer who will flock to the lowest bidder and companies who focus on quality eventually go out of business.",2016-05-02 14:49:29+00:00,d2pog0o,2,t1_d2phuky,13738,todayilearned
137,"Not in messenger, in the Facebook app",2016-04-29 12:56:31+00:00,d2lzx42,3,t1_d2lscv3,23753,Windows10
138,"Everyone can criticize but no one can give a serious plan to curb the crisis occurring with internet connected computers right now. 

I agree with you that Microsoft is too aggressive, but I can't think of a better solution to the problems they face.",2016-04-28 16:30:56+00:00,d2kuzw4,4,t1_d2kut4h,242,Windows10
139,"So when you click a link it opens in a browser in the app, and when you hit the back arrow, it goes to the bottom keeping the tab available if you want to return to it. That is a cool feature! Good job Facebook!",2016-04-28 14:23:58+00:00,d2kpbse,1,t3_4gtv6p,4904,Windows10
140,"What is your plan to address all the computers which are very vulnerable to attack or already being used by Botnets to perform coordinated attacks? Is the answer that people should just get educated? Is the answer to accept the growing problem with Botnet attacks? 

What do you propose?",2016-04-28 14:20:02+00:00,d2kp5z1,2,t1_d2kb6es,35925,Windows10
141,"I am sure my computer *could* remember me, but I still have to check that box every time. It is the Silicon Dis.",2016-04-28 14:14:32+00:00,d2koy2p,3,t1_d2knduq,2476,technology
142,"Honestly, O365 is a good deal because it is the future. You can keep one foot in the past but as time goes on you will spend more and more time fighting with Office than actually getting things done. It is a decent price for a good product. I also strongly believe you should invest in the type of services you want to see succeed. I don't want to see Google's Ad-supported world expand so I pay for Office 365, I pay for Music streaming, this way hopefully more companies will always have a pay option and avoid making everything free with ads.",2016-04-28 14:11:28+00:00,d2kotqw,2,t1_d2klb74,6188,technology
143,I assume you keep all your cash in a tin can in your house because if you put it in the bank You're just letting someone else hold (and potentially data-mine or lose) your money.,2016-04-28 14:07:55+00:00,d2kooq0,4,t1_d2kmlbn,3446,technology
144,Microsoft has separate teams working on separate products. However with that said it is crazy that the touch keyboard on Windows 10 has not been modernized.,2016-04-25 14:40:12+00:00,d2gk8r0,1,t3_4gdgpf,1878,Surface
145,Apparently this is a fix: http://www.blackforce.co.uk/2016/04/20/surface-book-update-failed-intel-control-logic-0x800f0203,2016-04-20 15:29:05+00:00,d2aenk0,1,t3_4fn6f0,9165,Surface
146,I like it. I would love to see Microsoft open up the Start Menu to 3rd party devs. I wouldn't want exactly this concept but some elements would be nice.,2016-04-19 20:09:49+00:00,d29bpnd,1,t3_4fi97l,15183,Windows10
147,I think this is the core problem with Windows. The range of different people doing different things is so enormous that Microsoft cannot possibly make a change without either endangering one group or enraging another. Also people who do very technical things frequently don't bother to make their personalized complex customizations. Then when the OS assumes the person is non-technical and does things automatically those people freak out.,2016-04-18 18:16:32+00:00,d27t0y4,2,t1_d27epjt,22115,Windows10
148,"At Build this year Microsoft announced action center in the cloud, this would enable notification mirroring on Windows phone and Android ",2016-04-16 02:01:10+00:00,d24sgtt,2,t1_d24akb6,27788,Windows10
149,To surface more content and make the big tiles more useful for programs like Office. Also to reduce the number of clicks. I would think for the non-power users it would be a natural way to get to content quickly,2016-04-15 18:37:20+00:00,d24bfq1,2,t1_d24aodh,1011,Windows10
150,I am an HP Spectre x360 and my computer will not shut down using the start menu item.,2016-04-13 21:26:06+00:00,d21pyyg,1,t3_4em1e9,21967,Windows10
151,"My guess would be that since phone screens are so small, people expect the ink resolution to be really fine, and to achieve that resolution the CPU has to work really hard killing the phone ",2016-04-11 16:29:08+00:00,d1ylov7,4,t1_d1yl7eq,642,windowsphone
152,"I can't tell if MS is just oblivious, or if ink on mobile devices is really difficult to do well, because it seems like no brainier to me",2016-04-11 16:05:52+00:00,d1ykn8p,2,t1_d1yj544,2084,windowsphone
153,I am 99% sure this is on Adobe for not developing the thumbnail preview. I know some programs do interface nicely with the preview pane on Windows and others don't it is up to the developer ,2016-04-09 13:08:46+00:00,d1w3nzz,3,t1_d1vxnvh,23042,Windows10
154,"I am a Win10 user and my wife is a Mac users. I use her Mac a lot and I think I have realized why Mac users love virtual desktops and why Windows users don't care.

* Mac has terrible window management tools
* Mac has lots of random gaps and different features like hot corners making layout difficult
* Full screen on a Mac is strange and hides menu bars 
* Windows has Aero snap 
* Windows can easily maximize a window without obscuring the taskbar
* A good work flow on a Mac is to manually lay out your windows before getting to work
  * This means once a layout is set it Mac users don't want to move the windows around so they just go do a different desktop
* Using Windows users can just quickly snap programs to one side or the other so there is no reason to preserve windows layouts with different desktops.

Those are my thoughts. I'd be curious what other Mac and Windows users think. Personally when Microsoft announced virtual desktops in Windows 10 I was excited then when it came down to day to day use I never used them.",2016-04-06 15:45:39+00:00,d1s8el2,1,t3_4dm14i,3705,Surface
155,"I would be amazed if Microsoft let that happen, but anything is possible ",2016-04-05 12:58:03+00:00,d1qm0ql,3,t1_d1qkz5t,2187,Surface
156,A lot of the announcements from build were bittersweet because they were way way overdue. This is one of those announcements ,2016-04-05 12:56:20+00:00,d1qlywe,2,t1_d1pw8m5,54023,Surface
157,That would be so amazing ,2016-04-05 12:55:14+00:00,d1qlxpl,3,t1_d1qeikv,24123,Surface
158,One year since Build,2016-04-05 02:24:20+00:00,d1q79ic,2,t1_d1q2mt8,6552,Windows10
