,body,created,id,nest_level,parent_id,reply_delay,subreddit
159,"&gt; I hope that this app will fix the annoyances of Skype.

The issues with Skype are far beyond the apps. The service is riddled with bugs.

So am I totally off base to think they announced Windows Passport last year? Also these APIs you mentioned are important and nice, but are they the APIs serious app devs were asking for?

I didn't really expect any Google news, I was just thinking Build would have been a good venue.

Showing a quick PR video is not enough for me. I want to see someone on stage talk about or acknowledge unified communications. 

I want to see Microsoft investing in Windows Mobile even if they don't push it. It seems like the things which would make it look very appealing (app hand-off, unified communication, project my screen 2.0, and more) are being avoided which is crazy to me! at the very least talk about how you are experiementing with the platform",2016-04-05 02:23:58+00:00,d1q78zk,2,t1_d1q0shl,9264,Windows10
160,"Wow! Thanks for this link, surprisingly thorough. I was unaware of most of those",2016-04-05 02:09:14+00:00,d1q6miv,2,t1_d1q28l8,6224,Windows10
161,"Oh man that was hard to watch. Microsoft is a company out to make money just like every company. They make some bad decisions and some good ones. A similar video could be made for nearly every company existing today, that isn't horrible or evil it is just people trying to make as big as possible return on their investment.",2016-04-04 20:53:43+00:00,d1ptj4i,1,t3_4dc6gp,11463,microsoft
162,Keep a notepad near by and write down what you did then write down how it tasted ,2016-04-02 20:37:31+00:00,d1nc6k6,1,t3_4d304d,2877,Coffee
163,You can buy a new pen for $50 if you can't find a good seller with what you want,2016-04-02 15:38:36+00:00,d1n1hxg,3,t1_d1n1ghk,72,Surface
164,The new pen is much better! The SP3 pen tends to lay ink before the tip actually contacts the screen. Also the eraser is more natural on the new pen. ,2016-04-02 15:35:16+00:00,d1n1dw4,1,t3_4d1vxi,822,Surface
165,"The desktop GUI is totally fine. GIMP, Blender, Libre Office, and the game catalog are all fine. If that those programs are enough for you then great! They are not enough for me, today. 

I know 0 creative, engineering, design, writing professionals who use Linux as their OS and I don't think it is a coincidence. The quality of content creation programs is just not good enough. They are fine for some people just not most professionals.",2016-04-02 14:04:08+00:00,d1myon4,6,t1_d1ml4fc,41275,pcmasterrace
166,"I know it is possible, it just requires a whole other layer of management between getting work done ",2016-04-02 02:01:56+00:00,d1mk17p,4,t1_d1mjcuo,1293,pcmasterrace
167,LOL. Good luck using any modern device that doesn't send telemetry back ,2016-04-01 15:41:41+00:00,d1lvtk8,2,t1_d1ls22b,5527,pcmasterrace
168,This is a great example of how Microsoft can add features to emphasize the advantages Windows has over the competition. Also some nice synergy with their Surface department.,2016-03-30 18:57:58+00:00,d1jf6eu,1,t3_4clnoc,7221,Surface
169,Out of curiosity how would a linux users working in Windows take advantage of this? what would they run?,2016-03-30 18:54:44+00:00,d1jf0x3,2,t1_d1jddcr,2121,microsoft
170,PEMDAS IS A LIE!! https://www.youtube.com/watch?v=y9h1oqv21Vs,2016-03-30 13:34:51+00:00,d1j0n0h,2,t1_d1iij31,43582,gifs
171,The photo is the [Hoan Bridge](https://en.wikipedia.org/wiki/Hoan_Bridge) in Milwaukee in case anyone is interested,2016-03-29 14:21:30+00:00,d1hoff4,1,t3_4cefcj,25220,QuotesPorn
172,Who made that logo? Is there a shirt I can buy?,2016-03-26 00:54:14+00:00,d1doxee,3,t1_d1djs9c,9176,SandersForPresident
173,"I have a Microsoft mouse and I need to go into the ""Microsoft Mouse and Keyboard Center"" every time I restart and switch the ""Flip Scrolling Direction"" off then on again. No clue what is up with that. The Mouse &amp; Trackpad section of the Setting app is a total joke though only 4 settings!! WTF come on Microsoft! call yourself a productivity company",2016-03-24 22:58:14+00:00,d1ce82z,1,t3_4btoqq,4978,Windows10
174,"This is a developer tool. Not a consumer product. They are a new product made in very small quantities. This price has been public for months. 

Also price of Oculus Rift + capable computer = ~$2,500 so... $3,000 isn't too crazy.",2016-03-24 18:54:43+00:00,d1c4050,2,t1_d1bzmvj,5767,microsoft
175,"They are making a new UWP, not just canceling the three separate apps",2016-03-24 18:51:27+00:00,d1c3upa,2,t1_d1bxq0w,8042,windowsphone
176,Orange is the new blackboard,2016-03-23 17:00:42+00:00,d1ao7w5,2,t1_d19z2jl,53480,tifu
177,This is not the best subreddit for this question. Try /r/windows or /r/techsupport ,2016-03-21 19:02:31+00:00,d186bsv,1,t3_4bddki,4114,microsoft
178,"Like most businesses Microsoft loves to make money. If they can make money with open source they love that. If they can make money hosting Linux in the cloud they love that. 

Microsoft and open source have a relationship similar to the relationship between concrete and grass. 

Concrete (Microsoft) very massive, capable, powerful, expensive, controlling, and hard to go without for many businesses. Alone concrete can embody huge structures and change the landscape in dramatic ways.

Grass (open source) very flexible, pervasive, unavoidable, clever, cheap, and hard to go without for many businesses. Alone grass provides oxygen, habitat, food, for a diverse ecosystem of beautiful grasslands.

Together concrete and grass can form wonderful gardens, parks, flower pots, and so many great unique experiences.",2016-03-11 19:53:08+00:00,d0wcbmk,1,t3_49z5vn,17045,linux
179,"are hidden folders captured by ""Folder Contents""? I don't use hidden folders so I cannot say for sure",2016-03-11 19:25:02+00:00,d0wb4i3,3,t1_d0w9gra,2331,onedrive
180,Does this build enable SMS/MMS via PC yet?,2016-03-11 17:49:00+00:00,d0w6zoe,1,t3_49uoeh,84731,windowsinsiders
181,Instead of selecting sub folders to ignore just deselect the entire folder and only select the folders you want to sync. This should do what you want,2016-03-11 17:43:32+00:00,d0w6rfu,1,t3_49zb8d,7080,onedrive
182,"Microsoft is a company who needs to maintain relevance. People who are not capable enough to avoid these ads probably won't care.

The title of the article should read, ""Company uses their free updates to their own self interest."" 

At least they made Windows 10 work on a massive number of existing PCs, and at least they are not selling user data to advertisers. ",2016-03-11 17:07:24+00:00,d0w58j9,1,t3_49x4rw,45516,windows
183,Yep! https://imgur.com/a/0J7zk,2016-03-10 15:46:49+00:00,d0us3ur,5,t1_d0urknj,785,battlestations
184,haha of course I left that out. It will NOT help. Your hands should not be at a different angle than your arms if at all possible,2016-03-10 15:29:18+00:00,d0ure8k,3,t1_d0uqp1g,1097,battlestations
185,"Sweet set up, so many computers. Although that keyboard angle is NOT going to help your carpel tunnel

edit: added the all important ""NOT""",2016-03-10 15:06:54+00:00,d0uqjka,1,t3_49tak9,8145,battlestations
186,The IT person who set up that computer obviously didn't do a good job. I don't see how that is Microsoft's fault.,2016-03-09 16:40:11+00:00,d0ticpo,1,t3_49omwq,3039,Windows10
187,"How do you think automation through robotics and machine learning will affect society in the short, medium, and long term? ",2016-03-08 18:56:03+00:00,d0scj45,1,t3_49jkhn,4653,IAmA
188,"I have no clue, but all laptops suffer from the same issue of screen wobble. Devices with kickstands do much better for that.",2016-03-06 23:05:02+00:00,d0q36ml,5,t1_d0q34sx,83,microsoft
189,"I like my x360, the only issue is the pen experience is lacking. ",2016-03-06 22:53:41+00:00,d0q2qxj,3,t1_d0q0u6u,3068,microsoft
190,"You are correct. I should have said, they have made no indication of moving their entire portfolio over to the Windows Store. Also, Adobe said they will bring Photoshop Elements and Premier Elements to the store last //Build... ",2016-03-05 03:28:57+00:00,d0o6d1b,8,t1_d0o0s1d,10570,microsoft
191,"Because Microsoft made Windows and created DirectX 12 maybe games bought from the store will be given an advantage in performance.

However there is no evidence to say Microsoft is doing this. Also, Windows Store will exist side-by-side with Steam/Origin/uPlay and all other traditional programs. Windows is just trying to compete with Valve, EA, Ubisoft, Apple, Google, Amazon, etc.

This article is mostly just fear mongering. ",2016-03-04 19:15:01+00:00,d0no7kf,2,t1_d0nmw5f,1802,pcmasterrace
192,"So out of curiosity, what would you say to companies like Adobe or Autodesk who say they don't plan to move their main products, (Creative Cloud, AutoCAD) to UWP? ",2016-03-04 18:33:35+00:00,d0nme3u,6,t1_d0nm02p,530,microsoft
193,"I'm not 100% sure UWP is the future for every Windows application, but I do think that UWP solves many issues that have plagued Windows for decades. 

My guess is it comes down to the target consumer. If your target consumer is tech savvy then you can afford to avoid the Windows Store, if your target consumer is not tech savvy then you cannot afford to avoid the Windows Store.

This whole thing reminds me of when Notch said Microsoft is making Windows a closed system... I couldn't believe how hypocritical that was coming from someone who had apps on iOS, Android, and Steam which are all ""Walled Gardens"" of content.",2016-03-04 17:47:22+00:00,d0nkcyj,4,t1_d0nhw60,3396,microsoft
194,So no official indication then?,2016-03-04 15:47:30+00:00,d0nf809,6,t1_d0nf4st,133,microsoft
195,"I assumed it was more of the Xbox feature set, like cross-play, cross-buy, achievements, etc.

I also assumed ""Windows features"" like dx12 would be open to any Windows devs.",2016-03-04 15:45:48+00:00,d0nf5j5,4,t1_d0need2,1136,microsoft
196,Is there any official indication that Microsoft is going to limit dx12 to UWP?,2016-03-04 15:44:19+00:00,d0nf3ep,4,t1_d0nex9z,252,microsoft
197,Is dx12 the feature that they are talking about here? Can applications/games not leverage dx12 without going through the store?,2016-03-04 15:03:50+00:00,d0ndjb5,2,t1_d0nc4b9,2431,microsoft
198,"Maybe the fees should be reduced, but really a consumer could pay (with time or money) a large amount trying to remove viruses, or paying for anti-virus software, or reinstalling Windows.

The app paradigm may have more clear and obvious costs, but it eliminates lots of the hidden costs of a 100% open platform.",2016-03-04 15:02:38+00:00,d0ndhpd,3,t1_d0nd0m4,805,microsoft
199,"Tech companies do lots of ""You scratch my back I'll scratch yours"" 

I wouldn't be surprised if Google struck some deal with Microsoft and Microsoft stipulated that Google make Windows 10 apps",2016-02-29 20:34:55+00:00,d0ih3gc,2,t1_d0i5xhn,15191,windowsphone
200,"""On average"" this means there are a small number of devs on Windows phone, and a few who make money. Compared to a huge number of devs on iOS and Android but only a tiny percent make any money.",2016-02-28 01:43:44+00:00,d0gf28h,1,t3_47z3xq,6333,windowsphone
201,I think a modern look on legacy icons is not a bad thing. Microsoft does not use skeuomorphism going forward with their new designs,2016-02-25 15:19:47+00:00,d0dawhi,4,t1_d0d7rmk,5618,Windows10
202,8128,2016-02-20 15:39:01+00:00,d073ezl,1,t3_46of9c,43450,pcmasterrace
203,"I was excited for the iPad Pro announcement because I wanted to see how Apple would innovate in the ""Surface"" category of devices. When they just made a bigger iPad with a  stylus I felt bad for all the creative professionals who would have loved an iPad Pro which ran Mac. 

Now Microsoft makes the best device for mobile creative professionals and Apple makes devices for the masses, it is funny how the roles have flipped.",2016-02-20 13:56:22+00:00,d070wan,1,t3_46pguu,15826,Surface
204,"Obviously Microsoft wants data. However, unlike Google Microsoft does not use the data they collect to serve ads, only to improve their products. Do you think Microsoft is somehow profiting directly from collecting the data?",2016-02-15 16:23:27+00:00,d00r6w8,6,t1_d00qn22,871,pcmasterrace
205,Could you clarify this. I still don't understand how Microsoft makes money off data they are not selling or sharing.,2016-02-15 15:41:19+00:00,d00pmeu,4,t1_d00or0a,1505,pcmasterrace
206,That guy is drinking Spotted Cow! I love that beer!,2016-02-15 15:40:34+00:00,d00plgw,1,t3_45wgze,7640,pcmasterrace
207,"I totally agree with you. Automatically downloading a huge update is an issue and no company should do it, not just Microsoft. 

While it is understandable why Microsoft initially thought it was a good idea... they should not have gone forward with the pre-loads. One new hurdle that Microsoft is trying to over come with Windows 10 is that many people don't need a PC and have an old out of date image of PCs in their mind. Also many people have the mind set of ""my computer works, why change anything?"" which is totally fair, but not good for Microsoft.

All this to say, I agree the updates are too aggressive, but I see where Microsoft is fighting to stay relevant and needs to push updates hard... but not too hard.",2016-02-15 15:12:24+00:00,d00omh2,4,t1_d00ny84,1278,pcmasterrace
208,"I see people whine about Windows 10 on Facebook, from their Android phone... I find it so funny!",2016-02-15 14:36:31+00:00,d00nieg,4,t1_czzzs05,58488,pcmasterrace
209,"Yes and no. The product is the money you may spend in the app store. 

In the EULA Microsoft states they do not sell or share data. How exactly do you see Microsoft making money on ""You"" if they are not selling data?",2016-02-15 14:35:25+00:00,d00nh7d,2,t1_d00jxqx,10184,pcmasterrace
210,Learn some Group Policies. That is how IT staff can customize Windows to whatever they need. You can do anything (including break your computer) with Group Policies.,2016-02-15 14:32:50+00:00,d00negt,2,t1_d003aef,52013,pcmasterrace
211,Welcome to modern computing.,2016-02-15 14:30:44+00:00,d00ncdx,3,t1_czzyzdy,59501,pcmasterrace
212,"The huge majority of Windows users do not care about their computers. They download crap software and break their computers over time from misuse. 

Microsoft wants to bring their non-technically minded customers into an app paradigm which should make their computers last longer and not be as exposed to viruses as previous versions. 

Also, Microsoft makes money when people buy apps, so they want more people using apps and buying them to make money continuously.

Finally, since Windows represents 90% of computers world wide, Microsoft has a unique obligation to prevent their software from being used in a malicious fashion. Many of the ""zombie"" computers around the world used to preform DDOS, spam bots, etc, are infected Windows computers. With Windows 10 Microsoft can force updates and prevent their OS from being used as a tool by criminals.

Anyone who is really concerned with privacy should be able to use group policy to block any part of Windows 10 they want. ",2016-02-15 14:26:00+00:00,d00n7hj,2,t1_d009i5m,40141,pcmasterrace
213,"Bbbbbbbbbbbbbbbbbrrrrrrrrrrrrrrrrrrrtttttt!
",2016-02-13 15:41:04+00:00,czyikzs,1,t3_45ix9g,36699,videos
214,"There is a policy at most big international companies to manufacture your product as close to your consumer as possible. The fewer things you need to consider when pricing or adjusting price the better. 

When the exchange rate changes between your company headquarters and your customers that is one thing which cannot be controlled. But you want the rates between your product and your customers to be as low as possible and you can control that.",2016-02-12 16:35:38+00:00,czxfuoz,3,t1_czx305v,33061,videos
215,"With the Garage project Microsoft is trying to bring apps their employees make in their spare time under the ""Microsoft Umbrella"" If there was no Garage project then the employees would build the apps and self publish then if the app is successful they would leave Microsoft and make a company. 

Really this to me is all about talent retention. Microsoft employs a bunch of Android and iOS developers who don't have Windows coding skills.",2016-02-12 14:32:52+00:00,czxb255,1,t3_45c1on,50264,windowsphone
216,"That looks like a Windows ""Tip"" which pops up and tells you about different features in Windows 10 to encourage you to try the new capabilities. You can turn those off if you want to.",2016-02-04 14:14:28+00:00,czniy7e,1,t3_445593,4437,Windows10
217,"Here is a cropped screenshot:
[Image](http://i.imgur.com/0fLmmrQ.png)",2016-02-02 15:13:11+00:00,czl10rx,3,t1_czl0dgh,1148,windowsphone
218,"Any Bluetooth keyboard would work. MS sells a few, but they are very common and made by lots of different people: 

http://www.amazon.com/s/ref=nb_sb_noss?url=search-alias%3Daps&amp;field-keywords=bluethooth+keyboard 

https://www.microsoft.com/accessories/en-us/products/keyboards/universal-foldable-keyboard/gu5-00001 

https://www.microsoft.com/accessories/en-us/products/keyboards/universal-mobile-keyboard/p2z-00001 ",2016-02-01 20:50:33+00:00,czk4pmx,1,t3_43prn4,9104,Surface
219,"Small bugs which still persist:

* Start icon still grey box in task switcher
* Icons missing in the All apps list from, Weather and Groove
",2016-02-01 20:22:22+00:00,czk3hev,1,t3_43ppk2,8066,windowsphone
220,https://www.youtube.com/watch?v=P2uUDkMYtrQ ,2016-02-01 17:34:18+00:00,czjw8o5,2,t1_czjrgs0,7117,microsoft
221,"Essentially:

**BILL GATES WAS ONCE A RUTHLESS BUSINESS MAN, probably why he is the richest man in the world.** 

 NOW CLICK MY ARTICLE SO I GET AD REVENUE!",2016-02-01 15:14:03+00:00,czjqp6s,2,t1_czjpv22,1525,microsoft
222,"nah, I don't want them to promise anything else. They've given themselves a ton of work already. I'd love to see some delivery on their old promises.",2016-01-31 14:26:34+00:00,cziksri,2,t1_czijyom,2456,windowsphone
223,"Yes, you can send single SMS through Cortana, but not SMS/MMS and no receiving messages.",2016-01-30 23:04:13+00:00,czhzroz,2,t1_czhz45v,1206,windowsphone
224,"I am not making an assumption that apps are better. I'm using apps as an indicator of investment. Google is heavily invested in the web, but they still invest in apps on iOS and Android. Native apps tend to perform better, be more feature rich, less sensitive to network connectivity, and take better advantage of hardware features (play pause buttons, hardware decoding, extra sensors, etc.)

If anything all this shows that Google does not invest long term into their products, but instead invests in new products or technology. This is not inherently a problem, but for people who rely heavily upon Google's products it could become a problem.

Personally I used to be invested in Google products, but they rarely improved and were frequently killed in favor of a different product. This made me nervous about investing time or resources it products which could be gone in a year. 

On the other hand Microsoft epitomizes the other side of the investment and support coin. Because Microsoft supports so many products for such a long time they spread their resources thin and are frequently prevented from innovating or taking risks because their customers are so static and change resistant. 

Neither company is clearly better, just different. Microsoft suits me for some things, Apple other things, and Google other things as well.  ",2016-01-28 22:23:00+00:00,czfo8cf,9,t1_czfnhfs,1082,windowsphone
225,"That is a foolish way to look at consumers. All companies share customers whether they like it or not. This is not a bad thing. No single company can lay claim to a customer and prevent them from spending their money elsewhere. 

Companies should be constantly competing to win customers.",2016-01-28 21:38:07+00:00,czfmc6g,4,t1_czfbtwb,14401,windowsphone
226,"**Let's look at productivity:**

Microsoft 

* Word, Excel, PowerPoint, OneNote, OneDrive, Outlook
* Native apps - Windows, Universal Windows, Mac, iOS, Android, Chrome, Amazon App store, Web

Apple 

* Pages, Numbers, Keynote, Notes, iCloud, Mail
* Native apps - Mac, iOS, Web

Google

* Docs, Sheets, Presentation, Slides, Drive, Gmail
* Native Apps - Windows (Drive only), Android, iOS 


Now which company has a financial interest in productivity, Microsoft. So, obviously they would have the best support. If Google really cared about their customers they would build native apps on Windows to give them a good experience.


**Let's look at music:**

Microsoft Groove

* Native Apps - Universal Windows, iOS, Android, Web

Apple Music, via iTunes

* Native Apps - Windows, Mac, iOS, Android

Google Music

* Native Apps - Android, iOS, Web

Now here Apple has the vested interest, and has the slight lead. So if Microsoft doesn't care about Music why would they build apps for Android and iOS? Because they understand people are diverse purchasers and just because you use an iPhone doesn't mean you don't use Microsoft services. Google knows Windows has the vast majority of the desktop marketshare, but doesn't build a native Windows app, why not? If you think ""Web is enough"" is the answer look at Spotify, Pandora, and iTunes.

I'm not trying to say Microsoft is this altruistic company, but they do tend to support their customers even when they are in different ecosystems. Other examples Xbox, Yammer, Skype, Skype for Business apps for iOS and Android.

I would love to see a YouTube app for Windows, or a Gmail app to compete with the Outlook Mail app. But, alas Google is silent on the topic, which is a bummer for competition and for their shared customers. ",2016-01-28 21:35:49+00:00,czfm8le,7,t1_czfi73j,5534,windowsphone
227,"Apple has &gt;10% of the desktop marketshare, if they made:

 * Safari 
 * Aperture 
 * Final Cut
 * iWork
 * iLife
 * etc.

for Windows they would reach way more potential customers, but they've decided not to, because they want people buying their computers. 

Google on the other hand is less of an obvious case because so many of their products are cloud based, but they know by avoiding Windows Phone they will have a negative affect on it, this is a fine business strategy. Though Microsoft's Bing is the only major threat to Google's monopoly in search (which is still where Google gets 90% of their revenue) and Google must protect their profits like every good business does.",2016-01-28 18:07:23+00:00,czfd3tw,5,t1_czfbzep,1544,windowsphone
228,"Microsoft is a business, they follow large chunks of their paying customers like any good business should.

 &gt; Don't assign some random moralistic motivation here

Good advice....... maybe you could take it.

Microsoft was dominant in desktop OS share, now that they are lagging in mobile they aren't standing their ground and punishing their customers. Instead they are hopping on the iOS and Android train with hopes they'll make... more money... because they are a business.",2016-01-28 17:59:48+00:00,czfcs1i,5,t1_czfbx5f,1176,windowsphone
229,"Agreed. Even though Microsoft was forced to chase their customer to other platforms due to their low marketshare in phones and tablets, they still did. I don't see Google or Apple following their customers to Windows 10.",2016-01-27 18:32:45+00:00,cze49oq,3,t1_cze2hav,2388,windowsphone
230,"Honestly, I think the best thing about Microsoft's ecosystem is that you don't need to be running MS hardware or OS to reap the benefits of the whole ecosystem.

For example, 

 * OneDrive is available on every major platform and the web.
 * Groove is on Windows, iOS, Android, and the Web
 * Cortana is on Windows, iOS, and Android
 * Xbox app is on Windows, iOS, and Android
 * Skype sucks on every platform, even the web!

I like the fact that even though I pay for Office 365 I am free to buy whatever phone, tablet, or laptop I want and not worry about support. To me that is a true focus on the customer.",2016-01-27 15:23:29+00:00,czdw60g,1,t3_42wib5,26316,windowsphone
231,"I started with Iced Mochas and now I love black coffee and everything in between.

One thing you can do to try out different coffees at Starbucks would be to order a drink on the [Clover](http://www.starbucks.com/coffee/learn/clover) if a store by you has one. That way you can try a great cup of fresh brewed coffee and try different types of roasts and get a taste for the variety in coffee.

If nothing else do this, when (if) you order coffee at least taste the coffee before adding cream and sugar. You will probably add less, and you will know the taste of the coffee before smoothing and sweetening the drink.",2016-01-27 15:10:24+00:00,czdvor3,1,t3_42xh87,5754,Coffee
232,"I'm getting an error, Your account cannot view this feedback. Anyway I'll look for them. 

Regarding this issue. Something to pass along, I was days from dropping Windows Phone for an iPhone because it was unacceptable that my phone was eating my limited data plan with no way for me to stop it.",2016-01-21 20:32:24+00:00,cz6x9hj,4,t1_cz61fsl,64247,windowsphone
233,What feedback specifically should I +1? I tried to search the feedback app but I couldn't find this problem posted,2016-01-21 01:46:58+00:00,cz5zd9h,2,t1_cz5yk7b,1262,windowsphone
234,"I've turn message sync off, and now I'll wait. Hopefully this fixes it. Thanks for sending this my way!",2016-01-21 00:13:56+00:00,cz5vtq9,2,t1_cz5vcr3,710,windowsphone
235,I turned my feedback to basic but still had this problem,2016-01-20 22:04:47+00:00,cz5qlsg,2,t1_cz5pzw6,809,windowsphone
236,Settings &gt; Network &amp; Wireless &gt; Data Usage &gt; (near the bottom of the page) press the 'Don't Allow' to stop the use of Cellular data when WiFi is limited ,2016-01-20 21:06:02+00:00,cz5nxvh,3,t1_cz5l6l0,3613,windowsphone
237,"When I'm on WiFi the ""System"" traffic goes over WiFi. The problem is when WiFi is off or not available the traffic goes over cellular.",2016-01-20 19:22:23+00:00,cz5j7va,2,t1_cz5ipdu,692,windowsphone
