,body,created,id,nest_level,parent_id,reply_delay,subreddit
238,yeah that is crazy I have a few text conversations with people and my app takes ~40% by noon. It is so crazy. It is also crazy how inconsistent builds seem to be from phone to phone.,2016-01-13 18:37:42+00:00,cywwdk4,6,t1_cywvtlw,746,windowsphone
239,oh I've tried. the app still sucks battery. ,2016-01-13 18:28:43+00:00,cywvz84,6,t1_cywvtys,194,windowsphone
240,"I was just curious, I think the build for Windows 10 Mobile is the same for 950/950xl users and Insiders",2016-01-13 18:21:55+00:00,cywvo6d,6,t1_cywvg07,312,windowsphone
241,"I think the Skype+Messaging app is the source of a lot of issues for my phone. The app kills battery life, crashes all the time, hangs all the time, the Skype integration is breaks regularly. All this is rough because the Skype integration could be awesome but it is aweful",2016-01-13 18:17:46+00:00,cywvhok,4,t1_cywvba9,240,windowsphone
242,Are you a part of the Windows Insider program?,2016-01-13 18:14:01+00:00,cywvbnr,4,t1_cywv9in,82,windowsphone
243,Do you use the Messaging app with Skype integrated?,2016-01-13 18:09:05+00:00,cywv3zj,2,t1_cywuj1d,794,windowsphone
244,I don't think the privacy model or the driver stability will change significantly going from 8.1 to 10. ,2016-01-13 16:34:51+00:00,cywr0iq,2,t1_cyw934z,44573,windows
245,"it is very stripped down, and i think you can 'favorite' channels. But i do agree it would be nice to have a ""Stream Your Local Channel"" button. ",2016-01-07 15:36:50+00:00,cype3ms,4,t1_cypdvgg,371,windowsphone
246,Windows Phone has an FM radio app which uses your headphones as an antenna if you want live NPR,2016-01-07 14:37:42+00:00,cypc2xm,2,t1_cyp7zlo,10657,windowsphone
247,"I enjoyed the video, the shots looked great. One thing I'd change, shorter clips. I don't know what you are editing on but if possible lining the cuts up with the song makes a big difference and can give more purpose behind the length of each clip. Luckily you've already gotten some awesome shots to work with and shortening up the video should be fairly straightforward!",2015-12-28 18:47:05+00:00,cye1a37,2,t1_cydyaux,4714,Coffee
248,"Technically, but really the truth is more complicated than that. http://www.onthemedia.org/story/polls-obscure/ ",2015-12-08 13:40:24+00:00,cxrhfrp,2,t1_cxr559x,35181,technology
249,"Yeah I suspected that app, but I had been logged in since the Skype features were integrated and I haven't been having battery issues until lately ",2015-11-09 20:43:04+00:00,cwuhypo,4,t1_cwuhi7y,623,windowsphone
250,"When I look at battery usage the chunk to background processes is huge, but there are no apps which stand out as being greedy in the background.",2015-11-09 20:29:32+00:00,cwuhd7j,2,t1_cwuh5i8,294,windowsphone
251,Surface is just a normal PC. If you can download videos to an SD card today on any other PC then you can do it on a Surface. ,2015-11-09 15:09:04+00:00,cwu3zx1,1,t3_3s4wk9,2640,Surface
252,when you auto hide the taskbar can you see the entire message?,2015-11-09 14:55:35+00:00,cwu3jty,1,t3_3s3pw4,31474,Windows10
253,"Excel 2013 enables multiple windows of Excel to be open at the same time. Multiple windows of a single document can be done by clicking the ""New Window"" button in the Window group under the View tab.",2015-11-04 18:21:29+00:00,cwoeh77,2,t1_cwodbab,1581,IAmA
254,"This functionality has been replaced by OneNote.

See: http://www.winbeta.org/news/legacy-desktop-programs-microsoft-still-include-windows-10",2015-10-29 13:37:18+00:00,cwh435w,1,t3_3qni1a,39298,Windows10
255,If you like using Multiple Desktops I think you can set 4 finger swipe to switch between desktops ,2015-10-27 13:38:10+00:00,cwejtdi,3,t1_cweb8q6,28758,Surface
256,"hahahahahahahahahahahahahahahahahahahahaha


k",2015-10-21 18:15:34+00:00,cw7vlia,4,t1_cw7v34d,730,Windows10
257,"I'm not expecting the Groove team to get their act together, this is more about the Windows team making these changes.",2015-10-21 17:55:25+00:00,cw7uqoe,4,t1_cw7ug9v,402,Windows10
258,haha so blunt. Okay so why do you think they won't? MS has done a lot in Windows 10 I thought they would never do.,2015-10-21 17:41:59+00:00,cw7u5um,2,t1_cw7u33v,107,Windows10
259,Under the Messaging app settings there is a section for History &amp; Sync and an option for Sync messages between devices... so it should be coming soon!,2015-10-21 14:59:45+00:00,cw7neri,3,t1_cw6x9lq,60353,windowsphone
260,"I'm not sure off the top of my head, I'll look into it.

edit: Just checked. 320kbps ",2015-10-21 13:57:00+00:00,cw7l4tv,4,t1_cw7gvyp,10798,Windows10
261,mp3s purchased in Groove are DRM free. ,2015-10-20 17:02:42+00:00,cw6jyig,2,t1_cw6iwxt,1505,Windows10
262,ITT: People pointing out there are cheaper options,2015-10-17 03:52:34+00:00,cw2nadf,1,t3_3p1ysv,15067,Surface
263,A phone app was included with the latest build,2015-10-16 15:38:26+00:00,cw1xfr4,3,t1_cw1uup3,4055,Surface
264,Are you in the Insider Program?,2015-10-16 13:34:16+00:00,cw1szsk,1,t3_3oyub5,17385,Surface
265,"I'm not too surprised. The release of Windows 10 would probably hurt hardware sales. The release of Windows 10 specific hardware would probably help hardware sales, and the big OEMs, Dell, HP, Lenovo, Acer, Asus, etc. are just now releasing their new hardware lines designed for Windows 10.",2015-10-09 18:49:32+00:00,cvtzv2d,1,t3_3o44t8,9968,microsoft
266,"My point exactly. Not incorrect, good use of style... IDK fine by me.",2015-10-06 20:22:23+00:00,cvqhqv2,2,t1_cvq8dcj,13628,xboxone
267,"I don't feel like this does anything. They used the correct meme, the style all fits. Who really cares",2015-10-06 13:50:07+00:00,cvq2axr,1,t3_3np703,4703,microsoft
268,I'm 24 on my 4th Windows Phone,2015-09-28 19:44:39+00:00,cvh8io2,1,t3_3mpaon,19459,windowsphone
269,Were you running 10536 before getting Denim? If so do you notice any performance differences?,2015-09-18 20:11:26+00:00,cv68o68,4,t1_cv67uil,1297,windowsphone
270,Let me know how this goes for you.,2015-09-18 15:55:21+00:00,cv5yof7,2,t1_cv5swp5,9832,windowsphone
271,"oh I read, ""Why are there minions in my Skype?"" as you want to know why there are minions in your Skype. 

As for how to remove them, I don't think there is a way as of now, just don't click the other buttons and stay on the standard emoji tab",2015-09-17 18:55:59+00:00,cv4zlpo,3,t1_cv4zfdd,262,skype
272,"Read all about it:
http://blogs.skype.com/2015/09/15/mojis-express-yourself-on-skype-like-never-before/",2015-09-17 18:48:41+00:00,cv4zb97,1,t3_3lbym1,1490,skype
273,"Here are the results as of 9:00 CST 9/16/2015
http://imgur.com/ZL2iLFc ",2015-09-16 15:04:34+00:00,cv3jc6m,2,t1_cv2l218,75110,Surface
274,I can see it here are the results as of 9:00am CST 6/16/2015 http://imgur.com/ZL2iLFc ,2015-09-16 15:04:09+00:00,cv3jbna,2,t1_cv3d5ds,13089,Surface
275,I made a similar chart: http://imgur.com/ZL2iLFc ,2015-09-16 15:03:41+00:00,cv3jayq,2,t1_cv3aftp,24932,Surface
276,If you restart the Windows Explorer process it fixes this. Not forever but it brings the icons back without needing to restart your entire PC,2015-09-03 15:14:22+00:00,cupbaln,1,t3_3jgvud,21055,Windows10
277,"It would be awesome if you could add iOS or Android devices, but if Microsoft brought that feature to Windows 10 Mobile first and refined it before trying it elsewhere that would be sweet.",2015-09-01 22:23:02+00:00,cunitr3,2,t1_cuniboq,834,Windows10
278,"Windows 10 Mobile could have a similar feature. Task View could be accessed via the long back button. 

Also, people always say I like Windows 10 but there is no incentive to get a Windows Phone, this concept would be a reason why people using Windows 10 should give Windows 10 Mobile phones a second look.",2015-09-01 21:44:30+00:00,cunheqc,2,t1_cungt3x,964,Windows10
279,Yeah I would. I want apps but I want them on the desktop in floating windows. There is no good way to set a timer/stopwatch/alarm in Windows 7 and that is nonsense. Want a lightweight app to track to-dos welp open your entire OS to a potential virus. Just crazy!,2015-09-01 19:26:34+00:00,cunbzut,1,t3_3j8cvr,13118,Windows10
280,Removed the space inside the bracket... still nothing. odd,2015-09-01 18:53:56+00:00,cunaprc,6,t1_cuna0o1,1050,Windows10
281,"Added a space, no change on my end.",2015-09-01 18:16:10+00:00,cun97kz,4,t1_cun95z9,68,Windows10
282,"I don't know how others would use this but here is how I would use it:

 * Listening to media during commute, come home grab music app from phone and continue listening on my desktop
 * Writing an email on my desktop, but I want to go into another room to get feedback from my wife, drop the app from my desktop to my laptop
 * Find a show I want to watch on my desktop, drop it on my laptop to watch in another room
 * Copy text on my desktop then access the clipboard on my phone to paste

I'd love to see what you could make with this concept, go for it!",2015-09-01 18:02:04+00:00,cun8nlx,2,t1_cun79nw,2094,Windows10
283,"here is [the link](Windows-Feedback:?contextid=214&amp;feedbackid=63a3791a-2d18-45d7-b8cf-9b555d23b38e&amp;form=1&amp;src=2) I copied from the Windows Feedback, but I don't know if it will work or not.",2015-09-01 17:24:12+00:00,cun75fz,2,t1_cun65iv,1492,Windows10
284,"Snowden said that no matter how careful you are, the government will go behind companies back, hack networks, break encryptions, and get their data. 

Microsoft, Apple, Google, Amazon, etc. all fight the NSA, but Snowden proved that it doesn't matter, they still hacked Gmail, they compromised internet traffic. MS collecting crash data or sending searches to Bing is nothing compared to what the NSA did.",2015-08-28 15:34:00+00:00,cuipggs,3,t1_cuinv24,2515,Windows10
285,"ITT: People who have a bunch of ideas, but no proof.",2015-08-28 13:37:36+00:00,cuilby4,1,t3_3iomho,36217,Windows10
286,"True, but if you're living in Windows just cut to the chase and get a PC which can transform, has an active stylus, and a touch screen.

If you're developing apps for touch devices, having a touch screen to debug would be nice. If you don't want it don't use it, but if you do want it and don't have it... you're stuck",2015-08-26 21:11:49+00:00,cugq42f,5,t1_cugpr0p,559,windows
287,"The university you attend could have a big affect on that. Do they prefer Unix based systems? Or do they have a more generaic approach to coding where any OS would work with any IDE. In which case I would say there are some awesome free IDEs for Windows which are good stepping stones into the real world of Visual Studio, but if you plan to do web/server/iOS/Android dev then Unix (Mac) would be better.",2015-08-26 20:39:13+00:00,cugosny,3,t1_cugofum,504,windows
288,"Mac Laptops are stuck with the same issues as PCs, except they are also limited in their software and hardware. 

If you use Windows you can do anything. 

If you get an Apple laptop you are limited to Design, Video editing, and Unix based coding. 

Windows 10 is so awesome and when I use my wife's MBP it is so painful. Bad keyboard shortcuts, strange UI which looks to be built for touch... but there are no touch Apple laptops, zero customization options, walled garden of device compatibility. 

Ultimately the best device is the one which you prefer working on, they are so similar when doing most things. Know all the platforms and you'll be fine.",2015-08-26 18:46:08+00:00,cugk3m5,1,t3_3igvth,16569,windows
289,"Yeah, 8 was awesome on touch machines, 10 is better over all, but still has a long way to go to capture the same feeling 8 had on tablets.",2015-08-19 15:22:50+00:00,cu8bn0d,2,t1_cu8ahal,1854,microsoft
290,Thanks for the reply. It is always interesting to see how people interact differently with technology. I think the main principle MS forgot through all this would be Windows users are so diverse a small change to their policy can really negatively affect users.,2015-08-14 19:56:18+00:00,cu35guu,13,t1_cu25fx0,75578,pcmasterrace
291,"I'm honestly not trying to be difficult. How do you think your experience differs from people who are not as cautious as you? 


Take me for example I use Windows 10, Edge, and Firefox, Windows Phone, and use Facebook, Twitter, and Reddit, sometimes I shop on Amazon, I have a gmail but fwd it to my Outlook.com, I use Bing and Google interchangeably, I message with SMS, MMS, Skype, Viber, and Google hangouts. 


If someone did a risk analysis comparing you and me; in the digital identity chapter how would I differ from you? (again I'm not trying to be difficult, I'm just trying to understand a different point of view)",2015-08-13 21:16:32+00:00,cu21srt,11,t1_cu1x7yq,6789,pcmasterrace
292,"I don't believe that link on its own, if there was another source off 4Chan to corroborate the evidence then that would be HUGE news. 

People freaking out about this still avoid the question: if you're so concerned (which is good) about privacy, tell us how you manage to live and work in today's world without being data mined; what smartphone OS do you use? what browsers do you use? are you on any social networks?",2015-08-13 17:43:34+00:00,cu1t1kq,9,t1_cu1sqvy,423,pcmasterrace
293,"Since you seem to be concerned with ""having your information stolen"" what browser, smartphone OS, and social media sites do you use?",2015-08-13 16:20:43+00:00,cu1pmk7,7,t1_cu1n1az,3983,pcmasterrace
294,"I totally believe I could learn Linux in a few months, but it is a cost benefit analysis. I'm giving up months to learn this, and also giving up lost of seamless compatibility, for what? to save $100? to have complete control of my OS? to support open source software? IDK it just isn't worth it to me.",2015-08-13 14:34:38+00:00,cu1lldv,5,t1_cu1l3an,866,pcmasterrace
295,lol wut? People are just saying they don't think it is a big deal... that opinion is just as legitimate as people thinking it is a big deal.,2015-08-13 13:33:07+00:00,cu1jl5d,2,t1_cu19xtz,30794,pcmasterrace
296,"I'm not prejudice against Linux, I've tried using it many many times with the same result, it is a pain in the ass to do basic things. I don't have time or energy to relearn every program and function of my computer.

I think Linux is awesome and should continue competing with Microsoft and Apple because a free alternative is good for consumers.

However, I know most people don't care about their OS or the programs they use, they just want to get their work done and be done.",2015-08-13 13:19:17+00:00,cu1j6ui,3,t1_cu1gjq3,7163,pcmasterrace
297,The majority of MS revenue comes from enterprise. Also they will sell a ton of Win10 licenses when they come on new PCs. MS isn't loosing a sale by giving the update to Win7 and Win8 users they are just getting everyone on the same playing field. Very few people will ever upgrade and almost none when it isn't free. Making it free enables them to pitch the platform to developers and claim they have a ton of users,2015-08-13 12:45:11+00:00,cu1iaof,2,t1_cu18204,32090,pcmasterrace
298,"All the new stuff can be turned off. If you know what you're doing you can go online and get a list of the registry hacks to turn everything off.

Mostly though the stuff you can't turn off has to do with error reporting.",2015-08-13 12:43:02+00:00,cu1i8ro,4,t1_cu1d1lf,18827,pcmasterrace
299,Just use a local account. It's not that hard to turn these things off,2015-08-13 12:41:01+00:00,cu1i71h,3,t1_cu17ui9,32269,pcmasterrace
300,I was drawing the difference between an Android docking device and a Windows 10 Mobile docking device. I understand other companies have tried to do what MS is doing.,2015-08-05 20:09:25+00:00,ctspwfn,4,t1_ctsmxry,4105,windowsphone
301,"The difference here is that Microsoft realizes people don't want to use their phone as a laptop/computer if there is nothing to do on it but phone things. 

So with Universal Windows Apps developers can write a single app which will run in different formats for different devices, or different device states. For example if you project your phone to a screen and attach a Bluetooth mouse and keyboard the apps now display in a bigger more powerful desktop mode, then when those devices detach the app goes back to the phone display state.",2015-08-05 16:18:02+00:00,ctsfxep,2,t1_ctsattb,7978,windowsphone
302,"The code name for Windows 10 was Threshold, which is an architectural term and from the Halo series ",2015-07-31 13:26:50+00:00,ctmqr8z,1,t3_3f8qrf,38312,windowsphone
303,What are some of the specific things you miss? I use a Spectre x360 in tablet mode and it works just fine.,2015-07-30 21:08:49+00:00,ctm0kum,5,t1_ctls346,11919,Surface
304,you can. the cost is to remove ads,2015-07-29 16:37:33+00:00,ctkfc9h,2,t1_ctk97by,8822,gaming
305,It has been since Windows 8 launched... this is old news,2015-07-29 16:36:42+00:00,ctkfazo,1,t3_3f0jst,20095,gaming
306,Your question is the question everyone is asking. We'll see soon.,2015-07-28 01:02:43+00:00,ctigcds,3,t1_cti683y,16346,microsoft
307,"Microsoft has always struggled with making a consistent and compelling ecosystem. Windows 10 will begin the process of unifying Microsoft devices with a universal app platform. 

However, the current advantage afforded by Microsoft is this, choice. With a Surface for example you can run full powered Photoshop or Premiere Pro. But if apps are more your style use apps. Windows tablets are full powered computers meaning they can use nearly all devices via USB. This makes using Windows devices awesome with few compromises. Use one device for hard core stuff, and app stuff and have them sync together, it is great.",2015-07-27 19:16:56+00:00,cti36zr,1,t3_3esjr9,7043,microsoft
308,seriously! I read the first 9 words/numbers then was crushed by the 10th!,2015-07-16 13:25:36+00:00,ct5b4jn,2,t1_ct5a00u,2486,windowsphone
309,With the light theme Cortana looks a lot like Google Now ,2015-07-14 13:00:45+00:00,ct2upzo,1,t3_3d7u8h,29541,windowsphone
310,"sure, but theoretically you could have a frame and sit on that but look around and see the rest of the bike which is virtual ",2015-07-14 12:49:24+00:00,ct2ufkc,2,t1_ct2sa0s,6446,microsoft
311,"MS is emulating the entire 360. The games think they are running on a 360, each game isn't emulated, the system is.",2015-07-13 19:23:41+00:00,ct21as5,4,t1_ct20h5x,1212,windowsphone
312,"I remember when Android was only for the nerds, now it commands the majority of smartphones. Microsoft needs to expose people to Windows 10 Mobile any way they can",2015-07-13 19:22:51+00:00,ct219k3,2,t1_ct20gyb,1171,windowsphone
313,"I don't think it is easy. After MS emulated the 360 on the X1, and they have partnerships with Android device makers. maybe they just make a Win10 Mobile emulator in Java. Some phones are getting pretty beefy maybe it could work",2015-07-13 17:13:43+00:00,ct1w0n5,2,t1_ct1vrw5,365,windowsphone
314,"I get that it must be hard, but there are devices which already run both, HTC M8, could MS enable android M8 users to install Win10 Mobile?",2015-07-13 17:11:35+00:00,ct1vxik,2,t1_ct1vsni,204,windowsphone
315,"I agree, it seems like Google is faster at skimming new content and bringing it to the top of search results.",2015-07-06 15:15:19+00:00,cstv0gk,1,t3_3cb1p0,1754,bing
316,Would this adaptor work on other devices or just Surface?,2015-06-25 13:21:49+00:00,csi6s9w,1,t3_3b2i1k,773,Surface
317,"I've never seen clear data on this, does ChromeOS have 2% of laptops sold? or all computers sold? or what?",2015-06-24 19:58:24+00:00,cshfn44,2,t1_csh7yos,11250,windowsphone
318,Why don't you disable it?,2015-06-23 14:53:33+00:00,csfxman,2,t1_csfq3de,21069,xboxone
319,"As far as I know here are the only apps by Autodesk for Windows Phone:
http://www.windowsphone.com/en-US/store/publishers?publisherId=Autodesk%2BInc.&amp;appId=0cc38b7b-dedd-42ed-a912-04297c997b95 ",2015-06-22 12:53:13+00:00,csep9rm,2,t1_csekm4l,18594,windowsapps
