,body,created,id,nest_level,parent_id,reply_delay,subreddit
0,I was going to ask the same thing ,2016-11-17 15:10:11+00:00,da48zsp,2,t1_da48010,1444,Windows10
1,I think you need a Microsoft account to use OneNote for free.,2016-11-16 20:34:48+00:00,da388b7,1,t3_5dbckg,1950,OneNote
2,"LOL, what is the ""No"" referring to?",2016-11-09 20:00:14+00:00,d9ta8aw,5,t1_d9t8hgg,2076,windowsphone
3,"IIRC Facebook uses an app converter for their apps, so they are not normal UWPs. But your point is still valid",2016-11-09 19:10:26+00:00,d9t7qvh,3,t1_d9t5f6h,2811,windowsphone
4,"I agree. I was saying that there were no significant new features. You inferred I said nothing was significant, I didn't say that.",2016-11-09 18:47:03+00:00,d9t6lgo,5,t1_d9t6g4r,180,windowsinsiders
5,"TL;DR lots of big fixes, no big new features (other than virtual touchpad, that is cool)",2016-11-09 18:42:10+00:00,d9t6cqy,2,t1_d9t4pkj,1970,Windows10
6,Seems more like a bug fix to me. It is a little silly that it took so long for that to happen.,2016-11-09 18:37:27+00:00,d9t647a,3,t1_d9t5x9a,230,windowsinsiders
7,Saved you a click: No significant new features (edit: cool virtual touchpad though),2016-11-09 18:31:18+00:00,d9t5t0d,1,t3_5c2mq1,1589,windowsinsiders
8,"Collaboration is nothing without integration to other tools. Slack is fine but Microsoft Teams ties nicely into other MS products like OneDrive. Also because Teams isn't freemium all the cool features like video meetings and no restrictions on history make it a simpler product to sell. 

People already pay for Office 365 why would they go buy Slack too.",2016-11-03 17:02:04+00:00,d9k718e,1,t3_5axihl,3948,microsoft
9,"Not too surprising. This speaks more about the state of the art for marketing videos and less about the products. Microsoft and Apple obviously didn't shoot these, they hired a company to do it. ",2016-11-03 16:50:01+00:00,d9k6dws,1,t3_5axgzr,3666,microsoft
10,That is an excellent point. Time will tell.,2016-11-03 01:37:06+00:00,d9jamc4,4,t1_d9irt3q,23120,Windows10
11,"That sounds good, and expensive. Those Raspberry Pis will not last with a school full of kids taking them to and from school. Also schools already have computer labs, just load Minecraft on those computers.

This product is about giving a unique tailored experience for teachers. Maybe they have a special lesson and need more specific tools. I think having a range of options and tools is smart and helps teachers do what they do best without the tech being too complex.

Also teaching students LibreOffice does not prepare students for a world dominated by MS Office and Google Docs. This product is clearly meant for a specific purpose. If teachers or schools want to spend way more on a bunch of Raspberry Pis for every student and waste class time troubleshooting and setting everything up then fine. Notice how Microsoft didn't kill other versions of Minecraft, this is just a different tool for a specific purpose.

TL;DR The Raspberry Pi route could easily be more expensive and will surely be more time consuming. Minecraft Edu is for a specific purpose. ",2016-11-02 14:42:21+00:00,d9idy16,2,t1_d9hebhf,63147,Windows10
12,"I think Microsoft should make targeted ads to 'power users' and focus on giving them tools and features they love while improving the platform for 'extremely casual' users who go to the power users for advice and help. I think what made Android so dominate is that the techies love it and they advise their family, friends, and companies on tech.

Also focusing on the platform and really refining the experience. Making the platform consistent and very robust for developers to continue investing in the platform. When there are new apps and experiences then that brings Windows 10 into the news in a positive light. 

I think going after creators is smart because Apple has clearly left them out in the cold. I think to really capture that audience they need to keep pulling Windows 10 out of 90s and into the modern age. It seems like that is what they are doing they just need to keep it up.

TL;DR Advertise to Power Users, keep devs happy, impress creators, keep making Win10 modern.",2016-11-02 14:31:58+00:00,d9idgpo,1,t3_5apv45,3780,Windows10
13,"I think that is how Windows Hello works, right?",2016-11-01 19:03:10+00:00,d9h7qr0,4,t1_d9h77av,622,microsoft
14,"The Touch ID is great, but also separate from the touch bar. Microsoft added thumbprint sensors to their computers a few years ago. Apple should have added the touch ID sensors to all of their devices when they added them to their iPhones.",2016-11-01 14:47:33+00:00,d9guksk,2,t1_d9gqgxt,6117,microsoft
15,I have had my Chemex for 6 years or so with no issues. Do you rinse it with cold water while the glass is still hot? You could be building up stress in the glass with the rapid temperature changes.,2016-10-21 21:31:43+00:00,d92bjut,1,t3_58oa4w,16513,Coffee
16,If you get in early I bet the ROI would be great. Boom and bust though?,2016-10-21 20:32:18+00:00,d92903p,1,t3_58lg3q,57690,MemeEconomy
17,When I flew to China I had Stardew Valley on my laptop and it made 16hours feel like 3 :D,2016-10-21 20:27:16+00:00,d928s1o,1,t3_58m0s2,46865,StardewValley
18,That is freaky,2016-10-21 19:34:09+00:00,d926c0y,5,t1_d9219py,6325,pics
19,I want a Surface 4 which has 2 USB type-C ports.,2016-10-19 18:13:43+00:00,d8z2d4t,2,t1_d8z1dzu,1116,windowsphone
20,I would only accept dogecoins if I were you,2016-10-18 13:35:24+00:00,d8x6135,2,t1_d8x5gbe,873,MemeEconomy
21,"Probably a bug, did you report it?",2016-10-13 20:53:00+00:00,d8qsi82,1,t3_57cgz6,1416,skype
22,"Chromebooks would be a change of pace, but keep your expectations low. They are essentially just the Chrome browser, so all the functionality comes from web apps. If that works for you then great but don't expect too much.",2016-10-12 13:46:57+00:00,d8oqxlz,3,t1_d8ob8e9,37744,microsoft
23,"You should be fine. 

If you want a change of pace don't be fooled by the Mac. You will be disappointed by how similar the experience is to your PC. You will still be moving around windows of programs and saving files here and there.

If you want to try something new then try using a tablet instead of a traditional computer. There are some slick Windows tablets and the iPad seems to be fairly functional.
",2016-10-11 15:53:49+00:00,d8ng254,1,t3_56yesh,3170,microsoft
24,Have you looked in the settings app under the Pen section?,2016-10-10 21:06:28+00:00,d8mejgt,1,t3_56tlj4,8539,Surface
25,There is no way to link pages to scroll between pages like you have shown.,2016-10-07 16:51:46+00:00,d8i2tqv,1,t3_56blxu,8781,Surface
26,I don't think that is possible today. But OneDrive does have a 'Recycle Bin' which holds deleted files for some time so you can restore files which were accidently deleted ,2016-10-07 14:54:38+00:00,d8hx9xq,1,t3_569s2x,35737,onedrive
27,I agree 100% I am waiting for a refresh of their keyboards and mice which are Bluetooth and Xbox Wireless compatible.,2016-10-06 20:05:59+00:00,d8gwwms,2,t1_d8g5ax1,48695,microsoft
28,Not as of 10/6/2016 3:06PM CST,2016-10-06 20:05:10+00:00,d8gwv8b,2,t1_d8gf486,22169,microsoft
29,I tried the above fix and it did not work for me. Still looking for a fix,2016-10-03 23:55:04+00:00,d8cuiyd,1,t3_558agz,291373,Windows10
30,"&gt; They're trying to lock down the gaming experience on PCs to be the same as on consoles.

Not true. They are simply building their own game distribution store. Competition is good for the consumer. I want to see Microsoft's Play Anywhere strategy light a fire under Valve to do new and innovative things in the gaming space. 

If you don't like the UWP model then don't buy into it, but competition is a good thing for Steam customers too.",2016-10-01 16:08:39+00:00,d89o8l3,7,t1_d89ipof,10417,Steam
31,Cool! Since you use it I'm curious if you see a similar bug that I see. When I open a PDF it doesn't show up until I do a quick pinch/zoom then it appears. Does that happen to you?,2016-10-01 15:58:44+00:00,d89nv24,4,t1_d89ni9d,583,Surface
32,Can you boot into safe mode?,2016-10-01 15:47:53+00:00,d89ngs0,3,t1_d89n7qi,412,Windows10
33,"Check out Drawboard too, it is pretty awesome",2016-10-01 15:46:22+00:00,d89nert,2,t1_d89bftv,34137,Surface
34,There have been reports that the latest cumulative update has install issues on some machines. Maybe that is what you are seeing. ,2016-10-01 15:36:45+00:00,d89n28s,1,t3_55difr,2573,Windows10
35,"So when my search is identical to yours I see what you see, but I also noticed that it gives me the answer before I hit enter: http://imgur.com/a/zdDyn 

Surely this is a bug, you should submit this in the feedback app",2016-09-30 21:38:58+00:00,d88ugz3,5,t1_d88tv55,919,bing
36,"Here is what I get when I use a different search string http://imgur.com/a/uojOC

Looks pretty good to me",2016-09-30 21:20:30+00:00,d88tqhh,3,t1_d88qysh,3955,bing
37,Here is what I get: http://imgur.com/a/3gDop looks pretty good to me,2016-09-30 19:55:33+00:00,d88q4ok,1,t3_558j5g,14764,bing
38,"Its them dang hackers, if they would just stop attacking computers regular forced updates wouldn't be needed haha",2016-09-29 14:46:54+00:00,d86xukb,4,t1_d86rzgz,9881,mildlyinfuriating
39,Sync both accounts to the same PC and just copy and paste the files.,2016-09-27 00:35:39+00:00,d83f7mj,1,t3_54mndc,15678,onedrive
40,"Yeah that is nonsense, but IIRC the stock apps team wanted feedback from users on how to improve, however they have since reversed course on those pop ups. Maybe the popups should only happen for Windows Insiders or something like that",2016-09-22 14:15:38+00:00,d7xgeb7,2,t1_d7x4b64,31731,Windows10
41,"I think this was explained as being a way for Microsoft to showcase casual games with ads and in-app purchases for developers. 

But yes it is really annoying and disappointing to see. Microsoft should just put their original solitaire game through their desktop app converter and deliver it through the store!",2016-09-22 14:11:58+00:00,d7xg8rc,1,t3_53wra6,43848,Windows10
42,"I know you are referring to /u/unidan God bless, but to answer your questions the crow was trained to do this. However that training is possible because of the natural caching behavior found in many birds (including crows) [Source](https://en.wikipedia.org/wiki/Hoarding_(animal_behavior))",2016-09-21 01:26:43+00:00,d7vfqrj,2,t1_d7v4vd2,15822,AnimalsBeingBros
43,"Thanks for the link! The post is by my wife, I'll pass it all along. 

&gt; sorry if my previous post came across a bit sternly

No worries, she uses Cornell for a lot of her data and they mainly focus on North and South America, so I'm sure that is how she informed her post.",2016-09-20 21:34:18+00:00,d7v6byk,4,t1_d7v5vd8,604,birding
44,thanks for the additional info. Out of curiosity what is your go to source for learning about bird ranges?,2016-09-20 21:21:40+00:00,d7v5qy4,2,t1_d7v0xtn,5895,birding
45,Yeah I think that would be a good design,2016-09-15 21:01:45+00:00,d7ocqer,7,t1_d7oc9tq,583,windowsphone
46,"I prefer the ""send Message"" button to be inline and to the right of the text field, like where your + button is.",2016-09-15 20:43:58+00:00,d7obvvd,5,t1_d7oa7s5,2080,windowsphone
47,"I was on the fence about calling it a FAB, I think the idea is that the button is detached from the other UI elements and floats on its own, it doesn't need a drop shadow to be a FAB in my book ",2016-09-15 19:53:14+00:00,d7o9fph,3,t1_d7o8vs1,664,windowsphone
48,The Skype team did a Q&amp;A recently: http://www.winbeta.org/news/skype-team-hosted-a-questions-and-answers-event-today-heres-what-they-revealed ,2016-09-15 18:55:10+00:00,d7o6jsd,2,t1_d7o3qgp,3444,windowsphone
49,"From a general aesthetic point of view I think this looks great! The concept looks clean and thorough. 

There are some design elements in the concept though that do not match with the Skype design or the Windows Universal design language. Stuff like the floating action buttons look like they were built for Android OS.

Also it looks like you took their current UWP (which needs a lot of work) and added in lots of the iMessage features (which I love)

I totally agree the current UWP needs a lot of the features you added, but I'd be surprised if their implementation looks like this concept.",2016-09-15 18:54:49+00:00,d7o6j5q,1,t3_52x6sv,6548,windowsphone
50,"You can customize the table of contents, I don't use that feature so I don't know all you can do with it but it seems pretty flexible ",2016-09-15 18:49:22+00:00,d7o69eu,3,t1_d7o3mj9,3227,microsoft
51,"Word can build the entire table of contents automatically, assuming you have the sections called out using heading formats http://imgur.com/a/uweUb",2016-09-15 17:45:52+00:00,d7o34xx,1,t3_52x958,1614,microsoft
52,I don't know. I haven't seen any evidence either way,2016-09-14 12:58:33+00:00,d7mbinf,2,t1_d7lzkf6,33012,bing
53,"Skimming this site might help:
http://www.whymicrosoft.com/ 

I obviously don't know what type of internship it will be but be ready to write some sample code on the spot. 

Also, IDK if tech companies still do this but many have been infamous for asking impossible questions just to see how you would think the answer through.
For example: 

* How many people are Facebook right now in Boston?
* How many ping pong balls could fit in the super dome?
* How many drops of water are in the great lakes?",2016-09-13 20:37:08+00:00,d7li0wx,1,t3_52mkq1,1985,microsoft
54,So the ship that Bossk files around looks just like a stapler: http://starwars.wikia.com/wiki/Hound%27s_Tooth ,2016-09-13 14:06:28+00:00,d7kz6wy,1,t3_52i1rp,44225,StarWars
55,https://www.youtube.com/watch?v=V-fRuoMIfpw,2016-08-26 19:30:21+00:00,d6xwx6y,6,t1_d6xv4v1,2318,Overwatch
56,"You are right about those emoji things, but the Skype emojis are consistent across Skype and have been around for awhile",2016-08-17 21:15:35+00:00,d6lq5h0,2,t1_d6lovby,1563,windowsphone
57,"Lol, from history we can say that means the service will work in beta, never come out, then get canceled before general release",2016-08-17 16:08:54+00:00,d6laces,3,t1_d6l5239,6564,microsoft
58,"So when comparing that UI to other places in the settings app Microsoft has some inconsistencies.

Check out this album of the different UIs http://imgur.com/a/JcYzO ",2016-08-16 19:12:46+00:00,d6k3b9p,1,t3_4xzisv,20111,Windows10
59,"&gt; Fuck these people, done with them. 

What do you mean when you say this? Do you work with people in Sherman park today? Are you going to change your behavior in some way?",2016-08-16 16:17:39+00:00,d6juplt,3,t1_d6hs1dc,138720,news
60,"&gt; Tell me which one's you were unaware of prior to our conversation

Why don't you share your sources for poverty and wealth for black families in the US over the past 200 years.

&gt; Black children have literally never been worse off than now. Pick a measure

Literacy 

&gt;&gt;As societies have since the dawn of civilization. 

&gt;You know this is in no way shape or form an argument. This is textbook fallacious 'reasoning'.

What textbooks do you read? Which fallacy is that? It was not an argument, it was a statement. Which argument is this: ""The state using armed men to take money"" oh right Appeal to Fear.",2016-08-16 14:42:17+00:00,d6jqala,22,t1_d6jp60r,1586,milwaukee
61,"You make a lot of specific claims. I'd like to see the sources for them.

&gt; The state using armed men to take money.

As societies have since the dawn of civilization. 

&gt; Why are black people worse off now than before white people gave them preferential treatment and cash?

What time frames are you trying to relate here?",2016-08-16 14:11:58+00:00,d6jp0es,20,t1_d6johpg,778,milwaukee
62,"There is a strong correlation between education and economic mobility, this is why there are affirmative action programs in universities. 

There is a strong correlation between nutrition and school performance, this is why there are free lunch and food stamp programs. 

Generally people with strong and diverse social networks have better vocational success, this is why there are programs to help with job training, resume building, and networking skills.

Children from families who need to choose between paying rent and school supplies, food, winter clothes, etc. generally have more issues in school, this is why rent assistance is a thing.

People are constantly working on this problem and continually trying new things. If you have some ideas on what would work then connect with a non-profit or start your own.

When there is trouble in a neighborhood like there was in Sherman Park it highlights that more work needs to be done. 

&gt;'Help' should result in better outcomes right?

Generally organizations try to find what works long term and do that. It can be very complicated because the conditions are constantly changing so strategy needs to change yet still be effective.

There are some dieses in the world which we have the ability to eradicate, but they keep making people sick and killing people. It would be crazy to give up and say ""we have treated enough people with malaria and some keep dying so we give up on everyone.""

There are people who grow up in Sherman Park who received help from society and have healthy and productive lives. A handful of bad actors should not be enough to cease all assistance to needy people in a neighborhood.

&gt; What better outcome are you promising

Personally I can not promise anything 

&gt; how is that different than the last time?

I don't know what you are referring to or how to answer this
",2016-08-16 13:54:07+00:00,d6joaul,18,t1_d6jn9bm,1700,milwaukee
63,No matter who you are you are benefiting from government handouts. If you are lucky enough to have avoided disability or layoff or an expensive medical condition yet you still whine about needy people getting help then you are doomed to a life full of frustration. ,2016-08-16 13:25:04+00:00,d6jn8dw,18,t1_d6jf2af,22688,milwaukee
64,"To answer most of your questions generally, this is a community problem. You as an individual don't owe anyone or group anything. Instead you as member of the community have a responsibility to do what you can to help those in need. Why? Because in America society has decided that is the role of communities.

People argue about the specifics, but generally western society has believed in helping the needy. Also it is a complex problem which needs a complex solution. If you have no role then encourage and equip those who do (mainly that happens via paying taxes) ",2016-08-16 00:01:48+00:00,d6j0wmj,16,t1_d6iut1w,8920,milwaukee
65,"I want to live in a more free, just, and wealthy America than my parents. To make that happen we cannot just pretend what is fair and what is equal are the same. 

History continues to play a big role in determining the future of black communities in America. There needs to be a specific focus on breaking the burden historic racism has on black neighborhoods. 

&gt; What does that have to do with treating races differently? 

When a people group is marginalized for centuries that cannot be reversed at the flip of a switch (or removal of racist laws). It takes new laws working to invest in new generations to hopefully break the cycle of generational poverty.

&gt; Are you advocating we punish white people?

Let's stay focused on helping black communities 

&gt;Can I point out that all race based public policy in existence today, and throughout my life has been in created expressively to favor non-whites?

Okay. For many people alive today that is not the case.",2016-08-15 21:29:38+00:00,d6iunjf,14,t1_d6it2cn,2108,milwaukee
66,"Yes, but the email I just got had a functioning unsubscribe button though. So I'm now off the list. That mailing was very strange, I wonder if it was a mistake or a glitch somehow.",2016-08-15 16:29:04+00:00,d6igl7i,1,t3_4wb3ic,865705,bing
67,"Unfortunately when those people are removed the community still has problems. You are discussing simple cause and effect; why was a crime committed, because someone committed a crime. While you are correct it isn't very helpful when trying to understand why there are more people choosing to commit crimes in one neighborhood verses another neighborhood. The pastor is addressing a broader systemic issue and trying to make a path to improve the community for the future. 

All neighborhoods need good job opportunities, especially poor neighborhoods.",2016-08-15 16:26:34+00:00,d6iggwo,2,t1_d6hl97e,63914,milwaukee
68,"Federal home loans were being used as a tool to entrench racial segregation throughout the 1960s. When the Fair Housing Act of 1968 was passed George Romney (appointed by Nixon) was tasked to fight the segregation that the federal home loans reinforced. While doing his job Romney ran into many people motivated by racism to stop what he was doing and he was eventually pushed out of his role. 

Now HUD has very little power to change the state of segregation in current day America. It was only 50 years ago that the federal government was actively segregating neighborhoods. When Nixon put a stop to Romney's plan he acknowledged this would mean more intense segregation, but he did it anyway.

That whole part of American history was new to me and was really surprising. It always bothered me when slavery was brought up as a reason why 'blacks are oppressed' but after hearing that story I learned you only have to go back 50 years to find institutionalized racism. That coupled with generational wealth does a decent job of explaining how we got to where we are today. ",2016-08-15 16:07:12+00:00,d6ifl0t,12,t1_d6id7hm,3254,milwaukee
69,"It would seem you believe that all races should be held to the exact same standard. I used to believe this too, but since reading more on the topic I have changed my mind.

Specifically look into the implementation of the Fair Housing Act of 1968. [Here is a story from This American Life on the topic of housing and race.](http://www.thisamericanlife.org/radio-archives/episode/512/house-rules)

I'm curious what you think of that.",2016-08-15 15:02:13+00:00,d6icrs2,10,t1_d6ibp1q,1617,milwaukee
70,"&gt; I'm pretty tired of being the only group expected to live up to any standard whatsoever

What group would that be? Oh wait let me guess... Caucasian? 

&gt; They are literally hunting white people. I feel dehumanized.

I agree with this. This is also a big reason why I am anxious about trying to show support for change in times like these. However just because someone makes you feel less than human doesn't give you a free pass to do the same.",2016-08-15 14:32:37+00:00,d6iblg8,8,t1_d6iattu,1222,milwaukee
71,This seems to be Microsoft's MO lately. Have some great ideas... and fail to deliver while disappointing their customers.,2016-08-15 14:15:18+00:00,d6iaxuc,1,t3_4xt8fi,7737,microsoft
72,"&gt; same way as diddling kids is a vicious circle.

I'm not so sure.

&gt; How unfair nobody wants to hire violent, racist thugs!

I didn't say that, nor do I believe it. I am just highlighting a very unfortunate part of the problem.

&gt; But BLM has the solution:commit more senseless violence against people of the race you irrationally hate, in order to draw attention to how unfairly the world treats racist, violent thugs!

I am not trying to defend BLM. Also I don't think there is an official BLM chapter in Milwaukee. I don't believe the events which transpired in Milwaukee were officially sponsored or condoned by BLM. 

All in all I'd give your comment a 3/10. 

* It was founded on the Faulty Comparison logical fallacy.
* It failed to contribute additional information
* It failed to communicate an clear unique perspective 
* It successfully introduced a mainstream legitimist criticism of BLM",2016-08-15 14:14:17+00:00,d6iawhh,6,t1_d6ia01q,1504,milwaukee
73,"Sure. I'm sure there are some who are, however I'm sure there are some who are not. The world is a complicated place, oversimplifying dehumanizes people. People need to take responsibility for their actions, but sometimes it takes some outside intervention for lasting change to happen.

Let's keep trying different things and learn from what works. ",2016-08-15 14:02:44+00:00,d6iahgv,6,t1_d6i9x7x,946,milwaukee
74,"This is the vicious cycle. If you commit a crime as a young person you are branded as a ""violent thug"" your entire life and cannot find honest work for good pay. ",2016-08-15 12:57:49+00:00,d6i8dof,4,t1_d6i4p84,10334,milwaukee
75,Many businesses do not hire people with any criminal record,2016-08-15 03:05:36+00:00,d6hux4f,2,t1_d6he9go,26924,milwaukee
76,It is a slippery slope. The worse it gets the quicker it gets worse.,2016-08-15 02:53:49+00:00,d6huhvc,2,t1_d6her6l,25460,milwaukee
77,Well there are not enough jobs in rough neighborhoods who will hire people with criminal records. Obviously it is a complicated problem.,2016-08-15 02:42:26+00:00,d6hu379,2,t1_d6hf6by,24132,milwaukee
78,"I thought it did. Open the connect app on your PC then plug in your 950 and select connect, does your PC pop up as an option?",2016-08-12 14:29:08+00:00,d6eka30,1,t3_4xde7z,5258,windowsphone
79,"You cannot hide the all apps view in the Anniversary update, tweet at MS so they know tons of people don't like this new change",2016-08-09 18:21:44+00:00,d6apacy,2,t1_d6aolhy,847,Windows10
80,"Shoot, I should have said that to a different content. My bad",2016-08-09 16:58:22+00:00,d6al80w,7,t1_d6ajjgo,2077,Windows10
81,"I never understand when people want a feature they don't use removed when other people use it.

You are aware the 'alt' letters works way better with the ribbon right? http://imgur.com/a/ROPPh",2016-08-09 16:21:57+00:00,d6ajg9g,5,t1_d6aejw7,6412,Windows10
82,"What is the keyboard shortcut or context menu for:

 * Invert selection
 * Copy path
 * Show file extensions",2016-08-09 13:53:15+00:00,d6acw1b,4,t1_d69ocq5,53114,Windows10
