,body,created,id,nest_level,parent_id,reply_delay,subreddit
352,"Especially that beautiful riff when Daisy Ridley narrates ""There are stories about what happened"" and you see the Millenium Falcon in all its majesty.",2015-10-25 05:10:59+00:00,cwbx2p2,3.0,t1_cwbhcz2,31553.0,videos
353,I've seen this deal on T-Mobile but I'm worried that 100 minutes isn't enough. I always go above 100 minutes it seems. ,2015-10-24 21:29:22+00:00,cwbjfm3,2.0,t1_cwb0hig,44580.0,bayarea
354,The look of the crossguard lightsaber is growing on me.,2015-10-21 00:53:45+00:00,cw733xb,1.0,t3_3pfpp1,81901.0,movies
355,"Man, you're probably the reason none of us got one",2015-10-19 03:46:28+00:00,cw4t5nl,2.0,t1_cw4o103,8155.0,buildapcsales
356,Narwhal is definitely the best iOS Reddit client I've seen,2015-10-15 16:41:36+00:00,cw0sjk9,3.0,t1_cw0ld91,11479.0,apple
357,Or the Jin and Sun death scene,2015-10-15 06:25:14+00:00,cw0e3v2,3.0,t1_cvz6yom,81301.0,shield
358,Its possible that 9.1 patched the exploit,2015-10-14 07:37:06+00:00,cvz6rnk,2.0,t1_cvz26sz,12695.0,jailbreak
359,My question is- does this hurt the traffic of the other design sites?,2015-10-13 02:26:52+00:00,cvxpgou,1.0,t3_3ogmcs,39467.0,Design
360,How do I mirror the phone's display in its original resolution? I only ever get standard or worse,2015-10-12 22:20:27+00:00,cvxg3nm,4.0,t1_cvwfbod,76924.0,Android
361,"They skimp out on graphics cards. That's what bothers me the most- you spend $2,000 for a laptop and your GPU is not even half as good as what's on a $1000 PC laptop.

I've been waiting for a macbook pro model with a killer GPU but it just never happens.",2015-10-12 16:15:24+00:00,cvx166m,2.0,t1_cvx0v48,504.0,apple
362,Does Vysor have HD?,2015-10-12 00:47:02+00:00,cvweym9,2.0,t1_cvw3ttp,18644.0,Android
363,"My hope for the next Macbook Pro is a graphics card that isn't years behind what PC users have.

The highest card we can get for a maxed out 15"" Macbook Pro is a Radeon R9 M370X, which isn't even half as good as what you can get in a PC laptop for a quarter of the price. This Dell laptop for [$500](http://slickdeals.net/f/8147628-dell-inspiron-7000-laptop-15-6-1080p-ips-intel-core-i5-6300hq-quad-core-8gb-ddr3l-256gb-ssd-gtx-960m-4gb-6-cell-win-10-pre-order-799-99-fs-amazon) has a 960M already.

How can Apple spend all this R&amp;D money on A9 chips but not push laptop GPUs when they have an opportunity to surpass PC? I just think if you're going to pay $1,000 or more on a laptop, you deserve more than a crappy Intel Iris 6100.",2015-10-11 18:45:08+00:00,cvw1s65,1.0,t3_3oavih,48362.0,apple
364,I'd love to see that footage. I haven't heard very much about OIS Video on the iPhone 6S+.,2015-10-11 18:30:01+00:00,cvw17g1,2.0,t1_cvvofca,31290.0,apple
365,I still think that Relay and Sync (maybe even Now) have a more modern looking UI,2015-10-11 18:24:36+00:00,cvw0zvi,1.0,t3_3ocsz2,753.0,Android
366,They should cast an unknown instead. Make a new star instead of hiring an established name who doesn't need Bond.,2015-10-10 13:14:27+00:00,cvuql8g,1.0,t3_3o7km6,5175.0,movies
367,Our only hope is a custom ROM.,2015-10-08 04:27:03+00:00,cvs5sl1,1.0,t3_3nva04,37185.0,GalaxyNote3
368,Doze- better standby battery. That's the big one.,2015-10-07 15:02:27+00:00,cvrbitu,2.0,t1_cvpy7kx,101801.0,GalaxyNote3
369,"Is there any way to find out which variant you have before purchase? Apple Stores must have a way of telling them apart, right?",2015-10-07 07:45:08+00:00,cvr2eve,1.0,t3_3nrk98,33766.0,apple
370,"At a fundamental level I think you're right. Most people who shop for clothes don't even think about whether it was made in a sweatshop or not.

",2015-10-06 06:33:33+00:00,cvpumzw,2.0,t1_cvp7cgc,41717.0,malefashionadvice
371,"CHVRCHES still came out with a fantastic album. I'm not so sure I agree that its restrained compared to the first album. Its just that you're so used to the synths and sound effects and their songwriting patterns that some of it seems old hat because its so similar to the first album I think.

None of Kanye's albums sound anything similar and that's what I think CHVRCHES needs to do for the third album- just try something completely different.
",2015-10-06 06:15:37+00:00,cvpuba9,2.0,t1_cvdw6iw,913277.0,indieheads
372,Beautiful artwork. ,2015-10-06 06:11:38+00:00,cvpu8kv,1.0,t3_3nn4eh,22180.0,comicbooks
373,"The thing that will help you the most is your portfolio, not the degree!",2015-10-06 05:53:35+00:00,cvptvz5,1.0,t3_3nm551,35987.0,Filmmakers
374,How good of a graphics card can we expect?,2015-10-05 19:59:39+00:00,cvp9u3h,1.0,t3_3nlji1,8963.0,Android
375,Completely agree on the touchpad. Macbook touchpads are really good in comparison.,2015-10-05 19:58:40+00:00,cvp9snj,3.0,t1_cvp687k,5295.0,Android
376,Keep in mind though that sideloading from a microSD is generally slower,2015-09-29 23:28:13+00:00,cvioxra,4.0,t1_cvi4s70,29893.0,Android
377,"But it makes perfect sense to have scenes like this. We are, on the whole, a scientifically illiterate society. You're explaining a potentially foreign scientific concept to a wide international audience.
",2015-09-28 15:35:17+00:00,cvgydzi,2.0,t1_cvgnzyj,31167.0,movies
378,How do you get the free router?,2015-09-26 23:06:13+00:00,cvf96ay,5.0,t1_cvf51py,7996.0,apple
379,"And you're absolutely right. File Management is usually not a necessity but its a nice thing to have. I absolutely empathize with the Android user who is switching over though. Its not an easy transition to make sometimes.

Think about how photos work on iPhone- aren't you glad that you have Camera Roll access EVERYWHERE? You might need Camera Roll when you use iMessage, edit photos in Instagram, upload to Gmail etc.

Now is it conceivable that users might want the same level of access for Documents or all other types of files?

I'm currently using an iPhone 6 as a test device and occasionally the sandbox gets in my way. Unlike Google Music, Apple Music doesn't play uncompressed FLAC music- so I migrated the music to Vox (which plays mp3, APE and FLAC, closest thing to an Android music player I've found). I used to use voice to choose songs in the car but Siri doesn't recognize music files that aren't in the music app, which is really sad. I wish I could just scan the folders and find it like Google Music.

The other funny thing that happened the other day is I tried using iTransmission to torrent a video and my video players on iPhone had no way of finding it. I think I need to download iFile to solve this problem?

Once I get back home after work, I can usually solve these problems through converting or file management with iTunes. There isn't any problem that can't be solved, but iOS does occasionally give me hoops to jump through.",2015-09-26 23:03:25+00:00,cvf937r,5.0,t1_cvf6dhw,5319.0,apple
380,"I definitely think that file management makes a lot more sense on Android than it does on iOS. Multiple apps can point to the same folder for resources. Just like having Camera Roll everywhere, except with all file types not just pictures. All Document apps can just look at the same Docs folder. Its more like my Macbook in that sense.

Also, being able to download torrents (videos, music, books, apps) and other media to sorted folders on the microSD Card is really useful.

Android apps aren't sandboxed, so being able to have one file manager where you can delete all the stuff you don't want is really handy. iPhone users don't think the same way.

iOS has a way different philosophy that works just as well. If you wanted to edit or delete photos you would go into the Photos app; if you wanted to edit or delete music you would go into the Music app.  With iOS, you indirectly get a file to the place you want by sharing the file from app to app so the files can leave their sandbox (usually Dropbox or Drive being the intermediary).

Its an adjustment but almost anything you would want to do with a file manager you could do by adding Dropbox or Drive as an extra step.",2015-09-26 20:41:47+00:00,cvf4o8a,3.0,t1_cvf1bpg,6256.0,apple
381,"Fragmentation is really bad for developers. I know lots of you guys are comfortable on 4.4 and below- but if you want the latest and shiniest toys from Google's API, it really helps developers that everyone is on the latest version.",2015-09-26 16:30:15+00:00,cvewjd8,1.0,t3_3mfla2,38989.0,MaterialDesign
382,What kind of budget airlines go to Asia?,2015-09-24 04:57:43+00:00,cvc9go3,2.0,t1_cqalub9,14162231.0,LifeProTips
383,Thank goodness. I have my phone in landscape when I'm driving (phone is too tall). If they can get this working then I might switch from Nova.,2015-09-23 23:05:03+00:00,cvbxyfl,1.0,t3_3m43kr,8373.0,Android
384,"5.5"" screen size is actually perfect! It's the bezels that make it too large and tall in my opinion. If iPhone 7+ retains the screen size but cuts down the bezel, I'll be first in line.",2015-09-23 19:25:57+00:00,cvbp6de,4.0,t1_cvb8rfn,26645.0,apple
385,"Yes, for the most part but there are a few hoops you have to jump through if you care to make it backwards compatible. Basically Google released something called the Support Library and this library allows you to use backwards compatible Material 
Design widgets and styles all the way down to like Android 2.1. 

However, some stuff is still missing. For example, ripples aren't supported below Lollipop so you need to use an open source library if you want ripple effects below L. Some animations and transitions don't work below L. But for the most part, 95% of things should just work.

",2015-09-23 06:43:43+00:00,cvb47ou,3.0,t1_cvb39yj,3200.0,AndroidQuestions
386,"Fragmentation I would say.

For example, if you're an iOS developer, you could use the newest APIs for iOS 9 because you know that by the end of the month, 80% or more are going to jump to iOS 9 with you. Everyone takes the leap of faith together and that's really awesome as a developer because you can use the latest tools.

It doesn't matter that Android M has all these nice and shiny features because only 1% of people are going to be on it, 20% will be on Lollipop, another 20% on KitKat- so on and so forth. Basically you'll never be able to give your users the latest and greatest Android features- you'll always have to waste time trying to backport some of them even if the features are not optimized for older operating systems.

 This ultimately leads to a shitty experience for older versions but the reviews all matter the same. You'll never be able to just simply use the latest tools and APIs as an Android developer- you're always going to have to worry about how to make it compatible with outdated versions. Right now I'm working on an app that has to be compatible down to 4.1 Jellybean to get 90% of Android users so I understand how painful this is firsthand.",2015-09-23 04:44:40+00:00,cvb1vnm,1.0,t3_3lykni,40434.0,AndroidQuestions
387,"There are so many Androids so its hard to compare. I've been using an iPhone 6 as a test device and to me it gets about the same screen on time as most 2K resolution Androids, maybe a little less for video playback.

Standby time on iOS kicks Android's ass.

Definitely missing the ability to swap batteries so Id say get a 6 Plus if battery life is a crucial factor.",2015-09-23 02:45:39+00:00,cvayj75,1.0,t3_3m0klq,2223.0,apple
388,Sleep Cycle! Really good app- you set an interval for when you want to wake up. It tries to figure out if it can wake you up during your Non-REM sleep by using the motion sensor on the phone.,2015-09-21 08:18:37+00:00,cv8tx6o,1.0,t3_3lrrh2,9333.0,androidapps
389,"Relay is really fucking good

Edit: but honestly all of them are pretty good. Even the ones like Reddit Now and Bacon Reader are super usable.",2015-09-21 08:16:16+00:00,cv8tw3n,2.0,t1_cv8ttuc,293.0,androidapps
390,"On the flip side, I had a bad experience as a buyer. The Note 3 I bought from Swappa had a broken orientation sensor, so basically it wouldn't rotate or register tilt at all. The worst part is that the seller  **gave me attitude, like I was a troublemaker for wanting to return the phone**. He was willing to refund me but he wasn't going to pay for return shipping. 

I managed to send it into Samsung for repair and they fixed it, but that took like an extra two weeks.

The seller was an asshole for the most part. So I guess what I'm trying to say is- its no different from eBay in that the trust has to go both ways.",2015-09-19 21:14:36+00:00,cv79nf0,1.0,t3_3lld8k,5853.0,apple
391,"Manufacturers should be forced to ship stock and if Carriers/Manufacturers want to install something on the ROM, they can give that option to the user.",2015-09-14 00:35:11+00:00,cv0mmh6,3.0,t1_cv0mb7h,593.0,Android
392,"Yeah, I was hoping the iPhone 6S might have OIS but I guess not",2015-09-13 22:58:08+00:00,cv0ji8b,3.0,t1_cv09j2n,15378.0,apple
393,+1 for Pocket Casts. Best podcast app I've seen on either platform.,2015-09-13 22:12:12+00:00,cv0hvey,2.0,t1_cv0bkwq,9578.0,Android
394,Damn that's gorgeous. What icon pack is that?,2015-09-13 22:03:16+00:00,cv0hjqa,2.0,t1_cuzupp5,49345.0,Android
395,"I took my case off and decided my Note 3 should be free about a month ago. Never had a crack even after nearly 2 years of usage. I thought to myself- Guerilla Glass 3, what could possibly go wrong? I dropped it about two weeks ago and it faceplanted and cracked the screen.

+1 for cases.",2015-09-13 19:03:28+00:00,cv0aew8,1.0,t3_3ksj3u,12574.0,Android
396,This is a great point. The value matters if you plan to sell it so it all depends.,2015-09-13 09:34:31+00:00,cuzvoik,3.0,t1_cuzu74b,6490.0,Android
397,Relay is another great Reddit client,2015-09-13 09:28:54+00:00,cuzvm10,2.0,t1_cuzs48b,13159.0,Android
398,"The Google Apps get really negative ratings on iOS

EDIT: Not even sure why I'm being downvoted for this. Look at these ratings compared to Play Store counterparts:

https://itunes.apple.com/us/app/google/id284815942?mt=8
https://itunes.apple.com/us/app/chrome-web-browser-by-google/id535886823?mt=8
https://itunes.apple.com/us/app/chromecast/id680819774?mt=8
https://itunes.apple.com/us/app/gmail-email-from-google/id422689480?mt=8

",2015-09-13 09:26:26+00:00,cuzvkx9,2.0,t1_cuzr75e,15489.0,Android
399,"Wow, you rank the Lumia above the G3 and iPhone 5s? What's good about it?",2015-09-13 09:18:59+00:00,cuzvhjz,2.0,t1_cuzhj1t,34882.0,iphone
400,It would be good for Android if all manufacturers were forced to jump to the latest OS and API level,2015-09-13 09:11:32+00:00,cuzve5u,2.0,t1_cuzhhnn,34509.0,iphone
401,"Another Android user here. The other thing is that iOS standby battery is fucking dope. I hope Android M Doze can be at least half as good.

And if you really love games, its nice to see games come out first on iOS before hitting Android.",2015-09-13 09:09:16+00:00,cuzvd5s,2.0,t1_cuzh6av,34980.0,iphone
402,Sounds like it's custom ROM time,2015-09-13 08:40:42+00:00,cuzuzgh,3.0,t1_cuzehcm,38318.0,iphone
403,"$20 cheaper than getting a screen replacement.
**salty**.",2015-09-12 00:08:44+00:00,cuyiiwy,1.0,t3_3kjunv,31935.0,GalaxyNote3
404,Is there a tutorial for that?,2015-09-09 19:14:57+00:00,cuvwtro,3.0,t1_cuvvu99,1527.0,Android
405,How did you get that version of the Google Now widget?,2015-09-08 06:38:21+00:00,cuu78ek,2.0,t1_cutdr5d,65140.0,Android
406,"That was for the iPhone though, not the iPad. With a bigger screen real estate and considering the use case for artists, I don't think Steve would have held the same opinion about big tablets.",2015-09-07 20:33:01+00:00,cutrfk1,2.0,t1_cutqe8b,2437.0,apple
407,Very true,2015-09-07 18:46:14+00:00,cutoa37,2.0,t1_cuto804,133.0,iphone
408,"Okay cool, so basically you're saying you renew AppleCare every year- is that right?",2015-09-07 18:37:30+00:00,cuto0dl,2.0,t1_cutnvzg,212.0,iphone
409,What are your gripes about the 6?,2015-09-06 00:07:08+00:00,curzz4a,2.0,t1_curlmyy,27902.0,apple
410,Wow really? Where are you looking?,2015-09-05 23:39:47+00:00,curz681,2.0,t1_curo50y,21533.0,GalaxyNote3
411,Every local repair shop I've called has said $200. I'm still looking for someone willing to replace just the glass.,2015-09-05 23:39:22+00:00,curz5rh,2.0,t1_curl0mh,27459.0,GalaxyNote3
412,"I think part of the reason he was scared to take the role is his experience with 20 Century Fox and Fantastic Four. Sure, it wasn't the Marvel studio, but he still had the baggage of working on a Marvel superhero film and being disappointed by it.

",2015-09-05 19:43:30+00:00,currzlc,1.0,t3_3jrc6h,11396.0,movies
413,"Your story scares the shit out of me. I definitely wouldn't trust myself to do it properly. Even if I had infinite time and followed each step with thoughtfulness and dexterity- I'd still probably find a way to break something.

",2015-09-05 08:53:33+00:00,curdag9,4.0,t1_curccdt,4324.0,GalaxyNote3
414,Whatchu guys got in mind? Maybe I should wait for the newly announced phones before making a decision.,2015-09-05 06:53:44+00:00,curbn3s,4.0,t1_curazb5,2359.0,GalaxyNote3
415,"Yeah, sounds like it.",2015-09-05 06:53:06+00:00,curbmpl,2.0,t1_cura9cv,4626.0,GalaxyNote3
416,"Just the glass. Nothing wrong with the digitizer and LCD (I'm pretty sure). The issue is that the reason these people charge so much is that the LCD and Glass are put together so carefully that taking off the glass usually cracks the LCD, so they don't bother with that and just replace everything with the glass, lcd, digitizer altogether.",2015-09-05 06:51:36+00:00,curbltq,2.0,t1_curaxi6,2412.0,GalaxyNote3
417,I bought a Heat Tech sweater. The sweaters pill quickly.,2015-09-05 04:48:03+00:00,cur97mu,2.0,t1_cuqkdy1,44732.0,frugalmalefashion
418,"My experience: standby time is way better on iPhone 6. When it comes to actually doing stuff with the phone like watching content or browsing social media, the iPhone dies faster than my Note 3.

Performance wise the apps load a little faster on the iPhone. Its pretty great. The one thing that still bothers me is multitasking. Android could painlessly run shit in the background like torrents, Tasker, or uploading to gmail/drive.

On iPhone the RAM limitation causes the background processes to just die so you gotta stay in the app. I know sandboxing apps is good for performance but its really fucking with my day.
",2015-09-04 18:30:03+00:00,cuqpkr9,1.0,t3_3jn324,5273.0,apple
419,What about running a Custom/Stock ROM? Is that an option for your Samsung model?,2015-09-03 09:46:53+00:00,cup3ii2,2.0,t1_cuozr8m,16306.0,Android
420,Running the latest certainly helps developers though. It means developers can use the latest APIs and Android Features from Google instead of being stuck with older APIs because everyone is still on KitKat.,2015-09-01 15:38:55+00:00,cun2yci,3.0,t1_cumpq6w,39310.0,Android
421,"I think there's plenty of iOS users that either prefer round designs, the Google ecosystem,  or don't believe in the value of smart watches enough to buy a $350 Apple Watch. I personally don't really think any of the second gen watches will provide that much value anyway, Apple or Android, but I can certainly see use cases where Android Wear is good for iOS users.",2015-09-01 09:31:17+00:00,cumuu5g,2.0,t1_cum062j,58862.0,apple
422,"Personally I think the Apple Watch looks fine. Not great, but not ugly either. UI doesn't appeal to me but hey, its first gen.",2015-09-01 09:26:44+00:00,cumurz6,3.0,t1_cumca0k,40161.0,apple
423,"The big issue that prevents this from coming true is fragmentation on Android. It doesn't help to release the latest and greatest Android APIs if only 10% of people can use it. This discourages developers from trying the newest toys because 90% of Android users dont have access.

If Google can figure out how to get everyone on Marshmallow, it would go a long way to being competitive with iOS.",2015-09-01 09:20:52+00:00,cumup1j,8.0,t1_cumjp9v,27660.0,apple
424,"Thank you for the suggestions, I love indie music and I've heard about both bands but never actually listened to their music very closely. I'll definitely check out both albums!",2015-08-31 20:51:35+00:00,cum90l3,2.0,t1_culrsjf,27497.0,Music
425,"Thanks SteevesWhiz. I vaguely remember listening to this album after watching their amazing, impromptu [train track performance](https://www.youtube.com/watch?v=60y_guXOKi0) but not really paying close attention to it. Maybe I'll give it another shot.",2015-08-31 02:29:58+00:00,culepap,2.0,t1_cul3uwh,20217.0,Music
426,"Checking this out now. I mean.. their name is Destiny Potato, how could I not",2015-08-31 00:16:57+00:00,culaeqd,2.0,t1_cukp4od,40722.0,Music
427,Thanks for the suggestion. I've actually only ever listened to Skinny Love. I'll check the album out.,2015-08-30 18:54:45+00:00,cukzy2g,2.0,t1_cukl9om,36192.0,Music
428,This is awesome. I like this kind of alternative pop and Melanie seems to be a really good storyteller. Apparently she was a contender on The Voice? I just watched the Sippy Cup music video. Is it a concept album? She's got an aesthetic that I think would blend in with radio but the stuff she's saying would win over indie fans.,2015-08-30 18:53:27+00:00,cukzwj5,2.0,t1_cuknz2e,25090.0,Music
429,I heard good things about this album and I will definitely check it out.,2015-08-30 18:33:15+00:00,cukz8es,2.0,t1_cukndll,26047.0,Music
430,Thanks! Screaming doesn't really bother me so I'll check it out,2015-08-30 18:32:03+00:00,cukz6zn,2.0,t1_cuknvrx,24131.0,Music
431,Thanks! I heard Chandelier but for some reason never came around to checking out the rest of the album. I'll definitely take a look.,2015-08-30 18:30:00+00:00,cukz4gg,2.0,t1_cukl4yl,35261.0,Music
432,Thank you for the recommendations. I liked that New Americana song so I'll give Halsey and Priest a try.,2015-08-30 18:29:00+00:00,cukz3ay,2.0,t1_cukmg1v,29641.0,Music
433,Are there any more recent videos?,2015-08-29 06:46:40+00:00,cujiz7e,2.0,t1_ctxeonq,1665299.0,videos
434,That's a real shame. I really don't want to go back to Touchwiz.,2015-08-29 03:38:26+00:00,cujewda,2.0,t1_cujd4g2,4001.0,GoogleCardboard
435,"So basically with the Google Cardboard app, you can scan QR codes. These QR codes represent configuration profiles based on whatever Cardboard you're using. The Powis ViewR for example has one: http://powiscustom.com/products/powis-virtual-reality-kit

Here are some configuration profiles people made with the One Plus One: https://forums.oneplus.net/threads/cardboard-viewer-profiles.322036/

You can generate a profile here:
https://www.google.com/get/cardboard/viewerprofilegenerator/

I'm trying to find the best one for the note 3",2015-08-28 16:41:17+00:00,cuis4cd,2.0,t1_cuihior,21362.0,GoogleCardboard
436,What's the difference between Google Wallet and Android Pay?,2015-08-26 20:53:31+00:00,cugpe3k,1.0,t3_3ihus7,9555.0,Android
437,Eminem could probably play himself,2015-08-23 23:27:11+00:00,cudazyv,2.0,t1_cu66lzf,533757.0,movies
438,"Apparently he spent two years with acting coaches, so he definitely took it seriously even if he didn't have the experience",2015-08-23 20:40:38+00:00,cud5dv4,6.0,t1_cu4n5c6,655589.0,hiphopheads
439,"Android shows up as an external storage drive. This is one of the coolest features.

For example, if I have e-books I want to read, music I want to listen, videos I want to watch, stuff outside the play store I want to install etc- I just drag and drop them into folders onto my Android. 

I don't have to go through iTunes (which doesn't allow you to put FLAC in the music library, even though other iOS music apps may be able to play FLAC).

 Apps aren't sandboxed either. Multiple apps can point to the same folder for content. For example, when you download torrent stuff into the Downloads folder- the comic book app, the document signer app, and video player app can look in the same folder for content.

The other cool thing is that there are programs like Airdroid which allow your Android to be a wireless storage device, so you can drag music onto the Android without having to physically connect it with a cable.

All that being said, I have heard from iOS users that iTunes is a lot better now. Your experience switching from one OS to the other OS probably won't be that big.

EDIT: Also want to make clear that I really like iOS too, iOS standby time is way more efficient. Android battery capacities are forced to be bigger to compensate for this.",2015-08-22 19:02:51+00:00,cuc1jj2,1.0,t3_3hyupl,19199.0,Android
440,"Agree. Fragmentation is an adoption problem- it means people aren't using the latest and best OS because people don't have access to it.

There's no problem with the Lollipop Android OS itself.",2015-08-22 18:42:12+00:00,cuc0vsa,2.0,t1_cubyhtp,4388.0,Android
441,"Yeah, seeing as he never used an iPhone 6+ its kind of silly to comment on a feature he's never used.",2015-08-22 18:39:12+00:00,cuc0s8l,5.0,t1_cubzggz,2445.0,Android
442,"If you install stock ROM or a custom ROM, then you get the best of both worlds: good hardware and good software.

But you're right, its easier because with iOS you wouldn't need to do the extra work.",2015-08-22 18:36:23+00:00,cuc0ovv,3.0,t1_cuby4x3,4690.0,Android
443,I don't think Tanner would mind being part of the flagship show,2015-08-20 02:40:44+00:00,cu925ak,3.0,t1_cu8g105,34267.0,TopGear
444,What phone are you using?,2015-08-19 07:28:38+00:00,cu815sl,2.0,t1_cty4kq7,743099.0,GoogleCardboard
445,What phone are you using with the powis?,2015-08-19 07:17:46+00:00,cu80z5p,3.0,t1_ctdhpez,2300032.0,GoogleCardboard
446,"Out of those three, which one would you reckon is the best?",2015-08-19 06:56:26+00:00,cu80ll1,4.0,t1_ctdq7nr,2286658.0,GoogleCardboard
447,Interesting. How hard would it be to create a diopter adjustment for cardboard similar to the way binoculars work?,2015-08-19 06:37:09+00:00,cu808mj,2.0,t1_cu2ipp8,433489.0,GoogleCardboard
448,"I don't doubt that the iPhone has a great camera, but I'd like to hear a photographer's opinion",2015-08-18 19:52:55+00:00,cu7ex6v,1.0,t3_3hhhwv,1209.0,Android
