,body,created,id,nest_level,parent_id,reply_delay,subreddit
81,"Please correct me if I'm wrong guys, but I've seen prices for older models go down but not by that much- maybe a hundred to a few hundred bucks difference. What's more likely to happen is that the mid 2015 model will be discontinued at some point, rather than get a significant reduction in price.

I don't think Apple wants to condition people to huge clearance level prices every time they release a new iteration, if that makes any sense.",2016-10-28 07:25:11+00:00,d9b5jss,2.0,t1_d9b4iwh,2985.0,apple
82,Even crazier ones in the 3k range.,2016-10-28 05:25:11+00:00,d9b2sjb,6.0,t1_d9aygtz,7845.0,apple
83,I'm kinda surprised people aren't getting more SSD storage. Do you plan to use external drives for backup?,2016-10-28 04:42:49+00:00,d9b1j58,3.0,t1_d9ac81i,35859.0,apple
84,"I agree with you in the sense that we can speculate about the touch bar but we shouldn't judge it before trying it out.

I'm skeptical that it can increase productivity but I don't necessarily think its about helping people work faster, its about making the experience of apps more interactive and engaging which might be worth it on its own.",2016-10-28 04:34:35+00:00,d9b19pp,1.0,t3_59sacn,5443.0,apple
85,Has there been any performance tests on these new graphics cards? I'd be curious to know how they compare to the latest generation of GeForce cards for example,2016-10-28 04:31:50+00:00,d9b16ne,1.0,t3_59sft5,3157.0,apple
86,Yeah but just because Microsoft did a bad job with the Surface Pro 4 doesn't mean Apple would. Bring all the user experience experts from iOS and disseminate that to a touch friendly Mac OS.,2016-10-28 04:30:27+00:00,d9b151w,2.0,t1_d9ayoca,4229.0,apple
87,"I'm also an amateur filmmaker and full time developer like yourself, and the problem with the Final Cut Pro demonstration is that all of those things (timeline scrubbing, controlling volume, trimming, shortcuts to certain actions) could be done pretty simply already by editors with keyboard and mouse.

In other words, the touch bar seems like a really fun and new interface/experience but it wasn't really solving problems for editors that needed solving necessarily and I'm not sure it would really increase productivity all that much for power users.",2016-10-28 03:34:35+00:00,d9az7pz,1.0,t3_59plil,32958.0,apple
88,Is the Radeon Pro good enough to run Oculus?,2016-10-27 18:44:23+00:00,d9ac6nx,1.0,t3_59olaj,11685.0,apple
89,"It would be great if the iPhones eventually had a swipe left on home button to go back feature. The back button just makes way more sense at the bottom from a UX perspective because its easier to get to, which is why Android has the universal back button. Double tapping just to get to the back button while one-handed and then double tapping to dismiss that mode is a bit much.
",2016-10-27 16:05:07+00:00,d9a46qo,2.0,t1_d9a26up,2437.0,apple
90,"I feel like it would be less likely for Apple to do that because the sales might eat into their iPad Pro lineup.

",2016-10-27 05:47:33+00:00,d99n5jf,2.0,t1_d99mvr6,649.0,apple
91,"In actuality, this show seems to have very little to do with Earn making it out from the hole he's in and more to do with exploring issues that really matter to the writers. In other words, the driving force behind plot from episode to episode seems to be social commentary rather than Earn or Paperboi's story arc and I don't necessarily think that's a bad thing.",2016-10-27 03:28:27+00:00,d99irxh,4.0,t1_d985y50,77823.0,AtlantaTV
92,I also hope that Craig becomes a reoccurring character. ,2016-10-27 02:51:07+00:00,d99h9uf,2.0,t1_d97z8dw,87274.0,AtlantaTV
93,"On the other hand, if the characters are too successful then they become less relatable.",2016-10-27 02:43:58+00:00,d99gyx2,4.0,t1_d987g8f,71059.0,AtlantaTV
94,"It came a little too late I feel. Tons of people hopped off by the first season, probably because they had unrealistic expectations of what the show was going to be.",2016-10-26 06:48:13+00:00,d9877vp,1.0,t3_59fj66,10622.0,television
95,Exactly. There's no way Google could have made an accurate sales projection because the Note 7 situation was an unprecedented variable.,2016-10-26 06:17:05+00:00,d986jqs,5.0,t1_d981q2p,9586.0,Android
96,"On the flip side, I'm glad they did that because the majority of people are going to use these devices as phones. They should've put a sim card in the Pixel to make it more valuable to real world users.",2016-10-25 03:43:50+00:00,d96loy8,2.0,t1_d96fpc3,8749.0,Android
97,"You could still have a metal unibody and a removable battery, kinda like what [LG did](http://venturebeat.com/2016/02/21/lg-g5-unveiled-metal-body-removable-battery-and-an-expansion-slot/)",2016-10-25 03:13:28+00:00,d96kjt3,4.0,t1_d96dh0c,10077.0,Android
98,"Even though I'm on the side of removable batteries, it would probably make it that much harder to waterproof the phone (disclaimer: not a waterproofing expert).",2016-10-25 03:08:05+00:00,d96kbvv,4.0,t1_d96c3ze,11714.0,Android
99,"I think the watch will probably have to do more than just glances, possibly pivot into a health product with heart rate and glucose sensors and so on.

Because there are Android watches for $50 that could give you the same glances that an Apple watch does, but majority of users still don't see the value proposition of a smart watch when they already have a phone. Having glanceable data is not enough to sell a $300 product.",2016-10-24 16:04:37+00:00,d95punj,5.0,t1_d95or90,1398.0,apple
100,Are there rumors about what graphic cards are going into the laptops? How powerful are they compared to the current PC generation?,2016-10-24 15:50:46+00:00,d95p75l,1.0,t3_58ym2c,93830.0,apple
101,Wow is this really a thing? When is the crossover supposed to be?,2016-10-23 06:25:00+00:00,d93zcot,1.0,t3_58wq52,12226.0,FlashTV
102,Doesn't work as well for me on the iPhone 6S+ but honestly don't have much of an issue just holding and pressing the home button,2016-10-22 18:25:50+00:00,d93a5u0,2.0,t1_d938syt,2109.0,apple
103,"I suppose it depends on where you live and what kind of rainfall you get. Say you lived in England for example, heavy rain might be a more common thing to worry about when using your phone.",2016-10-22 18:19:30+00:00,d939wvh,3.0,t1_d9364rg,5873.0,Android
104,I wouldn't mind a Continuity option to mirror all notifications regardless of app (similar to Pushbullet),2016-10-22 18:14:05+00:00,d939pb1,1.0,t3_58t94e,15053.0,apple
105,"Its not usable because of this: http://imgur.com/a/zedZF

And Siri does not pronounce anything for you. There's gotta be an alternate command.",2016-10-22 18:06:00+00:00,d939e5a,3.0,t1_d92x1jz,24875.0,apple
106,"Does Siri have a translation command? One thing I miss from Google Now is the ability to ask: ""How do I say ____ in Spanish?""

Siri doesn't know what to do with this which is pretty disappointing.

EDIT: http://imgur.com/a/zedZF",2016-10-22 09:36:40+00:00,d92vna5,1.0,t3_58r56l,25244.0,apple
107,"I'm not super educated on measure RR so I still need to read up on what Bart would do with the money, but I'd love to see Caltrain get the extensions they wanted to the East Bay and other places as an accessible alternative to Bart.",2016-10-22 00:44:46+00:00,d92inb3,2.0,t1_d920wm6,25408.0,bayarea
108,"Nightmare situation. Not sure which is worse, Comcast or AT&amp;T",2016-10-21 22:08:51+00:00,d92d1ea,1.0,t3_58on56,14780.0,movies
109,You'd be surprised. People carry laptops and tablets so a portable console of that size isn't a far cry,2016-10-21 20:41:28+00:00,d929erd,5.0,t1_d91ygva,13834.0,Games
110,I hope they drop hints that this is an alternate universe. The X-Men cinematic universe already has a lot of continuity baggage as it is.,2016-10-21 08:13:05+00:00,d91ila2,1.0,t3_58k71i,30507.0,Marvel
111,Hopefully they'll just suggest this is an alternate timeline to prevent any continuity baggage from previous movies,2016-10-20 17:11:15+00:00,d90jm2i,3.0,t1_d908o2a,13882.0,movies
112,"His death seemed really obvious in this trailer with Logan and the girl in the two shot at the end, so I hope they pull a fast one on us and Charles makes it out.",2016-10-20 17:03:17+00:00,d90j7pb,2.0,t1_d908628,14256.0,movies
113,Trailer could not have been more perfect,2016-10-20 16:57:51+00:00,d90ixlk,1.0,t3_58gow0,14267.0,movies
114,What are the current rumors on their graphics card?,2016-10-18 21:16:09+00:00,d8xtm3z,1.0,t3_5812el,72613.0,apple
115,The girl's name is Elsie and I believe the security officer's name is Ashley,2016-10-18 01:43:41+00:00,d8wmigv,5.0,t1_d8vn6tf,45448.0,westworld
116,Do you have any pictures that demonstrate the camera capabilities?,2016-10-17 20:12:56+00:00,d8w7bv7,1.0,t3_57sn4p,94468.0,apple
117,The paranoia is contagious. Any of the workers could be hosts.,2016-10-17 05:23:14+00:00,d8vd7s0,2.0,t1_d8hmmvn,855036.0,westworld
118,When did they say something bad happened 30 years ago? I must have missed that piece of exposition.,2016-10-17 05:11:46+00:00,d8vcwdn,,t1_d8laudt,,westworld
119,"I imagine that's why the park requires guests to answer a behavioral survey in the beginning. If the guests are psychologically evaluated to be psychopathic or murderous, they're probably swarmed with hosts or manipulated into storylines to prevent interaction with real people.

My guess is that guests absolutely would be able to kill each other by accident, but there are people that die from theme park accidents and millions still visit theme parks every year.",2016-10-17 04:40:14+00:00,d8vbz1p,2.0,t1_d8v9ooj,3833.0,westworld
120,What add-ons would you say are actually worth it?,2016-10-16 08:27:25+00:00,d8u4a7r,,t1_d2wc6xf,,teslamotors
121,"Wow, definitely not. I've been using iOS for the past month and  Sync, Relay, Baconreader are all better than Antenna. Narwhal is the closest thing on iOS I've found to a client that compares.",2016-10-16 00:50:37+00:00,d8tqshp,4.0,t1_d8tpc3z,2245.0,apple
122,True but I think his point is that Samsung has had a history of questionable quality control,2016-10-15 18:28:16+00:00,d8tbpb3,5.0,t1_d8t3kfk,12711.0,Android
123,Some Star Wars fan at Disney has probably been waiting almost forty years to fix this plot hole,2016-10-13 15:05:40+00:00,d8qbgc8,6.0,t1_d8q8177,4661.0,movies
124,"That's really too bad. Hopefully they'll create a role for him, like William Regal's enforcer or something, so he can still get involved in some matches or storylines but without taking bumps.",2016-10-13 08:19:48+00:00,d8q0dr5,1.0,t3_576hzj,40695.0,SquaredCircle
125,Is the Better Sweater thicker than most sweaters? How does it compare to a cheaper sweater from Banana Republic or Uniqlo for example? ,2016-10-13 07:07:40+00:00,d8pz0pm,1.0,t3_575rel,44420.0,frugalmalefashion
126,"To be honest there are a lot of bad to average screenplays saved by an incredible director. The best example I can think of is Christopher Nolan's Dark Knight- the movie far exceeded the original script in its execution. The same is true with many of Quentin Tarantino's scripts, not that his scripts are bad but his movies come out even better than the blueprints described.

So even though the script may not have been perfect, I'm sure that the cast had faith in David Ayer. Also keep in mind that filmmaking requires shooting the script in a non-linear fashion for budget, permit and time constraints and this affects their abilities to really grasp the scale of the fuck up until everything is shot.
",2016-10-13 07:04:32+00:00,d8pyydx,1.0,t3_578h9n,9972.0,movies
127,"Damn, I want to hear your story",2016-10-13 01:45:01+00:00,d8poic5,4.0,t1_d8pmhqz,2956.0,smashbros
128,I did! I wanted to see her go from little sparks to Apocalypse giving her nuclear level power.,2016-10-12 05:38:51+00:00,d8ofyrd,3.0,t1_d8of86x,1580.0,movies
129,"Is this actually true?
",2016-10-12 03:19:25+00:00,d8obahe,,t1_d55figk,,apple
130,"Damn, 10 million downloads is incredible. Did you do any search engine optimization stuff? I wish my apps had even one hundredth of that success.

Anyway, good luck man. And you tried reaching out to them on their [contact page](https://www.facebook.com/help/contact/515402665291918)? ",2016-10-12 02:06:52+00:00,d8o8eky,1.0,t3_570gco,17366.0,androiddev
131,Is there anything that Assistant does that Google Now doesn't do? I'm wondering if its worth switching over,2016-10-12 01:32:39+00:00,d8o6zto,3.0,t1_d8o66dx,1167.0,Android
132,What features are gained from Assistant vs Google Now On Tap?,2016-10-12 00:47:35+00:00,d8o5397,1.0,t3_56za01,25573.0,Android
133,What became of this friend?,2016-10-11 22:49:14+00:00,d8o04u2,3.0,t1_d8ng0c0,24986.0,AskReddit
134,"It has the reputation of catching on fire at this point. I'd imagine they'd want to rebrand this flagship altogether.

",2016-10-11 19:57:59+00:00,d8ns5j4,4.0,t1_d8nhz8c,12313.0,Android
135,How much space is left in the car?,2016-10-11 18:30:23+00:00,d8nnuu0,1.0,t3_56t30s,91122.0,teslamotors
136,They will probably end the Note lineup,2016-10-11 04:42:20+00:00,d8mxocm,2.0,t1_d8mxjmw,237.0,Android
137,"Damn, I'd be cool if they shortened all the series from thirteen episodes to eight episodes if it meant more Defenders every year.",2016-10-09 19:10:27+00:00,d8ks19u,1.0,t3_56lxs0,24995.0,Marvel
138,"Sure, the white savior point might be off but I still think this was Roy Thomas's attempt to basically make Bruce Lee for Marvel but without the Asian face",2016-10-09 18:56:53+00:00,d8krdhn,3.0,t1_d8kec8a,20430.0,Marvel
139,"Iron Fist kinda strikes me as old school Marvel's intention to culturally reappropriate kung fu and Asian culture but without the Asian face, kinda like the Macklemore of martial arts for the Marvel Universe.

Reminds me a lot of Avatar, Tom Cruise's Last Samurai or that new Great Wall movie with Matt Damon- white guy comes in and co-opts the culture, fucks the foreign girl and saves everyone at the end. 

Which is pretty interesting- like imagine if you took Netflix's Luke Cage, which has a lot of interesting stuff about black culture, Hip Hop culture, and being a black hero, but then making Luke Cage a white savior instead.",2016-10-09 08:44:33+00:00,d8k9jxj,1.0,t3_56jn98,33174.0,Marvel
140,"She either gets in Luke's way or becomes a non factor for most of the show doing interrogations or investigations that lead to nothing useful. 

The good thing about her is that she gets her shit together quickly when she has setbacks.

If shit went down I think Luke would rather have Claire on his side (or Jessica of course)",2016-10-07 18:04:43+00:00,d8i6efd,1.0,t3_56cmlp,1287.0,Defenders
141,"On the other hand, if an ordinary human like Crossbones or Batroc can tag Captain America, Luke definitely has a shot- especially in an enclosed area. ",2016-10-07 08:33:32+00:00,d8hnck3,2.0,t1_d8hler1,6203.0,Defenders
142,"Well there aren't that many characters compared to ensemble shows like Walking Dead or Game Of Thrones. There's the main four and then: Trish, Foggy, Karen, and Claire. If the Defenders are split up for most of the season I could imagine it being Iike Lost- the characters rarely being together but split into small groups for 99% of the show",2016-10-07 08:06:41+00:00,d8hmw0i,3.0,t1_d8hk67g,7851.0,Defenders
143,Try wearing [the white tubulars with black pants](http://6.kicksonfire.net/wp-content/uploads/2016/04/adidas-Tubular-Radial2.jpg?541b01),2016-10-07 05:39:19+00:00,d8hjr7y,2.0,t1_d8h5kqe,22484.0,frugalmalefashion
144,How long does the indexing usually take?,2016-10-05 23:21:28+00:00,d8fq2pi,2.0,t1_d8fis8j,9928.0,apple
145,This is crazy. Imagine if his biological father never gave him up. Would he have still become CEO of Apple? Or would he be some  manager at a restaurant?,2016-10-05 23:18:26+00:00,d8fpybe,1.0,t3_55z0o7,42137.0,apple
146,Doesn't sound that far fetched. Phones are essential to people at this point. I can imagine him working to get a new phone as soon as he landed.,2016-10-05 23:01:34+00:00,d8fpa2n,2.0,t1_d8ffm1c,12646.0,Android
147,"For a child actress, her performance was pretty good. Usually at that age, child actors can't really pull off subtlety or nuance. She performed in a way that wasn't corny to adults and that's pretty special to find in a kid.",2016-10-05 22:34:43+00:00,d8fo69i,2.0,t1_d8f4lir,24467.0,television
148,"What Cable Matters sent to me, lol:

Thank you for the message.  I’m very sorry to hear that happened.  There are many factors that could contribute to this failure but I’m sorry that our cable was involved.  To help make up for some of the inconvenience please let us know your order ID and we’d be glad to offer a full refund on your order.
 
Regards,

Jacob",2016-10-05 22:00:23+00:00,d8fmpya,6.0,t1_d8f9ow3,16149.0,GalaxyNote3
149,Is the screenplay any good?,2016-10-05 21:53:55+00:00,d8fmfnt,2.0,t1_d8edzja,74067.0,movies
150,"I contacted both Cable Matters and Samsung, but can't imagine either of them helping me out on this one",2016-10-05 17:24:21+00:00,d8f9cgg,4.0,t1_d8f93mp,294.0,GalaxyNote3
151,"Yeah, the phone still turns on and the battery still works just fine- so there's that.",2016-10-05 17:18:57+00:00,d8f92td,2.0,t1_d8f0xbd,10298.0,GalaxyNote3
152,Thanks for the heads up. Unfortunately I'm not good with my hands so it sounds a little daunting and I don't have the right screwdriver for this but I'll look at the guide on ifixit like you said.,2016-10-05 17:18:36+00:00,d8f927i,2.0,t1_d8f7wd1,1423.0,GalaxyNote3
153,[Cable Matters](http://imgur.com/a/HVyxA) is the brand that I was using,2016-10-05 17:12:54+00:00,d8f8s1i,2.0,t1_d8f4fg0,5365.0,GalaxyNote3
154,"Here are [pictures](http://imgur.com/a/HVyxA) of the USB cable I was using. Its from a brand called ""Cable Matters""",2016-10-05 17:11:29+00:00,d8f8pi3,2.0,t1_d8ew5e5,18193.0,GalaxyNote3
155,"Here are [pictures](http://imgur.com/a/HVyxA) of the charger that you asked for.

I was using Resurrection Remix as my ROM, an Anker battery, and this ""Cable Matters"" 3.0 USB Cable, any and all of which could have been the cause of the problem.",2016-10-05 17:10:25+00:00,d8f8nlj,2.0,t1_d8euci1,22949.0,GalaxyNote3
156,"Sure, Rock is definitely a part timer but I feel that Cena's promos against Rock were equating part timer with laziness or half-assing, which I feel was a little undeserved.

Rock doesn't need to come back to the WWE once or twice a year with his bajillion projects a year, movies, 50 million per year salary etc. So when he makes time for WWE out of his busy schedule for the fans, it doesn't make sense for Cena to hold him up to the standard of a full time wrestler. Cena can't see all the crazy hard work that Rock is doing outside of WWE because Cena only plays in the WWE sandbox, so he equates that with Rock being lazy or not showing up.

Similarly, Cena is doing tons of stuff that actually increases publicity for the WWE like the upcoming reality TV show he's doing or all the charity work he does, but Ambrose may not perceive the hard work that Cena is putting in outside of wrestling because Cena is not in front of Ambrose in a tangible way every night while he does 200+ matches a year.

",2016-10-05 16:54:20+00:00,d8f7vel,5.0,t1_d8f3hyg,5431.0,SquaredCircle
157,Ryback chants would be fun,2016-10-05 10:43:45+00:00,d8eu9n4,2.0,t1_d8ej6zg,27571.0,SquaredCircle
158,"The phone is not even out yet so I'm confused about how people can judge whether its worth $650 or not. iPhone users have been saying for years that its not about specs, its about the experience. Let's wait and see if the Pixel experience justifies the price before immediately shitting on Google for taking a chance.",2016-10-05 10:27:10+00:00,d8etyuv,2.0,t1_d8e9gz2,39209.0,apple
159,"Smackdown is a huge part of that I feel. Ever since the NXT head writer moved over to Smackdown, you can see this tangible ground swell where all of a sudden Ziggler and Miz are suddenly interesting again, Ambrose, Cena and AJ are cutting quality promos and delivering great matches. Becky Lynch is treated as a top wrestler instead of a third wheel in feuds etc. You begin to realize that these people had the potential all along but that the creative system was stifling them.

",2016-10-05 09:08:54+00:00,d8esoxn,2.0,t1_d8eogxq,12895.0,SquaredCircle
160,"You're thinking too deeply I feel. Both Rock and Cena work extremely hard, neither of them really deserve the criticism of being called lazy. But this is a promo meant to sell the feud, it doesn't necessarily have to be completely true.

But I think the rivalry between Ambrose and Cena is real regarding who is the most loyal to the company and its palpable in their promos to each other.",2016-10-05 09:03:10+00:00,d8eslks,3.0,t1_d8eq7cj,8090.0,SquaredCircle
161,"He definitely needs to completely revamp his move set. Everybody is doing the suicide dive so he could probably cut that out. The bulldog doesn't look that good and the rope telegraph thing he does is played out at this point.

I'd like to see him with more aggressive brawler style moves that just seem raw, like Seth Rollin's curb stomp or the way Daniel Bryan used to pull on the nose of his opponents while going for the surfboard- just like borderline illegal looking moves that emphasize his grit.",2016-10-05 08:48:23+00:00,d8escxr,2.0,t1_d8en7bo,14337.0,SquaredCircle
162,"I agree, I can't imagine any promo topping the one that Miz had with Daniel Bryan just because of the subtext of what they were saying to each other.

However, Dean Ambrose has been consistently killing it on the mic this year in terms of promo work, especially that promo he cut on Talking Smack.",2016-10-05 08:38:21+00:00,d8es73n,5.0,t1_d8eqx17,4433.0,SquaredCircle
163,"The motion controller is what elevates it in my opinion.

It looks comfortable which is a huge bonus.
",2016-10-04 20:17:04+00:00,d8e0nfk,3.0,t1_d8dsp83,9726.0,Android
164,The system kind of fails in Jessica Jones and Daredevil too at various points. Its the strongest justification for vigilante superheroes in my mind and that's why its easy for writers to portray police departments this way.,2016-10-02 21:05:32+00:00,d8b9j22,1.0,t3_55jid4,9401.0,Defenders
165,I appreciate you looking out for me but I needed a go pro urgently,2016-10-01 19:47:52+00:00,d89wns2,2.0,t1_d89w64c,787.0,frugalmalefashion
166,"Damn, if I was XS or XL I'd be living like a king right now",2016-09-28 16:40:55+00:00,d85oown,1.0,t3_54x5dc,1293.0,frugalmalefashion
167,"I'm still looking for an eBook reader as good as Moonreader on iOS but there doesn't seem to be an iOS app that can read all three major formats: PDF, ePub and Mobi which is annoying.

I love MX Player and wish iOS had a video app that auto fetched subtitles for me the way MX Player or BSPlayer does.

I also get withdrawal from missing the MusicXMatch widget that draws karaoke lyrics over the song that's current playing on any music app you're using. I use it all the time on the train because its harder to hear lyrics but on iOS you have to use the MusicXMatch app and nobody else's.
",2016-09-28 02:50:02+00:00,d850nxw,1.0,t3_54sffj,25371.0,androidapps
168,I liked Dean's theme song at first but at this point I think he deserves a better one. It gets bland very quickly and doesn't hold your attention.,2016-09-27 08:05:39+00:00,d83v8rb,5.0,t1_d82vnu0,53086.0,SquaredCircle
169,"My Mario Kart 8 and Super Mario 3D World backups don't even work for me after I upgraded to the latest OS version 5.5.1 so there's that. 

",2016-09-24 06:21:55+00:00,d7zvgma,3.0,t1_d7znzlp,16482.0,WiiUHacks
170,It works but has lots of bugs depending on what game you're trying to run from my experience. ,2016-09-23 21:27:25+00:00,d7zet7a,1.0,t3_5466tg,10781.0,WiiUHacks
171,"The truth is that Punk is a celebrity outside of the UFC and as long as he can generate PPV buys, he's still useful to the UFC even if he never reaches UFC caliber status as a fighter because there are lots of people that will watch his fights.",2016-09-23 08:27:12+00:00,d7ymhfn,4.0,t1_d7y2fq6,37208.0,MMA
172,Is this the dude that created 5 Centimeters Per Second?,2016-09-23 08:15:05+00:00,d7ymaab,1.0,t3_543iu8,4665.0,movies
173,"The Avengers saved people by stopping that theft. Those enemies were stealing a bio weapon that would've ended way more lives. Howard Stark accidentally created a bio weapon that killed hundreds of innocent people called Midnight Oil, so you would think Tony knows all about the importance of stopping bioterrorism from happening on his watch.

Moreover, even Spider-Man says ""when you can do the things I can, but you don't- then the bad things happen because of you."" That flies in the face of the Sokovia Accords which is basically allowing people that almost nuked New York to control the Avengers from taking action and saving lives.

Remember when Tony Stark created Ultron who almost wiped the entire planet? Imagine if the world governments were like ""Yeah sorry Avengers. You can't fly into Sokovia because its a foreign country and you don't have legal jurisdiction there. We can't let you go in there and stop billions of people from dying because if you go in there and fight then potentially dozens of people could be killed in the melee crossfire.""",2016-09-23 07:56:54+00:00,d7ylzeu,7.0,t1_d7yliml,1590.0,movies
