,body,created,id,nest_level,parent_id,reply_delay,subreddit
174,"I felt like Tony's arguments had very little weight. The Starks were pretty much responsible for all the bad things that led up to Civil War.

Howard created the serum, which started the arms race between America and Russia for super soldier serum in the first place. Bucky was just a victim of the serum that Howard created. Without Howard, Bucky never could've been turned into a weapon.

Tony never learned from Howard's mistakes. All three super villains from the Iron Man movies exist because of the Starks' unbearable need to create. They just keep making shit that could be used by bad people: the arc reactor, the super soldier serum, the guns and missiles used by terrorists in Iron Man 1 etc. Tony was even responsible for the completion of the Extremis virus. The Sokovia Accords happened because Tony created Ultron which led to the death of Baron Zemo's family.

Cap and Bucky are just victims of what the Starks irresponsibly invent and manufacture. Tony is the one that should have government oversight, not Cap.",2016-09-23 07:25:28+00:00,d7ylfdt,1.0,t3_5430ov,11632.0,movies
175,"To play devil's advocate, Cap did those things because the current establishments can't be trusted.

* The world security council almost nuked New York in Avengers and put their trust in SHIELD which almost killed everyone important in Winter Soldier (which would've included Tony Stark). It doesn't make sense to trust world leaders with the Avengers.

* The only one who actually deserves to be locked up or watched is Tony Stark because he created Ultron, who was capable of ending the world. 

Furthermore, the Starks are the ones that cause most of the problems that led to this movie because they refuse to stop inventing things that could potentially be used by bad people. Let me explain: 

* Howard Stark is shown to be obsessed with inventing things for military application in Agent Carter. 

* If you watch Agent Carter, Howard created the nerve gas that accidentally killed all the American soldiers in WW2, making the Soviets want Howard's inventions in the first place. 

* Howard was also shown to be obsessed with getting access to pym particles for military applications.

* Howard created the super soldier serum as a weapon in the first place which lead to an arms race where the Soviets took that serum and forcibly stuck it into Bucky: including torturing, brainwashing and ruining Bucky's life so that he would kill Howard and take more the serum- which Howard was presumably going to use to make even more super soldiers anyway

* Tony manufactured weapons which were used all over the world by terrorists in Iron Man 1.

* Whiplash (Iron Man 2) and Iron Monger (Iron Man 1) are able to become super villains in the movies because the Starks irresponsibly do not know how to keep the arc reactor from falling into the wrong hands. This is exactly the type of shit that Hank Pym was worried about.

* Tony fixed the Extremis problem in the beginning of Iron Man 3 which allowed The Mandarin to become a super villain and put the president's danger in life.
",2016-09-23 06:45:45+00:00,d7ykno3,2.0,t1_d7yjy4l,2054.0,movies
176,How do you view mobi files on Kindle?,2016-09-21 01:16:09+00:00,d7vfbwy,2.0,t1_d7uylxw,22767.0,IPhoneApps
177,Does Jack still prevent Instant Run from working as it states here: https://developer.android.com/guide/platform/j8-jack.html? What's the timeline for reconciling Jack with Instant Run?,2016-09-19 23:18:27+00:00,d7tua5a,1.0,t3_53iqji,20627.0,androiddev
178,"I still have mixed feelings about the formal declaration of a Cruiserweight Division. Not that I don't love cruiserweight wrestling, but when you start putting wrestlers back into weight brackets, these talented cruiserweight wrestlers will have the stigma of being small guys in the smaller division and it might be harder for them to move up to main event.


",2016-09-17 06:59:04+00:00,d7qb4zt,1.0,t3_533mic,41725.0,SquaredCircle
179,How bad is it on the battery?,2016-09-16 00:17:22+00:00,d7okvj3,6.0,t1_d7nz7oi,28301.0,androidapps
180,"There's a thread about Orton being allowed to take bumps at WWE live events, despite suffering a concussion at Summerslam when a steroided Brock Lesnar repeatedly bludgeoned him for some fresh cherry juice",2016-09-15 22:08:18+00:00,d7ofprw,3.0,t1_d7oeh0q,1703.0,SquaredCircle
181,I haven't been watching in a long time but that women's title is fucking gorgeous,2016-09-15 03:45:08+00:00,d7ne5qy,1.0,t3_52r6li,42318.0,SquaredCircle
182,How much battery does this consume compared to a regular stereo?,2016-09-14 23:49:49+00:00,d7n53ge,1.0,t3_52rcch,26301.0,DIY
183,Could he potentially apply for low income housing on that kind of salary if he has three dependents? Not sure what the rules are to qualify for that.,2016-09-14 17:14:13+00:00,d7mmlqj,1.0,t3_52qmyx,11229.0,bayarea
184,"Upper middle class and rich people spend retarded amounts of money in fine dining. There are people that spend money on meals like this every other day: $30 entrees, $20 appetizers, $20 drinks etc etc.",2016-09-14 07:48:22+00:00,d7m5dqa,2.0,t1_d7lwaa8,19831.0,AtlantaTV
185,Correct me if I'm wrong but I don't remember a single death being linked to his leaks.,2016-09-13 20:47:34+00:00,d7lijz0,2.0,t1_d7lh8sw,1574.0,worldnews
186,The man is in danger no matter what country he decides to live in. He might as well live in fear with the comfort of his family and friends.,2016-09-13 20:46:15+00:00,d7lihn2,2.0,t1_d7l7581,13760.0,worldnews
187,"Not sure what your depth for experience is outside of learning Android, but at the very least I highly recommend auditing an intro class like UC Berkeley's CS61A/CS61B or Harvard's beginning class that specializes in Data Structures and Algorithms fundamentals.

That stuff will come in handy no matter what type of dev you end up becoming, iOS/Android or otherwise.",2016-09-13 00:33:37+00:00,d7kbxcz,1.0,t3_527eg3,150944.0,androiddev
188,"Though AJ could probably do all the spots that Orton does, but you wouldn't be able to say the reverse.",2016-09-12 17:08:40+00:00,d7jrl5k,4.0,t1_d7j7wts,43076.0,SquaredCircle
189,"SZA is the one. People might not see it yet, but she has the power to be the face of Alternative R&amp;B one day",2016-09-11 00:23:32+00:00,d7hl4z9,1.0,t3_5250vr,13638.0,hiphopheads
190,"Looks better in this [picture](http://sneakerkat.connectivemkt.netdna-cdn.com/wp-content/uploads/2015/06/16065-thumb.jpg) but yeah, I'll probably pass on this even though its the best price I've seen for a prime knit Stan Smith.",2016-09-09 11:57:30+00:00,d7fija5,2.0,t1_d7dwipy,105553.0,SneakerDeals
191,"There were definitely older white neighbors calling us gooks as an insult growing up so even though I fuck with Denzel, I just can't take this song seriously lol.

Like if kids in my city took the N word and started saying it means lame or weird in local street slang. Shit must be all butterflies and rainbows in Miami.",2016-09-09 08:08:28+00:00,d7fecf3,4.0,t1_d7ekhry,47554.0,hiphopheads
192,San Francisco has a lot of hip districts with distinct fashion styles. Surprised it wasn't even considered a top 10 city in the article.,2016-09-08 07:32:10+00:00,d7dxkzg,1.0,t3_51m0q2,55384.0,LosAngeles
193,"The Northface [Venture Jacket](https://www.rei.com/product/863106/the-north-face-venture-rain-jacket-mens?CAWELAID=120217890001922539&amp;CAGPSPN=pla&amp;CAAGID=30926923000&amp;CATCI=pla-182894381560&amp;cm_mmc=PLA_Google|404_3939|8631060183|4be7730c-3684-4f23-983d-3899afd93f88|pla-182894381560&amp;lsft=cm_mmc:PLA_Google_LIA|404_3939|8631060183|4be7730c-3684-4f23-983d-3899afd93f88|pla-182894381560&amp;gclid=Cj0KEQjwr7S-BRD96_uw9JK8uNABEiQAujbffOW2KDpc-LQjr74tiC0qyI9K4DhxnztOWoHeZ1AZwdYaAsGI8P8HAQ) is a pretty good alternative to the Torrentshell, but wouldn't exactly call it slim fitting. ",2016-09-05 19:22:56+00:00,d7akt9e,2.0,t1_d7a9078,19034.0,malefashionadvice
194,Some of those Rains jackets are still on [sale](https://www.nordstromrack.com/brands/Rains) at Nordstrom Rack,2016-09-05 19:18:34+00:00,d7akmzu,2.0,t1_d7a76yo,22827.0,malefashionadvice
195,I've tried to get rid of all things Samsung on my Note 3 but I have to admit that this is a fantastic looking app,2016-09-02 06:22:28+00:00,d76gtny,1.0,t3_50p4s9,38281.0,GalaxyNote3
196,"On the flipside of the argument, I have both oxfords and broadcloths from Uniqlo and the broadcloths feel nicer and thinner to me. Of course I can't speak for recent constructions.",2016-09-01 02:09:27+00:00,d74vmla,3.0,t1_d73jxev,81849.0,frugalmalefashion
197,I've been using Resurrection Remix which is also a CM Marshmallow based ROM and I vouch for it being pretty stable. Have not tried Purify yet.,2016-08-31 22:00:59+00:00,d74ltp2,2.0,t1_d74bz3k,12430.0,GalaxyNote3
198,"I agree with this. Even though Kanye has done some pretty fucked up things over the years, he's never assaulted a girl or drawn a gun on somebody weaker than him.

The type of douchey shit that Kanye does is really not that serious in comparison.
",2016-08-31 06:22:02+00:00,d73oxfz,6.0,t1_d73g1tq,16740.0,hiphopheads
199,He's not locked into anything. Those independent contractor agreements are completely non-enforceable and the WWE has pretty much lost every time a wrestler wanted out. The only reason I imagine Daniel staying would be because he genuinely wants to stay and help.,2016-08-28 06:35:58+00:00,d6zpi4w,3.0,t1_d6znnfl,4740.0,SquaredCircle
200,"Did it feel weird at some point to only draw white characters in the early days?

Was there ever a push in the '60s to draw more ethnic characters?",2016-08-25 19:39:23+00:00,d6wig1u,1.0,t3_4zj9he,12768.0,IAmA
201,Is waxed canvas tougher than leather?,2016-08-25 08:59:21+00:00,d6vushr,4.0,t1_d6vj8xl,25279.0,malefashionadvice
202,Thanks! I found it with your help!,2016-08-20 22:16:41+00:00,d6pvj30,2.0,t1_d6pmpv4,14273.0,surfing
203,It seems like the company only hires engineers that have over five years of experience. Do you guys still take candidates seriously if they have less than that?,2016-08-12 04:04:06+00:00,d6e4lk0,1.0,t3_4xay9k,11382.0,IAmA
204,I bet Kota Ibushi and Neville could've been Olympic level gymnasts in another life,2016-08-11 06:47:47+00:00,d6cxywc,1.0,t3_4x5no0,18185.0,SquaredCircle
205,I'd argue Stillmatic is just as good,2016-08-06 02:20:58+00:00,d6682mg,2.0,t1_d6680w2,85.0,Music
206,I don't think good looks alone is enough to make anyone happy in life,2016-08-06 02:15:24+00:00,d667vo2,2.0,t1_d65zycf,13042.0,SquaredCircle
207,My boy Mikaze living the dream right now,2016-08-06 02:11:10+00:00,d667qfz,1.0,t3_4wbdhv,33343.0,SquaredCircle
208,"Don't know about last year but there was a 50% off sale just three months ago, so I'm assuming the next one won't come for awhile.",2016-08-02 02:43:32+00:00,d60itxg,,t1_d5u49mi,,frugalmalefashion
209,"Damn, how do you find out the closing dates?",2016-07-30 01:03:12+00:00,d5wnluq,1.0,t3_4v8li3,17302.0,Frugal
210,"Which part of UK are you from? They have Chipotle in London! I was in London for the first time in May and you guys have a lot of good eating options that we don't have.

For example, you have a fast food chain called Wasabi that serves sushi and bento! We don't have any fast food chains that are healthy and convenient like that. And also, Marks &amp; Spencer completely shit on any convenience store that we have in the States.",2016-07-29 05:07:03+00:00,d5vj0gr,4.0,t1_d5srh9o,155830.0,smashbros
211,"Wow, what's your local mexican burrito option?",2016-07-27 03:11:27+00:00,d5shkjq,2.0,t1_d5sdykc,5162.0,smashbros
212,"If there is a way to make the Google Apps (Map, Calendar) default like Android then I am definitely jailbreaking",2016-07-25 17:34:06+00:00,d5q8ffz,4.0,t1_d5p6lw6,71474.0,apple
213,"I also don't see much in either of those guys, but maybe I need to watch some of their NJPW matches so I can get a better understanding of why fans are excited about them.

They seem like two generic big men right now and I don't know if that's just because of the booking.",2016-07-13 06:35:43+00:00,d5aaf77,3.0,t1_d59tbo1,29853.0,SquaredCircle
214,"Wow that's actually really good advice (watching someone at a sushi bar make it).

Thanks for your suggestions!",2016-07-12 02:53:14+00:00,d58qppz,2.0,t1_d58hb9j,15081.0,bayarea
215,"Wow! I want you to know I really really appreciate your encouragement! I'll probably watch every video you linked me to.

I'll definitely be making a fool of myself for years to come, I'm sure.",2016-07-12 02:51:28+00:00,d58qndd,8.0,t1_d57z6sw,39556.0,Dance
216,Damn that's cool. You guys need any mobile developers by any chance?,2016-07-11 06:26:00+00:00,d57l1d0,2.0,t1_d576f0a,27606.0,oculus
217,"That will definitely change if you keep watching. I felt the same way that you did and couldn't identify with all these personality-less gladiators in the beginning, but there are actually some pretty fun characters in the MMA world. I love Miesha Tate's humility and never give up attitude. I love Connor McGregor's attitude and confidence. 

I'll absolutely root for Ronda Rousey and Daniel Cormier though, especially after I learned that they're both huge wrestling fans and both of them actually went to Wrestlemania 31 (although DC was just in the bleachers). I felt like that made him one of us.",2016-07-11 01:19:57+00:00,d57bozn,5.0,t1_d56cn8h,73167.0,SquaredCircle
218,I bought it at one of the Zara stores in Madrid,2016-07-10 21:27:18+00:00,d573efa,2.0,t1_d56uv90,13287.0,malefashionadvice
219,"I suppose you're right, but even with fast fashion items I guess I expected the jacket to last a little longer than a split second. I didn't expect it to fray this quickly!",2016-07-10 06:47:48+00:00,d56fcl0,2.0,t1_d56f2cg,789.0,malefashionadvice
220,Not really sure John Cho could do much. He's not the writer or the director.,2016-07-09 04:26:44+00:00,d557evr,2.0,t1_d555t15,3294.0,movies
221,Oops sorry! That is the wrong link for #1! Its actually [THIS](https://www.youtube.com/watch?v=IpVf5-aTgys),2016-07-09 03:58:54+00:00,d556m9b,6.0,t1_d542f44,65851.0,Dance
222,"Wow this is fantastic! Thank you so much lazylearner! You compiled a lot of stuff for me, I really appreciate you going out of your way in putting this together! 

That is certainly a HUGE list of dance styles. I guess I would start with maybe trying to learn some Hip Hop fundamentals?",2016-07-09 03:56:52+00:00,d556k1b,6.0,t1_d542f44,65729.0,Dance
223,"Maybe try some of the parking lots in this [plaza area south of the 101](https://www.google.com/maps/dir/37.4207197,-122.0927185/Shoreline+Amphitheatre,+1+Amphitheatre+Pkwy,+Mountain+View,+CA+94043/@37.4204853,-122.0952739,16.95z/data=!4m14!4m13!1m5!3m4!1m2!1d-122.0938996!2d37.4202569!3s0x808fba0568aca303:0x5049ac390d5fd1be!1m5!1m1!1s0x808fb9f776f5e165:0x1ddf014a1b553f3d!2m2!1d-122.0807224!2d37.4267782!3e0) near Costco and In N Out.

Its only about a 20 minute walk. If you park close to the Shoreline you'll probably be stuck there for at least an hour and a half on your way out of the concert.",2016-07-07 07:56:28+00:00,d52ke1z,1.0,t3_4rl4kf,34363.0,bayarea
224,"The basic gist of this is that airline websites keep track of you visiting the page through cookies. For example, how does Reddit remember that you signed in when you visit it every day? Its through cookies- a little snippet of code thats saved in your web browser (Chrome, Firefox). 

Its obviously very helpful if you don't want to sign in to gmail and reddit all the time, but air flight websites use cookies to get more money out of you. They raise the airline prices on you if you keep clicking through the pages to make it seem like everybody is buying the flights you were just looking at, thus convincing you to panic and buy flight tickets before they're all sold out. In incognito mode you're basically disabling cookies. You're like a ghost so the websites can't keep track of you visiting their site and dynamically increasing their prices on you. Hope that explanation makes sense

",2016-07-07 07:28:50+00:00,d52julx,,t1_d0mocoh,,LifeProTips
225,"Here are some dances I loved that I definitely am not capable of doing:

[1](https://www.youtube.com/watch?v=NBuIU22BfKs)

[2](https://www.youtube.com/watch?v=uFO4Riu5DjU)

[3](https://www.youtube.com/watch?v=sUw6cQ_ORJI)

",2016-07-07 06:41:51+00:00,d52iv0z,4.0,t1_d52hu9d,2517.0,Dance
226,Sorry I should have specified. Hip Hop? Contemporary maybe?,2016-07-07 05:55:40+00:00,d52hqcd,2.0,t1_d52hehb,762.0,Dance
227,"Pardon my ignorance, but why are people taking the cage off of these? Doesn't the cage add support and make it a better running shoe?",2016-07-06 18:25:58+00:00,d51pif8,1.0,t3_4rivxw,12286.0,Sneakers
228,Thanks for the insight. Did you work the VIP day? How does that work? Who gets to show up on VIP day?,2016-07-06 16:54:37+00:00,d51kxrq,2.0,t1_d51jbo3,1978.0,Sneakers
229,I still don't want this trade to happen. Both OKC and GSW were doing just fine this season without forming a super team. I think its bad for the league when superstars gang up just to win rings. Lebron started this terrible trend and now we're continuing it.,2016-07-04 23:46:06+00:00,d4zdy07,2.0,t1_d4z9w95,7001.0,bayarea
230,It worked out for Metta World Peace,2016-07-04 18:37:07+00:00,d4z2gye,2.0,t1_d4yvawy,10262.0,nba
231,"Damn, I stopped watching wrestling during this time like many others after the end of the Attitude Era. I had no idea Regal could cut main event level promos like this.",2016-07-04 07:32:45+00:00,d4ykiei,1.0,t3_4r2e1m,58440.0,SquaredCircle
232,Sting vs Rock would've been another crazy one. The electricity would be off the charts.,2016-07-04 06:24:19+00:00,d4yj5u9,2.0,t1_d4y9y11,19758.0,SquaredCircle
233,"I'm a Warriors fan and I hope this doesn't happen. I hate this modern trend of top superstars rescinding loyalty to form super teams just for rings. I know I can't fault a man for wanting to win, but the Warriors have proven that they don't need Kevin Durant to win a championship. We can still be contenders without trying to assemble Voltron like the Lakers or Heat.",2016-07-04 06:09:45+00:00,d4yiu0j,1.0,t3_4r3mv5,35152.0,nba
234,"Looks great, too bad nobody is seeding the torrent.",2016-07-02 06:23:24+00:00,d4wcq5i,,t1_d4sco8d,,learnspanish
235,"Was it really that exorbitant though? He was the most popular character in the entire movie and his star power has quadrupled since the first film. Plus, its 50 million spread out over two movies.

Each movie could make half a billion to a billion dollars. Spending 50 million to potentially double the gross for two blockbuster sequels back to back doesn't sound like an exorbitant investment at all.",2016-06-26 18:47:33+00:00,d4ovh37,2.0,t1_d4ondo4,13847.0,movies
236,Anyone know what issue this is?,2016-06-25 23:36:23+00:00,d4o20t0,1.0,t3_4pn5sa,119032.0,Marvel
237,Both of those numbers are pretty impressive honestly.,2016-06-25 21:14:06+00:00,d4nx713,3.0,t1_d4np5gk,13510.0,SquaredCircle
238,Need Android devs by any chance? ,2016-06-25 03:50:03+00:00,d4n5ou8,5.0,t1_d4ml2pi,32655.0,investing
239,"Are those two communities worth it? The nomadlist especially- $10 a month to talk to people sounds a little steep for a service that should be free

EDIT: Currently based in San Francisco where the rent is destroying me",2016-06-24 16:31:50+00:00,d4mev91,3.0,t1_d4m9jxn,7226.0,IAmA
240,"Same reason that some Captains will abandon ship and let the passengers sink.

Cameron is trying to get the fuck outta dodge.",2016-06-24 08:11:29+00:00,d4lzwta,2.0,t1_d4lzfnn,1363.0,news
241,"Still, five prime ministers in the last five years? Australia's got its fair share of problems too it seems",2016-06-24 08:04:23+00:00,d4lzrf6,2.0,t1_d4lz0uk,2045.0,news
242,"What are the most active countries? How many people for the European cities?

I'm not convinced yet that I should pay but maybe I should just bite the bullet and sign up if the numbers are big enough",2016-06-23 16:55:47+00:00,d4kzxo7,,t1_czl2fj7,,digitalnomad
243,"How do you become a digital nomad and how do you survive? I'm a mobile developer, currently 26 years old, and want to break free and do remote work while traveling but I just don't have that much information regarding what's possible. Are there lots of other digital nomads like you? Is there a community of some sort?",2016-06-23 16:45:30+00:00,d4kzfb7,1.0,t3_4pbrx3,84966.0,IAmA
244,"That's a really interesting spin on it. At least in California, our textbooks always group Italy and Japan together with Germany as part of the Axis, but you're saying that people disassociate themselves with the actions of the government.",2016-06-23 15:27:03+00:00,d4kvmw3,2.0,t1_d4kko0m,23221.0,AskReddit
245,"Interesting that you say that. In your mind, what puts AJ above guys like Neville, Cesaro, Zayn etc?",2016-06-23 07:47:28+00:00,d4kje6z,2.0,t1_d4ke1pt,13028.0,SquaredCircle
246,Favorite strain?,2016-06-22 17:11:34+00:00,d4jlpcg,1.0,t3_4pbr6t,337.0,IAmA
247,"I think a simulator is pretty good if you're trying to get instant feedback for small changes. That's what Xcode is good at. You write something and you can quickly deploy it on the simulator to see if you got it right. It actually saves development time.

You can't do that with Android. It doesn't make sense to have long  builds when you just want to see your progress.",2016-06-22 16:29:15+00:00,d4jjnhm,2.0,t1_d4jeaw9,7097.0,androiddev
248,"I think part of the reason for the emulator is that the Android SDK has to work on all three platforms: Windows, Linux and Mac. Therefore, Android had to account for all types of weird computer specs. It was probably easier for them to make it an emulator because they knew it would work on every computer if they just virtually recreated the whole device. 

I think we absolutely could have a simulator for Android. There's nothing really preventing it other than dealing with more hardware configurations than iOS. For day to day testing, an emulator is overkill.

I always just use physical Android devices, the emulator is pretty useless. I don't think that will change anytime soon. I've been waiting for a simulator since I was in college in 2013 and nothing has happened on that front.",2016-06-22 14:52:25+00:00,d4jf7m8,1.0,t3_4patpf,2611.0,androiddev
249,"Hi, you still trying to learn Spanish too? Would you like to Skype or Google Hangouts sometime? I'm almost done with Pimsleur Unit 5 ",2016-06-20 08:39:14+00:00,d4gfcsd,,t1_d1nl91p,,Spanish
250,This is anecdotal as well but I've had nothing but GPS problems since the day I got my Note 3 in 2013.,2016-06-19 06:52:34+00:00,d4f5gsa,,t1_d3v3nd1,,GalaxyNote3
251,I shop at Costco regularly and I just went to Europe and the supermarket croissants there are fucking insane. Like a random croissant out of a supermarket in Scotland or Oslo or Paris just completely shits on what we consider to be croissants.,2016-06-18 08:34:28+00:00,d4e3zca,4.0,t1_d4e1ynj,6687.0,news
252,Need this recipe,2016-06-17 18:05:30+00:00,d4dbs2s,1.0,t3_4oj5la,17519.0,FoodPorn
253,"In a way I think it's good that directors start with having constrained budgets on indie films because it forces them to work on fundamentals like getting good performances and nailing down an  individual style.

If someone starts with a billion dollars they might not develop those survival instincts that make them successful ",2016-06-16 17:47:42+00:00,d4bvg98,1.0,t3_4oek89,747.0,movies
254,Looks like an incredible experience. Feels like the Nintendo game developers spent time exploring New Zealand or Iceland or something and just decided to share their love of travel for the world to see.,2016-06-14 19:50:16+00:00,d4972vy,1.0,t3_4o26au,12811.0,videos
255,This is amazing. Which L series lens are your favorites?,2016-06-14 19:44:46+00:00,d496t3k,1.0,t3_4nvwz2,104704.0,videos
256,"Wow, best tag team matches you've ever seen? That's really high praise",2016-06-14 07:55:32+00:00,d48hskr,2.0,t1_d48g3ui,4856.0,SquaredCircle
257,"But if you look at it from the context of their relationship, it makes sense. Bobby probably never blames himself for fucking up the relationship by beating the shit out of her. Its just about what she did to him. She was probably holding it down until he either got violent or cheated himself which basically gave her the green light to treat the ring like a paperweight.",2016-06-13 02:19:49+00:00,d46shv3,1.0,t3_4nrwyh,23459.0,hiphopheads
258,Please Kano. I want him to annotate the whole Made In The Manor album,2016-06-10 15:52:05+00:00,d43r8bw,1.0,t3_4nfcw4,27145.0,grime
259,"You're absolutely right. Even before Matt Smith, there were tons of fans who had turned on Rose, Martha, Donna etc etc.

There's not a single main companion from the current series that didn't get hate at some point.",2016-06-10 03:42:24+00:00,d438d37,3.0,t1_d42fu2f,41283.0,television
260,"Wow, being an arcade tech must give you a leg up on things like this right? Or maybe it gives you enough insight that you don't even play the machines at all",2016-06-04 03:57:55+00:00,d3vdwf4,7.0,t1_d3umwwa,41272.0,Sneakers
261,She would actually be perfect,2016-06-02 06:32:46+00:00,d3ssuq1,1.0,t3_4m5qor,2735.0,movies
262,"Plus I'm visiting Europe for the first time and an Ultra Boost here is 180 euros (I'm drunk so I can't do the conversion). For sneakerheads, we honestly have it pretty good in the states.",2016-05-30 23:21:34+00:00,d3ppckz,5.0,t1_d3pp1mn,529.0,Sneakers
263,How do these compare to the Northface Resolve Rain Jackets?,2016-05-24 17:57:33+00:00,d3hzbvd,1.0,t3_4kl066,154414.0,frugalmalefashion
264,They should've put their full weight behind him as a top heel when Randy Orton put him over on RAW,2016-05-21 21:30:27+00:00,d3eix4d,1.0,t3_4kek3y,14145.0,SquaredCircle
