,body,created,id,nest_level,parent_id,reply_delay,subreddit
0,"People also buy $700 phones and cover them up with $1 phone cases

EDIT: Wasn't justifying that people do this, just saying that people do",2016-11-21 18:06:09+00:00,da9sa9h,4.0,t1_da9r80i,1270.0,apple
1,"The Google solution is the same in this case. The Chromecast is connected to the internet and streams the link, not the phone.",2016-11-20 19:11:03+00:00,da8gn9e,2.0,t1_da8d9r6,4466.0,apple
2,"I think its fine as long as they contact the customers and reimburse them afterwards. The same thing actually happened with the 2011 laptops. The 2011 macbooks had faulty logic boards that failed but Apple would charge us an extra $300-$600 rather than take the responsibility. It took 4 years for them to finally reimburse everyone.

",2016-11-20 18:55:46+00:00,da8fx7b,3.0,t1_da8aaze,8056.0,apple
3,What is everyone using as their external dock?,2016-11-20 08:22:21+00:00,da7zj2r,1.0,t3_5dwnbs,10851.0,apple
4,It might make sense if he/she is using Final Cut Pro for video editing,2016-11-20 08:20:52+00:00,da7zi0j,5.0,t1_da7zfed,240.0,apple
5,Was it difficult to figure out the right drivers for the dock? Does it require a lot of configuration changes?,2016-11-20 08:19:37+00:00,da7zh83,2.0,t1_da7yfh1,3265.0,apple
6,"My understanding is that the film industry is pretty fractured on the subject of NLEs and that lots of people use both Final Cut and Premiere nowadays, so its not as simple as just saying use Final Cut all the time. You'd probably lose jobs by committing to only one or the other.",2016-11-20 03:58:49+00:00,da7sqf5,2.0,t1_da7ognn,7237.0,apple
7,Are there tutorials out there for applying the DSDT?,2016-11-19 22:26:59+00:00,da7gik7,3.0,t1_da7gew3,163.0,apple
8,"This is actually a factor in whether or not the new Macbook will fit my needs (not the only factor of course), so I can't wait to hear what happens.",2016-11-19 22:11:24+00:00,da7fxfa,,t1_d9dprcs,,apple
9,"Do you have other modern games to test besides Battlefield 1? Most of those games you listed are five years old, which are probably playable on most PC laptops even. For example, I'd like to see how it handles Overwatch",2016-11-19 20:32:03+00:00,da7bz3i,1.0,t3_5drd0x,48824.0,apple
10,"Moreover, has anybody gotten PC gaming to work in bootcamp with a Razor Core?",2016-11-19 19:55:11+00:00,da7ah38,1.0,t3_5dtw22,3735.0,apple
11,"The [Razor Blade Stealth](http://www.razerzone.com/gaming-systems/razer-blade-stealth?gclid=CjwKEAiAjcDBBRCJxouz9fWHynwSJADaJg9BYxULAVO05H81o5MhG_7wS8h2tEbyr34wyfw7WEdoNxoCusbw_wcB) seems pretty cool- can plug an external GPU. Its only 3 pounds and apparently has a pretty decent battery life (9 hours), I wouldn't call that heavy and inefficient although the Pro model seems like a bajillion pounds.",2016-11-19 19:24:24+00:00,da7980b,3.0,t1_da72ul7,9530.0,apple
12,"From their mindset, I can imagine that they don't want to deal with the consequences of so many graphics cards out there and be responsible for supporting and optimizing drivers for an infinite variation of GPUs for Mac OS. 

The other issue is that Apple believes that raw power is a bad user experience if it compromises battery, silence, portability etc. I don't see Apple considering it a high enough priority to support external GPU drivers at the moment, although they might have a change of heart if they ever decide to support VR which requires insane power.",2016-11-19 11:45:27+00:00,da6uxa7,,t1_d9ediw2,,apple
13,Any luck trying to see how the Razor Core handles high intensity graphics on a Macbook? I'm curious to know if there are any caveats when you've tried to play games.,2016-11-19 11:33:14+00:00,da6uqk0,1.0,t3_5a6z8s,1708264.0,apple
14,"It will definitely be noticeable. If the rumors are true that next year's model will have 32 GB of RAM, then that will feel even more noticeable than the jump from Radeon 455 to 460.",2016-11-19 11:16:51+00:00,da6uhl2,1.0,t3_5dr9j1,17471.0,apple
15,He was very obviously Grindelwald from the opening scene I felt.,2016-11-19 10:59:41+00:00,da6u8ho,2.0,t1_da6083h,57593.0,movies
16,"It sounds like if anyone is ambitious enough to become a famous wizard, they should just Zuckerberg it and drop out of Hogwarts. 

",2016-11-19 10:53:46+00:00,da6u5cs,1.0,t3_5dk6u7,114535.0,movies
17,Me too. He played the character in a very soft spoken way that made it hard to make out all of his words.,2016-11-19 10:48:55+00:00,da6u2rd,2.0,t1_da6czd4,39530.0,movies
18,"I'm not sure if the ""bad"" memories were a literal statement. More like, this is used to erase memories and usually used as an anecdote for bad ones. I'd like to believe that Jacob is just a miracle nobody can explain.",2016-11-19 10:48:02+00:00,da6u29w,3.0,t1_da6py4z,14568.0,movies
19,I personally took a liking to Scamander's overcoat. He looked dapper the entire movie.,2016-11-19 10:39:12+00:00,da6txmp,2.0,t1_da6gahp,33506.0,movies
20,Which is actually pretty silly because if the wizarding community is aware of how an Obscurus forms then they should've known that letting a wizard like Credence get bullied and suppressed could be extremely dangerous.,2016-11-19 10:35:07+00:00,da6tvgp,3.0,t1_da6gwi9,32203.0,movies
21,Hopefully they don't recycle that.,2016-11-19 10:25:10+00:00,da6tqah,2.0,t1_da6o94p,17443.0,movies
22,Yeah it definitely feels like the movie has been chopped to bits for pacing reasons. My guess is that Shaw was supposed to feel like a threat because he had the power to spread newspaper propaganda against wizards.,2016-11-19 10:22:39+00:00,da6tp03,4.0,t1_da6qa37,12122.0,movies
23,"The other possibility is that the case is actually too big to travel with. Its huge on the inside and houses an entire ecosystem of animals and maybe apparition is only safe with one or two humans, not with a briefcase containing a microcosm the size of Noah's Ark.",2016-11-19 10:16:00+00:00,da6tldu,3.0,t1_da6qmhu,10689.0,movies
24,"Jacob was an audience surrogate, kind of like how we were all meant to identify with Harry in Sorceror's Stone- almost as if we were the ones exploring the wizarding world for the first time.

The reason Jacob didn't act like Harry did in Sorceror's Stone is because the audience has seen eight Harry Potter movies by this point. We've already accepted magic. If Jacob asked that question it would've been annoying to us because as an audience we already know magic exists in this world, like ""yeah idiot.. why don't you catch up with the rest of us."" Its actually the reason why Jacob is so likeable as a character. Despite only having found out about magic only half a day earlier, he accepted wizard culture and even volunteered to help Scamander out of the goodness in his heart.",2016-11-19 10:07:53+00:00,da6th1l,2.0,t1_da6rxvt,5794.0,movies
25,"I guess I felt the opposite way. Fantastic Beasts wasn't too bad but Arrival took a lot of more chances to be an original story, even posing some pretty interesting questions around free will and how different our decisions would be if we weren't bound by linear time; this on the other hand was rather run of the mill, although still an enjoyable adventure.",2016-11-19 09:57:05+00:00,da6tb3v,2.0,t1_da6s12a,4823.0,movies
26,"My understanding is that Tina was investigating the weird anti-Wizard orphanage lady against the orders of the wizard organization, and the reason she was no longer on the investigation team is because she saw what was happening to Credence and used magic to defend him against the evil orphanage lady. In other words, she saw a wizard get abused and tried to protect him, but her superiors didn't like that she used her powers in sight of humans.",2016-11-19 09:50:45+00:00,da6t7o0,2.0,t1_da6sb3r,3436.0,movies
27,Yeah that upset me too. Picquery was the one who dismissed Tina to begin with.,2016-11-19 09:41:19+00:00,da6t2kg,2.0,t1_da6sd5m,2663.0,movies
28,"Because Johnny Depp was actually the dark wizard described in the newspapers, disguising himself as Colin Farrell. Its rather contrived as to how he ended up infiltrating the American wizarding organization though.",2016-11-19 09:40:42+00:00,da6t28t,2.0,t1_da6soda,1481.0,movies
29,Pretty sure they will give you a replacement if its a weird issue,2016-11-18 18:35:00+00:00,da5z0sj,3.0,t1_da5yx2g,127.0,apple
30,"I think I'm gonna like this more than Top Gear, which I never thought I'd be saying",2016-11-18 09:03:15+00:00,da5gbjt,1.0,t3_5dj1s4,35401.0,TopGear
31,Graphics really that good?,2016-11-16 20:57:08+00:00,da39chx,1.0,t3_5da12u,16835.0,Android
32,How quick does it charge compared to an iPhone or Android?,2016-11-16 08:40:17+00:00,da2iuhd,2.0,t1_da2dm6v,12904.0,apple
33,This is the real shit right here. Can it handle Overwatch?,2016-11-16 08:38:02+00:00,da2isym,2.0,t1_da2hwho,2818.0,apple
34,"I guess the next question is: how much does it cost to repair the logic board on a new Macbook Pro?

If my SSD malfunctions in 3 years, will the Apple Store give me a reasonable fee for repair or will they charge me more than $800 to fix it? ",2016-11-16 08:36:39+00:00,da2is2n,1.0,t3_5d3127,62153.0,apple
35,"What Razor has going on with the external thunderbolt graphics card enclosures for their ultra portable laptop gives me hope for the future though.

",2016-11-16 08:11:50+00:00,da2ibip,7.0,t1_da2g5m7,5936.0,apple
36,"Its a shame about Bootcamp not cooperating. As someone interesting in PC gaming, I'd like to see how well it runs with a modern game like Overwatch for example.

I'm also curious to see how well it can handle editing 4K footage in Final Cut Pro or Premiere. 

Not sure if I should just cancel my order, wait it out and try my luck with the spring 2017 generation. Can't wait for a power user to give their review on this laptop at some point!",2016-11-16 07:20:55+00:00,da2h9hm,1.0,t3_5d2q56,61181.0,apple
37,? What were wrong with the PF Flyers?,2016-11-14 09:06:17+00:00,d9zm62v,2.0,t1_d9zbtk4,21482.0,frugalmalefashion
38,"I'm currently on Resurrection Remix, but I have to admit that I'm pretty jealous that other devices have been getting Pixel ROMs. I'd love to have Assistant baked into my OS.",2016-11-14 06:52:49+00:00,d9zjhwc,1.0,t3_5b56ns,823244.0,GalaxyNote3
39,Unfortunately Donnie is getting pretty old as well. Hollywood failed to take advantage of his amazing abilities when he was in his athletic prime,2016-11-13 22:12:55+00:00,d9yzb1h,3.0,t1_d9ykdrp,19460.0,movies
40,It's the most famous VFX studio so I'd imagine it's more commonly known among movie fans. I've known about them ever since I was a kid reading books about their work on Star Wars and Jurassic Park. ,2016-11-13 22:09:43+00:00,d9yz5sl,8.0,t1_d9yqt0e,10520.0,movies
41,"I like the Flatland explanation that someone else gave. Imagine there's a 2D world on a piece of paper- people living in that world would only be able to perceive front, back, left, right, but not up and down. If you extended your thumb down to the plane, it would be perceived as a giant circle appearing out of nowhere. The people living in that world wouldn't be able to perceive your thumb shooting out of the Z axis. If these aliens from the movie came from a fourth dimension (where they can perceive spacetime), then they would appear out of nowhere kind of like the thumb analogy. They were there the whole time but we couldn't perceive them until they put their thumb on the page.",2016-11-12 19:56:27+00:00,d9xih3q,2.0,t1_d9xhd79,1676.0,movies
42,"The implication is that in 3,000 years we wouldn't be writing or speaking English, we'd be communicating the way that they communicate.",2016-11-12 19:53:00+00:00,d9xic2g,2.0,t1_d9xi17l,454.0,movies
43,"I'm not sure what's happening here but the big tension of the second half of the final cut is that the human race might attack one of the ships.

The helicopters probably attack when the ships reorient themselves near the end. My guess is that the helicopters attacking the ship took away from that world war three tension.",2016-11-12 18:48:05+00:00,d9xfryn,2.0,t1_d9xdw19,2785.0,movies
44,That's a pretty good interpretation. I originally saw it as a way for Heptapods to talk to each other- like maybe humans don't have the sensors to fully process the nuances of their guttural growling. Maybe it performs similar to echo location since they don't seem to have eyes.,2016-11-12 11:45:48+00:00,d9x2tkt,3.0,t1_d9wwnck,20424.0,movies
45,I suppose if you go too heavy on the mathematics and people can't follow then its not really entertaining to a broad audience,2016-11-12 11:36:48+00:00,d9x2odf,3.0,t1_d9wylrg,14631.0,movies
46,"The Chinese general showed Louise his phone in the future, allowing her to recall the phone number in the past.",2016-11-12 11:35:27+00:00,d9x2nmf,2.0,t1_d9wwdff,20457.0,movies
47,Thanks for your explanation. I guess I'll have to go and read Flatland now!,2016-11-12 11:31:14+00:00,d9x2l92,2.0,t1_d9wx6x7,18177.0,movies
48,I didn't like it either. It seemed like the screenwriter gave up on showing instead of telling for a few brief moments.,2016-11-12 11:25:55+00:00,d9x2i75,2.0,t1_d9wxeb4,17333.0,movies
49,"One possible explanation is that the language is extremely difficult to become fluent in, taking generations for most people to really understand and begin to form a non-linear stream of thoughts. You're basically asking a race of people bound by linear time to  simultaneously write the beginning, end and middle of their thoughts at the same time, without prejudice of the order and in such a way that it can be read and comprehended no matter where you start.

She absorbed the language faster than anyone else because she's a leading expert in linguistics. Ian might have been an intelligent theoretical physicist but it doesn't mean he was capable of learning the language with the same level of fluency.

tl;dr - even though the resources are out there, most people can't reach Louise's level of language fluency to perceive time the way that she does.",2016-11-12 11:16:28+00:00,d9x2cxr,2.0,t1_d9wy30b,14895.0,movies
50,"I felt that Louise does more than just translate; she also interprets the implicit meaning behind the words that even a native speaker might not pick up on.

The best example of this is when she reinterprets the alien word for ""weapon"" or when she responds with ""a desire for more cows"" in regards to what ""war"" in Sanskrit means (possibly saying that war in a nutshell is about the desire to fight for resources).

I'm assuming that the insurgents speaking Farsi would speak in code words, which made it necessary for an expert like her to interpret the true meaning.",2016-11-12 10:59:20+00:00,d9x23n2,2.0,t1_d9wy4tn,13724.0,movies
51,"I think the point of the story was that having a big picture of your entire life would completely change your acceptance of death and fate.

Abbott, the heptapod alien, knew that it would be killed by C4 but didn't stop it because the heptapods experience all of time at once. From Costello's perspective, Costello could talk to Abbott whenever it wanted in the past, present or future. Abbott never actually goes away for Costello even if Abbott dies in that moment because Abbott experiences all of time.

In the future, Louise's daughter dies but Louise is okay with this because from Louise's perspective, she is with her daughter and with Ian at all times, no matter if she is in the past, present or future. 

In your dying in a car crash example, even at the moment that you get hit by another car, you wouldn't be alone. You would still be with your family, your friends, and your loved ones because you would be experiencing and reliving all of time, all the time, everything that had every happened to you and will happen to you. You might not have the same fear of death if you had this perspective.

What I'm saying is that if you just told me point blank that I was going to die in a car crash, I would probably avoid it and exercise my free will to stop that from happening. But if you made me experience all of my life, my entire beginning and end, all at once and all of the time, I might exercise my free will to go with fate because I wouldn't be afraid of death. I'd already be experiencing my life and death all at once, every moment of my life.",2016-11-12 10:48:41+00:00,d9x1xwb,4.0,t1_d9wys6w,11233.0,movies
52,"Well, there are other interpretations of free will that would be consistent with her actions. For example, if she chose to let the future happen then that could be considered free will because she chose to have the baby even though she knew the consequences of the future.

She deliberately gave in to fate through her own decision and by some interpretations that could be called free will.",2016-11-12 10:23:49+00:00,d9x1k74,2.0,t1_d9wye26,10872.0,movies
53,"My understanding is that canaries have some way of inhaling quicker than humans because they need the energy to fly all the time. So if the environment around them is poisonous, the canary would inhale faster and die before the humans.",2016-11-12 10:12:09+00:00,d9x1dq1,2.0,t1_d9wyoos,9322.0,movies
54,"My interpretation was that Louise proved that she understood the meaning behind the meaning of the Sanskrit word for war, whereas the other linguist didn't think that far ahead. In a way, war is about acquiring resources so the phrase ""a desire for more cows"" could be interpreted as ""Wars can be summed up by humanity's desire to gain natural resources"".

This came in handy later when Louise was the only one open minded enough to pivot her understanding of the alien word for ""weapon."" The other linguist might not have been open minded enough to reinterpret the word.",2016-11-12 10:06:50+00:00,d9x1ast,2.0,t1_d9wywme,8353.0,movies
55,Ian couldn't have known. Otherwise he wouldn't have gone through with having the child and then leaving Louise.,2016-11-12 09:48:58+00:00,d9x10v5,2.0,t1_d9wz7yp,6309.0,movies
56,"As a person who doesn't know jack shit about philosophy or metaphysics, I'm having trouble with the concept of compatibilism because it basically twists the definition of free will into acceptance and desire to act out what is already predestined. 

But to me that only made sense to Louise. She seemed okay with following the sequence of events because she could experience the happiness and love from her husband and daughter no matter where she was in time, but a different person that experiences the same perception of time and reality might attempt to fight back against the future if they have nothing but bad experiences.",2016-11-12 09:47:49+00:00,d9x1087,2.0,t1_d9wzd1r,5789.0,movies
57,"I imagine its the same reason why Louise was still able to smile even though she knew her marriage would go to shit and that her daughter would die. From her perspective, she's experiencing their love forever and always- no matter where she is in the timeline.",2016-11-12 09:26:18+00:00,d9x0ntj,2.0,t1_d9x0047,2393.0,movies
58,"I'm curious to hear from real linguists regarding what capacity languages have to affect our perception of reality.

I can imagine for example that if I was taught words for several shades of white and black that I might have been able to perceive a wider range of in-between colors or if my language dropped pronouns I might have more of a sense of community rather than self.",2016-11-12 09:22:26+00:00,d9x0lhz,1.0,t3_5cc7fb,109452.0,movies
59,"Must be important if they're willing to wait 3,000 years for our help. Maybe we teach them how to comprehend linear algebra in the future.",2016-11-12 09:16:00+00:00,d9x0hqd,2.0,t1_d9x0bhy,637.0,movies
60,Would you be interested in an entry level product manager?,2016-11-11 07:53:27+00:00,d9vli6e,1.0,t3_57b673,2474546.0,SFBayJobs
61,I prefer having the headphone jack at the top because the earphone cable doesn't get in my way when I try to hold the phone. I don't really like having to slip my phone upside down into my pocket on my iPhone because the jack is at the bottom.,2016-11-10 16:54:25+00:00,d9uiryk,1.0,t3_5c5llq,49658.0,Android
62,Other exceptions: if you're a power user that does things like video editing 4K footage or a developer that needs virtual machines to run Windows then 16 GB or more makes sense.,2016-11-07 23:49:18+00:00,d9qbay8,3.0,t1_d9q55rf,7787.0,apple
63,Wonder Woman needs to carry the DCU right now or else Justice League is gonna do less than Batman vs Superman numbers.,2016-11-04 15:45:22+00:00,d9llq4w,1.0,t3_5axjil,85472.0,movies
64,I hope that all the Adobe apps like Premiere will have touch bar commands just like Final Cut Pro. I mostly edit on Premiere and from what I understand there is only a 14 day window of return which is kind of a bummer because I want to see how it benefits the workflow in Premiere and After Effects before deciding if its worth it,2016-10-31 21:59:34+00:00,d9fzxm4,2.0,t1_d9fj1fj,19458.0,apple
65,Seems kinda pre-emptive though? It might make more sense for you to just stick with what you have for now and migrate to the Pro when all the cables actually become USB-C.,2016-10-30 23:27:43+00:00,d9elju0,3.0,t1_d9dwnq8,35593.0,apple
66,That's incredible. Your footage definitely came out stunning,2016-10-29 18:51:54+00:00,d9d16gv,5.0,t1_d9d100s,268.0,gifs
67,What did you use to stabilize the bike ride? Was it mostly software?,2016-10-29 18:38:04+00:00,d9d0miy,3.0,t1_d9cyoyv,2887.0,gifs
68,Its silly but of course I want Tom Cavanagh to stay on the show. He steals every scene he's in.,2016-10-29 07:38:22+00:00,d9cjd4p,,t1_d984yud,,FlashTV
69,What's the actual performance gain difference between Skylake vs Kaby Lake? Is it significant?,2016-10-29 05:25:27+00:00,d9cgqx1,2.0,t1_d9bfiiz,54272.0,apple
70,"That makes sense for a series with fifty episodes because there's so much time to fill, but for an eight episode miniseries it could be frustrating to only see them together during a short period of time.",2016-10-29 03:12:10+00:00,d9ccu23,3.0,t1_d9c2bjo,17430.0,television
71,"Might want to get a confirmation from another dev, but my understanding is that RelativeLayout usually ends up less expensive because to build a complicated layout with LinearLayout, you often need to nest LinearLayouts to get what you want. The hierarchy of RelativeLayout ends up being more flat on average.",2016-10-29 00:53:29+00:00,d9c7uyi,2.0,t1_d9b2dlb,70962.0,androiddev
72,"From a design perspective, how do you choose between implementing [bottom navigation](https://material.google.com/components/bottom-navigation.html) or [tabs](https://material.google.com/components/tabs.html)?",2016-10-29 00:46:58+00:00,d9c7mo8,1.0,t3_59nlhv,132072.0,androiddev
73,"I try to do that as well so that its not a waste of time, although I feel pretty fatigued when I attempt to watch lectures or do any real work because of how dizzy the BART ride is.",2016-10-28 21:30:01+00:00,d9c087n,2.0,t1_d9bx7gj,4095.0,cscareerquestions
74,"What I would like to know is the historical cost of production. If the cost to make a MacBook scales with inflation then the price is a bit more understandable. 

My impression was that high end parts deflate and get cheaper over time, making it cheaper to put high end specs in laptops. But I think there are a whole bunch of variables in the pricing that we're not privy to. ",2016-10-28 17:04:36+00:00,d9bncqe,1.0,t3_59uyqw,6392.0,apple
75,"Worse, I have to drive to get to public transit!",2016-10-28 16:01:26+00:00,d9bk8nd,3.0,t1_d9biki1,2046.0,cscareerquestions
76,Its also the fact that updates are infrequent and often times unavailable on most Android devices. I'm not sure what Google can do about this other than spend a ton of money figuring out how to make it easier for manufacturers to update.,2016-10-28 08:47:17+00:00,d9b719s,2.0,t1_d9ataia,27460.0,Android
77,"Just my opinion as a developer but I think that everyone being on the same OS is really helpful for the overall quality of the platform and experience of both the developers and the users. Hear me out on this one:

Whenever there is an iOS update, the developers can immediately start using the latest features in their apps with the reassurance that a large percentage of iOS users will use it. This creates a feedback loop where iOS users always experience the latest and greatest features and iOS developers always want to adopt the latest and greatest APIs. iOS is also a lot less maintenance because everyone is on the same OS.

Meanwhile on Android, if developers want to put a [Nougat feature](https://developer.android.com/about/versions/nougat/android-7.0.html) in their app pretty much noone will use it so there's no incentive to bring the latest and greatest to Android users. And there are bugs specific to Lollipop, Kitkat, Marshmallow etc. and developers have to deal with all of them because people aren't upgrading, which makes Android apps harder to maintain over time. Android developers have less of a reason to bring the cutting edge to users and users get shortchanged with outdated apps that lag behind the iOS versions.",2016-10-28 08:41:47+00:00,d9b6xvp,2.0,t1_d9agkx3,44897.0,Android
78,How did you get the tax deduction? Is it only for Apple employees?,2016-10-28 08:04:39+00:00,d9b6akg,2.0,t1_d9b4977,6078.0,apple
79,Any idea what the rumored specs are for that?,2016-10-28 07:57:09+00:00,d9b65ne,2.0,t1_d9aydv1,17095.0,apple
80,"I'd be curious to know how that setup is going. My impression is that Hackintosh users do quite a bit of maintenance to keep their system from breaking, but I'd like to hear what you have to say about it.",2016-10-28 07:28:52+00:00,d9b5mck,3.0,t1_d9b4wso,2135.0,apple
