,created,domain,full_link,locked,selftext,subreddit,title,url
44,2015-10-15 09:12:33+00:00,self.arrow,https://www.reddit.com/r/arrow/comments/3ou48e/no_spoilers_so_you_realize_arrows_can_kill_people/,False,"Since killing anyone unless you're Diggle makes you the devil, obviously you don't want to shoot projectiles into peoples' flesh, right? That could kill them! (and it is more of a ""cripple"" than disarm move. Right, Ollie?)

Sarcasm aside, in tonight's episode's opening, a couple guys took Arrows to the chest in what was apparently the same way that the random grunt died in the flashback, but with a knife. 

Now, unless I'm confused, a knife is shorter than an arrow, right? I know the knife would have a longer blade, but the arrows are projectiles being shot at high speeds into people. I'm not sure how a knife insta-kill preformed with an arrow doesn't kill the person, especially with the way they drop.

Bonus mention: Didn't Ollie shoot a flaming arrow back into a guy last season and he didn't call that a kill?",arrow,"[No Spoilers] So, you realize arrows can kill people, right?",https://www.reddit.com/r/arrow/comments/3ou48e/no_spoilers_so_you_realize_arrows_can_kill_people/
45,2015-10-13 02:47:29+00:00,m.imgur.com,https://www.reddit.com/r/MiiverseInAction/comments/3ojbjy/i_have_a_great_relationship_with_sakurai_sakurai/,False,,MiiverseInAction,"""I have a great relationship with Sakurai ... Sakurai loves me!",http://m.imgur.com/AA5xYWP
46,2015-10-13 02:28:18+00:00,m.imgur.com,https://www.reddit.com/r/smashbros/comments/3oj966/i_have_a_great_relationship_with_sakurai_sakurai/,False,,smashbros,"""I have a great relationship with Sakurai... Sakurai loves me!""",http://m.imgur.com/AA5xYWP
47,2015-10-12 18:21:27+00:00,self.3DS,https://www.reddit.com/r/3DS/comments/3ohc3q/why_is_there_a_social_standard_difference_between/,False,"I've been thinking about this topic for a while. Unlike most college-age people I know, I am not addicted to my cell phone and don't devote every spare moment I have to it. I do, however, appreciate having my 3DS on hand for certain longer wait times I may encounter, or just for streetpass. Even when everyone else is on a phone, I try to be more organic and enjoy my environment or simply wait like people used to.

I've noticed that even when everyone else around me is playing some game on their cell phone, people verbally criticize me for having my 3DS out in pretty hardcore ways, while my peers play phone games with no backlash. I don't even use my 3DS that often in public. 

In fact, I've go so far as to notice just how glued to their phones my peers are, and the addiction seems rather intense, though no one seems to care. This is intensified about doubly when I'm doing multiplayer with someone. Though we are being much more social than the people quietly trying to beat a record on their phone game, we suddenly look like lifeless nerds or something? 

Anyone else encounter this similarly or have thoughts on why this standard exists?",3DS,Why is there a social standard difference between cell phone gaming and 3DS gaming in public?,https://www.reddit.com/r/3DS/comments/3ohc3q/why_is_there_a_social_standard_difference_between/
48,2015-10-09 05:30:40+00:00,self.fireemblemcasual,https://www.reddit.com/r/fireemblemcasual/comments/3o2fnu/hey_casuals_whats_your_favorite_nonaction_rpg/,False,"I love RPGs and wanna know your favorites and why! My shortlist would be something like Fire Emblem, Xenoblade Chronicles, Knights of the Old Republic, and Paper Mario (up to TTYD).",fireemblemcasual,"Hey Casuals, What's Your Favorite Non-Action RPG Series or Game?",https://www.reddit.com/r/fireemblemcasual/comments/3o2fnu/hey_casuals_whats_your_favorite_nonaction_rpg/
49,2015-10-08 07:35:31+00:00,self.arrow,https://www.reddit.com/r/arrow/comments/3ny1u4/calling_all_those_who_disliked_the_premiere/,False,[removed],arrow,Calling all those who disliked the premiere,https://www.reddit.com/r/arrow/comments/3ny1u4/calling_all_those_who_disliked_the_premiere/
50,2015-10-05 23:46:38+00:00,self.Blink182,https://www.reddit.com/r/Blink182/comments/3nn2b0/perspective_neighborhoods_sounds_like_a_series_of/,False,"I was thinking about Neighborhoods' sound earlier, when an idea hit me: 

This album sounds very dream-like in sound and in mentality (as in how dreams remind/form our ideas of concepts).

It's probably not intentional like Tom would like these days, but it is there. Unlike past albums like TOYPAJ that clearly depict life and specific situations, the floaty sounds of Neighborhoods seem to compliment more conceptial lyrics. 

An example is Ghost on the Dancefloor. The floaty intro followed by lyrics that could well describe a dream really give off the feeling of it being a dream where you see a lost/gone loved one. Lines like ""I saw your ghost tonight, the moment felt so real"" and ""but dreams can't all be real"" really sell this idea.

Other songs that really have the ""dream sound"" and are concept-based or even lyrically invoke images of dreams include:

Natives (a fast nightmarish dream)
After Midnight (a peaceful dream of young love)
Love is Dangerous (""her eyes cut through the clouds"")
Fighting the Gravity (dizzy nightmare)
This is Home (euphoric celebration of your teenage years in your true home)

Most if not all songs fit into this somehow too. So, overall, I think the conceptual nature of how dreams can connect to our thoughts and ideas of things, mixed with the dream-like sound of Neighborhoods really gives off a feeling of the album being descriptive of a variety of dreams. I'd like to hear your thoughts!

(If you read all of this, thank you!) 
",Blink182,Perspective: Neighborhoods sounds like a series of dreams,https://www.reddit.com/r/Blink182/comments/3nn2b0/perspective_neighborhoods_sounds_like_a_series_of/
51,2015-10-05 08:13:54+00:00,self.fireemblem,https://www.reddit.com/r/fireemblem/comments/3njvwm/nohr_sakura/,False,"What happens to Sakura if you do the Nohr route? Try to answer without anything too plot-spoiley, but I'd like to know whatever you know on the character and her Fate. I ask because she seems to be the only thing making me like Hoshido so far.",fireemblem,Nohr Sakura?,https://www.reddit.com/r/fireemblem/comments/3njvwm/nohr_sakura/
52,2015-09-30 17:03:15+00:00,self.RoyMains,https://www.reddit.com/r/RoyMains/comments/3mzkx4/any_changes_to_our_boy/,False,Has anyone found any changes to Roy since the new patch?,RoyMains,Any Changes to Our Boy?,https://www.reddit.com/r/RoyMains/comments/3mzkx4/any_changes_to_our_boy/
53,2015-09-29 23:01:28+00:00,self.smashbros,https://www.reddit.com/r/smashbros/comments/3mw8my/who_is_hyped_for_the_mario_maker_dlc_tomorrow/,False,[removed],smashbros,Who is hyped for the Mario Maker DLC tomorrow!?,https://www.reddit.com/r/smashbros/comments/3mw8my/who_is_hyped_for_the_mario_maker_dlc_tomorrow/
54,2015-09-28 19:41:15+00:00,self.fireemblemcasual,https://www.reddit.com/r/fireemblemcasual/comments/3mqmfs/hey_casuals_hows_today_going_so_far/,False,[removed],fireemblemcasual,"Hey casuals, how's today going so far?",https://www.reddit.com/r/fireemblemcasual/comments/3mqmfs/hey_casuals_hows_today_going_so_far/
55,2015-09-24 23:50:24+00:00,self.fireemblem,https://www.reddit.com/r/fireemblem/comments/3m9lr6/did_anyone_play_elinicas_gambit_with_animations_on/,False,"If you did, how long did it take? I've been going for a long time without animations and I'm not even close to done",fireemblem,Did anyone play Elinica's Gambit with animations on?,https://www.reddit.com/r/fireemblem/comments/3m9lr6/did_anyone_play_elinicas_gambit_with_animations_on/
56,2015-09-24 04:12:30+00:00,self.fireemblem,https://www.reddit.com/r/fireemblem/comments/3m5rbd/whats_your_best_guess_for_fates_release_date/,False,"I know this has been asked before, but it's worth an update guess after a few things have gone down this year. Nintendo said E3 was only for short-term releases, which suggests early 2015. I'm sure there are other pieces of evidence, but that isn't the point. 

What's your best release date guess? You can guess by quarter, month, or date if you wanna be ambitious. ",fireemblem,What's your best guess for Fates release date?,https://www.reddit.com/r/fireemblem/comments/3m5rbd/whats_your_best_guess_for_fates_release_date/
57,2015-09-23 07:02:40+00:00,youtu.be,https://www.reddit.com/r/Blink182/comments/3m1e9y/remember_that_2009_performance_where_tom_sang/,False,,Blink182,Remember that 2009 performance where Tom sang like he did pre-breakup?,https://youtu.be/fvQv6oCDHRI
58,2015-09-23 04:33:48+00:00,reddit.com,https://www.reddit.com/r/SpongeEmblem/comments/3m11df/chroms_deepest_fear_xpost_from_rfireemblem/,False,,SpongeEmblem,Chrom's deepest fear (x-post from r/Fireemblem),https://www.reddit.com/r/Spongebros/comments/3m0czw/chroms_deepest_fear/.compact
59,2015-09-20 17:15:07+00:00,self.3DS,https://www.reddit.com/r/3DS/comments/3lp0i2/til_streetpass_works_in_homebrew/,False,"*It appears* that streetpass works in Homebrew mode. I was using mGBA when the green light on the side lit up, and when I went to check, sure enough I had a streetpass. I didn't think it would work in Homebrew mode, especially while open.",3DS,TIL Streetpass works in Homebrew,https://www.reddit.com/r/3DS/comments/3lp0i2/til_streetpass_works_in_homebrew/
60,2015-09-19 06:32:40+00:00,self.AngelsAndAirwaves,https://www.reddit.com/r/AngelsAndAirwaves/comments/3lj2qu/how_is_the_poet_anderson_animated_movie/,False,"I haven't seen it yet, nor have I had specific compulsion to, but I know it is short and cheap to buy. 

Anyone have anything to say about it to get me over the fence?",AngelsAndAirwaves,How is the Poet Anderson Animated Movie?,https://www.reddit.com/r/AngelsAndAirwaves/comments/3lj2qu/how_is_the_poet_anderson_animated_movie/
61,2015-09-16 05:45:58+00:00,self.fireemblem,https://www.reddit.com/r/fireemblem/comments/3l4z2e/some_basic_fates_questions_spoilers/,False,"Hey guys, the wait for Fates is killing me, and I have some questions I'd like answered if anyone wants to answer. Also, no huge spoilers, please.

* Can I be a ""good guy"" in Nohr? I know the game's morality is not black and white, but I don't want to kill much of the Hoshido cast. I love the idea of Nohr as a kingdom, but can I play Nohr and ""keep my soul intact""? 

* If I play Hoshido, do I need to kill the Awakening kids (or their kids)?

* Is DLC cross-compatible between cartridges of either version?

* Can I launch Invisible Kingdom from either cartridge?

* Is there any real pull to play Hoshido in an ""I am the protagonist"" sense? Nohr seems like the most logical option.",fireemblem,Some Basic Fates Questions (Spoilers),https://www.reddit.com/r/fireemblem/comments/3l4z2e/some_basic_fates_questions_spoilers/
62,2015-09-15 19:00:55+00:00,m.imgur.com,https://www.reddit.com/r/fireemblem/comments/3l2qwu/was_playing_paper_mario_ttyd_earlier_and_found/,False,,fireemblem,Was playing Paper Mario TTYD earlier and found the coolest Toad.,http://m.imgur.com/1eEqdWd
63,2015-09-13 23:28:18+00:00,youtu.be,https://www.reddit.com/r/Blink182/comments/3kucs1/does_someone_know_and_have_footage_of_what_show/,False,,Blink182,Does someone know [and have footage of] what show this is from?,https://youtu.be/I8dCSnTXc6M
64,2015-09-13 06:32:12+00:00,self.MarioMaker,https://www.reddit.com/r/MarioMaker/comments/3kr8rl/basic_airship_challenge_level/,False,"I'm pretty happy with my first level, but would love input on it. It is one perilous (but not overkil) airship that you need to clear of enemies in order to escape within a time limit. I tried to make it challenging without being cheap (although there is one sort of cheap element)

Spoiler-free screenshot: imgur.com/XnBYrWe

ID: 9466-0000-0019-D531",MarioMaker,Basic Airship Challenge Level,https://www.reddit.com/r/MarioMaker/comments/3kr8rl/basic_airship_challenge_level/
65,2015-09-12 06:29:17+00:00,self.MarioMaker,https://www.reddit.com/r/MarioMaker/comments/3kmzs7/brief_airship_challenge_level/,False,[removed],MarioMaker,Brief Airship Challenge Level,https://www.reddit.com/r/MarioMaker/comments/3kmzs7/brief_airship_challenge_level/
66,2015-09-11 23:29:40+00:00,self.nintendo,https://www.reddit.com/r/nintendo/comments/3kltv5/classic_mario_amiibo_availability/,False,[removed],nintendo,Classic Mario Amiibo Availability,https://www.reddit.com/r/nintendo/comments/3kltv5/classic_mario_amiibo_availability/
67,2015-09-11 16:39:44+00:00,mobile.twitter.com,https://www.reddit.com/r/Spongebros/comments/3kk721/hbox_getting_in_on_spongebros/,False,,Spongebros,HBox Getting in on Spongebros,https://mobile.twitter.com/LiquidHbox/status/642316448967315456
68,2015-09-09 22:57:57+00:00,self.fireemblem,https://www.reddit.com/r/fireemblem/comments/3kb9ia/which_team_is_weaker_dawn_brigade_or_most_of_the/,False,"Well, who is weaker?",fireemblem,Which team is weaker: Dawn Brigade or most of the cast of Binding Blade?,https://www.reddit.com/r/fireemblem/comments/3kb9ia/which_team_is_weaker_dawn_brigade_or_most_of_the/
69,2015-09-07 07:40:56+00:00,self.3DS,https://www.reddit.com/r/3DS/comments/3jy62g/which_gba_games_run_best_on_3ds/,False,"I've heard the 3DS GBA emulators are a mess. Which ones with which games run at or almost at 100%? Does having a New 3DS affect them negatively? 

Follow up question: how is Mario kart super circuit?",3DS,Which GBA games run best on 3DS?,https://www.reddit.com/r/3DS/comments/3jy62g/which_gba_games_run_best_on_3ds/
70,2015-09-06 06:51:38+00:00,self.Blink182,https://www.reddit.com/r/Blink182/comments/3ju0i7/what_are_the_lyrics_to_marks_spoken_part_in/,False,"I've seen them before, but I can't them again and they're hard to hear. Anyone know them?

p.s. I'm fairly new to the sub and you guys are an awesome community!",Blink182,What are the lyrics to Mark's spoken part in Violence?,https://www.reddit.com/r/Blink182/comments/3ju0i7/what_are_the_lyrics_to_marks_spoken_part_in/
71,2015-09-05 23:32:26+00:00,self.fireemblem,https://www.reddit.com/r/fireemblem/comments/3jsu2z/bring_the_best_of_the_fe45_translation_patches/,False,"I've seen some pretty funny issues/jokes in FE4/5 's translations. Even if they're reposts, can we just compile all of this into a thread for all to see?

(You can make your own jokes from FE4/5 dialogue too)",fireemblem,Bring the best of the FE4/5 translation patches,https://www.reddit.com/r/fireemblem/comments/3jsu2z/bring_the_best_of_the_fe45_translation_patches/
72,2015-09-05 08:22:05+00:00,self.fireemblem,https://www.reddit.com/r/fireemblem/comments/3jq1wc/just_how_easy_is_fire_emblem_sacred_stones/,False,"I'm halfway through my first SS playthrough. Man, I regret choosing normal for this playthrough. Playing it as a break from Binding Blade makes this game feel like a twice as much of a cakewalk.

Really, is this game just rediculously easy? Erika isn't exactly a beast from what I hear (maybe I hear wrongly), but at level 17 she capped skill and speed and is basically invincible. I've even put her into situations to try to kill her just to see if i can ~~like with PoR Titania~~.

Similarly Joshua is invincible at this point. I've had him for a short time and he's already slaying armies with a ease. In his recruitment mission he only did critical hits even when I took away his killing edge. Nothing can hit him, and his crit rate is insane.

Even Ross, who struck me as a ""hold my hand until I grow into a killing machine"" promoted quickly and now outperforms his dad. 

Also, Ephriam can kill someone with his sheer amazingness. 

Is this game just rediculously easy on normal or is it just full of beast-mode characters? (Like seriously, they all fight like my limit-broken stat-capped Priam with my avatar paired with him at A support) ",fireemblem,Just How Easy is Fire Emblem Sacred Stones?,https://www.reddit.com/r/fireemblem/comments/3jq1wc/just_how_easy_is_fire_emblem_sacred_stones/
73,2015-09-03 00:27:10+00:00,radio.com,https://www.reddit.com/r/AngelsAndAirwaves/comments/3jffxc/the_reasons_behind_the_sound_of_of_nightmares/,False,,AngelsAndAirwaves,The reasons behind the sound of Of Nightmares...,http://radio.com/2015/09/02/tom-delonges-angels-airwaves-of-nightmares-ep/
74,2015-08-29 01:02:37+00:00,m.imgur.com,https://www.reddit.com/r/fireemblem/comments/3iso41/uh_sothe_is_there_something_you_need_to_tell_us/,,,fireemblem,"Uh, Sothe, is there something you need to tell us?",http://m.imgur.com/KqyyWZn
75,2015-08-28 08:03:32+00:00,self.fireemblem,https://www.reddit.com/r/fireemblem/comments/3ipaz1/what_is_this_filthy_subhuman_doing/,,"Is this game text or is there some glitch that the filthy subhumans are trying to exploit against me?

http://m.imgur.com/kVNmfkf",fireemblem,What is this Filthy Subhuman Doing!?,https://www.reddit.com/r/fireemblem/comments/3ipaz1/what_is_this_filthy_subhuman_doing/
76,2015-08-23 01:20:16+00:00,self.AngelsAndAirwaves,https://www.reddit.com/r/AngelsAndAirwaves/comments/3i1682/into_the_night_now_available_for_download_for/,,Go to the website and check your downloads!,AngelsAndAirwaves,Into The Night now available for download for those who preordered from To The Stars...,http://www.reddit.com/r/AngelsAndAirwaves/comments/3i1682/into_the_night_now_available_for_download_for/
77,2015-08-17 00:19:37+00:00,self.fireemblem,https://www.reddit.com/r/fireemblem/comments/3h999l/just_how_good_is_radiant_dawn_i_need_some_hype/,,"I've finally secured a copy of Radiant Dawn through a friend (money + trades)! 

I've played Path of Radiance among tons of other Fire Emblem games. Now tell me, what sets Radiant Dawn apart? GIVE ME HYPE!

Also, I'm sure somewhere on this sub there's a ""radiant dawn guy"" who lives for RD.

",fireemblem,Just how good is Radiant Dawn? I need some hype.,http://www.reddit.com/r/fireemblem/comments/3h999l/just_how_good_is_radiant_dawn_i_need_some_hype/
78,2015-08-15 04:38:22+00:00,self.smashbros,https://www.reddit.com/r/smashbros/comments/3h2cnf/does_anyone_still_play_melee_casually/,,"Melee is a phenomenal game, as evidenced by its undying competitive scene.

I think melee is a phenomenal game, but I don't exactly care to do the hardcore techs. I play it like people did before they found the techs.

Is anyone else the same, or have all the casual Melee people moved to competition or another Smash?",smashbros,Does Anyone Still Play Melee Casually?,http://www.reddit.com/r/smashbros/comments/3h2cnf/does_anyone_still_play_melee_casually/
79,2015-08-14 18:20:28+00:00,self.fireemblem,https://www.reddit.com/r/fireemblem/comments/3h07jd/what_does_this_sub_think_of_shadow_dragon/,,"I just completed Shadow Dragon on hard in a no casualty playthrough. Ive noticed that a lot of people on the internet don't seem to like this game. 

I felt that it was a faithful update to the original, gave the story a tad more clarity in the prologue and additional Marth dialogue (unless my memory is failing me and it all was present in the original). 

I really liked it, having played it less than a year after the original (FE3 version). What does the sub think?",fireemblem,What Does This Sub Think of Shadow Dragon?,http://www.reddit.com/r/fireemblem/comments/3h07jd/what_does_this_sub_think_of_shadow_dragon/
80,2015-08-13 22:07:17+00:00,m.imgur.com,https://www.reddit.com/r/fireemblem/comments/3gwizw/uhh_has_anyone_else_noticed_this_wiki_entry/,,,fireemblem,Uhh... Has Anyone Else Noticed This Wiki Entry?,http://m.imgur.com/XhnA2Q4
81,2015-08-12 03:25:51+00:00,self.fireemblem,https://www.reddit.com/r/fireemblem/comments/3goha2/can_you_s_support_amiibo_in_fates/,,"I've kept up with the amiibo support in Fates and thought it was cool, then I had a thought. Since Lucina is my waifu I don't wanna s support someone else in Fates. 

Since you can recruit the alternate (smash) versions of the characters, I was hoping my alternate self to alternate Lucina. [Its like Hawkman and Hawkgirl]

Is this possible? ",fireemblem,Can You S Support Amiibo in Fates?,http://www.reddit.com/r/fireemblem/comments/3goha2/can_you_s_support_amiibo_in_fates/
82,2015-08-08 06:32:54+00:00,self.RobinMains,https://www.reddit.com/r/RobinMains/comments/3g7xn8/should_i_join_you_robin_mains/,,"I've played swordfighters for most of my Smash time, and I main Roy right now (I'm an avid Fire Emblem fan). I want a secondary/half-main with some ranged attacks, and I've tried out some Robin and am impressed. Is Robin a good Roy secondary? CONVINCE ME TO USE ROBIN!!!

P.S. Best Robin in FE is male Robin, I use red female Robin in Smash, though ;)",RobinMains,"Should I Join You, Robin Mains?",http://www.reddit.com/r/RobinMains/comments/3g7xn8/should_i_join_you_robin_mains/
83,2015-07-29 07:46:07+00:00,twitter.com,https://www.reddit.com/r/smashbros/comments/3f05ab/64_stages_coming_731/,,,smashbros,64 Stages Coming 7/31,https://twitter.com/SmashBrosJP/status/626286967106310144
84,2015-07-22 14:37:53+00:00,twitter.com,https://www.reddit.com/r/arrow/comments/3e7ain/no_spoilers_a_short_description_of_green_arrow_by/,,,arrow,[No Spoilers] A short description of Green Arrow by Stephen Amell,https://twitter.com/amellywood/status/623759917166428160
85,2015-07-22 14:18:06+00:00,twitter.com,https://www.reddit.com/r/arrow/comments/3e77ya/a_short_description_of_green_arrow_by_stephen/,,,arrow,A short description of Green Arrow by Stephen Amell,https://twitter.com/amellywood/status/623759917166428160
86,2015-07-14 20:33:40+00:00,self.CrazyHand,https://www.reddit.com/r/CrazyHand/comments/3dapxs/how_to_escape_marios_up_tilts/,,"Mario has what appears to be a true combo where he get you into a stream of up tilts while you fail helplessly. Is there a way to get out of, or at very least, avoid this? ",CrazyHand,How to escape Mario's up tilts?,http://www.reddit.com/r/CrazyHand/comments/3dapxs/how_to_escape_marios_up_tilts/
87,2015-07-10 18:46:49+00:00,self.AngelsAndAirwaves,https://www.reddit.com/r/AngelsAndAirwaves/comments/3ctta3/dream_walker_tour_will_happen/,,"Tom Delonge confirmed multiple times in a Mashable Q and A that there will eventually be a Dream Walker themed tour. 

The proof:
http://imgur.com/eTUv5lK
http://imgur.com/PFWUwBZ
",AngelsAndAirwaves,Dream Walker Tour Will Happen!,http://www.reddit.com/r/AngelsAndAirwaves/comments/3ctta3/dream_walker_tour_will_happen/
88,2015-07-05 04:27:55+00:00,self.fireemblem,https://www.reddit.com/r/fireemblem/comments/3c636j/my_fire_emblem_journey_por/,,"I'm that Awakening -&gt; FE3 guy!

So I wanted to say some more stuff about the FE games I've played, and maybe get some reccomendations from the community.

I finished FE1 (FE3 version) and really enjoyed that, but man was it hard at times. I can't count my restarts, and each battle took me about an hour. I only lost one unit, Chainy. It was painful to let her die (taken out by SAME TURN REINFORCEMENTS!). It wasn't my first FE death, though, since I let Cynthia in Awakening die after relentlessly getting trying to set it up so she didn't die by counterattack. Great game overall, though, and I'll play FE3 soon

I'm also doing a second play through of Awakening on Hard, and honestly, its about the same difficulty... Gregor and Cordelia have the best supports, by the way. Also, Brady is interesting, I love Owain as always, and I married Lucina and am quite dissapointed that I can't do so in real life. 

Finally, I'm about halfway though Path of Radiance. I needed something with more modern features before FE3. PoR's interface is nice, and the game seems really easy, even on hard. Ike is a beast, though. After the sensitive, soft Marth, the blunt contrast Ike gives is cool. I like that I can make all the fighting occur on the overworld as well. What do you guys think of PoR?

Finally, I want to say for all you wanting to see my suffer, I do plan to play Thracia ;)",fireemblem,My Fire Emblem Journey: PoR,http://www.reddit.com/r/fireemblem/comments/3c636j/my_fire_emblem_journey_por/
89,2015-07-04 20:59:45+00:00,self.smashbros,https://www.reddit.com/r/smashbros/comments/3c4z36/which_smash_stage_do_think_is_most_forgotten/,,"Personally, I think Mushroom Kingdom and Mushroom Kingdom 2 from Melee are pretty forgotten. ",smashbros,Which Smash stage do think is most forgotten?,http://www.reddit.com/r/smashbros/comments/3c4z36/which_smash_stage_do_think_is_most_forgotten/
90,2015-07-04 08:48:41+00:00,self.fireemblem,https://www.reddit.com/r/fireemblem/comments/3c35sl/spoilers_what_all_do_we_know_about_odin/,,"I loved Owain in Awakening and am happy to see he's in Fates. I'd love a roundup of all the info we have on him now, and if anyone can answer a few questions on top of that, that would be great.

1. He is of Exalt blood; Why is he with Nohr when his own kingdom should need him. Is Ylisse gone?
2. He's no longer a sword fighter, but does he ever talk about his sword hand?
3. Is Nohr really all that bad? I can't see Awakening kids aligning with a very evil country.",fireemblem,[Spoilers] What all do we know about Odin?,http://www.reddit.com/r/fireemblem/comments/3c35sl/spoilers_what_all_do_we_know_about_odin/
91,2015-07-01 21:34:14+00:00,geeksnack.com,https://www.reddit.com/r/Xenoblade_Chronicles/comments/3bsuij/xenoblade_x_famitsu_player_survey_results_to_be/,,,Xenoblade_Chronicles,Xenoblade X Famitsu Player Survey Results to be Revealed - Average Play through is 168 hours,http://www.geeksnack.com/2015/06/30/xenoblade-chronicles-x-famitsu-survey-to-be-detailed-in-next-issue-average-play-time-revealed/
