,created,domain,full_link,locked,selftext,subreddit,title,url
92,2015-06-29 21:37:35+00:00,self.fireemblem,https://www.reddit.com/r/fireemblem/comments/3bk3kt/if_marth_and_lucina_got_married_would_it_still_be/,,"I can look at this either way, but I'd like to know what this community thinks, so here are my arguments for both sides:

Argument 1:
Yes, in a patriarchal royal bloodline, a male king gives the kingship to his male son, creating the most solid, pure-blooded line (with a few exceptions over time, possibly). This means the purity of the bloodline among other things makes Marth about the same as Lucina's dad. 

Argument 2:
No, a couple thousand years makes this all irrelevant.",fireemblem,"If Marth and Lucina Got Married, Would It Still Be Incest?",http://www.reddit.com/r/fireemblem/comments/3bk3kt/if_marth_and_lucina_got_married_would_it_still_be/
93,2015-06-28 16:28:53+00:00,self.fireemblem,https://www.reddit.com/r/fireemblem/comments/3bewkc/no_spoilers_which_did_you_choose/,,"When you began your Awakening adventure, you soon realized you had a choice: circle pad or d-pad.

Did you use the circle pad or d-pad, and will you do the same in Fates?

(I mostly wanna know if anyone prefers circle pad for Fire Emblem)",fireemblem,[No Spoilers] Which Did You Choose?,http://www.reddit.com/r/fireemblem/comments/3bewkc/no_spoilers_which_did_you_choose/
94,2015-06-27 00:09:08+00:00,self.smashbros,https://www.reddit.com/r/smashbros/comments/3b9601/finally_got_a_gc_controller_adapter/,,"After my initial excitement of a GameCube controller adapter for Smash 4, I was soon dissappointed in the lack of stock availible and I've played Smash 4 in a pretty hardcore fashion with the Gamepad. It has not been easy. It just feels too easy to mess up a directional input and everything was too large for my liking (and quitting a solo smash match required me to use two hands and my leg to hit all the buttons). At long last by Amazon I have gotten an adapter.

To anyone who is a dedicated Smash fan who has Smash 4 and is using a controller they feel isn't optimal, I highly reccomend seeking out a GC adapter as they are now easier to find at retail price. The GameCube controller shall never die! ",smashbros,Finally Got a GC Controller Adapter!,http://www.reddit.com/r/smashbros/comments/3b9601/finally_got_a_gc_controller_adapter/
95,2015-06-25 20:40:53+00:00,self.fireemblem,https://www.reddit.com/r/fireemblem/comments/3b460f/fates_spoilers_can_someone_explain_this_choice_to/,,"(I can handle a few spoilers, but try to keep it reasonable)

I am confused by the importance of this one big choice you make. It was hyped at E3 that your choice of side is such a big deal, but with two different versions of the game, how does that work?

The circumstances look very complicated and I want to make the choice in the game, not at a store. Can anyone help me understand this?
",fireemblem,"[Fates Spoilers] Can Someone Explain This ""Choice"" To Me?",http://www.reddit.com/r/fireemblem/comments/3b460f/fates_spoilers_can_someone_explain_this_choice_to/
