,created,domain,full_link,locked,selftext,subreddit,title,url
0,2016-11-01 23:35:25+00:00,self.pokemon,https://www.reddit.com/r/pokemon/comments/5amkrp/can_i_get_some_help_with_figuring_out_if_my/,False,[removed],pokemon,Can I get some help with figuring out if my Platinum cartridge is real?,https://www.reddit.com/r/pokemon/comments/5amkrp/can_i_get_some_help_with_figuring_out_if_my/
1,2016-11-01 21:41:02+00:00,self.3DS,https://www.reddit.com/r/3DS/comments/5alxl6/can_someone_help_me_figure_out_if_i_bought_a_fake/,False,"I bought this copy of Pokemon Platinum from a local seller, but something seemed off. Most DS carts make an internal sliding noise when I shake them, and this one doesn't. My main concern is the bold lettering on the back, as opposed to the less bold lettering on my other DS games. Otherwise, it seems to check out.

http://i.imgur.com/YUPQHdI.jpg 
http://i.imgur.com/pLAf7tP.jpg 

EDIT: When compared with other DS carts I have, the contact points were not reflective.",3DS,Can someone help me figure out if I bought a fake copy of Pokemon Platnimum,https://www.reddit.com/r/3DS/comments/5alxl6/can_someone_help_me_figure_out_if_i_bought_a_fake/
2,2016-10-24 00:55:19+00:00,self.AskThe_Donald,https://www.reddit.com/r/AskThe_Donald/comments/591uft/ive_seen_people_saying_to_send_my_early_ballot_at/,False,,AskThe_Donald,I've seen people saying to send my early ballot at late as possible. Why would that be?,https://www.reddit.com/r/AskThe_Donald/comments/591uft/ive_seen_people_saying_to_send_my_early_ballot_at/
3,2016-10-22 08:20:43+00:00,self.pokemon,https://www.reddit.com/r/pokemon/comments/58s8l8/how_do_you_think_sun_and_moon_will_handle/,False,"Without the D-Pad for movement, we can't have the same step grinding that we have at Battle Resort in ORAS, but they're trying to make competitive play easier to get into. How do you think breeding grinding will be handled? ",pokemon,How do you think Sun and Moon will handle breeding grinding (if at all)?,https://www.reddit.com/r/pokemon/comments/58s8l8/how_do_you_think_sun_and_moon_will_handle/
4,2016-10-17 06:44:28+00:00,self.CasualPokemonTrades,https://www.reddit.com/r/CasualPokemonTrades/comments/57w0u0/lf_finishing_kanto_dex_ft_several_starters_or_can/,False,"[trade] Working on finishing my living Kanto pokedex at the moment. I can trade any breedabe Pokemon I have including starters: Bulbasaur, Charmander, Snivy, Pikachu, Mudkip, Froakie, Torchic, Fennekin, Oshawott, Totodile, Cydaquil, and Chikorita. 

https://pokedextracker.com/u/shulkario",CasualPokemonTrades,LF: Finishing Kanto Dex FT: Several starters or can breed what I have,https://www.reddit.com/r/CasualPokemonTrades/comments/57w0u0/lf_finishing_kanto_dex_ft_several_starters_or_can/
5,2016-10-14 20:21:25+00:00,self.pkmntcg,https://www.reddit.com/r/pkmntcg/comments/57ihzm/my_local_meta_is_dominated_by_darkraigiratina/,False,"I like the Volcanion decks and think they look fun, and I'm needing to find something else because my current decks (namely Zygarde EX) are too slow to compete with these decks that attach a only a couple energy for full knockouts on everyone I have. This led me to consider playing a mega deck like most of them, but I do want to try Volcanion (but I don't have a ton of money). Would Volcanion do well against these types of decks, or should I go for a mega deck of some type?",pkmntcg,My local meta is dominated by Darkrai/Giratina + Mega decks with Psychic infinity-style attacks. Would I do well playing Volcanion against them?,https://www.reddit.com/r/pkmntcg/comments/57ihzm/my_local_meta_is_dominated_by_darkraigiratina/
6,2016-10-13 20:27:48+00:00,self.masseffect,https://www.reddit.com/r/masseffect/comments/57cgoh/today_during_first_time_beating_mass_effect_3/,False,"That ending is such a horribly short and confusing way to end the trilogy. Ashley (my love interest) looked like she had died, Shepard didn't check on her at all, and she's suddenly aboard the Normandy looking like nothing happened. The relays looked fixable to me in the original ending, so it didn't come off as bleak like others I've heard from have seen it. My Shepard survived, but it was such a short ending with no view of what happened afterwards. I wasn't too mad and looked up the extended cut scenes, and those make a good ending in my opinion, but I got the experience of the original bad ending, which would have ticked me off if I played before EC.

PS, I don't know how I failed the last Paragon/Renegade dialogue since I always took those options with TIM, but thank goodness for that renegade interrupt. That last moment with Anderson was great.",masseffect,"Today during first time beating Mass effect 3, extended cut didn't trigger (ending spoilers)",https://www.reddit.com/r/masseffect/comments/57cgoh/today_during_first_time_beating_mass_effect_3/
7,2016-10-02 22:34:05+00:00,reddit.com,https://www.reddit.com/r/nocontext/comments/55kntv/dysentery_is_sooo_much_better_than_going_away_to/,False,,nocontext,Dysentery is SOOO much better than Going Away To College,http://reddit.com/r/Blink182/comments/55jdo0/blink182_survivor_eots_round_7/d8ba4oa
8,2016-09-26 19:34:10+00:00,self.getnarwhal,https://www.reddit.com/r/getnarwhal/comments/54mfou/bug_messages_icon_lights_up_every_couple_minutes/,False,I don't think this is user error. It's been going on for quite a while now. The same messages are appearing as new about every 2 minutes for the past few hours.,getnarwhal,[Bug] messages icon lights up every couple minutes despite having read all messages when large quantities of messages come in,https://www.reddit.com/r/getnarwhal/comments/54mfou/bug_messages_icon_lights_up_every_couple_minutes/
9,2016-09-26 08:29:51+00:00,self.masseffect,https://www.reddit.com/r/masseffect/comments/54jnff/just_played_leviathan_for_the_first_time_wow_me3/,False,"I have not been this amazed by a video game's story twist since Metal Gear Solid 2. I've been playing the series for the first time, and by ME3 I figured I knew everything that would happen. I was wrong.

Leviathan blew me away so powerfully firstly because it was visually and mentally stunning. I doubt anyone is fully comfortable with the idea of going to the bottom of a water planet's sea with reaper-sized aliens down there, so I'm pretty sure everyone had a strong response to that, but then as you sink down into the darkness you see an unbelievably massive creature. Wow.

Then comes the story part. I thought I knew the story: ""The Reapers are coming! Oh no!"" It didn't click with me because there wasn't a solid beginning, so to fix that they reveal a massive change to what we knew of the mythos: the Reapers were a construct of the Leviathan due to the need to save organic life from its own synthetics. This made my mind run circles because a big theme in Mass Effect is the conflict between organics and synthetics. I already had enough philosophical thoughts regarding that, especially after Legion's ME3 mission, but Leviathan made it all make sense. I won't and can't go into everything this information means because it gives so much to think about. 

Sorry if this is a messy post, I just wanted to capture the feeling in the moment because I haven't been this impressed by storytelling in a long time. I'm a longtime lurker, but I haven't seen too much information on how the community views Leviathan; did other people love it this much too?",masseffect,Just played Leviathan for the first time... Wow... (ME3 Leviathan spoilers),https://www.reddit.com/r/masseffect/comments/54jnff/just_played_leviathan_for_the_first_time_wow_me3/
10,2016-08-23 06:11:25+00:00,self.CasualPokemonTrades,https://www.reddit.com/r/CasualPokemonTrades/comments/4z52mh/lf_yveltal_ft_na_arceus_code/,False,[Legendary] First trade attempt here!,CasualPokemonTrades,LF: Yveltal FT: NA Arceus Code,https://www.reddit.com/r/CasualPokemonTrades/comments/4z52mh/lf_yveltal_ft_na_arceus_code/
11,2016-08-17 18:17:50+00:00,self.Blink182,https://www.reddit.com/r/Blink182/comments/4y77av/best_verse_in_california_other_favorites/,False,"I've always liked the verses to songs in particular, and California has some strong verses. In particular, I'd say I really like the second verse to Sober. It's got a lot going on, it's about as aggressive as Mark ever gets on the record, and the depicted events are interesting. What verses stand out to you from California? What are some of your other favorite verses from the other albums?",Blink182,Best verse in California / other favorites?,https://www.reddit.com/r/Blink182/comments/4y77av/best_verse_in_california_other_favorites/
12,2016-06-30 00:51:14+00:00,self.wiiu,https://www.reddit.com/r/wiiu/comments/4qizg9/what_do_you_think_will_happen_to_wii_u_vc/,False,[removed],wiiu,What do you think will happen to Wii U VC purchases when we move up to NX?,https://www.reddit.com/r/wiiu/comments/4qizg9/what_do_you_think_will_happen_to_wii_u_vc/
13,2016-06-27 07:27:38+00:00,self.nintendo,https://www.reddit.com/r/nintendo/comments/4q25ph/what_are_some_unpopularshovelwaretype_games_you/,False,"I ask this here because I bought a lot of obscure titles for the GBA and DS, then years later, I found out that many of these games were either unpopular or even considered shovelware. Either by trying something new or a bad birthday present, what games like this have you played and liked? 

A few games that come to mind for me are a stuntman-racing game (don't remember if it was GBA or DS) a monster truck GBA game, and Tank Beat on DS. ",nintendo,What are some unpopular/shovelware-type games you played and liked?,https://www.reddit.com/r/nintendo/comments/4q25ph/what_are_some_unpopularshovelwaretype_games_you/
14,2016-05-18 19:46:38+00:00,imgur.com,https://www.reddit.com/r/whatisthisthing/comments/4jyjtd/what_is_this_spaceshiptype_toy_supposed_to_be/,False,,whatisthisthing,What is this spaceship-type toy supposed to be?,http://imgur.com/ECnLVMk
15,2016-05-05 02:55:26+00:00,self.AngelsAndAirwaves,https://www.reddit.com/r/AngelsAndAirwaves/comments/4hy30j/has_anyone_figured_out_the_lyrics_to_wolfpack_1/,False,"I can't quite figure them all out, but I think I really like what they're going for. ",AngelsAndAirwaves,Has anyone figured out the lyrics to Wolfpack #1 Demo?,https://www.reddit.com/r/AngelsAndAirwaves/comments/4hy30j/has_anyone_figured_out_the_lyrics_to_wolfpack_1/
16,2016-04-24 20:50:59+00:00,self.iphone,https://www.reddit.com/r/iphone/comments/4g9ycf/which_eq_do_you_use_on_your_phone/,False,"I have mine set to rock, but I don't speak in EQ terms, so I'm wondering if anyone has good reasons for using other settings.",iphone,Which EQ do you use on your phone?,https://www.reddit.com/r/iphone/comments/4g9ycf/which_eq_do_you_use_on_your_phone/
17,2016-03-29 07:24:28+00:00,self.jaygarricks,https://www.reddit.com/r/jaygarricks/comments/4cefn3/any_jay_you_want_it/,False,"Any Jay you want it
That's the Jay you need it 
Any Jay you want it

Jay loves to laugh
Jay loves to sing
Jay does everything

Jay loves to move
Jay loves to groove
Jay loves the loving things

All night, all night
Oh, every night
So hold tight, hold tight
Ooh, Jayby, hold tight
Oh, Jay said

Any Jay you want it
That's the Jay you need it
Any Jay you want it
Jay said, Any Jay you want it
That's the Jay you need it
Any Jay you want it

Jay was alone
Jay never knew
What Jay's love could do
Ooh, then Jay touched
Then Jay sang
About the lovin' things

Ooh, all night, all night
Oh, every night
So hold tight, hold tight
Ooh Jayby, hold tight
Oh, Jay said,

Any Jay you want it
That's the Jay you need it
Any Jay you want it
Jay said, Any Jay you want it
That's the Jay you need it
Any Jay you want it




",jaygarricks,Any Jay You Want It,https://www.reddit.com/r/jaygarricks/comments/4cefn3/any_jay_you_want_it/
18,2016-03-16 19:39:35+00:00,self.splatoon,https://www.reddit.com/r/splatoon/comments/4apfru/i_made_it_to_srank_today/,False,"Seriously, Splatoon can be brutal in the ranking system. I usually got half the points for winning that I lost for losing, and since I lack Wii U friends, I was given teams at the mercy of matchmaking. It took a lot of blood, sweat, and tears to win. Eventually, though, with a mix of getting gud by watching YouTuber OBE1plays (thanks for the help!) and luck, I made it to S-Rank!

Proof/my inkling: http://imgur.com/apGwyf6",splatoon,I made it to S-Rank today!,https://www.reddit.com/r/splatoon/comments/4apfru/i_made_it_to_srank_today/
19,2016-03-06 20:49:51+00:00,self.fireemblem,https://www.reddit.com/r/fireemblem/comments/49936z/does_anyone_have_a_voice_clip_of_gunters_oh_my/,False,"I think Gunter's ""oh my"" would be a hilariously awkward text tone.",fireemblem,"Does anyone have a voice clip of Gunter's ""Oh my""?",https://www.reddit.com/r/fireemblem/comments/49936z/does_anyone_have_a_voice_clip_of_gunters_oh_my/
20,2016-03-02 07:43:25+00:00,gamestop.com,https://www.reddit.com/r/amiibo/comments/48l68t/pick_up_at_store_now_available_for_roy_ryu_and/,False,,amiibo,"Pick Up At Store now available for Roy, Ryu, and more pre-orders at Gamestop",http://www.gamestop.com/Browse?Nav=16variant.SKU-5-121963+OR+121951+OR+121959+OR+121961+OR+121965
21,2016-03-02 06:25:41+00:00,self.fireemblem,https://www.reddit.com/r/fireemblem/comments/48kxyh/minor_spoilers_a_major_missed_opportunity_of_a/,False,"Where is the triangle attack!? The final Yato is made of three legendary weapons, all of which you retain possession of. It's one of the most perfect triangle attack opportunities ever. 

I love the game, and triangle attacks are rarely useful, but it would have been fun, especially on Seize maps. ",fireemblem,[Minor Spoilers] A major missed opportunity of a minor mechanic in Fates,https://www.reddit.com/r/fireemblem/comments/48kxyh/minor_spoilers_a_major_missed_opportunity_of_a/
22,2016-02-25 17:42:42+00:00,self.fireemblem,https://www.reddit.com/r/fireemblem/comments/47k58x/psa_trigger_dlc_update_by_going_to_purchase_dlc/,False,"I've been trying to get into today's DLC, then I decided to try to go to the purchase area of the Dragon's Gate. When I did, it triggered an update, the DLC gained new icons, and was playable. Hope this helps someone else!",fireemblem,"[PSA] Trigger DLC update by going to ""purchase DLC, purchase content"" inside of Dragon's Gate",https://www.reddit.com/r/fireemblem/comments/47k58x/psa_trigger_dlc_update_by_going_to_purchase_dlc/
23,2016-02-20 21:43:10+00:00,self.splatoon,https://www.reddit.com/r/splatoon/comments/46s3py/is_blue_team_dominating_this_splatfest/,False,"I usually lose a lot in Splatoon, but today I've only lost one round and have played about twenty rounds. On top of it, I've been going about 9-0 in my kill-death ratio. Am I just super lucky in matchmaking or is Blue Team dominating? 

Also, is anyone else having major connection issues?",splatoon,Is Blue Team dominating this Splatfest?,https://www.reddit.com/r/splatoon/comments/46s3py/is_blue_team_dominating_this_splatfest/
24,2016-02-18 19:27:00+00:00,self.fireemblem,https://www.reddit.com/r/fireemblem/comments/46ggt7/so_who_else_has_fates_preloaded_you_ready_for_this/,False,[removed],fireemblem,"So, who else has Fates pre-loaded? You ready for this?",https://www.reddit.com/r/fireemblem/comments/46ggt7/so_who_else_has_fates_preloaded_you_ready_for_this/
25,2016-02-02 17:09:10+00:00,self.3DS,https://www.reddit.com/r/3DS/comments/43v58z/can_i_catch_all_the_original_pokemon_between_blue/,False,"Somehow I didn't play Pokemon back when everyone else I knew did. To make up for this, a friend and I are gonna catch them all when the re-release happens. He claimed Blue, so do I need to get Red, or can I choose Yellow and get all the Pokemon trading with Blue?",3DS,"Can I catch all the original Pokemon between Blue and Yellow, or does it need to be between Red and Blue?",https://www.reddit.com/r/3DS/comments/43v58z/can_i_catch_all_the_original_pokemon_between_blue/
26,2016-02-02 01:21:10+00:00,self.metalgearsolid,https://www.reddit.com/r/metalgearsolid/comments/43rtgg/do_people_play_mgo_on_xbox_360/,False,"I tried to play MGO once and didn't have any luck finding a match. Was it a bad one time thing, or is it actually barren?",metalgearsolid,Do people play MGO on Xbox 360?,https://www.reddit.com/r/metalgearsolid/comments/43rtgg/do_people_play_mgo_on_xbox_360/
27,2016-01-27 00:11:28+00:00,self.metalgearsolid,https://www.reddit.com/r/metalgearsolid/comments/42umb1/can_anyone_really_explain_fobs_and_single_player/,False,"I know the basis of the FOB system, but does it risk my single player progress? The internet elsewhere seems to be 50/50 on whether it does or not. I don't wanna jeopardize my single player Mother Base. ",metalgearsolid,Can anyone really explain FOBs and single player to me?,https://www.reddit.com/r/metalgearsolid/comments/42umb1/can_anyone_really_explain_fobs_and_single_player/
28,2016-01-18 08:24:10+00:00,self.metalgearsolid,https://www.reddit.com/r/metalgearsolid/comments/41i2o9/i_have_no_plans_to_buy_an_xbox_one_is_tpp_good_on/,False,"I've played some Phantom Pain on Xbox One, and the silky smooth frame rate and graphics are amazing, but I don't see the stars aligning for me to find it wise to buy an Xbox One at this point in my life. I'm a huge MGS fan, though. So should I get TPP on 360? I want to enjoy the game, and I can look past the downgrade, but I want to know if it's a good enough experience, or if I should just wait a couple years until I hopefully can get ahold of a next-gen console. ",metalgearsolid,"I have no plans to buy an Xbox One, Is TPP good on Xbox 360?",https://www.reddit.com/r/metalgearsolid/comments/41i2o9/i_have_no_plans_to_buy_an_xbox_one_is_tpp_good_on/
29,2016-01-18 04:18:36+00:00,twitter.com,https://www.reddit.com/r/arrow/comments/41h9me/no_spoilers_diggles_face_looks_so_uncomfortable/,False,,arrow,[No Spoilers] Diggle's face looks so uncomfortable in the mask,https://twitter.com/cw_arrow/status/688767825263996930
30,2016-01-18 04:15:57+00:00,twitter.com,https://www.reddit.com/r/arrow/comments/41h98r/diggles_face_looks_so_uncomfortable_in_his_mask/,False,,arrow,Diggle's face looks so uncomfortable in his mask,https://twitter.com/cw_arrow/status/688767825263996930
31,2016-01-10 05:59:33+00:00,imgur.com,https://www.reddit.com/r/metalgearsolid/comments/40a4n6/squidkid_ocelot_in_splatoon/,False,,metalgearsolid,Squid-kid Ocelot in Splatoon,http://imgur.com/oCyH1yc
32,2016-01-02 10:35:11+00:00,self.Xenoblade_Chronicles,https://www.reddit.com/r/Xenoblade_Chronicles/comments/3z4nuq/star_wars_spoilers_whats_kylo_rens_favorite/,False,"Backslash

I hope you feel better, Finn. ",Xenoblade_Chronicles,[Star Wars Spoilers] What's Kylo Ren's favorite Xenoblade art?,https://www.reddit.com/r/Xenoblade_Chronicles/comments/3z4nuq/star_wars_spoilers_whats_kylo_rens_favorite/
33,2015-12-21 20:49:54+00:00,self.Xenoblade_Chronicles,https://www.reddit.com/r/Xenoblade_Chronicles/comments/3xqy9e/how_do_i_obtain_these_blade_metals/,False,"I had a BLADE metal once, but haven't got any since. Can anyone tell me how to obtain these? ",Xenoblade_Chronicles,How do I obtain these BLADE Metals?,https://www.reddit.com/r/Xenoblade_Chronicles/comments/3xqy9e/how_do_i_obtain_these_blade_metals/
34,2015-12-14 20:51:35+00:00,self.Xenoblade_Chronicles,https://www.reddit.com/r/Xenoblade_Chronicles/comments/3wtzol/where_do_i_find_my_critical_stats/,False,"I am going for a high-critical hit build, and I can see plenty of boosts to my critical chance, but where do I find the main numbers for my critical stats?",Xenoblade_Chronicles,Where do I find my critical stats?,https://www.reddit.com/r/Xenoblade_Chronicles/comments/3wtzol/where_do_i_find_my_critical_stats/
35,2015-12-09 18:15:58+00:00,m.imgur.com,https://www.reddit.com/r/Spongebros/comments/3w3rdp/super_special_secret_monday_announcement/,False,,Spongebros,"""Super special secret Monday announcement""",http://m.imgur.com/5zSWJbs
36,2015-11-14 00:21:31+00:00,twitter.com,https://www.reddit.com/r/Spongebros/comments/3sq6k6/hungrybox_makes_smash_character_poll_with/,False,,Spongebros,Hungrybox makes Smash character poll with Squidward as an option,https://twitter.com/liquidhbox/status/665259948830547968
37,2015-11-13 20:25:00+00:00,twitter.com,https://www.reddit.com/r/Spongebros/comments/3spc3u/zero_getting_in_on_spongebros/,False,,Spongebros,ZeRo getting in on Spongebros,https://twitter.com/tsmzero/status/665239503209033728
38,2015-11-06 09:21:52+00:00,self.fireemblem,https://www.reddit.com/r/fireemblem/comments/3rqtt5/who_is_the_better_japanese_video_game_creative/,False,"I'm a big fan of Fire Emblem and Metal Gear Solid, and decided to come here with my fingers crossed that enough of us would know both game series/work of the two people. Who would you say is the greater creative genius?

I know this is a sort of apples to oranges comparison, but I'd like to see what anyone has to say about this. The main thing to compare would be their story visions and executions thereof. ",fireemblem,Who is the better Japanese video game creative genius: Kaga or Kojima?,https://www.reddit.com/r/fireemblem/comments/3rqtt5/who_is_the_better_japanese_video_game_creative/
39,2015-11-01 09:11:43+00:00,self.metalgearsolid,https://www.reddit.com/r/metalgearsolid/comments/3r2bcd/my_first_encounter_with_psycho_mantis_a_gaming/,False,"(I'm that guy who decided to play Metal Gear Solid in release order and asked about it a while back)

Now, I've been playing Twin Snakes (sorry PSX version fans), and have been loving it. (Also, HOW WAS THIS GAME RATED T? I haven't seen things so bloody and brutal as the cyborg-ninja sequence in rated M games!) My progress is kind of slow-going as going back to such an aged game isn't always easy. I was gonna save us all the trouble of this post until I finished the game and had my full ""review"" of MGS1, but I was too shocked by the Psycho Mantis fight. This, I'll never forget.

First I notice Merryl acting funny, so of course it was the psychic guy I'd been hearing about. Then there was the incredibly awkward scene where she grabs Snake's... snake to get up and Psycho Mantis jokes ""I thought you liked girls"". That sure was a good first impression. 

Then he goes on to talk about his power and tells me that I avoid traps, which probably just describes Snake in general, but then that I save often? Uhhh, okay. I do. Then that I play Smash Bros and Super Mario Sunshine among other things? The shattering of the fourth wall was really getting me for some reason.

Then he must show me his power firsthand. He tells me to put my controller on the floor and he'll move it. I thought it would be a trap, so I wasn't about to. Then all of a sudden in an intense flash of an animation, Snake looks at me and nods that I should do so. I trusted him, and sure enough, Mantis did move my controller. Soon enough the fight starts, and I shoot my Famas at him only to get a black screen with a green word in the top right corner. Suddenly a nostalgia wave hit me as I realized this was the old black screen from the TVs I used many years ago. 

I eventually had to consult the Internet to figure out how to confuse Mantis' powers via another control port. Clever. Almost as clever as the codec code I needed on the game box I didn't get with the game.

Then after so much goofiness and amusement, Mantis gives an amazingly moving death speech. His tale of his life was quite shocking and deeply affected me. I remember the gist, and many elements such as wanting to die with his mask were haunting, but when he decided to help Snake to help someone once in his life, he calls the feeling of it nostalgic, implying that our ""true"" humanity calls for us all to be good creatures, yet we all get corrupted by our experiences and the cruel world. I had to stop playing to process this all. I'll never forget it. Did anyone else experience this broad spectrum of emotions and awe at this section?",metalgearsolid,My First Encounter With Psycho Mantis: A Gaming Memory I'll Never Forget,https://www.reddit.com/r/metalgearsolid/comments/3r2bcd/my_first_encounter_with_psycho_mantis_a_gaming/
40,2015-10-21 08:03:30+00:00,m.imgur.com,https://www.reddit.com/r/FlashTV/comments/3plw37/has_anyone_done_this_yet/,False,,FlashTV,Has anyone done this yet?,http://m.imgur.com/eZgLpyd
41,2015-10-19 08:17:50+00:00,self.metalgearsolid,https://www.reddit.com/r/metalgearsolid/comments/3pbvv5/can_someone_make_me_a_list_of_mgs_games_according/,False,"Hey guys! I've never posted to this sub because I've never played Metal Gear Solid before aside from Ground Zeroes. Now, I am confused as heck by the games and the remakes, so can anyone help me out in figuring out the order to play these games?

I have an average non-gaming PC, so older games should run fine. I'd like to use Nintendo whenever possible, such as Twin Snakes and Snake Eater 3D. I'd love to fire up my PS2 again, and I have an Xbox 360.",metalgearsolid,Can someone make me a list of MGS games according to my console list?,https://www.reddit.com/r/metalgearsolid/comments/3pbvv5/can_someone_make_me_a_list_of_mgs_games_according/
42,2015-10-19 05:26:03+00:00,self.fireemblem,https://www.reddit.com/r/fireemblem/comments/3pbhqx/can_someone_writepaste_me_a_review_of_gaiden/,False,"I'm twice as into Fire Emblem as the next guy and I want to play Gaiden, but I'd like to know more about it since it isn't too popular. Can some of you Gaiden fanboys give me a review of it?",fireemblem,Can someone write/paste me a review of Gaiden?,https://www.reddit.com/r/fireemblem/comments/3pbhqx/can_someone_writepaste_me_a_review_of_gaiden/
43,2015-10-18 21:46:09+00:00,uproxx.com,https://www.reddit.com/r/arrow/comments/3p9y54/no_spoilers_til_there_was_a_scrapped_green_arrow/,False,,arrow,[No Spoilers] TIL There was a scrapped Green Arrow prison escape movie with the Joker in it,http://uproxx.com/movies/2015/10/david-goyer-green-arrow-movie/
