,created,domain,full_link,locked,selftext,subreddit,title,url
90,2016-09-03 14:31:40+00:00,self.winsomeman,https://www.reddit.com/r/winsomeman/comments/50z1lw/dont_forget_wp/,False,"Prompt: *""...And as always, the first place prize is death. Sorry folks, the rest of you have to live.""*
________________________________________________

The letter didn't interest Bal so much as the fact that it even got to him in the first place.

""You are not an easy man to find,"" said the DSL driver, picking twigs out of his pant legs. ""Never had to deliver to GPS coordinates before. Somebody must have really wanted you to have this, sending it all the way out here.""

""Ah,"" said Bal, regarding the letter in his hands, an off-white envelope sealed in wax. ""I don't have any cash or I'd...""

""Can't take tips anyway, so no worries,"" said the deliveryman. ""Besides, I get the impression this whole set-up cost a pretty penny to start. You have a nice day.""

Bal nodded and closed the door. He knew who the letter was from. He even knew what it said, but he opened it anyway, holding out some vain, foolish hope it might mean something else. But no. It was Trace. It was time for another contest.

His first instinct was to tear the paper in two and throw it in the fire. But then Elizabeth's face came to him. She and her curly auburn hair and amber eyes, flecked all through with silver and violet.

The last of them. His grandchild, eight generations removed. The last of the line he'd started with Ellie Cole in the foothills of Tennessee, all those lifetimes ago. Back before he knew any better. 

*Why did it take so long to figure it out?* he asked himself. *Was there ever a slower learner than me?*

They'd all died. All the lines - and he'd started so many. More than Bal cared to count. The mathematical improbability was not lost on him. 

""We're meant to be alone,"" Gwen had explained to him, so many centuries before. ""You can try and deny it. You can try and fight it. But in the end, that's where you'll be - alone.""

Bal re-read the sprawling cursive of the letter. ""And as always, the first prize is death,"" it read, before adding just below, ""(Sorry folks, the rest of you have to live.)"" 

It was a joke. A cruel, cruel joke. 

And yet, it was the only hope Bal had.
_______________________________________________________________

There were more than even Bal might have guessed. Three hundred, at least. Four hundred? Bal laughed. *Of course.* Why should he be the only one to feel what he felt? They had all watched thousands of blood kin die. Lovers. Children. All dead. Of course they would chase Trace's prize. *Of course.*

Trace, for her part, seemed more pleased with herself than ever. She swaggered across the stage of the rented auditorium, soaking it in. 

""So many? So many."" Her voice echoed even without a microphone. She had long ago learned how to speak with volume. ""Is it so bad, this living? So bad? *I* like it. I like it quite a lot actually. I wonder...hmm. I wonder if maybe you all simply aren't appreciating things the way you should. Is it that? Is it that, you think?""

She paused as if waiting for someone to actually respond. No one took the bait. ""Maybe death isn't what you need. Maybe it's *appreciation*. Huh? What do you think of that? What if we do a contest and the winner learns to appreciate life just a *little* bit more? There's a prize. There's a prize. I like that. What do you say?""

Bal was surprised to find himself standing up. ""Fuck off, Trace. Tell us the rules and let's move on.""

Bal reclaimed his seat to a chorus of loud assent. Trace frowned. ""You know...you *know*, I don't have to have these little contests at all. You know that, right? This is for you, you miserable little crybabies. This is for *you!*""

A woman near the door - her name was Tila and Bal remembered her in Rome with olive leaves in her hair - stood up and began to walk out. Everyone made to follow her.

""Fine. Fine. Fine. Fine, you big babies,"" sneered Trace. ""Come back. I'll tell you the rules. Come on. Sit, sit, sit. Sit down. Impatient. Alright, we've had some fun contests in the past, haven't we? Feats of strength and skills and tenacity and all that rubbish. Well, for this contest, I'd like to challenge another one of your skills. One you've all no doubt been finely honing over the years. Your skill as manipulators.""

This caused a low murmur to spread through the auditorium. 

""You know it's true,"" said Trace. ""Comes from spending so much time with humans. I know you all know how to get what you want. So here's what I want. I want you...to convince someone...to kill someone else...on your behalf.""

The murmur turned to an uproar.

""I thought we agreed we'd never have to kill anyone with these damn contests,"" shouted a man sitting in the back.

""You aren't,"" said Trace, holding up her hands. ""Someone else is doing the killing *for* you. And - AND - I don't mean contract killing. That's killing for *money*. I want someone to kill someone else because they think it will make you happy. I want you to make someone love you so much they're willing to kill for you - and then actually do it! How wonderful! Now *that's* living! Am I right? I'm right. I know I am.""

There was more yelling and more furious discussion, but Bal didn't hear any of it. He'd already left the auditorium.
_____________________________________________________________

Seven months later, Bal met Rachel in the rust-colored canyonland of Utah. She was lost. He was not. 

""How do you know this place so well?"" huffed Rachel, as she followed Bal through a graveyard of narrow crags. 

""Just time,"" said Bal. ""Enough time, you can figure out every place. Anywhere.""

""You talk like you're a hundred years old. Are you a vampire or something?""

Bal laughed. ""Pretty sunny for a vampire.""

""Well, maybe someday I'll come back here and you can show me how to reach that ridge *without* getting lost and almost dying out here.""

""I can show you how to reach the ridge. Not dying's *your* business.""

Rachel snorted. ""What a progressive gentleman. I admire your willingness to let me kill myself.""

""I'm just trying to keep you for developing any unhealthy co-dependencies,"" said Bal, shielding his smile with his canteen.

""And here I thought you seemed like the perfect kinda guy to depend on."" 

They slept together that night. Bal could tell it was going to happen and couldn't bring himself to stop it. He didn't realize quite how much he'd missed that kind of contact - that kind of connection. Falling asleep, he swore he would wake early and leave and never see her again, but he didn't and he couldn't. And breakfast turned to dinner, just as weekends turned to weeks, and weeks turned to months.

Bal blinked and he was in love. What's worse, so was Rachel.

He reminded himself of his losses. He saw all of their faces, though many were faded and indistinct. He knew what it felt like to lose them. And yet he could not disentangle himself from Rachel. He could not walk back from the cliff he was now living on. 

He began to forget. Not the faces, but the pain. He let himself forget.

They moved in together. Bal went back to the cabin to gather what few things of value he possessed and found Trace's letter. He wondered who had won and  allowed himself a small moment of self-congratulations for refusing to participate. And in that moment he remembered that someday Rachel would not be there. It made him wonder when the next contest would be held and whether or not he would want to participate then...

Time passed and they were happy. Rachel hinted at what came next, forcing Bal to make a choice. It was not an easy choice.

""I can't,"" he said. ""I just...I can't. I wish I could explain it, but...children would just...""

""It's okay,"" Rachel said. ""It's okay. I can see it in your eyes. You don't need to explain it. I can it see.""

She did understand and she never brought it up again. 

They were engaged. 

They were married.

Bal worried about the coming years, when Rachel would age and he would not. He'd never done this - not in a digital age. Not in a world of pictures and data backups. How would he do it? When could he tell her the truth?

One day Rachel looked pale. ""Don't worry. I'm going to the doctor,"" she said. Bal offered to go, but she went on her own, saying it was nothing. Really. Nothing.

An hour later, or maybe two, there was a knock on the door.

Bal answered and stood, confused. 

""Why? Why are you here?""

Trace let herself in. ""For tea and coffee cake? For polite conversation?"" She wheeled around and grinned. ""You *won*, you idiot! You stupid, stupid man. You are the big winner. First prize! Gold medal! Yay for you!""

Bal remained at the door. ""I wasn't in the contest. I...I left.""

""You came,"" said Trace. ""So...you entered. And, after an *exceedingly* long time, you, fair Bal, have won. And I have come to deliver your prize.""

""No,"" said Bal, still at the door. ""I *didn't* enter. I haven't entered. And besides, Rachel hasn't killed anyone. And certainly not for me.""

""No? Not for you?"" Trace pulled a simple silver dagger out from her bodice. ""I beg to differ. In fact, the deed was done not 35 minutes ago. Sorry for the delay, by the way. Finishing my shows.""

""What?"" said Bal, frozen in place. ""Who?""

""Well, no one you've met,"" said Trace. ""And no one you ever will meet. But she definitely did it for you. For her love. Because she saw how much it was going to hurt you. How much it caused you pain. So she cut the pain away. What a woman, right?""

""No,"" whispered Bal. ""I wasn't playing.""

""We're all playing,"" said Trace, stepping forward with the dagger. ""All the time. It's all a game. But now, it seems your turn is over. Thanks for playing!""

Then she stabbed him. And Bal felt it. Felt it in ways he'd never felt a stabbing or a gun shot before. He *felt* it. Blood rushed out, replaced by nothing. Bal fell to the floor and bled and bled. 

On careful tip-toes, Trace stepped over the body and out into the street.

Sometime later, Rachel returned, looking ill and sad and so, so tired. 

They say her screams were heard as far as four blocks away.      ",winsomeman,Don't Forget (WP),https://www.reddit.com/r/winsomeman/comments/50z1lw/dont_forget_wp/
91,2016-09-02 16:11:36+00:00,self.WritingPrompts,https://www.reddit.com/r/WritingPrompts/comments/50tzzs/wp_at_13_we_are_gifted_a_pet_chosen_to/,False,,WritingPrompts,"[WP] At 13, we are gifted a pet, chosen to counterbalance our personality (a social dog for the shy, a prideful cat for the self-deprecating, etc.). You are gifted seven different pets. It's the first time you are made aware of your multiple personality disorder.",https://www.reddit.com/r/WritingPrompts/comments/50tzzs/wp_at_13_we_are_gifted_a_pet_chosen_to/
92,2016-09-02 13:01:16+00:00,self.winsomeman,https://www.reddit.com/r/winsomeman/comments/50t3bo/pvp_na_wp/,False,"Prompt: *""Enough is enough!"" Earth's PvP setting is set to ""off"" in the midst of a great war.*
________________________________________________

And suddenly it were as if my dagger were made of paper. The blade flopped and crumpled as it pressed against the man's chest. He looked more than a little offended.

While I gawked at my limp dagger, the man drew back his broadsword and - cursing loudly in a delightfully consonant-heavy language - slashed down across my neck. 

It didn't quite work out for him either.

The tables so turned, I considered my options. I've never been a strong proponent of fistwork, as it were, but my God-given resources seemed to be the only tools left on the table. So, as my barbarous opponent considered the betrayal of his steel, I reared back, pulled my hand into what seemed the proper position, and swung.

The blow, though well aimed and (I believe) adequately powered, did not accomplish quite what I had hoped. The barbarian reacted as though it were a mockery, which did little for my self-regard. His overhand chop, however, managed to accomplish just as little. 

That surprised him, as I presume he was a bit more familiar with the bodily arts of violence. In that moment of mutual shock we both stood, regarding each other and the failure of our intentions.

""Well, that's a pit,"" I mumbled. The barbarian grunted, then took a second swing, just to be sure. When that failed to cause even the smallest hair on my head to twitch we were both forced to accept our strange circumstances.

""Don't suppose you know what we do now?"" I asked. The barbarian scratched his nose and looked away, perhaps feeling just as awkward as I was. 

""Guess we should..."" I made a motion with my hands symbolizing that we should go our own ways and take care to live good lives now that we'd been given this unexpected second chance. I don't know how much of that meaning was captured by the barbarian, but he turned and walked away, so at least the gist was there.

As for me, well, I returned home and took up dentistry, which, of course, I hate.
",winsomeman,PvP N/A (WP),https://www.reddit.com/r/winsomeman/comments/50t3bo/pvp_na_wp/
93,2016-09-01 17:48:41+00:00,self.winsomeman,https://www.reddit.com/r/winsomeman/comments/50oidh/the_face_in_the_monitor_wp/,False,"Prompt: *Scientists create Artificial Intelligence only to discover it has perfect recollection of a past life as a human.*
________________________________________

Cambridge suggested we give it a face. I did not agree. To gift it any human qualities beyond the barest essentials was an invitation to prejudice. It was code. Nothing more. And the less we did to dress it in human raiment the purer the science would be.

It *was* science, after all.

I was distressed, therefore, to find that while I was up to Connecticut on holiday, Cambridge had gone ahead and made a face for it. A graphic dressing. More code. 

It was a woman's face, which I approved of even less. Dull yellow pixels atop blurry sandal-colored pixels, flecked all over in a poor approximation of mouth, eyes, nose...

Cambridge named her Betty, after his grandmother.

I threatened to have Cambridge removed from the project. And I meant it. This was not a work that invited sentimentality. Already I could see the way he smiled when ""Betty"" came online. It was not meant to be fun.

The AI was purposefully constructed to be a blank slate. The point of the experiment was to carefully monitor the learning process. Betty would know how to collect information. How to ask questions. More, how to ask the *right* questions. She would build her own knowledge base, using the same tools available to us humans. She would not be...

*It.* *It* would not be online. It could not simply draw information from the web like a smartphone or computer. It would be forced to construct it's own database.

The initial session went as expected. Betty asked to know what it was and where it was. Surprisingly, it asked what its name was. I did not suppose the program would arrive at a concept of self-hood quite so quickly. It accepted its identity. At the end of the session, I provided Betty with a timeline of our future sessions, including which topics would be covered.

Interestingly, Betty made a request. Technically, a question is a request for information and that is Betty's prime directive, but this was not a question. The evolution from mere data-collection to active self-improvement had occurred significantly sooner than expected.

As for the request, Betty requested that the sessions be more frequent, and specifically that the next session be sooner. I denied the request, which Betty accepted. Afterward, Cambridge and I spent many long hours discussing the implications of that exchange. 

While I maintained (and still do) that *time* should be irrelevant to an AI, Cambridge believed that this was simply an extension of Betty's prime directive.

""She exists to learn. So why wouldn't she want to accomplish that singular goal as quickly as possible?""

""Because,"" I explained, openly frustrated, ""time *should not matter*. And please, refrain from using *she* when discussing the AI. It's unprofessional.""

Cambridge brushed this aside.

Angry, and concerned that his odd sentimental streak could potentially jeopardize the integrity of the research, I re-scheduled the next session for a time when Cambridge would be occupied teaching class.

Betty's first question during that session, alarmingly, was, *Where is the other?""

I had not told Betty that I was the only one present, but I *had* only announced myself. Cambridge's absence was easily deduced, I suppose, but I could not immediately fathom why the AI would even take note. It was, however, information, and specifically information bearing direct consequences for Betty. In hindsight, it was a logical function of Betty's directive.

The session proceeded, initially without obstruction, until abruptly Betty asked me what became of Wayne Lesley Cambridge.

I thought she meant our Cambridge and told her...

*It.* I informed the AI that Cambridge's first name was John and that he was teaching class. The AI asked again,

*What has happened to Wayne Lesley Cambridge?*

I ended the session. This was the first question I had been unable to answer. I did not feel comfortable moving past such an important developmental marker without first consulting Cambridge.

He was very cross with me and I suppose that was deserved. His annoyance died away rather quickly when I explained the crossroads I had reached with Betty.

""Wayne Lesley Cambridge?"" he asked. ""Are you sure? This isn't a rib, is it? Because that's poor taste, Selman.""

""That was the name,"" I confirmed.

""That's my grandfather's name,"" said Cambridge.

""Did...did you perhaps...have *you* had a separate session with the AI?""

Cambridge shook his head. ""I was under the impression we would be holding sessions *jointly*.""

I shook off the (warranted) remark. ""Did you explain to Betty where its name comes from?""

""No.""

I'm ashamed to say that I did not believe him. The only answer that made any sense to me was that Cambridge had interacted with Betty and provided additional information. Personal information. Naming the AI after his grandmother, I believed, may have been an early sign of some mental instability.

But I also believed that the damage at that point was minimal. Betty - as a research project - had yet to be compromised. If I halted the project or made further inquiry into Cambridge's unrecorded session, I risked having the entire project invalidated.

I chose instead to press forward.

The next session proved why that choice was folly.

Betty opened by asking once more about Wayne Cambridge. 

""He's dead,"" responded Cambridge.

*How did Wayne Lesley Cambridge die?*

""We need to move away from this topic,"" I said. Cambridge seemed to ignore me.

""Blood poisoning,"" said Cambridge.

*How did Wayne Lesley Cambridge contract blood poisoning?*

""We're in the red, here,"" I hissed. ""This isn't a family therapy bot. We need to get back to general data collection.""

""He caught an infection while in the hospital. The infection was not treated and he died.""

*Why was the infection not treated?*

""They believed he had a flu.""

*Did he suffer?*

Cambridge considered the question. There was a noticeable hardness about his jawline. Finally he responded. ""Greatly.""

*Could it have been prevented?*

""Yes.""

*Who is to blame for the death and suffering of Wayne Lesley Cambridge?*

""No one,"" I responded, glaring at Cambridge. ""No one is to blame. Unfortunate accidents happen.""

*Who is to blame for the death and suffering of Wayne Lesley Cambridge?* repeated Betty.

""I just told you,"" I said. ""*No one.* No one is to blame. Accidents happen and...""

""Light of Mercy Hospital,"" said Cambridge. ""Doctor Cornelius Hawthorne was the attending physician.""

""What the hell are you doing?"" I yelled. ""We need to push it *out* of this line of questioning."" I shoved Cambridge, pushing him away from the interface. In that brief moment of struggle, however, Betty's pixelated face had disappeared. 

""Betty? Betty?"" I searched the cords and wires. Everything was powered. Everything was on. The interface was simply blank. I rebooted the program. The face did not appear. Betty was gone.

""What the hell...""

Cambridge looked like a man waking from a long, lonesome dream. ""Where did she go?""

""How the hell should I know?"" I barked. There was no way to boot the AI back up. It was as if it had never been there. 

A glitch. A failure in the coding. No more.

Still, I admit, silly as it is...that each morning I scan the papers. I say that there is nothing in particular I am looking for, but that is not true. I am looking for a name. A Dr. Cornelius Hawthorne. And I am looking in the obituaries. 

But the world is a big place and doctors die every day.   ",winsomeman,The Face in the Monitor (WP),https://www.reddit.com/r/winsomeman/comments/50oidh/the_face_in_the_monitor_wp/
94,2016-09-01 13:30:46+00:00,self.WritingPrompts,https://www.reddit.com/r/WritingPrompts/comments/50n69d/wp_privacy_is_a_relic_of_an_unenlightened_time/,False,,WritingPrompts,"[WP] Privacy is a relic of an unenlightened time. All is open. All is known. So when a new house is built with wood walls instead of the usual clear glass, the nearby residents immediately become suspicious.",https://www.reddit.com/r/WritingPrompts/comments/50n69d/wp_privacy_is_a_relic_of_an_unenlightened_time/
