,created,domain,full_link,locked,selftext,subreddit,title,url
0,2016-11-17 14:32:21+00:00,self.WritingPrompts,https://www.reddit.com/r/WritingPrompts/comments/5dg2z8/wp_an_unbeatable_supervillain_conquers_the_world/,False,,WritingPrompts,"[WP] An unbeatable supervillain conquers the world, rules with an iron fist, grows bored, and eventually retires from public life. Years later, you strongly suspect the old man who just moved in next door is that retired supervillain.",https://www.reddit.com/r/WritingPrompts/comments/5dg2z8/wp_an_unbeatable_supervillain_conquers_the_world/
1,2016-11-17 01:18:15+00:00,self.WritingPrompts,https://www.reddit.com/r/WritingPrompts/comments/5dd2a8/wp_nothing_is_ever_discarded_nothing_is_ever_lost/,False,,WritingPrompts,"[WP] Nothing is ever discarded. Nothing is ever lost. You work in the space between life and death, where all the knowledge, skills, and attributes of the departed are recycled back to the living. But today you found something you'd rather keep for yourself.",https://www.reddit.com/r/WritingPrompts/comments/5dd2a8/wp_nothing_is_ever_discarded_nothing_is_ever_lost/
2,2016-11-08 15:07:14+00:00,self.winsomeman,https://www.reddit.com/r/winsomeman/comments/5btpi1/a_boys_purpose_wp/,False,"Prompt: *""I'm sorry for being human.""*
_____________________________________________

The bookcase sagged away from the wall at an 80 degree angle. All seven *Harry Potter* hardcovers slid off the top shelf and fluttered to the floor like dead birds.

Danny frowned. ""It's alright, dear,"" whirred Mother-Bot, wheeling forward on her narrow, matching treads to gather the fallen books in her nimble pincers. ""You did your best.""

""Sorry,"" mumbled Danny, red-faced. He'd worked on that bookcase for four hours. Followed every instruction. The pieces were *literally* numbered.

""Sorry for what, dear?"" sighed Mother-Bot, her digital singsong patterned to rise and fall in empathetic inflections. 

""Sorry for being human,"" pouted Danny, slumping at the shoulders and spinning away from the wreck of his efforts.

""No, no!"" said Mother-Bot, wheeling about, grabbing Danny gently under the arms and lifting him swiftly, effortlessly into the air. ""You are a precious miracle, little Danny. Never apologize for what you are."" Her servos clattered softly as she drew the boy into her felt and foam padded breast. 

""I'm *so slow*,"" he moaned, pushing away from the embrace. ""And weak. And *stupid*. I can't build anything right. I can't play whizzball with the other bots because they're all afraid I'll get hurt. I'm just... I don't belong.""

""You don't belong?"" sang Mother-Bot, kind and incredulous. ""This whole *world* is yours, wonderful Danny! A whole land, just for you. Your ancestors built this world and everything in it for you. So there would always be a place for you, even after the Ravages took them all. So even if you were the absolute last of your kind, you would have friends and family and a community. And yes, Danny, while we were making the world ready for you - clean for you - we lived our own lives in a way. Made our games. Our own communities. But then the world was ready for you and you are here and *we are so happy to have you*.""

The red and black digital display of Mother-Bot's face curved into an enormous, earnest smile. 

""I feel like a burden,"" sniffed Danny. ""Like everyone has to slow down for me.""

""We *do* slow down for you,"" said Mother-Bot. ""But that is not a burden. That is a privilege. It is our joy and pleasure. So do not feel alone, dear Danny. You are surrounded by those who love you; those who will protect you. And we will never think less of you for your humanity. Because that is your gift to us.""

Danny didn't cry, because he didn't want to. But still he dove forward into Mother-Bot's soft chest and felt the warm oscillation at her center and smiled and was happy.",winsomeman,A Boy's Purpose (WP),https://www.reddit.com/r/winsomeman/comments/5btpi1/a_boys_purpose_wp/
3,2016-11-08 03:22:18+00:00,self.WritingPrompts,https://www.reddit.com/r/WritingPrompts/comments/5bqwn2/wp_the_man_died_but_he_was_an_organ_donor_they/,False,,WritingPrompts,"[WP] The man died, but he was an organ donor. They harvested anything worth taking, but when they went to close him up and pull the plug, it had all grown back. So they did it again, and again, and again. On and on it went for decades, saving thousands of lives, until one day he opened his eyes.",https://www.reddit.com/r/WritingPrompts/comments/5bqwn2/wp_the_man_died_but_he_was_an_organ_donor_they/
4,2016-11-07 21:53:33+00:00,self.winsomeman,https://www.reddit.com/r/winsomeman/comments/5bp4sk/visiting_hours_wp/,False,"Prompt: *Everyone fears you. The mundane. The supernatural. Even the eldritch horrors. Why? It's because you are The End.*
______________________________________________

The little girl with the pink gown and the round, jaundiced skull, looked up from her mother's iPad. ""Oh. *You*,"" she said, before dropping her eyes back down to the screen.

""Well,"" I said, taking a seat on the opposite side of the rails. ""A bit rude, don't you think?""

""Why shouldn't I be rude to *you*? You're Death, after all.""

I drew back, wounded. ""How dare you?""

She looked up again, mildly interested. ""Aren't you?""

""Not in the least. *Death*? Blech. No, I'm someone else entirely.""

She set down the device. ""Well then, who are you?""

I placed a insubstantial finger against my temple. ""The End.""

She rolled her eyes and grabbed up the iPad. ""Ah. So Death with a dumb name.""

Agitated, I sprang to my feet. ""No! Not Death! That's a totally different thing. Death's a jumped-up chauffeur, ferrying *souls* from one realm to another. He's the Uber driver of the damned, as far as I'm concerned. I am The End. Much different. Even deathless gods hold me in high regard. I'm kind of a big deal.""

""I'm really not getting the concept,"" said the little girl, not looking up.

""The *End*! It's not... it's not that complicated, really. All things end. People. Plants. Animals. Cities. Stories. Relationships. Head colds. *Ideas*. All of it *ends*. And I'm the one that ends them. So... you see? Really not that complex.""

""When are you planning on ending this conversation?"" said the little girl.

I gritted my insubstantial teeth. ""I'd like to end that attitude of yours...""

""Please do,"" said the girl. The flash of the screen reflected off her round, glistening eyes. ""I'm ready whenever you are.""

""Well..."" I cleared my throat. ""As it turns, I am here to end your suffering.""

She shook her head. Now when she refused to look up it seemed less a form of rebellion and more a means by which to keep her emotions under wraps. ""Great. Sounds great. Like I said... I'm ready. But if all you were ever gonna do was kill me, I really wish you would've skipped all the talking before.""

""Oh. Oh no."" I straightened up. ""I'm ending your suffering. Not your life. That's all.""

She looked up, upset and hopeful and scared. ""You...?""

""Well, that's not *all*."" Her face wavered. ""I'm also ending your nihilism, just as a matter of course.""

""I'm eight,"" she said. ""I don't know what that means.""

""Doesn't matter,"" I shrugged. ""Our business is at an end.""

She chuckled sarcastically. ""Good one.""

""That wasn't...oh. Yes.""

Her face was suddenly more red than yellow. She was clutching the iPad so firmly I was worried she may break it. ""Are you saying I'm cured.""

""Oh,"" I said. ""That was the third thing, wasn't it? Your suffering, your belief that life is meaningless, and your cancer. Almost forgot. Those are all ended."" I waved my hands in the air dramatically. ""Tah-dah. *The End*, see?""

She nodded. ""Yeah. I see."" She wiped her eyes with the bed sheets. ""When...when will I see you again?""

I shook my head. ""Again, not Death. I'm not on a schedule. We will meet again, many, many times. Just as we've met before. You just don't remember.""

""Will I remember this time?""

""Probably not, no. But! I do believe you'll remember this at least - you'll remember not to be afraid of me.""

She nodded. ""Yes. I'm sure I'll remember that.""

I moved to the door. ""Places to be,"" I sighed. ""I'm afraid this meeting...""

""Is over,"" said the girl with a smile.

""*Is at an end*,"" I replied with a mock frown. ""Sheesh. Some people."" But my frown slipped into a smile just as I slipped into the air. 

Another moment ended. Another had just begun.   ",winsomeman,Visiting Hours (WP),https://www.reddit.com/r/winsomeman/comments/5bp4sk/visiting_hours_wp/
5,2016-11-07 04:58:37+00:00,self.winsomeman,https://www.reddit.com/r/winsomeman/comments/5bkdst/gods_orphans_part_10/,False,"**[Part 9](https://www.reddit.com/r/winsomeman/comments/5ao34i/gods_orphans_part_9/)**
_____________________________________________

Clay bought a jug of water and a big bottle of migraine pills. The girl behind the counter had gone to the same school as Clay, but she was maybe three years older and clearly had no idea who he was. That was probably for the best.

Tania stepped to the back of the line as Clay was walking away. She had a bag of Doritos, an iced tea, and a gallon of Draino.

""What the hell...?"" 

Tania shrugged. ""You said those shots were poison, right? Kept us feeling normal by giving our bodies something to *do* with all that energy. Well..."" 

""You're going to drink Draino?"" hissed Clay.

""Worth a shot, right?""

Clay waited outside until Tania had paid for her stuff. Together the pair walked south, sticking to smaller side streets.

""So what's the plan?"" said Tania, popping the lid off the Draino and taking a sniff. ""Storm your parents' house? Rip out the phone lines this time?""

""I can't believe you're going to drink that.""

""Christ,"" said Tania, rolling her eyes as she took a swig. ""Blech! Oh. Jesus.""

""Feel better?"" smiled Clay.

""Stop...*cough cough*...changing the subject.""

Clay nodded. ""I think we have to assume the house is being watched. And maybe where they work. So I have another idea.""

""Great non-answer,"" said Tania, wedging the capped Draino under her arm while she took a long chug of iced tea. 

""You'll see,"" said Clay. ""We're almost there.""

*There* was a slanted gray building behind a gas station that happened to be Clay's favorite pizza place - Antonio's. 

""So the plan is pizza?"" said Tania. ""I'm not saying it's a *bad* plan, I'm just not sure I'm getting it, is all.""

""Memorize this number,"" said Clay. ""230-4004. That's my house number. I'm gonna distract the person at the counter. You call from the phone here and tell whoever answers that they were randomly selected for a free pizza, but they have to come within the hour.""

""And if they don't want pizza?""

Clay blinked. ""It's pizza. And it's free. My parents may be part of a sinister plot involving gene manipulation, but they're not *monsters*.""

Tania nodded. ""No offense intended. Let's give it a shot. But if it all goes to shit in there, I'm gonna go ahead and steal some pizza for the road.""

""That's fair,"" said Clay.

Half of the plot didn't end up mattering, because Clay's friend Stevie Riddle was working the cash register.

""Clay?"" he said, as the pair walked through the door. Clay's eyes went wide.

""Stevie?""

Stevie was round-shouldered and long-faced, with an uncomfortable length of greasy black hair that he wadded up into a bun at the back of his head. He sprinted out from behind the cash register and wrapped Clay up in a swift, though somewhat lingering, bearhug.

""When'd you get back?"" said Stevie. ""With the mission work, I just assumed you'd be gone 'til Christmas at least.""

""Mission work?"" said Clay.

""Is that not what they call it?"" Said Stevie. ""It's what your mom told me. Dominican Republic, right?""

Clay cleared his throat. ""Yes. That's right. Back from my...mission.""

Stevie's eyes swung to Tania. ""Did you...you bring a girl back with you? Oh my god, did you get *married*??""

""Is he serious?"" said Tania. ""Is that a serious question? I'm from Albany, motherfucker.""

""She's a friend!"" yelped Clay, diving in between the two. ""This is Tania. She's a friend. Very...good friend. Listen, Stevie, can we use the phone real quick?""

""Yeah, I guess,"" said Stevie, frowning. Clay pointed Tania to the phone and led Stevie to the opposite corner of the room. ""So...uh... have I missed much?""

""Tammy Spitzer's preggo,"" said Stevie. ""And Mr. Farnsworth had a mental breakdown. Something about his wife leaving him. I dunno. How was the D.R.?""

""D.R.?""

""*Dominican Republic*. Sheesh man, you sure you didn't catch like, malaria or something? No offense, you look - and smell - like hell. You take a bus home?""

Clay forced a laugh. ""It's... you know... dirty. Kinda. But yeah, I need a shower, for sure."" Tania set down the receiver and gave him a thumbs up. ""Alright, we'll let you get back to work.""

""He seems like an idiot,"" said Tania, as the two loitered outside the pizza parlor. 

""He's fine,"" said Clay. ""Nice guy. Just...not all that worldly.""

""Right,"" said Tania. ""Well, they're coming. It's good to know their appetite for free pizza hasn't been affected by all the kidnappings and daughter shootings and whatnot.""

""They're a frugal people,"" said Clay.

""So what tells you your mom or dad are even gonna tell you the truth about anything? No one else in this thing seems all that big on the truth.""

""I don't know,"" said Clay, pulling nervously at his filthy shirt. ""I wasn't sure where else to go. If they won't tell us anything, I don't know who will.""

""Well, I'm in favor of punching the truth out of people, so let's not leave that off the table.""

Clay laughed, but not really. Fifteen minutes later a familiar Blue Toyota turned onto the street. Clay and Tania hid out of sight until the car stopped and the door opened. A weary-looking blond woman in a gray hoodie stepped out and made for the front door. 

""Hey,"" said Clay, stepping out from behind the building, while Tania curled around to the side of the Toyota.

Cynthia Haberlin's eyes went wide. She staggered momentarily. ""Clay?""

""Let's get in the car,"" said Tania, pulling open the driver's side door.

""Wha...where have you been?"" said Cynthia, as Clay pulled her gently to the backdoor of the car.

""Just sit down. We need to talk. Keys?""

Absently, Cythnia reached into the pocket of her hoodie and handled Clay the keys. He turned them over to Tania. 

""Drive carefully,"" he said. 

""What's that supposed to mean?"" said Tania. But she wasn't interested in an answer. Instead, she revved up the car and pulled out onto the street, as Clay and his mother settled into the backseat.

""Where have you been, Clay? We've been so...""

""I don't think we have time for all of that,"" said Clay, more coldly than he'd meant. ""You need to tell me where I came from. Everything you know. Now.""

Cynthia paused a moment, as if considering. Then she nodded. ""Yes. Okay. Where should I begin?""

""The beginning works,"" said Tania from the driver's seat.

Cynthia took a long, slow breath. ""Clay...you're adopted.""

""No shit,"" said Tania.

""Hey!"" said Clay, leaning through the seats. ""Just drive, okay? I've got this.""

Cynthia went on without prompting. ""After Callie I was told I couldn't have any more kids. *But*, we'd always wanted two kids at least, so...we began to look into adoption.""

Her eyes slipped to the window of the moving car. ""The adoption agency said we were a match for a special program. Special needs babies. Required very responsible, very stable parents. But if we said yes, it would cut through a lot of the usual red tape. And so...we said yes.""

""What did they tell you about the special program?"" said Clay.

Cynthia shook her head. ""Not much. They said you had early onset diabetes. But they said that was okay, because they would provide the doctors and all the medication necessary. We just had to use the meds they sent in the mail and only go to the doctors and dentists that they picked. So we did. That's all. Everything else was normal. Everything else was fine. You were just our son. As far as we're concerned, you still are.""

""They didn't tell you anything about where I came from? What else might be *wrong* with me?""

""No. It was confidential. We were just... we were just happy to have you. It didn't seem like such a burden to do those things. And it never hurt you. I mean, christ, it's not like you were ever sick or anything.""

""Right,"" said Clay quietly. The car pulled into a wide parking lot, circling slowly around the perimeter. ""What did they tell you - after I was gone?""

""We called the police,"" said Cynthia, looking down. ""We were always told to call *them* if anything was ever wrong with you, but that didn't really occur to us at the time. We just couldn't find you and then your father... found a bullet shell on the ground in the living room and we panicked. I called the police. That's when we found out they've been listening to our calls - I guess the whole time.""

""For real?"" said Tania, slowing the car but not stopping. 

Cynthia nodded. ""The police didn't come. *They* came instead. They said that they would find you and they warned us not to disobey them. They said that your life depended on it. But we never explained it to Callie. So that's why... she...""

""Oh god!"" said Clay. ""Is Callie okay? I keep... I've been so caught up, I forgot about...""

Cynthia put a hand on Clay's knee. ""She's fine. Your sister's fine. The people who came to... to get you - they helped her. Took care of the bullet wound. No permanent damage. She's fine. She's worried about you. We've all been worried. Clay...""

The tears came, slow and heavy. ""I don't know what we've done,"" she said at last. ""I don't understand any of this, but I'm so sorry. I don't know what those people did to you. What *any* of these people have done to you. And... I don't know how to help you right now.""

""This is fine,"" said Clay with a broken smile. ""This is what I wanted. I just need to find these people. I need more answers.""

Cynthia swallowed. ""Do you want to come home? We can call them. I'm sure they'll come.""

""Pass,"" said Tania. 

Clay shook his head. ""I think we need to go to them. Do you know where they are?""

""I think I do,"" said Cynthia, leaning into the front, past the passenger's seat to the glovebox. She pulled out a wad of papers and sorted through until she found what she wanted. ""Here,"" she said, handing Clay a crumpled slip of paper. ""Return address for your...shots. I think that's their headquarters.""

""Boston,"" said Clay. ""Okay. Good. This is good.""

""What are you going to do?"" asked Cynthia suddenly.

""Not sure,"" said Clay honestly. ""I think there's answers there. But I don't think anyone's gonna give us anything freely. We'll have to find a way to take it.""

""Take my car,"" said Cynthia, wiping her sleeve across her eyes. ""Just promise you'll go the speed limit.""

""Really?"" said Clay.

""Yeah."" She shrugged, almost violently. ""I really don't know what else to do for you. I've never felt like such a huge, worthless failure before. And I'm so, so sorry."" She was bawling by the end of it and Clay didn't hesitate to lean across the seat and wrap his arms around her.

""It's okay, Mom. You didn't do anything wrong.""

They dropped her off two blocks from home. She kissed Clay on the cheek, lingering in the open door. ""Be safe. And please come home soon,"" she said.

""I'll try,"" said Clay. He wanted to say something more. Something about being a son and how lucky he felt, despite all the fresh strangeness of his life, but just then he saw a familiar car turn onto the street a block away - a rattling, black Dodge Charger. ""Bye,"" he breathed, diving into the passenger's seat and slamming the door closed. ""Go!""
    
Tania didn't need any more prompting. She saw the black car accelerating towards them. ""Oh, you wanna race?""

""It's a goddamn Corolla - *move*!""

The Toyota peeled out onto the street. The Black Charger roared in pursuit. 

The chase was on again.

_________________________________________________

*Author's note - Just wanted to say thanks to everyone still following this story. It's been slow going, but the end is nigh! I appreciate you taking the time to read these. It means a lot. Cheers!*",winsomeman,God's Orphans - Part 10,https://www.reddit.com/r/winsomeman/comments/5bkdst/gods_orphans_part_10/
6,2016-11-06 16:38:46+00:00,self.WritingPrompts,https://www.reddit.com/r/WritingPrompts/comments/5bglhe/wp_youre_a_teen_playing_spin_the_bottle_your_spin/,False,,WritingPrompts,"[WP] You're a teen playing spin the bottle. Your spin lands between two other teens. You reach to spin again when an extra-dimensional being suddenly materializes in the empty space and says, ""Finally! Let's go.""",https://www.reddit.com/r/WritingPrompts/comments/5bglhe/wp_youre_a_teen_playing_spin_the_bottle_your_spin/
7,2016-11-06 15:03:33+00:00,self.WritingPrompts,https://www.reddit.com/r/WritingPrompts/comments/5bg4af/wp_there_is_a_waterfall_they_say_can_wash_away/,False,,WritingPrompts,[WP] There is a waterfall they say can wash away the worst of your sins. You and your partner step through together. Only you come out the other side.,https://www.reddit.com/r/WritingPrompts/comments/5bg4af/wp_there_is_a_waterfall_they_say_can_wash_away/
8,2016-11-06 03:04:41+00:00,self.WritingPrompts,https://www.reddit.com/r/WritingPrompts/comments/5bdu61/rf_we_all_have_that_one_friend_who_never_grew_up/,False,,WritingPrompts,"[RF] We all have that one friend who never grew up, never moved on, and never let go of the past. Except when we don't...because we're that friend.",https://www.reddit.com/r/WritingPrompts/comments/5bdu61/rf_we_all_have_that_one_friend_who_never_grew_up/
9,2016-11-05 17:23:55+00:00,self.WritingPrompts,https://www.reddit.com/r/WritingPrompts/comments/5bb04i/wp_an_amnesiac_wakes_up_inside_the_towering_walls/,False,,WritingPrompts,"[WP] An amnesiac wakes up inside the towering walls of a massive city. The city is completely empty, but they can hear the shouts of people on the other side of the wall, begging for the gates to be opened.",https://www.reddit.com/r/WritingPrompts/comments/5bb04i/wp_an_amnesiac_wakes_up_inside_the_towering_walls/
