,body,created,id,nest_level,parent_id,reply_delay,subreddit
0,I totally understand :),2016-11-16 20:35:30+00:00,da389kh,,t1_da0fq5r,165938.0,obscuremusic
1,"Thanks a lot! I really appreciate that. I'll be releasing my first EP this week, and I'd definitely like to get your feedback on it. I'll be posting it here on reddit, but you can also hear it on my bandcamp page &gt;&gt;&gt; http://funeralcasket.bandcamp.com

The official release is scheduled for this Saturday (November 19th). I can't wait to hear what you think about it. Thanks again for listening! :)",2016-11-14 17:31:40+00:00,da010wu,,t1_d9u76d5,,unheardof
2,"Hahaha! Guess I dodged a bullet there. Thanks! :)

I'll be releasing my first EP this week, and I'd definitely like to get your feedback on it. I'll be posting it here on reddit, but you can also hear it on my bandcamp page &gt;&gt;&gt; http://funeralcasket.bandcamp.com

The official release is scheduled for this Saturday (November 19th). I can't wait to hear what you think about it. Thanks again for listening! :)",2016-11-14 17:27:31+00:00,da00tlm,,t1_d9wiay3,,obscuremusic
3,"After about an hour of searching, this seems pretty darn impossible...the elusive ""acid trippin"" lyrics have done it again...",2016-11-09 22:25:36+00:00,d9thfxz,4.0,t1_d9seyqz,56943.0,doommetal
4,"Ghost is pretty cool. I listened to their Infestissumam album, I liked it a lot. They have a really vintage sound, to me, but not as heavy as other bands out there. I think they make up for it though with those cool melodies and vocal harmonies. I think the vocal melodies give a more ""pop"" element to their sound, but not in a bad way, in a ""people will dig this because it's catchy"" kind of way :)

As far as suggestions, I would say definitely check out Belzebong and Saint Vitus and Elder too! Really heavy stuff!",2016-11-09 22:20:17+00:00,d9th6rq,2.0,t1_d9rvnvy,80162.0,doommetal
5,"Yes, you have succeed in making me envy you...*sits in the corner*...

Seriously though, I think most doom tracks sound extremely awesome on vinyl versus digital format. Although the digital version of these songs still kick major ass!",2016-11-09 22:16:40+00:00,d9th0mb,2.0,t1_d9svue4,25801.0,doommetal
6,Haha couldn't have said it better myself :) we need more dank muzaks! ,2016-11-09 22:14:51+00:00,d9tgxha,8.0,t1_d9ruype,80744.0,doommetal
7,"Thanks a lot! Yeah, I'm always excited when music I like gets discovered and is considered awesome by new people. I'm definitely sharing all the doom songs I come across with my friends and family as well as posting them online. I agree with you, growth within a specific music community (especially metal) should always be seen as a good thing. With so much pop music and rap music dominating mainstream culture, it's good to see metal still thriving and keeping it's hold on the underground scene. I make Industrial Metal music, and for a while I was only interested in Industrial bands and that's it, but I quickly realized that venturing out to different branches of this awesome Metal tree is actually pretty beneficial because it introduces you to new sounds, new ways of playing music and amazing new people who love the music just as much as you do. I appreciate your comment, and I'll for sure be posting more cool songs here. 

DOOM ON \m/",2016-11-09 22:13:01+00:00,d9tgucs,4.0,t1_d9rw02n,79293.0,doommetal
8,"The ""Hellrasier"" movies were a big inspiration for me when creating this track. The dark atmosphere of the films, the cyber-goth aesthetic of Pinhead and the sadomasochistic undertones of Hellraiser overall inspired me to write a sort of theme song for the character of Pinhead. The idea was to capture the heavy darkness and aggression of Hellraiser and translate that into music that would convey that same type of energy and power.

The sadomasochistic themes in the Hellraiser films also played a role in the artwork design for the track. Displaying horrific pain and brutality without death was my goal when creating the artwork. The idea of being completely destroyed, but unable to die, thus forced to endure the pain and torture is truly terrifying, and that's what I wanted the art to portray.
Here you have ""Torture Chamber""...I hope you enjoy... ",2016-11-09 13:06:50+00:00,d9sre6x,1.0,t3_5c0yzh,16.0,Cyberpunk_Music
9,"**Funeral Casket** [Greenville, DE / USA] 

I make Industrial Metal, emphasizing heavy riffs and industrial rhythms using a slightly slower tempo than most Industrial Metal of the 90's and 2000's. I play, program, and produce all the music myself as well as design the artwork, which I feel allows me to really give each track I create it's own individual feel and aesthetic.

My plan for my music is to take Industrial Metal in a bit more heavier, slower, and MORE ""metal"" direction, away from the predominantly Electronic / Industrial Dance type of sound. I use elements of Electronic music and Noise in my  tracks, but I tend to stay away from synthesizer breakdowns and leads and electronic dance music elements and instead use synthesizers to enhance the guitar and Industrial aspects of my music.

You can check out my music on my Bandcamp: http://funeralcasket.bandcamp.com

and here's a link to my latest release *[""Torture Chamber""](https://funeralcasket.bandcamp.com/track/torture-chamber)*",2016-11-09 00:08:59+00:00,d9rvvx8,1.0,t3_5b2u8q,394181.0,Metal
10,"Lol maybe they're not bitter, they're just familiar with this song I guess. Being fairly new to doom metal (listening for about a year) and being VERY new to this particular sub, I had no idea that people here were already familiar with this song, to the point where a few of them seem to dislike it being posted here at all. Again, I like the song and figured I'd post it and share it with everyone, I certainly didn't know that there would be people here that would be annoyed with the popularity of this song. No one is at fault here, so I agree that a few of the comments seem bitter, but maybe it's just a misunderstanding...maybe...who knows, I may post songs that people are annoyed by again in the future as I am NEW TO THE SCENE...sorry in advance :)",2016-11-08 23:47:11+00:00,d9ruvex,2.0,t1_d9rr5go,4798.0,doommetal
11,"The ""Hellrasier"" movies were a big inspiration for me when creating this track. The dark atmosphere of the films, the cyber-goth aesthetic of Pinhead and the sadomasochistic undertones of Hellraiser overall inspired me to write a sort of theme song for the character of Pinhead. The idea was to capture the heavy darkness and aggression of Hellraiser and translate that into music that would convey that same type of energy and power.

The sadomasochistic themes in the Hellraiser films also played a role in the artwork design for the track. Displaying horrific pain and brutality without death was my goal when creating the artwork. The idea of being completely destroyed, but unable to die, thus forced to endure the pain and torture is truly terrifying, and that's what I wanted the art to portray.
Here you have ""Torture Chamber""...I hope you enjoy... ",2016-11-08 22:14:46+00:00,d9rqjs7,1.0,t3_5bwczh,24.0,bandcamp_discovery
12,"Oh ok, I get it now. Yeah, I didn't get any notification of it being posted here before that's why I went ahead and posted it. Dragonaut is not as heavy as most of the doom I like, but I figured since it's such a cool song I'd share it. Rock on \m/",2016-11-08 22:11:58+00:00,d9rqeqy,6.0,t1_d9rq85d,238.0,doommetal
13,Oh lol. You don't like Sleep?,2016-11-08 22:01:25+00:00,d9rpwkt,4.0,t1_d9rpq74,213.0,doommetal
14,"You don't think they'd be too heavy for the club? or do you just want them to produce so much heaviness that the club literally collapses under the weight of the awesomeness and the places turns into an epic scene of destruction and industrial goodness among smoldering rubble which was once a club! Haha, I just imagined that, and it would be awesome lol",2016-11-08 21:59:17+00:00,d9rpsr6,4.0,t1_d9r2mg8,27061.0,industrialmusic
15,"The ""Hellrasier"" movies were a big inspiration for me when creating this track. The dark atmosphere of the films, the cyber-goth aesthetic of Pinhead and the sadomasochistic undertones of Hellraiser overall inspired me to write a sort of theme song for the character of Pinhead. The idea was to capture the heavy darkness and aggression of Hellraiser and translate that into music that would convey that same type of energy and power.

The sadomasochistic themes in the Hellraiser films also played a role in the artwork design for the track. Displaying horrific pain and brutality without death was my goal when creating the artwork. The idea of being completely destroyed, but unable to die, thus forced to endure the pain and torture is truly terrifying, and that's what I wanted the art to portray.
Here you have ""Torture Chamber""...I hope you enjoy... ",2016-11-08 21:56:55+00:00,d9rpohq,1.0,t3_5bw915,19.0,YourBand
16,"Me too up until recently. I was listening to some Windhand and YOB and instantly thought of this song. Not as heavy as Dopelords, but still heavy as fuck!",2016-11-08 21:50:28+00:00,d9rpc94,2.0,t1_d9rlm83,4260.0,doommetal
17,"The ""Hellrasier"" movies were a big inspiration for me when creating this track. The dark atmosphere of the films, the cyber-goth aesthetic of Pinhead and the sadomasochistic undertones of Hellraiser overall inspired me to write a sort of theme song for the character of Pinhead. The idea was to capture the heavy darkness and aggression of Hellraiser and translate that into music that would convey that same type of energy and power.

The sadomasochistic themes in the Hellraiser films also played a role in the artwork design for the track. Displaying horrific pain and brutality without death was my goal when creating the artwork. The idea of being completely destroyed, but unable to die, thus forced to endure the pain and torture is truly terrifying, and that's what I wanted the art to portray.
Here you have ""Torture Chamber""...I hope you enjoy... ",2016-11-08 21:41:08+00:00,d9rouon,1.0,t3_5bw4uo,232.0,under10k
18,Lmao!,2016-11-08 21:27:11+00:00,d9ro4kp,3.0,t1_d9rmu89,1477.0,doommetal
19,"Wow, thanks a lot! Yeah a lot of people are new the industrial scene because it's been quiet for a few years, other then Marilyn Manson and 3TEETH putting out projects. I've thought about working on a full length project, but I'm always writing new material and coming up with new themes for new songs that I'm not sure if I could make a collection of tracks with just one single theme, sound and ""feel"". It would probably end up sounding more like a compilation of different stuff rather than an actual album. I could do an EP though, maybe 3-4 tracks?",2016-11-08 18:48:40+00:00,d9rfu48,3.0,t1_d9r0ylt,18219.0,BandCamp
20,"The ""Hellrasier"" movies were a big inspiration for me when creating this track. The dark atmosphere of the films, the cyber-goth aesthetic of Pinhead and the sadomasochistic undertones of Hellraiser overall inspired me to write a sort of theme song for the character of Pinhead. The idea was to capture the heavy darkness and aggression of Hellraiser and translate that into music that would convey that same type of energy and power.

The sadomasochistic themes in the Hellraiser films also played a role in the artwork design for the track. Displaying horrific pain and brutality without death was my goal when creating the artwork. The idea of being completely destroyed, but unable to die, thus forced to endure the pain and torture is truly terrifying, and that's what I wanted the art to portray.
Here you have ""Torture Chamber""...I hope you enjoy...",2016-11-08 18:44:30+00:00,d9rfm50,1.0,t3_5bv2dk,20.0,ENFPMusic
21,"Me too! When I hear this song, I just imagine an infinite wall of coffins rumbling and shaking as the guitars shred and then when the drums hit, the coffins burst open and release a million corpses to wreak havoc on the innocent and annihilate the guilty!",2016-11-08 18:13:27+00:00,d9rdy3o,2.0,t1_d9qrxsa,41154.0,doommetal
22,"The ""Hellrasier"" movies were a big inspiration for me when creating this track. The dark atmosphere of the films, the cyber-goth aesthetic of Pinhead and the sadomasochistic undertones of Hellraiser overall inspired me to write a sort of theme song for the character of Pinhead. The idea was to capture the heavy darkness and aggression of Hellraiser and translate that into music that would convey that same type of energy and power.

The sadomasochistic themes in the Hellraiser films also played a role in the artwork design for the track. Displaying horrific pain and brutality without death was my goal when creating the artwork. The idea of being completely destroyed, but unable to die, thus forced to endure the pain and torture is truly terrifying, and that's what I wanted the art to portray.
Here you have ""Torture Chamber""...I hope you enjoy...",2016-11-08 18:05:39+00:00,d9rdji5,1.0,t3_5butgd,18.0,instrumentalmusic
23,"The ""Hellrasier"" movies were a big inspiration for me when creating this track. The dark atmosphere of the films, the cyber-goth aesthetic of Pinhead and the sadomasochistic undertones of Hellraiser overall inspired me to write a sort of theme song for the character of Pinhead. The idea was to capture the heavy darkness and aggression of Hellraiser and translate that into music that would convey that same type of energy and power. Here you have ""Torture Chamber""...I hope you enjoy...",2016-11-08 17:45:06+00:00,d9rcfzf,1.0,t3_5buoa9,62.0,RedditOriginals
24,"Aaaaaah! I can't wait to see them live! I just think Industrial bands are the best type of bands to see live because the music is so different and dark and hypnotic and it just makes for an awesome experience to just let go and rock out to the music. Not saying other genres of music don't have that as well, but it seems like with most other kinds of music the crowd spends most of the time singing along with the band like it's a campfire singsong moment and recording everything on their phones and just letting the moment go to shit.",2016-11-08 15:59:54+00:00,d9r6wne,4.0,t1_d9qivto,47846.0,industrialmusic
25,"Well, there isn't a button, but posts like this can help you find new music. I'm not sure what kind of music you're into, but I make Industrial Metal if you'd like to check it out. Here's my bandcamp link &gt;&gt;&gt; http://funeralcasket.bandcamp.com ...I hope you like it :)",2016-11-08 00:29:28+00:00,d9qd19q,1.0,t3_59ctsr,1143249.0,BandCamp
26,I honestly think that 3TEETH would enjoy the fact that their music makes you feel dirty.,2016-11-08 00:19:03+00:00,d9qcl1j,2.0,t1_d9qce6t,270.0,industrialmusic
27,"The ""Hellrasier"" movies were a big inspiration for me when creating this track. The dark atmosphere of the films, the cyber-goth aesthetic of Pinhead and the sadomasochistic undertones of Hellraiser overall inspired me to write a sort of theme song for the character of Pinhead. The idea was to capture the heavy darkness and aggression of Hellraiser and translate that into music that would convey that same type of energy and power. Here you have ""Torture Chamber""...I hope you enjoy...",2016-11-08 00:18:31+00:00,d9qck7p,1.0,t3_5bpyms,16.0,mymusic
28,This...is...heavy! Super heavy! damn! The creepy ass video just adds to the overall aesthetic of the song. It's fucking awesome! The way that bass sits wide and distorted in the mix just makes the entire song feel like it's attacking your mind as you listen. Great post man!,2016-11-08 00:16:25+00:00,d9qch2i,1.0,t3_5bnzws,19428.0,doommetal
29,"The ""Hellrasier"" movies were a big inspiration for me when creating this track. The dark atmosphere of the films, the cyber-goth aesthetic of Pinhead and the sadomasochistic undertones of Hellraiser overall inspired me to write a sort of theme song for the character of Pinhead. The idea was to capture the heavy darkness and aggression of Hellraiser and translate that into music that would convey that same type of energy and power. Here you have ""Torture Chamber""...I hope you enjoy...",2016-11-07 23:44:28+00:00,d9qb34p,1.0,t3_5bprgy,174.0,mdmazingMusic
30,"The ""Hellrasier"" movies were a big inspiration for me when creating this track. The dark atmosphere of the films, the cyber-goth aesthetic of Pinhead and the sadomasochistic undertones of Hellraiser overall inspired me to write a sort of theme song for the character of Pinhead. The idea was to capture the heavy darkness and aggression of Hellraiser and translate that into music that would convey that same type of energy and power. Here you have ""Torture Chamber""...I hope you enjoy... ",2016-11-07 23:20:42+00:00,d9qa0nu,1.0,t3_5bpmxs,128.0,danktunes
31,"Sean Beavan who worked with NIN? Wow, now that should be epic!",2016-11-07 23:12:33+00:00,d9q9ncj,2.0,t1_d9pzn1e,12029.0,industrialmusic
32,"That's so cool! I haven't seen them live yet, but I can imagine that it's freaking amazing! Are they really heavy when they play live? I don't know why, but I just imagine them to sound REALLY heavy in a live setting, like Black Sabbath, but maybe heavier.",2016-11-07 23:06:18+00:00,d9q9czy,2.0,t1_d9q7r42,2098.0,industrialmusic
33,"The ""Hellrasier"" movies were a big inspiration for me when creating this track. The dark atmosphere of the films, the cyber-goth aesthetic of Pinhead and the sadomasochistic undertones of Hellraiser overall inspired me to write a sort of theme song for the character of Pinhead. The idea was to capture the heavy darkness and aggression of Hellraiser and translate that into music that would convey that same type of energy and power. Here you have ""Torture Chamber""...I hope you enjoy... ",2016-11-07 23:04:21+00:00,d9q99u0,1.0,t3_5bpjxi,41.0,allcore
34,"This track will be forever awesome! That groove and that bass is so classic. It also has that ""swing"" feel to it like a lot of Pantera records I've heard and Lemmy's voice is like a melodic growl turned on full blast. Great post!",2016-11-07 19:56:31+00:00,d9pzv9t,1.0,t3_58snpa,1414253.0,HardRock
35,"The ""Hellrasier"" movies were a big inspiration for me when creating this track. The dark atmosphere of the films, the cyber-goth aesthetic of Pinhead and the sadomasochistic undertones of Hellraiser overall inspired me to write a sort of theme song for the character of Pinhead. The idea was to capture the heavy darkness and aggression of Hellraiser and translate that into music that would convey that same type of energy and power. Here you have ""Torture Chamber""...I hope you enjoy... ",2016-11-07 19:46:21+00:00,d9pzclv,1.0,t3_5boc4i,26.0,SRSMusic
36,"The ""Hellrasier"" movies were a big inspiration for me when creating this track. The dark atmosphere of the films, the cyber-goth aesthetic of Pinhead and the sadomasochistic undertones of Hellraiser overall inspired me to write a sort of theme song for the character of Pinhead. The idea was to capture the heavy darkness and aggression of Hellraiser and translate that into music that would convey that same type of energy and power. Here you have ""Torture Chamber""...I hope you enjoy...",2016-11-07 19:32:01+00:00,d9pymk6,1.0,t3_5bo8vz,9.0,obscuremusic
37,"I don't know why, but I've always thought of Celldweller as an Electro/EDM artist. His tracks sound a lot like Wolfgang Gartner's earlier stuff and the times he does use E-Guitar it's always buried extremely deep into the mix and covered with Dubstep style synths and sounds. I don't know, maybe it's just me, I like his music, just never thought of it as ""Metal"". Cool song though",2016-11-07 19:28:27+00:00,d9pyg81,1.0,t3_59rhti,933166.0,industrialmetal
38,"The ""Hellrasier"" movies were a big inspiration for me when creating this track. The dark atmosphere of the films, the cyber-goth aesthetic of Pinhead and the sadomasochistic undertones of Hellraiser overall inspired me to write a sort of theme song for the character of Pinhead. The idea was to capture the heavy darkness and aggression of Hellraiser and translate that into music that would convey that same type of energy and power. Here you have ""Torture Chamber""...I hope you enjoy... ",2016-11-07 19:19:05+00:00,d9pxz7t,1.0,t3_5bo5xq,21.0,flocked
39,"I can see why now, it's really good. I agree the vocals are much better, probably because their just simply easier to hear in AW's version. I think Electric Wizard mixed their vocals a bit too low in the mix and that causes it to become muddy and lost in the song overall. I think I like AW's cover better too :)",2016-11-07 19:17:24+00:00,d9pxw6x,4.0,t1_d9pug6i,4046.0,doommetal
40,"The ""Hellrasier"" movies were a big inspiration for me when creating this track. The dark atmosphere of the films, the cyber-goth aesthetic of Pinhead and the sadomasochistic undertones of Hellraiser overall inspired me to write a sort of theme song for the character of Pinhead. The idea was to capture the heavy darkness and aggression of Hellraiser and translate that into music that would convey that same type of energy and power. Here you have ""Torture Chamber""...I hope you enjoy... ",2016-11-07 18:23:56+00:00,d9pv5yf,1.0,t3_5bnsi6,243.0,shareyourmusic
41,"I make Industrial Metal and some people actually classify it as Dark Electronic or even Industrial Dance and it pisses me off lol...but I guess because a genre like Industrial has so many elements in it, I can see why they would assume that...but it still pisses me off",2016-11-07 18:22:03+00:00,d9pv2jx,3.0,t1_d9phkw2,18203.0,doommetal
42,"That's because people usually think slow tempo = doom and that's NOT always the case. It's gets even harder when a band actually incorporates doom elements into their sound but change tempos and add elements of other genres too, so I guess I can understand a mistake in classification here and there",2016-11-07 18:15:46+00:00,d9puqx9,3.0,t1_d9phkw2,17826.0,doommetal
43,"I know it's stoner, but the flair had already been selected when I submitted it, I think I can change it...I think...or maybe it's sludge...well, Electric Wizard incorporate both sludge AND stoner...so I guess it really doesn't matter",2016-11-07 18:10:29+00:00,d9puh6p,4.0,t1_d9pu2p2,468.0,doommetal
44,"This is pretty cool. It has a real medieval/middle ages melodic sound to it. The recording is a bit lo-fi, but maybe that is the particular sound and feel the band was going for on this particular track. I don't think the lo-fi aspect takes away from the song too much, accept for the fact that the heaviness isn't really there because it's a bit lo-fi, but the track overall is good. I also like the singers approach with the low growling and then transitioning to harmonies back and forth, very cool. Thanks for sharing!",2016-11-07 18:06:19+00:00,d9pu9ek,1.0,t3_5bmx6l,7544.0,melodicdeathmetal
45,Some people are in fact triggered by the awesomeness that is Electric Wizard...,2016-11-07 17:58:50+00:00,d9ptvko,2.0,t1_d9pgxcl,18233.0,doommetal
46,"Hahaha yeah, seeing as Hellraiser is pretty much a sadomasochistic nightmare of destruction, I figure the art needed to display pain and torture in a sort of artistic way. A kind of ""Pain is Pleasure"" approach to the theme of the music.",2016-11-07 17:58:12+00:00,d9ptudz,4.0,t1_d9pbqlr,34909.0,industrialmetal
47,"The ""Hellrasier"" movies were a big inspiration for me when creating this track. The dark atmosphere of the films, the cyber-goth aesthetic of Pinhead and the sadomasochistic undertones of Hellraiser overall inspired me to write a sort of theme song for the character of Pinhead. The idea was to capture the heavy darkness and aggression of Hellraiser and translate that into music that would convey that same type of energy and power. Here you have ""Torture Chamber""...I hope you enjoy...",2016-11-07 17:55:35+00:00,d9ptplj,1.0,t3_5bnmwh,20.0,treemusic
48,"Honestly, I was extremely skeptical about hearing an acoustic version of a doom song, but I was pleasantly surprised at how heavy this cover actually is! Wow! The distant sounding vocals, the super wide and heavy guitars. They even manage to create a sort or rumbling bass with just an acoustic guitar, that's amazing! Thanks a lot for recommending this, it's wicked!",2016-11-07 17:44:24+00:00,d9pt4q6,2.0,t1_d9p9298,41344.0,doommetal
49,"The ""Hellrasier"" movies were a big inspiration for me when creating this track. The dark atmosphere of the films, the cyber-goth aesthetic of Pinhead and the sadomasochistic undertones of Hellraiser overall inspired me to write a sort of theme song for the character of Pinhead. The idea was to capture the heavy darkness and aggression of Hellraiser and translate that into music that would convey that same type of energy and power. Here you have ""Torture Chamber""...I hope you enjoy...",2016-11-07 17:28:35+00:00,d9psbw0,1.0,t3_5bjejm,58011.0,indie
50,"The ""Hellrasier"" movies were a big inspiration for me when creating this track. The dark atmosphere of the films, the cyber-goth aesthetic of Pinhead and the sadomasochistic undertones of Hellraiser overall inspired me to write a sort of theme song for the character of Pinhead. The idea was to capture the heavy darkness and aggression of Hellraiser and translate that into music that would convey that same type of energy and power. Here you have ""Torture Chamber""...I hope you enjoy...",2016-11-07 17:28:05+00:00,d9psazh,1.0,t3_5bj6bz,60656.0,indieheads
51,"The ""Hellrasier"" movies were a big inspiration for me when creating this track. The dark atmosphere of the films, the cyber-goth aesthetic of Pinhead and the sadomasochistic undertones of Hellraiser overall inspired me to write a sort of theme song for the character of Pinhead. The idea was to capture the heavy darkness and aggression of Hellraiser and translate that into music that would convey that same type of energy and power. Here you have ""Torture Chamber""...I hope you enjoy...",2016-11-07 17:27:40+00:00,d9psa75,1.0,t3_5bj2qk,61794.0,INTPmusic
