,body,created,id,nest_level,parent_id,reply_delay,subreddit
371,"holy shit!!! wow, this is insane!!! this sounds like it was designed to literally melt your brain and leave you in a pile of confused death. i freaking love this! the lack of melody and just constant bass assault is unreal, but it's what makes the track really unique.

my only complaint would be that bass seemed to lessen the impact of the drum slightly, i don't know if that's more of a sidechain issue or just the fact that the bass is purely demonic and just wants to rule the entire mix lol.

demonic dubstep what be what i'd classify this as. very, very awesome!",2016-08-21 05:09:46+00:00,d6qa73d,1.0,t3_4tr0s0,2736417.0,filth
372,"this sounds very jazz influenced, but yet very R&amp;B soul at the same time. the smooth intro is extremely relaxing and the i like the way the drums just sort of pop and join the jam without the main melody missing a single beat. 

the entire track actually sounds like one cool jam session especially with the free form keys/Rhodes playing around 1:34. even though it all sounds very spur of the moment, it comes together so well.

very cool!",2016-08-21 04:57:22+00:00,d6q9tqq,1.0,t3_4ynw60,76766.0,futurepopmusic
373,"this is incredible! i love the reggae vibes all over this track, as well as the really alien-like synth growls. it's like a really, really, really chill version of a dubstep track, and with way more emotion. the track feels like a literal travel through space with the really wide mix and distant sounds creeping in and out of the song.

i like the fact that the mix is so toned down and almost feels as if it's moving away from you instead of trying to smash your head in with bass. speaking of bass, the sub bass in this track is mixed in perfectly, it has a solid spot in the middle of the mix that gives it a real presence without being over dramatic and trying to mimic a hip hop or trap style bass. the bass in this mix almost acts like a vessel carrying you through the adventure that is the song.

great post, thanks for sharing!",2016-08-21 04:52:39+00:00,d6q9obk,1.0,t3_4xe4j0,738863.0,experimental
374,"yeah, it was crazy",2016-08-20 19:00:22+00:00,d6poayf,6.0,t1_d6pnsyd,804.0,Cyberpunk_Music
375,"the intro is very cool. it's really dark, almost gothic in some places. i think the use of the piano and synth together is what makes it sound so huge and wide, and it's a combo i rarely hear in complextro. 

that drop is pretty bad ass as well. i thought it was going to drop into some bass madness, but instead it kept the groove going and dropped into an almost NuDisco style melodic bounce. to me, it sounds like a much wider version of a Madeon track. Madeon's tracks are very melodic, and with pop melodies you want to hear how all the instruments work with eachother, but some of his tracks sound really close together and the harmonies almost bleed into one another, this mix sounds really spacious and you're able to hear every single aspect of every instrument. very well done!

i think prefekt would be an amazing electropop producer. the mixes are so clean, they're perfect for vocals.

awesome track!",2016-08-20 18:51:51+00:00,d6pnzmz,1.0,t3_4xtny1,449618.0,Complextro
376,"such a hard drum intro! and it's awesomely groovy too! the melodic structure of the track is pretty solid, i like the consistent bass throughout. it seems to hold everything together. it reminds me a lot of wolgang gartner, especially with the super thick drums and heavy use of the bass synth for the main part of the melody.

i don't know if it's a synth, or digital saxophone sound, but whatever it is, the melody that comes in at 1:59 is my favorite. it reminds me of a guitar, but it has a real sax feel to it.

overall, very, very cool track, and excellent work on the drum mix!",2016-08-20 18:44:36+00:00,d6pnppi,1.0,t3_4ylbl0,77533.0,Complextro
377,"**Funeral Casket - *Organ Grinder* [Electro Glitch]** 
**https://funeralcasket.bandcamp.com/track/organ-grinder** 

this is my latest release titled **""*Organ Grinder*""**. It's a bit electro, and a bit glitch which is basically my style. i release music pretty regularly, so if you want to check out my other work, just stop by my bandcamp page &gt;&gt;&gt; **http://funeralcasket.bandcamp.com** ",2016-08-20 18:21:22+00:00,d6pmtie,1.0,t3_4yfpvh,151943.0,experimentalmusic
378,"sorry about that. there was an issue with the track because it contained a clip from ""rosemary's baby"" and there was a copyright complaint filed by Paramount Pictures, so we had to remove the track from my back catalogue. that's pretty much why most of my earlier releases were removed. the companies either want full rights to the music, publishing, and streaming royalties, or they want you to remove the tracks all together. 

it was all removed from my spotify, itunes, tidal profiles, etc. really sorry about that.
",2016-08-20 18:08:46+00:00,d6pmc0h,4.0,t1_d6pj9fg,4866.0,Cyberpunk_Music
379,"**Funeral Casket - *Organ Grinder* [Electro Glitch]** 
**https://funeralcasket.bandcamp.com/track/organ-grinder** 

this is my latest release titled **""*Organ Grinder*""**. It's a bit electro, and a bit glitch which is basically my style. i release music pretty regularly, so if you want to check out my other work, just stop by my bandcamp page &gt;&gt;&gt; **http://funeralcasket.bandcamp.com** ",2016-08-20 16:54:47+00:00,d6pjjbf,1.0,t3_4xr3t4,489161.0,listentothis
380,"i have to agree with you. i mean, justice was literally the reason why i started producing myself, and i've always loved their original sound, like on the Cross album. it seems that when they made Audio Video Disco, they continued to move in a more rock/disco direction. i initially thought it was just for that album, but with the release of this track, i see that they went full on 70's disco, just like daft punk.

the production is really, really clean, which is different for justice, but i guess that's the direction they're going in now. guess we may have to get used it, although it's a bit hard :/",2016-08-20 16:37:04+00:00,d6piupr,,t1_d5mqya0,,frenchelectro
381,which track? i can totally help you with that :),2016-08-20 16:25:08+00:00,d6pie2h,2.0,t1_d6phqev,1046.0,Cyberpunk_Music
382,"wow, this sounds so clean. like seriously, the mix has so much space in it, it's awesome. that bass literally cuts down the middle with no problem, and it makes everything sound extra wide and groovy. 

1:28 is a blast from the past with that classic house drop, if i can use the word ""drop"". the sub bass is a nice touch as well, it holds the low end perfectly allowing the main melody to really have a strong impact.

another thing i really like about the track is the simplicity of it. it doesn't use that many sounds as far as melody, but more so uses the percussive sounds to give it that bouncy, moving along vibe. kind of reminds of jackin' house with it's infectious groove.

great work, and great mix! thanks for sharing :)",2016-08-20 05:14:49+00:00,d6p2l9g,1.0,t3_4yjexr,51005.0,electrohouse
383,"even though the video is slightly silly, which i like, the song is really good. it has a really strong political tone throughout which is awesome. i know it's probably meant to be satire, but most songs that try to be political often have a gimmicky feel to them, but this actually reminds me of one of those political songs from the 60's. it's literally the perfect troll song for donald trump lol. ",2016-08-20 05:08:34+00:00,d6p2f7a,1.0,t3_4ym5cx,18494.0,independentmusic
384,"that intro harmony is amazing! it sounds like the intro to an R&amp;B song. very smooth and very vintage sounding. i don't hear too many tracks utilize strings this good, so i'm pretty muched hooked already! 

the actual drum pattern is interesting. it's experimental, but at the same time very industrial sounding, and oddly trap sounding as well. although it may sound trap due to the slow tempo. i really like the effects added to the drums as well. it makes them sound really mechanical and almost like a bunch of machines buzzing and clicking and moving all at once.

after a while, the strings kinda just float into the background and it starts to sound really eerie, and cold especially around 2:24 when everything seems to just melt into one another.

overall, very cool track. i like to hear new music that really pushes sound and conventional ways to song structure to their limits. thanks for posting!",2016-08-20 04:59:45+00:00,d6p266u,1.0,t3_4yahnx,171574.0,glitch
385,"when i first heard about this collaboration i was kind of skeptical, but it's pretty cool. especially if you listen to it as it's own separate track instead of listening to it and comparing it with mr. oizo's previous work. it's definitely much more ""dance"" than experimental like mr. oizo's normal sound, but as a track by itself, it's pretty cool.

the james brown sample makes it sound a bit more hip hop than i personally like, but it keeps the energy up. around 2:29 the beat sounds really retro house with that funky bass synth. i don't know why, but that vocal saying ""end of the world"" is a bit creepy and kind of gets annoying after a while, and it reminds me A LOT of the vocal Porter Robinson used in ""Sad Machine""...i don't know, it just sounds similar.

anyway, i like this track for what it is. it's catchy, and not too typical of the current EDM sound :)",2016-08-19 22:56:37+00:00,d6op2q9,1.0,t3_4ykro8,12558.0,futurebeats
386,no problem! just keep creating awesome tracks like that! :),2016-08-19 19:59:20+00:00,d6oh60x,3.0,t1_d6offwj,2189.0,bassheavy
387,"well, honestly, you're doing a great job using the technology. it's rare that people these days create music that pushes boundaries and forces people to think and enjoy the actual experience of new sounds. most of the time, the same old formula is given to music, just to ensure that an audience will like it. recycle bin music lol",2016-08-19 19:19:45+00:00,d6ofapa,1.0,t3_4unqbh,2110431.0,glitch
388,"comments: 

#1: https://www.reddit.com/r/ratemyband/comments/4xm2mi/wing_of_the_praetor_spacemetal/d6nf9ng

#2: https://www.reddit.com/r/ratemyband/comments/4swmtq/downtempo_hip_hop_instrumental/d6nfs5d

#3: https://www.reddit.com/r/ratemyband/comments/4x77x1/new_fuzz_pop_song_i_made_what_do_you_think/d6ng8op",2016-08-19 01:54:05+00:00,d6nhw8n,1.0,t3_4yg7gq,79.0,ratemyband
389,"wow! this has a really heavy 60's psychedelic vibe to it! especially the vocals. the vocal sounds sad, almost in pain, and slightly angry, almost like a punk rock vocal but more controlled. the vocal effects are amazing too. my favorite is the vocal effect around 1:38, it sounds like a broken, mid 50's p.a. system in a high school gym.

the mix of the track is pretty solid as well, especially with all the distortion and effects. you'd think at some points it would be too much on the ears, but the track never gets too bright on the high's or muddy on the lows. my only complaint would be that the bass guitar is very low. a little too low at times, i mean it adds a really vintage aesthetic to the track, but hearing the bass guitar a bit louder would be great too.

the percussion mix is also well done. a lot of beatles songs that used this similar dance-pop drum style would have a really faint sounding or washed out drum sound and really overdone guitars. this track uses that same drum style, but really allows the drums to be heard and actually gives the drums room to move around and add cool fills that can actually be heard rather than sounding like distant mistakes or skips in the drum track.

overall, really great track. i think i'm bias though, i love anything with distortion and that sounds vintage :)

and the extra ""yeah...wooh!"" at the very end was awesome lol. ",2016-08-19 01:13:15+00:00,d6ng8op,1.0,t3_4x77x1,660922.0,ratemyband
390,"i actually enjoyed this more than i thought i would, seeing as i don't listen to a lot of hip hop music. the rhodes sound really pulls you in. reminds me of a lot of early 90's R&amp;B soul. 

i think, maybe, the bass is sitting a little too far back into the mix, it doesn't really dominate the way you'd expect it too, which kind of leaves the keys/rhodes to sound really loud almost overtaking the mix. i think maybe if the bass guitar was turned up and the keys turned down slightly it would sound ""thicker"" overall, like more lush.

my favorite part of the track is definitely the drums, they sound very, very clean. especially that snare drum. the attack on the snare drum is super crispy!  and you mixed the high hat, and shaker perfectly! they both sound as if they're being played by hand, with just the right amount of velocity.

overall, this is really awesome and really chill. if someone were to sing over it, i would hope they would do a light harmony, sort of like a vocal warmup, rather than just flat out sing, i think lyrics may actually hurt the vibe of the track, but a light vocal floating in the background would be perfect!",2016-08-19 01:02:10+00:00,d6nfs5d,1.0,t3_4swmtq,3024740.0,ratemyband
391,"that riff at 0:50 is amazing. just the right amount of fuzz and distortion gives it a real gritty feel, but still very melodic sounding all while being heavy! the black sabbath comparison is pretty spot on in my opinion, especially the way the guitar and bass melt together to create that ""wall of sound"" effect. it's like one giant dark cloud of melodic death hovering overhead, very cool. 

as for the vocals, the vocal style reminds me a lot of Geddy Lee, with the higher upper register. it really cuts through the sound, but doesn't sound to overdone or forced. the mix of the entire song is excellent as well, i don't hear too many rock style songs mixed as well as an electronic music track. this track is really mixed extremely well, with the guitars separated to allow that percussion to slam down the middle, great work, and very, very cool song!",2016-08-19 00:49:46+00:00,d6nf9ng,1.0,t3_4xm2mi,429219.0,ratemyband
392,"i've never heard of hudson mohawke until this post, i like this a lot. it's really a creative way to use sounds not so much in a straight melodic way, but more just matching tones and creating a very awkward, wonky style melody. very cool. it reminds me a lot of hot sugar and the work he does with sounds. he uses actual sounds like birds chirping and water running and fireworks popping, but he structures his tracks in the same way to create these wonky, off beat style melodies, it's really dope.

thanks for posting this!",2016-08-18 17:35:49+00:00,d6mv8np,1.0,t3_4y48mv,124448.0,bassheavy
393,"very, very, very cool! the width of the track is amazing! it's almost like complete atmosphere with an 808 just bouncing around the empty space. even the snare sounds like it's far away, like a crack of distance thunder. the overall mix of the track is really good as well, nothing is too harsh on the ears, and the occasional vocal samples fit really well into the flow of the track. very impressive work, thanks for sharing!",2016-08-18 17:28:58+00:00,d6muwaw,1.0,t3_4wt32l,843598.0,bassheavy
394,"wow, this is epic!",2016-08-18 17:16:40+00:00,d6mu9qa,,t1_d6fudnh,,audioinsurrection
395,"this is incredibly powerful, seriously! the music compliments the speech perfectly! it's not too overbearing, but still emotional enough to really pull you in. the piano melody was a perfect touch. i literally watched this like 14 times. so freaking awesome! thanks for posting!!!",2016-08-18 17:16:03+00:00,d6mu8k0,1.0,t3_4xgdcr,497711.0,audioinsurrection
396,"i like this, the concept behind it is meant to shine a bright light on a certain type of injustice. although i don't agree with the direct call to war, i can see why such anger is harbored. the line saying ""no more sharpton"" is pretty much the truest thing i've ever heard. seems like wherever al sharpton is, there is bound to be some sort of absolute fuckery afoot.",2016-08-18 17:11:18+00:00,d6mtzvl,1.0,t3_4ulh6q,2052539.0,audioinsurrection
397,"thanks! I really appreciate that. My style of electro seems to be a bit rougher and more distorted than the mainstream stuff I hear today, but I just enjoy working with more lo-fi sounds and various instruments outside of just synths. Thanks for listening :)",2016-08-18 11:09:56+00:00,d6mfy03,2.0,t1_d6mdxzq,6615.0,WhiteLabels
398,...brown haired?...brunette?...although some people call any dark hair brunette lol...their hair is just lighter than black lol,2016-08-18 10:35:39+00:00,d6mf9yo,3.0,t1_d6mbu20,11577.0,EdBangerRecords
399,"...my mom is set on believing that Justice is daft punk without the helmets. I've shown her pics of daft punk prior to their robot phase, but she still won't go for it. She's stuck on the fact that both Justice and daft punk have a tall guy and a short guy...and both tall guys are blonde and both short guys have dark hair...at this point arguing her down is a losing battle lol",2016-08-18 06:10:22+00:00,d6ma8m5,1.0,t3_4xl2nq,377289.0,EdBangerRecords
400,"...good question...everytime i listen to the ""it takes two"" remake, I'm like who the heck is this girl?...another ed banger mystery...",2016-08-18 06:04:53+00:00,d6ma3v1,1.0,t3_4y1qdo,120199.0,EdBangerRecords
401,lol thanks for taking a moment to check it out. i have lots more music coming up!,2016-08-18 04:12:54+00:00,d6m6yzl,2.0,t1_d6m5p3w,2257.0,ThisIsOurMusic
402,i only have twitter and bandcamp. it keeps things simple for me...my twitter is @funeralcasket,2016-08-18 00:18:37+00:00,d6ly0ce,4.0,t1_d6lxsh5,328.0,Songwriters
403,"wow! this looks like a scene out of a godzilla movie. that extreme haze caused by the dust in the air is pretty creepy as well...it gives the impression that carnage is not over and there more destruction to come. very awesome photo with a very horrific history behind it.

the 2nd image literally looks like some kind of demonic force being summoned about to wreck havoc on the already terrified citizens...",2016-08-18 00:14:45+00:00,d6lxuri,1.0,t3_4y5en1,40739.0,UrbanHell
404,"black is such a calming color, i agree. being calm is being happy, to me. i think because black is void of light it allows the eyes and the mind to rest while looking at it. basically, black is my favorite color.",2016-08-18 00:06:01+00:00,d6lxi6o,1.0,t3_4xammh,525174.0,goth
405,"this reminds me of a lot of those EDM cover art photos from spinnin records and revealed recordings and stuff. very cool, especially with the colored lights, and the expanded reflections on the water.",2016-08-17 23:59:54+00:00,d6lx9co,1.0,t3_4xw0xd,180734.0,skylineporn
406,Hahaha! Yessss! Thank YOU for taking the time out to give it a listen :),2016-08-17 22:50:07+00:00,d6lud09,2.0,t1_d6lsfvz,2706.0,Songwriters
407,lol well said,2016-08-17 21:41:10+00:00,d6lrd59,5.0,t1_d6lqi7p,1096.0,VillagePorn
408,"i agree, i made a post about that in a general discussion reddit and people didn't seem to care. i think the downvote option is hurting the site. either upvote or don't vote at all and be forced to leave a comment about why you dislike a particular post. it's simple, really. reddit doesn't seem to think so though.",2016-08-17 21:19:27+00:00,d6lqc79,3.0,t1_d6lpora,806.0,VillagePorn
409,"i like this a lot. the gray houses look so cold against the picturesque water in the background. to me, the houses almost represent some sort of depression blocking you from being happy, which is represented by the beach and water just behind the wall of depression. such a simple photo, but the colors and position of the houses, especially the house in the lower left that's facing away from the water completely, tell a story.",2016-08-17 20:45:13+00:00,d6lonco,1.0,t3_4wmdkf,867447.0,VillagePorn
410,yessss!,2016-08-17 20:26:10+00:00,d6lnonk,3.0,t1_d6ljved,4455.0,EdBangerRecords
411,"thanks a lot. working with the organ sound wasn't as easy as i thought it would be, but i'm pretty satisfied with the end result. sometimes the organ can sound as heavy as a synth bass line, so it was just a matter of removing a little of the organ's low frequency.

anyway, thanks again for taking a moment to check it out :)",2016-08-17 19:10:22+00:00,d6ljsfh,2.0,t1_d6lifmt,1538.0,glitch
412,"sebastiAn is such an incredible producer! each cut and sample comes together perfectly to make a distorted electro mash of awesomeness! this song makes me think about an epic battle between to bad ass robots on the golden gate bridge at sunset while the citizens look in awe as the unstoppable carnage unfolds before their unworthy eyes.

i've been a fan of ed banger for a while. the label is literally the reason i started making music myself, and tracks like this prove why ed banger will be forever awesome!",2016-08-17 18:19:07+00:00,d6lh2uh,1.0,t3_4xr8wt,232995.0,EdBangerRecords
413,"the intro alone pulled me into this! it sounds like an epic distorted thunderstorm and then instantly transitions into a bad ass 80's action movie theme. it reminds me a lot of something you'd hear in the original Robocop film, or maybe Escape From L.A. it has an atmospheric element to it, but the synthwave/retrowave vibes are very strong. really, really cool production and excellent in capturing the nostalgia of retro electronic music!",2016-08-17 18:06:57+00:00,d6lggax,1.0,t3_4vtj83,1299591.0,frenchelectro
414,"this is ridiculously awesome!!! the original song is so intense, but this is really chill, almost relaxing, but it's spot on with the original as far as perfect sound and execution of every aspect of the original song. are there anymore linkin park 8-bit covers? this is amazing, i'd like to hear more if there are. thanks for sharing!",2016-08-17 18:02:01+00:00,d6lg75r,1.0,t3_4x55nd,584105.0,8bit
415,"wow, thanks a lot! this is my first time working with the organ sounds. it's such a heavy sound with a lot of air behind it which made mixing it sort of difficult, but i think i worked out a good space for it in the mix. thanks again for taking the time to check it out :)",2016-08-17 17:55:07+00:00,d6lfuav,2.0,t1_d6le9nw,1817.0,frenchelectro
416,"thanks a lot. I'm really particular about chopping up sounds in a very specific way and this one took a few days to grow on me, as I didn't think my chops were tight enough, but I like it now. Thanks for taking a moment to listen to it :)",2016-08-17 06:51:23+00:00,d6ku3vl,2.0,t1_d6kr7zp,6808.0,WhiteLabels
417,that melody is awesome! it's really energetic and the way the bass mimics an arp the whole way through really makes the track feel like it's moving at 100mph down the highway at night. that snare drum sounds classic 80's all the way lol. another great track man!,2016-08-17 01:30:29+00:00,d6kjqo7,5.0,t1_d6kj4d4,917.0,BandCamp
418,going to check it out now! your work is really cool!,2016-08-16 22:53:32+00:00,d6kddeu,3.0,t1_d6kd7h2,232.0,BandCamp
419,the souls of the damned emerge from a giant structure made out of human bones as massive pools of mercury bubble below...hell has been unleashed...no one is safe...,2016-08-16 22:28:41+00:00,d6kcbs3,1.0,t3_4xobnr,201365.0,ImaginaryLandscapes
420,"i love this kind of art. i don't make glitch art, but i love the whole concept behind the art itself, it's random, but it always comes out telling a story. well, maybe that's just the way i look at the art.

i keep looking over my right shoulder because the eyes in the pic seem to be looking at something just behind me. it's eerie, and i guess that's why i like it so much. great work!",2016-08-16 22:17:16+00:00,d6kbuq2,1.0,t3_4y1k93,7753.0,glitch_art
421,"those drums in the beginning are amazing! i could just listen to that on a loop for hours. the vocals are kind of muddy though, like a bit washed out, or lost in the beat, and it makes it hard to understand the lyrics fully. the melody of the vocals is pretty great though. i guess in a way, the vocals being lost in the beat kind of add to it, almost like an additional synth over top of the main background synth pad. 

i listened to it a few times and i actually enjoy it overall. it's soothing. reminds me a lot of something ENYA would make. other than the vocal mixing, it's a really good track. thanks for sharing.",2016-08-16 22:11:13+00:00,d6kblkt,1.0,t3_4wtsjq,676707.0,BandCamp
422,"great tune. i don't listen to much chillwave, so rather than compare it to other tracks i've listened to i can just talk about what i like about the production overall. 

the 8-bit style synth that comes in around 0:33 is so cool. it's like something out of a sega genesis game or something. the drum programming has a synthwave style feel to it. minimal, but driving along endlessly to create an awesome groove. the whole track is mixed very well too, not too aggressive, but it really makes you nod your head the whole time while listening. i actually wish the track was longer though...it's like right when i'm getting into it, it fades out lol...and i'm like OMFG!...more!

anyway, great production and great track. can't wait to hear more :)",2016-08-16 22:07:58+00:00,d6kbgne,1.0,t3_4xhxcv,316238.0,BandCamp
423,"this sounds as if it was inspired by phil collins ""in the air tonight"". especially with the jungle/ethnic percussion and the slightly dark melody. if you remove the vocals, it would be the perfect ambient/chill track. i mean, i absolutely love the vocals on the track, but it's so well produced that the beat could stand alone on it's own too. really cool song though, thanks for posting!",2016-08-16 18:57:35+00:00,d6k2kfr,1.0,t3_4xi5j4,299827.0,Electropop
424,"that kick drum is so heavy, wow! i listen to a lot of house music and i haven't heard a kick drum that heavy since daft punk's ""da funk"". seriously awesome! the vintage video adds a different vibe to the track, i guess more in an artistic way rather than a literal way. the hip hop references clips kind of make the song feel a little more gritty and underground while watching the video. i like it.",2016-08-16 18:52:33+00:00,d6k2bco,1.0,t3_4xzdhn,20949.0,House
