,body,created,id,nest_level,parent_id,reply_delay,subreddit
142,"This is very, very cool. Sounds really inspired by the blues and a bit of funk. That slow, almost sludge-like groove just barely moving along is awesome! It has sort of a hiphop vibe, but much more free in the playing, and not as rigid and tight. 

This actually reminds me a lot of one of those slow 70's psychedelic rock jams that you'd probably hear playing from some random apartment at the end of the block, mid-day, with a bunch of people inside tripping on acid lol. It's pretty cool.

The bass is definitely king on this track. When the bass guitar comes in at 0:32, it's like a giant groove machine starting up and bulldozing forward destroying everything in it's way and allowing the guitars to just cover everything else in beautiful distortion! The best part is definitely the bass &amp; drum solo from 2:00 onward. That vibe is filthy and edgy as fuck!

I actually wish this track was a bit longer, maybe allowing for the guitars to have their moment to shine and play a few badass riffs before breaking down into that bass/drum solo, but the track is still cool nonetheless.

Very creative, especially to have such few and repetitive lyrics. I think that's what makes the track stand out so much. It's simple, but still so good.

Great post!",2016-09-26 20:08:28+00:00,d833p2h,1.0,t3_54mfop,2058.0,independentmusic
143,"The melody on this is incredible! The arrangement sounds like something I'd hear on an awesome synthpop track with the very tight groove and wide harmonies throughout the track. It's very cool to hear a melodic structure like this in alternative rock. I think it creates an opportunity for more people to get into the music, because it appeals to both the alt rock community and the more pop oriented fans as well.

The bass guitar quietly holds the melody together and helps to create that strong dance-style rhythm, but doesn't overpower the mix to the point where it sounds like a wannabe funk song. The bass also fits extremely well with the drums, as they seem to work together and push the record with a really strong groove, which I love. It's really well done, from a mixing standpoint, as far as the bass and drums are concerned.

My only critique would be the vocals. Not they way they're recorded, but more so, the vocal's position in the mix. At times it seems to fall under the groove and fade into the background making it a bit hard to understand the lyrics. At first I thought it may be an issue with the bass and drum groove getting in the way, but I think it's just the vocal being a bit too low in the mix and as the harmony builds over the course of the song, the vocals get a bit lost in it all. On the other hand, it does add a real indie quality to the recording and the vocals actually start to act as a synth filling out the melody even more, but the singers voice sounds pretty good, so I'm sure you'd want the lyrics to be heard nice and clear. Maybe turning the vocals up a bit may help.

The flow and arrangement of the track is my favorite for sure. I like the tempo changes and the highs and lows of the vocals working with the strong and quiet parts of the melody. It creates a sense of real emotion and allows the listener to really get into the song and feel driven by the music, instead of feeling like they've just listened to a typical digital, heavily compressed, and overplayed radio single. Very nice work on putting together an arrangement that feels genuine and sounds very dynamic.

Overall, this is an amazingly well written piece of music, with an extremely catchy melody and great dance vibe, which as I said before, is awesome for an alternative rock track.

Great work! Thanks for sharing!

- Funeral Casket

http://funeralcasket.bandcamp.com",2016-09-26 19:47:23+00:00,d832o5z,1.0,t3_54lxqq,6398.0,ratemyband
144,"That's actually a good idea. There is something similar to that being done in the /r/ListenToThis sub. It's a weekly thing, sort of like what we're trying to do here, but limited to new artists posts only. 

My only concern would be, do you think that would slow down the amount of music posts we receive? I mean, are people willing to share music of other artists they enjoy?",2016-09-26 19:31:52+00:00,d831wxj,2.0,t1_d82wrtk,6463.0,independentmusic
145,Haha! Hello!,2016-09-26 19:28:36+00:00,d831ra5,2.0,t1_d82wqo1,6305.0,independentmusic
146,"Wow thanks! I really appreciate the feedback! It's always been difficult for me to find a way to blend my love of Metal and Electronic music together than didn't sound cheesy, to me lol.

I figured I just have to keep things the way I like them and not worry to much about what sounds cool in either genre. Just take what I like best about both genres and make something all my own. So I'm really glad that others enjoy it as well, it means a lot!",2016-09-26 17:29:49+00:00,d82w357,2.0,t1_d82q9e1,7354.0,ratemyband
147,"I believe Jon Lord did say that in an interview, now that you mention it. I still find it a bit odd though, because Vanilla Fudge wasn't really that original, but I guess Deep Purple loved the melodic, slightly hard edge that Vanilla Fudge had. Nonetheless, I think both were extremely cool bands, I just now know that one influenced the other. Deep Purple just seemed to eventually find their own way and create, in my opinion, some legendary music.",2016-09-26 15:33:40+00:00,d82qk35,9.0,t1_d82q80l,436.0,indieheads
148,"It's funny you mention Vanilla Fudge and Purple sounding like a rip-off of them, when Vanilla Fudge, in my opinion, are only remembered for their remakes of other people's songs. ""Keep Me Hangin' On"", one of their biggest hits, was a remake of a Supremes song. Don't get me wrong, I love Vanilla Fudge, but everything they did seemed to be direct influence of what was being done at Motown and R&amp;B/Funk styled music. 

Tim Bogert, and Carmine Appice even continued doing covers in their own little side project 'Cactus', later on. They played Stevie Wonder covers a lot, it's all really cool. I'm not sure if Deep Purple did any covers, maybe they did, but Vanilla Fudge sure did.",2016-09-26 15:16:06+00:00,d82pqua,7.0,t1_d82ftx5,20126.0,indieheads
149,"Just something I like to do...

Maybe our idea of ""breaking barriers musically"" is a bit different, which is ok, but to me, Deep Purple were one of the few original bands bringing a heavy, more groove type of sound to the mainstream. Child In Time is classic. In Rock, in my opinion, is  a pretty great album overall. Being a producer myself, I look at the music in terms of what did it bring to the table sonically, or experimentally that wasn't being done already during that time? That being said, I think Jon Lord rocking a giant hammond organ on stage like it was a guitar and totally adding a new, distorted element to rock music, at the time, was pretty innovative, and Blackmore's playing was creative to say the least. ",2016-09-26 15:05:50+00:00,d82pa08,6.0,t1_d82ez0b,22833.0,indieheads
150,"...usually, I put my name and my link...just something I feel like doing...",2016-09-26 07:20:29+00:00,d82djpn,4.0,t1_d82ciiu,3141.0,indieheads
151,Ok. Thanks.,2016-09-26 03:29:00+00:00,d827oc4,8.0,t1_d826zjq,1168.0,numetal
152,"I will not argue with the fact that I promote my work in many of the subs that I feel that it applies to. As an indie musician, this is how I spread my work as well as connect with many musicians for collaboration, and my feedback that I give to other musicians is what helped me become a Mod in a sub that I liked to critique other people's work in. Again, I will not argue the fact that I may post my work in quite a bit in the subs that I feel it applies to, NOT every single sub on Reddit, c'mon man.

I'm not on reddit to cause trouble or fight with people who clearly enjoy music like me and just want to connect with like-minded people. I will admit when and if I am wrong, but at first this just felt like an attack out of nowhere. The Mods seem to be ok with my posts as I feel as though my style meets both NuMetal and Electronic music criteria, maybe you feel differently, which is your opinion and right to feel that way, but if I were you, I wouldn't try to stop people from getting their music out there, just because it makes you upset, that's not cool man.",2016-09-26 02:25:35+00:00,d825a5l,6.0,t1_d8251wh,355.0,numetal
153,"I'm sorry you think that's why I created my account, although, if you LOOKED at my account you would see I like to provide feedback on other creators music A LOT, as well as get involved in numerous musical discussions/debates. I've maintained an equal balance of both promoting my own work and being an active member on Reddit. I'm a bit confused by this clear attack out of nowhere, as it now has become not about NuMetal, which incorporates lots of other styles of music, and now it's about my activity on Reddit as a whole? Wow. I apologize if I have somehow offended you with MY Reddit account?",2016-09-26 02:17:09+00:00,d824ybo,4.0,t1_d824lj6,536.0,numetal
154,"Me too. NuMetal was literally the soundtrack to my childhood. It helped me get out a lot of aggression, and even helped me concentrate at times, I can't hate any of it, especially LP. Great dudes, and badass tunes!

- Funeral Casket",2016-09-26 01:53:43+00:00,d8240z1,3.0,t1_d81sqdy,16515.0,numetal
155,"What's with the downvotes? Linkin Park is really good at what they do, and I've always been unsure why people just ""love"" to hate them. I'm starting to think some people think you have to hate Linkin Park, so they do so without even having a legit reason as to why, it's pretty lame...and very weird.

Anyway, their music is awesome and has inspired me to create in many ways. There's already hate against NuMetal from a lot of outsiders, so why have more hate within the community as well? Kinda counterproductive, don't ya think?

- Funeral Casket",2016-09-26 01:52:09+00:00,d823ypk,1.0,t3_54h6fa,16605.0,numetal
156,"This is extremely random and extremely hostile for some reason? Have we spoken before? I just want to know why your comment comes off so rude. I have been instructed that I've posted in the wrong reddit before by moderators. I am a Moderator myself of /r/independentmusic, and I, or any of the Mods I know have ever taken such a blatant, out of nowhere, rude approach such as you've decided to take just now. I'm actually very active on Reddit besides just posting my own work. I'm unsure why you chose to just randomly attack MY work in particular, but ok.",2016-09-26 01:45:39+00:00,d823p7p,2.0,t1_d822qyb,1396.0,numetal
157,"This sounds so classic. From the kick drum to that snap/clap sounding snare. It sounds like the kind of beat that you could just turn on and play on repeat while driving down the highway at night.

I don't listen to much hiphop personally, but I could hear someone like Nas maybe rapping on this, or even Mac Miller. They both have pretty laid back flow styles and would fit perfectly on a beat like this, in my opinion.

The mix is very well done, and really has a warm retro feel. I think the thing that makes it sound so cool, is the way the rhodes/electric piano pans back and forth from left to right, giving it that classic vinyl stereo feel. Also the timing of the groove with the kick drum doubling up on the back beat is really creative and gives it that head nod quality. I'm literally nodding my head while typing this lol, very cool!

I don't know if you put a filter on the snare/clap/snap but if so, that was a great idea. It helps the snare fit snug down into the groove instead of it trying to balance out the groove if it were actually hitting hard and riding on top of the mix like most instrumental tracks.

The only critique I have, would be maybe to turn down the crowd/vocal fx a bit. At times they seem to overpower the groove and get in the way a little bit, but not so much that it ruins the track overall, they just break up the groove sometimes, and without lyrics you want that groove to flow smoothly the whole time.

Overall, very solid and catchy track. Thanks for sharing, it's very dope!

- Funeral Casket

http://funeralcasket.bandcamp.com",2016-09-26 00:33:55+00:00,d820ra6,1.0,t3_54fyc9,27483.0,independentmusic
158,Wait? Orangy is anonymous?,2016-09-26 00:24:37+00:00,d820dri,2.0,t1_d81w5td,6306.0,intothetunnel
159,"Wow, now you're playing with power! That intro breakbeat style drum beat at 17:09 is crazy! It almost sounds like original 80's hiphop electro production. I've never heard of Orangy until now. That orange square is pretty funny too, is that the official logo?

That lead synth sliding up and down against the breakbeat groove is pretty cool too. Adding the filter work on top of that, and it gives the track a real 8-bit character and video game feel to it. I'm not sure if this is a collection of different tracks or just an epic long track ""Planisphere"" by Justice, but that 17:09 beat is my favorite part of the whole thing. It has the most energy and seems to really disply Orangy's ability to create a solid dance groove without it sounding like a typcial cheesy EDM looped beat.

Great post! Thanks for sharing!

- Funeral Casket

http://funeralcasket.bandcamp.com",2016-09-26 00:24:22+00:00,d820deu,1.0,t3_54hk15,6310.0,intothetunnel
160,"I agree! The groove on this is undeniable! It almost sounds funk inspired, like Vanilla Fudge. I've listened to it about 17 times by now, great track!

I was actually unaware of this band until I checked out this sub today, so big shout out to IndieHeads for coming through with the badass grooves!

- Funeral Casket",2016-09-26 00:11:46+00:00,d81zvfn,2.0,t1_d81z6zu,1073.0,indieheads
161,"A lot of people have been asking me if would ever do video game music. This comment seems to point me in that direction even more so lol. 

Thanks for listening :)

- Funeral Casket

http://funeralcasket.bandcamp.com",2016-09-26 00:08:13+00:00,d81zqp1,2.0,t1_d81zjf8,325.0,SRSMusic
162,"I guess we'll just agree to disagree, maybe we like 2 different styles of metal, or maybe we just follow different news outlets in regards to following metal, I don't know, but I respect your point of view, and the people who don't regard either of those albums as great. The bands I like, Anthrax, Slayer, Megadeth, Slipknot, Korn, Marilyn Manson, Nine Inch Nails, Pantera and most 90's metal bands all site Judas Priest's British Steel as a huge influence because it was a solid, full on Metal album, compared to their more Classic Rock styled earlier work. Those are just the bands I like though, it doesn't mean that mine is the definitive answer, just the answer that those whom I admire have given.

Some people consider Venom a legendary metal band, but I don't, but that doesn't mean they didn't push music forward stylistically and changed the face of Thrash Metal forever. That's just the truth.

- Funeral Casket",2016-09-25 23:53:40+00:00,d81z6oc,9.0,t1_d81yogu,760.0,indieheads
163,"It truly seems as if you are looking to start an argument. Why? I don't know, but I like to think MUSICALLY GROUNDBREAKING is something we can all agree upon. As in pushing the set boundaries of music, or style, or even lyrical/theme content, like black metal does often. Yes, I believe we ALL know what's great using that criteria, not just me. You and I, and many others are very well able to tell when something is pushing the boundaries of an already set standard, and that is what I mean when I say ""great"". So again, YES, I think we ALL know what's great by that rule.

Personal opinion is something completely different, and if that's what you mean, then NO, I do NOT have the final say about what is ""Great"" and what is not.

- Funeral Casket",2016-09-25 23:37:37+00:00,d81yji1,7.0,t1_d81yasz,360.0,indieheads
164,"That's fine, people have the right to their own opinion.",2016-09-25 23:34:57+00:00,d81yfoo,7.0,t1_d81y8g8,299.0,indieheads
165,"Usually their people who have no idea about music, and/or the difference between what makes something great musically, and what makes something popular. 

I want to make sure I'm understanding you correctly first though, are you saying you've never heard anyone say ""Holy Wood"" or ""British Steel"" are great albums, or are you saying you've never heard anyone talk about them in the same conversation with Nevermind? I seem to be a bit confused about that part, sorry.",2016-09-25 23:21:01+00:00,d81xvh2,5.0,t1_d81xjai,493.0,indieheads
166,"I'm almost certain...or at least PRAYING that you misunderstood me by my use of the word ""category"". Category, in this situation = Great Album...people think ""Nevermind"" is a Great Album...a category...like Bad Albums, Good Albums, Ambient Albums, Rock Albums, Rap Albums...like that...moving on...people considering Nevermind a ""Great Album"" soley based on the music is putting it in the same Category...meaning Great Album...as the other albums I named...I hope I've made this a bit clearer.

- Funeral Casket",2016-09-25 23:05:55+00:00,d81x94l,3.0,t1_d81x0tt,329.0,indieheads
167,"Yeah, my style is pretty different. I want to keep the heavy distortion, and dark tone of metal, but also incorporate my love of Glitch and Hard Electro music. Launching each aspect of the track at different times and with different instruments gives me the dynamics that I like and it makes it sounds slighty choppy and chaotic lol...something I like.

Thanks a lot for taking a listen, I really appreciate it!

- Funeral Casket 

http://funeralcasket.bandcamp.com",2016-09-25 22:53:26+00:00,d81wqgn,2.0,t1_d81p623,10236.0,ThisIsOurMusic
168,"Thanks a lot! The idea for all of my tracks starts with a riff. It's probably the metal influences. Great songs like ""Hand of Doom"", ""Iron Man"", ""Valentines Day"" by Marilyn Manson all started with a simple badass riff, and they built the song around it. I just apply that the way I create music and plus it's fun just writing riffs all day lol. 

Thanks a lot for listening, I really appreciate it!

- Funeral Casket

http://funeralcasket.bandcamp.com",2016-09-25 22:25:20+00:00,d81vk7a,2.0,t1_d81utg7,1059.0,indie
169,"I'd have to agree with you, honestly. A lot of these albums seem to be considered ""great"" because of the people in the band and not because they broke any ground musically. Screamin Jay Hawkins, Deep Purple, Black Sabbath, Death, those guys broke barriers musically, in my opinion.

- Funeral Casket",2016-09-25 22:19:54+00:00,d81vbun,4.0,t1_d80iql4,92794.0,indieheads
170,"Being a metal head, I often like to pretend that ""Grunge"" never happened. Also being born in 91', I don't have as much of a connection with that era as other people. I was raised on Nu-Metal and Electronic music, yes it's true lol. Most Grunge bands don't even consider themselves apart of the metal family tree, but rather connect more with Punk Rock, which I can understand. Both styles are quite aggressive and never stood out as far as virtuosity was considered. Grunge seemed more of a way to ""fight back"" for frustrated 90's teens. Nonetheless, I think Kurt Cobain's image is what keeps Nirvana afloat all these years later.

Kurt, Like Tupac, was seen as the physical embodiment of the ""anti-establishment"" mentality. He was like an actual face being put to the feeling people had been feeling since the 60's/70's Punk movement. By ""people"" I mean, teens, but people all the same. Kurt never seemed to embrace fame the way most other bands, like Pantera, Anthrax, and Slayer did. So in a lot of people's eyes, Kurt was a sort of hero for the underdog. I think this idea is what makes people keep bumping up the ""legend"" of Nevermind and Nirvana as a whole. 

I'm not saying Nevermind isn't a good album, with very creative and strong lyrical content, but sometimes I think people put Nevermind in the same category, and by ""category"", I mean calling it a ""Great Album"", as albums like British Steel, or Paranoid, or Back in Black, or even Holy Wood (Yes, Marilyn Manson's best album in my opinion). 

I think a lot of our focus should be on reflecting on Kurt Cobain as an artist and individual more so than Nirvana as a band, because I doubt Nirvana would have been the same band without Kurt's personality, and affect on kids of the time. I mean, remove Kurt from Nirvana and you just have to very amazing musicians left, but no real ""image"" for kids to connect with.

That being said, I'm glad we're even reflecting on Kurt's art, but this is just my opinion on the whole ""Nevermind"" was the greatest album ever tag line that many people use today.

- Funeral Casket",2016-09-25 22:15:30+00:00,d81v53q,1.0,t3_54bmmn,96579.0,indieheads
171,"Whoa! That organ is heavy! I love it! Those bells add a very creepy and yet authentic vibe to the track and the chorus vocal gives it a very haunting atmosphere. I could literally listen to this on repeat for hours. Is there an extended version of this available?

It sounds like the beginning to something extremely dramatic. Like you just walked into the castle of Vlad The Impaler, and the end is near, and this music is being played as you slowly make your way down the hallways towards Vlad aka Dracula's main hall where he awaits to slaughter you mercilessly and impale your decapitated head on a spike and display it at the castle entrance as a symbol of his sheer power.

This song is epic! Thanks a lot for posting it!

- Funeral Casket

http://funeralcasket.bandcamp.com",2016-09-25 18:59:44+00:00,d81m5y2,1.0,t3_54g3t9,5532.0,gamemusic
172,"I really like the concept behind it. It sounds a lot like an EBM tune, or maybe and Electro-Industrial tune, especially the first half of the track with that pulsating flow to the music. Then it seems to incorporate a lot of dubstep styled growls into that fast/upbeat pace, which is pretty cool. I think the thing that throws me off is the constant changes, not in melody, but in style. It starts to sound like mix of several different songs wrapped into one and you forget it's supposed to be one central idea. Maybe I'm thinking of this in a song format and structure and not in a video game sense, where the environment is constantly changing. Even then, I would think some similarity in sound would be appreciated, right? Maybe not. I'd actually like to try my hand at remixing this track, but for fear of not doing it enough justice, I probably won't. DOOM is legendary and that's the way I want to remember it.

It's definitely a cool remix and keeps the energy of the original pretty high, but I'd like to hear an example, or remix of this with a more cohesive track structure. 

Overall, the E1M1 tune will forever be legendary! Thanks for sharing this!

- Funeral Casket

http://funeralcasket.bandcamp.com",2016-09-25 18:48:53+00:00,d81lo87,1.0,t3_54geyu,935.0,gamemusic
173,"I really like how this track builds over time. The progression is amazing, and really supports the lyrics well. That live piano break at 1:34 is my favorite part. It breaks up the groove and adds some tension leading into the second verse, very cool.

The vocals almost sound like a quieter version of Jim Morrison, a more tame version, but still the same tone in many ways. The atmosphere of the track also seems a bit like darkwave, or a bit of goth inspired synthpop. That could be because of the way the vocal delivery creates a sort of sad emotion or painful inspiration. Reminds me of how the Pet Shop Boys used to deliver vocals on some of their tracks. Very emotional and very relaxed, but very thought out and executed extremely well.

I really enjoy the sound, and the arrangement of the track is very creative and cleanly produced/mixed. Great tune!

- Funeral Casket 

http://funeralcasket.bandcamp.com",2016-09-25 18:15:43+00:00,d81k5ij,1.0,t3_541zs7,238820.0,Indietronica
174,"This is very, very good! I really like it because it's instrumental, and allows you to really hear the different aspects of the music and the technique and skill put into every single track composed.

My favorite track on this is definitely ""Flesh and Bone"". It reminds me a lot of Mastodon and the kind of powerful tracks that they compose with that really intricate style playing and progressive movements throughout each of their tracks.

The drums sounds almost like war drums, as they hit with great power and intensity and the guitars seem like electric battle cries signaling a beast being released to destroy everything! It's all so freaking cool! Great sound and great writing! Thanks for sharing!

- Funeral Casket

http://funeralcasket.bandcamp.com",2016-09-25 17:56:09+00:00,d81j8zh,1.0,t3_4zjyfl,2677274.0,findnewmetal
175,"This is a very cool idea! Is this your own personal ""Best Of"" list or is this something Bandcamp is doing themselves? Is this something artists can submit music for? and is it only for albums, or will there be highlights of individual tracks as well? Sorry for the massive amount of questions, I'm just really interested :)

- Funeral Casket

http://funeralcasket.bandcamp.com",2016-09-25 17:42:48+00:00,d81im37,1.0,t3_54ep3c,23274.0,BandCamp
176,"That opening guitar is epic! Priest, the heavy metal Godfathers, in my opinion. It may not be as heavy as some later metal bands like Pantera, Slayer, and even Slipknot, but those guys wouldn't exist without Priest!

This is the type of track that keeps a perfect balance between bright and dark moments on a single track. It's uplifting, but in a very heavy and powerful way, which I'm sure has a lot to do with K.K. and Glenn blending those crushing guitars, creating that sound wall of awesomeness! I often listen to British Steel when I need inspiration for a heavy guitar sound or just to get me inspired to write any music at all. It's such a great album, and ""United"" is such an epic classic. 

Much respect for posting this!

- Funeral Casket

http://funeralcasket.bandcamp.com",2016-09-25 15:56:14+00:00,d81e7yv,1.0,t3_546lj7,158853.0,HardRock
