,body,created,id,nest_level,parent_id,reply_delay,subreddit
146,"Just search Google Images for ""filthy sweatshop"" and use those. It's dishonest, but it's completely in line with his supporters' morals.",2016-10-12 20:48:37+00:00,d8pbs7t,1.0,t3_576f3m,131.0,EnoughTrumpSpam
147,Matt Drudge is a homosexual now?,2016-10-12 20:31:23+00:00,d8paxqw,1.0,t3_575xsv,4374.0,EnoughTrumpSpam
148,"I used to call them ""permanent virgins who use racial slurs on the internet because they have nobody in real life to communicate with"", but that's too wordy to be catchy.",2016-10-12 20:28:42+00:00,d8pat3v,1.0,t3_576ary,279.0,EnoughTrumpSpam
149,"No matter how gaudy Donald Trump's vehicles may be, none approach the huge-ness of the S.S. Mund.",2016-10-11 16:19:57+00:00,d8nhc2h,1.0,t3_56ynau,2052.0,howardstern
150,M'lord,2016-10-11 00:41:14+00:00,d8mnr5j,1.0,t3_56vf5g,30.0,CringeAnarchy
151,They would either approve or not care. Muckraking and yellow journalism are over a century old.,2016-10-11 00:37:56+00:00,d8mnm8j,2.0,t1_d8m2vtp,26974.0,CringeAnarchy
152,"Howard was VERY political in 2004. He had to be -- he was on the FCC's hit list. Even though he was fully supportive of Giuliani, he made it very clear that he didn't like the idea of ""indecency"" being legislated by his party. In some ways, he's conservative; in others, he's liberal.

Only one things for sure: Donald Trump shares Scott Salem's disdain for tapes.",2016-10-09 20:42:04+00:00,d8kwaz3,1.0,t3_56nu1g,4063.0,howardstern
153,"I think Howard is secretly leaking these clips. He wanted a seat on the Supreme Court, but Donald suggested Peter Thiel instead.",2016-10-09 17:34:50+00:00,d8knhux,1.0,t3_56lxv7,19203.0,howardstern
154,There's a jukebox with noinety-noine pieces of vinyl below the trampoline.,2016-10-09 17:31:36+00:00,d8kncbv,2.0,t1_d8k68e2,41812.0,howardstern
155,"&gt; What is pussy?

According to the majority of libertarians, it's the thing behind the mosaic in Japanese cartoons.",2016-10-08 17:21:01+00:00,d8je5pj,1.0,t3_56himm,5521.0,EnoughLibertarianSpam
156,"""I bought a Ford Pinto automobile online with BitCoin instead of going to a dealership. It's magically safer!""",2016-10-08 17:04:51+00:00,d8jdhvx,4.0,t1_d8iy1e6,39263.0,Buttcoin
157,"&gt; Me n me dick can't wait to get back to em!!

Back to those 0% returns in FILTHY FIAT?",2016-10-08 02:54:24+00:00,d8is75z,3.0,t1_d8iryfr,430.0,Buttcoin
158,"Don't forget the producers, the traffickers, and all the middlemen. But Ross is white, so it must've been nonviolent, right?",2016-10-08 02:32:57+00:00,d8irgpn,2.0,t1_d8iiu8i,14166.0,Buttcoin
159,"https://np.reddit.com/r/Buttcoin/comments/4us01k/comedy_gold_mine_overflowing_as_coinbase_may_have/d5tbcks

Literally worse than my checking account.",2016-10-08 02:31:33+00:00,d8irewj,1.0,t3_56ew4d,2451.0,Buttcoin
160,His heart is definitely wearing a trilby.,2016-10-06 19:37:06+00:00,d8gvhjh,3.0,t1_d8fo8er,75653.0,CringeAnarchy
161,"If you threaten to sue someone for telling the truth about yourself, you're a wuss.",2016-10-05 21:44:58+00:00,d8fm12i,1.0,t3_561src,2462.0,EnoughTrumpSpam
162,Of course he's wearing a trilby.,2016-10-05 13:45:27+00:00,d8ez840,1.0,t3_55ziut,66.0,CringeAnarchy
163,"&gt; Sure you can be biased, as long as you make it clear that you are siding with someone.

How would you enforce that?",2016-10-05 13:44:59+00:00,d8ez7g4,9.0,t1_d8e6ped,55100.0,CringeAnarchy
164,"So, you support the liberal media bias?",2016-10-04 21:46:49+00:00,d8e4ycs,7.0,t1_d8e3u7a,1451.0,CringeAnarchy
165,"Professional whore, as opposed to amateur whore?",2016-10-04 21:12:31+00:00,d8e3d8n,1.0,t3_55v29k,8792.0,CringeAnarchy
166,"&gt; Whenever I see someone that supports trump or Trump himself say something jokingly the media treats them like they are the biggest assholes in the world.

Many people complain about a ""liberal bias"" in the media. If you believe this: would you be willing to lobby your congressman to introduce legislation to make the FCC regulate the news and opinions expressed on the Internet?",2016-10-04 21:08:50+00:00,d8e371a,5.0,t1_d8e2s4y,525.0,CringeAnarchy
167,"&gt; Yeah, but if a prominent person that supported trump had said Hillary supporters should be branded, do you think people would just laugh and say it was a joke?

Yes.",2016-10-04 20:56:06+00:00,d8e2l3z,3.0,t1_d8e0ee7,2645.0,CringeAnarchy
168,"[One brave man corrected the record.](https://np.reddit.com/r/The_Donald/comments/55twc7/howard_stern_confirms_cnn_lied_about_iraq_war/d8dt5ii)

&gt; Howard Stern didn't say ""CNN LIED about Iraq War support,"" on the contrary, Stern admitted that while Donald Trump did say he was for it, it was just a random snippet from the freaking Howard Stern show, which every normal American understands isn't in any way a serious publication.

I'd be surprised if this text isn't deleted and the user banned soon.",2016-10-04 20:19:22+00:00,d8e0ril,1.0,t3_55viba,704.0,EnoughTrumpSpam
169,"""I was going to commit voter fraud, but someone in the world wore a red shirt, so I changed my mind.""",2016-10-04 20:08:21+00:00,d8e0804,1.0,t3_55ubmq,13307.0,EnoughTrumpSpam
170,"[He's on steroids](https://np.reddit.com/r/steroids/comments/5521ii/comment/d87c5na), of course.",2016-10-04 17:50:47+00:00,d8dthk2,1.0,t3_55uprd,578.0,EnoughTrumpSpam
171,"Clearly, they're too poor to buy lunch at the nearby McDonald's and they're too dumb to sneak off campus.",2016-10-04 17:42:16+00:00,d8dt2d0,3.0,t1_d8dr9er,2174.0,EnoughTrumpSpam
172,Is this high school?,2016-10-04 17:03:38+00:00,d8dr57s,1.0,t3_55ugyt,453.0,EnoughTrumpSpam
173,He's channeling his inner [Miss Teen USA](http://m.youtube.com/watch?v=lj3iNxZ8Dww).,2016-09-27 21:47:25+00:00,d84ori3,1.0,t3_54shuz,6422.0,EnoughTrumpSpam
174,Wasn't this also predicted in 2008 when Obama won?,2016-09-26 17:09:04+00:00,d82v3jz,1.0,t3_54kr1r,10718.0,EnoughTrumpSpam
175,"* You have no job, and you want all non-whites deported so there's more welfare money for you.",2016-09-25 20:48:02+00:00,d81rdcb,1.0,t3_54ayng,100252.0,EnoughLibertarianSpam
176,"&gt; Trump is now ""committed to preserving Internet freedom""? How is he going to do that while ""closing off parts of the Internet""?

Simple: he's a lying sack of shit.",2016-09-22 00:06:24+00:00,d7wslq6,1.0,t3_53w1tu,2906.0,EnoughTrumpSpam
177,Matthew Lillard really let himself go.,2016-09-21 13:57:23+00:00,d7vzq2j,1.0,t3_53s0wu,23806.0,justneckbeardthings
178,"Does the ""HARM REDUCTION!"" narrative work here?",2016-09-20 19:31:41+00:00,d7v0cju,1.0,t3_53obue,9547.0,Buttcoin
179,Some people actually believe what I said.,2016-09-20 15:48:28+00:00,d7upi13,3.0,t1_d7tg0jz,77951.0,EnoughTrumpSpam
180,"I'd pay money to see a person who is truly ""triggered"" by the mention of a bathroom.",2016-09-19 19:56:30+00:00,d7tl7bf,2.0,t1_d7sn8j1,62460.0,fatlogic
181,"Yes. It's a highly coordinated group, funded primarily by George Soros, that has completely infiltrated Reddit. Non-members will just see shitposts in this sub because the lizard kings have infected every computer in the world via HAARP that automatically disables your guns and makes your white daughters attracted to black men.",2016-09-19 18:05:42+00:00,d7tfud2,1.0,t3_53isvc,1111.0,EnoughTrumpSpam
182,"How does one even become an ""outspoken opponent of animal rights""? Does Forrest Lucas fuck dogs or something?",2016-09-19 17:59:21+00:00,d7tfj4a,1.0,t3_53itvx,386.0,EnoughTrumpSpam
183,Does this include his latest wife?,2016-09-19 16:11:08+00:00,d7ta7sl,1.0,t3_53i9fv,594.0,EnoughTrumpSpam
184,"So, you want me to prove that he hates freedom of the press without showing his hypocrisy in the Hulk Hogan sex tape trial? Fine, ask yourself this:

* Why didn't Peter Thiel fund the lawsuit against Matthew Lloyd and Michael Calta, the admitted thieves who stole and sold the sex tape?
* Why didn't he provide a lawyer for Heather Clem, the other subject in the sex tape? After all, if this as all about privacy, what about Clem's privacy? Was it not as violated as Bollea's?
* Why didn't he protest the Florida Attorney General who refused to prosecute Lloyd and Calta?
* Why does he endorse a political candidate who donated to that very same Attorney General?

Peter Thiel only funded the lawsuit because it would bring down a media outlet that told the truth about him. As far as he is concerned, the privacy of Heather Clem and Terry Bollea are collateral damage.",2016-09-15 19:20:16+00:00,d7o7suw,5.0,t1_d7o6iy3,1535.0,EnoughLibertarianSpam
185,"There is: https://en.wikipedia.org/wiki/Chicken_tax

Auto makers get around it by disassembling the truck, importing the parts, and re-assembling it in an American factory. They still have to pay an import tax, but it's far lower.

Also, for an automobile to be considered ""American made"", it has to be assembled in the U.S. with at least 87.5% American made parts.",2016-09-15 18:49:06+00:00,d7o68xm,2.0,t1_d7o5pvo,635.0,EnoughTrumpSpam
186,My headline is factual. There's no editorial.,2016-09-15 18:28:25+00:00,d7o5832,3.0,t1_d7o4g1r,955.0,EnoughLibertarianSpam
187,"Yeah, but Bill didn't import illegal aliens to bang.",2016-09-14 21:12:38+00:00,d7myg1j,2.0,t1_d7mxd79,1333.0,EnoughTrumpSpam
188,"FEMA: ""Sir, please follow us to avoid the possible flooding.""

Conspiracy theorist: ""FUCK YOU OBAMA RUINED THIS COUNTRY MAKE AMERICA GREAT AGAIN gurgle gurgle""",2016-09-07 20:36:20+00:00,d7da92u,1.0,t3_51mxrj,5340.0,CringeAnarchy
189,"https://www.reddit.com/r/Buttcoin/comments/4us01k/comedy_gold_mine_overflowing_as_coinbase_may_have/d5tbcks

Sorry for your loss.",2016-09-07 02:05:20+00:00,d7cau29,1.0,t3_51i9mg,8258.0,Buttcoin
190,She won't win in U.S. court. Republishing a rumor is protected speech.,2016-09-02 14:49:07+00:00,d76su9m,1.0,t3_50su5b,10507.0,EnoughTrumpSpam
191,"I'm surprised this guy didn't say ""m'lady"".",2016-08-31 18:59:35+00:00,d74d8ez,1.0,t3_50in4o,2537.0,CringeAnarchy
192,Maybe he's got Alzheimer's.,2016-08-31 14:37:36+00:00,d740tnq,1.0,t3_50hc17,1986.0,EnoughTrumpSpam
193,"&gt; Lmao who the fuck stops to take a pic of themselves at a club to argue with a redditor

An Internet tough guy and/or a liar.",2016-08-31 14:23:41+00:00,d7408dh,2.0,t1_d73zmb0,912.0,EnoughTrumpSpam
194,"&gt; Statists are keeping us in the dark ages

...like the Tennessee Valley Authority, right?",2016-08-30 18:07:37+00:00,d72w65q,1.0,t3_50bxmr,6668.0,EnoughLibertarianSpam
195,I'll meet you at JFK.,2016-08-30 01:59:52+00:00,d722ka6,2.0,t1_d717ql3,41867.0,howardstern
196,"&gt; Would you like reinforced beds and chairs too?

Yes, they would.",2016-08-30 01:21:14+00:00,d720zfe,1.0,t3_5070gk,18993.0,fatlogic
197,"I wouldn't celebrate banging an illegal immigrant whore for three years, either.",2016-08-29 20:51:19+00:00,d71pl2q,1.0,t3_506w5z,4111.0,EnoughTrumpSpam
198,Sorry for your loss.,2016-08-29 15:34:56+00:00,d71arm8,1.0,t3_504roh,10959.0,EnoughTrumpSpam
199,"Will Peter Thiel fund a lawsuit against Trump, then?",2016-08-26 20:44:38+00:00,d6y08yy,1.0,t3_4zqks3,2403.0,EnoughTrumpSpam
200,I may need to call the FAA to let them know where the joke is.,2016-08-26 18:56:40+00:00,d6xvdd4,4.0,t1_d6xtvd4,1924.0,EnoughTrumpSpam
201,"""Cunt"" isn't an appropriate word. That word should only be used against women. The jury's still out on his or her status as a transsexual.",2016-08-26 18:20:43+00:00,d6xtopy,2.0,t1_d6xrqgh,2539.0,EnoughTrumpSpam
202,"Ayn Rand is dead, and I say ""thank God"". Anyone who worships a blowhard spinster who ranted against government and died while collecting Social Security should be immediately sterilized.",2016-08-26 16:32:15+00:00,d6xolj8,1.0,t3_4zm8k0,52177.0,EnoughLibertarianSpam
203,"Melania is a public figure, and there's case law that says calling a woman a whore is protected speech, so I'm afraid I'm going to have to deny your request.",2016-08-25 14:43:53+00:00,d6w44ur,2.0,t1_d6w39iz,1185.0,EnoughTrumpSpam
204,"Sodium chloride is salt. Potassium chloride is a ""salt substitute"".",2016-08-23 17:02:34+00:00,d6tggo7,3.0,t1_d6t6xlq,12644.0,EnoughLibertarianSpam
205,"&gt; I am curious as to why you think that though? Are you averse to digital currency in general, or just a particularly ardent fan of the Federal Reserve?

Not as good as the ""Federal Reserve cock"" rant, but he's trying.",2016-08-22 20:48:36+00:00,d6scpwi,1.0,t3_4z2muk,819.0,Buttcoin
206,"http://www.shadbase.com/die-eiskonigin/

NSFW",2016-08-22 20:27:46+00:00,d6sbr1m,2.0,t1_d6saasb,1865.0,CringeAnarchy
207,"Ironically, /u/luke-jr is barely high school educated. That's probably why he lost half a million dollars after MtGox collapsed.",2016-08-18 14:28:10+00:00,d6mm5x2,1.0,t3_4yasto,27579.0,Buttcoin
208,"So, you want Hillary to get away with murder?",2016-08-15 19:37:54+00:00,d6ipeaz,5.0,t1_d6iodau,1318.0,CringeAnarchy
209,"You should study real hard while you're in high school. That way, you can apply to law school, get your ''juris doctorate'' degree, pass the bar, and bring criminal charges against Hillary Clinton.",2016-08-15 18:26:21+00:00,d6im485,3.0,t1_d6i5zhj,25809.0,CringeAnarchy
210,"&gt; I hate SJWs. Let's re-enact a government policy that led to the deaths of over 40 million Chinese people.

Holy shit, dude.",2016-08-11 22:03:48+00:00,d6duhyb,4.0,t1_d6dsr3r,2317.0,CringeAnarchy
211,Have you considered lobbying your congressman to reinstate the Fairness Doctrine and have the FCC regulate content on the Internet?,2016-08-10 18:48:47+00:00,d6c61r4,3.0,t1_d6c4ds5,2044.0,CringeAnarchy
212,"Prax it out, folks. As a libertarian, he deserved to die for being a layabout who goes to water parks.",2016-08-09 19:58:39+00:00,d6atzvo,1.0,t3_4wvy15,26655.0,EnoughLibertarianSpam
213,"Bitfinex took tokens that can be exchanged for heroin and kiddie porn, and replaced them with tokens that can't be exchanged for anything.",2016-08-08 16:50:32+00:00,d69736h,2.0,t1_d696jx7,706.0,Buttcoin
214,Thin privilege is being able to shop in a grocery store without getting out of breath.,2016-08-08 16:45:52+00:00,d696vee,1.0,t3_4wqsgu,3395.0,fatpeoplestories
215,"Threats are a crime, provided they are obvious.

Offending anyone or insulting anyone is not a crime.",2016-08-05 18:08:32+00:00,d65o37b,5.0,t1_d65nhmw,749.0,EnoughTrumpSpam
216,"Define ""hate speech"".",2016-08-05 17:46:05+00:00,d65n0ci,3.0,t1_d65lky8,1770.0,EnoughTrumpSpam
217,"Short answer: no.

Long answer: sorry for your loss, and no.",2016-08-05 17:45:23+00:00,d65mz61,1.0,t3_4w891z,54754.0,BitcoinMarkets
218,"It's good that you can't sue for hate speech. Otherwise, Donnie would be suing us.",2016-08-05 15:07:36+00:00,d65fgrt,1.0,t3_4wampe,2672.0,EnoughTrumpSpam
219,Donnie should've hired the Chinese and Bangladeshi workers who make his clothes.,2016-08-04 22:53:43+00:00,d64lof8,1.0,t3_4w78cp,1206.0,EnoughTrumpSpam
220,Sorry for his loss.,2016-08-04 20:37:36+00:00,d64fnvq,1.0,t3_4w6ahq,4342.0,Buttcoin
221,Someone just took their first Photoshop course at community college.,2016-08-04 20:34:33+00:00,d64fikr,1.0,t3_4w6mcu,244.0,CringeAnarchy
222,"* Is there a natural gas line on your street? Eat lots of broccoli and cabbage, then call the gas company and complain about a leak.
* Constantly adjust the thermostat to make the air conditioning turn off. If it's behind a locked cage, bring in frozen ""cold packs"" and leave them propped above the cage.
* Bring a Wi-Fi router in with the network name set to ""Free WiFi For Trump Supporters"", but don't actually connect it to the Internet. Watch people constantly fiddle with their phones.",2016-08-04 17:34:07+00:00,d646nw6,1.0,t3_4w4sqa,10709.0,EnoughTrumpSpam
223,noine noine noine noine noine,2016-08-04 15:44:05+00:00,d641b9y,2.0,t1_d640h7t,1059.0,howardstern
224,Have you considered lobbying your representative to open a Congressional hearing on this?,2016-08-04 14:54:49+00:00,d63yzka,2.0,t1_d63hgoh,39454.0,CringeAnarchy
225,"Creepy ""Frozen"" art.",2016-08-03 14:59:58+00:00,d62j359,1.0,t3_4vyqln,2086.0,CringeAnarchy
226,"We don't know that Donnie *didn't* donate to NAMBLA, though.",2016-08-02 22:04:15+00:00,d61my1n,1.0,t3_4vueoq,8319.0,CringeAnarchy
227,That kid is a future school shooter.,2016-08-02 18:16:18+00:00,d61c071,1.0,t3_4vtuac,780.0,EnoughTrumpSpam
228,"Pokémon GO depends on two critical inventions of the U.S. government: the Internet, and GPS.

Are libertarians that stupid, or do they just look for gullible people to recruit?",2016-08-02 02:05:14+00:00,d60haw5,1.0,t3_4vq1h4,1768.0,EnoughLibertarianSpam
229,"If it upsets Donnie, I'm all for it. Both he and his whore of a wife are public figures.",2016-08-01 19:44:24+00:00,d600q91,2.0,t1_d60008s,893.0,EnoughTrumpSpam
230,"I looked up the definition of ""intersectional"" outside of the Oxford English Dictionary, and I got this:

&gt; Intersectionality is a concept often used in critical theories to describe the ways in which oppressive institutions (racism, sexism, homophobia, transphobia, ableism, xenophobia, classism, etc.) are interconnected and cannot be examined separately from one another.

In other words, this individual believes everyone who doesn't subscribe to ""fat positivity"" is also racist, sexist, and homophobic.",2016-08-01 19:39:01+00:00,d600gq9,1.0,t3_4vo3cn,2963.0,fatlogic
231,Thin privilege is being able to control one's own bodily functions.,2016-08-01 19:25:34+00:00,d5zztb0,1.0,t3_4vm5v1,26036.0,fatpeoplestories
232,"Ross is a dirtbag and deserves to die, but could we refrain from talking about a theoretical anal prolapse?",2016-08-01 15:35:05+00:00,d5zoy27,1.0,t3_4vkyzi,36934.0,Buttcoin
233,Found the heroin addict.,2016-07-29 14:13:50+00:00,d5vw1ow,3.0,t1_d5vd8lx,42131.0,Buttcoin
234,/r/niceguys in a nutshell,2016-07-28 19:31:07+00:00,d5uv8p8,1.0,t3_4v2gej,860.0,CringeAnarchy
235,I keep that proof right next to my proof that Obama is a Kenyan Muslim.,2016-07-28 19:15:24+00:00,d5uuhau,3.0,t1_d5toz4i,71663.0,justneckbeardthings
236,"&gt; Never mind the whole murder-for-hire thing.

But if it happened, it's totally justified. Right?",2016-07-28 19:10:37+00:00,d5uu8ve,2.0,t1_d5upijh,5719.0,Buttcoin
237,"Okay, thank you for your call!",2016-07-27 20:10:08+00:00,d5tg002,1.0,t3_4uwi3t,1876.0,justneckbeardthings
238,I told you not to use the camera. DON'T USE THE CAMERA!,2016-07-27 19:53:56+00:00,d5tf7lm,1.0,t3_4uvyfq,6957.0,howardstern
239,I don't even need to click that link to know it's a scam. GoFundMe is the electronic tip jar for white trash and media whores.,2016-07-27 19:18:54+00:00,d5tdhiz,1.0,t3_4t9kgq,886087.0,CringeAnarchy
240,Where's his wheelchair?,2016-07-27 18:28:54+00:00,d5tazpg,1.0,t3_4uvr1q,4183.0,howardstern
241,"He was smart enough to kill his brother and make it look like alcohol poisoning.

Oh shit, did I just say that?",2016-07-27 16:22:05+00:00,d5t4ktn,1.0,t3_4uv1m4,4819.0,justneckbeardthings
242,Bitscoin: increasing the number of successful drug trafficking convictions since 2008.,2016-07-27 16:13:07+00:00,d5t44m9,2.0,t1_d5t0g7w,4584.0,Buttcoin
243,"""It's an investment, boff.""

I just looked on eBay for Baba Looey cels. They're going for $700 -- the same price as they were going for 26 years ago.",2016-07-27 15:22:47+00:00,d5t1o0b,2.0,t1_d5sudee,11506.0,howardstern
244,"If Meelo wants to be on Twitter, he can pull himself up by his own bootstraps and create his own personal Twitter competitor.",2016-07-27 15:15:13+00:00,d5t1b4v,1.0,t3_4ur7wg,62139.0,EnoughLibertarianSpam
245,&gt; I just watched a David Cronenberg film.,2016-07-27 14:40:39+00:00,d5szppx,1.0,t3_4uuwsf,265.0,CringeAnarchy
246,Would you like the long version or the short version?,2016-07-27 14:23:19+00:00,d5syyox,2.0,t1_d5sx494,2759.0,CringeAnarchy
247,He had an autistic meltdown and accused someone of being part of an insane conspiracy theory. He used Reddit karma points as proof of something.,2016-07-26 21:53:47+00:00,d5s3kb5,9.0,t1_d5s3f60,177.0,CringeAnarchy
248,/r/niceguys,2016-07-26 21:50:06+00:00,d5s3dx1,2.0,t1_d5rxuv8,6602.0,CringeAnarchy
249,Have you considered opening up a Congressional hearing on Reddit accounts?,2016-07-26 21:47:09+00:00,d5s38ow,7.0,t1_d5s29ze,1183.0,CringeAnarchy
250,Is Fred Norris there?,2016-07-26 18:26:25+00:00,d5rt5jo,1.0,t3_4up8bf,10212.0,howardstern
251,Do you collect Pokémon cels?,2016-07-25 22:02:47+00:00,d5ql8eu,1.0,t3_4ujfvr,20384.0,howardstern
252,Sorry for your loss?,2016-07-25 19:39:34+00:00,d5qecyg,1.0,t3_4uj91v,13946.0,btc
253,"Urophilic bisexual Christian furries, man.",2016-07-25 17:54:59+00:00,d5q9h94,1.0,t3_4u3l4y,264659.0,niceguys
254,"&gt; I asked for lots of ranch
&gt; I have diabetes, I need at least 8 of those, the milk is good for me.

The cholesterol cancels out the high blood sugar.",2016-07-25 17:35:47+00:00,d5q8ikq,1.0,t3_4ui2v0,22703.0,fatpeoplestories
255,"&gt; cuck

There's that word again. Do people really see that as a major insult, and not a childish taunt?",2016-07-25 17:25:29+00:00,d5q7zuw,1.0,t3_4ujq7k,582.0,justneckbeardthings
256,"What do you think ""chinpokomon"" means?",2016-07-20 15:22:25+00:00,d5jmtdt,4.0,t1_d5iv58u,56455.0,CringeAnarchy
257,It's almost as if Twitter is a corporate entity that would rather maximize shareholder value than please a couple of media whores.,2016-07-20 15:21:44+00:00,d5jms9k,2.0,t1_d5jjbqz,5032.0,CringeAnarchy
258,"That's a foolproof way of getting tazed while having the phrase ""stop resisting"" shouted at you.",2016-07-19 21:41:53+00:00,d5iq0v9,1.0,t3_4tltyc,20886.0,niceguys
259,Jealous?,2016-07-19 21:11:32+00:00,d5ioojm,2.0,t1_d5in3pj,2098.0,fatpeoplestories
260,"僕の***ちんぽこ***は美味しいです。

 ( *｀ω´)",2016-07-19 20:36:52+00:00,d5in47w,2.0,t1_d5igoyq,8119.0,CringeAnarchy
261,"NECKBEARD used Fedora Tip! It wasn't very effective...

NECKBEARD used Antiquated Compliment! It wasn't very effective...

NECKBEARD used Insult! It wasn't very effective...",2016-07-17 20:21:00+00:00,d5fzfje,2.0,t1_d5fqxzt,13552.0,justneckbeardthings
262,"Anne Frank: helped hide fellow Jews during the Nazi occupation of the Netherlands.

Ross Ulbricht: sold heroin online and ordered murders.

Care to explain, /u/MemoryDealers ?",2016-07-17 13:40:29+00:00,d5fljwt,1.0,t3_4t8yf5,15899.0,EnoughLibertarianSpam
263,Delia Ketchum is hot though.,2016-07-17 03:19:10+00:00,d5f9914,1.0,t3_4t7llj,5526.0,CringeAnarchy
264,Friendzoned by Pokémon.,2016-07-12 19:30:43+00:00,d59lq3r,1.0,t3_4shp0n,13069.0,justneckbeardthings
265,Why do coinbitsters think it's an armored truck? It's clearly a food truck.,2016-07-12 19:24:39+00:00,d59lfr5,1.0,t3_4sgk7c,27771.0,Buttcoin
266,"Are you sure it's a fedora, and not a trilby?",2016-07-11 20:23:01+00:00,d58bgwp,1.0,t3_4sbmew,15994.0,justneckbeardthings
267,**e u p h o r i c**,2016-07-11 19:22:01+00:00,d588plj,1.0,t3_4schxc,2781.0,CringeAnarchy
268,"This guy drives a prune colored Camaro, the official car of ""peaked in high school"".",2016-07-11 15:16:09+00:00,d57xmj1,1.0,t3_4s8z17,42197.0,CringeAnarchy
269,https://youtu.be/XTs_TZFjbJ8,2016-07-11 15:09:35+00:00,d57xckl,1.0,t3_4s9w2b,24730.0,CringeAnarchy
270,"I'd move, like any other sane human being.",2016-06-22 18:27:39+00:00,d4jpipw,1.0,t3_4pblcj,6643.0,EnoughLibertarianSpam
271,"Impossible. I hacked Ethereum, or The DAO, or whatever it's called.

It's true because I say it is.",2016-06-22 13:42:20+00:00,d4jcf3b,1.0,t3_4p9trr,14943.0,Buttcoin
272,$100%,2016-06-17 14:25:03+00:00,d4d1kym,1.0,t3_4oisfm,10386.0,justneckbeardthings
273,"Searched for new ""fedora guy"" pics, got this. I was amused after being terrified.",2016-06-13 22:07:10+00:00,d47wygw,2.0,t1_d47ozr2,10312.0,justneckbeardthings
274,"Let's face the facts: Uber defrauds private auto insurance companies by telling their drivers, who definitely aren't employees, to not get their vehicle ensured as a cab. You don't notice until your driver, who is still not an employee, gets into an accident, and their insurance company refuses to pay either you or the driver, and Uber's piss-poor liability policy pays nothing.

Then again, fraud isn't a crime in Ancapistan.",2016-06-13 22:05:52+00:00,d47wwgm,1.0,t3_4nwghv,19848.0,EnoughLibertarianSpam
275,"&gt; Then LN will come (off chain with the chain used to settle disputes) and we will have near infinite capacity.

Richard Simmons doesn't do this much hand waiving.",2016-06-07 19:40:48+00:00,d3zv3wp,1.0,t3_4n0mk8,3070.0,Buttcoin
276,Wow. I'm so hurt. The bitscoin price just needs to go up another $500 or so for the Mt. Gox victims like you to break even.,2016-06-07 15:28:16+00:00,d3zjcfp,1.0,t3_4mziun,694.0,Buttcoin
277,"Urophilic bisexual Christian furries, man.",2016-06-06 19:24:33+00:00,d3yg3mp,1.0,t3_4muntr,1017.0,justneckbeardthings
278,M'elania,2016-06-06 15:42:47+00:00,d3y5v7b,2.0,t1_d3xpke0,39456.0,justneckbeardthings
279,"&gt; I want the right to kill any children or I won’t have any. That’s that.

Thankfully, this perma-virgin will never have the ability to do either.",2016-06-03 14:41:14+00:00,d3uhz2b,1.0,t3_4m9hyf,62107.0,Buttcoin
280,Sorry for your loss.,2016-06-01 16:08:34+00:00,d3rv8gy,3.0,t1_d3rbzra,43533.0,Buttcoin
281,TIL: $500 is $10000.,2016-05-31 19:13:39+00:00,d3qr03n,1.0,t3_4lw2ox,9940.0,Buttcoin
282,I expected that bit~coin spam.,2016-05-23 15:49:42+00:00,d3ghg8l,1.0,t3_4kkpdk,64668.0,EnoughLibertarianSpam
283,Gum'ball,2016-05-23 15:47:38+00:00,d3ghd1h,1.0,t3_4kkpd3,64549.0,justneckbeardthings
284,"It's nice that Roger Ver advertises his acceptance of credit cards on his bitcion gambling site.

Wait, what?",2016-05-12 03:16:24+00:00,d328wrz,1.0,t3_4ix889,21171.0,Buttcoin
285,"He's ""self-employed"" as a Bitcoin mining software developer. His last real job was working at McDonald's, according to his CV.",2016-05-06 21:30:17+00:00,d2vnyfy,2.0,t1_d2vnjwo,608.0,Buttcoin
286,"Has SpaceX landed a man on the moon?

Eat a fart.",2016-05-06 19:46:17+00:00,d2vjl7b,3.0,t1_d2vh8yo,3252.0,EnoughLibertarianSpam
287,Why bother removing details? It's not as if this hypocrite will find this community between watching hentai and playing Call of Duty.,2016-04-26 21:01:18+00:00,d2ig9nk,3.0,t1_d2her55,67378.0,neckbeardstories
