,body,created,id,nest_level,parent_id,reply_delay,subreddit
0,Dry oatmeal.,2016-11-21 22:09:22+00:00,daa4isv,1.0,t3_5e6sw2,1094.0,howardstern
1,Misty from *Pokémon* really let herself go.,2016-11-21 21:54:11+00:00,daa3sst,1.0,t3_5e555q,17054.0,CringeAnarchy
2,"&gt; When Libel laws are adjusted, you will be sued and jailed for your lies.

* Barack Obama born in Kenya? Lie.
* Ted Cruz's father killed John F. Kennedy? Lie.

Guess who's going to be the first casualty of those new libel laws? $25 million won't buy your way out of this.",2016-11-20 10:18:27+00:00,da81gsx,1.0,t3_5dwk7n,19244.0,EnoughTrumpSpam
3,"What they meant to say was:

&gt; Fuck YOUR feelings. My feelings are still fragile, so don't make fun of me or I'll make death threats to you online.",2016-11-20 10:12:21+00:00,da81d8d,1.0,t3_5dtjeh,59412.0,EnoughTrumpSpam
4,Sorry for his loss. ,2016-11-20 09:57:56+00:00,da814wg,2.0,t1_da7yj7j,8860.0,Buttcoin
5,Was this before or after the film was released?,2016-11-18 19:25:49+00:00,da61gxb,4.0,t1_da61eor,78.0,EnoughLibertarianSpam
6,Simple: say that Edward Snowden violated the NAP by saying something they disagree with.,2016-11-18 17:47:14+00:00,da5wpm4,2.0,t1_da5splc,4960.0,EnoughLibertarianSpam
7,"This is coming from a crybaby who is still trying to find a way to sue Twitter for suspending his account.

What a fucking wuss.",2016-11-18 17:37:35+00:00,da5w8mh,1.0,t3_5dm2bu,19651.0,EnoughTrumpSpam
8,A green type of tube.,2016-11-18 17:34:16+00:00,da5w2s3,4.0,t1_da4ohkz,75948.0,howardstern
9,"George Soros pays me to link to these sites. Also, the moon is made of cheese.",2016-11-18 17:28:18+00:00,da5vs8f,4.0,t1_da4tcpc,69667.0,justneckbeardthings
10,(((boogiemen))),2016-11-17 20:33:47+00:00,da4or83,2.0,t1_da4kzyo,4549.0,justneckbeardthings
11,"&gt; To stay relevant, they would be forced to lower their corporate profit.

This is literally the exact opposite of what a corporation does. I'm not even being facetious with my use of the word ""literally""; no corporate officer on the planet would agree with this manchild.",2016-11-17 20:32:28+00:00,da4oovh,1.0,t3_5di1z2,874.0,EnoughTrumpSpam
12,Psychedelic BEE-E-EE-E!,2016-11-17 15:51:47+00:00,da4av8k,2.0,t1_da3rrw7,42818.0,howardstern
13,"Is this kid going to pursue a career in rap music, penny stocks, and phony phone calls?",2016-11-17 15:50:47+00:00,da4atks,1.0,t3_5dcsfm,55732.0,howardstern
14,"""Go have sex with your mother.""",2016-11-16 17:45:41+00:00,da2zsr3,2.0,t1_da1z4ld,66218.0,howardstern
15,"""Go ahead, what's your item?"" is a frequently used phrase by one of the Tradio hosts.",2016-11-16 17:43:06+00:00,da2zo64,1.0,t3_5d9r9p,8069.0,howardstern
16,"Classic Voinyl and Raw Dog channel noinety-noine work for me, boff.",2016-11-16 17:41:51+00:00,da2zlvk,1.0,t3_5d6vty,53293.0,howardstern
17,"I can debunk everything in that image with four words:

""He isn't inaugurated yet.""",2016-11-14 20:57:41+00:00,da0b86v,1.0,t3_5cybsu,250.0,EnoughTrumpSpam
18,Lesson 1: Don't launder money.,2016-11-14 17:13:34+00:00,da0056e,1.0,t3_5cwifo,6033.0,Buttcoin
19,"[Donald Trump Says He May Keep Parts of Obama Health Care Act](http://www.nytimes.com/2016/11/12/business/insurers-unprepared-for-obamacare-repeal.html)

tl;dr he isn't repealing it; he's barely even changing it.",2016-11-12 17:03:56+00:00,d9xbkgj,2.0,t1_d9xaqxy,1275.0,EnoughLibertarianSpam
20,Dob zhelv ligga.,2016-11-12 16:58:36+00:00,d9xbd47,1.0,t3_5cl0mb,3085.0,howardstern
21,"Now, if only someone would invent this mythical ""Lightning Network"", we'd all be RICH!",2016-11-12 16:57:31+00:00,d9xbbnc,1.0,t3_5cjv19,23784.0,Buttcoin
22,"For all we know, he's broke and only leases his name to eke out a few million a year. That's what smart people are saying.",2016-11-12 12:40:54+00:00,d9x3s0p,1.0,t3_5cjf4p,19219.0,EnoughTrumpSpam
23,"What's she saying, Robin?",2016-11-12 12:17:24+00:00,d9x3cif,1.0,t3_5cj27k,24807.0,howardstern
24,"Is there a full moon out, or what?",2016-11-12 12:10:46+00:00,d9x38f5,1.0,t3_5ciyoq,26100.0,howardstern
25,"&gt; It sets a precedent for future laws.

And werewolves live in New Mexico.",2016-11-12 12:06:48+00:00,d9x35ze,10.0,t1_d9woucb,35949.0,howardstern
26,"That may have something to do with web sites being run by private individuals and not the government.

""My system, my rules.""",2016-11-12 00:21:45+00:00,d9wkti6,8.0,t1_d9wkkln,388.0,howardstern
27,"You can label any kind of speech as hate speech. The United States isn't Europe, so claiming that some speech is hate speech isn't silencing an opponent. It's just a long-winded way of saying ""go fuck yourself"".

Have you heard Bubba the Love Sponge after he left SiriusXM? The MJ trial is the best example of this.",2016-11-11 23:57:17+00:00,d9wjvhb,6.0,t1_d9wj9c6,914.0,howardstern
28,"They aren't entirely wrong. (((George Soros))) financed Donnie's real estate, but that's an inconvenient truth.",2016-11-11 23:42:08+00:00,d9wj9g2,1.0,t3_5chcko,4228.0,EnoughTrumpSpam
29,"In my experience, it's faux-libertarians complaining about things that they don't like. They're the ones who actually take legal action. Some liberals complain, but never actually do anything in a court.",2016-11-11 23:29:39+00:00,d9wirhr,4.0,t1_d9whh3b,1931.0,howardstern
30,"Sal just goes with whatever political view Howard has. His sexual preferences are tame in the Internet age, anyway.",2016-11-11 22:27:12+00:00,d9wg84z,1.0,t3_5ch5cg,2029.0,howardstern
31,"It's because Howard has a point. He mentioned earlier this month that nobody cares about the political views of the people who run Johnson &amp; Johnson Co. because their business is profit, not opinion. Once you become a politician, you get a giant magnifying glass focused on your every move and the world's most sensitive microphone right next to your mouth. That's the nature of the game.",2016-11-11 22:20:47+00:00,d9wfyeu,1.0,t3_5ch90y,489.0,howardstern
32,"I'm asking a genuine question. What makes you think I have an ulterior motive?

edit: this thread is getting far too deeply nested to be easily read by the rest of the people here. I'll send you an invite to another sub so we can discuss Constitutional interpretations.",2016-11-11 22:07:07+00:00,d9wfde3,17.0,t1_d9wf3cu,394.0,EnoughTrumpSpam
33,No political views at all?,2016-11-11 21:53:45+00:00,d9wesr7,15.0,t1_d9werd0,53.0,EnoughTrumpSpam
34,Smart people are saying things.,2016-11-11 21:52:05+00:00,d9weq3q,2.0,t1_d9wehv2,314.0,EnoughTrumpSpam
35,"Legally, only dead people can be on U.S. currency.",2016-11-11 21:51:13+00:00,d9weoq1,1.0,t3_5ch4q2,57.0,EnoughTrumpSpam
36,You gave a wussy answer. Don't you have any political views?,2016-11-11 21:50:05+00:00,d9wemx9,13.0,t1_d9we9qv,499.0,EnoughTrumpSpam
37,"Do you support the plaintiff's action, or not?",2016-11-11 21:37:26+00:00,d9we2s1,11.0,t1_d9wdrth,405.0,EnoughTrumpSpam
38,"HI! THIS IS HOWARD STERN ON W-NNNNNN-B-C! HAVE SOME FUN WITH ME AND MY FRIENDS EVERY WEEKDAY AFTERNOON FROM FOUR TO EIGHT.

Sixty-six! W-N-B-C!",2016-11-11 21:34:44+00:00,d9wdycs,1.0,t3_5cgw43,1748.0,howardstern
39,"Many people believe that there exists a ""liberal bias"" in the media. If you believe this: would you be willing to lobby your congressman to have the FCC regulate opinions expressed on the Internet?",2016-11-11 21:30:43+00:00,d9wdrvj,2.0,t1_d9wdb03,630.0,howardstern
40,"Well, I'll think about it. ",2016-11-11 21:27:41+00:00,d9wdmym,3.0,t1_d9wboyf,2569.0,howardstern
41,"So, let's say you met a person who tried to sue someone for hyperbole. How would you describe the plaintiff?",2016-11-11 21:24:22+00:00,d9wdhog,9.0,t1_d9wd8ku,340.0,EnoughTrumpSpam
42,Do you believe hyperbole is protected speech?,2016-11-11 21:11:41+00:00,d9wcx61,7.0,t1_d9wcun6,94.0,EnoughTrumpSpam
43,"What's he going to do with Peter Thiel: take his money and ""convert"" him?

Actually, that's not a bad idea.",2016-11-11 21:10:02+00:00,d9wcui7,1.0,t3_5cgud7,808.0,EnoughTrumpSpam
44,/r/thatHappened,2016-11-11 21:05:28+00:00,d9wcmz9,1.0,t3_5cgton,751.0,EnoughTrumpSpam
45,"&gt; Why would I do that?

Filing frivolous defamation suits seems to be a common trait in right-wing public figures. Do you support that strategy of litigation?",2016-11-11 21:03:47+00:00,d9wck8r,5.0,t1_d9wcbj0,319.0,EnoughTrumpSpam
46,Have you considered lobbying your congressman to make it illegal to criticize a person you voted for?,2016-11-11 20:43:17+00:00,d9wbmbg,3.0,t1_d9waz37,843.0,EnoughTrumpSpam
47,"All right, here are the issues. I'm gonna make this short and sweet:

* Sal is a starfucker. He'd say he voted for Barack Obama a third time if Howard Stern claimed he was a candidate. (And, in fact, he did in 2008 and 2012.)
* Wendy the Retard doesn't know what day of the week it is, and she couldn't find Donald Trump's name in a book written by Donald Trump.
* High Pitch Eric only voted for whoever he thought would give him free money for food.",2016-11-11 19:06:01+00:00,d9w72to,1.0,t3_5cg2xt,1707.0,howardstern
48,Second -- Reagan was the first.,2016-11-11 14:46:41+00:00,d9vv5on,1.0,t3_5cet7b,54.0,EnoughTrumpSpam
49,"It's going to skyrocket after all those extremists fail to get their promised wall across the border with Mexico, don't get their coal digging jobs back, and don't see an executive order to break up media companies they hate.

Is that what you meant?",2016-11-11 00:38:23+00:00,d9v5rsi,1.0,t3_5cbgmg,746.0,EnoughTrumpSpam
50,Is it a good time to mention to /u/donalds_stones that (((Sheldon Adelson))) funded Donnie's campaign?,2016-11-11 00:14:49+00:00,d9v4qpd,1.0,t3_5cabci,11723.0,justneckbeardthings
51,[Did you see this guy cry like a little bitch?](https://youtu.be/l0xbk1TLYxk?t=1094),2016-11-11 00:08:36+00:00,d9v4gro,2.0,t1_d9v00wz,5892.0,howardstern
52,It's been noine days since I heard from Sour.,2016-11-10 22:48:00+00:00,d9v0uzm,1.0,t3_5caspi,1551.0,howardstern
53,"Can I put a finger in your ass?

This is better than rejuvenation.",2016-11-10 22:38:49+00:00,d9v0fcg,2.0,t1_d9soxtg,126278.0,howardstern
54,Pot is now legal in Las Vegas. Call Jackie and have a good time.,2016-11-10 22:35:14+00:00,d9v099f,1.0,t3_5c62uw,63521.0,howardstern
55,"Fred: hangs up.

Robin: never answers the phone.

Howard: calls Marci.",2016-11-10 22:33:44+00:00,d9v06oj,1.0,t3_5ca0bw,8848.0,howardstern
56,"""What I was simply trying to do was make a joke over the fact that white women generally don't have sex with orange men.""",2016-11-10 22:32:33+00:00,d9v04n1,2.0,t1_d9uvc9c,5776.0,howardstern
57,That makes this Steve Bannon guy a public character. He'd better be prepared for a hurricane of hyperbolic statements against him.,2016-11-10 22:20:50+00:00,d9uzk8g,1.0,t3_5cann7,1360.0,EnoughTrumpSpam
58,"You're right: it's morally wrong. Nevertheless, it's protected speech. The best way to retaliate is to burn an effigy of the white supremacist.",2016-11-10 22:12:21+00:00,d9uz5j5,4.0,t1_d9ut7aa,7053.0,EnoughTrumpSpam
59,"He is now, whether he likes it or not.",2016-11-10 22:01:52+00:00,d9uynjw,3.0,t1_d9uwgcs,2615.0,EnoughTrumpSpam
60,That makes Jimmy Carter a MENSA candidate.,2016-11-10 20:32:38+00:00,d9uu4l2,1.0,t3_5ca0lg,1502.0,EnoughTrumpSpam
61,"[Blockchain, cloud computing, internet of things, disruption, fintech, distributed.](https://www.youtube.com/watch?v=gqg3l3r_DRI)

Where's my cut of that VC money?",2016-11-10 20:18:39+00:00,d9uteg1,1.0,t3_5c8q2e,13851.0,Buttcoin
62,"If it's Constitutionally protected speech, do it. Nothing infuriates a politician more than doing something they're unable to stop.",2016-11-10 19:59:25+00:00,d9useu8,2.0,t1_d9uqmtq,2066.0,EnoughTrumpSpam
63,"The future of this sub is hyperbole and opinion, and hopefully some coverage of a orange man's meltdown.",2016-11-10 19:42:52+00:00,d9urk15,1.0,t3_5bzope,128325.0,EnoughTrumpSpam
64,Have you considered lobbying your local congressman to classify expressing an opinion you disagree with as treason?,2016-11-10 19:40:38+00:00,d9urfz7,4.0,t1_d9uh9km,11751.0,EnoughTrumpSpam
65,A politician lied. Color me surprised.,2016-11-10 19:29:15+00:00,d9uquvz,1.0,t3_5c9iql,2757.0,EnoughTrumpSpam
66,Pretty much.,2016-11-10 19:20:20+00:00,d9uqe4u,3.0,t1_d9rtc5p,158789.0,howardstern
67,I'm hoping Bubba comes back or is simulcasted.,2016-11-08 21:13:14+00:00,d9rne94,1.0,t3_5bvqxd,2420.0,howardstern
68,All election questions... DIRECTED TO THE KUKKAKAUPPA!,2016-11-08 21:12:22+00:00,d9rncn9,1.0,t3_5bvvio,1091.0,howardstern
69,"&gt; Now go pose for a syrup bottle.

""Hi. This is Sal Governale.""",2016-11-08 20:52:50+00:00,d9rmbto,3.0,t1_d9rj4sc,3660.0,howardstern
70,"&gt; DEAPLOUR ABLE

We've got the best spellers, don't we, folks?",2016-11-08 20:37:23+00:00,d9rli5s,1.0,t3_5bul9l,11200.0,EnoughTrumpSpam
71,Future school shooter.,2016-11-08 19:43:55+00:00,d9ripxv,1.0,t3_5bvbrf,1130.0,EnoughTrumpSpam
72,"He couldn't find another woman supporting him, so he used a picture of his daughter. ",2016-11-08 15:31:20+00:00,d9r5hrz,1.0,t3_5btrtm,787.0,EnoughTrumpSpam
73,What an odd looking fedora.,2016-11-08 15:23:37+00:00,d9r54be,1.0,t3_5btjjv,2693.0,EnoughTrumpSpam
74,Wasn't there a time when the Republican Party shunned Russia and China?,2016-11-08 15:20:22+00:00,d9r4ynb,1.0,t3_5bto6d,1128.0,EnoughTrumpSpam
75,Brent believes that Washington D.C. is a state.,2016-11-08 15:15:40+00:00,d9r4qe1,1.0,t3_5bq9o6,50388.0,howardstern
76,Future school shooter in that picture.,2016-11-08 14:11:26+00:00,d9r1y15,1.0,t3_5bt7i6,2188.0,EnoughTrumpSpam
77,Donnie hates American cars. His campaign is sponsoring a Toyota in NASCAR.,2016-11-08 01:07:58+00:00,d9qeosa,1.0,t3_5bq424,1274.0,EnoughTrumpSpam
78,All right. Here are the issues; I'm gonna make this short and sweet.,2016-11-08 01:01:49+00:00,d9qef7j,1.0,t3_5bo4dh,20992.0,howardstern
79,You forgot to mention black men sleeping with your white daughters and the evils of reefer.,2016-11-08 00:57:45+00:00,d9qe8re,2.0,t1_d9qc8mk,2804.0,howardstern
80,"Is this the mainstream media that dominates AM talk radio, or is it the mainstream media based out of Moscow?",2016-11-08 00:55:59+00:00,d9qe625,1.0,t3_5bpfz7,7915.0,EnoughTrumpSpam
81,"&gt; (even Robin who should be on the banned list by every insurance company in the country)

""I want Obamacare repealed so Howard Stern's sidekick will suffer.""",2016-11-07 21:56:02+00:00,d9q609v,1.0,t3_5bp212,936.0,howardstern
82,"Too late, Ivanka.",2016-11-06 19:02:43+00:00,d9ogkv7,1.0,t3_5bhdbk,25.0,EnoughTrumpSpam
83,"This is almost a candidate for /r/thatHappened

&gt; Donald Trump's attorneys skip physical letters, send cease and desist letters directly through Reddit. The USPS hates him!",2016-11-06 19:01:24+00:00,d9ogil9,1.0,t3_5bhbtb,417.0,EnoughTrumpSpam
84,"OH MY GOD, HE'S GOT A SIGN! QUICK, TAKE HIM DOWN BEFORE HE OFFENDS SOMEBODY!",2016-11-06 14:40:22+00:00,d9o5p9i,1.0,t3_5bdxgz,40417.0,EnoughTrumpSpam
85,"You could cover your Hillary sign with razor blades and shoot at whoever tries to steal it.

After all, if it's acceptable behavior for one candidate, it's acceptable behavior for all of them, right?",2016-11-06 14:36:30+00:00,d9o5kij,1.0,t3_5bfqqw,3559.0,EnoughTrumpSpam
86,Higher than 1?,2016-11-06 14:32:16+00:00,d9o5fh8,2.0,t1_d9o4k6a,1640.0,justneckbeardthings
87,"I'd wager a bet and say that /u/coupdetaco only works in operations, at best.",2016-11-05 02:05:49+00:00,d9me7bq,1.0,t3_5b56uy,28374.0,EnoughLibertarianSpam
88,"&gt; [Plus if it was legalized purity could be monitored and enforced.](https://np.reddit.com/r/BitcoinMarkets/comments/5a4f3m/daily_discussion_sunday_october_30_2016/d9k9mpu/)

OxyContin and Xanax are both legal, and that doesn't keep people from dying from overdoses on those.",2016-11-05 02:01:03+00:00,d9me10m,1.0,t3_5axpsw,120710.0,Buttcoin
89,"&gt; Well I'm Canadian

In that case, your opinion means fuck all, doesn't it?",2016-11-05 01:56:43+00:00,d9mdv9i,5.0,t1_d9mdfzi,670.0,EnoughTrumpSpam
90,Mark Cuban could buy Donald Trump ten times over and have change left to build a skyscraper.,2016-11-04 22:13:07+00:00,d9m51sh,2.0,t1_d9m09w5,6261.0,EnoughTrumpSpam
91,Do they even have a functional product?,2016-11-04 20:16:49+00:00,d9lzoq1,1.0,t3_5b43oj,18230.0,Buttcoin
92,"&gt; I honestly hoped BTCers would be slightly less prone to such BS than your wallstreet sheeples.

I would bet money that this guy owns a Guy Fawkes mask and a fedora.",2016-11-04 20:13:14+00:00,d9lzidi,1.0,t3_5b4iq9,13800.0,Buttcoin
93,Do you frequently purchase gifts for strippers and regular chicks?,2016-11-04 20:08:46+00:00,d9lzaae,1.0,t3_5b4doa,14915.0,howardstern
94,That's cheap for the location.,2016-11-03 21:18:21+00:00,d9kkbva,2.0,t1_d9k7zho,14301.0,howardstern
95,"She doesn't like the attention that she is getting on the Internet. That's pretty much it. Everyone else is fair game though, especially when her newest husband is the perpetrator.",2016-11-03 21:11:37+00:00,d9kk07d,1.0,t3_5az0vf,4230.0,EnoughTrumpSpam
96,"&gt; Indeed, I'm not letting you off the metaphorical hook here. :) I'm just shaking my head at the people over on Buttcoin who think this is somehow a problem with the concept of cryptocurrency as a whole.

At least we aren't saying ""sorry for your loss"" right before telling victims to throw more money away.",2016-11-02 23:10:47+00:00,d9j3q2o,5.0,t1_d9iyl6j,6498.0,ethereum
97,euphoric ,2016-11-02 14:26:16+00:00,d9id7fz,1.0,t3_5anipb,42470.0,EnoughLibertarianSpam
98,I hope so. ,2016-11-02 14:11:43+00:00,d9ick8u,,t1_d9clqpg,,howardstern
99,"What's he saying, Robin?",2016-11-02 13:16:46+00:00,d9iad79,1.0,t3_5apjtr,3274.0,howardstern
100,Is this person on hormone therapy?,2016-11-01 15:17:08+00:00,d9gw0iy,1.0,t3_5ahzau,24811.0,EnoughTrumpSpam
101,It's because New Balance sells Velcro shoes for adults.,2016-10-31 20:07:45+00:00,d9fua3h,1.0,t3_5adzfr,6113.0,justneckbeardthings
102,It went right up his nose.,2016-10-31 19:41:07+00:00,d9fswl6,1.0,t3_5adp9b,7210.0,EnoughTrumpSpam
103,Howard knows absolutely nothing about Gary's personal life after he unfriended his boff.,2016-10-31 18:23:58+00:00,d9fox65,1.0,t3_5a8mee,72973.0,howardstern
104,"Okay, thank you for your call!",2016-10-31 18:21:18+00:00,d9fos3h,1.0,t3_5aaecj,50498.0,howardstern
105,"$12,000?! Sorry for your loss.",2016-10-28 20:53:43+00:00,d9bynl4,1.0,t3_59v226,19115.0,Buttcoin
106,How much of their VC money was spent on that domain name?,2016-10-28 20:50:41+00:00,d9byiql,1.0,t3_59wtaa,682.0,Buttcoin
107,"Donald Trump stiffs everyone, including Donald Trump.",2016-10-28 14:49:35+00:00,d9bgswe,1.0,t3_59trx6,14443.0,EnoughTrumpSpam
108,"What's he saying, Robin?",2016-10-28 14:42:10+00:00,d9bggm5,1.0,t3_59uoyv,826.0,howardstern
109,"Hello hello, Alexa.",2016-10-28 14:41:36+00:00,d9bgfog,1.0,t3_59rtbo,47846.0,howardstern
110,"&gt; My reason isn't due to any inherent dislike of African Americans. It's due to the fact that allowing them to vote has a negative effect on the political landscape.
&gt; 
&gt; Also, a vast majority of people support mandatory voter id laws.

""Voter ID laws aren't racist, but they're good at keeping the blacks from voting, and that isn't racist!""",2016-10-28 06:49:30+00:00,d9b4txn,4.0,t1_d9b4g24,1056.0,EnoughLibertarianSpam
111,"&gt; It's not racism, these people just happen to overwhelmingly support democrats and must have their vote neutralized as a result. It's not racism, it's pragmatism.

""I don't want the blacks to vote, but I said it isn't racist, so it's not racist!""",2016-10-28 06:28:39+00:00,d9b4dfo,2.0,t1_d9avap7,16273.0,EnoughLibertarianSpam
112,How do you play vinyl on a Sonos system?,2016-10-25 23:54:23+00:00,d97s3gr,1.0,t3_59bplu,29522.0,howardstern
113,"I feel your pain, James. My lawyers are telling me not to release medical records showing that James O'Keefe is an HIV positive heroin addict.",2016-10-25 23:39:51+00:00,d97rh8z,1.0,t3_59dp59,7752.0,EnoughTrumpSpam
114,"The last time a state tried to succeed, the Union smacked down the rebellion. And that was 80 years before the United States built nuclear weapons.",2016-10-25 23:36:03+00:00,d97rbmj,1.0,t3_59ea9e,791.0,EnoughTrumpSpam
115,"**FBI Prosecutor:** Judge, if it pleases the court, I'd like to introduce, as Exhibit A, this email message that shows Hillary Clinton conspiring with George Soros, the Bilderberg Group, and Mossad to rig the election.

**Judge:** Did you, or someone in your bureau, get this email message by subpoenaing the Internet service that hosted the email?

**FBI Prosecutor:** No.

**Judge:** Were you or your bureau given this email by a witness in this courtroom?

**FBI Prosecutor:** No.

**Judge:** How did you obtain this email message?

**FBI Prosecutor:** I downloaded it off of some random Web site that a paranoid guy in exile says is real.

**Judge:** Case dismissed. Prosecutor, step into my chambers.",2016-10-25 23:34:23+00:00,d97r8zb,1.0,t3_59eahj,615.0,EnoughTrumpSpam
116,We don't know that. Inside sources say that Donald killed his brother and made it look like alcohol poisoning.,2016-10-25 20:57:07+00:00,d97kfda,2.0,t1_d97jjhl,1070.0,EnoughTrumpSpam
117,Has this kid ever had a real job?,2016-10-24 21:42:20+00:00,d966gja,1.0,t3_5978pc,404.0,EnoughTrumpSpam
118,"""Hi, I'm Gary Dell'Abate, it's time for 'Addicted To Childhood'.""",2016-10-24 20:53:56+00:00,d9645f9,1.0,t3_5940a1,33832.0,howardstern
119,SHAKE SHAKE SHAKE SHAKE,2016-10-24 20:49:57+00:00,d963ybu,1.0,t3_5937xu,49895.0,howardstern
120,Have you ever snorted the purest of Colombian nose candy? Your nose would drip like a levy in Louisiana if you ever did.,2016-10-24 20:17:32+00:00,d962cni,2.0,t1_d95tz5i,10117.0,EnoughTrumpSpam
121,Don't worry. It's physically impossible for any of them to carry out a lynching.,2016-10-24 01:57:03+00:00,d951i07,1.0,t3_5921nq,924.0,EnoughTrumpSpam
122,"Define ""European"". Different countries in Europe have different definitions of protected speech.",2016-10-24 01:53:15+00:00,d951cj3,1.0,t3_5912k6,13441.0,EnoughTrumpSpam
123,I hope you learned your lesson: don't use bit-coin.,2016-10-23 20:46:52+00:00,d94oylp,1.0,t3_53i3t7,2956582.0,Scams
124,https://www.reddit.com/r/justneckbeardthings/comments/4e1rny/when_you_were_partying_i_studied_the_blade/,2016-10-23 16:43:45+00:00,d94duaz,2.0,t1_d94c655,2404.0,justneckbeardthings
125,"For Trump's sake, let's hope he flip-flops on his position on libel laws. Barack Obama and Ted Cruz have solid cases against Donnie should he actually become President.",2016-10-23 16:27:22+00:00,d94d4lh,1.0,t3_58yk3a,10504.0,EnoughTrumpSpam
126,Sorry for your loss.,2016-10-22 19:22:53+00:00,d93cb4t,1.0,t3_58ghhn,198660.0,DarkNetMarkets
127,Donald Trump can't file a lawsuit by himself because he's too stupid to figure out the process. His lawyers don't file the lawsuits because they know they'd lose.,2016-10-22 19:01:59+00:00,d93bj6f,2.0,t1_d933zv2,11808.0,EnoughTrumpSpam
128,"Hold up a sign saying ""Where's The Money?""",2016-10-20 21:42:21+00:00,d90wrpy,1.0,t3_58jf6g,1762.0,EnoughTrumpSpam
129,[m'Isabelle](http://media.ign.com/games/image/object/077/077803/animalcrossinge1.jpg),2016-10-19 20:14:25+00:00,d8z8s4p,1.0,t3_5886f8,61287.0,justneckbeardthings
130,Frivolous lawsuits are frequently puzzling.,2016-10-19 17:19:14+00:00,d8yzhe9,1.0,t3_58aide,10670.0,EnoughTrumpSpam
131,"She stopped being an ""innocent bystander"" when she became a public figure.",2016-10-18 15:00:45+00:00,d8x9sp0,2.0,t1_d8x6ksn,4322.0,EnoughTrumpSpam
132,"Melania should seriously consider creating and entering an ""America's Biggest Cunt"" contest. She'd get more votes than her husband in this election.",2016-10-17 12:24:55+00:00,d8vlvr8,1.0,t3_57w2c7,19537.0,EnoughTrumpSpam
133,Trump will have Julian Assange killed right after he has Edward Snowden assassinated. This isn't a very extreme prediction: Trump already supports executing Snowden.,2016-10-17 12:18:52+00:00,d8vlppk,1.0,t3_57wvp4,2027.0,EnoughTrumpSpam
134,"Many people complain about a ""liberal bias"" in the media. If you believe this: would you be willing to lobby your congressman to introduce legislation to make the FCC regulate the news and opinions expressed on the Internet?",2016-10-15 17:13:08+00:00,d8t8sel,12.0,t1_d8t8m81,256.0,howardstern
135,"What's he saying, Robin?",2016-10-15 17:05:38+00:00,d8t8hkl,10.0,t1_d8t8e9u,142.0,howardstern
136,"Plus tip.

Also, there was a recent conversion where Howard talked about how much planning it took for a delivery team to get a 100 inch TV into his apartment.",2016-10-15 17:05:07+00:00,d8t8gu8,4.0,t1_d8t1v2d,10941.0,howardstern
137,James O'Keefe also lives with his parents in a New Jersey suburb.,2016-10-15 01:43:44+00:00,d8sl34t,2.0,t1_d8skosu,670.0,EnoughTrumpSpam
138,"If you could **guarantee** that Donnie would win the election, I would lay a thousand dollars on him winning in an offshoot betting parlor. Seriously: a $1 bet for Donnie pays $6 versus $1.20 for Hillary Clinton. Either way, my net worth would exceed his.",2016-10-14 22:35:20+00:00,d8se7ij,1.0,t3_57hgyj,19430.0,EnoughTrumpSpam
139,$800 wine.,2016-10-14 21:08:27+00:00,d8san9y,1.0,t3_57ihv4,2863.0,howardstern
140,"What's he saying, Robin?",2016-10-14 21:06:21+00:00,d8sak1b,2.0,t1_d8s89in,3019.0,howardstern
141,"I'm amazed that she can speak any English beyond ""me love you long time"".",2016-10-14 17:17:20+00:00,d8rzlp6,2.0,t1_d8rnkx9,16209.0,howardstern
142,"When a musician whose most famous verse is [""I wanna fuck you like an animal""](https://en.wikipedia.org/wiki/Closer_(Nine_Inch_Nails_song)) calls you deplorable, it's time to seek therapy.",2016-10-14 16:45:01+00:00,d8ry0c8,1.0,t3_57gt3o,5882.0,EnoughTrumpSpam
143,"What are they threatening to do? Complain?

Ooh, I'm *so* ***scared.***",2016-10-13 00:54:06+00:00,d8pmfb6,1.0,t3_577fu6,2329.0,EnoughTrumpSpam
144,"Uh oh, he's threatening to file a frivolous lawsuit again! It's like the rich spoiled brat version of being ""triggered"".",2016-10-13 00:08:45+00:00,d8pkj8s,1.0,t3_577al0,1576.0,EnoughTrumpSpam
145,You elderly gorilla.,2016-10-12 21:04:15+00:00,d8pcj8b,1.0,t3_575ufc,7314.0,howardstern
