,body,created,id,nest_level,parent_id,reply_delay,subreddit
288,Do you own a gun?,2016-04-26 20:59:02+00:00,d2ig5wy,1.0,t3_4gkma0,4127.0,neckbeardstories
289,"Apart from this story being $100% true, fat people do ""borrow"" disabled people's handicapped placards to use. I've seen paraplegics shake their head at these people.",2016-04-06 19:49:41+00:00,d1sk6tr,1.0,t3_4dl8pu,32085.0,fatpeoplestories
290,m'repost,2016-04-06 19:39:50+00:00,d1sjpd4,1.0,t3_4dn9ai,1919.0,justneckbeardthings
291,"Court records show his New York rental property managers discriminated against anyone who wasn't white. Donnie isn't responsible because reasons.

He's also a libel tourist who had sex with his mother in an outhouse and married a whore.",2016-03-21 21:49:42+00:00,d18dndv,2.0,t1_d187ep5,8589.0,justneckbeardthings
292,"By ""PC"", he means *post coital*, which he'll never experience.",2016-03-17 20:20:01+00:00,d13opvs,1.0,t3_4auefh,7127.0,justneckbeardthings
293,"&gt; indecesent

He can't possibly be a true gent(le)sir. Where's his spell checker and online thesaurus bundle?",2016-03-07 20:47:12+00:00,d0r6p78,1.0,t3_49eej1,3382.0,justneckbeardthings
294,"Things Bit-Coiners know nothing about:

1. Computers.
2. Monetary policy.
3. **Financial statements.**",2016-03-07 19:37:30+00:00,d0r3l5z,1.0,t3_49dz16,4337.0,Buttcoin
295,"&gt; Unlike subjectively hallucinated replacements for reality, the genuine article works on what is, not like what you feel like being. Miner cartel is just as capable of ignoring your ""rbf"" bells and whistles as it's capable of ignoring traditional transactions.

Mircea is wearing out his English thesaurus.

&gt; I think you might be retarded, so this won't likely help you, but in general : I'm a guy worth a cool billion bits of the toilet paper you call money when talking into the clown mouth/food pellet dispenser.

Never mind. He put down his thesaurus in anger.",2016-03-02 20:45:57+00:00,d0l5t1i,1.0,t3_48n7bd,11300.0,Buttcoin
296,i can be yuor repost,2016-02-24 01:49:09+00:00,d0behtx,2.0,t1_d0bctj7,2318.0,justneckbeardthings
297,"I'm going to send Ross every article I can find about the nation's growing opiate addiction problem, along with pictures of people having fun outside of prison for good measure.",2016-02-19 14:53:59+00:00,d05vp4u,1.0,t3_46hs64,53828.0,Buttcoin
298,That was /u/luke-jr ,2016-02-18 18:49:15+00:00,d04te81,2.0,t1_d04t8dx,193.0,Buttcoin
299,Were you expecting something different? /u/theymos profits on bit-coin scams.,2016-02-18 18:27:07+00:00,d04saw9,2.0,t1_d043hgq,53179.0,Buttcoin
300,They have the client's phone number on it.,2016-02-18 18:25:50+00:00,d04s8nw,2.0,t1_d04hmvx,14872.0,fatpeoplestories
301,"So, crazy people, then.",2016-02-16 22:45:21+00:00,d02h9ow,6.0,t1_d02ex3x,3290.0,Buttcoin
302,"&gt; The Most Serene Republic of Bitcoin

Do people actually say things like this?",2016-02-16 21:47:44+00:00,d02ese1,4.0,t1_d02ealu,645.0,Buttcoin
303,"It is safe to have drugs mailed to your house -- for the detectives investigating you, since it gives them a slam-dunk case.",2016-02-12 20:59:30+00:00,czxr5r7,2.0,t1_czxqups,452.0,Buttcoin
304,"HACK THE PLANET! ZERO COOL!

This text is ancient, by the way.",2016-02-12 20:58:05+00:00,czxr3ou,1.0,t3_45g2x4,9054.0,justneckbeardthings
305,"&gt; there would be less killings and war if women gave out sex more often

""GIVE ME SEX OR I WILL PERFORM HEINOUS ACTS!""",2016-02-12 17:10:14+00:00,czxhchw,2.0,t1_czxg7br,1583.0,justneckbeardthings
306,It's a trilby!,2016-02-04 20:50:08+00:00,cznzm5g,2.0,t1_cznvvc3,5113.0,justneckbeardthings
307,Does this include Cryptsy and MMM?,2016-02-04 20:39:15+00:00,cznz4vq,1.0,t3_44743s,1242.0,Buttcoin
308,https://en.wikipedia.org/wiki/Dunning–Kruger_effect,2016-02-04 17:56:48+00:00,cznrz7m,9.0,t1_cznrtaj,215.0,Buttcoin
309,"&gt; Banks don't invest in scams. Microsoft doesn't invest in scams. Venture Capitalists don't invest in scams.

Of course they do. They invested in bit-coin.

Are we playing the repeating game? ""You aren't really proving any argument for your point of view.""",2016-02-04 17:44:45+00:00,cznrfuh,7.0,t1_cznqzkn,618.0,Buttcoin
310,"Banks lose money on investments. Microsoft has lost money on software. Venture Capitalists lose money all the time.

You aren't really providing a good argument for your point of view.",2016-02-04 17:28:26+00:00,cznqpya,5.0,t1_cznqi2k,293.0,Buttcoin
311,That's because it *is* a big scam.,2016-02-04 17:08:44+00:00,cznpuqa,3.0,t1_cznprap,131.0,Buttcoin
312,[Looks like our friend got SKULLFUCKED again.](https://np.reddit.com/r/Bitcoin/comments/444bpx/warning_blatant_scam/cznfzlj) He just can't catch a break. 😓,2016-02-04 17:04:13+00:00,cznpnk7,1.0,t3_445pbp,5996.0,Buttcoin
313,Block chain and reasons.,2016-02-04 17:00:30+00:00,cznphtq,2.0,t1_cznp4x4,484.0,Buttcoin
314,You submitted this fluff article to the wrong sub. Give up the weasel dust and check the URL again.,2016-02-04 16:56:41+00:00,cznpbnq,1.0,t3_4459px,11988.0,Buttcoin
315,Sorry for his loss. ,2016-01-31 21:05:32+00:00,czixnkh,2.0,t1_czirl7n,10248.0,Buttcoin
316,"[Slavery is ethically ok.](https://np.reddit.com/r/Bitcoin/comments/43g8dq/capitalism_will_not_survive_the_financial/czhzm90)

Why are there only white men in Bitcion?!?!",2016-01-31 07:30:02+00:00,czie7dc,1.0,t3_43dz1t,66750.0,Buttcoin
317,"That isn't outside of the realm on possibility: /u/luke-jr vouched for Butterfly Labs, and /u/MemoryDealers (famously) vouched for Mt. Gox.",2016-01-31 07:28:56+00:00,czie6lu,2.0,t1_czie15u,480.0,Buttcoin
318,"Paint two coats of Kilz primer over the entire machine, then buy several square meters of silver-imbued copper mesh to turn your entire domicile into a Faraday cage.",2016-01-27 16:54:44+00:00,czdzwme,1.0,t3_42ybjs,564.0,Buttcoin
319,"He knows he's involved with shady characters. Luke got free equipment from Butterfly Labs while they were in business, so he was always provided with the best SHA256 hashing computers. Now that Butterfly Labs is gone, and since he can't convince any other manufacturers to give him discounted or free hardware, he's desperately trying to get the hashing algorithm changed so GPUs -- which he can buy in bulk for cheap -- will become a new source of income. The only legitimate reason he's given for keeping the block size at one megabyte is because he doesn't want to pay for faster Internet access at his home.

To him, it doesn't matter because it makes him money and he doesn't *directly* engage in those sins.",2016-01-27 16:38:44+00:00,czdz7py,2.0,t1_czdjdi5,40758.0,Buttcoin
320,"&gt; /u/ryancarnated's retarded fucking half-baked 'reddit notes'

To be fair to Reddit, they fired him and cancelled that project.",2016-01-27 16:28:38+00:00,czdys09,6.0,t1_czdj6nc,40539.0,Buttcoin
321,"[@krakenfx, you guys must sue @eastdakota|CloudFare! This is against the law! Take the money from them and share it with your customers! ;-)](https://twitter.com/ThiagoCMC/status/692174136748154881)

Typical Bit·coin mentality: expect money for nothing.",2016-01-27 16:26:06+00:00,czdyo7n,1.0,t3_42vbdo,49295.0,Buttcoin
322,"""Consensus"" means /u/theymos and /u/luke-jr agree with it.",2016-01-16 18:16:13+00:00,cz0l1n3,1.0,t3_4194i9,5473.0,Buttcoin
323,"&gt; centralisation

This kid is from Florida, born and raised. His spelling wears a fedora.",2016-01-16 18:14:59+00:00,cz0l05l,1.0,t3_41922k,6369.0,Buttcoin
324,He hasn't already?,2016-01-15 18:30:49+00:00,cyzgz06,2.0,t1_cyzenho,3207.0,Buttcoin
325,"No. The proof is in your own replies.

Keep replying, by the way.",2016-01-15 03:21:58+00:00,cyys9rl,19.0,t1_cyys5cr,195.0,Buttcoin
326,"lol, you're still asking for bestiality porn too",2016-01-15 03:13:50+00:00,cyyryrr,17.0,t1_cyyrwmo,90.0,Buttcoin
327,"&gt; It's a private law suit.

...filed in a public court of law.",2016-01-15 03:13:05+00:00,cyyrxp8,2.0,t1_cyyf8b0,19700.0,Buttcoin
328,"lol, you're still responding to me",2016-01-15 03:11:41+00:00,cyyrvqi,15.0,t1_cyyiz94,14216.0,Buttcoin
329,What did you want a picture of? Be specific,2016-01-14 20:48:25+00:00,cyycqhs,13.0,t1_cyycl1m,202.0,Buttcoin
330,"Just replace ""dereliction of duty"" with ""violation of the non-aggression pact"". Poof, China is a libertarian paradise!",2016-01-14 20:43:10+00:00,cyychz9,2.0,t1_cyybgzn,1401.0,EnoughLibertarianSpam
331,"Lying about what, exactly? You being angry? That's no lie.",2016-01-14 20:39:13+00:00,cyycbne,11.0,t1_cyy2ovn,12976.0,Buttcoin
332,Does dog porn turn you on? That's the only logical reason why you'd be asking for such a thing.,2016-01-14 16:46:13+00:00,cyy1yyx,9.0,t1_cyx3x29,69898.0,Buttcoin
333,"No, I'm saying that bit-coiners are retarded, and they are bound to lose money. It always happens.",2016-01-13 17:47:48+00:00,cywu66k,5.0,t1_cywso8g,2064.0,Buttcoin
334,"Tell that to the people who lost money with Mt. Gox, Moolah, and Cryptsy.",2016-01-13 15:13:15+00:00,cywnsu2,3.0,t1_cywmprl,1933.0,Buttcoin
335,"It's likely from a defunct site called AnonTalk. Ironically, it was started by a man who was banned from 4chan for posting CP.

",2016-01-13 13:14:20+00:00,cywkbmj,2.0,t1_cywj3g1,3636.0,EnoughLibertarianSpam
336,"Also, ignore the diary, and the block chain, and the fact that his first advertisement for Silk Road had his real name on it.",2016-01-13 13:06:38+00:00,cywk5e0,5.0,t1_cywizlw,3538.0,Buttcoin
337,Roger Ver was being paid by Mark Karpeles. That's the difference.,2016-01-13 13:02:30+00:00,cywk283,2.0,t1_cywgh05,12982.0,Buttcoin
338,You seem upset. What's the matter?,2016-01-13 12:55:55+00:00,cywjx5q,7.0,t1_cyw8353,33063.0,Buttcoin
339,"Post the transaction ID you originally received the coins at, and sign the message with the public key of the address you originally received the coins at.",2016-01-13 02:28:34+00:00,cyw53uy,5.0,t1_cyvycpk,10636.0,Buttcoin
340,People with the mind of a child shouldn't be teaching children.,2016-01-12 19:01:08+00:00,cyvmer9,1.0,t3_40n8sf,7127.0,EnoughLibertarianSpam
341,"By removing a blue check from a libertarian's microblog, Twitter acted like a statist by committing an act of aggression. Therefore, asking an actual government to revert the act of aggression is completely justified and is in no way liberal.",2016-01-12 18:58:29+00:00,cyvmaik,2.0,t1_cyvlooc,805.0,EnoughLibertarianSpam
342,A man who considers himself his own bank is giving a fool a line of credit.,2016-01-12 16:09:49+00:00,cyvf0cf,4.0,t1_cyv8tze,12033.0,Buttcoin
343,No you didn't.,2016-01-12 16:07:02+00:00,cyvewfl,3.0,t1_cyv8aiz,13498.0,Buttcoin
344,Found the neckbeard. ,2016-01-11 05:01:14+00:00,cytqebw,2.0,t1_cytqbdb,178.0,neckbeardstories
345,"The girl is dressed as Revy from ""Black Lagoon"", and she isn't morbidly obese. What's the problem?",2016-01-11 04:57:52+00:00,cytqazc,1.0,t3_40el5n,9721.0,justneckbeardthings
346,"Yes.

My knowledge of the surname ""Sato"" only extends to James Bond villains and bisexual CEOs, and I could see the error in his ways.",2016-01-10 22:13:49+00:00,cytbvx8,2.0,t1_cyswv2r,24551.0,Buttcoin
347,"You don't need loops to have a Turing-complete machine. Then again, you don't need opcodes for Bitcoin. All you really need is an array of inputs (public keys), an array of outputs (public key hashes and amounts), and signatures for each input.",2016-01-10 22:11:56+00:00,cytbtaw,3.0,t1_cyt1vwf,14898.0,Buttcoin
348,"&gt; I bought BTC in mid-2013 at an average price of $80US. 

I love guys like this.

Prove that you actually owned bit-coins in 2013 by doing the following:

 1. Post the address you had the bit-coins deposited in.
 2. Post the transaction ID where the deposit occurred. (This transaction should have been in the block-chain as of 2013.)
 3. Post a signed message using the public key of your address.
 4. Deposit a trivial amount of bit-coins into the same address to prove that you simply didn't find a compromised private key.

You will not do this.",2016-01-01 21:04:34+00:00,cyillqm,8.0,t1_cyik8y7,2397.0,neckbeardstories
349,"Funny how they don't mention Norway. They abandoned the gold standard well before Nixon did, and yet income inequality didn't jump.

(I expect libertarians to say ""something something lots of white people in Norway"".)",2015-12-31 22:29:27+00:00,cyhqqyy,2.0,t1_cyhnzwk,5089.0,Buttcoin
350,Like how Mt. Gox and the bearwhale were anomalies? The bitcion community must've put rocket thrusters on those goal posts to get them to move so fast.,2015-12-31 16:42:57+00:00,cyhelfk,2.0,t1_cyhd6ih,2539.0,Buttcoin
351,**HARM REDUCTION! THE CAT THREATENED HIM!** *etc.*,2015-12-30 01:45:19+00:00,cyfni42,1.0,t3_3yq2up,2576.0,Buttcoin
352,Needs more black bars to represent censorship of certain transactions he doesn't like.,2015-12-28 14:36:46+00:00,cydssb2,1.0,t3_3yilw4,7910.0,Buttcoin
353,"&gt; So you're saying police unions don't lobby for mass incarceration?

Yes, because the police are not judges.",2015-12-27 09:06:36+00:00,cycm0nf,6.0,t1_cyclsoh,915.0,EnoughLibertarianSpam
354,"Private prisons are lobbyists who say, ""put people in my prison and pay me for the privilege"". Show me the lobbyist who says, ""raise my taxes so you can put more people in the government run prison"".",2015-12-27 08:16:12+00:00,cycl8uv,4.0,t1_cycl506,402.0,EnoughLibertarianSpam
355,"&gt; I keep hearing the ""these companies will lobby to keep mass incarceration"" line

They already do lobby to arrest more people. That's how they make money -- they get the government to arrest people.",2015-12-27 07:57:19+00:00,cyckxlh,2.0,t1_cycksus,447.0,EnoughLibertarianSpam
356,"They must be shitty libertarians to not realize that private prisons provide an economic incentive for government overreach.

**edit:** found the libertarian hypocrite:

* [Oh shut it ... At least GEO paid me dividends.](https://np.reddit.com/r/politics/comments/3ybx9p/uc_system_divests_30_million_in_prison_holdings/cycgb2n)
* [How do you feel about putting the people who can't pay the fine in jail?](https://np.reddit.com/r/worldnews/comments/3ycnun/italy_to_fine_smokers_300_for_tossing_cigarettes/cycj8b1)",2015-12-27 07:43:20+00:00,cyckond,2.0,t1_cycaj3l,22885.0,EnoughLibertarianSpam
357,Damn. I was hoping for /r/rWeAreBetterBitcoinXT,2015-12-26 04:43:31+00:00,cybk3db,1.0,t3_3y5nqf,82377.0,Buttcoin
358,/r/thatHappened,2015-12-26 04:09:46+00:00,cybj9rc,1.0,t3_3y8vwt,3477.0,Buttcoin
359,"&gt; I don't do that anyway

Of course ""you"" don't, [but your software does](https://github.com/luke-jr/bitcoin/blob/spamfilter/src/main.cpp). It looks in each transaction for specific addresses; if it finds one, the transaction is removed from the mempool.",2015-12-26 04:08:27+00:00,cybj8kg,7.0,t1_cybi3xq,2687.0,Buttcoin
360,"That's a new one. When a government firewall in China drops a packet, it's merely deciding not to forward a packet! Totally not censorship!

When you actively search for and drop transactions you personally don't like in the theoretically decentralized bitcoin network, and when those transactions still contain valid inputs and an appropriate fee, that's censorship.",2015-12-26 02:48:24+00:00,cybh92z,5.0,t1_cybgcxq,2252.0,Buttcoin
361,"&gt; Is that me?

Yes. It looks like you've clarified your opinion.

&gt; Since they don't get any rewards or fees for their service, you should wonder what are their motivations.

A warm fuzzy feeling?",2015-12-26 02:08:42+00:00,cybgb1q,3.0,t1_cybd4dl,7514.0,Buttcoin
362,Censorship isn't censorship. Bitcoin in a nutshell.,2015-12-26 02:06:39+00:00,cybg9a4,3.0,t1_cybeyp7,3185.0,Buttcoin
363,"We have a local computer scientist (a PhD, not a captain of industry with a partial community college credit) who stated that adding more nodes is actually detrimental to the network. Basically, there are only nine or ten miners in the entire world, so adding more nodes just adds more hops for a transaction to take. More hops also means a higher possibly of failure. One developer, /u/luke-jr, runs a node that actively censors transactions -- something that is surprising easy to do.

Did BTCC just buy a few more IP addresses? If not, adding more modes is useless.",2015-12-25 19:13:22+00:00,cyb598g,1.0,t3_3y79lg,3192.0,Buttcoin
364,"Do students in India typically have $11,375 to spare?",2015-12-25 18:58:55+00:00,cyb4vl4,1.0,t3_3y6t4u,11999.0,Buttcoin
365,How many seats did the US government need to buy to get this guy flown overseas?,2015-12-23 17:24:38+00:00,cy93xqv,1.0,t3_3xyz7l,6943.0,Buttcoin
366,You know you've made a good argument when your opponent issues death threats against you.,2015-12-23 17:20:00+00:00,cy93rg0,4.0,t1_cy8nsuo,42969.0,Buttcoin
367,"It takes a big man to admit when he's wrong.

You are not a big man.",2015-12-23 03:34:57+00:00,cy8koc7,2.0,t1_cy886c9,21582.0,Buttcoin
368,"""Harm reduction"" means ""bought from a white guy"". He **stole** the drugs, so not only is it not harm reduction, but it's a violation of the non-aggression principle, so under the libertarian point of view he deserved to die.",2015-12-21 15:27:48+00:00,cy6mwev,2.0,t1_cy66lpy,44753.0,Buttcoin
369,"~~SECURE~~

~~FAST~~

~~NO FEES~~

What's the benefit of bit-coin, again?",2015-12-18 16:39:34+00:00,cy3ixeg,1.0,t3_3xc9vg,12888.0,Buttcoin
370,99% or more. The Feds don't just file wanton indictments.,2015-12-18 16:24:06+00:00,cy3ic46,11.0,t1_cy3hdr8,1533.0,EnoughLibertarianSpam
371,"By that method of reasoning, you're just as biased as I am -- possibly more.",2015-12-17 15:42:21+00:00,cy2agmn,7.0,t1_cy1getq,66530.0,investing
372,"The guy once thought he was important enough for a Wikipedia article: https://en.wikipedia.org/wiki/Wikipedia:Articles_for_deletion/Mircea_Popescu

The guy can't even use proxies correctly -- the WP admins quickly point out that every person defending the article seems to be from Romania.",2015-12-16 15:51:09+00:00,cy12yok,3.0,t1_cy128lc,1188.0,Buttcoin
373,Bit•coin is eating itself.,2015-12-16 15:27:05+00:00,cy1239p,1.0,t3_3x1s72,32233.0,Buttcoin
374,"&gt; Dude can't write either.


But he can use a thesaurus.",2015-12-16 14:55:11+00:00,cy10zud,2.0,t1_cy0x4cy,9330.0,Buttcoin
375,People still own PayCoin?,2015-12-16 14:53:50+00:00,cy10y9n,1.0,t3_3x2zo4,970.0,Buttcoin
376,"Linden dollars have a better chance of becoming the global reserve currency. Hell, Beanie Babies have a better chance.",2015-12-15 23:22:19+00:00,cy0ctfr,1.0,t3_3wzgdi,10890.0,Buttcoin
377,"Yes: the ""News"" feature. They need a way to announce bugs.

Also, for /r/SorryForYourLoss: 24 butts * $469 = $11,256",2015-12-15 22:16:30+00:00,cy0a1gy,2.0,t1_cy05kbr,6194.0,Buttcoin
378,"&gt; I won't because your definition of ""early"" adopter is irrelevant vanity.

I'm using **your** definition. **You** said you bought coins in 2013. Back up **your** words or shut up. Nobody here is going to hold your bag or subsidize your weasel dust habit.",2015-12-14 18:10:02+00:00,cxyvses,17.0,t1_cxyvl5b,311.0,investing
379,"Of course you won't, because you have no proof, despite proof being easy to generate.",2015-12-14 17:59:22+00:00,cxyvdb6,15.0,t1_cxyv419,403.0,investing
380,"**Ver**ified.

Roger Ver sold fireworks. Some fireworks are known as a ""[chaser](https://www.youtube.com/watch?v=jJAM4Sw0UHc)"". He probably used the same ""chaser"" slang.",2015-12-14 17:38:41+00:00,cxyukrh,3.0,t1_cxypkup,8114.0,Buttcoin
381,"Basically, we need almost everything needed to sign up for Cryptsy, but unlike Cryptsy we won't steal your identity.",2015-12-14 17:34:49+00:00,cxyuf5e,3.0,t1_cxyudgm,72.0,Buttcoin
382,**The most upvoted submission in /r/Bitcoin today: a guy in Portugal allegedly bought €0.50 in bit~coins.**,2015-12-14 17:30:44+00:00,cxyu9fy,1.0,t3_3wrxkl,20282.0,Buttcoin
383,"&gt; why does he transfer actual COINZ, to someone else...

/u/luke-jr was taking money and free equipment from Butterfly Labs, and he needed a place to convert their funny money into dollars.",2015-12-14 17:20:20+00:00,cxytv7j,4.0,t1_cxymbfe,14112.0,Buttcoin
384,"Post the address you originally used to exchange real money for bit-coins. Sign a message with the public key to prove that you have the private key, then transfer a trivial amount of money to the address to prove you didn't just pick a compromised private key that's open to the public.

This will prove that you were an actual early adopter, but you will not do this.",2015-12-14 17:18:31+00:00,cxytsvq,13.0,t1_cxyo9re,9451.0,investing
385,"&gt; I am a reporter and I am tentatively working on a piece about Keith Raniere and his involvement with bitcoins.

Send your name, the publication you work for, and a PGP key to the mods as proof.",2015-12-14 17:15:49+00:00,cxytowp,1.0,t3_3wt1m2,345.0,Buttcoin
386,"Again, sorry for your loss.",2015-12-14 11:32:21+00:00,cxyk9gn,11.0,t1_cxxyyoo,46503.0,investing
387,"He wants to look smart. It's difficult to do when you lose a small fortune to MtGox, so he relies on Photoshop.

(If you're curious, [here is where Luke admits to losing half a million dollars](https://np.reddit.com/r/Bitcoin/comments/38mhrh/call_me_inconsiderate_but_this_is_why_i_dont_take/crw6atd). I am not sorry for his loss.)",2015-12-14 11:31:35+00:00,cxyk912,2.0,t1_cxyjp16,2245.0,Buttcoin
388,"You aren't refuting my claim.

Sorry for your loss.",2015-12-13 22:22:03+00:00,cxxydto,9.0,t1_cxxyajw,145.0,investing
389,Useful trivia for libertarians: Wal-Mart stopped selling incandescent bulbs before the EPA mandated it.,2015-12-13 21:54:51+00:00,cxxxcpt,2.0,t1_cxxgjcb,29727.0,EnoughLibertarianSpam
390,"Actually, he was! His foray into JavaScript butts is one reason he was sacked.",2015-12-13 21:48:06+00:00,cxxx37j,5.0,t1_cxxmbgg,15885.0,Buttcoin
391,"My ""fiatscrip"" has appreciated over 300% against your vicodin vouchers since the collapse of Mount Gox. Stop trying to find a new bagholder here; you won't find one.",2015-12-13 21:34:29+00:00,cxxwjs8,7.0,t1_cxxkees,18717.0,investing
392,"Reddit Notes were the brainchild of Ryan X Charles, the quintessential ""ideas man"". Like all *ideas men* he just sat around and expected someone else to do the work. He had a similar attitude toward work: he was fired for working on a JavaScript implementation of Bitcoin Core (!!) during company time.

From [Ryan's activity](https://www.reddit.com/user/ryancarnated) it seems he abandoned Reddit to start a competing site that somehow integrates the block-chain. I don't think he'll get very far.",2015-12-13 07:18:41+00:00,cxxavju,1.0,t3_3wm1wb,7604.0,Buttcoin
393,"&gt; Don't give this sub the time of day, it's nothing more than a bunch of junior McCapitalist wannabes fapping to fantasies of wealth that will never come true.

This is coming from a guy who posts on /r/Bitcoin. Let that sink in.",2015-12-13 07:14:19+00:00,cxxas9k,5.0,t1_cxxa3gk,1859.0,investing
394,"The libertarian train of thought is simple:

* White males: government is evil, no matter the necessity.
* Everyone else: government is necessary, no matter the evil.

I like how libertarians redefine the meanings of words, too. ""Aggression"", for example, can be something as simple as a mean word. Here, they just redefine ""Islam"" as not being a religion. Presto, religious freedom is protected!",2015-12-13 02:25:52+00:00,cxx2lro,2.0,t1_cxwtvrb,16290.0,EnoughLibertarianSpam
395,Meat hooks? Nah. Martin Shkreli will be buried next to Jimmy Hoffa.,2015-12-13 02:20:58+00:00,cxx2g29,2.0,t1_cxx0qy1,3291.0,EnoughLibertarianSpam
396,"&gt; How many bagholders will take advantage and cash out today?

**None.** Literally, *none.*

They're like that one old person in the casino that finally hit 7-7-7 on the slot machine, and has the opportunity to actually walk out of a casino with a profit.

Instead, they'll *keep* their money in shady brokerages. They'll *keep* buying and buying, even as the price goes up. (Basically, reverse dollar-cost-averaging.)

It will culminate with a mining company finally taking some profits, and then the sorrow will begin:

 * Millions of dollars will be siphoned from the pockets of neckbeards all over the world to the miners.
 * People in /r/bitcoinmarkets will cry ""BEARWHALE!"" and will throw their real money at the coin market. You will see post after post saying something like ""WALL AT $$$, COME ON GUYS TAKE IT DOWN"", but it will all be for naught.

(Granted, a few people will cash out, but they will be the lucky ones. This is presuming no bit·coin exchange goes ""broke"", a.k.a. absconds with the money like Mt. Gox, Neo&amp;Bee, Cryptsy, and far too many to mention.)

And where does all that money end up? Why, a bank, of course!",2015-12-12 03:19:37+00:00,cxw44r9,1.0,t3_3wfhgi,21446.0,Buttcoin
397,"I think they don't want their names to be linked to accounts whose funds could be traced to the purchasing of heroin, child porn, or dildos. (Thanks, block·chain!)",2015-12-12 03:05:27+00:00,cxw3p1j,2.0,t1_cxvw5u0,13980.0,Buttcoin
398,[seriously. leave it alone already.](https://www.reddit.com/r/Buttcoin/comments/3sd40d/280/cwwjwie),2015-12-12 03:03:55+00:00,cxw3ndc,2.0,t1_cxw0t0g,5502.0,Buttcoin
399,"His offer to help the fake cult guy, who happened to be a pedophile (I can't recall his name), also shows how much of a true Catholic he is.",2015-12-11 17:57:14+00:00,cxvjpfk,3.0,t1_cxvgowe,4438.0,Buttcoin
400,"No. ""HARM REDUCTION!"" and ""HE HAD TO MURDER TO DEFEND HIS BUSINESS!"" are Ross Ulbricht's defenses.",2015-12-11 00:23:38+00:00,cxur8mz,4.0,t1_cxuqjy2,1169.0,Buttcoin
401,"They'll be looking for the gold fringe on the flag, I bet.",2015-12-11 00:22:53+00:00,cxur7p8,2.0,t1_cxuqgjl,1286.0,Buttcoin
402,"...and yet it's still below 20% below the last pump's top, and 65% below the biggest pump's top.",2015-12-11 00:12:43+00:00,cxuquuw,2.0,t1_cxuqmz4,372.0,Buttcoin
403,"The gypsy neckbeard strikes again!

(He's made death threats before. That's why [his Twitter account](https://twitter.com/mircea_popescu) is suspended.)",2015-12-11 00:11:30+00:00,cxuqtb1,1.0,t3_3wa9zf,7603.0,Buttcoin
404,"No scam can possibly be worse than BitCoin Talk. The squandered donations, the vaporware forum software, the sale of old accounts to criminals, the list goes on and on.",2015-12-10 01:13:14+00:00,cxtjzf5,1.0,t3_3w55y7,6059.0,Buttcoin
