,body,created,id,nest_level,parent_id,reply_delay,subreddit
507,"&gt; m'state

Neckbeard libertarian. Nice.",2015-11-01 22:34:44+00:00,cwkwbz2,1.0,t3_3r4e5w,7329.0,EnoughLibertarianSpam
508,"Ross Ulbricht said the following:

&gt; In my eyes, Friendly Chemist is a liability and I wouldn’t mind if he was executed

Also, the charges are still pending in Maryland.",2015-11-01 22:28:30+00:00,cwkw3lx,10.0,t1_cwktogn,3648.0,news
509,"You can call me a troll all you want, but that doesn't make me any less right. ",2015-11-01 21:22:54+00:00,cwkthcz,8.0,t1_cwk78cq,55908.0,news
510,"&gt; How to get your house egged by every kid in a four block radius

Fixed.",2015-11-01 05:30:40+00:00,cwk6uqc,1.0,t3_3r1e7t,11845.0,EnoughLibertarianSpam
511,"&gt; He didn't try to hire a hitman

How do you come to that conclusion? Ross wrote a request to kill six people, signed it with his GPG key, paid via bit-coin (thereby putting proof in the blockchain), and wrote about the attempted murders in his diary. What more proof do you need?",2015-11-01 05:25:13+00:00,cwk6qy0,6.0,t1_cwjp8pk,37053.0,news
512,"&gt; became ancap late 10th, was objectivist-minarchist before and Libertarian before that.

He's a kid with no job and is fully dependent on his parents for living expenses, but he wishes for a world with no child labor laws.",2015-11-01 05:22:29+00:00,cwk6p2s,1.0,t3_3r1rvs,2923.0,EnoughLibertarianSpam
513,"&gt; MMM ponzi is good for bitcoin because...

...it puts more bagholders into bit–coin.",2015-10-31 18:50:46+00:00,cwjootq,1.0,t3_3qzsqx,721.0,Buttcoin
514,Still waiting for that cryptographic proof...,2015-10-30 20:11:08+00:00,cwir2e4,5.0,t1_cwihylg,13500.0,Buttcoin
515,"A 300% rate of return implies you bought magic beans at $82.50, a price it never reached this year.

I could be mistaken. If you'd like to prove me wrong, post the address you first deposited money into when the price was $82.50, and sign a message with that address.",2015-10-30 15:48:09+00:00,cwigg8p,3.0,t1_cwib5v7,8997.0,Buttcoin
516,[Congratulations -- you almost have a 0% rate of return!](http://oneyearbitcoin.info/),2015-10-30 04:30:27+00:00,cwi1w8c,1.0,t3_3qssyt,1022.0,Buttcoin
517,"/u/werewewrong is a brand new account. Therefore, I totally believe he isn't a sock puppet from/r/Bitcoin.",2015-10-29 13:34:55+00:00,cwh40ej,1.0,t3_3qmlvd,52600.0,Buttcoin
518,I suspect you're a very late adopter.,2015-10-28 15:33:53+00:00,cwfyjb3,3.0,t1_cwfqvph,14973.0,Buttcoin
519,"&gt; Price reflects the demand, state of ecosystem and future innovation.

If this is true, then the demand, state of the ecosystem, and future innovation has fallen 75% since Mt. Gox failed, and another [13% from a year ago](http://oneyearbitcoin.info).",2015-10-28 15:32:54+00:00,cwfyhud,5.0,t1_cwfuhde,6324.0,Buttcoin
520,My sides hurt from laughing.,2015-10-27 19:18:00+00:00,cwexqrp,1.0,t3_3qgdfg,1835.0,Buttcoin
521,"&gt; Reddit is a cesspool of unemployed or underemployed 9-5ers.

...and you are a part of it.",2015-10-27 17:53:00+00:00,cweu2bb,2.0,t1_cweranf,3808.0,Buttcoin
522,"One year ago, /r/Bitcoin was celebrating the price not going below $300. Now they're celebrating the price just touching $300. Cognitive dissonance at its best.

(This reminds me of the first few pages of *1984*, where the Party successfully convinced people that a lowering of chocolate rations was actually an increase.)",2015-10-27 15:08:06+00:00,cwen2yq,1.0,t3_3qfa9j,1726.0,Buttcoin
523,"&gt; You limp-dick virgins are the losers who got burned in bitcoin

You're the one complaining about losing money in bit:Coin, not us.",2015-10-26 19:33:08+00:00,cwdpib3,2.0,t1_cwdozph,756.0,Buttcoin
524,"&gt; I never said he was worse than Mao.

So, why did you mention him in a discussion about Mao? Were you looking for sympathy from Chinese political prisoners?

""Look, Zhao, I know your grandparents starved to death because their farmland was confiscated, and your father was sent to a labor camp for advocating freedom of speech, and your sister was killed for daring to have a second child, but please pity me -- my uncle Moneybags lost $7.22 after having to turn in a gold coin!""",2015-10-25 19:08:04+00:00,cwcgwwr,2.0,t1_cwcau5c,8682.0,EnoughLibertarianSpam
525,This looks suspiciously like Neo &amp; Bee.,2015-10-25 15:30:47+00:00,cwc862a,1.0,t3_3q5lwu,1247.0,Bitcoin
526,"""sato.sh""? They're immortalizing Mike Hearn's alias, and they expect people to think it isn't a cult.",2015-10-23 17:56:33+00:00,cwaadse,1.0,t3_3pxhe4,2093.0,Buttcoin
527,"http://oneyearbitcoin.info

They just need about 50 more of these price ""surges"" to reach a rate of return of 0%.",2015-10-22 17:39:40+00:00,cw92fxw,1.0,t3_3pslgt,2425.0,Buttcoin
528,"&gt; Victim-less crimes, i.e. non-crimes.

If I assert that stealing bitcoins results in no harm being done, is it a victimless crime?",2015-10-21 18:48:35+00:00,cw7x0bt,11.0,t1_cw7uj8p,3475.0,Bitcoin
529,"""[He doesn't have to be guilty of the charges, he's still guilty.](https://np.reddit.com/r/Bitcoin/comments/3pkmr6/cop_charged_with_stealing_820k_from_silk_road_is/cw7b78r)""

You're advocating a system where people are guilty until proven innocent, and you're calling *me* a statist?

Methinks you need to think over your rhetoric a bit more, Mao.",2015-10-21 18:46:31+00:00,cw7wx5g,1.0,t3_3pnxpd,1896.0,Shitstatistssay
530,"Watch what happens when I take your method of reasoning and throw it back at you:

&gt; Try to follow along: even if Ross Ulbricht is not guilty of the murder-for-hire charges he's accused of, he's still guilty of other crimes. He accepted stolen funds and provided material support to an organization responsible for mass murder.",2015-10-21 17:36:48+00:00,cw7txt3,9.0,t1_cw7t0ni,1298.0,Bitcoin
531,...and Ross Ulbricht is connected to six attempted murders.,2015-10-21 16:17:02+00:00,cw7qk5f,5.0,t1_cw7p4ax,2080.0,Bitcoin
532,"This is par for the course in the BitCoin world: any truth that harms their sacred coin is blasphemy and must be destroyed.

May CoinFire rest in piece. ",2015-10-21 15:39:13+00:00,cw7ozll,1.0,t3_3pn1dc,2860.0,Buttcoin
533,[Bitcoin Savings and Trust](http://www.coindesk.com/bitcoin-ponzi-scheme-operator-pleads-not-guilty-to-fraud/),2015-10-21 14:28:31+00:00,cw7m8b7,1.0,t3_3pmrn7,2712.0,Bitcoin
534,So did Ross Ulbricht.,2015-10-21 13:28:01+00:00,cw7k79e,3.0,t1_cw7gnwa,9965.0,Bitcoin
535,I will condemn Shaun the moment that someone provides actual proof. Till that time I will put the burden of proof on the prosecutor.,2015-10-21 03:58:58+00:00,cw79kvy,1.0,t3_3pkmr6,10034.0,Bitcoin
536,"You're basically sending some unknown guy your 'coins, and in return the guy uses a stolen credit card to buy stuff on Amazon and have it shipped to you.",2015-10-21 02:55:30+00:00,cw77ke9,1.0,t3_3pkx0r,1764.0,Bitcoin
537,"For libertarians, theft is worse than murder.",2015-10-20 17:10:48+00:00,cw6kapv,2.0,t1_cw6i00m,3328.0,Buttcoin
538,"Unless your ""bitcoin applications"" will legalize murder-for-hire, I don't think you'll get very far.",2015-10-20 15:56:21+00:00,cw6h8di,4.0,t1_cw6adrm,12572.0,Bitcoin
539,"/r/Bitcoin deserves a mention.

The founder of the sub is a megalomaniac, and every subscriber feels as if anyone who disparages their ""investment"" is a banker or government shill. They also think any modicum of criticism will cause their net worth to decrease.

At least one mod (whollyhemp) was chased off after daring to ask questions about bitcoin's utility.",2015-10-19 20:26:45+00:00,cw5jyy4,1.0,t3_3pbutb,44561.0,AskReddit
540,"&gt; you have the power to get the price of each Bitcoin to $5,000 at least

YOU'VE GOT THE TOUCH! YOU'VE GOT THE POWER!",2015-10-19 12:44:44+00:00,cw52udm,1.0,t3_3pcfwa,1201.0,Buttcoin
541,"I'll call their actions criminal for you.

Hopefully, Cryptsy won't try to sue me, Reddit, and the rest of the Internet for telling the truth.",2015-10-19 02:12:20+00:00,cw4po7b,2.0,t1_cw4pf2g,385.0,Bitcoin
542,https://archive.is/Nc0Qq,2015-10-19 02:06:45+00:00,cw4pgbq,2.0,t1_cw4pa07,267.0,Buttcoin
543,"*tl;dr low interest rates caused the Holocaust.*

Do the entire community a favor and step away from the keyboard.",2015-10-18 19:07:23+00:00,cw496ye,3.0,t1_cw47hco,2550.0,Bitcoin
544,"In Liberland, Peter Schiff would be sent an itemized invoice from a privatized facility, then would be sent to debtor's jail for not paying.",2015-10-18 17:19:49+00:00,cw44v87,1.0,t3_3p6so8,50451.0,EnoughLibertarianSpam
545,"&gt; divine bitcoin

Not a cult. ",2015-10-18 17:09:16+00:00,cw44fsd,1.0,t3_3p8mw8,3572.0,Buttcoin
546,"If a Bit-coin exchange existed that wasn't a scam, I'd recommend the same thing.",2015-10-18 17:04:30+00:00,cw4497t,2.0,t1_cw43y3d,490.0,Buttcoin
547,What do you expect the admins to do?,2015-10-18 16:54:03+00:00,cw43v04,4.0,t1_cw3u67q,25734.0,Bitcoin
548,"At the very least, it means discussion about this brand of fake money is banned at /r/Bitcoin.",2015-10-16 21:17:40+00:00,cw2b0ri,2.0,t1_cw2aeuo,1001.0,Buttcoin
549,35 December 20XX,2015-10-15 19:24:04+00:00,cw0zcgj,6.0,t1_cw0yudp,701.0,Bitcoin
550,30 February 2016,2015-10-15 14:19:18+00:00,cw0mxvv,4.0,t1_cw0fhe7,23428.0,Bitcoin
551,"/u/MineForeman

Look at those downvotes. Those are coming from YOUR people, not us. You're losing the flock. I would recommend you delete this topic before /r/Bitcoin pulls a whollyhemp on you.",2015-10-14 02:07:43+00:00,cvyxu75,1.0,t3_3omp1i,21307.0,Buttcoin
552,"I can send you a few penny shavings, but before I do I need to verify that you're the *real* genius. Could you initiate a ""stress test"" on the network at 0000 GMT tomorrow (14 October)?",2015-10-13 16:06:04+00:00,cvy904z,2.0,t1_cvy6mvf,3628.0,Buttcoin
553,"Given the current trend of the price of Bit-Coin, I'd say a lot more than 50% of the world will be able to afford to be your bagholder.",2015-10-11 16:14:53+00:00,cvvwbgw,3.0,t1_cvvpq68,17274.0,Bitcoin
554,"It also isn't morally sound to cheat investors out of money, but that didn't stop you, did it?",2015-10-10 18:29:38+00:00,cvuzodu,2.0,t1_cvusrr7,13211.0,Bitcoin
555,"I'm no theologian, but I don't think Jesus sold explosives online.",2015-10-10 18:19:29+00:00,cvuzcm7,2.0,t1_cvtxl44,87983.0,Buttcoin
556,"I'm presuming it took you a long time to save up ~~$250~~ $240, which is why you posted here. If you consider this a great achievement, shouldn't you be doing something else with the money? It doesn't sound like you have much disposable income.",2015-10-09 22:06:34+00:00,cvu7f1u,1.0,t3_3o4ec7,17702.0,Bitcoin
557,"Oddly enough, from /r/Bitcoin -- but before you ridicule them for reading this, even *they* wouldn't believe this story was real.",2015-10-09 01:08:17+00:00,cvt6s70,2.0,t1_cvsa73x,60733.0,Buttcoin
558,"&gt; Godwin

😏",2015-10-06 18:55:28+00:00,cvqe5zm,3.0,t1_cvqduhk,465.0,Buttcoin
559,I thought that link went to /r/Buttcoin for a minute.,2015-10-06 15:54:57+00:00,cvq6r3w,2.0,t1_cvq1t8h,8467.0,Bitcoin
560,"I prefer ""egotistical manchild"".",2015-10-06 04:30:20+00:00,cvps1cn,1.0,t3_3nn51o,15788.0,Buttcoin
561,"Since 1984, and as long as the Apple Store refuses to accept good boy points as legal tender, it will continue to go on.",2015-10-06 04:17:33+00:00,cvpro7k,2.0,t1_cvp00f1,44846.0,justneckbeardthings
562,"We draw the line at people who are able to write a coherent argument. On the other side of the line, we put the gentlesirs with an irrational hatred for a *fucking operating system*.",2015-10-06 03:59:02+00:00,cvpr4b6,6.0,t1_cvpj1vh,13753.0,justneckbeardthings
563,"&gt; We will be reviewing our legal options against this libelous article.   

It isn't libel if it's true, Paul.",2015-10-06 03:53:37+00:00,cvpqy9o,1.0,t3_3nmel4,25090.0,Buttcoin
564,"That is some weapons-grade m'ladyium you've got there, bud.",2015-10-05 17:03:45+00:00,cvp2qmw,4.0,t1_cvoxp3t,8439.0,justneckbeardthings
565,"Call me a skeptic if you'd like, but from what I understand, the way this wildly overpriced Raspberry Pi works is as follows:

 1. Plug it in. It connects to 21's mining pool, and *only* 21's mining pool.
 2. Your device gets to do the work that 21 Inc. would normally do, except that you pay for the electricity.
 3. You get a fraction of a penny every day as a reward, if 21's mining pool remains up and decides to pay you at all.
 4. Excess heat is generated by the [enormous fan](https://dotco-prod.s3.amazonaws.com/landing/img/backgrounds/bg_faq.jpg) on the board and the poor, poor, overworked Raspberry Pi processor. (You will, at most, have 1 GB of RAM on the device, which will easily be taken up by Bitcoin Core if that's the software it's running.)",2015-10-02 23:19:42+00:00,cvm8y99,1.0,t3_3n9mqn,11070.0,Bitcoin
566,It's dangerous to conclude anything else on /r/bitcoin or the myriad of splinter groups.,2015-10-02 23:08:46+00:00,cvm8lt3,3.0,t1_cvm60v8,4714.0,Buttcoin
567,"I'm not saying it is a made up buzzword. What I'm saying is that they're merely proposing additions to a nonexistent project that consist of nothing *but* buzzwords. Oh, and there's [this comment](https://np.reddit.com/r/Bitcoin/comments/3n89cu/lightning_network_onion_routing_proposal/cvlscld).

Here's my ""simple English"" translation of what they are proposing:

 1. Set up a centralized server to route all of your transactions through, and hope your money isn't taken (or never routed, or sent to a burn address) by the person running the server.
 2. Host the service on Tor, giving you literally kilobytes of traffic.",2015-10-02 23:07:21+00:00,cvm8k6z,2.0,t1_cvm25jh,11002.0,Buttcoin
568,...and it never will.,2015-10-01 03:58:31+00:00,cvk5qrq,2.0,t1_cvk5i1p,496.0,Bitcoin
569,Ѕοrrу fοr уοur lοss.,2015-10-01 03:49:53+00:00,cvk5hno,3.0,t1_cvk48ln,2408.0,Bitcoin
570,**EUPHORIC**,2015-09-30 16:58:20+00:00,cvjgp9f,1.0,t3_3myahf,20983.0,Bitcoin
571,**m'lady** *tips fedora*,2015-09-30 15:07:28+00:00,cvjc41o,3.0,t1_cvj2o3x,26400.0,Bitcoin
572,"The Internet **did** exist in the 1990s, and it was used by more people than BitCoin today.

So, what's your point?",2015-09-30 01:48:02+00:00,cvitnu8,1.0,t3_3mwlbi,4182.0,Bitcoin
573,"Are you willing to pay $400 for a DVD player? If so, I've got one to sell you. I'll even throw in the Brooklyn Bridge for free.",2015-09-24 16:17:26+00:00,cvcorvf,1.0,t3_3m7l8i,2307.0,Bitcoin
574,What a euphoric screed.,2015-09-24 04:28:46+00:00,cvc8qko,1.0,t3_3m5mlf,3430.0,Bitcoin
575,"You must have been disappointed after browsing my post history and not seeing any personally identifiable information you could use to send me death threats. That's what you people do, after all.",2015-09-24 03:44:27+00:00,cvc7hgi,4.0,t1_cvbo3lz,31417.0,Bitcoin
576," * Google Nest.
 * Philips Hue.",2015-09-23 15:42:25+00:00,cvbft3l,7.0,t1_cvbf2e7,1108.0,Buttcoin
577,PayPal has deposit fees?,2015-09-23 13:54:28+00:00,cvbbpu0,2.0,t1_cvb75pm,12697.0,Bitcoin
578,Email was used by millions of people even before the World Wide Web existed. Please don't revise history to fit your views.,2015-09-23 05:13:22+00:00,cvb2ixc,2.0,t1_cvb2ack,659.0,Bitcoin
579,"You know what came with *those* developer kits?

 * Hardware that they designed.
 * Tools you literally couldn't get anywhere else.
 * A way to actually create a product someone would buy.

What comes with *this* developer kit?

 * A $40 Raspberry Pi that is sold by hundreds of online retailers.
 * Software that is freely available from the developers themselves.

By the way -- have you put in your pre-order yet?",2015-09-23 05:03:19+00:00,cvb2b2b,9.0,t1_cvb22vp,607.0,Bitcoin
580,"You'll need to find some dot-com sites that host whitepapers for ""sidechains"" and ""off-chain transactions"".",2015-09-23 04:36:58+00:00,cvb1oxd,7.0,t1_cvb1j5r,386.0,Buttcoin
581,"You're going to spend $400 on a Raspberry Pi so you can mock me?

Sure, go right ahead. I won't stop you.",2015-09-23 04:30:26+00:00,cvb1j23,7.0,t1_cvb1i51,61.0,Bitcoin
582,"&gt; It amazes me that people like you ever learned to breath without someone else explaining it to you using small words...

&gt; learned to breath

Will the blockchain make spellcheck and grammar checking software obsolete?",2015-09-23 04:13:44+00:00,cvb13iw,5.0,t1_cvb0w38,463.0,Bitcoin
583,"Will ""The Blockchain"" prevent mistakes from happening before they happen?",2015-09-23 03:43:34+00:00,cvb0a2o,7.0,t1_cvb090j,64.0,Bitcoin
584,**.network:** the TLD *dedicated* to vaporware.,2015-09-23 03:41:35+00:00,cvb085g,5.0,t1_cvazhvf,1513.0,Buttcoin
585,"I see you edited your comment after I replied to it. Will the blockchain prevent that, too?",2015-09-23 03:39:50+00:00,cvb06fk,5.0,t1_cvazvjo,633.0,Bitcoin
586,Slowly? http://vocaroo.com/i/s0FuUws4oTSh,2015-09-23 03:38:11+00:00,cvb04rz,2.0,t1_cvaz441,2056.0,Bitcoin
587,"Great idea. Let's put a $400 device in a $1200 refrigerator so it can talk to the other $1200 refrigerator you don't have in your house.

You should get a patent lawyer on this before Samsung and GE steal your idea!",2015-09-23 03:25:01+00:00,cvazr12,3.0,t1_cvazhoe,529.0,Bitcoin
588,"So, instead of paying the cable company once a month, you're paying hundreds of unknown people (and your power company) the same amount of money with thousands of ""microtransactions"" that take between 10 minutes and an hour to complete.",2015-09-23 03:07:09+00:00,cvaz7op,2.0,t1_cvaw9xq,5307.0,Bitcoin
589,"First, it was ""off-chain transactions"". Then, it was ""sidechains"". Not too long ago, it was ""the Lightning Network"". Now, it's ""21.co"".

They are desperately searching for a panacea for all the shortcomings of bitCoin so they can get easy money. For them, it doesn't have to actually solve any problems: it just has to *claim to* solve any problems.",2015-09-23 02:58:50+00:00,cvayyf9,1.0,t3_3m0niz,1609.0,Buttcoin
590,"&gt; There, I just made up a business in 10 seconds, someone go make it :)

Watch out, we've got a real Captain of Industry here.",2015-09-22 02:38:40+00:00,cv9s3e8,4.0,t1_cv9h9w5,18081.0,Bitcoin
591,You doxxed a guy on BitcoinTalk because you accidentally sent him $40 or something.,2015-09-21 18:21:07+00:00,cv99jaq,6.0,t1_cv902la,15198.0,Bitcoin
592,1. It mentions Bitcoin.,2015-09-21 18:19:19+00:00,cv99gsp,1.0,t3_3ltzff,1099.0,Bitcoin
593,"You're a convicted arms dealer, and you're defending a company that sells the leading cause of adult-onset diabetes.

Why am I not surprised?",2015-09-21 05:20:49+00:00,cv8r0dv,2.0,t1_cv7oqnp,83176.0,worldnews
594,*tips fedora*,2015-09-19 04:50:09+00:00,cv6o05s,1.0,t3_3lik2g,5754.0,Bitcoin
595,Why ban someone for expressing an opinion that you don't share?,2015-09-19 04:48:45+00:00,cv6nz0w,3.0,t1_cv6kml4,8089.0,Bitcoin
596,"And when you have your bit coins stolen, instead of a credit card, how does your situation change?",2015-09-19 04:38:18+00:00,cv6nqjg,5.0,t1_cv5khxj,84978.0,Bitcoin
597,"Did Roger Ver hire the same developers M.M. ""hired"" to develop the forum software?",2015-09-19 04:36:37+00:00,cv6np4k,1.0,t3_3liiwl,5588.0,Bitcoin
598,It would have to be an absurdly small and sparsely populated country to be able to use bitCoin for all monetary transactions.,2015-09-18 04:01:53+00:00,cv5iyhu,3.0,t1_cv5irzo,359.0,Bitcoin
599,"You have 30 days to report fraudulent charges on your credit card, and you're legally liable for none of the charges.",2015-09-18 04:00:24+00:00,cv5iwwa,3.0,t1_cv5ipxe,380.0,Bitcoin
600,"...dominate what, exactly?",2015-09-18 03:53:02+00:00,cv5iopx,1.0,t3_3ldx72,2732.0,Bitcoin
601,"Of course Bit-coin isn't affected. With credit cards, you aren't liable for losses due to theft.",2015-09-18 03:52:21+00:00,cv5inwx,1.0,t3_3ldz6y,1599.0,Bitcoin
602,Thank goodness the inventors of the Internet didn't act like Theymos and his gang. We'd still be using telegraphs.,2015-09-17 19:14:55+00:00,cv50d60,4.0,t1_cv4075g,76620.0,Bitcoin
603,"Unlike Bit-Coin, the Internet didn't have a schism between two groups of scientists arguing about packet sizes and speed.",2015-09-16 21:49:12+00:00,cv3zv71,2.0,t1_cv3zfrf,675.0,Bitcoin
604,Theymos' dox can be found in a subpoena he got during the Ross Ulbright trials. He's almost considered a public figure legally.,2015-09-16 21:26:55+00:00,cv3z0fl,2.0,t1_cv3hmt2,25718.0,Buttcoin
605,You need an incomplete whitepaper to get funding.,2015-09-16 21:25:35+00:00,cv3yyik,2.0,t1_cv3hruq,25402.0,Buttcoin
606,"&gt; Hail Bit-Coin

Is this a joke?",2015-09-16 00:52:58+00:00,cv306bf,22.0,t1_cv21432,72587.0,Buttcoin
607,This ought to end well.,2015-09-16 00:40:16+00:00,cv2zqct,1.0,t3_3l40lj,447.0,Bitcoin
608,"Don't forget [Eric Voorhees' batshit comment about the price.](https://np.reddit.com/r/Bitcoin/comments/3l3kxx/i_own_200btc_what_are_the_odds_of_that_being/cv2wh3x)

&gt; If bitcoin doesn't ever reach $5,000 per coin, then the project failed.",2015-09-16 00:29:44+00:00,cv2zctj,2.0,t1_cv2ww1q,4370.0,Buttcoin
609,It's sad how this mere statement of fact is being downvoted.,2015-09-16 00:26:49+00:00,cv2z97v,2.0,t1_cv2yzmp,461.0,Bitcoin
610,/r/thatHappened,2015-09-15 21:22:52+00:00,cv2stkr,1.0,t3_3l318x,4245.0,Bitcoin
611,"So, Usenet... but with Bitcoin!",2015-09-01 21:01:31+00:00,cunfrqy,1.0,t3_3j9ebn,4275.0,Buttcoin
612,"When one man controls /r/Bitcoin, bitcointalk.org, and bitcoin.org, that's pretty damned centralized.",2015-08-28 02:16:37+00:00,cui79ck,2.0,t1_cui1l01,10844.0,Bitcoin
613,"Roger Ver started a new company, it seems:

&gt; Saint Bitts LLC",2015-08-27 13:55:39+00:00,cuhfse1,1.0,t3_3ilixr,753.0,Buttcoin
614,"Without all that, Bitcoin wouldn't exist.

Remember that.",2015-08-26 01:27:09+00:00,cufrve3,5.0,t1_cufq9x5,2753.0,Bitcoin
615,Someone needs to call Child Protective Services.,2015-08-25 19:00:48+00:00,cufdko3,1.0,t3_3id2go,2845.0,Buttcoin
616,"Tell us what you mean by ""modeling bitcoin correctly"". Is that like saying ""not believing what I want you to believe""?",2015-08-20 23:35:27+00:00,cua2unh,6.0,t1_cua2pc0,261.0,Bitcoin
617,"&gt;  There is no expansion of this money supply.

Apart from the 25 bit-coins that appear every 10 minutes, sure.",2015-08-20 23:09:52+00:00,cua1zm9,4.0,t1_cua1xck,110.0,Bitcoin
618,Still running from the fines?,2015-08-19 15:37:38+00:00,cu8c835,2.0,t1_cu8brpg,687.0,Bitcoin
619,You forgot to say [Hail Bitcoin.](https://www.reddit.com/r/Bitcoin/comments/2sa16h/im_out/),2015-08-17 23:54:51+00:00,cu6h7qk,2.0,t1_cu6cc0z,8449.0,Bitcoin
620,I nominate this quote for /u/SnapshillBot.,2015-08-17 23:41:01+00:00,cu6grdo,10.0,t1_cu5sbq8,41835.0,Buttcoin
621,"I nominate StarMaged instead of Theymos, mainly due to [this quip.](https://np.reddit.com/r/Buttcoin/comments/3h769p/utheymos_is_a_fucking_coward_he_wants_so_badly_to/cu54gkr)",2015-08-16 22:30:34+00:00,cu5a10l,1.0,t3_3h7nih,21663.0,Buttcoin
622,"Well, that's another actor heading for the San Fernando Valley.",2015-08-13 02:31:55+00:00,cu15n37,1.0,t3_3gsopz,3426.0,Buttcoin
623,Shorters have been winning for a good while now. ,2015-08-12 06:14:51+00:00,cu0421i,1.0,t3_3gnagp,29966.0,Bitcoin
624,"How much did you lose, in dollars?",2015-08-10 23:16:42+00:00,ctyj3u1,3.0,t1_ctyixss,289.0,Bitcoin
625,The priests and bishops of the Cult of Satoshi. Nice.,2015-08-10 05:06:01+00:00,ctxnxub,1.0,t3_3ge02y,28357.0,Bitcoin
626,"The ""bitter"" ones are the bagholders.",2015-08-08 22:41:58+00:00,ctwb1tr,7.0,t1_ctw4sy4,13951.0,Bitcoin
627,"In his defense, the Chinese government frequently calls foreigners who criticize their policies ""racist"". I suppose Fox News would do the same thing if ""American"" could be considered a race.",2015-08-03 21:50:14+00:00,ctqe0ct,1.0,t3_3fo2j6,1588.0,Buttcoin
628,Innocent until proven guilty.,2015-08-01 23:14:44+00:00,ctoc51z,3.0,t1_ctob8a9,1907.0,Bitcoin
629,Free Mark! Harm reduction and something.,2015-08-01 09:50:01+00:00,ctnsl7g,1.0,t3_3fdou0,15580.0,Bitcoin
630,"Wait, are you telling me that you can't just ignore the loss of millions of dollars, then proceed to write blog posts about PHP, cappuccinos, and cats?",2015-08-01 01:53:57+00:00,ctniol2,1.0,t3_3fctk6,5683.0,Buttcoin
631,"http://www.extensionking.com

No mention of butts. I'm skeptical.",2015-07-26 21:15:38+00:00,cth1h2u,1.0,t3_3eonpx,8448.0,Buttcoin
632,Is this a real quote from /u/BashCo?,2015-07-26 18:27:31+00:00,ctgvq2v,3.0,t1_ctd6v63,290118.0,Buttcoin
633,"This guy used to shill for Bitcoin by passing out ~~$5~~ ~~$2.50~~ $1.25 tips. I guess he ran out of money.

But there's hope! He'll buy more neckbeard tokens with the savings he gets by [buying imported chickens from China](https://www.reddit.com/r/news/comments/3cwmbo/usda_says_okay_to_ship_us_chickens_to_china_for/cszrgn6?context=3).",2015-07-26 18:26:33+00:00,ctgvowy,1.0,t3_3eo0zk,9993.0,Buttcoin
634,"First step to launder stolen credit card cash advances to Bitcoin, you mean.",2015-07-21 19:49:08+00:00,ctb978a,1.0,t3_3e3y39,382.0,Buttcoin
635,"&gt; How does bitcoin stop this kind of fraud when the thieves can apply the very same tactic to Bitcoin ATMs?

Blockchain and reasons.",2015-07-18 21:58:47+00:00,ct827z8,6.0,t1_ct81x7p,565.0,Bitcoin
636,Roger Ver is also trying to [beg Jiu-Jitsu schools to accept neckbeard tokens.](https://np.reddit.com/r/bjj/comments/3dkey0/academy_owners_and_managers_help_me_build_you/ct60scr?context=3),2015-07-18 21:57:53+00:00,ct826xr,1.0,t3_3drwt3,1267.0,Buttcoin
637,"…except slavery was abolished through four years of violent civil war, and I doubt you'd get out of your chair to fight unless a 10 year old girl was offered to you as a reward.",2015-07-15 05:12:13+00:00,ct3uqey,10.0,t1_ct3p0h9,11086.0,Bitcoin
638,"First they jeer Putin for banning Bitcoin, and now they cheer Putin for merely mentioning Bitcoin.

The bagholders get more desperate every day.",2015-07-15 01:59:41+00:00,ct3oqlj,1.0,t3_3dbwv0,253.0,Buttcoin
639,"Bitching and moaning doesn't make your situation any better, either.",2015-07-15 01:43:07+00:00,ct3o5st,8.0,t1_ct2j2av,80393.0,Bitcoin
640,"Bitching, moaning, and nothing?",2015-07-14 03:08:04+00:00,ct2ijts,6.0,t1_ct2iisl,52.0,Bitcoin
641,"So, what are you going to do about it?",2015-07-14 03:05:14+00:00,ct2igc5,4.0,t1_ct2ibp8,226.0,Bitcoin
642,"What does ""CHUP"" mean?",2015-07-14 03:03:28+00:00,ct2ie69,2.0,t1_ct0gihm,160701.0,Bitcoin
