,body,created,id,nest_level,parent_id,reply_delay,subreddit
0,/r/thalassophobia,2016-11-19 13:46:25+00:00,da6x9v1,1,t3_5drg3s,22711,HeavySeas
1,"Yes, while I said draft, I meant to say the thought process that eventually led to the LoTR.",2016-11-18 02:49:13+00:00,da55hem,3,t1_da4r8tj,19524,tolkienfans
2,"The earliest drafts of the LoTR were about a guy called Aelfwine who sails west from Britain and finds the lands of the Gnomes who then tell him all these tales. He then comes back to Britain and translates all those tales into Old English. His descendants too, experience memories of these events. So some part of this mixture of old and new world setting from the earliest drafts made its way into the paragraph that you describe. Just a theory I wish to posit.",2016-11-17 19:01:18+00:00,da4k6i9,1,t3_5dg9t3,13920,tolkienfans
3,"Ah ok missed that, was past midnight when I replied! My point was that the guy in the GIF is drinking chai which is more milk and sugar than tea.",2016-11-13 05:24:52+00:00,d9y4fo1,5,t1_d9xkku9,30879,BollywoodRealism
4,"Tea leaves have more caffeine than coffee beans before they are brewed. Prepared, however, tea is diluted quite a bit more than most coffees. Each will vary depending on how strong you like it, though. Indian tea or chai is made with a lot of milk so caffeine content is even lower.",2016-11-12 20:32:27+00:00,d9xjvhn,3,t1_d9xjq0s,239,BollywoodRealism
5,"That's tea, your argument is invalid.",2016-11-12 20:06:06+00:00,d9xiulf,1,t3_5clniq,6283,BollywoodRealism
6,You do not deserve so many downvotes. Have my upvote.,2016-11-08 20:26:19+00:00,d9rkxds,3,t1_d9r6wdt,15994,Unexpected
7,Not really but that is a factor too. China was always hostile towards India as it is with all its neighbours since it always hopes for expansion. They attacked us in 1962 when they didn't like India giving asylum to the Dalai Lama.,2016-11-08 20:03:54+00:00,d9rjrk0,13,t1_d9rgbco,3969,interestingasfuck
8,"No, not as bad but China is getting increasingly aggressive recently. They do not send in terrorists like Pakistan but the PLA likes to show off power by getting inside Indian territory and build shelters and camps before going back. One was recently found 45kms inside the Indian border.

And then there is the whole matter of the area of Kashmir that was grabbed by Pakistan and then ceded over to China as payment for aid and general ""you please have my back"" type of deal.",2016-11-08 18:53:24+00:00,d9rg330,11,t1_d9rfuln,268,interestingasfuck
9,Actually it is quite frequent in the far eastern province of Arunachal Pradesh.,2016-11-08 18:47:29+00:00,d9rfrwd,9,t1_d9rfmmy,163,interestingasfuck
10,"The Indian military largely serves to dissuade their neighbours (China and Pakistan), and to protect their border from (~~occasional~~ *frequent*) incursions.",2016-11-08 18:43:25+00:00,d9rfk37,7,t1_d9rbmsz,4403,interestingasfuck
11,true dat,2016-11-04 11:08:48+00:00,d9lbitw,3,t1_d9laa7b,3809,todayilearned
12,"Should rather read, ""TIL ~~Daniel Craig~~ *Sam Mendes* almost cost the producers of Skyfall millions of dollars because he ~~wanted to wear~~ *didn't care about* a pair of gloves in a scene.""",2016-11-04 07:45:41+00:00,d9l7tx3,1,t3_5b1d7m,16060,todayilearned
13,"If I remember correctly, then that post referred to the US Civil War only. Didn't make sense.",2016-11-01 16:00:20+00:00,d9gy86y,3,t1_d9gx5hp,1245,interestingasfuck
14,Also there was another post with the same image that claimed this was in the Civil War.,2016-11-01 14:52:39+00:00,d9gutfv,1,t3_5aiznz,5712,interestingasfuck
15,Came here to say just this ^ .,2016-10-30 19:45:36+00:00,d9ebfbw,2,t1_d9dsx1y,34749,Unexpected
16,/r/gifsthatendtoosoon,2016-10-16 18:03:04+00:00,d8uk1c2,1,t3_57rzqo,7987,nevertellmetheodds
17,"Ref goes "" Let go, let go! Calm down!"" lol",2016-10-02 17:56:38+00:00,d8b0kl8,1,t3_55iy9g,5110,Gunners
18,Yes. Came here to say exactly that.,2016-09-16 16:55:43+00:00,d7pg3bj,3,t1_d7pcnhp,4229,Infographics
19,Today's world is a skewed place. Unfortunately.,2016-09-11 18:43:22+00:00,d7ihnpp,3,t1_d7ihl08,91,ImGoingToHellForThis
20,"Yes, those are facts. Your point?",2016-09-11 18:40:28+00:00,d7ihinp,3,t1_d7ihfyz,95,ImGoingToHellForThis
21,Don't think hell is for those who just state the facts.,2016-09-11 18:21:48+00:00,d7igkwz,1,t3_5292gf,9511,ImGoingToHellForThis
22,/r/submechanophobia,2016-09-09 17:45:26+00:00,d7fwt5s,1,t3_51vsry,44759,thalassophobia
23,Would be reposted even more if either of that happens.,2016-09-04 06:24:43+00:00,d78vgwo,3,t1_d78u249,3981,Unexpected
24,The miracles of ~~Pope Francis~~ CGI! ,2016-09-04 05:12:27+00:00,d78tx53,1,t3_512dqe,5032,Unexpected
25,/r/thalassophobia,2016-09-03 17:48:04+00:00,d7871eg,1,t3_50wjwk,60125,Unexpected
26,I came here to say just that. Forza's going bonkers.,2016-08-30 13:52:49+00:00,d72ks72,1,t3_50b7qg,79,Gunners
27,My response was towards the person you replied to.,2016-08-28 18:41:20+00:00,d7086zx,6,t1_d70851n,81,AskReddit
28,Apply cold water to the burned area!,2016-08-28 18:39:05+00:00,d7083r9,4,t1_d707fts,980,AskReddit
29,/r/bizarrebuildings,2016-08-28 18:35:45+00:00,d707yyj,1,t3_500oga,383,todayilearned
30,"Don't get me wrong, I liked both books. But after MBotF I had more expectations. Let's see how the third instalment shapes up. I guess reading Dancer's Lament just before FoL had this effect on me. DL was simply wonderful!",2016-08-13 17:06:16+00:00,d6g1ki7,6,t1_d6g0nbq,1504,Malazan
31,"Well yeah, if you compare FoD and FoL then FoL comes out better. Still with heavyweights like Rake and Brodd I was hoping for some more epic action moments. Like why was Rake the First Son. What were his accomplishments in the earlier wars when he was not an ascendant. You know, stuff like that. That's what was missing for me.",2016-08-13 16:15:36+00:00,d6fzoy6,4,t1_d6fy4lg,2598,Malazan
32,"Everybody has their own likes and dislikes but come on, there is no part of FoL that I can describe as ""enthralling""! Lots of plot development and hints about backstories dropped here and there.",2016-08-13 13:46:05+00:00,d6fut2m,2,t1_d6fncch,24481,Malazan
33,"Most comments here would be either a curry or something hot/spicy. So to spice things up a bit, if I may ;) , I would go ahead and recommend something sweet.

For anyone who hasn't already, try a Kulfi. Or a [Mango Kulfi](https://www.google.co.in/search?q=mango+kulfi&amp;safe=off&amp;espv=2&amp;biw=1280&amp;bih=726&amp;source=lnms&amp;tbm=isch&amp;sa=X&amp;ved=0ahUKEwjRm8SjsLzOAhWKp48KHUupDQMQ_AUIBygC) if the variety is available in your preferred Indian restaurant. You can thank me later.",2016-08-12 17:15:23+00:00,d6es10z,1,t3_4xeecs,2648,AskReddit
34,"At first glance, looks like something that Cobra Commander might build.",2016-08-06 16:19:14+00:00,d66s3ou,1,t3_4wdul3,51923,bizarrebuildings
35,Firetruck.,2016-07-27 09:58:17+00:00,d5srmdr,1,t3_4utury,89,AskReddit
36,LPT: Please don't do this.,2016-07-26 05:59:34+00:00,d5r58rq,1,t3_4ujt7a,44921,LifeProTips
37,/r/gifsthatendtoosoon,2016-07-23 07:29:00+00:00,d5nf3f8,1,t3_4u5kyc,29427,Unexpected
38,"Spot on, mate. Spot on.",2016-07-22 03:50:48+00:00,d5lx69p,4,t1_d5lidsi,22969,techsupportgore
39,"Sure, we can be able to do it.",2016-07-22 03:50:08+00:00,d5lx5hn,7,t1_d5lmpcx,16535,techsupportgore
40,Either you're an Indian or you have had a ton of correspondence with Indians!,2016-07-21 17:25:14+00:00,d5l7404,3,t1_d5l4ohk,3047,techsupportgore
41,"Can confirm that most service providers in India have similar levels of nonsense customer care. The practice is to hire resources who are barely competent and have somehow graduated. I'll not even go into discussing their communication skills. Plus, the work attitude is appalling. When in India, just hope that your service doesn't break down or need any help from the customer care else you're doomed!",2016-07-21 13:10:58+00:00,d5kw8ov,1,t3_4twmum,3942,techsupportgore
42,"How does this qualify under ""realism""?",2016-07-20 14:27:31+00:00,d5jkhdo,1,t3_4tpyxp,26201,BollywoodRealism
43,"^ This. The other answers are at least partially incorrect when answering your question. The speed of light in vacuum, c, is a universal constant. Light can surely slow down and scientists have recently managed to stop light as well. [Link](http://news.harvard.edu/gazette/2001/01.24/01-stoplight.html)",2016-07-20 14:24:56+00:00,d5jkdnh,2,t1_d5jh9ds,5250,explainlikeimfive
44,"Here's a writing tip for GRRM, Write!",2016-07-19 07:49:36+00:00,d5hwfmh,1,t3_4tizxf,17329,gameofthrones
45,Bernadette and Amy Farrah Fowler.,2016-07-18 18:31:29+00:00,d5h3us8,1,t3_4tf0z9,20640,AskReddit
46,You should not be downvoted for this.,2016-07-16 05:08:14+00:00,d5e9be3,2,t1_d5drucq,31127,interestingasfuck
47,*billions,2016-07-15 17:39:11+00:00,d5dk7bb,4,t1_d5dijqt,2133,AskReddit
48,/r/titlegore,2016-07-14 16:02:26+00:00,d5c30tu,1,t3_4ssyk4,13360,thalassophobia
49,"Hell no! I mean, yes, that's what this subreddit is for after all. But no, are you crazy, it's scary as fuck! You mad bro?",2016-07-13 18:33:01+00:00,d5awtdr,1,t3_4so3et,6814,thalassophobia
50,"Beak....is a minor character....? Dude, in the few pages he showed up in, he gave even the most badass characters a run for their money. Beak is an absolute legend.

A moment's silence for Beak.",2016-07-09 05:34:50+00:00,d5599i2,2,t1_d5463qu,60989,Malazan
51,Steven Erikson could very well be Gothos himself.,2016-07-03 09:08:32+00:00,d4xidns,2,t1_d4xg40u,8279,Malazan
52,Seems like you have a case of the Nachts ;),2016-07-03 09:07:50+00:00,d4xidbh,3,t1_d4xfxx7,8754,Malazan
53,"Deep breaths my friend, deep breaths...",2016-07-03 06:30:57+00:00,d4xfq0d,1,t3_4r0vvy,1978,Malazan
54,Is that you Captain Obvious?,2016-06-30 15:51:04+00:00,d4u362y,1,t3_4qlsug,6689,Infographics
55,Any rational minded person will instantly invalidate iPhones too.,2016-06-30 15:50:38+00:00,d4u35cd,2,t1_d4tzjok,4710,Infographics
56,"Nearest IDE convertor was in China?! Really? Unless you're exaggerating for effect, it can't be true. I've been using one since '01.",2016-06-21 03:17:21+00:00,d4hjvxs,1,t3_4ozdt3,41286,talesfromtechsupport
57,"While all the posters who give the cause as low storage, low memory quality, less RAM etc. do have it right to an extent, the major reason is the manufacturer wants you to keep buying their latest and greatest products. So it is detrimental to them if their products keep functioning at the top notch level for years on end. Thus, they purposely reduce the life of the product so that it has a limited life. This can be achieved by many ways like hardware which would decrease in performance after a period of time or software which would introduce features that need the ""latest hardware"" to run and which is designed to slow down the older product to the point where the user would prefer buying a new one. Lookup planned obsolescence if you wish to know more.",2016-06-19 16:50:59+00:00,d4fiefz,1,t3_4ostke,22143,explainlikeimfive
58,Don't think this is what /r/Unexpected was for.,2016-06-04 11:50:23+00:00,d3vmvll,1,t3_4mhl78,9216,Unexpected
59,^ This. I'm surprised that only one person here feels like that.,2016-05-31 18:39:58+00:00,d3qpgk4,2,t1_d3qnd7h,2791,thalassophobia
60,Did not know that.,2016-05-17 14:01:50+00:00,d38s503,5,t1_d38rncs,807,BollywoodRealism
61,"You are not mistaken. It is still on Netflix India. Yes, India has it's own version. Go figure.",2016-05-17 04:42:28+00:00,d38g2ry,3,t1_d38c6wg,6996,BollywoodRealism
62,"Actually not that surprising to an Indian as there is a full length commercial movie about a guy getting turned into a fly and the tale of his revenge. Was a box office hit too. You can see it here if you wish --&gt; https://www.youtube.com/watch?v=keW2o-ORifc

Caution though, it'll give you migranes.",2016-05-17 00:55:19+00:00,d387vct,1,t3_4jm8ut,26726,BollywoodRealism
63,Seconded.,2016-05-16 04:35:32+00:00,d375af4,2,t1_d3759ze,28,Gunners
64,"I'd be Largesse, the god of beneficence.",2016-05-12 16:34:50+00:00,d32ut2e,1,t3_4ispdh,139014,Malazan
65,/r/thalassophobia,2016-05-01 06:44:40+00:00,d2o71h3,1,t3_4h7lal,11503,interestingasfuck
66,You know who else is overpopulated? Humans. Makes sense then to hunt them with drones too?,2016-04-30 04:33:45+00:00,d2n0n0j,3,t1_d2msddp,14592,interestingasfuck
67,"Quite an interesting read, thanks!",2016-04-25 15:22:28+00:00,d2gm3zw,5,t1_d2gf7ww,12169,explainlikeimfive
68,"Got any source for the ""hidden space"", genuinely curious.",2016-04-24 16:00:40+00:00,d2ffvh2,3,t1_d2f7js6,22553,explainlikeimfive
69,"With FoD and DL you will get more perspective on Rake and Dancer. With the rest of the books which will follow Dancer's Lament, all the old guard will get more depth too.

Arya I found wanting. She could have been developed so much more. Oberyn, Jaqen and the rest were well written but beyond their original shade of personality, there was no other aspect to them. They all seem mono-faceted.

On the other hand, characters like Karsa are given a great evolution. You initially hate him with all your heart but by the time you read the last of him, you cannot help but admire the way he has grown up. The only character that comes close to such a growth so far in ASoIaF is Jamie. I hope GRRM fleshes out Bran and Jon more in the coming books and continues with Jamie's growth too.",2016-03-30 18:36:49+00:00,d1je6o4,5,t1_d1iyeqd,22485,Malazan
70,"I'll give you Jamie Lannister and maybe Varys. But the rest of them do not come anywhere near the likes of Whiskeyjack, Dancer, Kellanved, Dassem, Karsa, Fiddler, Coltaine, hell even the Wicken dogs!

Which ones do you think were central to the Malazan plot but were not delved into properly? I'd like to know.",2016-03-30 05:56:17+00:00,d1irgqi,3,t1_d1ijhsa,14678,Malazan
71,"ASoIaF has only one character that stands out as brilliant and that is Tyrion Lannister. Everyone else is mediocre at best.

On the other hand, Malazan, due to the sheer epicness of the world, has so many characters in so many shades. From the grim and brooding Anomander Rake to the utterly funny combo of Tehol and Bugg, Erikson explores all types of character personalities. You can identify more with and care more for a Malazan character than an ASoIaF one. In ASoIaF, you really don't give a damn about a named soldier dying but in Malazan you feel a sense of loss when even a single unnamed soldier dies. That's what Erikson does to you.

I'm really glad that I read Malazan after ASoIaF because I would not have read through all the ASoIaF books otherwise.",2016-03-29 21:15:32+00:00,d1i7ydi,1,t3_4cem36,45168,Malazan
72,That's an Omtose Phellack unveiling right there!,2016-03-19 09:00:29+00:00,d15j1dj,2,t1_d14pan2,57536,interestingasfuck
73,All diamonds are worth scrap. But as long as there are idiots who like shiny things the cost would be sky high. Lucky for those of us who don't need to spend money on such stuff.,2016-03-19 05:47:38+00:00,d15fxr3,1,t3_4axvj6,65257,todayilearned
74,"Since the reaper is technically within the 3 sq. m. radius, I'll use his own scythe against him and steal his soul. Will keep him as my own personal shinigami!",2016-03-08 18:48:10+00:00,d0sc65i,1,t3_49jhba,5317,AskReddit
75,"Agreed that we dropped points despite being in winning positions but so did other teams and that's why EPL is the way it is this year. In the future though, for those who are looking back and analyzing things that cost us the title, this will be one of key points. 3 points today would have got us level with Spurs, gave us the kick in the pants needed to keep winning and potentially demoralized them and cost them dropped points.",2016-03-06 11:40:08+00:00,d0pil7p,3,t1_d0ph2d5,6717,Gunners
76,Why change it??,2016-03-06 08:25:38+00:00,d0pfsjx,1,t3_496eun,3242,interestingasfuck
77,He just cost us the title.,2016-03-06 07:18:22+00:00,d0pejrs,1,t3_493zj4,39748,Gunners
78,"Ah, another young, naive bloke.",2016-03-04 22:03:35+00:00,d0nvcbc,1,t3_48xuxa,22415,AskReddit
79,"Um, he just said it has medical benefits. He never said you can get high.",2016-03-04 17:59:45+00:00,d0nkwma,2,t1_d0ncx0y,11599,interestingasfuck
80,This. Physics argues that technically we cannot touch anything in reality. Vsauce explains it pretty nicely on his channel --&gt; https://www.youtube.com/watch?v=yE8rkG9Dw4s,2016-02-24 11:44:05+00:00,d0btz9s,2,t1_d0blucv,24458,AskReddit
81,Something you should've figured out in the first season itself. And on the first go.,2016-02-23 21:10:16+00:00,d0b2kn2,1,t3_475r1i,44641,gameofthrones
82,"Yes, I do. You heard it first here.",2016-02-20 16:19:26+00:00,d074moc,2,t1_d070ngh,9314,Gunners
83,Giroud. To put an end to all the criticism once and for all.,2016-02-18 19:47:55+00:00,d04w9i1,1,t3_46ewal,20122,Gunners
84,"Top, top bloke this guy.",2016-02-18 19:41:25+00:00,d04vxvk,1,t3_46g32q,5423,Gunners
85,"Though I eat meat, procuring and cooking meat is next to impossible for me where I live. Can you suggest some vegetarian protein sources that I can replace cod/chicken etc with? Appreciate any inputs.",2016-02-18 19:35:43+00:00,d04vnt7,1,t3_46fxfr,6950,Fitness
86,That's how it is.,2016-02-16 17:57:15+00:00,d024fyl,2,t1_d01vie0,14050,Malazan
87,/r/thalassophobia,2016-02-16 09:32:50+00:00,d01qltt,1,t3_45ztun,31650,submechanophobia
88,Stick with it till the end of book 2 and I guarantee you'll be hooked.,2016-02-15 11:33:12+00:00,d00jr30,5,t1_d00hnu9,8879,books
89,"&gt; reading it was probably the only time reading a book made my cry a little

Sir, I then I will humbly suggest you read Malazan Book of the Fallen. Second book, Deadhouse Gates. If that does not make you cry then you probably are heartless. I guarantee it.

",2016-02-15 08:33:01+00:00,d00h5ts,3,t1_czzktec,62995,books
90,"I've read Hyperion (all 4) and Malazan (all 17). My verdict are both are awesome books with excellent storylines. But personally I will rate Malazan much higher than Hyperion. But nevertheless, Hyperion is a very well woven tale. It is not for everyone though as the combination of dark storylines, heavy leaning on poetry and philosophy is a turnoff for many people that I know.

Malazan on the other hand is witty, epic, sad all while being very dark sometimes. And you can connect with many of the Malazan characters on a much more human level than any characters from the Cantos.

My suggestion, humble as it is; finish what you've started and then get to Malazan. Because Malazan is going to keep you invested in it for a long long time and especially so since two new books are coming out in Feb/March and April. Oh and you'll want to reread Malazan once again after you finish it to get a better grasp on the epicness! ;)",2016-02-14 19:25:33+00:00,czztm88,1,t3_45qxan,17433,books
91,"I'd read that article before I went in for the surgery, but in my case, when I tore the meniscus it became lodged in my joint and resulted in a locked knee and I was unable to straighten it. There was no other way to fix it easily and permanently.",2016-02-14 04:58:13+00:00,czz9anf,3,t1_czz31ze,11300,Fitness
92,Both my knees used to pop while doing leg curls and squats. Turned out I had damaged menisci in both of my knees. Tore them during physical activities separately and had to get meniscectomy twice to fix them. Now no more popping sounds but the recovery was a bitch.,2016-02-13 19:57:03+00:00,czyr92r,1,t3_45jvwf,30711,Fitness
93,You proved that when you used an iPhone.,2016-02-13 19:36:34+00:00,czyqkdq,3,t1_czyp81r,2360,tifu
94,"Kyle, lol, that cracked me up!",2016-02-13 18:52:43+00:00,czyp2hf,3,t1_czyjg9u,9805,Malazan
95,VSauce should be here too.,2016-02-13 18:49:55+00:00,czyoz0m,1,t3_45li7t,5670,AskReddit
96,"Well, I can cross whale watching from the list of things I was looking forward to.",2016-02-12 11:47:17+00:00,czx743b,1,t3_459hz8,70692,thalassophobia
97,Sweet lord!!,2016-02-09 18:19:34+00:00,cztp4he,1,t3_44xqwx,3280,thalassophobia
98,"Yeah no, doesn't do anything for me.",2016-02-09 13:37:50+00:00,czteb7k,1,t3_44veko,25233,thalassophobia
99,"What the fuck did I ever do to you? Goodbye sleep. Damn you.

Edit: I can still see those unholy eyes in my head.",2016-02-07 17:58:44+00:00,czr81s6,1,t3_44lqbb,13510,thalassophobia
100,The barbell.,2016-02-05 18:31:50+00:00,czp36qn,1,t3_44bwqi,2776,AskReddit
101,Fake or not it is going to give me nightmares. Damn you OP!,2016-02-05 16:47:54+00:00,czoys3d,1,t3_444s8w,107766,thalassophobia
102,"Yep. Thus my rule: Always read the book first before watching the film. Helps with many issues where the director assumes ""I'm pretty sure the audience will get my drift."" :)",2016-01-31 07:58:13+00:00,cziepqg,3,t1_cziamqo,11053,lotr
103,"The Uruks did not flee into Fangorn. The forest of Fangorn and Helm's Deep were separated by the Gap of Rohan. After the Ent Moot, Treebeard sends Huorns to Helm's Deep for aiding Rohan on Gandalf's suggestion. And it was into this forest of Huorns that the Uruks fled. And as the forest seemingly appeared there overnight, this shot is perfectly fine.",2016-01-30 12:31:14+00:00,czhhpdk,1,t3_43bq37,43788,lotr
104,/r/thalassophobia,2016-01-26 06:49:45+00:00,czcac4p,1,t3_42met2,49543,HeavySeas
105,Who predicts a win because of Welbeck??,2016-01-09 04:21:17+00:00,cyrhfa9,3,t1_cyr1w8l,26690,Gunners
106,Mesa thinks yousa crazy!,2016-01-02 18:39:39+00:00,cyji1g5,2,t1_cyjgrxn,2126,AskReddit
107,Xbox guy,2016-01-01 18:34:05+00:00,cyighit,1,t3_3z1fh9,1289,AskReddit
108,Apparently this is from some place in New Zealand.,2015-12-30 19:53:03+00:00,cyggvn4,2,t1_cyg9ha5,11042,thalassophobia
109,Humans.,2015-12-30 13:58:10+00:00,cyg44fk,1,t3_3yqbq6,42378,AskReddit
110,Khalistani separatist movement is mostly non existent now I believe.,2015-12-28 09:30:05+00:00,cydnu73,3,t1_cydm289,6681,AskHistorians
111,"I love FMA but I'll be too depressed after the Chimera to continue watching. First time I saw it, I needed a day to sort my head out.",2015-12-26 18:38:41+00:00,cybz0gn,2,t1_cybtbce,13257,AskReddit
112,"Can the answer ""be"" more obvious?!",2015-12-26 18:36:20+00:00,cybyy0y,2,t1_cybrw2p,18007,AskReddit
113,"&gt;His wife is Yavanna, who created all the plants and fruits of Arda.

Flora and fauna. Plants and animals. Not plants and fruits. It'd need a pretty stupid god to create plants that cannot create fruits.

&gt;This may refer to Valmar. More convincingly, in the north of Valinor are the Mansions of Aulë, which may also be perceived as the North Pole.

It is clearly mentioned that Aule's mansions are in central Valinor. *""And in the midst of the Blessed Realm were the mansions of Aulë, and there he laboured long.""*

&gt;Valar and Maiar who wished to travel from the Undying Lands to Middle Earth had to take on another form

No such rule. Gandalf took the form of an old man only because the Valar, after the events in Numenor, had refused to directly intervene in any matters concerning ME. In actuality, as it is mentioned in the Silmarillion, the Valar have no form, they only take the raiment of the Children of Iluvatar for their ease of perception.",2015-12-26 03:53:32+00:00,cybiux1,1,t3_3y8kpe,8767,tolkienfans
114,Messi is overrated. Couple of games in the EPL against Stoke and all and he'll be out injured forever. He's protected by the referees in the La Liga. Wimp.,2015-12-23 16:53:16+00:00,cy92rgm,5,t1_cy8r521,32112,Gunners
115,And against Spuds.,2015-12-22 11:20:28+00:00,cy7nvmv,1,t3_3xtfjz,6565,Gunners
116,Absolutely irrelevant to OP's question.,2015-12-21 16:54:01+00:00,cy6pzvb,2,t1_cy6mbl5,6225,explainlikeimfive
117,Nope nope nope nope. Beautiful but nope nope nope nope.,2015-12-16 17:59:43+00:00,cy1868r,1,t3_3x1to8,40458,thalassophobia
118,TIL that this TIL has been posted a million times over already.,2015-12-16 17:26:42+00:00,cy16t4b,1,t3_3x2qbr,15123,todayilearned
119,*subconsciously,2015-12-16 09:01:29+00:00,cy0u775,4,t1_cy0qdoj,11527,todayilearned
120,How's that even a question?,2015-12-15 17:03:23+00:00,cxzwi1z,1,t3_3wycl9,3205,seduction
121,Shite refereeing and even shiter sportsmanship from the likes of Costa. He'll have a special place in hell.,2015-12-15 07:04:20+00:00,cxziazq,2,t1_cxz4p1y,32274,Gunners
122,"This might not be the kind of advice you're looking for but.....Document your life from this point onwards. If/when you decide to share your experience in dealing or overcoming the hardships in your life for commercial reasons or otherwise, this will come in handy as a reference.",2015-12-15 06:57:24+00:00,cxzi5dw,1,t3_3wwj95,3535,TheRedPill
123,seconded!,2015-12-14 19:06:49+00:00,cxyxt0j,3,t1_cxykp3g,25618,Gunners
124,Not the original one of course!,2015-12-14 04:02:25+00:00,cxyb2ug,9,t1_cxy9qpb,2089,gameofthrones
125,"Go ahead, mock/downvote. But do come back to this thread when WoW comes out.",2015-12-14 03:14:48+00:00,cxy98gp,7,t1_cxxs6uy,26673,gameofthrones
126,"People's view won't really matter as he is not going to inherit Winterfell. That'll be Rickon. Jon will sit on the Iron Throne with Dany, sad as it may sound.

Btw, the Aegon is an imposter, most probably a Blackfyre.",2015-12-13 17:58:45+00:00,cxxnkrt,5,t1_cxxkhzd,5572,gameofthrones
127,"My good sir, he is, in no way, a bastard. There is more than enough proof to support this. In fact, I cannot see a good way where GRRM can extricate himself from this and keep Jon a bastard.",2015-12-13 16:10:10+00:00,cxxk150,3,t1_cxxiv4w,2560,gameofthrones
128,"Well, if you look at it that way, Jon might inherit it. But OP's tone leant towards inheritance due to Jon being a Stark.",2015-12-13 12:28:26+00:00,cxxfgjy,3,t1_cxxdru5,7804,gameofthrones
129,/r/marinebiologygifs,2015-12-13 06:52:10+00:00,cxxaavt,1,t3_3wl91r,19709,woahdude
130,"Potential? No other ""mystery"" in any work of fiction has been clearer than Jon's parentage.",2015-12-13 06:47:03+00:00,cxxa6l5,3,t1_cxx9wc1,725,gameofthrones
131,"Bratja, Full Metal Alchemist.",2015-12-13 06:45:27+00:00,cxxa58x,1,t3_3wju8i,40016,AskReddit
132,"&gt;So if all the starks die including Jon

Jon is not a Stark.",2015-12-13 04:00:44+00:00,cxx5kcf,1,t3_3wko6f,18375,gameofthrones
