,body,created,id,nest_level,parent_id,reply_delay,subreddit
133,This is a conspiracy how?,2015-12-11 14:37:03+00:00,cxvc4v2,1,t3_3wdo8a,370,conspiracy
134,*extinct,2015-12-08 17:38:28+00:00,cxrq879,2,t1_cxrhi27,14136,explainlikeimfive
135,"Well, with that insanely perfect ring, he/she pretty much has achieved it all in this life so...",2015-12-07 07:35:34+00:00,cxq2777,2,t1_cxq1usq,1087,thalassophobia
136,That kinda looks like Sam Gamgee leading Gollum on into Mordor. Frodo might be up ahead.,2015-12-07 04:09:44+00:00,cxpx09y,1,t3_3vj735,144662,TheDepthsBelow
137,A better question would've been why did America buy it.,2015-12-06 17:08:26+00:00,cxp7lnp,2,t1_cxp4jwc,6523,AskHistorians
138,Doesn't that water scare you?,2015-12-06 14:32:52+00:00,cxp3hxu,2,t1_cxp321f,1342,thalassophobia
139,nice,2015-12-06 07:20:18+00:00,cxox30t,3,t1_cxoiqgb,28577,todayilearned
140,I was born that day.,2015-12-04 14:43:37+00:00,cxmxqe3,1,t3_3vee59,17208,TILinIndia
141,Hood's balls! That's crazy!,2015-12-02 16:56:40+00:00,cxkj5lf,1,t3_3v5i4g,4825,Unexpected
142,"&gt; if they start losing a ground war against Pakistan

Don't envision that happening anytime in the near future.",2015-12-02 14:48:27+00:00,cxke9f6,2,t1_cxkbo60,5686,todayilearned
143,Typical example of a karma whore.,2015-12-02 06:16:54+00:00,cxk4k13,1,t3_3v1rka,33605,HeavySeas
144,"&gt;Rake and his Drow kin no longer live on their home plane of existence, the Elder Warren of Shadow

Rake and his ~~Drow~~ Andii kin no longer live on their home plane of existence, the Elder Warren of ~~Shadow~~ Darkness",2015-12-01 12:01:00+00:00,cxj0w9h,1,t3_3uyn06,23591,Malazan
145,"&gt;First, it's entirely likely that some people lied when answering this question; it would be surprising if they hadn't.

So very scientific of you sir to conduct such a well researched survey.

&gt;Second, the survey is not conducted every year; some of the results are very recent and some are several years old, so we're assuming the results are static, which might not be the case.

And now we assume stuff and then pass judgement.

What a joke, both the study and the conclusion!",2015-11-29 15:41:11+00:00,cxgsr2x,1,t3_3upvfq,1901,todayilearned
146,That is not football.,2015-11-29 13:53:16+00:00,cxgqbmb,1,t3_3upjfn,2633,Unexpected
147,"Damn, I googled it and it sure is creepy! Damn. And to think that some crazy nutjob could actually possibly do something like this is creepier still. We live in a weird world!",2015-11-29 11:36:55+00:00,cxgo7j2,2,t1_cxgcahr,33457,AskReddit
148,A better way is to dip a small piece of cotton in Clove oil (should be available in grocery stores like Walmart or in any asian ethnic store) and hold it in your mouth where the pain is. It is a natural analgesic and antiseptic and will help in reducing the pain. Make sure you use a small amount though.,2015-11-28 13:55:21+00:00,cxfp4n1,1,t3_3ukupm,5962,LifeProTips
149,If it is more towards the side of the hip then you might have pinched your sciatic nerve while working out. Best to get it checked out by a doctor as it might indicate a herniated disc in your back which could get worse if left untreated.,2015-11-28 13:43:18+00:00,cxfowzs,1,t3_3ukxk2,3102,Fitness
150,That's just an urban legend.,2015-11-28 11:13:09+00:00,cxfmtyx,3,t1_cxfdxpq,27746,AskReddit
151,A new low for TIL.,2015-11-28 05:06:41+00:00,cxfglye,1,t3_3ujjyb,6034,todayilearned
152,Will close the tab and find some place else to waste my time.,2015-11-25 15:56:48+00:00,cxco2b3,1,t3_3u82bi,2596,AskReddit
153,*subconsciously.,2015-11-25 06:56:04+00:00,cxcd02s,3,t1_cxcaxda,5256,gifs
154,Our own little Hand of God!,2015-11-25 04:21:14+00:00,cxc9096,1,t3_3u4tbb,23514,Gunners
155,How does this answer OP's question?,2015-11-24 04:49:19+00:00,cxb2jg2,2,t1_cxb0mzz,3273,explainlikeimfive
156,I'd like to buy this guy a beer and probably learn a trick or two in return!,2015-11-23 17:30:54+00:00,cxabgu8,1,t3_3tx87x,30230,interestingasfuck
157,"Old, old one! :)",2015-11-22 09:51:49+00:00,cx8w76k,5,t1_cx8v8kl,4312,todayilearned
158,Damn. Beat me to beat me to it too. Double damn.,2015-11-22 06:38:43+00:00,cx8t71m,3,t1_cx8kyb9,17706,todayilearned
159,So advanced! But they still cannot catch that Russian sub in Swedish waters! :P,2015-11-22 05:37:34+00:00,cx8rsxq,1,t3_3tqgwn,31411,woahdude
160,"They are from Sentinel island, India. They even shoot arrows at helicopters. Sheesh.",2015-11-21 20:33:47+00:00,cx8am7o,3,t1_cx8abt9,493,todayilearned
161,"Many programs can be simply extracted and run. Even the ones that are typically ""installed"". Its called portable versions. They simply take all the files and folders from the installed program and zip it up for use without installation. The drawback in such programs usually is that they won't remember your settings the next time you run them as they are distributed as files/folders without the corresponding windows registry entries that allows for shell/context menu integrations and preservation of preferences.

Dependence on Java or Dot Net is not why installation is required. Programs can figure out where the dependencies are present using the values of system environment variables.

So most programs can be used with installers or as ""portable"" versions with the usual trade off being saving and preservation of preferences and system integrations (like Open With option on Right Click Menu etc.). There are some programs that integrate tightly with the operating systems and update/replace system libraries which have to be installed with an installer because uninstalling them manually would be very intricate. The installer in such cases backs up the changes it does so that while running the uninstaller, it knows what to replace or restore to get the system back to the original state.",2015-11-21 18:17:25+00:00,cx85usi,1,t3_3tp4b0,11973,explainlikeimfive
162,"Resubmit it as TIFU by being non tech savvy. Linux had nothing to do with your fuck up. Too many people are already scared to try out Linux and I'd not like your headline scare them away.

Linux is awesome. If something is wrong then it's your mistake 99% of the time.",2015-11-21 18:04:15+00:00,cx85e3x,1,t3_3tnt6m,45387,tifu
163,And I sincerely hope they remain that way. This world is so fucked up that it is great to have some people who are unaware of all the crap. At least they can continue to live on when we all kill each other eventually.,2015-11-21 17:46:06+00:00,cx84rp7,1,t3_3toqz2,18230,todayilearned
164,"I've never had a girl laugh ""historically"" at me.",2015-11-21 17:05:25+00:00,cx83fvg,1,t3_3tp24h,8861,tifu
165,JR was a legend!,2015-11-21 17:02:23+00:00,cx83cdr,3,t1_cx7r671,39227,AskMen
166,ICE books are not that great when compared to SE's work. But definitely great as compared to most other fantasy works as they are still Malazan!,2015-11-21 15:05:35+00:00,cx7zwz2,2,t1_cx7oecn,39200,Malazan
167,"A blue whale, because I find them awesome.",2015-11-20 17:33:48+00:00,cx72x86,1,t3_3tl84z,218,AskReddit
168,Cool quiz though.,2015-11-20 16:25:14+00:00,cx7071v,7,t1_cx6v51k,9040,Malazan
169,"It should be Raraku, Bridgeburners and ashes and not Raraku, Dogslayers and blood.",2015-11-20 07:28:53+00:00,cx6oudq,5,t1_cx5zxlk,44771,Malazan
170,"Agreed that it is all that you say. But for one, it lives underwater, which everyone here will agree is scary as hell to begin with. So imagine being freaked when underwater and have this thing show up next to your face. Doesn't matter the size, people will still get a heart attack.",2015-11-17 06:24:28+00:00,cx31fqu,6,t1_cx2z9sr,5044,thalassophobia
171,"Absolutely, I love whales. Just that I prefer to be on land for watching them! :)",2015-11-16 11:30:53+00:00,cx1yt3e,2,t1_cx1x8n6,7132,thalassophobia
172,"Animals or no, I'd refrain from getting into any water that is more than 6 feet deep!",2015-11-16 11:29:51+00:00,cx1ysjg,2,t1_cx1wkn7,9883,thalassophobia
173,"We have, as a group, moved to WhatsApp for deciding things that needs the group's attention and input. I am not in school so your other issue does not impact me, but I see why that would make you hang on to your social network login. But even with that, were I you, I'd keep the interaction strictly to that purpose and trim the friend list to the bare minimum necessary. Oh and also remove all pics and personal details that are irrelevant. There are enough ads being forced down our throats already so no point in giving them more ammunition!",2015-11-13 19:16:40+00:00,cwz6px2,3,t1_cwz66dt,831,AskReddit
174,"Absolutely. That's what being social means. Unfortunately today it has been reduced to scrolling down through tons of useless ""feeds"".",2015-11-13 19:02:37+00:00,cwz6640,3,t1_cwz57vn,1455,AskReddit
175,It is called a bidet and is common pretty much everywhere outside North America. Look it up. There are a lot of different styles to choose from as well.,2015-11-13 18:08:54+00:00,cwz427q,3,t1_cwz354w,1414,explainlikeimfive
176,Are 3rd graders allowed on Reddit??,2015-11-13 18:06:04+00:00,cwz3y6o,1,t3_3soo78,1433,todayilearned
177,"I deleted it in 2012. Have not looked back since. I can't believe how much time I used to spend there. Trust me, it is an awesome feeling when you realize you don't need social networks to stay in touch with people. I stay in contact with my close friends via WhatsApp/Text and not so close friends via email. It is wonderful when you realize you really don't need to know what your acquaintances are having for breakfast or if they bought a new car or went to an exotic vacation. You stay in touch with people who matter without being on a social network. You call them up or visit them, you know, like people used to do before this nonsense was invented. And since you don't have a constant feed of crap piling up on your ""wall"" you tend to have meaningful conversations when you meet face to face. Thank god for whatever was the reason back then that made me quit!

EDIT: Oh and no more sheep or tractors or bloody candy crush requests!!",2015-11-13 18:01:46+00:00,cwz3sav,1,t3_3sopxf,416,AskReddit
178,"I hope it does fail. I'm all for a seamless experience across all platforms but since all platforms have inherently different interfaces, you cannot have them all have the same way of using those interfaces. Having (forcing rather) a touch driven interface on a desktop/laptop is stupid and so is designing a primary keyboard interface for a tablet for e.g.. They should learn from the way iOS and OSX is integrated. It has a lot of issues but a bad interface is not one of them (at least on OSX).",2015-11-13 17:01:12+00:00,cwz1evl,4,t1_cwz10yx,594,AskReddit
179,"Midnight Tides, for me, was the worst book of the series and only Tehol and Bugg's awesomeness kept me interested. But yes, once you move forward you kinda see why this had to be done as there are multiple, seemingly disconnected, arcs that converge in the last 3 books. So yes, there are many, many characters and they all are important and yes, earlier characters do make comebacks in some cases and add to the story.",2015-11-13 16:34:19+00:00,cwz0d76,1,t3_3snv4f,8873,Malazan
180,There will be no more Windows versions after Windows 10. They're going to provide updates to it like an app and the version will always remain at 10. At least as of what they have planned right now.,2015-11-13 16:26:33+00:00,cwz0286,2,t1_cwywbki,6322,AskReddit
181,"Windows 7 is awesome. It is as stable as XP if not more and is a hell of an improvement over Vista. It packs a ton of great features and has a simple UI unlike the nastiness that is Windows 8/8.1.

And frankly, Windows 7 will be the last version of Windows that I'll be using. Once the support ends or if I need to move for any reason, it'll be to Linux. Windows 10 is a privacy nightmare and I'd rather publish all my personal information in a newspaper than allow Microsoft to have it.",2015-11-13 16:24:57+00:00,cwyzzxb,1,t3_3snw0a,7798,AskReddit
182,Don't start here.,2015-11-11 12:03:49+00:00,cwwf9w4,2,t1_cwwdwrh,5942,Gunners
183,"Wow, that's a great gesture but it is fantastically stupid!",2015-11-11 12:03:10+00:00,cwwf9iq,2,t1_cwwam9k,18635,Gunners
184,^ This!,2015-11-10 16:03:29+00:00,cwvekgz,2,t1_cwvc1d3,4341,Gunners
185,He's good but nowhere close to Coltaine or Itkovian or Gruntle etc.,2015-11-10 06:57:20+00:00,cwv3k8c,3,t1_cwulmj4,31764,Malazan
186,He does improve. Quite a lot. But he lacks the knack of keeping people hooked and tends to wander a bit instead of writing gripping content and/or characters. You'll never find a Coltaine or an Itkovian with ICE.,2015-11-09 12:33:34+00:00,cwtzwoz,1,t3_3s3wh8,18604,Malazan
187,"Never before had a book, the power to crush my soul. And Malazan went on to do it many more times.",2015-11-09 10:32:01+00:00,cwty0le,2,t1_cwtvmxx,9583,Malazan
188,I'd love to try out more but there are so few wallpaper quality images depicting Malazan characters/places. You have any links where I can get my hands on some that I can run through and see how crazy they get?,2015-11-09 01:46:50+00:00,cwtk8qn,2,t1_cwt50gh,22758,Malazan
189,"Oh yeah, I love such bitches ;)",2015-11-08 10:05:36+00:00,cwsqvz3,4,t1_cwsaann,38007,Gunners
190,Is a bitch.,2015-11-07 20:17:11+00:00,cws3qo0,2,t1_cws271j,2699,Gunners
191,Username checks out.,2015-11-07 20:15:06+00:00,cws3o1g,3,t1_cws2d0k,2293,Gunners
192,Thank you! I'll add arrogant to that.,2015-11-07 20:12:25+00:00,cws3koy,3,t1_cws2kqa,1759,Gunners
193,"So, a comment. Big whoop.",2015-11-07 04:14:29+00:00,cwrhxuc,1,t3_3rrxjr,44108,woahdude
194,"I thought FoD made it quite clear that the Andii soul inside Quick Ben is Korya Delath's. There are quite a few hints

1. Korya and her connection to The Spar of the Andii where Quick is later shown to be

2. Delath and Delat

3. Her dolls which we all know is one of Quick's specializations as well

4. Her being a mhybe which could explain how Quick obtained the knowledge to keep twelve souls inside of him",2015-11-06 07:54:56+00:00,cwqgbob,1,t3_3rpr7j,18020,Malazan
195,"USD, no. AUD, no. UK 'dollars'?? Hell no! That stuff does not exist! :P

But like I said, UK Pounds, yep, I could think about fighting the guy for it.",2015-11-06 05:08:30+00:00,cwqcnjw,3,t1_cwqcg8f,430,AskReddit
196,"500,000 of what currency? My native currency, no thanks. Sterling, maybe I'll fight back. That stuff converts to a lot of dough in my native.",2015-11-06 04:58:35+00:00,cwqcdcf,1,t3_3rq5gw,465,AskReddit
197,And you don't get the job!,2015-11-05 16:21:42+00:00,cwpi9c4,3,t1_cwphu6t,607,AskReddit
198,"OK, cool. But, before you get your hopes up, I'll just add that while the book starts answering your questions, it does not completely explain them just yet. While you get a tantalizing peek at answers, detailed explanation will follow in Fall of Light and Walk in Shadow.

I loved FoD but now I cannot wait for Fall of Light!",2015-11-04 07:43:31+00:00,cwnxl1v,3,t1_cwnwt1n,2614,Malazan
199,"I tried reading the audiobook but frankly, it was difficult to understand. Reading it is much better and especially so because there are oh so many things that you can easily miss. So I gave up and started reading GoTM. I tried listening to Reaper's Gale to see if it got better but no, reading it is the way to go, well at least for me.",2015-11-04 04:22:55+00:00,cwnsu08,1,t3_3rfdxj,14041,Malazan
200,"OK, so about Kurald Galain. All I'll say is read The Forge of Darkness and you'll learn a lot more about Kurald Galain and the manifestation of darkness. Any discussion without including the revelations in that book would be speculation.",2015-11-03 18:20:51+00:00,cwn4pod,1,t3_3rdmm6,2451,Malazan
201,Karsa Orlong?,2015-11-02 17:48:52+00:00,cwlszbq,4,t1_cwlmmnz,9574,Gunners
202,"You must've been really, really bored to come up with this.",2015-11-01 12:37:55+00:00,cwkcna1,1,t3_3r2nak,711,AskReddit
203,"You'd think that now that we have both the state CM and Union Transport Minister from the city our roads should be the best in the country, but guess that is not on the horizon.",2015-11-01 12:27:10+00:00,cwkchg6,5,t1_cwkbpqj,3345,nagpur
204,*Subconsciously.,2015-11-01 07:25:15+00:00,cwk8qfj,2,t1_cwk2js3,17440,Malazan
205,That is true. Although if you made a post about a road getting repaired then that would draw more attention these days. Roads in Nagpur have become pathetic.,2015-11-01 07:22:12+00:00,cwk8ow5,3,t1_cwk7fjq,4802,nagpur
206,No one cares.,2015-11-01 05:52:54+00:00,cwk79in,1,t3_3qygic,64492,nagpur
207,"I hope you guys know that Telugu movies keep such unrealistic scenes in the film on purpose. There are people who love such kind of scenes even if they make zero sense, like the one where a cop peels a banana and uses it as a knife against thugs. The more unbelievable the better.",2015-11-01 05:52:24+00:00,cwk7972,1,t3_3qyx2q,54273,BollywoodRealism
208,"&gt; Yes, but most people today literally use it incorrectly. So it is refreshing to see this usage.

Yes, but most people today literally use it incorrectly. So it is refreshing to see this usage.",2015-11-01 05:44:06+00:00,cwk73pv,6,t1_cwjscv4,32350,Gunners
209,Thank you for using figuratively instead of literally!,2015-10-31 19:28:37+00:00,cwjpx25,4,t1_cwjkzcb,8973,Gunners
210,"First in, last out.",2015-10-29 10:48:01+00:00,cwh0ags,1,t3_3qneje,30688,Malazan
211,"You sir, have got it going. Hold on to that SO of yours and needless to say, your beer as well ;)",2015-10-28 16:09:01+00:00,cwg00ih,3,t1_cwfzrqn,342,AskReddit
212,How dare you steal my move!,2015-10-28 14:39:46+00:00,cwfwdim,2,t1_cwfu2gc,3875,AskReddit
213,Welcome.,2015-10-28 14:35:42+00:00,cwfw7vv,4,t1_cwfw6m3,55,AskReddit
214,*rode,2015-10-28 14:32:40+00:00,cwfw3oo,2,t1_cwfw38x,19,AskReddit
215,"Don't know about activities but ""Go fuck yourself!"" will take on a whole new meaning.",2015-10-28 14:31:40+00:00,cwfw2by,1,t3_3qk9xs,864,AskReddit
216,"A bunch of beers with friends and no nagging ""Where are you?"" phone calls during that time.",2015-10-28 14:29:37+00:00,cwfvzmp,1,t3_3qkah0,519,AskReddit
217,"One theory says that during the plague Pope Gregory I ordered unceasing prayer for divine intercession. Part of his command was that anyone sneezing be blessed immediately, since sneezing was often the first sign that someone was falling ill with the plague. So since then, it became customary to say ""God bless you"" as a response to one sneezing.

There is another which says that in ye olden times people thought that a part of a person's soul leaves the body when one sneezes and at the same time the body is open for the devil/evil to enter and bless you is a way of protecting against that.",2015-10-28 14:25:51+00:00,cwfvum6,1,t3_3qkarn,170,explainlikeimfive
218,Spindle's warren was Hood's warren. Animals go crazy because it is related to death.,2015-10-28 12:49:51+00:00,cwfsq7r,1,t3_3qi8no,38380,Malazan
219,"Bellerin as RW and Chambers/Debuchy at RB. Or recall Jenko and promote Bellerin to RW. He should be allowed to show if he can fill that position.

Anyway, Sky reports that Ox substitution was more of a caution. So here's hoping that he is fit.",2015-10-28 04:22:56+00:00,cwfjefa,1,t3_3qhemc,20416,Gunners
220,"There are places in the Malazan world where the Warrens are suppressed and thus unusable or plain unavailable due to certain reasons. Hence, whether the Crippled God can corrupt them depends on if he is able to influence the warrens in a given place and to what extent.",2015-10-27 16:45:27+00:00,cwer4ad,1,t3_3qf4mr,9955,Malazan
221,"[Assail Spoiler](/s ""For one, it is about the undead Crimson Guard and them being the new Imass like thing. Easily predicted as soon as we see K'azz scene at the place where they took the vow and Kilava stands witness. The whole Malazan interest in the new continent angle seemed very half hearted. And then there was the fact that ICE did not give the whole Mallick Rel angle any conclusion. He is writing the beginning of the Malazan empire story next so what actually happened to the Malazan empire and Mallick is still a question. The only good part was Spinnock."")",2015-10-27 16:04:52+00:00,cwepebp,3,t1_cwejrsc,8883,Malazan
222,Never said I hate them nor compared his writing to SE. I don't think there is anything about Malazan that I can hate. But there is nothing wrong if one wants to compare their writing styles. The fact that they write about the same world makes for a rather apt comparison.,2015-10-27 12:12:33+00:00,cwehi14,3,t1_cwee3zj,13067,Malazan
223,I loathed B&amp;B but Assail was the biggest letdown as it failed to end the series they way it should have. Or could have. Night of Knives was more a novella so I'm indifferent about it.,2015-10-27 01:24:01+00:00,cwe33rw,3,t1_cwe2xxy,250,Malazan
224,"You absolutely need to read all of ICE's books before Assail. All the Malazan and Crimson guard things that happen in the series come to a head in Assail. That being said, the ICE books are definitely less interesting that SE ones. You'll absolutely loathe Blood and Bone if you are made of blood and bone. But then that's the price you pay when you pick up reading as a hobby. In the end, is it worth it? Yes. Barely so, but yes. And there are moments where ICE surprises you.

Let me prepare you for Assail as well since you want to jump right over to it. Don't. It ain't that great. Sorry.",2015-10-27 01:07:54+00:00,cwe2hed,1,t3_3qcbdl,9210,Malazan
225,You do.,2015-10-25 17:08:59+00:00,cwcbv71,4,t1_cwc1hb8,26087,privacy
226,You don't deserve to be downvoted.,2015-10-25 17:08:49+00:00,cwcbuxo,3,t1_cwbzx5s,33388,privacy
227,"Just giving an example of price differences. And no matter the setting, $200 for a dinner is too rich for my blood. Especially so if one is making minimum wage.",2015-10-24 08:54:08+00:00,cwb0c4n,4,t1_cway85a,8697,explainlikeimfive
228,"Each one with their own preferences. To give an example, I had Shawarma once at a fancy place near South Street Seaport and it was decent but cost me like $55 for two. Compared to that, my usual haunt, Mamoun's at Macdougal Street serves up the best Shawarma, falafels and chicken sandwiches I've had in my life. Cost for two at that time was about $25.",2015-10-24 06:10:35+00:00,cwaxwcg,6,t1_cwaxs75,390,explainlikeimfive
229,"Well, not fair to compare any real restaurant against chains which usually serve up crap based on a template menu and a template recipe. Take any good normal restaurant and the food quality there is not much different than high class restaurants. In such places, the food is costlier only because of the location, infrastructure or the kind of clientele the places draws in. There might very well be exceptions to this.

But given a choice, I'll rather have great food at a small family owned place than a high end one with all the fancy dress codes et al. A relaxed experience and awesome taste is what I'd prefer any day over unnecessary pomp and show, and extravagant costs.

But like you said, on the company dime, bring it on! But still once in awhile.",2015-10-24 05:58:38+00:00,cwaxok7,4,t1_cwaxezy,819,explainlikeimfive
230,"These so called ""high end"" restaurants are usually not worth their salt anyway. $115 for a meal for 2? No thank you.",2015-10-24 05:39:49+00:00,cwaxb7a,2,t1_cwaudad,7062,explainlikeimfive
231,It made me physically sick.,2015-10-23 19:22:11+00:00,cwadu9c,1,t3_3mcud8,2427799,BollywoodRealism
232,"When you talk about an Indian snack, it has to be a Samosa. Vada Pav sucks and is only eaten in Pune/Mumbai and there too it is on the wane rapidly. Two cities do not represent the country. Just goes to show why Expedia is not popular in India.",2015-10-18 11:57:42+00:00,cw3vuk1,1,t3_3p3zsb,80107,Infographics
233,"Lift. That's the only way to grow big. 2 times a week is a joke. Doesn't matter if you are a vegetarian, there are a ton of vegan supplements on the market. Do strength training 5 times a week. Grow big, grow in confidence. Then focus on how you can connect with a girl and how that connection can be made to last past the first contact.

Do the first part first though, as no confidence is a surefire way to make a girl turn away.",2015-10-18 11:01:51+00:00,cw3v3q9,1,t3_3p767k,19233,seduction
234,Stop giving him attention guys. His blood is blue now.,2015-10-11 07:34:52+00:00,cvvmlw6,1,t3_3o9h5g,36085,Gunners
235,"If you can see the mushroom cloud it's already too late. Say your prayers and prepare to meet your maker. Or you know, just prepare to die.",2015-10-08 04:25:56+00:00,cvs5rh4,1,t3_3nud7z,50975,AskReddit
236,"Yell ""Open the pod bay doors, HAL!"".",2015-10-06 09:01:25+00:00,cvpwt0m,1,t3_3no5yy,13582,AskReddit
237,"&gt; We will play again.

Hell yeah. And when that happens, hand him his leg or even better, his ass. That'll teach the cheating son of a bi*ch.",2015-10-05 17:25:40+00:00,cvp3mhm,2,t1_cvp0mz9,4517,Gunners
238,The Arkenstone is not a Silmaril. Just a fan theory and has been disproven many many times.,2015-10-04 05:52:42+00:00,cvnjcjm,3,t1_cvnilss,2138,todayilearned
239,The author a woman by any chance?,2015-10-02 10:45:46+00:00,cvlj5zf,1,t3_3n3tdy,73180,TheRedPill
240,"Stupid Spuds, cannot even spell Visitors correctly.",2015-10-02 05:11:29+00:00,cvleut3,1,t3_3n5g1n,28718,Gunners
241,"Draconus

Caladan Brood

Gothos

T'riss

Hood

Icarium

Ardata

Kruppe

K'rul (Before the Warrens)

The Crippled God

I'm skipping entities like T'iam, Korabas etc.",2015-09-26 19:03:07+00:00,cvf1i69,1,t3_3mh7gw,10210,Malazan
242,"What I meant to say was that there are multiple types of stacks, not FIFO types! Reddit and work do not mix I guess :)",2015-09-26 08:46:22+00:00,cvendly,6,t1_cveks0r,10639,Malazan
243,That is true.,2015-09-25 18:13:22+00:00,cve02qn,4,t1_cvdz2s9,1515,todayilearned
244,India - Bringing democracy to countries before it was cool.,2015-09-25 17:41:07+00:00,cvdysx7,3,t1_cvdtoxr,7868,todayilearned
245,Not since 1971. Since the Maharaja of Kashmir actually signed a treaty to join India. So kinda always belonged to India.,2015-09-25 17:38:54+00:00,cvdyprd,2,t1_cvdug0k,6570,todayilearned
