,body,created,id,nest_level,parent_id,reply_delay,subreddit
246,Failed burn attempt.,2015-09-25 17:37:06+00:00,cvdyn8g,3,t1_cvdv4fm,5406,todayilearned
247,Indus is same as Sindh. The name Indus is an anglicized version of the Sanskrit name Sindhu which is a river that flows from India to Pakistan. The province surrounding that river is known as Sindh.,2015-09-25 17:35:15+00:00,cvdyklo,1,t3_3mbqtc,20171,todayilearned
248,"In computer science, a stack or LIFO (last in, first out) is an abstract data type that serves as a collection of elements, with two principal operations: push, which adds an element to the collection, and pop, which removes the last element that was added.

Source:Wikipedia",2015-09-25 17:26:53+00:00,cvdy8ks,4,t1_cvdtwbc,6697,Malazan
249,Just one of the types though.,2015-09-25 08:30:35+00:00,cvdk3ab,2,t1_cvdf229,16051,Malazan
250,This could have been expressed better only in poetry.,2015-09-25 08:28:14+00:00,cvdk260,2,t1_cvdi5zq,7483,AskMen
251,I don't care what gender you are but you are a bit dumb if you cannot differentiate between a serious comment and a lighthearted one.,2015-09-25 06:44:10+00:00,cvdiiva,4,t1_cvdgaiu,6736,Infographics
252,"I agree that ""Women, and the men whom they keep as backups"" would have been more grammatically correct.

And it ain't worth having women on the side and worth even less to voluntarily give up that information if you have them for any reason, including science!",2015-09-24 18:52:11+00:00,cvcv79k,4,t1_cvcv3ip,154,Infographics
253,Men are smarter than shooting themselves in the foot by being truthful in such studies.,2015-09-24 18:12:51+00:00,cvctlu9,2,t1_cvctj57,110,Infographics
254,"Indian here. Chai is Hindi (and a couple of other Indian languages) for tea. Chai+Spices (like cardamom here) is called Masala Chai where Masala is Hindi (and again, a few other languages) for Spices. In US/Canada/Europe, people (usually) tend to sell Chai as anything that originates from India. Take Starbucks for example, Chai Tea Latte. Chai in India is usually made with milk and is not black. So if you see, Chai Tea Latte translates to Tea Tea Latte. Just trying to make quick bucks off of people's lack of knowledge about foreign terminology.

Anyway don't try to make tea out of that as you'll be drinking boiled cardamom water which will not taste anywhere close to the definition of good. If you have tea leaves at home, make a nice cup of cardamom tea and if you want to have it like we do in India, add milk to it. The usual concentration here is 1/4th cup of milk to 3/4th cup of tea and sugar to taste. Heat the milk though so it does not lower the temperature of the tea. Another tip will be to crack open the cardamom pod slightly and boil it with the pod itself for that extra dash of flavour.

Amazon link if you wish to buy a semi authentic Assamese chai.

http://www.amazon.com/Cardamom-Spiced-Premium-Blended-Elaichi/dp/B013P6ZFHI/ref=sr_1_3?s=grocery&amp;ie=UTF8&amp;qid=1443115247&amp;sr=1-3&amp;keywords=chai+assam&amp;refinements=p_89%3AGolden+Tips+Teas+India",2015-09-24 17:22:04+00:00,cvcrihp,1,t3_3m5dxu,54024,tea
255,"Flamini Volley like in Alley get it, get it??!!",2015-09-24 08:40:29+00:00,cvcddan,3,t1_cvburqx,39767,Gunners
256,The most accurate answer here.,2015-09-16 15:57:16+00:00,cv3le3h,2,t1_cv2cdbz,91949,explainlikeimfive
257,"Absolutely not. I am an ardent Arsenal supporter but not in my wildest dream would I ever support England. The whole team and the management is utterly dysfunctional. So yeah, Arsenal fan, was never, am not and will never be an England fan. Sorry to disappoint.",2015-09-14 03:33:02+00:00,cv0sk1s,4,t1_cv0de08,26205,Gunners
258,"&gt; Compared to these, celebrating a reckless attitude to weight is kind of mild.

Actually this is worse, considering the fact that the number of people afflicted with this problem is much more than people who do drugs or weed or alcohol abuse.",2015-09-12 18:15:53+00:00,cuz6rj0,2,t1_cuz5fi8,2327,explainlikeimfive
259,I could have shared links but the images bring back some bad memories so...,2015-09-11 18:35:52+00:00,cuy7312,3,t1_cuy65jh,1399,AskReddit
260,"India, 26/11 i.e. the November 2008 Mumbai terror attacks. Extremely horrible. You can Google for more info.",2015-09-11 17:54:31+00:00,cuy5ggj,1,t3_3kkhmb,278,AskReddit
261,"Kruppe can very well be the Queen of Dreams herself.

[Multiple Book Spoiler](/s ""Queen of Dreams or T'riss was an Azathanai so she could assume any shape she wished. More is explained in FoD though no hint that Kruppe is QoD."")",2015-09-11 13:00:53+00:00,cuxuq3z,1,t3_3kh4w8,47324,Malazan
262,"You might be an exception then. A rare one at that too. I understand why people used to buy Macs for e.g. when they came with Power processors. That is not the case today. Today, almost everyone I know buys Apple because it is a fashion/status statement. When I ask them why made you go for it, the answer is usually ""because it is Apple dude!"". I cannot even begin to explain how wrong that attitude is.",2015-09-09 03:52:24+00:00,cuv8xgl,5,t1_cuv6ucb,3921,todayilearned
263,"I am not going to start one of those Samsung vs Apple debates again. Samsung is equally bad. But the reason people buy Apple is because it is a status symbol. Which it should not be, because its devices are incredibly mediocre and way, way overpriced for the hardware. And the software does not make up for it. Samsung, while being a tad better at functionality has killed the spirit of Android by making its devices too expensive with no new (useful, not gimmicky) features. Both of them just want to rake in profits while not offering anything new.",2015-09-09 01:55:37+00:00,cuv4zou,3,t1_cuuru2y,21782,todayilearned
264,My point. With a hint of sarcasm.,2015-09-09 01:49:55+00:00,cuv4s4k,3,t1_cuuqt79,22980,Gunners
265,"He is not the striker that Arsenal deserve, but he is the striker that Arsenal need.",2015-09-08 16:57:16+00:00,cuukvh6,1,t3_3k3g82,10177,Gunners
266,"And with that successful demo, Apple has since been shoving that crappy device down fanboys' throats.",2015-09-08 16:54:49+00:00,cuukrxr,1,t3_3k1tjn,48080,todayilearned
267,Should rather read very awkwardly placed sticker. Pretty sure they didn't place the hatch according to the image. :\,2015-09-06 03:53:08+00:00,cus6cyo,1,t3_3jswij,14358,Gunners
268,This reminds me that I need to upgrade to Fedora 22. I hope the upgrade goes smoothly.,2015-09-04 16:51:29+00:00,cuqlkiu,1,t3_3jladl,34570,techsupportgore
269,"To all folks coming to a conclusion that drinking milk or having milk products in India is a surefire way to illness, please note that most milk in the cities nowadays is properly processed. At the very least, most of the milk used in commercial restaurants et al. As for homes, people are not dying left and right of dysentery so there must be some merit in the way Indians handle their food traditionally. The trick for outsiders to survive in India is to avoid anything from the roadside vendors and trust in clean looking restaurants or if the food is home cooked. Roadside food stuffs are delicious as hell but they are not fit for the digestive tracts which don't belong to a stomach which has evolved in the Indian subcontinent!",2015-08-28 13:44:49+00:00,cuilk06,1,t3_3imju4,70920,explainlikeimfive
270,"Yeah, an obscure word in an obscure language called Hindi. Oh wait, isn't that the national language of India?! Get at least your basic facts correct before you ramble on like a loose cannon.",2015-08-28 13:37:59+00:00,cuilce5,5,t1_cuifm86,18459,explainlikeimfive
271,"Indian here, with a bit more awareness that the Indian above. Doodhwalla is a term ubiquitous all over Northern India which means everywhere excluding the five Southern states of Tamil Nadu, Karnataka, Andhra Pradesh, Telangana and Kerala.

Seems you are not a resident Indian or probably belong to these five states. Don't blame you though if you are from the south. Totally different languages. But your tone ain't good.",2015-08-28 13:36:09+00:00,cuilaei,3,t1_cui59hr,44601,explainlikeimfive
272,You should not be downvoted.,2015-08-28 08:41:26+00:00,cuifs02,2,t1_cuhyuyf,38647,explainlikeimfive
273,That's a PCEA uniform. YCCE has a shit uniform now a days if I remember correctly. Oh I miss the good ol' days when YCCE used to rock!,2015-08-28 04:17:09+00:00,cuiat1w,1,t3_35szh9,9236143,nagpur
274,"They missed marking that her data was not in her computer but ""safely"" with Microsoft.",2015-08-28 04:10:10+00:00,cuiambq,1,t3_3ilejf,54122,techsupportgore
275,"Canadians living up to their name, being nice to everyone, even birds.",2015-08-16 05:23:00+00:00,cu4lq66,1,t3_3h3xio,46138,woahdude
276,^This.,2015-08-14 17:55:04+00:00,cu30k8a,2,t1_cttdobz,723437,Malazan
277,You're going to love him so much.,2015-08-14 17:42:13+00:00,cu3010b,1,t3_3gz6i3,13383,Malazan
278,Wake up.,2015-08-11 02:37:53+00:00,ctyq61g,1,t3_3gjkmi,602,AskReddit
279,"Hello, thank you for responding. Actually that is a description of a sword from a book as shared by the author in an interview. He had mentioned it there as he could not find a single fan image of the sword that was created properly with what he had in mind. I like that sword in the books and thought it will make a very nice wallpaper so I took the description that the author gave and posted it here. Since there are no correct (according to the author) images of the sword, I could not link to any images.

Also, the watermarking here refers to the way symbols are etched on a sword while making it as opposed to watermarking an image or a document.

Hope this clears things a bit. Please feel free to ask questions if I am not clear enough and you want to discuss details!

I appreciate your response, thanks!",2015-08-10 06:13:37+00:00,ctxpg1d,2,t1_ctxp1w9,1129,picrequests
280,Cash.,2015-08-09 14:15:12+00:00,ctwviao,1,t3_3gcjpx,2383,AskReddit
281,"Wow, that is a perfect analogy!",2015-08-02 05:49:44+00:00,ctomzby,4,t1_ctoaa2h,27622,conspiracy
282,"Don't bother. Those who know Linux's usefulness will get it to work for them no matter what. For others, Windows will always be the only saviour. You cannot help those who don't want to be helped.",2015-08-01 20:26:17+00:00,cto7ae2,2,t1_cto6527,2373,conspiracy
283,I cannot agree more. Automatic updates suck.,2015-08-01 20:23:18+00:00,cto7770,3,t1_cto3bjh,7763,conspiracy
284,"Exactly, something. And that something irks me because there were not enough clues to even leave it up to our imagination. Plus, I'm pretty sure it is not resolved in Assail (reading it at this moment). Wonder if it'll be there in FoD, though I'm not too hopeful.",2015-08-01 16:29:04+00:00,cto07ek,6,t1_cto00dq,419,Malazan
285,"Assuming that, what happened to Osserc then? I hate the way ICE wrote that book.",2015-08-01 15:13:30+00:00,ctny4wp,4,t1_ctnupk1,9801,Malazan
286,"Since Spite was there and the shard was missing I think he fought her for it and was able to release it. Probably handling the shard knocked him out.

Point taken about Kallor. But why he is so powerful that he is not even afraid of taking on Draconus is something I'd like to know.

As for L'oric's parts I think I'll learn more on the re-read. This stuff is made for re-reads!",2015-07-28 16:47:59+00:00,ctj5jb1,2,t1_ctiykzp,10576,Malazan
287,"Disagree about the visitor impacting. The visitor basically contained the souls of the followers of Kaminsod as explained in The Crippled God and since he was freed by Cotillion and the gang they turned back and went to their own world with him.

Also, Saeng disrupted the Thaumaturg's ritual and helped turn back the visitor so the impact never happened. Good point about Mare though. Probably the old civilisation worshipped Osserc.",2015-07-28 16:45:22+00:00,ctj5fes,2,t1_ctiyenc,10734,Malazan
288,"Stormy and Gesler
Coltaine
T'Amber

All of the above hurt bad. But there were two, that I could not shake off.

Beak. Poor little beak. Oh his reunion with his brother is all fine and dandy but he should not have died. Broke my heart.

And then Anomander Rake. The best character in the whole damn books. And Steven Erikson had to kill him. Not once, but twice. Twice. I had to put the book down and just take a pause for a good 10-15 minutes.",2015-07-24 20:55:38+00:00,ctf0rxz,1,t3_3egsy2,12842,Malazan
289,That's why it is not a top level comment.,2015-07-21 16:41:34+00:00,ctb18ta,4,t1_ctazphs,2265,AskReddit
290,Art? He printed all those pages as art? Good lord what utter lunacy is this! Moron.,2015-07-21 15:23:04+00:00,ctay37q,1,t3_3e1lw4,30779,todayilearned
291,Ross on a break.,2015-07-21 15:17:15+00:00,ctaxv1b,1,t3_3e2gtp,7228,AskReddit
292,"The comment should have been ""The Vampire Diaries. Ridiculous.""",2015-07-21 15:16:16+00:00,ctaxtp4,2,t1_ctau2cz,6732,AskReddit
293,"Some die and come back. Some die and ascend. Some die and come back undead or in someone else's body. In the Malazan universe, death itself is not tragic. What happens to a person while being alive or for that matter dead is of more importance. Remember, the fates can be cruel to those who are living and also to those who have died. ASoIaF uses death as a shock and awe technique and often, it subtracts something from the tale. Here, death is treated subtly and more poetically. It is the ability of Steven Erikson to move us not just with death but with life as well, that makes Malazan a much better read than ASoIaF. And before you slam me for saying that ASoIaF ain't that good, I would like to say that I read ASoIaF before Malazan and until then, I rated ASoIaF very highly. Like many here would agree, once you read the complete works of Steven Erikson and ICE, anything in the fantasy genre (excluding LoTR) has to be benchmarked against Malazan.",2015-07-21 13:54:00+00:00,ctauy7w,1,t3_3e0wke,40526,Malazan
294,Thank you. Seems I never learn my lessons here. Post an opinion and get slaughtered. Oh well.,2015-07-19 14:11:50+00:00,ct8mmj7,8,t1_ct8mijv,299,explainlikeimfive
295,"Really, you got nothing better than caps? It's a Sunday, go get some fresh air while your mom cleans out the basement for you.",2015-07-19 14:02:06+00:00,ct8merl,6,t1_ct8mcw5,142,explainlikeimfive
296,The same person who fucking asked you to post this comment. Mind your own business.,2015-07-19 13:49:36+00:00,ct8m4oc,6,t1_ct8ja3p,10533,explainlikeimfive
297,I'd not watch it at all. Those movies suck.,2015-07-19 10:00:18+00:00,ct8im3e,4,t1_ct8h9m3,6096,explainlikeimfive
298,"Been using the the preview for a few months now. If the final version is anything similar to the preview then I'll stick to my Windows 7 until they release 10.1 or something. They've gone a long way to fix the craziness that was Windows 8 &amp; 8.1 but the effort seems lacking somewhat. Ideally, they should not have gone with the one OS fits all platforms solution. The Metro UI does not fit a desktop and is not suitable for business use. The app store has a precious few of the modern apps as well. I'd prefer the classic Win32 apps anyday over half baked modern apps. I hope that they get rid of the Metro UI completely in the final version or at least allow it to be disabled for those who just wish to use the desktop computer instead of fancy touch monitors which are nothing but a novelty.",2015-07-12 19:13:36+00:00,ct0wrlw,1,t3_3d170x,4914,AskMen
299,So you mean to say Harry Potter was not a girl?!,2015-07-12 19:00:31+00:00,ct0wct3,1,t3_3cxgoy,92272,AskMen
300,"Unfortunately I've recently run into a bunch of women who seem not to agree with your viewpoint. Thus my observation.

Af far as athletics achievements go, it is unfair to compare men and women. Hell, even comparing regular men with professional athletes would paint regular men as losers (which some are). Training professionally for a sport makes you sharper and fitter than your regular gender counterparts that's all. There's no point in comparison. I'm sure there are female athletes who are in better shape than certain male athletes and would leave them biting the dust in their given sport.",2015-07-08 11:31:00+00:00,csw2kju,5,t1_csv3u4x,68677,AskWomen
301,"Sure. What has he won for Argentina? Hint: Squat, nil, nothing, nada. He's a decent player surrounded by better players in Barcelona who serve opportunities for him on a plate. He does not get the same preferential treatment for the national side and the refereeing is also not favoured there and that exposes his real level of skills. Compare him to players like Zidane, Ronaldinho et al and he comes up pitifully short. Being flashy is not a true skill.",2015-07-07 15:20:34+00:00,csv18v4,3,t1_csuxj6n,6688,AskWomen
302,"&gt; Men are, in general, stronger and faster and more muscular than women. That doesn't take away women's accomplishments when competing with other women, and while Messi might be able to run circles around these players, they'd whip the shit out of 90 percent of the people posting such things.

If only most women (and many men) thought as rationally as you do, the world you be a better place. Nature has made men a lot better at some things for a reason and everyone should accept that. In the same vein women are better at some other things and that's how nature wants it to be so no point in calling one superior over the other.",2015-07-07 14:47:08+00:00,csv00yf,3,t1_csuwott,6611,AskWomen
303,"Take your time, this one is a big commitment.",2015-07-07 13:17:18+00:00,csux7ik,13,t1_csuvkn7,4197,gameofthrones
304,"If you like the fantasy genre in general then you'd love it. The main series is 10 books long and it is complete. Fair warning, it is a huge saga and the first book was written nine years before the second, so there is a difference in writing style. Plus Steven Erikson does not dole out explanations early on, you're practically dropped into the middle of an existing story and you would feel clueless. But that is all by design and once you are about 3 book into the series, you realize that he could not have started the story at any other point to make it simpler and from that point onwards, things start to fall into place wonderfully. It is not for everyone but anyone who really likes fantasy would love it. Awesome characters, epic proportions for almost everything, great world building and some fantastic humour too. Because of the way it is written, it is even better on a reread (and you'd find that you would love to reread it) as you start to realize the significances of seemingly minor events early on in the books that turn out to be big deals later on. I've had many a moments where I went, ""well, how did I not miss this the first time around!"". Give it a go!",2015-07-07 01:00:02+00:00,csugndy,11,t1_csu0rsl,25796,gameofthrones
305,"I don't like using the same example over and over again but I've read Malazan and ASoIaF back to back so these two are fresh in memory. If you have read Malazan, you'd know what I mean when I say that I want the dragons to be in the story and be awesome but not go all guns blazing and totally dominate anything and everything.

I'm all for having storylines that are not really relevant if they add a touch of humour or are used for world building etc. but with the amount of irrelevant-ness GRRM has in the book is probably the result of him taking too many breaks between books and thus losing track of where he left it off last and taking some time to get back into the proper flow. I can't find the reference now (midnight here) but he himself has admitted that had he started on WoW right after he finished DoD then he'd have made more progress as he kinda lost track of the direction he wanted to go after DoD and it took him a while to find that touch. With less meandering about he could have trimmed what was not really necessary and made more progress and we may have had our next book earlier.

Don't get me wrong, I love the core storyline. It's just that it'd have been better if it was shorter. Malazan is very very huge but then, there, on the contrary you get the feeling that you cannot get enough of a character most of the time than the feeling I sometimes have in some POVs here. Dany and her story is just one place where I wished he could have been faster, if I may put it that way.",2015-07-06 17:46:37+00:00,csu0mjj,9,t1_cstyygm,2557,gameofthrones
306,"&gt; I see what you are saying here, but the problem is the timing of the other things. He'd only be able to show Daenarys a few more times. There are at least 4 groups of people seeking her out at the moment, making their way to her. Then there is the component of her goals in Meereen and how it will play into her making it to Westeros. Daenerys would just become a secondary character or a huge portion of the story would go unexplained and unexplored if he just breezed through it.

He could have kept her parts crisper and shorter by having less of her POV chapters, no need to curtail the timeline. The whole thing about Quentyn Martell was utterly inconsequential. Having less of her could have meant more time for the mysteries of the maesters and Old Town or even exploring Valyria more. He could have used the concept of time skip to show how she has or hasn't matured during that time. No need to show the excruciatingly boring Mhysa saga.

&gt;You just want the dragons to start burning and eating everything and being awesome dragons. So do I. But if that happened, the story would be over real quick. Her dragons also aren't full sized yet, which is the other thing (and has to do with the timing I mentioned). If she took them over now they would likely be killed sooner rather than later. She needs somebody to help her control them. She's at least being somewhat smart about that, except that instead of even trying to do it herself she is focusing on saving people from slavery, etc.

Frankly, not really. Having the dragons burn stuff left and right would be a deus ex machina almost and that'd not be a lot of fun unless it's against the others who are really overpowered anyway.",2015-07-06 16:26:08+00:00,cstxj94,7,t1_csttses,6518,gameofthrones
307,No.,2015-07-06 16:09:35+00:00,cstwxk0,1,t3_3c98w5,50323,AskMen
308,"&gt; Wait, so he should have written them like another author wrote characters of a similar age...?

He could have handled her character better than how he did till now is that I mean.

&gt; It is very clear that part of Daenerys' problem is that she is not listening to her advisors and that she is suffering from it.

Um, that's why OP is asking others if they find her unlikeable and I agree that I too find her unlikeable.

That GRRM wrote her slightly worse than other characters has nothing to do with how old the characters are. He has dragged on her storyline for no apparent reason other than filling up pages. I might not be aware of his future plans but the way he has made her languish in Essos is utterly boring. If he wishes to say that dealing with Meereen and all is a part of building her up as a good ruler for Westeros then I do not buy that. Her story is boring and dull as far as I am concerned. How one can have dragons around and still be a boring character is very baffling!

My expectations were more related to GRRM rather than Dany. He had an awesome premise with Dany after Drogo's death and the birth of the dragons and he could have used that storyline to great effect. Her parts could have been shorter and crisper and could have still covered how she is clueless, ignores her advisors, learns a lesson and then becomes wiser from it. He could have then brought the dragons into the picture and would have had a fantastic way to bring her back into Westeros politics. But sadly what we have is slaves and Meereen and a shit ton of pages which are utterly drab. Heck he has handled Sansa better than Dany and that's saying a lot.",2015-07-06 14:22:47+00:00,csttca9,5,t1_cstswpk,871,gameofthrones
309,"Refer to Steven Erikson's Malazan Book of the Fallen to understand how he wrote 13-16 year old characters. Felisin Paran, Sinn, Crokus/Cutter, Apsalar/Sorry being some examples. They're all in the similar age bracket but they way they are written and portrayed in the story is excellent. Danerys doesn't need to know the right answers or whatever, but at that age, it is expected that you draw upon history or your advisors' knowledge and not act as a clueless brat. Hell, GRRM has not written her half as well as he has written other characters, Tyrion, Tywin, Maester Aemon and Petyr Baelish being some examples of well written ones. There is a clear difference in how the character building differs.",2015-07-06 13:55:35+00:00,cstsjs3,3,t1_cstrypf,1304,gameofthrones
310,"Be it the show or the books, she's utterly useless and the least suited to sit on the Iron Throne, Targaryen or no. She has no fighting prowess, no political acumen, no people skills or any other qualities to survive without her advisors. It is because of characters like these that I rate GRRM's work as a bit lesser than other fantasy books (e.g. Malazan series). But then there are awesome characters like Tyrion, who despite being  a dwarf is one of the cleverest folks around.",2015-07-06 08:03:24+00:00,cstmlvl,1,t3_3c797y,60415,gameofthrones
