,body,created,id,nest_level,parent_id,reply_delay,subreddit
311,"In India, using acid to attack women is a common way of revenge by spurned lovers. This is more common among the smaller towns than in cities and there too it is rapidly on the wane, for good. So those that are saying the source of acid being car batteries etc. are right to an extent but that is not the case most of the times. Believe it or not, many people in India, even today, use acid as a toilet cleaner. Although normal toilet cleaners have been readily available in the country for decades now, there are some who still cling to the age old way of using diluted acid to clean ceramic surfaces of the toilets. To cater to these folks, you'll find concentrated acids in some of the smaller grocery stores, especially in small towns. It is sold just like any other grocery item with no regulations or questions asked. When you have access to corrosive materials like that, all it takes is the desire to hurt someone and a wild leap of thought resulting in such acid attacks. The most common way is to use a hollowed out lightbulb filled with the acid and throw it at the victim. The intention usually is to disfigure the victim's (usually a woman) face with the rationale being ""if you rejected me then no one will ever accept you after this"". In other cases, they threaten the victim (also most women) walking down an isolated street with an acid attack on the face if they don't part with their jewellery/valuables etc. All this used to be more common but thankfully is rapidly declining as a result of modernization of culture and more and more people having access to education.",2015-07-05 14:48:40+00:00,cssuh9l,1,t3_3c6s30,12463,explainlikeimfive
312,*great food,2015-07-05 05:06:33+00:00,cssld1e,3,t1_cssge72,13505,AskReddit
313,"Deadhouse Gates is fine. But go till Memories of Ice. If that does not move you then you're a heartless person maybe. That was the book that sealed the deal for me. Excellent, excellent book that one.",2015-07-05 04:32:04+00:00,cssknpt,3,t1_css6mpg,33541,Malazan
314,"You'd bring Bieber and Spears in this discussion, really? They get a shit ton of hate 'cause they're just that: shit.",2015-07-04 03:12:35+00:00,csrn0ef,5,t1_csrbqck,24452,AskMen
315,I was hoping that the picture was of the iron throne converting into the Shrike but I guess Hyperion Cantos is not everyone's cup of tea.,2015-07-03 02:09:12+00:00,csqkm6i,1,t3_3bvbb6,46435,gameofthrones
316,Hard drives are not silicon based.,2015-07-02 17:13:26+00:00,csq1lfw,5,t1_csq0w96,1102,explainlikeimfive
317,30 degrees hmmpf. You apparently have never been to India in summers. Might want to give it a shot.,2015-07-02 17:09:01+00:00,csq1fj2,2,t1_cspuz8w,10427,explainlikeimfive
318,Have an upvote.,2015-06-28 07:13:43+00:00,csl8kk6,2,t1_csl300j,15436,gameofthrones
319,Then you ma'am are one of the exceptions.,2015-06-20 15:54:48+00:00,cscykzq,5,t1_cscxn2r,2122,LifeProTips
320,And may I ask if you're somebody's wife? If not then my argument does not apply to you.,2015-06-20 11:48:19+00:00,csctiio,3,t1_cscjdud,34285,LifeProTips
321,If your wife has never jogged before you're already having a bad time.,2015-06-20 01:16:27+00:00,cschprg,1,t3_3agpqg,1991,LifeProTips
322,"You're welcome. If possible, let me know how you like the books when you read them.",2015-06-19 17:53:49+00:00,csc2z3j,8,t1_csc0x0k,3180,gameofthrones
323,"Personally I do not like Terry Brooks' work at all. But that's me and there is no reason everyone should like the same books.

Anyway, the next ASoIAF book will at best and I really mean at best, come out in late 2016. That's how bad GRRM is in allocating time to his most important work, i.e. his upcoming books. He has admitted himself that he attended too many book signings, tours, conferences etc. in the last couple of years and lagged behind on his writing. He even admitted that he could have made better progress if he had continued writing right after the last book came out and that he lost the flow of the story and it took him a lot of time to get back into the groove again. Anyway, enough venting. What I wanted to say is that if you've seen the show then you know the story and if you finish the 5 books then you wait for more than a year or so to read the next one.

On the other hand, by the time you catch up with all Malazan books, the new trilogy would probably be close to completion. And by that time the release of the next ASoIAF book would be that much closer too. So go with Malazan and may Burn's blessings guide you through the journey!",2015-06-18 20:00:05+00:00,csb2zqr,6,t1_csb2boj,982,gameofthrones
324,"You're in for a wild ride in that case. Don't worry, Malazan will last you for a month or so if you're a serious reader. Plus there are close to 20 books in the whole series (the main one being 10 books long and then there are other stories which you'll want to read once the main 10 are done). It is an epic fantasy and the author does not do a lot of information dumps so you cannot just skim and expect to understand. Also, you'll feel lost in the first book as Steven Erikson just drops you in the middle of the story. You'll need to finish the first 3 books and then you'll get an understanding of how everything so far fits nicely into an overarching plot which is huge to say the least. But trust me, no matter how confusing you find it, read at least till then end of book 3 and I'm sure you'll be hooked.

The way he sets up his books (save the first one) is that the first half of the book is character building and some details about the world/country/place where things will happen and then from the second half things start to boil and the end of each book is awesome. Mostly each book has a story line that reaches some sort of conclusion at the end and each book contributes to the overall plot which is tied up excellently in the last book. While Steven writes about the main arc, Ian's books (set of 7) explains the series of events that take place in other parts of the world in parallel to the main arc. Those are very well written and are a good read to say the least. Also, these guys are writing prequels and sequels so it'll be something to look forward to in the future as well.

And both of them are relatively young so no worries about them dying without finishing the story!",2015-06-18 14:52:15+00:00,csaqftp,4,t1_csaprtp,1137,gameofthrones
325,"I've been in pretty bad jams and once it took me 6 hours to get to where I wanted, and that was about 12 miles from the point I was stuck. How long are these Chinese ones and in the worst case how long are people stuck?",2015-06-18 14:34:33+00:00,csaptal,2,t1_csaohjw,2413,explainlikeimfive
326,"It seems you're not familiar with Steven Erikson and Malazan Book of the Fallen. ASoIAF seems childish as compared to MBotF. You like a character there huh, let me kill him and all his friends. That's how he plays the game.",2015-06-18 14:29:53+00:00,csapnop,2,t1_csan6c8,4862,gameofthrones
327,Hillary Clinton. Anyone other than the first woman president will not do. What's foreshadowing what here?!,2015-06-18 01:55:28+00:00,csa95qc,1,t3_3a8i2l,506,AskReddit
328,Really? We get that you're pissed about Jon dying. Live with that and stop this moaning.,2015-06-18 01:53:21+00:00,csa93fd,1,t3_3a8i6q,323,gameofthrones
329,I'll be ready in 2 minutes.,2015-06-18 01:51:42+00:00,csa91nv,1,t3_3a8ib3,169,AskReddit
330,Why? They can still be cast in flashback scenes.,2015-06-18 01:50:48+00:00,csa90o3,1,t3_3a8if0,67,gameofthrones
331,"Karsa shatters one of Fener's tusks using his flint sword. The sword itself is an Imass sword and is aspected. Karsa in himself is a warren. Fener was no more a God and was thrust into the mortal realm by Heboric Light Touch. When forced to manifest in such a way, Gods/Ascendants are very vulnerable since they're no more in their own realm where they can control all it's aspects. Putting it all together I can see how Fener was killed.",2015-06-18 01:34:22+00:00,csa8iqc,2,t1_cs9h87f,46776,Malazan
332,"Please do not read about the books on the internet. You'll spoil the fun. Everyone who reads Malazan feels lost initially. I went through the whole GoTM without having a clue of what's going on. Things slowly make sense as you move onwards and therein lies the fun. They say for a reason that the series is made for a re-read. Take a plunge into the unknown and enjoy the experience.

Follow the Tor re-read project when you re-read it yourself.",2015-06-18 01:25:17+00:00,csa88su,5,t1_cs8r7dj,104968,Malazan
333,Do not read the ICE books before the Eriksen ones no matter what one says. ICE is not as great a writer as Eriksen and you'll end up not getting used to either of their styles. ICE has his own way of explaining stuff so better read it later. Plus NoK is very interesting so don't skip that to jump to RoTCG whenever you get there.,2015-06-18 01:22:36+00:00,csa85wj,1,t3_3a2nzv,107974,Malazan
334,Hope you got the hint as to who Pust really is.,2015-06-18 01:19:34+00:00,csa82ll,2,t1_cs9yx7o,16503,Malazan
335,"I agree with everyone here who says that the Malazan world is huge but one thing they missed is that there are other books by Ian Cam Esslemont (ICE) which tell us the tale of what goes on in parallel to the main storyline. Also, Eriksen is writing a nice trilogy about how the whole Malazan universe began (the first book is already out) and ICE is writing a new series on how the Malazan empire was founded. So the world is huge and we're getting to know more about it.

In my opinion WoT is a great series but it pales slightly in comparison to the Malazan books. Wish you the best for your journey and would like to know what you think of the books when you finish them. Burn's blessings be with you!",2015-06-18 01:18:20+00:00,csa819g,1,t3_3a7xt8,8781,Malazan
336,A Gentleman.,2015-06-17 00:03:21+00:00,cs8zine,1,t3_3a1q8n,30881,AskReddit
337,I would not go if I was in his position. If the guy is really his best friend then I'd assume that he'd be fine knowing the situation your BF is in. He can always catch up when he visits NY later.,2015-06-16 20:39:56+00:00,cs8s6je,1,t3_39zc89,72299,AskMen
338,Hood's bony arse! I can't wait!,2015-06-16 10:46:39+00:00,cs8869e,4,t1_cs7v6bu,33913,Malazan
