,body,created,id,nest_level,parent_id,reply_delay,subreddit
0,Why not go to the source of the Nile?,2016-09-19 05:47:13+00:00,d7stkup,1,t3_53eqlt,23279,pics
1,"In my country in East Africa no one ever pumps their own gas up till now. We just drive up, tell the attendant how much in money we are going to pay for he then opens up does everything and we pay cash to him at the window. All while still sitting",2016-07-19 12:18:05+00:00,d5i1kc8,2,t1_d5htwgt,23108,AskReddit
2,Women are better drivers than men,2016-07-10 16:41:21+00:00,d56se88,1,t3_4s51el,21122,AskReddit
3,"Hey, i know the feeling. Some small things i did were starting to wake up early, its hard at first but once you wake up at 8am you feel fresh and renewed and it gives you the sense that you aren't going to waste the day sleeping. Going to the gym can be something to do with your time and fitness gains is a serious boost of confidence, there is an amazing fitness community here and on youtube you could join. Have you ever thought about a job? You can meet many fun people and make some extra money while at it. Don't worry about your mom being disappointed in you, you are still the best thing that has ever happened to her.",2016-06-28 12:25:18+00:00,d4r3ts5,1,t3_4q8y9n,3202,SuicideWatch
4,And by picks he means killing off/helping to kill of someone,2016-06-24 19:21:08+00:00,d4mmpho,2,t1_d4mlok6,1346,heroesofthestorm
5,Damnnn i am in a village in east africa and atleast i have 300ms,2016-06-20 11:12:53+00:00,d4ghzdi,2,t1_d4gcud9,16765,heroesofthestorm
6,cause in the rat leagues people play whoever meta or not,2016-06-17 18:26:26+00:00,d4dcsm8,8,t1_d4d9t1q,3684,heroesofthestorm
7,Im guessing your mmr is pretty high?,2016-06-17 16:03:48+00:00,d4d5ysc,6,t1_d4cyxcd,10178,heroesofthestorm
8,Thank you! Much appreciated! ,2016-06-13 20:22:32+00:00,d47s8pt,1,t3_4nwetb,14216,heroesofthestorm
9,"Don't worry bro Dehaka is a bossssssssssss, you ain't alone we on here all love him",2016-06-13 12:26:31+00:00,d477kjh,1,t3_4nv3vb,5151,heroesofthestorm
10,Tie shoelaces?,2016-06-12 18:16:39+00:00,d46901w,1,t3_4nrh3a,187,AskReddit
11,Find the replay and record it,2016-06-11 09:58:59+00:00,d44qlmh,1,t3_4nk4qx,18711,heroesofthestorm
12,ok ok ok your life for aiur i get it already sheeeshh,2016-06-09 19:59:43+00:00,d42qgw5,1,t3_4nasjz,23350,heroesofthestorm
13,Nah he means like sometimes in pro games they 4-5 man one lane and trade usually a fort and gate and get back to the normal setting ,2016-06-08 20:20:52+00:00,d41djxz,3,t1_d40wlti,20570,heroesofthestorm
14,Did you organize the icons by game you play most and one you play least?,2016-06-08 19:38:31+00:00,d41bjf2,1,t3_4n5o8u,13978,heroesofthestorm
15,like which heroes?,2016-06-08 19:23:40+00:00,d41atqg,4,t1_d40a3jo,64209,heroesofthestorm
16,Hell.,2016-06-06 10:14:32+00:00,d3xw168,1,t3_4mn4gc,79311,AskReddit
17,A country in East Africa called Uganda :),2016-06-04 19:37:12+00:00,d3w0sws,2,t1_d3w0k7a,428,pics
18,I imagine he is done with college he is 30+ years old,2016-06-02 20:10:52+00:00,d3tjp8d,2,t1_d3th7ig,3174,heroesofthestorm
19,"i don't really understand his mount, can he fly around untouchable all game?And what is the cool down?",2016-05-25 17:57:39+00:00,d3jcqgv,1,t3_4kyu26,30241,heroesofthestorm
20,"And the one time we don't do anything on this reddit column, the exact thing we are trying to avoid happens smh",2016-05-20 10:23:09+00:00,d3cr1oh,1,t3_4k22td,80965,AskReddit
21,Hehe did that on purporse,2016-03-29 02:30:53+00:00,d1h733a,2,t1_d1h6we3,277,heroesofthestorm
22,Just Attack Always!,2016-03-24 15:31:18+00:00,d1bupr7,2,t1_d1b7tb9,53322,heroesofthestorm
